work_title,sentence,sentence_length
1806,இம்முயற்சியிலீடுபட்ட வெள்ளைத் தளபதி ஒருவன் நம் வீரர்களால் தொடையில் குறி பார்த்துச் சுடப்பட்டு வாழ்க்கைக்குப் பயனற்றவனாக்கப்பட்டான்.,12
1806,"கொத்தளங்களைக் கைப்பற்றிய பட்டாளம் தன்னை இரு பிரிவுகளாகப் பிரித்துக்கொண்டு, நம் சிப்பாய்களைப் புடைக்க முந்தியது.",11
1806,"ஒரு பிரிவு, இந்தியச் சிப்பாய்கள் நிறைந்திருந்த ஒரு கோட்டைப் பகுதியைத் தாக்குவதைக் குறியாகக் கொண்டது.",11
1806,"இன்னெரு பிரிவு, வேலூர்க் கோட்டையின் கீழ்த்திசையிலிருந்த தலை வாயிலைக் கைப்பற்றுவதில் கவனம் செலுத்தியது.",10
1806,இக்கடுமுயற்சியில் ஈடுபட்ட வெள்ளைப் பட்டாளம் சுதந்தர வீரர்களால் சுட்டுப் பொசுக்கப்பட்டது.,8
1806,கோட்டை வாயிலை அணுகிய வெள்ளைப் படைகள் தலைவாயிற்கதவுகள் தாளிடப்பட்டுப் புரட்சி வீரர்களின் பலம் பொருந்திய பீரங்கிகளால் பாதுகாக்கப்பட்டிருப்பதை அறிந்தனர்.,14
1806,கோட்டைக் கதவுகளை வெள்ளைப்பட்டாளம் நெருங்காத வண்ணம் கடும்போர் புரிந்தார்கள் இந்தியச் சிப்பாய்கள்.,9
1806,போரில் வெள்ளையர் பலர் உயிரிழந்தனர்.,4
1806,கொடிப்போர் வெள்ளைப்பட்டாளம் கோட்டையின் ஆயுதச்சாலையை அடுத்தபடியாகத் தாக்கத் துடித்தது.,7
1806,"ஆனால், குண்டுகளை எல்லாம் இழந்து வெறுங்கையோடு நின்ற பட்டாளத்தால் ஆகும் காரியமா அது?",10
1806,அம்முயற்சியில் ஏகாதிபத்திய வெறியர் பலர் மாண்டு மடிந்தனர்.,6
1806,"ஆனால், அவர்கள் முயற்சி படுதோல்வி அடையும் வகையில் ஆவேசப் போர் புரிந்தார்கள் இந்தியச் சிப்பாய்கள்.",11
1806,இம்முறையும் கடும் போர் நிகழ்ந்தது.,4
1806,செய்தி கிடைத்ததும் ஆர்க்காட்டு வெள்ளைத் தளபதியின் இரத்தம் கொதித்தது.,7
1806,ஒரு பெரும்படையுடன் வேலூரை நோக்கிக் காற்றாய்ப் பறந்தான் கில்லெஸ்பி.,7
1806,ஆர்க்காட்டிலிருந்து வந்த ஆங்கிலப்பட்டாளம் சுமார் பத்து மணிக்கு வேலூர்க்கோட்டை வாயிலை அடைந்தது.,9
1806,கோட்டையின் முதல் இரு கதவுகளும் திறந்தே இருந்தன.,6
1806,மூடிக்கிடந்த மூன்றாவது கதவையும் வெள்ளைப்பட்டாளம் பெருமுயற்சி செய்து சுதந்தர வீரர்களுடன் போராடித் திறந்தது.,10
1806,"ஆனால், நான்காவது வாயிலிடம் வந்ததும் பறங்கிப்பட்டாளம் செயலற்று நின்றது.",7
1806,"காரணம், கதவுகள் மூடப்பட்டிருந்ததோடு உள்ளே இருந்த நம் சிப்பாய்கள் பலத்த துப்பாக்கிப் பிரயோகம் செய்த வண்ணம் இருந்ததேயாகும்.",13
1806,"எனவே, கர்னல் கில்லெஸ்பி ஆர்க்காட்டிலிருந்து பெரும்பெரும் பீரங்கிகள் வரும் வரை தவம் கிடந்தான்.",10
1806,கடைசியாகப் பேய்வாய்ப்பீரங்கிகளும் வந்து சேர்ந்தன.,4
1806,கோட்டைக் கதவுகள் தகர்த்தெறியப்பட்டன பீரங்கிப் பட்டாளம் பேய்களின் கூட்டமென உள்ளே சாடியது.,9
1806,வெள்ளைப்பட்டாளம் வெறியாட்டம் பேயாட்டம் ஆடியது.,4
1806,கர்னல் கில்லெஸ்பி ஏகாதிபத்திய வெறியர்களுக்குத் தலைமை தாங்கினான் எட்டுக் திசைகளிலும் பாய்ந்தான் சுட்டான் சூறையாடினான் கொன்றான் கொளுத்தினான்.,13
1806,இச்சந்தர்ப்பத்தில் நடைபெற்ற கொடுமைகளைப் பற்றி வெள்ளையரின் நூல்களே வாய் விட்டுப் புலம்புகின்றன.,9
1806,புரட்சி வீரன் ஒருவனை அங்குலம் அங்குலமாகச் சிதைத்தனர்.,6
1806,கர்னல் கில்லெஸ்பியும் அவன் கூட்டாளிகளும் நம் வீரர்கட்கு இன்னும் எண்ணற்ற கொடுமைகளைப் புரிந்திருப்பார்கள்.,10
1806,கொள்கைக் வீரர்க்கட்கும் கொள்ளைக் கூட்டத்திற்கும் இடையே நடந்த வீரப்போராட்டத்தில் எண்ணூற்றுவருக்கு மேற்பட்ட இந்தியச்சிப்பாய்கள் படுகொலை செய்யப்பட்டார்கள்.,12
1806,"இச்சந்தர்ப்பத்தில் வேலூரிலும், திருச்சியிலும் ஒரே சமயத்தில் அறுநூற்றுவருக்கு மேற்பட்ட புரட்சி வீரர் சிறையிடப் பட்டனர்.",11
1806,புரட்சித் தீயில் வெந்து மடிந்த வெள்ளையர்கள் நூற்றுக்கணக்கானவர்கள்.,6
1806,வேலூர்ப் புரட்சிக்குப் பின்னே அமைந்து கிடந்த திட்டம் மிகப்பெரியது மெய் சிலிர்க்கச் செய்வது !,10
1806,புரட்சியின் குறிக்கோள் ஒவ்வொரு வெள்ளையனையும் கொன்று தீர்த்துவிட்டுத் திப்புவின் திருமகனை அரியணையில் அமரச் செய் வதே.,12
1806,இந்நோக்குடன் தென்னகத்தில் பல்வேறு பகுதிகட்கும் அனுப்பப் பெறுவதற்குப் புரட்சிக் கடிதங்கள் தயாராய் இருந்தன.,10
1806,ஏற்கெனவே அனுப்பப்பட்டும் இருந்தன.,3
1806,"மேலும், பின்னாளில் புரட்சி பற்றி நடை பெற்ற விசாரணையின் விளைவாகத் திடுக்கிடும் உண்மைகள் சில வெளியாயின.",12
1806,அவற்றுள் சில வருமாறு புரட்சி வீரர்கள் கோட்டையைக் கைப்பற்றிக் குறைந்தது எட்டு நாட்களேனும் தங்கள் ஆட்சியில் வைத்திருக்க வேண்டும்.,14
1806,இடை வேளையில் திப்புவின் அரசிளங்குமரன் பத்தாயிரம் வீரர்களைப் போர்க்கருவிகளுடன் நாட்டின் பல்வேறு பகுதிகளினின்றும் திரட்ட வேண்டும்.,12
1806,சிறப்பாக மைசூர் மக்களின் துணையை நாட வேண்டும்.,6
1806,"வேலூர்க்கோட்டையும், பேட்டையும் பிடிபட்டவுடன் இந்திய இராணுவத்தினிடையே ஏற்படக்கூடிய பேரதிர்ச்சியைப் பயன்படுத்தி ஆங்கில அதிகாரத்தைச் சீர்குலைக்க வேண்டும்.",12
1806,இவ்வாறெல்லாம் திட்டமிட்ட புரட்சி வீரர்கட்கு ஏற்கெனவே இராணுவப் பயிற்சி பெற்று ஓய்வு பெற்றிருந்த பலர் துணை புரிய வாக்களித்தனர்.,14
1806,குடியைக் கெடுத்த குடி !,3
1806,"தோல்விக்கு இரண்டாவது முக்கிய காரணம், புரட்சி வீரர்கட்குத் தக்க தலைவர்கள் இருந்து வழி காட்டாமையே.",11
1806,"நான்காவது காரணம், நினைக்குந்தோறும் நம் மனத்தில் வெட்கத்தையும் வேதனையையும் வெறுப்பையும் நெருப்பென அள்ளிக்கொட்டுவதாகும்.",10
1806,வேலூர்ச் சிப்பாய்களில் பெரும்பாலோர்க்கு இருந்த சுதந்தர உணர்ச்சிக்கு உலை வைக்கக் கோட்டைக்குள்ளேயே சில கருங்காலிகள் இருந்தார்கள்.,12
1806,அதைக்காட்டிலும் புரட்சியை அடக்க வெள்ளையர்க்கு உதவியாக ஆர்க்காட்டிலிருந்து வந்த இந்தியக் கூலிப்பட்டாளமே பேருதவி புரிந்தது.,11
1806,"என்றாலும், இறுதி வெற்றி தேச பத்தர்களிடமே சரண் புகுந்தது.",7
1806,இத்தகைய புரட்சிகளின் முடிவில் உலக இயற்கைக்கு ஒப்ப இங்கும் வீரர் அமர வாழ்வு அடைந்தனர்.,11
1806,துரோகிகள் சுகவாழ்வு பெற்றார்கள்.,3
1806,சார்ஜன்டு பிராடிலிக்கு இரண்டாயிரத்து எண்ணுாறு வெண்பொற்காசுகள் பரிசளிக்கப்பட்டன.,6
1806,கர்னல் பான்கோர்ட்டின் மனைவிக்கும் மக்களுக்கும் உதவி நிதி அளிக்கப்பட்டது.,7
1806,ஆர்க்காட்டிலிருந்து வந்த பரதேசிப் பட்டாளத்திற்கு ஒரு மாதச் சம்பளம் இனாமாக அள்ளி வழங்கப்பட்டது.,10
1806,துரோகியாகச் செயல் புரிந்த முஸ்தாபாவுக்கு இரண்டாயிரம் வராகன்கள் பரிசாகத் தரப்பட்டன.,8
1806,மேலும் வாழ்நாள் முழுவதும் ஒரு சுபேதாருக்குள்ள சம்பளம் அவனுக்கு உபகாரச் சம்பளமாகத் தரப்பட்டது.,10
1806,மேற்குறிப்பிட்ட தனி நபர்க்கு மட்டுமேயன்றிப் புரட்சியை ஒடுக்குவதில் துணை புரிந்த படைப்பிரிவினர் பலருக்கும் மொத்தச் சலுகைகளும் காட்டப்பட்டன.,13
1806,"துரோகிகள் வாழ்வு பெற்ற வரலாறு இதுவாக, வீரத்தியாகிகளைச் சாவும் புகழும் சேர்ந்து தழுவின.",10
1806,புரட்சி நடத்தியதற்காக ஆறு தேசபத்தர்களின் மார்பகங்கள் பீரங்கிகளால் பிளக்கப்பட்டன.,7
1806,ஐந்து பேர் துப்பாக்கிகளால் சுட்டுக் கொல்லப்பட்டனர்.,5
1806,எட்டுப்பேர் தூக்கிலிடப் பட்டனர்.,3
1806,"அவர்கள் பொன்னுடலை அழித்ததோடு ஆறுதல் கொள்ளாத அயல் ஆட்சி, இராணுவப் பட்டியல்களில் அவர்கள் பேரும் இல்லாதபடி அழித்து ஒழித்தது.",14
1806,என்றாலும் இன்று கோட்டையிலே பொங்கிய தீ நாளை குடிசைகளிலெல்லாம் பொங்குமானால் என் செய்வது என்று எண்ணித் தயங்கியது.,13
1806,இவ்வாறெல்லாம் கற்பனைக்கும் எட்டாத அடக்கு முறைகளைப் புரிந்தும் வேலூர்ப் புரட்சியின் எதிரொலிகளை வெள்ளை அரசாங்கத்தால் தடுத்து நிறுத்த முடியவில்லை.,14
1806,வேலூர்ப் புரட்சியைப்பற்றி மக்கள் மனத்தில் வெறுப்புண்டாக்கும் வகையில் எத்தனையோ கதைகளைக் கட்டிவிட்டது பறங்கி ஆட்சி.,11
1806,"ஆனால், அவையனைத்தும் காலப்போக்கில் அப்புரட்சியின் தூய்மையையும் ஏகாதிபத்திய வெறியர்களின் பொய்யையும் காட்டவே பயன்பட்டன.",10
1806,பாரி எழுதியது என்ன?,3
1806,வேலூர்ப் புரட்சிக்குக் காரணம் வெள்ளை ஏகாதிபத்தியத்தின் கண்மூடிச்செயல்களே என்பதை நாளடைவில் ஆங்கில ஆட்சியே ஒப்புக்கொண்டது.,11
1806,அவ்வுண்மையை இப்புரட்சி சம்பந்தமாக ஆராய்ந்து பார்த்த அத்தனை வெள்ளை வரலாற்று ஆசிரியர்களுமே ஒப்புக்கொண்டுள்ளார்கள்.,10
1806,"மேலும், அப்புரட்சியின் வேகத்தையும், அது வெற்றி கண்டிருந்தால் நேர்ந்திருக்கக்கூடிய விளைவுகளையும் நம்மைக்காட்டிலும் நாடாண்ட வெள்ளையரே நன்கு உணர்ந்திருந்தனர்.",13
1806,இவ்வுண்மைக்கு உரை கல்லாய் விளங்கும் பல கூற்றுகளே ஜி. எச்.,8
1806,ஹாட்ங்சன் என்பவர் பதினெட்டு  ஆம் நூற்றாண்டின் பிற்பகுதியிலும்.,6
1806,யாராவது இப்படிப்பட்ட அவலமான உத்தரவுகளைப் பிறப்பிப்பார்களென்று நீங்கள் கருத முடியுமோ?,8
1806,ஆனால் உண்மை என்னவோ அப்படித்தான் இருந்திருக்கிறது.,5
1806,"ஆனால், அவற்றை இனியேனும் தொலைத்தாக வேண்டும் ஏற்கெனவே அவை ஒழிக்கப்பட்டு வருகின்றன.",9
1806,சென்னைக் கவர்னர் பென்டிங்கு பிரபு இவ்வுத்தரவுகளை ஒழித்துக் கட்டி ஆணைகள் பிறப்பிக்குமாறு இராணுவப் பெருந்தலைவனுக்குக் கட்டளையிட்டுள்ளார்.,12
1806,இச்செயல் இனி இத்தகைய புரட்சிகள் தோன்றாது காப்பாற்றுமென்று நம்புகிறேன்.,7
1806,"ஆனால், நாம் வேலூர்ப் புரட்சியின் போது இந்தியாவின் இப்பகுதியைத் தலை முழுகிவிடக்கூடிய நிலையிலேதான் இருந்தோம்.",11
1806,இத்தகைய படுமோசமான உத்தரவுக்குக்குக் காரணம் மேஜர் பியர்சி என்னும் இராணுவத்தலைவன்தான் என்பது இப்பொழுது எனக்குத் தெரிகிறது.,12
1806,அதன் விளைவாகச் சென்னைக் கவர்னர் பென்டிங்கு பிரபுவும் இராணுவப் பெருந்தலைவனும் புரட்சிநடந்த ஓராண்டு கழித்துத் தங்கள் பதவியினின்றும் நீக்கப்பட்டார்கள்.,14
1806,"அச்சமயத்தில் தாமஸ் பாரி, தம் நண்பர் ஒருவருக்கு எழுதிய கடிதத்தில் மீண்டும் ஒரு முறை பின் வருமாறு குறித்துள்ளார்.",14
1806,தம் கைப்பட அரசாங்க ஏடுகளில் அவர் வரைந்துள்ள குறிப்பொன்று பின் வருமாறு பேசு கின்றது.,11
1806,ஐரோப்பியர்களின் உயிரைக் காக்கச் சிப்பாய்களுள் சிலர் மிக்க கருணையோடு செய்த செயல்கள் சிலவும் புரட்சிக் காலத்தில் நடைபெற்றன.,13
1806,நீ எவ்வாறு நன்றி காட்டப் போகின்றாய்?,5
1806,"ஆனால், இதனால் அதன்பெருமை எவ்வகையிலும் குறையுடையதன்று.",5
1806,பெருமை மிக்க அவர்களுடைய திருமரபைப் பின்பற்றியே பல்லாயிரக் கணக்கான மக்கள் சுதந்தரத்தைப் பெற்றுள்ளார்கள்.,10
1806,விடுதலை பெற்ற இந்தியா அவர்களை என்றும் மறவாது போற்றித் தன் வீர வணக்கங்களை நன்றியுடன் நாளும் உரிமையாக்கும் !,13
1806,ஆளும் சாதிக்கும் அடிமைப்பட்ட சாதிக்கும் உள்ள வேறுபாடு இதுதான் போலும் !.,8
1806,ஆங்கிலப் பேரரசு நடுக்கமின்றி வேர் கொள்ளத் தொடங்கியது.,6
1806,அந்நிலையில் தமிழகத்தின் வடவெல்லையில் குறுநில மன்னர் பலர் செங்கோலோச்சி வந்தனர்.,8
1806,"அவசியமற்ற, அறிவற்ற ஆணைகளை எல்லாம் பிறப்பித்தார்கள் வெள்ளையதிகாரிகள்.",6
1806,இவ்வுத்தரவுகளைக் கேட்டு முணுமுணுத்தார்கள் முறையிட்டார்கள் வெறுப்புக்காட்டினார்கள் தமிழ்ச்சிப்பாய்கள்.,6
1806,வேலூர்க் கோட்டையில் பெரிய தொரு புரட்சி மூளப்போகின்றது என்பதற்கான அறிகுறிகள் பல வகையிலும் விளங்கிய வண்ணம் இருந்தன.,13
1806,எரிமலை ஏற்கெனவே புகையத் தொடங்கிவிட்டது.,4
1806,"ஆயினும், வெள்ளை அதிகாரிகள் அதை அறியத் தவறிவிட்டார்கள்.",6
1806,அந்நிலையில் அது சமயம் வேலூரிலிருந்து பதினாறு மைல் தொலைவிலுள்ள ஆற்காட்டில் முகாமடித்திருந்த கர்னல் கில்லெஸ்பிக்கு செய்தி பறந்தது.,13
1806,காலைப் பத்து மணிக்கெல்லாம் வேலூர்க் கோட்டை கொலைக்களமாயிற்று !,6
1806,ஏகாதிபத்திய வெறியர்கட்கும் சுதந்தர வேட்கையினர்க்குமிடையே நேருக்கு நேர் போர் நடைபெற்றது.,8
1806,அப்பொழுது நிகழ்ந்த பயங்கரக் காட்சிகளை யாரால் சித்திரித்துக் காட்ட இயலும்?,8
1806,அதன் விளைவாக வேலூர்க் கோட்டை வீர மாந்தரின் தியாக இரத்தத்தால் நனைக்கப்பட்டுப் புனித பூமியாயிற்று.,11
1806,வேலுர்ப் புரட்சி சுடர் வடவிந்தியச் சிப்பாய்களின் புரட்சி சோதி.,7
1806,என்ற கூக்குரல் வானளாவ எழுந்தது.,4
