work_title,sentence,sentence_length
1806,"﻿முதற்பதிப்பு மார்ச்சு, ஓர் ஆயிரத்து தொள்ளாயிரத்து அறுபது உரிமை ஆசிரியர்க்கே.",8
1806,வேலூர்ப் புரட்சி இரண்டு.,3
1806,"சுடரும் சோதியும் ﻿முதற்பதிப்பு மார்ச்சு, ஓர் ஆயிரத்து தொள்ளாயிரத்து அறுபது உரிமை ஆசிரியர்க்கே.",10
1806,போன்ற பெருமக்களால் ஆராய்ச்சிவன்மை நிறைந்த வரலாற்று நூல்களும் கலையுணர்ச்சி நிறைந்த தொடர்நிலைக் கதைகளும் பலவாக எழுதப் பெற்றுள்ளன.,13
1806,அக்குறை ஒருவாறு நீங்க எழுந்ததே இந்நூல்.,5
1806,பின்னது அதே ஆண்டு அதே திங்களில் வெளிவந்த சுதேச மித்திரன் சுதந்தர நாள் மலரில் மலர்ந்தது.,12
1806,இந்நூல் அச்சாகும் காலத்துச் செப்பம் செய்து உதவிய மகாவித்துவான் மே.வீ.வே.,10
1806,அவர்கட்கு என் நன்றி கலந்த வணக்கங்கள் உரியன.,6
1806,பின்னர் ஏற்பட்ட முதலாவது சுதந்தரப் போருக்கு அது ஒர் ஒத்திகை.,8
1806,—வீர சவர்க்கார் இந்தியாவில் பிரிட்டிஷ் ஏகாதிபத்தியத்திற்கு எதிராய் வளர்ந்து வந்த பெருவெறுப்பு முதல் முதலாக மக்கள் எழுச்சியாய் வெளிப்பட்டது.,14
1806,உண்மையில் ஓர் ஆயிரத்து எண்ணூற்று ஐம்பத்தேழு ஆம் ஆண்டின் இந்தியச் சிப்பாய் புரட்சியின் சிறிய வடிவமே வேலூர்ப் புரட்சி.,14
1806,அவனுக்குப் பின் வாள் முனையின் வலியின்றியே அவன் பரம்பரையைச் செல்லாக் காசாக்கியது ஆங்கில வல்லரசு.,11
1806,﻿ அதே நேரத்தில் கர்நாடகம் முழுவதையும் கொடுங்கோலுக்கு இரையாக்கியது கும்பினி ஆட்சி.,9
1806,அந்தக் கொடுங்கோலின் தன்மையை அதன் விளைவுகளை அக்கொடுங்கோலர்களின் குடியில் தோன்றிய வெள்ளை வரலாற்று ஆசிரியர்களாலேயே மறைக்க முடியவில்லை.,13
1806,அதன் பயனாக வடவெல்லையில் வாழ்ந்த பாளையக்காரர்களுக்கும் ஆங்கில வல்லரசிற்கும் இடையே போர் மூண்டது.,10
1806,"பல மாதங்கள் போர் நடைபெற்றதாயினும், இறுதி வெற்றி ஏகாதிபத்தியத்தின் சார்பிலேயே அமைந்தது.",9
1806,அவர்கள் வீரப் போர் புரிந்து விண்ணுலகெய்தினர்கள்.,5
1806,அதை ஒட்டித் தென்பாண்டி நாட்டில் செய்ததுபோலவே கும்பினி அரசாங்கம் தமிழகத்தின் வடவெல்லையிலும் பேயாட்டமாடிற்று.,10
1806,வானுயர்நத கோட்டைகளெல்லாம் குப்பை மேடுகளாயின.,4
1806,அடர்ந்த காடுகளெல்லாம் அழித்து நாசமாக்கப்பட்டன.,4
1806,தேச பத்தர்கள் வாழ்ந்த இடங் களில் எல்லாம் கொலையும் கொள்ளையும் வாளும் நெருப்பும் கொடுங்கூத்து நிகழ்த்தின.,12
1806,சில தினங்கள் முன்வரை குறுநில மன்னர்களாய்ப் பெருமையுடன் வாழ்ந்தவரெல்லாரும் கைவிலங்குகளோடு சிறைக் குகைகளிலே தள்ளப்பட்டனர்.,11
1806,காட்டிக் கொடுத்த துரோகிகட்குப் பணமும் பதவியும் பரிசாக அளிக்கப்பட்டன.,7
1806,மக்களின் ஏக்கம் தீரும் நாள் விரைந்தோடி வந்தது.,6
1806,பெருமை வாய்ந்த வேலூர்க் கோட்டை கொடுங்கோல் வெறியர்களின் கல்லறையாகவும் சுதந்தர வீரர்களின் பாசறையாகவும் உருக்கொண்டது.,11
1806,ஆங்கில ஏகாதிபத்தியத்திற்குப் பலம் பொருந்திய பகைவர்களாய் விளங்கியவர்கள் ஐதர் அலியும் அவன் வீர மைந்தன் திப்புவுமாவார்கள்.,12
1806,பிரெஞ்சுக்காரர்களோடும் மாவீரன் நெப்போலியனோடும் தொடர்பு கொண்டிருந்தான் திப்பு.,6
1806,அவர் களுடைய ஆதரவைத் துணையாக்கிக்கொண்டு ஆங்கில ஏகாதிபத்தியத்தை இந்திய மண்ணினின்றும் வேரோடு கில்லி எறிவதே அவன் குறிக்கோளும் திட்டமுமாம்.,14
1806,"ஆனால், பல்வேறு காரணங்களால் அத்திட்டம் வெற்றிகரமாக நிறைவேறவில்லை.",6
1806,"திப்பு, போர் முனையில் தலையிலே சுடப்பட்டு விழுப்புண் எய்திப் பகைவர் கைப்படுதற்கு முன்பே மாண்டான்.",11
1806,அயல் ஆட்சியினரும் பயத்தோடும் பத்தியோடும் அவன் பொன் உடலைப் புதைத்து ஆறுதல் கண்டனர்.,10
1806,திப்பு மாண்டதும் அவன் வீர மைந்தர்களை குடும்பத்தை வேலூர்க் கோட்டையிலே சிறை வைத்தது கும்பினி ஆட்சி.,12
1806,பஞ்சுப் பொதிக்கு நடுவே நீறு பூத்த நெருப்புக் கட்டை ஒன்றை நுழைத்து வைத்தது போல ஆயிற்று அச்செயல்.,13
1806,மனக்குமுறல் ஏற்கெனவே கும்பினி ஆட்சியின் கொடுமையால் மனம் கொதித்துக் கிடந்தனர் வடவெல்லைத் தமிழர்.,10
1806,அவர்தம் பிரதிநிதிகள் பலர் வேலூர்க் கோட்டையிலே நிலைத்திருந்த ஆங்கிலப் படையில் கூலிக்கு வேலை பார்த்து வந்தனர்.,12
1806,திப்புவின் மைந்தர் பன்னிருவரையும் மகளிர் அறுவரையும் அந்நாளில் வேலூர்க் கோட்டையில் சிறை வைத்திருந்தது கும்பினி ஆட்சி.,12
1806,"பலம் பொருந்திய காவலில் அவர்கள் இருப்பதாகக் கருதப்பட்டாலும், உண்மை நிலை அதுவன்று.",9
1806,"மூவாயிரவருக்குக் குறையாத மைசூர் நாட்டினர், அவர்களது எதிர்காலத்தில் கருத்துடையவர்களாய், வேலூரில் குடியிருந்தனர்.",9
1806,அவர்களுடைய உணர்ச்சிகளைப் புரிந்துகொண்டு அன்பு காட்டிய பல்லாயிரக் கணக்கான தமிழ் மக்களும் வேலைமாநகரின் குடிமக்களாய் விளங்கினார்கள்.,12
1806,தேவையற்ற இத்திடீர்க் கட்டளைகளால் இந்தியச் சிப்பாய்களிடையே பெருமனக்கசப்பு ஏற்பட்டது.,7
1806,நாளடைவில் சுயமரியாதையையும் சொந்த மதத்தையும் இழந்து மதம் மாற நேரிடும் என்ற கலக்கமும் தமிழ் வீரர்கட்கு உண்டாயிற்று.,13
1806,"அதனால், அவர்கள் அடைந்த மனத்துயர் மிக அதிகம்.",6
1806,"அந்நிலையில் ஓர் ஆயிரத்து எண்ணூற்று ஆறு ஆம் ஆண்டு, ஏப்பிரல், மே, ஜூன் மாதங்களில் புதுத்தொப்பிகள் வேலூர்ப்பட்டாளத்திற்கு அனுப்பப்பட்டன.",14
1806,உடனே அவற்றை அணிந்துகொள்ளும்படி சிப்பாய்கள் வற்புறுத்தப்பட்டார்கள்.,5
1806,"இச்சமயத்தில் வேலூரிலிருந்த ஒரு படைப்பிரிவினர், அரசாங்கத்தின் புதிய உத்தரவுகள் எங்கள் மனத்தைப் பெரிதும் புண்படுத்திவிட்டன.",11
1806,எங்கட்குக்கொடுக்கப்பட்டிருக்கும் தொப் பிகள் கிழக்கிந்திய பாண்டு வாத்தியக்காரர்களின் குல்லாய்கள் போலிருக்கின்றன.,8
1806,"எனவே, எங்களால் அவற்றை நிச்சயமாக அணிய இயலாது என்று உறுதியாக மறுத்து விட்டனர்.",10
1806,"ஆனால், கொடுங்கோலர்களின் செவியில், அறம் பிறழா வகையில் படை வீரர்களும் அவர்கள் தலைவர்களும் செய்துகொண்ட வேண்டுகோள் சற்றும் ஏறவில்லை.",14
1806,"உள்ளத்தில் கிளர்ந்தெழுந்த எண்ணங்களை ஒளியாமல் வெளியிட்ட வேலூர் வீரர்கள், கைக்குட்டைகளால் முக்காடிடப்பட்டு, சென்னைக் கோட்டைக்கு இழுத்துச் செல்லப்பட்டார்கள்.",13
1806,விசாரணை நாடகத்திற்குப்பின் நீதியின் பெயரால் தீர்ப்புகளை வழங்கியது கும்பினி ஆட்சி.,8
1806,அதன்படி ஒரு முஸ்லீமுக்கும் இந்துவுக்கும் முறையே தொள்ளாயிரம் தொள்ளாயிரம் சாட்டையடிகள் கொடுக்கப்பட்டன.,9
1806,சாட்டை அடிகளால் பிழிந்து சக்கையாக்கப்பட்டவர்கள் உத்தியோகத்தினின்றும் நீக்கப்பட்டார்கள்.,6
1806,மேலும் பத்தொன்பது பேர்கட்கு ஐந்நூறு ஐந்தாறு சாட்டையடிகள் கொடுத்ததுடன் மன்னிப்பும் வழங்கப் பெற்றது.,10
1806,இவ்வாறே வாலாஜாபாதில் தம் வெறுப்பை வெளிப்படுத்திய ஒரு சுபேதாரை வேலையை விட்டே வெளியேற்றியது வெள்ளை அரசாங்கம்.,12
1806,அவர்கள் உள்ளத்தில் பழிவாங்கும் உணர்ச்சி கிளர்ந்து எழுந்தது.,6
1806,வேலூர்க் கோட்டையில் நள்ளிரவு நேரங்களில் இரகசியக் கூட்டங்கள் நடைபெற்றன.,7
1806,மறைமுகமாகப் புரட்சி வேலைகள் செய்ய மன்றங்கள் நிறுவப்பட்டன.,6
1806,அக்கூட்டங்களிலும் ஆவேசம் மிக்க சொற்பொழிவுகள் நிகழ்த்தப்பெற்றன.,5
1806,"அக்கூட்டங்கட்கெல்லாம் மாவீரன் திப்புவின் மக்களும் வேலூர்ப்பட்டாளத்தின் சுதேசி அதிகாரிகளுள் பெரும்பாலாரும் வந்திருந்து, ஒங்குக புரட்சி !",11
1806,என்று ஆசி கூறினார்கள்.,3
1806,ஆரம்பத்தில் இந்நிகழ்ச்சிகள் இரகசியமாகவே நிகழ்ந்தன.,4
1806,"ஆனால், நாளடைவில் ஊர் வாயை மூடுவது அரியதாகிவிட்டது.",6
1806,மெல்ல மெல்ல இச்செய்தி திக்கெட்டிலும் பரவியது.,5
1806,இரவு நேரங்களில் ஏராளமான பல்லக்குகளில் அஞ் அஞ்சத்தக்க போர்க் கருவிகள் கோட்டைக்குள் போய்ச் சேர்ந்தன.,11
1806,இச்செய்திகளெல்லாம் பல்வேறு வழிகளில் வெள்ளைத் துரைமார்கள் செவிகளிலும் சிறிது சிறிதாகச் சென்று சேர்ந்தன.,10
1806,திருமணத்திற்கு ஆயிரக்கணக்கான அன்பர் விருந்தினராய் வந்து குழுமினர்.,6
1806,மக்கள் உள்ளத்தில் புரட்சித்தீ மூளுவதற்கான சூழ்நிலை மிக நன்றாக உருவாகியது.,8
1806,ஆங்கில ஏகாதிபத்தியத்தை எதிர்த்து முதல் முதலாக இந்திய மண்ணில் இராணுவப் புரட்சி வீறுடன் கிளம்பியது.,11
1806,புரட்சி எழுவதற்கான பல்வேறு அறிகுறிகளையும் ஆங்கிலப்படை அதிகாரிகள் அறிந்திருந்தார்கள்.,7
1806,"மேலும், இந்நாளிலேதான் வெள்ளை அதிகாரி ஒருவன் இந்தியச்சிப்பாய் ஒருவனால் பயிற்சி புரியுமிடத்தில் பகிரங்கமாக அவமானப்படுத்தப் பட்டிருந்தான்.",12
1806,"இந்நிலையில் ஜூலை மாதம், பத்து ஆம் தேதி, பொழுது விடிந்ததும் இராணுவ நாள் கொண்டாட ஏற்பாடு செய்யப்பட்டிருந்தது.",13
1806,இப்படிப்பட்ட சந்தர்ப்பங்களில் முதல் நாள் இரவே சிப்பாய்கள் அனைவரும் கோட்டைக்குள்ளே உறங்குதற்கு அனுமதிக்கப்படுவது வழக்கம்.,11
1806,அப்பொழுதுதான் அவர்கள் அதிகாலையிலேயே எழுந்து பயிற்சிக்குத் தயாராக முடியும்.,7
1806,வேலூரிலிருந்த பட்டாளத்தின் ஒரு பிரிவில் மிக முக்கியமான புரட்சிக்காரர்கள் இருந்தார்கள்.,8
1806,அவர்களே அன்றைய தினம் இரவு கோட்டையில் காவலாளிகளாகவும் நியமிக்கப்பட்டார்கள்.,7
1806,மறுநாள் பொழுது விடியும் நேரத்தில் பல மாதங்களாகக் கனன்றுகொண்டிருந்த புரட்சி எரிமலை குபீரென வெடித்துத் தீக்குழம்பை வாரி வீசத்தொடங்கியது.,14
1806,இந்திய அதிகாரிகளின் ஆணையின் பேரில் இந்திய இராணுவத்தின் ஒரு பகுதி பயிற்சிக்களத்தில் அணி வகுத்து நின்றது.,12
1806,குறி பார்த்துச் சுடும் பயிற்சிக்கு ரவைகள் வழங்குவது போலத் துப்பாக்கிக் குண்டுகள் வழங்கப்பட்டன.,10
1806,ஏற்கெனவே அவ்விடத்தில் காவல் புரிந்து கொண்டிருந்த சுதேசி சிப்பாய்களும் இப்படையினரின் வரவை எதிர் நோக்கி இருந்தார்கள்.,12
1806,இரு படைகளும் ஒன்று சேர்ந்தன.,4
1806,"டுமீல், டுமீல் என்று துப்பாக்கிகள் வெடித்தன.",5
1806,குழுமியிருந்த பறங்கிக் கூட்டத்தின் குலை நடுங்கியது.,5
1806,"புரட்சி எரிமலையின் முதல் வீச்சு இவ்வாறு தொடங்கியதும், கோட்டை எங்கும் ஒரே கொந்தளிப்பு ஏற்பட்டது.",11
1806,அடியுண்ட அரவங்களைப்போலப் பறங்கித்துரைகள் சுருண்டு சுருண்டு நாற்காலிகட்கும் தூண்கட்கும் பின்னே ஒடி ஒளிந்தார்கள்.,10
1806,சுதந்தர வீரர்களின் இம்முதல் வேட்டை முடிவதற்குள் தளவாடப் பேரறை உட்படக் கோட்டையின் முக்கிய இடங்களை எல்லாம் புரட்சியாளர் கைப்பற்றிவிட்டனர்.,14
1806,கோட்டைக்குள் இருந்த கோவிலுங்கூட அவர்கள் கையிற் சிக்கியது.,6
1806,துப்பாக்கிப் போர் விடியற்காலம் மணி மூன்றிருக்கும்.,5
1806,தங்கள் இன்னுயிரைக் காக்க அவ்வெள்ளையர்கள் கை ஓயுமட்டும் விடுதலை வீரர்களைச் சுட்டுத் தீர்த்தார்கள்.,10
1806,அப்படியும் விடுதலை வீரர்களின் எதிர்த்தாக்குதலைச் சமாளிக்கப் பறங்கித் துரைகளால் முடியவில்லை.,8
1806,"எனவே, அவர்கள் அண்மையிலிருந்த ஜோன்ஸ் என்பவன் வீட்டில் ஓடி ஒளிந்தார்கள்.",8
1806,நிகழ்ச்சிகள் இவ்வாறு ஒரு புறம் நடந்துகொண்டிருக்கப் புரட்சி வீரர்கள் கோட்டைக்கொடி மரத்தையும் கைப்பற்றினார்கள்.,10
1806,புரட்சி தொடங்கி ஐந்து மணி வரை எந்த வெள்ளையனுக்கும் வெளியே தலை நீட்டத் துணிச்சலில்லை.,11
1806,புதிய வீட்டில் அடைக்கலம் புகுந்த துரைமார் அனைவரும் திருதிருவென விழித்துக் கொண்டு திகிலுடன் காலத்தைப் போக்கினர்.,12
1806,காலை எட்டு மணி ஆயிற்று.,4
1806,துரைமார்கள் ஒளிந்திருந்த வீடு புரட்சி வீரர்களால் கடுமையாகத் தாக்கப்பட்டது.,7
1806,இரு தரப்பிலும் கடுமையான துப்பாக்கிப் பிரயோகம் நடை பெற்றது.,7
1806,இந்தியச் சிப்பாய்களின் ஆற்றலுக்கு எதிர் நிற்க இயலாமல் வெள்ளைத் தளபதிகள் அனைவரும் சிப்பாய்கள் குடியிருக்கும் பகுதிக்குள் போய் மறைந்தனர்.,14
1806,தப்பியோடிய அத்துரைமார்களை விடாது விரட்டி வேட்டையாடினர் புரட்சி வீரர்.,7
1806,செய்வதறியாது திகைத்த சீமைத் துரைகள் தாங்கள் ஒளியச் சென்ற இடத்திற்கு எதிரே இருந்த பறைச்சேரியை நோக்கி ஓட ஆரம்பித்தார்கள்.,14
1806,எப்படியாவது கோட்டை கொத்தளங்களைக் கைப்பற்ற வேண்டுமென்பதே பறங்கிப் பட்டாளத்தின் திட்டம்.,8
1806,"கொத்தளங்கள் மேலும், கொத்தளத்தின் அடியில் பத்திரப்படுத்தி வைக்கப்பட்டிருந்த கிடங்கிலிருந்த பொருள்கள் யாவற்றையும் நம் வீரர்கள் முன்பே சூறையாடிவிட்டார்கள்.",13
1806,இதையறிந்த துரைமார்கள் அடைந்த துக்கம் சொல்லி முடியாது.,6
