work_title,sentence,sentence_length
அந்த_நாய்க்குட்டி_எங்கே,முத்துப் பல்லக்கு மாதிரி ஆடி அசைந்து புறப்பட்டது அந்த நீலநிற கார்.,9
அந்த_நாய்க்குட்டி_எங்கே,உமைபாலனின் அழகான விழிகளிலிருந்து கண்ணீரின் துளிகள் வழிந்துகொண்டே இருந்தன.,7
அந்த_நாய்க்குட்டி_எங்கே,அவனது பிஞ்சுக் கரங்கள் குவித்தது குவித்தபடியே இருந்தன.,6
அந்த_நாய்க்குட்டி_எங்கே,﻿ ﻿ இளவரசி வாழ்க !,4
அந்த_நாய்க்குட்டி_எங்கே,ஒன்று தேமதுரத் தமிழ் வாழ்த்துகின்ற பொங்குவிரி காவிரியின் வாழ்த்தைப் பெற்றது அல்லவா சோழவள நாடு !,11
அந்த_நாய்க்குட்டி_எங்கே,"புலிக்கொடி வாகை சூடிக் கொடிகட்டி பறந்த சோழமண்டலத்திற்கு, அன்றைக்கு வழித்தடம் அமைத்துக் கொடுத்த முதல் மரியாதைக்குரியது சிருங்காரபுரி நாடு !..",14
அந்த_நாய்க்குட்டி_எங்கே,அப்பொழுது – அத்தாணி மீண்டபம் மிகுந்த பரபரப்புடன் காணப்பட்டது.,7
அந்த_நாய்க்குட்டி_எங்கே,"மண்டபத்தின் பிரதான வாயிலில் காவலர்கள் இருவர் கடமையின் கண்ணியத்தோடு, கட்டுப்பாடு காத்து நின்றனர்.",10
அந்த_நாய்க்குட்டி_எங்கே,அவர்களுடைய முகங்களிலே பளிச்சிட்ட கேள்விக்குறியில் ஆச்சரியக்குறி மின்னிமின்னி மறைந்தது.,7
அந்த_நாய்க்குட்டி_எங்கே,"அடுத்த கால்நாழிகைப் பொழுதில், அரண்மனை அறிவிப்பு மணியின் ஒலி திக்கெட்டும் எதிரொலிக்கத் தொடங்கியது.",10
அந்த_நாய்க்குட்டி_எங்கே,"ஆம், அன்று அங்கே மந்திராலோசனை சபை கூடப்போகிறது !",6
அந்த_நாய்க்குட்டி_எங்கே,அதோ தலைமை அமைச்சர் அழகண்ணல் !,4
அந்த_நாய்க்குட்டி_எங்கே,அவரைத் தொடர்ந்தார் ஆஸ்தான கவிஞர் தமிழேந்தி !,5
அந்த_நாய்க்குட்டி_எங்கே,இருவரும் உற்ற காவலர்களுடனும் உரிய மரியாதைகளுடனும் இடைவழி கடந்தனர்.,7
அந்த_நாய்க்குட்டி_எங்கே,அங்கு குழுமியிருந்தவர்களின் அஞ்சலிகளை ஏற்றனர்.,4
அந்த_நாய்க்குட்டி_எங்கே,தலைமை அமைச்சர் அழகண்ணல்.,3
அந்த_நாய்க்குட்டி_எங்கே,மேனியைத் தழுவிக் கிடந்த பட்டு அங்கியின் நுனி கொண்டு நெற்றிப் பொட்டின் விளிம்பினைத் துடைத்துக்கொண்டே அமர்ந்தார்.,12
அந்த_நாய்க்குட்டி_எங்கே,மன்னர்பிரானின் சிம்மாசனத்திற்குச் சற்றுக் கீழே இருந்த மேடையில் அமைக்கப்பட்டிருந்தது அவரது இருக்கை.,9
அந்த_நாய்க்குட்டி_எங்கே,கவிஞர் பெருமான் தமிழேந்தியும் அமர்ந்து கொண்டார்.,5
அந்த_நாய்க்குட்டி_எங்கே,முதுமையின் தளர்ச்சியை அவர் மாற்ற முடியாமல் திணறினார்.,6
அந்த_நாய்க்குட்டி_எங்கே,"மன்னர் வருகை பற்றிய அறிவிப்புச் சொல்லப்பட்டது, அரசாங்கத் தோரணையில் !",7
அந்த_நாய்க்குட்டி_எங்கே,சில கணங்கள் கழிந்திருக்கும்.,3
அந்த_நாய்க்குட்டி_எங்கே,மாட்சிமை தங்கிய மாமன்னர் வருகிறார் !.. பராக்... பராக் ! என்று ஆரவாரப் பேரொலி கிளம்பியது.,10
அந்த_நாய்க்குட்டி_எங்கே,முதுகுப்புறம் இரு மருங்கிலும் தவழ்ந்த வெண்பட்டுத் துப்பட்டாக்களை கைகளில் ஏந்தி நின்றனர் ஏவலாளர் இருவர்.,11
அந்த_நாய்க்குட்டி_எங்கே,வெண்சாமரம் வீசினர் இருவர்.,3
அந்த_நாய்க்குட்டி_எங்கே,மணிமகுடத்தை நாசூக்காக நகர்த்திக் கொண்டு வைரக்கற்களும் நவரத்தினங்களும் கண் சிமிட்டின.,8
அந்த_நாய்க்குட்டி_எங்கே,முதல் அமைச்சர் எழுந்து மன்னரின் காதோரம் குனிந்து பவ்யமாக ஏதோ பேசினார்.,9
அந்த_நாய்க்குட்டி_எங்கே,மன்னர் ம் ! கொட்டினார்.நெற்றியில் சிந்தனைக் கோடுகள் இருந்தன !,7
அந்த_நாய்க்குட்டி_எங்கே,அரசவைக் கவிஞருக்கு அடையாளம் காட்டப்பட்டது.,4
அந்த_நாய்க்குட்டி_எங்கே,தோத்திரப்பா சொன்னர் கவிஞர் தமிழேந்தி கல்லார்க்குங் கற்றவர்க்கும் களிப்பருளுங் களிப்பே !,8
அந்த_நாய்க்குட்டி_எங்கே,⁠காணார்க்குங் கண்டவர்க்கும் கண்ணளிக்கும் கண்ணே !,4
அந்த_நாய்க்குட்டி_எங்கே,வல்லார்க்கும் மாட்டார்க்கும் வரமளிக்கும் வரமே ⁠மதியார்க்கும் மதிப்பவர்க்கும் மதிகொடுக்கும் மதியே !,8
அந்த_நாய்க்குட்டி_எங்கே,நல்லார்க்கும் பொல்லார்க்கும் நடுவில்நின்ற நடுவே !,4
அந்த_நாய்க்குட்டி_எங்கே,⁠நரர்களுக்கும் சுரர்களுக்கும் நலங்கொடுக்கும் நலமே !,4
அந்த_நாய்க்குட்டி_எங்கே,எல்லாருக்கும் பொதுவில்நடமிடுகின்ற சிவமே !,3
அந்த_நாய்க்குட்டி_எங்கே,யான்புகலு மிசையுமணித் தருளே ! பாட்டு முடிந்தது.,5
அந்த_நாய்க்குட்டி_எங்கே,அமைதியின் அடையாளத்திற்கென இராமேசுவரம் சங்கு இதமாய் முழங்கியது.,6
அந்த_நாய்க்குட்டி_எங்கே,மந்திராலோசனை மண்டபம் பேரமைதி பூண்டது.,4
அந்த_நாய்க்குட்டி_எங்கே,"ஆகவே, அவனைப் படை கொண்டு தாக்க வேண்டும் என்பதே நம் புவி முதல்வரின் விருப்பம்.",11
அந்த_நாய்க்குட்டி_எங்கே,"இச்செய்தியை நாம் அனைவரும் கருத்திற்கொண்டு, அரண்மனையின் ஆட்சிபீடம் அறிவிக்கும் திட்டப்படி செயற் படுவோமாக ! பேசி முடித்தார் பெரியவர்.",13
அந்த_நாய்க்குட்டி_எங்கே,முத்து வடமாலை பளிச்சிட்டது.,3
அந்த_நாய்க்குட்டி_எங்கே,"மாமன்னர் வாழ்க !... எதிரியை வெல்வோம் ! என்று மண்ணதிர, விண்ணதிர ஒலி எழுப்பனான் பிரதமசேனாதிபதி.",10
அந்த_நாய்க்குட்டி_எங்கே,பூபேந்திர பூபதி ஆத்திரம் தொனிக்க எழுந்தார்.,5
அந்த_நாய்க்குட்டி_எங்கே,உட்புறம் நோக்கி அவரது பாதணிகள் நடைபயின்றன !,5
அந்த_நாய்க்குட்டி_எங்கே,ஆய்வுக் குழு கலைந்தது.,3
அந்த_நாய்க்குட்டி_எங்கே,சுற்றுமதிற் கோட்டையின் நெடு வாயிலில் காவல் இருந்த வாயிற்காப்போன் அரண்மனையின் உட்புறம் நோக்கி அடிக்கடி கண்களைப் பாயவிட்டபடி இருந்தான்.,14
அந்த_நாய்க்குட்டி_எங்கே,சிறுபொழுதில் குழந்தை பிறந்து விடுமாம் !... என்று செய்தி சொன்னான்.,7
அந்த_நாய்க்குட்டி_எங்கே,ஐயனே மன்னருக்கு ஆண்மகவைக் கொடுத்து அருள்செய்.,5
அந்த_நாய்க்குட்டி_எங்கே,அம்மையப்பனே என்று நெஞ்சம் நெக்குருகப் பிரார்த்தித்தனர் காவலாளிகள் !,6
அந்த_நாய்க்குட்டி_எங்கே,இரண்டு சிருங்காரபுரி நகரத்தின் முச்சந்தித் தகவல் அறிவிப்புக் கூடம் அது.,8
அந்த_நாய்க்குட்டி_எங்கே,பறை ஒலி வானைப் பிளந்தது.,4
அந்த_நாய்க்குட்டி_எங்கே,படைத்தலைவன் ஒருவன் தன்னுடைய நீலத்தலைப்பாகையுடன் கம்பீரமாக அழகிய குதிரையினின்றும் இறங்கினான்.,8
அந்த_நாய்க்குட்டி_எங்கே,கையிலிருந்த ஒலைச்செய்தியைத் தயாராக எடுத்து வைத்துக் கொண்டான்.,6
அந்த_நாய்க்குட்டி_எங்கே,டம்... டம்... டமார் என்று பலதரப்பட்ட மேள வாத்திய ஒலிகளும் தொடர்ந்தன.,9
அந்த_நாய்க்குட்டி_எங்கே,நாட்டு மக்கள் களிபேருவகையுடனும் நனிமிகு ஆர்வத்துடனும் அங்கு கூட ஆரம்பித்தனர்.,8
அந்த_நாய்க்குட்டி_எங்கே,"பெண்கள், குழந்தைகள், முதியோர்கள், அயலவர்கள் என்ற பாரபட்சம் ஏதுமில்லாமல் கூட்டம் நெருக்க ஆரம்பித்தது.",10
அந்த_நாய்க்குட்டி_எங்கே,"அப்போது, அக் கூட்டத்தில் ஒர் அங்கமாக அழகான புதிய யுவதி ஒருத்தி வந்து இணைந்தாள்.",11
அந்த_நாய்க்குட்டி_எங்கே,வந்தவள் உண்மையிலேயே அந்நாட்டுக்குப் புதியவள் என்பது அவளது விழிப்பிலிருந்தே புரிந்துவிட்டது.,8
அந்த_நாய்க்குட்டி_எங்கே,உச்சி வெயிலின் வெக்கை அவளுக்குப் பிடிக்க வில்லைபோலும் !,6
அந்த_நாய்க்குட்டி_எங்கே,படைத்தலைவன் அக் கூட்டத்தைக் கூர்ந்து நோட்டம் விட்டான்.,6
அந்த_நாய்க்குட்டி_எங்கே,"பிறகு, இடுப்பில் செருகியிருந்த ஒரு கருவியைக் கண்களிலே இடுக்கி, அதை ஒலைத்துணி கொண்டு லாகவமாக மறைத்தபடி கும்பலைக் கவனித்தான்.",14
அந்த_நாய்க்குட்டி_எங்கே,அவன் முகம் ஏன் அப்படி வெளிற வேண்டும்?,6
அந்த_நாய்க்குட்டி_எங்கே,பிறகு தன் அரசாங்கக் கடமையை நிறைவேற்றலானான்.,5
அந்த_நாய்க்குட்டி_எங்கே,தாயும் சேயும் நலமாயிருக்கிறார்கள்.,3
அந்த_நாய்க்குட்டி_எங்கே,எல்லாம் நம் மதிப்புக்குரிய மேன்மை பொருந்திய மாமன்னர் கைதொழும் எம்பிரான் கந்தவேளின் கடாட்சமேயாகும்.,10
அந்த_நாய்க்குட்டி_எங்கே,"கூட்டம் கலையத் தொடங்கிய கட்டத்தில், அந்தப் படைத் தலைவன் விசுக்கென்று விரைந்து கூட்டத்தை ஊடுருவினான்.",11
அந்த_நாய்க்குட்டி_எங்கே,அதோ... அந்தப் புதிய யுவதி !...,4
அந்த_நாய்க்குட்டி_எங்கே,"அவளை நலியாமல் நெருங்கி, அவளது பூங்கரங்களை இறுகப் பிடித்துக் கொண்டான் படைத்தலைவன்.",9
அந்த_நாய்க்குட்டி_எங்கே,அவள் எதிரி நாட்டின் உளவாளிப் பகுதியை சார்ந்தவளாகவே இருக்க வேண்டுமென்பது அவனுடைய திடமான கருத்து.,11
அந்த_நாய்க்குட்டி_எங்கே,அப்பெண் முதன் முதலில் கூட்டத்தில் ஒண்டியதிலிருந்தே அவள்பால் ஒரு கண் பதித்து வந்திருக்கிறான் அவன்.,11
அந்த_நாய்க்குட்டி_எங்கே,பாம்பின் கால் பாம்புக்குத்தான் தெரியுமோ?,4
அந்த_நாய்க்குட்டி_எங்கே,"நீ யார்? நானா, பெண் !...",4
அந்த_நாய்க்குட்டி_எங்கே,குமரி !.... ஊர்? மணிபல்லவம்? உண்மையாகவா? ஆம் புத்தர் வழிபாடு எங்களுக்குச் சொந்தம்.,9
அந்த_நாய்க்குட்டி_எங்கே,"பின், நீ மட்டுந்தானா வந்தாய்? என்று மீண்டும் வினவினான்.",7
அந்த_நாய்க்குட்டி_எங்கே,"ஆம், எனக்கு நான்தான் காவல்.",4
அந்த_நாய்க்குட்டி_எங்கே,வேறு அச்சம் எனக்கு ஏன் இருக்கப் போகிறது? பெரிய பெண்தான் நீ ஊஹம்.,10
அந்த_நாய்க்குட்டி_எங்கே,"ஆமாம், உன் பெயரைச் சொல்லவில்லையே நீ? நீங்கள் கேட்டால்தானே சொல்வேன்?...",8
அந்த_நாய்க்குட்டி_எங்கே,"பெண் எதையும் வலுவில் திணிப்பது பண்பாடல்ல, எங்கள் நாட்டில் ! இங்கு எங்கள் நாட்டிலும் அதுதான் மரபு !",12
அந்த_நாய்க்குட்டி_எங்கே,ம்... உன் பெயர்? நாதசுரபி !.. புதிதாக ஒலிக்கிறது ! நானே புதியவள்தான் ! அவன் சிரிப்புடன் நடந்தான்.,11
அந்த_நாய்க்குட்டி_எங்கே,அவளைத் தொடரச் செய்தான்.,3
அந்த_நாய்க்குட்டி_எங்கே,நடந்து வந்த நாதசுரபி அந்த ஆலமரத்தின் அருகில் சற்று நேரம் நின்றாள்.,9
அந்த_நாய்க்குட்டி_எங்கே,அரண்மனையின் குடதிசைக் கோட்டைச் சுவர் கம்பீரமாக மின்னியது.,6
அந்த_நாய்க்குட்டி_எங்கே,"நின்றவள், சற்றும் எதிர்பாராத வகையில் ஏனோ மயங்கிச் சாய்ந்தாள்.",7
அந்த_நாய்க்குட்டி_எங்கே,"நடத்திச் சென்ற குதிரையை நிறுத்திவிட்டு, தண்ணீருக்காகத் தேடினான்.",6
அந்த_நாய்க்குட்டி_எங்கே,"தெரிந்த கிழவியிடம் வேண்டி நீர் பெற்று, அக் கன்னியின் முகத்தில் தெளித்தான்.",9
அந்த_நாய்க்குட்டி_எங்கே,மூன்று பண்புசால் பழந்தமிழ் இலக்கியங்களிலே ஓர் உண்மை செப்பப்பட்டிருப்பது மாறாத நடப்பாகவும் மாற்றமுடியாத நிகழ்ச்சியாகவும் இடம் பெற்றுள்ளன.,13
அந்த_நாய்க்குட்டி_எங்கே,மன்னன் வழிப்படியே குடிமக்கள் !,3
அந்த_நாய்க்குட்டி_எங்கே,"நாட்டின் அரசவைப் பாவாணர் தமிழேந்தி குறித்த பிரகாரம், அயன் கையெழுத்தை யார்தாம் அறிய வல்லமை பெற்றிருக்கிறார்கள்?",12
அந்த_நாய்க்குட்டி_எங்கே,"மன்னர் பூபேந்திரபூபதி, யார் என்ன தேற்றியும் மனம் தேறினார் இல்லை.",8
அந்த_நாய்க்குட்டி_எங்கே,"ஈடு செய்ய முடியாத பேரிழப்பால் அவரும் அவரது அரசவையினரும் அவருடைய குடிமக்களும் முகத்தில் ஈயாடாமல், சோம்பிய தோற்றத்துடன் காணப்பட்டார்கள் !",14
அந்த_நாய்க்குட்டி_எங்கே,என் ராணியை இனி என்று காண்பேன்?... அவள் தெய்வம் போல வந்தாள்.,9
அந்த_நாய்க்குட்டி_எங்கே,தெய்வமாக ஆகிவிட்டாள். அடிக்கொரு முறை அரசர் பெருமான் சித்தம் பேதலித்தவர் போன்று புலம்பினார்.,10
அந்த_நாய்க்குட்டி_எங்கே,தம் மனைவி தன் நினைவுச்சின்னமாக விட்டுச் சென்றுள்ள ஆண்மகவின் அழுகையும் தவிப்பும் வேறு அவரைப் பாடாய்ப்படுத்தின.,12
அந்த_நாய்க்குட்டி_எங்கே,யார் யாரோ தாதிகள் அரண்மனைக் குழவியைப் பராமரிக்க அமர்த்தப்பட்டார்கள்.,7
அந்த_நாய்க்குட்டி_எங்கே,அவர்களிலே யாருடைய அன்புக்கும் அது கட்டுப்படவில்லை.,5
அந்த_நாய்க்குட்டி_எங்கே,"விடிய விடிய விழித்திருந்தும், அதன் ஒலத்தை அடக்க முடியவில்லை, பணிப்பெண்களால்.",8
அந்த_நாய்க்குட்டி_எங்கே,நான் இந்த அவலக் காட்சிகளையெல்லாம் கண்கொண்டு கண்டு சகித்துக்கொண்டு உயிர்தரித்திருக்க மாட்டேன் ! என்று கதறினார் பூபேந்திர பூபதி.,13
அந்த_நாய்க்குட்டி_எங்கே,துயரம் அவரது உடலை துரும்பாக்கிற்று.,4
அந்த_நாய்க்குட்டி_எங்கே,முதல் மந்திரி அழகண்ணல் புழுவாய்த் துடித்தார். மன்னர் பெருந்தகைக்குத் தெரியாததல்ல.,8
அந்த_நாய்க்குட்டி_எங்கே,எங்களைத் தேற்றுவார் யார்?,3
அந்த_நாய்க்குட்டி_எங்கே,மேலும்... எதிரி நாட்டானுக்குக் கொண்டாட்டமான நேரம் இது.,6
