work_title,sentence,sentence_length
அன்னை_கஸ்தூரிபாயின்_நம்மை_மேம்படுத்தும்_எண்ணங்கள்,நீ மதம் மாறியதை நான் விரும்பவில்லை.,5
அன்னை_கஸ்தூரிபாயின்_நம்மை_மேம்படுத்தும்_எண்ணங்கள்,இனி நீ ஒழுக்கம் தவறாமல் வாழ்வாய் என்று நம்பினேன்.,7
அன்னை_கஸ்தூரிபாயின்_நம்மை_மேம்படுத்தும்_எண்ணங்கள்,"ஆனால், அந்த நம்பிக்கையும் உடைந்து விட்டது.",5
அன்னை_கஸ்தூரிபாயின்_நம்மை_மேம்படுத்தும்_எண்ணங்கள்,உன்னுடைய நடத்தையால் உன் பிள்ளை எவ்வளவு துயரப்படுகிறான் என்பதை நீ அறிவாயா?,9
அன்னை_கஸ்தூரிபாயின்_நம்மை_மேம்படுத்தும்_எண்ணங்கள்,"உன் நடத்தையால் ஏற்பட்ட சோகச் சுமையை உன் பெண்களும், மருமகளும் மிகவும் கஷ்டப்பட்டுச் சுமக்கிறார்கள்.",11
அன்னை_கஸ்தூரிபாயின்_நம்மை_மேம்படுத்தும்_எண்ணங்கள்,"ஹீராலுக்கு இவ்வாறு கடிதம் எழுதிய அன்னை கஸ்தூரிபாய், ஹீராலாலின் முகமதிய நண்பர்களுக்கும் பத்திரிகை வாயிலாக ஓர் அறிக்கை வெளியிட்டார்.",14
அன்னை_கஸ்தூரிபாயின்_நம்மை_மேம்படுத்தும்_எண்ணங்கள்,அந்த அறிக்கை விவரம் வருமாறு என்மகன் சமீபத்தில் செய்த காரியங்களுக்கு உதவி புரிந்தவர்களுக்குத்தான் இந்தக் கடிதத்தை எழுதுகிறேன்.,13
அன்னை_கஸ்தூரிபாயின்_நம்மை_மேம்படுத்தும்_எண்ணங்கள்,"உங்கள் செயலும், மனப்போக்கும் எனக்கு விளங்கவில்லை.",5
அன்னை_கஸ்தூரிபாயின்_நம்மை_மேம்படுத்தும்_எண்ணங்கள்,"அதற்காக, நான் மகிழ்கிறேன்.",3
அன்னை_கஸ்தூரிபாயின்_நம்மை_மேம்படுத்தும்_எண்ணங்கள்,மத மாற்றத்தால் என் பிள்ளை உயரவில்லை.,5
அன்னை_கஸ்தூரிபாயின்_நம்மை_மேம்படுத்தும்_எண்ணங்கள்,இன்னும் இழி செயல்களிலே ஆழ்ந்து விட்டான்.,5
அன்னை_கஸ்தூரிபாயின்_நம்மை_மேம்படுத்தும்_எண்ணங்கள்,"ஆனால், உங்கள் மதத்தைச் சார்ந்த சிலர், அவனுக்கு மெளல்வி என்று பட்டம் சூட்டவும் முனைந்துவிட்டார்கள்.",11
அன்னை_கஸ்தூரிபாயின்_நம்மை_மேம்படுத்தும்_எண்ணங்கள்,இது உங்களுக்கு நீதியா என்று கேட்கிறேன்.,5
அன்னை_கஸ்தூரிபாயின்_நம்மை_மேம்படுத்தும்_எண்ணங்கள்,என் மகனைப் போன்ற ஒழுக்கம் கெட்டவர்களுக்கு மெளல்வி பட்டம் சூட்ட உங்கள் மதம் சம்மதிக்கிறதா?,11
அன்னை_கஸ்தூரிபாயின்_நம்மை_மேம்படுத்தும்_எண்ணங்கள்,"ஆணேறு என்று அவனைத் தட்டிக் கொடுத்து, நீங்கள் கண்ட ஆனந்தம் ஏன் என்று எனக்குப் புரியவில்லை.",12
அன்னை_கஸ்தூரிபாயின்_நம்மை_மேம்படுத்தும்_எண்ணங்கள்,அவனுடைய நன்மைக்காக இவ்வாறு செய்கிறீர்கள் என்றும் என்னால் நம்ப முடியவில்லை.,8
அன்னை_கஸ்தூரிபாயின்_நம்மை_மேம்படுத்தும்_எண்ணங்கள்,எங்களை இழிவு செய்ய வேண்டும் என்பதே உங்கள் நோக்கம் என்றால் நான் ஒன்றும் சொல்வதற்கில்லை.,11
அன்னை_கஸ்தூரிபாயின்_நம்மை_மேம்படுத்தும்_எண்ணங்கள்,நீங்கள் உங்கள் விருப்பப்படி செய்யலாம்.,4
அன்னை_கஸ்தூரிபாயின்_நம்மை_மேம்படுத்தும்_எண்ணங்கள்,உங்களுக்குள் சிலருக்காவது மனச்சாட்சி இருக்காதா?,4
அன்னை_கஸ்தூரிபாயின்_நம்மை_மேம்படுத்தும்_எண்ணங்கள்,நொந்து நலியும் ஒரு தாயின் சோகக் குரல் உங்களுடைய உள்ளத்தைத் தீண்டாதா?,9
அன்னை_கஸ்தூரிபாயின்_நம்மை_மேம்படுத்தும்_எண்ணங்கள்,"அதனால், அவர்கள் என் பிள்ளையை நேர் வழிக்குத் திருப்பிட முயற்சி செய்ய மாட்டார்களா?",10
அன்னை_கஸ்தூரிபாயின்_நம்மை_மேம்படுத்தும்_எண்ணங்கள்,தெய்வ சந்நிதானத்தில் நியாயமான வேலைகளையே செய்ய வேண்டும் என்று எனது மகனுக்குக் கூறினேன்.,10
அன்னை_கஸ்தூரிபாயின்_நம்மை_மேம்படுத்தும்_எண்ணங்கள்,அதையே உங்களுக்கும் மீண்டும் மீண்டும் கூறுகிறேன்.,5
அன்னை_கஸ்தூரிபாயின்_நம்மை_மேம்படுத்தும்_எண்ணங்கள்,"அன்னை கஸ்தூரிபாய், தன்னுடைய மகன் செய்கையால் எவ்வளவு நொந்து போயிருந்தார் என்பதையே மேலே உள்ள இரண்டு கடிதங்களும் உணர்த்துகின்றன.",14
அன்னை_கஸ்தூரிபாயின்_நம்மை_மேம்படுத்தும்_எண்ணங்கள்,இதற்குப் பிறகு தான் ஹீராலால் மீண்டும் இந்து மதத்திற்குத் திரும்பினார்.,8
அன்னை_கஸ்தூரிபாயின்_நம்மை_மேம்படுத்தும்_எண்ணங்கள்,அவர் தனது செயல்களுக்காக வருந்தினார்.,4
அன்னை_கஸ்தூரிபாயின்_நம்மை_மேம்படுத்தும்_எண்ணங்கள்,"ஆனால் அவர், தனது பெற்றோர்களுடன் மீண்டும் சேர்ந்து வாழ விரும்பவில்லை.",8
அன்னை_கஸ்தூரிபாயின்_நம்மை_மேம்படுத்தும்_எண்ணங்கள்,﻿ ஓர் ஆயிரத்து தொள்ளாயிரத்து நாற்பத்திரண்டு ஆம் ஆண்டு வெள்ளையனே வெளியேறு என்ற போராட்டம் தொடங்கியது.,12
அன்னை_கஸ்தூரிபாயின்_நம்மை_மேம்படுத்தும்_எண்ணங்கள்,இதுதான் எனது கடைசிப் போராட்டம் என்று காந்தியடிகள் கூறிவிட்டார்.,7
அன்னை_கஸ்தூரிபாயின்_நம்மை_மேம்படுத்தும்_எண்ணங்கள்,அந்த ஆண்டு ஆகஸ்டு ஒன்பது ஆம் நாள் இந்திய தேசிய காங்கிரஸ் செயற்குழு பம்பாயில் கூடுவதாக இருந்தது !,13
அன்னை_கஸ்தூரிபாயின்_நம்மை_மேம்படுத்தும்_எண்ணங்கள்,இருள் இரவை விட்டுப் பிரியாத வேளை !,5
அன்னை_கஸ்தூரிபாயின்_நம்மை_மேம்படுத்தும்_எண்ணங்கள்,மகாத்மாவும் கஸ்தூரிபாயும் அன்று பிர்லா மாளிகையில் தங்கி இருந்தார்கள்.,7
அன்னை_கஸ்தூரிபாயின்_நம்மை_மேம்படுத்தும்_எண்ணங்கள்,அப்போது ஆங்கிலேயர் அரசு அந்தக் கருக்கல் இருட்டு நேரத்தில் மகாத்மா காந்தியைக் கைது செய்தது !,11
அன்னை_கஸ்தூரிபாயின்_நம்மை_மேம்படுத்தும்_எண்ணங்கள்,அன்று மாலை சிவாஜி பூங்காவில் காந்தி அடிகள் பொதுக் கூட்டத்தில் பேசுவதாக அறிவிக்கப்பட்டிருந்தது.,10
அன்னை_கஸ்தூரிபாயின்_நம்மை_மேம்படுத்தும்_எண்ணங்கள்,"அவரை ஆட்சி கைது செய்து விட்டதால், கஸ்துரிபாய் அடிகளாருக்குப் பதிலாக பேசுவார் என்று கூறப்பட்டது.",11
அன்னை_கஸ்தூரிபாயின்_நம்மை_மேம்படுத்தும்_எண்ணங்கள்,"அன்றுமாலை இரண்டு காவலர்கள் பிர்லா மாளிகைக்கு வந்து, இன்றைய பொதுக்கூட்டத்தில் கஸ்தூரிபாய் பேசப்போகிறாரா என்று அங்குள்ளவர்களைக் கேட்டார்கள்.",13
அன்னை_கஸ்தூரிபாயின்_நம்மை_மேம்படுத்தும்_எண்ணங்கள்,உடனே ஆம் நான் தான் பேசப் போகிறேன் என்று அந்த அதிகாரிகளிடம் கஸ்தூரிபாய் கூறினார்.,11
அன்னை_கஸ்தூரிபாயின்_நம்மை_மேம்படுத்தும்_எண்ணங்கள்,"உடனே போலீசார், கஸ்தூரி பாயையும், பியாரிலாலையும், சுசிலா நய்யாரையும் கைது செய்தார்கள்.",9
அன்னை_கஸ்தூரிபாயின்_நம்மை_மேம்படுத்தும்_எண்ணங்கள்,ஏற்கனவே கைது செய்யப்பட்ட காந்தியடிகளை பூனாவில் உள்ள ஆகாகான் அரண்மனையில் அதிகாரிகள் சிறைவைத்திருந்தார்கள்.,10
அன்னை_கஸ்தூரிபாயின்_நம்மை_மேம்படுத்தும்_எண்ணங்கள்,அதே இடத்திற்கு கஸ்தூரிபாயையும் அழைத்துச் சென்று அவர்கள் சிறை வைத்தார்கள்.,8
அன்னை_கஸ்தூரிபாயின்_நம்மை_மேம்படுத்தும்_எண்ணங்கள்,அன்னையின் உடல் நலம் ஏற்கனவே மிகவும் பலவீனம் பெற்றிருந்தது.,7
அன்னை_கஸ்தூரிபாயின்_நம்மை_மேம்படுத்தும்_எண்ணங்கள்,அடிகளுடனே சிறை வைக்கப்பட்டதால் அவர் மகிழ்ச்சி அடைந்தார்.,6
அன்னை_கஸ்தூரிபாயின்_நம்மை_மேம்படுத்தும்_எண்ணங்கள்,இவர் மகாத்மாவுக்கு சேவை செய்தவாறே தாம் இறக்கவேண்டும் என்று கூறிக் கொண்டிருந்தவர்.,9
அன்னை_கஸ்தூரிபாயின்_நம்மை_மேம்படுத்தும்_எண்ணங்கள்,அவர் இறப்பு காந்தியடிகளை உலுக்கிவிட்டது.,4
அன்னை_கஸ்தூரிபாயின்_நம்மை_மேம்படுத்தும்_எண்ணங்கள்,சோகமே உருவானார் அடிகள்.,3
அன்னை_கஸ்தூரிபாயின்_நம்மை_மேம்படுத்தும்_எண்ணங்கள்,மகாதேவ தேசாய் செல்வமே என்னை விட்டு விட்டு எங்கேயடா சென்றாய்?,8
அன்னை_கஸ்தூரிபாயின்_நம்மை_மேம்படுத்தும்_எண்ணங்கள்,என்று கஸ்தூரிபாய் கதறி அழுதார் !,4
அன்னை_கஸ்தூரிபாயின்_நம்மை_மேம்படுத்தும்_எண்ணங்கள்,அதை ஆண்டவன் கட்டளை என்று மனைவியிடம் கூறிவிட்டார்.,6
அன்னை_கஸ்தூரிபாயின்_நம்மை_மேம்படுத்தும்_எண்ணங்கள்,தேசாய் மறைந்த துக்கம் தாளவில்லையே என்று கஸ்தூரிபாய் அழுது கண்ணீர்விட்டார்.,8
அன்னை_கஸ்தூரிபாயின்_நம்மை_மேம்படுத்தும்_எண்ணங்கள்,காந்தியடிகளின் படுக்கையைச் சுற்றிச் சுற்றி அந்த மெலிந்த உடல் வலம் வந்து பணிசெய்து கொண்டே இருந்தது.,12
அன்னை_கஸ்தூரிபாயின்_நம்மை_மேம்படுத்தும்_எண்ணங்கள்,ஓர் ஆயிரத்து தொள்ளாயிரத்து நாற்பத்து மூன்று ஆம் ஆண்டு மார்ச் மாதம் அன்னைக்கு இருமுறை இருதய நோய் தாக்கியது.,14
அன்னை_கஸ்தூரிபாயின்_நம்மை_மேம்படுத்தும்_எண்ணங்கள்,அதற்கடுத்து டிசம்பர் மாதத்தில் மீண்டும் இரு முறை வந்தது.,7
அன்னை_கஸ்தூரிபாயின்_நம்மை_மேம்படுத்தும்_எண்ணங்கள்,ஓர் ஆயிரத்து தொள்ளாயிரத்து நாற்பத்து நான்கு ஆம் ஆண்டில் மீண்டும் மார்பு அடைப்பு நோய் வந்தது.,12
அன்னை_கஸ்தூரிபாயின்_நம்மை_மேம்படுத்தும்_எண்ணங்கள்,"அதே நேரத்தில் இந்திய மக்கள், கஸ்தூரி பாயை விடுதலை செய் என்று குரல் கொடுத்துக் கொண்டே இருந்தார்கள்.",13
அன்னை_கஸ்தூரிபாயின்_நம்மை_மேம்படுத்தும்_எண்ணங்கள்,இதே போலவே இங்கிலாந்திலே வாழும் இந்தியர்களும் அன்னையை விடுதலை செய் என்று போராடினார்கள்.,10
அன்னை_கஸ்தூரிபாயின்_நம்மை_மேம்படுத்தும்_எண்ணங்கள்,"ஆனாலும், ஆங்கிலேய அரசு அன்னையை விடுதலை செய்யவில்லை.",6
அன்னை_கஸ்தூரிபாயின்_நம்மை_மேம்படுத்தும்_எண்ணங்கள்,சக்கரவர்த்தி ராஜாஜியின் மருமகன் !,3
அன்னை_கஸ்தூரிபாயின்_நம்மை_மேம்படுத்தும்_எண்ணங்கள்,பிப்ரவரி இருபது ஆம் நாள் அவருடைய உடல் நிலை மிகவும் கவலைக்கிடமாக இருந்தது.,10
அன்னை_கஸ்தூரிபாயின்_நம்மை_மேம்படுத்தும்_எண்ணங்கள்,"ஆங்கிலேய அரசு அறிக்கை வெளியிட்ட போதும், எப்படியாவது நோய் நீங்கிப் பிழைத்து விடலாம் என்ற நம்பிக்கை இருந்தது அவருக்கு.",14
அன்னை_கஸ்தூரிபாயின்_நம்மை_மேம்படுத்தும்_எண்ணங்கள்,இருதயம் பலவீனமாக இயங்கியதால் சிறு நீர்ப்பை அவருக்குச் சரியாக வேலை செய்யவில்லை.,9
அன்னை_கஸ்தூரிபாயின்_நம்மை_மேம்படுத்தும்_எண்ணங்கள்,அத்துடன் தாயாருக்கு நிமோனியாக் காய்ச்சலும் கண்டுவிட்டது.,5
அன்னை_கஸ்தூரிபாயின்_நம்மை_மேம்படுத்தும்_எண்ணங்கள்,ரத்த வேகமும் குறைந்து விட்டதால் டாக்டர்கள் என் தாயார் உயிர்மீது நம்பிக்கை இழந்து விட்டார்கள்.,11
அன்னை_கஸ்தூரிபாயின்_நம்மை_மேம்படுத்தும்_எண்ணங்கள்,திங்கள் கிழமை காலை நான் தாயாரைப் பார்க்கச் சென்றேன்.,7
அன்னை_கஸ்தூரிபாயின்_நம்மை_மேம்படுத்தும்_எண்ணங்கள்,அவர் மிகவும் கஷ்டப்பட்டுக் கொண்டிருப்பதைப் பார்த்தேன்.,5
அன்னை_கஸ்தூரிபாயின்_நம்மை_மேம்படுத்தும்_எண்ணங்கள்,"உறவினர்களும், நண்பர்களும் செய்த ஓரளவு பணிவிடைகளால் அவர் நலமடைந்தவர் போலக் காணப்பட்டார்.",9
அன்னை_கஸ்தூரிபாயின்_நம்மை_மேம்படுத்தும்_எண்ணங்கள்,அன்றிரவு டாக்டர்கள் சொன்னதற்கு மாறாக தாயார் உயிருடன் இருந்தார்.,7
அன்னை_கஸ்தூரிபாயின்_நம்மை_மேம்படுத்தும்_எண்ணங்கள்,இந்த உலகத்தில் அவர் உயிரோடு இருந்தது அன்று இரவுதான்.,7
அன்னை_கஸ்தூரிபாயின்_நம்மை_மேம்படுத்தும்_எண்ணங்கள்,"அந்த இரவிலே நண்பர்களும், சுற்றத்தாரும், எனது தந்தையும் அம்மாவுக்கு வேண்டிய பணிகளைச் செய்தார்கள்.",10
அன்னை_கஸ்தூரிபாயின்_நம்மை_மேம்படுத்தும்_எண்ணங்கள்,"ஏதாவது கேள்வி கேட்டால், அம்மா அரைகுறை நினைவோடு ஒரே வார்த்தைதான் பதில் கூறுவார்.",10
அன்னை_கஸ்தூரிபாயின்_நம்மை_மேம்படுத்தும்_எண்ணங்கள்,அதுவும் இயலாத போது தலையை மட்டும் ஆட்டுவார்.,6
அன்னை_கஸ்தூரிபாயின்_நம்மை_மேம்படுத்தும்_எண்ணங்கள்,"ஒருமுறை அப்பா அருகில் சென்று உட்கார்ந்த போது, அம்மா கைகளைத் தூக்கி அவர் யார்?",11
அன்னை_கஸ்தூரிபாயின்_நம்மை_மேம்படுத்தும்_எண்ணங்கள்,என்று அப்பாவைப் பார்த்துக் கேட்டார்.,4
அன்னை_கஸ்தூரிபாயின்_நம்மை_மேம்படுத்தும்_எண்ணங்கள்,அம்மா அருகிலே இருந்து சில பணிகளைச் செய்ததன் மூலம் அப்பா ஓர் ஆறுதல் கிடைத்தது போலக் காணப்பட்டார்.,13
அன்னை_கஸ்தூரிபாயின்_நம்மை_மேம்படுத்தும்_எண்ணங்கள்,"அம்மாவுக்கு அருகில் இருந்த அப்பா, அப்போது சில ஆண்டுகள் குறைந்து விட்ட வயதினரைப் போலத் திகழ்ந்தார்.",12
அன்னை_கஸ்தூரிபாயின்_நம்மை_மேம்படுத்தும்_எண்ணங்கள்,"ஆனால், அப்பா கைகள் மட்டும் நடுங்கிக் கொண்டே இருந்தன.",7
