work_title,sentence,sentence_length
அந்த_நாய்க்குட்டி_எங்கே,⁠ நானும் உனக்கு ஒரு பரிசு தரவேண்டாமா?,6
அந்த_நாய்க்குட்டி_எங்கே,இதோ ! என்று சொல்லித் தன் கழுத்திலிருந்த அந்தப் புதிய வைரச் சங்கிலியை கழற்றி அவன் கழுத்தில் போட்டாள் பூங்கோதை.,14
அந்த_நாய்க்குட்டி_எங்கே,"⁠பிறகு இருவரும் சிரித்து மகிழ்ந்து, கை கோர்த்து நடனமாடினார்கள்.",7
அந்த_நாய்க்குட்டி_எங்கே,டேக் !... ⁠டைரக்டரின் குரல்கள் மாறி மாறி ஒலித்தது.,6
அந்த_நாய்க்குட்டி_எங்கே,⁠படம் பிடிக்கப்பட்டது ⁠அடுத்த இரண்டாவது வினாடி– ⁠ ஆ ! என்று கதறினான் பூபாலன்.,10
அந்த_நாய்க்குட்டி_எங்கே,கீழே கிடந்த கத்தியொன்றை எடுத்து எதிரே வீசினான்.,6
அந்த_நாய்க்குட்டி_எங்கே,⁠ ஆ ! என்ற எதிர்க்குரல் கேட்டது.,5
அந்த_நாய்க்குட்டி_எங்கே,எதிரே அந்தக் குரலுக்குரிய உருவம் நின்றது.,5
அந்த_நாய்க்குட்டி_எங்கே,சர்க்கஸ்காரன்... சுகுமாரன் ! ⁠சில வினாடிகள் தேய்ந்தன.,5
அந்த_நாய்க்குட்டி_எங்கே,⁠ தம்பி பூபாலன் !,3
அந்த_நாய்க்குட்டி_எங்கே,"உன்னைக் கைது செய்திருக்கிறோம், இதோ நீ கழுத்தில் போட்டுக் கொண்டிருக்கும் இந்த வைரச் சங்கிலி திருட்டுச் சொத்து.",13
அந்த_நாய்க்குட்டி_எங்கே,இதோ பார் சர்க்கஸ் சுகுமார் ! என்ற எழுத்துகள் இந்தச் சங்கிலியின் டாலரில் மின்னுகின்றன... !,10
அந்த_நாய்க்குட்டி_எங்கே,சர்க்கஸ்காரர் சுகுமாரனுடையதாம் இந்தச் சங்கிலி !,4
அந்த_நாய்க்குட்டி_எங்கே,"அதோடு, நீ அவரைக் கத்தியால் குத்த யத்தனித்த குற்றம் வேறே !",8
அந்த_நாய்க்குட்டி_எங்கே,"ம்... புறப்படு தம்பி, அறந்தாங்கி போலீஸ் ஸ்டேஷனுக்கு.. ! ⁠சட்டம் சிரித்தது சிரித்துக் கொண்டேயிருந்தது !",10
அந்த_நாய்க்குட்டி_எங்கே,ஒன்பது ⁠அறந்தாங்கி போலீஸ் ஸ்டேஷனில் என்றுமில்லாத கூட்டம்.,6
அந்த_நாய்க்குட்டி_எங்கே,அடுத்த கட்டடத்திலுள்ள மாஜிஸ்திரேட் கோர்ட்டிலும் ஜனங்கள் கூடி நின்றனர்.,7
அந்த_நாய்க்குட்டி_எங்கே,"⁠பெரியவர் ஒருவர் சொன்னார் பாவம், பூபாலன் நல்ல பையனாச்சே !",7
அந்த_நாய்க்குட்டி_எங்கே,பிறந்த மண்ணிலேயே பூவை மாநகரிலேயே முருகேசன் தங்க நினைச்சிருந்தான்.,7
அந்த_நாய்க்குட்டி_எங்கே,"போதாத காலம், அப்பன் மனசை ஒடியச் செய்ய, மகனுக்கு அறியாத பிள்ளைக்கு இப்படி ஜெயிலும் விலங்கும் வந்து விடிஞ்சிருக்குது.",14
அந்த_நாய்க்குட்டி_எங்கே,படம் பிடிக்க பட்டணத்துக்காரங்க வந்த அதிசயத்தையே நம்ப நாடு நகரம் கதை கதையாய் பேசுது !,11
அந்த_நாய்க்குட்டி_எங்கே,அதுக்குள்ளே சட்டத்தின் அதிசயமான இந்தக் கதையையும் பேச ஆரம்பிச்சிட்டாங்க.,7
அந்த_நாய்க்குட்டி_எங்கே,அந்த சர்க்கஸ்காரனோட வைரச் சங்கிலியை இந்தச் சின்னப் பிள்ளை திருடிடுச்சாம்.,8
அந்த_நாய்க்குட்டி_எங்கே,அதுக்காக அவனுக்குத் திருட்டுப் பட்டம் கட்டின கையோடு விலங்கையும் கைக்கு மாட்டிப்பிட்டானே பாவி.. !,10
அந்த_நாய்க்குட்டி_எங்கே,பட்டணத்துப் போக்கிரின்னா சரியாய்த்தான் இருக்கிறான்... !,4
அந்த_நாய்க்குட்டி_எங்கே,அரசாங்கத்தின் நியாயம் எப்படி இருக்கப்போகுதோ..?,4
அந்த_நாய்க்குட்டி_எங்கே,படைச்சவனின் நீதி எப்படித் தீர்ப்புச் சொல்லப் போகுதோ..?,6
அந்த_நாய்க்குட்டி_எங்கே,வரவர உலகம் உருப்படாமல் போகுது.,4
அந்த_நாய்க்குட்டி_எங்கே,"இல்லையானா, இந்தப் புயல் அடிச்சு ஊர் உலகத்தை இப்படி திமிலோகப் படுத்தியிருக்குமா? ⁠காலை மணி பதினொன்று.",12
அந்த_நாய்க்குட்டி_எங்கே,⁠அரசாங்கச் சேவகன் கூப்பாடு போட்டான்.,4
அந்த_நாய்க்குட்டி_எங்கே,⁠கூடியிருந்தவர்களின் கவனம் ஒன்று கூடியது.,4
அந்த_நாய்க்குட்டி_எங்கே,⁠சிறுவன் பூபாலன் கைதிக் கூண்டில் விலங்கும் கையுமாக கண்ணீரும் கம்பலையுமாக நின்றான்.,9
அந்த_நாய்க்குட்டி_எங்கே,அருகே போலீஸ் ஜவான்கள் இரண்டு பேர் பாதுகாப்பிற்காக நின்றார்கள்.,7
அந்த_நாய்க்குட்டி_எங்கே,"ஒரு ஓரத்தில் பூங்கோதையின் தந்தை டைரக்டர் பரசுராம், பூங்கோதை, சர்க்கஸ்காரர் சுகுமாரன், பூபாலனின் அப்பா முருகேசன் ஆகியோர் நின்றார்கள்.",14
அந்த_நாய்க்குட்டி_எங்கே,⁠நாற்காலியில் போலீஸ் சப் இன்ஸ்பெக்டர் அமர்ந்திருந்தார்.,5
அந்த_நாய்க்குட்டி_எங்கே,அவர் முகத்தில் சிந்தனைக் கோடுகள் கிழிக்கப்பட்டிருந்தன.,5
அந்த_நாய்க்குட்டி_எங்கே,அவருடைய கையில் அந்த வைரச் சங்கிலியும் கத்தியும் மின்னிக்கொண்டிருந்தன.,7
அந்த_நாய்க்குட்டி_எங்கே,⁠பட்டணத்துக்கு இந்த வழக்கை மாற்ற முயன்ற டைரக்டர் தோற்றார்.,7
அந்த_நாய்க்குட்டி_எங்கே,பட்டணத்துக்கு இந்த விசாரணையை மாற்றத் தேவையில்லை என்று வாதாடிய சர்க்கஸ்காரர் வெற்றி பெற்றார்.,10
அந்த_நாய்க்குட்டி_எங்கே,இரு தரப்பு வக்கீல்களும் வாதப்பிரதிவாதங்களை முடித்துக் கொண்டார்கள்.,6
அந்த_நாய்க்குட்டி_எங்கே,⁠மாஜிஸ்திரேட்டின் கவனம் தன் மேஜை மீதிருந்த தாளில் ஓடியிருந்த எழுத்துக்களில் ஈடுபட்டிருந்தது.,9
அந்த_நாய்க்குட்டி_எங்கே,பூபாலனின் வாக்குமூலம் அது ⁠... என் பெயர் பூபாலன்.,7
அந்த_நாய்க்குட்டி_எங்கே,என் பிறந்த ஊர் அறந்தாங்கியிலிருக்கும் பூவைமாநகரம் என்பது.,6
அந்த_நாய்க்குட்டி_எங்கே,என் அப்பா பிழைப்பு காரணமாக சென்னைப் பட்டணத்துக்குப் போனார்.,7
அந்த_நாய்க்குட்டி_எங்கே,அப்பாவுக்கு இந்த சர்க்கஸ்கார முதலாளி சுகுமாரன்தான் சிபாரிசு பண்ணி வேலையில் அமர்த்தினார்.,9
அந்த_நாய்க்குட்டி_எங்கே,"நான் சினிமாப்படத்தில் நடிக்க ஆசைப்பட்டதை இவர் எப்படியோ அறிந்து, தன்னுடைய சர்க்கஸ் கம்பெனியில் என்னைச் சேர்த்துவிடத் துடியாய்த் துடித்தார்.",14
அந்த_நாய்க்குட்டி_எங்கே,எனக்கு இது கட்டோடு பிடிக்கவில்லை ஒரு நாள் என்னைத் தந்திரமாக தன்னுடைய இருப்பிடத்துக்குக் கூட்டிச் சென்றார்.,12
அந்த_நாய்க்குட்டி_எங்கே,கடைசியில் என்னுடைய அந்த நாய்க்குட்டியும் கிடைத்தது.,5
அந்த_நாய்க்குட்டி_எங்கே,"ஆகவே, அவருடைய மகள் அல்லி என்ற சிறு பெண்ணின் அன்பு நிறைந்த நிர்ப்பந்தத்தின் பேரில் நான் அங்கு தங்கினேன்.",14
அந்த_நாய்க்குட்டி_எங்கே,எனக்கு என்னவோ சர்க்கஸ் விளையாட்டு வெறுப்பாகயிருந்தது.,5
அந்த_நாய்க்குட்டி_எங்கே,ஆனால் நான் சர்க்கஸில் விளையாட ஆரம்பித்ததிலிருந்துதான் அவருக்கு நிறைய வசூலானது.,8
அந்த_நாய்க்குட்டி_எங்கே,ஒரு நாள் இந்தச் சர்க்கஸ்காரனை ஏமாற்றிவிட்டு ஓடி விட முன் கூட்டியே நான் திட்டங்கள் போட்டிருந்தேன்.,12
அந்த_நாய்க்குட்டி_எங்கே,நான் தப்பித்துக் கொண்டேன்.,3
அந்த_நாய்க்குட்டி_எங்கே,நான் மட்டுமே காரில் தொப்பென்று விழுந்தேன்.,5
அந்த_நாய்க்குட்டி_எங்கே,என் நாய்க்குட்டி கை தவறி விட்டதை அப்புறம்தான் அறிந்துகொண்டேன்.,7
அந்த_நாய்க்குட்டி_எங்கே,என் நாய்க்குட்டி இறந்து விட்டதாக அடுத்த நாள் பேப்பரில் படித்தேன்.,8
அந்த_நாய்க்குட்டி_எங்கே,அதிலிருந்து எனக்கு மூளை குழம்பி விட்டது.,5
அந்த_நாய்க்குட்டி_எங்கே,கடைசியில் என் மனத்தின் அமைதிக்காகப் பட்டணத்தை விட்டு பூவைமாநகருக்கு வந்தேன்.,8
அந்த_நாய்க்குட்டி_எங்கே,என் பெற்றோர் பேரில் நான் கொண்டிருந்த ஆத்திரத்தையும் அவர்கள் மாற்றி விட்டார்கள்.,9
அந்த_நாய்க்குட்டி_எங்கே,சென்ற வாரம் சூட்டிங்கில் தேர்த் திருவிழாவில் – நானும் பூங்கோதையும் நடித்தோம்.,9
அந்த_நாய்க்குட்டி_எங்கே,குறி தவறிய கத்தி சிறிது தூரம் தள்ளி விழுந்தது.,7
அந்த_நாய்க்குட்டி_எங்கே,இந்தச் சர்க்கஸ்காரர் என் முன் நின்றார்.,5
அந்த_நாய்க்குட்டி_எங்கே,அடுத்த நிமிஷம் போலீஸ்காரர்கள் என்னைக் கைது செய்தார்கள்.,6
அந்த_நாய்க்குட்டி_எங்கே,இந்த வைரச் சங்கிலியைப் பற்றிய விவரம் எதுவுமே எனக்குத் தெரியாது.,8
அந்த_நாய்க்குட்டி_எங்கே,ககுமார் சொல்வது பொய்.,3
அந்த_நாய்க்குட்டி_எங்கே,அவருடைய வைரச் சங்கிலியை நான் வேலை பார்த்தபோதே திருடி வந்து விட்டதாகப் பழி சுமத்துவது அபாண்டப் பொய்.,13
அந்த_நாய்க்குட்டி_எங்கே,கடவுள் சாட்சியாக நான் சொன்னது பூராவும் உண்மை... ! மாஜிஸ்திரேட் சைகை காட்டினார்.,9
அந்த_நாய்க்குட்டி_எங்கே,கத்தியும் வைரச் சங்கிலியும் இப்பொழுது அவரது மேஜையில் கிடந்தன.,7
அந்த_நாய்க்குட்டி_எங்கே,மாஜிஸ்திரேட் அவை இரண்டையும் புரட்டிப் பார்த்தார் சுகுமார் என்ற அழகான எழுத்துக்கள் அவை இரண்டிலும் மின்னின.,12
அந்த_நாய்க்குட்டி_எங்கே,அடுத்த மூன்றாம் நாள் தீர்ப்புச் சொல்லப்படுமென்று அறிவிக்கப்பட்டது.,6
அந்த_நாய்க்குட்டி_எங்கே,கூடியிருந்த அனைவரின் பார்வையும் ஒரு முகமாக மாஜிஸ்திரேட்டையே நோக்கியிருந்தது.,7
அந்த_நாய்க்குட்டி_எங்கே,அப்பகுதிக்கு அவர்தானே நீதியின் காவலர் !,4
அந்த_நாய்க்குட்டி_எங்கே,பூபாலன் பழைய கைதிக் கோலத்துடன் கிளிக் கூண்டில் நின்றான்.,7
அந்த_நாய்க்குட்டி_எங்கே,"டைரக்டர், பூங்கோதை, பூபாலனின் தகப்பன் முருகேசன் முதலியோர் தெய்வத்தின்மீது பாரத்தைப் போட்ட வண்ணம் நின்றார்கள்.",11
அந்த_நாய்க்குட்டி_எங்கே,இந்தத் துயரக் காட்சிகளைக் கண்டு அந்தக் கூட்டத்தில் ஒரே ஒரு மனிதரால் தான் சிரிக்க முடிந்தது.,12
அந்த_நாய்க்குட்டி_எங்கே,அவர்தான் சர்க்கஸ் கம்பெனிச் சொந்தக்காரரான சுகுமார் !,5
அந்த_நாய்க்குட்டி_எங்கே,⁠நீதி பேசியது சிறுவன் பூபாலனை விடுதலை செய்கிறேன்.,6
அந்த_நாய்க்குட்டி_எங்கே,தன் மீது குறி வைத்து வீசப்பட்ட சுகுமாரனின் கத்தியைக் கொண்டுதான் எதிரியைத் தாக்கியிருக்கிறான் சிறுவன்.,11
அந்த_நாய்க்குட்டி_எங்கே,எதிரியின் பெயர் கத்தியிலிருப்பதே இதற்குச் சாட்சியம்.,5
அந்த_நாய்க்குட்டி_எங்கே,"அடுத்ததாக, இந்தப் பையன் களவாடி விட்டதாகச் சொல்லப்படும் இந்த வைரச் சங்கிலி சர்க்கஸ் சுகுமாரனுடையதென்று இவரே சொல்கிறார்.",13
அந்த_நாய்க்குட்டி_எங்கே,அதற்கு அத்தாட்சியாக இவர் பெயரே இதிலும் பொறிக்கப் பட்டிருக்கிறது.,7
அந்த_நாய்க்குட்டி_எங்கே,"ஆனால் பாவம், இந்த வைரச் சங்கிலி போலி நகை... !",7
அந்த_நாய்க்குட்டி_எங்கே,இதில் வைரமும் இல்லை தங்கமும் இல்லை.,5
அந்த_நாய்க்குட்டி_எங்கே,யானை தன் தலையில் மண்ணைக் கொட்டிக் கொண்டு விட்டது.,7
அந்த_நாய்க்குட்டி_எங்கே,பொய்யாக கேஸ் கொடுத்த இந்தச் சுகுமார் மீது மானநஷ்ட வழக்குத் தொடரப்பட வேண்டும்.,10
அந்த_நாய்க்குட்டி_எங்கே,"பாவம், இவரையும் மன்னிக்கிறேன்.",3
அந்த_நாய்க்குட்டி_எங்கே,⁠அவசரத் தந்தியொன்று வந்தது.,3
அந்த_நாய்க்குட்டி_எங்கே,⁠மாஜிஸ்திரேட் உத்தரவு போட்டார் எஸ்.ஐ !,5
அந்த_நாய்க்குட்டி_எங்கே,"அதற்குரிய காரணங்கள் அவ்வூர் ஆரம்பப்பள்ளி, உயர் தர ஆரம்பப் பள்ளியாக அன்று தான் உயர்த்தப்பட்டது.",11
அந்த_நாய்க்குட்டி_எங்கே,அந்தக் கிராமத்தில் அன்றைக்குத்தான் புதியதாக தபாலாபீஸ் திறக்கப்பட்டது.,6
அந்த_நாய்க்குட்டி_எங்கே,"பிறகு, சந்தோஷத்துக்குக் கேட்க வேண்டுமா, என்ன?",5
அந்த_நாய்க்குட்டி_எங்கே,⁠புது உலகிலே சஞ்சரிப்பதாக அப்பொழுது பூபாலனுக்குத் தோன்றியது.,6
அந்த_நாய்க்குட்டி_எங்கே,⁠ போன வாரம் இதே நேரத்துக்கு அறந்தாங்கி ஜெயிலிலே அடைப்பட்டுக் கிடந்தேன்.,9
அந்த_நாய்க்குட்டி_எங்கே,ஆண்டவன் புண்ணியத்திலே தலைக்கு வந்தது தலைப்பாகையோடே போயிடுச்சு.,6
அந்த_நாய்க்குட்டி_எங்கே,அந்தச் சர்க்கஸ்காரன் பலே ஆள்தான்.,4
அந்த_நாய்க்குட்டி_எங்கே,"நெஞ்சில்லாத இரக்கமில்லாத அந்தப் பாவிக்கு நெஞ்சுள்ள, இரக்கமுள்ள அல்லி மகளாகப் பிறந்திருக்குது.",9
அந்த_நாய்க்குட்டி_எங்கே,நத்தை வயிற்றிலே முத்து பிறக்கிற கதைதான்.. !,5
அந்த_நாய்க்குட்டி_எங்கே,"ஆனா, தங்கச்சி பூங்கோதை, பூங்கோதையேதான் !",4
அந்த_நாய்க்குட்டி_எங்கே,"அது உடம்பெல்லாம், அன்பு செய்கையெல்லாம் அன்புதான் !",5
அந்த_நாய்க்குட்டி_எங்கே,அது மாதிரியேதான் அதோட அப்பாவும்... !,4
அந்த_நாய்க்குட்டி_எங்கே,நான் ஏழை வீட்டுப் பையன் அதுவோ பணக்கராங்க வீட்டுப் பொண்ணு !,8
அந்த_நாய்க்குட்டி_எங்கே,மலையும் மடுவும் சடுகுடு விளையாடற கதைதான் ஆண்டவன் பலே கில்லாடிதான் !,8
அந்த_நாய்க்குட்டி_எங்கே,"புதுச் சட்டை, நிஜார் மாற்றினான்.",4
அந்த_நாய்க்குட்டி_எங்கே,⁠சிறுவன் பூபாலன் கீழத் தெருவிலிருந்து ஓடி வந்தான்.,6
அந்த_நாய்க்குட்டி_எங்கே,"⁠ தம்பி, உன்னை விடுதலை பண்ணிட்டாங்களாமே?",5
