work_title,sentence,sentence_length
அன்னை_கஸ்தூரிபாயின்_நம்மை_மேம்படுத்தும்_எண்ணங்கள்,பாராட்டு விழா முடிந்தது !,3
அன்னை_கஸ்தூரிபாயின்_நம்மை_மேம்படுத்தும்_எண்ணங்கள்,வீட்டுக்கு வந்தார் காந்தியடிகள் !,3
அன்னை_கஸ்தூரிபாயின்_நம்மை_மேம்படுத்தும்_எண்ணங்கள்,அன்று இரவு முழுவதும் அவருக்கு நித்திரை வரவில்லை.,6
அன்னை_கஸ்தூரிபாயின்_நம்மை_மேம்படுத்தும்_எண்ணங்கள்,"காரணம், மக்களுக்குத் தொண்டு செய்வது பிறப்பெடுத்ததன் கடமை !",6
அன்னை_கஸ்தூரிபாயின்_நம்மை_மேம்படுத்தும்_எண்ணங்கள்,அந்தத் தொண்டுக்கு அன்பளிப்பாக இந்தப் பரிசுப் பொருட்களை மக்கள் வழங்கினார்களா அல்லது தொண்டு செய்ததற்கு இவை கூலியா?,13
அன்னை_கஸ்தூரிபாயின்_நம்மை_மேம்படுத்தும்_எண்ணங்கள்,என்று சிந்தனை செய்தவாறே இருந்ததால் அவருக்கு அன்றிரவு தூக்கம் வரவில்லை.,8
அன்னை_கஸ்தூரிபாயின்_நம்மை_மேம்படுத்தும்_எண்ணங்கள்,தொண்டர்கள் மக்களிடம் செய்த தொண்டுகளுக்காகப் பரிசு வாங்கலாமா?,6
அன்னை_கஸ்தூரிபாயின்_நம்மை_மேம்படுத்தும்_எண்ணங்கள்,அவ்வாறு வாங்கினால் தொண்டு என்பதே பொருளற்றுப் போகாதா?,6
அன்னை_கஸ்தூரிபாயின்_நம்மை_மேம்படுத்தும்_எண்ணங்கள்,தங்களுக்குக் கிடைத்த பரிசுகளைத் தொண்டர்கள் தனது சொந்தத்துக்கு உரிமையாக்கிக் கொள்ளலாமா?,8
அன்னை_கஸ்தூரிபாயின்_நம்மை_மேம்படுத்தும்_எண்ணங்கள்,என்ற நோக்கம் காந்தியடிகளது மனத்தைக் குத்திக் குடைந்து கொண்டிருந்தன.,7
அன்னை_கஸ்தூரிபாயின்_நம்மை_மேம்படுத்தும்_எண்ணங்கள்,தொண்டர்கள் அன்போடு கொடுத்த பரிசுகளை அவர்களிடமே திருப்பித் தருவதும் தவறு.,8
அன்னை_கஸ்தூரிபாயின்_நம்மை_மேம்படுத்தும்_எண்ணங்கள்,தந்தவர்கள் மனது புண்படுமே !,3
அன்னை_கஸ்தூரிபாயின்_நம்மை_மேம்படுத்தும்_எண்ணங்கள்,"எனவே, கொடுக்கப்பட்ட பரிசுகளைத் தான் அனுபவிக்காமல் அவற்றைப் பொது நன்மைகளுக்குப் பயன்படுத்துவது தான் நியாயம் என்றும் தீர்மானித்தார்.",13
அன்னை_கஸ்தூரிபாயின்_நம்மை_மேம்படுத்தும்_எண்ணங்கள்,இதைப் பற்றி தனது மனைவியிடமும் கலந்து பேசினார்.,6
அன்னை_கஸ்தூரிபாயின்_நம்மை_மேம்படுத்தும்_எண்ணங்கள்,"ஏனென்றால், கஸ்தூரிபாய்க்கும் சில பரிசுப் பொருட்கள் வந்துள்ளனவே !",6
அன்னை_கஸ்தூரிபாயின்_நம்மை_மேம்படுத்தும்_எண்ணங்கள்,"அதனால் மனைவி கருத்தையும் தெரிந்து கொள்ளலாம் என்று தனது தீர்மானத்தின் முடிவை மனைவியிடமும், பிள்ளைகளிடமும் காந்தியடிகள் விவரித்தார்.",13
அன்னை_கஸ்தூரிபாயின்_நம்மை_மேம்படுத்தும்_எண்ணங்கள்,அவரது பிள்ளைகள் இருவரும் அப்பாவின் கருத்தை ஒப்புக் கொண்டார்கள்.,7
அன்னை_கஸ்தூரிபாயின்_நம்மை_மேம்படுத்தும்_எண்ணங்கள்,"ஆனால், கஸ்தூரிபாய் மட்டும் ஒப்புக் கொள்ளவில்லை.",5
அன்னை_கஸ்தூரிபாயின்_நம்மை_மேம்படுத்தும்_எண்ணங்கள்,"உங்களுக்கும், பிள்ளைகளுக்கும் நகைகள் தேவையில்லை.",4
அன்னை_கஸ்தூரிபாயின்_நம்மை_மேம்படுத்தும்_எண்ணங்கள்,நீங்கள் சொல்கிறவாறு பிள்ளைகள் சரி என்று கூறலாம்.,6
அன்னை_கஸ்தூரிபாயின்_நம்மை_மேம்படுத்தும்_எண்ணங்கள்,"ஆனால், நான் பரிசாக வந்த நகைகளைக் கூடவா அணிந்து கொள்ளக் கூடாது?",9
அன்னை_கஸ்தூரிபாயின்_நம்மை_மேம்படுத்தும்_எண்ணங்கள்,என்ற கேள்வியை எழுப்பினார்.,3
அன்னை_கஸ்தூரிபாயின்_நம்மை_மேம்படுத்தும்_எண்ணங்கள்,"காந்தியடிகள் இதற்கு மெளனமாக இருக்கும்போது, மீண்டும் கஸ்தூரிபாய், சரி நான் நகைகளைப் போட்டுக் கொள்ளவில்லை.",11
அன்னை_கஸ்தூரிபாயின்_நம்மை_மேம்படுத்தும்_எண்ணங்கள்,"என் பிள்ளைகளுக்குத் திருமணமாகி, மருமகள்கள் வந்தால் என்ன செய்கிறது?",7
அன்னை_கஸ்தூரிபாயின்_நம்மை_மேம்படுத்தும்_எண்ணங்கள்,அவர்களுக்கு வேண்டாமா நகைகள்?,3
அன்னை_கஸ்தூரிபாயின்_நம்மை_மேம்படுத்தும்_எண்ணங்கள்,மக்கள் கொடுத்த பொருட்களை நான் திருப்பித் தர மாட்டேன் என்று அவர் திட்டவட்டமாகக் கூறிவிட்டார் கணவரிடம் !,12
அன்னை_கஸ்தூரிபாயின்_நம்மை_மேம்படுத்தும்_எண்ணங்கள்,அதே நேரத்தில் நகைப் பைத்தியமுள்ள மருமகள்களை நாம் நமது வீட்டிற்குக் கொண்டு வர மாட்டோம்.,11
அன்னை_கஸ்தூரிபாயின்_நம்மை_மேம்படுத்தும்_எண்ணங்கள்,அப்படிப்பட்ட பெண்களை நமது பிள்ளைகளுக்கு மணம் செய்தும் வைக்கமாட்டோம்.,7
அன்னை_கஸ்தூரிபாயின்_நம்மை_மேம்படுத்தும்_எண்ணங்கள்,அவர்களுக்கு நகைகள் அணிய வேண்டிய ஆசைகள் இருந்தால் அதை நான் கவனித்துக் கொள்கிறேன்.,10
அன்னை_கஸ்தூரிபாயின்_நம்மை_மேம்படுத்தும்_எண்ணங்கள்,அப்போது நீ என்னைக் கேள் என்றார்.,5
அன்னை_கஸ்தூரிபாயின்_நம்மை_மேம்படுத்தும்_எண்ணங்கள்,"அது சரி, உங்களைப் பற்றி எனக்குத் தெரியாதா என்ன?",7
அன்னை_கஸ்தூரிபாயின்_நம்மை_மேம்படுத்தும்_எண்ணங்கள்,நான் போட்டிருந்த நகைகளை எல்லாம் வாங்கிக் கொண்டு என்னை நிர்க்கதியாக நிறுத்தி விட்டீர்களே !,10
அன்னை_கஸ்தூரிபாயின்_நம்மை_மேம்படுத்தும்_எண்ணங்கள்,இப்படிப்பட்ட நீங்களா எனது மருமகள்களுக்கு நகை போடுவீர்கள்?,6
அன்னை_கஸ்தூரிபாயின்_நம்மை_மேம்படுத்தும்_எண்ணங்கள்,எனது பிள்ளைகளை இப்போதே சாமியார்களாக்கி விட்டீர்கள்.,5
அன்னை_கஸ்தூரிபாயின்_நம்மை_மேம்படுத்தும்_எண்ணங்கள்,நீங்களா மருமகள்கள் வந்த பிறகு நகைபோடப் போகிறீர்கள்?,6
அன்னை_கஸ்தூரிபாயின்_நம்மை_மேம்படுத்தும்_எண்ணங்கள்,எனக்குப் பரிசாக மக்கள் தந்த நகைகளை நான் திருப்பித் தர மாட்டேன் என்று கூறினார் கஸ்தூரிபாய்.,12
அன்னை_கஸ்தூரிபாயின்_நம்மை_மேம்படுத்தும்_எண்ணங்கள்,"அது சரி, இந்த நகைகளை மக்கள் ஏன் தந்தார்கள்?",7
அன்னை_கஸ்தூரிபாயின்_நம்மை_மேம்படுத்தும்_எண்ணங்கள்,அல்லது எனது சேவைக்கா?,3
அன்னை_கஸ்தூரிபாயின்_நம்மை_மேம்படுத்தும்_எண்ணங்கள்,அதைச் சொல் என்றார் காந்தியடிகள்.,4
அன்னை_கஸ்தூரிபாயின்_நம்மை_மேம்படுத்தும்_எண்ணங்கள்,உங்களுடைய தொண்டுக்காகத்தான் மக்கள் கொடுத்தார்கள் என்று இருக்கட்டுமே.,6
அன்னை_கஸ்தூரிபாயின்_நம்மை_மேம்படுத்தும்_எண்ணங்கள்,நீங்கள் செய்தால் என்ன?,3
அன்னை_கஸ்தூரிபாயின்_நம்மை_மேம்படுத்தும்_எண்ணங்கள்,நான் செய்தால் என்ன?,3
அன்னை_கஸ்தூரிபாயின்_நம்மை_மேம்படுத்தும்_எண்ணங்கள்,நீங்கள் செய்த தொண்டுக்கு நான் உடனிருந்து பாடுபடவில்லையா?,6
அன்னை_கஸ்தூரிபாயின்_நம்மை_மேம்படுத்தும்_எண்ணங்கள்,இரவும் பகலும் கண் விழித்துப் பணி செய்தது எல்லாம் தொண்டாகப்பட வில்லையா?,9
அன்னை_கஸ்தூரிபாயின்_நம்மை_மேம்படுத்தும்_எண்ணங்கள்,"என்னிடம் எவ்வளவு அருவருப்பான, கேவலமான, அற்பமான வேலைகளை எல்லாம் செய்யச் சொல்லி வேலை வாங்கினீர்கள்?",11
அன்னை_கஸ்தூரிபாயின்_நம்மை_மேம்படுத்தும்_எண்ணங்கள்,"ரத்தக் கண்ணிர் வடிக்கும் அளவிற்கு என்னை அலைக்கழித்து, அதட்டி, உருட்டி, நோய் வாய்ப்படும் அளவிற்கு வேலை செய்யச் சொன்னீர்கள்?",14
அன்னை_கஸ்தூரிபாயின்_நம்மை_மேம்படுத்தும்_எண்ணங்கள்,நானும் மக்களுக்காக உழைக்கவில்லையா?,3
அன்னை_கஸ்தூரிபாயின்_நம்மை_மேம்படுத்தும்_எண்ணங்கள்,என்று கஸ்தூரிபாய் நறுக் நறுக்கென்று சில கேள்விகளைக் கேட்டுக் கண்ணிர் விட்டார்.,9
அன்னை_கஸ்தூரிபாயின்_நம்மை_மேம்படுத்தும்_எண்ணங்கள்,கஸ்தூரிபாய் பேசியதை எல்லாம் காந்தியடிகள் ஏற்கவில்லை.,5
அன்னை_கஸ்தூரிபாயின்_நம்மை_மேம்படுத்தும்_எண்ணங்கள்,கஸ்தூரிபாயின் தேசத் தொண்டு !,3
அன்னை_கஸ்தூரிபாயின்_நம்மை_மேம்படுத்தும்_எண்ணங்கள்,"ஆசிரமத்தில் முதல் உறுப்பினராகத் தனது மனைவியையும், அத்துடன் இருபத்தைந்து உறுப்பினர்களையும் அவர் சேர்த்தார்.",10
அன்னை_கஸ்தூரிபாயின்_நம்மை_மேம்படுத்தும்_எண்ணங்கள்,எளிய முறையில் வாழ்ந்து தேச சேவை செய்வதுதான் ஆசிரமத்தின் நோக்கமாக இருந்தது.,9
அன்னை_கஸ்தூரிபாயின்_நம்மை_மேம்படுத்தும்_எண்ணங்கள்,எல்லோருக்கும் பொதுவான சமையல் அறை சேர்ந்து வேலை செய்து சமைத்து உண்பது.,9
அன்னை_கஸ்தூரிபாயின்_நம்மை_மேம்படுத்தும்_எண்ணங்கள்,"இந்த ஆசிரமத்தின் தலைவியாகவும், அன்னையாகவும் கஸ்தூரிபாய் விளங்கினார்.",6
அன்னை_கஸ்தூரிபாயின்_நம்மை_மேம்படுத்தும்_எண்ணங்கள்,"கணவர் காந்தி பொது வாழ்க்கையில் தோல்வியுறும் போது எளிமையுடனும், அஞ்சா நெஞ்சத்துடனும், கம்பீரத்துடனும் ஆடியோடி கஸ்தூரிபாய் பணியாற்றினார்.",13
அன்னை_கஸ்தூரிபாயின்_நம்மை_மேம்படுத்தும்_எண்ணங்கள்,"தென்னாப்ரிக்க ஃபினிக்ஸ் செட்டில்மெண்ட் ஆசிரமத்தில் வாழ்ந்ததற்கு மாறாக, சபர்மதி ஆஸ்ரமத்தில் ஒரு திண்டு மீது சாய்ந்து காந்தி உட்கார்ந்திருந்தார்.",14
அன்னை_கஸ்தூரிபாயின்_நம்மை_மேம்படுத்தும்_எண்ணங்கள்,"காந்தியடிகள் அப்போது உடல் நலம் குன்றி, கொட்டைகளையும், பழவகைகளையும் ஆகாரமாகக் கொண்டு மெலிந்து நலிந்து காணப்பட்டார்.",12
அன்னை_கஸ்தூரிபாயின்_நம்மை_மேம்படுத்தும்_எண்ணங்கள்,"சபர்மதியில் ஆசிரமம் அமைக்கப்பட்ட நேரத்தில், ஹரிஜனக் குடும்பம் ஒன்று அங்கு வந்து சேர்ந்தது.",10
அன்னை_கஸ்தூரிபாயின்_நம்மை_மேம்படுத்தும்_எண்ணங்கள்,"அந்தக் குடும்பத்தையும், அவர்களைச் சேர்ந்தவர்களையும் காந்தியடிகள் அப்போது ஆசிரமத்தில் சேர்த்துக் கொண்டார்.",9
அன்னை_கஸ்தூரிபாயின்_நம்மை_மேம்படுத்தும்_எண்ணங்கள்,அதற்குப் பெரும் எதிர்ப்பு எழுந்தது.,4
அன்னை_கஸ்தூரிபாயின்_நம்மை_மேம்படுத்தும்_எண்ணங்கள்,"ஆசிரமத்திற்கு யார் யார் பண உதவிகளைச் செய்தார்களோ அவர்கள், தங்களது உதவிகளை நிறுத்திக் கொண்டார்கள்.",11
அன்னை_கஸ்தூரிபாயின்_நம்மை_மேம்படுத்தும்_எண்ணங்கள்,"ஆனால், காந்தியடிகள் அதையெல்லாம் ஒருவாறு சமாளித்துக் கொண்டார்.",6
அன்னை_கஸ்தூரிபாயின்_நம்மை_மேம்படுத்தும்_எண்ணங்கள்,ஆசிரமத்துக்குள் எழுந்த கலவரங்களை ஆனால் அடக்குவது கஷ்டமாகவே இருந்தது.,7
அன்னை_கஸ்தூரிபாயின்_நம்மை_மேம்படுத்தும்_எண்ணங்கள்,அன்னை கஸ்தூரிபாய் தாழ்த்தப்பட்ட ஹரி ஜனங்களை ஆசிரமத்தில் சேர்த்துக் கொள்ள மறுத்து விட்டார்.,10
அன்னை_கஸ்தூரிபாயின்_நம்மை_மேம்படுத்தும்_எண்ணங்கள்,மற்றும் சில ஆசிரமப் பெண்களுக்கும் இது திருப்தியளிக்கவில்லை.,6
அன்னை_கஸ்தூரிபாயின்_நம்மை_மேம்படுத்தும்_எண்ணங்கள்,"அதனால் மக்களிலே பலர் ஆசிரமத்தைப் புறக்கணித்ததால், ஆசிரம வாழ்க்கை மிகவும் பாதித்து விட்டது.",10
அன்னை_கஸ்தூரிபாயின்_நம்மை_மேம்படுத்தும்_எண்ணங்கள்,அதே நேரத்தில் ஆசிரமத் தலைவியான கஸ்தூரிபாயும் ஹரிஜன எதிர்ப்பு எழுப்புவதைப் பார்த்து காந்தியடிகள் மிகவும் கவலையடைந்தார்.,12
அன்னை_கஸ்தூரிபாயின்_நம்மை_மேம்படுத்தும்_எண்ணங்கள்,அதனால் அவர் ஆசிரமத்துக்கு உள்ளேயே ஏழு நாட்கள் உண்ணாவிரதம் இருந்தார் என்பது கஸ்தூரிபாய்க்கு மட்டும்தான் தெரியும்.,12
அன்னை_கஸ்தூரிபாயின்_நம்மை_மேம்படுத்தும்_எண்ணங்கள்,"ஏழு நாட்கள் அவர் உண்ணாவிரதம் இருந்தபோதுதான், கஸ்தூரிபாய்க்கு அந்த ஆசிரமத்தின் அடிப்படைத் தத்துவம் சரியாகப் புரிந்தது.",12
அன்னை_கஸ்தூரிபாயின்_நம்மை_மேம்படுத்தும்_எண்ணங்கள்,அந்த உயிர்களுக்கு ஆசிரம விதிப்படி எல்லா உரிமைகளும் வழங்கப்படவேண்டும் என்பதும் அப்போதுதான் கஸ்தூரி பாய்க்குப் புரிந்தது.,12
அன்னை_கஸ்தூரிபாயின்_நம்மை_மேம்படுத்தும்_எண்ணங்கள்,அந்தக் கிராம மக்களுடைய உரிமைகளுக்காக ஆங்கிலேயர்களை எதிர்த்து நடந்த அந்தப் போராட்ட்த்திற்கு பெண்களும் தேர்வு செய்யப்பட்டார்கள்.,12
அன்னை_கஸ்தூரிபாயின்_நம்மை_மேம்படுத்தும்_எண்ணங்கள்,அந்த மாதர்களுக்கு வழிகாட்டியாகக் கஸ்தூரி பாயைக் காந்தியடிகள் நியமித்தார்.,7
அன்னை_கஸ்தூரிபாயின்_நம்மை_மேம்படுத்தும்_எண்ணங்கள்,"அப்போது, சம்ப்ரான் பகுதியில் ஆறு பள்ளிக்கூடங்கள் உருவாக்கப்பட்டன.",6
அன்னை_கஸ்தூரிபாயின்_நம்மை_மேம்படுத்தும்_எண்ணங்கள்,அந்தப் பள்ளிகளில் ஒன்றில் கஸ்தூரி பாய் ஆசிரியையாகப் பணி புரிந்தார்.,8
அன்னை_கஸ்தூரிபாயின்_நம்மை_மேம்படுத்தும்_எண்ணங்கள்,கல்வி கற்பிப்பது மட்டுமல்ல அந்தப் பள்ளியின் பணி.,6
அன்னை_கஸ்தூரிபாயின்_நம்மை_மேம்படுத்தும்_எண்ணங்கள்,"கிராமத்து மக்களுக்குரிய அகத்தூய்மையையும், புறத்தூய்மையையும் சொல்லிக் கொடுப்பதும் அப்பள்ளிகளின் வேலை.",8
