work_title,sentence,sentence_length
அந்த_நாய்க்குட்டி_எங்கே,அவனுடைய கண்கள் ஏன் இப்படிக் கலங்குகின்றன?... அவன் ஏன் அப்படிப் பெருமூச்சு விடவேண்டும்?....,10
அந்த_நாய்க்குட்டி_எங்கே,"கண்களைத் துடைத்தபடி, மனத்திற்குள் ஒன்று... இரண்டு... என்று சொல்லி நாட்களைக் கணக்கிட்டான்.",9
அந்த_நாய்க்குட்டி_எங்கே,சடக்கென்று பத்திரிகைத்தாளைக் குறுக்கு வசமாக மடித்தான்.,5
அந்த_நாய்க்குட்டி_எங்கே,விளம்பரத்தில் காணவில்லை பகுதியில் இருந்த அந்தப் படத்தில் பென்சிலால் ஏதோ கிறுக்கினான்.,9
அந்த_நாய்க்குட்டி_எங்கே,அவசரமாக அதை மடித்து வைத்தான்.,4
அந்த_நாய்க்குட்டி_எங்கே,பாலா ! என்று கூப்பிட்டு அவன் தோளைப் பற்றினான் ஜெயராஜ்.,7
அந்த_நாய்க்குட்டி_எங்கே,"வெள்ளைப் பிள்ளையார் கோயிலைக் கடக்கும் வரை ஜெயராஜ், உமைபாலன் இருவரும் மெள்ள நடந்தனர்.",10
அந்த_நாய்க்குட்டி_எங்கே,அப்போது நேருஜியின் உடல் நலம் கெட்டது பற்றி யாரோ பேசிக்கொண்டு போனது உமைபாலனின் செவிகளில் விழுந்தது.,12
அந்த_நாய்க்குட்டி_எங்கே,அதல பாதாளத்தில் விழுந்துவிட்டதைப் போல் அவன் பதைப்புற்றான்.,6
அந்த_நாய்க்குட்டி_எங்கே,"அதற்குள், பாலா, உன்னைப் பற்றிச் சொல்லேன் !",5
அந்த_நாய்க்குட்டி_எங்கே,"கொஞ்சமும் சுவாரஸ்யம் இல்லாமல், உமைபாலன் சொன்னான் நான் அனாதை.",7
அந்த_நாய்க்குட்டி_எங்கே,ராமநாதபுரச்சீமைப் பக்கம் எனக்கு.,3
அந்த_நாய்க்குட்டி_எங்கே,உழைச்சால்தான் வயிற்றுக்கு வழிபிறக்கும் !...,3
அந்த_நாய்க்குட்டி_எங்கே,அவன் இப்போது ஜெயராஜை நோக்கி உன்னைப்பற்றியும் நான் தெரிந்து கொள்ள வேணாமா? என்றான்.,10
அந்த_நாய்க்குட்டி_எங்கே,"தாராளமாக ! என்று தொடங்கினான் ஜெயராஜ், எனக்கு மெட்ராஸ் ஊர்.என் தகப்பனார் பெரிய வியாபாரி.",11
அந்த_நாய்க்குட்டி_எங்கே,"பெரிய பங்களா, கார் எல்லாம் உண்டு.",5
அந்த_நாய்க்குட்டி_எங்கே,ஒருநாள் கோபித்துக்கொண்டார் என் அப்பா.,4
அந்த_நாய்க்குட்டி_எங்கே,அதைப் பொறுக்காது ஓடி வந்துவிட்டேன்.,4
அந்த_நாய்க்குட்டி_எங்கே,பத்திரிகையிலே விளம்பரம் கூட போட்டுவிட்டார்.,4
அந்த_நாய்க்குட்டி_எங்கே,எனக்கு சுயகவுரவம்தான் ஒசத்தி ஒரு சந்து வந்தது.,6
அந்த_நாய்க்குட்டி_எங்கே,"ஜெயராஜ் தன் நண்பனை நிறுத்தி, அவன் கால்சட்டையிலிருந்து ஒரு சிகரெட்டை எடுத்து அவனிடம் நீட்டினான் டே !",12
அந்த_நாய்க்குட்டி_எங்கே,பிடிடா உமைபாலன் மறுத்தான்.,3
அந்த_நாய்க்குட்டி_எங்கே,என்ன சொல்லி மன்றாடியும் மறுதளித்தான்.,4
அந்த_நாய்க்குட்டி_எங்கே,"ஆகவே, ஜெயராஜ் வெகு குதூகலத்தோடு சிகரெட் பிடித்தான்.",6
அந்த_நாய்க்குட்டி_எங்கே,"எங்க வீட்டிலே – ஊஹும், பங்களாவிலே சிகரெட் எடுத்துக் குடுக்கிறதுக்குன்னே ஒரு பையன் உண்டு ! என்றான்.",12
அந்த_நாய்க்குட்டி_எங்கே,சிகரெட்டை உனக்கு எடுத்துக் கொடுக்கவா?... நீ சுத்த கண்ட்ரியாக இருக்கியே?,8
அந்த_நாய்க்குட்டி_எங்கே,நான் அவ்வளவு தைரியமாக அங்கே பிடிக்க முடியுமாடா? உஸ்... டா போடாதே.... இதுதான் உனக்கு மாப்பு !..,12
அந்த_நாய்க்குட்டி_எங்கே,உன்னைப் போல எனக்கும் சுயகவுரவம் உண்டு.,5
அந்த_நாய்க்குட்டி_எங்கே,உஷார் ! என்று கம்பீரமாக மொழிந்தான் உமைபாலன்.,5
அந்த_நாய்க்குட்டி_எங்கே,"சென்னையைப் பார்க்கவேண்டுமென்ற தன் ஆசையை வெளியிடவே, உடனேயே நிறைவேற்றுவதாக வாக்களித்தான் ஜெயராஜ்.",9
அந்த_நாய்க்குட்டி_எங்கே,இருவரும் ஒட்டலை அடைந்தபோது மணி இரண்டு அடிக்கச் சில வினாடிகள் இருந்தன.,9
அந்த_நாய்க்குட்டி_எங்கே,சாப்பாட்டு இலைகள் அவர்களை அழைத்தன.,4
அந்த_நாய்க்குட்டி_எங்கே,ஜெயராஜ் உட்கார்ந்து வாயில் அள்ளிக் கொட்டத் தொடங்கினான்.,6
அந்த_நாய்க்குட்டி_எங்கே,கை கழுவி வந்த உமைபாலன் இலையில் குந்தினான்.,6
அந்த_நாய்க்குட்டி_எங்கே,"அப்போது, ரேடியோ பயங்கரமான விதி போல அலறியது.",6
அந்த_நாய்க்குட்டி_எங்கே,குந்திய உமைபாலன் குபிரென்று எழுந்து விட்டான்.,5
அந்த_நாய்க்குட்டி_எங்கே,தெய்வமாகி வந்த நேருஜியே !...,3
அந்த_நாய்க்குட்டி_எங்கே,இவ்வளவு சீக்கிரமாக நீங்கள் தெய்வமாகி விட்டீர்களே !...,5
அந்த_நாய்க்குட்டி_எங்கே,அவனது பிஞ்சு மனம் வெந்து உருகியது.,5
அந்த_நாய்க்குட்டி_எங்கே,நான்கு அந்த ஓட்டலிலே மிகவும் பரபரப்பான பொழுதல்லவா அது !,7
அந்த_நாய்க்குட்டி_எங்கே,"கல்லாவில் கனபாடி கங்காதரம் அதாவது, கோபுவின் தகப்பனார் வீற்றிருந்தார்.",7
அந்த_நாய்க்குட்டி_எங்கே,உச்சியில் சுற்றிய காற்று அவருக்குப் போதுமா... போதாது.,6
அந்த_நாய்க்குட்டி_எங்கே,"ஆகவே, கையிலும் ஒரு விசிறி மட்டையை வைத்திருந்தார்.",6
அந்த_நாய்க்குட்டி_எங்கே,⁠ வைரக் கடுக்கன் அறுபது காசு ! என்ற குரல் உள்ளேயிருந்து கேட்டது.,9
அந்த_நாய்க்குட்டி_எங்கே,⁠குரல் ஈந்தவன் மாஸ்டர் மணி.,4
அந்த_நாய்க்குட்டி_எங்கே,⁠இல்லையென்றால் புளித்துப்போன ஒரு பழைய ஹாஸ்யத்தை இத்தனை தைரியமாகச் சொல்லி ஒப்பிடக்கூடுமா?,9
அந்த_நாய்க்குட்டி_எங்கே,"பிறகு, காற்றில் புறம் மாறிவிட்ட அந்த அட்டையை வாகாய்த் திருப்பி விட்டார்.",9
அந்த_நாய்க்குட்டி_எங்கே,⁠அதில் ⁠ இன்று முதல் சாப்பாடு ஆரம்பம் ! என்ற அறிவிப்பு இருந்தது.,9
அந்த_நாய்க்குட்டி_எங்கே,"அளவுச் சாப்பாடு, எடுப்புச் சாப்பாடு, முழுச் சாப்பாடு, டிக்கட் சாப்பாடு என்ற பாகுபாடுகளின் விலை விவரங்களும் இருந்தன.",13
அந்த_நாய்க்குட்டி_எங்கே,"⁠அது தருணம், முதலாளி கூப்பிட்டார் டேய் பாலா ! ⁠உமைபாலன், பாலாவாக வடிவம் பெற்று ஓடி வந்தான்.",12
அந்த_நாய்க்குட்டி_எங்கே,கையில் துடைக்கும் நீலத் துணி காட்சியளித்தது.,5
அந்த_நாய்க்குட்டி_எங்கே,⁠ எங்கேடா ஜெயராஜ் ! ⁠அவன் உள்ளே சென்றான்.,6
அந்த_நாய்க்குட்டி_எங்கே,"பாலா, நம்ம ராஜ், சர்பத் சாப்பிடக் கொல்லைப் பக்கமாய்ப்போயிருக்கான், நீ கண்டுக்காதே, பெரிய பணக்காரப்பிள்ளை அவன்.",12
அந்த_நாய்க்குட்டி_எங்கே,அவன் தயவு நமக்கு எப்பவும் வேணும்.,5
அந்த_நாய்க்குட்டி_எங்கே,அவன் இங்கே இனி இருக்கப் போறது நாள் கணக்குத் தாண்டா !...,8
அந்த_நாய்க்குட்டி_எங்கே,உன்னையும் என்னையும் கூட அவன் பட்டணத்துக்கு அழைச்சுக்கிட்டுப்போய்த் தன்னோட பங்களாவிலே வச்சுக்கிடப் போறதாச் சொல்லியிருக்கானே !... என்றான் அப்துல்லா.,13
அந்த_நாய்க்குட்டி_எங்கே,⁠இவர்களின் சம்பாஷணை முடிவதற்கும் ஜெயராஜ் அங்கு வருவதற்கும் கனகச்சிதமாக இருந்தது.,8
அந்த_நாய்க்குட்டி_எங்கே,"⁠ முதலாளி அய்யர் கூப்பிடுகிறார் உன்னை ! என்றான் உமைபாலன், ஜெயராஜிடம்.",8
அந்த_நாய்க்குட்டி_எங்கே,"⁠அவனோ வெகு அலட்சிய பாவத்தோடு, ம்... சரிடா நீ போ ! என்றான்.",9
அந்த_நாய்க்குட்டி_எங்கே,⁠உடனே இதைக்கேட்டதும் உமைபாலனுக்குக் கோபம் வந்துவிட்டது.,5
அந்த_நாய்க்குட்டி_எங்கே,டே பட்டம் போடறியா?... ரொம்பத் திமிர்தான் !,5
அந்த_நாய்க்குட்டி_எங்கே,உன் பணக்கொழுப்பை எங்கிட்டவா காட்டறே?... என்று முஷ்டியை ஓங்கினான்.,7
அந்த_நாய்க்குட்டி_எங்கே,⁠ஜெயராஜ் அதற்குள் அசந்துவிட்டான்.,3
அந்த_நாய்க்குட்டி_எங்கே,வீட்டிலே கூப்பிட்டு கூப்பிட்டுப் பழக்கமாகப் போச்சுப்பா !,5
அந்த_நாய்க்குட்டி_எங்கே,கோபிக்காதே ! என்று பவ்யமாகக் கெஞ்சினான்.,4
அந்த_நாய்க்குட்டி_எங்கே,⁠உமைபாலன் கோபம் ஆறினான்.,3
அந்த_நாய்க்குட்டி_எங்கே,⁠இருவரும் வெளிப்புறம் வந்து நின்றார்கள்.,4
அந்த_நாய்க்குட்டி_எங்கே,"⁠ சாப்பாட்டுக்கு நேரமாயிடுத்து... உள்ளே டேபிள், நாற்காலியையெல்லாம் செட்டிலாப் போட்டாச்சாடா?.",8
அந்த_நாய்க்குட்டி_எங்கே,ஆத்திலேருந்து வந்ததுகளையும் உள்ளவே போட்டுடனும்டா ! என்றார் முதலாளி.,6
அந்த_நாய்க்குட்டி_எங்கே,"⁠ ஆத்திலேருந்து மேஜை–நாற்காலி கூடவா வரும்? என்று ஜெயராஜ் ஜோக் அடிக்க, மற்றவன் ரசித்தான்.",11
அந்த_நாய்க்குட்டி_எங்கே,⁠இருவரும் ஒருவரையொருவர் பொருளுடன் பார்த்தனர்.,4
அந்த_நாய்க்குட்டி_எங்கே,"பேச்சுக்குப் பேச்சு டா போட்டுப் பேசினாரே, அதற்காகவா?",6
அந்த_நாய்க்குட்டி_எங்கே,⁠காரியம் என்றால் உமைபாலனுக்கு எப்போதுமே கண்.,5
அந்த_நாய்க்குட்டி_எங்கே,அவன் உள்ளே போய்த் திரும்பி வந்து சரியாக எல்லாம் போடப்பட்டிருப்பதாகச் சொன்னான்.,9
அந்த_நாய்க்குட்டி_எங்கே,"⁠ நானும் பார்க்கிறேன், அந்தப் பயல் ஜெயராஜ் என்னவோ பெரிய குபேரர் வீட்டுப்பிள்ளையாண்டான் மாதிரிதான்.",11
அந்த_நாய்க்குட்டி_எங்கே,கொஞ்சம் கூடப் பொறுப்பில்லாமத் திரியறான் ! என்றார் பெரியவர்.,6
அந்த_நாய்க்குட்டி_எங்கே,"⁠உமைபாலன் முன்வந்து, தன் நண்பன் ஜெயராஜின் உண்மைக் கதையைச் சொல்லிவிட வேண்டுமென்று துடித்தான்.",10
அந்த_நாய்க்குட்டி_எங்கே,"⁠ஐயரோ அவரையும் அறியாமல் மேஜையிலிருந்த அழைப்பு மணியை அழுத்திவிட்டு, ம்... போங்களேண்டா பசங்களா !...",10
அந்த_நாய்க்குட்டி_எங்கே,யாரோ பெரியவா வர்றா !...,3
அந்த_நாய்க்குட்டி_எங்கே,போய் டேபிளைச் சுத்தம் பண்ணுங்களேண்டா !...,4
அந்த_நாய்க்குட்டி_எங்கே,பதட்டம் குரலில் பேசியது.,3
அந்த_நாய்க்குட்டி_எங்கே,⁠சிறார்கள் இருவரும் உள்ளே விசையுடன் விரைந்தனர்.,5
அந்த_நாய்க்குட்டி_எங்கே,"⁠வெளியே கார் நின்றதும், அதிலிருந்து பட்டுச் சொக்காய் போட்ட ஆசாமி ஒருவர் இறங்கி வந்து, கல்லாவை அணுகினார்.",13
அந்த_நாய்க்குட்டி_எங்கே,படம் – ஆறு எல்லாவற்றையும் கேட்டுக்கொண்ட பின் உங்க நேம்? என்று கேட்டார் ஓட்டல்காரர்.,11
அந்த_நாய்க்குட்டி_எங்கே,"⁠ செங்காளியப்பன் ! என்று சொல்லி, சாண் அகல ஜரிகை கரையைத் தரையில் படாமல் கொய்து ஒதுக்கினார்.",12
அந்த_நாய்க்குட்டி_எங்கே,"⁠அப்படிப்பட்ட பையன் வந்தால் தெரிவிப்பதாகக் கூறி, காரைக்கால் புள்ளியின் முகவரியைக் கேட்டார்.",9
அந்த_நாய்க்குட்டி_எங்கே,"அதற்கு, அவர் தமது விலாசம் எழுதி தபால் தலை ஒட்டப்பட்ட வெள்ளைக்கூடு ஒன்றையும் கொடுத்தார்.",11
அந்த_நாய்க்குட்டி_எங்கே,இருங்கோ... ஒரு கப் டிக்ரி காப்பி சாப்பிட்டுப் போங்கோ.... தஞ்சாவூர் ஸ்பெஷல் இது !...,10
அந்த_நாய்க்குட்டி_எங்கே,"உங்க ஊரிலே காப்பி நல்லதாக் கிடைக்காதில்லே ! என்று கூறி, உமைபாலன் – ஜெயராஜ் இருவரது பெயர்களையும் அழைத்தார்.",13
அந்த_நாய்க்குட்டி_எங்கே,⁠மேஐையைச் சுத்தம் பண்ண அப்துல்லாதான் வந்தான்.,5
அந்த_நாய்க்குட்டி_எங்கே,⁠ காப்பி எனக்கு ஒத்துக்காதுங்க ! என்று தீர்ப்பளித்தார் காரைக்கால் செங்காளியப்பன்.,8
அந்த_நாய்க்குட்டி_எங்கே,"⁠ போச்சு, இருபத்தஞ்சு காசு என்ற ஏமாற்றத்தில், வந்தவரை வழியனுப்பக்கூட ஒப்பாமல், வியாபாரத்தில் கவனம் செலுத்தலானார் ஐயர்.",13
அந்த_நாய்க்குட்டி_எங்கே,"⁠சாப்பாட்டு டிக்கட்டுகள் கேட்டு, ஆட்கள் வந்தனர்.",5
அந்த_நாய்க்குட்டி_எங்கே,⁠ஐயர் தம் உடம்பை வெகு சிரமத்துடன் சுமந்துகொண்டு நடந்து உள்ளே சென்றார்.,9
அந்த_நாய்க்குட்டி_எங்கே,அம்பி கோபுவுக்கு உடம்பு நன்னா இல்லாததாலே இத்தனை கஷ்டம்... ஈஸ்வரப் பிரபோ.. ! என்று வாய்விட்டு அலுத்துக்கொள்ள வேண்டியவர் ஆனார்.,14
அந்த_நாய்க்குட்டி_எங்கே,⁠டிக்கட்டுகள் வியாபாரம் ஆயின.,3
அந்த_நாய்க்குட்டி_எங்கே,⁠உள்ளே முதற்பந்தி ஆரம்பாயிற்று.,3
அந்த_நாய்க்குட்டி_எங்கே,⁠கல்லாப் பெட்டி முடிக்கொண்டது.,3
அந்த_நாய்க்குட்டி_எங்கே,பிறகு வலம் வந்தார்.,3
அந்த_நாய்க்குட்டி_எங்கே,⁠கீழ்ப்பகுதியில் உமைபாலன் டபரா–தம்ளர் முதலியவைகளைச் சுத்தம் செய்து கழுவிக்கொண்டிருந்தான்.,7
அந்த_நாய்க்குட்டி_எங்கே,காலடியில் ஒட்டி உறவாடிய சூட்டைச் சட்டை செய்தால் முடியுமா?,7
அந்த_நாய்க்குட்டி_எங்கே,சட்டையை உதறி வேர்வையைத் துடைத்தபடி கைவேலையில் முனைந்தான்.,6
அந்த_நாய்க்குட்டி_எங்கே,மகாத்மா காந்தி வீட்டுப்பாத்திரங்களைக் கழுவிய நிகழ்ச்சியையும் அவன் அப்போது எண்ணிப் பார்த்தான்.,9
அந்த_நாய்க்குட்டி_எங்கே,⁠ இங்கே எச்சில் துப்பு என்ற பலகை இருந்த இடத்தை நெருங்கினார்.,9
அந்த_நாய்க்குட்டி_எங்கே,⁠கல்லாச் சாவியை எடுத்துத் திறந்தார்.,4
அந்த_நாய்க்குட்டி_எங்கே,⁠அவ்வேளையில் ⁠ சாமி !,3
அந்த_நாய்க்குட்டி_எங்கே,என் பையன் காத்தான்... நல்ல செகப்புங்க... இங்காலே வந்தானுங்களா? என்று பரிதாபமாகக் கேட்டான்.,10
அந்த_நாய்க்குட்டி_எங்கே,அவனுக்கு அறந்தாங்கிப் பகுதியாம் !,3
