work_title,sentence,sentence_length
ஆப்பரேஷனுக்கு_அஞ்சவேண்டாம்,இதைச் சொன்னால் யாரும் தடை சொல்லமாட்டார்கள்.,5
ஆப்பரேஷனுக்கு_அஞ்சவேண்டாம்,அப்படியானால் எல்லா மாதங்களிலும் இந்த மாதிரி நடந்து கொண்டால் குழந்தை உண்டாவதையே தடுத்து விடலாம் போலிருக்கிறதே.,12
ஆப்பரேஷனுக்கு_அஞ்சவேண்டாம்,பெற்ற குழந்தைகளை நல்ல விதமாக வளர்க்கலாம்.,5
ஆப்பரேஷனுக்கு_அஞ்சவேண்டாம்,சி தம்பி நீங்கள் சொல்வது மிகவும் எளிதாகக் கையாளக்கூடிய முறையாக இருக்கிறது.,9
ஆப்பரேஷனுக்கு_அஞ்சவேண்டாம்,"இதை நான் என் மருமகப்பிள்ளையிடம் சொல்லுகிறேன், அவர் இதை ஏற்றுக்கொள்வார் என்றே நம்புகிறேன்.",10
ஆப்பரேஷனுக்கு_அஞ்சவேண்டாம்,ஒருமணி நேரம் அவர்களுடன் இருந்துவிட்டு நானும் என் மனைவியும் விடை பெற்றுக்கொண்டு வீடு திரும்பினோம்.,11
ஆப்பரேஷனுக்கு_அஞ்சவேண்டாம்,நாங்கள் பேசிக்கொண்டிருந்தது எல்லோர்க்கும் பயன்படும் என்று இங்கு எழுதுகின்றேன்.,7
ஆப்பரேஷனுக்கு_அஞ்சவேண்டாம்,சிலர் நீங்கள் கூறுவது நியாயம்தான்.,4
ஆப்பரேஷனுக்கு_அஞ்சவேண்டாம்,"மூன்று குழந்தைகள் போதும், இரண்டுகூடப் போதும் என்று சில வேளைகளில் தோன்றுகிறது.",9
ஆப்பரேஷனுக்கு_அஞ்சவேண்டாம்,"ஆனால் ஆப்பரேஷன் செய்துகொள்ளச் சொல்லுகிறீர்களே, ஆப்பரேஷன் செய்தால் குழந்தை பிறக்காது என்றால் ஆப்பரேஷனால் ஆண்மை போய் விடுமல்லவா?",13
ஆப்பரேஷனுக்கு_அஞ்சவேண்டாம்,"அது உண்டாகாமல் இருப்பதற்காகக் காளைக்குக் காயடிக்கிறார்களே, தாங்கள் கூறும் ஆப்பரேஷனும் அது போன்றதுதானே?",10
ஆப்பரேஷனுக்கு_அஞ்சவேண்டாம்,இவர்கள் நினைப்பது தவறு.,3
ஆப்பரேஷனுக்கு_அஞ்சவேண்டாம்,"நான் கூறும் ஆப்பரேஷனால் ஆண்மை போகாது, அத்துடன் நான் கூறும் ஆப்பரேஷன் வேறு, காயடிக்கும் ஆப்பரேஷன் வேறு.",13
ஆப்பரேஷனுக்கு_அஞ்சவேண்டாம்,இந்தக் கேள்வியைக் கேட்பவர்கள் கருவுண்டாக்கும் சக்தியையே ஆண்மை என்று எண்ணுகிறார்கள்.,8
ஆப்பரேஷனுக்கு_அஞ்சவேண்டாம்,ஆனால் கருவுண்டாக்கும் சக்தி வேறு.,4
ஆப்பரேஷனுக்கு_அஞ்சவேண்டாம்,ஆண்மைச் சக்தி வேறு.,3
ஆப்பரேஷனுக்கு_அஞ்சவேண்டாம்,ஒருவனுடைய கோசம் குய்யத்துள் நுழையக் கூடிய அளவு கட்டியாக ஆகுமானால் அப்போதே அவன் கலவி செய்யமுடியும்.,12
ஆப்பரேஷனுக்கு_அஞ்சவேண்டாம்,அந்தக் கலவி செய்யும் சக்தியே ஆண்மைச் சக்தியாகும்.,6
ஆப்பரேஷனுக்கு_அஞ்சவேண்டாம்,"சில கணவன்மார் கலவி செய்வார்கள், ஆயினும் அவர்களுடைய மனைவிமார்க்குக் கருவுண்டாகிக் குழந்தை பிறவாதிருக்கும்.",10
ஆப்பரேஷனுக்கு_அஞ்சவேண்டாம்,ஆண்மகனுடைய விதைகள் இருவித நீர்களை உண்டாக்குகின்றன.,5
ஆப்பரேஷனுக்கு_அஞ்சவேண்டாம்,ஒன்றை அகச்சுரப்பு என்றும் மற்றதைப் புறச்சுரப்பு என்றும் மருத்துவர்கள் கூறுவர்.,8
ஆப்பரேஷனுக்கு_அஞ்சவேண்டாம்,ஆகவே ஆண்மை அல்லது கலவி செய்யும் சக்தியைத் தருவது இந்த அகச் சுரப்பேயாகும்.,10
ஆப்பரேஷனுக்கு_அஞ்சவேண்டாம்,கலவியின் இறுதியில் கோசத்திலிருந்து புறச் சுரப்பு நீர் குய்யத்துள் பாயும்.,8
ஆப்பரேஷனுக்கு_அஞ்சவேண்டாம்,அந்த நீர் விந்து எனப் பெறும்.,5
ஆப்பரேஷனுக்கு_அஞ்சவேண்டாம்,அதில் மிதக்கும் விந்துயிர்களில் ஒன்று பெண்ணின் சினைக்குழாய்க்கு வரும் முட்டையுடன் கலக்கும் போது கருவுண்டாகும்.,11
ஆப்பரேஷனுக்கு_அஞ்சவேண்டாம்,"ஆகவே அகச்சுரப்பு நீர் கலவி செய்யும் சக்தியைத் தரும், புறச்சுரப்பு நீர் கரு உண் டாக்கும் சக்தியைத் தரும்.",14
ஆப்பரேஷனுக்கு_அஞ்சவேண்டாம்,"நான் கூறும் விந்துக்குழாய் வெட்டுதல் என்னும் ஆப்பரேஷனைச் செய்தால் புறச்சுரப்பு நீர் உண்டாகாது, அதனால் கருவுற்பத்தியாகாது.",12
ஆப்பரேஷனுக்கு_அஞ்சவேண்டாம்,"﻿ இரண்டாவதாக நான் கூறும் விந்துக்குழாய் வெட்டுதல் என்னும் ஆப்பரேஷன் வேறு, காளைகளுக்குக் காயடித்தல் என்னும் ஆப்பரேஷன் வேறு.",14
ஆப்பரேஷனுக்கு_அஞ்சவேண்டாம்,காயடித்தல் என்பது விதைகளை நீக்கிவிடுதல் என்பதாகும்.,5
ஆப்பரேஷனுக்கு_அஞ்சவேண்டாம்,"விதைகளை நீக்கிவிட்டால் அகச்சுரப்பு நீருமில்லை, புறச்சுரப்பு நீருமில்லை.",6
ஆப்பரேஷனுக்கு_அஞ்சவேண்டாம்,"ஆண்மகன் ஒருவனுக்கு அவ்விதம் செய்தால் அவன் கலவியும் செய்யமுடியாது, கருவுண்டாக்கவும் முடியாது.",9
ஆப்பரேஷனுக்கு_அஞ்சவேண்டாம்,அதனால் விதையை நீக்கும்போதே அதாவது அகச்சுரப்பு நீரை இல்லாமற் செய்யும்போதே ஆண்மை போகும்.,10
ஆப்பரேஷனுக்கு_அஞ்சவேண்டாம்,நான் கூறும் ஆப்பரேஷனால் புறச் சுரப்பு நீர் மட்டுமே உண்டாகாது.,8
ஆப்பரேஷனுக்கு_அஞ்சவேண்டாம்,அகச்சுரப்பு நீர் உண்டாகிக்கொண்டே இருக்கும்.,4
ஆப்பரேஷனுக்கு_அஞ்சவேண்டாம்,"அதனால் ஆண்மை போகாது, இருந்துகொண்டே இருக்கும்.",5
ஆப்பரேஷனுக்கு_அஞ்சவேண்டாம்,"கணவன் கலவி செய்வான், முன்போல் இன்பம் துய்ப்பான், ஆனால் குழந்தை மட்டும் பிறக்காது.",10
ஆப்பரேஷனுக்கு_அஞ்சவேண்டாம்,ஆப்பரேஷனால் ஆண்மை போகாது.,3
ஆப்பரேஷனுக்கு_அஞ்சவேண்டாம்,"அதிகப்படவே செய்யும், அஞ்ச வேண்டியதில்லை, ஆப்பரேஷனைச் செய்து கொள்ளுங்கள், நன்மையே அடைவீர்கள்.",9
ஆப்பரேஷனுக்கு_அஞ்சவேண்டாம்,நான் குடும்பத்தைப் பெருக்கினால் நமக்கும் நாட்டுக்கும் நன்மை உண்டாகாது.,7
ஆப்பரேஷனுக்கு_அஞ்சவேண்டாம்,எனக்குத் துன்பமும் அசெளகர்யமுமே உண்டாகும்.,4
ஆப்பரேஷனுக்கு_அஞ்சவேண்டாம்,அதிகமாகக் குழந்தைகள் பெறுவது பெண்களுக்கு எத்துணைக்கஷ்டமான காரியம் என்பதை ஆண்கள் எண்ணிப் பார்ப்பதேயில்லை.,10
ஆப்பரேஷனுக்கு_அஞ்சவேண்டாம்,எனச் சிலர் கேட்பர்.,3
ஆப்பரேஷனுக்கு_அஞ்சவேண்டாம்,"இவர்கள் இருவரும் குடும்பக் கட்டுப்பாடு வேண் டாம், பிள்ளைகளைப் பெற்றுத் தள்ளிக்கொண்டே இருக்கலாம் என்று கூறவில்லை.",12
ஆப்பரேஷனுக்கு_அஞ்சவேண்டாம்,"அதற்கு மாறாக அவர்கள் இருவரும் குடும்பக் கட்டுப்பாடு அவசியம் வேண்டும், அதிகக் குழந்தைகளைப் பெறலாகாது என்றே கூறுகிறார்கள்.",13
ஆப்பரேஷனுக்கு_அஞ்சவேண்டாம்,மருத்துவர்கள் கண்டுபிடித்துள்ள மாத்திரைகளும் களிம்புகளும் கருவிகளும் செயற்கை முறைகள்.,7
ஆப்பரேஷனுக்கு_அஞ்சவேண்டாம்,"ஆனால் எல்லோர்க்கும் இது சாத்தியப் படாது, எல்லோரும் மனத்தை அடக்கிக்கொண்டு காதல் செய்வதை அறவே துறந்துவிட முடியாது.",13
ஆப்பரேஷனுக்கு_அஞ்சவேண்டாம்,"அவர்கள் காதல் செய்யவும் வேண்டும், குழந்தை உண்டாகாமலும் இருக்கவேண்டும் என்றே எண்ணுவார்கள் அதற்கும் ஓர் இயற்கையான முறை இருக்கிறது.",14
ஆப்பரேஷனுக்கு_அஞ்சவேண்டாம்,இதில் தவறு ஏதுமில்லை.,3
ஆப்பரேஷனுக்கு_அஞ்சவேண்டாம்,அமெரிக்க நாட்டில் மார்கரட் ஸாங்கர் என்ற பெயருடைய ஓர் அம்மையார் இருக்கிறார்.,9
ஆப்பரேஷனுக்கு_அஞ்சவேண்டாம்,அவர் தாம் அந்த நாட்டில் முதன் முதலாகக் குடும்பக் கட்டுப்பாட்டின் அவசியத்தை எடுத்துக்காட்டி அதற்கான முறைகளைப் பரவச் செய்தவர்.,14
ஆப்பரேஷனுக்கு_அஞ்சவேண்டாம்,அவர் இப்போது சர்வதேசக் குடும்பக் கட்டுப்பாட்டு சங்கத்தின் தலைவராக இருந்துவருகிறார்.,8
ஆப்பரேஷனுக்கு_அஞ்சவேண்டாம்,அவர் ஓர் ஆயிரத்து தொள்ளாயிரத்து முப்பத்தாறு ஆம் ஆண்டில் இந்தியாவுக்கு வந்திருந்தார்.,9
ஆப்பரேஷனுக்கு_அஞ்சவேண்டாம்,மகாத்மா காந்தியடிகளுடன் குடும்பக் கட்டுப்பாடு சம்பந்தமாகப் பேசிக்கொண்டிருந்தார்.,6
ஆப்பரேஷனுக்கு_அஞ்சவேண்டாம்,காந்தியடிகளும் போப்பாண்டவரைப் போலவே மருத்துவர் கூறும் செயற்கை முறைகளை ஆதரிக்கவில்லை.,8
ஆப்பரேஷனுக்கு_அஞ்சவேண்டாம்,அதோடு போப்பாண்டவர் கூறும் காதல் செய்யாதிருக்கும் முறையையே ஆதரித்தார்.,7
ஆப்பரேஷனுக்கு_அஞ்சவேண்டாம்,அது எல்லோர்க்கும் சாத்தியப்படாது என்பதை அம்மையார் வற்புறுத்தி வாதித்தார்.,7
ஆப்பரேஷனுக்கு_அஞ்சவேண்டாம்,ஆகவே இந்த இரண்டு உலகப் பெரியார்களும் குடும்பக் கட்டுப்பாடு வேண்டாம் என்று கூறவில்லை.,10
ஆப்பரேஷனுக்கு_அஞ்சவேண்டாம்,அதற்கு மாறாக அவர்கள் வேண்டும் என்றே கூறுகிறார்கள்.,6
ஆப்பரேஷனுக்கு_அஞ்சவேண்டாம்,ஆனால் அவர்கள் கூறும் வழிகள் நான் கூறும் வழிகளுக்கு வேறானவை.,8
ஆப்பரேஷனுக்கு_அஞ்சவேண்டாம்,அப்படியானால் மருத்துவர்கள் கூறும் செயற்கை முறைகளை விட்டு விட்டு இயற்கை முறைகளைக் கையாளலாம் அல்லவா?,11
ஆப்பரேஷனுக்கு_அஞ்சவேண்டாம்,ஆப்பரேஷன் வேண்டாம் அல்லவா?,3
ஆப்பரேஷனுக்கு_அஞ்சவேண்டாம்,எனச் சிலர் கேட்பார்.,3
ஆப்பரேஷனுக்கு_அஞ்சவேண்டாம்,உலகம் புகழும் தத்துவ ஞானியும் பாரத தேசத்தின் ராஷ்டிரபதியுமான டாக்டர் ராதா கிருஷ்ணன் அவர்கள் அந்த மகாநாட்டை.,13
ஆப்பரேஷனுக்கு_அஞ்சவேண்டாம்,இந்த விஷயத்திலும் செயற்கை முறைகள் தான் முழுப்பலன் தருமாயின் அவற்றைக் கையாளத் தயங்கலாகாது.,10
ஆப்பரேஷனுக்கு_அஞ்சவேண்டாம்,"நம்முடைய ராஷ்டிரபதி பேரறிஞர், அவர் தவறான கருத்துக் கூறமாட்டார்.",7
ஆப்பரேஷனுக்கு_அஞ்சவேண்டாம்,"ஆதலால் எல்லோரும் எந்த முறை நிச்சயமாகப் பயன் தருமோ, அந்த முறையை அனுஷ்டிக்கப் பின்வாங்கலாகாது.",11
ஆப்பரேஷனுக்கு_அஞ்சவேண்டாம்,ஆப்பரேஷன் முறை அத்தகையது என்பதில் ஐயமில்லை.,5
ஆப்பரேஷனுக்கு_அஞ்சவேண்டாம்,கருத்தரிக்கும் நாட்களில் காதல் செய்யாதிருக்தால் குழந்தை உண்டாகாது என்றால் ஆப்பரேஷன் முறையை விட்டுவிட்டு இந்த முறையைக் கையாளலாம் அல்லவா?,14
ஆப்பரேஷனுக்கு_அஞ்சவேண்டாம்,இந்த முறையைக் கையாளவேண்டுமானால் கருத்தரிக்கும் நாட்களைத் தெரிந்துகொள்ள வேண்டும்.,7
ஆப்பரேஷனுக்கு_அஞ்சவேண்டாம்,"படங்களைப் பார்த்தால், இரண்டு சினைப் பைகள் இருப்பது தெரியும்.",7
ஆப்பரேஷனுக்கு_அஞ்சவேண்டாம்,அம் முட்டை கருப்பையை அடைய ஒரு நாளாகும்.,6
ஆப்பரேஷனுக்கு_அஞ்சவேண்டாம்,அந்த நாளில்தான் கரு உண்டாக முடியும்.,5
ஆப்பரேஷனுக்கு_அஞ்சவேண்டாம்,அந்த நாளில் கோசத்திலிருந்து குய்யத்தினுள் பாயும் விந்திலுள்ள விந்துயிர்கள் கருப்பைக்குள் சென்று அங்கிருந்து சினைக்குழாய்களுக்குள் நுழையும்.,12
ஆப்பரேஷனுக்கு_அஞ்சவேண்டாம்,முட்டையுள்ள சினைக் குழாயினுள் செல்லும் விந்துயிர்களில் ஒன்று முட்டையைக் கிழித்துக் கொண்டு அத்துடன் ஐக்கியமாகிவிடும்.,11
ஆப்பரேஷனுக்கு_அஞ்சவேண்டாம்,இவ்வாறு விந்துயிர் கலந்த முட்டை கருப்பைக்கு வந்து அதில் ஒட்டிக் கொண்டு குழந்தையாக வளரும்.,11
ஆப்பரேஷனுக்கு_அஞ்சவேண்டாம்,"அந்த நாளில் காதல் செய்யா விட்டால் கரு உண்டாகாது, குழந்தை பிறக்காது, மற்ற நாட்களில் காதல் செய்யலாம்.",13
ஆப்பரேஷனுக்கு_அஞ்சவேண்டாம்,ஆனால் மாதவிடாய்களுக்கிடையில் முட்டை.,3
ஆப்பரேஷனுக்கு_அஞ்சவேண்டாம்,வெளி வரும் அந்த நாள் எது?,5
ஆப்பரேஷனுக்கு_அஞ்சவேண்டாம்,அதைக் கண்டுபிடிப்பது எப்படி?,3
ஆப்பரேஷனுக்கு_அஞ்சவேண்டாம்,"அந்த நாள் இதுதான் என்று நிச்சயமாகக் கூறமுடியுமானால் ஆப்பரேஷனும் வேண்டாம், வேறு எந்த முயற்சியும் தேவையில்லை.",12
ஆப்பரேஷனுக்கு_அஞ்சவேண்டாம்,ஆனால் மாதவிடாய்க் ﻿காலம் சாதாரணமாக இருபத்தெட்டு நாட்களாயிருக்க வேண்டுமாயினும் எல்லோருக்கும் அப்படி யிருப்பதில்லை.,10
ஆப்பரேஷனுக்கு_அஞ்சவேண்டாம்,சில சமயங்களில் முட்டையானது சம்போக வேகத்தின் காரணமாகக் காலந் தவறி வெளியே வந்து விடுவதுமுண்டு.,11
ஆப்பரேஷனுக்கு_அஞ்சவேண்டாம்,"மூன்று குழந்தைகள் உடையவர்கள், இனிக் குழந்தை வேண்டாம் என்று எண்ணுகிறவர்கள் இந்த முறையைக் கையாளலாகாது.",11
ஆப்பரேஷனுக்கு_அஞ்சவேண்டாம்,"ஆப்பரேஷன் முறை மட்டுமே முற்றிலும் நம்பக்கூடியது, அதனால்தான் அந்த முறையைக் கையாண்டு நலம் பெறுமாறு வேண்டிக் கொள்கிறேன்.",13
ஆப்பரேஷனுக்கு_அஞ்சவேண்டாம்,அந்த மாதிரியான மாத்திரைகள் இருப்பதாகத்தான் அடிக்கடி பத்திரிகையில் விளம்பரங்கள் வருகின்றன.,8
ஆப்பரேஷனுக்கு_அஞ்சவேண்டாம்,ஆனால் விளம்பரங்களை நம்பி எதுவும் செய்துவிட லாகாது.,6
ஆப்பரேஷனுக்கு_அஞ்சவேண்டாம்,அதுபோல் எந்த மருத்துவர் கூறுவதையும் கூட நம்பிவிடலாகாது.,6
ஆப்பரேஷனுக்கு_அஞ்சவேண்டாம்,மாத்திரையைச் சாப்பிட்டு மக்களைப் பெறாதிருக்க வழியிருக்குமானால் மிகவும் நல்லதுதான்.,7
