work_title,sentence,sentence_length
ஆப்பரேஷனுக்கு_அஞ்சவேண்டாம்,ஆப்பரேஷனுக்கு அஞ்சவேண்டாம் பொ.,3
ஆப்பரேஷனுக்கு_அஞ்சவேண்டாம்,﻿ ஆப்பரேஷனுக்கு அஞ்சவேண்டாம் ஆசிரியர் பொ.,5
ஆப்பரேஷனுக்கு_அஞ்சவேண்டாம்,"திருகூ.ட சுந்தரம் எம்.ஏ., பி.ல்.",7
ஆப்பரேஷனுக்கு_அஞ்சவேண்டாம்,முகவுரை கனம் எம்.,3
ஆப்பரேஷனுக்கு_அஞ்சவேண்டாம்,எம்.ஏ. இல் பல்கலைக் கழகத் தங்கப்பதக்கம் பெற்ற பேரறிஞர்.,8
ஆப்பரேஷனுக்கு_அஞ்சவேண்டாம்,ஓர் ஆயிரத்து தொள்ளாயிரத்து இருபத்து நான்கு ல் வக்கீல் தொழிலைப் புறக்கணித்து காங்கிரஸில் சேர்ந்து ஒத்துழையாமை இயக்கத்தில் ஈடுபட்டார்.,14
ஆப்பரேஷனுக்கு_அஞ்சவேண்டாம்,காந்தியடிகளின் தத்துவங்களை முதன்முதலில் மொழிபெயர்த்து தமிழர்க்கு உதவினார்.,6
ஆப்பரேஷனுக்கு_அஞ்சவேண்டாம்,தீண்டாமை விலக்குக்குத் தீவிரமாக உழைத்து வந்தார்.,5
ஆப்பரேஷனுக்கு_அஞ்சவேண்டாம்,கள்ளுக்கடை மறியல் நடத்தி சிறை சென்றார்.,5
ஆப்பரேஷனுக்கு_அஞ்சவேண்டாம்,தமிழ் ஹரிஜன் பத்திரிகைக்கு ஆசிரியராக இருந்தார்.,5
ஆப்பரேஷனுக்கு_அஞ்சவேண்டாம்,"ஆங்கிலத்திலும், தமிழிலும் பாண்டித்தியமுடையவர்.",3
ஆப்பரேஷனுக்கு_அஞ்சவேண்டாம்,சென்னை செனட் சபையில் அங்கம் வகித்தார்.,5
ஆப்பரேஷனுக்கு_அஞ்சவேண்டாம்,தேச முன்னேற்றத்திற்கும் மக்கள் வாழ்வு நலம் பெறவும் சிறுவர் அறிவு பெறவும் பல அரிய நூல்களை எழுதியுள்ளார்.,13
ஆப்பரேஷனுக்கு_அஞ்சவேண்டாம்,பல நூல்களுக்கு அரசாங்கம் பரிசுகள் வழங்கி ஆசிரியரைப் பெருமைப்படுத்தியுள்ளது.,7
ஆப்பரேஷனுக்கு_அஞ்சவேண்டாம்,கலைக்களஞ்சியக் கூட்டாசிரியராக இருந்தார்.,3
ஆப்பரேஷனுக்கு_அஞ்சவேண்டாம்,தற்போது ஓய்வு பெற்று வருகிறார்.,4
ஆப்பரேஷனுக்கு_அஞ்சவேண்டாம்,சென்னை மாநில முதலமைச்சர் கனம் எம்.,5
ஆப்பரேஷனுக்கு_அஞ்சவேண்டாம்,திருகூடசுந்தரம் அவர்கள் இச்சிறு நூலை எழுதியிருக்கிறார்.,5
ஆப்பரேஷனுக்கு_அஞ்சவேண்டாம்,ஆப்பரேஷன் பற்றி அறிந்து கொள்ள விரும்பும் அனைவருக்கும் இது மிகவும் பயன்படத்தக்க பிரசுரம்.,10
ஆப்பரேஷனுக்கு_அஞ்சவேண்டாம்,தமிழ் மக்கள் இதைஏற்ற முறையில் பயன்படுத்திக் கொள்வார்கள் என்று நம்புகிறேன்.,8
ஆப்பரேஷனுக்கு_அஞ்சவேண்டாம்,இவ்வெளியீட்டு உரிமையாளருக்கு என் நல் வாழ்த்துக்கள்.,5
ஆப்பரேஷனுக்கு_அஞ்சவேண்டாம்,"பெற்றோர்களின் ஆரோக்கியமும், குழந்தைகளின் நல்வாழ்வும் குடும்பத்தின் சுபீட்சமும் அத்திட்டத்தின் முக்கிய லட்சியங்களாகும்.",9
ஆப்பரேஷனுக்கு_அஞ்சவேண்டாம்,அத்திட்டத்தின் அவசியத்தைப்பற்றி மக்கள் படிப்படியாக உணர்ந்து ஆதரித்து வருகிறார்கள்.,7
ஆப்பரேஷனுக்கு_அஞ்சவேண்டாம்,"வெகுகாலமாக இவர் இத்திட்டத்தைப் பற்றி கட்டுரைகள், நாடகங்கள் எழுதியும், கூட்டங்களில் பேசியும் விளக்கி வருகிறார்.",11
ஆப்பரேஷனுக்கு_அஞ்சவேண்டாம்,சில இயற்கையான வழிகளையும் இதில் விளக்கியிருக்கிறார்.,5
ஆப்பரேஷனுக்கு_அஞ்சவேண்டாம்,ஒவ்வொருவரும் படித்துப் பயன் பெறக்கூடிய இந்த நூலை எழுதிய ஆசிரியருக்கு என் பாராட்டுக்கள்.,10
ஆப்பரேஷனுக்கு_அஞ்சவேண்டாம்,அரசாங்க ரீதியில் நாடு முழுவதும் கையாள வகை செய்தார்கள்.,7
ஆப்பரேஷனுக்கு_அஞ்சவேண்டாம்,வாசகர்கள் இந்த நூலால் அடையும் பயன் ஒன்றே அவர்கள் கூறும் நல்லாசி.,9
ஆப்பரேஷனுக்கு_அஞ்சவேண்டாம்,பாபுஜி பதிப்பகம் உ.,3
ஆப்பரேஷனுக்கு_அஞ்சவேண்டாம்,"தங்கப்பா பதிப்பக உரிமையாளர், ﻿ஆப்பரேஷனுக்கு அஞ்ச வேண்டாம் மனிதன் எந்தச் சிறு காரியமானாலும் திட்டமிட்டே செய்வான்.",12
ஆப்பரேஷனுக்கு_அஞ்சவேண்டாம்,திட்டமிடாமல் செய்யும் காரியம் எதுவும் திருப்தியாய் முடிவதில்லை.,6
ஆப்பரேஷனுக்கு_அஞ்சவேண்டாம்,முன்கூட்டிச் சிந்தியாமல் செய்தால் வெற்றி பெற முடியாது.,6
ஆப்பரேஷனுக்கு_அஞ்சவேண்டாம்,"அதற்காகவே தமிழ் மக்களுக்குத் தனிப்பெரு வழிகாட்டியாகவுள்ள வள்ளுவர், எண்ணித் துணிக கருமம், துணிந்தபின் எண்ணுவம் என்பது இழுக்கு.",13
ஆப்பரேஷனுக்கு_அஞ்சவேண்டாம்,என்று எப்போதும் எச்சரித்து வருகின்றார்.,4
ஆப்பரேஷனுக்கு_அஞ்சவேண்டாம்,ஆனால் மனிதன் நல்வாழ்விற்காகச் செய்யும் காரியங்களில் எல்லாம் அஸ்திவாரமாகவுள்ள காரியம் ஒன்று உள்ளது.,10
ஆப்பரேஷனுக்கு_அஞ்சவேண்டாம்,மனிதன் அல்லும் பகலும் உழைப்ப தெல்லாம் தன்னுடைய மனைவியும் மக்களும் சுகமாக வாழவேண்டும் என்பதற்காகவே.,11
ஆப்பரேஷனுக்கு_அஞ்சவேண்டாம்,ஆனால் அதற்குரிய வழியை மட்டும் ஆராய்ந்து காண்பதில்லை.,6
ஆப்பரேஷனுக்கு_அஞ்சவேண்டாம்,ஆராய்ந்து கண்டாலும் அதை மேற்கொள்வதில்லை.,4
ஆப்பரேஷனுக்கு_அஞ்சவேண்டாம்,பிறர் ஆராய்ந்து சொன்னாலும் அதைக் கவனிப்பதில்லை.,5
ஆப்பரேஷனுக்கு_அஞ்சவேண்டாம்,மனிதன் மணந்து மக்களைப் பெற்று மகிழ்ச்சியுடன் வாழவே விரும்புகின்றான்.,7
ஆப்பரேஷனுக்கு_அஞ்சவேண்டாம்,ஆனால் எவனும் ஒரு பெண்ணை மனைவியாக மணக்கும்போதும் மணந்த பின்னரும் அவனும் அவனுடைய மனைவியும் மணந்து கொண்டோம்.,13
ஆப்பரேஷனுக்கு_அஞ்சவேண்டாம்,ஆனால் எப்போது குழந்தை உண்டாக வேண்டும்?,5
ஆப்பரேஷனுக்கு_அஞ்சவேண்டாம்,ஒரு குழந்தை பெற்ற பின் எத்தனை ஆண்டுகள் கழித்து ﻿ அடுத்த குழந்தை உண்டாகவேண்டும்?,11
ஆப்பரேஷனுக்கு_அஞ்சவேண்டாம்,மொத்தம் எத்தனை குழந்தைகள் பெறவேண்டும்?,4
ஆப்பரேஷனுக்கு_அஞ்சவேண்டாம்,"இந்தக் காரியங்கள் வாழ்க்கையை இன்பமாகச் செய்யவேண்டுமானால், அதற்காகச் செய்யவேண்டிய காரியங்கள் எவை?",9
ஆப்பரேஷனுக்கு_அஞ்சவேண்டாம்,என்பன போன்ற விஷயங்களைப் பற்றிக் கனவில்கூடச் சிந்திப்பதில்லை.,6
ஆப்பரேஷனுக்கு_அஞ்சவேண்டாம்,ஆனால் இந்த விஷயங்களை அறிந்து அவ்வறிவின் படி நடக்கும் தம்பதிகளே சந்தோஷமாக வாழ்வார்கள்.,10
ஆப்பரேஷனுக்கு_அஞ்சவேண்டாம்,அதை எண்ணி நான் பதினெட்டு  ஆண்டுகட்கு முன்னர் விவாகமானவர்கட்கு ஒரு யோசனை என்ற பெயருடன் ஒரு நூலை எழுதினேன்.,14
ஆப்பரேஷனுக்கு_அஞ்சவேண்டாம்,அதற்குச் சென்னை ஸ்டான்லி வைத்தியக் கல்லூரியில் தலைவராயிருந்த டாக்டர் டி.,8
ஆப்பரேஷனுக்கு_அஞ்சவேண்டாம்,திருமூர்த்தி முகவுரை எழுதினார்.,3
ஆப்பரேஷனுக்கு_அஞ்சவேண்டாம்,தமிழ் வளர்ச்சிக் கழகத்தார் அந்த நூலைப் பரிசீலனை செய்து பாராட்டுப் பத்திரம் வழங்கினார்கள்.,10
ஆப்பரேஷனுக்கு_அஞ்சவேண்டாம்,அது இப்போது பனிரண்டு  ஆம் பதிப்பாகத் தமிழ் மக்களிடையே உலவி வருகின்றது.,9
ஆப்பரேஷனுக்கு_அஞ்சவேண்டாம்,நாடோறும் பத்து நிமிஷம் ஒழுங்காகச் செய்தால் போதும்.,6
ஆப்பரேஷனுக்கு_அஞ்சவேண்டாம்,"உண்டாகியிருந்தால் மறைந்து விடும், நோய் வராது.",5
ஆப்பரேஷனுக்கு_அஞ்சவேண்டாம்,பெண்களுக்குப் பிரசவத்தில் கஷ்டமிராது.,3
ஆப்பரேஷனுக்கு_அஞ்சவேண்டாம்,குழந்தைகளை நன்றாக வளர்க்க விரும்பினால் இரண்டு மூன்றுக்கு அதிகமாகப் பெறலாகாது.,8
ஆப்பரேஷனுக்கு_அஞ்சவேண்டாம்,அதற்காகக் கணவராவது மனைவியாவது ஆப்பரேஷன் செய்துகொள்ள வேண்டும்.,6
ஆப்பரேஷனுக்கு_அஞ்சவேண்டாம்,இந்த மூன்று யோசனைகளையும் கேட்பவர்கள் பெரும்பாலும் உடற்பயிற்சி யோசனை பற்றியும் இன்ஷூரன்ஸ் யோசனை பற்றியும் சந்தேகம் எதுவும் கேட்பதில்லை.,14
ஆப்பரேஷனுக்கு_அஞ்சவேண்டாம்,ஆப்பரேஷன் யோசனை பற்றியே கேட்கிறார்கள்.,4
ஆப்பரேஷனுக்கு_அஞ்சவேண்டாம்,ஆப்பரேஷன் என்பது உடலில் அறுப்பதாயிருப்பதால் யாரும் அஞ்சக்கூடியதுதான்.,6
ஆப்பரேஷனுக்கு_அஞ்சவேண்டாம்,"ஆப்பரேஷன் செய்யும்படி கூறுகிறீர்களே, அதனால் அபாயம் ஒன்றும் ஏற்படாதா என்று கேட்கிறார்கள்.",9
ஆப்பரேஷனுக்கு_அஞ்சவேண்டாம்,"இந்த ஆப்பரேஷன் மிகவும் சிறியது, மயக்க மருந்து எதுவும் கொடுக்கவேண்டியதில்லை.",8
ஆப்பரேஷனுக்கு_அஞ்சவேண்டாம்,பதினைந்து  நிமிஷ நேரத்தில் ஆப்பரேஷன் செய்து கட்டுக் கட்டி விடுவார்கள்.,8
ஆப்பரேஷனுக்கு_அஞ்சவேண்டாம்,அப்போதும் நோவு தெரியாது.,3
ஆப்பரேஷனுக்கு_அஞ்சவேண்டாம்,ஆப்பரேஷன் நடந்தபின் படுத்திருக்க வேண்டியதில்லை.,4
ஆப்பரேஷனுக்கு_அஞ்சவேண்டாம்,மெதுவாக நடந்து வந்து வண்டியில் ஏறி வீட்டிற்கு வரலாம்.,7
ஆப்பரேஷனுக்கு_அஞ்சவேண்டாம்,வீட்டிலும் மெதுவாக நடக்கலாம்.,3
ஆப்பரேஷனுக்கு_அஞ்சவேண்டாம்,மூன்று நாட்கள் வீட்டில் ஓய்வுகொள்ள வேண்டும்.,5
ஆப்பரேஷனுக்கு_அஞ்சவேண்டாம்,பத்தாம் நாள் மருத்துவர் நூலை உருவி விடுவார்.,6
ஆப்பரேஷனுக்கு_அஞ்சவேண்டாம்,ஆதலால் இந்த ஆப்பரேஷன் செய்வதில் எவ்வித அபாயமுமில்லை கஷ்டமுமில்லை.,7
ஆப்பரேஷனுக்கு_அஞ்சவேண்டாம்,"நண்பர்கள் இதைக் கேட்டவுடன், அபாயமில்லை குழந்தையும் உண்டாகாது.",6
ஆப்பரேஷனுக்கு_அஞ்சவேண்டாம்,ஆனால் நாங்கள் இளைஞர்கள்.,3
ஆப்பரேஷனுக்கு_அஞ்சவேண்டாம்,காதல் இன்பத்தை அவ்வளவு சீக்கிரத்தில் இழந்துவிட முடியுமா?,6
ஆப்பரேஷனுக்கு_அஞ்சவேண்டாம்,எல்லோரும் துறவிகளாக ஆகிவிட முடியாது.,4
ஆப்பரேஷனுக்கு_அஞ்சவேண்டாம்,ஆனால் நண்பர்கட்கு இந்த அச்சம் வேண்டியதில்லை.,5
ஆப்பரேஷனுக்கு_அஞ்சவேண்டாம்,ஆப்பரேஷன் செய்தபோதிலும் இன்பம் துய்க்கலாம்.,4
ஆப்பரேஷனுக்கு_அஞ்சவேண்டாம்,அதில் எவ்வித மாறுதலும் உண்டா ﻿காது.,5
ஆப்பரேஷனுக்கு_அஞ்சவேண்டாம்,குழந்தை பிறக்காது என்பதைத் தவிர வேறு எவ்வித வேறுபாடும் கிடையாது.,8
ஆப்பரேஷனுக்கு_அஞ்சவேண்டாம்,குழந்தை எப்படி உண்டாகிறது?,3
ஆப்பரேஷனுக்கு_அஞ்சவேண்டாம்,ஆண்மகனுடைய விதையில் பெண்ணிடமுண்டாகும் முட்டையுடன் சேர்ந்து கருவுண்டாக்கும் விந்துயிர்கள் உண்டாகின்றன.,8
ஆப்பரேஷனுக்கு_அஞ்சவேண்டாம்,அவை ஒரு மெல்லிய குழாய் வழியாகச் சென்று விந்துப் பை என்ற பையில் சேர்கின்றது.,11
ஆப்பரேஷனுக்கு_அஞ்சவேண்டாம்,கலவி சமயத்தில் அவை வேறு சில சுரப்பு நீர்களுடன் சேர்ந்து கோசம் வழியாக வெளியேறுகின்றன.,11
ஆப்பரேஷனுக்கு_அஞ்சவேண்டாம்,அவை பெண்ணின் கருப்பை வழியாகச் சினைக் குழாய்க்குள் நுழைகின்றன.,7
ஆப்பரேஷனுக்கு_அஞ்சவேண்டாம்,சினைக்குழாய்க்கு வரும் முட்டையுடன் அவ்வுயிர்களுள் ஒன்று கலந்துவிடுகிறது.,6
ஆப்பரேஷனுக்கு_அஞ்சவேண்டாம்,அதைத்தான் கரு உண்டாவதாகச் சொல்லுகிறோம்.,4
ஆப்பரேஷனுக்கு_அஞ்சவேண்டாம்,விந்து விந்துப்பைக்குச் செல்லும் குழாயை விந்துக் குழாய் என்பர்.,7
ஆப்பரேஷனுக்கு_அஞ்சவேண்டாம்,அதனால் இந்த ஆப்பரேஷன் விந்துக் குழாய் வெட்டல் எனப் படும்.,8
ஆப்பரேஷனுக்கு_அஞ்சவேண்டாம்,விதையானது விந்துயிர்களை மட்டும் உண்டாக்குவதில்லை.,4
ஆப்பரேஷனுக்கு_அஞ்சவேண்டாம்,அது விதை ஹார்மோன் என்னும் ஒருவித சுரப்பு நீரை உண்டாக்குகின்றது.,8
ஆப்பரேஷனுக்கு_அஞ்சவேண்டாம்,அந்த நீர் உண்டாகாவிட்டால் விந்து உண்டானாலும் பயனில்லை.,6
ஆப்பரேஷனுக்கு_அஞ்சவேண்டாம்,அந்த நீர்தான் ஆண்மை தருவது.,4
ஆப்பரேஷனுக்கு_அஞ்சவேண்டாம்,ஆண்மை என்பது ﻿ஆண் குறி பெண் குறிக்குள் நுழையக்கூடிய அளவு கட்டியாகி நிற்பதாகும்.,10
ஆப்பரேஷனுக்கு_அஞ்சவேண்டாம்,விந்துக் குழாயை வெட்டிவிட்டால் விந்துயிர்கள் வெளிப்படா.,5
ஆப்பரேஷனுக்கு_அஞ்சவேண்டாம்,விந்து நீர் சுரப்பது நிற்பதில்லை.,4
ஆப்பரேஷனுக்கு_அஞ்சவேண்டாம்,அதனால் ஆப்பரேஷன் செய்துகொள்பவர்கள் முன்போலவே கலவி இன்பம் துய்ப்பார்கள்.,7
ஆப்பரேஷனுக்கு_அஞ்சவேண்டாம்,அதில் எவ்விதக் குறைவும் ஏற்படுவதில்லை.,4
ஆப்பரேஷனுக்கு_அஞ்சவேண்டாம்,நான் இவ்விதம் விளக்கிச் சொன்னபோதிலும் சில நண்பர்களுக்கு அச்சம் விட்டு விலகுவதில்லை.,9
ஆப்பரேஷனுக்கு_அஞ்சவேண்டாம்,இந்த ஆப்பரேஷன் செய்தால் மூளைக் கோளாறு ஏற்படுமாமே என்று கேட்கிறார்கள்.,8
ஆப்பரேஷனுக்கு_அஞ்சவேண்டாம்,அப்படி அவர்கள் கேட்பதற்குக் காரணம் சில டாக்டர்கள் தான்.,7
ஆப்பரேஷனுக்கு_அஞ்சவேண்டாம்,"என்னுடைய நண்பர் ஒருவரிடம் சிந்தாதிரிப் பேட்டையிலுள்ள டாக்டர் ஒருவரும், கோவையிலுள்ள டாக்டர் ஒருவரும் கூறியதுண்டு என்பதை அறிவேன்.",13
ஆப்பரேஷனுக்கு_அஞ்சவேண்டாம்,இவர்கள் மருத்துவக் கல்லூரியில் படித்துப் பட்டம் பெற்றவர்கள்.,6
ஆப்பரேஷனுக்கு_அஞ்சவேண்டாம்,இவர்கள் விந்துக் குழாய் வெட்டும் ஆப்பரேஷன் செய்தால் மூளைக்கோளாறு உண்டாகும் என்று எதை வைத்துக் கூறுகிறார்கள் என்று விளங்கவில்லை.,14
