work_title,sentence,sentence_length
ஆப்பரேஷனுக்கு_அஞ்சவேண்டாம்,ஆனால் விஷயம் யாதெனில் மருத்துவ நிபுணர்கள் எல்லோரும் மூளைக்கோளாறு உண்டாகாது என்று மட்டும் கூறவில்லை.,11
ஆப்பரேஷனுக்கு_அஞ்சவேண்டாம்,மனோசக்தி பெருகும் என்றே உலகப் பிரசித்தி பெற்ற அறுவை வைத்திய நிபுணர் சர்.,10
ஆப்பரேஷனுக்கு_அஞ்சவேண்டாம்,"ஆர்பத்நெட் லேன், உலகப் புகழ் பெற்ற காம நூல் அறிஞர் ஹாவ்லக் எல்லிஸ் போன்றவர்கள் கூறுகிறார்கள்.",12
ஆப்பரேஷனுக்கு_அஞ்சவேண்டாம்,ஆதலால் ஆப்பரேஷன் செய்தால் மூளைக்கோளாறு உண்டாகும் என்று கூறுவோர்க்கே மூளைக்கோளாறு ஏற்பட்டிருக்கிறது என்று கூற வேண்டியவர்களாக இருக்கின்றோம்.,13
ஆப்பரேஷனுக்கு_அஞ்சவேண்டாம்,"ஆப்பரேஷன் செய்வதால், அபாயம் எதுவும் உண்டாகாது.",5
ஆப்பரேஷனுக்கு_அஞ்சவேண்டாம்,காதல் இன்பம் முன் போலவே துய்க்கலாம்.,5
ஆப்பரேஷனுக்கு_அஞ்சவேண்டாம்,ஆண்மை என்பது அணுவளவும் குறையாது.,4
ஆப்பரேஷனுக்கு_அஞ்சவேண்டாம்,அறிவு கெட்டுப் போகாது.,3
ஆப்பரேஷனுக்கு_அஞ்சவேண்டாம்,அறிவு சக்தி அதிகப்படவே செய்யும்.,4
ஆப்பரேஷனுக்கு_அஞ்சவேண்டாம்,குழந்தை மட்டும் பிறக்காது.,3
ஆப்பரேஷனுக்கு_அஞ்சவேண்டாம்,மூன்று குழந்தைகள் போதும்.,3
ஆப்பரேஷனுக்கு_அஞ்சவேண்டாம்,அவர்களை அறிவறிந்த நன்மக்களாக வளர்க்கும் பெரும்பேற்றுடன் இன்பமாய் வாழுங்கள்.,7
ஆப்பரேஷனுக்கு_அஞ்சவேண்டாம்,அது உங்களுக்கும் நன்மை.,3
ஆப்பரேஷனுக்கு_அஞ்சவேண்டாம்,உங்களைப் பெற்றெடுத்த நாட்டிற்கும் நன்மை.,4
ஆப்பரேஷனுக்கு_அஞ்சவேண்டாம்,குறிப்பு அரசாங்க மருத்துவ இல்லங்களில் இந்த ஆப்பரேஷனை இலவசமாகச் செய்கிறார்கள்.,8
ஆப்பரேஷனுக்கு_அஞ்சவேண்டாம்,அரசாங்க ஊழியர்கள் செய்து கொண்டால் சம்பளத்துடன் ஏழு நாள் ரஜா பெறுவார்கள்.,9
ஆப்பரேஷனுக்கு_அஞ்சவேண்டாம்,﻿எந்த ஆப்பரேஷன் நல்லது?,3
ஆப்பரேஷனுக்கு_அஞ்சவேண்டாம்,அரசாங்கத்தாரும் அவ்விதமே பிரசாரம் செய்து வருகிறார்கள்.,5
ஆப்பரேஷனுக்கு_அஞ்சவேண்டாம்,"அப்படியானால் எல்லோரும் காதலின்பம் அனுபவிப்பதை விட்டுத் துறவிகளாக ஆகிவிட வேண்டுமோ, அது எல்லோர்க்கும் சாத்தியப்படுமோ?",11
ஆப்பரேஷனுக்கு_அஞ்சவேண்டாம்,என்று சிலர் கேட்கிறார்கள்.,3
ஆப்பரேஷனுக்கு_அஞ்சவேண்டாம்,இரண்டு மூன்று குழந்தைகள் போதும் என்று கூறுவோர் யாரையும் துறவுகொள்ளச் சொல்லவில்லை.,9
ஆப்பரேஷனுக்கு_அஞ்சவேண்டாம்,காதலின்பத்தை விட்டுவிடவேண்டும் என்று கூறவில்லை.,4
ஆப்பரேஷனுக்கு_அஞ்சவேண்டாம்,"அவர்கள் காதலின்பம் வேண்டாம் என்று கூறவில்லை, அதிகக் குழந்தைகள் வேண்டாம் என்றே கூறுகிறார்கள்.",10
ஆப்பரேஷனுக்கு_அஞ்சவேண்டாம்,காதலின்பம் துய்த்தால் கருத்தரிக்குமே என்றால் காதலின்பம் துய்த்தாலும் கருத்தரியாமல் இருப்பதற்கான வழிகளை டாக்டர்கள் கண்டு பிடித்திருக்கிருர்கள்.,12
ஆப்பரேஷனுக்கு_அஞ்சவேண்டாம்,கணவனோ மனைவியோ ஒரு ஆப்பரேஷ்ன் செய்துகொண்டால் கருத்தரியாது என்று கூறுகிறார்கள்.,8
ஆப்பரேஷனுக்கு_அஞ்சவேண்டாம்,ஆப்பரேஷன் செய்து கொள்பவர்க்கு உடல்நலம் முன்னிலும் சிறந்ததாக இருக்கும்.,7
ஆப்பரேஷனுக்கு_அஞ்சவேண்டாம்,இந்த ஆப்பரேஷனை வெள்ளைக்கார நாடு களில் கிழவர்கள் பலமாக இருப்பதற்காகச் செய்து கொள்கிறார்கள்.,10
ஆப்பரேஷனுக்கு_அஞ்சவேண்டாம்,இத்துணைச் சிறந்த ஆப்பரேஷன்கள் யாவை என்று அறிவதற்குமுன் கருப்பம் எவ்வாறு உண்டாகின்றது என்று அறிந்துகொண்டால் நல்லது.,12
ஆப்பரேஷனுக்கு_அஞ்சவேண்டாம்,கருப்பம் உண்டாவதற்கு வேண்டிய விந்துயிர்கள் கணவனுடைய விதைகளில் உற்பத்தியாகின்றன.,7
ஆப்பரேஷனுக்கு_அஞ்சவேண்டாம்,அவை மிக மெல்லிய விந்துக் குழாய்கள் வழியாகச் சென்று விந்துப் பைகளில் தங்குகின்றன.,10
ஆப்பரேஷனுக்கு_அஞ்சவேண்டாம்,கலவி செய்யும்போது கணவனுடைய கோசத்தில் ஒரு.,5
ஆப்பரேஷனுக்கு_அஞ்சவேண்டாம்,வழ வழப்பான விந்து நீர் சுரக்கும்.,5
ஆப்பரேஷனுக்கு_அஞ்சவேண்டாம்,விந்துப் பைகளிலுள்ள விந்துயிர்கள் அந்த விந்து நீரில் மிதந்து கோசத்தின் வழியாகக் குய்யத்தில் பாயும்.,11
ஆப்பரேஷனுக்கு_அஞ்சவேண்டாம்,பின் அவை கருப்பப் பை வழியாகச் சென்று சினைக்குழாயினுள் செல்லும்.,8
ஆப்பரேஷனுக்கு_அஞ்சவேண்டாம்,ஒவ்வொரு மாதமும் சினைப் பையிலிருந்து ஒரு முட்டை வெளியாகி சினைக் குழாய்க்கு வந்து சேரும்.,11
ஆப்பரேஷனுக்கு_அஞ்சவேண்டாம்,விந்துயிர்கள் சினைக் குழாயில் நுழையும்போது அங்கு முட்டை இருக்குமாயின் அதனுடன் கலக்க முயலும்.,10
ஆப்பரேஷனுக்கு_அஞ்சவேண்டாம்,ஏதேனும் ஒரு விந்துயிர் முட்டையுடன் கலந்துவிடுமாயின் அதுவே கருவாகும்.,7
ஆப்பரேஷனுக்கு_அஞ்சவேண்டாம்,உடனே மற்ற உயிர்கள் இறந்துபோகும்.,4
ஆப்பரேஷனுக்கு_அஞ்சவேண்டாம்,கருவானது கருப்பப் பைக்கு வந்து தங்கி வளர்ந்து பத்து மாதங்கள் சென்றதும் குழந்தையாகப் பிறக்கும்.,11
ஆப்பரேஷனுக்கு_அஞ்சவேண்டாம்,"ஆகவே குழந்தை உண்டாவதற்கு, கருப்பம் தரிப்ப ﻿தற்கு இரண்டு காரியங்கள் நடைபெறவேண்டும்.",9
ஆப்பரேஷனுக்கு_அஞ்சவேண்டாம்,"கோசத்தின் வழியாகக் குய்யத்துள் பாயும் விந்து, நீரில் விந்துயிர்கள் இருத்தல் வேண்டும்.",9
ஆப்பரேஷனுக்கு_அஞ்சவேண்டாம்,சினைப் பையிலிருந்து முட்டை சினைக் குழாய்க்கு வந்து சேர வேண்டும்.,8
ஆப்பரேஷனுக்கு_அஞ்சவேண்டாம்,இந்த இரண்டு காரியங்களும் நிகழ்ந்தால்தான் விந்துயிர் முட்டையுடன் கலந்து கரு உண்டாகும்.,9
ஆப்பரேஷனுக்கு_அஞ்சவேண்டாம்,ஆதலால் கரு உண்டாகாதிருக்க வேண்டுமாயின் ஒன்று.,5
ஆப்பரேஷனுக்கு_அஞ்சவேண்டாம்,விந்துயிர் குய்யத்துள் வந்து சேராதபடி தடுத்துவிடவேண்டும்.,5
ஆப்பரேஷனுக்கு_அஞ்சவேண்டாம்,"முட்டை, சினைப் பையிலிருந்து சினைக் குழாய்க்கு வந்து சேராதபடி தடுத்துவிட வேண்டும்.",9
ஆப்பரேஷனுக்கு_அஞ்சவேண்டாம்,இந்த ஆப்பரேஷனை விந்துக் குழாய் வெட்டல் என்று கூறுவார்கள்.,7
ஆப்பரேஷனுக்கு_அஞ்சவேண்டாம்,இந்த ஆப்பரேஷன் செய்தால் விதையில் உற்பத்தியாகும் விந்துயிர்கள் விந்துப் பைக்குச் செல்ல முடியாது.,10
ஆப்பரேஷனுக்கு_அஞ்சவேண்டாம்,அதனால் அவை குய்யத்துக்குள் வந்து சேர வழியில்லை.,6
ஆப்பரேஷனுக்கு_அஞ்சவேண்டாம்,விந்துயிர் குய்யத்துள் வராவிட்டால் கருப்பம் எப்படித் தரிக்க முடியும்?,7
ஆப்பரேஷனுக்கு_அஞ்சவேண்டாம்,﻿ இதில் சினைக் குழாய் வெட்டியது தெரிகிறது.,6
ஆப்பரேஷனுக்கு_அஞ்சவேண்டாம்,அதனால் முட்டை சினைக் குழாய்க்கு வராது.,5
ஆப்பரேஷனுக்கு_அஞ்சவேண்டாம்,விந்துயிர்கள் மட்டும் வந்து பயனில்லை.,4
ஆப்பரேஷனுக்கு_அஞ்சவேண்டாம்,இந்த ஆப்பரேஷனைச் சினைக் குழாய் வெட்டல் என்று கூறுவார்கள்.,7
ஆப்பரேஷனுக்கு_அஞ்சவேண்டாம்,"இந்த இரண்டு ஆப்பரேஷன்களில் எதைச் செய்து கொண்டாலும் கருப்பம் உண்டாகாது, குழந்தை பிறக்காது.",10
ஆப்பரேஷனுக்கு_அஞ்சவேண்டாம்,"ஆனால் சிலர் என்னிடம் இரண்டு ஆப்பரேஷன் கள் கூறுகிறீர்களே, அவற்றுள் எந்த ஆப்பரேஷன் நல்லது என்று கேட்கிறார்கள்.",13
ஆப்பரேஷனுக்கு_அஞ்சவேண்டாம்,"எந்த ஆப்பரேஷனைச் செய்வதிலும் கஷ்டமில்லை, அபாயமுமில்லை, எதைச் செய்தாலும் குழந்தை பிறக்காது.",9
ஆப்பரேஷனுக்கு_அஞ்சவேண்டாம்,ஆதலால் இரண்டு ஆப்பரேஷன்களும் நல்லவைகளே.,4
ஆப்பரேஷனுக்கு_அஞ்சவேண்டாம்,﻿ஆயினும் எதைச் சிபார்சு செய்கிறீர்கள் என்று கேட்டால் நான் கணவன் செய்யும் ஆப்பரேஷனையே சிபார்சு செய்வேன்.,12
ஆப்பரேஷனுக்கு_அஞ்சவேண்டாம்,அதற்குரிய காரணங்கள் இவை ஒன்று.,4
ஆப்பரேஷனுக்கு_அஞ்சவேண்டாம்,கணவன் எந்த நேரத்திலும் செய்துகொள்ளலாம்.,4
ஆப்பரேஷனுக்கு_அஞ்சவேண்டாம்,மனைவி குழந்தை பெற்று மூன்றாவது நாளே செய்யலாம்.,6
ஆப்பரேஷனுக்கு_அஞ்சவேண்டாம்,மற்ற வேளைகளில் செய்வதானால் வயிற்றைக் கீறியே செய்யவேண்டும்.,6
ஆப்பரேஷனுக்கு_அஞ்சவேண்டாம்,அதையும் அபாயமில்லாமலே டாக்டர்கள் செய்கிறார்கள்.,4
ஆப்பரேஷனுக்கு_அஞ்சவேண்டாம்,"ஆயினும் அது அவசியமில்லை, குழந்தை பெற்றவுடன் செய்வதே நல்லது.",7
ஆப்பரேஷனுக்கு_அஞ்சவேண்டாம்,அப்போது வயிற்றைக் கீறவேண்டாம்.,3
ஆப்பரேஷனுக்கு_அஞ்சவேண்டாம்,"குய்யம், கருப்பப் பை முதலியவை குழந்தை வெளிவரக் கூடிய அளவு விரிந்திருக்குமாதலால் அதன் வழியாகவே ஆப்பரேஷனை எளிதில் செய்துவிடுவார்கள்.",14
ஆப்பரேஷனுக்கு_அஞ்சவேண்டாம்,கணவனுக்குச் செய்யும் ஆப்பரேஷன் வயிற்றுக்கு வெளியே நடப்பது.,6
ஆப்பரேஷனுக்கு_அஞ்சவேண்டாம்,ஆனால் மனைவிக்குச் செய்யும் ஆப்பரேஷன் வயிற்றினுள்ளே நடப்பது.,6
ஆப்பரேஷனுக்கு_அஞ்சவேண்டாம்,அதனால் கணவன் ஆப்பரேஷன் மனைவி ஆப்பரேஷனை விட எளிது.,7
ஆப்பரேஷனுக்கு_அஞ்சவேண்டாம்,ஆதலால் கணவன் வைத்தியசாலையில் படுத்திருக்க வேண்டியதில்லை.,5
ஆப்பரேஷனுக்கு_அஞ்சவேண்டாம்,ஆப்பரேஷன் முடிந்ததும் வீட்டுக்கு வந்துவிடலாம்.,4
ஆப்பரேஷனுக்கு_அஞ்சவேண்டாம்,வீட்டிலும் நாலைந்து நாள் அதிகமாக நடக்காமலிருந்தால் போதும்.,6
ஆப்பரேஷனுக்கு_அஞ்சவேண்டாம்,ஆகவே இரண்டு மூன்று குழந்தைகள் உடைய தந்தை மார்களே !,7
ஆப்பரேஷனுக்கு_அஞ்சவேண்டாம்,எவ்விதத் தயக்கமுமின்றி ஆப்பரேஷன் செய்துகொள்ளுங்கள்.,4
ஆப்பரேஷனுக்கு_அஞ்சவேண்டாம்,தமிழ்நாட்டிலுள்ள அரசாங்க வைத்தியசாலைகளிலெல்லாம் இலவசமாகவும் மிகுந்த கவனமாகவும் ஆப்பரேஷன் செய்கிறார்கள்.,8
ஆப்பரேஷனுக்கு_அஞ்சவேண்டாம்,ஆப்பரேஷனைச் செய்து உங்களுக்கும் உங்கள் மனைவி ﻿மார்க்கும் உங்கள் குழந்தைகளுக்கும் நலம் தேடுமாறு வேண்டிக்கொள்கிறேன்.,11
ஆப்பரேஷனுக்கு_அஞ்சவேண்டாம்,"ஆகவே, மூன்று குழந்தைகள் போதும் என்று முடிவு செய்து கொள்ளுகிறவர்கள் இந்த ஆப்பரேஷனை இம்மியும் அச்சமின்றிக் செய்து கொள்ளலாம்.",14
ஆப்பரேஷனுக்கு_அஞ்சவேண்டாம்,"செய்து, கொண்டால் நன்மையே அடைவார்கள்.",4
ஆப்பரேஷனுக்கு_அஞ்சவேண்டாம்,ஏற்கனவே இரண்டு குழந்தைகள் இருந்தால் தாய் அடுத்த குழந்தையை மருத்துவச்சாலையில் பிரசவிக்க வேண்டும்.,10
ஆப்பரேஷனுக்கு_அஞ்சவேண்டாம்,மருத்துவசாலைக்குச் சென்றதும் மருத்துவரிடம் ஆப்பரேஷன் செய்யவேண்டும் என்று சொல்லவேண்டும்.,7
ஆப்பரேஷனுக்கு_அஞ்சவேண்டாம்,மருத்துவர் குழந்தை பிறந்த மறு நாள் ஆப்பரேஷனை மிக எளிதாக எவ்விதக் கஷ்டமும் இல்லாமல் செய்துவிடுவார்.,12
ஆப்பரேஷனுக்கு_அஞ்சவேண்டாம்,எத்தனை நாள் அங்கே இருக்கவேண்டுமோ அத்தனை நாள் இருந்தால் போதும்.,8
ஆப்பரேஷனுக்கு_அஞ்சவேண்டாம்,அதிகநாள் இருக்க வேண்டியதில்லை.,3
ஆப்பரேஷனுக்கு_அஞ்சவேண்டாம்,அரசாங்க மருத்துவ இல்லங்களில் இலவசமாக ஆப்பரேஷனும் செய்வார்கள்.,6
ஆப்பரேஷனுக்கு_அஞ்சவேண்டாம்,﻿ஆப்பரேஷன் செய்தபின் முப்பது ரூபாயும் தருவார்கள்.,5
ஆப்பரேஷனுக்கு_அஞ்சவேண்டாம்,ஆப்பரேஷன் செய்தபின் தந்தை மருத்துவ இல்லத்தில் படுத்திருக்க வேண்டியதில்லை.,7
ஆப்பரேஷனுக்கு_அஞ்சவேண்டாம்,அதிகமாக நடக்காமல் ஒருவாரம் ஓய்வாக இருந்தால் போதும்.,6
ஆப்பரேஷனுக்கு_அஞ்சவேண்டாம்,அதற்கேற்ப ஆப்பரேஷன் செய்து கொள்ளுங்கள்.,4
ஆப்பரேஷனுக்கு_அஞ்சவேண்டாம்,இந்திய மக்கள் சுதந்திரமாக வாழ விரும்புவது போலவே சுகமாக வாழவும் விரும்புகிறார்கள்.,9
ஆப்பரேஷனுக்கு_அஞ்சவேண்டாம்,அதற்கு வறுமை ஒழிய வேண்டும் வருமானம் பெருக வேண்டும்.,7
ஆப்பரேஷனுக்கு_அஞ்சவேண்டாம்,அவ்வாறு செய்வதற்காக அரசாங்கத்தார் ஐந்தாண்டுத் திட்டங்கள் வகுத்து அரும்பாடுபட்டு வருகிறார்கள்.,8
ஆப்பரேஷனுக்கு_அஞ்சவேண்டாம்,ஆயினும் அவற்றால் நன்மையை உடனே பெற்று விடமுடியாது.,6
ஆப்பரேஷனுக்கு_அஞ்சவேண்டாம்,பல ஆண்டுகள் செல்லும்.,3
ஆப்பரேஷனுக்கு_அஞ்சவேண்டாம்,அதுவரை ஒவ்வொருவரும் தம்முடைய சக்திக்கும் சமய சந்தர்ப்பங்களுக்கும் ஏற்றவாறு ஒரு குறிப்பிட்ட அளவு வருமானமே தேட முடியும்.,13
ஆப்பரேஷனுக்கு_அஞ்சவேண்டாம்,அவ்வாறு வகுத்து வாழ்க்கையைச் சுகமாக நடத்த விரும்புகிறவர்கள் மூன்று காரியங்கள் செய்ய வேண்டும்.,10
ஆப்பரேஷனுக்கு_அஞ்சவேண்டாம்,﻿முதலாவதாக மூன்று குழந்தைகள் போதும் என்று முடிவு செய்து கொள்ள வேண்டும்.,9
ஆப்பரேஷனுக்கு_அஞ்சவேண்டாம்,கூடிய நன்மைகள் பல.,3
