work_title,sentence,sentence_length
ஆல்பர்ட்_ஐன்ஸ்டைனின்_நம்மை_மேம்படுத்தும்_எண்ணங்கள்,ஒரு பொருளின் பொருண்மை நிலையானது மாறாதது இவை பழங்கால பெளதிக விதிமுறைகளாகும்.,9
ஆல்பர்ட்_ஐன்ஸ்டைனின்_நம்மை_மேம்படுத்தும்_எண்ணங்கள்,"ஆனால், ஐன்ஸ்டைனுடிைய சார்பு நிலைக் கொள்கை ஆய்வின்படி இந்தக் கருத்துகள் தவறானவையாகும்.",9
ஆல்பர்ட்_ஐன்ஸ்டைனின்_நம்மை_மேம்படுத்தும்_எண்ணங்கள்,இயங்கும் ஒரு பொருளின் பொருண்மை நிலையானது அல்ல.,6
ஆல்பர்ட்_ஐன்ஸ்டைனின்_நம்மை_மேம்படுத்தும்_எண்ணங்கள்,அது வேகத்திற்கு ஏற்றபடி மாறும் தன்மை பெற்றது என்பதுதான் ஐன்ஸ்டைன் ஆய்வில் கண்ட விதியாகும்.,11
ஆல்பர்ட்_ஐன்ஸ்டைனின்_நம்மை_மேம்படுத்தும்_எண்ணங்கள்,"இவ்வாறு ஒரு பொருளின் பொருண்மை வேறுபாடு, ஓர் உரிய முறையில் செயல்படுகின்றது.",9
ஆல்பர்ட்_ஐன்ஸ்டைனின்_நம்மை_மேம்படுத்தும்_எண்ணங்கள்,"எனவே, பொருண்மையும் சார்புடையதே.",3
ஆல்பர்ட்_ஐன்ஸ்டைனின்_நம்மை_மேம்படுத்தும்_எண்ணங்கள்,இந்த பொருண்மைச் சார்பு தத்துவத்தின் அடிப்படையில் ஐன்ஸ்டைன் அதை ஆராய்ந்தபோது ஓர் உண்மை புலப்பட்டது.,11
ஆல்பர்ட்_ஐன்ஸ்டைனின்_நம்மை_மேம்படுத்தும்_எண்ணங்கள்,பொருட்களின் வேகம் என்பதும் ஓர் ஆற்றல்தான்.,5
ஆல்பர்ட்_ஐன்ஸ்டைனின்_நம்மை_மேம்படுத்தும்_எண்ணங்கள்,வேகம் அதிகரிப்பதால் பொருண்மையும் வேகம் பெருகி அதிகரிக்கின்றது.,6
ஆல்பர்ட்_ஐன்ஸ்டைனின்_நம்மை_மேம்படுத்தும்_எண்ணங்கள்,இதுதான் உண்மையான முடிவு என்று முடிவு கட்டுகிறார் ஐன்ஸ்டைன்.,7
ஆல்பர்ட்_ஐன்ஸ்டைனின்_நம்மை_மேம்படுத்தும்_எண்ணங்கள்,"அதாவது, வேகத்தின் வளர்ச்சியால் உருவாகும் பொருண்மை வளர்ச்சி உண்மையில் ஆற்றல் வளர்ச்சியே ஆகும்.",10
ஆல்பர்ட்_ஐன்ஸ்டைனின்_நம்மை_மேம்படுத்தும்_எண்ணங்கள்,ஆற்றலுக்கும் பொருண்மை உண்டு.,3
ஆல்பர்ட்_ஐன்ஸ்டைனின்_நம்மை_மேம்படுத்தும்_எண்ணங்கள்,"அணுத்துகள்கள் சிதைவுறுகின்றபோது, உண்டாகும் பொருண்மைக் குறைவு, அளவுக்கு அதிகமான ஆற்றல் சக்திகளாக மாறுகிறது என்று விஞ்ஞானிகள் ஆராய்ந்துள்ளார்கள்.",13
ஆல்பர்ட்_ஐன்ஸ்டைனின்_நம்மை_மேம்படுத்தும்_எண்ணங்கள்,இந்த செயல்களால் அதிகமான ஆற்றல்கள் வெளிப்படுகின்றன.,5
ஆல்பர்ட்_ஐன்ஸ்டைனின்_நம்மை_மேம்படுத்தும்_எண்ணங்கள்,"அதனால், அணுச்சிதைவுகள் தொடர்ந்து நடைபெறுகின்றது.",4
ஆல்பர்ட்_ஐன்ஸ்டைனின்_நம்மை_மேம்படுத்தும்_எண்ணங்கள்,அந்த சக்திகளுக்கு உகந்தவாறு அதன் ஆற்றலும் வெளிப்படுகிறது.,6
ஆல்பர்ட்_ஐன்ஸ்டைனின்_நம்மை_மேம்படுத்தும்_எண்ணங்கள்,அணுசக்தி உற்பத்தியில் அதிகமாக உற்பத்தியாவது யூரேனியம் போன்ற பொருட்களேயாகும்.,7
ஆல்பர்ட்_ஐன்ஸ்டைனின்_நம்மை_மேம்படுத்தும்_எண்ணங்கள்,"இதனால், சக்தியே பொருள், பொருளே சக்தி என்ற உண்மையை ஐன்ஸ்டைன் ஆராய்ச்சியால் உலகு உணர்ந்துள்ளது.",11
ஆல்பர்ட்_ஐன்ஸ்டைனின்_நம்மை_மேம்படுத்தும்_எண்ணங்கள்,"அணுசக்தி, அணுகுண்டாக மாறி, அண்டத்தில் அழிவுச்சக்திகளையே அதிகமாக உருவாக்கியதை அதை வெடித்ததால் உலகம் கண்டது.",11
ஆல்பர்ட்_ஐன்ஸ்டைனின்_நம்மை_மேம்படுத்தும்_எண்ணங்கள்,"ஆனால், அழிவுச்சக்திக்கு மட்டும்தான் அணுகுண்டு பயன்படும் என்ற உண்மையையும் தகர்த்தெறிந்தது விஞ்ஞான உலகம்.",10
ஆல்பர்ட்_ஐன்ஸ்டைனின்_நம்மை_மேம்படுத்தும்_எண்ணங்கள்,"அணுசக்தியை எந்த அளவுக்கு அதிகமாக மருத்துவ உலகம் பயன்படுத்த முடியுமோ, அந்த அளவுக்கு அதைப் பயன்படுத்திக் கொண்டு வருகிறது.",14
ஆல்பர்ட்_ஐன்ஸ்டைனின்_நம்மை_மேம்படுத்தும்_எண்ணங்கள்,"அதுபோலவே, பெளதிகத்துறையும் அணுச்சக்தியைப் பயன்படுத்திக் கொண்டு வருவதையும் பார்க்கின்றோம்.",7
ஆல்பர்ட்_ஐன்ஸ்டைனின்_நம்மை_மேம்படுத்தும்_எண்ணங்கள்,"இவை மட்டுமல்ல, அணுசக்தியை மின்சார உற்பத்திக்கும் பயன்படுத்தும் ஆய்வுகள் வெற்றி பெற்றுள்ளன.",9
ஆல்பர்ட்_ஐன்ஸ்டைனின்_நம்மை_மேம்படுத்தும்_எண்ணங்கள்,"இதனால், சக்தியே பொருள், பொருளே சக்தி என்ற மகத்தான் ஆற்றலையும் நமக்கு தெளிவுறுத்துகின்றது.",10
ஆல்பர்ட்_ஐன்ஸ்டைனின்_நம்மை_மேம்படுத்தும்_எண்ணங்கள்,"எனவே, ஐன்ஸ்டைனின் ஆய்வால் நமக்குக் கிடைத்த சார்புநிலைக் கொள்கை, மக்களுக்கு கிடைத்த மகத்தான் ஒரு அணுசக்தியாகும்.",12
ஆல்பர்ட்_ஐன்ஸ்டைனின்_நம்மை_மேம்படுத்தும்_எண்ணங்கள்,அந்த சக்தி நமக்கு விளைவித்து வரும் பயன்பாடுகளுக்குரிய ஈடுபாடுகளுக்கு நிகரே இல்லை என்று கூறலாம்.,11
ஆல்பர்ட்_ஐன்ஸ்டைனின்_நம்மை_மேம்படுத்தும்_எண்ணங்கள்,ஒளியிலிருந்து உருவான விளைவுகள் ஏராளம் ஏராளமாகும்.,5
ஆல்பர்ட்_ஐன்ஸ்டைனின்_நம்மை_மேம்படுத்தும்_எண்ணங்கள்,"ஒளியானது, உலோகத்தகடு ஒன்றின் மீது மோதும்போது.",5
ஆல்பர்ட்_ஐன்ஸ்டைனின்_நம்மை_மேம்படுத்தும்_எண்ணங்கள்,எலக்ட்ரான்கள் என்று சொல்லப்படுகின்ற மின் அணுக்கள் வெளி வருகின்றன.,7
ஆல்பர்ட்_ஐன்ஸ்டைனின்_நம்மை_மேம்படுத்தும்_எண்ணங்கள்,"இந்த ஒளிமின் விளைவுக்குரிய அறிவியல் சூத்திரம், விதி என்ன?",7
ஆல்பர்ட்_ஐன்ஸ்டைனின்_நம்மை_மேம்படுத்தும்_எண்ணங்கள்,என்பது தான் அந்த விதி.,4
ஆல்பர்ட்_ஐன்ஸ்டைனின்_நம்மை_மேம்படுத்தும்_எண்ணங்கள்,இதை உருவாக்கியவர் ஆல்பர்ட் ஐன்ஸ்டைனாவார்.,4
ஆல்பர்ட்_ஐன்ஸ்டைனின்_நம்மை_மேம்படுத்தும்_எண்ணங்கள்,ஒளிக்கிரணம் உலோகத் தகடுகளின்மீது மோதும் போது மின்னணுக்கள் வெளி வருகின்றன என்பதுதான் ஒளிமின் விளைவு என்று பார்த்தோம்.,13
ஆல்பர்ட்_ஐன்ஸ்டைனின்_நம்மை_மேம்படுத்தும்_எண்ணங்கள்,"எனவே, சக்தி வாய்ந்த துகள்கள், உலோகத் தகடுகளின் மேல் மோதுவதால், மின்னணுக்கள் தோற்றுவிக்கப் படுகின்றன.",11
ஆல்பர்ட்_ஐன்ஸ்டைனின்_நம்மை_மேம்படுத்தும்_எண்ணங்கள்,"இந்த செயல், பில்லியர்டு பந்துகளின் மோதலைப் போன்றது.",6
ஆல்பர்ட்_ஐன்ஸ்டைனின்_நம்மை_மேம்படுத்தும்_எண்ணங்கள்,"இத்தகைய அறிவியல் விதிகளின் விளக்கங்களால், ஐன்ஸ்டைன் ஒளி மின் விளைவுகளைக் கண்டுபிடித்தார்.",9
ஆல்பர்ட்_ஐன்ஸ்டைனின்_நம்மை_மேம்படுத்தும்_எண்ணங்கள்,"இந்த புதுமையான ஆராய்ச்சியை, விஞ்ஞானிகள் வரவேற்றார்கள்.",5
ஆல்பர்ட்_ஐன்ஸ்டைனின்_நம்மை_மேம்படுத்தும்_எண்ணங்கள்,இந்த கண்டுபிடிப்புக்குத் தான் நோபல் பரிசும் ஐன்ஸ்டைனுக்குக் கிடைத்தது.,7
ஆல்பர்ட்_ஐன்ஸ்டைனின்_நம்மை_மேம்படுத்தும்_எண்ணங்கள்,"இந்த ஒளிமின் விளைவு என்ற கண்டுபிடிப்பினால், உலகம் பெற்ற உயர்வு என்ன?",9
ஆல்பர்ட்_ஐன்ஸ்டைனின்_நம்மை_மேம்படுத்தும்_எண்ணங்கள்,"அது சரி, இந்த விளைவால் சினிமா பெற்ற புதுமை என்ன?",8
ஆல்பர்ட்_ஐன்ஸ்டைனின்_நம்மை_மேம்படுத்தும்_எண்ணங்கள்,ஒளி மின் விளைவு என்றால் என்ன என்பதை இதற்கு முன்பு இதே பகுதியில் விளக்கியுள்ளோம்.,11
ஆல்பர்ட்_ஐன்ஸ்டைனின்_நம்மை_மேம்படுத்தும்_எண்ணங்கள்,"இந்த மின்கலத்தால்தான், நாம் திரையரங்குகளிலே படம் பார்க்க உட்கார்ந்த உடனே, பாட்டுக்களையும் பேச்சுக்களையும் கேட்டு மகிழ்கின்றோம்.",12
ஆல்பர்ட்_ஐன்ஸ்டைனின்_நம்மை_மேம்படுத்தும்_எண்ணங்கள்,"இந்த ஒளிமின்கலம், ஒளிச் சக்தியை மின் சக்தியாக மாற்றுகின்றது.",7
ஆல்பர்ட்_ஐன்ஸ்டைனின்_நம்மை_மேம்படுத்தும்_எண்ணங்கள்,ஒரு விளக்கில் இருந்து வெளிவரும் ஒளி குவிக்கப்பட்டு அது ஃபிலிமில் ஒலி பதிக்கப்பட்டுள்ள பகுதி மீது விழுகின்றது.,13
ஆல்பர்ட்_ஐன்ஸ்டைனின்_நம்மை_மேம்படுத்தும்_எண்ணங்கள்,இதனால் தோன்றும் ஒளி மின்னூட்டம் மின் அதிர்ச்சிகளை எதிரொலிக்கின்றது.,7
ஆல்பர்ட்_ஐன்ஸ்டைனின்_நம்மை_மேம்படுத்தும்_எண்ணங்கள்,இந்த மின் அதிர்ச்சி மேலும் வலுவுள்ளதாகி ஒலி பெருக்கிக்கு செல்கிறது.,8
ஆல்பர்ட்_ஐன்ஸ்டைனின்_நம்மை_மேம்படுத்தும்_எண்ணங்கள்,ஒலி பெருக்கியில் மின் அதிர்ச்சியானது ஒலியாக உருவமடைகின்றது.,6
ஆல்பர்ட்_ஐன்ஸ்டைனின்_நம்மை_மேம்படுத்தும்_எண்ணங்கள்,இந்த கொள்கையை ஆல்பர்ட் ஐன்ஸ்டைன் ஓர் ஆயிரத்து தொள்ளாயிரத்து இருபத்தொன்பது ம் ஆண்டில் கண்டுபிடித்து வெளியிட்டார்.,12
ஆல்பர்ட்_ஐன்ஸ்டைனின்_நம்மை_மேம்படுத்தும்_எண்ணங்கள்,ஒன்றிய புலக் கொள்கை என்றால் என்ன?,5
ஆல்பர்ட்_ஐன்ஸ்டைனின்_நம்மை_மேம்படுத்தும்_எண்ணங்கள்,அதை ஐன்ஸ்டைன் எவ்வாறு விளக்குகிறார் என்பதைப் பார்ப்போம்.,6
ஆல்பர்ட்_ஐன்ஸ்டைனின்_நம்மை_மேம்படுத்தும்_எண்ணங்கள்,"பொருள், சக்தி ஆகிய இரண்டினுடைய, ஒவ்வொன்றையும் அறிவியல் விதிகளை உருவாக்கியே விளக்குகிறார்.",9
ஆல்பர்ட்_ஐன்ஸ்டைனின்_நம்மை_மேம்படுத்தும்_எண்ணங்கள்,"புவி ஈர்ப்பு விசையும், மின்காந்த விசையும் தனித்தனியானவையாக இருப்பது இயற்கைக்கு மாறானது.",9
ஆல்பர்ட்_ஐன்ஸ்டைனின்_நம்மை_மேம்படுத்தும்_எண்ணங்கள்,"இவை இரண்டும், ஒன்றுக்கொன்று தொடர்புடையனவாக இருக்க வேண்டும் என்று எண்ணியே ஐன்ஸ்டைன் இக்கொள்கையை ஆராய்ந்தார்.",11
ஆல்பர்ட்_ஐன்ஸ்டைனின்_நம்மை_மேம்படுத்தும்_எண்ணங்கள்,"இந்தக் கொள்கைகளை விளக்கி ஆல்பர்ட் ஐன்ஸ்டைன், கட்டுரை வடிவமாக எழுதினார்.",8
ஆல்பர்ட்_ஐன்ஸ்டைனின்_நம்மை_மேம்படுத்தும்_எண்ணங்கள்,அதை இக்கட்டுரை மூலமாகச் செய்து காட்டினார்.,5
ஆல்பர்ட்_ஐன்ஸ்டைனின்_நம்மை_மேம்படுத்தும்_எண்ணங்கள்,"இணை பிரிக்க முடியாத புவிஈர்ப்பு விசையையும், மின் காந்த விசையையும் விளக்கும் விதிகளையே, இக்கொள்கையில் ஐன்ஸ்டைன் விளக்கி இருக்கிறார்.",14
ஆல்பர்ட்_ஐன்ஸ்டைனின்_நம்மை_மேம்படுத்தும்_எண்ணங்கள்,"ஒன்றிய புலக் கொள்கை எனப்படும் இந்தக் கொள்கையைப் பற்றி, அவர் மூச்சுள்ளவரை சிந்தித்தார்.",10
ஆல்பர்ட்_ஐன்ஸ்டைனின்_நம்மை_மேம்படுத்தும்_எண்ணங்கள்,அதன் எல்லா விவரங்களையும் அக் கட்டுரையிலே அழகாக எழுதி வைத்த பின்பே அவர் காலத்தோடு ஒன்றி விட்டார்.,13
ஆல்பர்ட்_ஐன்ஸ்டைனின்_நம்மை_மேம்படுத்தும்_எண்ணங்கள்,இன்றும் அக்கட்டுரையைப் படிக்கும் விஞ்ஞானிகள் புருவத்தை மேலேற்றி வியந்தவாறே உள்ளார்கள்.,8
ஆல்பர்ட்_ஐன்ஸ்டைனின்_நம்மை_மேம்படுத்தும்_எண்ணங்கள்,அதாவது இன்றைய அறிவியல் தத்துவ ஞானத்தை நோக்கியே சென்று கொண்டிருக்கின்றது.,8
ஆல்பர்ட்_ஐன்ஸ்டைனின்_நம்மை_மேம்படுத்தும்_எண்ணங்கள்,மாமேதை ஐன்ஸ்டைனின் அறிவியல் உண்மைகள் தத்துவ ஞானம் என்ற அறிவுமுகட்டின் சிகரத்தை தொட்டுக் கொண்டிருக்கின்றன.,11
ஆல்பர்ட்_ஐன்ஸ்டைனின்_நம்மை_மேம்படுத்தும்_எண்ணங்கள்,அவர்களுள் ஒருவராக ஐன்ஸ்டைனும் சில நேரங்களிலே காணப்பட்டார்.,6
ஆல்பர்ட்_ஐன்ஸ்டைனின்_நம்மை_மேம்படுத்தும்_எண்ணங்கள்,"ஆனால், இவ்வாறு கூறப்பட்டவர்கள் கருத்து எவ்வளவு தவறானது என்பதை ஐன்ஸ்டைனே மறுக்கிறார் பாருங்கள்.",10
ஆல்பர்ட்_ஐன்ஸ்டைனின்_நம்மை_மேம்படுத்தும்_எண்ணங்கள்,"உலக மாயை உணரும் அனுபவம் ஒன்றுதான் வினோதமான, அழகு வாய்ந்த சிறப்பான உணர்ச்சியாகும்.",10
ஆல்பர்ட்_ஐன்ஸ்டைனின்_நம்மை_மேம்படுத்தும்_எண்ணங்கள்,உண்மையான அறிவியலின் கருவூலம் அந்த உணர்ச்சிதான்.,5
ஆல்பர்ட்_ஐன்ஸ்டைனின்_நம்மை_மேம்படுத்தும்_எண்ணங்கள்,உடலுறுப்புகளை சிலிர்க்க வைக்கும் இந்த உணர்ச்சி இல்லாத மனிதன் உயிரற்றவன்.,8
ஆல்பர்ட்_ஐன்ஸ்டைனின்_நம்மை_மேம்படுத்தும்_எண்ணங்கள்,"மனித அறிவுக்கு அப்பாற்பட்டதொரு சக்தியே இந்த உலகத்தின் அழகு வடிவமாகவும், அறிவுச் சிகரமாகவும் வியாபித்திருக்கிறது.",11
ஆல்பர்ட்_ஐன்ஸ்டைனின்_நம்மை_மேம்படுத்தும்_எண்ணங்கள்,"இந்த உணர்வு, இந்த அனுபவம், மனிதனுக்கு உருவாகுமானால், அதுவே அவனுடைய உண்மையான மதக்கொள்கையின் மையமாகும்.",11
ஆல்பர்ட்_ஐன்ஸ்டைனின்_நம்மை_மேம்படுத்தும்_எண்ணங்கள்,"வேறொரு சந்தர்ப்பத்தில் ஐன்ஸ்டைன் குறிப்பிடும் போது, உலகத்தில் மிகப்பெரிய மனிதசக்திக்கு அப்பாற்பட்ட சக்தியொன்று இருப்பதை உணரும் அனுபவம்தான்.",13
ஆல்பர்ட்_ஐன்ஸ்டைனின்_நம்மை_மேம்படுத்தும்_எண்ணங்கள்,"ஆனால், நாத்திகர் என்று கூறப்படும் ஐன்ஸ்டைன் இதுபோன்ற விருப்பு வெறுப்பு உணர்ச்சிகளுக்கு அடிமையானவர் அல்லர்.",11
ஆல்பர்ட்_ஐன்ஸ்டைனின்_நம்மை_மேம்படுத்தும்_எண்ணங்கள்,"ஆனால், இந்தக் கொள்கைக்கு ஐன்ஸ்டைன் ஒரு விதிவிலக்காக விளங்குகிறார்.",7
