work_title,sentence,sentence_length
ஆல்பர்ட்_ஐன்ஸ்டைனின்_நம்மை_மேம்படுத்தும்_எண்ணங்கள்,ஆல்பர்ட் ஐன்ஸ்டைனின் நம்மை மேம்படுத்தும் எண்ணங்கள் என்.,6
ஆல்பர்ட்_ஐன்ஸ்டைனின்_நம்மை_மேம்படுத்தும்_எண்ணங்கள்,ஆல்பர்ட் ஐன்ஸ்டைனின்﻿ நம்மை மேம்படுத்தும் எண்ணங்கள் புலவர் என்.,7
ஆல்பர்ட்_ஐன்ஸ்டைனின்_நம்மை_மேம்படுத்தும்_எண்ணங்கள்,"ஆல்பர்ட் ஐன்ஸ்டைனுக்கு முன்பு, மேடம் கியூரி தம்பதிகள், அணுவைப் பிளக்க முடியும் என்பதை முதன் முதலில் அவனிக்கு அறிவித்தார்கள்.",14
ஆல்பர்ட்_ஐன்ஸ்டைனின்_நம்மை_மேம்படுத்தும்_எண்ணங்கள்,என்பதை அறிந்து நம்மால் வியக்காமல் இருக்க முடிய வில்லை.,7
ஆல்பர்ட்_ஐன்ஸ்டைனின்_நம்மை_மேம்படுத்தும்_எண்ணங்கள்,என்ற மலராரம் மணந்து கொண்டிருப்பதை நாம் இன்றும் நுகரலாம்.,7
ஆல்பர்ட்_ஐன்ஸ்டைனின்_நம்மை_மேம்படுத்தும்_எண்ணங்கள்,கவி பாடுவதில் அவர் மன்னர் மன்னனாக விளங்கியவர்.,6
ஆல்பர்ட்_ஐன்ஸ்டைனின்_நம்மை_மேம்படுத்தும்_எண்ணங்கள்,அவர் எழுதிய இராம காதை யில் ஓர் பகுதி இரண்ய வதைப் படலம்.,10
ஆல்பர்ட்_ஐன்ஸ்டைனின்_நம்மை_மேம்படுத்தும்_எண்ணங்கள்,மாவீரன் இரண்யன் தனது மகன் பிரகலாதனைப் பார்த்து.,6
ஆல்பர்ட்_ஐன்ஸ்டைனின்_நம்மை_மேம்படுத்தும்_எண்ணங்கள்,"அதாவது, ஒரு சாண் அளவுள்ள இடத்திலும் கடவுளே இருக்கிறார், இங்கே நிற்கின்ற இந்தத் தூணிலும் கடவுள் உள்ளார்.",13
ஆல்பர்ட்_ஐன்ஸ்டைனின்_நம்மை_மேம்படுத்தும்_எண்ணங்கள்,அணு என்பதே சிறு துண் பொருள் !,5
ஆல்பர்ட்_ஐன்ஸ்டைனின்_நம்மை_மேம்படுத்தும்_எண்ணங்கள்,"கோன் என்று பெயர் வைத்தார் என்றால், கம்பர் பெருமானை நாம் எப்படிப் புகழ்வது?",10
ஆல்பர்ட்_ஐன்ஸ்டைனின்_நம்மை_மேம்படுத்தும்_எண்ணங்கள்,என்ன பரிசு கொடுப்பது?,3
ஆல்பர்ட்_ஐன்ஸ்டைனின்_நம்மை_மேம்படுத்தும்_எண்ணங்கள்,எவனுக்கு எந்த மன்னனுக்கு அந்த அறிவியல் உணர்வு இருந்தது?,7
ஆல்பர்ட்_ஐன்ஸ்டைனின்_நம்மை_மேம்படுத்தும்_எண்ணங்கள்,"என்று நாம் எண்ணும்போது, கம்பன் பிறந்த நாட்டிலே பிறந்த மண் பெருமைதான் நமக்கு மிகுதி இல்லையா?",12
ஆல்பர்ட்_ஐன்ஸ்டைனின்_நம்மை_மேம்படுத்தும்_எண்ணங்கள்,அணு வை ஆட்டம் என்பார்கள் ஆங்கிலத்தில் !,5
ஆல்பர்ட்_ஐன்ஸ்டைனின்_நம்மை_மேம்படுத்தும்_எண்ணங்கள்,"இந்த இரண்டு சொற்கள் மூலத்தை ஆராய்ந்தால், அணு என்ற பெயர்தான் ஆட்டம் என்று உருமாறியது என்பதை உணரலாம் !",13
ஆல்பர்ட்_ஐன்ஸ்டைனின்_நம்மை_மேம்படுத்தும்_எண்ணங்கள்,"ஆல்பர்ட் ஐன்ஸ்டைன், பத்தொன்பதாம் நூற்றாண்டில் தோன்றிய ஓர் அறிவியல் மேதை !",8
ஆல்பர்ட்_ஐன்ஸ்டைனின்_நம்மை_மேம்படுத்தும்_எண்ணங்கள்,அவருக்கு முன்பு வாழ்ந்த விஞ்ஞான வித்தகர்களின் ஆய்வுகளுக்கு எல்லாம் சிகரம் வைத்தார் போன்ற ஒரு தனிப்புரட்சியை உருவாக்கியவர்.,13
ஆல்பர்ட்_ஐன்ஸ்டைனின்_நம்மை_மேம்படுத்தும்_எண்ணங்கள்,"ஐன்ஸ்டைன் பிறப்பதற்கு முன்பிருந்த அறிவியலாளர்களும் அதிசயிக்கத்தக்க அறிவிற்கு, அறிவியல் துறைக்குப் பெருமை தேடித் தந்தவர் ஐன்ஸ்டைன்.",12
ஆல்பர்ட்_ஐன்ஸ்டைனின்_நம்மை_மேம்படுத்தும்_எண்ணங்கள்,விஞ்ஞானம் என்றால் என்ன?,3
ஆல்பர்ட்_ஐன்ஸ்டைனின்_நம்மை_மேம்படுத்தும்_எண்ணங்கள்,ஐன்ஸ்டைன் பிறந்த காலச் சூழ்நிலை !,4
ஆல்பர்ட்_ஐன்ஸ்டைனின்_நம்மை_மேம்படுத்தும்_எண்ணங்கள்,குறிப்பாக தெற்கு ஜெர்மன் நாடு உச்சகட்ட நாகரிக நாடாக இருந்தது எனலாம்.,9
ஆல்பர்ட்_ஐன்ஸ்டைனின்_நம்மை_மேம்படுத்தும்_எண்ணங்கள்,"தென் ஜெர்மன், புகழ்ச் செல்வர்கள் பலரைத் தோற்றுவித்த நாடு.",7
ஆல்பர்ட்_ஐன்ஸ்டைனின்_நம்மை_மேம்படுத்தும்_எண்ணங்கள்,"இங்கே மதப் பூசல் கிடையாது, மனித இன வேறுபாடுகள் கிடையா.",8
ஆல்பர்ட்_ஐன்ஸ்டைனின்_நம்மை_மேம்படுத்தும்_எண்ணங்கள்,"எங்கும் சமத்துவம், சகோதரத்துவம், ஆன்மீகத்துவம், செல்வத்துவம், ஒழுக்கத்துவம் ஒளி வீசி அமைதியான வாழ்க்கையிலே ஆனந்தமாக வாழ்த்துகொண்டிருக்கும் ஒருபகுதியாக விளங்கியது.",14
ஆல்பர்ட்_ஐன்ஸ்டைனின்_நம்மை_மேம்படுத்தும்_எண்ணங்கள்,வடக்கு ஜெர்மன் நாடு அப்படி அல்ல தெற்கு ஜெர்மனிக்கு நேர் விரோதமாக வாழ்ந்து வரும் நாடு.,12
ஆல்பர்ட்_ஐன்ஸ்டைனின்_நம்மை_மேம்படுத்தும்_எண்ணங்கள்,மண்ணாதிக்கம் செய்வது வடக்கு ஜெர்மன் மக்களுக்கு அளவற்ற மகிழ்ச்சியைத் தரும் சுபாவமாகும்.,9
ஆல்பர்ட்_ஐன்ஸ்டைனின்_நம்மை_மேம்படுத்தும்_எண்ணங்கள்,"இதனால் மற்ற நாடுகளையும், மிற இனத்தவர்களையும் வட ஜெர்மன் நாடு ஆதிக்கம் செலுத்தும் நாடாக மாறியது.",12
ஆல்பர்ட்_ஐன்ஸ்டைனின்_நம்மை_மேம்படுத்தும்_எண்ணங்கள்,பிரஷ்யர்கள் போர் வெறியர்கள்.,3
ஆல்பர்ட்_ஐன்ஸ்டைனின்_நம்மை_மேம்படுத்தும்_எண்ணங்கள்,அவர்கள் வட ஜெர்மனியை போர்வெறி நாடாக மாற்றுமளவுக்கு படைகளைப் பெருக்கி மற்ற நாடுகள் மீதும் படையெடுக்கலானார்கள்.,12
ஆல்பர்ட்_ஐன்ஸ்டைனின்_நம்மை_மேம்படுத்தும்_எண்ணங்கள்,தென் ஜெர்மனியை தங்கள் ஆதிக்கத்தில் கொண்டு வந்தார்கள்.,6
ஆல்பர்ட்_ஐன்ஸ்டைனின்_நம்மை_மேம்படுத்தும்_எண்ணங்கள்,இப்படிப்பட்ட மண்வெறி பூமிக்குத் தான் பிற்காலத்தில் போர் வெறியன் இட்லர் படைதளபதியானான்.,9
ஆல்பர்ட்_ஐன்ஸ்டைனின்_நம்மை_மேம்படுத்தும்_எண்ணங்கள்,உலகப் போர் மீண்டும் இரண்டாவது முறையாக உருவானது.,6
ஆல்பர்ட்_ஐன்ஸ்டைனின்_நம்மை_மேம்படுத்தும்_எண்ணங்கள்,"போர் வெறியன் இட்லர், ஜெர்மனி ஜெர்மனியருக்கே என்று உலக நாடுகள் முன்பு போர்முரசு அறைந்தான்.",11
ஆல்பர்ட்_ஐன்ஸ்டைனின்_நம்மை_மேம்படுத்தும்_எண்ணங்கள்,ஜெர்மனியிலே உள்ள யூதர்களை அடியோடு எதிர்த்தான் !,5
ஆல்பர்ட்_ஐன்ஸ்டைனின்_நம்மை_மேம்படுத்தும்_எண்ணங்கள்,எங்கு பார்த்தாலும் யூதர்கள் ஆதிக்கமும் செல்வாக்கும் வேரூன்றியுள்ளதை ஆணிவேரற அறுக்க நினைத்து யூத இனத்தைப் பூண்டோடு ஒழித்துக் கொல்வேன் !,14
ஆல்பர்ட்_ஐன்ஸ்டைனின்_நம்மை_மேம்படுத்தும்_எண்ணங்கள்,அதற்கான போர்க்களங்களைக் கண்டு போரிட்டு ஜெர்மனியின் சர்வாதிகாரியானான்.,6
ஆல்பர்ட்_ஐன்ஸ்டைனின்_நம்மை_மேம்படுத்தும்_எண்ணங்கள்,இந்த சம்பவங்களை எல்லாம் ஆல்பர்ட் ஐன்ஸ்டைன் கண்டார் !,6
ஆல்பர்ட்_ஐன்ஸ்டைனின்_நம்மை_மேம்படுத்தும்_எண்ணங்கள்,அப்போது அவருக்கு வயது ஐம்பது இருக்கக் கூடும்.,6
ஆல்பர்ட்_ஐன்ஸ்டைனின்_நம்மை_மேம்படுத்தும்_எண்ணங்கள்,ஓர் ஆயிரத்து எண்ணூற்று எழுபத்தொன்பது ஆம் ஆண்டு மார்ச் மாதம் பதினான்கு  ஆம் தேதியன்று பிறந்தார்.,12
ஆல்பர்ட்_ஐன்ஸ்டைனின்_நம்மை_மேம்படுத்தும்_எண்ணங்கள்,ஐன்ஸ்டைன் தந்தை பெயர் ஹெர்மன் ஐன்ஸ்டைன்.,5
ஆல்பர்ட்_ஐன்ஸ்டைனின்_நம்மை_மேம்படுத்தும்_எண்ணங்கள்,"தாய், பாலைன் ஐன்ஸ்டைன்.",3
ஆல்பர்ட்_ஐன்ஸ்டைனின்_நம்மை_மேம்படுத்தும்_எண்ணங்கள்,இருவரின் செல்வ மகனாய் பிறந்தார் ஆல்பர்ட் ஐன்ஸ்டைன்.,6
ஆல்பர்ட்_ஐன்ஸ்டைனின்_நம்மை_மேம்படுத்தும்_எண்ணங்கள்,"ஆல்பர்ட்டின் தந்தையாரான ஹெர்மன், அவரது உடன்பிறந்த தம்பியான ஜேக் என்பவரோடு இணைந்து மின்காந்தத் தொழிற்சாலை நடத்தி வந்தார்.",13
ஆல்பர்ட்_ஐன்ஸ்டைனின்_நம்மை_மேம்படுத்தும்_எண்ணங்கள்,"தனது மகனான ஆல்பர்ட்டை விருப்போடும், பொறுப்போடும், கருத்தோடும் வளர்த்துவந்தார்.",7
ஆல்பர்ட்_ஐன்ஸ்டைனின்_நம்மை_மேம்படுத்தும்_எண்ணங்கள்,அந்தச்சிறிய வயதிலேயே ஆல்பர்ட் மின்காந்தக் கருவிகளை எவ்லாம் ஊன்றிக் கவனித்து தந்தை தொழிலிலே ஊக்கம் செலுத்தி வந்தார்.,13
ஆல்பர்ட்_ஐன்ஸ்டைனின்_நம்மை_மேம்படுத்தும்_எண்ணங்கள்,ஆல்பர்ட் ஐன்ஸ்டைன் தாய் பாலைன் ஐன்ஸ்டைன் மகன் மீது அளப்பரிய அன்பு செலுத்திவந்தார்.,10
ஆல்பர்ட்_ஐன்ஸ்டைனின்_நம்மை_மேம்படுத்தும்_எண்ணங்கள்,அவர் நகைச்சுவையோடு மகனிடம் பேசி அடிக்கடி சிரிக்க வைக்கும் கலையுணர்வு உள்ளவர்.,9
ஆல்பர்ட்_ஐன்ஸ்டைனின்_நம்மை_மேம்படுத்தும்_எண்ணங்கள்,"இசைக் கலையில் ஈடுபாடு கொண்ட பாலைன் ஐன்ஸ்டைன், வயலின் கருவியை வாசிப்பதில் வல்லவர்.",10
ஆல்பர்ட்_ஐன்ஸ்டைனின்_நம்மை_மேம்படுத்தும்_எண்ணங்கள்,"அதனால், தனது மகனுக்கு இசை நுட்பங்களைக் கற்றுக் கொடுத்தார்.",7
ஆல்பர்ட்_ஐன்ஸ்டைனின்_நம்மை_மேம்படுத்தும்_எண்ணங்கள்,ஐன்ஸ்டைனுக்கு ஒரு தங்கை.,3
ஆல்பர்ட்_ஐன்ஸ்டைனின்_நம்மை_மேம்படுத்தும்_எண்ணங்கள்,அவள் பெயர் மேயா !,3
ஆல்பர்ட்_ஐன்ஸ்டைனின்_நம்மை_மேம்படுத்தும்_எண்ணங்கள்,தனது ஒரே தங்கையிடம் ஆல்பர்ட் அன்போடும் உண்ர்வோடும் பழகி வந்தார்.,8
ஆல்பர்ட்_ஐன்ஸ்டைனின்_நம்மை_மேம்படுத்தும்_எண்ணங்கள்,தங்கையைத் தனது உயிருக்குச் சமமாக எண்ணி அவர் இணைபிரியாமல் வளர்த்து வந்தார்.,9
ஆல்பர்ட்_ஐன்ஸ்டைனின்_நம்மை_மேம்படுத்தும்_எண்ணங்கள்,"ஆல்பர்ட் ஐன்ஸ்டைன், இளம் வயதில் திக்குவாயராக தெத்தித் தெத்திப் பேசும் சுபாவம் கொண்டவர்.",10
ஆல்பர்ட்_ஐன்ஸ்டைனின்_நம்மை_மேம்படுத்தும்_எண்ணங்கள்,"கொஞ்சம் மந்தமாக எல்லா விஷயங்களிலும் ஆல்பர்ட் நடந்து கொண்டாலும், அவரை யாரும் வெறுக்காமல் விருப்போடு தான் பழகுவார்கள்.",13
ஆல்பர்ட்_ஐன்ஸ்டைனின்_நம்மை_மேம்படுத்தும்_எண்ணங்கள்,"ஐன்ஸ்டைன் திக்குவாயராக இருந்தாலும், எந்த சொற்களை அவர் கூறினாலும் பொறுமையாக, பொறுப்பாக, சிதைவுற்றுச் சிதைவுற்று மெதுவாகத்தான் வெளிவரும்.",13
ஆல்பர்ட்_ஐன்ஸ்டைனின்_நம்மை_மேம்படுத்தும்_எண்ணங்கள்,"இவ்வாறு இவர் பேசுவது, ஆசிரியருக்கு கோபத்தை அடிக்கடி கிளறிவிடும்.",7
ஆல்பர்ட்_ஐன்ஸ்டைனின்_நம்மை_மேம்படுத்தும்_எண்ணங்கள்,"அதனால், அவர் அடிக்கடி ஆல்பர்ட் ஐன்ஸ்டைனை முட்டாள் முட்டாள் என்றே அழைப்பார்.",9
ஆல்பர்ட்_ஐன்ஸ்டைனின்_நம்மை_மேம்படுத்தும்_எண்ணங்கள்,"ஆனாலும், அவருக்குக் கோபம் என்பதே வராது.",5
ஆல்பர்ட்_ஐன்ஸ்டைனின்_நம்மை_மேம்படுத்தும்_எண்ணங்கள்,"காரணம், தனது திக்குவாய்த்தன்மை அவருக்கே நன்கு புரியும் அல்லவா?",7
ஆல்பர்ட்_ஐன்ஸ்டைனின்_நம்மை_மேம்படுத்தும்_எண்ணங்கள்,ஆல்பர்ட்டுக்கு ஆசிரியரிடம் இந்தக் கோபத்திலும் ஒரு நற்பெயர் உருவானது.,7
ஆல்பர்ட்_ஐன்ஸ்டைனின்_நம்மை_மேம்படுத்தும்_எண்ணங்கள்,"பொய் பேசாத, உண்மை உரைப்பவர் என்பதே அந்த நல்ல பெயராகும்.",8
ஆல்பர்ட்_ஐன்ஸ்டைனின்_நம்மை_மேம்படுத்தும்_எண்ணங்கள்,"ஆனாலும், ஆல்பர்ட்டுக்கு பள்ளிக்கூடம் என்பது ஒரு சிறைச்சாலையாகவே தென்பட்டது.",7
ஆல்பர்ட்_ஐன்ஸ்டைனின்_நம்மை_மேம்படுத்தும்_எண்ணங்கள்,"ஆனால், அடிக்கடி தனது தாயாரிடமும், தங்கையிடமும் அளவளாவியே காலம் கழிப்பார் !",8
ஆல்பர்ட்_ஐன்ஸ்டைனின்_நம்மை_மேம்படுத்தும்_எண்ணங்கள்,அதனால் பள்ளிபாரமே தெரியாது.,3
ஆல்பர்ட்_ஐன்ஸ்டைனின்_நம்மை_மேம்படுத்தும்_எண்ணங்கள்,"எந்தக் கேள்வியை ஆசிரியரிடம் ஆல்பர்ட் கேட்டாலும், ஏன்?",6
ஆல்பர்ட்_ஐன்ஸ்டைனின்_நம்மை_மேம்படுத்தும்_எண்ணங்கள்,எப்போது என்ற வினாக்களைத் தொடுக்கும் சாக்ரட்டீசியம் மாணவராகவே விளங்குவார்.,7
ஆல்பர்ட்_ஐன்ஸ்டைனின்_நம்மை_மேம்படுத்தும்_எண்ணங்கள்,"அதனாலும் ஆசிரியருக்கு ஆல்பர்ட் மீது கோபம் அடிக்கடி உருவாகி, முட்டாள், முட்டாள் என்றே வகுப்பு மாணவர்கள் மத்தியிலே அழைப்பார்.",14
ஆல்பர்ட்_ஐன்ஸ்டைனின்_நம்மை_மேம்படுத்தும்_எண்ணங்கள்,அப்போதும் அவருக்கு அருவருப்போ ஆத்திரமோ ஆவேசமோ வராது.,6
ஆல்பர்ட்_ஐன்ஸ்டைனின்_நம்மை_மேம்படுத்தும்_எண்ணங்கள்,எந்தப் பாடத்திலும் அவருக்கு முழுமையான அறிவு வராது.,6
ஆல்பர்ட்_ஐன்ஸ்டைனின்_நம்மை_மேம்படுத்தும்_எண்ணங்கள்,எதையெடுத்தாலும் அரை குறைதான் !,3
ஆல்பர்ட்_ஐன்ஸ்டைனின்_நம்மை_மேம்படுத்தும்_எண்ணங்கள்,"அதுவும் ஒரு காரணம், ஆல்பர்ட்டை ஆசிரியர் அடிக்கடி முட்டாள், முட்டாள் என்று அழைப்பதற்கு.",10
ஆல்பர்ட்_ஐன்ஸ்டைனின்_நம்மை_மேம்படுத்தும்_எண்ணங்கள்,"இவ்வாறு, வல்லாண்மைக்குக் காரணம், ஆல்பர்ட்டின் சிறிய தந்தையாரான ஜேக்கப்பும் ஒரு காரணமாகும்.",9
ஆல்பர்ட்_ஐன்ஸ்டைனின்_நம்மை_மேம்படுத்தும்_எண்ணங்கள்,"அல்ஜீப்ரா, ஜியோமிட்ரி கணக்கியல்களில் ஆல்பர்ட் அற்புதமாகப் போடும் வித்தகம் ஆசிரியருக்கும் வகுப்பு மாணவர்களுக்கும் ஓர் அதிசயமாக விளங்கியது.",13
ஆல்பர்ட்_ஐன்ஸ்டைனின்_நம்மை_மேம்படுத்தும்_எண்ணங்கள்,"ஆனால், புரிந்தவர்களுக்கு அது சுலபமானது.",4
