work_title,sentence,sentence_length
இளைஞர்களுக்கு_தந்தை_பெரியார்_வரலாறு,சுப்பிரமணிய அய்யர் இதை ஒப்புக் கொள்ளவில்லை.,5
இளைஞர்களுக்கு_தந்தை_பெரியார்_வரலாறு,காந்தியார் வந்து அறிவுரை சொல்லியும் அய்யர் கேட்கவில்லை.,6
இளைஞர்களுக்கு_தந்தை_பெரியார்_வரலாறு,பெரியார் இராமசாமி இதைக்கண்டித்தார்.,3
இளைஞர்களுக்கு_தந்தை_பெரியார்_வரலாறு,படிக்கும் பிள்ளைகளிடையே சாதி வேற்றுமை காட்டக் கூடாது என்று எடுத்துரைத்தார்.,8
இளைஞர்களுக்கு_தந்தை_பெரியார்_வரலாறு,குருகுலத்தில் சமபந்தி உணவு நடத்த வேண்டும் என்று ஒரு போராட்டமே.,8
இளைஞர்களுக்கு_தந்தை_பெரியார்_வரலாறு,இதனால் விழிப்படைந்த தமிழ்மக்கள் குருகுலத்தை வெறுத்தனர்.,5
இளைஞர்களுக்கு_தந்தை_பெரியார்_வரலாறு,நேர்மையற்ற எந்தச் செயலும் நிலைபெறாது.,4
இளைஞர்களுக்கு_தந்தை_பெரியார்_வரலாறு,என்பதற்கு இந்தக் குருகுலம் ஒரு எடுத்துக்காட்டாகும்.,5
இளைஞர்களுக்கு_தந்தை_பெரியார்_வரலாறு,குருகுலப் போராட்டத்தின் மூலம் தமிழ்மக்கள் ஒரு கருத்தைத் தெரிந்து கொண்டார்கள்.,8
இளைஞர்களுக்கு_தந்தை_பெரியார்_வரலாறு,பெரும்பாலான பார்ப்பனத் தலைவர்கள் சாதி ஒற்றுமையை விரும்புவதில்லை.,6
இளைஞர்களுக்கு_தந்தை_பெரியார்_வரலாறு,தாங்கள் என்றென்றைக்கும் உயர்ந்த சாதியாராகவே இருக்க வேண்டும்.,6
இளைஞர்களுக்கு_தந்தை_பெரியார்_வரலாறு,மற்ற சாதிக்காரர்கள் கீழானவர்களாகவே இருக்க வேண்டும் என்று அவர்கள் கருதுகிறார்கள்.,8
இளைஞர்களுக்கு_தந்தை_பெரியார்_வரலாறு,ஒவ்வொரு வகுப்பாரும் முன்னேற வேண்டும் என்ற கருத்தை அடிப்படையாக வைத்து அவர் தொண்டு புரிந்தார்.,11
இளைஞர்களுக்கு_தந்தை_பெரியார்_வரலாறு,தன்னாட்சிக் கொள்கை காந்தியாரின் கொள்கைகளில் நம்பிக்கை ﻿தத்தை பெரியார் வைத்து பெரியார் காங்கிரஸ் கட்சியில் சேர்ந்தார்.,12
இளைஞர்களுக்கு_தந்தை_பெரியார்_வரலாறு,காங்கிரஸ் கட்சியில் தலைமை இடங்களில் எல்லாம் பார்ப்பனர்களே இருந்தனர்.,7
இளைஞர்களுக்கு_தந்தை_பெரியார்_வரலாறு,பார்ப்பனர்கள் அதிகாரத்தை எதிர்த்த கட்சி ஒன்று இருந்தது.,6
இளைஞர்களுக்கு_தந்தை_பெரியார்_வரலாறு,"அது நீதிக் கட்சி, நீதிக் கட்சி மக்களுக்கு நன்மைகள் பலவற்றைச்செய்தாலும் வெள்ளையர்களுக்கு ஆதரவு கொடுத்துக் கொண்டிருந்தது.",12
இளைஞர்களுக்கு_தந்தை_பெரியார்_வரலாறு,அதன் தலைவர்களும் பெரிய செல்வர்களாக இருந்தனர்.,5
இளைஞர்களுக்கு_தந்தை_பெரியார்_வரலாறு,எனவே காங்கிரஸ் கட்சியைப்போல நீதிக் கட்சியை மக்கள் ஆதரிக்கவில்லை.,7
இளைஞர்களுக்கு_தந்தை_பெரியார்_வரலாறு,மக்கள் நன்மைக்காக பெரியார் தன்மான இயக்கத்தைத் தோற்றுவித்தார்.,6
இளைஞர்களுக்கு_தந்தை_பெரியார்_வரலாறு,தன்மான இயக்கம் அந்தக் காலத்தில் சுயமரியாதை இயக்கம் என்று அழைக்கப்பட்டது.,8
இளைஞர்களுக்கு_தந்தை_பெரியார்_வரலாறு,மக்களிடையே இருந்த வேற்றுமைகளை அடியோடு ஒழிக்கப் பாடுபட்டது.,6
இளைஞர்களுக்கு_தந்தை_பெரியார்_வரலாறு,"சாதி, மதம் ஆகியவை மக்களின் வாழ்க்கையைக் கெடுத்து விட்டதை ஏற்கனவே பல பெரியோர்கள் உணர்ந்திருந்தனர்.",11
இளைஞர்களுக்கு_தந்தை_பெரியார்_வரலாறு,ஏற்றத்தாழ்வு கூடாது என்பதை அவர்கள் வற்புறுத்தியுள்ளனர்.,5
இளைஞர்களுக்கு_தந்தை_பெரியார்_வரலாறு,ஆனால் பெரியார்தான் அவற்றின் அடிவேர் என்ன என்பதைக் கண்டுபிடித்தார்.,7
இளைஞர்களுக்கு_தந்தை_பெரியார்_வரலாறு,சாதிகளுக்கு ஆதாரமாய் இருப்பது மதம்.,4
இளைஞர்களுக்கு_தந்தை_பெரியார்_வரலாறு,மதத்திற்கு ஆதாரமாய் இருப்பவை வேதம் புராணம் சாத்திரம் ஆகியவை.,7
இளைஞர்களுக்கு_தந்தை_பெரியார்_வரலாறு,இவற்றிற்கெல்லாம் அடிப்படையாய் விளங்குவது கடவுள்.,4
இளைஞர்களுக்கு_தந்தை_பெரியார்_வரலாறு,கடவுளை அல்லது கடவுள் மீது உள்ள நம்பிக்கையை அகற்றிவிட்டால் மனிதனுக்குத் தெளிவு பிறந்துவிடும்.,10
இளைஞர்களுக்கு_தந்தை_பெரியார்_வரலாறு,இந்தக் கருத்தை அடிப்படையாகக் கொண்டு பெரியார் வேலை செய்தார்.,7
இளைஞர்களுக்கு_தந்தை_பெரியார்_வரலாறு,பெரியாருடைய கொள்கைகளை ஆதாரமாக வைத்து தன்மான இயக்கம் நடைபெற்றது.,7
இளைஞர்களுக்கு_தந்தை_பெரியார்_வரலாறு,நம்நாடு ஒரே நாடாக இருக்க வேண்டும்.,5
இளைஞர்களுக்கு_தந்தை_பெரியார்_வரலாறு,ஏற்கனவே பல அரசுகளாகப் பிரிந்திருந்தது.,4
இளைஞர்களுக்கு_தந்தை_பெரியார்_வரலாறு,சிறிய சிறிய அரசர்கள் சிறிய சிறிய பகுதிகளை ஆண்டு வந்தார்கள்.,8
இளைஞர்களுக்கு_தந்தை_பெரியார்_வரலாறு,அதனால் அயல்நாட்டிலிருந்து படையெடுத்து வந்தவர்கள் எளிதாக நாட்டைப் பிடிக்க முடிந்தது.,8
இளைஞர்களுக்கு_தந்தை_பெரியார்_வரலாறு,இந்தியாவின் மேல் பல அன்னியப் படையெடுப்புகள் நிகழ்ந்தன.,6
இளைஞர்களுக்கு_தந்தை_பெரியார்_வரலாறு,"அது தவிர, உள்நாட்டுக்குள்ளேயே அரசர்கள் ஒருவர் மீது ஒருவர் பகை கொண்டனர்.",9
இளைஞர்களுக்கு_தந்தை_பெரியார்_வரலாறு,தொடர்ந்து போராட்டங்கள் நடந்து கொண்டேயிருந்தன.,4
இளைஞர்களுக்கு_தந்தை_பெரியார்_வரலாறு,இதனால் மக்கள் வாழ்க்கை அமைதியற்றதாய் விளங்கியது.,5
இளைஞர்களுக்கு_தந்தை_பெரியார்_வரலாறு,கடைசியாகப் படையெடுத்து வந்த ஆங்கிலேயர்கள் எல்லா நாடுகளையும் சிறிதுசிறிதாகப் பிடித்து விட்டனர்.,9
இளைஞர்களுக்கு_தந்தை_பெரியார்_வரலாறு,அவர்களுக்கு அடங்கிக் கப்பம் கட்டிய சிற்றறசர்களை மட்டும் ஆட்சி செய்ய அனுமதித்தனர்.,9
இளைஞர்களுக்கு_தந்தை_பெரியார்_வரலாறு,மற்றபடி இந்தியா முழுவதையும் கைப்பற்றி ஒரே அரசாக ஆக்கி விட்டார்கள்.,8
இளைஞர்களுக்கு_தந்தை_பெரியார்_வரலாறு,எல்லா மக்களும் சமமாக நடத்தப்பட்டால் ஒரே நாடாக இருப்பது நல்லதுதான்.,8
இளைஞர்களுக்கு_தந்தை_பெரியார்_வரலாறு,"ஆனால் வடநாட்டில் இந்து மதத்தவர்களும், முஸ்லீம் மதத்தவர்களும் வேற்றுமையை வளர்த்துக் கொண்டனர்.",9
இளைஞர்களுக்கு_தந்தை_பெரியார்_வரலாறு,அதனால் ஒற்றுமையாக இருக்க முடியாது என்ற நிலைமை தோன்றியது.,7
இளைஞர்களுக்கு_தந்தை_பெரியார்_வரலாறு,பாகிஸ்தான் என்ற பெயரில் இந்தியா பிரிந்தது.,5
இளைஞர்களுக்கு_தந்தை_பெரியார்_வரலாறு,"வடநாட்டார் தென்நாட்டாரை இழிவாக நடத்தியதாலும், பொருளாதாரத்தில் வேற்றுமைப் படுத்தியதாலும், பெரியார் தனிநாடு கேட்டுப் போராடினார்.",11
இளைஞர்களுக்கு_தந்தை_பெரியார்_வரலாறு,இந்தப் போராட்டம் வெற்றி பெறவில்லை.,4
இளைஞர்களுக்கு_தந்தை_பெரியார்_வரலாறு,"நாடு விடுதலை அடைந்த பிறகும், மத்திய அரசு அதிகாரங்களையெல்லாம் தன் கையில் வைத்துக்கொண்டது.",10
இளைஞர்களுக்கு_தந்தை_பெரியார்_வரலாறு,மாநில அரசுகளுக்கு அதிகாரம் மிகக்குறைவாக உள்ளது.,5
இளைஞர்களுக்கு_தந்தை_பெரியார்_வரலாறு,அதிகாரத்தைச் சமமாக்க வேண்டும்.,3
இளைஞர்களுக்கு_தந்தை_பெரியார்_வரலாறு,அல்லது மாநிலங்கள் தங்களைத் தாங்களே ஆண்டு கொள்ளும் உரிமையைத் தரவேண்டும் என்று பெரியார் தொடர்ந்து போராடினார்.,12
இளைஞர்களுக்கு_தந்தை_பெரியார்_வரலாறு,அவருடைய போராட்டம் இதுவரை வெற்றி பெறவில்லை.,5
இளைஞர்களுக்கு_தந்தை_பெரியார்_வரலாறு,என்றாலும் விரைவில் மாநிலங்கள் தன்னாட்சி பெறும்.,5
இளைஞர்களுக்கு_தந்தை_பெரியார்_வரலாறு,பெரியாருடைய தன்னாட்சிக் கொள்கைக்காக இன்றைய தமிழ்மக்கள் போராடி வருகின்றார்கள்.,7
இளைஞர்களுக்கு_தந்தை_பெரியார்_வரலாறு,இந்தப் பணியை திராவிடர் கழகம் செய்து வருகின்றது.,6
இளைஞர்களுக்கு_தந்தை_பெரியார்_வரலாறு,அது இந்தி எதிர்ப்புப் போராட்டம்.,4
இளைஞர்களுக்கு_தந்தை_பெரியார்_வரலாறு,பெரியார் தலைமையில் தமிழ் மக்கள் யாவரும் ஒன்று கூடி இந்தியை எதிர்த்தார்கள்.,9
இளைஞர்களுக்கு_தந்தை_பெரியார்_வரலாறு,காங்கிரஸ் காரர்கள் இந்தியை இந்தியாவின் ஆட்சி மொழி ஆக்க வேண்டும் என்ற கொள்கையைக் கொண்டிருந்தார்கள்.,11
இளைஞர்களுக்கு_தந்தை_பெரியார்_வரலாறு,இதனால் மற்ற தாய்மொழிகள் வளர்ச்சி குறையும்.,5
இளைஞர்களுக்கு_தந்தை_பெரியார்_வரலாறு,அந்த மக்கள் பின் தங்கியவர்கள் ஆவார்கள்.,5
இளைஞர்களுக்கு_தந்தை_பெரியார்_வரலாறு,இதை காந்தியார் போன்றவர்கள் சிந்தித்துப் பார்க்கவில்லை.,5
இளைஞர்களுக்கு_தந்தை_பெரியார்_வரலாறு,திரு ராசகோபாலச்சாரியார் அவர்கள் சென்னை மாநிலத்தின் முதல்வராக இருந்தபோது.,7
இளைஞர்களுக்கு_தந்தை_பெரியார்_வரலாறு,இந்தியைக் கட்டாயம் எல்லாரும் படிக்க வேண்டும் என்ற சட்டம் கொண்டு வந்தார்.,9
இளைஞர்களுக்கு_தந்தை_பெரியார்_வரலாறு,"இதைத் தமிழ்நாட்டுத் தலைவர்கள், அறிஞர்கள் எதிர்த்து வந்தார்கள்.",6
இளைஞர்களுக்கு_தந்தை_பெரியார்_வரலாறு,திருச்சியில் பெரிய இந்தி எதிர்ப்பு மாநாடு நடைபெற்றது.,6
இளைஞர்களுக்கு_தந்தை_பெரியார்_வரலாறு,நாவலர் பாரதியார் தலைமையில் அந்த மாநாடு நடந்தது.,6
இளைஞர்களுக்கு_தந்தை_பெரியார்_வரலாறு,அந்த மாநாட்டில் பெரியார் தலைமையில் தமிழ்மக்கள் அனைவரும் ஒன்றாகி இந்தியை எதிர்ப்பது என்று முடிவு செய்யப் பட்டது.,13
இளைஞர்களுக்கு_தந்தை_பெரியார்_வரலாறு,பள்ளிக் கூடங்களின் முன் இந்தி எதிர்ப்புக் கிளர்ச்சி நடைபெற்றது.,7
இளைஞர்களுக்கு_தந்தை_பெரியார்_வரலாறு,அவர்களை வழியனுப்பி வைத்து பிறகு பெரியார் தாமும் சென்னைக்கு வந்து சேர்ந்தார்.,9
இளைஞர்களுக்கு_தந்தை_பெரியார்_வரலாறு,சென்னைக் கடற்கரையில் எழுபதினாயிரம் தமிழ் மக்கள் ஒன்று கூடினார்கள்.,7
இளைஞர்களுக்கு_தந்தை_பெரியார்_வரலாறு,"பல தலைவர்களும், பெரியாரும் இந்தியைப் புகுத்துவதைக் கண்டித்தும், அதனால் ஏற்படும் கேடுகளை விளக்கியும் பேசினார்கள்.",11
இளைஞர்களுக்கு_தந்தை_பெரியார்_வரலாறு,பெரியாருடைய பேச்சு தமிழ் இளைஞர்களை ஆவேசங்கொள்ளச் செய்தது.,6
இளைஞர்களுக்கு_தந்தை_பெரியார்_வரலாறு,இந்தியை எதிர்த்துப் போராடிய இளைஞர்கள் சிறையில் அடைக்கப்டிட்டார்கள்.,6
இளைஞர்களுக்கு_தந்தை_பெரியார்_வரலாறு,ஆயிரக்கணக்கான இளைஞர்கள் சிறிதும் அச்சம் கொள்ளாமல் சிறைப்பட்டார்கள்.,6
இளைஞர்களுக்கு_தந்தை_பெரியார்_வரலாறு,தாளமுத்து நடராசன் என்ற இரண்டு இளைஞர்கள் சிறையில் இறந்து போனார்கள்.,8
இளைஞர்களுக்கு_தந்தை_பெரியார்_வரலாறு,அதனால் இந்தி எதிர்ப்பு வேகம் கொண்டது.,5
இளைஞர்களுக்கு_தந்தை_பெரியார்_வரலாறு,தமிழ்நாட்டுப் பென்கள் மாநாடு ஒனறு சென்னையில் நடந்தது.,6
இளைஞர்களுக்கு_தந்தை_பெரியார்_வரலாறு,அதன் தலைவர் நீலாம்பிகை அம்மையார் அவர்கள் தமிழ்த்தலைவர் மறைமலையடிகளின் மகள் ஆவார்.,9
இளைஞர்களுக்கு_தந்தை_பெரியார்_வரலாறு,திருமதி நீலாம்பிகையார் தலைமையில் நடந்த பெண்கள் மாநாட்டில் இந்தியை எதிர்த்துத் தீர்மானம் நிறைவேற்றப்பட்டது.,10
இளைஞர்களுக்கு_தந்தை_பெரியார்_வரலாறு,அன்று முதல் எல்லோரும் பெரியாரைப் பெரியார் என்றே குறிப்பிட்டார்கள்.,7
இளைஞர்களுக்கு_தந்தை_பெரியார்_வரலாறு,தமிழ் மக்கள் இந்தியை எதிர்த்துப் போராடத் தூண்டியதற்காக பெரியாரை அரசாங்கம் சிறையில் அடைத்தது.,10
இளைஞர்களுக்கு_தந்தை_பெரியார்_வரலாறு,அந்த நேரத்தில் மற்ற தலைவர்கள் ஒன்று கூடி தமிழர் மாநாடு ஒன்றை நடத்தினார்கள்.,10
இளைஞர்களுக்கு_தந்தை_பெரியார்_வரலாறு,பெரியார் சிறையில் இருந்தமையால் மாநாட்டில் அவர் படம் ஒன்றை வைத்து அவர் தலைமையில் நிகழ்ச்சிகளை நடத்தினார்கள்.,12
இளைஞர்களுக்கு_தந்தை_பெரியார்_வரலாறு,பன்னிர்ச்செல்வம் அந்தக்காலத்தில் இருந்த மிகப்பெரிய தலைவர்களில் ஒருவர்.,6
இளைஞர்களுக்கு_தந்தை_பெரியார்_வரலாறு,அவர் மக்கள் தனக்குப் போடவந்த மாலைகளை வாங்கிப் பெரியார் படத்துக்கு அணிவித்தார்.,9
இளைஞர்களுக்கு_தந்தை_பெரியார்_வரலாறு,பெரியார்தான் நம் தலைவர் அவருடைய தலைமையில் நாம் போராடுவோம் !,7
இளைஞர்களுக்கு_தந்தை_பெரியார்_வரலாறு,சிறையில் இருந்த பெரியாருக்கு நோய் உண்டாயிற்று.,5
இளைஞர்களுக்கு_தந்தை_பெரியார்_வரலாறு,அதனால் அரசாங்கம் அவரை விடுதலை செய்தது.,5
இளைஞர்களுக்கு_தந்தை_பெரியார்_வரலாறு,ஒயாமல் உழைத்துக் கொண்டே இருந்தால் நோய் வராது.,6
இளைஞர்களுக்கு_தந்தை_பெரியார்_வரலாறு,உழைக்காவிட்டால்தான் நோய் உண்டாகும்.,3
