work_title,sentence,sentence_length
இளைஞர்களுக்கு_தந்தை_பெரியார்_வரலாறு,இளைஞர்களுக்கு தந்தை பெரியார் வரலாறு பாவலர் நாரா.,6
இளைஞர்களுக்கு_தந்தை_பெரியார்_வரலாறு,"பெரியார் சுயமரியாதை பிரச்சார நிறுவன வெளியீடு பெரியார் திடல், சென்னை அறுநூறு  ஏழு.",10
இளைஞர்களுக்கு_தந்தை_பெரியார்_வரலாறு,"சம்பத் சாலை, சென்னை அறுநூறு  ஏழு.",5
இளைஞர்களுக்கு_தந்தை_பெரியார்_வரலாறு,தந்தை பெரியார் ﻿முன்னுரை என் கண்மணிகளே !,5
இளைஞர்களுக்கு_தந்தை_பெரியார்_வரலாறு,இப்போது உங்களுக்கு ஒரு வரலாறு சொல்லப் போகிறேன்.,6
இளைஞர்களுக்கு_தந்தை_பெரியார்_வரலாறு,இது நம் பெரியாருடைய வரலாறு.,4
இளைஞர்களுக்கு_தந்தை_பெரியார்_வரலாறு,உங்கள் பாடப் புத்தகத்தில் பெரிய பெரிய தலைவர்களைப் பற்றி நீங்கள் படித்திருப்பீர்கள்.,9
இளைஞர்களுக்கு_தந்தை_பெரியார்_வரலாறு,நமது பெரியாருக்கும் மிகப் பெரிய வேறுபாடு உண்டு.,6
இளைஞர்களுக்கு_தந்தை_பெரியார்_வரலாறு,"தமிழ் மக்களின் தாழ்வுக்குக் காரணமாக இருந்தவை சாதிகளும், மதங்களுமே ஆகும்.",8
இளைஞர்களுக்கு_தந்தை_பெரியார்_வரலாறு,பல பெரியவர்கள் சாதி வேற்றுமை கூடாது என்றார்கள்.,6
இளைஞர்களுக்கு_தந்தை_பெரியார்_வரலாறு,மதவெறியைப் பல அறிஞர்கள் கண்டித்திருக்கிறார்கள்.,4
இளைஞர்களுக்கு_தந்தை_பெரியார்_வரலாறு,நமது பெரியார் இராமசாமியோ சாதிகளே கூடாது என்றார்.,6
இளைஞர்களுக்கு_தந்தை_பெரியார்_வரலாறு,மதங்களை ஒழிக்க வேண்டும்.,3
இளைஞர்களுக்கு_தந்தை_பெரியார்_வரலாறு,இவற்றிற்குக் காரணமான கடவுளை ஒழிக்க வேண்டும் என்றெல்லாம் கூறினார்.,7
இளைஞர்களுக்கு_தந்தை_பெரியார்_வரலாறு,இதுவரை இந்த மாதிரி துணிச்சலாகப் போராடியவர்கள் யாரும் இல்லை.,7
இளைஞர்களுக்கு_தந்தை_பெரியார்_வரலாறு,நமது பெரியார் இராமசாமி தான் இவ்வாறு புதுமையாகப் போராடினார்.,7
இளைஞர்களுக்கு_தந்தை_பெரியார்_வரலாறு,"அவர் வாழ்ந்த காலம் முழுவதும் இந்த நோக்கங்களுக்காகவும், தமிழ் மக்களின் நல் வாழ்வுக்காகவும் அயராமல் போராடினார்.",12
இளைஞர்களுக்கு_தந்தை_பெரியார்_வரலாறு,அவருடைய வரலாறு ஒரு வீர வரலாறு.,5
இளைஞர்களுக்கு_தந்தை_பெரியார்_வரலாறு,அவருடைய வரலாறு ஒர் அறிவு வரலாறு.,5
இளைஞர்களுக்கு_தந்தை_பெரியார்_வரலாறு,அவருடைய வரலாறு ஒர் எழுச்சி வரலாறு.,5
இளைஞர்களுக்கு_தந்தை_பெரியார்_வரலாறு,பெரியாரின் பெற்றோர் ஐந்து இரண்டு.,4
இளைஞர்களுக்கு_தந்தை_பெரியார்_வரலாறு,செல்லப் பாட்டி ஏழு மூன்று.,4
இளைஞர்களுக்கு_தந்தை_பெரியார்_வரலாறு,பெரியாரின் துணைவியார் பதிமூன்று  நான்கு.,4
இளைஞர்களுக்கு_தந்தை_பெரியார்_வரலாறு,பெரியார் சாமியார் ஆனார் பத்தொன்பது  ஐந்து.,5
இளைஞர்களுக்கு_தந்தை_பெரியார்_வரலாறு,பொது வாழ்க்கை முப்பது ஆறு.,4
இளைஞர்களுக்கு_தந்தை_பெரியார்_வரலாறு,வைக்கம் போராட்டம் முப்பத்து நான்கு ஏழு.,5
இளைஞர்களுக்கு_தந்தை_பெரியார்_வரலாறு,குருகுலப் போராட்டம் நாற்பது எட்டு.,4
இளைஞர்களுக்கு_தந்தை_பெரியார்_வரலாறு,தன்னாட்சிக் கொள்கை நாற்பத்திரண்டு ஒன்பது.,4
இளைஞர்களுக்கு_தந்தை_பெரியார்_வரலாறு,இந்தி எதிர்ப்புப் போராட்டம் நாற்பத்தைந்து பத்து.,5
இளைஞர்களுக்கு_தந்தை_பெரியார்_வரலாறு,வெளிநாடுகளில் பெரியார் நாற்பத்தொன்பது பதினொன்று .,4
இளைஞர்களுக்கு_தந்தை_பெரியார்_வரலாறு,மணியம்மையார் ஐம்பத்து நான்கு பனிரண்டு .,4
இளைஞர்களுக்கு_தந்தை_பெரியார்_வரலாறு,அவருடைய ஊர் ஈரோடு.,3
இளைஞர்களுக்கு_தந்தை_பெரியார்_வரலாறு,அவருடைய தந்தையார் பெயர் வெங்கட்டர்.,4
இளைஞர்களுக்கு_தந்தை_பெரியார்_வரலாறு,தாயார் பெயர் சின்னத் தாயம்மாள்.,4
இளைஞர்களுக்கு_தந்தை_பெரியார்_வரலாறு,சின்னத் தாயம்மாளை அவருடைய பெற்றோர்கள் அன்பாக முத்தம்மா என்று அழைப்பார்கள்.,8
இளைஞர்களுக்கு_தந்தை_பெரியார்_வரலாறு,வெங்கட்டர் ஏழைக் குடியில் பிறந்தார்.,4
இளைஞர்களுக்கு_தந்தை_பெரியார்_வரலாறு,அவர் இளம் வயதில் தந்தையை இழந்தார்.,5
இளைஞர்களுக்கு_தந்தை_பெரியார்_வரலாறு,தாயாரும் சிறிது காலம் சென்றதும் இறந்து போனார்.,6
இளைஞர்களுக்கு_தந்தை_பெரியார்_வரலாறு,அவருக்குப் பனிரெண்டு வயது நடக்கும் போதே கூலி வேலை செய்து பிழைத்தார்.,9
இளைஞர்களுக்கு_தந்தை_பெரியார்_வரலாறு,வெங்கட்டருக்கு பதினெட்டு  வயது ஆகும் போது திருமணம் நடந்தது.,7
இளைஞர்களுக்கு_தந்தை_பெரியார்_வரலாறு,சின்னத்தாயம்மாள் ஒரளவு வசதி படைத்த குடும்பத்தைச் சேர்ந்தவர்.,6
இளைஞர்களுக்கு_தந்தை_பெரியார்_வரலாறு,இருந்தாலும் அவரும் குடும்பச் செலவுக்காக கூலி வேலைகள் செய்தார்.,7
இளைஞர்களுக்கு_தந்தை_பெரியார்_வரலாறு,இருவருக்கும் கிடைத்த மிகச் சிறிய வருவாயில் மிச்சம் பிடித்து வெங்கட்டர் வண்டியும் மாடுகளும் வாங்கினார்.,11
இளைஞர்களுக்கு_தந்தை_பெரியார்_வரலாறு,பிறகு ஒரு சிறிய மளிகைக் கடை வைத்தார்.,6
இளைஞர்களுக்கு_தந்தை_பெரியார்_வரலாறு,"அவருடைய ஒயாத உழைப்பினாலும், சின்னத் தாயம்மாள் உதவியாலும் மளிகைக்கடை சில ஆண்டுகளில் மண்டிக்கடை ஆயிற்று.",11
இளைஞர்களுக்கு_தந்தை_பெரியார்_வரலாறு,மிகப் பெரிய செல்வர் ஆகிவிட்டார்.,4
இளைஞர்களுக்கு_தந்தை_பெரியார்_வரலாறு,"ஒரு மரம் பழுத்து விட்டால் காக்கைகளும், குருவிகளும், அணிலும், வெளவாலும் வந்து சேரும்.",10
இளைஞர்களுக்கு_தந்தை_பெரியார்_வரலாறு,"அதுபோல வெங்கட்டர் பணக்காரர் ஆனவுடன் பண்டிதர்களும், பாகவதர்களும், பக்தர்களும் அவரைத் தேடி வந்தார்கள்.",10
இளைஞர்களுக்கு_தந்தை_பெரியார்_வரலாறு,உழைப்பினால் வந்த பணத்தை கடவுள் அருளால் வந்ததென்று அவர்கள் கூறினார்கள்.,8
இளைஞர்களுக்கு_தந்தை_பெரியார்_வரலாறு,மேலும் கோயில் திருவிழா என்று தருமம் செய்தால் புண்ணியம் கிடைக்கும் என்றார்கள்.,9
இளைஞர்களுக்கு_தந்தை_பெரியார்_வரலாறு,வெங்கட்டருக்கு இரண்டு குழந்தைகள் பிறந்து இறந்து போயின.,6
இளைஞர்களுக்கு_தந்தை_பெரியார்_வரலாறு,தொடர்ந்து பத்து ஆண்டுகள் பிள்ளை பிறக்கவில்லை.,5
இளைஞர்களுக்கு_தந்தை_பெரியார்_வரலாறு,இதனால் அவர்கள் பக்தியுடன் பிள்ளை வரம் கேட்டு விரதம் இருந்தனர்.,8
இளைஞர்களுக்கு_தந்தை_பெரியார்_வரலாறு,பத்து ஆண்டுகள் கழித்து முதல் பிள்ளையாக கிருஷ்ணசாமி பிறந்தார் அதன்பின் இரண்டாண்டுகள் கழித்து இராமசாமி பிறந்தார்.,12
இளைஞர்களுக்கு_தந்தை_பெரியார்_வரலாறு,செல்லப் பாட்டி வெங்கட்டருடைய சிற்றன்னை கணவனை இழந்தவர்.,6
இளைஞர்களுக்கு_தந்தை_பெரியார்_வரலாறு,அவருக்குப் பிள்ளை கிடையாது.,3
இளைஞர்களுக்கு_தந்தை_பெரியார்_வரலாறு,"ஆகவே, இராமசாமியைத் தன் வீட்டிற்கு அழைத்துச் சென்று வளர்த்து வந்தர்.",8
இளைஞர்களுக்கு_தந்தை_பெரியார்_வரலாறு,சிறிய பாட்டியின் செல்லம் இராமசாமியை ஒரு முரடன் ஆக்கி விட்டது.,8
இளைஞர்களுக்கு_தந்தை_பெரியார்_வரலாறு,"ஆகவே, இராமசாமிக்குப் பழஞ்சோறும்.",3
இளைஞர்களுக்கு_தந்தை_பெரியார்_வரலாறு,சுண்டற்குழம்பும் தான் உணவாகக் கிடைக்கும்.,4
இளைஞர்களுக்கு_தந்தை_பெரியார்_வரலாறு,"இராமசாமிக்கோ வடை, வேர்க்கடலை, பட்டாணி போன்ற தீனிகளில் ஆசை அதிகம்.",8
இளைஞர்களுக்கு_தந்தை_பெரியார்_வரலாறு,பாட்டியிடம் காசு கிடைக்காது.,3
இளைஞர்களுக்கு_தந்தை_பெரியார்_வரலாறு,"ஆகையால், ஒசி வாங்கியும், தெருவில் சிந்திக் கிடப்பதைப் பொறுக்கித் தின்றும் தன் ஆசையைத் தணித்துக் கொள்வார்.",12
இளைஞர்களுக்கு_தந்தை_பெரியார்_வரலாறு,இராமசாமிக்கு ஆறுவயது ஆகும் போது திண்ணைப் பள்ளிக் கூடத்தில் படிக்கத் தொடங்கினார்.,9
இளைஞர்களுக்கு_தந்தை_பெரியார்_வரலாறு,பள்ளிக்குப் போகும் பொழுது தாழ்ந்த சாதிக்காரர்கள் வீட்டில் தண்ணிர் வாங்கிக் குடிப்பது வழக்கம்.,10
இளைஞர்களுக்கு_தந்தை_பெரியார்_வரலாறு,"இதைக் கேள்விப்பட்டபோது, அவருடைய தாயார் மிக வருந்தினார்.",6
இளைஞர்களுக்கு_தந்தை_பெரியார்_வரலாறு,"பார்ப்பனர்களுக்கு அடுத்த பெரிய சாதியாக, தங்கள் சாதியை நினைத்துக் கொண்டிருந்த தாயாரால் இதைப் பொறுக்க முடியவில்லை.",12
இளைஞர்களுக்கு_தந்தை_பெரியார்_வரலாறு,வேறு சாதியார் வீட்டிலோ சாயபுமார் வீட்டிலோ சாப்பிடக்கூடாது என்பத்ற்காக சில சமயங்களில் காலில் விலங்குக்கட்டை போட்டு விடுவார்கள்.,13
இளைஞர்களுக்கு_தந்தை_பெரியார்_வரலாறு,அந்தக் கட்டையையும் தோளில் சுமந்து கொண்டு மற்ற பிள்ளைகளுடன் விளையாடப் போய்விடுவார்.,9
இளைஞர்களுக்கு_தந்தை_பெரியார்_வரலாறு,சிறிய பாட்டியின் வளர்ப்பில் இராமசாமி அடங்காப் பிடாரி ஆகி விட்டார்.,8
இளைஞர்களுக்கு_தந்தை_பெரியார்_வரலாறு,அதனால் பாட்டியின் வளர்ப்பு சரியில்லை என்று தாய் தந்தையர் எண்ணினார்கள்.,8
இளைஞர்களுக்கு_தந்தை_பெரியார்_வரலாறு,அந்தப் பாட்டிக்கு இராமசாமியைத் தத்து எடுத்துக் கொள்ள ஆசையாய் இருந்தது.,8
இளைஞர்களுக்கு_தந்தை_பெரியார்_வரலாறு,"பாட்டி ஏழை என்பதாலும், கண்டித்து வளர்க்கவில்லை என்பதாலும், சின்னத்தாயம்மாள் அதற்கு ஒப்புக் கொள்ளவில்லை.",10
இளைஞர்களுக்கு_தந்தை_பெரியார்_வரலாறு,திண்ணைப் பள்ளிக்கூடத்தில் மூன்று ஆண்டுகள் படித்தார்.,5
இளைஞர்களுக்கு_தந்தை_பெரியார்_வரலாறு,பிறகு அவர் ஆங்கிலப் பள்ளிக்கு அனுப்பப் பட்டார்.,6
இளைஞர்களுக்கு_தந்தை_பெரியார்_வரலாறு,அவருடைய குணம் மாறவில்லை.,3
இளைஞர்களுக்கு_தந்தை_பெரியார்_வரலாறு,"குறும்பு செய்வதும், கூடப்படிக்கும் மாணவர்களை வம்புக்கு இழுப்பதும், அடிப்பதும் வழக்கமாகி விட்டது.",9
இளைஞர்களுக்கு_தந்தை_பெரியார்_வரலாறு,ஒரு நாள் தண்டிக்க வந்த ஆசிரியரையே அடித்து விட்டார்.,7
இளைஞர்களுக்கு_தந்தை_பெரியார்_வரலாறு,ஒரு மாணவன் எப்படி இருக்கக் கூடாதோ அப்படி இருந்த இராமசாமியை பள்ளிக்கூடத்திலிருந்து நிறுத்தி விட்டார்கள்.,11
இளைஞர்களுக்கு_தந்தை_பெரியார்_வரலாறு,பத்து வயதோடு அவருடைய படிப்புக்கு முற்றுப் புள்ளி வைக்கப்பட்டது.,7
இளைஞர்களுக்கு_தந்தை_பெரியார்_வரலாறு,அதன் பிறகும் அவர் தன் குறும்புத் தனத்தை விடவில்லை.,7
இளைஞர்களுக்கு_தந்தை_பெரியார்_வரலாறு,"வீட்டிற்கு வந்து இராமாயணம், பாகவதம் படிக்கும் பண்டிதர்களிடம் குறுக்குக் கேள்வி கேட்பார்.",9
இளைஞர்களுக்கு_தந்தை_பெரியார்_வரலாறு,உலகத்தைப் பாயாகச் சுருட்டிய இராட்சதன் எங்கே நின்று கொண்டு சுருட்டினான் என்று கேட்பார்.,10
இளைஞர்களுக்கு_தந்தை_பெரியார்_வரலாறு,பாகவதர் பதில் சொல்லத் தெரியாமல் விழிப்பார்.,5
இளைஞர்களுக்கு_தந்தை_பெரியார்_வரலாறு,எதிரில் நின்று சண்டையிட முடியாமல் மறைந்திருந்து வாலியின் மீது அம்பு விட்ட இராமன் வீரன்தானா?,11
இளைஞர்களுக்கு_தந்தை_பெரியார்_வரலாறு,இப்படி புராணங்களில் உள்ள நம்பத்தகாத செய்திகளை யெல்லாம் அப்பட்டமான தன்து பகுத்தறிவால் அந்தச் சின்ன வயதிலேயே தட்டிக் கேட்டார்.,14
இளைஞர்களுக்கு_தந்தை_பெரியார்_வரலாறு,ஒரு நாள் இராமநாத அய்யர் என்பவரின் கடைக்குச் சென்றார்.,7
இளைஞர்களுக்கு_தந்தை_பெரியார்_வரலாறு,அவர் எல்லாம் தலை விதிப்படிதான் நடக்கும் என்று அடிக்கடி சொல்வார்.,8
இளைஞர்களுக்கு_தந்தை_பெரியார்_வரலாறு,அவர் கடையில் வெயிலுக்காக வைத்திருந்த தட்டியின் காலைக்கீழே தள்ளி விட்டார்.,8
இளைஞர்களுக்கு_தந்தை_பெரியார்_வரலாறு,உடனே தட்டி கீழே சாய்ந்தது.,4
இளைஞர்களுக்கு_தந்தை_பெரியார்_வரலாறு,அது இரரமநாதய்யர் தலையில் விழுந்தது.,4
இளைஞர்களுக்கு_தந்தை_பெரியார்_வரலாறு,தலைவிதி உன் தலையில் தட்டியைத் தள்ளி விட்டது.,6
இளைஞர்களுக்கு_தந்தை_பெரியார்_வரலாறு,என்னை ஏன் அடிக்க வருகிறாய்?,4
இளைஞர்களுக்கு_தந்தை_பெரியார்_வரலாறு,"என்று சொல்லிக்கொண்டே ஒடி விட்டார், இராமசாமி !",5
இளைஞர்களுக்கு_தந்தை_பெரியார்_வரலாறு,வெங்கட்டர் உழைத்து முன்னேறியவர்.,3
இளைஞர்களுக்கு_தந்தை_பெரியார்_வரலாறு,அனுபவப் படிப்பால் உயர்ந்தவர்.,3
இளைஞர்களுக்கு_தந்தை_பெரியார்_வரலாறு,தன் மகன் படிப்பை நிறுத்திய அவர் கடையில் வேலைக்கு வைத்துக் கொண்டார்.,9
இளைஞர்களுக்கு_தந்தை_பெரியார்_வரலாறு,இராமசாமிப் பெரியாரின் அண்ணன் கிருஷ்ணசாமி.,4
இளைஞர்களுக்கு_தந்தை_பெரியார்_வரலாறு,அவர் மூத்த பிள்ளை.,3
