work_title,sentence,sentence_length
எனது_நாடக_வாழ்க்கை,நாகர்கோவிலில் உங்கள் நாடகம் நடைபெற்றபோது நான் அடிக்கடி வந்து பார்த்திருக்கிறேன்.,8
எனது_நாடக_வாழ்க்கை,பால பார்ட்டுகள் இந்தப் பாடலைத் தினமும் பாடுவதைக் கேட்டிருக்கிறேன் என்றார்.,8
எனது_நாடக_வாழ்க்கை,எனக்குப் பெருமகிழ்ச்சி ஏற்பட்டது.,3
எனது_நாடக_வாழ்க்கை,"சரி, நீயே சொல்லிக் கொடு என்று சொல்லி விட்டு, நான் வேறு வேலையைக் கவனிக்கச்சென்றேன்.",11
எனது_நாடக_வாழ்க்கை,பாடம் சொல்லிக்கொடுத்த முதல் நாளே ஆசிரியப் பொறுப்பை ஏற்றுக்கொண்ட அந்த இளைஞர் யார் தெரியுமா?,11
எனது_நாடக_வாழ்க்கை,அவர்தாம் கலைவாணர் என்.,3
எனது_நாடக_வாழ்க்கை,விளையும்பயிர் முளையிலே தெரியும் என்பார்கள்.,4
எனது_நாடக_வாழ்க்கை,"கிருஷ்ணன், வருங்காலத்தில் மகோன்னதமாக விளங்கப்போகிறார் என்பதை அவரது இளம் பருவச் செயல்கள் காட்டின.",10
எனது_நாடக_வாழ்க்கை,விளையாட்டுத் திறன் மாதம் பதிமூன்று நாடகங்கள் நடந்துகொண்டிருந்த காலமாதலால் எங்களுக்கு நிறைய ஒய்வுண்டு.,10
எனது_நாடக_வாழ்க்கை,"ஒய்வுநேரங்களில் பலீன் சடுகுடு, கிளிதட்டு, நொண்டி, பிள்ளையார் பந்து முதலிய பலவிதமான விளையாடல்களை நாங்கள் ஆடுவோம்.",12
எனது_நாடக_வாழ்க்கை,எந்த விளையாட்டுக்கும் இரண்டு கட்சி உண்டல்லவா?,5
எனது_நாடக_வாழ்க்கை,"கட்சி பிரிக்கும் போது ஒவ் வொருவரும், என்.",6
எனது_நாடக_வாழ்க்கை,"கிருஷ்ணன் எந்தக் கட்சியில் இருக்கிறாரோ, அந்தச் கட்சியில் சேரவே விரும்புவார்கள்.",8
எனது_நாடக_வாழ்க்கை,கிருஷ்ணன் இருக்கும் கட்சி கண்டிப்பாய் வெற்றி பெறும்.,6
எனது_நாடக_வாழ்க்கை,நான் எப்போதும் என்.,3
எனது_நாடக_வாழ்க்கை,கே. கட்சியில் தான் சேருவேன்.,4
எனது_நாடக_வாழ்க்கை,"கிளித்தட்டு என்பது ஒரு நல்ல விளையாட்டு, அதில் ஒவ்வொரு கட்சியிலும் கிளியாக இருப்பவருக்குச் சில தனி உரிமைகள் உண்டு.",14
எனது_நாடக_வாழ்க்கை,"கட்டத்தைச் சுற்றி வரவும், குறுக்கே தாண்டியடிக்கவும் கிளிக்கு மாத்திரம் உரிமையுண்டு.",8
எனது_நாடக_வாழ்க்கை,இந்த ஆட்டத்திலும் வழக்கமாக என்.,4
எனது_நாடக_வாழ்க்கை,கே. கட்சிதான் வெற்றி பெறும்.,4
எனது_நாடக_வாழ்க்கை,அவர் கிளியாக நின்று அற்புதமாக விளையாடுவார்.,5
எனது_நாடக_வாழ்க்கை,"அவ்வாறே அவர் பொதுக்கிளியாக இருந்து, ஒவ்வொரு ஆட்டத்தின் போதும் தம் கட்சிக்கு வெற்றியைத் தேடிக் கொடுப்பார்.",12
எனது_நாடக_வாழ்க்கை,விளையாட்டுகளில் இவ்வாறு முதன்மை பெற்றிருந்தாலும் நாடகங்களில் சிறிய பாத்திரங்களையே தாங்கி வந்தார்.,9
எனது_நாடக_வாழ்க்கை,"அவர் கோவலனில் பாண்டியன், சாவித்திரியில் சத்தியவானின் தந்தை துயுமத்சேனன், மனோஹரனில் பெளத்தாயணன் இவைதாம் என்.",11
எனது_நாடக_வாழ்க்கை,கிருஷ்ணனுக்குத் துவக்கத்தில் கிடைத்த வேடங்கள்.,4
எனது_நாடக_வாழ்க்கை,அவர்களும் எங்களுடனேயே தியேட்டருக்குள் குடியிருந்தார்கள்.,4
எனது_நாடக_வாழ்க்கை,அவர்களுடைய நாடகங்கள் சிலவற்றைப் பார்க்க எங்களுக்கு வாய்ப்புக் கிடைத்தது.,7
எனது_நாடக_வாழ்க்கை,அந்தக் கம்பெனியில் எஸ்.,3
எனது_நாடக_வாழ்க்கை,ஜானகி அம்மாள் கதாநாயகனாக நடித்து வந்தார்.,5
எனது_நாடக_வாழ்க்கை,"என் இராஜலட்சுமி, ஜானகியம்மாள் மிக நன்றாக பாடுவார்.",6
எனது_நாடக_வாழ்க்கை,அவரது குரல் கெம்பீரமாக இருக்கும்.,4
எனது_நாடக_வாழ்க்கை,அவர்கள் நடித்த நாலைந்து நாடகங்களைத் தொடர்ச்சியாகப் பார்த்ததும் எங்களுக்கெல்லாம் அவர்கள் மீது பற்றுதல் உண்டாகி விட்டது.,12
எனது_நாடக_வாழ்க்கை,நாங்கள் எங்கள் அன்னையாருடன் அவர்கள் தங்கியிருந்த அறைக்கு அடுத்த அறையிலேயே தங்கியிருந்தோம்.,9
எனது_நாடக_வாழ்க்கை,ஜானகியம்மாள் எங்கள் தாயாருடன் நெருங்கிப் பழகினார்கள்.,5
எனது_நாடக_வாழ்க்கை,"அங்கு, சிலநாட்கள் ஒன்றாகக் குடியிருந்து விட்டு, அவர்கள் பிரிந்து சென்றபோது எங்களுக்கு வருத்தமாக இருந்தது.",11
எனது_நாடக_வாழ்க்கை,ஆரம்ப நாடகம் கோவலன்.,3
எனது_நாடக_வாழ்க்கை,நாடகக் கம்பெனி தொடங்குவதற்காய் நாங்கள் செலவிட்ட பணம் சுமார் ஐநூறு ரூபாய்.,9
எனது_நாடக_வாழ்க்கை,சின்னையாபிள்ளை கம்பெனியிலிருந்து பல நடிகர்கள் எங்கள் கம்பெனிக்கு வரத் தயாராக இருந்தார்கள்.,9
எனது_நாடக_வாழ்க்கை,"என்றாலும், அம்மா யாரையும் சேர்த்துக் கொள்ளக் கூடாதென்று கண்டிப்பாகச் சொல்லிவிட்டார்கள்.",8
எனது_நாடக_வாழ்க்கை,கோவலனாக நடித்த எஸ்.,3
எனது_நாடக_வாழ்க்கை,சங்கரன் முன்பே நாடகங்களில் நடித்தவர்.,4
எனது_நாடக_வாழ்க்கை,மற்ற நடிகர்கள் அனைவரையும் புதிதாகவே சேர்த்துக் கொண்டோம்.,6
எனது_நாடக_வாழ்க்கை,நகைச் சுவை நடிகர் எம்.,4
எனது_நாடக_வாழ்க்கை,சாமி நாதன் ஒருவர் மட்டும் சின்னையாபிள்ளையிடமிருந்து விலகிப் பிடிவாதமாக வந்து எங்களிடம் சேர்ந்து கொண்டார்.,11
எனது_நாடக_வாழ்க்கை,அவருடைய வேண்டுகோளை அம்மாவாலும் தடுக்கமுடியவில்லை.,4
எனது_நாடக_வாழ்க்கை,முதல் நாடகத்தில் தம்பி பகவதி பபூனாக நடித்தான்.,6
எனது_நாடக_வாழ்க்கை,"சுவாமிகளின் அருமையான நகைச்சுவைப் பாடல்களை அவன் பாடியபோது, சபையோர் வெகுவாக ரசித்தார்கள்.",9
எனது_நாடக_வாழ்க்கை,இரண்டாவதாக மனோஹரா நடைபெற்றது.,3
எனது_நாடக_வாழ்க்கை,மொத்தம் ஆறு நாடகங்களே தயாராகியிருந்தன.,4
எனது_நாடக_வாழ்க்கை,அவற்றை நடித்துவிட்டு நாகர்கோவிலுக்குச் சென்றோம்.,4
எனது_நாடக_வாழ்க்கை,செய்கு தம்பிப் பாவலர் தீர்க்க தரிசனம் நாகர்கோவிலிலும் இதே ஆறுநாடகங்கள் நடைபெற்றன.,9
எனது_நாடக_வாழ்க்கை,கோவலன் நாடகத்திற்குப் பெரும் புலவரான கோட்டாறு சதாவதானம் செய்குதம்பிப் பாவலர் வந்திருந்தார்.,9
எனது_நாடக_வாழ்க்கை,ஒழுகினசேரி சரஸ்வதி ஹாலில் நாடகங்கள் நடைபெற்றன.,5
எனது_நாடக_வாழ்க்கை,"கிருஷ்ணன் ஒழுகினசேரியைச் சேர்ந்தவராதலால், அங்குள்ள சில நண்பர்கள் ஒன்று சேர்ந்து, என்.",9
எனது_நாடக_வாழ்க்கை,கிருஷ்ணனுக்கு ஒரு தங்கப் பதக்கம் பரிசளித்தார்கள்.,5
எனது_நாடக_வாழ்க்கை,"அந்தப் பதக்கத்தைப் பாவலரைக் கொண்டு, வாழ்த்திக் கொடுக்க ஏற்பாடு செய்தார்கள்.",8
எனது_நாடக_வாழ்க்கை,செய்கு தம்பிப் பாவலர் இன்று நம்மிடையே இல்லை.,6
எனது_நாடக_வாழ்க்கை,அவர் பெரும் புலமை வாய்ந்தவர்.,4
எனது_நாடக_வாழ்க்கை,"இத்தகைய பெரும் புகழ்படைத்த முஸ்லீம் பெரியார், அன்று மேடையேறி, பாண்டியன் வேடத்தில் நின்ற என்.",11
எனது_நாடக_வாழ்க்கை,கிருஷ்ணனை வாழ்த்திப் பரிசளித்தார்.,3
எனது_நாடக_வாழ்க்கை,நம் நாஞ்சில்நாட்டு இளஞ்சிறுவன் என்.எஸ்.,5
எனது_நாடக_வாழ்க்கை,கிருஷ்ணன் வருங்காலத்தில் மகா மேதையாக விளங்கப் போகிறான்.,6
எனது_நாடக_வாழ்க்கை,"அப்பெரியாரது தீர்க்க தரிசனத்தை எண்ணி, இப்போதும் நான் பெருமையடைகிறேன்.",7
எனது_நாடக_வாழ்க்கை,கிருஷ்ணன் எத்தனையோ முறை இதைப் பெருமையோடு சொல்லி மகிழ்ந்திருக்கிறார்.,7
எனது_நாடக_வாழ்க்கை,கம்பெனி திருநெல்வேலிக்கு வந்தது.,3
எனது_நாடக_வாழ்க்கை,கொல்லத்தில் நாங்கள் விலகியபின் சின்னையாபிள்ளை மிகவும் சிரமப்பட்டதாக அறிந்தோம்.,7
எனது_நாடக_வாழ்க்கை,எப்படியோ தட்டுத் தடுமாறி அவரும் திருநெல்வேலிக்கு வந்து சேர்ந்தார்.,7
எனது_நாடக_வாழ்க்கை,"எங்கள் கம்பெனி மனோரமா தியேட்டரிலும், சின்னையாபிள்ளை கம்பெனி கணபதி விலாஸ் தியேட்டரிலும் நடைபெற்றது.",10
எனது_நாடக_வாழ்க்கை,பல நடிகர்கள் போய் விட்டதால் அவருடைய கம்பெனி தள்ளாடிக் கொண்டிருந்தது.,8
எனது_நாடக_வாழ்க்கை,"சகோதரர்கள் நாங்கள் நால்வரும் சிறுவர்களாய் இருந்ததால் மாமா செல்லம்பிள்ளை, தம் பெயரையும், சிற்றப்பா பெயரையும் உரிமையாளர் ஸ்தானத்தில் போட்டார்.",14
எனது_நாடக_வாழ்க்கை,எஸ்.செல்லம்பிள்ளை உரிமையாளர் என்று சிற்றப்பா பேரே விளம்பரப் படுத்தப் பட்டது.,9
எனது_நாடக_வாழ்க்கை,"இந்த நிலையில் நாங்கள் சொந்தக் கம்பெனி தொடங்கிய விஷயம் தெரிந்து, பழைய மானேஜர் காமேஸ்வர ஐயர் வந்து சேர்ந்தார்.",14
எனது_நாடக_வாழ்க்கை,கருப்பையாபிள்ளை கம்பெனி அதற்குள் கலைந்து விட்டதால் சும்மா இருந்த ஐயரை அவரது விருப்பத்தின்படி எங்கள் கம்பெனியில் சேர்த்துக் கொண்டோம்.,14
எனது_நாடக_வாழ்க்கை,"அவருடைய போக்கு எங்களுக்குப் பிடிக்காவிட்டாலும் நல்ல நிருவாகத் திறமையைக் கருதி, இடமளித்தோம்.",9
எனது_நாடக_வாழ்க்கை,மானேஜர் ஐயர் வந்து சேர்ந்தவுடன் இரண்டாம் நாளே ஒரு மாறுதல் செய்தார்.,9
எனது_நாடக_வாழ்க்கை,உரிமையாளர் ஸ்தானத்திலிருந்த சிற்றப்பா பெயரை நீக்கி விட்டார்.,6
எனது_நாடக_வாழ்க்கை,இரண்டு நாடக விளம்பரங்களில் எந்தப்பெயரும் இல்லாதிருந்தது.,5
எனது_நாடக_வாழ்க்கை,சிற்றப்பாவுக்குக் கோபம் வந்து விட்டது.,4
எனது_நாடக_வாழ்க்கை,ஐயரைக் கடுமையாகக் கண்டித்தார்.,3
எனது_நாடக_வாழ்க்கை,ஐயர் ஏதோ சமாதானம் சொல்லிப் பார்த்தார்.,5
எனது_நாடக_வாழ்க்கை,கடைசியாகச் சிற்றப்பா பெயர் மறுபடியும் ஒழுங்காக விளம்பரங்களில் போடப் பெற்றது.,8
எனது_நாடக_வாழ்க்கை,﻿தூத்துக்குடி கலவரம் திருநெல்வேலி நாடகம் முடிந்து தூத்துக்குடி சென்றோம்.,7
எனது_நாடக_வாழ்க்கை,அந்த நாளில் அநேகமாக எல்லா ஊர்களிலும் ரெளடிகள் உண்டு.,7
எனது_நாடக_வாழ்க்கை,அவர்கள் நாடகக்காரர்களிடம் எப்போதும் தங்கள் கைவரி சையைக் காண்பிப்பது வழக்கம்.,8
எனது_நாடக_வாழ்க்கை,இதற்காக ஒவ்வொரு ஊரிலும் சில ரெளடிகளுக்கு ஒசி டிக்கட் கொடுத்துச் சரிப்படுத்துவதுண்டு.,9
எனது_நாடக_வாழ்க்கை,தூத்துக்குடியில் இப்படிப்பட்ட ரெளடிகள் அந்த நாளில் அதிகம்.,6
எனது_நாடக_வாழ்க்கை,"நாங்கள் துரத்துக்குடியில் நாடகம் துவக்கிய அன்று, சில் ரெளடிகள் கம்பெனி வீட்டுக்கு வந்தார்கள்.",10
எனது_நாடக_வாழ்க்கை,நானும் மானேஜர் ஐயரும் திண்ணையில் உட்கார்ந்திருந்தோம்.,5
எனது_நாடக_வாழ்க்கை,ஐயரிடம் அவர்கள் ஏதோ பேசினார்கள்.,4
எனது_நாடக_வாழ்க்கை,"எந்தக் கம்பெனி வந்தாலும் தாங்கள்தாம் நுழைவு வாயிலில் இருப்பது வழக்கமென்றும், அதற்காக ஒரு குறிப்பிட்ட தொகை தரவேண்டுமென்றும் சொன்னார்கள்.",14
எனது_நாடக_வாழ்க்கை,"ஐயர், வந்தவர்களிடம் பொறுமையோடு பேசவில்லை.",4
எனது_நாடக_வாழ்க்கை,பேச்சு வளர்ந்து தகராறு முற்றியது.,4
எனது_நாடக_வாழ்க்கை,"வந்த ரெளடிகள், இன்று நாடகம் நடப்பதைப் பார்க்கலாம் என்று போய் விட்டார்கள்.",9
எனது_நாடக_வாழ்க்கை,"ஐயர் கோபத்தோடு, இது என்ன வெள்ளரிக்காய் பட்டணமா? என்று முணுமுணுத்தார்.",8
எனது_நாடக_வாழ்க்கை,கொட்டகையோ மூக்கமேஸ்திரியின் பழைய ஓலைக் கொட்டகை.,5
எனது_நாடக_வாழ்க்கை,துரத்துக்குடியைப்பற்றி எனக்கு நன்றாகத் தெரியும்.,4
எனது_நாடக_வாழ்க்கை,"எனவே, இரவு நாடகத்தின் போது என்ன நேருமோவென்று நான் பயந்து கொண்டே இருந்தேன்.",10
எனது_நாடக_வாழ்க்கை,முதல் நாடகம் அபிமன்யு சுந்தரி.,4
எனது_நாடக_வாழ்க்கை,நாடகம் தொடங்கி நடந்து கொண்டிருந்தது.,4
எனது_நாடக_வாழ்க்கை,வெளிவாயிலுக்குச் சுமார் ஐம்பதடி தூரத்தில்தான் அரங்கின் நுழைவாயில்.,6
எனது_நாடக_வாழ்க்கை,கொட்டகை முழுதும் மெல்லிய மூங்கிற் பாயினால் போடப் பெற்றிருந்தது.,7
எனது_நாடக_வாழ்க்கை,நான் மூங்கிற் பாயின் இடுக்குகளின் வழியாகவெளிவாயிலைப்பார்த்துக் கொண்டிருந்தேன்.,6
எனது_நாடக_வாழ்க்கை,குழப்பம் ஏதாவது நடக்கிறதாவென அடிக்கடி விசாரித்துக் கொண்டே நின்றேன்.,7
எனது_நாடக_வாழ்க்கை,"சுந்தரி, அபிமன்யுவுக்கு ஒலை எழுதியனுப்பும் காட்சியும் முடிந்தது.",6
எனது_நாடக_வாழ்க்கை,அடுத்து அபிமன்யு வரவேண்டிய காட்சி.,4
எனது_நாடக_வாழ்க்கை,நான் வேட்டைப் பாட்டுப் பாடியபடி மேடைக்கு வந்தேன்.,6
எனது_நாடக_வாழ்க்கை,வாயிலில் குழப்பம் வெளியே வாயிலில் ஏதோ குழப்பம் நடப்பது நன்றாகத் தெரிந்தது.,9
எனது_நாடக_வாழ்க்கை,டிக்கட் விற்குமிடத்திலும் ஒரு கூட்டம் பாய்ந்தது.,5
எனது_நாடக_வாழ்க்கை,"அடி, குத்து, வெட்டு என்றெல்லாம் பெருஞ் சத்தம் கேட்டது.",7
எனது_நாடக_வாழ்க்கை,பலத்த அடிதடி நடப்பதை மேடையிலிருந்தே பார்த்தேன்.,5
எனது_நாடக_வாழ்க்கை,எனக்குக் குலை நடுக்கம் எடுத்தது.,4
எனது_நாடக_வாழ்க்கை,"இதில் பெரிய ஆச்சரியம் என்ன வென்றால், உள்ளேயிருந்த சபையோர் அப்படியொரு கலவரம் நடப்பதாகவே கருதியதாகத் தெரியவில்லை.",12
