work_title,sentence,sentence_length
எனது_நாடக_வாழ்க்கை,எனது நாடக வாழ்க்கை அவ்வை தி.,5
எனது_நாடக_வாழ்க்கை,﻿எனது நாடக வாழ்க்கை அவ்வை தி.க.,6
எனது_நாடக_வாழ்க்கை,சண்முகம் எம்.எல்.சி.,4
எனது_நாடக_வாழ்க்கை,வானதி பதிப்பகம் பதிமூன்று .,3
எனது_நாடக_வாழ்க்கை,தீனனதயாளு தெரு தி.,3
எனது_நாடக_வாழ்க்கை,"நகர், சென்னை பதினேழு  ﻿முதற் பதிப்பு ஏப்ரல், ஓர் ஆயிரத்து தொள்ளாயிரத்து எழுபத்திரண்டு அவ்வை தி.",12
எனது_நாடக_வாழ்க்கை,சண்முகம் மணிவிழா வெளியீடு மூன்றாம் பதிப்பு நவம்பர் ஓர் ஆயிரத்து தொள்ளாயிரத்து எண்பத்தாறு திருகாவுக்கரசு தயாரிப்பு விலை ரு.,14
எனது_நாடக_வாழ்க்கை,கே. ஷண்முகம் எம்.,3
எனது_நாடக_வாழ்க்கை,பொதுவாகத் தமிழ் மக்கள் அனைவரும் போற்றுதற் குரியது என்ற என் பணிவான கருத்தினைத் தெரிவித்துத் திரு டி.,13
எனது_நாடக_வாழ்க்கை,கே. எஸ் அவர்களின் அரிய முயற்சி வெல்க என வாழ்த்துகின்றேன்.,8
எனது_நாடக_வாழ்க்கை,"கூத்தாடிகள், குடிகாரர்கள் இவை போன்ற பெயர்கள் நாடகக்காரர்களுக்கு அடைமொழிகளாயிருந்து வந்தன.",8
எனது_நாடக_வாழ்க்கை,நாடகக்காரன் என்றால் குடியிருக்க வீடும் கொடுக்கமாட்டார்கள்.,5
எனது_நாடக_வாழ்க்கை,அவ்வளவு நல்ல பெயர் நடிகனுக்கு.,4
எனது_நாடக_வாழ்க்கை,இளம் பெண்களைக் கடத்திச் சென்று விடுவான் என்று மக்கள் பயப்பட்டார்கள்.,8
எனது_நாடக_வாழ்க்கை,இந்தப் பயத்தில் ஒரளவு உண்மையும் இருந்தது.,5
எனது_நாடக_வாழ்க்கை,பெற்றோர்கள் தங்கள் பிள்ளைகளை நாடகம் பார்க்க அனுமதிக்கமாட்டார்கள்.,6
எனது_நாடக_வாழ்க்கை,நாடகம் பார்த்த இளைனார்கள் அதை நாலு பேருக்கு நடுவில் சொல்லிக்கொள்ள வெட்கப்படுவார்கள்.,9
எனது_நாடக_வாழ்க்கை,நாடகக் கொட்டகைக்கு எதிரிலேயே ஒரு கள்ளுக் கடையும் இருக்கும்.,7
எனது_நாடக_வாழ்க்கை,"ஆம் இயல், இசை, நாடகம் என்று தமிழ்மொழியை மூன்றாக வகுத்த நாட்டிலேதான் இந்தக் கேவலநிலை.",11
எனது_நாடக_வாழ்க்கை,தாயும் தந்தையும் என் தந்தையார் திரு டி.,6
எனது_நாடக_வாழ்க்கை,கண்ணாசாமிப்பிள்ளை தாயார் திருமதி சீதையம்மாள்.,4
எனது_நாடக_வாழ்க்கை,தந்தையாரும் ஒரு நடிகர்.,3
எனது_நாடக_வாழ்க்கை,பெண் வேடம் தரித்து நடிப்பதில் பிரசித்தி பெற்றவர்.,6
எனது_நாடக_வாழ்க்கை,வேலுநாயர் பின்பாட்டுப் பாடுவதிலிருந்து ராஜபார்ட் வேடத்திற்கு வரத் துாண்டுகோலாயிருந்தவர் என் தந்தையார்.,9
எனது_நாடக_வாழ்க்கை,"இச்செய்தியினைத் திரு நாயரவர்களே என்னிடம் கூறி, என் தந்தையாரைப் பாராட்டினார்.",8
எனது_நாடக_வாழ்க்கை,அந்த நாளில் எல்லா நாடக நடிகர்களுக்கும் ஆசிரியராக இருந்தவர் தவத்திரு சங்கரதாஸ் சுவாமிகள்.,10
எனது_நாடக_வாழ்க்கை,அவரைத் தமிழ் நாடகத் தலைமை ஆசிரியர் என்றே எல்லோரும் குறிப்பிடுவார்கள்.,8
எனது_நாடக_வாழ்க்கை,என் தந்தையும் அவரது மாளுக்கர்களிலே ஒருவர்.,5
எனது_நாடக_வாழ்க்கை,நாடகத் தொழிலுக்கு அக்காலத்தில் தாய் வீடாக விளங்கியது மதுரைமாரு கரம்.,8
எனது_நாடக_வாழ்க்கை,நாடகக் கம்பெனிகள் பெரும்பாலும் மதுரையிலிருந்தே தொடங்கும்.,5
எனது_நாடக_வாழ்க்கை,"இளஞ் சிறுவர்களையே முழுதும் நடிகர்களாகக் கொண்ட அந்தச் கம்பெனியின் பெயர், மதுரை தத்துவ மீனலோசனி வித்துவ பால சபா.",14
எனது_நாடக_வாழ்க்கை,"ஒரு நாள் என் தந்தையார் என் சகோதரர்களுடன் என்னையும் அழைத்துக் கொண்டு, தமது ஆசிரியராகிய சுவாமிகளைக் காணச் சென்றார்.",14
எனது_நாடக_வாழ்க்கை,நாடகத்துறையை வெறுத்திருந்த தந்தையார் தயங்கினார்.,4
எனது_நாடக_வாழ்க்கை,குழந்தைகள் படிக்கிறார்கள் அவர்களுடைய படிப்பு... என்று ஏதோ சொல்ல முயன்றார்.,8
எனது_நாடக_வாழ்க்கை,"உடனே சுவாமிகள், நானே தமிழ்ப் படிப்பும் சொல்லி வைக்கிறேன் படித்து வக்கீல் உத்தியோகம் செய்யப் போகிறார்களா, என்ன !",13
எனது_நாடக_வாழ்க்கை,"நல்ல சந்தர்ப்பம், இங்கேயே சேர்த்துவிடு என்று வற்புறுத்திச் சொன்னார்.",7
எனது_நாடக_வாழ்க்கை,எங்கள் தந்தை அப்போது ஸ்பெஷல் நாடகம் என்ற மரக் கட்டையைப் பற்றிக் கொண்டு வாழ்க்கைக் கடலில் நீந்திக் கொண்டிருந்தார்.,14
எனது_நாடக_வாழ்க்கை,"கொழும்பு, யாழ்ப்பாணம் முதலிய இலங்கைத் தீவின் நகரங்களிலேதான் அவரது நாடகப்பணி மிகுதியாக நடை பெற்று வந்தது.",12
எனது_நாடக_வாழ்க்கை,மதுரை அம்மன் சந்நிதியை அடுத்த சோற்றுக் கடைத்தெருவில் நாங்கள் குடியிருந்தோம்.,8
எனது_நாடக_வாழ்க்கை,பண்டை நாளில் இத் தெருவில் உணவு விடுதி இருந்திருக்குமென நினைக்கிறேன்.,8
எனது_நாடக_வாழ்க்கை,"ஆனால், நாங்கள் இருந்தபோது சோற்றுக்கடையோ, இந்தக் காலச் சாப்பாட்டு ஒட்டலோ எதுவுமில்லை.",9
எனது_நாடக_வாழ்க்கை,அருகே தெற்கு ரத வீதியிலுள்ள வெள்ளியம்பலம் கலாசாலேதான் நான் படித்த பள்ளிக்கூடம்.,9
எனது_நாடக_வாழ்க்கை,என் மூத்த அண்ணா திரு டி.,5
எனது_நாடக_வாழ்க்கை,"கே. சங்கரன் ஆறாவது வகுப்பிலும், சின்னண்ணா திரு டி.",7
எனது_நாடக_வாழ்க்கை,"கே. முத்துசாமி நான்காவது வகுப்பிலும், நான் இரண்டாவது வகுப்பிலுமாகப் படித்துக் கொண்டிருந்தோம்.",9
எனது_நாடக_வாழ்க்கை,தம்பி பகவதி அப்போது கைக்குழந்தை.,4
எனது_நாடக_வாழ்க்கை,கம்பெனியில் சேர்ந்தோம் என் தந்தையார் நன்கு சிந்தித்தார்.,6
எனது_நாடக_வாழ்க்கை,எங்களோடு கலந்து பேசினார்.,3
எனது_நாடக_வாழ்க்கை,"என்னையும், சின்னண்ணாவையும் சேர்த்துவிட எண்ணி னார்.",5
எனது_நாடக_வாழ்க்கை,பெரியண்ணா மட்டும் படிப்பது நலமெனத் தோன்றியது.,5
எனது_நாடக_வாழ்க்கை,"ஆனால், பெரியண்ணாவோ அப்பாவின் முடிவைக் கேட்டுக் கலங்கினார்.",6
எனது_நாடக_வாழ்க்கை,எங்களைப் பிரிய அவர் மனம் இடம் தரவில்லை.,6
எனது_நாடக_வாழ்க்கை,"எனவே, பள்ளிப் படிப்புக்கு முற்றுப்புள்ளி வைக்கப்பட்டது.",5
எனது_நாடக_வாழ்க்கை,நாங்கள் நாடகக் கம்பெனியில் சேர்ந்தோம்.,4
எனது_நாடக_வாழ்க்கை,தந்தையார் சிறந்த பாடகர்.,3
எனது_நாடக_வாழ்க்கை,நல்ல சாரீர வன்மையுடையவர்.,3
எனது_நாடக_வாழ்க்கை,"எனவே, அக்காலத்தில் மிக அவசியமாகக் கருதப்பட்ட பின்பாட்டுப் பாடும் ஸ்தானத்தில் அவரையும் கம்பெனியில் சேர்த்துக் கொண்டார்கள்.",12
எனது_நாடக_வாழ்க்கை,எங்களைத் தனியே விட்டுப் போகத் தந்தையார் இசையவில்லை.,6
எனது_நாடக_வாழ்க்கை,பெரிய அண்ணாவுக்குப் பத்து ரூபாய் மாதச் சம்பளம்.,6
எனது_நாடக_வாழ்க்கை,சின்னண்ணாவுக்கு எட்டு ரூபாயும் எனக்குப் பதினேந்து ரூபாயும் கொடுப்பதாக முடிவு செய்யப்பட்டது.,9
எனது_நாடக_வாழ்க்கை,பின்பாட்டுப் பாடும் என் தந்தையாருக்கு மட்டும் அறுபத்தி ஐந்து ரூபாய் சம்பளம்.,9
எனது_நாடக_வாழ்க்கை,ஓர் ஆயிரத்து தொள்ளாயிரத்து பதினெட்டு  ஆம்ஆண்டில் தத்துவ மீனலோசனி வித்துவ பால சபையின் நாடகங்கள் மதுரையில் ஆரம்பமாயின.,13
எனது_நாடக_வாழ்க்கை,காரதா கலகப்ரியா நாடகக் கம்பெனி மதுரை புட்டுத்தோப்பிலுள்ள ஒரு வீட்டில் இருந்து வந்தது.,10
எனது_நாடக_வாழ்க்கை,நாடகங்களுக்குப் பயிற்சி நடந்து கொண்டிருந்ததால் நாங்கள் கம்பெனி வீட்டிலேயே தங்கினோம்.,8
எனது_நாடக_வாழ்க்கை,எனக்கு முதன்முதலாகச் சத்தியவான் சாவித்திரி நாடகத்தில் நாரதர் வேடம் கொடுக்கப்பட்டது.,8
எனது_நாடக_வாழ்க்கை,அப்போது கம்பெனியிலிருந்த நடிகர்கள் அனைவரிலும் நான் தான் மிகச் சிறியவன்.,8
எனது_நாடக_வாழ்க்கை,அதனால் ஆசிரியர் சங்கரதாஸ் சுவாமிகளுக்கு என்மீது அளவு கடந்த பற்றுதல்.,8
எனது_நாடக_வாழ்க்கை,அவர் என்னைப்பற்றி என்ன நினைத்தாரோ எனக்குத் தெரியாது.,6
எனது_நாடக_வாழ்க்கை,அநேகமாக எல்லா நாடகங்களிலும் எனக்கு நாரதர் வேடமே கொடுக்கப்பட்டது.,7
எனது_நாடக_வாழ்க்கை,கம்பெனியில் அப்போது சட்டாம் பிள்ளை யாக இருந்து பாடங்கள் சொல்லி வைத்தவர் திரு டி.,11
எனது_நாடக_வாழ்க்கை,"சீமந்தனி, சதியனுகுயா, சுலோசன சதி, பார்வதி கல்யாணம் முதலிய நாடகங்களில் எல்லாம் நாரதர் வேடமே எனக்குக் கிடைத்தது.",13
எனது_நாடக_வாழ்க்கை,தொடர்ந்து நான் நாரதர் பாடம் செய்து வருவதைக் கண்ட மற்றப் பிள்ளைகள் என்னைக் கேலி செய்தார்கள்.,12
எனது_நாடக_வாழ்க்கை,"நாரதா, கலகப் பிரியா என்றெல்லாம் அடிக்கடி என்னைப் பெயர் வைத்துக் கூப்பிட்டார்கள்.",9
எனது_நாடக_வாழ்க்கை,இந்தச் செய்தி சுவாமிகளின் செவிக்கும் எட்டியது.,5
எனது_நாடக_வாழ்க்கை,வையை யென்னும் பொய்யாக் குலக் கொடி புட்டுத்தோப்பில் கம்பெனி வீட்டிற்கு எதிரே முழுதும் ஒரே மணற் பரப்பு.,13
எனது_நாடக_வாழ்க்கை,வையை யென்னும் பொய்யாக் குலக்கொடி என்று சங்க இலக்கியம் வைகையின் வளத்தைப் பற்றிப் பேசுகிறது.,11
எனது_நாடக_வாழ்க்கை,இப்போதெல்லாம் மழைக் காலங் களில் நாலைந்து நாட்கள் வெள்ளம் கரை புரண்டு ஒடும்.,10
எனது_நாடக_வாழ்க்கை,மீண்டும் பழைய குருடிதான்.,3
எனது_நாடக_வாழ்க்கை,அதற்குப் பின் ஊற்று நீரில்தான் குளிக்க வேண்டும்.,6
எனது_நாடக_வாழ்க்கை,நான் எந்தப் பாடத்தையும் மிக விரைவில் நெட்டுருப் போட்டுவிடுவேன்.,7
எனது_நாடக_வாழ்க்கை,அதனுல் பாடத்திற்காக ஆசிரியர் சுவாமி களிடம் நான் அடிவாங்கியதே இல்லை.,8
எனது_நாடக_வாழ்க்கை,சட்டாம்பிள்ளையும் எனக்கு அன்போடு நடிப்புச் சொல்லித் தருவார்.,6
எனது_நாடக_வாழ்க்கை,"ஆனால், மற்ற வர்கள் பாடம் செய்யாமல் அடிபடுவதைப் பார்க்கும்போது எனக்குக் கஷ்டமாக இருக்கும்.",10
எனது_நாடக_வாழ்க்கை,முதல் நாடகம் முதல் நாடகம் சத்தியவான் சாவித்திரி மதுரை பெரிய தகரக் கொட்டகையில் அரங்கேறியது.,11
எனது_நாடக_வாழ்க்கை,இப்போது அந்தக் கொட்டகை இருந்த அடையாளமே தெரியவில்லை.,6
எனது_நாடக_வாழ்க்கை,எல்லாம் வீடுகள் நிறைந்து விட்டன.,4
எனது_நாடக_வாழ்க்கை,மேல மாசி வீதியில் சின்னத் தகரக் கொட்டகை ஒன்று இருந்தது.,8
எனது_நாடக_வாழ்க்கை,இப்பொழுது அது சந்திரா டாக்கீஸ் என்று சொல்லப் படுகிறது.,7
எனது_நாடக_வாழ்க்கை,இவ்விரண்டைத் தவிர அப்போது மதுரையில் நான் அறிந்த வரையில் வேறு நாடக அரங்கம் கிடையாது.,11
எனது_நாடக_வாழ்க்கை,பெயர் பெற்ற நகைச்சுவை நடிகர் திரு சி.,6
எனது_நாடக_வாழ்க்கை,எஸ்.சாமண்ணா ஐயர் எங்களுக்கெல்லாம் பவுடர் தொட்டு நெற்றியிலிட்டு வேஷம் போட்டு விட்டார்.,10
எனது_நாடக_வாழ்க்கை,எனக்குத் தலையில் நிறைய முடி இருந்ததால் அதிலேயே கொண்டை போட்டார்கள்.,8
எனது_நாடக_வாழ்க்கை,"இடுப்பில் முழங்கால் வரை, தூக்கி ஒரு மஞ்சள் பட்டுத் துண்டைத் தார் போட்டுக் கட்டினார்கள்.",11
எனது_நாடக_வாழ்க்கை,அதற்குமேல் இடுப்பைச் சுற்றி ஒரு சிவப்புப் பட்டு இரண்டு கால்களிலும் கஜ்ஜை கட்டப்பட்டது.,10
எனது_நாடக_வாழ்க்கை,நாரதர் கதித்தை போட்டு ஆடிக் கொண்டே வரவேண்டும்.,6
எனது_நாடக_வாழ்க்கை,நான் அரங்கில் பிரவேசிக்கும் சமயத்தில் யாரோ ஒருவர் வந்து என் கையில் மரத்தால் செய்த ஒரு வீணையைக் கொடுத்தார்.,14
எனது_நாடக_வாழ்க்கை,எல்லோரிலும் நான் மிகச் சிறுவனாக இருந்ததால் வந்தவுடனேயே சபையில் கைதட்டலும் கலகலப் பும் ஏற்பட்டன.,11
எனது_நாடக_வாழ்க்கை,"பாட்டு முடிந்ததும் அசுவபதி ராஜா, அவர் மனைவி மாளவி, புதல்வி சாவித்திரி மூவரும்பாட்டுப்பாடி என்னை வணங்கி உட்காரச் சொன்னார்கள்.",14
எனது_நாடக_வாழ்க்கை,மேடையில் உயரமான நாற்.,3
எனது_நாடக_வாழ்க்கை,"காலி போடப்பட்டிருந்தது.ஒரு கையில் வீணை இருந்ததால் அந்த உயரமான நாற்காலியில் உட்கார இயலாமல் நான்சற்று, தயங்கினேன்.",13
எனது_நாடக_வாழ்க்கை,"பிறகு கையிலிருந்த வீணையைக் கீழே போட்டுவிட்டு, நாற்காலியைப் பிடித்து ஏறி ஒருவாறு அதில் உட்கார்ந்தேன்.",11
எனது_நாடக_வாழ்க்கை,சபையில் அதற்கும் கை தட்டினார்கள்.,4
எனது_நாடக_வாழ்க்கை,எனக்கு ஒன்றும் புரிய வில்லை.,4
எனது_நாடக_வாழ்க்கை,பாடத்தை மட்டும் தவறாமல் பேசினேன் பாடினேன்.,5
எனது_நாடக_வாழ்க்கை,ஒருவகையாக நாரதரின் முதல் காட்சி முடிந்தது.,5
எனது_நாடக_வாழ்க்கை,உள்ளே வந்ததும் சுவாமிகள் என்னைத் தூக்கி முத்தமிட்டுப் பாராட்டினார்.,7
எனது_நாடக_வாழ்க்கை,பையன் சீக்கிரம் முன்னுக்கு வந்துவிடுவான் என்று எல்லோரும் புகழ்ந்தார்கள்.,7
எனது_நாடக_வாழ்க்கை,நாரதர் வர வேண்டிய அடுத்த காட்சி.,5
எனது_நாடக_வாழ்க்கை,எமதரும ராஜனின் சபை.,3
எனது_நாடக_வாழ்க்கை,நான் மகிழ்ச்சியோடு சபையில் பிரவேசித்தேன்.,4
எனது_நாடக_வாழ்க்கை,எமனுக்கும் எனக்கும் வாதம் நடந் தது.,5
