work_title,sentence,sentence_length
"எது_வியாபாரம்,_எவர்_வியாபாரி","எது வியாபாரம், எவர் வியாபாரி கி.",5
"எது_வியாபாரம்,_எவர்_வியாபாரி",﻿ எது வியாபாரம்?,3
"எது_வியாபாரம்,_எவர்_வியாபாரி","சித்த மருத்துவ சிகாமணி முத்தமிழ்க் காவலர், கலைமாமணி டாக்டர் கி.",8
"எது_வியாபாரம்,_எவர்_வியாபாரி","லிட்., பாரி நிலையம் பிராட்வே சென்னை ﻿முதற் பதிப்பு டிசம்பர்.விலை ரூ. அச்சிட்டோர் சிறீ.",12
"எது_வியாபாரம்,_எவர்_வியாபாரி",என்ற அரிய நூல் சிறந்த படைப்பாகும்.,5
"எது_வியாபாரம்,_எவர்_வியாபாரி",அவர்கள் ஒரு தலைசிறந்த வணிகராகத் திகழ்ந்தார்.,5
"எது_வியாபாரம்,_எவர்_வியாபாரி","வணிகத்துக்கும், வணிகனுக்கும் இலக்கணமாக விளங்கினார்.",4
"எது_வியாபாரம்,_எவர்_வியாபாரி",மீண்டும் மீண்டும் படிக்க ஆவலைத் தூண்டுகின்றன.,5
"எது_வியாபாரம்,_எவர்_வியாபாரி","﻿ வணிகரான அவர், தம் சொந்த முயற்சினால் உழைப்பினால், வணிகத்தில் மட்டும் தலைசிறந்தவராக விளங்கவில்லை.",11
"எது_வியாபாரம்,_எவர்_வியாபாரி","அத்துடன் தமிழ் இலக்கியத்திலும் மாபெரும் அறிஞராய் உயர்ந்து, சித்த மருத்துவத்திலும் சிறந்த விற்பன்னராக விளங்குகிறார்.",11
"எது_வியாபாரம்,_எவர்_வியாபாரி","அவருடைய அரிய, பெரிய சாதனை வணிக சமுதாயத்தினர் அனைவருக்கும் பெருமையளிப்பதாகும்.",8
"எது_வியாபாரம்,_எவர்_வியாபாரி",﻿ ﻿எது வியாபாரம்?,3
"எது_வியாபாரம்,_எவர்_வியாபாரி",﻿ யார் வியாபாரி?,3
"எது_வியாபாரம்,_எவர்_வியாபாரி",﻿ திருக்குரானில் வணிகம்...,3
"எது_வியாபாரம்,_எவர்_வியாபாரி",﻿ திருக்குறளில் வணிகம்...,3
"எது_வியாபாரம்,_எவர்_வியாபாரி",﻿ கோலாலம்பூரில் வணிகம்...,3
"எது_வியாபாரம்,_எவர்_வியாபாரி",﻿ சிங்கப்பூரில் வணிகம்...,3
"எது_வியாபாரம்,_எவர்_வியாபாரி",வணிகம் வணிகன் என்பன நல்ல தமிழ்ச் சொற்கள்.,6
"எது_வியாபாரம்,_எவர்_வியாபாரி","இவை அடியோடு மறைந்து, வியாபாரம் வியாபாரி, வர்த்தகம் வர்த்தகன் என்பன போன்ற பிறசொற்களே வழக்கத்தில் இருந்து வருகின்றன.",13
"எது_வியாபாரம்,_எவர்_வியாபாரி","அதிலும் சிறு தொழிலை வியாபாரம் என்றும், பெருந்தொழிலை வர்த்தகம் என்றும் கூறி வருகின்றனர்.",10
"எது_வியாபாரம்,_எவர்_வியாபாரி",வர்த்தகர்களின் சின்னம் தராசு.,3
"எது_வியாபாரம்,_எவர்_வியாபாரி","நிறுப்பவன் எவனாக இருந்தாலும், நிறுப்பது எதுவாக இருந்தாலும், தராசின் முள் சிறிது முனைக்கும்படி நிறுக்க வேண்டும்.",12
"எது_வியாபாரம்,_எவர்_வியாபாரி",முள் பின்னுக்குப்போனால் வியாபாரம் பின்னுக்குப் போய் அடியோடு அழிந்து ஒழிந்து விடும்.,9
"எது_வியாபாரம்,_எவர்_வியாபாரி",தராசைப் பிடித்து நிறுக்கிற ஒவ்வொருவரும் இதைத் தம் உள்ளத்தில் பதிய வைத்துக் கொள்வது நல்லது.,11
"எது_வியாபாரம்,_எவர்_வியாபாரி",காரணம் தராசின் முள் நடுநிலை வகிப்பதுபோல வர்த்தகர்களின் உள்ளமும் எப்போதும் நடுநிலைமை வகிக்க வேண்டும்.,11
"எது_வியாபாரம்,_எவர்_வியாபாரி","கிடைக்குமிடத்தில் வாங்கி, கிடைக்காத இடத்தில் விற்பது வியாபாராம்.",6
"எது_வியாபாரம்,_எவர்_வியாபாரி",விளையுமிடத்தில் வாங்கி விளையாத இடத்தில் விற்பது வியாபாரம்.,6
"எது_வியாபாரம்,_எவர்_வியாபாரி","உழவர்களுக்கும், தொழிலாளிகளுக்கும் பொது மக்களுக்கும் ஒரு பாலமாய் அமைவது தான் வியாபாரம்.",9
"எது_வியாபாரம்,_எவர்_வியாபாரி",இதைச் செய்யும் வியாபாரிக்கு ஊதியம் அடைய உரிமையுண்டு.,6
"எது_வியாபாரம்,_எவர்_வியாபாரி",அது ஒரு அளவுக்குள் இருக்கும்பொழுது இலாபம் என்று பெயர் பெறும்.,8
"எது_வியாபாரம்,_எவர்_வியாபாரி",அளவுக்கு மீறினால் கொள்ளை என்றாகி விடும்.,5
"எது_வியாபாரம்,_எவர்_வியாபாரி",நாட்டின் உறுப்பு ஒரு மனிதனின் உடல் உறுப்புக்களும் ஒரு நாட்டின் உறுப்புக்களும் ஒன்றுதான் வெவ்வேறல்ல.,11
"எது_வியாபாரம்,_எவர்_வியாபாரி",ஒரு நாட்டின் வர்த்தகம் பாழ்படுமானால் முதுகெலும்பு இல்லாத மனிதனைப் போன்று அந்ந நாடு காட்சியளிக்கும்.,11
"எது_வியாபாரம்,_எவர்_வியாபாரி",﻿ நாணயம் ஒரு வியாபாரிக்கு முதல் தேவை நாணயம்.,7
"எது_வியாபாரம்,_எவர்_வியாபாரி",சொல் ஒன்று எழுத்து நான்கு பொருள் மூன்று.,6
"எது_வியாபாரம்,_எவர்_வியாபாரி",நாணயம்—பணம் ஒரு வியாபாரத்திற்குப் பொருள் முதலில் தேவை.,6
"எது_வியாபாரம்,_எவர்_வியாபாரி",அதற்கு மூலதனம் என்றும் பொருள்.,4
"எது_வியாபாரம்,_எவர்_வியாபாரி",முதல் வைத்துத் தொழில் செய்பவன்தான் முதலாளி.,5
"எது_வியாபாரம்,_எவர்_வியாபாரி",கடன் வாங்கித் தொழில்செய்பவன் முதலாளியாகான்.,4
"எது_வியாபாரம்,_எவர்_வியாபாரி",வேண்டுமானால் அவன் கடனாளி எனப் பெயர் வைத்துக் கொள்ளலாம்.,7
"எது_வியாபாரம்,_எவர்_வியாபாரி",கடன் வாங்கி வியாபாரம் செய்கிறவன் வெற்றி பெற முடியாது.,7
"எது_வியாபாரம்,_எவர்_வியாபாரி",வியாபாரத்தில் வரும் இலாபம் அனைத்தையும் வட்டி தின்று விடும்.,7
"எது_வியாபாரம்,_எவர்_வியாபாரி",யானை அசைந்து தின்னும் வட்டி அசையாமல் தின்னும் என்பது ஒரு பழமொழி.,9
"எது_வியாபாரம்,_எவர்_வியாபாரி","காசுக்கு எட்டு சட்டி வாங்கி, சட்டி எட்டுக் காசிற்கு விற்றாலும் வட்டிக்குக் கட்டாது என்பது மற்றொரு பழமொழி.",13
"எது_வியாபாரம்,_எவர்_வியாபாரி",கெடு தாண்டினால் நாணயமும் போய்விடும்.,4
"எது_வியாபாரம்,_எவர்_வியாபாரி",குறைந்தால் நாணயமும் போய்விடும்.,3
"எது_வியாபாரம்,_எவர்_வியாபாரி",நாணயம் — நா நயம் இனிய சொற்களைச் சொல்வது.,7
"எது_வியாபாரம்,_எவர்_வியாபாரி",நாம் ஐந்து ரூபாய் விலை சொன்னால் கேட்கிறவன் மூன்று ரூபாய்க்குக் கேட்பான்.,9
"எது_வியாபாரம்,_எவர்_வியாபாரி","அப்படிக் கேட்பவனிடம் கடிந்து கொள்ளாமல், முகம் சுளிக்காமல், இப்போது உங்களுக்குப் பருவம் தெரியாது.",10
"எது_வியாபாரம்,_எவர்_வியாபாரி",இதுதான் குறைந்த விலை.,3
"எது_வியாபாரம்,_எவர்_வியாபாரி",இன்னும் நாலு கடைகளில் விலையைக் கேட்டுப் பாருங்கள்.,6
"எது_வியாபாரம்,_எவர்_வியாபாரி",இதைவிட அதிக விலை கூறுவார்கள்.,4
"எது_வியாபாரம்,_எவர்_வியாபாரி",நாக்கு தீய சொற்களைச் சொல்லப் படைக்கப்பட்டதல்ல என்பதை மற்றவர்களைவிட வியாபாரிகள் உணர்வது நல்லது.,10
"எது_வியாபாரம்,_எவர்_வியாபாரி",ஒரு நாட்டு மக்களில் அதிகத் திறமைசாலிகளாகக் காணப்படுகிறவர்கள் வியாபாரிகளே.,7
"எது_வியாபாரம்,_எவர்_வியாபாரி",இத்தனை பேரிடமும் பழகிப் பட்ட அறிவுபெறுவதினாலேயே ஒவ்வொரு வியாபாரியும் திறமைசாலியாகக் காணப்படுகிறான்.,9
"எது_வியாபாரம்,_எவர்_வியாபாரி",ஆகவே திறமைசாலிகளாகக் காணப்படுகிறவர்களே வியாபாரிகளாவர்.,4
"எது_வியாபாரம்,_எவர்_வியாபாரி",மட்டச் சரக்குகளை வாங்கிக் குறைந்த விலைக்கு விற்பது வியாபாரமாகாது.,7
"எது_வியாபாரம்,_எவர்_வியாபாரி",ஏனெனில் எந்த உயர்ந்த சரக்கையும் குறைந்த விலைக்கு யாரும் விற்க முடியாது.,9
"எது_வியாபாரம்,_எவர்_வியாபாரி",உயர்ந்த சரக்கு அதிக விலை என்பதே உண்மையானதாக இருக்கும்.,7
"எது_வியாபாரம்,_எவர்_வியாபாரி",மக்களும் இதனை நம்புவர்.,3
"எது_வியாபாரம்,_எவர்_வியாபாரி",எழுபது ஆண்டுகளுக்கு முன்பு திருச்சிராப்பள்ளியில் உள்ள வணிகம் இந்த முறையிலேயே நடைபெற்று வந்தது.,10
"எது_வியாபாரம்,_எவர்_வியாபாரி",இப்பொழுது சில வணிகர்கள் இதை மீண்டும் தொடங்கியிருப்பது மகிழ்ச்சிக் குரியதாகும்.,8
"எது_வியாபாரம்,_எவர்_வியாபாரி",﻿ ஏமாற்றம் ஏமாறுகிறவர்கள் இல்லாவிடில் ஏமாற்றுகிறவர்கள் இல்லை.,6
"எது_வியாபாரம்,_எவர்_வியாபாரி",ஏமாறுகிறவர்கள் இருப்பதினாலேயே ஏமாற்றுகிறவர்களும் இருக்கிறார்கள்.,4
"எது_வியாபாரம்,_எவர்_வியாபாரி",ஒரு நல்லவியாபாரி பிறரை ஏமாற்றவும் மாட்டான் தானும் ஏமாறமாட்டான்.,7
"எது_வியாபாரம்,_எவர்_வியாபாரி",வேலையில்லாத் திண்டாட்டம் தமிழகத்தில் வேலையில்லாத் திண்டாட்டம் பெருகி வருகின்றது.ஏறத்தாழப் பல லட்சம் பட்டதாரிகள் வேலையின்றி இருக்கின்றார்கள்.,13
"எது_வியாபாரம்,_எவர்_வியாபாரி",இதற்குக் காரணம் இவர்களுடைய கல்லூரிப் படிப்பு இவர்களை கிளார்க் வேலைக்கு மட்டுமே தயார்செய்து அனுப்பி வைப்பதுதான்.,12
"எது_வியாபாரம்,_எவர்_வியாபாரி",இவர்கள் வேறு எந்தத் தொழிலுக்கும் தகுதி உடையவர்களாக இருப்பதில்லை.,7
"எது_வியாபாரம்,_எவர்_வியாபாரி","கொல்லு வேலை, உழவு வேலை, தச்சு வேலை, கொத்து வேலை முதலிய வேலைகளுக்கு ஆட்கள் கிடைப்பதில்லை.",12
"எது_வியாபாரம்,_எவர்_வியாபாரி",இவர்கள் வேலை கிடைக்கவில்லை என்று அலைந்து கொண்டு இருக்கிறார்கள்.,7
"எது_வியாபாரம்,_எவர்_வியாபாரி",இன்றைய கல்லூரிப் படிப்பு அதையும் செய்வதில்லை.,5
"எது_வியாபாரம்,_எவர்_வியாபாரி",இதனால் வியாபாரம் பெருகாமல் கடை கள் மட்டுமே பெருகுகின்றன.,7
"எது_வியாபாரம்,_எவர்_வியாபாரி",ஓர் ஆயிரம் வீடுகள் உள்ள ஓர் ஊரில் ஐம்பது கடைகள் திறக்கப்படுகின்றன.,9
"எது_வியாபாரம்,_எவர்_வியாபாரி",ஒவ்வொரு கடைக்காரரும் அதிக வியாபாரத்தை எண்ணி விலையைக் குறைக்கத் தொடங்குகிறார்கள்.,8
"எது_வியாபாரம்,_எவர்_வியாபாரி",அதற்கேற்ப மட்ட சரக்குகளை விற்கிறார்கள்.,4
"எது_வியாபாரம்,_எவர்_வியாபாரி",அதிலும் சிலர் கலப்படம் செய்து விற்று வாழத் தொடங்கிவிட்டார்கள்.,7
"எது_வியாபாரம்,_எவர்_வியாபாரி",இதை வாங்கி உண்ணும் மக்களுக்கு வயிற்றுப் போக்கு போகத் தொடங்குகிறது.,8
"எது_வியாபாரம்,_எவர்_வியாபாரி",இந்தப் போக்கு நாட்டின் போக்குக்கு நல்லதல்ல.,5
"எது_வியாபாரம்,_எவர்_வியாபாரி",இதை அரசும் மக்களும் வணிகரும் கவனிப்பது நல்லது.,6
"எது_வியாபாரம்,_எவர்_வியாபாரி",ஒரு நாடு சிறந்து விளங்க வேண்டுமானால் அந்த நாட்டின் வணிகம் சிறந்து விளங்க வேண்டும்.,11
"எது_வியாபாரம்,_எவர்_வியாபாரி",அந்த நாட்டை வணிகர்கள் ஆள வேண்டும்.,5
"எது_வியாபாரம்,_எவர்_வியாபாரி",இன்றைக்கு உலகில் சிறந்து விளங்கும் நாடுகளில் பல நாடுகள் வணிகர்களையே நாடாளுமன்ற உறுப்பினர்களாகக் கொண்டு விளங்குகின்றன.,12
"எது_வியாபாரம்,_எவர்_வியாபாரி","இதற்கு எடுத்துக்காட்டாக இங்கிலாந்தையும், ஜெர்மனியையும், ஜப்பானையும், கூறலாம்.",6
"எது_வியாபாரம்,_எவர்_வியாபாரி",அதிலும் ஜப்பானிய அரசு வியாபாரிகளாலேயே ஆளப்படுகிறது.,5
"எது_வியாபாரம்,_எவர்_வியாபாரி",﻿ திருக்குரானில் வணிகம் பெருமானார் நபிகள் நாயகம் அவர்கள் இவ்வுலகில் அறுபத்திரண்டு ஆண்டுகள் உயிர் வாழ்ந்தார்கள்.,12
"எது_வியாபாரம்,_எவர்_வியாபாரி","அவர் செய்து வந்த வணிகம் ஒட்டக வணிகம். வியாபாரி ஒருவர் அவரிடம் வந்து, ஒட்டகத்தின் விலைகளைக் கேட்டார்.",13
"எது_வியாபாரம்,_எவர்_வியாபாரி",முதலில் ஒட்டகத்தைப் பார்த்து வாருங்கள் விலை பேசலாம் என்றார் பெருமானார்.,8
"எது_வியாபாரம்,_எவர்_வியாபாரி",வியாபாரியும் அப்படியே ஒட்டகத்தைப் போய்ப் பார்த்து வந்து பெருமானார் அவர்களிடம் ஒட்டகத்தின் விலையைக் கேட்டார்.,11
"எது_வியாபாரம்,_எவர்_வியாபாரி","எத்தனை ஒட்டகங்கள் வேண்டுமென்று பெருமானார் கேட்க, மந்தையிலுள்ள நாற்பது ஒட்டகங்களையுமே எடுத்துக் கொள்ளுகிறேன்.",10
"எது_வியாபாரம்,_எவர்_வியாபாரி",அத்தனைக்கும் விலையைக் கூறுங்கள் என்றார் வந்தவர்.,5
"எது_வியாபாரம்,_எவர்_வியாபாரி","பெருமானார் புன்சிரிப்போடு சிரித்து, நாற்பது ஒட்டகங்களில் ஒரு ஒட்டகம் நொண்டி ஆயிற்றே !",9
"எது_வியாபாரம்,_எவர்_வியாபாரி",அதுவுமா உங்களுக்குத் தேவை? என்று திருப்பிக் கேட்டார்.,6
"எது_வியாபாரம்,_எவர்_வியாபாரி",அது மற்ற ஒட்டகங்களுடன் சேர்ந்தே ﻿இருக்கட்டும் அதற்கும் சேர்த்தே விலை கூறுங்கள் என்றார்.,10
"எது_வியாபாரம்,_எவர்_வியாபாரி","அதற்குப்பெருமானார், அந்தநொண்டி ஒட்டகத்தைத் தவிர மற்ற முப்பத்தொன்பது ஒட்டகங்களின் விலை இவ்வளவுதான்.",9
"எது_வியாபாரம்,_எவர்_வியாபாரி",இதைக் கொடுத்தால் போதும்.,3
"எது_வியாபாரம்,_எவர்_வியாபாரி","நீங்கள் விரும்பினால் அந்த நொண்டி ஒட்டகத்தை இலவசமாகக் கூட்டிப் போகலாம், அல்லது இங்கேயே விட்டுப் போகலாம்.",12
"எது_வியாபாரம்,_எவர்_வியாபாரி",நான் அதற்குத் தீனி போட்டுட் பாதுகாப்பேன்.,5
"எது_வியாபாரம்,_எவர்_வியாபாரி",நீங்கள் அதை அழைத்துப் போனால் எனக்கு செலவு இராது.,7
"எது_வியாபாரம்,_எவர்_வியாபாரி",ஆகவே அதற்கு விலை தேவையில்லை என்று கூறி முடித்தார்கள்.,7
"எது_வியாபாரம்,_எவர்_வியாபாரி",அப்படியே நடந்து முடிந்தது.,3
