work_title,sentence,sentence_length
எனது_நாடக_வாழ்க்கை,பசுவை வாங்கிக் கொள்வதாக வாயால் பேசியதைத் தவிர வேறு எதுவும் நடக்கவில்லை.,9
எனது_நாடக_வாழ்க்கை,அதற்காக முன் பணமும் கொடுக்கவில்லை.,4
எனது_நாடக_வாழ்க்கை,இந்தச் சம்பவம் எங்களுக்குப் பெரும் அதிர்ச்சியைத் தந்தது.,6
எனது_நாடக_வாழ்க்கை,பால்காரருக்கும் பிள்ளைக்கும் நீண்ட நேர வாதம் நடந்தது.,6
எனது_நாடக_வாழ்க்கை,"இறுதியாகப் பால்காரர், பிள்ளையைக்கண்டபடி ஏசிவிட்டுப் போய்ச் சேர்ந்தார்.",6
எனது_நாடக_வாழ்க்கை,மீண்டும் ஊர் திரும்பினோம் வசூல் இல்லாமல் சாப்பாட்டு நிருவாகம் தத்தளித்தது.,8
எனது_நாடக_வாழ்க்கை,என்ன செய்வதென்று தோன்றவில்லை.,3
எனது_நாடக_வாழ்க்கை,நீடித்து நடத்த முடியாமல் தர்மராஜபிள்ளை ஒரு நாள் சொல்லாமலே போய்விட்டார்.,8
எனது_நாடக_வாழ்க்கை,நாடகக் கொட்டகைச் சொந்தக்காரர் தம் வாடகைப் பாக்கிக்காகச் சாமான்களை வைத்துக் கொண்டார்.,9
எனது_நாடக_வாழ்க்கை,"காட்சிகள், உடைகள் முதலிய எங்கள் சாமான்கள் கொட்டகையில் இருந்தன.",7
எனது_நாடக_வாழ்க்கை,"அவை எங்களுடையதென்று கொட்டகைக்காரர் மீது வழக்குத் தொடர்ந்து, அவற்றை மீட்க வேண்டிய நெருக்கடி ஏற்பட்டு விட்டது.",12
எனது_நாடக_வாழ்க்கை,"எப்படியோ ஒரு வகையாகச் சாமான்களை மீட்டு, அவற்றையெல்லாம் ஒருவீட்டில் போட்டு வைத்தோம்.",9
எனது_நாடக_வாழ்க்கை,புதிதாகச் சேர்ந்திருந்த சில பையன்களை அவரவர் ஊருக்கு அனுப்பி வைக்க வேண்டிய பொறுப்பும் எங்கள் தலையில் சுமந்தது.,13
எனது_நாடக_வாழ்க்கை,"எல்லோரையும் அனுப்பிவிட்டு, ஊரிலிருந்து புறப்பட்ட எங்கள் சிறிய குழுவுடன் நாகர்கோவிலுக்குத் திரும்பினோம்.",9
எனது_நாடக_வாழ்க்கை,பெரியண்ணா மனச் சோர்வு பெரியண்ணாவுக்கு மிகுந்த மனச்சோர்வு ஏற்பட்டுவிட்டது.,7
எனது_நாடக_வாழ்க்கை,எங்கள் மூவரை மட்டும் ஏதாவது ஒரு கம்பெனியில் சேர்ந்துவிட எண்ணினார்.,8
எனது_நாடக_வாழ்க்கை,சில காலமாவது கம்பெனி நடத்தும் தொந்தரவி லிருந்து நிம்மதி பெற விரும்பினார்.,9
எனது_நாடக_வாழ்க்கை,நவாப் ராஜமாணிக்கம் பிள்ளைக்குக்கூட எழுதியதாக அறிந்தோம்.,5
எனது_நாடக_வாழ்க்கை,எவரிடமிருந்தும் அனுகூலமான பதில் வரவில்லை.,4
எனது_நாடக_வாழ்க்கை,இரண்டு மாதகாலம் அமைதியின்றிக் காலம் கழித்தோம்.,5
எனது_நாடக_வாழ்க்கை,எஸ் வேலப்பன் இருவரும் சாரதாம்பாள் கம்பெனிக்குப் போய்விட்டார்கள்.,6
எனது_நாடக_வாழ்க்கை,நாங்கள் கம்பெனி ஆரம்பிக்கப் போவதை எதிப்பார்த்து என்.,6
எனது_நாடக_வாழ்க்கை,கிருஷ்ணன் மட்டும் காத்திருந்தார்.,3
எனது_நாடக_வாழ்க்கை,நாட்கள் செல்லச் செல்ல அவருடைய உறுதியும் தளர்ந்தது.,6
எனது_நாடக_வாழ்க்கை,எல்லோரிடமும் வறுமை தாண்டவமாடியது.,3
எனது_நாடக_வாழ்க்கை,கிருஷ்ணன் எங்களைச் சந்திப்பார்.,3
எனது_நாடக_வாழ்க்கை,கம்பெனியைத் தொடங்கச் சொல்லி வற்புறுத்துவார்.,4
எனது_நாடக_வாழ்க்கை,"ஒருநாள் பெரியண்ணா, எங்களுக்காக நீ காத்திருக்க வேண்டாம்.",6
எனது_நாடக_வாழ்க்கை,எந்தக் கம்பெனியிலாவது சேர்ந்து கொள்.,4
எனது_நாடக_வாழ்க்கை,பிறகு நாங்கள் கம்பெனி தொடங்கும்போது உன்னை அழைத்துக்கொள் கிறோம் என்று சொன்னார்.,9
எனது_நாடக_வாழ்க்கை,கிருஷ்ணன் வருத்தத்துடன் பின்னும் சில நாட்கள் இருந்து பார்த்தார்.,7
எனது_நாடக_வாழ்க்கை,நாயுடு அடிக்கடி அவருக்குக் கடிதம் எழுதி வற்புறுத்தினார்.,6
எனது_நாடக_வாழ்க்கை,அச்சமயம் கோல்டன் கம்பெனியே நாகர்கோவிலுக்கு வந்து விட்டது.,6
எனது_நாடக_வாழ்க்கை,நாடகங்கள் தொடர்ந்து நடைபெற்றன.,3
எனது_நாடக_வாழ்க்கை,கே.யும் அடிக்கடி நாடகங்கள் பார்த்தோம்.,5
எனது_நாடக_வாழ்க்கை,சாரதாம்பாள் என்.எஸ்.கிருஷ்ணனைத் தம் கம்பெனியில் சேர்ந்து விடும்படி நேரில் கேட்டுக்கொண்டார்.,10
எனது_நாடக_வாழ்க்கை,கே. அதுபற்றி யோசிப்பதாகக் கூறினார்.,4
எனது_நாடக_வாழ்க்கை,நாகர்கோவில் முடிந்து கம்பெனி திருவனந்தபுரம் சென்றது.,5
எனது_நாடக_வாழ்க்கை,அங்கு சென்ற பிறகும் நாயுடுவின் வற்புறுத்தல் கடிதங்கள் வந்தன.,7
எனது_நாடக_வாழ்க்கை,இறுதியாக வேறு வழியில்லாத நிலையில் என்.,5
எனது_நாடக_வாழ்க்கை,"கிருஷ்ணன் ஒருநாள் எங்களிடம் வந்து கண்களில் நீர் ததும்பப் பிரியாவிடை பெற்று, சாரதாம்பாள் கம்பெனிக்குப் போய்ச் சேர்ந்தார்.",13
எனது_நாடக_வாழ்க்கை,பெரியண்ணா இதை விரும்பவில்லை.,3
எனது_நாடக_வாழ்க்கை,இந்தத் தொந்தரவு அடிக்கடி ஏற்பட்டதால் தவிர்க்க முடியாமல் இரு நாடகங்களில் நடிக்க நேர்ந்தது.,10
எனது_நாடக_வாழ்க்கை,"ஒன்று அல்லி அர்ஜூனா, மற்றொன்று சதாரம்.",5
எனது_நாடக_வாழ்க்கை,ஸ்பெஷல் நாடக அனுபவம் எனக்கில்லை.,4
எனது_நாடக_வாழ்க்கை,என்றாலும் ஏராளமான ஸ்பெஷல் நாடகங்களைப் பார்த்திருப்பதால் சமாளித்துக் கொள்ளலாம் என்ற துணிவோடு ஒப்புக் கொண்டேன்.,11
எனது_நாடக_வாழ்க்கை,"முதல் நாடகம் அல்லி அர்ஜூனா, சுசீந்திரத்தை அடுத்த தாமரைக் குளத்தில் நடந்தது.",9
எனது_நாடக_வாழ்க்கை,"என் தந்தையாரோடு இளமையில் நடித்த ஐயப்பன் உடையார் பிள்ளை, அன்று ஸ்ரீ கிருஷ்ணனக நடித்தார்.",11
எனது_நாடக_வாழ்க்கை,"நான் அர்ஜுனன், நாஞ்சில் நாட்டில் அப்பொழுது பிரபலமாய் இருந்த நாகர் கோவில் லக்ஷ்மி அல்லியாக நடித்தார்.",12
எனது_நாடக_வாழ்க்கை,ஒசரவிளை உடையார்பிள்ளை இவர் நாஞ்சில் நாட்டில் குறிப்பிடத்தக்க நாடக ஆசிரியர்.,8
எனது_நாடக_வாழ்க்கை,மிகச்சிறந்த ஐயப்பசுவாமி பக்தர்.,3
எனது_நாடக_வாழ்க்கை,எப்போதும் இவருடைய வாய் சாமியே சரணம் ஐயப்பா என்று துதித்த வண்ணமிருக்கும்.,9
எனது_நாடக_வாழ்க்கை,நவாப் இராஜமாணிக்கம் கம்பெனிக்கு பிரசித்தி பெற்ற சபரிமலை ஐயப்பன் நாடகத்தை எழுதிப் பயிற்றுவித்தவர் இவரே தாம்.,12
எனது_நாடக_வாழ்க்கை,இவர் என் தந்தைக்கு மிகவும் வேண்டியவராதலால் என்னைக் கண்டதும் அன்பு பாராட்டி அணைத்துக்கொண்டு பாசமும் பரிவும் காட்டினார்.,13
எனது_நாடக_வாழ்க்கை,இரண்டாவது ஸ்பெஷல் நாடகம் சதாரம்.,4
எனது_நாடக_வாழ்க்கை,நாகர்கோவில் மீனாட்சிபுரத்திலுள்ள ஸ்ரீமீனாம்பிகா தியேட்டரில் நடந்தது.,5
எனது_நாடக_வாழ்க்கை,அதில் நான் மயோனாக நடித்தேன்.,4
எனது_நாடக_வாழ்க்கை,மற்றப் பாத்திரங்களைத் தாங்கி நடித்தவர்களின் பெயர்கள் எனக்கு நன்கு நினைவில்லை.,8
எனது_நாடக_வாழ்க்கை,"சதாரத்தைச் சல்லாபம் செய்ய அழைக்கும் கட்டத்தில், நான் பாடிய காதல் பாட்டுக்களை ரசிகர்கள் பிரமாதமாக ரசித்துக் கைதட்டிப் பாராட்டினார்கள்.",14
எனது_நாடக_வாழ்க்கை,"சுவாமிகளின் நாடகங்களிலுள்ள எத்தனையோ காதல் பாட்டுக்களும், உரையாடல்களும் எனக்கு மனப்பாடமாய் இருந்ததால் சிறிதும் சிரமப் படாமல் சமாளித்தேன்.",13
எனது_நாடக_வாழ்க்கை,தாமரைக் குளத்தைப் போலவே இங்கும் பெரும் புகழ் கிடைத்தது.,7
எனது_நாடக_வாழ்க்கை,இரண்டு ஸ்பெஷல் நாடகங்களிலும் பேரும் புகழும் பெற்று விட்டதால் ஸ்பெஷல் நாடகக் காண்ட்ராக்டர்கள் என்னை முற்றுகை யிட்டார்கள்.,13
எனது_நாடக_வாழ்க்கை,"ஆனால் எனக்கோ, என் சகோதரர்களுக்கோ இந்த நாடகங்கள் மகிழ்ச்சி அளிக்கவில்லை.",8
எனது_நாடக_வாழ்க்கை,ஆடம்பரமும் அமுலும் ஸ்பெஷல் நாடகத்திற்கு நான் நடிக்க ஒப்புக்கொண்டதும் எனது மருமகன் டி.,10
எனது_நாடக_வாழ்க்கை,"சிவதாணுவுக்கும், எங்கள் பழைய நடிகரும் எங்கள் அன்புக்கு பாத்திரருமான கொல்லம் பால கிருஷ்ணனுக்கும் ஒரே குவி.",12
எனது_நாடக_வாழ்க்கை,ஸ்பெஷல் நாடக ராஜபார்ட்டு காரர்களுக்குச் சில கையாட்கள் நடத்தும் ஆடம்பரப் படாடோபங்களை எனக்கும் நடத்த இவர்கள் ஆசைப்பட்டார்கள்.,13
எனது_நாடக_வாழ்க்கை,முதல் நாடகத்தன்று நான் காரில்போய் தாமரைக் குளம் நாடகக் கொட்டகைக்கு முன் இறங்கியதுமே இவர்களது இந்த அமுல் தொடங்கிவிட்டது.,14
எனது_நாடக_வாழ்க்கை,"என் முன்னை கூடிநின்றவர்களை யெல்லாம் விலகுங்கள் விலகுங்கள் என்று சொல்லி, அமளி துமளிப்படுத்தினார்கள்.",10
எனது_நாடக_வாழ்க்கை,இது எனக்கு மிகவும் கூச்சமாக இருந்தது.,5
எனது_நாடக_வாழ்க்கை,நான் எவ்வளவோ தடுத்து விலக்கியும் இவர்கள் கேட்கவில்லை.,6
எனது_நாடக_வாழ்க்கை,ஸ்பெஷல் நாடக ராஜபார்ட்டுக்கு இந்த ஆடம்பரமெல்லாம் தேவையென்று சொல்லி என் வாயை அடைத்து விட்டார்கள்.,11
எனது_நாடக_வாழ்க்கை,பாலகிருஷ்ண சாஸ்திரி கம்பெனி திடீரென்று ஒரு நாள் பாலகிருஷ்ண சாஸ்திரியிடமிருந்து கடிதம் வந்தது.,10
எனது_நாடக_வாழ்க்கை,மடிந்து கொண்டிருந்த பழைய ஜெகனாதையர் கம்பெனி நடிகர்களில் சிலர் அவருடைய நிருவாகத்தில் வேலூரில் நாடகம் நடத்திக் கொண்டிருந்தார்கள்.,13
எனது_நாடக_வாழ்க்கை,பாலகிருஷ்ணசாஸ்திரி ஏற்கனவே எங்களுக்குப் பல ஆண்டுகளாக அறிமுகமானவர்.,6
எனது_நாடக_வாழ்க்கை,"மின்சாரம் இல்லாத கொட்டகைகளில் அவர்தான் இஞ்சின் கொண்டு வந்து, வாடகைக்கு மின்சாரம் கொடுத்து உதவுவார்.",11
எனது_நாடக_வாழ்க்கை,எங்களிடம் அவருக்கு அபார நம்பிக்கை.,4
எனது_நாடக_வாழ்க்கை,"வேலூருக்கு வந்து, தாம் நடத்தும் கம்பெனியில் ஒத்துழைக்க வேண்டுமென்று அவர் கடிதம் எழுதியிருந்தார்.",10
எனது_நாடக_வாழ்க்கை,பாலசுப்பிரமணியத்தின் அன்பு கம்பெனியின் நிருவாகம் யாரிடத்தில் இருக்கிறதென்றே புரியவில்லை.,7
எனது_நாடக_வாழ்க்கை,சாப்பாட்டு நிருவாகம் ஒழுங்காக இல்லை.,4
எனது_நாடக_வாழ்க்கை,பால சுப்பிரமணியம் தாயுடன் தனியே குடியிருந்தார்.,5
எனது_நாடக_வாழ்க்கை,நாங்கள் வந்ததற்காக உண்மையில் சந்தோஷப்பட்டவர் அவர் ஒருவர்தாம்.,6
எனது_நாடக_வாழ்க்கை,அவரும் நாங்களும் நன்கு அளவளாவி மகிழ்ந்தோம்.,5
எனது_நாடக_வாழ்க்கை,அவருடைய தாயார் எங்களிடம் மிகவும் பரிவு காட்டினார்கள்.,6
எனது_நாடக_வாழ்க்கை,பால சுப்பிரமணியம் ஜெகனாதையரின் ஸ்ரீபால மீன ரஞ்சனி சங்கீத சபையில் இருந்தவர்.,9
எனது_நாடக_வாழ்க்கை,பழம் பெரும் நடிகர்.,3
எனது_நாடக_வாழ்க்கை,"ஐயர் கம்பெனியில் சங்கரதாஸ் சுவாமிகள் ஆசிரியராக இருந்த காலத்தில், அவரிடம் பயின்றவர்.",9
எனது_நாடக_வாழ்க்கை,சுவாமிகளிடம் அளவுகடந்த பக்தியுடையவர்.,3
எனது_நாடக_வாழ்க்கை,இலக்கியப் பற்று மிகுந்தவர்.,3
எனது_நாடக_வாழ்க்கை,நாங்கள் போனபின் வேலூரில் சில நாடகங்கள் நடந்தன.,6
எனது_நாடக_வாழ்க்கை,சாஸ்திரி அடிக்கடி வெளியூருக்குப் போய்க் கொண்டிருந்தார்.,5
எனது_நாடக_வாழ்க்கை,சாப்பாட்டு நிருவாகம் ஒரே ஊழலாக இருந்தது.,5
எனது_நாடக_வாழ்க்கை,ஒருநாள் பகல் பதினொரு மணிவரை அடுப்பே எரியவில்லை.,6
எனது_நாடக_வாழ்க்கை,அதற்கு மேல் அரிசி காய் கறிகள் எல்லாம் வந்தன.,7
எனது_நாடக_வாழ்க்கை,சமையல் ஆரம்ப மாயிற்று.,3
எனது_நாடக_வாழ்க்கை,பிற்பகல் இரண்டரை மணிக்குத்தான் உணவு கிடைத்தது.,5
எனது_நாடக_வாழ்க்கை,"நாங்கள், இருக்கும் நிலைமையைப் பார்த்து வருந்தினோம்.",5
எனது_நாடக_வாழ்க்கை,கம்பெனிக்கு யார் பொறுப்பாளி யென சாஸ்திரியைக் கேட்டோம்.,6
எனது_நாடக_வாழ்க்கை,திருப்தியான பதில் கிடைக்கவில்லை.,3
எனது_நாடக_வாழ்க்கை,நாங்கள் இந்த நிலைமையில் இங்கே இருப்பது சாத்தியமில்லை எங்களை ஊருக்கு அனுப்பி விடுங்கள் என்று வேண்டினோம்.,12
எனது_நாடக_வாழ்க்கை,பெரும் நஷ்டம் ஏற்பட்டதால் கம்பெனி கலைக்கப்பட்டது.,5
எனது_நாடக_வாழ்க்கை,அக்கம்பெனியின் காட்சிகளும் உடைகளும் அவரிடமிருந்தன.,4
எனது_நாடக_வாழ்க்கை,அவற்றில் உபயோகமான பொருட்களை எங்களுக்கு கொடுத்து உதவுவதாகக் கூறினார்.,7
எனது_நாடக_வாழ்க்கை,மீண்டும் கம்பெனியைத் தொடங்குமாறு வற்புறுத்தினார்.,4
எனது_நாடக_வாழ்க்கை,பழைய நடிகர்களில் பலர் மறுபடியும் வந்து சேர்ந்தார்கள்.,6
எனது_நாடக_வாழ்க்கை,புதிதாகச் சில நடிகர்களையும் சேர்த்துக்கொண்டோம்.,4
எனது_நாடக_வாழ்க்கை,கம்பெனி ஒழுங்காக நடைபெற்றது.,3
எனது_நாடக_வாழ்க்கை,"﻿பெரியார் ஜீவா நட்பு திண்டுக்கல்லில் இருந்து பொள்ளாச்சி, ஈரோடு முதலிய ஊர்களுக்குச் சென்றோம்.",10
எனது_நாடக_வாழ்க்கை,ஈரோட்டில் ஒரு நாள் ஈ. வெ.,5
எனது_நாடக_வாழ்க்கை,பெரியார் அவர்களைக் காண அவரது குடியரசு அச்சகத்திற்குச் சென்றேன்.,7
எனது_நாடக_வாழ்க்கை,முன்புற அறையில் உட்கார்ந்திருந்த ஒருவர் என்ன அன்புடன் வரவேற்றார்.,7
எனது_நாடக_வாழ்க்கை,"கறுத்து அடர்ந்த மீசை, கம்பீரமான தோற்றம், பேச்சிலே இனிமை தவழ்ந்தது.",8
