work_title,sentence,sentence_length
எனது_நாடக_வாழ்க்கை,கணக்குப்பிள்ளை தர்மராஜு யார் யாரோ குறுக்கே வந்து தடுத்தார்கள்.,7
எனது_நாடக_வாழ்க்கை,பலமாக அடித்த பிறகுதான் ஒய்ந்தார் அண்ணா.,5
எனது_நாடக_வாழ்க்கை,அப்போது இரவு மணி ஏழு.,4
எனது_நாடக_வாழ்க்கை,அன்று ஸ்ரீ கிருஷ்ண லீலா நாடகம்.,5
எனது_நாடக_வாழ்க்கை,நான் கொட்டகையை அடுத்த ஒரு வீட்டில் குடியிருந்தேன்.,6
எனது_நாடக_வாழ்க்கை,இரவு எட்டு முப்பது க்குத் தியேட்டருக்கு வந்தேன்.,6
எனது_நாடக_வாழ்க்கை,சுப்பையா என்னிடம் வந்தார்.,3
எனது_நாடக_வாழ்க்கை,என் மீது ஒரு குற்றமும் இல்லை.,5
எனது_நாடக_வாழ்க்கை,"கறுப்பு இராமசாமியும், சிவப்பு இராமசாமியும் கோள் மூட்டியதால் பெரியண்ணாச்சி என்னை அநியாயமாக அடித்து விட்டார் என்றார்.",12
எனது_நாடக_வாழ்க்கை,அவர் உடம்பில் அடிபட்ட காயங்கள் இருந்தன.,5
எனது_நாடக_வாழ்க்கை,நான் அவருக்கு ஆறுதல் கூறினேன்.,4
எனது_நாடக_வாழ்க்கை,"இதே போன்று தம்பி பகவதி, எஸ்.",5
எனது_நாடக_வாழ்க்கை,சகஸ்ரநாமம் போன்றவர்களெல்லாம் கூட அடி வாங்கியவர்கள் தாம் என்று கூறி அவரைச் சமாதானப்படுத்த முயன்றேன்.,11
எனது_நாடக_வாழ்க்கை,இரு இராமசாமிகளையும் பெரியண்ணாவிடம் புகார் கூறியதற்காகக் கடிந்து விட்டு வெளியே சென்றேன்.,9
எனது_நாடக_வாழ்க்கை,நள்ளிரவில் சென்ற கலைஞர் சுப்பையா சோகமே உருவாக ஒருபுறம் உட்கார்ந்திருந்தார்.,8
எனது_நாடக_வாழ்க்கை,இரவு மணி ஒன்பது.,3
எனது_நாடக_வாழ்க்கை,இன்னும் அரைமணி நேரத்தில் நாடகம் தொடங்க வேண்டும்.,6
எனது_நாடக_வாழ்க்கை,அன்று நாடகத்தில் சுப்பையாதான் வசு தேவர்.,5
எனது_நாடக_வாழ்க்கை,அவரோ வேடம் புனையவில்லை.,3
எனது_நாடக_வாழ்க்கை,முதல் காட்சியிலேயே வசுதேவர் வரவேண்டும்.,4
எனது_நாடக_வாழ்க்கை,இரண்டொருவர் சுப்பையாவிடம் போய் இன்னும் வேடம் புனையவில்லையா? என்று கேட்டார்கள்.,8
எனது_நாடக_வாழ்க்கை,அவர் வேடம் புனைய மறுத்து விட்டார்.,5
எனது_நாடக_வாழ்க்கை,சுப்பையா வசு தேவர் போட மறுக்கிறார் என்று சொல்லி எனக்கு ஆள் வந்தது.,10
எனது_நாடக_வாழ்க்கை,"பகவதி அன்று கம்சன், கே. ஆர்.",5
எனது_நாடக_வாழ்க்கை,"இராமசாமியும், பகவதியும் மாறி மாறிப் போடுவார்கள்.",5
எனது_நாடக_வாழ்க்கை,அன்று பகவதியின் முறை.,3
எனது_நாடக_வாழ்க்கை,"பகவதி கம்சன் வேடத்தோடு வந்து, வேடம் புனையும் படியாகச் சுப்பையாவிடம் கூறினார் போல் இருக்கிறது.",11
எனது_நாடக_வாழ்க்கை,சுப்பையா அவரிடமும் மறுத்து விட்டார்.,4
எனது_நாடக_வாழ்க்கை,ஒப்பனை அறையில் ஒரே ரகளே.,4
எனது_நாடக_வாழ்க்கை,சுப்பையா வேடம் புனைய மறுப்பதாகப் பெரியண்ணாவிடம் சொல்ல ஆள் போய் விட்டதாக அறிந்தேன்.,10
எனது_நாடக_வாழ்க்கை,எனக்கும் தகவல் வந்தது.,3
எனது_நாடக_வாழ்க்கை,நான் வந்து சுப்பையாவிடம் எவ்வளவோ சொன்னேன்.,5
எனது_நாடக_வாழ்க்கை,அவர் ஒரே பிடிவாதமாக வேடம் புனைய மறுத்து விட்டார்.,7
எனது_நாடக_வாழ்க்கை,உடனே நான் கே. ஆர்.,4
எனது_நாடக_வாழ்க்கை,இராமசாமியை வசுதேவர் போடச் சொல்லி விட்டு சுப்பையாவையும் அழைத்துக் கொண்டு அருகிலுள்ள என் விட்டிற்குச் சென்றேன்.,12
எனது_நாடக_வாழ்க்கை,கிருஷ்ணலீலாவில் எனக்கு வேடம் இல்லையாதலால் நிறைய நேரம் கிடைத்தது.,7
எனது_நாடக_வாழ்க்கை,வேடம் புனையாததற்காகப் பெரியண்ணா மீண்டும் வந்து அடிப்பார் என்பதைச் சுப்பையா நன்றாக அறிவார்.,10
எனது_நாடக_வாழ்க்கை,ஆனாலும் அவருக்கு அசட்டுப் பிடிவாதம் ஏற்பட்டிருந்தது.,5
எனது_நாடக_வாழ்க்கை,"மேலும் அடிபடவும், வேடம் புனையாததன் விளைவுகளை ஏற்கவும் சுப்பையா சித்தமாக இருந்தார்.",9
எனது_நாடக_வாழ்க்கை,நான் சுப்பையாவுக்கு அறிவுரைகள் கூறினேன்.,4
எனது_நாடக_வாழ்க்கை,என்னத்தான் இருந்தாலும் வேடம் புனைய மறுத்தது தவறு என்பதை அவருக்கு உணர்த்தினேன்.,9
எனது_நாடக_வாழ்க்கை,பெரியண்ணாவின் கோபத்தை நன்கு உணர்ந்தவன் நான்.,5
எனது_நாடக_வாழ்க்கை,விடிந்தால் சுப்பையாவுக்கு என்ன நேருமோ என்று எனக்கு அச்சமாக இருந்தது.,8
எனது_நாடக_வாழ்க்கை,சுப்பையா மேற்கொண்டு கம்பெனியில் இருக்கவும் விரும்பவில்லை.,5
எனது_நாடக_வாழ்க்கை,இரவோடிரவாக அவரை ஊருக்கு அனுப்பி விடுவது நல்லது என எனக்குத் தோன்றியது.,9
எனது_நாடக_வாழ்க்கை,"அவரும் என் யோசனையை ஏற்றார், கையிலிருந்த சிறு தொகையை அவரிடம் கொடுத்தேன்.",9
எனது_நாடக_வாழ்க்கை,அன்றிரவே அவரைப் பாதுகாப்பாக.,3
எனது_நாடக_வாழ்க்கை,எல்லோரும் சுப்பையா தானாகவே ஒடி விட்டதாக எண்ணினார்கள்.,6
எனது_நாடக_வாழ்க்கை,நானே அவரை அனுப்பினேன் என்பது பெரியண்ணாவுக்குக் கூடத் தெரியாது.,7
எனது_நாடக_வாழ்க்கை,கலைமாமணி கே. பி.,3
எனது_நாடக_வாழ்க்கை,கேசவன் ஒருநாள் பழம் பெரும் கலைஞர் கே. பி.,7
எனது_நாடக_வாழ்க்கை,கேசவன் மனோகரா நாடகம் பார்க்க வந்திருந்தார்.,5
எனது_நாடக_வாழ்க்கை,நாடகம் முடிந்ததும் உள்ளே வந்து என்னைப் பாராட்டினார்.,6
எனது_நாடக_வாழ்க்கை,தன் இல்லத்திற்கு ஒருநாள் விருந்துண்ண வர வேண்டுமென்று அழைத்தார்.,7
எனது_நாடக_வாழ்க்கை,"அழைப்பினை ஏற்று ஒலவக்கோட்டிலுள்ள அவரது இல்லத்திற்குத் தம்பி பகவதி, சிவதாணு, கே. ஆர்.",10
எனது_நாடக_வாழ்க்கை,இராமசாமி ஆகியோருடன் நானும் சென்றிருந்தேன்.,4
எனது_நாடக_வாழ்க்கை,மலர்ந்த முகத்துடன் எங்களே வரவேற்றார் கேசவன்.,5
எனது_நாடக_வாழ்க்கை,கம்பெனியின் பழங்கால நிகழ்ச்சிகளைப் பற்றி வெகு நேரம் பேசிக் கொண்டிருந்தோம்.,8
எனது_நாடக_வாழ்க்கை,விருந்துண்ட பின்னும் பேச்சு முடியவில்லை.,4
எனது_நாடக_வாழ்க்கை,நாடகம் இருந்ததால் விடைபெற்றுக் கொண்டு திரும்பினோம்.,5
எனது_நாடக_வாழ்க்கை,கேசவன் மதுரை ஒரிஜினல் பாய்ஸ் கம்பெனியின் சிறந்த நடிகர்களிலே ஒருவர்.,8
எனது_நாடக_வாழ்க்கை,நன்றாகப் பாடவும் திறமை வாய்ந்தவர்.,4
எனது_நாடக_வாழ்க்கை,அவரது ஆற்றல்மிக்க நடிப்பினை ஏற்கனவே நான் பார்த்து மகிழ்ந்திருக்கிறேன்.,7
எனது_நாடக_வாழ்க்கை,"அப்போது எங்கள் கம்பெனியிலும் பம்பாய் மெயில் முக்கிய நாடகமாக இருந்ததால், கே. பி.",10
எனது_நாடக_வாழ்க்கை,கேசவனின் பம்பாய் மெயில் நாடகத்தைப் பார்க்க ஆசைப்பட்டேன்.,6
எனது_நாடக_வாழ்க்கை,எங்களுக்கு நாடகம் இல்லாத நாளில் இதற்காகவே கூடலூர் சென்றேன்.,7
எனது_நாடக_வாழ்க்கை,பம்பாய் மெயில் நாடகம் பார்த்தேன்.,4
எனது_நாடக_வாழ்க்கை,நாடகத்தில் கே. பி.,3
எனது_நாடக_வாழ்க்கை,கேசவனின் அபாரமான நடிப்பு என்னை மிகவும் கவர்ந்தது.,6
எனது_நாடக_வாழ்க்கை,நாடகம் முடிந்ததும் அவர் வருகைக்காகக் காத்திருந்து நேரில் சந்தித்தேன்.,7
எனது_நாடக_வாழ்க்கை,மனமாரப் பாராட்டி விட்டு விருத்தாசலம் திரும்பினேன்.,5
எனது_நாடக_வாழ்க்கை,கேசவனின் பம்பாய் மெயில் நடிப்பைப் பார்த்தது எனக்குமிகவும் பயனுடையதாக இருந்தது.,8
எனது_நாடக_வாழ்க்கை,அதன் பிறகு நான் நடித்த பம்பாய் மெயிலில் புதிய மெருகுடன் நடித்தாக எல்லோரும் பேசிக் கொண்டார்கள்.,12
எனது_நாடக_வாழ்க்கை,திரைப்பட உலகில் கே. பி.,4
எனது_நாடக_வாழ்க்கை,கேசவன் நடித்த பதி பக்தியும் இரு சகோதரர்களும் இன்னும் கூட என் நினைவிலிருந்து அகல வில்லை.,12
எனது_நாடக_வாழ்க்கை,"கேசவன் சென்னை க்கு வந்து சங்கத்தின் விருதினைப் பெற்றுக் கொண்டபோது, அப்படியே அவரைக் கட்டித் தழுவிக் கொண்டேன்.",13
எனது_நாடக_வாழ்க்கை,கலைவாணர் கடிதம் சென்னையிலிருந்து கலைவாணர் கிருஷ்ணன் ஒரு கடிதம் எழுதியிருந்தார்.,8
எனது_நாடக_வாழ்க்கை,உள்ளே இராமசாமிக்கு ஒரு கடிதமும் இருந்தது.,5
எனது_நாடக_வாழ்க்கை,நான் மிகுந்த மகிழ்ச்சியோடு கடிதத்தைப் பெரியண்ணாவிடம் காட்டினேன்.,6
எனது_நாடக_வாழ்க்கை,கே. இராமசாமிக்கே நேராக எழுதாமல் எனக்குக் கடிதம் எழுதியதற்காக அவரைப் பாராட்டினார் அண்ணா.,10
எனது_நாடக_வாழ்க்கை,இராமாசாமி தாராளமாகப் போய் நடிக்கட்டும் அவன் திரைப்படத்தில் நடித்தால் நமக்குத்தானே பெருமை !,9
எனது_நாடக_வாழ்க்கை,எப்பொழுது தேவையோ அப்பொழுது அனுப்பலாமென்று நான் சொன்னதாகக் கிருஷ்ணனுக்கு எழுது என்றார்.,9
எனது_நாடக_வாழ்க்கை,அண்ணா சொன்னபடியே கலைவாணருக்கு எழுதினேன்.,4
எனது_நாடக_வாழ்க்கை,கடித்ததையும் இராமசாமியிடம் கொடுத்தேன்.,3
எனது_நாடக_வாழ்க்கை,இராமசாமிக்கு ஒரே மகிழ்ச்சி.,3
எனது_நாடக_வாழ்க்கை,அண்ணாவின் அனுமதியோடு கலைவாணருக்குக் கடிதம் எழுதினார்.,5
எனது_நாடக_வாழ்க்கை,நாலைந்து நாட்களில் உடனே புறப்படும்படியாகக் கலைவாணரிடமிருந்து தந்தி வந்தது.,7
எனது_நாடக_வாழ்க்கை,அன்றிரவே இராமசாமி சென்னைக்குப் புறப்பட ஏற்பாடு செய்யப்பட்டது.,6
எனது_நாடக_வாழ்க்கை,எல்லோருடைய அன்புக்கும் பாத்திரமாக இருந்த கே. ஆர்.,6
எனது_நாடக_வாழ்க்கை,இராமசாமி கண்கலக்கத்துடன் விடைபெற்றுச் சென்னைக்கு சென்றார்.,5
எனது_நாடக_வாழ்க்கை,மயங்கி விழுந்தேன் அப்போது மயில் ராவணன் தொடர்ச்சியாக நடந்து வந்தது.,8
எனது_நாடக_வாழ்க்கை,நான் அதில் இராமர் போடுவது வழக்கம்.,5
எனது_நாடக_வாழ்க்கை,சிறிய வேடம் அது.,3
எனது_நாடக_வாழ்க்கை,இராமசாமி ஆஞ்சநேயராக நடிப்பார்.,3
எனது_நாடக_வாழ்க்கை,அவர் போன அன்று நானே ஆஞ்சநேயராக நடிக்க நேர்ந்தது.,7
எனது_நாடக_வாழ்க்கை,"அதுவரை மயில் ராவணன், இராமாயணம் ஆகிய நாடகங்களில் நான் ஆஞ்சநேயர் பாத்திரத்தை ஏற்றதே இல்லை.",11
எனது_நாடக_வாழ்க்கை,"அதுமட்டுமல்ல சுக்ரீவனாகவோ, வாலியாகவோ கூட நடித்ததில்லை.",5
எனது_நாடக_வாழ்க்கை,குரங்குகளுக்குரிய உடையை அன்றுதான் முதலாவதாகப் புனைந்தேன்.,5
எனது_நாடக_வாழ்க்கை,ஏப்ரல் மாதம் அது.,3
எனது_நாடக_வாழ்க்கை,உள்ளே ஒரே புழுக்கம்.,3
எனது_நாடக_வாழ்க்கை,ரோமம் போன்று அடுக்கடுக்காக வைத்துத் தைக்கப்பட்ட அதிகக் கனமாக உடையைப் போட்டேன்.,9
எனது_நாடக_வாழ்க்கை,தலையில் குல்லாவையும் வைத்துக் கட்டினேன்.,4
எனது_நாடக_வாழ்க்கை,அதன்மேல் கிரீடத்தை வைத்தேன்.,3
எனது_நாடக_வாழ்க்கை,உடலுக்குள் காற்று புகுவதற்கு வழியே இல்லை.,5
எனது_நாடக_வாழ்க்கை,இரண்டு காட்சிகளில் நடித்தேன்.,3
எனது_நாடக_வாழ்க்கை,மின்சார வெளிச்சம் மேடையில் மேலும் வெப்பத்தை உண்டாக்கியது.,6
எனது_நாடக_வாழ்க்கை,ஏதோ தலை சுற்றுவது போலிருந்தது.,4
எனது_நாடக_வாழ்க்கை,மயங்கி விழுந்து விட் டேன்.,4
எனது_நாடக_வாழ்க்கை,காரணம் எல்லோருக்கும் புரிந்தது.,3
எனது_நாடக_வாழ்க்கை,என் உடைகளைத் தளர்த்தி மின்விசிறியின் கீழே படுக்கவைத்தார்கள்.,6
எனது_நாடக_வாழ்க்கை,ஐந்து நிமிடங் களுக்குப் பிறகுதான் நினைவு வந்தது.,6
எனது_நாடக_வாழ்க்கை,எப்படியோ ஒருவகையாக நடித்து நாடகத்தை முடித்தேன்.,5
எனது_நாடக_வாழ்க்கை,மறுநாள் இந்தச் செய்திகளை யெல்லாம் இராமசாமிக்கு விவரமாக எழுதினேன்.,7
எனது_நாடக_வாழ்க்கை,உன்னுடைய அருமையும் பெருமையும் இப்போது முன்னைவிட அதிகமாகப் புரிகிறது.,7
எனது_நாடக_வாழ்க்கை,உனக்கு அடுத்தபடியாக உன்னுடைய வேடங்களைப்புனைய தகுதியுடையவனுக இருந்த சுப்பையா கம்பெனியை விட்டு விலகு வதற்கு நீயே காரணமாக இருந்தாய்.,14
எனது_நாடக_வாழ்க்கை,இப்போது நீயும் விலகிக் கொண்டாய்.,4
எனது_நாடக_வாழ்க்கை,நான்தான் உன் வேடத்தைப் போட்டுக் கொண்டு அவஸ்தைப்படுகிறேன் என்று குறிப்பிட்டிருந்தேன்.,8
எனது_நாடக_வாழ்க்கை,ஏறத்தாழ ஐந்து மாத காலம் பாலக்காட்டில் நாடகம் நடத்திவிட்டு ஈரோட்டுக்குப் பயணமானோம்.,9
எனது_நாடக_வாழ்க்கை,மதுரை சிவலீலா வெற்றிக்குப்பின் நாங்கள் சென்ற நகரங்களிலெல்லாம் சிவலிலாவையே முதல் நாடகமாக ஆரம்பித்தோம்.,10
எனது_நாடக_வாழ்க்கை,ஈரோட்டில் தொடர்ந்து ஐம்பது நாட்கள் சிவலீலா நடைபெற்றது.,6
எனது_நாடக_வாழ்க்கை,அப்படி வெள்ளி விழாக்காணும் நாடகம் கூடத் தொடர்ந்து ஒரே அரங்கில் நடைபெறுவதில்லை.,9
எனது_நாடக_வாழ்க்கை,"நாடகம் தொடங்கிப் பல மாதங்களுக்குப் பிறகுதான், வெள்ளிவிழா, பொன்விழா எல்லாம் நடை பெறுகின்றது.",10
எனது_நாடக_வாழ்க்கை,திரைப்படமாக வந்து ஓடிக்கொண்டிருந்த குமாஸ்தாவின் பெண் நாடகம் கூட ஈரோட்டில் இருபத்தைந்து நாட்கள் தொடர்ந்து நடைபெற்றது.,12
எனது_நாடக_வாழ்க்கை,வசூலும் நல்ல முறையில் இருந்தது.,4
எனது_நாடக_வாழ்க்கை,பேரறிஞர் அண்ணா அவர்கள் ஒவ்வொரு நாடகத்தையும் பலமுறை பார்த்து மகிழ்ந்தார்.,8
