work_title,sentence,sentence_length
"எது_வியாபாரம்,_எவர்_வியாபாரி",இந்த வணிக முறையைத் திருக்குரானில் காணும் போது நமது உள்ளமெல்லாம் மகிழ்ச்சியடைகிறது.,9
"எது_வியாபாரம்,_எவர்_வியாபாரி",ஒரு நல்ல வணிக முறை எப்படியிருக்கும் என்பதை திருக்குரான் நமக்குத் தெளிவாகக் காட்டுகிறது.,10
"எது_வியாபாரம்,_எவர்_வியாபாரி",இதனை நம் வணிகர் ஒவ்வொருவரும் பின்பற்றி நடப்பதே நாட்டுக்கும் நமக்கும் பெருமையளிப்பதாக இருக்கும்.,10
"எது_வியாபாரம்,_எவர்_வியாபாரி","﻿ திருக்குறளில் வணிகம் ஆட்டுச் சண்டை, மாட்டுச் சண்டை, கோழிச் சண்டை முதலியவைகளைப் பார்ப்பதில் மனிதனுக்கு அதிக மகிழ்ச்சி.",14
"எது_வியாபாரம்,_எவர்_வியாபாரி",அதிலும் யானைப் போரைப் பார்ப்பதில் ஒருவனுக்கு அதிக மகிழ்ச்சி ஏற்படும்.,8
"எது_வியாபாரம்,_எவர்_வியாபாரி",அதிலும் யானை தன் பக்கம் திரும்பி விட்டால் தீங்கு விளையுமே என்ற அச்சமும் ஏற்படும்.,11
"எது_வியாபாரம்,_எவர்_வியாபாரி",ஆனால் அவன் குன்றின்மேல் ஏறி நின்று யானைப் போரைப் பார்ப்பதில் அவனுக்கு அந்த அச்சம் ஏற்படாது.,12
"எது_வியாபாரம்,_எவர்_வியாபாரி",அது எப்படிப்பட்டது என்பதை வள்ளுவர் அடியிற்கண்டவாறு கூறுகிறார்.,6
"எது_வியாபாரம்,_எவர்_வியாபாரி",அது வணிகத் தொழில் புரிகின்றவர்கள் பிறர் பொருளையும் தம் பொருள் போல் கருதிச் செய்ய வேண்டும்.,12
"எது_வியாபாரம்,_எவர்_வியாபாரி",அதுவே உயர்ந்த வணிகமுறையாகும் என்பது.,4
"எது_வியாபாரம்,_எவர்_வியாபாரி",அது ஒன்றுதான் அறமும் இன்பமுமாகிய மகிழ்ச்சியைத் தரும் வணிகமாகும் என்று குறள் கூறுகிறது.,10
"எது_வியாபாரம்,_எவர்_வியாபாரி",அறன்ஈனும் இன்பமும் ஈனும் திறனறிந்து தீதின்றி வந்த பொருள்.,7
"எது_வியாபாரம்,_எவர்_வியாபாரி",ஒரு வணிகன் தன் தொழிலில் வெற்றிபெறத் தேவையானவை என்னென்ன?,7
"எது_வியாபாரம்,_எவர்_வியாபாரி",என்பது ஒரு கேள்வி.,3
"எது_வியாபாரம்,_எவர்_வியாபாரி",பொருள் என்பர் சிலர்.,3
"எது_வியாபாரம்,_எவர்_வியாபாரி",அனுபவம் என்பர் சிலர்.,3
"எது_வியாபாரம்,_எவர்_வியாபாரி",நண்பர்கள் என்பர் சிலர்.,3
"எது_வியாபாரம்,_எவர்_வியாபாரி",குடும்பம் என்பர் சிலர்.,3
"எது_வியாபாரம்,_எவர்_வியாபாரி",அரசாங்க உதவி என்பர் சிலர்.,4
"எது_வியாபாரம்,_எவர்_வியாபாரி",நல்ல விளைவு காலம் என்பர் சிலர்.,5
"எது_வியாபாரம்,_எவர்_வியாபாரி",நல்ல பஞ்ச காலம் என்பர் சிலர் வள்ளுவர் இத்தனையையும் ஒப்ப இல்லை.,9
"எது_வியாபாரம்,_எவர்_வியாபாரி",﻿ கோலாலம்பூரில் வணிகம் என் தந்தை இறந்தபோது எனக்கு வயது முப்பது.,9
"எது_வியாபாரம்,_எவர்_வியாபாரி",குடியிருக்க அரை வீடும் சோற்றுக்கு ஒரு ஏக்கர் நிலமும் தான் இருந்தன.,9
"எது_வியாபாரம்,_எவர்_வியாபாரி",வேறு சொத்து ரொக்கம் எதுவும் இல்லை.,5
"எது_வியாபாரம்,_எவர்_வியாபாரி",வியாபாரத்தில் எங்களுக்கு வரவேண்டிய நிலுவை ஏழாயிரமும் கொடுக்க வேண்டிய கடன் ஏழாயிரமும் இருந்தன.,10
"எது_வியாபாரம்,_எவர்_வியாபாரி",என்று எனக்கு ஒன்றும் புரியவில்லை.,4
"எது_வியாபாரம்,_எவர்_வியாபாரி",நான் கதி கலங்கிப் போனேன்.,4
"எது_வியாபாரம்,_எவர்_வியாபாரி","அந்த சேட்டும் வருத்தப்பட்டு, உள்ளுரிலேயே வேறு எங்கும் வேலை பார்க்க முடியாதா? என்று கேட்டார்.",11
"எது_வியாபாரம்,_எவர்_வியாபாரி","பார்க்கலாம். சுருட்டு, புகையிலைக் கடைகளில் ரூ மட்டும்தான் மாதச்சம்பளம், பெரிய கணக்கப்பிள்ளைக்கு.",9
"எது_வியாபாரம்,_எவர்_வியாபாரி",நகை ஜவுளி கடைகளில் ரூ. மட்டும் சம்பளம் கொடுக்கிறார்கள்.,7
"எது_வியாபாரம்,_எவர்_வியாபாரி",எப்படி வேலை பார்ப்பது?,3
"எது_வியாபாரம்,_எவர்_வியாபாரி",எப்படிக் குடும்பம் நடத்துவது?,3
"எது_வியாபாரம்,_எவர்_வியாபாரி",எப்படிக் கடன் கட்டுவது?,3
"எது_வியாபாரம்,_எவர்_வியாபாரி",எவ்வளவு காலம் கடன் கட்டுவது?,4
"எது_வியாபாரம்,_எவர்_வியாபாரி","என்று சேட்டிடம் கூறி, நான் வெளி நாட்டுக்கு ஒடிப் போய்விட்டேன் என்று கவலைப் படாதீர்கள்.",11
"எது_வியாபாரம்,_எவர்_வியாபாரி",என் சொந்த வீடு ரூ. பெறும்.,5
"எது_வியாபாரம்,_எவர்_வியாபாரி",இந்தப் ﻿பத்திரத்தை வைத்துக் கொள்ளுங்கள்.,4
"எது_வியாபாரம்,_எவர்_வியாபாரி",நான் என் வியாபாரிகளிடம் போய்க் கடனை வசூலிக்கப் பார்க்கிறேன்.,7
"எது_வியாபாரம்,_எவர்_வியாபாரி",வசூலானால் அங்கிருந்தே உங்களுக்குத் தொகையை அனுப்பி வைப்பேன்.,6
"எது_வியாபாரம்,_எவர்_வியாபாரி","சிறிது நேரம் அங்கிருந்த மேலாள், நடு ஆள், கடை ஆள் மூவரும் கலந்து பேசினார்கள்.",11
"எது_வியாபாரம்,_எவர்_வியாபாரி","கடைசியாக அவர்கள் சிரித்துக் கொண்டே பத்திரத்தை வாங்க மறுத்து விட்டு, வெற்றியோடு போய் வாருங்கள்.",11
"எது_வியாபாரம்,_எவர்_வியாபாரி",திரும்ப இந்தியாவிற்கே வந்து தொழில் செய்யுங்கள்.,5
"எது_வியாபாரம்,_எவர்_வியாபாரி",நாங்கள் உதவி செய்கிறோம்.,3
"எது_வியாபாரம்,_எவர்_வியாபாரி",உங்கள் மேல் எங்களுக்கு நம்பிக்கை இருக்கிறது என்று சொல்லி அனுப்பி விட்டார்கள்.,9
"எது_வியாபாரம்,_எவர்_வியாபாரி",அன்றைக்கே அப்பணத்தை செட்டிப்பிள்ளைகள் உண்டியல் மூலம் சேட்டுக்கு அனுப்பி வைத்தேன்.,8
"எது_வியாபாரம்,_எவர்_வியாபாரி",அடுத்த நாள் மற்றொரு வியாபாரி ரூ. பாக்கியைக் கொடுத்து அவரும் மூட்டைப் புகையிலை அனுப்ப ஆர்டர் கொடுத்தார்.,13
"எது_வியாபாரம்,_எவர்_வியாபாரி",மூன்றாம் நாள் கடைவீதியைப் பார்க்கப் போனேன்.,5
"எது_வியாபாரம்,_எவர்_வியாபாரி",அது மலாய் மொழியில் இருந்தது.,4
"எது_வியாபாரம்,_எவர்_வியாபாரி",என்னுடன் வந்தவரை அதைப் படிக்கச் சொன்னேன்.,5
"எது_வியாபாரம்,_எவர்_வியாபாரி","ஒரு தூணில் தொங்க விடப்பட்டிருந்தது, உயர்ந்த சரக்கு என்றிருந்தது.",7
"எது_வியாபாரம்,_எவர்_வியாபாரி",அடுத்த தூணில் எழுதப் பெற் ﻿றிருப்பது குறைந்த விலை என்றிருக்கும் என நான் நினைத்தேன்.,11
"எது_வியாபாரம்,_எவர்_வியாபாரி",ஆனால் அதைப் படித்தவர் அதிக விலை என்று படித்தார்.,7
"எது_வியாபாரம்,_எவர்_வியாபாரி",இப்படி ஒரு வியாபாரமா?,3
"எது_வியாபாரம்,_எவர்_வியாபாரி",என்று என் தலை சுற்ற ஆரம்பித்தது.,5
"எது_வியாபாரம்,_எவர்_வியாபாரி",மற்ற வேலைகளை யெல்லாம் விட்டுவிட்டு அந்தக் கடையில் போய்க் கடையிலுள்ள சரக்குகளைப் பார்க்கத் தொடங்கினேன்.,11
"எது_வியாபாரம்,_எவர்_வியாபாரி",விறகு என்றால் பதினான்கு  அடி நீளம்தான் இருக்கும் காய்ந்தும் இருக்கும்.,8
"எது_வியாபாரம்,_எவர்_வியாபாரி",அரிசி என்றால் சன்னமாக இருக்கும்.,4
"எது_வியாபாரம்,_எவர்_வியாபாரி",பருப்பு என்றால் தூசி இராது.,4
"எது_வியாபாரம்,_எவர்_வியாபாரி",எல்லாம் உயர்ந்த சரக்குகள்.,3
"எது_வியாபாரம்,_எவர்_வியாபாரி",அதிக விலைக்கு விற்கப்படுகின்றன.,3
"எது_வியாபாரம்,_எவர்_வியாபாரி",கடையின் வியாபார நேரம் காலை மணி முதல் மணிவரை தான்.,8
"எது_வியாபாரம்,_எவர்_வியாபாரி",விற்பனையாளர்கள் அனைவருமே பகுதி நேர ஊழியர்கள்.,5
"எது_வியாபாரம்,_எவர்_வியாபாரி",அரசாங்கத்திலும் ரயில் நிலையங்களிலும் பணி புரிகின்றவர்கள்.,5
"எது_வியாபாரம்,_எவர்_வியாபாரி",ஒவ்வொரு பொருளுக்கும் முன்னால் கியூ வரிசையில் நின்று பொதுமக்கள் பொருட்களை வாங்கு கின்றார்கள்.,10
"எது_வியாபாரம்,_எவர்_வியாபாரி",அறுபது பேர் நிற்கிறார்கள்.,3
"எது_வியாபாரம்,_எவர்_வியாபாரி",முப்பது பேர்களுக்கு மட்டுமே சரக்குகள் கிடைக்கின்றன.,5
"எது_வியாபாரம்,_எவர்_வியாபாரி","முட்டை, இறைச்சி வரிசையில் எண்பது பேர் நிற்கிறார்கள்.",6
"எது_வியாபாரம்,_எவர்_வியாபாரி","ஐம்பத்தைந்து, அறுபது பேர்களுக்கு மட்டுமே பொருள்கள் கிடைக்கின்றன.",6
"எது_வியாபாரம்,_எவர்_வியாபாரி",மீதம் இருபது பேர் ஏமாற்றமுடன் திரும்பிப் போய் விடுகின்றனர்.,7
"எது_வியாபாரம்,_எவர்_வியாபாரி",முடிவாகக் கூற வேண்டுமானால் விற்பனைக்காக வந்த அந்த நூற்றி அறுபது சாமான்களும் அன்றன்றே விற்பனையாகி விடுகின்றன.,12
"எது_வியாபாரம்,_எவர்_வியாபாரி",ஒரு சரக்கும் மிஞ்சுவதில்லை.,3
"எது_வியாபாரம்,_எவர்_வியாபாரி",சரியாக மணிக்கு நெய் விற்பவர் ஒருபடி நெய்யைக் கொண்டு வந்து ஆளுக்கு,9
"எது_வியாபாரம்,_எவர்_வியாபாரி",வீசமபடி வீதம் பதினாறு  பேருக்குக் கொடுத்து விட்டு நெய் விற்குமிடத்தை மூடி விட்டுப் போய் விட்டார்.,12
"எது_வியாபாரம்,_எவர்_வியாபாரி",எனக்கு முன்னே நின்றிருந்த ஐந்து பேர்களும் எனக்குப் பின்னே இருந்த ஏழு பேர்களும் கிடைக்காமல் ஏமாற்றமடைந்து திரும்பிவிட்டோம்.,13
"எது_வியாபாரம்,_எவர்_வியாபாரி","அந்த கோலாலம்பூர், சீனரின் வணிக முறை என்னை வியப்படையச் செய்தது.",8
"எது_வியாபாரம்,_எவர்_வியாபாரி",உயர்ந்த சரக்குகளை அதிக விலை கொடுத்தாலும் வாங்க முடியவில்லையே என மனம் வருந்தினேன்.,10
"எது_வியாபாரம்,_எவர்_வியாபாரி",நாமும் இப்படி ஏன் தொழில் செய்யக் கூடாது?,6
"எது_வியாபாரம்,_எவர்_வியாபாரி",எனச் சிறிது நேரம் எண்ணினேன்.,4
"எது_வியாபாரம்,_எவர்_வியாபாரி",மூன்றாம் நாள் சிங்கப்பூருக்குச் சென்றேன்.,4
"எது_வியாபாரம்,_எவர்_வியாபாரி",அதோடு சில ஆர்டர்களும் கிடைத்தன.,4
"எது_வியாபாரம்,_எவர்_வியாபாரி",அத்தொகையை அங்கிருந்தே திருச்சி சேட்டுக்கு அனுப்பி மகிழ்ந்தேன்.,6
"எது_வியாபாரம்,_எவர்_வியாபாரி",அவரிடமிருந்த புகையிலைகள் மூன்றாம் தரத்திற்குரிய சரக்காக இருந்தன.,6
"எது_வியாபாரம்,_எவர்_வியாபாரி",அதை அவரிடம் சுட்டிக்காட்டி உங்களுக்கு உயர்ந்த சரக்குத் தேவையானால் எனக்கு ஆர்டர் கொடுங்கள்.,10
"எது_வியாபாரம்,_எவர்_வியாபாரி","ஆனால், விலை இதைவிட ரூ. ்கு",5
"எது_வியாபாரம்,_எவர்_வியாபாரி",இரண்டு மூட்டைக்கு ஆர்டர் கொடுங்கள் உடன் அனுப்பி வைக்கிறேன்.,7
"எது_வியாபாரம்,_எவர்_வியாபாரி",உங்களுக்குப் பிடித்தமானால் தொடர்ந்து என்னிடம் சரக்கு வாங்கலாம் என்று கூறினேன்.,8
"எது_வியாபாரம்,_எவர்_வியாபாரி","அதற்கு அவர், மனமகிழ்ச்சியோடு இப்படிப்பட்ட வியாபாரியைத்தான் நாங்கள் எதிர்பார்த்துக் கொண்டிருந்தோம்.",8
"எது_வியாபாரம்,_எவர்_வியாபாரி",உயர்ந்த சரககை அதிக விலைக்கு விற்பது ஒரு நல்ல வியாபாரம்.,8
"எது_வியாபாரம்,_எவர்_வியாபாரி",உங்களுடைய பேச்சும் தோற்றமும் உங்கள் மேல் எங்களுக்கு நம்பிக்கையை உண்டாக்கிவிட்டது.,8
"எது_வியாபாரம்,_எவர்_வியாபாரி",இரண்டு முட்டை என்ன?,3
"எது_வியாபாரம்,_எவர்_வியாபாரி",நீங்கள் இந்தியா சென்றதும் இதே கப்பலுக்கு நான்கு.,6
"எது_வியாபாரம்,_எவர்_வியாபாரி",மூட்டைப் புகையிலை அனுப்புங்கள் என்று கூறினார்கள்.,5
"எது_வியாபாரம்,_எவர்_வியாபாரி",எனக்கு உற்சாகம் பிறந்தது.,3
"எது_வியாபாரம்,_எவர்_வியாபாரி","மனமகிழ்ச்சியோடும், ஊக்கத்தோடும் இந்தியா திரும்பி வந்து தொழிலைத் தொடங்கினேன்.",7
"எது_வியாபாரம்,_எவர்_வியாபாரி",என்பதை உறுதியாகக் கடைப்பிடித்துத் தொழில் நடத்தத் தொடங்கினேன்.,6
"எது_வியாபாரம்,_எவர்_வியாபாரி",இந்தச் சிங்கப்பூர் வணிகம் என் வாழ்நாளில் வியாபார வெற்றிக்கு முதற்படியாக அமைந்தது.,9
"எது_வியாபாரம்,_எவர்_வியாபாரி",அவ்வூரின் மணியக்காரர் ஒரு பெரிய விவசாயி.,5
"எது_வியாபாரம்,_எவர்_வியாபாரி",அவரிடம் நல்ல புகையிலை இருப்பதாகக் கேள்விப்பட்டேன்.,5
"எது_வியாபாரம்,_எவர்_வியாபாரி",ஏழு மைல்கள் துாரம் நடந்து சென்றேன்.,5
"எது_வியாபாரம்,_எவர்_வியாபாரி",நான் கேள்விப்பட்டது உண்மையாகிவிட்டது.,3
"எது_வியாபாரம்,_எவர்_வியாபாரி",மலையடிவாரம் ஆனதாலும் ஆட்டுப் பண்ணைகள் அவரிடம் அதிகமாக இருந்ததாலும்.,7
"எது_வியாபாரம்,_எவர்_வியாபாரி",விவசாயிடம் விலை கேட்டேன்.,3
"எது_வியாபாரம்,_எவர்_வியாபாரி",அவர் நூறு கட்டுகளின் விலை சொல்வது ரூபாய் தொன்னூற்றைந்து என்றும் விற்பது ரூபாய் தொன்னூறு என்றும் முடிவாகச் சொன்னார்.,14
"எது_வியாபாரம்,_எவர்_வியாபாரி","நான் கேட்டேன், ஏன்?",3
"எது_வியாபாரம்,_எவர்_வியாபாரி",சொல்லுவது ஒரு விலை விற்பது ஒரு விலை?,6
"எது_வியாபாரம்,_எவர்_வியாபாரி",அதற்கு அவர் விலையை எவ்வளவு குறைத்துச் சொன்னாலும் வருகிற வியாபாரிகள் அதற்குக் கீழேதான் குறைத்துக் கேட்கிறார்கள்.,12
"எது_வியாபாரம்,_எவர்_வியாபாரி",ஒரு வாரம் கழித்த பிறகு கட்டு கட்டலாம்.,6
"எது_வியாபாரம்,_எவர்_வியாபாரி",ஒவ்வொரு கட்டும் நாற்பது பதம் எடை உள்ளதாக கட்டி வையுங்கள்.,8
