work_title,sentence,sentence_length
ஒரு_பூர்வ_பௌத்தனின்_சாட்சியம்,மேற்கிந்தியாவின் அரசியல் நிலை பற்றி வாத்சியாயனர் விளக்குபவற்றிலிருந்து ஆந்திராவை அபிரர்களும் ஆந்திரர்களும் ஆண்டதாக அறிகிறோம்.,11
ஒரு_பூர்வ_பௌத்தனின்_சாட்சியம்,இருநூற்று இருபத்தைந்து வரை அந்நிலம் ஆந்திரர்களால் மட்டுமே ஆளப்பட்டு வந்தது.,8
ஒரு_பூர்வ_பௌத்தனின்_சாட்சியம்,காமசூத்திரம் மொழிநடையில் அர்த்தசாஸ்த்திரத்திற்கு நெருக்கமானதாக இருக்கிறது.,5
ஒரு_பூர்வ_பௌத்தனின்_சாட்சியம்,மூன்றாம் நூற்றாண்டில் எழுதப்பட்டிருக்கலாமென்று நம்பப் பெறுகிறது.,5
ஒரு_பூர்வ_பௌத்தனின்_சாட்சியம்,"காமசூத்திரம் தர்மம், அர்த்தம், காமம் எனும் மூன்று உறுதிப் பொருள்கள் அல்லது திரிவர்க்கங்கள் பற்றிய விவாதத்துடன் தொடங்குகின்றது.",13
ஒரு_பூர்வ_பௌத்தனின்_சாட்சியம்,நான்காவது உறுதிப் பொருளென்று கருதப்பெறும் வீடு பற்றி வாத்ஸ்யாயனர் அக்கறை காட்டவில்லை.,9
ஒரு_பூர்வ_பௌத்தனின்_சாட்சியம்,வாத்ஸ்யாயனர் மோட்சத்திற்குத் தருமிடம் மிகச் சிறியது.,5
ஒரு_பூர்வ_பௌத்தனின்_சாட்சியம்,அதனை அவர் கிண்டலாகக் கையாளவும் காணலாம்.,5
ஒரு_பூர்வ_பௌத்தனின்_சாட்சியம்,தான் விரும்பாத காதலனைப் பரத்தை விரட்டுதற்கு இச்சொல் பயன்படுத்தப் பெறுகிறது.,8
ஒரு_பூர்வ_பௌத்தனின்_சாட்சியம்,காமசூத்திரம் ஆண் பெண் உடலுறவைப் படம் பிடித்துக் காட்டுவது காமத்துப்பால் ஆண் பெண் உள்ள உறவுகளை நுட்பமாகச் சுட்டுவது.,14
ஒரு_பூர்வ_பௌத்தனின்_சாட்சியம்,ஒன்று உடலுறவு பற்றிய அறிவியல் விளக்கம் இன்னொன்று உளவியல் ஆய்வு.,8
ஒரு_பூர்வ_பௌத்தனின்_சாட்சியம்,முன்னது வெறும் பட்டியல் பின்னது இலக்கியம்.,5
ஒரு_பூர்வ_பௌத்தனின்_சாட்சியம்,முன்னது உடல்வெறியைத் தூண்டும் நீலப்படம் பின்னது முருகியல் இன்பம் தரும் காவியம்.,9
ஒரு_பூர்வ_பௌத்தனின்_சாட்சியம்,முன்னதற்குக் காமம் ஒரு விலங்குணர்வு பின்னதற்குக் காமம் மலரினும் மெல்லிய இறையின்பம்.,9
ஒரு_பூர்வ_பௌத்தனின்_சாட்சியம்,பரத்தையர் பற்றிய காம சூத்திரத்தின் ஆறாம் பகுதியில் தும்மலைப் பற்றிய ஒரு குறிப்பு வருகிறது.,11
ஒரு_பூர்வ_பௌத்தனின்_சாட்சியம்,தான் விரும்பும் வாடிக்கையாளனைப் பரத்தை தன் கைக்குள் வைத்திருப்பது எப்படியென்று விளக்கும் இடம் இது.,11
ஒரு_பூர்வ_பௌத்தனின்_சாட்சியம்,அவன் சொல்லுகின்ற கதைகளையல்லாம் அவள் கவனமாகக் கேட்கிறாள்.,6
ஒரு_பூர்வ_பௌத்தனின்_சாட்சியம்,"அவன் தும்மும்போதும், கத்தும்போதும், திடுக்குறும் போதும், அவள் அவனை வாழ்க என்று வாழ்த்துகிறாள்.",10
ஒரு_பூர்வ_பௌத்தனின்_சாட்சியம்,"அவள் சோர்வாக இருக்கும்போது, நோயுற்றவள் போலும், பிள்ளைப் பேற்றை எதிர்பார்க்கும் பெண்களின் விநோதமான விருப்பங்களைக் கொண்டிருப்பதாக நடிக்கிறாள்.",13
ஒரு_பூர்வ_பௌத்தனின்_சாட்சியம்,இப்பகுதியை விளக்கும் டோனிகர் தும்மலின்போது உயிர் உடலை விட்டே தற்காலிகமாக நீங்கி விடுகிறதென்னும் நாட்டார் நம்பிக்கையை எடுத்துரைப்பார்.,13
ஒரு_பூர்வ_பௌத்தனின்_சாட்சியம்,திருக்குறளில் காமத்துப்பாலின் புலவி நுணுக்கம் எனும் அதிகாரத்தில் தும்மலைப் பற்றி மூன்று பாடல்கள் பேசுகின்றன.,11
ஒரு_பூர்வ_பௌத்தனின்_சாட்சியம்,ஊடி இருந்தேமாத் தும்மினார் யாம் தம்மை நீடுவாழ் கென்பாக் கறிந்து.,8
ஒரு_பூர்வ_பௌத்தனின்_சாட்சியம்,வழுத்தினாள் தும்மினேன் ஆக அழித்தழுதாள் யார் உள்ளித் தும்மினிர் என்று.,8
ஒரு_பூர்வ_பௌத்தனின்_சாட்சியம்,யான் தும்மினேனாகத் தன் இயல்பால் வாழ்த்தினாள்.,5
ஒரு_பூர்வ_பௌத்தனின்_சாட்சியம்,தும்முச் செறுப்ப அழுதாள் நுமருள்ளல் எம்மை மறைத்திரோ என்று.,7
ஒரு_பூர்வ_பௌத்தனின்_சாட்சியம்,எனக்குத் தும்மல் வந்தபோது யார் நினைக்கத் தும்மினீரென்று கேட்பாளென்பதற்கு அஞ்சி அதனை நான் அடக்கினேன்.,11
ஒரு_பூர்வ_பௌத்தனின்_சாட்சியம்,அவ்வாறு அடக்கவும் உம்மைச் சார்ந்தவர் நினைப்பதை மறைப்பதற்காகத் தும்மலை அடக்கினீரோ வென்று சொல்லிப் புலந்து அழுதாள்.,12
ஒரு_பூர்வ_பௌத்தனின்_சாட்சியம்,இப்பாடல்களுக்கு உரையெழுதும் பரிமேலழகர் தும்மியக்கால் வாழ்த்துதல் மரபு அன்புடையார் நினைத்த வழி அந்நினைக்கப்பட்டார்க்குத் தும்மல் தோன்றுமென்பது மகளிர் வழக்கு.,14
ஒரு_பூர்வ_பௌத்தனின்_சாட்சியம்,எங்கும் தும்மல் பற்றிய இந்நம்பிக்கை வடநூல் மரபென்றோ வடவர் வழக்கென்றோ பரிமேலழகர் குறிப்பிடாதது காண்க.,11
ஒரு_பூர்வ_பௌத்தனின்_சாட்சியம்,தும்மல் பற்றிய இப்பாடல்களுக்கும் காமசூத்திரத்துத் தும்மலுக்கும் உள்ள வேறுபாடுகளை விளக்கத் தேவையில்லை.,9
ஒரு_பூர்வ_பௌத்தனின்_சாட்சியம்,வடமொழி இலக்கியங்கள் அவர்கள் கற்பனை செய்து கொண்டது போல் அவ்வளவு பழமையானவை அல்ல என்பது இப்பொழுது தெளிவாகியுள்ளது.,13
ஒரு_பூர்வ_பௌத்தனின்_சாட்சியம்,எனவே அவர்கள் கண்ட ஒற்றுமைப் பகுதிகளுக்கெல்லாம் மூலம் குறள் என்று இப்பொழுது அறிய முடிகிறது.,11
ஒரு_பூர்வ_பௌத்தனின்_சாட்சியம்,அறவுரைகளைச் சுருங்கச் சொல்லி விளங்க வைக்கும் தமிழ்ப் பாடல் ஒவ்வொன்றிற்கும்கூட வடமொழியில் ஒத்த பாடலொன்றை மேற்கோள் காட்ட முடியும்.,14
ஒரு_பூர்வ_பௌத்தனின்_சாட்சியம்,காமத்துப்பால் பற்றியும் அவர் அறிவித்துள்ள கருத்துக்களும் தெளிவானவை.,6
ஒரு_பூர்வ_பௌத்தனின்_சாட்சியம்,பேரின்பத்தையும் விளக்குவதற்கே வள்ளுவர் சிற்றின்பம் பற்றிப் பேசுகிறார் என்பது அவர் முடிவு.,9
ஒரு_பூர்வ_பௌத்தனின்_சாட்சியம்,ஆதலின் தென் புலத்தோராம் நாயனார் காமத்துப் பாலாம் சிற்றின்ப நுகர்ச்சியை விளக்கிப் பேரின்பத்தைத் துலக்குவதற்காய்.,11
ஒரு_பூர்வ_பௌத்தனின்_சாட்சியம்,"வள்ளுவர் காமத்துப்பாலில் பேசும் சிற்றின்ப நுகர்ச்சி, பேரின்பத்தைப் பற்றிய மறைமுக விளக்கமே என்று தொ.பொ.",12
ஒரு_பூர்வ_பௌத்தனின்_சாட்சியம்,மீனாட்சிசுந்தரனார் கூறியுள்ளது இங்கு நினைவுகூரத்தக்கது.,4
ஒரு_பூர்வ_பௌத்தனின்_சாட்சியம்,என்று விடை தருவார்.,3
ஒரு_பூர்வ_பௌத்தனின்_சாட்சியம்,ஆனால் ஓர் ஆயிரத்து எண்ணூற்று முப்பத்தொன்று ஆம் ஆண்டு வெளிவந்த நூலில் வள்ளுவரின் பெற்றோர் பற்றிய கட்டுக்கதைகள் ஏதுமில்லை.,14
ஒரு_பூர்வ_பௌத்தனின்_சாட்சியம்,"மூத்தவர் நாயனார் பிறந்த இடம் மயிலையென்று மட்டும் கூறி மற்ற அறுவர் பிறந்த, வளர்ந்த இடங்களைக் கூறவில்லை.",13
ஒரு_பூர்வ_பௌத்தனின்_சாட்சியம்,இளையவர் ஏழு குழந்தைகளுக்கும் இடங்களைச் சுட்டியதல்லாமல் வேதாளக்கதை ஒன்றையும் சேர்த்தார்.,8
ஒரு_பூர்வ_பௌத்தனின்_சாட்சியம்,திருவள்ளுவமாலையில் நான்முகன் என்று குறிப்பிடப்படுபவர் புத்தரேயென்றும் திரிபிடகமே உண்மை வேதமென்றும் அதன் வழிநூலே திருக்குறள் என்றும் விளக்குவார்.,13
ஒரு_பூர்வ_பௌத்தனின்_சாட்சியம்,என்னும் திருவள்ளுவ மாலைப் பாடல்கள் காட்டப்பெறும்.,5
ஒரு_பூர்வ_பௌத்தனின்_சாட்சியம்,திரிபீட வாக்கிய மறைபொருள் பாலிமொழியில் மக்களுக்கு விளங்காமல் இருந்ததால் அதனை யாவரும் விளங்கிக் கொள்ளுமாறு தமிழில் திருக்குறள் வந்தது.,14
ஒரு_பூர்வ_பௌத்தனின்_சாட்சியம்,முதல்குறள் புத்தரை ஆதிபகவன் என்று அழைக்கிறது.,5
ஒரு_பூர்வ_பௌத்தனின்_சாட்சியம்,புத்தபிரானை மகட மொழியில் பகவனென்று கூறியதைப்போல் திராவிட மொழியில் திவாகரர் என்று வழங்கினர்.,10
ஒரு_பூர்வ_பௌத்தனின்_சாட்சியம்,ஒன்பதாவது குறள் இறைவனை எண்குணத்தான் என்று அழைக்கும்.,6
ஒரு_பூர்வ_பௌத்தனின்_சாட்சியம்,ஐந்தவித்தான் ஆற்றல் அகல்விசும்புளார் கோமான் இந்திரனே சாலும் கரி.,7
ஒரு_பூர்வ_பௌத்தனின்_சாட்சியம்,எனும் குறள் இரண்டு வகையாகப் பொருள் கூறப்பட்டு வருகிறது.,7
ஒரு_பூர்வ_பௌத்தனின்_சாட்சியம்,தாசர் கூறும் பொருள் இவ்விரண்டிலிருந்தும் மாறுபட்டது.,5
ஒரு_பூர்வ_பௌத்தனின்_சாட்சியம்,இங்கு இந்திரன் புத்தரையே குறிக்கும் என்று கூறிக்கீழ்க்காணும் விளக்கம் தருவார்.,8
ஒரு_பூர்வ_பௌத்தனின்_சாட்சியம்,"மெய், வாய், கண், மூக்கு, செவி என்னும் ஐந்தினையும் அவித்த வல்லபங்கொண்டு ஐந்திரர் என்னும் பெயர் பெற்று ஐ.",14
ஒரு_பூர்வ_பௌத்தனின்_சாட்சியம்,அகலிகை கதைக்கு எதிராக இந்திரனை நல்லவனாகக்கருதி ஏற்றுக் கொண்டவர்கள் சமணமுனிவர்கள்.,8
ஒரு_பூர்வ_பௌத்தனின்_சாட்சியம்,இந்திரனைப் பற்றிய இக்கருத்து மாறுபாடுகளைப் பார்க்கும்போது குறள்பாவில் வரும் இந்திரன் புத்தனே என்ற தாசரின் விளக்கம் பொருத்தமானதாகத் தோன்றுகிறது.,14
ஒரு_பூர்வ_பௌத்தனின்_சாட்சியம்,இங்கு எல்லிஸ் சொல்லும் இன்னொரு செய்தியும் நம்மவர் அறிய வேண்டிய ஒன்றாகும்.,9
ஒரு_பூர்வ_பௌத்தனின்_சாட்சியம்,கடவுள் வாழ்த்துப் பாடல்களில் சிலவற்றிற்குப் பரிமேலழகர் தரும் உரைகளும் அவை பற்றி எல்லிஸ் கூறுவனவும் இங்கு நோக்கற்பாலன.,13
ஒரு_பூர்வ_பௌத்தனின்_சாட்சியம்,ஒன்பதாவது குறளில் வரும் எண்குணத்தான் என்னும் தொடருக்குப் பரிமேலழகர் மூன்று விளக்கங்கள் தருவார்.,10
ஒரு_பூர்வ_பௌத்தனின்_சாட்சியம்,இவ்வாறு சைவ ஆகமத்துள் கூறப்பட்டுள்ளன.,4
ஒரு_பூர்வ_பௌத்தனின்_சாட்சியம்,அணிமாவை முதலாகவுடையவன் எனவும் கடையிலாத அறிவை முதலாகவுடையவன் எனவும் எனவும் உரைப்பாருமுளர்.,9
ஒரு_பூர்வ_பௌத்தனின்_சாட்சியம்,"எனவே இப்பொருள் முற்றும் பொருந்தாது என்பது போதரும், மூன்றாவது விளக்கம் கீழ்வரும் சூளாமணி நிகண்டுப் பாடலை அடிப்படையாகக் கொண்டது.",14
ஒரு_பூர்வ_பௌத்தனின்_சாட்சியம்,சமணர்களின் கோட்பாட்டின்படி இவை இறைவனுக்குரிய எட்டு நிறைகளாகும்.,6
ஒரு_பூர்வ_பௌத்தனின்_சாட்சியம்,மாந்தருக்குரிய எட்டுக் குறைகளையும் சூளாமணி நிகண்டு அடுத்த பாடலில் கூறும்.,8
ஒரு_பூர்வ_பௌத்தனின்_சாட்சியம்,எவ்வகையிலென்னில் சருவ வுயிர்களின் மீதும் செவ்விய சாந்த நிலை யமைந்து காத்து வருதலால் என்பது பதம்.,12
ஒரு_பூர்வ_பௌத்தனின்_சாட்சியம்,என்று தாசர் சொல்வது கருதற்பாலது.,4
ஒரு_பூர்வ_பௌத்தனின்_சாட்சியம்,இதற்கு அவர் தரும் தன்னிலை விளக்கமும் ஆராயத்தக்கது.,6
ஒரு_பூர்வ_பௌத்தனின்_சாட்சியம்,இல்வாழ்வான் என்பான் இயல்புடைய மூவர்க்கு நல்லாற்றின் நின்ற துணை.,7
ஒரு_பூர்வ_பௌத்தனின்_சாட்சியம்,இறந்தாரின் பிணங்களைக் கொண்டு போய்ச் சுடலை சேர்த்தலே மரித்தோர்க்குச் செய்யும் உதவி என்பது அவர் விளக்கம்.,12
ஒரு_பூர்வ_பௌத்தனின்_சாட்சியம்,எழு பிறப்பு என்பதை ஏழு வகைப் பிறவிகளாக அவர் கொள்வது புதுமையானது.,9
ஒரு_பூர்வ_பௌத்தனின்_சாட்சியம்,இருந்தோம்பி இல் வாழ்வதெல்லாம் விருந்தோம்பி வேளாண்மை செய்தற் பொருட்டு.,7
ஒரு_பூர்வ_பௌத்தனின்_சாட்சியம்,எனும் குறளில் வேளாண்மை என்ற சொல்லுக்கு விவசாயம் எனும் பொருள் கொள்ளப்பெறுகிறது.,9
ஒரு_பூர்வ_பௌத்தனின்_சாட்சியம்,இல்லற தன்மத்தைச் சரிவர நடத்துவோன் ஈகைக்கு ஆதாரமாம் விவசாயத்தை விருத்தி செய்வதற்கேயாம் என்று எடுத்துரைப்பார் தாசர்.,12
ஒரு_பூர்வ_பௌத்தனின்_சாட்சியம்,வேள்வி எனும் சொல்லிற்கு யாகம் என்று பொருள் கொள்ளாமல் ஐம்புலனடக்கும் தவம் என்று அயோத்திதாசர் விளக்கமளிக்கக் காணலாம்.,13
ஒரு_பூர்வ_பௌத்தனின்_சாட்சியம்,அத்தகைய ஒடுக்கமில்லாதோர் மாறாப் பிறவியில் சுழன்று தீரா துக்க சாகரத்தில் ஆழ்வார்கள் என்பது கருத்து.,11
ஒரு_பூர்வ_பௌத்தனின்_சாட்சியம்,என்று விளக்கம் தருவார்.,3
ஒரு_பூர்வ_பௌத்தனின்_சாட்சியம்,பார்ப்பான் என்பவன் தன்னை ஆராய்ந்தறிவோன் என்று தாசர் கூறுவது நம் சிந்தனையைத் தூண்ட வேண்டிய கருத்தாகும்.,12
ஒரு_பூர்வ_பௌத்தனின்_சாட்சியம்,நன்கு அறியப்பெற்ற சில குறள்களுக்கு அவர் தரும் விளக்கங்கள் ஏற்புடையன என்று கொள்ளல் இயலாது.,11
ஒரு_பூர்வ_பௌத்தனின்_சாட்சியம்,என்று புதுப்பொருள் தருவார்.,3
ஒரு_பூர்வ_பௌத்தனின்_சாட்சியம்,அதன் திருத்த மொழியை அருங்கலைச் செப்பால் அறிந்து கொள்ளலாம்.,7
ஒரு_பூர்வ_பௌத்தனின்_சாட்சியம்,வீடு பேறு அருங்கோடர் சங்க மணுகி அறவுரை கேட்டு இறுமாந்திருப்பதே வீடு.,9
ஒரு_பூர்வ_பௌத்தனின்_சாட்சியம்,என்று அவர் விளக்கமளிப்பது பொருத்தமானதாகவே இருக்கக் காணலாம்.,6
