work_title,sentence,sentence_length
ஒரு_பூர்வ_பௌத்தனின்_சாட்சியம்,"அவர்கள் அவனிடம், நீ சொல்வது ஒரு நல்ல நண்பனும் பிராமணனுக்குரிய பண்புகள் கொண்ட ஒருவனும் சொல்லத் தகுந்ததாகும்.",13
ஒரு_பூர்வ_பௌத்தனின்_சாட்சியம்,நாங்கள் தவறான பாதையில் சென்ற தீய குதிரைகளை ஒத்தவர்கள் நீ எங்களை நல்வழிப்படுத்தினாய்.,10
ஒரு_பூர்வ_பௌத்தனின்_சாட்சியம்,என்று அவனுடைய உரையை ஏற்றுப் புகழ்ந்து பகைவர்களோடு ஒத்துப்போவதாக அக்காண்டம் ஒரு பிராமணனின் நற்பண்பையும் நற்செயலையும் முற்படுத்திக் காட்டும்.,14
ஒரு_பூர்வ_பௌத்தனின்_சாட்சியம்,அவர் வடமொழியிலுள்ள அசுவகோசரின் புத்த சரிதத்தை மூலங்களில் ஒன்றாகச் சேர்க்கவில்லை.,8
ஒரு_பூர்வ_பௌத்தனின்_சாட்சியம்,அசுவகோசரை வேறு சில இடங்களில் தமது கட்டுரைகளில் சுட்டுகிறார்.,7
ஒரு_பூர்வ_பௌத்தனின்_சாட்சியம்,பாலி நூல்களிலிருந்தும் ஆங்காங்கே மேற்கோள்கள் தருகிறார்.,5
ஒரு_பூர்வ_பௌத்தனின்_சாட்சியம்,ஆதி வேதத்திற்கு அயோத்திதாசர் எழுதிய பாயிரத்தில் தாம் எவற்றை மூலங்களாகக் கொண்டாரென்பதற்கான பட்டியலைத் தருகிறார்.,11
ஒரு_பூர்வ_பௌத்தனின்_சாட்சியம்,"சாந்தவாரா வென்னும் சமண முனிவராலும், ஹோன்னா சிலோன், யு.",7
ஒரு_பூர்வ_பௌத்தனின்_சாட்சியம்,"வினயலங்காரா வென்னும் சமண முனிவராலும் மோல்மென், யு.",6
ஒரு_பூர்வ_பௌத்தனின்_சாட்சியம்,பிராமணர்கள் பலரோடு புத்தர் உரையாடுவதாகப் புத்த சரிதத்தில் வரும் காட்சிகள் இங்கு எண்ணிப்பார்க்க வேண்டியவை.,11
ஒரு_பூர்வ_பௌத்தனின்_சாட்சியம்,அதை அனுசரித்தே ஓர் பொய்க்கதையைச் சேர்த்துவிட்டிருக்கிறார்கள்.,5
ஒரு_பூர்வ_பௌத்தனின்_சாட்சியம்,அவர்களும் அதை மெய்யென்று நம்பி எடுத்துப்போய் இப்போது அச்சிடும் புத்தகங்களில் வெளியிடுகின்றார்கள்.,9
ஒரு_பூர்வ_பௌத்தனின்_சாட்சியம்,... அவர்களுக்குள் பெரும்பாலும் மாடுகளையும் குதிரைகளையும் சுட்டுத் தின்றதாக வரைந்து கொண்டிருக்கிறார்களேயன்றி ஆடுகளை நெருப்பிலிட்டுச் சுட்டுத் தின்றதாகக் கிடையாது.,13
ஒரு_பூர்வ_பௌத்தனின்_சாட்சியம்,ஆயினும் இது பற்றி அயோத்திதாசர் கொண்டிருந்த கருத்து தெளிவானது.,7
ஒரு_பூர்வ_பௌத்தனின்_சாட்சியம்,மனிதனால் செய்யக்கூடிய வித்தைகள் அனந்தமுண்டு.,4
ஒரு_பூர்வ_பௌத்தனின்_சாட்சியம்,அவ்வித்தைகளால் தருமம் சிறப்படையாது.,3
ஒரு_பூர்வ_பௌத்தனின்_சாட்சியம்,மனிதனை சீலமும் ஒழுக்கமுமே சிறப்படையச் செய்யும்.,5
ஒரு_பூர்வ_பௌத்தனின்_சாட்சியம்,சித்துக்களை விளையாடியவர்கள் யாவரும் சமணமுனிவருள் சித்தி பெற்றோர்களேயன்றி வேறொருவரும் கிடையா.,8
ஒரு_பூர்வ_பௌத்தனின்_சாட்சியம்,அவர்களினும் மேலாய சித்து வித்தைகளைக் கையாடினோர் வேறொருவரும் கிடையாதென்பதே திண்ணம்.,8
ஒரு_பூர்வ_பௌத்தனின்_சாட்சியம்,இவ்வித்தைகள் யாவற்றையும் பெளத்தர்கள் வெகுவாக மதிக்க மாட்டார்கள்.,6
ஒரு_பூர்வ_பௌத்தனின்_சாட்சியம்,சீலத்தையும் ஒழுக்கத்தையுமே மேலாக மதிப்பர்.,4
ஒரு_பூர்வ_பௌத்தனின்_சாட்சியம்,புத்தரது வரலாற்றை ஓர் உரைநடைக்காப்பியமாகத் தரும் அயோத்திதாசர் அவரைத் தமிழ்க் காப்பியத் தலைவனாகவே படைத்துள்ளார்.,11
ஒரு_பூர்வ_பௌத்தனின்_சாட்சியம்,"சிலப்பதிகாரம், மணிமேகலை ஆகியவற்றின் அடியொற்றித் தமது நூலின் பிரிவுகளைக் காதைகள் என்றே அழைக்கிறார்.",10
ஒரு_பூர்வ_பௌத்தனின்_சாட்சியம்,அசுவகோசர் பல புராணப் பாத்திரங்களையும் கதைகளையும் அவர்களுடைய உரையாடல்களில் கொண்டு வருகிறார்.,9
ஒரு_பூர்வ_பௌத்தனின்_சாட்சியம்,குழந்தையைப்பற்றி நீர் யாதுக்கும் அஞ்ச வேண்டாம்.,5
ஒரு_பூர்வ_பௌத்தனின்_சாட்சியம்,ஆதலின் அம் மகத்துவத்தை என் கண் குளிரக் காணாது அற்பாயுளைப் பெற்றுள்ளதால் துக்கித்தேனென்றான்.,10
ஒரு_பூர்வ_பௌத்தனின்_சாட்சியம்,என்று புத்தரது உற்பவக் காதையைச் சொல்லிச் செல்வார்.,6
ஒரு_பூர்வ_பௌத்தனின்_சாட்சியம்,சித்தார்த்தனின் கலையறிவும் பாராட்டப்பெறுகிறது.,3
ஒரு_பூர்வ_பௌத்தனின்_சாட்சியம்,அதனால் சித்தார்த்தரை சதுர்முகன் சதுர்முகன் என்றும் அழைத்தார்கள்.,6
ஒரு_பூர்வ_பௌத்தனின்_சாட்சியம்,அப்பெண்கள் அவனைக் கவர மேற்கொண்ட முயற்சிகளை ஓர் அதிகாரம் விரிவாக விளக்கும்.,9
ஒரு_பூர்வ_பௌத்தனின்_சாட்சியம்,நான்காம் சங்கத்தார் உயிர்களுக்கு ஆதியுமில்லை அந்தமும் இல்லையென்றும் எல்லாம் தானே ஏற்றுக்கொள்வதால் யாவும் தற்செயல் என்றும் எண்ணுபவர்கள்.,13
ஒரு_பூர்வ_பௌத்தனின்_சாட்சியம்,பெளத்தத்திற்குமுன் வேதநெறியாளர்களென்றழைத்துக் கொண்ட பிராமணர்கள் இருந்தார்களென்றும் அவர்களோடு புத்தர் பின்னால் வாதிட்டதாகவும் புத்தசரிதம் கூறும்.,11
ஒரு_பூர்வ_பௌத்தனின்_சாட்சியம்,இவ்வாறு சங்கத்தார் பற்றிய செய்திகளை அருங்கலைச் செப்பு எனும் தமிழ் நூலிலிருந்து அவர் மேற்கோள்களாகத் தருவதும் குறிப்பிடத்தக்கது.,13
ஒரு_பூர்வ_பௌத்தனின்_சாட்சியம்,ஆறாம் சங்கத்தார் என்போர் கலிவாகு மரபில் வந்த சாக்கையர்கள் என்றும் சோதிடத்தில் வல்லவர்கள் என்றும் தாசர் கூறுவதும் கருதற்குரியது.,14
ஒரு_பூர்வ_பௌத்தனின்_சாட்சியம்,வாசக நடையில் எழுதியுள்ள தசசீலத்தின் பெயராம்.,5
ஒரு_பூர்வ_பௌத்தனின்_சாட்சியம்,அசுவகோசரின் புத்தசரிதமும் புத்தரை விநாயகர் என்று அழைப்பது குறிப்பிடற்குரியது.,7
ஒரு_பூர்வ_பௌத்தனின்_சாட்சியம்,இக்காதையில் புத்தருடைய கோட்பாடு பற்றித் தாசர் கூறும் கருத்தொன்று குறிப்பிடற்குரியது.,8
ஒரு_பூர்வ_பௌத்தனின்_சாட்சியம்,ஆதலின் சகலவித கோட்பாடுகளினின்றும் சகல எண்ணங்களினின்றும் சகலவித தப்பபிப்பராயங்களினின்றும் தற்பெருமையினின்றும் தன்னயத்தினின்றும் முற்றும் நீங்கியுள்ளவர் என்று அறிந்து கூறுவீர்களாக.,14
ஒரு_பூர்வ_பௌத்தனின்_சாட்சியம்,என்றெல்லாம் பிராமணனுக்குரிய இலக்கணம் கூறப்பெறுகிறது.,4
ஒரு_பூர்வ_பௌத்தனின்_சாட்சியம்,பிக்கு வர்க்கம் எனும் பகுதியில் யார் உண்மையான பிக்கு என்பது வரையறை செய்யப்படுகின்றது.,10
ஒரு_பூர்வ_பௌத்தனின்_சாட்சியம்,புத்தர் அசோதரை சந்திப்பை உள்ளத்தை உருக்கும் ஒரு சிறு நாடகமாகவே உருவாக்குகின்றார் தாசர்.,10
ஒரு_பூர்வ_பௌத்தனின்_சாட்சியம்,ததாகதர் தனது தந்தைக்கு ஞானோபதேசம் செய்துவிட்டு அசோதரை வாசம் செய்யும் இடத்தை நாடி வாயிற்படியில் நின்று ததாகதன் வரலாமோவென்றார்.,14
ஒரு_பூர்வ_பௌத்தனின்_சாட்சியம்,தேவிகா லோத்திரம் தடையின்றி வரலாம் என்னும் மிருது வாக்கு எழும்பிற்று.,8
ஒரு_பூர்வ_பௌத்தனின்_சாட்சியம்,அதனை வினவிய பகவன் அறைக்குள் சென்று அசோதரையை நோக்கி அம்மே !,8
ஒரு_பூர்வ_பௌத்தனின்_சாட்சியம்,அசோதரையோ நமது ஐயன் பாதத்தை இறுகப்பற்றி ஐயனே !,6
ஒரு_பூர்வ_பௌத்தனின்_சாட்சியம்,உமது கருணா நோக்கத்தால் இம்மட்டும் சுகமே யென்றாள்.,6
ஒரு_பூர்வ_பௌத்தனின்_சாட்சியம்,யாதொரு துக்கமும் இல்லையோ வென்றார்.,4
ஒரு_பூர்வ_பௌத்தனின்_சாட்சியம்,உம்மைப் பிரிந்த துக்கம் ஒன்றேயன்றி வேறு துக்கம் யாதும் அறியேன் என்றாள்.,9
ஒரு_பூர்வ_பௌத்தனின்_சாட்சியம்,சதாசுக நித்ய தன்மமாம் பேரின்பத்தையே தெரிந்து கொள்ள ஆசிக்கின்றேனென்றாள்.,7
ஒரு_பூர்வ_பௌத்தனின்_சாட்சியம்,பகவன் பரத்துவாசரை நோக்கி அன்பனே !,4
ஒரு_பூர்வ_பௌத்தனின்_சாட்சியம்,இத்தியாதி வியாதிகளின் தோற்றத்திற்கும் உபாதைக்கும் மக்கள் அவாக்களே காரணமாகும்.,7
ஒரு_பூர்வ_பௌத்தனின்_சாட்சியம்,இவற்றையே உண்மையான கீதைகள் என்று தாசர் கருதி அறிமுகப்படுத்துவார்.,7
ஒரு_பூர்வ_பௌத்தனின்_சாட்சியம்,"உலகைப் படைத்த இறைவன் ஒருவன் உண்டா, இல்லையா?",6
ஒரு_பூர்வ_பௌத்தனின்_சாட்சியம்,"பிரமம் அதுவா, இதுவா?",3
ஒரு_பூர்வ_பௌத்தனின்_சாட்சியம்,"இல்லறத்தார், துறவறத்தார் ஆகிய இருசாராரும், எப்படியிருக்க வேண்டுமென்று தெளிவாகச் சொல்லப்படுகிறது.",8
ஒரு_பூர்வ_பௌத்தனின்_சாட்சியம்,இத்தகைய சந்திப்பும் அசுவகோசரின் புத்த சரிதத்தில் இடம்பெறவில்லை.,6
ஒரு_பூர்வ_பௌத்தனின்_சாட்சியம்,சக்கரவர்த்தியாரும் தனக்குள்ளிருந்த வியாதியின் உபத்திரவம் நீங்கித் திருமகனை விழித்துப் பார்த்து அருமை மைந்தனேயென்று அழைக்கலாமோ வென்று சிந்தித்தான்.,13
ஒரு_பூர்வ_பௌத்தனின்_சாட்சியம்,அவரது முக தேஜசைக் கண்டு ஆனந்தக்கண்ணிரைச் சொரிந்தான்.,6
ஒரு_பூர்வ_பௌத்தனின்_சாட்சியம்,தோற்றும் பொருட்கள் யாவும் கெடும் என்பதைத் தெள்ளறத் தெளிந்து கொண்டீரா இல்லையாவென்றார்.,9
ஒரு_பூர்வ_பௌத்தனின்_சாட்சியம்,"தாதா தெரிந்து கொண்டேன், தெரிந்து கொண்டேன் என்று கூறினான்.",7
ஒரு_பூர்வ_பௌத்தனின்_சாட்சியம்,இதை அடுத்து வரும் காட்சி வியப்புக்குரியது.,5
ஒரு_பூர்வ_பௌத்தனின்_சாட்சியம்,இந்நிகழ்ச்சிப் படப்பிடிப்பில் அசோதரை மலைமகள் என்று அழைக்கப்படுவது கவனத்தில் கொள்ளத்தக்கது.,8
ஒரு_பூர்வ_பௌத்தனின்_சாட்சியம்,குடும்பிகளுக்கு அறவுரை கூறவிழையும் தாசர் சிகாளா விசாரிணைக் காதை யை அதற்குப் பயன்படுத்திக் கொள்கிறார்.,11
ஒரு_பூர்வ_பௌத்தனின்_சாட்சியம்,"சதுர் பரமார்த்த காதை மனம், மனத்தின் ஆற்றல், உருவம், நிருவாணம் ஆகிய நான்கு வகைப் பரமார்த்தங்கள் பற்றிப் பேசும்.",14
ஒரு_பூர்வ_பௌத்தனின்_சாட்சியம்,பிருமன் தரிசன காதை ஒரு தனித்தன்மை கொண்டது.,6
ஒரு_பூர்வ_பௌத்தனின்_சாட்சியம்,சங்க இலக்கியம் கூறும் ஐந்நில மக்களின் வாழ்க்கை முறைகளை இக்காதை விளக்கும்.,9
ஒரு_பூர்வ_பௌத்தனின்_சாட்சியம்,புத்தர் பாலைவனம் சென்று அங்குள்ள மக்களுக்குக் கண்ணாடி செய்யும் தொழிலைக் கற்றுத் தருகிறார்.,10
ஒரு_பூர்வ_பௌத்தனின்_சாட்சியம்,"முல்லை நிலம் அடைந்து அம்மக்கள் கொண்டுவந்த பாலில் நெய்யும், தயிரும் கலந்திருப்பது கண்டு அவற்றைப் பிரிக்கும் வகையைக் கற்பிக்கிறார்.",14
ஒரு_பூர்வ_பௌத்தனின்_சாட்சியம்,மருத நில மக்களுக்குப் பயிர்த் தொழில் பயிற்றுவிக்கிறார்.,6
ஒரு_பூர்வ_பௌத்தனின்_சாட்சியம்,அஃது அகுஸல கர்மங்களாகும்.,3
ஒரு_பூர்வ_பௌத்தனின்_சாட்சியம்,"அதாவது, பாம்பின் வாய்ப்பட்ட தேரை எறும்பைப் பிடித்துண்பதற்கு ஒக்கும்.",7
ஒரு_பூர்வ_பௌத்தனின்_சாட்சியம்,பரிநிருவாண காதை யில் புத்தர் தமது அடியார்களாகிய ஆனந்தனையும் பிருங்கியையும் சத்தியசங்கத்து அடியார்களையும் அழைத்துப் பரிநிருவாணத்தை விளக்குவார்.,13
ஒரு_பூர்வ_பௌத்தனின்_சாட்சியம்,"மலைவாழ் மக்களுக்கும் ஆனந்தனுக்கும் புத்த தன்மத்தையும், சேணிபன் என்னும் அரசனுக்குக் குடும்ப தன்மத்தையும் போதிப்பார்.",11
ஒரு_பூர்வ_பௌத்தனின்_சாட்சியம்,இக்காதையில் ஒரு மகிழ்வூட்டும் நாடகக்காட்சி இடம் பெறுகிறது.,6
ஒரு_பூர்வ_பௌத்தனின்_சாட்சியம்,இதையடுத்து வரும் காட்சி உள்ளத்தை உருக்குவதாகும்.,5
ஒரு_பூர்வ_பௌத்தனின்_சாட்சியம்,இறைவன் என்று ஒருவன் உண்டா வெனும் இக்கேள்விக்குப் புத்தர் தரும் விடையாக அயோத்திதாசர் கூறுவது ஆழ்ந்த சிந்தனையைத் தூண்டுவது.,14
ஒரு_பூர்வ_பௌத்தனின்_சாட்சியம்,உண்டென்பதை உங்கள் உள்ளத்திலும் இல்லையென்பதைத் தோற்றும் பொருள் க்ஷணத்திற்கு க்ஷணம் அழிதலிலும் அறிந்து கொள்ளலாம்.,11
ஒரு_பூர்வ_பௌத்தனின்_சாட்சியம்,அன்னையானவள் குழந்தைக்கு அன்னம் ஊட்டுவாள்.,4
ஒரு_பூர்வ_பௌத்தனின்_சாட்சியம்,அதனை விழுங்கித் தன்னைப் போஷித்துக் கொள்ள வேண்டியது குழவியின் செயலாகும்.,8
ஒரு_பூர்வ_பௌத்தனின்_சாட்சியம்,அது போல ததாகதர் தான் கண்டடைந்த சுகவழியைப் போதிப்பார்.,7
ஒரு_பூர்வ_பௌத்தனின்_சாட்சியம்,நீங்களோ அவ்வழியில் சென்று சுகமுற்று உண்டா இல்லையாவென்பதை உங்களுக்குள் நீங்களே உணர்ந்து தெளிந்து கொள்ள வேண்டும்.,12
ஒரு_பூர்வ_பௌத்தனின்_சாட்சியம்,உண்டென்னிலோ விசாரணையற்ற சோம்பலால் எங்குண்டு என்னும் எதிர்வினாத் தோன்றும்.,7
ஒரு_பூர்வ_பௌத்தனின்_சாட்சியம்,இல்லையென்னிலோ மகோத்மத்தச் சோம்பலால் யாதுக்கில்லையென்னும் பதில் மொழித்தோன்றும்.,6
ஒரு_பூர்வ_பௌத்தனின்_சாட்சியம்,இக்கதைக்கு ஒரு காண்டம் புத்த சரிதத்தில் ஒதுக்கப்பட்டுள்ளது.,6
ஒரு_பூர்வ_பௌத்தனின்_சாட்சியம்,சாக்கையக் குடும்பத்தினருக்கு விபூதி பூசும் பழக்கம் எவ்வாறு ஏற்பட்டதென்பதையும் இங்கு விளக்குவார்.,9
