work_title,sentence,sentence_length
ஓலைக்_கிளி,﻿ பகுதி சிறுகதைகள் ஆசிரியரர் பெ.,5
ஓலைக்_கிளி,மூங்கிலை நீள நீளமான தப்பைகளாகவும் ஈர்க்குகளாகவும் கிழித்து அவற்றைக்கொண்டு கூடை பின்னுவது ஆச்சரியமாக இருக்கும்.,11
ஓலைக்_கிளி,அப்படிச் செய்கின்ற பல பேர்கள் சேர்ந்த ஒரு கூட்டம் இருந்தது.,8
ஓலைக்_கிளி,"ஆண்கள், பெண்கள், குழந்தைகள் எல்லோரும் அதிலே இருந்தார்கள்.",6
ஓலைக்_கிளி,"அவர்கள் ஊர் ஊராகச் சென்று, ஒவ்வோர் ஊரிலும் சில நாள்கள் தங்குவார்கள்.",9
ஓலைக்_கிளி,தங்கி அங்கே தங்கள் தொழிலைச் செய்வார்கள்.,5
ஓலைக்_கிளி,அவர்களுக்கு வீடு ஒன்றும் கிடையாது.,4
ஓலைக்_கிளி,போய்த் தங்குகிற இடத்தில் கூடாரங்கூடப் போட்டுக்கொள்ள மாட்டார்கள்.,6
ஓலைக்_கிளி,வீடும் கூடாரமும் அவர்களுக்கு வேண்டியதில்லை.,4
ஓலைக்_கிளி,நல்ல நிழல் கொடுக்கும்படியான ஒரு பெரிய மரம் இருந்தால் போதும்.,8
ஓலைக்_கிளி,அதனடியில் தங்கித் தங்கள் தொழிலைச் செய்து வயிறு வளர்ப்பார்கள்.,7
ஓலைக்_கிளி,மூங்கிலில் வேலை செய்வதும் சோறு சமைத்துச் சாப்பிடுவதும் மரத்தடியிலேதான்.,7
ஓலைக்_கிளி,அவர்கள் நீளமான மூங்கில்களை ஒரு கற்றையாகக் கட்டிக்கொண்டு வந்திருப்பார்கள்.,7
ஓலைக்_கிளி,"அந்த மூங்கில் ﻿களும் அவற்றை லேசான தப்பைகளாகவும், ஈர்க்குகளாகவும் கிழிப்பதற்கு உபயோகமாகும் கத்திகளுந்தாம் அவர்களுடைய சொத்து.",12
ஓலைக்_கிளி,சமையல் செய்வதற்குச் சட்டிபானைகள் சிலவும் வைத்திருப்பார்கள்.,5
ஓலைக்_கிளி,"ஊராருக்குத் தேவையான கூடை, முறம், தட்டம் முதலான சாமான்களைச் செய்து கொடுத்துக் காசும் தானியமும் சம்பாதிப்பார்கள்.",12
ஓலைக்_கிளி,இப்படிப்பட்ட அந்தக் கூட்டத்திலே ஒரு கிழவியும் ஒரு சிறு பையனும் இருந்தார்கள்.,9
ஓலைக்_கிளி,கிழவி பையனுக்குப் பாட்டி.,3
ஓலைக்_கிளி,அவன் குழந்தையாக இருந்தபோதே அவனுடைய அப்பாவும் அம்மாவும் இறந்துபோனார்கள்.,7
ஓலைக்_கிளி,பாட்டிக் கிழவிதான் அவனைக் காப்பாற்றி வளர்த்து வந்தாள்.,6
ஓலைக்_கிளி,"ஆனால், ﻿வயதாக ஆகக் கிழவியால் மூங்கிலைத் தப்பையாகக் கிழித்துக் கூடை முறம் கட்ட முடியவில்லை.",11
ஓலைக்_கிளி,அவள் கைகள் தளர்ந்து போய்விட்டன.,4
ஓலைக்_கிளி,ஓர் ஊரிலிருந்து வேறோர் ஊருக்குப் போவதே அவளுக்குக் கஷ்டமாக இருந்தது.,8
ஓலைக்_கிளி,இருந்தாலும் அந்தக் கூடைமுறம் கட்டும் உறவினர்களை விட்டுப் பிரிய முடியுமா?,8
ஓலைக்_கிளி,பிரிந்தால் அவளுக்கு வேறு துணை யாரும் இல்லை.,6
ஓலைக்_கிளி,அதனால் எப்படியோ கஷ்டப்பட்டு அவர்களுடன் செல்லுவாள்.,5
ஓலைக்_கிளி,அந்தச் சிறு பையனையும் அவளே தூக்கிக்கொண்டு போவாள்.,6
ஓலைக்_கிளி,சில சமயங்களிலே அவ்விடத்திலே இரக்கங்கொண்டு சில பேர் அந்தப் பையனைத் துரக்கிக்கொண்டு வர உதவி செய்வார்கள்.,12
ஓலைக்_கிளி,கிழவியால் ஊருக்குள்ளே தினமும் சுற்றிக் கூடை முறங்களை விற்கவும் முடியாது.,8
ஓலைக்_கிளி,சிறுவனாலும் நடக்க முடியாது.,3
ஓலைக்_கிளி,"ஆதலால், அவர்கள் இரண்டு பேரும் மரத்தின் அடியிலேயே இருப்பார்கள்.",7
ஓலைக்_கிளி,மற்றவர் அனைவரும் ஊருக்குள்ளே போய்த் தாங்கள் செய்த கூடை முறங்களை விற்பார்கள்.,9
ஓலைக்_கிளி,கிழவியால் கூடை முறம் செய்ய முடியாவிட்டாலும் பனையோலையைக்கொண்டு அழகான விளையாட்டுப் பொம்மைகள் செய்வதிலே அவள் கெட்டிக்காரி.,12
ஓலைக்_கிளி,"ஓலையைப் பலவகையாகக் கிழித்தும், நறுக்கியும் அவள் பொம்மைகள் செய்வாள்.",7
ஓலைக்_கிளி,கிலுகிலுப்பை உங்களுக்குத் தெரியுமா?,3
ஓலைக்_கிளி,அதற் குள்ளே சிறிய கற்களைப் போட்டிருப்பார்கள்.,5
ஓலைக்_கிளி,கிலுகிலுப்பையை ஆட்டினால் கிலுகிலு என்று சத்தம் உண்டாகும்.,6
ஓலைக்_கிளி,அதைப் போல அவள் வேறு விளையாட்டுச் சாமான்களும் செய்வாள்.,7
ஓலைக்_கிளி,சிறுவன் அவளுக்குப் பக்கத்திலே உட்கார்ந்து அவள் செய்வதையெல்லாம் ஆவலோடு பார்த்துக் கொண்டிருப்பான்.,9
ஓலைக்_கிளி,அவன் பெயர் தங்கவேல்.,3
ஓலைக்_கிளி,கிழவி அவனைச் செல்லமாகத் தங்கம் என்று கூப்பிடுவாள்.,6
ஓலைக்_கிளி,ஒரு சமயம் இந்தக் கூடைமுறம் செய்கிறவர்கள் கூட்டம் ஒரு சிறு கிராமத்திலே வந்து தங்கியது.,11
ஓலைக்_கிளி,அந்த ஊரிலே பணக்காரர்கள் நிறைய உண்டு.,5
ஓலைக்_கிளி,குழந்தைகள் புதிய புதிய விளையாட்டுப் பொம்மைகள் வேண்டும் என்று கேட்டார்கள்.,8
ஓலைக்_கிளி,கிலு கிலுப்பை அவர்களுக்குப் பிடிக்கவில்லை.,4
ஓலைக்_கிளி,அதனால் அந்தக் கிழவி புதிதாகக் கற்பனை பண்ணி ஓலையாலே பின்னி ஓர் அழகிய கிளி செய்தாள்.,12
ஓலைக்_கிளி,பச்சிலைகளையெல்லாம் பிடுங்கி வந்து அதற்கு அழகாகப் பச்சைச் சாயம் கொடுத்தாள்.,8
ஓலைக்_கிளி,அந்த ஊர்க் குழந்தைகளெல்லாம் அதன்மேல் ஆசை கொண்டார்கள்.,6
ஓலைக்_கிளி,ஒவ்வொரு குழந்தையும் தனக்கே அது வேண்டும் என்று போட்டி போட்டது.,8
ஓலைக்_கிளி,"அதனால், கிழவி அதைப் போலவே இன்னும் பல கிளிகள் செய்தாள்.",8
ஓலைக்_கிளி,அவளுக்குப் பணம் நிறையக் கிடைத்தது.,4
ஓலைக்_கிளி,"தங்கம், இந்தப் பணத்தையெல்லாம் வைத்து உனக்கு நல்ல சொக்காய் வாங்கிக் கொடுக்கிறேன் என்று சிறுவனிடம் கிழவி ஆசையோடு சொன்னாள்.",14
ஓலைக்_கிளி,புதிய சொக்காய் போட்டுக்கொள்ளத் தங்கவேலுவுக்கு ஆசைதான்.,5
ஓலைக்_கிளி,இருந்தாலும் பாட்டியின் பேச்சைக் கேட்டு அவன் மகிழ்ச்சி அடையவில்லை.,7
ஓலைக்_கிளி,"அவன் முகம் வாடத் தொடங்கியது ஏனென்றால், அவனுக்குப் பாட்டி செய்யும் கிளிகளிடம் அத்தனை ஆசை.",11
ஓலைக்_கிளி,அவற்றை அந்த ஊர்ச் சிறுவர்களும் சிறுமிகளும் வாங்கிக்கொண்டு ஓடுவதைப் பார்த்து அவன் மனம் வருந்தினான்.,11
ஓலைக்_கிளி,அவையெல்லாம் தனக்கே வேண்டும் என்று ஆசைப்பட்டான்.,5
ஓலைக்_கிளி,"பாட்டீ, இந்தக் கிளிகளை விற்கவேண்டாம் என்று அவன் கண்ணீர் பெருக்கிக்கொண்டு கிழவியிடம் சொன்னான்.",10
ஓலைக்_கிளி,"தங்கம், இந்தக் கிளிகளெல்லாம் நமக்கு எதற்கு?",5
ஓலைக்_கிளி,காசிருந்தால் என்ன வேணுமானாலும் வாங்கலாம்.,4
ஓலைக்_கிளி,பொம்மை சோறு போடுமா?,3
ஓலைக்_கிளி,என்று கிழவி ஆறுதல் சொன்னாள்.,4
ஓலைக்_கிளி,இதுவரையிலும் யாருக்கும் செய்து கொடுக்காத அளவில் மிகப்பெரியதாகத் தனக்குக் கிளியொன்று வேண்டும் என்று அவள் சொன்னாள்.,12
ஓலைக்_கிளி,அவள் தகப்பனார்தான் அந்த ஊரிலே எல்லோரையும்விடப் பெரிய பணக்காரர்.,7
ஓலைக்_கிளி,அவர்களுடைய பெரிய மச்சு வீடு அந்தக் கூடை முறம் கட்டுவோர் தங்கியிருந்த இடத்திற்கு எதிராகவே இருந்தது.,12
ஓலைக்_கிளி,அதனால் அந்தப் பெண் கேட்டதும் தோட்டம் இருந்தது.,6
ஓலைக்_கிளி,அதிலே நீரூற்றுகள் சிலுசிலு வென்று ஓடிக்கொண்டிருந்தன குயில்கள் பாடின மயில்கள் ஆடின.,9
ஓலைக்_கிளி,பச்சைக்கிளிகள் கொஞ்சிப் கொஞ்சிப் பேசின.,4
ஓலைக்_கிளி,இவற்றையெல்லாம் பார்த்துவிட்டு மகிழ்ச்சியோடு தங்கவேல் மறுபடியும் மாளிகைக்குள் நுழைந்தான்.,7
ஓலைக்_கிளி,இன்பலோகத்தில் இருப்பதாக அவனுக்குத் தோன்றியது.,4
ஓலைக்_கிளி,அப்படியே ஒரு பட்டு மெத்தை விரித்த கட்டிலிலே அமர்ந்து தலையணையில் சாய்ந்தான்.,9
ஓலைக்_கிளி,சுகமாகத் தூக்கம் வந்தது.,3
ஓலைக்_கிளி,அவன் அப்படியே தூங்கிப்போய்விட்டான்.,3
ஓலைக்_கிளி,தங்கவேல் மறுபடியும் கண்ணை விழிக்கும்போது பழையபடி மரத்தின் அடியிலே ஓலைத் தடுக்கின்மேல் படுத்திருந்தான்.,10
ஓலைக்_கிளி,கொஞ்ச நேரத்திற்கு முன் அவன் மேலிருந்த பட்டாடைகளையெல்லாம் இப்பொழுது காணோம்.,8
ஓலைக்_கிளி,"கிழிந்து போன பொம்மைக்கிளி பக்கத்தில் இருந்தது, பாட்டி கொஞ்ச தூரத்தில் வெறுந்தரையில் படுத்திருந்தாள்.",10
ஓலைக்_கிளி,தங்கவேலுக்கு முதலில் கொஞ்சம் ஏமாற்றமாகத்தான் இருந்தது.,5
ஓலைக்_கிளி,ஆனால் பக்கத்திலே பிய்ந்துபோன அந்தக் கிளிப் பொம்மையைப் பார்த்ததும் மனத்துக்குத் தைரியம் வந்தது.,10
ஓலைக்_கிளி,அந்தப் பொம்மை இருக்கும் வரையில் மறுபடியும் அந்த மாளிகைக்குப் போகலாம் என்ற நம்பிக்கை உண்டாயிற்று.,11
ஓலைக்_கிளி,தங்கவேலின் நம்பிக்கை வீண்போகவில்லை.,3
ஓலைக்_கிளி,ஒவ்வொரு நாளும் அவன் தூங்கும்போது அந்தக் கிளிப்பொம்மை அவனை எங்கெல்லாமோ அதிசயமான இடங்களுக்குக் கொண்டுபோவதாக அவன் கனவு கண்டான்.,14
ஓலைக்_கிளி,அது முதல் பாட்டி புதிய புதிய கிளிப்பொம்மைகள் செய்து விற்கும்போது அவன் முன் போலக் கவலைப்படவில்லை.,12
ஓலைக்_கிளி,சந்தோஷமாகவே ஊரிலுள்ள குழந்தைகளுக்கு அவனே அந்தப் பொம்மைகளை எடுத்துக் கொடுப்பான்.,8
ஓலைக்_கிளி,இந்தக் கிளி மேலே ஏறிக்கொண்டு என்னோடு வருகிறாயா?,6
ஓலைக்_கிளி,அழகான முத்து மாளிகைக்குப் போகலாம்.,4
ஓலைக்_கிளி,அங்கே விளையாடலாம் என்று அவன் சொல்லிக்கொண்டே கிளிப்பொம்மையைக் குழந்தைகளுக்குக் கொடுப்பான்.,8
ஓலைக்_கிளி,"ஆனால், அவன் சொல்வது மற்ற குழந்தைகளுக்கு விளங்காது.",6
ஓலைக்_கிளி,"ஏனென்றால், அவர்களுக்குத் தங்கவேலின் கனவுகளைப் பற்றி ஒன்றுமே தெரியாது.",7
ஓலைக்_கிளி,அவன் சொல்லுகின்ற மாளிகையைப்பற்றியும் தெரியாது.,4
ஓலைக்_கிளி,அதனால் அவர்கள் பதில் சொல்லாமல் விழித்துக்கொண்டிருப்பார்கள்.,5
ஓலைக்_கிளி,பிறகு தங்கள் வீட்டுக்குப் போய்விடுவார்கள்.,4
ஓலைக்_கிளி,ஒவ்வொரு குழந்தையும் கிளிப்பொம்மை வாங்கும் போது தங்கவேல் சந்தோஷமடைய ஆரம்பித்தான்.,8
ஓலைக்_கிளி,தன்டைய ஓலைக்கிளி பிய்ந்து போனதாக இருந்தாலும் அதுதான் மற்ற ஓலைக்கிளிகளைவிட உயர்ந்தது என்று அவன் நிச்சயமாக நம்பினான்.,13
ஓலைக்_கிளி,அதுதானே அவனைத் தன் முதுகில் தூக்கிக்கொண்டு எங்கெங்கோ பறந்து செல்கிறது?,8
ஓலைக்_கிளி,கிழவிக்கு இப்பொழுது அவனிடத்திலே கொஞ்சங் கூடக் கோபம் கிடையாது.,7
ஓலைக்_கிளி,தங்கம் நல்ல பையனாகிவிட்டான் அவன் விளையாட்டுப் பையனாக இல்லை.,7
ஓலைக்_கிளி,இனிமேல் அவன் தொழில் செய்து பிழைத்துக்கொள்வான் என்று அவள் மனத்திற்குள்ளேயே மகிழ்ச்சியடைந்தாள்.,9
ஓலைக்_கிளி,இவ்வாறு தங்கவேலும் அவனுடைய பாட்டிக் கிழவியும் சந்தோஷமாக வாழ்ந்து வந்தார்கள்.,8
ஓலைக்_கிளி,நீலத்தாமரை முன்னொரு காலத்தில் நெல்லி வளநாடு என்று ஒரு தேசம் இருந்தது.,9
ஓலைக்_கிளி,அந்தத் தேசத்து அரசனுடைய அரண்மனைப் பூந்தோட்டத்திலே ஒரு விசித்திரமான தாமரைக் குளம் உண்டு.,10
ஓலைக்_கிளி,அதிலே நாள்தோறும் ஒரே ஒரு தாமரை மலர்மட்டும் பூக்கும்.,7
ஓலைக்_கிளி,அந்தப் பூவும் நீல நிறமாக இருக்கும்.,5
ஓலைக்_கிளி,வேறு தாமரையே கண்ணில் படாது.,4
ஓலைக்_கிளி,அந்த நாட்டு ராணி அந்த நீலத் தாமரையைப் பறித்துக்கொள்ளுவாள்.,7
ஓலைக்_கிளி,யாரோ ரகசியமாக வந்து அதைப் பறித்துக்கொண்டு போய்விட்டார்கள்.,6
ஓலைக்_கிளி,மறுநாள் பார்த்தால் அன்றும் தாமரைப்பூவைக் காணமுடியவில்லை.,5
ஓலைக்_கிளி,இப்படியே பல நாள்கள் நீலத் தாமரைப்பூத் திருட்டுப் போய்க்கொண்டிருந்தது.,7
ஓலைக்_கிளி,அதனால் ராணிக்கு மிகுந்த கோபம் வந்துவிட்டது.,5
ஓலைக்_கிளி,திருடனை உடனே கண்டுபிடிக்க வேண்டும் என்று அரசனிடத்திலே சொன்னாள்.,7
ஓலைக்_கிளி,ராணி சொன்னால் அரசன் எந்தக்காரியத்தையும் உடனே செய்வான்.,6
ஓலைக்_கிளி,அப்படியிருக்கும் போது திருடனைக் கண்டுபிடிக்க ஏற்பாடு செய்யாமலா இருப்பான்?,7
ஓலைக்_கிளி,உடனே அதற்கு வேண்டிய முயற்சிகளையெல்லாம் எடுக்கலானான்.,5
ஓலைக்_கிளி,அந்தத் தாமரைக்குளம் அரண்மனைப் பூந்தோட்டத்தில் இருக்கிறதல்லவா?,5
ஓலைக்_கிளி,அந்தப் பூந்தோட்டத்தைச் சுற்றிலும் அரசன் காவல் வைத்தான்.,6
ஓலைக்_கிளி,அப்படியிருந்தும் தாமரை மலர் களவு போய்க் கொண்டேயிருந்தது.,6
ஓலைக்_கிளி,"அந்த வீரர்களால் திருடனைத் தடை செய்யவோ, கண்டுபிடிக்கவோ முடியவில்லை.",7
ஓலைக்_கிளி,ராணிக்கு மேலும் கோபம் பொங்கி எழுந்தது.,5
ஓலைக்_கிளி,அவள் அரசனிடத்திலே கோபமாகப் பேசினாள்.,4
ஓலைக்_கிளி,அரசிளங்குமரர்கள் ஐந்து பேரையும் உடனே தன்னிடம் வரும்படி ஆணையிட்டாள்.,7
ஓலைக்_கிளி,அவர்கள் எல்லோரும் ராணியின் கோபத்தைக் கண்டு சற்று பயத்தோடு அவளுக்கு முன்னால் வந்து நின்றார்கள்.,11
ஓலைக்_கிளி,நமது காவலாளிகளால் தாமரைப் பூவைத் திருடுகின்றவனைக் கண்டுபிடிக்க முடியவில்லை.,7
ஓலைக்_கிளி,உங்கள் தந்தையால் இந்தக் காரியம் ஆகாமல் போய்விட்டது.,6
ஓலைக்_கிளி,அவர் செய்த முயற்சியெல்லாம் பலன் கொடுக்கவில்லை.,5
ஓலைக்_கிளி,அதனால் உங்களுக்கு நான் ஒரு உத்தரவு போடப்போகிறேன்.,6
