work_title,sentence,sentence_length
ஓலைக்_கிளி,அதன்படி நீங்கள் செய்தாக வேண்டும் என்று ராணி பலத்த குரலில் சொன்னாள்.,9
ஓலைக்_கிளி,அரசன் பேசாமல் மெளனமாக உட்கார்ந்திருந்தான்.,4
ஓலைக்_கிளி,கொஞ்ச நாள்களாக அரசி தங்களிடத்திலே அன்பு காட்டாமல் கடுமையாக நடந்து வருவதை அரசகுமாரர்கள் அறிந்திருந்தார்கள்.,11
ஓலைக்_கிளி,திடீரென்று தங்களுடைய அன்பான தாய் இப்படி மாறிவிட்டதை அவர்களால் புரிந்துகொள்ளவே முடியவில்லை.,9
ஓலைக்_கிளி,அதனால் அவளிடத்தில் அதிகமாக நெருங்காமலேயே அரச குமாரர்கள் இருந்து வந்தார்கள்.,8
ஓலைக்_கிளி,இப்பொழுது அவள் என்ன உத்தரவு போடப்போகிறாளோ என்று கவலையோடு நின்றார்கள்.,8
ஓலைக்_கிளி,ராணி மூத்த குமாரனைப் பார்த்துப் பேசத் தொடங்கினாள்.,6
ஓலைக்_கிளி,இன்றைக்கு இரவிலே நீ குளத்தடியிலிருந்து காவல் புரிய வேண்டும்.,7
ஓலைக்_கிளி,தாமரைப்பூவைத் திருடுகின்றவனைப் பிடித்துக்கொண்டு வரவும் வேண்டும்.,5
ஓலைக்_கிளி,அப்படிச் செய்யத் தவறினால் உன்னைப் பாதாளச் சிறையில் அடைப்பேன்.,7
ஓலைக்_கிளி,அடுத்த நாளைக்கு இரண்டாவது ராஜகுமாரன் போகவேண்டும் என்று அவள் கர்ஜனை செய்தாள்.,9
ஓலைக்_கிளி,அரசன் வாய் பேசாமல் தலையைக் குனிந்துகொண்டு இருந்தான்.,6
ஓலைக்_கிளி,﻿ராணியின் உத்தரவைக் கேட்டுக்கொண்டு அரச குமாரர்கள் தங்களுடைய அறைக்குச் சென்றார்கள்.,8
ஓலைக்_கிளி,அங்கே சென்று கூடி ஆலோசனை நடத்தினார்கள்.,5
ஓலைக்_கிளி,எல்லோருக்கும் மூத்தவனுடைய வயது பதினான்கு இருக்கும்.,5
ஓலைக்_கிளி,அவன் தைரியமாகத்தான் இருந்தான்.,3
ஓலைக்_கிளி,இருந்தாலும் மற்றவர்களுக்குக் கவலையாக இருந்தது.,4
ஓலைக்_கிளி,"அண்ணா, நமது வீரர்கள் அத்தனைபேரும் சேர்ந்து கண்டு பிடிக்க முடியாத திருடனை நீ எப்படிக் கண்டுபிடிப்பாய் !",12
ஓலைக்_கிளி,அப்படிக் கண்டுபிடித்தாலும் நீ அவனைக் கட்டிப் பிடித்துவர முடியுமா? என்று விசனத்தோடு கேட்டார்கள்.,10
ஓலைக்_கிளி,"தம்பிகளே, நீங்கள் எதற்கும் பயப்படக்கூடாது.",4
ஓலைக்_கிளி,பயப்படுவது ஆண்களுக்கு அழகல்ல.,3
ஓலைக்_கிளி,நான் திருடனை நிச்சயமாகக் கண்டுபிடித்து வருவேன்.,5
ஓலைக்_கிளி,அவன் கையிலே தனது வில்லையும் அம்பையும் எடுத்துக்கொண்டான்.,6
ஓலைக்_கிளி,"இடையிலே கச்சை கட்டி, அதிலே உடைவாளைத் தொங்கவிட்டுக்கொண்டான்.",6
ஓலைக்_கிளி,"ஆனால், அவனால் திருடனைக் கண்டுபிடிக்க முடியவில்லை.",5
ஓலைக்_கிளி,எப்படியோ அவனையும் ஏமாற்றிவிட்டுத் திருட்டு நடந்துவிட்டது.,5
ஓலைக்_கிளி,"அதனால், அவன் பாதாளச்சிறையில் அடைபட்டான்.",4
ஓலைக்_கிளி,சிறைக்குள் போவதற்கு முன்பு தன் தம்பிகளைப் பார்த்து ஒருவிஷயம் சொல்ல அவன் விரும்பினான்.,10
ஓலைக்_கிளி,"ஆனால், ராணி அதற்கு அனுமதி தரவில்லை.",5
ஓலைக்_கிளி,அரசகுமாரன் தன் தந்தையிடம் கெஞ்சிப் பார்த்தான்.,5
ஓலைக்_கிளி,அரசன் ராணியின் உத்தரவுக்கு விரோதமாக ஒன்றும் செய்ய விருப்பமில்லாமல் பேசாமல் இருந்துவிட்டான்.,9
ஓலைக்_கிளி,மறுநாள் இரண்டாவது அரசகுமாரன் திருடனைக் கண்டுபிடிக்கச் செல்ல வேண்டும் என்பது ராணியின் கட்டளை.,10
ஓலைக்_கிளி,அதன்படியே அவனும் சென்றான்.,3
ஓலைக்_கிளி,அவனுக்கும் திருடனைக் கண்டுபிடிப்பதில் வெற்றி கிடைக்கவில்லை.,5
ஓலைக்_கிளி,அவனும் தனது தம்பிகளைச் சந்திக்க முடியாமலேயே பாதாளச் சிறைக்குப் போகவேண்டியதாயிற்று.,8
ஓலைக்_கிளி,"இவ்வாறே மூன்றாவது அரசகுமாரனும், நான்காவது அரசகுமாரனும் குளத்தடியில் காவல் புரிந்து திருடனைக் கண்டுபிடிக்காமல் பாதாளச்சிறை சேர்ந்தார்கள்.",12
ஓலைக்_கிளி,கடைசியில் எல்லோருக்கும் இளையவனான ஐந்தாவது அரசகுமாரனுடைய முறை வந்தது.,7
ஓலைக்_கிளி,அவன் சிறு பையன்.,3
ஓலைக்_கிளி,இருந்தாலும் அவனும் திருடனைக் கண்டுபிடிக்கப் போக வேண்டும் என்று ராணி உத்தரவு போட்டாள்.,10
ஓலைக்_கிளி,விக்கிரமன் தைரியமாகப் புறப்பட்டான்.,3
ஓலைக்_கிளி,அவனும் அவனுடைய சிறிய வில்லையும் அம்பையும் எடுத்துக்கொண்டான்.,6
ஓலைக்_கிளி,திருடனைப் பார்த்தால் உடனே அம்பு போட்டுக் கொன்றுவிட வேண்டும் என்று தீர்மானம் செய்துகொண்டான்.,10
ஓலைக்_கிளி,விக்கிரமன் இரவு முழுவதும் தூங்கவேயில்லை.,4
ஓலைக்_கிளி,ஜாக்கிரதையாக அடுத்த நாள் காலையில் மலரப்போகும் தாமரை மொக்கையே பார்த்துக்கொண்டு குளக்கரையில் அமர்ந்திருந்தான்.,10
ஓலைக்_கிளி,அடிக்கடி கண்ணில் தண்ணீரைத் தெளித்துக் கொண்டான்.,5
ஓலைக்_கிளி,பொழுது விடியும் சமயம் வரையில் யாரும் வரவில்லை.,6
ஓலைக்_கிளி,அந்தத் தாமரை மொக்கும் அப்படியே இருந்தது அது கொஞ்சம் கொஞ்சமாக விரியத் தொடங்கியது.,10
ஓலைக்_கிளி,கொஞ்சம் மங்கலாக வெளிச்சம் பரவத் தொடங்கிற்று.,5
ஓலைக்_கிளி,அந்தச் சமயத்திலே ஒரு அற்புதமான பஞ்சவர்ணக்கிளி யொன்று குளத்திற்கு மேலே சத்தமில்லாமல் பறந்து வந்தது.,11
ஓலைக்_கிளி,விக்கிரமன் அதைப் பார்த்துவிட்டான்.,3
ஓலைக்_கிளி,"ஆனால், அவ்வளவு அழகான அந்தப் பஞ்சவர்ணக் கிளியின்மேல் அம்பு போட அவனுக்கு மனம் வரவில்லை.",11
ஓலைக்_கிளி,"பஞ்சவர்ணக்கிளியே, நீ அந்தத் தாமரைப் பூவைப் பறிக்காதே.",6
ஓலைக்_கிளி,பறித்தால் உன்மீது அம்பு போடுவேன்.,4
ஓலைக்_கிளி,"நீ அழகான பறவையாயிருப்பதால், உன்னைக் கொல்ல எனக்கு மனமில்லை.",7
ஓலைக்_கிளி,அந்தப் பூ ராணிக்கு வேண்டும் என்று விக்கிரமன் சொன்னான்.,7
ஓலைக்_கிளி,பஞ்சவர்ணக்கிளி அவனது பேச்சைக் கேட்டுவிட்டுத் தாமரைப் பூவைப் பறிக்காமல் பக்கத்திலே இருந்த ஒரு மரக்கிளையில் வந்து அமர்ந்தது.,13
ஓலைக்_கிளி,"விக்கிரமா, உன்னுடைய அன்பான பேச்சைக் கேட்டு என் உள்ளம் குளிர்ந்தது.",8
ஓலைக்_கிளி,உன் அண்ணன்மார்கள் இவ்வாறு ஒன்றுமே சொல்லாமல் என்மீது அம்பைப் போட்டார்கள்.,8
ஓலைக்_கிளி,"ஆனால், நான் அந்த அம்புகளுக்குத் தப்பிக்கொண்டு பூவைப் பறித்துச்சென்றேன் என்று கிளி மனித பாஷையில் சொல்லிற்று.",12
ஓலைக்_கிளி,நீ பூவைப் பறித்துக்கொண்டு போனதால் இப் பொழுது அவர்கள் பாதாளச் சிறையில் கஷ்டப்படுகிறார்களே நீயேன் அப்படிச் செய்தாய்?,13
ஓலைக்_கிளி,என்று விக்கிரமன் கேட்டான்.,3
ஓலைக்_கிளி,அதுவா அது ஒரு பெரிய ரகசியம்.,5
ஓலைக்_கிளி,இங்கே இருந்து பேசக்கூடாது.,3
ஓலைக்_கிளி,பேசினால் ஆபத்து வரும்.,3
ஓலைக்_கிளி,விக்கிரமன் உடனே புறப்பட்டான்.,3
ஓலைக்_கிளி,தாமரைப்பூ அப்படியே மலர்ந்திருந்ததால் காவல்காரர்கள் அவனைச் சிறைப்படுத்தவில்லை.,6
ஓலைக்_கிளி,அந்தப் பூவைக் காணோமென்றால் தான் அரசகுமாரனைப்பிடித்துச் சிறைக்குக்கொண்டுபோக வேண்டும் என்பது ராணியின் கட்டளை.,10
ஓலைக்_கிளி,விக்கிரமன் கஷ்டப்பட்டு மலைமீது ஏறினான்.,4
ஓலைக்_கிளி,கிளி அவனுக்கு வழி காண்பித்துக்கொண்டே முன்னால் மெதுவாகப் பறந்து சென்றது.,8
ஓலைக்_கிளி,"மலையின் உச்சியிலுள்ள முருகன் கோயில் கண்ணுக்குத் தெரிந்தவுடனே கிளி, விக்கிரமா, அதோ கோயில் தெரிகிறது.",11
ஓலைக்_கிளி,நீ அங்குப் போய்க் கொஞ்சம் இளைப்பாறு.,5
ஓலைக்_கிளி,நான் ஒரு நொடியில் வந்துவிடுகிறேன்.,4
ஓலைக்_கிளி,பயப்படாதே என்று சொல்லிவிட்டு வேகமாக அரண்மனைத்தோட்டத்தை நோக்கிப் பறந்தது.,7
ஓலைக்_கிளி,விக்கிரமன் கோயிலுக்குச் சென்று முருகனை வணங்கி நின்றான்.,6
ஓலைக்_கிளி,அதற்குள் கிளியும் திரும்பி வந்துவிட்டது.,4
ஓலைக்_கிளி,அது தாமரை மலரைப் பறித்து வந்திருந்தது.,5
ஓலைக்_கிளி,அந்தப் பூவை முருகனுடைய பாதத்தில் போட்டு வணங்கியது.,6
ஓலைக்_கிளி,இந்தப் பூவைப் பறித்துவிட்டாயா? என்று விக்கிரமன் கவலையோடு கேட்டான்.,7
ஓலைக்_கிளி,இனிமேல் அந்த மாயக்காரியைப் பற்றிப் பயம் வேண்டியதில்லை என்று கிளி உற்சாகத்தோடு சொல்லிற்று.,10
ஓலைக்_கிளி,அவள் என் தாயார் ராணியல்லவா? என்று விக்கிரமன் கேட்டான்.,7
ஓலைக்_கிளி,அவள் உன் தாய் அல்ல.,4
ஓலைக்_கிளி,அவள் ஒரு மாயக்காரி.,3
ஓலைக்_கிளி,நான்தான் உன்னுடைய தாய்.,3
ஓலைக்_கிளி,என்னை இப்படி ஒரு கிளியாகச் செய்துவிட்டு அவள் என்னை போல வேஷம் போட்டுக்கொண்டு அரசரிடத்திலே நடிக்கிறாள்.,12
ஓலைக்_கிளி,அரசரும் அவளிடத்திலே மயங்கிக் கிடக்கிறார் என்று கிளி சொல்லிற்று.,7
ஓலைக்_கிளி,விக்கிரமனுக்கு ஒரே ஆச்சரியமாகப் போய்விட்டது.,4
ஓலைக்_கிளி,இருந்தாலும் கிளி சொல்லுவதை முழுவதும் அவனால் நம்ப முடியவில்லை.,7
ஓலைக்_கிளி,அவன் நம்பிக்கை கொள்ளாதிருப்பதைப் பார்த்துக் கிளி.,5
ஓலைக்_கிளி,"விக்கிரமா, என் கண்ணே, நான் சொல்லுவதில் உனக்கு நம்பிக்கையில்லையா?",7
ஓலைக்_கிளி,நான் உன்னைப் போல மனித பாஷையிலே பேசுவதைக் கேட்டாகிலும் நம்பிக்கை பிறக்கவில்லையா? என்று கேட்டது.,11
ஓலைக்_கிளி,"பஞ்சவர்ணக் கிளியே, நீ என் தாயாராக இருந்தால் என் அண்ணன்மார்களைப் பாதாளச் சிறையில் அடைக்கும்",11
ஓலைக்_கிளி,நீ இந்தத் தாமரைப்பூவைக் கொண்டு வராமலிருந்தால் அவர்கள் சுகமாக இருப்பார்களே ! என்று அவன் கேட்டான்.,11
ஓலைக்_கிளி,"கண்ணே, அவர்கள் எல்லாம் சிறையில் அடைபட்டதால் எனக்கு மிகவும் வருத்தந்தான்.",8
ஓலைக்_கிளி,"ஆனால், அவர்கள் உன்னைப் போல என்னிடத்தில் இரக்கம் காட்டவில்லையே !",7
ஓலைக்_கிளி,"இரக்கம் காட்டியிருந்தால், இங்கே அழைத்து வந்திருப்பேன்.",5
ஓலைக்_கிளி,முன்பு நான் ராணியாக இருந்தபோது இந்த முருகன் கோயிலுக்குத் தாமரைப்பூவை நாள்தோறும் அனுப்புவது வழக்கம்.,11
ஓலைக்_கிளி,அதன்படியே கிளியாக மாறிய பிறகும் கொண்டு வந்து முருகனுக்கு வைக்கிறேன்.,8
ஓலைக்_கிளி,முருகனுடைய அருளால் தான் நான் இன்னும் உயிரோடிருக்கிறேன் என்றது கிளி.,8
ஓலைக்_கிளி,இந்தக் கிளி உருவத்தை மாற்ற முடியாதா?,5
ஓலைக்_கிளி,என்று விக்கிரமன் கவலையோடு கேட்டான்.,4
ஓலைக்_கிளி,அதற்குத்தான் உன்னை இங்கே அழைத்து வந்தேன்.,5
ஓலைக்_கிளி,அதோ முருகனுடைய கையிலே ஒரு வேலிருக்கிறதல்லவா?,5
ஓலைக்_கிளி,அதை எடுத்து என் தலையில் குத்து என்றது கிளி.,7
ஓலைக்_கிளி,விக்கிரமனுக்கு அப்படிச் செய்ய மனம் வரவில்லை.,5
ஓலைக்_கிளி,கிளி இறந்துவிடுமே என்று பயந்தான்.,4
ஓலைக்_கிளி,முருகனைப் பணிந்து வேலை எடுத்துக்குத்து.,4
ஓலைக்_கிளி,உனக்கு உன் தாயார் வேண்டாவா? என்றது கிளி.,6
ஓலைக்_கிளி,விக்கிரமன் இதைக் கேட்டதும் தைரியமடைந்து கிளி சொன்னவாறே செய்தான்.,7
ஓலைக்_கிளி,"என்ன ஆச்சரியம் வேலை எடுத்துக் குத்தியதும் கிளி மறைந்து, விக்கிரமன் தாயார் எதிரே நின்றாள்.",11
ஓலைக்_கிளி,"அவள் விக்கிரமனைக் கட்டி அணைத்து முத்தமிட்டாள் கண்ணே, வா.",7
ஓலைக்_கிளி,நாம் உடனே அரண்மனைக்குப் போயாக வேண்டும்.,5
ஓலைக்_கிளி,அந்த மாயக்காரியின் வேடத்தை உடனே வெளிப்படுத்த வேண்டும்.,6
ஓலைக்_கிளி,அவள் உன் அண்ணன்மார்களுக்கு ஏதாவது தீங்கு இழைக்க முயற்சி செய்தாலும் செய்வாள்.,9
ஓலைக்_கிளி,அதற்கு முன்னே நாம் போக வேண்டும்.,5
ஓலைக்_கிளி,அந்த வேலினை எடுத்துக்கொள்.,3
ஓலைக்_கிளி,அது உன் கையிலிருக்கும்போது அந்த மாயக்காரியால் ஒன்றும் செய்ய முடியாது என்று சொன்னாள்.,10
ஓலைக்_கிளி,இரண்டு பேரும் கடவுளைத் தொழுதுவிட்டுப் புறப்பட்டார்கள்.,5
ஓலைக்_கிளி,விக்கிரமன் தன் தாயின் சொற்படி அந்த வேலை எடுத்துக்கொண்டான்.,7
ஓலைக்_கிளி,தாயும் மகனுமாக அரண்மனைக்கு ஓடிவந்தார்கள்.,4
ஓலைக்_கிளி,மாயக்காரியைப் பிடித்துச் சிறையில் தள்ளினார்கள்.,4
ஓலைக்_கிளி,அரசகுமாரர்களையெல்லாம் பாதாளச் சிறையிலிருந்து விடுதலை செய்தார்கள்.,5
ஓலைக்_கிளி,அரசனும் தன்னுடைய மயக்கம் தீர்ந்து சுயபுத்தியடைந்தான்.,5
ஓலைக்_கிளி,எல்லோரும் சுகமாக வாழ்ந்தார்கள்.,3
