work_title,sentence,sentence_length
கந்தர்_அலங்காரச்_சொற்பொழிவுகள்-1,ஆதலால் பிருதிவியின் சம்பந்தமும் உண்டாயிற்று.,4
கந்தர்_அலங்காரச்_சொற்பொழிவுகள்-1,இவ்வாறு சரவணபவன் உலகத்துக்கு வரும்போது உலகத்துக்கு மூலகாரணமாக இருக்கின்ற ஐம்பூதங்களின் முத்திரையைப் பெற்றே வந்தான்.,11
கந்தர்_அலங்காரச்_சொற்பொழிவுகள்-1,"ஏன், அப்படி வர வேண்டும்?",4
கந்தர்_அலங்காரச்_சொற்பொழிவுகள்-1,அந்த முத்திரையைப் பெறாமல் வந்தால் என்ன என்று கேட்கலாம்.,7
கந்தர்_அலங்காரச்_சொற்பொழிவுகள்-1,"ஓர் ஏழை, சிறு குடிசையில் வாழ்ந்து கொண்டிருக்கிறவன்.",6
கந்தர்_அலங்காரச்_சொற்பொழிவுகள்-1,அவன் குடிசையின் வாயிற்படி மூன்று அடி உயரந்தான் இருக்கிறது.,7
கந்தர்_அலங்காரச்_சொற்பொழிவுகள்-1,அவனுக்கு நோய் வந்துவிட்டது.,3
கந்தர்_அலங்காரச்_சொற்பொழிவுகள்-1,அந்தச் சிறு குச்சுக்குள் படுத்து மிகவும் வேதனைப்படுகிறான்.,6
கந்தர்_அலங்காரச்_சொற்பொழிவுகள்-1,அந்த ஊரிலேயே ஒரு டாக்டர் இருக்கிறார்.,5
கந்தர்_அலங்காரச்_சொற்பொழிவுகள்-1,அவர் ஏழைகளுக்கு இலவசமாக வைத்தியம் செய்வதைத் தம் லட்சியமாகக் கொண்டவர்.,8
கந்தர்_அலங்காரச்_சொற்பொழிவுகள்-1,"ஏழை நோயினால் வேதனைப்படுகிறான் என்று அறிந்தவுடன், அவன் குடிசையை நோக்கி ஓடி வருகிறார்.",10
கந்தர்_அலங்காரச்_சொற்பொழிவுகள்-1,அவர் உயரமானவர் ஆறு அடி உயரம் இருப்பார்.,6
கந்தர்_அலங்காரச்_சொற்பொழிவுகள்-1,அவர் ஏன் தம் உடம்பை வளைத்துக் கொண்டு போக வேண்டும்?,8
கந்தர்_அலங்காரச்_சொற்பொழிவுகள்-1,அது மூன்றடி உயர முள்ள கதவுடைய குடிசை.,6
கந்தர்_அலங்காரச்_சொற்பொழிவுகள்-1,நோயாளியோ உள்ளே இருக்கிறான்.,3
கந்தர்_அலங்காரச்_சொற்பொழிவுகள்-1,அதனால் அவனுக்கு அழுக்கு ஏற்படாதா என்பது ஒரு கேள்வி.,7
கந்தர்_அலங்காரச்_சொற்பொழிவுகள்-1,நம் வீட்டுக் குழந்தை பந்து விளையாடிக் கொண்டிருக்கிறது.,6
கந்தர்_அலங்காரச்_சொற்பொழிவுகள்-1,அது அடித்த பந்து விறகு அடுக்கியிருக்கும் அறைக்குள் விழுந்து விட்டது.,8
கந்தர்_அலங்காரச்_சொற்பொழிவுகள்-1,பந்து எடுக்க அறைக்குள் குழந்தை ஒடியது.,5
கந்தர்_அலங்காரச்_சொற்பொழிவுகள்-1,அந்தச் சமயம் குழந்தை வீரிட்டு அழுதான்.,5
கந்தர்_அலங்காரச்_சொற்பொழிவுகள்-1,தாய் பதறிப் போய் விறகு அறைக்கு ஒடினாள்.,6
கந்தர்_அலங்காரச்_சொற்பொழிவுகள்-1,கரி மூட்டையின் மேல் விழுந்த பந்தை எடுக்கக் குழந்தை மூட்டையின்மேல் ஏறியிருக்கிறான்.,9
கந்தர்_அலங்காரச்_சொற்பொழிவுகள்-1,மூட்டை சரிந்து அவன்மேல் விழுந்து விட்டது.,5
கந்தர்_அலங்காரச்_சொற்பொழிவுகள்-1,கரி மூட்டைக்கு அடியில் அகப்பட்டு அழுகின்ற குழந்தையைத் தாய் அலறிப் போய் எடுக்கிறாள்.,10
கந்தர்_அலங்காரச்_சொற்பொழிவுகள்-1,நீராடியாகி விட்டதே கரி மூட்டையைத் தூக்கினால் கரி நம் உடம்பெல்லாம் படுமே என்று அவள் அப்போது நினைப்பாளா?,13
கந்தர்_அலங்காரச்_சொற்பொழிவுகள்-1,நாம் பட்டுப் புடவை உடுத்துக் கொண்டிருக்கிறோமே !,5
கந்தர்_அலங்காரச்_சொற்பொழிவுகள்-1,கரி மூட்டையைத் தூக்கினால் நம் புடைவை கரியாகிவிடுமே என்று நினைப்பாளா?,8
கந்தர்_அலங்காரச்_சொற்பொழிவுகள்-1,இறைவியின் அருள் ஐந்து பூதங்களின் சம்பந்தம் உண்டாகிவிட்டது போதுமா?,7
கந்தர்_அலங்காரச்_சொற்பொழிவுகள்-1,பராசக்தியிலிருந்து சிவபெருமான் தனித்து நின்றபோது அவன் கண்களிலிருந்து முருகன் வெளிப்பட்டதனால் முருகனுக்கு பூரணத்துவம் ஏற்படவில்லை.,11
கந்தர்_அலங்காரச்_சொற்பொழிவுகள்-1,இறைவியின் அருள் சேராவிட்டால் ஒன்றும் நடவாது.,5
கந்தர்_அலங்காரச்_சொற்பொழிவுகள்-1,உலகத்தில் காதலர் இருவர் கருத்தொருமித்து இருப்பதுவே இன்பம்.,6
கந்தர்_அலங்காரச்_சொற்பொழிவுகள்-1,பரமேசுவரனே படைத்தாலும் அது வெறும் ஞானமயமாகத்தான் இருக்கும்.,6
கந்தர்_அலங்காரச்_சொற்பொழிவுகள்-1,"அது செயல் புரிய வேண்டுமென்றால், பராசக்தியின் அருள் வேண்டும்.",7
கந்தர்_அலங்காரச்_சொற்பொழிவுகள்-1,வெறும் பொன்னாக இருப்பதனால் பயன் இல்லை.,5
கந்தர்_அலங்காரச்_சொற்பொழிவுகள்-1,அது பயன்பட வேண்டுமென்றால் ஆபரணமாக வேண்டும் அல்லது நாணயமாக அடிக்க வேண்டும்.,9
கந்தர்_அலங்காரச்_சொற்பொழிவுகள்-1,வெறும் ஈயத்தைப் பாத்திரத்தில் பூச முடியாது.,5
கந்தர்_அலங்காரச்_சொற்பொழிவுகள்-1,ஈயம் பூச வேண்டுமென்றால் சிறிது நவாசாரம் சேர்க்க வேண்டும்.,7
கந்தர்_அலங்காரச்_சொற்பொழிவுகள்-1,அன்னை வரவில்லையே என்று முருகப் பெருமான் சரவணப் பொய்கையில் காத்துக் கொண்டிருந்தான்.,9
கந்தர்_அலங்காரச்_சொற்பொழிவுகள்-1,ஆறு குழந்தையாக இருந்து விளையாடினான்.,4
கந்தர்_அலங்காரச்_சொற்பொழிவுகள்-1,பிரிந்த பொருள் எதுவும் உலகத்தைக் காக்காது.,5
கந்தர்_அலங்காரச்_சொற்பொழிவுகள்-1,"ஒன்றுபடுவது, கூடுவது, இன்பத்தைத் தரும்.",4
கந்தர்_அலங்காரச்_சொற்பொழிவுகள்-1,எந்த இன்பமானாலும் பிரிந்திருந்தால் இன்பம் இல்லை.,5
கந்தர்_அலங்காரச்_சொற்பொழிவுகள்-1,முருகன் ஆறு குழந்தையாகப் பிரிந்திருக்கிற வரைக்கும் உலகத்துக்குப் பயன்படவில்லை.,7
கந்தர்_அலங்காரச்_சொற்பொழிவுகள்-1,"எம்பெருமாட்டி வந்து அணைத்தபோதுதான் ஆறுமுகமும், பன்னிரு திருக்கரங்களும் உடைய ஒரு குழந்தை ஆனான்.",10
கந்தர்_அலங்காரச்_சொற்பொழிவுகள்-1,அப்பொழுது உலகத்திற்குப் பயன்படுகிற நிலை வந்தது.,5
கந்தர்_அலங்காரச்_சொற்பொழிவுகள்-1,எம்பெருமாட்டி ஷண்முகநாதனுக்குப் பால் கொடுத்தாள்.,4
கந்தர்_அலங்காரச்_சொற்பொழிவுகள்-1,திருந்தப் புவனங்கள் ஈன்ற பொற் பாவை திருமுலைப் பால் அருந்தினான் கந்தன்.,9
கந்தர்_அலங்காரச்_சொற்பொழிவுகள்-1,எம்பெருமாட்டியின் தனங்களிலே வாய் வைத்துப் பால் அருந்தவில்லை.,6
கந்தர்_அலங்காரச்_சொற்பொழிவுகள்-1,ஞானசம்பந்தப் பெருமானுக்கு உமாதேவி தன் திருமுலைப் பாலைப் பொற் கிண்ணத்தில் கறந்து அதில் சிவஞானத்தைக் குழைத்து அருந்தினாள்.,13
கந்தர்_அலங்காரச்_சொற்பொழிவுகள்-1,எம்பெருமாட்டி உலகிலுள்ள மற்ற தாய்மார்களைப் போலக் கருவிருந்து குழந்தையைப் பெறுபவள் அல்ல.,9
கந்தர்_அலங்காரச்_சொற்பொழிவுகள்-1,"தன்னுடைய கருணாகடாட்சத்தால் உலக முழுவதையும் ஈன்றும், அவள் இன்னும் கன்னியாகவே இருக்கிறாள்.",9
கந்தர்_அலங்காரச்_சொற்பொழிவுகள்-1,இது உலக இயலுக்கு விரோதமாகத் தோன்றும்.,5
கந்தர்_அலங்காரச்_சொற்பொழிவுகள்-1,"எம்பெருமாட்டியின் தனம் குழந்தை வாய் வைத்துப் பால் குடிப்பதற்கோ, போகத்திற்கோ உரியது அன்று.",10
கந்தர்_அலங்காரச்_சொற்பொழிவுகள்-1,ஆதலால்தான் எம்பெருமாட்டி தந்த பால் ஞானப்பாலாயிற்று.,5
கந்தர்_அலங்காரச்_சொற்பொழிவுகள்-1,அதையே ஞானசம்பந்தர் உண்டார்.,3
கந்தர்_அலங்காரச்_சொற்பொழிவுகள்-1,"பரமேசுவரனிடம் தோன்றிய முருகன் உலகத்தில் அவதாரம் செய்தமையால் ஐம்பூதங்களின் முத்திரையைப் பெற்று, ஞான மயமாக வந்தான்.",12
கந்தர்_அலங்காரச்_சொற்பொழிவுகள்-1,அவன் ஞானப் பிழம்பு.,3
கந்தர்_அலங்காரச்_சொற்பொழிவுகள்-1,நீயான ஞான விநோதந் தனையென்று நீயருள்வாய் என்று அருணகிரியார் பின்னாலே சொல்லப் போகிறார்.,10
கந்தர்_அலங்காரச்_சொற்பொழிவுகள்-1,ஞானம் வேறு அவன் வேறு அல்ல.,5
கந்தர்_அலங்காரச்_சொற்பொழிவுகள்-1,மூன்று தாமரைத் தொட்டில் அந்தக் குழந்தை எங்கே விளையாடினான்?,7
கந்தர்_அலங்காரச்_சொற்பொழிவுகள்-1,அந்தக் குழந்தைக்கு யார் தொட்டில் பண்ணிக் கொடுக்க முடியும்?,7
கந்தர்_அலங்காரச்_சொற்பொழிவுகள்-1,தாமரை இதழ்களின் மீது படுத்துக் கொண்டு தூங்கினான்.,6
கந்தர்_அலங்காரச்_சொற்பொழிவுகள்-1,தண்மை மலிந்த மலர்ப் படுக்கையில் கண் வளர்ந்தான்.,6
கந்தர்_அலங்காரச்_சொற்பொழிவுகள்-1,"மெத்தென்ற படுக்கையாக, மென்மை மிக்க மணமுள்ள தாமரை மலர்கள் அமைந்தன.",8
கந்தர்_அலங்காரச்_சொற்பொழிவுகள்-1,அதில் அவன் விளையாடினான் படுத்து உறங்கினான்.,5
கந்தர்_அலங்காரச்_சொற்பொழிவுகள்-1,சரவணப் பூந்தொட்டில் ஏறி என்று அருணகிரிநாதர் சொல்வது புதிதன்று.,7
கந்தர்_அலங்காரச்_சொற்பொழிவுகள்-1,இந்தக் கருத்துப் பழங்காலம் முதற் கொண்டே வழங்கி வருகிறது என்பதைப் பழம் பாடல்களால் உணரலாம்.,11
கந்தர்_அலங்காரச்_சொற்பொழிவுகள்-1,அவர் இயற்றிய சிலப்பதிகாரத்தில் இந்தச் செய்தியைச் சொல்கிறார்.,6
கந்தர்_அலங்காரச்_சொற்பொழிவுகள்-1,சேர நாட்டு மலைவாழ் மக்கள் முருகனுக்குப் பூசை போடுகிறார்களாம்.,7
கந்தர்_அலங்காரச்_சொற்பொழிவுகள்-1,குரவைக் கூத்து ஆடுகிறார்கள்.,3
கந்தர்_அலங்காரச்_சொற்பொழிவுகள்-1,அப்போது குரவைக்குரிய பாடலைப் பாடுகிறார்கள்.,4
கந்தர்_அலங்காரச்_சொற்பொழிவுகள்-1,குன்றக் குரவை என்ற பகுதியில் அந்தப் பாடல் இருக்கிறது.,7
கந்தர்_அலங்காரச்_சொற்பொழிவுகள்-1,சரவணப்பூம் பள்ளியறைத் தாய்மார் அறுவர் திருமுலைப்பால் உண்டான் என்பது பாட்டின் ஒரு பகுதி.,10
கந்தர்_அலங்காரச்_சொற்பொழிவுகள்-1,சரவணப் பொய்கையில் பூம்பள்ளியில் முருகன் அறுவர் பாலை உண்டு தங்கினானென்று கூறுகிறது இது.,10
கந்தர்_அலங்காரச்_சொற்பொழிவுகள்-1,பயந்தோர் என்ப பதுமத்துப் பாயல் என்று சங்ககாலத்துப் பரிபாடலில் முருகன் புகழ் வருகிறது.,10
கந்தர்_அலங்காரச்_சொற்பொழிவுகள்-1,பதுமத்துப் பாயல் தாமரைப் பூவாகிய படுக்கை.,5
கந்தர்_அலங்காரச்_சொற்பொழிவுகள்-1,அருணகிரி நாதர் தொட்டில் என்கிறார்.,4
கந்தர்_அலங்காரச்_சொற்பொழிவுகள்-1,அந்தப் புலவர் பாயல் என்றார்.,4
கந்தர்_அலங்காரச்_சொற்பொழிவுகள்-1,பழங்காலம் முதற்கொண்டே இத்தகைய புராண வரலாறுகள் வழங்கி வந்திருக்கின்றன என்பதற்கு இவை அடையாளம்.,10
கந்தர்_அலங்காரச்_சொற்பொழிவுகள்-1,அருணகிரிநாதர் எதையும் கற்பனையாகச் சொன்னதாகக் கருத வேண்டாம்.,6
கந்தர்_அலங்காரச்_சொற்பொழிவுகள்-1,அவர் காலத்திற்கு முன்பே தொன்றுதொட்டு இந்த நாட்டில் முருகனைப் பற்றி வழங்கி வந்த செய்திகளையே அவர் அலங்காரமாகச் சொல்கிறார்.,14
கந்தர்_அலங்காரச்_சொற்பொழிவுகள்-1,சரவணப் பூந்தொட்டிலேறி அறுவர் கொங்கை விரும்பி முருகன் அழுதான்.,7
கந்தர்_அலங்காரச்_சொற்பொழிவுகள்-1,பசி எடுத்தவனைப் போல அழுதான்.,4
கந்தர்_அலங்காரச்_சொற்பொழிவுகள்-1,நமக்கு உண்டாகும் பசிபோன்றது அல்ல அது.,5
கந்தர்_அலங்காரச்_சொற்பொழிவுகள்-1,கருணைப் பசி எடுத்த குழந்தை உலகியலை ஒட்டிப் பாலுக்காக அழும் குழந்தையைப் போல விம்மி விம்மி அழுதான்.,13
கந்தர்_அலங்காரச்_சொற்பொழிவுகள்-1,கார்த்திகை மாதர் கார்த்திகை மாதர்கள் ஆறு பேர்.,6
கந்தர்_அலங்காரச்_சொற்பொழிவுகள்-1,சப்த ரிஷிகள் என்று சொல்லும் ஏழு முனிவர்களுடைய மனைவிமார்களும் வானில் ஏழு நட்சத்திரங்களாக இருக்கிறார்கள்.,11
கந்தர்_அலங்காரச்_சொற்பொழிவுகள்-1,அவர்களில் மிகவும் சிறப்பானவள் அருந்ததி.,4
கந்தர்_அலங்காரச்_சொற்பொழிவுகள்-1,அவள் தன் கணவராகிய வசிஷ்டருக்கு அருகிலேயே வானில் ஒளிர்கிறாள்.,7
கந்தர்_அலங்காரச்_சொற்பொழிவுகள்-1,மற்ற ஆறு முனிவர்களுடைய மனைவிமாரும் கிருத்திகா நட்சத்திரங்களாக வானிலே இருப்பதைப் பார்க்கலாம்.,9
கந்தர்_அலங்காரச்_சொற்பொழிவுகள்-1,இந்த ஆறு மாதர்களும் சரவணப் பொய்கையில் இருந்த முருகனுக்கு வளர்ப்புத் தாய்களாக அமைந்தார்கள்.,10
கந்தர்_அலங்காரச்_சொற்பொழிவுகள்-1,இந்தக் குழந்தைக்கு அவர்கள் பால் கொடுத்து வளர்த்தார்கள்.,6
கந்தர்_அலங்காரச்_சொற்பொழிவுகள்-1,சரவணப் பொய்கையில் தாமரையாகிய தொட்டிலில் விளையாடிக் கொண்டிருந்த முருகனுக்கு முதலில் கார்த்திகை மாதர்களே பால் கொடுத்து வளர்த்தார்கள்.,13
கந்தர்_அலங்காரச்_சொற்பொழிவுகள்-1,இது தோத்திர நூல் ஆனதால் முன் பின்னாகச் சொல்கிறார்.,7
கந்தர்_அலங்காரச்_சொற்பொழிவுகள்-1,கதையைச் சொல்வதானால் முறை பிறழாமல் சொல்வார்.,5
கந்தர்_அலங்காரச்_சொற்பொழிவுகள்-1,அலங்காரமாக அமைக்கும் கவியில் இந்த முறை முன்பின்னாக மாறுவதில் தவறு இல்லை.,9
கந்தர்_அலங்காரச்_சொற்பொழிவுகள்-1,கங்கை தன்னிடம் விட்ட ஆறு பொறிகளையும் எடுத்துப் போய்ச் சரவணப் பொய்கையில் விட்டாள்.,10
கந்தர்_அலங்காரச்_சொற்பொழிவுகள்-1,அவை ஆறு குழந்தைகளாக உருப்பெற்றன.,4
கந்தர்_அலங்காரச்_சொற்பொழிவுகள்-1,அழுத பிள்ளை பால் குடிக்கும் என்பது எல்லாக் குழந்தைகளுக்கும் பொருத்த மல்லவா?,9
