work_title,sentence,sentence_length
கல்வி_எனும்_கண்,சிலர் உழைப்பின் பயனால் சிறிதளவு முன்னேறுகிறார்கள் என்றாலும் பலர் எங்கோ சென்று கொண்டிருக்கின்றனர்.,10
கல்வி_எனும்_கண்,எனவே தமிழ்க் கல்வியோ பிற பாடங்களோ அன்றி ஆங்கிலக் கல்வியும்.,8
கல்வி_எனும்_கண்,இத்தன்ை ஆரவாரங்களுக்கிடையில் நன்கு வளரவில்லை.,4
கல்வி_எனும்_கண்,க. ⁠மன்னிக்கவும் எங்கோ சென்றுவிட்டேன்.,4
கல்வி_எனும்_கண்,பின் மூன்றாவது வகுப்பு வந்தபோது பள்ளிக்கூடம் வந்தது.,6
கல்வி_எனும்_கண்,"அதுவும் காந்தி அடிகள் கூறியது போன்று, எளிய ஒலைவேய்ந்த கூரைக் கட்டடம் மண்சுவர் மரச்சன்னல்தான்.",11
கல்வி_எனும்_கண்,"எனினும் அன்று ஆசிரியர்கள் நன்கு பிள்ளைகளுக்குக் கல்வி மட்டுமின்றி, கலை, சமூகவியல் போன்றவற்றையும் கற்றுத்தந்தனர்.",11
கல்வி_எனும்_கண்,எனவே ஊர்தொறும் பள்ளி அமைப்பதில் அதிலும் குறைந்த செலவில் அமைப்பதில் அதிக கடினம் இல்லை.,11
கல்வி_எனும்_கண்,பழங்காலத்தில் இதைத் திண்ணைப் பள்ளிக்கூடம் என்பார்கள்.,5
கல்வி_எனும்_கண்,அப்பள்ளிகளில் அவ்வூர்ப் பிள்ளைகள் அனைவருமே ஐந்தாம் வகுப்பு வரையில் நன்கு படிப்பார்கள்.,9
கல்வி_எனும்_கண்,"பின் சிலர் மேல் வகுப்பில் சேரப் பேரூர்களுக்கும் நகரங்களுக்கும் செல்ல, சிலர், ஊரில் பெற்றோருடன் தொழில் செய்வர்.",13
கல்வி_எனும்_கண்,எப்படியும் ஐந்தாம் வகுப்பு வரை அனைவரும் பெரும்பாலும் நூறு க்கு எண்பது பேரவது படித்திருப்பர்.,11
கல்வி_எனும்_கண்,அடிப்படையில் நெடுங்காலத்துக்கு முன் சென்றாலும் சங்க காலத்திலோ பல்லவர் காலத்திலோ இத்தகைய ஊர் ஒற்றுமையினைக் காணமுடிகிறது.,12
கல்வி_எனும்_கண்,"பின்னால் யார் யாரோ இங்கே வர, பிற்காலச் சோழர்காலத்துச் சாதிப் பிரிவுகள் சமயப் பேர்ராட்டங்கள் பல தோன்றின.",13
கல்வி_எனும்_கண்,இன்றோ பாரதிதாசன் கூறியப்படி வாழ்கின்றார் முப்பத்து முக்கோடி மக்கள் என்றால் சூழ்கின்ற பேதம் அந்தத் தொகை இருக்கும்.,13
கல்வி_எனும்_கண்,இந்த அவல நிலையை இன்றைய அரசாங்கம் எப்படியும் போக்கித்தான் ஆகவேண்டும்.,8
கல்வி_எனும்_கண்,பல நாடுகளைச் சுற்றிவந்த நான் இந்தக் கல்வி முறையினைப் போற்றும் அமெரிக்க நாட்டினைக் கண்டு வியந்தேன்.,12
கல்வி_எனும்_கண்,"தெரு அமைப்பு, சுற்றுப்புறத் தூய்மை, கல்வி, நலத்துறை ஆகியவற்றை அவர்களே ஒரு குழு அமைத்து நன்கு பாராமரித்துக் கொள்ளுகின்றனர்.",14
கல்வி_எனும்_கண்,அந்தந்த எல்லையில் அமைந்த வீட்டுவரி முதலிய விஷயங்களையும் அவர்களே வசூலித்துக் கொள்ளுகின்றனர்.,9
கல்வி_எனும்_கண்,இந்த முறையினால் அங்கங்கே கல்வி நிலையங்கள் தக்க வகையில் செயல்படுகின்றன.,8
கல்வி_எனும்_கண்,இதுபற்றி என்னுடைய நூலில் குறித்துள்ளேன்.,4
கல்வி_எனும்_கண்,"இந்த நிலை, தமிழ்நாட்டில் இருந்த பழைய வட்ட, மாவட்டக் கழகங்களை எனக்கு நினைவூட்டின.",10
கல்வி_எனும்_கண்,பின் பஞ்சாயத்து ஆட்சி என்ற பெயரில் பல மாற்றங்கள்.உண்டானபோதிலும் போதிய வளர்ச்சி இல்ல்ை.,11
கல்வி_எனும்_கண்,இதுபற்றி முன்னரே விளக்கியுள்ளேனாதலின் இங்கே அதிகம் எழுதத்தேவை இல்லை.,7
கல்வி_எனும்_கண்,⁠இனி ஆரம்பப் பள்ளிகளில் அமையும் பாடங்களைப் பற்றிச் சிறிது காண்போம்.,8
கல்வி_எனும்_கண்,தற்போது மெட்ரிகுலேஷன் போன்ற பள்ளிகளில் பயிலும் மாணவர்களுக்கு மிக அதிக மன சுமைகள் ஏற்றப்பெறுகின்றன.,11
கல்வி_எனும்_கண்,அரசாங்கப் பள்ளிகளிலும் பாடத்திட்டம் தேவையான அளவுக்கு அதிகமாகவே உள்ளது.,7
கல்வி_எனும்_கண்,நான் இதுபற்றி முன்னரும் குறிப்பிட்டுள்ளேன்.,4
கல்வி_எனும்_கண்,ஆத்திசூடி போன்ற சிறு சிறு.,4
கல்வி_எனும்_கண்,தொடர்களாலான அறநெறி பற்றிய வாக்கியங்கள் பயிற்றப்பெறல் வேண்டும்.,6
கல்வி_எனும்_கண்,விளையாட்டு வகையிலே பலவற்றைச் சொல்லித்தரலாம்.,4
கல்வி_எனும்_கண்,ஆசிரியர் என்ற அச்சம் எழாத வகையில் அவ்ர்கள் நடந்துகொள்ளவேண்டும்.,7
கல்வி_எனும்_கண்,வீட்டில் இருப்பதைக் காட்டிலும் பள்ளியில் இருப்பதே மகிழ்ச்சிக்குரியதென அந்த இளம் பிஞ்சு உள்ளங்கள் நினைக்கவேண்டும்.,11
கல்வி_எனும்_கண்,"பள்ளிக்கூடம் ஏதோ சட்டதிட்டம், அடி உதை என்ற எண்ணத்தை அவர்களிடம் உண்டாக்கக்கூடாது.",9
கல்வி_எனும்_கண்,பல ஆண்டுகளுக்கு முன் நடந்த ஒரு நிகழ்ச்சி எனக்கு நினைவுக்கு வருகிறது.,9
கல்வி_எனும்_கண்,சிறிது நேரம் பேசிக் கொண்டிருந்தபோது நான் அங்குள்ள கல்லூரியில் ஆசிரியராகப் பணியாற்றுவதைச் சொன்னேன்.,10
கல்வி_எனும்_கண்,அக் குழந்தையுடனும் சிரித்துப் பேசினேன்.,4
கல்வி_எனும்_கண்,அன்னையார் என்னவென்று கேட்டார்கள்.,3
கல்வி_எனும்_கண்,"அந்தக் குழந்தை வாத்தியார் சிரிப்பாரோ, நீ பொய் சொல்லுகிறாய் என்று பதில் சொல்லிற்று.",10
கல்வி_எனும்_கண்,நான் உண்மையில் வருந்தினேன்.,3
கல்வி_எனும்_கண்,எனவே ஆசிரியர்கள் சிறப்பாக ஆரம்பப்பள்ளி ஆசிரியர்கள் அன்பு கலந்த தயுளத்தோடு இன்முகத்தோடு குழந்தைகளுக்குப் பாடம் கற்பி கவேண்டும்.,13
கல்வி_எனும்_கண்,இன்று சென்னையில் பல தனியார் பள்ளிகளில் ஐந்தாம் வகுப்பு வகையில் பெண்களே ஆசிரியராக உள்ளனர்.,11
கல்வி_எனும்_கண்,தமிழக அரசும் இனி ஆரம்பப்பள்ளிகளில் பெண்களையே ஆசிரியர்களாக நியமிக்கப் போவதாகக் கூறியது ஆறுதல் அளிக்கின்றது.,11
கல்வி_எனும்_கண்,பெண்கள் தாயுள்ளம் கொண்டவர்களாதலின் அவர்தம் பண்பும் பழக்கமும் குழந்தைகளுக்கு ஆதரவாக அமையும் என்ற அடிப்படையிலே இத்தகைய ஏற்பாடுகள் செய்யப்பெறுகின்றன.,14
கல்வி_எனும்_கண்,வகுப்பு முடிய முறையான பாடத்திட்டங்கள் அமையலாம்.,5
கல்வி_எனும்_கண்,"வரலாறு, நிலநூல், கணக்கு, அறிவியல் துளிகள், நல்வாழ்வு, மொழிகள் இரண்டு எனப் பகுத்து அவற்றிற்கெனப் பாடநூல்கள் அமைக்கலாம்.",13
கல்வி_எனும்_கண்,முதல் இரண்டு வகுப்புகளுக்கும் நான் மேலே காட்டியபடி பாடல்நூல்கள் ஆரம்பத்தில் தடையில்லை.,9
கல்வி_எனும்_கண்,"அப்படியே வரலாற்றில் சிலவற்றை இராசராசன், சிவாஜி, காந்திஅடிக்ள் போன்றவர் வரலாறு முதலியன, சிறுசிறு கதைகளாக.",11
கல்வி_எனும்_கண்,பிள்ளைகள் விரும்பும் வகையில் இடம்பெறச் செய்யலாம்.,5
கல்வி_எனும்_கண்,மற்றைய கணக்கு இரு மொழிகள் ஆகியவற்றிற்கு வகுப்புக்கு ஏற்ற பாடங்கள் அமைந்த நூல்கள் அச்சிடலாம்.,11
கல்வி_எனும்_கண்,கணக்கு முறை படிப்படியாக வகுப்புக்கு ஏற்ப வளர்ச்சி பெறும்வகையில் பாடத்திட்டம் அமையலாம்.,9
கல்வி_எனும்_கண்,நான் முன்னமே குறித்தபடி பள்ளிக்கூடத் திட்டங்களைப்பற்றிச் சிந்திக்க வேண்டும்.,7
கல்வி_எனும்_கண்,திண்ணைப் பள்ளிக் கூடங்கள் இன்று நடத்த முடியாது.,6
கல்வி_எனும்_கண்,முன்பு தமிழ் நாட்டில் இந்த வகையில் எத்தனையோ ஊர்களில் சாலைகள் அமைத்தனர்.,9
கல்வி_எனும்_கண்,ஏரிகளைத் துப்புறவு செய்தனர்.,3
கல்வி_எனும்_கண்,இளைஞருக்கு மட்டுமன்றி வயது வந்தோருக்கும் கல்வி கற்பிக்கும் இயக்கம் நாட்டில் வலுப்பெற்று வருகின்றது.,10
கல்வி_எனும்_கண்,"சமூகசேவை செய்வதாகக் கூறிக்கொண்டு, பட்டுடுத்து, படம் எடுத்துக் கொண்டு தம் சமூக சேவையைக் காட்டுவோரும் உண்டு.",12
கல்வி_எனும்_கண்,"எல்லாவற்றிற்கும் கையூட்டு இல்லாத திட்டமான மேற்பார்வை முறை அமையின் கல்விமட்டுமன்றி, நாட்டில் எல்லாத்துறைகளும் நன்கு அமையும்.",12
கல்வி_எனும்_கண்,அந்த ஆக்கநெறிக்கு இன்று நாடாளும் நல்லவர்க்ள் வழிவகுத்து முயலவேண்டும் எனக்கேட்டுக் கொள்ளுகிறேன்.,9
கல்வி_எனும்_கண்,இருபது இந்தியாவும் ஒரு காமன்வெல்த் நாடுதானே !,5
கல்வி_எனும்_கண்,பள்ளியில் சேரும் மாணவர் எண்ணிக்கை வளர்ந்துவிட்டது என்றாலும் கடந்த இருபத்தைந்து ஆண்டுகளில் தரம் மிகத் தாழ்ந்துள்ளதைக் குறித்துள்ளனர்.,13
கல்வி_எனும்_கண்,இது பிற மேல் படிப்புகளையும் பாதித்துள்ளதையும் சுட்டிக்காட்ட அவர்கள் தவறவில்லை.,8
கல்வி_எனும்_கண்,"மக்கள் தொகைப் பெருக்கத்தினால் பள்ளிகள் வளர்ச்சி அடைய, அதை நிறைவேற்ற நிதி இல்லாநிலை உடைய நாடுகளும் எண்ணப்பெறுகின்றன.",13
கல்வி_எனும்_கண்,உலகவங்கி உதவ வந்த நிலையிலும் சில நாடுகள் ஏற்காது.,7
கல்வி_எனும்_கண்,நம் பாரதமும் இதை எண்ண வேண்டும்.,5
கல்வி_எனும்_கண்,ஆரம்பக்கல்வி திருந்தினால்தான் பிற அனைத்து மட்டத்து உயர்கல்விகளும் உயர்ச்சியுறும்.,7
கல்வி_எனும்_கண்,இந்த நிலை இன்றேல் என்னாகும் என்பதையும் எண்ணிப் பார்க்கவேண்டும்.,7
கல்வி_எனும்_கண்,ஆளும் நல்ல அமைச்சர்கள் ஆழ்ந்து எண்ணி ஆவன காண்பார்களாக.,7
கல்வி_எனும்_கண்,இந்தத் தலைப்பு அச்சாகிக் கொண்டிருக்கையில் தினமணியில் பதினேழு  பதினொன்று  தொன்னூற்றொன்று பக்.,9
கல்வி_எனும்_கண்,நான்கு திரு த.,3
கல்வி_எனும்_கண்,பரசுராமன் என்பவர் எழுதிய தொடக்கப்பள்ளிகளில் தடுமாறும் தமிழ் என்ற கட்டுரை வெளிவந்ததைக் கண்டேன்.,10
கல்வி_எனும்_கண்,அதில் அவர்கள் தமிழ்நாட்டில் தமிழ்மொழி போற்றப்பெறாத அவல நிலையினை நன்கு விளக்கியுள்ளனர்.,9
கல்வி_எனும்_கண்,"தொடக்க நிலையில் மொழிக்கே முக்கியத்துவம் தரவேண்டும் எனச் சுட்டி, மொழிப்பாடம் ஆரம்பப் பள்ளிகளில் பெற்றுள்ள இழிநிலையினைச் சுட்டிக்காட்டியுள்ளார்.",13
கல்வி_எனும்_கண்,இனியாகிலும் தமிழ்நாட்டில் விழிப்புணர்ச்சி அரும்புமா?,4
கல்வி_எனும்_கண்,தமிழக அரசு தக்கன செய்யுமா?,4
கல்வி_எனும்_கண்,﻿மழலையர் கல்வி இளங்குழந்தைகள் கல்வியும் போற்றப்பட வேண்டிய ஒன்று.,7
கல்வி_எனும்_கண்,ஐந்து வயதில் முதல்வகுப்பில் சேர்வதற்கு முன் ஓரிரு வகுப்புகளைத் தற்போது பலர் தெருவுதோறும் நடத்தி வருகின்றனர்.,12
கல்வி_எனும்_கண்,மூன்று வயதுக்கு முன்பும் பணியிடை உழலும் மகளிர் தங்கள் குழந்தைகளைக் காப்பகங்களில் விட்டுச் செல்லுகின்றனர்.,11
கல்வி_எனும்_கண்,"இந்த இளங்குழந்தைகளுக்குப் படிப்புடன், தேவையான ஊட்டச்சத்துடன் கூடிய உணவும் தேவைப்படுகிறது.",8
கல்வி_எனும்_கண்,பள்ளிகளில் சத்துணவுக் கூடங்கள் அமைத்து அரசாங்கம் உதவி புரிவதைப் போன்று.,8
கல்வி_எனும்_கண்,இந்த மழலைகள் பள்ளிகளையும் நன்கு பராமரிக்க வேண்டும்.,6
கல்வி_எனும்_கண்,இளம் மழலைகளைப் பாதுகாக்கும் இல்லங்கள் அவ்வளவாகப் பயிற்று நிலையங்களாக அமைவதில்லை.,8
கல்வி_எனும்_கண்,பெரும்பாலும் பணிமேற்செல்லும் தாயர் பிள்ளைகளைப் பாதுகாப்பாக விட்டுச் செல்லும் இடங்களாகவே அவை உள்ளன.,10
கல்வி_எனும்_கண்,எங்கோ ஓரிரு இடங்களில் பாட்டுகள் கற்றுத் தருவதாகக் கூறுகின்றனர்.,7
கல்வி_எனும்_கண்,சிறுசிறு அடிகளில் அமைந்த பாடல்களை மூன்று வயது நிரம்பாத மழலைகள் வாய்மொழியாகக் கேட்க இனிமையாக இருக்குமல்லவா !,12
கல்வி_எனும்_கண்,ஆனால் இன்று அப்பாடல்கள் எல்லாம் ஆங்கிலப் பாடல்களாகவே உள்ள்ன.,7
கல்வி_எனும்_கண்,அப்பிஞ்சு உள்ளங்களில் தாய்மொழி உணர்வும் பற்றும் அற்றுப்போக இந்த முறை வழிசெய்கின்றது.,9
கல்வி_எனும்_கண்,ஒருசில தவிர்த்துப் பெருபாலானவை வெறும் பால் உண்பிக்கும் தூங்கவைக்கும் நிலையங்களாகவே உள்ளன.,9
கல்வி_எனும்_கண்,அமெரிக்காவிலோ இங்கிலாந்திலோ ஆங்கில மொழி உணர்வு மழலை உள்ளங்களில் நிழலிடுகின்றன.,8
கல்வி_எனும்_கண்,பிரான்சில் பிரஞ்சு மொழி பிள்ளை உள்ளங்களைக் கொள்ளை கொள்ளுகின்றது.,7
கல்வி_எனும்_கண்,ஏன் நம் வடநாட்டிலும் அவரவர் தாய்மொழியே வாய்மொழியாக இளம் பிள்ளைகள் பயில வழி செய்கின்றனர்.,11
கல்வி_எனும்_கண்,ஆனால் தமிழ் நாட்டில்தான் ஆங்கில மோகம் தலைவிரித்தாடுகிறது.,6
கல்வி_எனும்_கண்,அரசு அன்றி வேறு யாரே இதைத் தடுத்து நிறுத்த வல்லார் !,8
கல்வி_எனும்_கண்,மூன்று வயது முடிந்ததும் முறையான வகையில் தொடக்க வகுப்பில்,7
கல்வி_எனும்_கண்,பிள்ளைகள் சேர்க்கப் பெறுகின்றனர்.,3
கல்வி_எனும்_கண்,பெரும்பாலான பிள்ளைகள் வழிவகை இன்றி வாடுகின்ற்னர்.,5
கல்வி_எனும்_கண்,"அப்படியே முதற் வகுப்பில் சேர்ந்தாலும் இடையில் இரண்டு, மூன்று, நான்கு, ஐந்து இல் வருகின்ற பிள்ளைகள் எத்துணையர்?",13
கல்வி_எனும்_கண்,கிராமங்கள்தோறும் நகரில் குடிசைப் பகுதிகள் தோறும் இந்த அவலநிலையில் உள்ள குழந்தைகளைக் காணமுடிகின்றதே !,10
கல்வி_எனும்_கண்,அதற்கு ஒரு வழிவகை காண வேண்டாமா !,5
