work_title,sentence,sentence_length
கலீலியோவின்_நம்மை_மேம்படுத்தும்_எண்ணங்கள்,ஆவர். இசைத் துறையில் வல்லவர் !,4
கலீலியோவின்_நம்மை_மேம்படுத்தும்_எண்ணங்கள்,அதனால் தான் அவரால் இசையின் மெய்ப் பொருளைப் புற்றி விளக்கிச் சிறந்த ஒரு இசை நூலையும் எழுத முடிந்தது.,14
கலீலியோவின்_நம்மை_மேம்படுத்தும்_எண்ணங்கள்,தந்தை மகனுக்குச் செய்ய வேண்டிக உதவிகளுக்கு ஏற்றவாறு.,6
கலீலியோவின்_நம்மை_மேம்படுத்தும்_எண்ணங்கள்,"சிறப்பான கல்வியையும், தத்துவ போதனைகளையும் இளம் வயதிலேயே போதித்த தந்தையாக அவர் விளங்கினார் !",10
கலீலியோவின்_நம்மை_மேம்படுத்தும்_எண்ணங்கள்,"அதனால், பைசா நகரத்துப் பல்கலைக் கழகத்தில் ஓர் ஆயிரத்து ஐநூற்று எண்பத்தொன்று ம் ஆண்டில் கல்விக்காகச் சேர்த்தார் !",13
கலீலியோவின்_நம்மை_மேம்படுத்தும்_எண்ணங்கள்,"சிறுவராக இருந்த கலீலியோ, தனது கற்ற நேரம் போக, பிற ஓய்வு நேரங்கள் சுறுசுறுப்பாக இருப்பார் !",12
கலீலியோவின்_நம்மை_மேம்படுத்தும்_எண்ணங்கள்,"அவர், இவ்வாறு வழிபாடுகளைச் செய்து வந்த ஒரு நாளன்று இருண்ட நேரமாகி விட்டது.",10
கலீலியோவின்_நம்மை_மேம்படுத்தும்_எண்ணங்கள்,அப்போது ஒரு பணியாள் அந்த தேவாலயத்தின் கூரை மீது தொங்கவிடப்பட்டிருந்த ஒரு விளக்கை தீப ஒளிக்காக ஏற்றினார்.,13
கலீலியோவின்_நம்மை_மேம்படுத்தும்_எண்ணங்கள்,கலீலியோவுக்கு அந்த பணியாள் செய்த வேலை ஒரு வேடிக்கையாக இருந்தது.,8
கலீலியோவின்_நம்மை_மேம்படுத்தும்_எண்ணங்கள்,அதனால் அவர் அதே விளக்கைத் தனது கைகளாலேயே இழுத்து வேகமாக ஊசலாடவிட்டார்.,9
கலீலியோவின்_நம்மை_மேம்படுத்தும்_எண்ணங்கள்,அப்போது அந்த ஊசலிலே ஓர் ஆற்புதத்தைப் பார்த்து அதோடு அதில் மறைந்திருந்த ஓர் உண்மையினைக் கண்டுணர்ந்தார்.,12
கலீலியோவின்_நம்மை_மேம்படுத்தும்_எண்ணங்கள்,என்ன அந்த உண்மை?,3
கலீலியோவின்_நம்மை_மேம்படுத்தும்_எண்ணங்கள்,விளக்கு ஆரம்பத்தில் அதிக நேரம் ஆப்படியும் இப்படியுமாக அதிக நீளமாக ஊசலாடியது.,9
கலீலியோவின்_நம்மை_மேம்படுத்தும்_எண்ணங்கள்,"பிறகு, அதன் வேகம் குறையக குறைய ஊசலாட்டம் மெதுவாகக் குறைந்துவந்தது.",8
கலீலியோவின்_நம்மை_மேம்படுத்தும்_எண்ணங்கள்,ஊசல் குறைந்து வந்த காலத்தை உற்றுப்பார்த்தனர்.,5
கலீலியோவின்_நம்மை_மேம்படுத்தும்_எண்ணங்கள்,"ஏனென்றால், காலத்தைத் துல்லியமாக கணக்கிடத்தக்கக் கூடிய கடிகாரமோ, கருவியோ அன்றுவரை கண்டு பிடிக்கப்படாத காலமாகும்.",11
கலீலியோவின்_நம்மை_மேம்படுத்தும்_எண்ணங்கள்,"அதனால், கலீலியோ அந்தக் குறைந்து வந்த காலத்தை அவர் உற்று உற்றுப் பர்த்தார் !",10
கலீலியோவின்_நம்மை_மேம்படுத்தும்_எண்ணங்கள்,"அதாவது, அவர் தனது கைவிரலால் தம் நாடித் துடிப்பைக் கணக்கிட்டு, ஊசலின் குறைான ஆட்ட நேரத்தைக் கணக்கிட்டுப் பார்த்தார்.",14
கலீலியோவின்_நம்மை_மேம்படுத்தும்_எண்ணங்கள்,இவ்வாறு ஒரு முறையல்ல பலமுறை சோதனை செய்தார் !,6
கலீலியோவின்_நம்மை_மேம்படுத்தும்_எண்ணங்கள்,அவருக்கே அவரது அரிய செயல் ஒரு வியப்பாக அமைந்துவிட்டது.,7
கலீலியோவின்_நம்மை_மேம்படுத்தும்_எண்ணங்கள்,பத்தொன்பதே வயது பல்கலைக்கழகக் கல்விகற்கும் கல்வி வயதுதான் என்றால் வியப்படையாதவர் யார்?,9
கலீலியோவின்_நம்மை_மேம்படுத்தும்_எண்ணங்கள்,அந்த ஆராய்ச்சி என்ன தெரியுமா?,4
கலீலியோவின்_நம்மை_மேம்படுத்தும்_எண்ணங்கள்,தனது நாடித் துடிப்பைக் கொண்டு அல்லவா ஊசல் விளக்கின் கால அளவை ஆராய்ந்தார் !,10
கலீலியோவின்_நம்மை_மேம்படுத்தும்_எண்ணங்கள்,"இப்போது, எந்த தாடித்துடிப்பால் ஊசல் காலத்தை ஆராய்ந்தாரோ, அந்த நாடித்துடிப்பையே இப்போது ஆராய்ச்சி செய்ய முற்பட்டார்.",12
கலீலியோவின்_நம்மை_மேம்படுத்தும்_எண்ணங்கள்,இதல்லவா செயற்கரிய சாதனை !,3
கலீலியோவின்_நம்மை_மேம்படுத்தும்_எண்ணங்கள்,கலீலியோவின் தந்தையாருக்கு மகன் மருத்துவத்துறையிலே ஈடுபட்டு உலகம் போற்றும் மருத்துவ மேதையாக வேண்டும் என்ற ஆசை !,12
கலீலியோவின்_நம்மை_மேம்படுத்தும்_எண்ணங்கள்,"ஆனால், அவரது தந்தையார் மகனின் கணிதக் கல்வி படிப்புக்கு இடையூறாக இருந்தார்.",9
கலீலியோவின்_நம்மை_மேம்படுத்தும்_எண்ணங்கள்,"உடனே தனது நண்பரில் ஒருவர் அங்குப் பேராசிரியராகப் பணியாற்றுவதால், அந்தப் பைசா பல்கலைக் கழகத்துக்குச் சென்றார்.",12
கலீலியோவின்_நம்மை_மேம்படுத்தும்_எண்ணங்கள்,"ஆனால், கலீலியோவுக்கு கடுகளவும் மருத்துவத்துறை பிடிக்கவில்லை அதே வேளையில் தமது தந்தையின் ஆசையையும் தம்மால் புறக்கணிக்க முடியாதபடித் தத்தளித்தார் !",14
கலீலியோவின்_நம்மை_மேம்படுத்தும்_எண்ணங்கள்,இந்த நேரத்தில் கிரேக்கக் கணித மேதையாக கி.மு.,7
கலீலியோவின்_நம்மை_மேம்படுத்தும்_எண்ணங்கள்,அந்த கட்டுரையைப் படித்துப் பார்த்த மற்றக் கணித வல்லுநர்கள்.,7
கலீலியோவின்_நம்மை_மேம்படுத்தும்_எண்ணங்கள்,"அவருக்கு அத்துறையில் இருந்த புலமையைக் கண்டு ஆச்சரியப்பட்டு, அவருக்குள்ள கணித ஆர்வத்தையும், அறிவு நுட்பத்தையும் பாராட்டி வெகுவாகப் புகழ்ந்தார்கள்.",14
கலீலியோவின்_நம்மை_மேம்படுத்தும்_எண்ணங்கள்,அப்போது அவருக்கு வயது இருபத்தைந்தே.,4
கலீலியோவின்_நம்மை_மேம்படுத்தும்_எண்ணங்கள்,இவ்வளவு சிறிய வயதில் அவர் கணிதத்துறைப் பேராசிரியர் ஆனது இந்தப் பல்கலைக்கழகத்திற்கே ஒரு பெருமையாக அமைந்தது.,12
கலீலியோவின்_நம்மை_மேம்படுத்தும்_எண்ணங்கள்,ஒவ்வொரு நாட்டிலும் பெரும் கல்வியாளர் எனப்படுவோர் எல்லாரும் இவருக்கு மாணவர்களாக இருந்தார்கள் !,9
கலீலியோவின்_நம்மை_மேம்படுத்தும்_எண்ணங்கள்,கலீலியோவின் தொடர் ஆராய்ச்சியின் எதிரொலி அரிஸ்டாட்டில் முடிவை எதிர்த்துக் கொண்டே வந்தது.,9
கலீலியோவின்_நம்மை_மேம்படுத்தும்_எண்ணங்கள்,"கணிதத்தில், வானியலில் அரிஸ்டாட்டிலின் முடிவை பலமாக எதிர்த்து தவறுகளைத் தவறு என்று கூறலானார்.",10
கலீலியோவின்_நம்மை_மேம்படுத்தும்_எண்ணங்கள்,அரிஸ்டாட்டிலின் இந்தக் கருத்தை எதிர்த்துக் கலீலியோ கணிதப் போர்க்களத்திலே எதிர்ப்புக் கொடி தூக்கிவிட்டார்.,10
கலீலியோவின்_நம்மை_மேம்படுத்தும்_எண்ணங்கள்,இந்தக் கருத்தை ஏற்கமாட்டேன் இது தவறான ஓர் ஆய்வு என்று பலமாகக் கண்டனம் செய்து அவர் பேசினார் எழுதினார் !,14
கலீலியோவின்_நம்மை_மேம்படுத்தும்_எண்ணங்கள்,"கலீலியோ எழுப்பிய இந்தக் கண்டனக் குரல்களைக் கேட்ட கணித உலகம், சற்றுக்கண்களைத் திறந்து விழிப்புணர்வு பெற்றது !",12
கலீலியோவின்_நம்மை_மேம்படுத்தும்_எண்ணங்கள்,"காரணம், கரடுமுரடானக் குரலாக இருந்தது கலீலியோவின் குரல் !",6
கலீலியோவின்_நம்மை_மேம்படுத்தும்_எண்ணங்கள்,அரிஸ்டாட்டிலை எதிர்த்தது சரி எப்படி அவர் எதிர்த்தார்?,6
கலீலியோவின்_நம்மை_மேம்படுத்தும்_எண்ணங்கள்,காரணம் என்ன? என்பதைக் கூறிவிட்டல்லவா அவர் தனது இரும்பு வாதத்தை வைக்க வேண்டும் இதோ கலீலியோவே பேசுகிறார் பாருங்கள்.,14
கலீலியோவின்_நம்மை_மேம்படுத்தும்_எண்ணங்கள்,"இந்த பலமான எதிர்ப்பைக் கேட்ட அன்றைய அறிவியல் உலகம், மாமேதை அரிஸ்டாட்டில் கருத்துக்கு எதிர்ப்பா?",11
கலீலியோவின்_நம்மை_மேம்படுத்தும்_எண்ணங்கள்,எவனவன் பேதைமைப் பிடித்தப் பித்தன்?,4
கலீலியோவின்_நம்மை_மேம்படுத்தும்_எண்ணங்கள்,ஓர் ஆராய்ச்சியில் கருத்து முரண் இருந்தால் அதை வரவேற்பவன் அறிஞன் எதிர்த்து எள்ளி நகையாடுபவன் அறிவின் வறிஞன் !,13
கலீலியோவின்_நம்மை_மேம்படுத்தும்_எண்ணங்கள்,"அப்போது, யார் யார் கலீலியோ கருத்துக்கனை எள்ளி நகையாடி ஏளனம் பேசினாரோ?",9
கலீலியோவின்_நம்மை_மேம்படுத்தும்_எண்ணங்கள்,அவர்களை எல்லாம் அங்கே வந்து கூடுமாறு ஏற்கெனவே அவர் விடுத்திருந்த வேண்டுகோள்படி பலர் வந்து கூடினார்கள்.,12
கலீலியோவின்_நம்மை_மேம்படுத்தும்_எண்ணங்கள்,கோபுரத்தின் உச்சியில் இரண்டு குண்டுகளையும் அருகருகே அவர் வைத்தார் !,7
கலீலியோவின்_நம்மை_மேம்படுத்தும்_எண்ணங்கள்,ஒரே நேரத்தில் அந்த இரண்டு குண்டுகளையும் கீழே தள்ளினார் !,7
கலீலியோவின்_நம்மை_மேம்படுத்தும்_எண்ணங்கள்,கலீலியோ எழுப்பிய கண்டனக் குரலுக்கு ஏற்றவாறு இரண்டு குண்டுகளும் ஒரே நேரத்தில் தரையில் வந்து விழுந்தன !,12
கலீலியோவின்_நம்மை_மேம்படுத்தும்_எண்ணங்கள்,"அரிஸ்டாட்டிலின் கணிதக் கோட்பாடுகளைத் தகர்த்தெறிந்த கலீலியோ, மேலும்பல ஆய்வுகளைத் தொடர்த்து செய்து சோதனைகள் பல நிகழ்த்தினார்.",12
கலீலியோவின்_நம்மை_மேம்படுத்தும்_எண்ணங்கள்,மேலே இருந்து கீழே விழும் பொருள்களைப் பற்றி அவர் மூன்று பொது விதிகளை உலகுக்கு எடுத்துரைத்தார்.,12
கலீலியோவின்_நம்மை_மேம்படுத்தும்_எண்ணங்கள்,"அந்த மூன்றும் இன்னும் கல்லூரிகளிலும், பல்கலைக் கழகளிலும் கல்வி கற்கும் மாணவர்களுக்குப் போதிக்கப்பட்டு வருகின்றன.",11
கலீலியோவின்_நம்மை_மேம்படுத்தும்_எண்ணங்கள்,அரிஸ்டாட்டில் கோட்பாடுகள் தவறு என்பதைக் கலீலியோ நிரூபித்தார் !,6
கலீலியோவின்_நம்மை_மேம்படுத்தும்_எண்ணங்கள்,தாம் கூறிய விதிகள் தான் உண்மையானவை என்பதையும் மக்களைக்கூட்டி அவர் மெய்ப்பித்துக் காட்டினார்.,10
கலீலியோவின்_நம்மை_மேம்படுத்தும்_எண்ணங்கள்,கலீலியோ பிறப்பதற்கு முன்பு ஏறத்தாழ இரண்டாயிரம் ஆண்டுகளுக்கு முன்பு அரிஸ்டாட்டில் கிரீஸ் நாட்டில் தோன்றினார்.,11
கலீலியோவின்_நம்மை_மேம்படுத்தும்_எண்ணங்கள்,உலகத்திற்கு அவர் செய்துள்ள அறிவுச் சேவைகள் அரிதரிது !,6
கலீலியோவின்_நம்மை_மேம்படுத்தும்_எண்ணங்கள்,அரிஸ்டாட்டிலின் உண்மைகள் மாற்றக் கூடாதவை அவர் கூறிய உண்மைகள் அசைக்க முடியாதவை அவர் மொழிகளை எதிர்ப்பவர்.,12
கலீலியோவின்_நம்மை_மேம்படுத்தும்_எண்ணங்கள்,"இந்த எண்ணம் கொண்ட மக்கள் மனம், அரிஸ்டாட்டிலின் மீதும் அப்படியே பற்றிப் பரவி இருந்தது !",11
கலீலியோவின்_நம்மை_மேம்படுத்தும்_எண்ணங்கள்,அதே மனம் கலீலியோ காலத்து மக்கள் இடையேயும் இருந்தது என்றால் அது என்ன ஆச்சரியப்படத்தக்க விஷயமா !,12
கலீலியோவின்_நம்மை_மேம்படுத்தும்_எண்ணங்கள்,"இந்த அரிஸ்டாட்டில் வாசம் பற்றிய மக்கள், கலீலியோவின் உண்மைகளை, அவர் தம் கருத்துக்களை எப்படி ஏற்பார்கள்?",12
கலீலியோவின்_நம்மை_மேம்படுத்தும்_எண்ணங்கள்,அவர் மீது அறிவுப் பொறாமை பிடித்தவர்களும் எப்படி அவரது உண்மை ஆய்வு முடிவுகளை வரவேற்பார்கள்?,11
கலீலியோவின்_நம்மை_மேம்படுத்தும்_எண்ணங்கள்,அதனால் ஆயிரமாயிரம் மக்கள் கலீலியோ கருத்துக்களை அரிஸ்டாட்டில் மோகத்தால் மறுத்தார்கள் !,8
கலீலியோவின்_நம்மை_மேம்படுத்தும்_எண்ணங்கள்,உண்மைகளை ஏற்க மறுப்பவர்கள் பல்துறைகளிலே இருக்கிறார்கள் என்றால் என்னபொருள்?,7
கலீலியோவின்_நம்மை_மேம்படுத்தும்_எண்ணங்கள்,அவர்களுடைய அறிவை அவர்களே நம்ப மறுக்கிறார்கள் என்பதல்லவா உண்மை?,7
கலீலியோவின்_நம்மை_மேம்படுத்தும்_எண்ணங்கள்,தன்னையும் தனது முடிவையும் கேலி பேசியவர்களை அவர் ஏறெடுத்தும் பாராமல் அலட்சியப்படுத்தினார் !,9
கலீலியோவின்_நம்மை_மேம்படுத்தும்_எண்ணங்கள்,கலீலியோவை மறுத்தவர்கள் யார் தெரியுமா?,4
கலீலியோவின்_நம்மை_மேம்படுத்தும்_எண்ணங்கள்,தலை பழுத்த அறிவுக் கணிச்சுவை முதியவர்கள் வயது ஏறி ஏறி வயிரம் பாய்த்த நெஞ்சமுடையவர்கள் !,11
கலீலியோவின்_நம்மை_மேம்படுத்தும்_எண்ணங்கள்,அதாவது அக்காலப் பெரியார்கள் மதவாதிகள் !,4
கலீலியோவின்_நம்மை_மேம்படுத்தும்_எண்ணங்கள்,"அதனால் பல்கலை அறிஞரான அவர், பலவிதமான தொல்லைகள் ஏற்று அனுபவிக்கும் காலம் வந்தது.",10
கலீலியோவின்_நம்மை_மேம்படுத்தும்_எண்ணங்கள்,அங்கே அவர் பதினெட்டு ஆண்டுகள் பணியாற்றினார்.,5
கலீலியோவின்_நம்மை_மேம்படுத்தும்_எண்ணங்கள்,"சிறந்த சேவையாளர் என்ற பெயரையும், புகழையும் பெற்றார்.",6
கலீலியோவின்_நம்மை_மேம்படுத்தும்_எண்ணங்கள்,அந்த விஞ்ஞானி அப்போதுதான் தொலை நோக்கிக் கண்ணாடியைக் கண்டு பிடித்திருந்தார் !,8
கலீலியோவின்_நம்மை_மேம்படுத்தும்_எண்ணங்கள்,"என்ற லிப்ரிஷே, கலீலியோவிடம் அதைச் செய்து காட்டிய செயல், அவருக்கு ஓர் அதிசயமாகவே அப்போது இருந்தது.",12
