work_title,sentence,sentence_length
கல்வி_எனும்_கண்,அத்துறையில் விதி உள்ளமையின் தாங்கள் தடுக்க முடியாதே என அஞ்சுகின்றனர்.,8
கல்வி_எனும்_கண்,அவ்வாறு தேர்வு எழுதி வெற்றிபெறும் மாணவர்களைப் பொறியியல் கல்லூரி போன்றவை ஏற்றுக்கொள்ளா.,9
கல்வி_எனும்_கண்,இவ்வாண்டுமுதல் சென்னைப் பல்கலைக் கழகம் ஏற்றுக்கொள்ள வேண்டாம் என விதி செய்துள்ளது.,9
கல்வி_எனும்_கண்,ஆக அவர்கள் அவ்வாறு சுருங்கிய எல்லையில் தேர்வில் வெற்றி பெற்றும் மேலே பயில வாய்ப்பு இல்லையே.,12
கல்வி_எனும்_கண்,"முறையாக இரண்டாண்டு பள்ளிகளில் சேர்ந்து பயிற்சி பெற்று வருகின்றவர்களுக்கு மாறாக, இந்தக் குறுக்குவழி இருத்தல் ஏற்புடைத்தாகாது.",12
கல்வி_எனும்_கண்,இது மற்ற மாநிலங்களில் ஒரு வேளை இருந்தாலும் தவறே.,7
கல்வி_எனும்_கண்,எனவே நம் தமிழக அரசு உடன் இந்தக் குறுக்கு வழித் தேர்வினை நிறுத்த ஏற்பாடு செய்ய வேண்டும்.,13
கல்வி_எனும்_கண்,பத்தாம் வகுப்பில் வெற்றிபெற்று இரண்டு ஆண்டுகள் கழிந்த பிறகே இரண்டு எழுதவேண்டும் என்ற விதி கட்டாயம் ஆராயப் பெறவேண்டும்.,14
கல்வி_எனும்_கண்,"ஆனால் இந்த ஆண்டு சேர்க்கக்கூடாது என்ற விதியினைத் திட்டமாக முன்அறிவித்து விட்டமையின், எந்தக் கல்லூரியும் அவர்களைச் சேர்த்திருக்காது.",13
கல்வி_எனும்_கண்,எனவே உடன் இத்தகைய குறுக்குத் தேர்வினை முறைக்கு மாறான ஒன்றினை நிறுத்த வேண்டும்.,10
கல்வி_எனும்_கண்,"பிராமணர் அல்லாதார் இயக்கம் செயல்படத் தொடங்கி, நீதிக்கட்சி எனப் பெயர் பெற்று நாட்டில் வளரத் தொடங்கிய காலமது.",13
கல்வி_எனும்_கண்,அதே வேளையில் அன்றைய ஆங்கில அரசும் இந்தியருக்குச் சில வகையில் ஆளும் உரிமைகளை விட்டுக் கொடுக்கத் திட்டமிட்டது.,13
கல்வி_எனும்_கண்,"இராசன், முத்தையா முதலியார் ஆகியோர் முக்கிய இடம் பெற்ற நீதிக் கட்சி ஆட்சி அமைத்த காலமும் அது.",13
கல்வி_எனும்_கண்,மேலும் அன்று தொட்டு அடிக்கடி அரசுகள் மாறும் நிலை உண்டாயின.,8
கல்வி_எனும்_கண்,தனியாக இடைநிலைப்பள்ளிகளும் இருந்தன.,3
கல்வி_எனும்_கண்,இரண்டிற்கும் சற்றே பாடத்திட்டத்தில் மாற்றம் இருந்த போதிலும் யாவரும் மேலே கல்வியைத் தொடர வாய்ப்பு இருந்தது.,12
கல்வி_எனும்_கண்,ஆங்கிலேயர் வகுத்த கல்வி முறை மாறவேண்டும் என்று நான் மேலே குறித்துள்ளேன்.,9
கல்வி_எனும்_கண்,ஓர் ஆயிரத்து தொள்ளாயிரத்து தொன்னூற்றொன்று வரையில் ஆறு முதல் பதினொன்று  வகுப்புகள் பாரம் என்ற பெயரோடு உயர்நிலைப்பள்ளிகளில் இயங்கின.,14
கல்வி_எனும்_கண்,அக்காலத்திய பாடத்திட்டம் மாணவர் உளம் கொள்ளும் வகையில் அமைய எளிய வகையில் அமைந்து இருந்தது.,11
கல்வி_எனும்_கண்,ஆயினும் அடுத்தடுத்து வந்த அமைச்சரவகைளும் பிறமாறுதல்களும் கட்சி அடிப்படையில் அமைந்த பிறவும் கல்வித்துறையில் மாற்றம் காணவிரும்பின.,12
கல்வி_எனும்_கண்,அன்றைய இந்தியா ஒன்றாகவே இருந்தாலும் கல்வியைப் பொறுத்த வரையில் மாநிலங்களில் மத்திய அரசு தலையிட்டது கிடையாது.,12
கல்வி_எனும்_கண்,கணக்கும் அந்த வகையிலேயே படிப்படியாக உயர இறுதி வகுப்பில் சிறந்த வகையில் அமைந்தது.,10
கல்வி_எனும்_கண்,"ஆங்கிலம், வரலாறு போன்றவையும் அப்படியே.",4
கல்வி_எனும்_கண்,"இன்று அந்தப் பழைய கல்வியை ஒப்பிட்டுக் காணத்தக்க பள்ளி, கல்லூரிகளில் கற்ற பெரியவர்கள் இன்மையின் அத்தகைய பேச்சுக்கு இடமில்லை.",14
கல்வி_எனும்_கண்,இன்று இரு நிலையும் அருகிவிட்டனவே !,4
கல்வி_எனும்_கண்,ஆயினும் பாரதியார் அத்தகைய கல்வியினையே பழித்து உரைத்தார்.,6
கல்வி_எனும்_கண்,நம் நாட்டு வரலாறு அறியாத குழந்தைகள்.,5
கல்வி_எனும்_கண்,எந்நாட்டு வரலாறுகளையோ அறிகிறார்களே என வருந்தினார்.,5
கல்வி_எனும்_கண்,இதற்கா நான் ஆனந்த சுதந்திரம் அடைந்துவிட்டோம் என்று பள்ளுப் பாடினேன் என்று அவதியுற்றுக் கலங்குவார்.,11
கல்வி_எனும்_கண்,தெய்வநெறி போற்றும் மரபும் அக்காலத்தில் போற்றப்பட்டது.,5
கல்வி_எனும்_கண்,"கல்லூரி, பள்ளிகளில் தமிழ்ப் பாடநூல்களில் முதலில் கட்வுள் வாழ்த்து அமைந்தே பிறகு அறம், இலக்கியம் போன்றவை இடம் பெற்றன.",14
கல்வி_எனும்_கண்,இப்படி எவ்வளவோ சொல்லலாம்.,3
கல்வி_எனும்_கண்,"கல்லூரியிலும் இடைநிலை வகுப்பு என்ற பேரேரியிலும் இரண்டாண்டுகள் அமைய, அடுத்து, பட்ட வகுப்பு",10
கல்வி_எனும்_கண்,"பட்டச் சிறப்பு வகுப்பு,, மேல் பட்ட வகுப்பு என்ற நிலையிலும் இருந்தன.",9
கல்வி_எனும்_கண்,"மாணவர் தரம், தம் திறன், தகுதி கருதி அந்தந்த வகையில் கல்வி பயின்றனர்.",10
கல்வி_எனும்_கண்,ஆனால் இந்த நிலையெல்லாம் இன்று இல்லை.,5
கல்வி_எனும்_கண்,ஒரே முறையான பத்து இரண்டு மூன்று இரண்டு என்ற வகையிலேதான் முதல் வகுப்பு தொடங்கி முதுநிலைவரை அமைகின்றது.,13
கல்வி_எனும்_கண்,"பட்ட வகுப்பில் ஒரு பாடம், மேநிலையில் வேறு ஒரு பாடம் படிக்கவும் இன்று வகை உண்டு.",12
கல்வி_எனும்_கண்,இப்படிப் பயில்கின்றவர் எப்படித் தெளிந்த அறிவுடையவராக முடியும்?,6
கல்வி_எனும்_கண்,கடைக்கால் இல்லாமல் கட்டும் வீடாக அன்றோ அது இடிவுறும்.,7
கல்வி_எனும்_கண்,அதனால் பலருடைய கோபத்துக்கு ஆளானதும் உண்டு.,5
கல்வி_எனும்_கண்,ஆயினும் நான் இருந்த வரையில் என் கொள்கையில் வழாமலேயே மாணவர்களைச் சேர்த்துவந்தேன்.,9
கல்வி_எனும்_கண்,மேலே காட்டியபடி எத்தனையோ வகையில் ஆரம்பப் பள்ளி முதல் கல்லூரிவரையில் புதுப்புது மாற்றங்களால் கல்வியின் தரமே மங்கிவிட்டது.,13
கல்வி_எனும்_கண்,மறுபடியும் எங்கோ சென்றுவிட்டேன் மன்னிக்கவும்.,4
கல்வி_எனும்_கண்,உயர்நிலைப் பள்ளியின் கல்வி நிலை பற்றி மறுபடியும் காணலாம்.,7
கல்வி_எனும்_கண்,ஆறாம் வகுப்பு முதல் பள்ளி.,4
கல்வி_எனும்_கண்,இறுதிவரை ஐந்து பாடங்களே பயிற்றுவிக்கப் பெற்றன.,5
கல்வி_எனும்_கண்,"தமிழ், ஆங்கிலம், கணக்கு, வரலாறு, புவிஇயல் ஆகியவையே அவை.",7
கல்வி_எனும்_கண்,"அவை அனைத்தும் வகுப்பின் தரத்துக்கு ஏற்ப, படிப்படியாக உயர்ந்து வந்து பயிலும் மாணவர்களுக்குத் தெளிவினை உண்டாக்கும்.",12
கல்வி_எனும்_கண்,உதாரணமாக நிலநூலை எடுத்துக் கொள்வோம்.,4
கல்வி_எனும்_கண்,பின் ஏழாம் வகுப்பில் ஆசியாவைப்பற்றித் தெளிவாகவும் அதைச் சார்ந்த சில ஐரோப்பிய நாடுகள் பற்றிச் சுருக்கமாகவும் அறிவான்.,13
கல்வி_எனும்_கண்,ஒன்பதாம் வகுப்பில் உலக முழுவதும் பற்றிய நில வரலாற்றை அறிந்து அத்துறையில் மனநிறைவு பெற்றுத் தெளிவு காண்பான்.,13
கல்வி_எனும்_கண்,பள்ளியில் இரு மேல் வகுப்புகளிலும் இந்தப் பாடம் கிடையாது.,7
கல்வி_எனும்_கண்,ஒன்பதாம் வகுப்புவரை வரலாற்றிலும் அப்படியே.,4
கல்வி_எனும்_கண்,எனினும் தமிழக மாணவனுக்கு எங்கோ இராசராசன் போன்ற ஓரிரு அரசர்களைப் பற்றி மட்டுமே அறிய முடியும்.,12
கல்வி_எனும்_கண்,"ஆனால் வடநாட்டு வரலாறு, ஆங்கில நாட்டு வரலாறு பற்றி அதிகமாக அறிய வாய்ப்பு இருந்தது.",11
கல்வி_எனும்_கண்,அதனாலேயே பாரதி நைந்து பாடினார்.,4
கல்வி_எனும்_கண்,"கணக்கிலும் அப்படியே, வகுப்பின் தரத்தினுக்கு ஏற்ப, பள்ளி இறுதி வகுப்புவரை திட்டமான பாடத்திட்டம் வகுக்கப் பெற்றிருக்கும்.",12
கல்வி_எனும்_கண்,அந்த இரு பாடங்களுக்குப் பதிலாக மாணவர் விருப்பப்படி வேறு இரு பாடங்களை விருப்பப்பாடங்களாக எடுத்துக் கொள்ளலாம்.,12
கல்வி_எனும்_கண்,சென்ற பிரசோற்தியில் மாறுபட்ட பாதை அறுபது ஆண்டுகள் கழித்து இந்தப் பிரசோற்பத்தியில் நேரிய பாதையில் திரும்புமா?,12
கல்வி_எனும்_கண்,ஓர் ஆயிரத்து தொள்ளாயிரத்து முப்பத்தொன்று க்குப் பிறகு அப்போது வந்த புதிய அரசு மாற்றங்களைச் செய்தது.,12
கல்வி_எனும்_கண்,விருப்பப் பாடம் ஒன்றாயிற்று.,3
கல்வி_எனும்_கண்,வேறு பல மாற்றங்களும் நிகழ்ந்தன.,4
கல்வி_எனும்_கண்,அன்றுதொட்டு இன்று வரையில் தமிழகக் கல்வி எடுப்பார் கைப்பிள்ளையாய் ஏங்கும் வகையில் எங்கோ சென்று கொண்டிருக்கிறது.,12
கல்வி_எனும்_கண்,இன்று மாணவர்களுக்குத் தேவையற்ற பாடங்களும் அதற்கெனப் பாடநூல்களும் குறிப்பேடுகளும் என்று செயலுக்கெனத் தனி நூல்களும் அதிகமாகத் திணிக்கப் பெறுகின்றன.,14
கல்வி_எனும்_கண்,அவற்றைச் சுமப்பதற்கும்கூட மாணவர் இயலாது வருந்துவர்.,5
கல்வி_எனும்_கண்,பழங்காலத்தில் மனப்பாடம் செய்யும் மரபு இருந்தது.,5
கல்வி_எனும்_கண்,இது பற்றி முன்னமே நான் குறிப்பட்டேன்.,5
கல்வி_எனும்_கண்,கீழ்வாய் இலக்கமும் வாய்பாடும் மனப்பாடம் செய்தவர்கள் எத்தகைய கணக்கினையும் மனத்திலே கணக்கிட்டு விரைந்து விடை காண்பர்.,12
கல்வி_எனும்_கண்,அப்படியே பல்வேறு இலக்கியங்களை மனப்பாட்ம் செய்வதால் அவர்தம் பேச்சும் எழுத்தும் சிறக்க அமையும்.,10
கல்வி_எனும்_கண்,நம்மிலும் பலகோடி மடங்கு நினைவாற்றல் உடைய கணிப்பொறிமுன் மனிதனுடைய நினைவாற்றல் தேவையற்றது என்பர்.,10
கல்வி_எனும்_கண்,பெருக்கல் கூட்டல் போன்றவற்றிற்கு மின் அணுக் கருவிகள் வந்துள்ளமையின் வாய்பாடு மனப்பாடமும் தேவை இல்லை என்பர்.,12
கல்வி_எனும்_கண்,காலம்தான் இதற்குப் பதில் சொல்லவேண்டும்.,4
கல்வி_எனும்_கண்,இன்று உயர்தர ஆரம்பப்பள்ளிகள் இல்லை என எண்ணுகிறேன்.,6
கல்வி_எனும்_கண்,"இந்தப் பள்ளிகள் நான் மேலே கூறியபடி, தமிழ்நாட்டில் பல வகையில், பல பாட முறைகளில் நடைபெறுகின்றன.",12
கல்வி_எனும்_கண்,இவை நிறுத்தப்பெறல் வேண்டும்.,3
கல்வி_எனும்_கண்,"தமிழக அரசும் மெட்ரிகுலேஷன் என்ற அமைப்பில் முழுக்க ஆங்கிலப்பள்ளி அமைத்து, அதில் பயில்வாரைத் தனிச் சாதியாக வளர்த்து வருகிறது.",14
கல்வி_எனும்_கண்,"அதன் பாடத்திட்டமும் குறைவு தமிழன் தரம் மிகத் தாழ்வு, அப்படியே கீழ்த்திசைப் பள்ளிகள் உள்ளன.",11
கல்வி_எனும்_கண்,இவ்வாறு ஒரே நாட்டில் பலவகையான ஆரம்பப் பள்ளிகள் இயங்குமானால் எப்படி நாட்டு ஒற்றுமை உண்டாகும்?,11
கல்வி_எனும்_கண்,"இன்றைய அரசாங்கத்தின் வழியே தமிழ், தமிழ்நாட்டில் விரைவில் கட்டாயமாக்கப்பெறும் என அறிய மகிழ்ச்சி பிறக்கிறது.",11
கல்வி_எனும்_கண்,இங்கே மற்றொன்றும் நினைவுக்கு வருகிறது.,4
கல்வி_எனும்_கண்,நான் தமிழின் சிறப்பு நிலைத் தேர்வாளனாகப் பதினைந்தாண்டுகள் அங்கே பணிபுரிந்தேன்.,8
கல்வி_எனும்_கண்,தமிழை மட்டுமன்றி ஒவ்வொரு மொழியினையும் மேல்மட்டம் கீழ்மட்டம் என இரண்டாகப் பிரித்துள்ளனர்.,9
கல்வி_எனும்_கண்,தாய்மொழியை மேல்மட்டமாகக் கொண்டவர் மற்றொன்றினைக் கீழ்மட்ட நிலையில் கொள்ளலாம்.,7
கல்வி_எனும்_கண்,இரண்டிற்கும் பாட அமைப்பில் வேறுபாடு உள்ளது.,5
கல்வி_எனும்_கண்,கீழ்மட்டம் சற்றே எளிதாகப் பயிலும் வாய்ப்பு உடையது.,6
கல்வி_எனும்_கண்,இந்த முறையினால் மராத்தியர் மராத்தியினைக் கட்டாயமாக மேல்மட்ட்த்தில் படிப்பதுடன் மற்றொரு மொழியினைக் கீழ்மட்டத்தில் கட்டாயம் படிக்கவேண்டும்.,12
கல்வி_எனும்_கண்,அங்கே உள்ள தமிழர்கள் தமிழை மேல்மட்டத்தில் கற்றால் மராத்தியினைக் கீழ்மட்டத்தில் பயிலலாம்.,9
கல்வி_எனும்_கண்,அன்றி வேறு மொழியினை மேல்மட்டமாகக் கொண்டாலும் தமிழைக் கீழ்மட்டத்திலாவது பயிலவேண்டும்.,8
கல்வி_எனும்_கண்,"தமிழ் மட்டுமன்றி மராத்தி நாட்டிலுள்ள தெலுங்கர், கன்னடியர், குஜராத்தியர் ஆகியோருக்கும் இந்த நிலை உண்டு.",11
கல்வி_எனும்_கண்,"கூடவே ஆங்கிலமும், இந்தியும் இவ்வாறே பகுக்கப்பெற்று உள்ளன என எண்ணுகிறேன்.",8
கல்வி_எனும்_கண்,இன்னும் பல மாற்றங்கள் இந்த வகுப்புகளில் செய்ய வேண்டியுள்ளன.,7
கல்வி_எனும்_கண்,"அவற்றை அவ்வத்துறையினர் ஆராய்ந்து, தெளிந்து அரசுடன் கலந்து முடிவெடுத்து ஆவன காணலாம்.",9
கல்வி_எனும்_கண்,என் சில நூல்களில் இவை பற்றி முன்னரே குறித்துள்ளேன்.,7
கல்வி_எனும்_கண்,நான் அங்கம்வகித்த சில குழுக்களிடையேயும் அவை பற்றிக் கூறியிருக்கிறேன்.,7
கல்வி_எனும்_கண்,எனவே தற்போது இந்த அளவோடு இது பற்றி அமையும் என எண்ணி நிற்கின்றேன்.,10
கல்வி_எனும்_கண்,கல்வியில் மொழி பற்றிய சர்ச்சையே வளாந்துகொண்டு இருக்கிறது.,6
கல்வி_எனும்_கண்,பல மொழி பேசும் நாட்டில் ஒரு மொழியினைக் கட்டாய்மாகத் திணிப்பது தவறுதான் என எல்லாரும் உணருகின்றனர்.,12
கல்வி_எனும்_கண்,அரசியல் சாசனத்திலே தலைவர் தம் தனிவாக்கினால் ஒருவாக்கு அதிகமாகப் பெற்றமையால் இந்தி நாட்டு மொழியாக இடம்பெற்றது.,12
