work_title,sentence,sentence_length
கந்தர்_அலங்காரச்_சொற்பொழிவுகள்-1,கந்தர் அலங்காரச் சொற்பொழிவுகள் ஒன்று கி.,5
கந்தர்_அலங்காரச்_சொற்பொழிவுகள்-1,கந்தர் அலங்காரச் சொற்பொழிவுகள் பாகம் ﻿கி.வா.,6
கந்தர்_அலங்காரச்_சொற்பொழிவுகள்-1,﻿பதிப்புரை வாகீச கலாநிதி கி.வா.,5
கந்தர்_அலங்காரச்_சொற்பொழிவுகள்-1,ஜகந்நாதன் அவர்கள் எங்கள் குடும்பத்துடன் நெருங்கிப் பழகிய எழுத்தாளர்களுள் ஒருவர்.,8
கந்தர்_அலங்காரச்_சொற்பொழிவுகள்-1,"எங்கள் நிறுவனர் வி.குப்புஸ்வாமி ஐயருக்கு, மூத்த குமாரர் போல் பழகி வந்தவர்.",10
கந்தர்_அலங்காரச்_சொற்பொழிவுகள்-1,அவருடைய நூல்கள் நமது நிறுவனத்தின் மூலம் மூன்று தலைமுறையினரால் தொடர்ந்து வெளியிடப்பட்டு வருகின்றன.,10
கந்தர்_அலங்காரச்_சொற்பொழிவுகள்-1,இவர் தமிழ் இலக்கியத்தில் கரை கடந்தவர் ஆன்மிகத்தில் பரம்பொருளைக் கண்ட ஞானி.,9
கந்தர்_அலங்காரச்_சொற்பொழிவுகள்-1,"எனவே இவரை ஞானப் புலவர் என்று கூறினால், அது மிகையாகாது.",8
கந்தர்_அலங்காரச்_சொற்பொழிவுகள்-1,பரசுராமன் போன்ற பல ஞானப்புலவர்கள் இருக்கத்தான் செய்கிறார்கள்.,6
கந்தர்_அலங்காரச்_சொற்பொழிவுகள்-1,"இவர்கள் எல்லாம் சாதாரண மனித சக்தியை மீறி, இறைவன் திருவருளால், ஏராளமான சொற்பொழிவுகளையும் நூல்களையும் இயற்றிக் கொண்டிருக்கிறார்கள்.",13
கந்தர்_அலங்காரச்_சொற்பொழிவுகள்-1,பிறவிப் பெருங்கடலை நீந்த நமக்கு வழிகாட்டியாக விளங்குகிறார்கள்.,6
கந்தர்_அலங்காரச்_சொற்பொழிவுகள்-1,"இவர்களுடைய பேச்சுக்களையும், எழுத்துக்களையும் நாம் பின்பற்றி வந்தாலே போதும்.",7
கந்தர்_அலங்காரச்_சொற்பொழிவுகள்-1,அதுதான் அவர்கள் எல்லாம் பாமரராகிய நமக்குக் காட்டும் வழி.,7
கந்தர்_அலங்காரச்_சொற்பொழிவுகள்-1,சற்றேறக்குறைய அறுநூறு  ஆண்டுகளுக்கு முன்பு இப்படி ஒரு ஞானப் புலவர் இருந்தார்.,9
கந்தர்_அலங்காரச்_சொற்பொழிவுகள்-1,இறைவனை நேரில் தரிசித்து அருளைப் பெற்றவர்.,5
கந்தர்_அலங்காரச்_சொற்பொழிவுகள்-1,"இவர் அருளிய நூல்கள் எல்லாம் நமக்கு, பரப்பிரம்மத்தை உணரவைக்கும் வழிகாட்டிகள்.",8
கந்தர்_அலங்காரச்_சொற்பொழிவுகள்-1,அந்தச் சொற்பொழிவின் தொகுப்புதான் இந்நூல்.,4
கந்தர்_அலங்காரச்_சொற்பொழிவுகள்-1,"இதைப் பற்றி அவரே, தனது முன்னுரையில் விரிவாக எடுத்துக் கூறியுள்ளார்கள்.",8
கந்தர்_அலங்காரச்_சொற்பொழிவுகள்-1,"வாக்கில் ஒரு நாள், அடியேன், கி.வா.ஜ.",7
கந்தர்_அலங்காரச்_சொற்பொழிவுகள்-1,"அவர்களுடன் புரூஃப் பார்த்துக் கொண்டிருக்கும்போது, அவர் என்னிடம், நீ ﻿ என்னுடைய அலங்காரப் புத்தகங்களைப் போடுகிறாயா?",12
கந்தர்_அலங்காரச்_சொற்பொழிவுகள்-1,ஒரு தெய்வப் புலவர் எழுதியதை மற்றொரு தெய்வப் புலவர் விளக்கமாகக் கூறிய நூலை வெளியிடுகிறாயா?,11
கந்தர்_அலங்காரச்_சொற்பொழிவுகள்-1,என்று கேட்கப்பட்டவுடன் அதிர்ச்சி அடைந்தேன் இவ்வளவு பெரிய பாக்கியம் நமக்கு உள்ளதா?,9
கந்தர்_அலங்காரச்_சொற்பொழிவுகள்-1,என்று எண்ணி வியந்தேன்.,3
கந்தர்_அலங்காரச்_சொற்பொழிவுகள்-1,அன்று அவர் போட்ட பிள்ளையார் சுழி இன்றும் தொடர்ந்துகொண்டே போகிறது.,8
கந்தர்_அலங்காரச்_சொற்பொழிவுகள்-1,எல்லாம் அவன் அருள் !,3
கந்தர்_அலங்காரச்_சொற்பொழிவுகள்-1,ம் வருடம் கி.வா.ஜ.,5
கந்தர்_அலங்காரச்_சொற்பொழிவுகள்-1,அவர்களின் நூற்றாண்டு வருகிறது.,3
கந்தர்_அலங்காரச்_சொற்பொழிவுகள்-1,"இந்தச் சமயத்தில் அவருடைய அனைத்து நூல்களையும், ஒன்றன்பின் ஒன்றாக வெளியிட, இறைவனைப் பிரார்த்திக்கிறோம்.",10
கந்தர்_அலங்காரச்_சொற்பொழிவுகள்-1,கி.வா.ஜ.,3
கந்தர்_அலங்காரச்_சொற்பொழிவுகள்-1,"அவர்களின் ஞானப் பெருக்கையும், அவர் கையாண்ட தமிழ் அழகையும் நீங்களே படித்து ரஸியுங்கள் சுவையுங்கள் போற்றிப் பாதுகாத்து பயன்பெறுங்கள்.",14
கந்தர்_அலங்காரச்_சொற்பொழிவுகள்-1,அல்லயன்ஸ் ஸ்ரீநிவாஸன் ﻿﻿உள்ளுறை ஒன்று.,4
கந்தர்_அலங்காரச்_சொற்பொழிவுகள்-1,", அதன் பயன், அப்போது நினைத்தல், கலந்து பாடுதல், பாதுகாப்பு, மரண வேதனை, பயமும் பக்தியும், எப்போது வருவான்?",13
கந்தர்_அலங்காரச்_சொற்பொழிவுகள்-1,ஆனால் மற்றவர்களையும் அப்படி ஈடுபடச் செய்யும் வழிகாட்டிகளிலே சிறந்தவர் அருணகிரிநாதர்.,8
கந்தர்_அலங்காரச்_சொற்பொழிவுகள்-1,அவர் பாடிய திருப்புகழ் இன்று தமிழர் வாழும் இடமெல்லாம் பரவி முருக பக்தியை மேன்மேலும் வளர்த்து வருகிறது.,13
கந்தர்_அலங்காரச்_சொற்பொழிவுகள்-1,கந்தர் அலங்காரம் நூறு கட்டளைக் கலித்துறையால் ஆகியது.,6
கந்தர்_அலங்காரச்_சொற்பொழிவுகள்-1,ஆயினும் நூற்றுக்கு அப்பாலும் சில கவிகள் வழக்கில் இருந்து வருகின்றன.,8
கந்தர்_அலங்காரச்_சொற்பொழிவுகள்-1,அலங்காரம் என்ற பெயரோடு உள்ள நூல்கள் முன்பும் தமிழில் இருந்தன.,8
கந்தர்_அலங்காரச்_சொற்பொழிவுகள்-1,ஆனால் அவை தமிழ் இலக்கணம் ஐந்தில் ஒன்றாகிய அணி இலக்கணத்தைச் சொல்லும் நூல்கள்.,10
கந்தர்_அலங்காரச்_சொற்பொழிவுகள்-1,"தண்டியலங்காரம், மாறன் அலங்காரம் என்பவை அத்தகையனவே.",5
கந்தர்_அலங்காரச்_சொற்பொழிவுகள்-1,கண்டன் அலங்காரம் என்ற நூல் ஒன்று முன்பு இருந்த தென்று தெரிய வருகிறது.,10
கந்தர்_அலங்காரச்_சொற்பொழிவுகள்-1,அதிலுள்ள சில செய்யுட்கள் மாத்திரம் இப்போது கிடைக்கின்றன.,6
கந்தர்_அலங்காரச்_சொற்பொழிவுகள்-1,சமீப காலத்தில் வாழ்ந்த திருப்புகழ்ச் சுவாமிகள் என்ற தண்டபாணி சுவாமிகள் தமிழ் அலங்காரம் என்று ஒரு நூல் பாடியுள்ளார்.,14
கந்தர்_அலங்காரச்_சொற்பொழிவுகள்-1,அது தமிழின் பெருமையை விளக்கும் நூல்.,5
கந்தர்_அலங்காரச்_சொற்பொழிவுகள்-1,கந்தர் அலங்காரத்தை எண்ணி அமைத்த பெயர் அது என்றே தோன்றுகிறது.,8
கந்தர்_அலங்காரச்_சொற்பொழிவுகள்-1,கந்தருக்கு அலங்காரமாக அமைந்த நூலாதலால் இதற்கு இப்பெயர் உண்டாயிற்று.,7
கந்தர்_அலங்காரச்_சொற்பொழிவுகள்-1,அருணகிரி நாதருடைய நூல்கள் யாவற்றுக்கும் பொதுவாக அமைந்த இயல்புகளை இதிலும் காணலாம்.,9
கந்தர்_அலங்காரச்_சொற்பொழிவுகள்-1,இந்த நூலுக்குச் சில அன்பர்கள் பொருள் எழுதி வெளியிட்டிருக்கிறார்கள்.,7
கந்தர்_அலங்காரச்_சொற்பொழிவுகள்-1,ஏதேனும் ஒரு நூலைப் பற்றி வாரந்தோறும் ஒரு நாள் அவ்வாலயத்தில் சொற்பொழிவாற்ற வேண்டும் என்று சொன்னார்கள்.,12
கந்தர்_அலங்காரச்_சொற்பொழிவுகள்-1,"வரையறையாக இடையீடின்றிச் செய்ய வேண்டிய கடமையாதலின், நான் மெல்லப் போக்குக் கூறிக் காலம் கழித்து வந்தேன்.",12
கந்தர்_அலங்காரச்_சொற்பொழிவுகள்-1,அவர்களும் விடாப்பிடியாக என்னைத் தம் அன்பு வலைக்குள் போட்டு இறுக்கி வந்தனர்.,9
கந்தர்_அலங்காரச்_சொற்பொழிவுகள்-1,கடைசியில் ஒப்புக் கொண்டேன்.,3
கந்தர்_அலங்காரச்_சொற்பொழிவுகள்-1,"திருமுருகாற்றுப் படை, கந்தர் அநுபூதி, ஞானசம்பந்தர் தேவாரம் ஆகியவற்றைத் தொடர்ந்து சொல்லியதுண்டு.",9
கந்தர்_அலங்காரச்_சொற்பொழிவுகள்-1,"அந்த வழக்கத்தால், இதையும் நிறைவேற்றலாம் என்று எண்ணினேன்.",6
கந்தர்_அலங்காரச்_சொற்பொழிவுகள்-1,நான் இந்தக் கடமையை ஏற்றுக் கொண்டதற்கு முக்கியமான காரணம் ஒன்று உண்டு.,9
கந்தர்_அலங்காரச்_சொற்பொழிவுகள்-1,"எதை எதையோ பேசுவதற்கு இடையிலே, அயில் வேலன் கவியை ப் பேச வகை அவனருளால் வந்தது என்று எண்ணினேன்.",14
கந்தர்_அலங்காரச்_சொற்பொழிவுகள்-1,அதுவே இப்பணியில் புகுவதற்குரிய தலைமையான காரணம்.,5
கந்தர்_அலங்காரச்_சொற்பொழிவுகள்-1,இந்தச் சொற்பொழிவுத் தொடர் அன்று தொடங்கியது.,5
கந்தர்_அலங்காரச்_சொற்பொழிவுகள்-1,அவராகவே அன்பு வைத்து இதனைச் செய்யத் தொடங்கினார்.,6
கந்தர்_அலங்காரச்_சொற்பொழிவுகள்-1,அவர் அப்படிச் செய்வதை அறிந்த அமுத நிலையத் தலைவரும் என் கெழுதகை நண்பருமாகிய ஸ்ரீ ரா.,12
கந்தர்_அலங்காரச்_சொற்பொழிவுகள்-1,ஸ்ரீகண்டன் அவர்கள் அவர் எழுதுபவற்றைப் பயன்படுத்திக் கொள்ளலாம் என்றார்.,7
கந்தர்_அலங்காரச்_சொற்பொழிவுகள்-1,அவர் விருப்பப்படியே இந்த வெளியீடுகள் இப்போது உருவாகின்றன.,6
கந்தர்_அலங்காரச்_சொற்பொழிவுகள்-1,கந்தர் அலங்காரப் பாடல்களுக்கு மாத்திரம் விளக்கம் எழுதினால் அது இவ்வளவு விரியாது.,9
கந்தர்_அலங்காரச்_சொற்பொழிவுகள்-1,"பேசும்போது கேட்டதையே படித்தால், கேட்கும்போது இருந்த சுவை ஓரளவு குறையும்.",8
கந்தர்_அலங்காரச்_சொற்பொழிவுகள்-1,சில இடங்களில் பன்னிப் பன்னிச் சொன்னதுபோலத் தோற்றும்.,6
கந்தர்_அலங்காரச்_சொற்பொழிவுகள்-1,ஓரிடத்தில் சொன்ன செய்தியே வேறு ஓரிடத்தில் வருவதும் கூடும்.,7
கந்தர்_அலங்காரச்_சொற்பொழிவுகள்-1,ஆயினும் சொற்பொழிவு நடையாகவே இருக்கட்டும் என்ற நினைவினால் அவற்றை நான் சுருக்கவில்லை.,9
கந்தர்_அலங்காரச்_சொற்பொழிவுகள்-1,"ஒரு முறை இவற்றைப் பார்த்துக் சிறிதளவே செப்பஞ் செய்து, வெளியிடக் கொடுத்து விட்டேன்.",10
கந்தர்_அலங்காரச்_சொற்பொழிவுகள்-1,இது புதுவகையான முயற்சி.,3
கந்தர்_அலங்காரச்_சொற்பொழிவுகள்-1,அன்பர்கள் நன்றாக இருக்கிறதென்றால் முயற்சி வெற்றி பெற்றது என்று மகிழ்வேன்.,8
கந்தர்_அலங்காரச்_சொற்பொழிவுகள்-1,அன்பர்களின் கருத்தைத் தெரிந்து கொண்டால் அதற்கு ஏற்றபடி செய்யலாம் என்று தோன்றுகிறது.,9
கந்தர்_அலங்காரச்_சொற்பொழிவுகள்-1,இந்த முயற்சி உருவாக அருளிய முருகன் திருவருளை வழுத்துகிறேன்.,7
கந்தர்_அலங்காரச்_சொற்பொழிவுகள்-1,அவருடைய உதவியே இந்த வரிசைக்கு உரமூட்டுகிறது.,5
கந்தர்_அலங்காரச்_சொற்பொழிவுகள்-1,அவருக்கு என் நன்றியறிவைத் தெரிவித்துக் கொள்கிறேன்.,5
கந்தர்_அலங்காரச்_சொற்பொழிவுகள்-1,ஸ்ரீகண்டன் அவர்கள் இந்த வரிசை மலர்வதற்கு நீர் வார்க்கிறவர்.,7
கந்தர்_அலங்காரச்_சொற்பொழிவுகள்-1,அவருக்கும் என் நன்றியைத் தெரிவித்துக் கொள்கிறேன்.,5
கந்தர்_அலங்காரச்_சொற்பொழிவுகள்-1,முருகன் திருவருளால் கந்தர் அலங்காரச் சொற்பொழிவுகள் இனிது நிறைவேறுமென்று நம்புகிறேன்.,8
கந்தர்_அலங்காரச்_சொற்பொழிவுகள்-1,அந்தக் கதைகள் அனைத்துக்கும் சான்று உண்டு என்று சொல்ல இயலாது.,8
கந்தர்_அலங்காரச்_சொற்பொழிவுகள்-1,திருப்புகழைக் கொண்டு பார்த்தால் அருணகிரி நாதப் பெருமானைப் பற்றிய செய்திகள் பல தெரியவரும்.,10
கந்தர்_அலங்காரச்_சொற்பொழிவுகள்-1,"திருப்புகழ், திருவகுப்பு, கந்தர் அலங்காரம், கந்தர் அநுபூதி, கந்தர் அந்தாதி ஆகிய அழகான நூல்களிலிருந்து இவற்றை ஒருவாறு அறியலாம்.",14
கந்தர்_அலங்காரச்_சொற்பொழிவுகள்-1,அந்த நூல்களால் அவர் பல சாஸ்திரம் அறிந்தவரென்று தெரியவரும் ஞானம் பெற்றவரென்று தெரியவரும்.,10
கந்தர்_அலங்காரச்_சொற்பொழிவுகள்-1,"சரியை முதலிய மார்க்கம் அறிந்தவரென்பதும், தலங்களின் சிறப்பை உணர்ந்தவரென்பதும் அறிந்து கொள்ளலாம்.",9
கந்தர்_அலங்காரச்_சொற்பொழிவுகள்-1,பலவகையான செய்திகளை அவர் அறிவார்.,4
கந்தர்_அலங்காரச்_சொற்பொழிவுகள்-1,"உலா, கோவை போன்ற பிரபந்தங்களிலும் அவருக்குப் பழக்கம் உண்டு.",7
கந்தர்_அலங்காரச்_சொற்பொழிவுகள்-1,சங்ககால நூல்களிலும் பயிற்சி உண்டு.,4
கந்தர்_அலங்காரச்_சொற்பொழிவுகள்-1,இவற்றை அறிந்து கொள்வதற்குரிய பல குறிப்புக்களை முன் சொன்ன அவர் நூல்களிற் காணலாம்.,10
கந்தர்_அலங்காரச்_சொற்பொழிவுகள்-1,அருணகிரிநாதப் பெருமானை இனி நாம் காண முடியாது.,6
கந்தர்_அலங்காரச்_சொற்பொழிவுகள்-1,ஆனால் அப்பெருமான் திருவாய் மலர்ந்தருளிய நூல்கள் இன்றும் இருக்கின்றன.,7
கந்தர்_அலங்காரச்_சொற்பொழிவுகள்-1,"அவற்றினூடே புகுந்து பார்க்கும்போது அவர், திருவருட்பேற்றை அடைந்தவர் என்பதை நாம் உணர்ந்து கொள்ள முடியும்.",11
கந்தர்_அலங்காரச்_சொற்பொழிவுகள்-1,அருணகிரியார் அருளிய நூல்கள் மிகவும் நல்ல நூல்கள்.,6
கந்தர்_அலங்காரச்_சொற்பொழிவுகள்-1,இலக்கிய நயத்தை மாத்திரம் உணர்ந்து கொள்ள இலக்கிய நூல்களைப் பார்க்கலாம்.,8
கந்தர்_அலங்காரச்_சொற்பொழிவுகள்-1,சாஸ்திர உண்மைகளை அறிந்து கொள்ளச் சாஸ்திர நூல்களைப் பார்க்கலாம்.,7
கந்தர்_அலங்காரச்_சொற்பொழிவுகள்-1,அருணகிரிநாதர் இயற்றிய நூல்களிலோ அநுபவம் புதைந்து கிடக்கின்றது.,6
கந்தர்_அலங்காரச்_சொற்பொழிவுகள்-1,நிழலும் ஒளியும் கலந்திருப்பதனால்தான் அவர் பாடல்கள் நமக்கு இனிக்கின்றன.,7
கந்தர்_அலங்காரச்_சொற்பொழிவுகள்-1,ஆனால் ஒளி மயமான இன்பங்களை அவர் கூறும்போது அவை நமக்கு விளங்குவதில்லை.,9
