work_title,sentence,sentence_length
கல்வி_எனும்_கண்,கல்வி எனும் கண் அ.,4
கல்வி_எனும்_கண்,"மு. பரமசிவானந்தம்‎ அக்டோபர், அன்று விக்கிமூலத்தில் இருந்து பதிவிறக்கப்பட்டது கல்வி எனும் கண் பேராசிரியர் அ.மு.",13
கல்வி_எனும்_கண்,﻿கல்வி எனும் கண் பேராசிரியர் அ.மு.,6
கல்வி_எனும்_கண்,"அச்சிட்டோர் மாருதி பிரஸ், நூற்றி எழுபத்து மூன்று, பீட்டர்ஸ் ரோடு, சென்னை அறுநூறு  பதினான்கு .",11
கல்வி_எனும்_கண்,கல்வி எனும் கண் ஒன்பது இரண்டு.,5
கல்வி_எனும்_கண்,அ.மு.ப.,3
கல்வி_எனும்_கண்,இதற்கு விளக்கம் தந்த பரிமேலழகர் இதனால் கற்கப்படும் நூல்களும் கற்குமாறும் கற்றதனால் பயனும் கூறப்பட்டன என்கிறார்.,12
கல்வி_எனும்_கண்,நாட்டில் நாம் கற்கிறோம்.,3
கல்வி_எனும்_கண்,ஆனால் கற்பவற்றை கற்க வேண்டியவற்றைக் கற்கிறோமா?,5
கல்வி_எனும்_கண்,இன்றைய கல்வி மக்கள் வாழ்க்கைக்கு சமுதாய வளர்ச்சிக்கு ஏற்றதாக உள்ளதா?,8
கல்வி_எனும்_கண்,ஆம் என்று யாராவது கூறமுடியுமா?,4
கல்வி_எனும்_கண்,"சரி, அவ்வாறு கற்பனவற்றைக் கசடுஅற பிழையறா மாசுஅற குற்றமறக் கற்கிறோமா?",8
கல்வி_எனும்_கண்,ஆனால் அந்த நிலை இல்லையே !,4
கல்வி_எனும்_கண்,"அடுத்து, கற்றபடியாவது நிற்கிறோமா?",3
கல்வி_எனும்_கண்,பெற்று இன்பமாக வாழும் நாடாகத்தானே இது இருக்கும்.,6
கல்வி_எனும்_கண்,ஆனால் அந்த இன்பம் எங்கே இருக்கிறது?,5
கல்வி_எனும்_கண்,எனவே நாட்டில் தேவையான சமுதாய வாழ்வை வளம் படுத்தும் கல்வி இல்லை என்பது கண் கூடு.,12
கல்வி_எனும்_கண்,இதை ஒருவாறு விளக்கும் வகையிலே ஒவ்வொரு பகுதியும் இந்நூலில் எழுதப்பெற்றுள்ளது.,8
கல்வி_எனும்_கண்,அக்குறைகளை நீக்க வழிகளும் ஓரளவு சுட்டப் பெறுகின்றன.,6
கல்வி_எனும்_கண்,"திருக்குறளில் பொருட்பாலில் அரசியல், தொடக்கத்தே முதல் அதிகாரமான இறைமாட்சிக்கு அடுத்த அதிகாரமாகவே கல்வி அமைகின்றது எதைக் காட்டுகிறது?",13
கல்வி_எனும்_கண்,கல்வியை தேவையான கல்வியைத் தம் மக்களுக்கு அளித்தலே அரசின் முதற் கடமை என்பதைத் தானே இது விளக்குகிறது.,13
கல்வி_எனும்_கண்,"நாட்டிலே கல்வி நலம் பெறவில்லையானால், வேறு எதுவும் நல்லமுறையில் அமையாது என அன்றுதொட்டு இன்று வரை எல்லாரும் கூறிவருகின்றனர்.",14
கல்வி_எனும்_கண்,அந்த மாநாட்டில் கூடி இருந்த அத்தனை பேரும் இன்றுவரையில் கல்வியில் நலம்பெறு மாற்றங்கள் என்ன கண்டார்கள்?,12
கல்வி_எனும்_கண்,எண்ணிப்பார்க்க இந்நூல் சுடர் விளக்காயினும் நன்றாய் விளக்கிடும் தூண்டுகோலாக அமைகின்றது.,8
கல்வி_எனும்_கண்,பண்டிதர் நேரு அவர்கள் கூறியதில் ஒரு பகுதியை இங்கே தருகிறேன்.,8
கல்வி_எனும்_கண்,"இன்று, அன்று இல்லாத வகையில் எத்தனையோ வேறுபாடுகள் முளைத்துத் தலை விரித்தாடுகின்றனவே.",9
கல்வி_எனும்_கண்,இப்போதும் இத்தகைய பல்லோர் கலந்த நலம் காணும் கூட்டங்களை இன்றைய பிரதமரும் நடத்துகிறார்.,10
கல்வி_எனும்_கண்,எல்லாவற்றினும் நல்லனவும் உண்டு அல்லனவும் உண்டு.,5
கல்வி_எனும்_கண்,பல நல்லன மாறியுள்ளன.,3
கல்வி_எனும்_கண்,அவற்றை எண்ணிப் பார்க்கவும் வேண்டியுள்ளேன்.,4
கல்வி_எனும்_கண்,"சுதந்திரம் பெற்றபின் மாநில, மத்திய அரசுகள் இக்கல்வியின் சீர்திருத்தம் பற்றியும் மாற்றம் பற்றியும் எத்தனையோ குழுக்களை அமைத்தன.",13
கல்வி_எனும்_கண்,அவையும் பலப் பல வகைகள் ஆய்ந்து பல்வேறு கருத்துக்களை ஏட்டில் வடித்துத் தந்தன.,10
கல்வி_எனும்_கண்,"சிலவற்றையும் அப்படியே இந்நூலில், சேர்த்துள்ளேன்.",4
கல்வி_எனும்_கண்,"இது எனக்கு, கல்லாத பேர்களே நல்லவர்கள் நல்லவர்கள் என்ற தாயுமானவர் அடியை நினைவூட்டிற்று.",10
கல்வி_எனும்_கண்,தாயுமானவர் கற்றும் அறிவில்லாத என் கன்மத்தை என் சொல்லுவேன் என்று நைந்து உருகியதையும் நினைக்க வேண்டியுள்ளது.,12
கல்வி_எனும்_கண்,இன்றைய மத்திய அரசும் மாநில அரசுகளும் இந்த நெறி வழியைப் பின்பற்ற வேண்டும்.,10
கல்வி_எனும்_கண்,பாடங்கள் செம்மையாக்கப் பெறவேண்டும்.,3
கல்வி_எனும்_கண்,ஆசிரியர் பட்டத்துக்கு நல்லாசிரியர் களாக அன்றி உண்மையிலேயே நல்லாசிரியர்களாகத் தம்மிடம் பயில்வாரை வாழ வைக்கவேண்டும்.,11
கல்வி_எனும்_கண்,பெற்றோர்களும் பிறவற்றைக் காட்டிலும் தம் மக்கள் கண்ணாகிய கல்வியில் நலம் பெறுவழியே உதவி செய்யவேண்டும்.,11
கல்வி_எனும்_கண்,"மாணவர்களும் இன்றைய சுற்றுப்புறச் சூழலில் சிக்காமல் கற்பன கற்று, அதன் வழி நின்று நாட்டை வளமாக்க முயலவேண்டும்.",13
கல்வி_எனும்_கண்,இந்தப் பேராசையின் காரணமாகவே நான் இந்த நூலை எழுதினேன்.,7
கல்வி_எனும்_கண்,"இதனால் நான் யாரையும் குறை கூறினேன் என்றோ, குறைத்து மதிப்பிட்டேன் என்றோ யாரும் எண்ணவேண்டாமெனக் கேட்டுக்கொள்ளுகிறேன்.",12
கல்வி_எனும்_கண்,"தமிழ்க்கலை இல்லம் சென்னை பணிவுள்ள, அ.மு.",6
கல்வி_எனும்_கண்,பரமசிவானந்தம் அச்சிடும்போது பிழைகளை ஒத்து நோக்கித் திருத்தி உதவிய பேராசிரியர் திரு சா.,10
கல்வி_எனும்_கண்,வளவன் அவர்களுக்கு என் நன்றி உரித்து.,5
கல்வி_எனும்_கண்,அ.மு.ப ﻿,4
கல்வி_எனும்_கண்,கல்வி எனும் கண் உலகம் சுழன்று வரும் வேகத்தில் மக்கள் உணர்வு ஊசலாடுகின்றது.,10
கல்வி_எனும்_கண்,பரந்த பாரதமும் அதன் அங்கமாக உள்ள தமிழகமும் நாள்தோறும் முழங்குகின்றன.,8
கல்வி_எனும்_கண்,இன்றும் மெய்ம்மையாக அன்றோ உள்ளது.,4
கல்வி_எனும்_கண்,சொல்வது ஒன்று செய்வது ஒன்று என்பது இன்றைய வழக்கமாகிவிட்டது.,7
கல்வி_எனும்_கண்,அரசியலைச் சூதாட்டம் என்பர்.,3
கல்வி_எனும்_கண்,"ஆனால் அறிவியல், ஆன்மவியல், சமூகவியல், பண்பாட்டியல் யாவுமே சூதாட்டமாகவன்றோ இன்று வடிவெடுத்து உலவுகின்றது.",10
கல்வி_எனும்_கண்,இன்று பலர் பேசுவது போன்று ஆங்கிலேயன் ஆட்சியே மேல் என்ற உணர்வு தானே பலருக்கு உண்டாகின்றது.,12
கல்வி_எனும்_கண்,"உணவிலே, உடையிலே, ஊர்ப் பயணத்திலே, உற்ற செயல்களிலே மனிதன் மாறி விட்டாலும் கவலை இல்லை.",11
கல்வி_எனும்_கண்,காலம் அவனைத் திருத்தி விடும் என நம்பலாம்.,6
கல்வி_எனும்_கண்,"சமுதாயத்தில், தன்னை ஒரு அங்கமாக்கிக்கொண்டு, தான் சமுதாயத்துக்காக வாழவேண்டியது மக்கள் நியதி.",9
கல்வி_எனும்_கண்,நாம் சமுதாயத்துக்கு உயிரினத்துக்கு இன்று என்ன செய்தோம் என அவன் இரவில் படுக்கப் போகும்போது எண்ணிப் பார்க்கக் கடமைப்பட்டவன்.,14
கல்வி_எனும்_கண்,எத்தனை பேருக்குத் தீங்கிழைத்தேன்எத்தனை பேரைக் கொலை செய்தேன் என்றல்லவா கணக்கிட்டுக் கொண்டிருக்கிறான்.,9
கல்வி_எனும்_கண்,துப்பாக்கி கலாசாரம் என்று பிறரைச் சுடுதலாகிய பண்பாடே என்று பேசுவதன்றோ இன்று நாட்டில் நடமாடுகின்றது.,11
கல்வி_எனும்_கண்,நாடாளும் மன்னர்கள் அச்சமின்றி இரவிலும்.,4
கல்வி_எனும்_கண்,இந்த நாட்டில் லஞ்சம் தாண்டவமாடாத இடம் எங்கும் இல்லை என்ற பெருமைக்கு இங்குள்ளவர்கள் வழிவகுத்து உள்ளார்களே.,12
கல்வி_எனும்_கண்,பள்ளியிலும் கல்லூரியிலும் சேர்ப்பதற்கு ஆயிரக் கணக்கிலும் இலட்சக் கணக்கிலும் வாரிக்கொட்ட வேண்டியுள்ளது.,9
கல்வி_எனும்_கண்,பல பொருள்களைப் பற்றி எண்ணம் எழுகிறது.,5
கல்வி_எனும்_கண்,இங்கே முதலில் கல்வியைப் பற்றிக் காணலாம்.,5
கல்வி_எனும்_கண்,பழங்காலத்தில் கல்வி போற்றப் பெற்றமை குருகுல வாசம் என்ற வகையால் நாம் அறிகிறோம்.,10
கல்வி_எனும்_கண்,வறிஞரான குசேலரும் அரச மைந்தனான கண்ணனும் ஒரே குருவிடம் வேறுபாடின்றிக் கற்றனர்.,9
கல்வி_எனும்_கண்,ஆனால் இன்று அந்த நிலையில்லை.,4
கல்வி_எனும்_கண்,ஆனால் இன்றைய ஆசிரியர்கள் நிலையினை எண்ணிப் பார்க்கக் கூடவில்லை.,7
கல்வி_எனும்_கண்,எங்கோ ஒரு சிலர் பழைய பண்பாட்டு நெறி மாறாமல் வாழ்கிறார்கள்.,8
கல்வி_எனும்_கண்,என்றாலும் பெரும்பாலான ஆசிரியர்கள் தாழ்வுற்றுத் தறிகெட்டுத்தானே வாழ்கிறார்கள்.,6
கல்வி_எனும்_கண்,அவர்களைப் பின்பற்றி மாணவர் நடந்தால் என்னாகும்?,5
கல்வி_எனும்_கண்,பட்டங்கள் பெறுவதிலும் எத்தனை ஏமாற்றம்.,4
கல்வி_எனும்_கண்,ருபாய் இருநூறும் முன்னூறும் தந்தால் டாக்டர் பட்டம் பெற வாய்ப்பும் உண்டே !,9
கல்வி_எனும்_கண்,இவை பற்றியெல்லாம் நாள்தோறும் நாளிதழ்களில் செய்திகளைக் காண்கின்றோமே !,6
கல்வி_எனும்_கண்,பட்டங்கள் பெறுவதைப்பற்றியும் நகைப்புக்கிடமான வகையில் பல செய்திகள் வருகின்றனவே.,7
கல்வி_எனும்_கண்,டாக்டர் பட்டம் பெறுவதற்குப் பணமே முக்கியம்.,5
கல்வி_எனும்_கண்,அதை யாராவது எந்தப் பல்கலைக் கழகமாவது மறுத்ததுண்டா?,6
கல்வி_எனும்_கண்,உண்மையை எப்படி மறுக்கமுடியும்?,3
கல்வி_எனும்_கண்,என் நூலிலும் அதுபற்றிக் குறித்துள்ளேன்.,4
கல்வி_எனும்_கண்,நான்கு ஆசிரியர் என்ற அவல நிலை அங்கில்லை.,6
கல்வி_எனும்_கண்,அவர்தம் தெளிந்த புலமையை உலகம் வியந்து போற்றுகின்றது.,6
கல்வி_எனும்_கண்,இது நம்நாட்டுப் பழக்காலக் குருகுல வாக்கையினையே நினைவூட்டுகிறதன்றோ !,6
கல்வி_எனும்_கண்,அங்கே தமிழும் அந்த வகையிலேயே பயிற்றப்பெறுகின்றது.,5
கல்வி_எனும்_கண்,"ஒளவையார் பாடல்கள் ஒன்றனையே பாடமாகப் பெற்று, ஒரே ஆசிரியரின் கீழ்ப் பட்டம் பெறப் பயின்றவரை நான் கண்டேன்.",13
கல்வி_எனும்_கண்,அப்படியே டாக்டர் பட்டம் பெறுவதும் ஆழ்ந்து பயின்று தெளிந்தாலன்றி இயலாது.,8
கல்வி_எனும்_கண்,அந்த மாணவி பதில் அளித்தார்.,4
கல்வி_எனும்_கண்,சிறந்த வகையில் அமைந்ததால் பட்டமும் பெற்றார்.,5
கல்வி_எனும்_கண்,இங்கே டாக்டர் பட்டத் தேர்விற்கு அம்மாணவரின் மேற்பார்வையாளரே முக்கிய தேர்வாளர்.,8
கல்வி_எனும்_கண்,அவருக்கு வேண்டிய வேறு இருவர் உடன் தேர்வாளர்கள்.,6
கல்வி_எனும்_கண்,பின் எதை எழுதினும் பட்டம் பெறத் தடை என்ன?,7
கல்வி_எனும்_கண்,"எங்கள் கல்லூரியில், தமிழில் முதல் வகுப்பில் தேறிய ஒருவர் தமிழாசிரியராக இருந்தார்.",9
கல்வி_எனும்_கண்,"ஒரு நாள் அவரை அழைத்து, வாக்குண்டாம் என்ற நூலைப் பற்றி ஏதேனும் தெரியுமா என்று கேட்டேன்.",12
கல்வி_எனும்_கண்,ஆமாம் வாக்குண்டாம் நல்ல மன்முண்டாம் என்ற பாடல் இருக்கிறது என்று யோசித்துச் சொன்னார்.,10
கல்வி_எனும்_கண்,ஆனால் அந்த நூலைப் பற்றியோ அதன் ஆசிரியரைப் பற்றியோ அவ்ர் எழுதிய வேறு நூல்களைப் பற்றியோ ஒன்றும் தெரியவில்லை.,14
கல்வி_எனும்_கண்,நல்லவேளை அவர்கள் இப்போது பணியில் இல்லை.,5
கல்வி_எனும்_கண்,ஒருமுறை தேர்வாணையத்தில் கல்லூரி ஆசிரியரைத் தேர்வு செய்யும் பணிக்கு அழைக்கப்பெற்றேன்.,8
கல்வி_எனும்_கண்,அங்கே வந்த ஒருவர் எம்.ஏ. வகுப்பில் சைவ இலக்கியங்களைச் சிறப்புப் பாடமாக எடுத்திருந்தார்.,11
கல்வி_எனும்_கண்,"எனவே நான் அவர்களை நோக்கி, முதல் மூன்று திருமுறைகளைப் பாடியவர் யார்?",9
கல்வி_எனும்_கண்,உடனே தயக்கமில்லாமல் திருநாவுக்கரசர் என்றார்.,4
கல்வி_எனும்_கண்,உறுப்பினர் அனைவரும் சிரித்தனர்.,3
கல்வி_எனும்_கண்,"என் பக்கத்திலிருந்த முகமதிய உறுப்பினர் ஐயா, எனக்குத் தெரிகிறதே, இவர்களுக்குத் தெரிய வில்லையே என்று வருந்தினார்.",12
கல்வி_எனும்_கண்,அந்த ஆண்டு அவரைத் தேர்வு செய்யவில்லை.,5
கல்வி_எனும்_கண்,"எனினும் அடுத்த ஆண்டு எப்படியோ இடம்பிடித்து, இப்பொழுது ஒரு கல்லூரியில் பேராசிரியராக இருக்கிறார்.",10
கல்வி_எனும்_கண்,இதுபோன்று எத்தனையோ சான்றுகள் காட்ட முடியும்.,5
கல்வி_எனும்_கண்,தமிழில் மட்டுமின்றி பிறமொழிகளிலும் பிறபாடங்களிலும் இதே நிலையினைக் காண முடிகின்றது.,8
கல்வி_எனும்_கண்,"எங்கள் கல்லூரி, பள்ளிகளுக்கு வரும் விண்ணப்பங்களைப் பார்த்தால் மயக்கம் வந்துவிடும்.",8
கல்வி_எனும்_கண்,நாடாளும் நல்லவர் இந்த நிலையினை எண்ணிப் பார்க்கவேண்டும்.,6
கல்வி_எனும்_கண்,ஆனால் ஆசிரியர் படிப்புக்கோ ஒன்றும் தேவை இல்லை.,6
கல்வி_எனும்_கண்,பல முறை தோல்வியுற்று நூற்றுக்கு முப்பத்தைந்து நாற்பது வாங்கினால் போதும் என்ற விதி உள்ளது.,11
கல்வி_எனும்_கண்,இது தருமந்தானோ? என்று வள்ளலாரைப் போன்று வாய் விட்டு அலற வேண்டியுள்ளது.,9
கல்வி_எனும்_கண்,அவர்களுக்கு களப்பணியும் செம்மையாக நடைபெறுவதில்லை.,4
கல்வி_எனும்_கண்,"ஜூலை கடைசியில் சேர்ந்து, பிப்ரவரி இறுதியில் முடித்து.",6
கல்வி_எனும்_கண்,"மார்ச்சில் தேர்வு எழுதி, பட்டம் பெற்றவர் எப்படி முதிர்ந்த அறிவுடைய பவணந்தி காட்டிய ஆசிரியராக முடியும்?",12
