work_title,sentence,sentence_length
கம்பராமாயணம்_(உரைநடை),இராமன் திருவடி பட்டதும் அவள் உயிர் பெற்று எழுந்தாள்.,7
கம்பராமாயணம்_(உரைநடை),"கல்லையும் காரிகையாக்கும் கலை, அவன் காலுக்கு இருந்தது.",6
கம்பராமாயணம்_(உரைநடை),அவள் சாப விமோசனம் பெற்றாள்.,4
கம்பராமாயணம்_(உரைநடை),ஆத்திரத்தில் முனிவர் மிகைப்பட நடந்து கொண்டார்.,5
கம்பராமாயணம்_(உரைநடை),அவரே அவளை மன்னித்து இருக்கலாம் அத்தகைய மனநிலை அவருக்கு அப்பொழுது அமைய வில்லை.,10
கம்பராமாயணம்_(உரைநடை),இராமனைக் கண்டதும் அவர் மனம் மாறியது விசுவாமித்திரர் வேறு அறிவுரை கூறினார்.,9
கம்பராமாயணம்_(உரைநடை),பொறுப்பது கடன் என்று எடுத்துக் கூறினார் அவளை மறுபடியும் சேர்த்துக் கொள்ள வேண்டினார்.,10
கம்பராமாயணம்_(உரைநடை),கவுதமர் மறுபடியும் தம் தவ வாழ்க்கையில் ஈடுபடலாயினார்.,6
கம்பராமாயணம்_(உரைநடை),தாடகை அழிவு பெற்றாள் அகலிகை வாழ்வு பெற்றாள் அவன் கைவண்ணம் அங்குப் புலப் பட்டது.,11
கம்பராமாயணம்_(உரைநடை),கால்வண்ணம் இங்கே தெரிய வந்தது என்று விசுவாமித்திரர் பாராட்டினார்.,7
கம்பராமாயணம்_(உரைநடை),கைவண்ணம் அங்குக் கண்டேன் கால்வண்ணம் இங்குக் கண்டேன் என்பது அவர் சொல்.,9
கம்பராமாயணம்_(உரைநடை),"முனிவர் பின் சென்ற இராமன், மாடத்துப் புறாவைக் கண்டு வியந்தாள்.",8
கம்பராமாயணம்_(உரைநடை),"பொன்னை ஒத்து ஒளி பொருந்திய மேனியும், மலர்க் கூந்தலும், கண்ணைக் கவரும் அழகும் அவனைக் கவர்ந்தன.",12
கம்பராமாயணம்_(உரைநடை),அக் கோதையாள் சனகன் மகள் சீதை என்பது அவனுக்குத் தெரியாது.,8
கம்பராமாயணம்_(உரைநடை),அவளுக்கும் அவ் விளைஞன் யார்?,4
கம்பராமாயணம்_(உரைநடை),என்பதும் தெரியாது அண்ணலும் நோக்கினான் அவளும் நோக்கினாள் இருவரும் மாறிப்புக்கு இதயம் எய்தினர்.,10
கம்பராமாயணம்_(உரைநடை),மாடத்தில் இருந்தவள் அவன் நெஞ்சில் குடி புகுந்தாள்.,6
கம்பராமாயணம்_(உரைநடை),முற்றத்தில் நடந்த இளைஞன் அவள் நெஞ்சில் குடி புகுந்துவிட்டாள்.,7
கம்பராமாயணம்_(உரைநடை),அவள் அவனுக்குச் செஞ்சொற்கவி இன்பமாக விளங்கினாள்.,5
கம்பராமாயணம்_(உரைநடை),"சந்திப்பு முனிவர், முன்னே நடந்தார்.",4
கம்பராமாயணம்_(உரைநடை),அவர்பின் இராமன் தொடர்ந்தான்.,3
கம்பராமாயணம்_(உரைநடை),திட்டமிட்டபடி மூவரும் சனகன் அரண்மனையை அடைந்தனர்.,5
கம்பராமாயணம்_(உரைநடை),அவன் விருந்தாளி களாய் மூவரும் அங்குத் தங்கினர்.,6
கம்பராமாயணம்_(உரைநடை),இராமன் நெஞ்சில் சீதையைச் சுமந்து அவள் நினைவாகவே இருந்தான் அவளும் இராமன் நினைவே நிறைந்தவளாய் இருந்தாள்.,12
கம்பராமாயணம்_(உரைநடை),புதிய வேட்கையில் அவர்கள் நெஞ்சங்கள் பதிந்து கிடந்தன.,6
கம்பராமாயணம்_(உரைநடை),சனகன் ஒரு பெரு வேள்வி நடத்தினான்.,5
கம்பராமாயணம்_(உரைநடை),அதில் பங்கு கொள்ள முனிவர்களும் அந்தணர்களும் வந்து சேர்ந்தனர்.,7
கம்பராமாயணம்_(உரைநடை),மாமன்னைனை மறையோர்கள் வாழ்த்தினர்.,3
கம்பராமாயணம்_(உரைநடை),விசுவாமித்திரரோடு வந்திருந்த அரசிளங்குமரர் களான இராம இலக்குவரை சனகன் கவனித்தான்.,8
கம்பராமாயணம்_(உரைநடை),"பெண்ணைப் பெற்றவன் ஆயிற்றே அதனால், அவன் கண்கள் தன் மகளுக்குத் தக்க மணாளனைத் தேடியது.",11
கம்பராமாயணம்_(உரைநடை),முருகனைப் போன்ற அழகன் தன் மருகனாக மாட்டானா?,6
கம்பராமாயணம்_(உரைநடை),யார் இந்தக் காளையர்?,3
கம்பராமாயணம்_(உரைநடை),அம் முனிவரோடு ஏன் வந்தனர்? என்று கேட்டுத் தெரிந்து கொள்ள விழைந்தான் சனகன்.,10
கம்பராமாயணம்_(உரைநடை),ஏன் அவர்களைப் பற்றி இவன் விசாரிக்க வேண்டும்?,6
கம்பராமாயணம்_(உரைநடை),மகளைத் தருவதற்கு அவன் அடி போடுகிறான் என்பதை அறிந்து கொண்டார் விசுவா மித்திரர்.,10
கம்பராமாயணம்_(உரைநடை),"இராமன் குலப் பெருமையையும், அவன் நலங்களையும் விவரித்தார்.",6
கம்பராமாயணம்_(உரைநடை),"திருமணம் குலமும் நலமும் பேரழகும் ஆற்றலும் மிக்க இராமன், சீதையை மணக்கத் தக்கவன் என்று சனகன் முடிவு செய்தான்.",14
கம்பராமாயணம்_(உரைநடை),அது ஒரு தடைக்கல் ஆக இருக்குமோ?,5
கம்பராமாயணம்_(உரைநடை),என்று கவலையுற்றான் அவனே சீதையைச் சுற்றி ஒரு முள்வேலியை அமைத்து விட்டான்.,9
கம்பராமாயணம்_(உரைநடை),அதனை அவனே எப்படி அகற்ற முடியும்?,5
கம்பராமாயணம்_(உரைநடை),வில்லை வளைத்தே இராமன் அவளை மணக்க வேண்டும் என்று முடிவு செய்தான்.,9
கம்பராமாயணம்_(உரைநடை),அதற்கு முன்னர்ச் சீதையின் பிறப்பு.,4
கம்பராமாயணம்_(உரைநடை),அவள் வளர்ப்பு இவற்றைப் பற்றி அறிவிக்க விரும்பினான்.,6
கம்பராமாயணம்_(உரைநடை),அந்த வில்லின் வரலாற்றையும் தெரிவிக்க விரும்பினான்.,5
கம்பராமாயணம்_(உரைநடை),சீதை சனகன் வளர்ப்பு மகள் அவன் மன்னனாக இருந்தும் உழவர்களைப் போலத் தானே சென்று நிலத்தை உழுது வந்தான்.,14
கம்பராமாயணம்_(உரைநடை),அவன் கலப் பையின் கொழு முனையில் தட்டுப்பட்ட செல்வக் கொழுந்து சீதை என்பதைத் தெரிவித்தார்.,11
கம்பராமாயணம்_(உரைநடை),"அவள் மண்மகள் தந்த அரிய செல்வம் அவளைச் சனகன், தன் மகள் என்றே வளர்த்து வந்தான்.",12
கம்பராமாயணம்_(உரைநடை),அவள் பேரழகைக் கண்டு அரசர் போர் எழுப்பித் தங்களுக்குள் மோதிக் கொண்டனர்.,9
கம்பராமாயணம்_(உரைநடை),"அவனாக விரும்பி, அவளை யாருக்கும் கொடுக்க முடியாத சூழ்நிலை ஏற்பட்டுவிட்டது.",8
கம்பராமாயணம்_(உரைநடை),"அமைச்சர்களுடன் கலந்து, அடுத்துச் செய்வது யாது?",5
கம்பராமாயணம்_(உரைநடை),"என்று ஆலோசித்தான் தன்னிடம் ஒரு காலத்தில் ஒப்படைக்கப்பட்ட சிவதனுசு ஒன்று, எடுப்பார் அற்று முடங்கிக் கிடந்தது.",12
கம்பராமாயணம்_(உரைநடை),கனியைப் பறிக்கக் கல் தேவைப்பட்டது.,4
கம்பராமாயணம்_(உரைநடை),கல்லை எடுத்தால்தான் அதைக் கொண்டு கனியை வீழ்த்த முடியும்.,7
கம்பராமாயணம்_(உரைநடை),அதே நிலைமைதான் இங்கு உருவாயிற்று.,4
கம்பராமாயணம்_(உரைநடை),வில்லை வளைத்தால்தான் அவளை அடைய முடியும் என்ற நிலை ஏற்பட்டுவிட்டது.,8
கம்பராமாயணம்_(உரைநடை),சீதையைத் தொடுதவதற்கு முன் இந்த வில்லின் நாணைத் தொட நேர்ந்தது.,8
கம்பராமாயணம்_(உரைநடை),"அதனால், பல்லை இழந் தவர் பலர்.",5
கம்பராமாயணம்_(உரைநடை),வில் முறிவு சிவதனுசு சீதையைப் போலவே தக்க வீரனின் கை படாமல் காத்துக் கிடந்தது.,11
கம்பராமாயணம்_(உரைநடை),வில்லை முறிக்கும் விழாவைக் காண நாட்டவர் வந்து குழுமினர்.,7
கம்பராமாயணம்_(உரைநடை),புதியவன் ஒருவன் வருகை தந்திருக்கிறான் என்ற செய்தி எங்கும் பரவியது.,8
கம்பராமாயணம்_(உரைநடை),இந்த முற்றிய வில்லால் கன்னியும் முதிர்ந்து போக வேண்டிய நிலை ஏற்படுமோ? என்று பலரும் அஞ்சினர்.,12
கம்பராமாயணம்_(உரைநடை),இந்த வில்லை முறிப்பவர் முல்லைக் கொடியாளை மணக்கலாம் என்று முன்னுரை கூறினான் சனகன்.,10
கம்பராமாயணம்_(உரைநடை),அவன் வில்லை எடுக்கச் செல்பவனைப் போல அதை நோக்கி நடந்தான்.,8
கம்பராமாயணம்_(உரைநடை),இவன் எப்படி எடுப்பான்? எடுத்தால் வில் முறியுமா அவன் இடுப்பு முறியுமா என்று பார்க்கக் காத்துக் கிடந்தனர்.,13
கம்பராமாயணம்_(உரைநடை),எடுத்தது கண்டவர் இற்றது கேட்டனர்.,4
கம்பராமாயணம்_(உரைநடை),ஒசைதான் முடிவை அவர்களுக்கு அறிவித்தது.,4
கம்பராமாயணம்_(உரைநடை),"அவன் வில்லை வளைத் ததையும், நாண் பூட்டியதையும், அவர்கள் காணவே இல்லை.",9
கம்பராமாயணம்_(உரைநடை),முறிந்த ஒசையை மட்டும் கேட்டுச் செய்தி அறிந்தனர்.,6
கம்பராமாயணம்_(உரைநடை),அது வளைக்கும் போதே இரண்டாக முறிந்து விட்டது.,6
கம்பராமாயணம்_(உரைநடை),அப்பேரொலி திக்கெட்டும் எட்டியது.,3
கம்பராமாயணம்_(உரைநடை),சீதையின் செவிகளையும் எட்டியது.,3
கம்பராமாயணம்_(உரைநடை),அவளுக்கு அது மனமுரசாக இரட்டியது.,4
கம்பராமாயணம்_(உரைநடை),நீலமாலை என்னும் பெயருடைய பேரழகி அவள் தோழி சீதையிடம் செய்தி சொல்ல ஒடோடிச் சென்றாள்.,11
கம்பராமாயணம்_(உரைநடை),தான் உப்பரிகையில் இருந்து கண்டவனே கொண்டவனாக வரப் போகிறான் என்பதில் அவள் கொண்ட மகிழ்ச்சி இரட்டிப்பு ஆகியது.,13
கம்பராமாயணம்_(உரைநடை),அவள் பன்மடங்கு பொலிந்த முகத்தினன் ஆயினள்.,5
கம்பராமாயணம்_(உரைநடை),நாட்டு மக்கள் இராமன் நலம் கண்டு வியந்தனர்.,6
கம்பராமாயணம்_(உரைநடை),நம்பியைக் காண நங்கைக்கு ஆயிரம் நயனம் வேண்டும் என்று பாராட்டினர்.,8
கம்பராமாயணம்_(உரைநடை),சீதையும் இராமனுக் கேற்ற துணைவி என்று அவள் மாட்சிகளைப் பேசினர்.,8
கம்பராமாயணம்_(உரைநடை),திருமணம் உறுதி செய்யப்பட்டது.,3
கம்பராமாயணம்_(உரைநடை),தசரதனுக்குச் செய்தி அறிவிக்கப்பட்டது.,3
கம்பராமாயணம்_(உரைநடை),"மணக் கோலத்தில் வந்த மாணலம் மிக்க பேரழகி தந்தையின் அருகில் அமர்ந்து, அம் மண்டபத்திற்குப் பெருமை சேர்த்தாள்.",13
கம்பராமாயணம்_(உரைநடை),மாடத்தில் இருந்து தான் கண்ட மாணிக்கத்தை மறுபடியும் காணும் வாய்ப்பைப் பெற அவள் விரும் பினாள்.,12
கம்பராமாயணம்_(உரைநடை),நேர்மை தவறிய இடம் இது ஒன்றுதான் என்பதைஎண்ண அவள் நாணம் அடைந்தாள்.,9
கம்பராமாயணம்_(உரைநடை),நாகரிகமாக அந்த நளினி நடந்து கொண்டதை அங்கிருந்த நங்கையர் பாராட்டினார்.,8
கம்பராமாயணம்_(உரைநடை),தாமரை மலரில் உறையும் கமலச் செல்வியே அவள் என்று அந்த முனிவர் பாராட்டினார்.,10
கம்பராமாயணம்_(உரைநடை),தசரதன் வரப்போகும் தன் மருமகளைக் கண்டதும் அவள் தனக்குக் கிடைத்த வரப்பிரசாதம் என்றே கருதினான்.,11
கம்பராமாயணம்_(உரைநடை),திரு என்பதற்கு உரு இது என்பதை அறிந்தான்.,6
கம்பராமாயணம்_(உரைநடை),"முனிவர் பாராட்டுரை ஆசானாய் வந்த விசுவாமித்திரர், பொன்னொளிர் மகளைக் கண்டதும் பொலிவுபெற்ற மனத்தினர் ஆயினர்.",11
கம்பராமாயணம்_(உரைநடை),மேனகையைக் கண்டு அவள் அழகிற்குக் குழைந்து அவர் தம் தவத்தையே பரிசாகத் தந்தவர்.,10
கம்பராமாயணம்_(உரைநடை),மேனகையைக் கண்டது காதற்பார்வை அழகு ரசனை அவரை விட வில்லை.,8
கம்பராமாயணம்_(உரைநடை),"நச்சுடை வடிக்கண் மலர் நங்கை இவள் என்றால், இச் சிலை கிடக்கட்டும் ஏழுமலையாயினும் இவளுக்காக இருக்கலாம் என்று பாராட்டினார்.",14
கம்பராமாயணம்_(உரைநடை),காதற் பெண் கடைப் பார்வையில் விண்ணையும் சாடலாம் என்ற பாரதியின் வாசகம் இந்த மாமுனிவர் பேச்சில் வெளிப்பட்டது.,13
கம்பராமாயணம்_(உரைநடை),நாள் தள்ளிப்போட அவர்களால் முடியவில்லை.,4
கம்பராமாயணம்_(உரைநடை),அடுத்த நாளே மணநாள் என்று முடிவு செய்யப்பட்டது.,6
கம்பராமாயணம்_(உரைநடை),இடையிட்ட அந்த ஒர் இரவும் காதலர் இருவர்களுக்கும் ஒருயுகமாகக் கழிந்தது.,8
கம்பராமாயணம்_(உரைநடை),"நாளும் கிழமையும் காட்டி, இளையவரைச் சேராதபடி தடுக்கும் முதியவர் செயலைச் சாடினர்.",9
கம்பராமாயணம்_(உரைநடை),மறுநாள் வருக்ைககாக எதிர்பார்த்து வாடினார்.,4
கம்பராமாயணம்_(உரைநடை),மண விழா வசிட்டர் தலைமையில் திருமணம் நடந்தேறியது.,6
கம்பராமாயணம்_(உரைநடை),தன் மகளை மருமகன் கையில் சனகன் ஒப்புவித்தான் ஆசிகள் நல்கினான்.,8
கம்பராமாயணம்_(உரைநடை),"அவள் மெல்லிய கரங்களைப் பிடித்து இராமன் கைகளில் தந்து, சடங்கின்படி அவளை ஒப்புவித்தான்.",10
கம்பராமாயணம்_(உரைநடை),அவள் மலர்க் கரங்களைப் பற்றி இராமன் அன்றுமுதல் அவள் இன்னுயிர்த் துணைவன் ஆயினான்.,10
கம்பராமாயணம்_(உரைநடை),"வாழ்த்துப் பெற்றனர் மணம் முடித்துக் கொண்ட அவர்கள், பெரியோர்களை வணங்கி வாழ்த்துரைகள் பெற்றனர் முதற்கண் கேகயன் மக.",13
கம்பராமாயணம்_(உரைநடை),மாமியர் மூவரும் மருமகளை மனமார வாழ்த்தினர்.,5
கம்பராமாயணம்_(உரைநடை),அவள் பேரழகும் பெரு வனப்பும் அவர்களைப் பெரிதும் கவர்ந்தன.,7
கம்பராமாயணம்_(உரைநடை),"அவள் மாமியர் மெச்சும் மருமகள் ஆயினள், வீட்டுக்கு வந்த திருமகள் எனப் பாராட்டிப் பேசினார்.",11
கம்பராமாயணம்_(உரைநடை),இராமன் கண்டெடுத்த அரிய அணிகலன் அவள் என ஆராதித்தனர்.,7
கம்பராமாயணம்_(உரைநடை),"சீதை மண்ணில் கிடைத்த மாணிக்கம் பூமகள் தந்த புனை கோதை, அவள் சனகன் வளர்ப்பு மகள்.",12
கம்பராமாயணம்_(உரைநடை),மற்றொருத்தி பிறப்பு மகளாக அவளுக்கு வாய்த்தாள் அவள் பெயர் ஊர்மிளை என்பது இலக்குவனை அவள் தன் இலக்காகக் கொண்டாள்.,14
கம்பராமாயணம்_(உரைநடை),சனகன் தம்பி மகளிர் இருவரை முறையே பரதனுக்கும் அவன் தம்பி சத்துருக் கனனுக்கும் மணம் முடித்தனர்.,12
கம்பராமாயணம்_(உரைநடை),"மிதிலையில் பெண்தேடு படலமும், மணம் முடிக்கும் படலமும் முடிந்தன.",7
