work_title,sentence,sentence_length
கம்பராமாயணம்_(உரைநடை),தசரதன் மாளிகை நோக்கிப் பரதன் தேரைச் செலுத்தினான்.,6
கம்பராமாயணம்_(உரைநடை),அரண்மனைக் கட்டடங்கள் விதவைக் கோலத்தை விரும்பி ஏற்றுக்கொண்டன.,6
கம்பராமாயணம்_(உரைநடை),தசரதனை அவன் கண்கள் துருவித்தேடின.,4
கம்பராமாயணம்_(உரைநடை),தசரதன் கண்கள் மூடிக்கிடந்தன.,3
கம்பராமாயணம்_(உரைநடை),இவன் வந்ததைத் தசரதன் பார்க்க இயலவில்லை.,5
கம்பராமாயணம்_(உரைநடை),தாயைக் காணச் சென்றான் அங்குப் பேய் ஒன்று நின்று பேசியது.,8
கம்பராமாயணம்_(உரைநடை),உன் தந்தைக்கு வானுலகத்தினின்று அழைப்பு வந்தது மறுக்க முடியாமல் அவர் போய்விட்டார் என்றாள்.,10
கம்பராமாயணம்_(உரைநடை),மங்கலமாகச் சொன்ன அச்சொற்களை அவனால் சுவைக்க முடியவில்லை.,6
கம்பராமாயணம்_(உரைநடை),இது முதலில் தோன்றிய மின்னல் அடுத்து இடி ஒலியும் கேட்டது.,8
கம்பராமாயணம்_(உரைநடை),முகத்திரை விலகியது முழுமதியைக் காண வில்லை பல்லவி முடிந்தது அனுபல்லவி தொடர்ந்தது.,9
கம்பராமாயணம்_(உரைநடை),உன்னை நாட்டுக்கு அரசனாக்கினேன் என் வாழ்க்கை லட்சியம் நிறைவேறிவிட்டது என்றாள்.,8
கம்பராமாயணம்_(உரைநடை),அவன் விழிகளில் வழிந்த கண்ணிர் அம் மாசினைத் துடைத்தது.,7
கம்பராமாயணம்_(உரைநடை),கருமக்கடன் செய்தல் தருமம் என்று அவன் தொடங்கினான் வசிட்டர் திருத்தம் கொண்டு வந்தார்.,10
கம்பராமாயணம்_(உரைநடை),உனக்கு அருகதை இல்லை என்றார்.,4
கம்பராமாயணம்_(உரைநடை),அந்தச் சிறு கதை என்ன? என்று கேட்டான்.,6
கம்பராமாயணம்_(உரைநடை),ஆட்சி உரிமை தந்த மன்னன் எந்த அடிப்படையில் தந்தான்?,7
கம்பராமாயணம்_(உரைநடை),அதை எப்படி இப்பொழுது மறுக்க முடியும்?,5
கம்பராமாயணம்_(உரைநடை),ஆட்சிக்கும் உரிமை இல்லை?,3
கம்பராமாயணம்_(உரைநடை),என்பது இதனால் தெளிவாகிறது அன்றோ எனத் தெளிவுபடுத்தினான்.,6
கம்பராமாயணம்_(உரைநடை),"நாள்கள் சில நகர்ந்தன ஆள்கள் வந்து அவனைச் சூழ்ந்தனர் அமைச்சர், அந்தணர், நகரமாந்தர் வசிட்டர் அவனை அணுகினர்.",13
கம்பராமாயணம்_(உரைநடை),அண்ணன் இருக்கத் தம்பி ஆட்சியை ஏற்பதில் நியாயம் இல்லை என்றான் பரதன்.,9
கம்பராமாயணம்_(உரைநடை),அவன் திண்மையைக் கண்டு நாட்டோர் திகைத் தனர் உறுதியாய் நன்மை விளையும் என்று நம்பினர்.,11
கம்பராமாயணம்_(உரைநடை),அவள் பயணம் தொடரட்டும் அதைத் தடுக்க நாம் யார்?,7
கம்பராமாயணம்_(உரைநடை),குகன் கொதித்து எழுந்தான் தன் படையைக் கொண்டு பரதன் எதிர்க்க அவற்றை அருகில் கூவி அழைத்தான்.,12
கம்பராமாயணம்_(உரைநடை),ஆழம் மிக்க இவ் ஆற்றை இவர்கள் எப்படி என் உதவி இல்லாமல் கடக்க முடியும்?,11
கம்பராமாயணம்_(உரைநடை),யானைப்படை கொண்டு வந்தால் அதைக் கண்டு நடுங்கிப்போக நான் ஒரு சிற்றெலியா?,9
கம்பராமாயணம்_(உரைநடை),படை எடுத்து அழிக்க வருகிறார்களே ! என்று வீரர்களிடம் உரை நிகழ்த்தினான்.,8
கம்பராமாயணம்_(உரைநடை),"இராமனுக்கு அன்பனாகிய குகன், இவ்வாறு பேசி நிற்பதைக் கண்ட பரதன், இவன் யார்?",10
கம்பராமாயணம்_(உரைநடை),என்று சுமந்திரனைக் கேட்டான்.,3
கம்பராமாயணம்_(உரைநடை),சுமந்திரன் அவனை அறிமுகப் படுத்தினான்.,4
கம்பராமாயணம்_(உரைநடை),இராமன் எங்கே உறங்கினான்?,3
கம்பராமாயணம்_(உரைநடை),இலக்குவன் என்ன செய்து கொண்டிருக்கிறான்? என்ற கேள்வி களைப் பரதன் கேட்டான்.,9
கம்பராமாயணம்_(உரைநடை),"அல்லை ஆண்டு அமைந்தமேனி அழகனும் அவளும் துஞ்ச, வில்லையூன்றியகையோடும் வெய்துயிர்ப் போடும் வரன், கல்லையாண்டு உயர்ந்த தோளாய் !",13
கம்பராமாயணம்_(உரைநடை),கண்கள் நீர் சொரியக் கங்குல் எல்லைகாண் பளவும் நின்றான் இமைப்பிலன் நயனம் என்றான்.,10
கம்பராமாயணம்_(உரைநடை),அழகனும் அவளும் துயில் கொள்ள இளவல் அவர்களுக்காகக் காவல் காத்தான் உறக்கம் நீத்தான் என்று குகன் விவரித்தான்.,13
கம்பராமாயணம்_(உரைநடை),நங்கையர் நடையின் அன்ன நாவாய்கள் கங்கையில் இடமே இல்லாதபடி நிறைந்துவிட்டன அவை வந்தவர் களைக் கரை ஏற்றின.,13
கம்பராமாயணம்_(உரைநடை),"தன் தம்பியும், தாயர் மூவரும், சுமந்திரனும், குகனும் ஒரே படகில் ஏறிச் சென்றனர்.",10
கம்பராமாயணம்_(உரைநடை),"குகன் கோசலையைத் தொழுது நோக்கி, இவர் யார்? என்று வினவினான்.",8
கம்பராமாயணம்_(உரைநடை),"தசரதன் முதல்தேவி, இராமன் தாய் அவனைப் பெற்றதால் அடைந்த செல்வத்தை யான் பிறந்ததால் இழந்த பெரியாள் என்றான் பரதன்.",14
கம்பராமாயணம்_(உரைநடை),அடுத்துச் சுமித்திரையை அறிமுகம் செய்தான்.,4
கம்பராமாயணம்_(உரைநடை),இராமனுக்குப் பின்பிறந்தான் என்னும் பெருமைக் குரிய இலக்குவனைப் பெற்றெடுத்த பெருமை உடையவள் இவள் என்றான்.,11
கம்பராமாயணம்_(உரைநடை),அடுத்துக் கைகேயியை அறிமுகம் செய்தான்.,4
கம்பராமாயணம்_(உரைநடை),தாய் என்பதால் இரக்கமற்ற அவளையும் குகன் கையெடுத்து வணங்கினான்.,7
கம்பராமாயணம்_(உரைநடை),தோணியை விட்டு இறங்கிய தாயர் மூவரும் சிவிகையில் ஏறினர்.,7
கம்பராமாயணம்_(உரைநடை),குகனோடு பரதன் காலால் நடந்தான்.,4
கம்பராமாயணம்_(உரைநடை),அனைவரும் பரத்துவாசர் இருப் பிடத்தை அடைந்தனர்.,5
கம்பராமாயணம்_(உரைநடை),அவர் இவர்களை இன்முகம் காட்டி வரவேற்றார்.,5
கம்பராமாயணம்_(உரைநடை),"திருவடி சூட்டிய வரலாறு பரத்துவாசர், ஆள்வதை விட்டுக் காட்டுக்கு வந்தது ஏன்? என்றார்.",10
கம்பராமாயணம்_(உரைநடை),முனிவர் மனம் குளிர்ந்தது சேனையையும் மற்றவர்களையும் வரவேற்று உபசரித்தார்.,7
கம்பராமாயணம்_(உரைநடை),அவனை ஆற்றுவது இராமனுக்கு அரும்பாடு ஆயிற்று.,5
கம்பராமாயணம்_(உரைநடை),நம் குலத்து உதித்தவர் இதுவரை தவறே செய்ததில்லை.,6
கம்பராமாயணம்_(உரைநடை),அறம் நெகிழ்ந்தது இல்லை.,3
கம்பராமாயணம்_(உரைநடை),பரதன் நீதி நெறியினின்று நிலை குலையான்.,5
கம்பராமாயணம்_(உரைநடை),அவன் இங்கு வருவது ஆட்சியைத் தரவே தவிர மாட்சிமை நீங்கிப் போரைத் தொடுக்க அல்ல என்று விளக்கினான்.,13
கம்பராமாயணம்_(உரைநடை),படையை நிறுத்திவிட்டுப் பரதனும் தன் தம்பி சத்துருக்கனனோடு முந்திச் சென்றான்.,8
கம்பராமாயணம்_(உரைநடை),இறந்த தந்தையை எதிர் கண்டதுபோலப் பரதன் இராமனைச் சந்தித்தான்.,7
கம்பராமாயணம்_(உரைநடை),அறத்தை நினைத்தாய் இல்லை அருளையும் நீத்தாய் முறைமையைத் துறந்தாய் என்று கூறி இராமன் அடிகளில் விழுந்து வணங்கினான்.,13
கம்பராமாயணம்_(உரைநடை),அறத்தைத் தழுவியதுபோல இராமன் பரதனைத் தழுவினான் அவன் புனைந்த வேடத்தைப் பன் முறை நோக்கினான்.,11
கம்பராமாயணம்_(உரைநடை),துயருற்ற நிலையில் அயர்ச்சி கொண்டுள்ளாய் தந்தை வலியனோ? என்று கேட்டான்.,8
கம்பராமாயணம்_(உரைநடை),பகை மன்னர்க்குச் சிங்க ஏறு போன்றவனே !,5
கம்பராமாயணம்_(உரைநடை),இனி வாய்மைக்கு யார் இருக்கிறார்கள்?,4
கம்பராமாயணம்_(உரைநடை),ஆட்சித் தலைமை இறக்கி வைத்து விட்டு நீ விரும்பிய ஒய்வு இதுதானா? !,9
கம்பராமாயணம்_(உரைநடை),இதுதானா நீ செய்ய நினைத்த தவம்? என்று கதறினான்.,7
கம்பராமாயணம்_(உரைநடை),"இராமனை வசிட்டர் தேற்றத் தொடங்கினார் பரத்துவாசரும், மற்றைய முனிவர்களும், அமைச்சர்களும், அரசர்களும், சேனைகளும் வந்து சூழ்ந்து கொண்டனர்.",13
கம்பராமாயணம்_(உரைநடை),அவர்கள் கூறிய ஆறுதல் மொழிகள் அவலத்தைத் தணித்தன.,6
கம்பராமாயணம்_(உரைநடை),அவர்கள் இறுதிக் கடனை அவன் செய்கையால் செய்ய வேண்டினர்.,7
கம்பராமாயணம்_(உரைநடை),இராமன் புனலிடை மூழ்கினான் சடங்கின்படி தருப்பண நீரை எடுத்துவிட்டான் பின் பர்ண சாலைக்குச் சென்றான்.,11
கம்பராமாயணம்_(உரைநடை),உடன் சென்ற பரதன் சீதையின் கால்களில் விழுந்து அரற்றினான் சீதை அவனை எடுத்து ஆற்றினாள்.,11
கம்பராமாயணம்_(உரைநடை),நாயகன் என் நெடிய பிரிவினால் துஞ்சினான் என்று சீதைக்கு இராமன் உரைத்தான்.,9
கம்பராமாயணம்_(உரைநடை),"அவளை முனிபத்தினிகள் கங்கையில் முழுக வைத்துத் தேற்றித் துயரம் நீக்கி, இராமனிடம் சேர்ப்பித்தனர்.",10
கம்பராமாயணம்_(உரைநடை),இறுதிச் சுற்று தந்தை செய்த தவறும் தாய் செய்த கேடும் நீ ஆட்சி ஏற்றால் மாறும் என்றான் பரதன்.,14
கம்பராமாயணம்_(உரைநடை),அதை உனக்கு வழங்குகிறேன் மன்னா !,4
கம்பராமாயணம்_(உரைநடை),நீ மகுடம் சூடுக என்றான் பரதன்.,5
கம்பராமாயணம்_(உரைநடை),நீ அறிவாளி என்னை மடக்கி விட்டாய் ஆட்சியை ஏற்கிறேன்.,7
கம்பராமாயணம்_(உரைநடை),பதினான்கு ஆண்டுகள் பொறுத்துக் கொள் அதுவரை என் கட்டளை ஏற்று அரசு ஆள்வாய் !,10
கம்பராமாயணம்_(உரைநடை),இது நான் உனக்கிடும் ஆணை மறுக்காதே என்றான் இராமன்.,7
கம்பராமாயணம்_(உரைநடை),வசிட்டர் இராமன் ஆட்சியை ஏற்றுத்தான் ஆக வேண்டும் என்று வற்புறுத்தினார் சூரிய குலத்து மன்னர்கள் முறை பிறழ்ந்தது இல்லை.,14
கம்பராமாயணம்_(உரைநடை),"மேலும் நான் தந்தையைப்போல மதிக்கத் தக்கவன், ஆசான், ஆசான் சொல்லைத் தட்டாதே !",9
கம்பராமாயணம்_(உரைநடை),யான் இடும் ஆணையை ஏற்று உனக்கு உரிய நாட்டைப் பாதுகாப்பாய் என்று கூறித் தன்னைத் தாழ்த்திக் கொண்டார்.,13
கம்பராமாயணம்_(உரைநடை),அம் முனிவனைத் தொழுது அறிஞ !,4
கம்பராமாயணம்_(உரைநடை),"முனிவன் உரைத்தும் அவன் ஏற்கவில்லை என் பதை அறிந்த பரதன், முடிவாகத் தன் கருத்தைக் கூறினான்.",12
கம்பராமாயணம்_(உரைநடை),அப்படியானானல் நாட்டை ஆள்பவர் ஆளட்டும் நான் காட்டை மேவுதல் உறுதி என்றான்.,9
கம்பராமாயணம்_(உரைநடை),"அது என் உரிமை, இதை யாரும் தடுக்க முடியாது என்ற பரதன் உறுதியாக நின்றான்.",11
கம்பராமாயணம்_(உரைநடை),வானவரும் என்ன ஆகுமோ? என்று அஞ்சினர்.,5
கம்பராமாயணம்_(உரைநடை),"தெய்வத் திருவுளமும், அங்கு கூடியிருந்தவர் கருத்தும் பரதன் ஆட்சியை ஏற்று நடத்துவதே தக்கது என்ற முடிவுக்கு வந்தனர்.",13
கம்பராமாயணம்_(உரைநடை),மறுபடியும் இராமன் பரதனை அன்புடன் கேட்டுக் கொண்டான்.,6
கம்பராமாயணம்_(உரைநடை),என் ஆணையால் பாரினை ஆள்க என்றான்.,5
கம்பராமாயணம்_(உரைநடை),இராமன் உறுதிமொழி தந்தான்.,3
கம்பராமாயணம்_(உரைநடை),அதற்குமேல் பேச முடியாமல் நின் திருவடி நிலைகளை ஈக என்று கேட்டான்.,9
கம்பராமாயணம்_(உரைநடை),இராமன் தன் பாதுகைகள் இரண்டனையும் அவனுக்குத் தந்தான்.,6
கம்பராமாயணம்_(உரைநடை),பரதன் அழுத வண்ணம் பாதுகை இரண்டையும் தரையில் வைத்து வணங்கினான் மணி முடிகளாய் அவற்றைத் தலையில் தாங்கிக் கொண்டான்.,14
கம்பராமாயணம்_(உரைநடை),அவற்றை வணங்கி வழிபட்டு இராமன் ஆட்சியைப் பரதன் அங்கு இருந்து நடத்தினான்.,9
கம்பராமாயணம்_(உரைநடை),"ஆரணிய காண்டம் அடவியை அடைந்த இராமன், அறிவும் ஆசாரமும் மிக்க தவசிகளின் விருந்தினாய்த் தங்கி வந்தான்.",12
கம்பராமாயணம்_(உரைநடை),"அத்திரி முனிவர் என்பவர் அவனை இன்முகம் காட்டி, இனிதுரை வழங்கி, நல் விருந்து அளித்தார்.",11
கம்பராமாயணம்_(உரைநடை),"வஞ்சனை மிக்க அவன் செயலை அஞ்சன வண்ணனாகிய இராமன் எதிர்த்து, அம்பு எய்து, அவளை விலக்கி அவனை எதிர்த்தான்.",14
கம்பராமாயணம்_(உரைநடை),படைகள் அவனைத் தொடவில்லை படைக் கருவியால் அழிவு பெறாத வரங்களை பிரமணிடம் வாங்கி இருந்தான்.,11
கம்பராமாயணம்_(உரைநடை),மராமரம் ஒன்றை அவன் இராமன்மீது வீசினான்.,5
கம்பராமாயணம்_(உரைநடை),அது அவன் கைக்குச் சிக்கி வேரோடு பட்டது கிளையோடு கெட்டது.,8
கம்பராமாயணம்_(உரைநடை),வாள்கொண்டு அவன் தோள்களை வெட்டினான் இராமன் வெட்டிய தோள்கள் மறுபடியும் ஒட்டிக் கொண்டன.,10
கம்பராமாயணம்_(உரைநடை),அவன் தோள்கள்மீது ஏறி இருவரும் அமர்ந்தனர்.,5
கம்பராமாயணம்_(உரைநடை),அவன் அவர்களை உலகம் சுற்றும் வாலிபர்களாக்கினான்.,5
கம்பராமாயணம்_(உரைநடை),கருடன்மீது அமரும் திருமால் போல் இராமனும் இலக்குவனும் காட்சி அளித்தனர்.,8
கம்பராமாயணம்_(உரைநடை),வேறு வழியின்றி அவனை வெட்டிக் குழி தோண்டி மண்ணில் புதைத்தனர்.,8
கம்பராமாயணம்_(உரைநடை),விண்ணில் அவன் தேவ கந்தருவனாய்க் காட்சி அளித்தான்.,6
கம்பராமாயணம்_(உரைநடை),கலைஞன் காமுகன் ஆனான்.,3
கம்பராமாயணம்_(உரைநடை),"இதையறிந்து அளகை வேந்தனாகிய குபேரன், அவனை அரக்கனாகுக என்று சாபமிட்டான்.",8
கம்பராமாயணம்_(உரைநடை),தேவனாகப் பிறந்தவன் அரக்க குணம் கொண்டு அழிவுப் பாதையை அடைந்தான்.,8
கம்பராமாயணம்_(உரைநடை),இராமன் திருவடி தீண்டப்பட்டதால் அவனுக்குச் சாப விமோசனம் கிடைத்தது காந்தருவனாய் மாறினான் நன்றி நவின்றுவிட்டு விண்ணுலகில் மறைந்தான்.,13
கம்பராமாயணம்_(உரைநடை),இதுவும் கருத்துள்ள கதையாகும்.,3
