work_title,sentence,sentence_length
கேள்வி_நேரம்,கேள்வி நேரம் குழந்தைக் கவிஞர் அழ.,5
கேள்வி_நேரம்,﻿கேள்வி நேரம் தொகுத்தவர் குழந்தைக் கவிஞர் அழ.,6
கேள்வி_நேரம்,இதில் மொத்தம் பதினொன்று  பகுதிகள் உள்ளன.,5
கேள்வி_நேரம்,"ஒவ்வொரு பகுதியிலும், பெரியவர்களில் ஒருவர் கேள்வி கேட்க, மூன்று நான்கு சிறுவர், சிறுமியர் பதில் கூறுகிறார்கள்.",12
கேள்வி_நேரம்,"மொத்தம் பதினொன்று  பெரியவர்களும், முப்பத்தெட்டு சிறுவர் சிறுமியரும் பங்கு எடுத்துக் கொண்டுள்ளனர்.",9
கேள்வி_நேரம்,"வரலாறு, புவிஇயல், விஞ்ஞானம், விளையாட்டு, நுண்கலைகள், தலைவர்களைப் பற்றிய செய்திகள் எனப் பலவற்றையும் இப்புத்தக வாயிலாக அறியலாம்.",13
கேள்வி_நேரம்,"வெறும் கேள்வி பதிலாக இல்லாமல், விடைகளுடன் தேவையான விளக்கங்களையும் காணலாம்.",8
கேள்வி_நேரம்,இதிலுள்ள பகுதிகள் அனைத்தும் கோகுலம் மாத இதழில் தொடர்ந்து வெளி வந்தவையே.,9
கேள்வி_நேரம்,"பழனிவேலு உமா விஜி கனகசபை, யாழினி எஸ்.",6
கேள்வி_நேரம்,லிங்கராஜ் அலமேலு அழகப்பன் எஸ்.,4
கேள்வி_நேரம்,கே. சரவணன் பால நடராஜன் சி.,5
கேள்வி_நேரம்,"பத்மஜா, ம. இராஜலெட்சுமி, கி.",4
கேள்வி_நேரம்,சுப்பிரமணியன் டாக்டர் மா.,3
கேள்வி_நேரம்,"சூடாமணி குமார், சீதாராமன், ராஜேஸ்வரி, சுப்பிரமணியம், ஆனந்த் பி.",7
கேள்வி_நேரம்,"பத்மா கே. வரதராஜன், பமீலா நாராயணன், ஆர்.",6
கேள்வி_நேரம்,"மூன்று ஆயிரத்து எண்பத்தைந்து ஒன்று பொன்ராசன் பிள்ளைத் தமிழ் என்றால் என்ன, தெரியுமா?",10
கேள்வி_நேரம்,எங்களைப் போன்ற பிள்ளைகளுக்காக எழுதப்படும் தமிழ்தானே?,5
கேள்வி_நேரம்,"பொன் இல்லை, இல்லை.",3
கேள்வி_நேரம்,வேறு யாருக்காவது தெரியுமா?,3
கேள்வி_நேரம்,பழனிவேலு பிள்ளைத் தமிழ் என்றால் கடவுளைப் பிள்ளையாக வைத்துப் பாடியது என்று கேள்விப்பட்டிருக்கிறேன்.,10
கேள்வி_நேரம்,மீனாட்சியம்மை பிள்ளைத் தமிழ் என்பதுகூட அப்படிப்பட்டதுதானே?,5
கேள்வி_நேரம்,"கடவுளைப் பற்றி மட்டுமல்ல தங்களுக்கு விருப்பமான அரசர்கள், தலைவர்களைப் பற்றிக்கூடக் கவிஞர்கள் பாடியிருக்கிறார்கள்.",10
கேள்வி_நேரம்,"கம்பன் பிள்ளைத் தமிழ், காந்தி பிள்ளைத் தமிழ் என்றெல்லாம் பல பிள்ளைத் தமிழ் நூல்கள் உண்டு.",12
கேள்வி_நேரம்,"சரி, தமிழில் முதலாக வெளி வந்த நாவல் எது?",7
கேள்வி_நேரம்,அதை எழுதியவர் பெயர் என்ன?,4
கேள்வி_நேரம்,ராஜேஷ் பிரதாப முதலியார் எழுதிய வேத நாயகம் பிள்ளை சரித்திரம்.,8
கேள்வி_நேரம்,ராஜேஷ் மாற்றிச் சொல்லிவிட்டானே !,3
கேள்வி_நேரம்,வேதநாயகம் பிள்ளை எழுதிய பிரதாப முதலியார் சரித்திரம் என்பதுதானே சரியான விடை?,9
கேள்வி_நேரம்,கார்த்தியாயினி சரியாகச் சொல்லிவிட்டாள்... காந்தி திரைப்படம் பார்த்திருப்பீர்கள்.,6
கேள்வி_நேரம்,எத்தனை பேர் காயம் அடைந்திருப்பார்கள்?,4
கேள்வி_நேரம்,பழனி நாநூறு  பேர் இறந்திருப்பார்களா?,4
கேள்வி_நேரம்,ராஜாத்தி சமீபத்தில் நான் ஒரு புத்தகத்தில் படித்தேன்.,6
கேள்வி_நேரம்,"முன்னூற்று எழுபத்தொன்பது பேர் சுட்டுக் கொல்லப்பட்டதாகவும், ஓர் ஆயிரத்து இருநூறு  பேர் காயமடைந்ததாகவும் அதில் எழுதியிருந்தது.",12
கேள்வி_நேரம்,"பொன் சபாஷ் ராஜாத்தி, படித்ததை நன்றாக நினைவில் வைத்திருக்கிறாயே !...",7
கேள்வி_நேரம்,சென்னையில் கிரிக்கெட் டெஸ்ட் பந்தயங்கள் நடக்கும் ஸ்டேடியத்தின் பெயர் தெரியுமா?,8
கேள்வி_நேரம்,ராஜேஷ் எனக்குத்.தெரியும்.,3
கேள்வி_நேரம்,சென்னைப் பல்கலைக் கழகத்திற்குப் பக்கத்திலுள்ள சிதம்பரம் ஸ்டேடியத்தில்தான் கிரிக்கெட் டெஸ்ட் பந்தயங்கள் நடைபெறுகின்றன.,10
கேள்வி_நேரம்,உலகிலேயே அதிகமான பன்றிகள் உள்ள தேசம் எது?,6
கேள்வி_நேரம்,பொன் ராஜேஷ் மிகவும் சரியாகச் சொல்லி விட்டான்.,6
கேள்வி_நேரம்,கார்த்தியாயினி ராஜாஜி பொன் இல்லை.,4
கேள்வி_நேரம்,பழனி ஈ. வெ.,3
கேள்வி_நேரம்,"பொன் அடே, சரியாகச் சொல்லி விட்டாயே.. !",5
கேள்வி_நேரம்,இந்தியாவிலே பனை மரங்கள் அதிகமாக உள்ள மாநிலங்களைக் கூற முடியுமா?,8
கேள்வி_நேரம்,ராஜாத்தி நமது தமிழ்நாட்டில்தான் நிறையப் பனை மரங்களைப் பார்க்கிறோமே?,7
கேள்வி_நேரம்,"பொன், தமிழ்நாட்டில் மட்டும்தானா?",3
கேள்வி_நேரம்,இன்னும் இரண்டு மாநிலங்களிலும் நிறையப் பனை மரங்கள் இருக்கின்றனவே !,7
கேள்வி_நேரம்,﻿ கார்த்தியாயினி ஆந்திர மாநிலம்.... அப்புறம்.,5
கேள்வி_நேரம்,அப்புறம்... பொன் மேற்கு வங்காளத்திலும் அதிகமான பனை மரங்களைக் காணலாம்.,8
கேள்வி_நேரம்,சரி... இதோ இந்தப் படத்தில் இருப்பவர் யார் என்று தெரிகிறதா?,8
கேள்வி_நேரம்,"பொன் இல்லை, நம் இந்தியாவின் தலைசிறந்த தேச பக்தர்களில் ஒருவர்.",8
கேள்வி_நேரம்,சுயராஜ்ஜியம் என்ற சொல்லை முதல் முதலாகப் பயன்படுத்தியவர்... இன்னுமா தெரியவில்லை?,8
கேள்வி_நேரம்,கார்த்தியாயினி தாதாபாய் நெளரோஜி.,3
கேள்வி_நேரம்,பொன் சரியான விடை.,3
கேள்வி_நேரம்,பிரிட்டிஷ் பாராளுமன்றத்திற்கு முதல் முதலாகத் தேர்ந்தெடுக்கப் பெற்ற இந்தியர் இவர்தான்.,8
கேள்வி_நேரம்,பழைய டில்லியில் யமுனை ஆற்றங்கரையில் நம் தேசத் தந்தை மகாத்மா காந்தியின் சமாதி இருக்கிறது.,11
கேள்வி_நேரம்,அதன் அருகிலே வேறு இரு தலைவர்களின் சமாதிகளும் இருக்கின்றன.,7
கேள்வி_நேரம்,"அந்தத் தலைவர்கள் யார், யார்?",4
கேள்வி_நேரம்,"பழனி நேரு மாமா, இன்னொருவர்... ராஜாத்தி லால் பகதூர் சாஸ்திரி.",8
கேள்வி_நேரம்,பொன் இருவரும் சேர்ந்து சரியான விடையளித்து விட்டீர்கள்.,6
கேள்வி_நேரம்,குடல் காய்ச்சல் என்றால் என்ன?,4
கேள்வி_நேரம்,"பொன் ஆம், தமிழ்நாட்டில் சில பகுதிகளில் அப்படித்தான் சொல்கிறார்கள்.",7
கேள்வி_நேரம்,"குடலை அதிகமாகப் பாதிக்கும் காய்ச்சலாதலால்... ராஜாத்தி தெரியும், தெரியும்.",7
கேள்வி_நேரம்,"பொன் ரொம்ப சரி, உலகிலேயே மிகப்பெரிய ரயில்வே ஸ்டேஷன் எங்கே இருக்கிறது?",9
கேள்வி_நேரம்,பழனி ஜப்பானில் பொன் இல்லை.,4
கேள்வி_நேரம்,ராஜேஷ் அமெரிக்காவில் பொன்.,3
கேள்வி_நேரம்,"அதுசரி, அமெரிக்காவில் எந்த நகரத்தில்...?",4
கேள்வி_நேரம்,ராஜேஷ் நியூயார்க் நகரத்தில்.,3
கேள்வி_நேரம்,திருக்கொடுங்குன்றம் என்ற ஊர்ப் பெயரை உங்களில் யாராவது கேள்விப்பட்டதுண்டா?,7
கேள்வி_நேரம்,பழனி நான் கேள்விப்பட்டிருக்கிறேன்.,3
கேள்வி_நேரம்,பிரான் மலைக்கு அப்படி ஒரு பெயர் உண்டாம்.,6
கேள்வி_நேரம்,"பொன் அடே, சரியாகச் சொல்லிவிட்டாயே !",4
கேள்வி_நேரம்,அங்குள்ள முருகனை அருணகிரிநாதர் பாடியிருக்கிறார்.,4
கேள்வி_நேரம்,மிளகாயை நம் நாட்டில் பரப்பியவர்கள் யார்?,5
கேள்வி_நேரம்,போர்த்துகீசியர்கள் தான் பொன் சரியான பதில்.,5
கேள்வி_நேரம்,"பழனி தங்கப் பதக்கம், வெள்ளிப் பதக்கம் இரண்டையும் சேர்த்துச் சொல்ல வேனுமா?",9
கேள்வி_நேரம்,பொன் வெண்கலப் பதக்கத்தை விட்டு விடலாமா?,5
கேள்வி_நேரம்,"தங்கம், வெள்ளி, வெண்கலம் மூன்றையும் சேர்த்துச் சொல்லுங்கள் பழனி தங்கப் பதக்கங்கள் பதிமூன்று  வெள்ளி பத்தொன்பது , வெண்கலம் இருபத்தைந்து.",14
கேள்வி_நேரம்,ஆக மொத்தம் ஐம்பத்தேழு.,3
கேள்வி_நேரம்,இல்வளவு சரியாகச் சொல்கிறாயே !,3
கேள்வி_நேரம்,"ஆடிப்பெருக்கு என்கிறார்களே, அதுபற்றித் தெரியுமா?",4
கேள்வி_நேரம்,"ராஜாத்தி ஆடிமாதம் முதல் முதலாக ஆறுகளில் நீர் பெருகி வருமே, அதைத்தான் ஆடிப் பெருக்கு என்கிறார்கள்.",12
கேள்வி_நேரம்,வியாசர் சமஸ்கிருதத்தில் எழுதினார்.,3
கேள்வி_நேரம்,பொன் சரியான விடை அதைத் தழுவித் தமிழில் யார் யார் எழுதினார்கள்?,9
கேள்வி_நேரம்,பொன் இன்னொருவரும் எழுதியிருக்கிறார்.,3
கேள்வி_நேரம்,என்று போட்டிருப்பார்கள் பார்த்திருக்கிறீர்களா?,3
கேள்வி_நேரம்,அதற்கு என்ன பொருள்?,3
கேள்வி_நேரம்,... சமீபத்தில் நான் ஒரு கதை படித்தேன்.,5
கேள்வி_நேரம்,அமாவாசை இரவிலே ஒரு சிறுவன் விளக்கில்லாமல் சைக்கிளில் செல்கிறான்.,7
கேள்வி_நேரம்,எதிரே ஒருவர் ஒற்றை மாட்டு வண்டியை மிக மெதுவாக ஒட்டி வருகிறார்.,9
கேள்வி_நேரம்,"வேறு ஆட்களோ, கார், வண்டிகளோ அந்தச் சாலையில் இல்லை.",7
கேள்வி_நேரம்,இருட்டிலே எதிரே வண்டி வருவது தெரியாமல் அவன் சைக்கிளை ஒட்டிச் செல்கிறான்.,9
கேள்வி_நேரம்,"நல்ல வேளையாக, வண்டிக்குச் சிறிது துரத்தில் செல்லும்போதே, மாட்டின் கண்களில் பளபள என்ற ஒளி தெரிகிறது.",12
கேள்வி_நேரம்,"அதைக் கண்டு, அவன் சைக்கிளை ஒர் ஒரமாக ஒட்டித் தப்பித்துக் கொள்கிறான் இப்படி அவர் எழுதியிருப்பதில் ஒரு தவறு.",14
கேள்வி_நேரம்,பழனி இருட்டிலே மாட்டின் கண்களிலே எப்படி ஒளி தெரியும்?,7
கேள்வி_நேரம்,"அதன் முகத்திலே ஒளி பட்டால்தானே, கண் பளபளப்பாகத் தெரியும்?",7
கேள்வி_நேரம்,அங்குதான் வெளிச்சம் படுவதற்கு வழியே இல்லைய பொன் அடேடே !,7
கேள்வி_நேரம்,மிகவும் நன்றாகச் சொன்னாய்.,3
கேள்வி_நேரம்,இரவிலே மாட்டின் கண்களில் தானாக ஒளி தெரியாது.,6
கேள்வி_நேரம்,"ஏதேனும் வெளிச்சம் பட்டால், பளபளப்பான அதன் கண்களில் ஒளி பிரதிபலிக்கும்.",8
கேள்வி_நேரம்,"எங்கே சரியான பதில் சொல்லுங்க, பார்க்கலாம்.",5
கேள்வி_நேரம்,கப் அண்ட் சாசரிலே கப் இருக்குதே அதுதான் கோப்பை அதன் கைப்பிடி எந்தப் பக்கம் இருக்கும்?,12
கேள்வி_நேரம்,விஜி வலது பக்கம்.,3
கேள்வி_நேரம்,"கனகசபை இல்லை, இடது பக்கம்.",4
கேள்வி_நேரம்,யாழினி இரண்டும் தப்பு.,3
கேள்வி_நேரம்,வெளிப் பக்கம் தான் இருக்கும்.,4
கேள்வி_நேரம்,வெளிப் பக்கம்னு நீ சொன்னது தான் சரி.,6
கேள்வி_நேரம்,"அதனாலே, யாழினி வெளிப் பக்கம்னு சொன்னதுதான் சரி.",6
கேள்வி_நேரம்,"விஜி, நீ கிளி பார்த்திருக்கிறாயா?",4
கேள்வி_நேரம்,உமா எங்கே பார்த்திருக்கிறாய்?,3
கேள்வி_நேரம்,விஜி மரத்தடியிலே கிளி ஜோஸ்யம் சொல்றாரே அவருக்கிட்டே பார்த்திருக்கிறேன்.,7
கேள்வி_நேரம்,"உமா சரி, கிளியினுடைய ஒரு காலில் எத்தனை விரல்கள் இருக்கும்?",8
கேள்வி_நேரம்,"யாழினி நாலு, உமா அதுவும் இல்லேன்னா மூனுன்னு சொல்லுவீங்க.",7
கேள்வி_நேரம்,"ஆனால், நாலுங்கிறதுதான் சரி... போகட்டும்.",4
கேள்வி_நேரம்,அந்த நாலு விரல்களிலே முன்னாலே எத்தனை விரல்கள் இருக்கும்?,7
கேள்வி_நேரம்,பின்னாலே எத்தனை விரல்கள் இருக்கும் விஜி முன்னாலே ஒண்னு.,7
கேள்வி_நேரம்,"உமா தப்பு, தப்பு.",3
கேள்வி_நேரம்,யாழினி நான் சொல்லட்டுமா?,3
கேள்வி_நேரம்,முன்னாலே மூணு பின்னாலே ஒண்ணு.,4
கேள்வி_நேரம்,"உமா யாழினி, நீ சொன்னதும் தப்பு.",5
கேள்வி_நேரம்,"முன்னாலே இரண்டு பின்னாலே இரண்டு விரல்களிருக்கும்... விஜி, இன்னொரு தடவை கிளி ஜோஸ்யர்கிட்டே போய் நல்லாப் பார்த்துட்டு வா.",14
கேள்வி_நேரம்,உமா இன்னொரு கேள்வி.,3
கேள்வி_நேரம்,உமா இல்ல கனகசபை பேனா உமா இல்லை.,6
கேள்வி_நேரம்,விஜி நான் சொல்றேன்.,3
கேள்வி_நேரம்,"உமா விஜி, நீ இந்தக் கேள்விக்கு இரண்டாம் தடவையாய்ப் பதில் சொல்கிறாய்.",9
கேள்வி_நேரம்,இப்பவா வது சரியாச் சொல்லு.,4
கேள்வி_நேரம்,விஜி சரியாச் சொல்லிட்டாள்.,3
கேள்வி_நேரம்,அடுத்ததாக ஒரு கேள்வி.,3
கேள்வி_நேரம்,ஆகாயத்திலே பிறைச் சந்திரன் தெரியுது.,4
கேள்வி_நேரம்,"பார்த்தவுடனே அது வளர் பிறையா, தேய்பிறையா என்று எப்படிக் கண்டுபிடிப்பீங்க?",8
கேள்வி_நேரம்,"கனகசபை வளர்பிறையாக இருந்தால், கீழே இருந்து மேல் பக்கமா படகு போல் வளைஞ் சிருக்கும்.",11
கேள்வி_நேரம்,தேய்பிறையாக இருந்தால் மேல் பக்கத்திலே யிருந்து கீழ்ப்பக்கமா குடை போல் வளைஞ்சு இருக்கும்.,10
கேள்வி_நேரம்,"உமா அடே, கனகசபை உடனே சொல்லிட்டானே !",5
கேள்வி_நேரம்,இப்போது ஒரு கணக்கு.,3
கேள்வி_நேரம்,ஆறு மணி அடிக்க முப்பது விநாடிகள் ஆகுது.,6
கேள்வி_நேரம்,பனிரண்டு  மணி அடிக்க எத்தனை விகாடிகள் ஆகும்?,6
கேள்வி_நேரம்,யாழினி அறுபது விநாடிகள்.,3
கேள்வி_நேரம்,"விஜி அறுபத்து மூன்று விநாடிகள் உமா கனகசபை, உனக்குத் தெரியுமா?",8
கேள்வி_நேரம்,"கனகசபை நீங்களே சொல்லிடுங்க அக்கா, உமா ஒன்றுக்கும் ஆறுக்கும் உள்ள இடை வெளிகள் ஐந்து.",11
கேள்வி_நேரம்,ஐந்து இடை வெளிகளுக்கு முப்பது விநாடிகள் என்றால் ஒரு இடைவெளிக்கு எத்தனை விநாடிகள்?,10
கேள்வி_நேரம்,விஜி ஆறு விநாடிகள்.,3
கேள்வி_நேரம்,உமா அதே போலத்தானே ஒன்றுக்கும் ்கும் உள்ள இடைவெளிகளைத் தெரிந்து கொண்டு... யாழினி தெரியும் தெரியும்.,12
கேள்வி_நேரம்,பதினொரு இடை வெளிகள்.,3
கேள்வி_நேரம்,"உமா ஆம், சரியான விடை அறுபத்தாறு விநாடிகள்தான் !",6
கேள்வி_நேரம்,இப்போது வேறொரு விதமான கேள்வி.,4
