work_title,sentence,sentence_length
கள்வர்_குகை,"மறைந்து மறைந்து அந்த இடத்திற்குப் போய் மரத்தின் பின் ஒளிந்து கொண்டு, நடப்பதைக் கவனித்தான்.",11
கள்வர்_குகை,பிறகு அவன் அந்தக் கால்வாயை நோக்கி நடந்தான்.,6
கள்வர்_குகை,சென்ற பிறகு தம்பி மெதுவாக வெளியில் வந்தான்.,6
கள்வர்_குகை,சுற்றுமுற்றும் ஒருமுறை பார்த்துக் கொண்டான்.,4
கள்வர்_குகை,"அந்த அடியில் இருந்த கல்லை அழுத்திக்கொண்டு, மேலேயிருந்த பாறாங்கல்லைப் புரட்டினான்.",8
கள்வர்_குகை,உள்ளே ஒரே இருட்டாக இருந்தது.,4
கள்வர்_குகை,கொஞ்ச தூரம் தட்டித் தடவியபடி நடந்து சென்றான்.,6
கள்வர்_குகை,பிறகு எங்கிருந்தோ வெளிச்சம் வந்தது.,4
கள்வர்_குகை,அந்தக் குகை முழுவதும் தகதகவென்று ஒளிவீசியது.,5
கள்வர்_குகை,"அங்கு குவித்திருந்ததெல்லாம், தங்கம், வெள்ளி, வைரம் முதலிய விலையுயர்ந்த பொருள்கள்.",8
கள்வர்_குகை,அவற்றில் சிறிது சிறிது அள்ளித் தன் வேட்டியில் மடிகட்டிக்கொண்டான்.,7
கள்வர்_குகை,விறுவிறுவென்று வெளியில் வந்தான்.,3
கள்வர்_குகை,நேராகக் குதிரையேறித் தன் குடிசைக்குப் புறப்பட்டான்.,5
கள்வர்_குகை,அப்படிப் புறப்பட்டுப் போனவன் அந்தப் பாறையை மூடி வைக்காமல் போய்விட்டான்.,8
கள்வர்_குகை,"அதன் பிறகு அன்று மாலையில் சந்தித்த மூன்று ஆசாமிகளும் யாரோ, தங்களைக் கண்டு பிடித்துவிட்டார்கள் என்பதைத் தெரிந்துகொண்டார்கள்.",13
கள்வர்_குகை,"அதற்குத் தகுந்தபடி, ஏற்பாடு செய்து கொள்ளத் திட்டமிட்டார்கள்.",6
கள்வர்_குகை,"அடுத்தநாள் காலையிலிருந்து மூன்று பேரும் மரங்களுக்குப் பின்னால் ஒளிந்திருந்து, அங்கு வரும் ஆளைப் பிடித்துவிடுவது என்று திட்டமிட்டுக்கொண்டார்கள்.",13
கள்வர்_குகை,போய்ப் பாண்டிய மன்னனிடம் இந்தச் செய்தியைக் கூற வேண்டுமென்று தோன்றியது.,8
கள்வர்_குகை,நேராக அரண்மனைக்குச் சென்றான்.,3
கள்வர்_குகை,வாயிலில் நின்ற காவலரிடம் அரசரை நம்பி பார்க்க வேண்டும் என்று சொல்லுங்கள் !,9
கள்வர்_குகை,இப்பொழுது யாரும் பார்க்கமுடியாது.,3
கள்வர்_குகை,நாளை வா என்று மறுத்தனர்.,4
கள்வர்_குகை,என்னுடைய அரசரை நான் விரும்பிய போது பார்க்க முடியாதா? என்று கேட்டபடி வேகமாக உள்ளே நுழைந்தான் நம்பி.,13
கள்வர்_குகை,அவர்களை உதறித் தள்ளிவிட்டு உள்ளே ஓடினான்.,5
கள்வர்_குகை,அவசரமாகப் பார்க்க வந்தால்.,3
கள்வர்_குகை,இந்த முட்டாள்கள் தடுத்து விட்டார்கள்.,4
கள்வர்_குகை,சண்டை செய்ய வேண்டி வந்துவிட்டது அரசே என்று நம்பி தன் வருத்தத்தைக் கூறினான்.,10
கள்வர்_குகை,பாண்டியன் தலையசைத்தவுடன் அந்த வீரர்கள் அகன்று விட்டனர்.,6
கள்வர்_குகை,பிறகு என்ன அவசர வேலையாக வந்தாய்?,5
கள்வர்_குகை,உனக்கென்ன வேண்டும்? என்று அன்போடு கேட்டான் பாண்டியன்.,6
கள்வர்_குகை,நம்பி எனக்கொன்றும் வேண்டாம்.,3
கள்வர்_குகை,"நம்பி, இதெல்லாம் ஏது? என்று அதட்டிய குரலில் கேட்டான் அரசன்.",8
கள்வர்_குகை,ஓரிடத்தில் திருடிக் கொண்டு வந்தேன்.,4
கள்வர்_குகை,அதைத் தங்களிடம் கொடுக்கவேண்டுமென்று காட்டிலிருந்து அவசரமாகப் புறப்பட்டு வத்தேன் அரசே ! என்றான் நம்பி.,10
கள்வர்_குகை,பாண்டியனின் முகம் கறுத்தது.,3
கள்வர்_குகை,அவன் மனதில் சுழன்ற எண்ணங்கள் நம்பிக்கு எப்படித்தெரியும்?,6
கள்வர்_குகை,அவையெல்லாம் பாண்டியனுடைய பொருள்கள்.,3
கள்வர்_குகை,இப்படி நினைத்தவுடன் அவன் கண்கள் சிவந்து சுழன்றன.,6
கள்வர்_குகை,அங்கிருந்த மணியை ஓங்கியடித்தான்.,3
கள்வர்_குகை,அந்தப் பழைய காவவர் இருவரும் வந்தார்கள்.,5
கள்வர்_குகை,நீ தீயோடு விளையாடுகிறாய்.,3
கள்வர்_குகை,உனக்கு இது விளையாட்டாக இருக்கலாம்.,4
கள்வர்_குகை,"ஆனால் தீ சுட மறந்துவிடாது என்று சொல்லிவிட்டுக் காவலர்களே, நம்பியைச் சிறையில் வையுங்கள் என்றான்.",11
கள்வர்_குகை,நம்பிக்கு ஒன்றும் புரியவில்லை.,3
கள்வர்_குகை,அரசே எதற்காக என்னைச் சிறையில் வைக்கிறீர்கள்? என்று கேட்டான்.,7
கள்வர்_குகை,எல்லாம் நாளைக்குப் புரியும் என்று கூறி விட்டுப் பாண்டியன் போய்விட்டான்.,8
கள்வர்_குகை,"பாண்டியன் வேடர் தலைவனுக்குச் செய்தி அனுப்பினான், அவன் வந்து சிறையுள்ளே ஆத்திரத்தோடு ஒன்றும் புரியாமல் நின்றுகொண்டிருந்த நம்பியைப் பார்த்தான்.",14
கள்வர்_குகை,"நம்பி, அரசர் கோபப்படும்படி ஏன் நடந்துகொண்டாய்? என்று கேட்டான்.",7
கள்வர்_குகை,நம்பி நடந்த விஷயத்தை எல்லாம் வரிசையாகச் சொன்னான்.,6
கள்வர்_குகை,உடனே வேடர் தலைவன் பாண்டியனிடம் போய்க் காட்டில் குகையிருப்பதைப் பற்றிக் கூறினான்.,9
கள்வர்_குகை,"தன் முன் கோபத்திற்கு வருந்தி, நம்பியை விடுவித்து நம்பி, என் முன் கோபத்தால் இப்படி நேர்ந்து விட்டது.",13
கள்வர்_குகை,இதை நீ மனதில் போட்டுக் கொள்ளாதே என்றான்.,6
கள்வர்_குகை,தீ அணைக்க வருபவனையும் சுடுகிறது.,4
கள்வர்_குகை,ஏற்ற வருபவனையும்தான் சுடுகிறது அதற்காக அதன்மேல் கோபங்கொள்ளலாமா? என்றான்.,7
கள்வர்_குகை,நெடு நேரம் வரை யாருமே வரவில்லை.,5
கள்வர்_குகை,"உண்மையில் அந்த மூன்று ஆசாமிகளும் வந்திருந்தார்கள், யாரும் குகைக்கு வருகிறார்களா என்று பார்ப்பதற்காக அவர்களும் ஒளிந்து கொண்டிருந்தார்கள்.",13
கள்வர்_குகை,கடைசியாகப் பொறுமை இழந்து விட்ட நம்பி மரத்தைவிட்டு வெளியில் வந்து நேராகக் குகைச்கெதிரில் சென்று பாறையைப் புரட்டினான்.,13
கள்வர்_குகை,அப்பொழுது திடீரென்று அந்த மூன்று பேரும் பாய்ந்து வந்து நம்பியைப் பிடித்துக் கொண்டார்கள்.,10
கள்வர்_குகை,"இதைக் கண்டவுடன், பாண்டியனும் வேடர் தலைவனும், வீரர்களும் மறைந்திருந்த மரங்களினின்றும் வெளிக்கிளம்பி அவர்கள் மூவரையும் சூழ்ந்து கொண்டார்கள்.",13
கள்வர்_குகை,அந்த மூன்று ஆசாமிகளுக்கும் மனம் திக்திக் என்று அடித்துக்கொண்டது.,7
கள்வர்_குகை,வீரர்கள் அந்த ஆசாமிகளைக் கைது செய்தார்கள்.,5
கள்வர்_குகை,பாண்டியன் குகைக்குள் சென்று பார்த்தான்.,4
கள்வர்_குகை,"தன், நகரத்தில் களவு போன பொருள்கள், அரண்மனைப் பொருள்கள், இன்னும் யாராருடைய பொருள்களோ குவிந்திருந்தன.",11
கள்வர்_குகை,திரும்பி வந்து இந்த மூன்று ஆசாமிகளையும் பார்த்தான் பாண்டியன்.,7
கள்வர்_குகை,அவர்கள் மூவருமே அவனுக்குத் தெரிந்தவர்கள்தான்.,4
கள்வர்_குகை,"தமிழ் நாட்டு ஆசாமி, ஒரு பெரிய பணக்காரன்.",6
கள்வர்_குகை,அரசர் குலத்திற்கு மிகவும் வேண்டியவன்.,4
கள்வர்_குகை,ஆனால் அவனுடைய பண ஆசைதான் இத்தனை பொருள்களையும் திருடிக்குவித்து வைக்கத் தூண்டியிருக்கின்றது.,9
கள்வர்_குகை,"அந்த மங்கோலியர்கள் இருவரும், வடநாட்டிலிருந்து பாண்டி நாட்டுக்குப் பிழைக்க வந்தவர்கள்.",8
கள்வர்_குகை,அவர்கள் அந்தப் புணக்காரன் வீட்டில் வேலைக்கமர்ந்தார்கள்.,5
கள்வர்_குகை,"கடைசியாகத் தாங்கள் கொள்ளையடிக்கும் திறமையைக்காட்டவே, பணக்காரன் அவர்கள் உ.தவியால் கொள்ளையடிக்கத் தொடங்கினான்.",10
கள்வர்_குகை,பொருள்களில் அவர்களுக்கும் அவ்வப்போது கொள்ளையடித்துக் கொடுத்ததற்குக் கூலியாகக் கொடுத்து வந்தான்.,8
கள்வர்_குகை,பாண்டிய நாட்டில் பல நாட்களாக நடைபெற்றுவந்த இந்த மாயக் கொள்ளையைப் பாண்டின் இன்றுதான் கண்டுபிடித்தான்.,11
கள்வர்_குகை,அவர்களை அரண்மனைக்கு அழைத்துப்போய்ச் சிறையில் அடைக்கும்படி வீரர்களுக்குக் கட்டளையிட்டான்.,7
கள்வர்_குகை,அங்கிருந்த பொருள்களையெல்லாம் அரண்மனைக்குக் கொண்டுவரச் செய்தான்.,5
கள்வர்_குகை,பொருளைக் காணவில்லை என்று முன் முறையிட்ட குடி மக்களை அழைத்து அவரவர்கள் பொருளைக் கொடுத்து விட்டான்.,12
கள்வர்_குகை,தன் அரண்மனைப் பொருள்கள் எப்படித் திருட்டுப்போயின என்பது இன்னும் அவனுக்குப் புரியவில்லை.,9
கள்வர்_குகை,அந்த மங்கோலிய ஆசாமிகள் அந்த முறையைச் சொல்ல மறுத்து விட்டனர்.,8
கள்வர்_குகை,செத்தாலும் சொல்ல மாட்டோம் என்று கூறி விட்டார்கள்.,6
கள்வர்_குகை,"நம்பி, இந்தத் துப்புத் துலக்கியத்திற்கு நன்றியாக அவனுக்கு அரண்மனைப் படையிலேயே ஒரு பெரிய வேலை கொடுத்தான் பாண்டியன்.",13
கள்வர்_குகை,வேடர் தலைவன் உள்ளம் பூரித்துப் போனான்.,5
கள்வர்_குகை,"நம்பியும் மகிழ்ச்சியுடன், நான் பிறந்த நாட்டுக்கும், என் அரசர்க்கும் என்னாலான நன்மைகளைச் செய்வேன் என்றான்.",11
கள்வர்_குகை,அன்று நம்பியும் பாண்டிய மன்னனும் பல்லக்கேறி ஊர்வலம் வந்தார்கள்.,7
கள்வர்_குகை,மிகத் திறமையாகத் திருடியவர்களைக் கண்டுபிடித்துப் பொருளைத் திருப்பித் தந்த நம்பியை மக்கள் வாயார வாழ்த்தினார்கள்.,11
கள்வர்_குகை,"தனி ஆளாக நின்று, அந்தக் குகைக் கள்வர்களைப் பிடிக்க வழிகண்ட நம்பியை எல்லோரும் பாராட்டினார்கள்.",11
கள்வர்_குகை,அன்று முதல் பாண்டிய நாட்டில் களவு அற்றுப் போய் விட்டது.,8
கள்வர்_குகை,மக்கள் மகிழ்ச்சியாக இருந்தார்கள்.,3
கள்வர்_குகை,"செந்தமிழ்ப் பதிப்பகம், புதுக்கோட்டை.",3
