work_title,sentence,sentence_length
கந்தர்_அலங்காரச்_சொற்பொழிவுகள்-1,வாய் பெற்ற பயன் இறைவன் நமக்கு வாய் தந்திருப்பது சாப்பிடுவற்காக மாத்திரமா?,9
கந்தர்_அலங்காரச்_சொற்பொழிவுகள்-1,அப்படியானால் எல்லா உயிர்களுக்கும் வாய் இருக்கிறது.,5
கந்தர்_அலங்காரச்_சொற்பொழிவுகள்-1,நம்மைக் காட்டிலும் யானைக்கு மிகப் பெரிய வாய் இருக்கிறது.,7
கந்தர்_அலங்காரச்_சொற்பொழிவுகள்-1,ஆனால் அதை வாயில்லாப் பிராணி என்றுதான் சொல்கிறோம்.,6
கந்தர்_அலங்காரச்_சொற்பொழிவுகள்-1,நாம் ஒரு கவளம் சாப்பிட்டால் யானை நூறு கவளத்தை ஒரே வாயில் சாப்பிட்டுவிடும்.,10
கந்தர்_அலங்காரச்_சொற்பொழிவுகள்-1,பெரிய பிராணி அல்லவா யானை?,4
கந்தர்_அலங்காரச்_சொற்பொழிவுகள்-1,"ஆனாலும், அதனை நாம் வாயில்லாப் பிராணி என்றே சொல்கிறோம்.",7
கந்தர்_அலங்காரச்_சொற்பொழிவுகள்-1,சாப்பிடுகின்ற வாய் வாயாகாது.,3
கந்தர்_அலங்காரச்_சொற்பொழிவுகள்-1,பேசும் வாய்தான் வாய்.,3
கந்தர்_அலங்காரச்_சொற்பொழிவுகள்-1,யானைக்குப் பேசத் தெரியாது.,3
கந்தர்_அலங்காரச்_சொற்பொழிவுகள்-1,ஆகையால் அது வாயில்லாப் பிராணி ஆயிற்று.,5
கந்தர்_அலங்காரச்_சொற்பொழிவுகள்-1,நாம் பேசும் வாய் படைத்ததன் பயன் என்ன?,6
கந்தர்_அலங்காரச்_சொற்பொழிவுகள்-1,வாழ்த்த வாயும் நினைக்க மடநெஞ்சும் தாழ்த்தச் சென்னியும் தந்த தலைவனை என்று அப்பர் அருளியிருக்கிறார்.,11
கந்தர்_அலங்காரச்_சொற்பொழிவுகள்-1,அவ்வாறு வாய் படைத்தவர்கள் எல்லோரும் அவனை வாழ்த்தாவிட்டால் ஆண்டவன் என்ன செய்வான்?,9
கந்தர்_அலங்காரச்_சொற்பொழிவுகள்-1,போன பிறப்பில் இவனுக்கு அழகாகப் பேசக் கூடிய வாயைக் கொடுத்தோம்.,8
கந்தர்_அலங்காரச்_சொற்பொழிவுகள்-1,"இவன் அதை நன்கு பயன்படுத்தாமல் இன்னாதன கூறி, பிறர் மனத்தைப் புண்படுத்தி வாழ்ந்தான்.",10
கந்தர்_அலங்காரச்_சொற்பொழிவுகள்-1,புறங்கூறிப் பெரிய பெரிய சண்டைகளைக் கிளப்பி விட்டான்.,6
கந்தர்_அலங்காரச்_சொற்பொழிவுகள்-1,வழவழவென்று பயனற்ற வம்புப் பேச்சைப் பேசினான்.,5
கந்தர்_அலங்காரச்_சொற்பொழிவுகள்-1,இவனுக்கு வாய் கொடுத்துப் பயன் இல்லை.,5
கந்தர்_அலங்காரச்_சொற்பொழிவுகள்-1,இவன் வாயில்லாப் பிராணியாகவே போகட்டும் என்று செய்து விடுகிறான்.,7
கந்தர்_அலங்காரச்_சொற்பொழிவுகள்-1,"இராமலிங்க சுவாமிகள், எந்தைநினை வாழ்த்தாத பேயர்வாய் கூழுக்கும் ஏக்கற் றிருக்கும்வெறு வாய் என்று வருந்திச் சொல்கிறார்.",12
கந்தர்_அலங்காரச்_சொற்பொழிவுகள்-1,ஆகவே நாவை நமக்கு இறைவன் கொடுத்ததற்குக் காரணம் என்ன?,7
கந்தர்_அலங்காரச்_சொற்பொழிவுகள்-1,நம்முடைய கடமை என்ன?,3
கந்தர்_அலங்காரச்_சொற்பொழிவுகள்-1,வாய் கொடுத்த இறைவனை வாழ்த்துவது நம்முடைய முதற் கடமை.,7
கந்தர்_அலங்காரச்_சொற்பொழிவுகள்-1,நமக்கெல்லாம் அவன் வாய் கொடுத்தது தன்னை எல்லாரும் புகழ வேண்டுமென்ற எண்ணத்தினாலா?,9
கந்தர்_அலங்காரச்_சொற்பொழிவுகள்-1,நாம் புகழ்ந்து அவனுக்கு ஆக வேண்டியது ஒன்றும் இல்லை.,7
கந்தர்_அலங்காரச்_சொற்பொழிவுகள்-1,ஆனாலும் நம்முடைய கடமை அது.,4
கந்தர்_அலங்காரச்_சொற்பொழிவுகள்-1,நாம் நம்முடைய நாவைக் கொண்டு மற்ற மக்களைப் புகழ்ந்து பேசினால் அவர்களுக்கு இன்பம் உண்டாகும்.,11
கந்தர்_அலங்காரச்_சொற்பொழிவுகள்-1,ஆனால் அவரிடம் விருப்பம் இல்லாதவர்களுக்குத் துன்பம் உண்டாகும்.,6
கந்தர்_அலங்காரச்_சொற்பொழிவுகள்-1,"நாலு பேர் இருக்கும்போது ஒருவரைப் புகழ்ந்தால் மற்ற மூவரும், நம்மை இவன் புகழவில்லையே ! என்று எண்ணக் கூடும்.",13
கந்தர்_அலங்காரச்_சொற்பொழிவுகள்-1,எல்லோரையும் புகழ வேண்டுமென்றால் இந்த நாவினாலே முடியாது ஆயிரம் நா நமக்கு இருந்தாலும் முடியாது.,11
கந்தர்_அலங்காரச்_சொற்பொழிவுகள்-1,"ஆகவே, யார் நமக்கு உபகாரம் செய்கிறார்களோ அவர்களைப் புகழ்கிறோம்.",7
கந்தர்_அலங்காரச்_சொற்பொழிவுகள்-1,"உபகாரம் செய்பவரைப் புகழ க.சொ.வேண்டும் என்று தெரிந்து கொண்டது உண்மையானால், அப்போதும் இறைவனைப் புகழ வேண்டும்.",14
கந்தர்_அலங்காரச்_சொற்பொழிவுகள்-1,மக்கள் எல்லோரும் உபகாரம் செய்கிறார்கள்.,4
கந்தர்_அலங்காரச்_சொற்பொழிவுகள்-1,அவர்கள் செய்கிற உதவிக்கு எல்லை உண்டு.,5
கந்தர்_அலங்காரச்_சொற்பொழிவுகள்-1,தாம் நினைத்தபடி எல்லாம் உபகாரம் செய்ய வேண்டுமென்றால் அவர்களிடம் மிகப் பெரிய சக்தி இருக்க வேண்டும்.,12
கந்தர்_அலங்காரச்_சொற்பொழிவுகள்-1,தன் குழந்தையைத் தொட்டால் அது உடனே வஜ்ரமாக ஆகிவிட வேண்டுமென்று ஒரு தாய் ஆசைப்படுகிறாள்.,11
கந்தர்_அலங்காரச்_சொற்பொழிவுகள்-1,ஆனால் அவளால் செய்ய முடிவதில்லை.,4
கந்தர்_அலங்காரச்_சொற்பொழிவுகள்-1,அவளுக்கு வெறும் ஆசைதான் இருக்கிறது.,4
கந்தர்_அலங்காரச்_சொற்பொழிவுகள்-1,ஆசையை நிறைவேற்றும் ஆற்றல் இல்லை.,4
கந்தர்_அலங்காரச்_சொற்பொழிவுகள்-1,அவளிடம் உண்டாகிற ஆசைகள் பல.,4
கந்தர்_அலங்காரச்_சொற்பொழிவுகள்-1,அவற்றில் ஒரளவு நிறைவேறுகிறது என்றால் அது ஆண்டவனுடைய சக்தியினால்தான் நிறைவேறுகின்றது.,8
கந்தர்_அலங்காரச்_சொற்பொழிவுகள்-1,குழந்தைக்கு அவள் உபகாரம் செய்கிறாள் என்று நினைக்கிறோம்.,6
கந்தர்_அலங்காரச்_சொற்பொழிவுகள்-1,கொடுக்கும் கருவி அவள்.,3
கந்தர்_அலங்காரச்_சொற்பொழிவுகள்-1,அவள் மூலமாகக் கொடுக்கிறவன் ஆண்டவன்.,4
கந்தர்_அலங்காரச்_சொற்பொழிவுகள்-1,யாரோ ஒருவர் நமக்கு ஒரு புத்தகம் கொடுக்கிறார்.,6
கந்தர்_அலங்காரச்_சொற்பொழிவுகள்-1,இறைவனால் தூண்டப்பட்டுக் கொடுக்கிற அவர் இறைவனுடைய அருளாணைக்குரிய கருவியாகத்தான் இருக்கிறார்.,8
கந்தர்_அலங்காரச்_சொற்பொழிவுகள்-1,ஆண்டவன் மற்றவர்களையன்றி அவரை ஒரு கருவியாகக் கொண்டு கொடுப்பதனால் அவருக்கு ஒரு பெருமை உண்டு.,11
கந்தர்_அலங்காரச்_சொற்பொழிவுகள்-1,அதனால் அவர் மகிழ்ச்சி அடையலாம்.,4
கந்தர்_அலங்காரச்_சொற்பொழிவுகள்-1,நாமும் அவரைப் போற்றலாம்.,3
கந்தர்_அலங்காரச்_சொற்பொழிவுகள்-1,ஆனால் அதனை அவர் நமக்குக் கொடுப்பதற்கு யார் மூல காரணமாக இருந்தானோ அவனை மறந்துவிடக்கூடாது.,11
கந்தர்_அலங்காரச்_சொற்பொழிவுகள்-1,தஞ்சாவூரிலிருந்து ஒருவர் நமக்கு ஐம்பது ரூபாய் மணியார்டர் பண்ணியிருக்கிறார்.,7
கந்தர்_அலங்காரச்_சொற்பொழிவுகள்-1,அந்த மணியார்டரைக் கொண்டு வந்து தபால்காரன் கொடுக்கிறான்.,6
கந்தர்_அலங்காரச்_சொற்பொழிவுகள்-1,அதனை வாங்கிக் கொண்டு நாம் என்ன செய்கிறோம்?,6
கந்தர்_அலங்காரச்_சொற்பொழிவுகள்-1,"ஆனால் அதே சமயத்தில், அப்பாடி !",4
கந்தர்_அலங்காரச்_சொற்பொழிவுகள்-1,நம்முடைய கஷ்டம் நீங்கிற்று.,3
கந்தர்_அலங்காரச்_சொற்பொழிவுகள்-1,சரியான சமயத்தில் உதவி செய்த அந்தத் தஞ்சாவூர்ச் செட்டியாருக்கு என்ன கைம்மாறு செய்வோம் ! என்று எண்ணி உள்ளம் உருகுகின்றோம்.,14
கந்தர்_அலங்காரச்_சொற்பொழிவுகள்-1,இவ்வாறே நமக்கு உபகாரம் செய்கின்றவர்களிடம் நாம் ஓரளவு நன்றி பாராட்டக் கடமைப்பட்டிருக்கிறோம்.,9
கந்தர்_அலங்காரச்_சொற்பொழிவுகள்-1,அதே சமயத்தில் எல்லாவற்றுக்கும் மூலகாரணமாயிருக்கிற ஆண்டவனிடத்தில் நாம் மிக்க நன்றி பாராட்ட வேண்டும் அல்லவா?,11
கந்தர்_அலங்காரச்_சொற்பொழிவுகள்-1,நாம் அவனுக்கு வேறு எவ்விதமாகக் கைம்மாறு செய்ய முடியும்?,7
கந்தர்_அலங்காரச்_சொற்பொழிவுகள்-1,அவன் புகழைச் சொல்வதுதான் நன்றியறிவுக்கு அறிகுறி.,5
கந்தர்_அலங்காரச்_சொற்பொழிவுகள்-1,இருள்சேர் இருவினையும் சேரா இறைவன் பொருள்சேர் புகழ்புரிந்தார்மாட்டு என்பது வள்ளுவர் வாய்மொழி.,9
கந்தர்_அலங்காரச்_சொற்பொழிவுகள்-1,பொருள் சேர் புகழ் என்பதற்கு உண்மையான புகழ் என்பது பொருள்.,8
கந்தர்_அலங்காரச்_சொற்பொழிவுகள்-1,இறைவனுடைய புகழ்தான் உண்மையான புகழ்.,4
கந்தர்_அலங்காரச்_சொற்பொழிவுகள்-1,மற்றவர்களைப் புகழ்வது ஏதோ ஒரு சம்பிரதாயத்திற்காகத்தான்.,5
கந்தர்_அலங்காரச்_சொற்பொழிவுகள்-1,மற்றவர்களைக் கருவியாகக் கொண்டு எல்லாக் காரியத்தையும் யார் செய்கின்றானோ அவனைப் புகழ்வதே உண்மையான புகழ்ச்சி.,11
கந்தர்_அலங்காரச்_சொற்பொழிவுகள்-1,இதனை உணர்ந்து அப்பர் பெருமான் சொல்லுகிறார்.,5
கந்தர்_அலங்காரச்_சொற்பொழிவுகள்-1,"பொன்னாயும், மணியாயும், அவற்றால் ஏற்படுகின்ற போகமாயும் நீ இருக்கின்றாய்.",7
கந்தர்_அலங்காரச்_சொற்பொழிவுகள்-1,ஆகையால் பூமி மேல் யாரையாவது புகழ வேண்டுமென்றால் யாரைப் புகழ்வது?,8
கந்தர்_அலங்காரச்_சொற்பொழிவுகள்-1,எல்லாம் நீயாகவே இருக்கின்றதனால் உன்னைத்தானே புகழ வேண்டும்?,6
கந்தர்_அலங்காரச்_சொற்பொழிவுகள்-1,எந்த வகையைக் கொண்டு உன்னை நான் புகழ்வேன்?,6
கந்தர்_அலங்காரச்_சொற்பொழிவுகள்-1,நீ எப்படி இருக்கின்றாய் என்று அறிந்தால்தானே புகழ முடியும்?,7
கந்தர்_அலங்காரச்_சொற்பொழிவுகள்-1,உன்னை எப்படிப் புகழ்வது என்று எனக்குத் தெரியவில்லையே ! என்று பாடுகிறார்.,8
கந்தர்_அலங்காரச்_சொற்பொழிவுகள்-1,இனியும் அதனால் விளையும் பயன் ஒன்று உண்டு.,6
கந்தர்_அலங்காரச்_சொற்பொழிவுகள்-1,அது என்ன என்று பார்க்கலாம்.,4
கந்தர்_அலங்காரச்_சொற்பொழிவுகள்-1,நம்மிடம் இருக்கும் சொத்தைக் கண்டு அந்தக் காலன் பயப்படமாட்டான்.,7
கந்தர்_அலங்காரச்_சொற்பொழிவுகள்-1,பதவி கண்டும் பயந்து உயிரை விட்டுப் போக மாட்டான்.,7
கந்தர்_அலங்காரச்_சொற்பொழிவுகள்-1,"எந்த நிமிஷத்தில், எந்தக் கணத்தில் வந்து சுருக்கிட்டு இழுத்துப் போக வேண்டுமென்பது அவனுக்குத் தெரியும்.",11
கந்தர்_அலங்காரச்_சொற்பொழிவுகள்-1,அவனை வெல்ல வேண்டுமென்றால் அயில்வேலன் கவியை அன்பால் படிக்க வேண்டும்.,8
கந்தர்_அலங்காரச்_சொற்பொழிவுகள்-1,"சாகிற காலத்தில் சங்கரா, சங்கரா என்றால் வருமா?",6
கந்தர்_அலங்காரச்_சொற்பொழிவுகள்-1,மனிதனுடைய பழக்கத்தால் உண்டான வாசனை எதுவோ அதுவே சாகிற காலத்தில் முந்திக் கொண்டு நிற்கும்.,11
கந்தர்_அலங்காரச்_சொற்பொழிவுகள்-1,அப்போது நினைத்தல் இறைவன் நினைப்புச் சாகிற போது வருமா என்பதை அநுபவத்தில் ஒவ்வொரு நாளும் பார்த்துக் கொள்ளலாம்.,13
கந்தர்_அலங்காரச்_சொற்பொழிவுகள்-1,உறங்குவதும் ஒரு சாவுதான்.,3
கந்தர்_அலங்காரச்_சொற்பொழிவுகள்-1,உறங்குவது போலும் சாக்காடு என்று சொல்லுகிறார் வள்ளுவர்.,6
கந்தர்_அலங்காரச்_சொற்பொழிவுகள்-1,நம்முடைய அநுபவத்தில் நம் நினைவில் என்ன என்னபடுகின்றனவோ அவை கனவில் வருகின்றன.,9
கந்தர்_அலங்காரச்_சொற்பொழிவுகள்-1,திருடனைக் கண்டு பயப்படுகிறோம் திருடனைப் பற்றிக் கேட்டு அஞ்சுகிறோம் கனவில் திருடன் தோன்றி நம்மை அலற வைக்கிறான்.,13
கந்தர்_அலங்காரச்_சொற்பொழிவுகள்-1,தினந்தோறும் நாம் இறைவனை நினைத்தால் கனவிலும் இறைவன் வருவான்.,7
கந்தர்_அலங்காரச்_சொற்பொழிவுகள்-1,நாம் நினைப்பதில்லை அவன் நம் கனவில் வருவதில்லை.,6
கந்தர்_அலங்காரச்_சொற்பொழிவுகள்-1,நம் மனத்தில் உள்ள அழுத்தமான நினைவுகள் கனவில் தோன்றுகின்றன.,7
கந்தர்_அலங்காரச்_சொற்பொழிவுகள்-1,கனவிலே ஆண்டவனைக் காண வேண்டுமென்றால் நனவில் அவனை அழுத்தமாக நினைக்க வேண்டும்.,9
கந்தர்_அலங்காரச்_சொற்பொழிவுகள்-1,"பயத்தால் அலறும்போது, அம்மா, அப்பா !",4
கந்தர்_அலங்காரச்_சொற்பொழிவுகள்-1,என்று அலறுகிறோம் ஐயோ !,3
கந்தர்_அலங்காரச்_சொற்பொழிவுகள்-1,அப்படிக் கூவிப் பழக்கம் ஆகிவிட்டது.,4
கந்தர்_அலங்காரச்_சொற்பொழிவுகள்-1,அப்போது ஆண்டவனை அழைப்பதில்லை.,3
கந்தர்_அலங்காரச்_சொற்பொழிவுகள்-1,அந்தப் பழக்கம் திடீரென்று நம்மிடம் வராது.,5
கந்தர்_அலங்காரச்_சொற்பொழிவுகள்-1,பலநாள் பழக்கத்தால் வர வேண்டும்.,4
கந்தர்_அலங்காரச்_சொற்பொழிவுகள்-1,சுந்தரமூர்த்தி சுவாமிகள் திருவாரூர்த் தியாகேசரிடம் மிகுதியான அன்பு கொண்டவர்.,7
கந்தர்_அலங்காரச்_சொற்பொழிவுகள்-1,அவர் திருவொற்றியூர் வந்தார்.,3
கந்தர்_அலங்காரச்_சொற்பொழிவுகள்-1,தாம் திருவொற்றியூரை விட்டுப் போவதில்லை எனச் சபதம் செய்து கொடுத்துவிட்டுச் சங்கிலி நாச்சியாரை மணந்து கொண்டார்.,12
கந்தர்_அலங்காரச்_சொற்பொழிவுகள்-1,திருவாரூர்ப் பெருமானைப் பிரிந்திருக்க அவரால் முடியவில்லை.,5
கந்தர்_அலங்காரச்_சொற்பொழிவுகள்-1,சங்கிலி நாச்சியாருக்குச் சத்தியம் செய்து கொடுத்தால் என்ன?,6
கந்தர்_அலங்காரச்_சொற்பொழிவுகள்-1,சத்தியத்தை மீறியதால் அவர் கண்கள் குருடாகிவிட்டன.,5
