work_title,sentence,sentence_length
கோவூர்_கிழார்,உணவுப் பொருள்கள் சுருங்கச் சுருங்க மக்கள் தம் உணவைக் குறைத்துக்கொண்டனர்.,8
கோவூர்_கிழார்,குழந்தைகளுக்கும் கணவன்மார்களுக்கும் உணவை அளித்துவிட்டு மகளிர் தாம் ஒரு பொழுது மாத்திரம் உண்ணலாயினர்.,10
கோவூர்_கிழார்,இந்த அவலமான நிலையிலும் நெடுங்கிள்ளி தன் பிடிவாதத்தை விடவில்லை.,7
கோவூர்_கிழார்,எல்லாரும் மடிந்தாலும் கோட்டைக் கதவைத் திறந்து பகைவரை வரவேற்கமாட்டேன் என்று இருந்தான்.,9
கோவூர்_கிழார்,தன் கண்முன்னே மக்கள் வாடுவதை அவன் கண்டான்.,6
கோவூர்_கிழார்,குழந்தைகள் பாலின்றி அழுவதைக் கேட்டான்.,4
கோவூர்_கிழார்,அவன் மனம் மாறவில்லை.,3
கோவூர்_கிழார்,அவனுடைய அசட்டுத் துணிவைக் கண்டு கோட்டையில் உள்ளவர்கள் அஞ்சினார்கள்.,7
கோவூர்_கிழார்,"﻿தலைவன் எவ்வழி நடக்கிறானோ, அவ்வழியே நடப்பதையன்றி அவர்களால் செய்யத்தக்க ஒன்றும் இல்லை.",9
கோவூர்_கிழார்,எல்லாரும் அமைதியாக வாழவேண்டும் என்ற நோக்கம் உடையவன் சோழன் நலங்கிள்ளி.,8
கோவூர்_கிழார்,முதுகண்ணன் சாத்தனார் இளமையிலிருந்தே அவனுக்குப் பகர்ந்த நல்லுரைகள் அவனை அப்படி ஆக்கியிருந்தன.,9
கோவூர்_கிழார்,இன்றியமையாத சமயங்களிலன்றிப் போரிடுவது தகாதென்றே அவன் உறுதியாக எண்ணினான்.,7
கோவூர்_கிழார்,அவன் நினைத்திருந்தால் ஆவூர்க் கோட்டைக்குள் இருந்த நெடுங்கிள்ளியை வெளிவரச் செய்திருக்கலாம்.,8
கோவூர்_கிழார்,போரைத் தொடங்குவது எளிது.,3
கோவூர்_கிழார்,ஆனால் அதை நடத்தி வெற்றி பெறுவதற்குள் இரு படையிலும் பலர் உயிர் இழப்பார்கள்.,10
கோவூர்_கிழார்,ஆதலால் இயன்ற வரையில் போர் செய்யாமல் காலங்கடத்தவே அவன் விரும்பினான் இப்போது நிலைமை வேறுவிதமாக இருந்தது.,12
கோவூர்_கிழார்,நெடுங்கிள்ளி கோட்டையைக் கைப்பற்றிக் கொண்டுவிடவில்லை.,4
கோவூர்_கிழார்,அங்கு இருப்பவர்கள் என்ன ஆனார்களோ !,4
கோவூர்_கிழார்,அவர்களைக் காப்பாற்றும் பொருட்டாகவாவது மதிற்கதவை உடைத்து உள்ளே புகலாமா என்று எண்ணினான்.,9
கோவூர்_கிழார்,மதிலின்மேல் தன் வீரர்களை ஏறச்செய்து உள்ளே குதித்துக் கோட்டைக் கதவைத் திறக்கச் செய்யலாமா என்று யோசித்தான்.,12
கோவூர்_கிழார்,திடீரென்று அவனுக்கு ஒரு வழி தோன்றியது.,5
கோவூர்_கிழார்,அது நிறைவேறினால் உள்ளே உள்ள மக்களுக்கு நன்மை உண்டாகும்.,7
கோவூர்_கிழார்,பகை வேந்தர்கள் போரிட்டுக்கொண்டிருந்தாலும் புலவர்கள் அவர்களைப் போர்க்களத்திலே சென்று பார்ப்பதுண்டு.,8
கோவூர்_கிழார்,ஓர் ஊரிலே உள்ள புலவர் அந்த ஊருக்குரிய மன்னனுடைய பகைவன் இருக்கும் ஊருக்குச் செல்லலாம்.,11
கோவூர்_கிழார்,அந்தப் பகை மன்னன் புலவருக்கு வேண்டிய உபசாரங்கள் செய்வான்.,7
கோவூர்_கிழார்,"ஒரு நாட்டுப் படைத் தலைவனை, அமைச்சனை போர் நிகழும் காலத்தில் பகை நாட்டுக்குள் அகப்பட்டால் மீண்டு வரமுடியாது.",13
கோவூர்_கிழார்,"ஆனால் ஒரு நாட்டிலே வாழும் புலவன், பகை நாட்டுக்குச் செல்லலாம்.",8
கோவூர்_கிழார்,புலவன் யாருக்கும் பகைவன் அல்லன்.,4
கோவூர்_கிழார்,போர் நிகழ்ந்தால் போரிடும் வேந்தர்களுக்கிடையே சந்து செய்விக்க முயல்வார்கள் புலவர்கள்.,8
கோவூர்_கிழார்,தமிழ் மக்கள் அரசனைத் தெய்வத்தைப் போல எண்ணி மதித்தார்கள்.,7
கோவூர்_கிழார்,மன்னனுடைய பதவிதான் நாட்டிலே மிக மிக உயர்ந்த பதவி.,7
கோவூர்_கிழார்,ஆனால் மன்னர்களைக் காட்டிலும் உயர்ந்தவர்களாகப் புலவர்களை மதித்தனர்.,6
கோவூர்_கிழார்,புலவர்கள் எல்லாருக்கும் நண்பர்கள் யாருக்கும் அவர்களிடம் பகை இராது.,7
கோவூர்_கிழார்,"புலவர்கள் பாடும் புகழை இவ்வுலகத்தில் பெறும் பேறுகளுக்குள் சிறந்ததாகவும், அவர்களாற் பாடப்பெறாமையைப் பெரிய குறையாகவும் தமிழ்நாட்டு மன்னர்கள் எண்ணினார்கள்.",14
கோவூர்_கிழார்,"ஆகவே, கோவூர் கிழார் நெடுங்கிள்ளியிடம் சென்றால் அவன் அவரை மதித்து உபசரிப்பான் என்பது யாவருக்கும் தெரியும்.",12
கோவூர்_கிழார்,கோவூர் கிழார் கோட்டைக்குள் எப்படிச் செல்வது?,5
கோவூர்_கிழார்,சென்ற பிறகல்லவா நெடுங்கிள்ளியைக் கண்டு அறிவுரை கூறமுடியும்?,6
கோவூர்_கிழார்,"அதற்கும் ஒரு தந்திரம் தோன்றியது, நலங்கிள்ளிக்கு.",5
கோவூர்_கிழார்,கோட்டைக்குள் இருப்பவர்களுக்குச் சந்து செய்யும் யோசனையையும் மற்றக் கருத்துக்களையும் இந்த வகையாகத் தெரிவிப்பது பழங்கால் வழக்கம்.,12
கோவூர்_கிழார்,ஓலை மதிலுக்குள் சென்று வீழ்ந்தது.,4
கோவூர்_கிழார்,நெடுங்கிள்ளியிடம் அந்த ஓலையை எடுத்துச் சென்று காட்டினார்கள்.,6
கோவூர்_கிழார்,கோவூர் கிழார் வருவார் என்ற செய்தியை அவனுடன் இருந்த படைத் தலைவர்கள் அறிந்தார்கள்.,10
கோவூர்_கிழார்,செய்தி கோட்டைக்குள் எங்கும் பரவியது.,4
கோவூர்_கிழார்,கோவூர் கிழார் வரப் போகிறார் என்ற செய்தி அவர்களுடைய உள்ளத்தில் புதிய நம்பிக்கை முளைக்கும்படி செய்தது.,12
கோவூர்_கிழார்,பாலை நிலத்தில் மழை பெய்தால் எப்படி இருக்கும்?,6
கோவூர்_கிழார்,நெடுங்கிள்ளி அந்த ஓலைக்கு விடை அனுப்பினான்.,5
கோவூர்_கிழார்,எந்தச் சமயத்திலும் கோவூர் கிழாரை வரவேற்கக் காத்திருப்பதாகச் செய்தி அனுப்பினான்.,8
கோவூர்_கிழார்,சொன்ன சொல்லை மாற்றாமலும் வரம்பு கடவாமலும் தமிழ் மன்னர்கள் நடந்தார்கள்.,8
கோவூர்_கிழார்,ஆதலால் கோவூர் கிழார் உள்ளே வருகிறார் என்று சொல்லிவிட்டு ஏமாற்றிப் படையை உள்ளே புகுத்திவிடும் எண்ணம் நலங்கிள்ளிக்கு இல்லை.,14
கோவூர்_கிழார்,குறிப்பிட்டபடி கோவூர் கிழார் மாத்திரம் கோட்டைக்குள் நுழைந்தார்.,6
கோவூர்_கிழார்,மதில் வாயிலில் நின்ற காவலர்கள் அவரை உள்ளே விட்டுக் கதவைச் சாத்திக்கொண்டார்கள்.,9
கோவூர்_கிழார்,நெடுங்கிள்ளி வாயிலருகிலே நின்று புலவரை வரவேற்றான்.,5
கோவூர்_கிழார்,கோவூர் கிழாரின் பெருமையைத் தமிழுலகம் முழுவதும் நன்கு அறிந்திருந்த காலம் அது.,9
கோவூர்_கிழார்,"ஆகவே, அவர் ஏதேனும் சொன்னால் நெடுங்கிள்ளி மறுக்க மாட்டான் என்று யாவரும் நம்பினர்.",10
கோவூர்_கிழார்,புலவர் பெருமான் கோவூர் கிழார் உள்ளே புகுந்து சுற்றிப் பார்த்தார்.,8
கோவூர்_கிழார்,யானைப் படையைப் பார்த்தார்.,3
கோவூர்_கிழார்,தக்கபடி உணவு பெறாமல் யானைகள் ﻿மெலிந்திருந்தன.,5
கோவூர்_கிழார்,அடிக்கடி பசி தாங்காமல் ஆர்த்தன.,4
கோவூர்_கிழார்,மகளிர் முகத்தில் ஒளியே இல்லை.,4
கோவூர்_கிழார்,"வேண்டிய அளவு சோறு, தண்ணீர் இல்லாமல் மக்கள் வருந்தினார்கள்.",7
கோவூர்_கிழார்,அவருக்கே துயரம் பொறுக்கவில்லை.,3
கோவூர்_கிழார்,அவர் முன் அமர்ந்தார்.,3
கோவூர்_கிழார்,அரசர்களுக்கு வழக்கமான செயல்தானே இது? என்றான் நெடுங்கிள்ளி.,6
கோவூர்_கிழார்,அரசருக்கு இது வழக்கமென்கிறாயே !,3
கோவூர்_கிழார்,இங்கே உன்னைச் சூழ இருக்கும் காட்சிகளைப் பார்த்தாயா?,6
கோவூர்_கிழார்,உன்னுடைய படையிலுள்ள யானைகள் எப்படி இருக்கின்றன?,5
கோவூர்_கிழார்,அவை முன்பு எப்படி வாழ்ந்தன?,4
கோவூர்_கிழார்,தினந்தோறும் பெண் யானைகளின் கூட்டத்தோடு களிறுகள் குளத்துக்குச் சென்று படிந்து நீராடி இன்புறும்.,10
கோவூர்_கிழார்,நெல்லைக் கதிரோடு தின்னும் சோழ நாட்டு யானைகள் அல்லவா அவை?,8
கோவூர்_கிழார்,நெய்யும் சோறுமாகப் பிசைந்து தரும் கவளத்தை உண்டு நடைபோடும் அவை இப்போது எப்படி இருக்கின்றன?,11
கோவூர்_கிழார்,கட்டுத் தறியை முறித்துத் தும்பிக்கையை நிலத்திலே புரளவிட்டுத் தடவுகின்றன.,7
கோவூர்_கிழார்,அடிக்கடி பெரு மூச்சு எறிகின்றன.,4
கோவூர்_கிழார்,பசி தாங்காமல் இடிபோல முழங்குகின்றன.,4
கோவூர்_கிழார்,இவ்வளவு காலமும் இன்புற்று வாழ்ந்த அவற்றை இப்படிப் பட்டினி போடுகிறாயே !,8
கோவூர்_கிழார்,இது தகுமா? நெடுங்கிள்ளி ஒன்றும் பேசாமல் கேட்டுக் கொண்டிருந்தான்.,7
கோவூர்_கிழார்,அவன் ஏதாவது விடை சொல்வானோ என்று எதிர்பார்த்துக் கோவூர் கிழார் தம் பேச்சைச் சிறிதே நிறுத்தினார்.,12
கோவூர்_கிழார்,அம் மன்னன் ஏதும் பேசவில்லை.,4
கோவூர்_கிழார்,புலவர் உண்மையைத்தானே எடுத்துச்சொன்னார்?,3
கோவூர்_கிழார்,அதை அவன் மறுக்க முடியுமா?,4
கோவூர்_கிழார்,அல்லது இந்த நிலை முறைப்படி ஏற்பட்டது என்று சொல்வானா?,7
கோவூர்_கிழார்,கோவூர் கிழார் மறுபடியும் பேசத் தொடங்கினார்.,5
கோவூர்_கிழார்,மக்கள் நிலையைக் கண்டு பொறுக்க முடியவில்லை.,5
கோவூர்_கிழார்,தாய்மார்கள் போதிய உணவு இல்லாமல் உடம்பு மெலிந்திருக்கிறார்கள்.,6
கோவூர்_கிழார்,அவர்களிடம் போதிய பால் இல்லாமையால் இளங் குழந்தைகள் பசி நீங்காமல் கதறுகின்றன.,9
கோவூர்_கிழார்,அந்தக் குழந்தைகளின் அலறல் உன் காதில் விழவில்லையா?,6
கோவூர்_கிழார்,தாம் கூறும் வார்த்தைகள் அவன் உள்ளத்தில் இறங்கி அழுத்தமாகப் படவேண்டும் என்ற எண்ணத்தால் அப்படிச் செய்தார்.,12
கோவூர்_கிழார்,உண்மையில் அவர் இந்தக் காட்சிகளை எடுத்துக் காட்டும்போது நெடுங்கிள்ளியின் அகக் கண்ணில் அவை பெரிய உருவம் எடுத்துக்கொண்டு நின்றன.,14
கோவூர்_கிழார்,அவன் ஒன்றும் பேச வழியின்றி வாயடைத்து அமர்ந்திருந்தான்.,6
கோவூர்_கிழார்,கோவூர் கிழார் மீண்டும் தமது பொருளுடைய சொற்களை வீசலாயினர்.,7
கோவூர்_கிழார்,அந்த மங்கையருடைய நிலை எவ்வளவு இரங்கத்தக்கதாக இருக்கிறது !,6
கோவூர்_கிழார்,இப்போது தம் கணவன்மார் அருகில் இருக்கவும் பூவோடு முடிக்கும் கூந்தலை வெறுமையாக முடிக்கிறார்கள்.,10
கோவூர்_கிழார்,மக்கள் உணவில்லை யென்று இடும் கூக்குரல் கிடக்கட்டும்.,6
கோவூர்_கிழார்,வீட்டிலே குடிக்க நல்ல தண்ணீர் இல்லை என்று வருந்துகிறார்கள்.,7
கோவூர்_கிழார்,இவற்றையெல்லாம் உன் கண் கொண்டு பார்த்தாயா?,5
கோவூர்_கிழார்,இதுவா உன் ஆண்மைக்கு அழகு?,4
கோவூர்_கிழார்,சில சமயங்களில் அவர் வார்த்தைகள் அவனை உருக்கின.,6
கோவூர்_கிழார்,மேலும் அவர் பேசிக் கொண்டே போவதை அவன் விரும்பவில்லை.,7
கோவூர்_கிழார்,தான் செய்வது தவறு என்ற உணர்ச்சி அவனுக்கு உண்டாகிவிட்டது.,7
கோவூர்_கிழார்,அதுகாறும் தலையைக் குனிந்தவாறே கேட்டுக்கொண்டிருந்தவன் சற்றே தலை நிமிர்ந்தான்.,7
கோவூர்_கிழார்,என் குற்றங்களைப் பொறுக்க வேண்டும்.,4
கோவூர்_கிழார்,தாங்கள் கூறுகின்ற காட்சிகளை நான் காணாமல் இருக்கவில்லை.,6
கோவூர்_கிழார்,கண்டேன் ஆனால் கருத்தோடு காணவில்லை.,4
கோவூர்_கிழார்,இப்போது என் அறியாமையை உணர்கிறேன்.,4
கோவூர்_கிழார்,இனி என்ன செய்வது என்று எனக்கு ஒன்றும் தோன்றவில்லை.,7
கோவூர்_கிழார்,"தாங்கள் எப்படிச் சொல்கிறீர்களோ, அப்படிச் செய்கிறேன் என்று மெலிந்த குரலில் அவன் பேசினான்.",10
கோவூர்_கிழார்,அவன் வாயில் சொற்கள் மிடுக்கோடு வரவில்லை தொடர்ந்தும் வரவில்லை.,7
கோவூர்_கிழார்,இடையிடையே அற்று அற்று வந்தன.,4
கோவூர்_கிழார்,புலவர் எடுத்துச் சொன்னவை அவன் உள்ளத்தை அரம்போல் அறுத்தன.,7
கோவூர்_கிழார்,எனக்குத் தெரிந்தவை இரண்டு வழிகள்.,4
கோவூர்_கிழார்,ஒன்று அறநெறி மற்றென்று ஆண்மை நெறி.,5
கோவூர்_கிழார்,நலங்கிள்ளி நாட்டை விட்டுப் புறத்தே சென்றிருந்த காலத்தில் நீ இந்தக் கோட்டையைக் ﻿கைப்பற்றியது அறநெறி அன்று ஆண்மையும் அன்று.,14
கோவூர்_கிழார்,"ஆதலின், இந்தக் கோட்டை உனக்குரியது என்று சொல்லித் திறந்து அவனுக்கு உரியதாக்கி விடுவது நல்லது.",11
கோவூர்_கிழார்,இது கோழையின் செயல். நெடுங்கிள்ளி இப்போது பேசலானான் ஆண்மை நெறியென்றும் அறநெறியென்றும் சொன்னீர்களே.,10
கோவூர்_கிழார்,அறம் என்பது எல்லாருக்கும் பொது.,4
கோவூர்_கிழார்,நீ அறங்கருதித் திறந்தாயானால் பிறகு போர் ஏன்?,6
கோவூர்_கிழார்,நலங்கிள்ளி அத்தகையவன் அல்லன்.,3
கோவூர்_கிழார்,நீ சமாதானத்தை விரும்புகிறாய் என்று தெரிந்தால் அவன் உன்னையும் உன் படைவீரர்களையும் அவர்களைச் சார்ந்தோரையும் ஒன்றும் செய்ய மாட்டான்.,14
கோவூர்_கிழார்,ஒரு குலத்திற் பிறந்த உன்னைத் துன்புறுத்துவதனால் அவனுக்கு ஊதியம் ஏதும் இல்லை என்று அறிவுறுத்தினார் கோவூர் கிழார்.,13
கோவூர்_கிழார்,நெடுங்கிள்ளி அவர் உரையின்படியே செய்யத் துணிந்தான்.,5
கோவூர்_கிழார்,கோவூர் கிழாரையே முன்னிட்டுக் கொண்டு கோட்டைக் கதவைத் திறந்து விட்டான்.,8
கோவூர்_கிழார்,சமாதான நோக்கத்தோடு நெடுங்கிள்ளி வருவதனை அறிந்த சோழப் படையினர் ஆரவாரித்தனர்.,8
