work_title,sentence,sentence_length
கல்வி_எனும்_கண்,ஏட்டுக் கணக்கினை நாட்டு நிகழ்ச்சியோடு ஒப்பிட்டுப் பார்ப்பின் உண்மை விளங்கும்.,8
கல்வி_எனும்_கண்,தற்போது புதிய வேகத்தில் மாவட்டந்தோறும் இந்த முயற்சி செயலாக்கப்பெறுகின்றது.,7
கல்வி_எனும்_கண்,எழுத்தறியார் இந்த மாவட்டத்தில் இல்லையாகச் செய்வோம் என்று ஒவ்வொரு மாவட்ட ஆட்சித் தலைவரும் அவரைச் சார்ந்தோர்களும் முயல்கின்றனர்.,13
கல்வி_எனும்_கண்,எனினும் மக்கள் ஒத்துழைப்புத் தேவை.,4
கல்வி_எனும்_கண்,அதைப் பொறுத்திருந்துதான் காண வேண்டும்.,4
கல்வி_எனும்_கண்,எல்லாரும் கற்றோரே என்ற நிலை நாட்டில் மலரின் அந்தநாள் நன்னாளாகும் என்பது உண்மை !,10
கல்வி_எனும்_கண்,ஆனால் அந்நாள் என்று வருமோ !,4
கல்வி_எனும்_கண்,இலவசக் கல்வி பற்றியும் சற்று எண்ணிப் பார்க்கத் தோன்றுகிறது.,7
கல்வி_எனும்_கண்,முன்பெல்லாம் ஆரம்பப்பள்ளி வகுப்புகள் ஐந்தாம் வகுப்புவரை எங்கும் இலவசமாகவே இயங்கின.,8
கல்வி_எனும்_கண்,ஒருசில தனியார் கிறித்தவர் பள்ளிகள் போன்றவை மிகக் குறைந்த அளவில் சம்பளம் பெற்றன.,10
கல்வி_எனும்_கண்,பள்ளியில் மத்திய வகுப்புகளிலும் மேல் வகுப்புகளிலும் மிகக் குறைவாகவே சம்பளம் பெற்றனர்.,9
கல்வி_எனும்_கண்,இன்று மேநிலைப்பள்ளி வரையில் கல்வி இலவசமாக்கப்பெற்றுள்ளது.,5
கல்வி_எனும்_கண்,இது தேவைதானா என்ற வினா பலர் உள்ளத்தில் எழுகின்றது.,7
கல்வி_எனும்_கண்,அக்குறைந்த சம்பளத்தையும் அவர்கள் கட்டவேண்டியதில்லை.,4
கல்வி_எனும்_கண்,அப்போது இருந்த தரம் இன்று கல்வியில் இல்லை.,6
கல்வி_எனும்_கண்,பல பெற்றோர் பணம் செலவில்லையாதலால் பிள்ளைகள் படிப்பைப் பற்றிக் கவலைப்படுவதில்லை.,8
கல்வி_எனும்_கண்,"பல ஏழைகளும் கூட, பிற செலவுகளைக் குறைத்துக்கொண்டு சம்பளம் கட்டும் பள்ளிகளுக்கே பிள்ளைகளை அனுப்பக் காண்கிறோம்.",12
கல்வி_எனும்_கண்,சூன் மாதம் தொடங்கிய பள்ளிக்கு அடுத்த ஆண்டு பிப்ரவரியில் தேவையான ஆசிரியரை அனுப்புகின்ற அரசாங்க விதிமுறைகளும் உள்ளன.,13
கல்வி_எனும்_கண்,"ஆசிரியர்களும், முன்னைவிடப் பல மடங்கு எண்ணிப் பார்க்க முடியாத அளவிற்கு சம்பளம் வாங்குகிறார்கள்.",10
கல்வி_எனும்_கண்,"என்றாலும் பிள்ளைகள் கல்வியில் போதிய கருத்தினைச் செலுத்தவில்லை எனப் பெற்றோர்களும், தலைவர்களும், ஆளுநர், அமைச்சர் போன்றார்களும் சொல்லுகின்றனர்.",13
கல்வி_எனும்_கண்,அரசின் கண்காணிப்பும் அதிகமாக்கப்பெறல் வேண்டும்.,4
கல்வி_எனும்_கண்,எனவே அதிகக் கண்காணிப்பும் கண்டிப்பும் ஆரம்ப உயர்நிலைப் பள்ளிகளுக்குத் தேவையானவை.,8
கல்வி_எனும்_கண்,இலவசக் கல்வியுடன் அரசியலும் இணைக்கப் பெற்றிருப்பதால் என் கருத்தினை ஏற்றுக்கொள்ள மாட்டார்கள் என்பது தெரியும்.,11
கல்வி_எனும்_கண்,எனினும் உள்ள நிலையினைத் தெள்ளத்தெளியக் காட்டவே இதைக் குறித்தேன்.,7
கல்வி_எனும்_கண்,இப்படியே இலவச பஸ் பாஸ் வழங்கலும்.,5
கல்வி_எனும்_கண்,இது வேண்டுமென்று யாரும் கேட்கவில்லை.,4
கல்வி_எனும்_கண்,பெரும்பாலும் பள்ளிப் பிள்ளைகள் தத்தம் வாழிடங்களுக்கு அருகில் உள்ள பள்ளிகளிலேயே இடம் பெறுகின்றனர்.,10
கல்வி_எனும்_கண்,சம்பளம் வாங்கும் பள்ளிகளில் பெரும்பாலன உந்துவண்டிகள் கொண்டுள்ளன.,6
கல்வி_எனும்_கண்,எனவே இந்த நிலை தேவையற்றது.,4
கல்வி_எனும்_கண்,பல பள்ளிகளில் இதனால் முறையான வேலையும் தடைப்படுகிறது.,6
கல்வி_எனும்_கண்,பெற்றோர்களும் மாணவர்களும் உடன் வாங்கித் தரவில்லையே என வாதிடும் நிலையும் உண்டாகிறது.,9
கல்வி_எனும்_கண்,இப்படித் தேவையற்ற வகையில் அரசியல் பின்னணியில் அமையும் சில செயல்களைப் பற்றி அதிகம் எழுதாமல் இருப்பதே நலமென எண்ணுகிறேன்.,14
கல்வி_எனும்_கண்,ஒருவரையும் குறைசொல்லுவதற்கென்றோ குற்றம் சாட்டுவதற்கென்றோ வேறு பழிபடர்நிலையிலோ நான் இவற்றை எழுதவில்லை.,9
கல்வி_எனும்_கண்,அதனாலேயே அத்தகைய பல்கலைக்கழகங்களை நாடி நம்நாட்டு மக்களுள் பலர் வெளிநாடுகளுக்குச் செல்கின்றனர்.,9
கல்வி_எனும்_கண்,"இந்தியாவை, தமிழ்நாட்டை அவ்வாறு பலர் நாடிவந்தகாலமும் ஒன்று இருந்தது.",7
கல்வி_எனும்_கண்,ஆய்ந்து கண்டு உணர்த்துவனவாய் அமையவேண்டும்.,4
கல்வி_எனும்_கண்,"கல்வியெனும் மாளிகையில் உயர்ந்த மேல்மாடியாக நின்று, படிப்படியாக ஏறிவரும் அறிஞரை சான்றோரை முழுமைபெறச் செய்வன இவை.",12
கல்வி_எனும்_கண்,இங்கே காழ்ப்புக்கும் கசப்புக்கும் வேற்றுமைக்கும் வேறுபாட்டுக்கும் இடமில்லை.,6
கல்வி_எனும்_கண்,வஞ்சகத்துக்கும் வன்கண்மைக்கும் வழக்குக்கும் வாதத்துக்கும் இடம் இல்லை.,6
கல்வி_எனும்_கண்,இவ்விடம் துலாக்கோல் போன்று நேர்மை வழங்கும் கடவுள் சந்நிதானம் போன்ற ஒன்றாகும்.,9
கல்வி_எனும்_கண்,பல்கலைக்கழகம் என்ற சொல்லே பொருள் பொதிந்ததாகும்.,5
கல்வி_எனும்_கண்,மாந்தர்க்குக் கண் என அமைந்த இக்கல்வி இத்தகைய பரந்த விரிந்த தெளிந்த நுண்ணிய ஆய்ந்த தன்மையில் உள்ளதாக அமையவேண்டும்.,14
கல்வி_எனும்_கண்,ஆனால் இன்றைய பல்கலைக் கழகங்கள் நம் தமிழ்நாட்டுப் பல்கலைக் கழகங்கள் இந்தப் பெருநிலையில் உள்ளனவா?,11
கல்வி_எனும்_கண்,உலகெங்கும் சுற்றி மேலைநாட்டுப் பல்கலைக் கழகங்கள் பலவற்றையும் கீழைநாட்டுப் பல்கலைக் கழகங்கள் சிலவற்றையும் கண்டவன் நான்.,12
கல்வி_எனும்_கண்,அவற்றோடு நம் நாட்டுப் பல்கலைக் கழகங்களை ஒப்புநோக்கின் நாம் எங்கோ பின்நிலையில் இருக்கின்றோம் என்பதை அறியமுடியும்.,12
கல்வி_எனும்_கண்,நம்நாட்டு அறிவியல் நுணுக்கங்களை விளக்கும் பண்டைய இலக்கியங்களுக்கு மேலை நாட்டுப் பல்கலைக்கழகங்கள் விளக்கம் தருகின்றன போற்றுகின்றன.,12
கல்வி_எனும்_கண்,"அவைபற்றி, மேலும் மேலும் ஆராய்கிறார்கள்.",4
கல்வி_எனும்_கண்,ஆனால் இங்கோ அவற்றைப் படிக்க வேண்டியவர்கள் கூடப் படிப்பதில்லை.,7
கல்வி_எனும்_கண்,அதன் பயன் என்ன என்று எண்ணிப்பார்ப்பதில்லை.,5
கல்வி_எனும்_கண்,இவற்றைத் தெளிவுபடுத்தி உலகுக்கு உணர்த்தவேண்டிய வழங்கவேண்டிய பல்கலைக் கழகங்கள் எதை எதையோ எடுத்து ஆராய்கின்றன.,11
கல்வி_எனும்_கண்,தமிழ்த்துறை ஒன்றினை மட்டும் நான் சுட்டிக்காட்டினேன்.,5
கல்வி_எனும்_கண்,பிற துறைகளைப் பற்றி அவ்வத் துறையினர் நன்கு அறிவர்.,7
கல்வி_எனும்_கண்,தமிழ்நாட்டு மிகப் பழைய பல்கலைக்கழகம் சென்னைப் பல்கலைக்கழகந்தான்.,6
கல்வி_எனும்_கண்,"அதற்குச் சற்று முன்பாக அதே ஆண்டில் பம்பாய், கல்கத்தா பல்கலைக்கழகங்கள் தோன்றின என அறிகிறோம்.",11
கல்வி_எனும்_கண்,இத்தகைய பழம்பெரும் பல்கலைக்கழகம் பரந்த எல்லையினைக் கட்டி ஆண்டது.,7
கல்வி_எனும்_கண்,"கேரளம், கன்னடம், ஆந்திரப் பகுதிகளையும் ஐதராபாத் எல்லையினையும் அன்று சென்னைப் பல்கலைக்கழகம் கொண்டிருந்தது.",10
கல்வி_எனும்_கண்,இன்று ஒரிசாவுடன் இருக்கும் கஞ்சம் தொடங்கிக் குமரி வரையிலும் மேல் கீழ் கடல் எல்லையிலும் இது ஆட்சி செலுத்தியது.,14
கல்வி_எனும்_கண்,நல்லவர்கள் இதில் இருந்து நாட்டு மேனிலைக் கல்வியினை நன்கு வளர்த்து வந்தனர்.,9
கல்வி_எனும்_கண்,எனினும் அன்று இதன் ஆணையின்கீழ் இருந்த கல்லூரிகளின் எண்ணிக்கையினைக் காட்டிலும் இன்று எண்ணிக்கை அதிகமாக உள்ளது.,12
கல்வி_எனும்_கண்,"மருத்துவம், விவசாயம், பொறியியல், கால்நடை போன்ற வகைக்கொரு பல்கலைக்கழகம் அமைந்து இ ன் அடிப்படைப் பகுதிகளையும் சுருங்கச் செய்துவிட்டன.",14
கல்வி_எனும்_கண்,"இன்று தமிழகத்தில் தனிப்பட அண்ணாமலை, அழகப்பர், அவினாசிலிங்கம் போன்றோருடைய பல்கலைக்கழகங்கள்.",8
கல்வி_எனும்_கண்,அம்பாத்துறை காந்தி கிராமம் பல்கலைக்கழகம் ஆகியவையும் தனி ஆணை செலுத்துகின்றன.,8
கல்வி_எனும்_கண்,தமிழுக்கும் மகளிருக்கும் என்றும் தனிப் பல்கலைக் கழகங்கள் உள்ளன.,7
கல்வி_எனும்_கண்,ஆகவே பாட அளவிலும் பரப்பளவிலும் எல்லை சுருங்கியதாகச் சென்னைப் பல்கலைக் கழகம் நின்றுவிட்டது.,10
கல்வி_எனும்_கண்,சென்னை நகரிலேயே இன்று பல்கலைக் கழகங்கள் உள்ளன.,6
கல்வி_எனும்_கண்,எனினும் அவை தனிப்பட்டவை.,3
கல்வி_எனும்_கண்,சென்னைப் பல்கலைக் கழகம் மட்டுமே கல்லூரிகளை இணைத்துத் தேர்வு நடத்துகின்றது.,8
கல்வி_எனும்_கண்,இங்கே எல்லாப் பல்கலைக் கழகங்களைப் பற்றியும் எண்ணிப் பார்த்து எழுத இடமில்லை.,9
கல்வி_எனும்_கண்,முற்றும் என்னால் அறிந்து கொள்ளவும் முடியர்து.,5
கல்வி_எனும்_கண்,எனவே சென்னைப் பல்கலைக் கழகத்தை மட்டும் எடுத்துக் காண நினைக்கின்றேன்.,8
கல்வி_எனும்_கண்,இது அறிவு வளம் பெற்றவனாக்கி என்னை வளர்த்துப் பெயரிட்டு உலகில் உலவவிட்ட பல்கலைக் கழகம் அல்லவா !,12
கல்வி_எனும்_கண்,இது பற்றி நான் காட்டும் நல்லவையோ அல்லவையோ பிறவற்றிற்கும் பொருந்தும் என்றும் கூறமாட்டேன்.,10
கல்வி_எனும்_கண்,நான் முன்பே சுட்டியபடி மேலை நாட்டுப் பல்கலைக் கழகங்களின் செயல்திறனை ஒப்பு நோக்கும்போது நாம் எங்கோ பின்னிலையில்தான் உள்ளோம்.,14
கல்வி_எனும்_கண்,"அங்கெல்லாம் பயிற்று முறையும், பாட அமைப்பும், தேர்வு முறையும், பிற செயல்முறைகளும் நமக்கு வழிகாட்டிகளாக உள்ளன.",12
கல்வி_எனும்_கண்,என்று கூறக் கேட்கிறோம்.,3
கல்வி_எனும்_கண்,"ஆசிரியர்கள் தொழிற்சங்கங்கள் அமைத்து, பயனுள்ள முறையன்றி மாறுபடுவதைப் பலர் சுட்டிக் காட்டி வருகின்றனர்.",10
கல்வி_எனும்_கண்,பல்கலைக்கழகத்திலும் அதன் அங்கங்களாகிய கல்லூரிகளிலும் இன்றைய நிலை வருந்தத்தக்கதாக உள்ளது.,8
கல்வி_எனும்_கண்,எதற்கெடுத்தாலும் வேலை நிறுத்தமும் உண்ணாவிரதமும் மேற்கொள்ளும் முறை இத்தூய தெய்வத்தலங்களில் நடைபெறுவது வருந்தத்தக்கது.,10
கல்வி_எனும்_கண்,அத்தகைய அவலநிலைக்கு அவர்களைத் தள்ளாத வகையில் ஆட்சியாளரும் செயல்படவேண்டும்.,7
கல்வி_எனும்_கண்,ஒரு பாடத்துக்கு நான்கு அல்லது மூன்று ஆசிரியர் எனப் பாடம் நடத்துகின்றனர்.,9
கல்வி_எனும்_கண்,ஆனால் பாடத்திட்டமோ பயிற்று முறையோ அவ்வாறு அமைவதில்லை.,6
கல்வி_எனும்_கண்,"ஆசிரியர்களும், முன்னரே நான் காட்டியபடி எந்தப் பயிற்சியும் பெறாமல் திடீரெனக் கற்பிக்க வந்து விடுகின்றனர்.",11
கல்வி_எனும்_கண்,ஆசிரியர்களுக்குக் குறைந்தது இரண்டாண்டுகளாவது பயிற்சி அளிக்க அரசாங்கம் ஏற்பாடு செய்யவேண்டும்.,8
கல்வி_எனும்_கண்,அவர்கள் ஏதேனும் ஒரு பாடத்தினைத் திறம்பட நடத்தும் வகையில் ஏற்ற பயிற்சி அளிக்கப் பெறல் வேண்டும்.,12
கல்வி_எனும்_கண்,அனைத்திந்தியத் தேர்வுகளிலும் முதலிடம் பெற்றுத் திகழ்ந்தது.,5
கல்வி_எனும்_கண்,இன்று பல்கலைக்கழகம் தன்னிலையினின்று தாழ்ந்தமையானும் கல்லூரிகளும் வெறும் வாணிப நிறுவனங்களாக மாறிவருகின்றமையானும் தரத்தினைக் காண முடிவதில்லை.,12
கல்வி_எனும்_கண்,மதிப்பெண் அடிப்படையில் சேர்ப்பன விடுத்து பணத்தெண்ணைக் கணக்கிட்டுச் சேர்க்கும் கல்லூரிகளே அதிகமாகிவிட்டன.,9
கல்வி_எனும்_கண்,மருத்துவக் கல்லூரிக்கு ஐந்துலட்சம் ஆறுலட்சம் வரையிலும் பொறியியல் கல்லூரிக்கு இரண்டு லட்சம் வரையிலும் பேரங்கள் நடைபெறுகின்றன.,12
கல்வி_எனும்_கண்,இவற்றைத் தடுக்க யார் நினைக்கிறார்கள்?,4
கல்வி_எனும்_கண்,பல்கலைக் கழகங்கள் இவற்றைக் கண்டிப்பதற்குப் பதிலாக ஊக்குவிக்கின்றன என்ற பேச்சே எங்கும் அடிபடுகிறது.,10
கல்வி_எனும்_கண்,கல்லூரிகளில் தேர்வு நடத்தும் முறையிலும் சீர்கேடுகள் உள்ளன என்பர்.,7
கல்வி_எனும்_கண்,பல்கலைக் கழகச் செயற்பாடுகளிலும் மிகுந்த குறைபாடுகள் இருக்கக் காண்கிறோம்.,7
கல்வி_எனும்_கண்,ஊனினைச் சுருக்கின் உள்ளோளி பெருகும் என்பார் ஆன்றோர்.,6
கல்வி_எனும்_கண்,"ஆனால் இங்கே ஊன் சுருங்க, உள்ளமுமன்றோ சுருங்கிவிட்டது.",6
கல்வி_எனும்_கண்,நான் சுமார் ஐம்பது ஆண்டுகளாகச் சென்னைப் பல்கலைக் கழகத்தோடு தொடர்பு உடையவன்.,9
கல்வி_எனும்_கண்,ஆட்சிக்குழு ஒன்று தவிர்த்து பிற அனைத்திலும் பங்குகொண்டவன்.,6
கல்வி_எனும்_கண்,சிலவற்றில் உறுப்பினனாகவும் சிலவற்றில் தலைவனாகவும் இருந்து பணியாற்றி வந்துள்ளேன்.,7
கல்வி_எனும்_கண்,எடுத்துக்காட்டுக்கு இரண்டொன்று காட்ட நினைக்கிறேன்.,4
கல்வி_எனும்_கண்,தவறாயின் பொறுத்திட வேண்டும் !,3
