work_title,sentence,sentence_length
கலீலியோவின்_நம்மை_மேம்படுத்தும்_எண்ணங்கள்,"அவர் கொண்டுள்ளக் கருத்துக்களைக், கொள்கைகளைத் தமது உள்ளத்தினின்றும் உடனே அகற்றி விட வேண்டும் !",10
கலீலியோவின்_நம்மை_மேம்படுத்தும்_எண்ணங்கள்,"அவ்வாறு செய்ய விட்டால் கலீலியோ கண்டிப்பாகத்தண்டிக்கப்படுவார் என்று போப்பாண்டவர் அவருக்கு நிபந்தனையும், எச்சரிக்கையும் விதித்தார்.",11
கலீலியோவின்_நம்மை_மேம்படுத்தும்_எண்ணங்கள்,"ஒரு போப், வானியல், அறிவியல் உணர்வுகளே இல்லாதிருப்பதனால் வரும் கேடுபாடு இது என்பதை உணர்ந்தார் !",11
கலீலியோவின்_நம்மை_மேம்படுத்தும்_எண்ணங்கள்,"போப் ஆண்டவர் என்பவர், வானியல் அதிசயங்களை உணராதவராக உள்ளாரே என்று அவர் வருத்தப்பட்டார் !",10
கலீலியோவின்_நம்மை_மேம்படுத்தும்_எண்ணங்கள்,"வானியல் வரலாறு, தத்துவம் ஆகியவற்றைப் போப் அறிந்திராவிட்டால் பரவாயில்லை அவற்றுக்காகக் கண்டு பிடிக்கப்பட்ட கருவிகள் என்ன?",12
கலீலியோவின்_நம்மை_மேம்படுத்தும்_எண்ணங்கள்,அவற்றின் தத்துவப் பயன்கள் என்னென்ன?,4
கலீலியோவின்_நம்மை_மேம்படுத்தும்_எண்ணங்கள்,அதனால் உலகுக்கு வரும் புதுமை வளர்ச்சிகள் என்னென்ன?,6
கலீலியோவின்_நம்மை_மேம்படுத்தும்_எண்ணங்கள்,இக்கருவிகளால் உலக மக்களுக்குப் பயனுண்டா?,4
கலீலியோவின்_நம்மை_மேம்படுத்தும்_எண்ணங்கள்,என்ற விபரத்தையாவவது என்னை அழைத்துக் கேட்டிருக்கலாம்.,5
கலீலியோவின்_நம்மை_மேம்படுத்தும்_எண்ணங்கள்,அதற்காகக் கண்டு பிடிக்கப்பட்டக் கருவிகளின் பயன்கள் யாவை?,6
கலீலியோவின்_நம்மை_மேம்படுத்தும்_எண்ணங்கள்,மக்களுக்கு அதனால் நன்மையா?,3
கலீலியோவின்_நம்மை_மேம்படுத்தும்_எண்ணங்கள்,என்பதையாவது தீர்மானம் செய்திருக்க வேண்டாமா?,4
கலீலியோவின்_நம்மை_மேம்படுத்தும்_எண்ணங்கள்,அதைக் கேட்டவர்கள் மனம் கொதித்துக் கூச்சலிட்டனர் !,5
கலீலியோவின்_நம்மை_மேம்படுத்தும்_எண்ணங்கள்,எவ்வளவு நாட்களுக்கு ஒரு சிந்தனை முடக்கு வாத நோய்க்குட்பட்ட தளர்வோடு முடங்கிக்கிடக்கும்?,9
கலீலியோவின்_நம்மை_மேம்படுத்தும்_எண்ணங்கள்,மூன்றாம் நாளே அவர் தனது ஆராய்ச்சிப் பணிகளை ஆரம்பித்து விட்டார்.,8
கலீலியோவின்_நம்மை_மேம்படுத்தும்_எண்ணங்கள்,"அவ்வாறு செய்ததின் விளைவாக, அவர் பல புதிய புதிய உண்மைகளைக் கண்டறிந்து வெளியிட்டார்.",10
கலீலியோவின்_நம்மை_மேம்படுத்தும்_எண்ணங்கள்,"அதனால், அவரது புதிய தனிமைக் கண்டு பிடிப்புக்களை உலகம் உணர ஆரம்பித்தது.",9
கலீலியோவின்_நம்மை_மேம்படுத்தும்_எண்ணங்கள்,கலீலியோவின் எதிரிகள் மீண்டும் விழித்தெழுந்தார்கள்.,4
கலீலியோவின்_நம்மை_மேம்படுத்தும்_எண்ணங்கள்,"கலீலியோ வெளியிட்ட நூல், அவரது பகைவர்கள் இடையேயும், மக்கள் மத்தியிலும் புதியதோர் பரபரப்புச் சூழ்நிலை உருவாக்கியது.",12
கலீலியோவின்_நம்மை_மேம்படுத்தும்_எண்ணங்கள்,"வாயால் பேசக்கூடாது என்ற கலீலியோ கருத்துக்கள், எண்ணங்கள் எல்லாம் இப்போது புத்தக உருவிலே நாட்டில் நடமாடின !",12
கலீலியோவின்_நம்மை_மேம்படுத்தும்_எண்ணங்கள்,"அதைக் கண்ட போப் திருச்சபையினர், கலீலியோவை எங்கிருந்தாலும் துரத்திப்பிடி !",7
கலீலியோவின்_நம்மை_மேம்படுத்தும்_எண்ணங்கள்,வேகமாகச் செயல்பட்டு கைது செய் என்ற பழைய போப் ஆணைமீது மறுபடியும் ஒரு புது கட்டளையை பிறப்பித்தார்கள் !,13
கலீலியோவின்_நம்மை_மேம்படுத்தும்_எண்ணங்கள்,சிறைபட்ட அன்றே கலீலியோவை ரோமாபுரியின் சிறைக்குக் கொண்டு போய் விட்டார்கள்.,8
கலீலியோவின்_நம்மை_மேம்படுத்தும்_எண்ணங்கள்,அந்தக் கருத்து பைபிள் வேதாகமத்திற்கு நேர் விரோதமானது என்ற குற்றச்சாட்டை போப்பாண்டவர் சாட்டினார்.,10
கலீலியோவின்_நம்மை_மேம்படுத்தும்_எண்ணங்கள்,என்ன வாதாடி என்ன பயன்?,4
கலீலியோவின்_நம்மை_மேம்படுத்தும்_எண்ணங்கள்,எட்டிப் பழத்திலே தேன் சுவைச்சாறா சுரக்கும்?,5
கலீலியோவின்_நம்மை_மேம்படுத்தும்_எண்ணங்கள்,எட்டிதானே ஊரார் எனவே அவரது உண்மைகளையே குற்றம் சாட்டி கலீலியோவுக்கு ஆயுட்காலச் சிறை தண்டனை என்று போப்பாண்டவர் தீர்ப்பளித்தார் !,14
கலீலியோவின்_நம்மை_மேம்படுத்தும்_எண்ணங்கள்,ஆயுள் தண்டனை சிறை பெற்ற போது கலீலியோவுக்கு வயது எழுபது மூதறிஞராகி விட்டார் பாவம் !,11
கலீலியோவின்_நம்மை_மேம்படுத்தும்_எண்ணங்கள்,நாடு கடத்தப்பட்டார் கலீலியோ !,3
கலீலியோவின்_நம்மை_மேம்படுத்தும்_எண்ணங்கள்,சீயன்னா நகர் சென்ற கலீலியோவுக்கு வறுமை நோய் அவரைப் பற்றிக் கொண்டது.,9
கலீலியோவின்_நம்மை_மேம்படுத்தும்_எண்ணங்கள்,"அதனால், அவர் மட்டும் அல்லல்களை ஏற்கவில்லை !",5
கலீலியோவின்_நம்மை_மேம்படுத்தும்_எண்ணங்கள்,குடும்பமே வறுமை நெருப்பிலே சிக்கி கருகிய நிலையில் வாடியது !,7
கலீலியோவின்_நம்மை_மேம்படுத்தும்_எண்ணங்கள்,"அதனால், அவருடைய உடல் மிகவும் பலவீனமானது மெலிந்தது உடல் !",7
கலீலியோவின்_நம்மை_மேம்படுத்தும்_எண்ணங்கள்,சோர்ந்தது உள்ளம் சுருங்கியது தோல் பற்றியது அவரைப் பெரு தோய் இறுதியாக அலைந்தார் தன்னையும் மறந்து !,12
கலீலியோவின்_நம்மை_மேம்படுத்தும்_எண்ணங்கள்,அவருக்கு மட்டுமன்று பெருநோய் அவருடைய அன்பு மகளுக்கு வந்தது பசிநோய் !,8
கலீலியோவின்_நம்மை_மேம்படுத்தும்_எண்ணங்கள்,அந்தப் பெருநோயால் மரணம் விழுங்கியது அவளை !,5
கலீலியோவின்_நம்மை_மேம்படுத்தும்_எண்ணங்கள்,மகளே என்று அழுது அழுதுக்கதறி ஆறாத்துயருற்றார் !,5
கலீலியோவின்_நம்மை_மேம்படுத்தும்_எண்ணங்கள்,அன்று முதல் உணவை மறந்தார் உறக்கத்தை மறத்தார் உணர்வற்ற நடைப் பிணம்போல வாழ்ந்தார் !,10
கலீலியோவின்_நம்மை_மேம்படுத்தும்_எண்ணங்கள்,"அதனால், அவர் பார்வை இழந்து குருடரானார் செவிகளும் செவிடாகின.",7
கலீலியோவின்_நம்மை_மேம்படுத்தும்_எண்ணங்கள்,"உடலும், உள்ளமும் நரம்பும் தோலுமானது !",4
கலீலியோவின்_நம்மை_மேம்படுத்தும்_எண்ணங்கள்,"அவர் கண்டறிந்த உண்மைகளைக் கொண்டே, பிற்கால உலகம் கடிகாரம் என்னும் காலம் காட்டும் கருவியை உருவாக்கிக் கொண்டது.",13
கலீலியோவின்_நம்மை_மேம்படுத்தும்_எண்ணங்கள்,புறவிரோதிகளாலும் உருட்டி விடப்பட்டால் தலைகுப்புற வீழ்ந்து சாகவேண்டிய அபாயம் தானே அவனுக்கு வரும்.,10
கலீலியோவின்_நம்மை_மேம்படுத்தும்_எண்ணங்கள்,"ஆனால், கலீலியோ இந்த மனிதப் பகைக்கு விதிவிலக்காகக்கூட இல்லை முழு விரோதியாகவே அவரை கிறித்தவ குருமார்கள் சித்தரித்துக் காட்டிவிட்டார்கள்.",14
கலீலியோவின்_நம்மை_மேம்படுத்தும்_எண்ணங்கள்,"இந்த வேதனை வாழ்க்கை மனித இனத்திற்கு எவ்வளவு பெரிய தீராப்பழியாகவும், பாவமாகவும், அமைகின்றது.",10
கலீலியோவின்_நம்மை_மேம்படுத்தும்_எண்ணங்கள்,"என்பதை நாம் என்னும் போது, நமக்கு ஒரு பெரும் எச்சரிக்கை வழங்கும் மனபாரமாகவே அது மாறுகின்றது.",12
கலீலியோவின்_நம்மை_மேம்படுத்தும்_எண்ணங்கள்,கலீலியோவின் வாழ்க்கை என்ற சுமைதாங்கியில் இந்த மன பாரத்தை நம்மால் இறக்கிவைத்து இளைப்பாற முடியுமா?,11
கலீலியோவின்_நம்மை_மேம்படுத்தும்_எண்ணங்கள்,இது மனித குலத்தின் கேள்வி !,4
கலீலியோவின்_நம்மை_மேம்படுத்தும்_எண்ணங்கள்,"காலமெல்லாம், கல்லைறையான பிறகெல்லாம், அவதூறுகனை வாரி இறைத்து வரலாற்றுக் களங்கத்தை உருவாக்கி விடுகிறது !",10
கலீலியோவின்_நம்மை_மேம்படுத்தும்_எண்ணங்கள்,மரணம் அவருக்கு மாலை போட்டு வரவேற்று வாழ்த்தி அணைத்துக் கொண்டது.,8
கலீலியோவின்_நம்மை_மேம்படுத்தும்_எண்ணங்கள்,"ஏனென்றால், கலீலியோ ஒரு சிறைக் கைதியாக மரணமடைந்தாராம் அவருக்கு ஒரு நினைவுச் சின்னம் எழுப்பாததற்கு இது தான் காரணமாம் !",14
கலீலியோவின்_நம்மை_மேம்படுத்தும்_எண்ணங்கள்,ஆனால் தன்விருப்பப்படி சிந்தித்துப் பார்க்கும் மனப்பான்மை எவருக்கும் இருக்கவில்லை.,7
கலீலியோவின்_நம்மை_மேம்படுத்தும்_எண்ணங்கள்,இந்த மூன்று விஞ்ஞான மேதைகளும் அறிவாற்றலில் மனத்திறனில் உண்மையான சர்வதேசவாதிகளாகவே திகழ்ந்தார்கள் !,9
கலீலியோவின்_நம்மை_மேம்படுத்தும்_எண்ணங்கள்,பழைய உலகில் இருந்து புதிய உலகத்துக்குச் சரித்திரம் திரும்பிய காலத்தில் அவர் இருந்தார்.,10
கலீலியோவின்_நம்மை_மேம்படுத்தும்_எண்ணங்கள்,"சூரியனும், மற்ற கோள்களும் பூமியைச்சுற்றி வருகின்றன என்று நம்பிக்கை.",7
கலீலியோவின்_நம்மை_மேம்படுத்தும்_எண்ணங்கள்,ஆயிரமாயிரம் ஆண்டுகளாக இருந்து வந்தது.,4
கலீலியோவின்_நம்மை_மேம்படுத்தும்_எண்ணங்கள்,அந்த எண்ணத்தையாரும் மறுத்துரைத்து உண்மை என்ன என்பதை எடுத்துக் கூறவில்லை.,8
கலீலியோவின்_நம்மை_மேம்படுத்தும்_எண்ணங்கள்,"கோப்பர் நிக்கசுக்கு முன்பு இருந்த சிந்தனையாளர்கள் பலர், பூமியே மையம் என்ற கோட்பாட்டை எதிர்த்தார்.",11
கலீலியோவின்_நம்மை_மேம்படுத்தும்_எண்ணங்கள்,பூமியே மையம் என்ற எண்ணத்தை எதிர்த்து அவர் புத்தகம் எழுதினார்.,8
கலீலியோவின்_நம்மை_மேம்படுத்தும்_எண்ணங்கள்,அந்த நூல் பிற்காலத்தில் மிகச் சிறந்த ஒரு நூலாகவே மக்களால் போற்றப்பட்டது.,9
கலீலியோவின்_நம்மை_மேம்படுத்தும்_எண்ணங்கள்,"சூரிய மண்டலத்தில், சூரியன் மையமான இடத்தில் நிலைத்து நிற்கிறது.",7
கலீலியோவின்_நம்மை_மேம்படுத்தும்_எண்ணங்கள்,பூமியும் மற்ற கிரகங்களும் தான் சூரியனைச் சுற்றி வருகின்றன என்றார்.,8
கலீலியோவின்_நம்மை_மேம்படுத்தும்_எண்ணங்கள்,அதே நேரத்தில் நட்சத்திரங்கள் நிலை என்ன என்பதையும் விவரித்திருந்தார்.,7
கலீலியோவின்_நம்மை_மேம்படுத்தும்_எண்ணங்கள்,"மதவாதிகள் எதிர்ப்பு ஏற்படாமல் இருக்க கோப்பர் நிக்கஸ் மிகச் சமர்த்தியமாக, தந்திரமாக அந்த சித்தாந்தங்களை விளக்கினார் !",12
கலீலியோவின்_நம்மை_மேம்படுத்தும்_எண்ணங்கள்,"இந்த உண்மையை, கோப்பர் நிக்கஸ் வாழ்ந்து மறைந்த நூற்றைம்பது ஆண்டுகளுக்குப் பிறகுதான், அதாவது கி.பி.",12
கலீலியோவின்_நம்மை_மேம்படுத்தும்_எண்ணங்கள்,"ஓர் ஆயிரத்து ஐநூற்று நாற்பத்து மூன்று ஆம் ஆண்டின் போது, உலகமும், மதத்தலைவர்களும் மனம் திறந்து ஒப்புக் கொண்டார்கள்.",14
கலீலியோவின்_நம்மை_மேம்படுத்தும்_எண்ணங்கள்,"சுமார் நூறு ஆண்டுகளுக்குப் பிறகுதான் கலீலியோ, கோப்பர் நிக்கஸ் கருத்து உண்மையானது என்று நிலைநாட்டினார்.",11
கலீலியோவின்_நம்மை_மேம்படுத்தும்_எண்ணங்கள்,அக்காலத்தில் கலீலியோ பயன்படுத்திய டெலஸ்கோப் என்ற தொலைநோக்கிப் பார்வைக் குழல் நூதனமான ஒரு கருவியாக எல்லோராலும் பாராட்டிப் போற்றப்பட்டது.,14
கலீலியோவின்_நம்மை_மேம்படுத்தும்_எண்ணங்கள்,"அந்தக் கருவியை கலீலியோ பயன்படுத்தியதால், புதிய இயந்திர நுட்பக் கலையுலகத்துக்கு அவர் அடிகோலிட்டார் என்று உலகம் இன்றும் பேசுகின்றது.",14
கலீலியோவின்_நம்மை_மேம்படுத்தும்_எண்ணங்கள்,"இப்போது, கலீலியோவின் சாதனைகள் என்ன?",4
கலீலியோவின்_நம்மை_மேம்படுத்தும்_எண்ணங்கள்,சந்திர மண்டல ஆராய்ச்சியை நடத்தி அவற்றின் மூலம் சந்திரனில் உள்ள பொருட்களைக் கண்டு பிடித்தார் !,11
கலீலியோவின்_நம்மை_மேம்படுத்தும்_எண்ணங்கள்,நட்சத்திர இயக்கங்களின் நிலைகள் என்ன என்பதை அவர் உலகுக்கு விவரமாக விளக்கிக் காட்டினார்.,10
கலீலியோவின்_நம்மை_மேம்படுத்தும்_எண்ணங்கள்,வியாழன் கோளை ஆராய்ச்சி செய்தார் !,4
கலீலியோவின்_நம்மை_மேம்படுத்தும்_எண்ணங்கள்,அந்த மண்டலத்துள்ளே நிலவும் நான்கு நிலாக்களைக் கண்டறிந்து உலகுக்கு புதிய ஓர் அற்புதத்தை எடுத்துரைத்தார் !,11
கலீலியோவின்_நம்மை_மேம்படுத்தும்_எண்ணங்கள்,சூரிய மண்டலத்தை ஆராய்ந்தார்.,3
கலீலியோவின்_நம்மை_மேம்படுத்தும்_எண்ணங்கள்,அதன் முகத்திலே நகரும் கரும்புள்ளிகள் என்ன?,5
கலீலியோவின்_நம்மை_மேம்படுத்தும்_எண்ணங்கள்,ஏன் அந்தக் கருப்புப் புள்ளிகள் சூரியனில் தோன்றின என்பதற்கான காரண காரியங்களைத் துல்லியமாக ஆராய்ந்து உண்மையை உலகுக்கு உணர்த்தினார்.,14
கலீலியோவின்_நம்மை_மேம்படுத்தும்_எண்ணங்கள்,வியாழன் கிரகத்தில் துணை கிரகங்கள் உள்ளன என்பதை முதன்முதலில் கண்டறிந்து மிகப்பெரும் சாதனையை உருவாக்கிய முதன் மனிதரே கலீலியோதான் !,14
