work_title,sentence,sentence_length
கம்பராமாயணம்_(உரைநடை),வானரத் தலைவனாகிய அவன் மானுடர் தலைவனாகிய இராமனை அடைந்து அடைக்கலம் பெற்றான்.,9
கம்பராமாயணம்_(உரைநடை),"இருவரும் இன்னுரையாடி நல்லுறவு கொண்டு, நட்பு உடன்படிக்கை யும் செய்து கொண்டனர்.",9
கம்பராமாயணம்_(உரைநடை),"குகனோடு ஐவராய் விளங்கிய தசரதன் மக்கள், சுக்கிரீவனோடு அறுவராயினர்.",7
கம்பராமாயணம்_(உரைநடை),சுக்கிரீவன் இராமன் இலக்குவரை விருந்துண்ண அழைத்தான் காயும் கனியும் கிழங்கும் கொண்டு வந்து வைத்தான் அவற்றை உண்டு அளவளாவினர்.,14
கம்பராமாயணம்_(உரைநடை),நீயும் நின் மனையும் சுகமா? என்று கேட்டான் இராமன்.,7
கம்பராமாயணம்_(உரைநடை),மூடியிருந்த கதவுகள் திறந்தன.,3
கம்பராமாயணம்_(உரைநடை),அடக்கி வைத்த வேதனை வெளிப்பட்டது கடந்த காலச் செய்திகளை நடந்தவாறு உரைத்தான்.,9
கம்பராமாயணம்_(உரைநடை),அனுமன் இதைக்கேட்டு அகம் மிக மகிழ்ந்தான்.,5
கம்பராமாயணம்_(உரைநடை),சுக்கிரீவனும் அதுவே தக்கவழி என்று சிந்தித்த வனாய் மகிழ்ச்சி கொண்டான் இராமனை அணுகித் தன் கருத்தை அடக்கமாய் அறிவித்தான்.,14
கம்பராமாயணம்_(உரைநடை),மராமரங்கள் ஏழும் ஒன்றன்பின் ஒன்றாய் வரிசையாய் நின்று கொண்டிருந்தன.,7
கம்பராமாயணம்_(உரைநடை),வற்றி உலர்ந்த அந்த எலும்புக்கூடு வழிமறித்தது.,5
கம்பராமாயணம்_(உரைநடை),இராமன் தன் தம்பியிடம் அதை அகற்றுமாறு குறிப்புக் காட்டினான்.,7
கம்பராமாயணம்_(உரைநடை),இலக்குவன் தன் கால் நகத்தால் அதை உதைத்துத் துக்கி எறிந்தான்.,8
கம்பராமாயணம்_(உரைநடை),அது சென்ற இடம் தெரியாமல் நெடுந்தொலைவில் விழுந்து மறைந்தது.,7
கம்பராமாயணம்_(உரைநடை),"இலக்குவன் ஆற்றலை அறிய, இது சுக்கிரீவனுக்கு ஒரு வாய்ப்பாய் அமைந்தது.",8
கம்பராமாயணம்_(உரைநடை),இது என்ன? என்று இராமன் கேட்டான்.,5
கம்பராமாயணம்_(உரைநடை),துந்துபி என்பவன் போர்த்தினவு கொண்டு வாலியொடு மோதினான் வெற்றி தோல்வி இன்றி இருவரும் கட்டிப் புரண்டனர்.,12
கம்பராமாயணம்_(உரைநடை),இறுதியில் வாலி அவனைக்குத்திக் கொன்று தரையில் வீழ்த்தினான்.,6
கம்பராமாயணம்_(உரைநடை),துந்துபியின் மாமிசப்பிண்டம் இந்த ருசியமுக பருவதத்தில் வாலியினால் தூக்கி எறியப்பட்டது இங்கு மதங்க முனிவர் தங்கி இருந்தார்.,13
கம்பராமாயணம்_(உரைநடை),அவர் இதைக்கண்டு அருவெறுப்புக் கொண்டார்.,4
கம்பராமாயணம்_(உரைநடை),"சீதை சிந்திய கலன்கள் அப்பொழுது வானரக்குலம், இடியும் அஞ்சும்படி வாய் திறந்து ஆரவாரித்தது.",10
கம்பராமாயணம்_(உரைநடை),தூய நற்சோலையில் இராமனும் சுக்கிரீவனும் அமர்ந்து இன்னுரையாடினான்.,6
கம்பராமாயணம்_(உரைநடை),நான் உணர்த்துவது ஒன்று உண்டு என்று சுக்கிரீவன் உரையாடினான்.,7
கம்பராமாயணம்_(உரைநடை),இராமன் தன்னிலை கெட்டுச் சோர்ந்து மயங்கி விழுந்தான் தான் உயிரோடு இருக்கும்போதே அணிகளைக் களையும் அவலநிலை ஏற்பட்டதே !,13
கம்பராமாயணம்_(உரைநடை),அருகிலிருந்த சுக்கிரீவன் ஆறுதலாய் நல்லுரைகள் தந்து மீண்டும் உணர்வுபெறச் செய்தான்.,8
கம்பராமாயணம்_(உரைநடை),ஒரே இடத்துக்குப் பலரையும் அனுப்பி வைப்பது மிகைப்பட்ட முயற்சியாகும்.,7
கம்பராமாயணம்_(உரைநடை),இராமனும் அவன் சொல்வது சரி என்று ஏற்றுக் கொண்டான்.,7
கம்பராமாயணம்_(உரைநடை),சுக்கிரீவனும் அவன் அமைச்சர் நால்வரும் இராம இலக்குவரைத் தொடர்ந்து மலைச்சாரல் இடையே சென்றனர்.,10
கம்பராமாயணம்_(உரைநடை),தான் செய்யத் தக்கது யாது? என்று சுக்கிரீவன் இராமனை நோக்கிக் கேட்டான்.,9
கம்பராமாயணம்_(உரைநடை),அவனே வலிய வந்து வகையாய் மாட்டிக் கொள்ளும்போது நாம் என்ன செய்ய முடியும்?,10
கம்பராமாயணம்_(உரைநடை),அவனுக்குச் சரியான பாடம் கற்பிக்க வேண்டும் என்று கூறி எழுந்தான் வாலி.,9
கம்பராமாயணம்_(உரைநடை),வாலி கடுங்கோபம் கொண்டான் இராமன் திருப்பெயருக்கு மாசு கற்பிப்பதை அவனால் தாங்கிக் கொள்ள முடியவில்லை.,11
கம்பராமாயணம்_(உரைநடை),"இராமன், வாலியின் தோற்றத்தைக் கண்டு இலக்குவனிடம் அவனைப் பற்றிப் பெருமையாய்ப் பேசினான்.",9
கம்பராமாயணம்_(உரைநடை),"இலக்குவன், சுக்கிரீவன் நம்பத்தகுந்தவன் அல்லன் என்று எடுத்து உரைத்தான்.",7
கம்பராமாயணம்_(உரைநடை),"அண்ணனையே கொல்வதற்கு நம்மை அவன் துணை தேடுகிறான் என்றால், அது துரோகம் அல்லவா?",10
கம்பராமாயணம்_(உரைநடை),அவனை நம்புவது மண் குதிரையை நம்பி நட்டாற்றைக் கடப்பது போலத் தான் ஆகும் என்றான்.,11
கம்பராமாயணம்_(உரைநடை),தம்பியர் எல்லாம் பரதன் ஆகமுடியுமா?,4
கம்பராமாயணம்_(உரைநடை),யார் பக்கம் நியாயம் இருக்கிறது?,4
கம்பராமாயணம்_(உரைநடை),என்பதை வைத்துத்தான் ஒரு காரியத்தில் இறங்க வேண்டும்.,6
கம்பராமாயணம்_(உரைநடை),"வாலி, சுக்கிரீவனுக்கு உரிய ஆட்சியை எடுத்துக் கொண்டான் தவறு இல்லை அவன் மனைவியை ஏன் அவன் கைப்பற்ற வேண்டும்?",14
கம்பராமாயணம்_(உரைநடை),எந்தத் தவறும் செய்யாத தம்பியை அவன் ஏன் விரட்டி அடிக்க வேண்டும்?,9
கம்பராமாயணம்_(உரைநடை),வாலி தவறு உடையவன் அவனை அழிப்பதுதான் அறம் என்று கூறித் தெளிவுபடுத்தினான் இராமன்.,10
கம்பராமாயணம்_(உரைநடை),போர் மும்முரமாய் நடந்தது சுக்கிரீவனை வாலி பந்தாடுவது போலத் துக்கி எறிந்தான்.,9
கம்பராமாயணம்_(உரைநடை),ஊக்கம் மிகுந்தவனாக வாலியோடு சுக்கிரீவன் போரில் இறங்கினான்.,6
கம்பராமாயணம்_(உரைநடை),அவனை விண்ணில் எறிய வாலி தயாராய் இருந்தான்.,6
கம்பராமாயணம்_(உரைநடை),"பரதனுக்குத் தமையனாய் விளங்கியவன், சகோதர பாசத்துக்கு இடையூறு செய்யலாமா? என்று கேட்டான்.",9
கம்பராமாயணம்_(உரைநடை),ஒவியத்தில் எழுத ஒண்ணா உருவத்தாய் !,4
கம்பராமாயணம்_(உரைநடை),காவிய நாயகனாகிய நீ நடுநிலைமை தடுமாறலாமா?,5
கம்பராமாயணம்_(உரைநடை),சீதையைப் பிரிந்துவிட்டதால் மனம் தடுமாறி இந்தத் தவறைச் செய்துவிட்டாயா?,7
கம்பராமாயணம்_(உரைநடை),உலகநெறி என்பது உயர்ந்தவர் செய்கையில் தானே அமைந்து கிடக்கிறது?,7
கம்பராமாயணம்_(உரைநடை),அதற்கு இராமன் விடை தரவில்லை இலக்குவன் இடைமறித்து.,6
கம்பராமாயணம்_(உரைநடை),அதைத் தவிர்ப்பதற்குத்தான் மறைந்து இருந்து அம்பு செலுத்த வேண்டி நேர்ந்தது என்று பதில் கூறினான்.,11
கம்பராமாயணம்_(உரைநடை),"ஒழுக்கம் என்பது மானிடர்க்கு விதிக்கப்பட்ட வரையறை, நாங்கள் விலங்குகள் விலங்குகளுக்குள் கணவன் மனைவி என்ற உரிமை கொண்டாட முடியாது.",14
கம்பராமாயணம்_(உரைநடை),அதற்குப் பின் இராமன் தவறு செய்யமாட்டான் நீரில் நெருப்புத் தோன்றாது தவறு தன்னுடையதுதான் என்று உணர்ந்து அடங்கிவிட்டான் வாலி.,14
கம்பராமாயணம்_(உரைநடை),வாலி சிறியன சிந்தியாதான் என்பதை இராமன் இதனால் அறிய முடிந்தது.,8
கம்பராமாயணம்_(உரைநடை),வாலி இராமன் மதிப்பில் மிக உயர்ந்து நின்றான்.,6
கம்பராமாயணம்_(உரைநடை),தன் தம்பியைப் பார்த்து அவனுக்கு அறிவுரைகள் சில கூறினான்.,7
கம்பராமாயணம்_(உரைநடை),எமன் வருதற்கு அஞ்சும் உன்னை மரணம் எப்படித் தழுவியது?,7
கம்பராமாயணம்_(உரைநடை),"இந்த வெறும் உடம்பு, நீ இல்லாமல் எப்படி வாழும்?",7
கம்பராமாயணம்_(உரைநடை),காலையும் மாலையும் சென்று நீ முக்கண்ணனை வழிபடுவாயே !,6
கம்பராமாயணம்_(உரைநடை),இப்பொழுது நீ என்ன செய்வாய்?,4
கம்பராமாயணம்_(உரைநடை),எப்படி உன்னால் வாளா இருக்க முடிகிறது?,5
கம்பராமாயணம்_(உரைநடை),"என் மெல்லிய ஆடைமீது சாயும் நீ, எப்படி வன்மையான தரையில் கிடக்கிறாய்?",9
கம்பராமாயணம்_(உரைநடை),பொய் புகலாத புண்ணியனே !,3
கம்பராமாயணம்_(உரைநடை),நீ என் உயிர் என்று புகழ்ந்து பேசுவாயே !,6
கம்பராமாயணம்_(உரைநடை),உயிரைவிட்டு உயிர் எப்படிப் போக முடியும்?,5
கம்பராமாயணம்_(உரைநடை),"அமுதத்தைத் தந்த உனக்குத் தேவர், பாராட்டுரை வழங்க, எதிர்கொண்டு அழைத்து உபசரித்தார்களோ?",9
கம்பராமாயணம்_(உரைநடை),"போருக்குச் சென்றபோதே தடுத்தேனே, இராமன் சுக்கீரவனுக்குத் துணையாய் வந்திருக்கிறான் என்று சொன்னேனே, நீ கேட்கவில்லையே !",11
கம்பராமாயணம்_(உரைநடை),சாவை விரும்பி ஏற்றுக் கொண்டாயே !,4
கம்பராமாயணம்_(உரைநடை),"தன் மகனை விளித்து, தம்பியும் தமையனும் உறவு கொண்டிருந்தபோது உயர்ந்திருந்தனர்.",8
கம்பராமாயணம்_(உரைநடை),பகை புகுந்தபோது எவ்வளவு பெரிய அழிவு ஏற்பட்டுவிட்டது பார்த்தாயா?,7
கம்பராமாயணம்_(உரைநடை),முடிபுனை விழா தம்பி இலக்குவனிடம் சுக்கிரீவனுக்கு அவன் கையால் முடி சூட்டும்படி கட்டளை இட்டான் இராமன்.,12
கம்பராமாயணம்_(உரைநடை),சுக்கிரீவனுக்கு முடி சூட்டப்பட்டது இராமன் பின் வருமாறு அறிவுரை கூறினான்.,8
கம்பராமாயணம்_(உரைநடை),பொது நிலையில் உள்ளவர் யார்?,4
கம்பராமாயணம்_(உரைநடை),என்று பகுத்தறிந்து செயல்பட வேண்டும் யாரிடத்தில் எப்படிப் பேச வேண்டுமோ?,8
கம்பராமாயணம்_(உரைநடை),முயற்சி திருவினை ஆக்கும் முயற்சி இன்மை வுறுமைக்குக் காரணம் ஆகிவிடும்.,8
கம்பராமாயணம்_(உரைநடை),சுக்கிரீவன் சில நாள்கள் தங்களோடு தங்கும்படி இராமனைக் கேட்டுக் கொண்டான்.,8
கம்பராமாயணம்_(உரைநடை),மேலும் தன் மனக் கருத்தை விரித்துரைத்தான்.,5
கம்பராமாயணம்_(உரைநடை),சீதை இன்றித் தனித்து நான் அடையும் இன்பம் எதுவாய் இருக்கும்?,8
கம்பராமாயணம்_(உரைநடை),"பெண்டாட்டியைப் பறி கொடுத்து, அரண்மனையில் களித்து இருக்கிறான் என்று உலகம் பேசாதா?",9
கம்பராமாயணம்_(உரைநடை),யான் துறவிகளைப்போல நோன்பு நோற்றுத் தனித்து வாழ்வதுதான் தக்கது என்று கூறினான்.,9
கம்பராமாயணம்_(உரைநடை),சுக்கிரீவன் இராமன் திருவடிகளை வணங்கிக் கண்ணிர் மல்க விடைபெற்றுக் கிட்கிந்தை நோக்கிச் சென்றான்.,10
கம்பராமாயணம்_(உரைநடை),"சேனைகளைத் திரட்டுதல் கார்காலம் கடந்தது, எனினும், குறிப்பட்டபடி குரங்கினத் தலைவனாகிய சுக்கிரீவன் படைகளோடு வந்து சேரவில்லை.",12
கம்பராமாயணம்_(உரைநடை),"அதனால், வெகுண்டு எழுந்த இராமன் இலக்குவனிடம், சுக்கிரீவன் காலம் தாழ்த்து வது ஏன்?",10
கம்பராமாயணம்_(உரைநடை),கடமையை மறந்து கள்ளுண்டு மயங்கிக் கிடக்கின்றான் போலும் சொன்ன சொல் தவறியவனைத் தவறாமல் தண்டிப்பது கடமையும் ஆகும்.,13
கம்பராமாயணம்_(உரைநடை),"சத்தியம் தவறியவனைக் கொன்று அழிப்பது தவறு அன்று, எதற்கும் நீ சென்று அவன் கருத்தினை அறிந்துவா என்றான்.",13
கம்பராமாயணம்_(உரைநடை),"சீதையைத் தேடுவதற்காக உடனே புறப்பட்டு வரட்டும் இல்லை என்றால், அவனும் அவ் வானரக்குடியும் அழியும் என்பதை அறிவித்துவிட்டு வா.",14
கம்பராமாயணம்_(உரைநடை),அவசரப்பட்டு உன் ஆவேசத்தைக் காட்டாமல் அவன் சொல்லும் பதிலைத் தெரிந்துவா என்ற சொல்லி அனுப்பினான் இராமன்.,12
கம்பராமாயணம்_(உரைநடை),தன் சிற்றப்பன் அற்பத்தனமாய்க் குடித்து மயங்கி ஆழ்ந்த துயிலில் கிடப்பதைப் பார்த்தான்.,9
கம்பராமாயணம்_(உரைநடை),"உள்ளே நுழைந்து, உரத்த குரலில் இலக்ககுவன் வருகையை அறிவித்தான் இடி இடித்தாலும் அசையாத வனாய் அவன் மயக்கத்தில் கிடந்தான்.",14
கம்பராமாயணம்_(உரைநடை),"அங்கதன் அனுமனை அடைந்து, அடுத்து நடப்பது குறித்து ஆலோசனை செய்தான்.",8
கம்பராமாயணம்_(உரைநடை),"அன்னை தாரையை அணுகி, நிலைமையைத் தெரிவியுங்கள் என்று அனுமன் அறிவுரை கூறினான்.",9
கம்பராமாயணம்_(உரைநடை),"தன்மனைவியைத் தவிர, வேறு எந்தப் பெண்ணையும் ஏறெடுத்துப் பார்த்து அறியாதவன் அவன்.",9
கம்பராமாயணம்_(உரைநடை),"சிரித்த முகமும், விரித்த கூந்தலும், இனித்த சொல்லும் கனிந்த பார்வையும் கொண்ட மகளிரைக் கண்டு இலக்குவன் நாணினான்.",13
கம்பராமாயணம்_(உரைநடை),அதற்குக் காரணம் அறிந்துவர இராமன் என்னை அனுப்பி இருக்கிறான் என்று சொன்னான் இலக்குவன்.,10
கம்பராமாயணம்_(உரைநடை),அதனால்தான் இன்னும் அவன் புறப் படவில்லை.,5
கம்பராமாயணம்_(உரைநடை),அனுமனும் தாரை உடன் இருந்து தக்க சொற்களை எடுத்துக் கூறி அவன் சினத்தைத் தணிவித்தான்.,11
கம்பராமாயணம்_(உரைநடை),ஏன் இலக்குவன் வருகையைத் தன்னிடம் தெரிவிக்கவில்லை என்று மயக்கம் நீங்கிய நிலையில் வினவினான்.,10
கம்பராமாயணம்_(உரைநடை),"நான் போய்த்தான் அந்தக் கீரை உணவும் சமைக்கவேண்டும் அதனால், விரைவில் புறப்படுக என்றான் அவன் உபசாரங்களை இலக்குவன் ஏற்றுக்கொள்ளவில்லை.",14
கம்பராமாயணம்_(உரைநடை),அனுமன் பெரும்படையுடன் பின் தொடர்ந்து வருவதாகக் கூறி அவனை மகிழ வைத்தான்.,9
