work_title,sentence,sentence_length
கந்தர்_அலங்காரச்_சொற்பொழிவுகள்-1,அது அவருக்கு ஆனந்தத்தைக் கொடுக்கவில்லை.,4
கந்தர்_அலங்காரச்_சொற்பொழிவுகள்-1,அறிவின் துணை கொண்டு உலகத்திலுள்ள பொருள்களின் உண்மையை உணர்ந்து கொண்டிருக்கலாம்.,8
கந்தர்_அலங்காரச்_சொற்பொழிவுகள்-1,உள்ளத்திலுள்ள மயக்கத்தைப் போக்கிக் கொண்டிருக்கலாம்.,4
கந்தர்_அலங்காரச்_சொற்பொழிவுகள்-1,பலபல தத்துவங்களைக் கடந்து செல்லலாம்.,4
கந்தர்_அலங்காரச்_சொற்பொழிவுகள்-1,"ஆனால் ஆண்டவனோடு கலந்து இன்பத்தை அடையக் கூடிய நிலையில் அறிவு நழுவிப் போய், அன்பு தலைப்பட வேண்டும்.",13
கந்தர்_அலங்காரச்_சொற்பொழிவுகள்-1,அதனை நான் அநுபவிக்கும்படியாக விளம்பியவாறு என்னே !,5
கந்தர்_அலங்காரச்_சொற்பொழிவுகள்-1,என்று வியப்பு அடைகிறார் அருணகிரியார்.,4
கந்தர்_அலங்காரச்_சொற்பொழிவுகள்-1,வெறும் பாழ் நமக்குச் சூரியன் ஒளி தெரியும்.,6
கந்தர்_அலங்காரச்_சொற்பொழிவுகள்-1,கல் மலை தெரியும்.,3
கந்தர்_அலங்காரச்_சொற்பொழிவுகள்-1,இவற்றுக்கு உருவம் உண்டு.,3
கந்தர்_அலங்காரச்_சொற்பொழிவுகள்-1,"அருணகிரியாரும் ஒளி என்கிறார், மலை என்கிறார், தேன் என்கிறார்.",7
கந்தர்_அலங்காரச்_சொற்பொழிவுகள்-1,அப்படியானால் அவர் சொல்லுகின்றவற்றுக்கு உருவம் உண்டா?,5
கந்தர்_அலங்காரச்_சொற்பொழிவுகள்-1,என்ற சந்தேகம் நமக்குத் தோன்றலாம்.,4
கந்தர்_அலங்காரச்_சொற்பொழிவுகள்-1,உண்மையில் அங்கே ஒன்றும் இல்லை.,4
கந்தர்_அலங்காரச்_சொற்பொழிவுகள்-1,அவை யாவும் நமக்கு அகக்கண் இல்லாவிட்டால் தோன்றா.,6
கந்தர்_அலங்காரச்_சொற்பொழிவுகள்-1,விளக்க முடியாத உருவற்ற பொருளை உருவம் கொடுத்து நமக்கு விளக்கினார் அவர்.,9
கந்தர்_அலங்காரச்_சொற்பொழிவுகள்-1,தாம் உணர்ந்த பொருளை பிறருக்கு உணர்த்துவதற்காக உருவகமாகச் சொன்னார்.,7
கந்தர்_அலங்காரச்_சொற்பொழிவுகள்-1,இவை எல்லாம் உண்மை அல்ல.,4
கந்தர்_அலங்காரச்_சொற்பொழிவுகள்-1,உனக்குப் புரிய வேண்டுமென்பதற்காக உன் மொழியில் சொன்னேன்.,6
கந்தர்_அலங்காரச்_சொற்பொழிவுகள்-1,அங்கு ஒன்றும் இல்லை என்று பின்பு புலப்படுத்துகிறார்.,6
கந்தர்_அலங்காரச்_சொற்பொழிவுகள்-1,எந்தக் காலத்தில் அந்த ஆனந்தம் உண்டாயிற்று என்று தெரியாது.,7
கந்தர்_அலங்காரச்_சொற்பொழிவுகள்-1,நான் அநுபவித்த இன்பத்தை பல காலமாகப் பல பெரியோர்களும் அநுபவித்தார்கள்.,8
கந்தர்_அலங்காரச்_சொற்பொழிவுகள்-1,இப்படி அநாதி காலமாக இருந்து வருகின்றது.,5
கந்தர்_அலங்காரச்_சொற்பொழிவுகள்-1,அது கால எல்லையைக் கடந்தது என்று சொல்லிவிட்டீர்கள்?,6
கந்தர்_அலங்காரச்_சொற்பொழிவுகள்-1,அது விளைந்த இடம் எது? என்று கேட்டால் அதற்கும் விடை சொல்கிறார்.,9
கந்தர்_அலங்காரச்_சொற்பொழிவுகள்-1,வெளியில் விளைந்தது என்று.,3
கந்தர்_அலங்காரச்_சொற்பொழிவுகள்-1,வெளி என்றால் ஆகாசம்.,3
கந்தர்_அலங்காரச்_சொற்பொழிவுகள்-1,அதற்கு ஆதாரம் ஆகாசந்தான் என்று சொன்னார்.,5
கந்தர்_அலங்காரச்_சொற்பொழிவுகள்-1,ஆகாசம் ஐந்து பூதங்களில் ஒன்று.,4
கந்தர்_அலங்காரச்_சொற்பொழிவுகள்-1,ஆகாசத்திற்குள் நான்கு பூதங்களும் அடங்கி இருக்கின்றன.,5
கந்தர்_அலங்காரச்_சொற்பொழிவுகள்-1,பாழ் என்று சொன்னால் போதாது.,4
கந்தர்_அலங்காரச்_சொற்பொழிவுகள்-1,நமது ஊரில் பாழ் வெளி இருக்கிறது என்றால் அந்தப் பாழ் வெளிக்கு அப்பாலே ஊர் இருக்கிறது என்று தெரியும்.,14
கந்தர்_அலங்காரச்_சொற்பொழிவுகள்-1,பாழுக்குப் பக்கத்தில் மனிதன் நடமாடுகிற இடம் தெரியும்.,6
கந்தர்_அலங்காரச்_சொற்பொழிவுகள்-1,ஆனால் இந்தப் பாழுக்கு அப்பாலே எதுவும் இல்லை.,6
கந்தர்_அலங்காரச்_சொற்பொழிவுகள்-1,இது வெறும் பாழ் தனக்கு அப்பாலே எதுவும் இல்லாத பாழ் இது இட எல்லை கடந்தது என்று சொன்னபடி.,14
கந்தர்_அலங்காரச்_சொற்பொழிவுகள்-1,"கால எல்லை கடந்தது என்பதற்காக, அநாதியிலே என்று சொன்னார்.",7
கந்தர்_அலங்காரச்_சொற்பொழிவுகள்-1,"பிறகு இது பஞ்ச பூதங்களுக்கும் அப்பாற்பட்டது என்பதற்காக, வெளியில் விளைந்த பாழ் என்று சொன்னார்.",11
கந்தர்_அலங்காரச்_சொற்பொழிவுகள்-1,பிறகு இது இட எல்லையையும் கடந்தது என்பதற்காக வெறும் பாழ் என்று சொன்னார்.,10
கந்தர்_அலங்காரச்_சொற்பொழிவுகள்-1,"இந்தப் பாட்டின் முன்பகுதியில் உருவம் உடைய பொருள்போல ஒளி, மலை, உச்சி, தேன் என்று சொன்னார்.",12
கந்தர்_அலங்காரச்_சொற்பொழிவுகள்-1,அவை நமக்கு விளங்குவதுபோல இருந்தன.,4
கந்தர்_அலங்காரச்_சொற்பொழிவுகள்-1,ஆனால் பிற் பகுதியில் ஒரே நுண்பொருள்களாகச் சொல்கிறார்.,6
கந்தர்_அலங்காரச்_சொற்பொழிவுகள்-1,ஏன் அப்படிச் சொல்ல வேண்டும்?,4
கந்தர்_அலங்காரச்_சொற்பொழிவுகள்-1,நமக்கு விளங்க வேண்டுமென்று முதலில் உருவகமாகச் சொன்னார்.,6
கந்தர்_அலங்காரச்_சொற்பொழிவுகள்-1,அதனைப் பொறிகளின் மூலமாக அநுபவிக்க முடியாது.,5
கந்தர்_அலங்காரச்_சொற்பொழிவுகள்-1,அது கால எல்லை கடந்தது.,4
கந்தர்_அலங்காரச்_சொற்பொழிவுகள்-1,பூத எல்லை கடந்தது.,3
கந்தர்_அலங்காரச்_சொற்பொழிவுகள்-1,இட எல்லை கடந்ததுங என்று புலப்படுத்துகிறார்.,5
கந்தர்_அலங்காரச்_சொற்பொழிவுகள்-1,அநாதியிலே வெளியில் விளைந்த வெறும் பாழ் என்று சொல்கிறார்.,7
கந்தர்_அலங்காரச்_சொற்பொழிவுகள்-1,வெறுங்தனி அதை வெறும் பாழ் என்று மட்டும் சொல்லிவிடவில்லை.,7
கந்தர்_அலங்காரச்_சொற்பொழிவுகள்-1,அந்தப் பாழைப் பெற்ற வெறுந்தனி என்று பேசுகின்றார்.,6
கந்தர்_அலங்காரச்_சொற்பொழிவுகள்-1,"தனி என்பதற்கும், வெறுந் தனி என்பதற்கும் வித்தியாசம் உண்டு.",7
கந்தர்_அலங்காரச்_சொற்பொழிவுகள்-1,நான் தனியாக இருக்கிறேன் என்று ஒருவன் சொன்னால் என்ன பொருள்?,8
கந்தர்_அலங்காரச்_சொற்பொழிவுகள்-1,அவன் இருக்கிற வீடு இல்லையா?,4
கந்தர்_அலங்காரச்_சொற்பொழிவுகள்-1,அவனைச் சூழ்ந்து பல பொருள்கள் இல்லையா?,5
கந்தர்_அலங்காரச்_சொற்பொழிவுகள்-1,அவை யாவும் இருந்தாலும் அவன் தனியாக இருக்கிறேன் என்று சொல்கிறான்.,8
கந்தர்_அலங்காரச்_சொற்பொழிவுகள்-1,அதாவது அவனுக்கு இனமான பொருள் அங்கே ஒன்றும் இல்லை என்பது அதற்குப் பொருள்.,10
கந்தர்_அலங்காரச்_சொற்பொழிவுகள்-1,"இங்கேயோ தன் இனப் பொருளும் இல்லை, வேறு இனப் பொருளும் இல்லை.",9
கந்தர்_அலங்காரச்_சொற்பொழிவுகள்-1,"அதைத் தெரிவிக்கவே, வெறுந் தனியை என்று சொன்னார்.",6
கந்தர்_அலங்காரச்_சொற்பொழிவுகள்-1,முகம் ஆறுடைத் தேசிகனே !,3
கந்தர்_அலங்காரச்_சொற்பொழிவுகள்-1,தேசிகன் என்றால் குரு.,3
கந்தர்_அலங்காரச்_சொற்பொழிவுகள்-1,குருநாதன் ஆகிய அவனுக்கு அடையாளம் என்ன?,5
கந்தர்_அலங்காரச்_சொற்பொழிவுகள்-1,யாருக்கும் இல்லாத அடையாளம் உண்டு அவனுக்கு.,5
கந்தர்_அலங்காரச்_சொற்பொழிவுகள்-1,அவன் முகம் ஆறு உடையவன்.,4
கந்தர்_அலங்காரச்_சொற்பொழிவுகள்-1,தேசிகன் என்று பொதுவாகச் சொன்னால் அது யாரையும் குறிக்கும்.,7
கந்தர்_அலங்காரச்_சொற்பொழிவுகள்-1,"முருகப் பெருமானையே குறிக்க, முகம் ஆறுடைத் தேசிகன் என்றார்.",7
கந்தர்_அலங்காரச்_சொற்பொழிவுகள்-1,சிவபிரான் ஐந்து முகம் உடைய தேசிகன்.,5
கந்தர்_அலங்காரச்_சொற்பொழிவுகள்-1,ஐந்து முகங்களினால் அவர் இருபத்தெட்டு ஆகமங்களைச் சொன்னார்.,6
கந்தர்_அலங்காரச்_சொற்பொழிவுகள்-1,குமரக் கடவுள் ஆறுமுகம் உடையவன்.,4
கந்தர்_அலங்காரச்_சொற்பொழிவுகள்-1,இந்த ஆறுமுகக் கடவுள் ஐந்து முகக் கடவுளுக்கே பிரணவ மந்திரோபதேசம் செய்தவன்.,9
கந்தர்_அலங்காரச்_சொற்பொழிவுகள்-1,அத்தகைய ஆறு முகம் உடைய குருநாதன் எனக்கு உபதேசம் செய்தான் என்றார் அருணகிரிநாதர்.,10
கந்தர்_அலங்காரச்_சொற்பொழிவுகள்-1,எதற்கு உபதேசம் செய்தான்?,3
கந்தர்_அலங்காரச்_சொற்பொழிவுகள்-1,பொருளைத் தெரிந்துகொள்ள அல்ல என்கிறார்.,4
கந்தர்_அலங்காரச்_சொற்பொழிவுகள்-1,தெளிந்து கொள்ள என்கிறார்.,3
கந்தர்_அலங்காரச்_சொற்பொழிவுகள்-1,அறிவு என்பது நூல்களினாலே அறிவது.,4
கந்தர்_அலங்காரச்_சொற்பொழிவுகள்-1,"காலம், இடம், பூதம் ஆகிய எல்லாவற்றையும் கடந்து நிற்கின்ற ஒரு பொருளை அறிவினாலே தெரிந்து கொள்வது இயலாத காரியம்.",14
கந்தர்_அலங்காரச்_சொற்பொழிவுகள்-1,அதுபவத்தினாலேதான் அது முடியும்.,3
கந்தர்_அலங்காரச்_சொற்பொழிவுகள்-1,அறிவுடையவர்கள் எல்லாம் அந்த ஆனந்தத்தை அடைவார்கள் என்று சொல்ல முடியாது.,8
கந்தர்_அலங்காரச்_சொற்பொழிவுகள்-1,"அறிவினாலே பல பல தத்துவங்களையும் அறிந்து, உணர்ந்து கடந்து செல்லலாம்.",8
கந்தர்_அலங்காரச்_சொற்பொழிவுகள்-1,"ஆனால் அந்த அறிவு நழுவிய நிலையில், அன்பு கனியும்போதுதான் அந்த ஆனந்தத்தைப் பெற முடியும்.",11
கந்தர்_அலங்காரச்_சொற்பொழிவுகள்-1,சர்க்கரை இனிக்கும் என்பதை அறிவினாலே தெரிந்து கொள்ளலாம்.,6
கந்தர்_அலங்காரச்_சொற்பொழிவுகள்-1,அல்லது அதைப்போன்ற பல பொருள்களை உபமானமாக வைத்துத் தெரிந்து கொள்ளலாம்.,8
கந்தர்_அலங்காரச்_சொற்பொழிவுகள்-1,ஆனால் எப்படி இனிக்கும் என்பதை அநுபவத்தினாலேதான் அறியலாம்.,6
கந்தர்_அலங்காரச்_சொற்பொழிவுகள்-1,அநுபவத்தினால் அறிந்து கொள்வது தெளிந்து கொள்வது ஆகும்.,6
கந்தர்_அலங்காரச்_சொற்பொழிவுகள்-1,அறிவினாலே அறியப்படுவனவற்றைப் பிறருக்குச் சொல்ல முடியும்.,5
கந்தர்_அலங்காரச்_சொற்பொழிவுகள்-1,அநுபவத்தினாலே உணர்கிறவற்றை யாருக்கும் சொல்ல முடியாது.,5
கந்தர்_அலங்காரச்_சொற்பொழிவுகள்-1,தெரிந்த பல பொருள்களை அநுபவத்தில் அடையாமல் இருக்க முடியும்.,7
கந்தர்_அலங்காரச்_சொற்பொழிவுகள்-1,தெளிய அறிந்தேன் என்றால் அநுபவத்தினாலேயும் அதனைப் பெற்றேன் என்று பொருள்.,8
கந்தர்_அலங்காரச்_சொற்பொழிவுகள்-1,அது வெறும் பாழைப் பெற்ற தனி.,5
கந்தர்_அலங்காரச்_சொற்பொழிவுகள்-1,"அதனை நான் பெறம்படியாக, அவன் உபதேசம் செய்தான்.",6
கந்தர்_அலங்காரச்_சொற்பொழிவுகள்-1,நான் தெளியும்படியாக விளம்பினான் என்று அருணகிரியார் சொல்கிறார்.,6
கந்தர்_அலங்காரச்_சொற்பொழிவுகள்-1,விளம்பியவா விளம்பியவாறு என்னே என்று ஒரு சொல்லை வருவித்து முடிக்க வேண்டும்.,9
கந்தர்_அலங்காரச்_சொற்பொழிவுகள்-1,தேசிகன் குரு பெரும் பெயர் முருகன் என்னும் புத்தகத்தில் எது சரி?,9
கந்தர்_அலங்காரச்_சொற்பொழிவுகள்-1,என்ற கட்டுரையில் இந்த வேறுபாடுகளைப் பற்றி ஆராய்ந்திருக்கிறேன்.,6
கந்தர்_அலங்காரச்_சொற்பொழிவுகள்-1,"நாம் சொல்கிறோம் என்று சொல்வதைக் காட்டிலும் மேல்நாட்டார் சொல்ல, நாம் சொல்கிறோம் என்று சொல்வதே பொருத்தம்.",12
கந்தர்_அலங்காரச்_சொற்பொழிவுகள்-1,"அவர்கள்தாம் இந்தியா என்றும், ஹிந்து மதம் என்றும் சரித்திரத்தில் எழுதி இருக்கிறார்கள்.",9
கந்தர்_அலங்காரச்_சொற்பொழிவுகள்-1,ஹிந்து மதம் என்று ஒரு மதம் உண்டா?,6
கந்தர்_அலங்காரச்_சொற்பொழிவுகள்-1,இந்தியா முழுமைக்கும் ஒரு சமயம் உண்டா?,5
கந்தர்_அலங்காரச்_சொற்பொழிவுகள்-1,அப்படியானால் ஹிந்து மதத்திற்குப் பொதுவான தத்துவம் என்ன இருக்கிறது?,7
கந்தர்_அலங்காரச்_சொற்பொழிவுகள்-1,என்று சிலர் கேட்கிறார்கள்.,3
கந்தர்_அலங்காரச்_சொற்பொழிவுகள்-1,ஹிந்து மதத்திற்குப் பொதுவாக ஏதாவது இலக்கணம் உண்டா என்பதைப் பார்க்கலாம்.,8
கந்தர்_அலங்காரச்_சொற்பொழிவுகள்-1,ஆகையால் கோயிலில் போய்க் கும்பிடுவது இந்து மதத்தின் பொதுக் கொள்கை என்று சொல்ல முடியாது.,11
கந்தர்_அலங்காரச்_சொற்பொழிவுகள்-1,அப்படியானால் விபூதி பூசுவதை ஹிந்து மத அடையாளம் என்று சொல்லலாமா?,8
கந்தர்_அலங்காரச்_சொற்பொழிவுகள்-1,நாமம் போடுகிறவர்கள் ஹிந்து மதத்தில் இருக்கிறார்கள்.,5
கந்தர்_அலங்காரச்_சொற்பொழிவுகள்-1,நாமம் போடுவதும் அப்படியே பொதுவான இலக்கணம் ஆகாது.,6
கந்தர்_அலங்காரச்_சொற்பொழிவுகள்-1,"வேஷ்டி கட்டாதவர்கள் ஹிந்து மதத்தினர் ஆகமாட்டார்கள் என்றால், பாண்ட் போடுவது ஹிந்து மதத்திற்கு விரோதம் என்று எங்கும் சொல்லவில்லை.",14
கந்தர்_அலங்காரச்_சொற்பொழிவுகள்-1,"காது குத்துவது ஹிந்து மதத்தின் அடையாளம் என்றால், காது குத்தாமல் பல காலம் வாழ்கின்ற பிள்ளைகள் இருக்கிறார்கள்.",13
கந்தர்_அலங்காரச்_சொற்பொழிவுகள்-1,குழந்தைக்கு உபநயனம் செய்யும் போது காது குத்துவது என்ற வழக்கம் உள்ள குடும்பங்கள் இருக்கின்றன.,11
கந்தர்_அலங்காரச்_சொற்பொழிவுகள்-1,ஆகவே காது குத்துவதையும் அடையாளமாகச் சொல்ல முடியாது.,6
