work_title,sentence,sentence_length
கலீலியோவின்_நம்மை_மேம்படுத்தும்_எண்ணங்கள்,கலீலியோவின் நம்மை மேம்படுத்தும் எண்ணங்கள் என்.,5
கலீலியோவின்_நம்மை_மேம்படுத்தும்_எண்ணங்கள்,﻿கலீலியோவின்﻿ ﻿நம்மை மேம்படுத்தும் எண்ணங்கள் புலவர் என்.,6
கலீலியோவின்_நம்மை_மேம்படுத்தும்_எண்ணங்கள்,"கலைமணி எம்.ஏ., சாந்தி நிலையம் புதிய எண்.",7
கலீலியோவின்_நம்மை_மேம்படுத்தும்_எண்ணங்கள்,"முப்பத்தாறு, உஸ்மான் சாலை, தியாகராய தகர், சென்னை அறுநூறு  பதினேழு .",8
கலீலியோவின்_நம்மை_மேம்படுத்தும்_எண்ணங்கள்,◯ உள்ளடக்கம் பதிப்புரை ஒன்று.,4
கலீலியோவின்_நம்மை_மேம்படுத்தும்_எண்ணங்கள்,உலக வரை படத்தை முதன் முதல் வரைந்தவர் !,6
கலீலியோவின்_நம்மை_மேம்படுத்தும்_எண்ணங்கள்,கடற் பயணிகளின் கண்டுபிடிப்புகள் மூன்று கலீலியோ காலத்து மக்கள் மனநிலைகள் நான்கு.,9
கலீலியோவின்_நம்மை_மேம்படுத்தும்_எண்ணங்கள்,"மூக்குக் கண்ணாடியால், தொலை நோக்கி வந்த விதம் !",6
கலீலியோவின்_நம்மை_மேம்படுத்தும்_எண்ணங்கள்,கலீலியோவால் இத்தாலிக்குப் பெருமை !,3
கலீலியோவின்_நம்மை_மேம்படுத்தும்_எண்ணங்கள்,கை நாடித் துடிப்பால் பெண்டுல நேரத்தை கணக்கிட்டார் ஆறு.,7
கலீலியோவின்_நம்மை_மேம்படுத்தும்_எண்ணங்கள்,கை நாடித் துடிப்பால் பெண்டுல நேரத்தை கணக்கிட்டார் ஏழு.,7
கலீலியோவின்_நம்மை_மேம்படுத்தும்_எண்ணங்கள்,அரிஸ்டாட்டில் தத்துவத்தை கலீலியோ வென்றார் எட்டு.,5
கலீலியோவின்_நம்மை_மேம்படுத்தும்_எண்ணங்கள்,டெலஸ் கோப்பை முதன் முதல் கண்டு பிடித்தவர் ஒன்பது.,7
கலீலியோவின்_நம்மை_மேம்படுத்தும்_எண்ணங்கள்,தொலை நோக்கி மூலமாக சந்திரனை ஆராய்ந்தார் !,5
கலீலியோவின்_நம்மை_மேம்படுத்தும்_எண்ணங்கள்,வியாழனில் நான்கு சந்திரன்களைக் கண்டார் !,4
கலீலியோவின்_நம்மை_மேம்படுத்தும்_எண்ணங்கள்,கலீலியோ செய்த சூரியன் ஆராய்ச்சி !,4
கலீலியோவின்_நம்மை_மேம்படுத்தும்_எண்ணங்கள்,"அறியாமை முன்பு, அறிவுபட்ட அவமானம் !",4
கலீலியோவின்_நம்மை_மேம்படுத்தும்_எண்ணங்கள்,ஒளியை ஆராய்ந்த முதல்வன் கலீலியோ !,4
கலீலியோவின்_நம்மை_மேம்படுத்தும்_எண்ணங்கள்,கலீலியோ பைபிள் விரோதி !,3
கலீலியோவின்_நம்மை_மேம்படுத்தும்_எண்ணங்கள்,பதினைந்து  கலீலியோ கருத்துக்குத்தடை !,3
கலீலியோவின்_நம்மை_மேம்படுத்தும்_எண்ணங்கள்,புரட்சி மேதைகள் மூவருள் கலீலியோவும் ஒருவர் பதினேழு .,6
கலீலியோவின்_நம்மை_மேம்படுத்தும்_எண்ணங்கள்,கோப்பர் நிக்கஸ் செய்த புரட்சி !,4
கலீலியோவின்_நம்மை_மேம்படுத்தும்_எண்ணங்கள்,பதினெட்டு  கலீலியோ செய்த புரட்சிச் சாதனைகள் !,5
கலீலியோவின்_நம்மை_மேம்படுத்தும்_எண்ணங்கள்,நியூட்டன் கண்டு பிடித்த புவியீர்ப்புப் புரட்சி இருபது.,6
கலீலியோவின்_நம்மை_மேம்படுத்தும்_எண்ணங்கள்,கலீலியோ டெலஸ்கோப் புதுமைக் கண்டுபிடிப்புகள் இருபத்தொன்று.,5
கலீலியோவின்_நம்மை_மேம்படுத்தும்_எண்ணங்கள்,இந்நூலை வெளியிடுவதில் நாங்கள் மிகவும் பெருமிதம் அடைகிறோம்.,6
கலீலியோவின்_நம்மை_மேம்படுத்தும்_எண்ணங்கள்,அனைவரும் தவறாமல் படித்து பயன்பெற வேண்டுகிறோம்.,5
கலீலியோவின்_நம்மை_மேம்படுத்தும்_எண்ணங்கள்,"கிரேக்க நாட்டின் அறிஞர்களில் ஒருவரான இராடோஸ்தனீஸ் என்பவர்தான், உலகத்தின் வரைபடத்தை முதன் முதலில் வரைந்தவர்.",11
கலீலியோவின்_நம்மை_மேம்படுத்தும்_எண்ணங்கள்,இவர் கி.மு.,3
கலீலியோவின்_நம்மை_மேம்படுத்தும்_எண்ணங்கள்,"இருநூறு  ம் ஆண்டுகளுக்கு முன்பு, எகிப்து நாட்டிலுள்ள அலெக்சாண்டிரியா என்ற நகரில் வாழ்ந்தவர்.",10
கலீலியோவின்_நம்மை_மேம்படுத்தும்_எண்ணங்கள்,"இந்திய ஞானிகள் கற்பனையில், மிகப் பெரிய ராட்சத ஆமை ஒன்று கரையில்லாத கடலில் நீத்திக் கொண்டு இருந்தது.",13
கலீலியோவின்_நம்மை_மேம்படுத்தும்_எண்ணங்கள்,அந்த ராட்சத ஆமையின் முதுகு ஓட்டின் மீது மிகப் பெரிய யானை ஒன்று நின்று கொண்டிருந்தது.,12
கலீலியோவின்_நம்மை_மேம்படுத்தும்_எண்ணங்கள்,அந்த யானையின் முதுகு மீது கட்டப்பட்ட ஓர் அரண்மனை போல பூமி அமைந்துள்ளது என்று கற்பனை செய்யப்பட்டது.,13
கலீலியோவின்_நம்மை_மேம்படுத்தும்_எண்ணங்கள்,இன்றைய உலக வடிவப் படம்.,4
கலீலியோவின்_நம்மை_மேம்படுத்தும்_எண்ணங்கள்,"சுமார் நாநூறு  ஆண்டுகளுக்கு முன்பு தான், சரியான உலக உருவம் என்று மக்களுக்குத் தெரிய ஆரம்பித்தது.",12
கலீலியோவின்_நம்மை_மேம்படுத்தும்_எண்ணங்கள்,"அவரது கண்டு பிடிப்பில், புது உலகம் என்று இன்று தாம் கூறும் நிலப்பரப்பு காணப்படவில்லை.",11
கலீலியோவின்_நம்மை_மேம்படுத்தும்_எண்ணங்கள்,கொலம்பஸ் என்ற நிலப்பரப்பு கண்டு பிடிப்பாளரது முயற்சிக்குப்பிறகே புது கண்டங்கள் சில இருப்பது உலகுக்குத் தெரிந்தது.,12
கலீலியோவின்_நம்மை_மேம்படுத்தும்_எண்ணங்கள்,"ஆனால், அவரது வரை படத்தில், ஐரோப்பா, எகிப்து இந்தியா போன்ற இடங்கள் எல்லாம் காணப்பட்டன.",11
கலீலியோவின்_நம்மை_மேம்படுத்தும்_எண்ணங்கள்,மக்களுக்குப் பாதுகாப்பாகப் பெரும் கடல்கள் உலகைச் சூழ்ந்துள்ளன என்பது மட்டும் தெரிந்துள்ளது.,9
கலீலியோவின்_நம்மை_மேம்படுத்தும்_எண்ணங்கள்,"ஆனால், உலகம் உருண்டை வடிவமானது என்பதை அப்போது மதவாதிகளும் நம்பவில்லை மாறாக, அவர் கூறியதைக் கேட்டு அவர்கள் ஆதிர்ச்சியடைந்தார்கள்.",14
கலீலியோவின்_நம்மை_மேம்படுத்தும்_எண்ணங்கள்,உலகம் தட்டையானது அல்ல அது பந்து போன்ற ஓர் உருண்டையானது.,8
கலீலியோவின்_நம்மை_மேம்படுத்தும்_எண்ணங்கள்,வாணவெளியில் அது தன்னைத்தானே கற்றி வருகிறது என்ற செய்தி உலகம் முழுவதும் தெரிந்திடப் பலநூறு ஆண்டுகள் ஆயின.,13
கலீலியோவின்_நம்மை_மேம்படுத்தும்_எண்ணங்கள்,அதற்கு முன்பு பல நூற்றாண்டுகளாக மதவாதிகளும்.,5
கலீலியோவின்_நம்மை_மேம்படுத்தும்_எண்ணங்கள்,மக்களும் அவர்கள் நம்பியிருந்த நம்பிக்கையை அவர்கள் மாற்றிக் கொள்ள விரும்பவில்லை.,8
கலீலியோவின்_நம்மை_மேம்படுத்தும்_எண்ணங்கள்,இந்த மனித உயிர்க் கொலை நீண்ட காலமாகவே நீடித்தது.,7
கலீலியோவின்_நம்மை_மேம்படுத்தும்_எண்ணங்கள்,"ஆனாலும், உண்மை விளம்பிகள் ஒவ்வொரு நூற்றாண்டிலும் மக்களுக்குரிய வழிகாட்டிகளாகவே வாழ்ந்துச் செத்தார்கள் !",9
கலீலியோவின்_நம்மை_மேம்படுத்தும்_எண்ணங்கள்,"வானியல் அறிவு மிகப் பழமையான காலத்தில், கீழ்த்திசை நாடுகளிலும் நன்றாக வளர்ந்து இருந்தது.",10
கலீலியோவின்_நம்மை_மேம்படுத்தும்_எண்ணங்கள்,அங்கே இருந்துதான் பெரும்பகுதியான எண்ணங்கள் மேலை நாடுகளுக்கும் பரவின !,7
கலீலியோவின்_நம்மை_மேம்படுத்தும்_எண்ணங்கள்,பூமியைப் போல பல கோள்கள் !,4
கலீலியோவின்_நம்மை_மேம்படுத்தும்_எண்ணங்கள்,வான வெளியில் இருக்கின்றன.,3
கலீலியோவின்_நம்மை_மேம்படுத்தும்_எண்ணங்கள்,அவை எல்லாமே மிகப்பெரிய சூரியனைச் சுற்றி வருகின்றன என்றார்.,7
கலீலியோவின்_நம்மை_மேம்படுத்தும்_எண்ணங்கள்,ஏற்றுக்கொண்டால்தான் அவனுக்கு மரியாதை வந்து விடுமே !,5
கலீலியோவின்_நம்மை_மேம்படுத்தும்_எண்ணங்கள்,இந்த வான சாஸ்திர மேதைகள் கண்டு பிடித்தவற்றால் என்ன பலன்?,8
கலீலியோவின்_நம்மை_மேம்படுத்தும்_எண்ணங்கள்,"பூமி உருண்டை வடிவானது என்றால், அதைச் சுற்றிப் பயணம் செய்தவர்கள் புறப்பட்ட இடத்திற்கே மறுபடியும் வந்த சேரவேண்டும் !",13
கலீலியோவின்_நம்மை_மேம்படுத்தும்_எண்ணங்கள்,இவ்வாறு புறப்பட்ட பயணிகள் மீண்டு வர இயலுமா?,6
கலீலியோவின்_நம்மை_மேம்படுத்தும்_எண்ணங்கள்,எவ்வளவு தடிப்பு பூமி இருக்குமோ?,4
கலீலியோவின்_நம்மை_மேம்படுத்தும்_எண்ணங்கள்,பூமியைச் சுற்றிவர எவ்வளவு காலம் ஆகுமோ?,5
கலீலியோவின்_நம்மை_மேம்படுத்தும்_எண்ணங்கள்,என்பனவற்றையெல்லாம் உலகத்தினர்கள் சிந்திக்கலானார்கள்.,3
கலீலியோவின்_நம்மை_மேம்படுத்தும்_எண்ணங்கள்,அந்தப் பிரயாணிகள் தேரில் பார்த்த விஷயங்களை எல்லாம் தங்களது குறிப்பேட்டில் விவரமாக எழுதியுள்ளார்கள்.,10
கலீலியோவின்_நம்மை_மேம்படுத்தும்_எண்ணங்கள்,மார்க்கோ போலோவின் பயணங்கள் என்ற பயண நூலில் இவற்றை எல்லாம்.,8
கலீலியோவின்_நம்மை_மேம்படுத்தும்_எண்ணங்கள்,"அவர் விளக்கமாக எழுதியிருப்பதுடன், அது உலகம் முழுவதும் விரைவில் பரவியது !",8
கலீலியோவின்_நம்மை_மேம்படுத்தும்_எண்ணங்கள்,அவர் சில தீவுகணைக் கண்டார்.,4
கலீலியோவின்_நம்மை_மேம்படுத்தும்_எண்ணங்கள்,சீனாவுக்கோ இந்தியாவுக்கோ ஜாக்கிரதையாக வந்து சேர்ந்து விட்டதாக அவர் எண்ணினார்.,8
கலீலியோவின்_நம்மை_மேம்படுத்தும்_எண்ணங்கள்,என்று கேட்கக் கூடும் அல்லவா?,4
கலீலியோவின்_நம்மை_மேம்படுத்தும்_எண்ணங்கள்,"ஒரு காலத்தில் சூரிய கிரகணத்தைக் கண்ட ஐரோப்பிய மக்கள், கிணறு, குளங்கனை எல்லா மூடி விட்டார்கள்.",12
கலீலியோவின்_நம்மை_மேம்படுத்தும்_எண்ணங்கள்,ஏதோ ஒரு வித விஷம் தண்ணீரில் கலந்து விடும் என்பது அவர்களிடையே எழுந்த அச்சமாக இருந்தது.,12
கலீலியோவின்_நம்மை_மேம்படுத்தும்_எண்ணங்கள்,என்று நினைத்து அவர்கள் நம்பினர்.,4
கலீலியோவின்_நம்மை_மேம்படுத்தும்_எண்ணங்கள்,"பழைய காலத்தில் வாழ்த்த மக்கள், நாம் வாழும் பூமி சலனமற்று நிற்பதாக நம்பினார்கள்.",10
கலீலியோவின்_நம்மை_மேம்படுத்தும்_எண்ணங்கள்,"ஆனால், இன்று பூமி உள்ளிட்ட கோள்கள் எல்லாமே வானவெளியில் பவனி வந்து கொண்டிருக்கின்றன என்று நாம் ஆறிவோம்.",13
கலீலியோவின்_நம்மை_மேம்படுத்தும்_எண்ணங்கள்,"அன்றைய மக்கள் வானவெளியில் காணப்படும் கோள்கள் எல்லாம் எந்தெந்தப் பொருட்களால் ஆக்கப் பட்டவை, எதனால் இப்படி இயங்குகின்றன?",13
கலீலியோவின்_நம்மை_மேம்படுத்தும்_எண்ணங்கள்,எந்த வழியில் சுற்றுகின்றன?,3
கலீலியோவின்_நம்மை_மேம்படுத்தும்_எண்ணங்கள்,உலகம் என்பது என்ன?,3
கலீலியோவின்_நம்மை_மேம்படுத்தும்_எண்ணங்கள்,சூரியன் நட்சத்திரங்கள் இவற்றின் பிறப்பு வளர்ப்பு என்ன?,6
கலீலியோவின்_நம்மை_மேம்படுத்தும்_எண்ணங்கள்,என்ன போன்ற உண்மைகளை இவர்கள் அறிந்திருக்கவில்லை.,5
கலீலியோவின்_நம்மை_மேம்படுத்தும்_எண்ணங்கள்,தங்களது சாதாரணக் கண்களையே நபிேயப் பழங்கல மக்கள் !,6
கலீலியோவின்_நம்மை_மேம்படுத்தும்_எண்ணங்கள்,விண்மீன்கதைக் கண்டு தெரிந்து கொண்டார்கள்.,4
கலீலியோவின்_நம்மை_மேம்படுத்தும்_எண்ணங்கள்,ஒருவர் தனது ஆண்களின் சாதாரண பார்வையால் சுமார் ஐயாயிரம் விண்மீன்களை மட்டுமே பார்த்து வந்தார்கள்.,11
கலீலியோவின்_நம்மை_மேம்படுத்தும்_எண்ணங்கள்,"ஆனால், இன்று அடிப்படியல்ல.",3
கலீலியோவின்_நம்மை_மேம்படுத்தும்_எண்ணங்கள்,அவர் டச்சு நாட்டைச் சேர்ந்தவராவார்.,4
கலீலியோவின்_நம்மை_மேம்படுத்தும்_எண்ணங்கள்,அவர் பொருத்திய இரண்டு கண்ணாடி வில்லைகள்தான்.,5
கலீலியோவின்_நம்மை_மேம்படுத்தும்_எண்ணங்கள்,இந்த டச்சுக்காரர் செய்த ஆச்சரியமான கண்டுபிடிப்பு டிஸ்கனி நகரிலே வாழ்ந்த விஞ்ஞானியான கலீலியோவுக்கு ஒரு வியப்பாக இருந்தது.,13
கலீலியோவின்_நம்மை_மேம்படுத்தும்_எண்ணங்கள்,அவர் அந்த டச்சுக்காரரிடம் வந்து அவர் செய்து வைத்திருந்த அந்த மூக்குக்கண்ணாடியின் விவரங்களைக் கேட்டறிந்தார்.,11
கலீலியோவின்_நம்மை_மேம்படுத்தும்_எண்ணங்கள்,"அதனால், தன்னால் கண்டு பிடிக்கப்பட்ட பெரிய லியப்பான செயலைக் கண்டு எண்ணி யெண்ணி அவர் மகிழ்ச்சிப் பெற்றார்.",13
கலீலியோவின்_நம்மை_மேம்படுத்தும்_எண்ணங்கள்,அந்த விந்தை மிகு விஞ்ஞான வானியல் ஆய்விலே வெற்றி கண்டவரின் முழுப்பெயரி என்ன தெரியுமா?,11
கலீலியோவின்_நம்மை_மேம்படுத்தும்_எண்ணங்கள்,கலீலியோ அலீலி என்பது தான்.,4
கலீலியோவின்_நம்மை_மேம்படுத்தும்_எண்ணங்கள்,இந்த அற்புத மனிதன் கலீலியோ கி.பி.,6
கலீலியோவின்_நம்மை_மேம்படுத்தும்_எண்ணங்கள்,ஐரோப்பா கண்டத்தின் தெற்குப் பகுதியிலே அமைந்துள்ள ஒரு சிறிய தீபகற்ப நாடு இத்தாலி.,10
கலீலியோவின்_நம்மை_மேம்படுத்தும்_எண்ணங்கள்,அது உலகப் புகழ் பெற்ற விஞ்ஞானிகளையும்.,5
கலீலியோவின்_நம்மை_மேம்படுத்தும்_எண்ணங்கள்,"வானியல் ஆய்வாளர்களையும், தத்துவ ஞானிகளையும், கவிஞர் பெருமக்களையும், வரலாற்றுப் பேரறிஞர்களையும், அரசியல் வல்லுநர்களையும், ஈன்றளித்த புகழ்வாய்ந்த நாடுகளுள் ஒன்று.",14
