work_title,sentence,sentence_length
கேள்வி_நேரம்,"அது பத்திரமாகப் பூமிக்குத் திரும்பி வந்ததால், பிறகு ஒரு மனிதரையே விண்வெளியில் அனுப்பினார் கள்.",11
கேள்வி_நேரம்,அந்த மனிதர் பெயராவது தெரியுமா?,4
கேள்வி_நேரம்,"வாஸ்கோட காமாவைப் பற்றி, வரலாறு படிக்கும்போது நன்கு தெரிந்து கொண்டிருப்பீர்கள்.",8
கேள்வி_நேரம்,அவர் எங்கே இறந்தார் என்று தெரியுமா?,5
கேள்வி_நேரம்,லிங்க கொச்சி நகரில்.,3
கேள்வி_நேரம்,"தேனி அடடே, அதையும் வரலாற்று நூலிலே படித்து நினைவில் வைத்திருக்கிறாய் போலிருக்கிறது !",9
கேள்வி_நேரம்,ரொம்ப நல்லது... நம் தேசத் தலைவர்களில் ஒருவர் வழக்கறிஞராக இருந்தார்.,8
கேள்வி_நேரம்,அவருடைய தந்தையும் வழக் கறிஞராயிருந்தார்.,4
கேள்வி_நேரம்,இருவரும் ஒரு சமயம் எதிர் எதிராக நின்று வழக்காடினார்கள்.,7
கேள்வி_நேரம்,அதில் மகன் வெற்றி பெற்றார்.,4
கேள்வி_நேரம்,அந்தத் தலைவர் பெயர் என்ன?,4
கேள்வி_நேரம்,அவர் தங்தை பெயர் என்ன?,4
கேள்வி_நேரம்,சசி ஜவாஹர்லால் நேருவும் அவரது தந்தை மோதிலால் நேருவும்.,7
கேள்வி_நேரம்,கார்த்தி கப்பலோட்டிய தமிழர் வ.உ.சிதம்பரம் பிள்ளை.,7
கேள்வி_நேரம்,அவர் தந்தை பெயர் தெரிய வில்லை.,5
கேள்வி_நேரம்,தேனி மகன் பெயரைச் சரியாகச் சொல்லி விட்டாய்.,6
கேள்வி_நேரம்,தந்தையார் பெயர் உலகநாத பிள்ளை சதுரங்க ஆட்டத்திற்கான பலகையில் மொத்தம் எத்தனை கட்டங்கள் இருக்கின்றன?,11
கேள்வி_நேரம்,இந்த ஆட்டத்தை இருவர் ஆடுவார்கள் என்பது உங்களுக்குத் தெரியும்.,7
கேள்வி_நேரம்,ஒவ்வொரு ஆட்டக்காரருக்கும் தனித்தனியாக எத்தனை காய்கள் இருக்கும்?,6
கேள்வி_நேரம்,கார்த்தி பதினாறு  தேனி ரொம்ப கரெக்ட்.,5
கேள்வி_நேரம்,இதேபோல் இன்னொரு நாடும் அதே தேதியில் சுதந்திர தினத்தைக் கொண்டாடுகிறது.,8
கேள்வி_நேரம்,அந்த நாடு எது?,3
கேள்வி_நேரம்,"லிங்க தென் கொரியா, தேனி சரியான விடை.",6
கேள்வி_நேரம்,"﻿இடம் சென்னை, அண்ணாநகர் கேள்வி கேட்பவர் அலமேலு அழகப்பன்.",7
கேள்வி_நேரம்,பங்கு பெறுவோர் எஸ்.,3
கேள்வி_நேரம்,அலமேலு கோனார் உரைநூல் என்றால் உங்களுக்கு நன்றாகத் தெரியும்.,7
கேள்வி_நேரம்,"கோனார் என்கிறார்களே, அவருடைய முழுப் பெயர் தெரியுமா?",6
கேள்வி_நேரம்,சரவணன் தெரியும் அக்கா.,3
கேள்வி_நேரம்,ஐயன் பெருமாள் கோனார் அலமேலு சரியான விடை.,6
கேள்வி_நேரம்,அந்த அளவுக்கு அவர் பெயர் பிரபலமாகியிருக்கிறது !...,5
கேள்வி_நேரம்,மகாத்மா காந்தி நடத்திய பத்திரிகைகளின் பெயர்களைக் கூற முடியுமா?,7
கேள்வி_நேரம்,கிரிசங்கர் ஹரிஜன் பத்திரிகை அலமேலு உம்... இன்னும் சில பத்திரிகைகளையும் அவர் ஆசிரியராயிருந்து நடத்தியிருக்கிறாரே !,11
கேள்வி_நேரம்,சரவணன் யங் இந்தியா... நவஜீவன்.,4
கேள்வி_நேரம்,அலமேலு சரி... இந்தியாவில் அவர் நடத்திய மூன்று பத்திரிகைப் பெயர்களையும் கிரியும் சரவணனும் சேர்ந்து கூறி விட்டார்கள்.,13
கேள்வி_நேரம்,"ஆனால், தென் ஆப்பிரிக்காவில் அவர் இருந்த போது, இந்தியன் ஒப்பீனியன் என்று ஒரு பத்திரிகையை நடத்தினார்.",12
கேள்வி_நேரம்,ஜெயா சர் ஐசக் கியூட்டன்.,4
கேள்வி_நேரம்,புவி ஈர்ப்புச் சக்தியைக் கண்டுபிடித்தவர்.,4
கேள்வி_நேரம்,"இன்னொருவர்... இன்னொருவர்.... அலமேலு தலையைச் சொறிகிறாயே, சரி வேறு யாருக்காவது தெரியுமா?",9
கேள்வி_நேரம்,அலமேலு இன்னொருவர் சர் ஐசக் பிட்மென்.,5
கேள்வி_நேரம்,"பிட்மென், சுருக்கெழுத்துக் கண்டு பிடித்தவர்.",4
கேள்வி_நேரம்,பிட்மென் ஷார்ட் ஹாண்ட் என்று கேள்விப்பட்டிருப்பீகளே !,5
கேள்வி_நேரம்,"சரி, யூக்கலிப்டஸ் அதாவது நீல கிரித் தைலம் என்கிறோமே, அந்தத் தைலத்தை எதிலிருந்து எடுக்கிறார்கள்?",11
கேள்வி_நேரம்,ஜெயா யூக்கலிப்டஸ் மரப் பட்டையிலிருந்து.,4
கேள்வி_நேரம்,"அலமேலு இல்லை, ஜெயா விடை தவறு.",5
கேள்வி_நேரம்,கிரி யூக்கலிப்டஸ் இலையிலிருந்துதான் தைலம் எடுக்கிறார்கள்.,5
கேள்வி_நேரம்,"மூன்று ஆயிரத்து எண்பத்தைந்து ஆறு அலமேலு ஆம், கிரி சொன்னதே சரி.",9
கேள்வி_நேரம்,"யூக்கலிப்டஸ் மரத்திலிருந்து இலைகளைப் பறித்து ஒரு பெரிய பாத்திரத்திலே போட்டு, அதிலே நீர் விட்டுக் காய்ச்சு வார்கள்.",13
கேள்வி_நேரம்,அப்போது பாத்திரத்திலிருந்து குபுகுபுவென்று ஆவிவரும்.,4
கேள்வி_நேரம்,அந்த ஆவியைச் சேகரித்துக் குளிர வைப்பார்கள்.,5
கேள்வி_நேரம்,அதுதான் நீலகிரித் தைலம்... இதோ இங்கு நான்கு பிராணிகள் இருக்கின்றன.,8
கேள்வி_நேரம்,"நத்தை, தவளை, கரப்பான்பூச்சி, பாம்பு இந்த நான்கிலே இரண்டு ஒரு வகையைச் சேர்ந்தவை.",10
கேள்வி_நேரம்,மற்ற இரண்டும் வேறொரு வகையைச் சேர்ந்தவை.,5
கேள்வி_நேரம்,"சரவணன் கத்தையும், தவளையும் நீரில் வசிப்பவை, கரப்பான் பூச்சியும் பாம்பும் நிலத்தில் வசிப்பவை.",10
கேள்வி_நேரம்,"அலமேலு சரவணா, நீ சொன்னது சரியான விடையில்லை.",6
கேள்வி_நேரம்,பாம்பில் கூடத்தான் தண்ணிர்ப் பாம்பு இருக்கிறது.,5
கேள்வி_நேரம்,வேறு யாருக்குத் தெரியும்?,3
கேள்வி_நேரம்,ஜெயா எனக்குத் தெரியும்.,3
கேள்வி_நேரம்,பாம்புக்கும் தவளைக்கும் முதுகு எலும்பு உண்டு நத்தைக்கும் கரப்பானுக்கும் முதுகு எலும்பு இல்லை.,10
கேள்வி_நேரம்,அலமேலு ஆஹா ஜெயா எவ்வளவு சரியாய்ச் சொல்லிவிட்டாள் !,6
கேள்வி_நேரம்,கிரி அடிக்கடி டி.,3
கேள்வி_நேரம்,அலமேலு கிட்டத்தட்டச் சரியாகச் சொல்லி விட்டாய்.,5
கேள்வி_நேரம்,"கிட்டத்தட்ட என்று ஏன் சொல்கிறேன், தெரியுமா?",5
கேள்வி_நேரம்,கிரி ஆமாம் அக்கா.,3
கேள்வி_நேரம்,இதோ நான் சரியாய்ச் சொல்கிறேன்.,4
கேள்வி_நேரம்,ஐக்கிய நாடுகளின் சர்வதேசக் குழந்தை களின் அவசரத் தேவைக்கான நிதி என்று அர்த்தம்.,10
கேள்வி_நேரம்,மெட்ரிக் முறையைத்தான் இப்போது நாம் எல்லோரும் கையாண்டு வருகிறோம்.,7
கேள்வி_நேரம்,இந்த முறையைக் கண்டுபிடித்தவர் யார்?,4
கேள்வி_நேரம்,கிரி ஒரு பிரெஞ்சுக்காரர்.... பெயர்...... தெரிய வில்லை.,6
கேள்வி_நேரம்,அலமேலு வேறு யாரேனும் சொல்வீர்களா?,4
கேள்வி_நேரம்,அலமேலு நானே சொல்கிறேன்.,3
கேள்வி_நேரம்,"அதைக் கண்டு பிடித்தவர் ஒருவரல்லர், ஏழு பிரெஞ்சுக்காரர்கள் அடங்கிய ஒரு குழுதான் கண்டு பிடித்தது.",11
கேள்வி_நேரம்,அந்த ஏழு பேரும் சேர்ந்து ஒன்பது ஆண்டுகளில் கண்டுபிடித்தார்கள்.,7
கேள்வி_நேரம்,சரவணன் முன் காலத்தில் அநேகமாக ஒவியங்களை யெல்லாம் சுவர்களிலே எழுதினார்கள்.,8
கேள்வி_நேரம்,அதனால்தான் அந்தப் பழமொழி.,3
கேள்வி_நேரம்,முன்காலத்தில் பெரும்பாலும் சுவர்களில்தான் சித்திரங்கள் எழுதப்பட்டன.,5
கேள்வி_நேரம்,"கோயில்கள், அரண்மனைகள், சித்திர மாடங்கள் இப்படி எல்லாவற்றிலும் சுவர் ஒவியங்கள் எழுதப்பட்டன.",9
கேள்வி_நேரம்,ஜெயா ஒருவர் பெயர் விஜயலட்சுமி பண்டிட்... இன்னொருவர் பெயர்... சுசேதா கிருபலானி.,9
கேள்வி_நேரம்,"அலமேலு ஜெயா, முதலில் சொன்ன பெயர் சரிதான்.",6
கேள்வி_நேரம்,"ஆனால், இரண்டாவது பெயர் தவறு.",4
கேள்வி_நேரம்,கிரி நான் சொல்கிறேன்.,3
கேள்வி_நேரம்,அலமேலு கிருஷ்ணா என்பது சரிதான்.,4
கேள்வி_நேரம்,அது என்ன பட்டம் !,3
கேள்வி_நேரம்,சரவணன் ஹாஜி என்ற பட்டம்தானே?,4
கேள்வி_நேரம்,"அலமேலு ஆம், சரியான விடை சுத்தத் தங்கம் எத்தனை காரட் எடையுள்ளது?",9
கேள்வி_நேரம்,ஜெயா இருபத்து நான்கு காரட்.,4
கேள்வி_நேரம்,"எவரெஸ்ட் சிகரத்தை எட்டிப் பிடித்து வெற்றிக்கொடி காட்டியவர்கள் டென்சிங்கும், ஹில்லரியும் என்பது நமக்குத் தெரியும்.",11
கேள்வி_நேரம்,"ஆனால், அதற்குப் பிறகு, இருமுறை எவரெஸ்ட் சிகரத்தை அடைந்தவர் யார் என்று தெரியுமா?",10
கேள்வி_நேரம்,அவரும் டென்சிங் இனத்தைச் சேர்ந்தவர்தான்...... இதோ இந்தப் படத்தைப் பாருங்கள்.,8
கேள்வி_நேரம்,இதில் இருப்பது என்ன என்று தெரிகிறதா?,5
கேள்வி_நேரம்,"சரவணன் ஓ, நன்றாகத் தெரிகிறதே, இதுதான் விசைக் காற்றாடி.",7
கேள்வி_நேரம்,ஜெயா ஐயையோ விசைக் காற்றாடி இப்படியா இருக்கும்?,6
கேள்வி_நேரம்,காற்றாடியிலே நீளநீளத் தகடு இருக்குமே !,4
கேள்வி_நேரம்,"ஒரு பொருளின் இருப்பிடத்தையும் தூரத்தையும், ரேடியோ அலைகளைக்கொண்டு அறிவதற்குப் பயன்படும் ராடார் கருவிதான் இது.",11
கேள்வி_நேரம்,முன்பெல்லாம் கோயில் கட்டடங்கள் செங்கற்களாலே கட்டப்பட்டிருக்கும்.,5
கேள்வி_நேரம்,பிறகுதான் கருங்கற்களைக் கொண்டு கட்டினார்கள்.,4
கேள்வி_நேரம்,"முதல் முதலாகக் கருங்கற்களால் கட்டப்பட்ட கோயில் எது, தெரியுமா?",7
கேள்வி_நேரம்,சரவணன் அந்தக் கோயில் காஞ்சிபுரத்தில் இருக்கிறது.,5
கேள்வி_நேரம்,ஏகாம்பரநாதர் என்று நினைக்கிறேன்.,3
கேள்வி_நேரம்,அலமேலு காஞ்சிபுரம் என்பது சரியே.,4
கேள்வி_நேரம்,ஏகாம்பரநாதர் கோயில் என்பது தவறு.,4
கேள்வி_நேரம்,ஜெயா கைலாசநாதர் கோயில்.,3
கேள்வி_நேரம்,"அலமேலு ஆம், கைலாசநாதர் கோயில்தான் முதன் முதலாக அமைக்கப்பட்ட கற்றளிக் கோயில்.",9
கேள்வி_நேரம்,இந்திய அரசு அளிக்கின்ற விருது களில் மிகவும் உயர்ந்தது.,7
கேள்வி_நேரம்,"அடுத்த மூன்றைக் கூறுங்கள், பார்க்கலாம்.",4
கேள்வி_நேரம்,"கிரி பத்மவிபூஷண், பத்மசிறீ, பத்மபூஷண்.",4
கேள்வி_நேரம்,"ஆனாலும், இடம் மாறி இருக்கின்றன.",4
கேள்வி_நேரம்,ஜெயா இரண்டு தீவுகள்.,3
கேள்வி_நேரம்,ஒன்று அந்தமான் இன்னொன்று நிகோபார்.,4
கேள்வி_நேரம்,"அலமேலு தவறு, தவறு.",3
கேள்வி_நேரம்,சரவணன் ஒவ்வொன்றிலும் பல தீவுகள் இருக்கின்றன.,5
கேள்வி_நேரம்,எத்தனை எத்தனை என்று சரியாகத் தெரியாது.,5
கேள்வி_நேரம்,"அலமேலு சரி, நானே சொல்லிவிடுகிறேன்.",4
கேள்வி_நேரம்,"அந்தமானில் இருநூற்று ஐந்து தீவுகள், நிகோபாரில் பத்தொன்பது  தீவுகள்.",7
கேள்வி_நேரம்,மொத்தம்.. ஜெயா தீவுகள்.,3
கேள்வி_நேரம்,"இந்த இருநூற்று இருபத்து நான்கு தீவுகளும் சேர்ந்ததுதான் அங்தமான், நிகோபார் தீவுகள்.",9
கேள்வி_நேரம்,"பெரு நகரம் அதாவது மெட்ரோபாலிடன் சிட்டி என்கிறார்களே, எந்த மாதிரி நகரத்தை அப்படிச் சொல்லுகிறார்கள்?",11
கேள்வி_நேரம்,சரவணன் பத்து லட்சம் மக்களுக்கு மேல் இருந்தால் அந்த நகரத்தை மெட்ரோபாலிடன் சிட்டி என்கிறார்கள்.,11
கேள்வி_நேரம்,அமெரிக்கா இல்லை என்றால் ரஷ்யாவா?,4
கேள்வி_நேரம்,எப்படியோ சரியான விடையைச் சொல்லிவிட்டாய்.,4
கேள்வி_நேரம்,அந்த ஏரி எங்கே இருக்கிறது?,4
கேள்வி_நேரம்,ஜெயா சிதம்பரத்துக்குப் பக்கத்திலே.,3
கேள்வி_நேரம்,"அலமேலு ஆம், தென் ஆர்க்காட்டில் சிதம்பரம் வட்டத்திலே இருக்கிறது.",7
கேள்வி_நேரம்,"இந்த ஏரி கடலைப் போல நீளமாகவும், விரிவாகவும் இருக்கும்.",7
கேள்வி_நேரம்,தமிழ் நாட்டிலேயே மிகப் பெரிய ஏரி இதுதான்... மறைமலை அடிகள் மிகப் பெரிய தமிழறிஞர் என்பது உங்களுக்குத் தெரியும்.,14
கேள்வி_நேரம்,அவருடைய இயற்பெயர் என்ன?,3
கேள்வி_நேரம்,அலமேலு சரியான விடை.,3
கேள்வி_நேரம்,"வேதம் மறை, அசலம் மலை.",4
கேள்வி_நேரம்,இரண்டையும் சேர்த்தால் மறைமலை.,3
கேள்வி_நேரம்,இன்னோரிடத்திலும் ஐதராபாத் என்ற பெயரில் ஒரு நகரம் இருக்கிறது.,7
கேள்வி_நேரம்,எங்கே என்று தெரியுமா?,3
கேள்வி_நேரம்,எல்லாரும் அலமேலு ஒருவருக்கும் தெரியவில்லையே !,4
கேள்வி_நேரம்,பாகிஸ்தானில் சிந்து நதியின் மேற்குக் கரைக்கு அருகிலே ஒரு குன்று இருக்கிறது.,9
கேள்வி_நேரம்,"அதன் மேல்தான் இருக்கிறது, இன்னொரு ஐதராபாத் நகரம்... காந்தி புராணம் என்ற கவிதை நூலை ஓர் அம்மையார் பாடியிருக்கிறார்.",14
கேள்வி_நேரம்,ஜெயா செளந்தரா கைலாசம்.,3
கேள்வி_நேரம்,ஒரு குறிப்புத் தருகிறேன்.,3
கேள்வி_நேரம்,அந்த அம்மையாரின் முன்னால் பண்டிதை என்ற பட்டம் இருக்கும்.,7
கேள்வி_நேரம்,சரவணன் உம்........ கேள்விப்பட்டிருக்கிறேன்.,3
கேள்வி_நேரம்,பண்டிதை அசலாம்பிகை அம்மையார்.,3
கேள்வி_நேரம்,அலமேலு சரியாகச் சொன்னாய்.,3
கேள்வி_நேரம்,"காந்தி புராணம் மட்டுமல்ல, திலகர் புராணம் என்று ஒரு புத்தகமும் எழுதியிருக்கிறார்.",9
கேள்வி_நேரம்,இன்னும் பல தல புராணங்களும் எழுதியிருக்கிறார்.,5
கேள்வி_நேரம்,"கிரி சங்கர், நீ கப்பல் பார்த்திருக்கிறாயா?",5
கேள்வி_நேரம்,"கிரி ஒ, பார்த்திருக்கிறேனே !",3
கேள்வி_நேரம்,அலமேலு எப்போது பார்த்தாய் !,3
கேள்வி_நேரம்,கிரி போன கோடை விடுமுறையிலேதான் நான் கப்பலைப் பார்த்தேன்.,7
கேள்வி_நேரம்,மிகப் பெரிய கப்பல்.,3
கேள்வி_நேரம்,உள்ளேயெல்லாம் கூட என்னை என் மாமா அழைத்துப் போய்க் காட்டினார்.,8
கேள்வி_நேரம்,"அலமேலு ஒ, அப்படியா !",3
