work_title,sentence,sentence_length
குதிரைச்_சவாரி,அந்த மூலைக்கடையிலே டீ குடித்துவிட்டு வருகிறேன்.,5
குதிரைச்_சவாரி,நீ குதிரை இரண்டையும் ஒட்டிக்கொண்டு முன்னாலே போ.,6
குதிரைச்_சவாரி,"என்ன, சரிதானா? என்றான் முனுசாமி.",4
குதிரைச்_சவாரி,"ஓ, அப்படியே என்றான் மகிழ்ச்சியுடன் மோஹன், குதிரைகளின் கடிவாளங்களைக் கையில் பிடித்துக் கொண்டான்.",10
குதிரைச்_சவாரி,ஆனந்தமாகக் கடற்கரையை நோக்கிக் குதிரைகள் இரண்டையும் ஒட்டிச் சென்றான்.,7
குதிரைச்_சவாரி,வழியிலே பல தெருக்களைக் கடந்துதான் கடற்கரைக்குச் செல்ல வேண்டும்.,7
குதிரைச்_சவாரி,ஒரு தெருவில் நாலைந்து துஷ்டப் பையன்கள் நின்றுகொண்டிருந்தார்கள்.,6
குதிரைச்_சவாரி,"அவர்கள் மோஹனையும், குதிரைகளையும் கண்டார்கள்.",4
குதிரைச்_சவாரி,இந்த ரகளை யில் குதிரைகள் இரண்டும் வேகமாக ஒட ஆரம்பித்தன.,8
குதிரைச்_சவாரி,"ஒட, ஒட, அந்தத் துஷ்டப் பையன்களும் விடாமல் விரட்டலானார்கள்.",7
குதிரைச்_சவாரி,"மோஹனும் மூச்சைப் பிடித்துக்கொண்டு, குதிரைகளைத் தொடர்ந்து ஒடினான்... ஆனாலும், அவனால் அதிக தூரம் ஓட முடியவில்லை களைத்து விட்டான்.",14
குதிரைச்_சவாரி,கையிலிருந்த கடிவாளங்கள் நழுவி விட்டன குதிரைகள் இரண்டும் அவனை விட்டு விட்டு ﻿ஒடலாயின.,10
குதிரைச்_சவாரி,ஒவ்வொன்றும் ஒவ்வொரு வீதியில் நுழைந்து ஓடி மறைந்துவிட்டன !,6
குதிரைச்_சவாரி,"மோஹன், அப்படியே சிலை போலச் சிறிது நேரம் நின்றுவிட்டான்.",7
குதிரைச்_சவாரி,அவனுக்கு ஒன்றும் புரியவில்லை.,3
குதிரைச்_சவாரி,குதிரைகளை எப்ப்டிப் பிடிப்பது?,3
குதிரைச்_சவாரி,இந்தப் பக்கம் ஒன்று ஓடிவிட்டது அந்தப் பக்கம் ஒன்று ஓடிவிட்டதே என்று திகைத்தான்.,10
குதிரைச்_சவாரி,﻿குதிரைகள் சென்ற திசைகளில் ஒன்றை நோக்கி ஒடினான் இங்குமங்கும் தேடினான்.,8
குதிரைச்_சவாரி,"பிறகு, மற்றொரு குதிரை சென்ற தெருவழியே சென்றான்.",6
குதிரைச்_சவாரி,வெகு நேரம் தேடினான்.,3
குதிரைச்_சவாரி,அவனுக்கு என்ன செய்வது என்றே தெரியவில்லை.,5
குதிரைச்_சவாரி,அழுகை அழுகையாக வந்தது.,3
குதிரைச்_சவாரி,﻿ ஐயோ குதிரைக்கார முனுசாமி என்ன சொல்லு வானோ?,7
குதிரைச்_சவாரி,... என்மேல் என்ன குற்றம்?,3
குதிரைச்_சவாரி,எல்லாம் அந்தப் பாழாய்ப்போன துஷ்டப் பையன்களால் வந்த வினை தானே !,8
குதிரைச்_சவாரி,"... யார் குற்றமானாலும், குதிரைக்காரன், சும்மா விடுவானா? இப்படி அவன் ஏதேதோ எண்ணினான்.",9
குதிரைச்_சவாரி,நேரம் ஆக ஆகப் பயம் அதிகரித்தது.,5
குதிரைச்_சவாரி,பேசாமல் வீட்டுக்குப் போய் விடுவதுதான் நல்லது என்று நினைத்தான்.,7
குதிரைச்_சவாரி,"அழுகையை அடக்கிக்கொண்டு, வீட்டை நோக்கி நடந்தான்.",5
குதிரைச்_சவாரி,அப்போது அவனுக்குப் பற்பல எண்ணங்கள் தோன்றின.,5
குதிரைச்_சவாரி,நான் இருக்கும் வீதிப்பெயர்கூட அந்தக் குதிரைக் காரனுக்குத் தெரியுமே !,7
குதிரைச்_சவாரி,"வீட்டுக்கு வந்துவிட்டால், என்ன செய்வது?",4
குதிரைச்_சவாரி,"அப்பாவிடம் வந்து, குதிரை வேண்டும்.",4
குதிரைச்_சவாரி,"அல்லது குதிரை விலையைத் தந்தால்தான் விடுவேன் என்று சொன்னால், என்ன பண்ணுவது?",9
குதிரைச்_சவாரி,அப்பா என்னைச் சும்மா விடுவாரா?,4
குதிரைச்_சவாரி,சரியாக அடி கிடைக்கும்.,3
குதிரைச்_சவாரி,அடி கிடைத்தால்கூடப் பரவாயில்லையே !,3
குதிரைச்_சவாரி,"பணம் கேட்டால், பணத்துக்கு அப்பா எங்கே போவார்?",6
குதிரைச்_சவாரி,என்னவெல்லாம் நடக்குமோ? என்று ஒரே கவலையாக வீட்டை அடைந்தான்.,7
குதிரைச்_சவாரி,நடந்ததைப்பற்றி அப்பா அம்மாவிடம் ஒன்றுமே கூற வில்லை.,6
குதிரைச்_சவாரி,"கூறினால் என்ன நேருமோ, ஏது நடக்குமோ என்று எண்ணி, பேசாமல் இருந்துவிட்டான்.",9
குதிரைச்_சவாரி,"ஆனாலும், அவன் மனம் சும்மா இருக்குமா?",5
குதிரைச்_சவாரி,இரவு முழுவதும் சரியான தூக்கம் இல்லை.,5
குதிரைச்_சவாரி,குதிரைக்கார முனுசாமி வந்து விடுவானோ.,4
குதிரைச்_சவாரி,வந்துவிடுவானோ என்று பயந்துகொண்டே இருந்தான் மோஹன்.,5
குதிரைச்_சவாரி,தெருப்பக்கமே தலை காட்டவில்லை.,3
குதிரைச்_சவாரி,﻿வீட்டுக்குள்ளேயே உட்கார்ந்துகொண்டு ஏதோ கதை படிப்பவன் போலப் புத்தகத்தைப் புரட்டிக்கொண்டே இருந்தான்.,9
குதிரைச்_சவாரி,அப்பா ஆபீஸிற்குப் போய்விட்டார்.,3
குதிரைச்_சவாரி,அம்மா சமையல் கட்டில் வேலை பார்த்துக்கொண்டிருந்தாள்.,5
குதிரைச்_சவாரி,"மோஹன் வாசல் கதவை நன்றாக அடைத்துவிட்டு, படுக்கையில் படுத்துக் ﻿ கொண்டான்.",9
குதிரைச்_சவாரி,அப்போதும் அவன் மனத்தில் நிம்மதி இல்லை.,5
குதிரைச்_சவாரி,முனுசாமி நேற்றுக் கடற்கரைக்குச் சென்றிருப்பான்.,4
குதிரைச்_சவாரி,குதிரைகளையும் என்னையும் அங்கே காணாமல் என்ன செய்தானோ?,6
குதிரைச்_சவாரி,முனுசாமி வந்துவிட்டானே ! என்று நடுங்கினான் மோஹன்.,5
குதிரைச்_சவாரி,பேசாமல் கண்களை இறுகமூடிக்கொண்டு தூங்குகிறவன் போலப் பாசாங்கு செய்தான்.,7
குதிரைச்_சவாரி,கதவைத் தட்டும் சத்தம் வர வர அதிகரித்தது.,6
குதிரைச்_சவாரி,"ஆனாலும், மோஹன் அசையவில்லை.",3
குதிரைச்_சவாரி,"சத்தம் பலமாகக் கேட்டதும், அடுப்பங்கரையில் இருந்த அம்மா ஒடி வந்தாள்.",8
குதிரைச்_சவாரி,ஏண்டா நீ கதவைத் திறக்கப்படாதா?... சரிதான்.,5
குதிரைச்_சவாரி,தூங்குகிறயாக்கும் என்று சொல்லிக்கொண்டே கதவின் அருகே சென்றாள்.,6
குதிரைச்_சவாரி,யாரது? என்று கேட்டுக்கொண்டே கதவைத் திறந்தாள்.,5
குதிரைச்_சவாரி,"அப்போது, மோஹன் மெதுவாகக் கண்களைத் திறந்து கதவுப்பக்கம் பார்த்தான்.",7
குதிரைச்_சவாரி,அங்கே முனுசாமி இல்லை !,3
குதிரைச்_சவாரி,யாரோ ஒரு பையன் நின்றுகொண்டிருந்தான்.,4
குதிரைச்_சவாரி,"இவன் யாராக இருக்கும்? என்று மோஹன் யோசிப்பதற்குள், அம்மா, நான் ராமச்சந்திரன் செட்டி கடையிலிருந்து வருகிறேன்.",12
குதிரைச்_சவாரி,கடைப்பாக்கியை இந்த மாசம் பிறந்தவுடனே தருவதாகச் சொன்னீர்களாம்.,6
குதிரைச்_சவாரி,இன்னும் தம்படி தரவில்லை.,3
குதிரைச்_சவாரி,எங்கள் முதலாளி கண்டிப்பாகக் கேட்டு வாங்கிவரச் சொன்னர் என்று மளமளவென்று கூறி முடித்தான் அந்தப் பையன்.,12
குதிரைச்_சவாரி,"﻿ சரிதான், ஐயா ஆபீஸ் போயிருக்கிறார், சாயங்காலம் வந்ததும் சொல்கிறேன்.",8
குதிரைச்_சவாரி,கொண்டுவந்து கொடுப்பார். என்று பதில் சொன்னாள் அம்மா.,6
குதிரைச்_சவாரி,"உடனே, அவன் போய்விட்டான்.",3
குதிரைச்_சவாரி,அப்பாடா ! என்று உள்ளுர மகிழ்ச்சி அடைந்தான் மோஹன்.,6
குதிரைச்_சவாரி,ஆனாலும் அந்த மகிழ்ச்சி அதிக நேரம் நீடிக்கவில்லை.,6
குதிரைச்_சவாரி,அவனுக்கிருந்த பயம் அந்த மகிழ்ச்சியை அப்படியே விழுங்கிவிட்டது.,6
குதிரைச்_சவாரி,படுத்தபடியே திரும்பவும் யோசனை செய்தான்.,4
குதிரைச்_சவாரி,இரவு நல்ல தூக்கம் இல்லாததால் சிறிது கண்மூடலானான்.,6
குதிரைச்_சவாரி,யாரோ கதவு திறக்கும் சத்தம் கேட்டது.,5
குதிரைச்_சவாரி,கூர்ந்து கவனித்தான் மோஹன்.,3
குதிரைச்_சவாரி,"உடனே, அவனுடைய உடல் நடுங்க ஆரம்பித்துவிட்டது.",5
குதிரைச்_சவாரி,அங்கு வந்தது சாட்சாத் குதிரைக்கார முனுசாமியேதான் !,5
குதிரைச்_சவாரி,"அவன் வந்ததும், மீசையை ந்ன்றாக முறுக்கிவிட்டுக்கொண்டான்.",5
குதிரைச்_சவாரி,அவன் கண்கள் அபாய விளக்கைப்போல் சிவப்பாக இருந்தன.,6
குதிரைச்_சவாரி,"ஐயா, மோஹன் என்கிற பையன் இங்குதானே இருக்கிறான்? என்று அதிகாரத்துடன் கேட்டான் அவன்.",10
குதிரைச்_சவாரி,என்னப்பா விஷயம்? என்று கேட்டார் மோஹனுடைய அப்பா.,6
குதிரைச்_சவாரி,என்னவா என் குதிரைகள் இரண்டையும் அவனிடம் கொடுத்திருந்தேன்.,6
குதிரைச்_சவாரி,பொம்மைக் குதிரையா? நாணா விளையாடுகிறேன்?,4
குதிரைச்_சவாரி,எங்கே அந்தப் பையன்?,3
குதிரைச்_சவாரி,"கூப்பிட்டுக் கேளுங்கள், யார் விளையாடுவது என்று தெரியும் இப்படி ஆத்திரத்துடன் கூறினான் முனுசாமி.",10
குதிரைச்_சவாரி,﻿அவன் முன்பு பார்த்த முனுசாமியாக இல்லை அவன் முகம் கடுகடுப்பாக இருந்தது.,9
குதிரைச்_சவாரி,குரலில் சாந்தம் இல்லை.,3
குதிரைச்_சவாரி,டேய் மோஹன் என்று அப்பா கூப்பிட்டார்.,5
குதிரைச்_சவாரி,இதையெல்லாம் கம்பிகளின் இடுக்கு வழியாகக் கவனித்துக்கொண்டிருந்த மோஹனின் உடல் நடுங்க ஆரம்பித்தது.,9
குதிரைச்_சவாரி,கைகால்களெல்லாம் தந்தி அடித்தன.,3
குதிரைச்_சவாரி,"சர்வ நாடியும் ஒடுங்க, ஏனப்பா ! என்று அழுது கொண்டே முன்னால் வந்தான்.",9
குதிரைச்_சவாரி,அப்பா நடந்தவற்றை விசாரித்தார்.,3
குதிரைச்_சவாரி,ஒளிவு மறைவு இல்லாமல் எல்லாவற்றையும் நடந்தது நடந்தபடியே மோஹன் சொன்னான்.,8
குதிரைச்_சவாரி,"மோஹன் சொல்லி முடித்ததும், இப்போது என்ன சொல்கிறீர்கள்?",6
குதிரைச்_சவாரி,என் பிழைப்பிலே மண்ணப் போடப் பார்க் ﻿ கிறீர்களா?,7
குதிரைச்_சவாரி,இப்போது குதிரைகள் இரண்டையும் தந்தால் தான் விடுவேன்.,6
குதிரைச்_சவாரி,இல்லாவிட்டால் குதிரை ஒன்றுக்கு ஆயிரம் ரூபாய் தரவேண்டும் என்று முனுசாமி கண்டிப்பாகக் கூறினான்.,10
குதிரைச்_சவாரி,என்ன இரண்டுக்கும் இரண்டாயிரம் ரூபாயா !,4
குதிரைச்_சவாரி,அதற்கு எங்கே போகிறது?,3
குதிரைச்_சவாரி,"இந்தச் சனியன் பிடித்த பயல் ஏன் குதிரைகளைப் பிடித்துப் போனான்?... என்னவோ அப்பா, எனக்கு ஒன்றும் தெரியாது.",13
குதிரைச்_சவாரி,குதிரைகளை நீ இந்தப் பையனிடம்தானே கொடுத்தாய்?,5
குதிரைச்_சவாரி,"சரி, இவனை வேண்டுமானால் பிடித்துக்கொண்டு போ.",5
குதிரைச்_சவாரி,பணம் கொடுக்க நான் எங்கே போவேன்? என்று கூறிவிட்டார் அப்பா.,8
குதிரைச்_சவாரி,"சரி, இந்தப் பையனை இப்பொழுதே என்னோடு அனுப்பி வையுங்கள். நான் என்ன அனுப்புகிறது?",10
குதிரைச்_சவாரி,"நீயே பிடித்துக் கொண்டு போ, இந்த நாசமாய்ப்போன பயலை அப்படியா !",8
குதிரைச்_சவாரி,"சரி என்று கூறிவிட்டு, முனுசாமி மோஹனைப் பிடித்து, பரபர வென்று இழுத்தான்.",9
குதிரைச்_சவாரி,"உடனே, ஐயோ அம்மா அம்மா ! என்று கதறினான் மோஹன்.",7
குதிரைச்_சவாரி,"என்னடா மோஹன், என்ன உளறுகிருய்?",4
குதிரைச்_சவாரி,சொப்பனமா? என்று கேட்டாள் அம்மா.,4
குதிரைச்_சவாரி,"அப்போதுதான் மோஹனுக்கு, தான் கண்மூடியதற்குப் பிறகு இதுவரை நடந்ததெல்லாம் வெறும் கனவு என்பது தெரிந்தது.",11
குதிரைச்_சவாரி,ஒன்றுமில்லை அம்மா ! என்று கூறி அம்மாவை அனுப்பிவிட்டான்.,6
குதிரைச்_சவாரி,"கனவிலே கண்டவற்றையெல்லாம் நினைக்க நினைக்க, அவனுக்குப் பயமாக இருந்தது.",7
குதிரைச்_சவாரி,"கடவுளே, இப்படியெல்லாம் நடக்கக் கூடாது என்று வேண்டிக்கொண்டான் ﻿அன்று மாலை அவன் கடற்கரைக்குப் போகவேயில்லை.",11
குதிரைச்_சவாரி,போனால் அகப்பட்டுக்கொள்வோம் என்ற பயம் அவனுக்கு.,5
குதிரைச்_சவாரி,இது அவனுடைய அம்மாவுக்கு மிகுந்த ஆச்சரியமாக இருந்தது.,6
குதிரைச்_சவாரி,"மோஹன், இந்தக் கோடை விடுமுறையில் நீ தினமும் மூன்று மணிக்கே கடற்கரைக்குப் புறப்பட்டுவிடு வாயே !",11
குதிரைச்_சவாரி,இன்றைக்கு ஏன் போகவில்லை? என்று கேட்டாள்.,5
குதிரைச்_சவாரி,"தினசரி கடற்கரைக்குப் போய், சலிப்புத்தட்டிவிட்டது என்று சமாதானம் கூறினான் மோஹன்.",8
குதிரைச்_சவாரி,இப்படியே அவன் ஒரு வாரம் கடற்கரைக்கே போகாமல் காலம் தள்ளிவிட்டான்.,8
குதிரைச்_சவாரி,அதுவரை குதிரைக்கார முனுசாமி அவனைத் தேடி வராதது அவனுக்கே ஆச்சரியமாக இருந்தது.,9
குதிரைச்_சவாரி,அப்பாவுக்கு ஆபீஸ் விடு முறை.,4
குதிரைச்_சவாரி,"அவர் அவனைப் பார்த்து, மோஹன், இன்று நாம் கடற்கரைக்குப் போவோமா?",8
குதிரைச்_சவாரி,"வா, போகலாம் என்றார்.",3
குதிரைச்_சவாரி,மோஹனுக்கு என்ன சொல்லுவது என்று தெரியவில்லை.,5
குதிரைச்_சவாரி,முனுசாமி ஞாபகம் வந்துவிட்டது.,3
குதிரைச்_சவாரி,"ஒரு வேளை முனுசாமி, பழைய குதிரைகள் போனால் போகிறது என்று புதிதாகக் குதிரைகள் வாங்கியிருக்கிறானோ என்னவோ...... யார் கண்டது?",14
குதிரைச்_சவாரி,"கடற்கரையில் அவன் என்னைப் பார்த்துவிட்டால் சும்மா விடுவானா? என்று எண்ணினான், உடனே, அவனுடைய பயம் அதிகரித்தது.",12
குதிரைச்_சவாரி,"வேண்டாம் அப்பா, எனக்கு விட்டிலே உட்கார்ந்து கதை படிப்பதில்தான் ஆசை.",8
குதிரைச்_சவாரி,கடற்கரையிலே என்ன அப்பா இருக்கிறது? என்று தட்டிக் கழித்துப் பார்த்தான் மோஹன்.,9
குதிரைச்_சவாரி,ஆனால் அப்பா விடவில்லை.,3
குதிரைச்_சவாரி,இந்த வயதிலே நன்றாக ஒடி ஆடி விளையாட வேண்டும்.,7
குதிரைச்_சவாரி,"வா, போகலாம், என்று விடாப்பிடியாக அவனை அழைத்துக்கொண்டு சென்றார்.",7
