work_title,sentence,sentence_length
கள்வர்_குகை,கள்வர் குகை பாவலர் நாரா.,4
கள்வர்_குகை,﻿கள்வர் குகை — எழுதியது — நாரா.,6
கள்வர்_குகை,நாச்சியப்பன் ஆசிரியர் இளந் தமிழன் சென்னை பதினான்கு  விலை பதினைந்து  காசுகள் — வெளியிடுவோர் — கலைப்பிரசுரம் த.,14
கள்வர்_குகை,அறுநூற்று இருபத்து மூன்று ஆயிரத்து முன்னூற்று இரண்டு கலைப் பிரசுரம் வெளியீடு ஐந்து ﻿ தம்பிகளே !,12
கள்வர்_குகை,கள்வர் குகை கலைப் பிரசுரத்தின் ஐந்தாவது வெளியீடு.,6
கள்வர்_குகை,இருபத்து மூன்று ஆண்டுகட்கு முன் அன்புள்ளம் கொண்ட அண்ணன் நாரா.,8
கள்வர்_குகை,நாச்சியப்பன் அவர்கள் எழுதியது.,3
கள்வர்_குகை,மீண்டும் வெளியிடுவதில் மிக்க மகிழ்சி யடைகிறேன்.,5
கள்வர்_குகை,நீங்கள் எல்லாம் உங்கள் எண்ணத்தை எங்கட்கு எழுதுவீர்கள் என்று நம்புகிறேன்.,8
கள்வர்_குகை,அவர்களில் ஒவ்வொரு கூட்டத்திற்கும் ஒவ்வொரு தலைவன் உண்டு.,6
கள்வர்_குகை,அவனே அவர்கள் வேட அரசன் என்று கூப்பிடுவார்கள்.,6
கள்வர்_குகை,அவன் ஆணைப்படி மற்ற வேடர்கள் நடப்பார்கள்.,5
கள்வர்_குகை,வேட்டைக்குப் புறப்பட்டுப் போகும் போது அவன் முன்னே நடக்க அவன் பின் மற்றவர்கள் நடந்து செல்வார்கள்.,12
கள்வர்_குகை,"அவன் எங்கு சென்றாலும், அவனை இரண்டு வேடர்கள் தொடர்ந்து செல்வார்கள்.",8
கள்வர்_குகை,"வேடர்களுக்கு அவன் தலைவனுயிருந்தாலும், நகரத்தில் உள்ள அரசர்களுக்குக் கட்டுப்பட்டவன் தான்.",8
கள்வர்_குகை,காட்டில் விளையும் பொருள்களில் ஒரு பகுதியை அவன் நகரத்தையாளும் அரசனுக்குக் கப்பமாகக் கட்டவேண்டும்.,10
கள்வர்_குகை,"இன்னும் வில் வளைக்க, அரசன் படையில் உள்ளவர்களுக்கு அவன் தன் ஆட்களே அனுப்பிச் சொல்லித்தர வேண்டும்.",12
கள்வர்_குகை,இது போல் காட்டரசர்களுக்கும் நாட்டரசர்களுக்கும் ஒரு வகையான ஒப்பந்தம் இருந்து வந்தது.,9
கள்வர்_குகை,கொல்லிமலைக் காட்டில் இது போல் ஒருவேடர் கூட்டம் இருந்து வந்தது.,8
கள்வர்_குகை,அக்கூட்டத் தலைவனுக்கு ஒரு மகன் இருந்தான்.,5
கள்வர்_குகை,அவனுக்கு நம்பி என்று பெயர்.,4
கள்வர்_குகை,நம்பி எப்பொழுதும் காடுகளைச் சுற்றிக் கொண்டு திரிவான்.,6
கள்வர்_குகை,"அவன், கையில் வில்லும் அம்பும் எப்பொழுதும் தயாராக நாணேற்றியபடி இருக்கும்.",8
கள்வர்_குகை,குடிசைக்கு வராமலே அவன் பல நாட்கள் ﻿காடுகளைச் சுற்றுவான்.,7
கள்வர்_குகை,அப்பொழுது கணக்கில்லாத மிருகங்களைக் கொன்று குவிப்பான்.,5
கள்வர்_குகை,மலைகளின் மீது ஏறி இறங்குவது அவனுக்கொரு விளையாட்டு.,6
கள்வர்_குகை,"நம்பி, வேடர் தலைவனுக்கு ஒரே மகனாகையால், அவன் விருப்பப்படி தனியாகச் சுற்ற விட்டிருந்தான்.",10
கள்வர்_குகை,அவனை என்ன குற்றம் செய்தாலும் கண்டிக்கவே மாட்டான்.,6
கள்வர்_குகை,மற்ற வேடர்களும் அவ்ன் தங்கள் தலைவர் மகன் என்று அவன் செய்யும் துன்பங்களைப் பொறுத்துக் கொள்ளுவார்கள்.,12
கள்வர்_குகை,சில சமயங்களில் அவன் புலியின் தோலைப் போர்த்திக் கொண்டு மரத்திலிருந்தபடி வேடர்களுக்கு மத்தியில் குதிப்பான்.,11
கள்வர்_குகை,அவர்கள் எங்கிருந்தோ புலி பாய்கிறது என்று எண்ணிப்பயந்து பதைபதைத்துச் சிதறி ஓடுவார்கள்.,9
கள்வர்_குகை,உடனே புலித்தோலை நீக்கிவிட்டு வெளியில் வந்து சிரிப்பான்.,6
கள்வர்_குகை,இப்படிப் பல வேடிக்கைகள் செய்துகொண்டே அவன் தன் வாழ்க்கையை இன்பமாகச் செலுத்தி வந்தான்.,10
கள்வர்_குகை,"ஒரு நாள் நம்பி, ஒரு மரத்தின் மேல் ஏறிப்பழம் பறித்துக் கொண்டிருந்தான்.",9
கள்வர்_குகை,அப்பொழுது கீழே ஒரு குதிரை நிற்பதைப் பார்த்தான்.,6
கள்வர்_குகை,குதிரையில் வந்த ஆள் அதை மரத்தடியில் கட்டிவிட்டு எதற்காகவோ இறங்கி நடந்து கொண்டிருந்தான்.,10
கள்வர்_குகை,நம்பி மரத்தை விட்டுக் கீழே இறங்கினான்.,5
கள்வர்_குகை,குதிரையை அவிழ்த்து அதன் முதுகில் ஏறிக்கொண்டு கிளம்பினான்.,6
கள்வர்_குகை,அது பாண்டிய மன்னனின் குதிரை.,4
கள்வர்_குகை,"அவனுடைய படை வீரர்கள், சிறிது தூரத்தில் தங்கியிருந்தார்கள்.",6
கள்வர்_குகை,எல்லோரும் காட்டில் வேட்டையாடுவதற்காக வந்திருந்﻿தார்கள்.,4
கள்வர்_குகை,தம்பியும் குதிரையும் சென்ற வழியில் பாண்டியன் படைவீரர்.,6
கள்வர்_குகை,அனைவரும் பறந்து விட்டார்கள்.,3
கள்வர்_குகை,குளத்தில் நீர் அருந்துவதற்காகச் சென்ற பாண்டியன் குதிரைகள் கிளம்பும் சத்தத்தைக் கேட்டுத் திரும்பி வந்தான்.,11
கள்வர்_குகை,"அங்கே தன் குதிரையையும், படை வீரர்களையும் காணவில்லை.",6
கள்வர்_குகை,கால்நடையாக ஊருக்குள் போவதற்கு அவனுடைய உயர் தன்மை இடங்கொடுக்கவில்லை.,7
கள்வர்_குகை,"என்ன செய்வதென்று புரியாமல், வேடர் தலைவன் தங்கியிருந்த குடிசை நோக்கி தடந்தான்.",9
கள்வர்_குகை,"இதற்கிடையில், நம்பியை அரசனென்று நினைத்துப் பின் தொடர்ந்த வீரர்கள், அந்தக் குதிரையின் வேகத்தைப்பிடிக்க முடியாமல் பின் தங்கி விட்டார்கள்.",14
கள்வர்_குகை,"விரட்டிய ஆட்கள் நின்று விட்ட பிறகு நம்பி, வேறு வழியாகக் குதிரையைத் திருப்பித் தன் குடிசை நோக்கித் தட்டினான்.",14
கள்வர்_குகை,﻿நம்பி குதிரையை ஒரு மரத்தில் கட்டிவிட்டுத் தன் குடிசைக்கு வந்தான்.,8
கள்வர்_குகை,"அங்கே, பாண்டியனும், வேடர்.",3
கள்வர்_குகை,அங்கே வந்த நம்பி !,3
கள்வர்_குகை,இன்று காலையில் மாமரத்தடியில் ஒரு குதிரை நின்றது.,6
கள்வர்_குகை,"அதைப் பிடித்துக்கொண்டு, சவாரிக்குக் கிளம்பினேன்.",4
கள்வர்_குகை,"அந்தக் குதிரைக்காரன், அவனுடைய ஆட்களை விட்டு விரட்டினான்.",6
கள்வர்_குகை,இல்லையப்பா. என்று தன் திறமையைக் கூறினான்.,5
கள்வர்_குகை,"ஏண்டா, அரசருடைய குதிரையை, ஆணையில்லாமல் சவாரிக்குக் கொண்டு போகலாமா? என்று அதட்டினான் வேடத் தலைவன்.",11
கள்வர்_குகை,"அவன் உடனே பாண்டியனைப் பார்த்து, ஏனையா, நீரே சொல்லும், சவாரி செய்து பார்த்தால் என்ன குறைந்து விடும்.",13
கள்வர்_குகை,"இதற்கெல்லாம், உத்தரவு கேட்டால் நடக்குமா? என்று தட்டிக் கேட்டான்.",7
கள்வர்_குகை,"பாண்டியனுக்கு ஒருபுறம் கோபமும், ஒருபுறம் வருத்தமுமாக இருந்தது.",6
கள்வர்_குகை,அவன் வேடர் தலைவனை முறைத்துப் பார்த்தான்.,5
கள்வர்_குகை,"உடனே வேடர் தலைவன், டே நம்பி, எட்ட நின்று பேசு !",8
கள்வர்_குகை,அரசரிடம் இப்படித்தான் பேசுவதா? என்று அதட்டினான்.,5
கள்வர்_குகை,"உடனே நம்பி, ஓகோ இவர்தான் பாண்டியரா?",5
கள்வர்_குகை,"ஏனையா நீர் ஐநூறு குதிரை வைத்திருக்கிறீரே, இந்தக் குதிரையை எனக்குத் தந்துவிடும்.",9
கள்வர்_குகை,இது மிக அருமையான குதிரை.,4
கள்வர்_குகை,என் சவாரிக்கு ஏற்ற குதிரை !,4
கள்வர்_குகை,நானே வைத்துக் கொள்கிறேன்.,3
கள்வர்_குகை,சரிதானே? என்று கேட்டான்.,3
கள்வர்_குகை,சரி நாளைக்கு வேறு குதிரை யனுப்புகிறேன்.,5
கள்வர்_குகை,"இப்பொழுது இந்தக் குதிரையைக் கொடு, நான் ஊர் போக வேண்டும் என்று கெஞ்சினான்.",10
கள்வர்_குகை,"இந்தக் குதிரைதான் பாண்டியரே நல்ல குதிரை, இதை.",6
கள்வர்_குகை,நாளையனுப்புவதானால் இன்று தருகிறேன்.,3
கள்வர்_குகை,இல்லாவிட்டால் கிடையாது என்று சொல்லி விட்டான் நம்பி !,6
கள்வர்_குகை,சரி யென்று சொல்வதைத் தவிரப் பாண்டியனால் அப்பொழுது வேறொன்றும் செய்ய முடியவில்லை.,9
கள்வர்_குகை,கடைசியில் குதிரையை வாங்கிக்கொண்டு அரண்மனை போய்ச் சேர்ந்தான்.,6
கள்வர்_குகை,அடுத்த நாள் பாண்டியன் அரண்மனையிலிருந்து ஒரு வீரன் வந்து குதிரையைக் கொடுத்து விட்டுப் போனான்.,11
கள்வர்_குகை,அது முதல் அந்தக் குதிரையுடன் காடு மேடு சுற்றுவதே தொழிலாகக் கொண்டான் நம்பி !,10
கள்வர்_குகை,ஒரு நாள் கொல்லிமலையைச் சுற்றிக்கொண்டு வந்தான் தம்பி !,6
கள்வர்_குகை,ஓரிடத்தில் மலைச்சாரலில் ஏதோ மனிதர்கள் பேசும் அரவங்கேட்டது.,6
கள்வர்_குகை,சட்டென்று தன் குதிரையை நிறுத்தி ஒரு புதருக்குப் பின்னால் கட்டிவிட்டு மரத்தின் மேல் ஏறி நின்று பார்த்தான்.,13
கள்வர்_குகை,மலைக்குக் கீழ் எப்படி போய்வர முடியும் என்று அவனுக்குப் புரியவில்லை.,8
கள்வர்_குகை,அன்று முதல் தினமும் அதே நேரத்திற்கு அங்கே வருவான்.,7
கள்வர்_குகை,ஏறுவான் அந்த மூன்று பேரும் பேசிக் கொள்வதைப் பார்ப்பான்.,7
கள்வர்_குகை,"பிறகு போய்விடுவான், இப்படியாகப் பல நாட்கள் சென்றன.",6
கள்வர்_குகை,"அந்த இடத்தைச்சுற்றி ஒரே புற்றும் புதரும் செடியும் கொடியும், மரமுமாக வளர்ந்திருந்தது.",9
கள்வர்_குகை,வெளியில் நின்று கொண்டு பார்த்தால் சாதாரணமாக அந்த இடம் யார் கண்ணுக்கும் தெரியாது.,10
கள்வர்_குகை,அந்த இடத்தைச் சுற்றிச்சுற்றி நன்றாகக் கவனித்தான் நம்பி மலையியின்.,7
கள்வர்_குகை,நடுவில் ஒரு பாறை துண்டாக இருப்பதுபோல் தெரிந்தது.,6
கள்வர்_குகை,அதற்குச் சற்றுத் தூரத்தில் ஏதோ ஒன்று மின்னிக்கொண்டு கிடந்தது.,7
கள்வர்_குகை,"போய் அதையெடுத்துப் பார்த்தான், வைரக் கற்கள் பதித்த தங்கச் சங்கிலி அது.",9
கள்வர்_குகை,நல்ல வேலைப்பாடுகள் செய்யப்பட்டிருந்தது.,3
கள்வர்_குகை,"சரி, மீதியை நாளைக்குப் பார்த்துக்கொள்ளுவோம் என்று அதை எடுத்துக்கொண்டு திரும்பி வந்துவிட்டான்.",9
கள்வர்_குகை,அவனுக்கு அந்த மூன்று ஆட்களைப் பற்றியும் விவரமாகத் தெரிந்து கொள்ளவேண்டும் என்று ஒரு ஆசையுண்டாகியது.,11
கள்வர்_குகை,"அந்த மூன்று ஆசாமிகளும் வந்தார்கள், அவர்களில் ஒருவன் தான் தமிழன்.",8
கள்வர்_குகை,"மற்றவர்கள் இரண்டுபேரும் தலையைத் திட்டுத் திட்டாக வழித்து, முடியிருக்கும் இடத்தில் இரண்டு சடைகள் பின்னித் தொங்கவிட்டுக் கொண்டிருந்தார்கள்.",13
கள்வர்_குகை,"அவர்கள் மங்கோலியர்கள், அவர்கள் மூவரும் வந்து மங்கோலிய மொழியில் ஏதேதோ பேசிக் கொண்டார்கள்.",10
கள்வர்_குகை,அதெல்லாம் நம்பிக்குப் புரியவில்லை.. ஆகையால் அவர்கள்.,5
கள்வர்_குகை,செயல் ஒவ்வொன்றையும் ஊன்றிக் கவனித்தான்.,4
கள்வர்_குகை,"நெடுநேரம் ஏதேதோ பேசிக்கொண்டிருந்து விட்டு, அந்த மங்கோலியர்களில் ஒருவன், தனியாக நின்ற பாறாங்கல்லின் அடியில் எதையோ அழுத்தினான்.",13
கள்வர்_குகை,மற்றொரு ஆள் அதை மெதுவாகச் சாய்த்தான்.,5
கள்வர்_குகை,பிறகு மூவரும் உள்ளே சென்றார்கள்.,4
கள்வர்_குகை,உள்ளே என்ன செய்தார்களோ தெரியவில்லை.,4
கள்வர்_குகை,சிறிது நேரம் சென்றபிறகு மூவரும் வெளியில் வந்தார்கள்.,6
கள்வர்_குகை,மங்கோலியர் இருவர் கையிலும் தங்கப் பாளங்கள் மின்னின.,6
கள்வர்_குகை,அவற்றை மடியில் கட்டிக்கொண்டனர்.,3
கள்வர்_குகை,பிறகு எல்லோரும் நடந்தனர்.,3
கள்வர்_குகை,தூரத்தில் ஒரு கால்வாய் இருந்தது.,4
கள்வர்_குகை,அதில் அப்பொழுது தண்ணீர் கிடையாது.,4
கள்வர்_குகை,"அதில் இறங்கி அந்தக் கால்வாய் ஓடிய திசையில் நடந்து சென்றார்கள், நம்பி, திரும்பிப்போய்க் குதிரை மீது ஏறிக்கொண்டான்.",13
கள்வர்_குகை,அந்தக் கால்வாய்க்குச் சிறிது தூரத்தில் அதையொட்டியவாறே குதிரையை நடத்திக்கொண்டு பறந்தான்.,8
கள்வர்_குகை,மற்ற இருவரும் அங்கு கட்டிவைத்திருந்த படகை அவிழ்த்துக் கொண்டு புறப்பட்டனர்.,8
கள்வர்_குகை,படகு ஆற்றில் மேற்கு நோக்கி அதன் போக்கில் சென்றது.,7
கள்வர்_குகை,"சிறிது தூரம் சென்றவுடன் அதில் இருந்த ஒரு மங்கோலியன் நம்பி யிருந்த மரத்தைச், சுட்டிக் காட்டி என்னவோ சொன்னான்.",14
கள்வர்_குகை,அவனும் திரும்பிப் பார்த்து விட்டு ஏதோ பேசிக்கொண்டான்.,6
கள்வர்_குகை,நம்பி அவர்கள் சென்ற திக்கையே பார்த்துக் கொண்டிருந்தான்.,6
கள்வர்_குகை,அந்த மங்கோலியர் இருவரும் தான் அவர்களைக் கவனித்ததைக் கண்டுகொண்டு விட்டார்கள் என்பதை நம்பி உணரவில்லை.,11
கள்வர்_குகை,பிறகு இறங்கிக் குதிரையைத் தமிழ் ஆசாமிபோன திசையில் தட்டிவிட்டான்.,7
கள்வர்_குகை,வெகுதூரம் போயும் அவனால் ஒன்றும் கண்டு பிடிக்க முடியவில்லை.,7
கள்வர்_குகை,பிறகு மனம் சலித்தவனாக வீடு திரும்பினான்.,5
கள்வர்_குகை,"அடுத்த நாள் காலையில் எழுந்த உடன் குதிரைமீது ஏறிக்கொண்டு, வழக்கம்போல் அந்த மூன்று பேர் சந்திக்கும் இடத்திற்கு வந்தான்.",14
கள்வர்_குகை,மரத்தின் மேல் ஏறிக் கீழ் நோக்கினான்.,5
கள்வர்_குகை,அந்தத் தமிழ் ஆசாமிமட்டும் அங்கே நின்று கொண்டிருந்தான்.,6
கள்வர்_குகை,சிறிது நேரத்தில் அவன் மலைக்குக் ழே மறைவதுபோல் தோன்றியது.,7
கள்வர்_குகை,நம்பி மரத்தைவிட்டுக் கீழே இறங்கினான்.,4
