work_title,sentence,sentence_length
கம்பராமாயணம்_(உரைநடை),கம்பராமாயணம் டாக்டர் ரா.,3
கம்பராமாயணம்_(உரைநடை),"சீனிவாசன் பொருள் இலக்கியம் பதிப்பகம் அணியகம், ஐந்து, செல்லம்மாள் தெரு, செனாய் நகர், சென்னை முப்பது.",12
கம்பராமாயணம்_(உரைநடை),தொலைபேசி ஆறு மில்லியன் நாநூற்று எழுபத்தொன்பது ஆயிரத்து எழுநூற்று எழுபத்திரண்டு.,8
கம்பராமாயணம்_(உரைநடை),தொன்னூறு அச்சகம் மைக்ரோ அச்சகம் சென்னை இருபத்தொன்பது.,6
கம்பராமாயணம்_(உரைநடை),கம்பர் காவியத்துக்கே அவர் எடுத்தாளும் சொற்கள் தனிச் சிறப்பைத் தருகின்றன.,8
கம்பராமாயணம்_(உரைநடை),செஞ் சொற் கவி இன்பம் அவர் ஊட்டியது.,6
கம்பராமாயணம்_(உரைநடை),அவ்வின்பம் சிறிதும் குறையாது உரைநடையில் இந்நூல் படைக்கப்பட்டுள்ளது.,6
கம்பராமாயணம்_(உரைநடை),கம்ப ராமாயணக் கதை மட்டும் எடுத்துக் கூறுவது இவ்வுரைநடை நூல்.,8
கம்பராமாயணம்_(உரைநடை),கதைக் கோவை கெடாமல் நிகழ்ச்சிகளைச் சித்திரிக்கிறது இந்நூல் உரைநடை இதற்குத் தனிச்சிறப்புத் தருகிறது.,10
கம்பராமாயணம்_(உரைநடை),சில பதிப்புகளைக் கண்ட இந்நூல் அழகாக அச்சிடப்பட வேண்டும் என்ற முயற்சி எடுத்துக் கொள்ளப்பட்டது.,11
கம்பராமாயணம்_(உரைநடை),ஒளி அச்சில் தக்கதாளில் இந்நூல் வெளிவருகிறது.,5
கம்பராமாயணம்_(உரைநடை),இந்நூல் தரம் மிக்கதாக அமைய எல்லா முயற்சிகளும் எடுத்துக் கொள்ளப்பட்டன.,8
கம்பராமாயணம்_(உரைநடை),எம் வெளியீடுகள் சில இலக்கியப் பின்புலம் கொண்டவை அவை நிலைபேறு பெறத்தக்கவை என்பதால் மறுபதிப்புக் காண்கின்றன.,12
கம்பராமாயணம்_(உரைநடை),இவரின் புதுமுயற்சி வெற்றிபெற்றுள்ளது என்று தான் கூற வேண்டும்.,7
கம்பராமாயணம்_(உரைநடை),தெளிவான சிறந்த சொல்லாட்சி ஆசிரியரின் வெற்றிக்கு அடிப்படைக் காரணமாகும்.,7
கம்பராமாயணம்_(உரைநடை),இன்றியமையாத தருணங்களில் மட்டுமே கவிதை வரிகள் கண் சிமிட்டுகின்றன.,7
கம்பராமாயணம்_(உரைநடை),மற்றபடி நூலெங்கும் உரைநடை ராஜ நடை போடுகிறது.,6
கம்பராமாயணம்_(உரைநடை),தொய்வில்லாத ஆற்றொழுக்கான உரைநடை.,3
கம்பராமாயணம்_(உரைநடை),பாராட்டு கம்பனுக்கு மட்டுமல்ல போராசியர் ராசீக்கும் தான்.,6
கம்பராமாயணம்_(உரைநடை),உரையின் சிறப்புக்குச் சான்று இதோ அனுமனிடம் சீதை கூறியது தாரம் அல்லள் என்று சொல்லி என்னை ஒரம் கட்டலாம்.,14
கம்பராமாயணம்_(உரைநடை),அதற்காகத்தன் வீரம் காட்டாமல் இருப்பது அவன் ஆண்மைக்கு இழுக்கு என்பதை நினைவுறுத்து..... என்றாள்.,10
கம்பராமாயணம்_(உரைநடை),"வாழ்வதா, வீழ்வதா என்பதுதான் என் வாழ்க்கைப் பிரச்சனை என்றாள்.",7
கம்பராமாயணம்_(உரைநடை),மொத்தத்தில் அனைவருக்கும் பயனளிக்கும் நூல் சிறந்த முயற்சி பாராட்டுக்கள்.,7
கம்பராமாயணம்_(உரைநடை),"படைத்தலும், காத்தலும், அழித்தலும் இறைவனுக்குத் தொடர்ந்த விளையாட்டுகளாகும்.",6
கம்பராமாயணம்_(உரைநடை),அவர் எம் தலைவர் ஆவார்.,4
கம்பராமாயணம்_(உரைநடை),அன்னவர்க்கே நாங்கள் அடைக்கலம்.,3
கம்பராமாயணம்_(உரைநடை),இறைவன் எம்மைக் காப்பானாக.,3
கம்பராமாயணம்_(உரைநடை),"அது பழம் பெருமைமிக்கது அதைச் சத்திய விரதன் ஆகிய தசரதன், சக்கரவர்த்தி என்ற பெருமையோடு ஆண்டு வந்தான்.",13
கம்பராமாயணம்_(உரைநடை),அவன் உதித்த குலம் சூரிய குலம் என்பர்.,6
கம்பராமாயணம்_(உரைநடை),மனு என்பவனும் இக் குலத்தில் பிறந்தவனே.,5
கம்பராமாயணம்_(உரைநடை),மக்களை நன்னெறிப்படுத்த நீதிநெறிகளை வகுத்துக் கொடுத்தவன் இவன்.,6
கம்பராமாயணம்_(உரைநடை),"மழைவளம் குன்றி, மண்வளம் குறைந்த மகிதலத்துக்கு விண்ணுலகினின்று கங்கையை வரவழைத்த பகீரதனும் இக்குலத்தில் தோன்றியவனே.",11
கம்பராமாயணம்_(உரைநடை),அவனுடைய விடாமுயற்சியை மாநிலம் போற்றுகிறது.,4
கம்பராமாயணம்_(உரைநடை),அரிதின் முயன்று ஆற்றும் செயலுக்குப் பகீரதப் பிரயத்தனம் என்ற தொடர் இன்றும் வழங்குகிறது.,10
கம்பராமாயணம்_(உரைநடை),இச்சுவாகு என்ற அரசனின் மெச்சத்தக்க புகழ் இன்றும் பேசப்படுகிறது.,7
கம்பராமாயணம்_(உரைநடை),அவனால் இக்குலம் இச்சுவாகு குலம் என்று நச்சி உலகம் போற்றுகிறது.,8
கம்பராமாயணம்_(உரைநடை),காகுத்தன் என்பவன் தேவர்களின் ஆகுலங்களைத் தீர்த்தவன் அவர்கள் குறை கேட்டு அசுரர்களோடு போராடி அவர்கள் வாழ்வை மலரச் செய்தவன்.,14
கம்பராமாயணம்_(உரைநடை),பெருமைமிக்க இக் குலத்தில் பிறந்ததால் இவனைக் காகுத்தன் என்றும் அழைத்தனர்.,8
கம்பராமாயணம்_(உரைநடை),நீதியும் நேர்மையும் வீரமும் பேராற்றலும்மிக்க மன்னர் இராமனின் குல முதல்வர்களாய்த் திகழ்ந்தனர்.,9
கம்பராமாயணம்_(உரைநடை),"இராமன் பிறந்ததால் இக்குலமும், உயர்வு பெற்றது இக்குலத்தின் பெருமையால் இராமனும் உயர்வு பெற்றான்.",10
கம்பராமாயணம்_(உரைநடை),நாட்டு வளம் மழை வளம் கரந்தால் நாட்டின் வளம் மறைந்து விடும்.,9
கம்பராமாயணம்_(உரைநடை),கோசல நாட்டில் பருவ மழை தவறாது பெய்தது.,6
கம்பராமாயணம்_(உரைநடை),"மலைபடு பொருள்களாகிய மணியும், பொன்னும், முத்தும், சந்தனமும், அகிலும், தேக்கும் அவ்வெள்ளம் அடித்து வர அலைபடு பொருள்கள் ஆயின.",14
கம்பராமாயணம்_(உரைநடை),வணிக மக்களைப்போல அந்நதி இப் பொருள்களை வாரி அடித்துக் கொண்டு வந்தது.,9
கம்பராமாயணம்_(உரைநடை),நீள்நதி அந்த மலையின் உச்சியையும் அகலத்தை யும் தழுவி வந்ததால் அது கணிகை மகளை ஒத்திருந்தது.,12
கம்பராமாயணம்_(உரைநடை),அலைக் கரத்தில் மலைப் பொருள்களை ஏந்தி வந்து அடி வாரத்தில் குவித்தது.,9
கம்பராமாயணம்_(உரைநடை),"சரயூநதி, குறிஞ்சி, முல்லை, மருதம், நெய்தல், பாலை என்னும் ஐவகை நிலங்களில் பாய்ந்தது அந் நாட்டை வளப்படுத்தியது.",13
கம்பராமாயணம்_(உரைநடை),மூலப் பொருள் ஒன்று எனினும் ஞாலம் அதைப் பல்வேறு பெயர்களைக் கொண்டு அழைக்கிறது.,10
கம்பராமாயணம்_(உரைநடை),"கல்வியும் செல்வமும் ஏட்டையும் தொடுவது தீமை என்று கூறி, நாட்டைக் கெடுத்தவர்கள் அக்காலத்தில் இல்லை.",11
கம்பராமாயணம்_(உரைநடை),பெண் கல்வி நாட்டு முன்னேற்றத்திற்கு நலம் விளைவிக்கும் என்பதை நன்கு உணர்ந்திருந்தனர்.,9
கம்பராமாயணம்_(உரைநடை),பொருட் செல்வம் இயற்கை தருவது கல்வி மானுடர் தேடிப் பெறுவது.,8
கம்பராமாயணம்_(உரைநடை),செல்வக் குடியிற் பிறந்த செல்வியர் கல்வி கற்றுக் கவின் பெற்றுச் சிறப்பு அடைந்தனர்.,10
கம்பராமாயணம்_(உரைநடை),"கலைமகளும், திருமகளும் அவர்களை அடைந்து கொலுவீற்றிருந்தனர்.",5
கம்பராமாயணம்_(உரைநடை),கற்ற இப்பெண்களால் உற்ற நல் அறங்கள் சீரும் சிறப்பும் பெற்றுத் திகழ்ந்தன.,9
கம்பராமாயணம்_(உரைநடை),மாதரார்தம் செயலால் மாட்சி மிக்க அறங்கள் தழைத்து ஓங்கின.,7
கம்பராமாயணம்_(உரைநடை),அன்ன சத்திரங்கள் ஆயிரக்கணக்கில் செயல் பட்டன.,5
கம்பராமாயணம்_(உரைநடை),அங்கே சோறு வடித்த கஞ்சி ஆறு போலப் பெருகியது.,7
கம்பராமாயணம்_(உரைநடை),"அது கால்வாய்களாகக் கிளைத்துச் சோலைகளிலும், வயல் நிலங்களிலும் பாய்ந்து வளம் பெருக்கியது தேர் ஒடுவதால் தெருக்களில் துகள் கிளம்பியது.",14
கம்பராமாயணம்_(உரைநடை),யானையின் மதநீர்பட்டு அது தெருவினைச் சேறு ஆக்கியது அதில் யானைகள் வழுக்கி விழுந்தன.,10
கம்பராமாயணம்_(உரைநடை),மகளிர் குழை எறிந்து கோழி எறியும் செல்வ வாழ்க்கையைப் பெற்றிருந்தனர்.,8
கம்பராமாயணம்_(உரைநடை),சிறுமியர் சிற்றில் இழைத்துச் சிறுசோறு சமைத்தனர்.,5
கம்பராமாயணம்_(உரைநடை),முத்துகளை அவர்கள் சிறுசோறாக அமைத்தனர் அம் முத்துகளை இளம் விளையாட்டுச் சிறுவர்கள் தம் காலில் இடறிச் சிதைத்தனர்.,13
கம்பராமாயணம்_(உரைநடை),அவை அவர்கள் திரட்டி எடுத்துப் போடும் குப்பைகளாகக் குவிந்து கிடந்தன அவை ஒளி செய்தன.,11
கம்பராமாயணம்_(உரைநடை),குவளைகள் கண்விழித்து நோக்கின.,3
கம்பராமாயணம்_(உரைநடை),"இவ்வாறு மருத நிலம், நாட்டிய அரங்காகப் பொலிவு பெற்று அழகு செய்தது.",9
கம்பராமாயணம்_(உரைநடை),அன்னப் பறவைகள் தாமரை மலர்களை அடைந்து துயில் கொண்டன தம் அருகே தம் இளங்குஞ்சுகளை உறங்கச் செய்தன.,13
கம்பராமாயணம்_(உரைநடை),தேரைகள் எனப்படும் பசுமை நிறத் தவளைகள் தாலாட்டுப் பாடின.,7
கம்பராமாயணம்_(உரைநடை),அவை அதனைக் கேட்டு மயங்கித் துயின்றன.,5
கம்பராமாயணம்_(உரைநடை),சேற்று நிலத்தில் எருமைகள் பாலைச் சொரிந்ததால் நாற்று நடும் வயல்கள் வளம் காட்டின.,10
கம்பராமாயணம்_(உரைநடை),"அரங்குகளில் அரிவையர், ஆடலும் பாடலும் நிகழ்த்தினர்.",5
கம்பராமாயணம்_(உரைநடை),யாழும் குழலும் இணைந்து இசை அரங்குகளில் இனிமை கூட்டின.,7
கம்பராமாயணம்_(உரைநடை),"சதங்கை ஒலிகள், பதங்களுடன் சேர்ந்து, நாட்டிய நங்கையருக்கு நளினம் சேர்த்தன.",8
கம்பராமாயணம்_(உரைநடை),இசையும் நாட்டியமும் வசையில் கலைச் செல்வங்களாய்க் கவின் செய்தன.,7
கம்பராமாயணம்_(உரைநடை),காவியக் கதைகளில் தேர்ச்சி மிக்கவர் சொரியும் கவி அமுதம் செவிநுகர் கனிகள் ஆயின.,10
கம்பராமாயணம்_(உரைநடை),நகர் வளம் இந்நாட்டின் தலைநகர் அயோத்தி என்னும் மாநகர் ஆகும்.,8
கம்பராமாயணம்_(உரைநடை),"செல்வச் சிறப்பால் அளகை நகரையும், இன்பச் சிறப்பால் பொன்னகராம் அமராவதியையும் இது ஒத்து இருந்தது.",11
கம்பராமாயணம்_(உரைநடை),"எழில்மிக்க இந் நகரைப் பொழில் சூழ்ந்த மதில்களும், குழிகள்மிக்க அகழிகளும் சூழ்ந்திருந்தன.",9
கம்பராமாயணம்_(உரைநடை),மதில்கள் விண்ணைத் தொட்டன.,3
கம்பராமாயணம்_(உரைநடை),அகழிகள் மண்ணின் அடித்தலத்தை அழுத்தின.,4
கம்பராமாயணம்_(உரைநடை),காவல்மிக்க இக் கடிநகரை நால்வகைப் படைகள் காத்துப் போற்றின.,7
கம்பராமாயணம்_(உரைநடை),மக்கள் தம் உயிர் என மன்னனை மதித்தனர்.,6
கம்பராமாயணம்_(உரைநடை),அவனும் மக்களைக் கண்களை இமை காப்பது போல் காத்துவந்தான்.,7
கம்பராமாயணம்_(உரைநடை),"பகைவர் காட்டிய பகை, அவன் முன் எரிமுன் வைத்த பஞ்சு ஆகியது.",9
கம்பராமாயணம்_(உரைநடை),அவர்கள் அஞ்சிப் புறமுது கிட்டனர்.,4
கம்பராமாயணம்_(உரைநடை),"மக்கள் பசியும், பிணியும் நீங்க, வளனும் வாழ்வும் பெற்று, அவன் குடை நிழலில் குளிர்ந்தனர்.",11
கம்பராமாயணம்_(உரைநடை),உட்பூசலும் வெளித்தாக்கலும் இன்றி நாட்டில் அமைதி நிலவியது ஆக்கம் தழைத்தது ஊக்கம் நிலவியது செம்மைகள் நிலைத்தன.,12
கம்பராமாயணம்_(உரைநடை),மாதரார்தம் கற்பின் திறத்தால் நாட்டின் பொற்பு உயர்ந்தது.,6
கம்பராமாயணம்_(உரைநடை),அறத்தின் ஆக்கத்தால் துறக்கமும் தோற்றது.,4
கம்பராமாயணம்_(உரைநடை),ஆடவர் தம் மறச் செயலால் வீரம் செறிந்தது புகழ்மிக்க நாடு எனத் திகழ்ந்தது.,10
கம்பராமாயணம்_(உரைநடை),"பிறர் கை ஏந்தாமல் பீடும் பெருமையும் பெற்று, மக்கள் வாழ்க்கை நடத்தினர்.",9
கம்பராமாயணம்_(உரைநடை),"செல்வம், தனி உடைமை என்று கூற முடியாமல் அனைவர்க்கும் உரியதாய் இருந்தது.",9
கம்பராமாயணம்_(உரைநடை),கல்வியும் மக்கள் உடைமையாக இருந்தது.,4
கம்பராமாயணம்_(உரைநடை),"கற்றவர் கல்லாதவர் என்ற பேதம் இன்றி, அனைவரும் கல்வி கற்று அறிவிற் சிறந்தவராய்த் திகழ்ந்தனர்.",11
கம்பராமாயணம்_(உரைநடை),மக்கட்செல்வம் அவனிடம் வந்து அவனை மகிழச் செய்யவில்லை.,6
கம்பராமாயணம்_(உரைநடை),யாழும் குழலும் அவனுக்குத் திகட்டிவிட்டன.,4
கம்பராமாயணம்_(உரைநடை),அமுதமொழி பேசும் குழந்தைகளின் மழலைமொழி கேட்டு மகிழ விரும்பினான்.,7
கம்பராமாயணம்_(உரைநடை),கோடி இருந்தும் என்ன பயன்?,4
கம்பராமாயணம்_(உரைநடை),நாடித் தன்மடியில் தவழும் நன்மக்களை அவன் பெறவில்லையே.,6
கம்பராமாயணம்_(உரைநடை),"ஒருத்திக்கு மூவர், அவனுக்கு மனைவியர் எனினும் கருத்தரித்துக் காதல் நன்மகனைப் பெற்றுத் தரவில்லை என்ற குறை அவனை அரித்தது.",14
கம்பராமாயணம்_(உரைநடை),சூரிய குலம் அவனோடு அத்தமித்து விடுமோ? என்ற அச்சம் உண்டாகியது.,8
கம்பராமாயணம்_(உரைநடை),அவனுக்குப் பின் யார் அந்த நாட்டை ஆள்வது?,6
கம்பராமாயணம்_(உரைநடை),வாரிசு இல்லாமல் வறுமை உற்றுக் கிடந்தது அவன் வாழ்வு.,7
கம்பராமாயணம்_(உரைநடை),இன்பம் சேர்ப்பதற்கு ஏந்திழையர் பலர் இருந்தனர் துன்பம் துடைப்பதற்கு ஒரு மகவு இல்லையே என்ற ஏக்கம் அவனைத் தாக்கியது.,14
கம்பராமாயணம்_(உரைநடை),வயித்தியனைக் கேட்டான் வழிவகை அவனால் கூற இயலவில்லை.,6
கம்பராமாயணம்_(உரைநடை),வசிட்டர் அவன் குலகுரு அரசியல் ஆசான் வாழ்க்கை வழிகாட்டி சாத்திரம் அறிந்தவர்.,9
கம்பராமாயணம்_(உரைநடை),அவரை அடைந்து தன் குறையை வெளியிட்டான்.,5
