work_title,sentence,sentence_length
சதுரங்கம்_விளையாடுவது_எப்படி,சதுரங்கம் விளையாடுவது எப்படி — சதுரங்கம் விளையாடுவது எப்படி டாக்டர்.,8
சதுரங்கம்_விளையாடுவது_எப்படி,﻿சதுரங்கம் விளையாடுவது எப்படி?,3
சதுரங்கம்_விளையாடுவது_எப்படி,பல்கலைப் பேரறிஞர் டாக்டர் எஸ்.,4
சதுரங்கம்_விளையாடுவது_எப்படி,"பப்ளிகேஷன் எட்டு, போலீஸ் குவார்ட்டர்ஸ் ரோடு, தி.",6
சதுரங்கம்_விளையாடுவது_எப்படி,"ஆகவே, ஒவ்வொரு காயும் எவ்வாறு நகர்த்தப்பட வேண்டும் என்கிற வழிமுறைகள் படம் மூலமாக நன்கு விளக்கப்பட்டிருக்கின்றன.",12
சதுரங்கம்_விளையாடுவது_எப்படி,"அதன்பின், அடிப்படை விதிமுறைகள் என்னும் பகுதியில், முக்கியமான விளையாட்டுக் குறிப்புகள் இடம் பெற்றிருக்கின்றன.",10
சதுரங்கம்_விளையாடுவது_எப்படி,முயற்சியின் தொடக்கம்தான் இந்நூல் என்பதைத் தவிர வேறெதுவுமே என்னால் கூற இயலவில்லை.,9
சதுரங்கம்_விளையாடுவது_எப்படி,ஆர்வம் உள்ளவர் பயன்படுத்திக்கொள்வார்கள் என்று நம்புகிறேன்.,5
சதுரங்கம்_விளையாடுவது_எப்படி,"எனது நூல்களையெல்லாம் ஆதரித்து வந்த அன்பர்கள் அனைவரும், இந்நூலையும் ஏற்று மகிழ்வார்கள் என்று நம்புகிறேன்.",11
சதுரங்கம்_விளையாடுவது_எப்படி,"பி.எஸ், சி, அவர்களுக்கும் என் இதய நன்றி ஞான மலர் இல்லம் தி.நகர், சென்னை எஸ்.",14
சதுரங்கம்_விளையாடுவது_எப்படி,நவராஜ் செல்லையா அவர்களின் பேரவா.,4
சதுரங்கம்_விளையாடுவது_எப்படி,இத்தகைய முயற்சிக்குப் பெரிதும் துணைபுரிந்த டாக்டர் எஸ்.,6
சதுரங்கம்_விளையாடுவது_எப்படி,"டாக்டர் நவராஜ் செல்லையா அவர்கள் சிறந்த கவிஞர், நல்ல நாடக ஆசிரியர் இயக்குநர்.",10
சதுரங்கம்_விளையாடுவது_எப்படி,உடற்கல்விக்கான டிப்ளமோ தேர்வில்,3
சதுரங்கம்_விளையாடுவது_எப்படி,"தனிச் சிறப்புக்குரிய மதிப்பெண்கள் பெற்று முதல் நிலையில் தேறி, மாநிலத்திலேயே முதலாவதாகவும் வெற்றி பெற்றவர்.",11
சதுரங்கம்_விளையாடுவது_எப்படி,சாந்தி சாக்ரட்டீஸ் பதிப்பாளர் உள்ளே.,4
சதுரங்கம்_விளையாடுவது_எப்படி,சதுரங்க ஆட்டத்தின் வரலாறு பதினொன்று  இரண்டு.,5
சதுரங்கம்_விளையாடுவது_எப்படி,"சதுரங்க ஆட்டத்தின் வரலாறு சதுரங்கத்தின் பெருமை நாகரிகம் நிறைந்த நாடுகள் அனைத்திலும், நயமுறவிரும்பி ஆடப்பெறுகிற ஆட்டம் சதுரங்கமாகும்.",13
சதுரங்கம்_விளையாடுவது_எப்படி,"ஆர்வமுடன் ஆடுகின்ற மக்கள், ஆங்காங்கே எண்ணிக்கையில் குறைந்தவர்களாக இருப்பினும் இது அகில உலகப் புகழ் பெற்ற ஆட்டமாகும்.",13
சதுரங்கம்_விளையாடுவது_எப்படி,"இது வாழ்வுக்குத் தேவையான அடிப்படை ஆதார குணங்களை, அருமையுடனும் திறமையுடனும் வளர்த்துவிடும் அரியதொரு அறிவாட்டம் என்பதே அறிஞர்களின் கருத்தாகும்.",14
சதுரங்கம்_விளையாடுவது_எப்படி,"சதுரங்க ஆட்டம் மனதை மகிழ்விக்கிறது மயக்குகிறது, மலர்ச்சியுறச் செய்கிறது.",7
சதுரங்கம்_விளையாடுவது_எப்படி,மலர்ந்த மனதைப் பண்படுத்துகிறது.,3
சதுரங்கம்_விளையாடுவது_எப்படி,"விளையாடுவோர் நினைவுகளில் அமைதியைத் தளிராடச் செய்வதுடன், கனிவான கற்பனையைக் கட்டவிழ்த்துவிட்டுக் களிப்பூட்டுகிறது.",9
சதுரங்கம்_விளையாடுவது_எப்படி,சதுரங்க ஆட்டம் உலகப் பொது மக்களுக்குப் பொதுவானதாகும்.,6
சதுரங்கம்_விளையாடுவது_எப்படி,எல்லா நாடுகளுக்கும் உரிமையானதாகும்.,3
சதுரங்கம்_விளையாடுவது_எப்படி,சதுரங்க ஆட்டத்திற்கென்றே தனியான மொழித் தன்மை உண்டு.,6
சதுரங்கம்_விளையாடுவது_எப்படி,"இலக்கியம் உண்டு இசைப்பாட்டு, இன்கவிதை, இதமான உரை நடை உண்டு.",8
சதுரங்கம்_விளையாடுவது_எப்படி,ஆன்ற கலையின் அரிய மென் நடையும் உண்டு.,6
சதுரங்கம்_விளையாடுவது_எப்படி,இத்தகைய இதமான சதுரங்க ஆட்டத்தின் பிறப்புக்கென்று பல கதைகளைப் பாருக்குத் தொகுத்துத் தந்திருக்கின்றார்கள் ஆராய்ச்சி வல்லுநர்கள்.,12
சதுரங்கம்_விளையாடுவது_எப்படி,அத்தகைய வரலாற்றின் வடிவங்களைக் கவிதையிலே காணலாம்.,5
சதுரங்கம்_விளையாடுவது_எப்படி,உரை நடையில் படித்து மகிழலாம்.,4
சதுரங்கம்_விளையாடுவது_எப்படி,ஒவியங்களிலே பார்த்து பேரின்பம் பெறலாம்.,4
சதுரங்கம்_விளையாடுவது_எப்படி,அமைதி தரும் ஆட்டம் அறிவாளிகளின் ஆட்டம் சதுரங்க ஆட்டம் என்றே அன்றும் இன்றும் அழைக்கின்றார்கள் மக்கள்.,12
சதுரங்கம்_விளையாடுவது_எப்படி,"அறிவாளிகளின் ஆட்டம் என்று சதுரங்கத்திற்குப் புகழ் மாலை சூட்டிப் போற்றுகிறார்கள் என்றால், அதற்குக் காரணம் இல்லாமலா இருக்கும் !",13
சதுரங்கம்_விளையாடுவது_எப்படி,ரேடி என்ற ஆராய்ச்சியாளர் கூறுகின்றார்.,4
சதுரங்கம்_விளையாடுவது_எப்படி,"சிதுரங்க ஆட்டமானது, மூளையின் அளப்பரிய அறயின் அரிய சக்தியை தெளிவாக விளக்கிக் காட்டுகிறது.",10
சதுரங்கம்_விளையாடுவது_எப்படி,"அமைதி கொள்ளுமாறு வழி நடத்துகிறது என்று ஆடியவர்களின் அனுபவங்கள், நமக்குத் தெள்ளத் தெளியக் காட்டுகின்ற உண்மையாகும்.",12
சதுரங்கம்_விளையாடுவது_எப்படி,சதுரங்க ஆட்டம் தோன்றிய காலம் எப்பொழுது என்று தெரியவில்லை.,7
சதுரங்கம்_விளையாடுவது_எப்படி,என்றாலும் தொடர்ந்து ஆடிய காலம் தெரிகிறது.,5
சதுரங்கம்_விளையாடுவது_எப்படி,சதுரங்கம் என்று இந்தியாவில் அழைக்கப் பெறும் இந்த ஆட்டம் உலக நாடுகளில் வெவ்வேறு பெயர்களில் விரவி வந்திருக்கிறது.,13
சதுரங்கம்_விளையாடுவது_எப்படி,ஆங்கிலேயர் செக் என்றனர்.,3
சதுரங்கம்_விளையாடுவது_எப்படி,பிரெஞ்ச் நாட்டினர் எஸ்க் என்றனர்.,4
சதுரங்கம்_விளையாடுவது_எப்படி,பாரசீகத்தினர் சத்ரஞ்ச் என்றனர்.,3
சதுரங்கம்_விளையாடுவது_எப்படி,ரோமானியர்கள் லூடஸ் லேட்ரம் குளோரம் என்றனர்.,5
சதுரங்கம்_விளையாடுவது_எப்படி,சீனர்கள் சோங் கி என்றனர்.,4
சதுரங்கம்_விளையாடுவது_எப்படி,அயர்லாந்து மக்கள் பிப்த் சீயல் என்றும் வேல்ஸ் நாட்டினர் தாவ்ல் பர்டுடு என்றும்.,10
சதுரங்கம்_விளையாடுவது_எப்படி,அவன் விலங்கிலும் கொடியவன்.,3
சதுரங்கம்_விளையாடுவது_எப்படி,அரக்க மனம் கொண்டவன்.,3
சதுரங்கம்_விளையாடுவது_எப்படி,என்ன காரணமோ தெரியவில்லை.,3
சதுரங்கம்_விளையாடுவது_எப்படி,பெற்ற தந்தை மீதே அவன் பெருஞ்சினம் கொண்டான்.,6
சதுரங்கம்_விளையாடுவது_எப்படி,"கொண்ட கோபத்தைத் தணித்துக் கொள்ள வேறு வழி காண முடியாத அவன், தன் தந்தையைக் கொன்றேவிட்டான்.",12
சதுரங்கம்_விளையாடுவது_எப்படி,"கொன்றுவிட்டதும் அல்லாமல், தந்தையின் உடலை முன்னுாறு துண்டுகளாகக் கூறு போட்டான்.",8
சதுரங்கம்_விளையாடுவது_எப்படி,பறந்து வந்த முன்னுாறு பருந்துகளுக்கு விருந்தாக்கியும் மகிழ்ந்தான்.,6
சதுரங்கம்_விளையாடுவது_எப்படி,"இந்த இரக்கமிலா கொடிய நிகழ்ச்சியைக் கேள்வியுற்ற அரசவையினர் ஒன்றுகூடி, இதயமில்லா இளவரசனின் பைத்தியக்காரத்தனம் நிறைந்த வெறித்தனத்தைப் போக்க விழைந்தனர்.",14
சதுரங்கம்_விளையாடுவது_எப்படி,இரவு பகலாக முயன்றனர்.,3
சதுரங்கம்_விளையாடுவது_எப்படி,"இறுதியில் சதுரங்கம் ஆட்டம் போன்ற ஒரு ஆட்டத்தைக் கண்டுபிடித்து, அவனை அமைதிபெறச் செய்தனர்.",10
சதுரங்கம்_விளையாடுவது_எப்படி,நேர் வழியைக் காட்டினர் என்று கிரேக்க புராணம் கூறும்.,7
சதுரங்கம்_விளையாடுவது_எப்படி,"அவனைத் திருத்தி நல்வழிப் படுத்தவே, ஜஸ்டஸ் என்ற தத்துவஞானி.",7
சதுரங்கம்_விளையாடுவது_எப்படி,இதுபோன்ற ஒரு ஆட்டத்தினைக் கண்டுபிடித்தார் என்பது ஒரு சான்று.,7
சதுரங்கம்_விளையாடுவது_எப்படி,இந்தியாவிலே ஒரு அரசர் ஆண்டு வந்தார்.,5
சதுரங்கம்_விளையாடுவது_எப்படி,அவர் அமைதியில் நாட்டமுள்ளவர்.,3
சதுரங்கம்_விளையாடுவது_எப்படி,தன்னைப் போன்ற மன்னர்கள் போரிட்டு இரத்தம் சிந்தி நாடு பிடிக்கும் கொடிய வழியினை அறவே வெறுத்தவர்.,12
சதுரங்கம்_விளையாடுவது_எப்படி,வெறிமாற்ற வந்த கதைகள் போர்முறை குறித்தே இவ்வாட்டம் தொடங்கப்பெற்றது என்பதற்கு ஆதாரமாகப் பல கதைகள் உள்ளன.,12
சதுரங்கம்_விளையாடுவது_எப்படி,இந்தியாவை சிக்ராம் என்றொரு மன்னன் ஆண்டு வந்தான்.,6
சதுரங்கம்_விளையாடுவது_எப்படி,அவனுக்குப் போரிலே நிறைய விருப்பமும் அதிக ஈடுபாடும் உண்டு.,7
சதுரங்கம்_விளையாடுவது_எப்படி,"மன்னரின் மன நிலையைப் புரிந்து கொண்டு, மாற்று வழி ஒன்றைக் காண விரும்பினார் அவரது மந்திரி சேஷா என்பவர்.",14
சதுரங்கம்_விளையாடுவது_எப்படி,அவரது அருங் கண்டுபிடிப்புத்தான் இப்படி சதுரங்கமாகப் பிறந்தது என்பாரும் உண்டு.,8
சதுரங்கம்_விளையாடுவது_எப்படி,இதனை முகமதிய வரலாற்று ஆசிரியர்கள் எழுதியிருக்கிறார்கள் என்றும் சரித்திரக் குறிப்புகள் கூறுகின்றன.,9
சதுரங்கம்_விளையாடுவது_எப்படி,"இந்தக் கருத்தின் அடிப்படையிலே, இன்னொரு கதையும் உலவுகிறது.",6
சதுரங்கம்_விளையாடுவது_எப்படி,இந்திய மன்னர் ஒருவர் போரிடும் ஆர்வம் பெரிதும் நிறைந்தவர்.,7
சதுரங்கம்_விளையாடுவது_எப்படி,வாழ்நாள் முழுவதையும் வீரம் நிறைந்த போர்க்களத்திலேயே கழித்துவிட்டார்.,6
சதுரங்கம்_விளையாடுவது_எப்படி,"பகைவர் அனைவரையும் போரிலே புறங்கண்டு, வெற்றி வாகை சூடினார்.",7
சதுரங்கம்_விளையாடுவது_எப்படி,எனினும் அவரது போர் வேட்கை தணியவில்லை.,5
சதுரங்கம்_விளையாடுவது_எப்படி,"வேறு யாரும் வெற்றி கொள்வதற்கு இல்லையே என்ற வெறியில் துடித்த அவர் மனம், ஏக்கத்திலும் எரிச்சலிலும் மூழ்கியது.",13
சதுரங்கம்_விளையாடுவது_எப்படி,கரை காணாத வெறி கவலையுள் ஆழ்த்தியது.,5
சதுரங்கம்_விளையாடுவது_எப்படி,அதுவே மன நோயாக மாறி மன்னரைப் படுத்த படுக்கையாக்கிவிட்டது.,7
சதுரங்கம்_விளையாடுவது_எப்படி,எதிரியின் சேனைகளை எவ்வாறு வெற்றி கொள்வது என்ற முறையிலேயே சதுரங்கத்தைக் கண்டுபிடித்து மன்னரிடம் தந்தாராம்.,11
சதுரங்கம்_விளையாடுவது_எப்படி,பொழுது போக்குவதற்காகப் பிறந்த கதைகள்.,4
சதுரங்கம்_விளையாடுவது_எப்படி,"ஹன்சிங் என்ற சீன மன்னன் ஒருவன், சென் சி என்ற நாட்டின் மீது படையெடுத்துச் சென்றபொழுது, குளிர்காலம் தொடங்கிவிட்டது.",14
சதுரங்கம்_விளையாடுவது_எப்படி,அதனால் போர் நிகழாது தடைபட்டுவிட்டது.,4
சதுரங்கம்_விளையாடுவது_எப்படி,வீரர்கள் போரில்லாமல் கூடாரத்துக்குள்ளே உறங்கத் தொடங்கிவிட்டனர்.,5
சதுரங்கம்_விளையாடுவது_எப்படி,அறிஞர்களை அழைத்து அதற்கான வழிவகைகளைக் காணுமாறும் ஆணையிட்டான்.,6
சதுரங்கம்_விளையாடுவது_எப்படி,"அவனது ஆணையை மேற்கொண்ட அறிஞர்கள், சதுரங்கம் போன்றதொரு ஆட்டத்தைக் கண்டுபிடித்தனர்.",8
சதுரங்கம்_விளையாடுவது_எப்படி,அதற்கு சோக் சூ ஹாங்கி என்றும் பெயரிட்டனர்.,6
சதுரங்கம்_விளையாடுவது_எப்படி,"அதற்கு, போர்க்கள அறிவு நூல் என்பது பொருளாகும்.",6
சதுரங்கம்_விளையாடுவது_எப்படி,போர்க்களத்தில் சேனைகள் முன்னேறுவதைப் போலத்தான்.,4
சதுரங்கம்_விளையாடுவது_எப்படி,சதுரங்க ஆட்டத்திலும் காய்கள் நகர்த்தப்படுகின்றன என்று ஹன்சிங் கருதினான்.,7
சதுரங்கம்_விளையாடுவது_எப்படி,சதுரங்க ஆட்டத்திற்கு இவனே மூலகாரணம் என்று சீனர்கள் கருதிப் புகழத் தொடங்கினர் என்பதும் ஒரு கதை.,12
சதுரங்கம்_விளையாடுவது_எப்படி,"போர் வீரர்களின் பொழுதுபோக்குக்காகப் பிறந்ததே சதுரங்க ஆட்டம் என்னும் கருத்தை வலியுறுத்த, கிரேக்க புராணத்திலிருந்து ஒரு கதை.",13
சதுரங்கம்_விளையாடுவது_எப்படி,"கிரேக்க நாட்டு அரசன் ஒருவனது மனைவியாய் விளங்கிய கட்டழகி ஹெலன் என்பவளை, டிராய் நாட்டு இளவரசன் காதலித்தான்.",13
சதுரங்கம்_விளையாடுவது_எப்படி,"ஆளில்லாத நேரத்து, அவளைக் கவர்ந்து கொண்டு சென்றுவிட்டான்.",6
சதுரங்கம்_விளையாடுவது_எப்படி,"அவனை அழித்துக் கொன்று ஹெலனை மீட்க, கிரேக்கப் படைகள் டிராய் நாட்டுக்குச் சென்று பத்தாண்டுகளாக முற்றுகையிட்டுப் போர் புரிந்தன.",14
சதுரங்கம்_விளையாடுவது_எப்படி,"என்றாலும், டிராய் நகரத்து வீரர்கள் நிலைகுலையவோ, பின் வாங்கவோ இல்லை.",8
சதுரங்கம்_விளையாடுவது_எப்படி,"அதனையுணர்ந்த யுலிசெஸ் என்ற மன்னன் சதுரங்க ஆட்டத்தைக் கண்டுபிடித்து, வீரர்களை உற்சாகப்படுத்தினான் என்பது கதை.",11
சதுரங்கம்_விளையாடுவது_எப்படி,அதனை பலமடஸ் என்பவனே கண்டுபிடித்தான் என்றும் ஒரு கருத்து உண்டு.,8
