work_title,sentence,sentence_length
சிறந்த_கதைகள்_பதிமூன்று,"சாமான் அறையின் காற்றோடியை, பருந்து மீண்டும் அங்கே உள்ளே வர இயலாதபடி அடைப்பதற்கான யோசனைகளை போதி ராஜ் சொன்னான்.",14
சிறந்த_கதைகள்_பதிமூன்று,அன்று மாலை அவன் வேறு எதுவும் பேசவில்லை.,6
சிறந்த_கதைகள்_பதிமூன்று,﻿ மறுநாள் போதி ராஜ் வந்தபோது அவன் கவனோ கற்களோ வைத்திருக்கவில்லை.,9
சிறந்த_கதைகள்_பதிமூன்று,ஒரு பை நிறைய விதைகள் கொண்டு வந்தான்.,6
சிறந்த_கதைகள்_பதிமூன்று,நாங்கள் மைனா குஞ்சுகளுக்குத் தீனி கொடுத்தோம்.,5
சிறந்த_கதைகள்_பதிமூன்று,அவற்றின் சேட்டைகளை மணிக்கணக்கில் வேடிக்கை பார்த்தோம்.,5
சிறந்த_கதைகள்_பதிமூன்று,﻿ராகுலன் திரிவேணி ராகுலன் முதலில் எங்கள் வீட்டுக்கு வந்த போது சிறு குட்டியாகத் தான் இருந்தது.,12
சிறந்த_கதைகள்_பதிமூன்று,என் பாட்டி சுத்தம் பற்றி அலட்டிக் கொள்கிறவள் அழுக்குப் படிவது பற்றி தீவிரக் கருத்துகள் உடையவள்.,12
சிறந்த_கதைகள்_பதிமூன்று,நாய் வருகிறது எனத் தெரிந்ததுமே அவள் குழம்பித் தவித்தாள்.,7
சிறந்த_கதைகள்_பதிமூன்று,"பத்திரிகை படித்துக் கொண்டிருந்த என் அப்பாவிடம் போய், கவனி, குழந்தே என்றாள்.",9
சிறந்த_கதைகள்_பதிமூன்று,ராகுலனைப் பற்றி பாட்டி நீண்ட உபதேசம் புரிவாள் என அப்பா அறிவார்.,9
சிறந்த_கதைகள்_பதிமூன்று,எனவே அவர் பத்திரிகையை மடக்கி விட்டு அவள் சொற்பொழிவைக் கேட்கத் தயாரானார்.,9
சிறந்த_கதைகள்_பதிமூன்று,நான் ஒரு கொய்யாப்பழத்தைக் கடித்தபடி அவர்கள் அருகில் நின்றேன்.,7
சிறந்த_கதைகள்_பதிமூன்று,இந்த வீட்டில் என்ன நடக்கிறது என்று அவள் கேட்டாள்.,7
சிறந்த_கதைகள்_பதிமூன்று,பிராமணர்கள் எப்படித் தங்கள் வீட்டில் நாய் வளர்க்கலாம்?,6
சிறந்த_கதைகள்_பதிமூன்று,அது அசிங்கமான பிராணி.,3
சிறந்த_கதைகள்_பதிமூன்று,நாம் நமது சடங்குகளையும் சம்பிரதாயங்களையும் அனுஷ்டிப்பதற்கு ரொம்ப சுத்தமாக இருக்கவேண்டும்.,8
சிறந்த_கதைகள்_பதிமூன்று,நாய் வெகு புத்திசாலியான பிராணி.,4
சிறந்த_கதைகள்_பதிமூன்று,மண்ணாங்கட்டி மோசமான ஒரு நாய்க்குட்டியை நீ எப்படிப் பழக்குவாய்?,7
சிறந்த_கதைகள்_பதிமூன்று,அடுக்களையைப் புனிதப்படுத்த நாம் எவ்வளவு செலவும் சிரமமும் மேற்கொள்ள நேரிடும்?,8
சிறந்த_கதைகள்_பதிமூன்று,"அம்மா, நாம் ஜாக்கிரதையாக இருந்து, அது அடுப்பங்கரைக்குள் போகாதபடி பார்த்துக் கொள்ளலாம்.",9
சிறந்த_கதைகள்_பதிமூன்று,ஒரிரு தடவை அதுக்கு நல்ல அடி கொடு.,6
சிறந்த_கதைகள்_பதிமூன்று,"எங்கே போகலாம், எங்கே போகக்கூடாது என்பதை அது தெரிந்து கொள்ளும்.",8
சிறந்த_கதைகள்_பதிமூன்று,சாப்பிட்டானதும் எச்சில் இலைகளை விட்டெறியப் போகிற போது அது என் மேலே பாய்ந்தால் என்ன பண்ண?,12
சிறந்த_கதைகள்_பதிமூன்று,நான் புனிதம் அடைய கங்கை நதியில் குளிக்கப் போக வேண்டும்.,8
சிறந்த_கதைகள்_பதிமூன்று,அது சின்னக் குட்டியாக இருக்கிற போதே அதுக்குப் பயிற்சி அளித்தால் நிச்சயம் அது கற்றுக் கொள்ளும்.,12
சிறந்த_கதைகள்_பதிமூன்று,அது உன் வழிக்கு வராதபடி நான் கவனித்துக் கொள்கிறேன்.,7
சிறந்த_கதைகள்_பதிமூன்று,பாட்டி மிக அதிருப்தி கொண்டாள்.,4
சிறந்த_கதைகள்_பதிமூன்று,நீ முடிவு பண்ணி விட்டாய் என்று புரிகிறது என்றாள்.,7
சிறந்த_கதைகள்_பதிமூன்று,"அம்மா, நான் உன்னைப் பயமுறுத்த விரும்பவில்லை.",5
சிறந்த_கதைகள்_பதிமூன்று,ஆனால் எங்கும் திருட்டு அதிகரித்து வருகிறது.,5
சிறந்த_கதைகள்_பதிமூன்று,ஒரு நாய் இருப்பது பத்து காவல் காரனுக்குச் சமம்.,7
சிறந்த_கதைகள்_பதிமூன்று,"நாய், தின்னும் சோற்றுக்கு விசுவாசத்தோடு இருக்கும்.",5
சிறந்த_கதைகள்_பதிமூன்று,"உன் இஷ்டம் போல் செய், என்று கூறியபடி பாட்டி அகன்றாள்.",8
சிறந்த_கதைகள்_பதிமூன்று,"அப்பா என்னை நோக்கி, நீ என்ன சொல்கிறாய், லீலு?",7
சிறந்த_கதைகள்_பதிமூன்று,வீட்டில் ஒரு நாய் இருப்பது நல்லது தான்.,6
சிறந்த_கதைகள்_பதிமூன்று,நாய் வளர்க்க வேண்டும் என்று எனக்கு எப்பவும் ஆசை என்றேன்.,8
சிறந்த_கதைகள்_பதிமூன்று,ஒரு நாள் சென்னா நல்ல சாதி நாய் ஒன்று கொண்டு வந்தான்.,9
சிறந்த_கதைகள்_பதிமூன்று,அதை அவன் தன் மார்போடு அணைத்திருந்தான்.,5
சிறந்த_கதைகள்_பதிமூன்று,அவன் என்னைக் கூப்பிட்டான்.,3
சிறந்த_கதைகள்_பதிமூன்று,நான் கொண்டு வந்திருப்பதைப் பார் !,4
சிறந்த_கதைகள்_பதிமூன்று,இது அழகாக இல்லை?,3
சிறந்த_கதைகள்_பதிமூன்று,"பாவம், அது பயந்து எங்களிடமிருந்து விலகியது.",5
சிறந்த_கதைகள்_பதிமூன்று,அது ரொம்பவும் கறுப்பு.,3
சிறந்த_கதைகள்_பதிமூன்று,"இருட்டில் அதைக் கண்டு கொள்ள முடியாது, அப்படிக் கறுப்பு.",7
சிறந்த_கதைகள்_பதிமூன்று,அதன் உடலில் ஒரு வெள்ளை மயிர் கூடக் கிடையாது.,7
சிறந்த_கதைகள்_பதிமூன்று,கறுப்பாய் பட்டுப் போல் மினுமினுத்தது அது.,5
சிறந்த_கதைகள்_பதிமூன்று,அதன் சிறு உடலுக்கு மிகப் பெரிய காதுகள்.,6
சிறந்த_கதைகள்_பதிமூன்று,ஒளி நிறைந்த பச்சைநிறக் கண்களுக்கு இரு புறமும் அவை தொங்கின.,8
சிறந்த_கதைகள்_பதிமூன்று,அதனிடம் எனக்குப் பிரியம் ஏற்பட்டது.,4
சிறந்த_கதைகள்_பதிமூன்று,"சென்னா, இது ரொம்ப அழகு இதன் முகம் மின்மினி மாதிரிப் பளபளக்கிறது பார்.",10
சிறந்த_கதைகள்_பதிமூன்று,நான் இதை வைத்துக் கொள்கிறேன்.,4
சிறந்த_கதைகள்_பதிமூன்று,"என்று, நான் என் கைகளை நீட்டினேன்.",5
சிறந்த_கதைகள்_பதிமூன்று,"இது டீ இல்லை, டா.",4
சிறந்த_கதைகள்_பதிமூன்று,இவனுக்கு என்ன வயது?,3
சிறந்த_கதைகள்_பதிமூன்று,இருபதே நாட்கள் தான்.,3
சிறந்த_கதைகள்_பதிமூன்று,தாயிடமிருந்து எடுத்து வந்த போது இது ஊளையிட்டது.,6
சிறந்த_கதைகள்_பதிமூன்று,இன்னும் ஒரு மாதத்துக்கு நீ இதுக்கு பால் மட்டுமே ஊட்ட வேண்டும்.,9
சிறந்த_கதைகள்_பதிமூன்று,இதன் உடல் எப்படி இருக்கிறது?,4
சிறந்த_கதைகள்_பதிமூன்று,அமாவாசை இரவின் இருட்டுத் தான் என்று நான் குட்டியை என் கைகளில் எடுத்தேன்.,10
சிறந்த_கதைகள்_பதிமூன்று,என் அம்மாவை அழைத்தேன்.,3
சிறந்த_கதைகள்_பதிமூன்று,﻿ ஏன் இந்தக் கூப்பாடு?,4
சிறந்த_கதைகள்_பதிமூன்று,என்று கேட்டவாறு அம்மா அடுப்பங்கரையிலிருந்து வந்தாள்.,5
சிறந்த_கதைகள்_பதிமூன்று,என் கையில் நாய்க் குட்டியைக் கண்டதுமே பாட்டி பின்னுக்கு நகர்ந்தாள்.,8
சிறந்த_கதைகள்_பதிமூன்று,இந்தப் பெண்ணைப் பாரேன்.,3
சிறந்த_கதைகள்_பதிமூன்று,பாவப்பட்ட இந்தக் கண்களால் இன்னும் என்னென்ன பார்க்க வேண்டுமோ !,7
சிறந்த_கதைகள்_பதிமூன்று,"எனப் புலம்பி, பாட்டி திரும்பிச் சென்றாள்.",5
சிறந்த_கதைகள்_பதிமூன்று,அம்மாவுக்கு ஒரே வியப்பு.,3
சிறந்த_கதைகள்_பதிமூன்று,"குட்டியைப் பார்த்து, என்ன அழகு !",4
சிறந்த_கதைகள்_பதிமூன்று,இதுக்கு என்ன பெயர் வைக்கப் பொகிறாய்?,5
சிறந்த_கதைகள்_பதிமூன்று,அச்சந்தர்ப்பத்தில் நான் யசோதரா என்றொரு நாடகம் படித்துக் கொண்டிருந்தேன்.,7
சிறந்த_கதைகள்_பதிமூன்று,என் உள்ளத்தில் யசோதரையும் ராகுலனும் நிறைந்து நின்றார்கள்.,6
சிறந்த_கதைகள்_பதிமூன்று,எனவே என் மனசில் அலைமோதிய ராகுலன் என்ற பெயரை உச்சரித்தேன்.,8
சிறந்த_கதைகள்_பதிமூன்று,அம்மா ஒரு கணம் யோசித்தாள்.,4
சிறந்த_கதைகள்_பதிமூன்று,அது நல்ல பெயர் தான் என ஆமோதித்தாள்.,6
சிறந்த_கதைகள்_பதிமூன்று,அன்றிறவு ராகுலன் சரியாகத் தூங்கவில்லை.,4
சிறந்த_கதைகள்_பதிமூன்று,அவனுக்குப் பிரிவின் ஏக்கம்.,3
சிறந்த_கதைகள்_பதிமூன்று,தனது தாய் உடலின் கதகதப்பையும் அன்பையும் இழந்து விட்டானே.,7
சிறந்த_கதைகள்_பதிமூன்று,"நான் ஒரு மூலையில், அவனுக்காக இரு கோணிப்பைகளாலான படுக்கை தயாரித்திருந்தேன்.",8
சிறந்த_கதைகள்_பதிமூன்று,"ஆயினும், ராகுலன் இரவு முழுவதும் கத்திக் கொண்டே இருந்தான்.",7
சிறந்த_கதைகள்_பதிமூன்று,அவனைச் சீராட்ட நான் பலமுறை எழுந்தேன்.,5
சிறந்த_கதைகள்_பதிமூன்று,என் கைகளில் எடுத்து வைத்திருந்த வரை அவன் அமைதியாக இருப்பான்.,8
சிறந்த_கதைகள்_பதிமூன்று,"ஆனால் விளக்கை அணைக்க வேண்டியது தான் தாமதம், உடனே சிணுங்கத் தொடங்குவான்.",9
சிறந்த_கதைகள்_பதிமூன்று,அன்றிரவு வீட்டில் யாரும் தூங்கவே இல்லை.,5
சிறந்த_கதைகள்_பதிமூன்று,பாட்டிக்கு மகா கோபம்.,3
சிறந்த_கதைகள்_பதிமூன்று,என்னைத் தூங்க விட மாட்டேன் என்கிறதே !,5
சிறந்த_கதைகள்_பதிமூன்று,இந்த வீட்டில் நான் எப்படி வசிப்பது என் கடைசி நாட்களை இது இப்படிச் சீரழிக்கவா?,11
சிறந்த_கதைகள்_பதிமூன்று,பாட்டியின் முணுமுணுப்புகளை நான் கேட்டவாறிருந்தேன்.,4
சிறந்த_கதைகள்_பதிமூன்று,"பிறகு பாட்டி, இருக்கட்டும் இந்தக் குட்டிக்கு தாயின் நினைப்பு.",7
சிறந்த_கதைகள்_பதிமூன்று,உனக்குக் கல்யாணம் ஆனபோது பதினோரு வயது என்று நீ சொல்லவில்லையா?,8
சிறந்த_கதைகள்_பதிமூன்று,பாட்டியின் எரிச்சலில் பிரியமும் கலந்தது.,4
சிறந்த_கதைகள்_பதிமூன்று,நீ கெட்டிக்காரி தான்.,3
சிறந்த_கதைகள்_பதிமூன்று,"﻿என்றைக்கோ நான் சொன்னதை நினைவில் வைத்திருந்து, இப்ப எனக்கு எதிராகக் குறிப்பிடுகிறாயே?",9
சிறந்த_கதைகள்_பதிமூன்று,ராகுலன் அமைதி பெற ஒரு வாரம் பிடித்தது.,6
சிறந்த_கதைகள்_பதிமூன்று,மெதுமெதுவாக அது தன் ஊளையை நிறுத்தியது பயத்தை விட்டொழித்தது.,7
சிறந்த_கதைகள்_பதிமூன்று,கொஞ்சம் கந்தல் துணிகளைப் பரப்பி அதற்கு மென்மையும் கதகதப்பும் நிறைந்த படுக்கை அமைத்தேன்.,10
சிறந்த_கதைகள்_பதிமூன்று,அதன் சாப்பாட்டுக்குப் பெரிய கண்ணாடித் தட்டு ஒன்று வைத்தேன்.,7
சிறந்த_கதைகள்_பதிமூன்று,கட்டிப் போட தோல் கழுத்துப்பட்டை வாங்கினேன்.,5
சிறந்த_கதைகள்_பதிமூன்று,வாரம் ஒரு முறை சென்னா அதைக் குளிப்பாட்டினான்.,6
சிறந்த_கதைகள்_பதிமூன்று,ராகுலனும் நானும் நண்பர்களானோம்.,3
சிறந்த_கதைகள்_பதிமூன்று,நான் பள்ளி முடிந்து வந்த உடனேயே அதை வெளியே உலாவ அழைத்துச் சென்றேன்.,10
சிறந்த_கதைகள்_பதிமூன்று,அதற்கு உணவு ஊட்ட நான் வேறு எவரையும் அனுமதிக்கவில்லை.,7
சிறந்த_கதைகள்_பதிமூன்று,சாதமும் பாலும் நானே கொடுத்தேன்.,4
சிறந்த_கதைகள்_பதிமூன்று,அதை நான் குளிப்பாட்ட இயலவில்லை.,4
சிறந்த_கதைகள்_பதிமூன்று,ஏனெனில் தண்ணிரைக் கண்டதும் அது ஒட்டம் எடுக்கும்.,6
சிறந்த_கதைகள்_பதிமூன்று,ஒரு நாள் நான் அதைக் குளிப்பாட்ட முயன்றேன்.,6
சிறந்த_கதைகள்_பதிமூன்று,அது என்னைத் தள்ளிவிட்டு ஒடியது.,4
சிறந்த_கதைகள்_பதிமூன்று,நான் சேற்றுக்குட்டையில் விழுந்தேன்.,3
சிறந்த_கதைகள்_பதிமூன்று,அது குளத்தின் அருகில் நின்று வாலை ஆட்டியது.,6
சிறந்த_கதைகள்_பதிமூன்று,அது தான் நான் அதைக் குளிப்பாட்ட முயன்ற கடைசித் தடவையும் ஆகும்.,9
சிறந்த_கதைகள்_பதிமூன்று,"பாட்டியின் சுத்தம், அசிங்கம் பற்றிய நோக்குகளை ராகுலனுக்குப் புரியவைப்பது சிரமமாக இருந்தது.",9
சிறந்த_கதைகள்_பதிமூன்று,"ஒரு சமயம், ராகுலனைக் கட்டிப் போட்டிருப்பதாக நம்பி, பாட்டிவெளியே வந்தாள்.",8
சிறந்த_கதைகள்_பதிமூன்று,"அது, தன் வழக்கம்போல், அவளை வரவேற்கத் தாவியது.",6
சிறந்த_கதைகள்_பதிமூன்று,பாட்டி பயங்கரமாக அலறிக் கொண்டு வீட்டுக்குள் ஒடிப் போனாள்.,7
சிறந்த_கதைகள்_பதிமூன்று,நான் எல்லாக் கிரியைகளையும் முடித்த பிறகா இப்படி !,6
சிறந்த_கதைகள்_பதிமூன்று,என்னை அசிங்கப்படுத்திவிட்டதே பாழாய் போகிற இந்தப் பிராணி !,6
சிறந்த_கதைகள்_பதிமூன்று,நான் என்னை சுத்தப்படுத்திக் கொள்ள வேண்டும் என்று அவள் சொன்னாள்.,8
சிறந்த_கதைகள்_பதிமூன்று,சென்னா ராகுலனை செம்மையாக உதைத்தான்.,4
சிறந்த_கதைகள்_பதிமூன்று,"தீட்டைப் போக்கி தன்னை சுத்தப்படுத்திக் கொள்வதற்காகப் பாட்டி மந்திரங்களை உச்சரித்தாள், பட்டினி கிடந்தாள், பிச்சைக்காரர்களுக்கு அன்னதானம் செய்தாள்.",13
சிறந்த_கதைகள்_பதிமூன்று,அன்றிலிருந்து ராகுலன் பாட்டி அருகில் போவதில்லை.,5
சிறந்த_கதைகள்_பதிமூன்று,அவளைக் கண்டால் அது தொலைவிலிருந்து வாலை ஆட்டும்.,6
சிறந்த_கதைகள்_பதிமூன்று,பாட்டி அதைப் பாராட்டினாள்.,3
சிறந்த_கதைகள்_பதிமூன்று,இது புத்திசாலி நாய் தான்.,4
சிறந்த_கதைகள்_பதிமூன்று,"சென்னா அடி ﻿கொடுத்த நாள் முதல், இது என் பக்கத்தில் வர முயலுவதில்லை என்றாள்.",11
சிறந்த_கதைகள்_பதிமூன்று,இப்படியாக அது பாட்டியின் அன்பைப் பெற்றுவிட்டது.,5
