work_title,sentence,sentence_length
சிறந்த_கதைகள்_பதிமூன்று,"அவனை உதைக்க வேண்டியது தான், மற்றப் பையன்களோடு அவன் சண்டை போடுவது பற்றியும் அதிகம் கேள்விப் படுகிறேன்.",13
சிறந்த_கதைகள்_பதிமூன்று,அவனைக் கூப்பிடு உடனே.,3
சிறந்த_கதைகள்_பதிமூன்று,தலைமை ஆசிரியர் தன் பியூனை கூப்பிட்டார்.,5
சிறந்த_கதைகள்_பதிமூன்று,"அவர் குரலின் வெடிப்பைக் கேட்டே, தலைமை ஆசிரியர் வெகு கோபமாக இருக்கிறார் என மோகன் புரிந்து கொண்டான்.",13
சிறந்த_கதைகள்_பதிமூன்று,"உள்ளே விரைந்து, என்ன ஐயா?",4
சிறந்த_கதைகள்_பதிமூன்று,என்று பணிவுடன் கேட்டான்.,3
சிறந்த_கதைகள்_பதிமூன்று,சீக்கிரம் போய் ஐந்தாம் வகுப்பு தபனைக் கூட்டி வா என்று அவர் கட்டளையிட்டார்.,10
சிறந்த_கதைகள்_பதிமூன்று,தபன் பதுமணி கிராமத்தின் குமாஸ்தாவான ரத்தனின் இரண்டாவது மகன்.,7
சிறந்த_கதைகள்_பதிமூன்று,தோற்றத்தில் மெலிந்திருப்பினும் பலசாலி.,3
சிறந்த_கதைகள்_பதிமூன்று,சற்று கறுப்பு நிறம்.,3
சிறந்த_கதைகள்_பதிமூன்று,ஒளி நிறைந்த கண்கள் கொண்டவன்.,4
சிறந்த_கதைகள்_பதிமூன்று,"ஆனால், வீட்டிலும் வெளியிலும் சதா ஏதாவது விஷமத்தனங்கள் செய்து வம்பில் சிக்கிக் கொள்வான்.",10
சிறந்த_கதைகள்_பதிமூன்று,அவனாக வலியச் சண்டைக்குப் போகமாட்டான்.,4
சிறந்த_கதைகள்_பதிமூன்று,ஆனால் யாராவது அவனை வம்புக்கு இழுத்தால் பதிலடி கொடுக்க அவன் தயங்குவதில்லை.,9
சிறந்த_கதைகள்_பதிமூன்று,தன் வயதுப் பையன்களிடையே அவனே தலைவன்.,5
சிறந்த_கதைகள்_பதிமூன்று,அவர்களுக்காகப் பரிந்து அடிதடியில் இறங்க அவன் எப்பவும் தயாராக இருந்தான்.,8
சிறந்த_கதைகள்_பதிமூன்று,அவன் சகாக்கள் அவனை மதித்தார்கள்.,4
சிறந்த_கதைகள்_பதிமூன்று,"கிராமத்தின் ஆரம்பப்பள்ளியில் கற்று முடிந்ததும், தயன் பதினைந்து மைல்களுக்கு அப்பால் உள்ள உயர்நிலைப்பள்ளிக்குப் போனான்.",11
சிறந்த_கதைகள்_பதிமூன்று,தன் மாமாவுடன் ஒரு வருடம் தங்கியிருந்தான்.,5
சிறந்த_கதைகள்_பதிமூன்று,மீண்டும் ஊருக்கு வந்து அவன் ஞானபீடம் உயர்நிலைப் பள்ளியில் படிக்கிறான்.,8
சிறந்த_கதைகள்_பதிமூன்று,ஊரிலிருந்து ஒன்றரை மைல் தூரத்தில் இருக்கிறது அது.,6
சிறந்த_கதைகள்_பதிமூன்று,அவன் ஞானபீடத்தில் சேர்ந்து ஒரு மாதம் தான் ஆகிறது.,7
சிறந்த_கதைகள்_பதிமூன்று,அதற்குள் அவன் மீது ஒரு குற்றச்சாட்டு வந்துவிட்டது.,6
சிறந்த_கதைகள்_பதிமூன்று,பதுமணி கிராமத்தின் கடைக்காரன் ஹரன் தலைமை ஆசிரியரிடம் முறையிட்டான்.,7
சிறந்த_கதைகள்_பதிமூன்று,தபன் பியூனுடன் வந்து சேர்ந்தான்.,4
சிறந்த_கதைகள்_பதிமூன்று,தலைமை ஆசிரியரைப் பயத்துடன் பார்த்துத் தலைகுனிந்து நின்றான்.,6
சிறந்த_கதைகள்_பதிமூன்று,அவர் பிரம்பை ஆட்டிய வாறு நீ தானே தபன்?,7
சிறந்த_கதைகள்_பதிமூன்று,ஆமாம் ஸார் என்று தபன் பணிவுடன் சொன்னான்.,6
சிறந்த_கதைகள்_பதிமூன்று,"கடைக்காரனைக் காட்டி, இவரை உனக்குத் தெரியுமா?",5
சிறந்த_கதைகள்_பதிமூன்று,என்று தலைமை ஆசிரியர் கேட்டார்.,4
சிறந்த_கதைகள்_பதிமூன்று,எங்கள் ஊர்க் கடைக்காரன்.,3
சிறந்த_கதைகள்_பதிமூன்று,நேற்று மாலை நீயும் உன் நண்பர்களும் கூடி இவன் கடை மீது கல்லெறிந்தது உண்மைதானா?,11
சிறந்த_கதைகள்_பதிமூன்று,நானும் ரத்தனும் மற்றும் சிலரும் இவன் கடைமீது கல்விசியது உண்மை தான்.,9
சிறந்த_கதைகள்_பதிமூன்று,"ஏன் அப்படிச் செய்தாய், சொல்லு என்று தலைமை ஆசிரியர் முழங்கினார்.",8
சிறந்த_கதைகள்_பதிமூன்று,"ஐயா, இவன் ஏய்க்கிறான்.",3
சிறந்த_கதைகள்_பதிமூன்று,"அதிக விலை வாங்கிக் கொண்டு, சாமான்களைக் குறைவாய்த் தருகிறான்.",7
சிறந்த_கதைகள்_பதிமூன்று,"மேலும், இவன் புதுரகத் தாள் பை ஒன்றை உபயோகிக்கிறான்.",7
சிறந்த_கதைகள்_பதிமூன்று,அதன் அடியில் கனத்த தாள்கள் ஒட்டி யிருக்கின்றன.,6
சிறந்த_கதைகள்_பதிமூன்று,நேற்று முன்தினம் நாங்கள் இவனிடம் ஒரு கிலோ பருப்பு வாங்கினோம்.,8
சிறந்த_கதைகள்_பதிமூன்று,வீட்டில் அதை நிறுத்தபோது எண்ணுாறு கிராம் தானிருந்தது.,6
சிறந்த_கதைகள்_பதிமூன்று,பையிலிருந்த தாள் ஐம்பது கிராம் கனமிருந்தது.,5
சிறந்த_கதைகள்_பதிமூன்று,நூற்றைம்பது கிராமுக்கு நிறுவையில் கள்ளத்தனம் செய்திருக்கிறான்.,5
சிறந்த_கதைகள்_பதிமூன்று,இது ஊர் முழுதும் தெரிந்த விஷயம்.,5
சிறந்த_கதைகள்_பதிமூன்று,நேற்று இதை நான் இவனிடம் கேட்டேன்.,5
சிறந்த_கதைகள்_பதிமூன்று,இவன் ஏசி என்னை வெளியே துரத்தினான்.,5
சிறந்த_கதைகள்_பதிமூன்று,அதனால் தான் நானும் மற்றவர்களும் இவன் கடை மீது கல்விசினோம்.,8
சிறந்த_கதைகள்_பதிமூன்று,தலைமை ஆசிரியர் கடைக்காரனை நோக்கினார்.,4
சிறந்த_கதைகள்_பதிமூன்று,அவன் முகம் சிவந்திருந்தது.,3
சிறந்த_கதைகள்_பதிமூன்று,தலைமை ஆசிரியர் சிறிது நேரம் யோசித்தார்.,5
சிறந்த_கதைகள்_பதிமூன்று,"பிறகு தபன் பக்கம் திரும்பி, அப்படி இருந்தாலும், நீ செய்தது சரியல்ல.",9
சிறந்த_கதைகள்_பதிமூன்று,பிறர் பொருளைச் சேதப்படுத்துவது தவறு.,4
சிறந்த_கதைகள்_பதிமூன்று,"கடைக்காரன் ஏமாற்றினால், அதைக் கவனிக்க வேண்டியது அரசு அல்லது ஊர்பஞ்சாயத்தின் பொறுப்பு ஆகும்.",10
சிறந்த_கதைகள்_பதிமூன்று,அது உன் வேலை இல்லை.,4
சிறந்த_கதைகள்_பதிமூன்று,சில தினங்களுக்குப் பிறகு இன்னொரு சம்பவம் நடந்தது.,6
சிறந்த_கதைகள்_பதிமூன்று,அவ்வட்டாரத்தில் தொல்லை கொடுத்து வந்த ஒரு முரட்டுக் காளை சம்பந்தப் ﻿பட்டது அது.,10
சிறந்த_கதைகள்_பதிமூன்று,அது பலபேரை முட்டித் தள்ளியிருந்தது.,4
சிறந்த_கதைகள்_பதிமூன்று,யாராவது கம்புடன் அதை நெருங்கினால் அது அவர்களைத் தாக்கும்.,7
சிறந்த_கதைகள்_பதிமூன்று,அதைக் கண்டு அனைவரும் பயந்தனர்.,4
சிறந்த_கதைகள்_பதிமூன்று,அந்தக் காளையின் மூர்க்கத்தனம் தபனின் வீரத்தைத் துாண்டியது.,6
சிறந்த_கதைகள்_பதிமூன்று,இரு இரு தடிமாடே !,3
சிறந்த_கதைகள்_பதிமூன்று,நான் உன்னை அடக்குகிறேன் என்று அவன் முனகினான்.,6
சிறந்த_கதைகள்_பதிமூன்று,பள்ளி இடைவேளையின் போது அவன் ஒரு கம்பும் துண்டுக் கயிறும் எடுத்துக் கொண்டு மெதுவாகக் காளையை அனுகினான்.,13
சிறந்த_கதைகள்_பதிமூன்று,"காத்து நின்று, சரியான சமயம் பார்த்து, அதன் முதுகு மேல் தாவி ஏறினான்.",10
சிறந்த_கதைகள்_பதிமூன்று,"குதிரைக்குக் கடிவாளம் மாட்டுவது போல், கயிற்றைக் காளையின் வாயில் திணித்தான்.",8
சிறந்த_கதைகள்_பதிமூன்று,காளை திடுக்கிட்டுத் திகைத்தது.,3
சிறந்த_கதைகள்_பதிமூன்று,தன் முதுகு மேல் இருந்த கனத்தை உணர்ந்ததும் அது கால்களை உதைக்கவும் துள்ளிக் குதிக்கவும் தொடங்கியது.,12
சிறந்த_கதைகள்_பதிமூன்று,தொல்லை தருபவனை உதறித் தள்ளலாம் என எண்ணி வேகமாய் பாய்ந்து ஒடியது.,9
சிறந்த_கதைகள்_பதிமூன்று,இதற்குள் பள்ளி இடைவேளை முடிந்தது.,4
சிறந்த_கதைகள்_பதிமூன்று,வகுப்பு ஆரம்பித்து விட்டது.,3
சிறந்த_கதைகள்_பதிமூன்று,ஆனால் தபன் காளையை அடக்குவதிலேயே கருத்தாக இருந்தான்.,6
சிறந்த_கதைகள்_பதிமூன்று,துள்ளிக்குதிக்கும் முரட்டுக் காளையின் முதுகிலிருந்து கீழே விழாதபடி அவன் கயிற்றை இறுகப் பற்றிக் கொண்டு சமாளித்தான்.,12
சிறந்த_கதைகள்_பதிமூன்று,காளையின் முதுகில் தட்டினான்.,3
சிறந்த_கதைகள்_பதிமூன்று,இது காளைக்கு மேலும் வெறியூட்டியது.,4
சிறந்த_கதைகள்_பதிமூன்று,அது பள்ளி வளைவினுள் பாய்ந்தது.,4
சிறந்த_கதைகள்_பதிமூன்று,ஏழாம் வகுப்பு அறைக்குள் புகுந்தது.,4
சிறந்த_கதைகள்_பதிமூன்று,ஆசிரியரும் மாணவர்களும் பதறியடித்துச் சிதறினர்.,4
சிறந்த_கதைகள்_பதிமூன்று,முட்டி மோதிக் கொண்டு அறைக்கு வெளியே ஒடினார்கள்.,6
சிறந்த_கதைகள்_பதிமூன்று,பலர் தவறி விழுந்தனர்.,3
சிறந்த_கதைகள்_பதிமூன்று,ஆசிரியர் ரஜனி சகாரியா வெளியில் ஒடித் தப்பினார்.,6
சிறந்த_கதைகள்_பதிமூன்று,வெறித்தனமாய் தாவிக் குதித்த காளையின் கொம்புகள் பட்டு சன்னல் கண்ணாடிகள் உடைந்து போயின.,10
சிறந்த_கதைகள்_பதிமூன்று,"இறுதியில், மிரண்டுவிட்ட காளை அரண்டு கதறி பள்ளி மைதானத்திற்கு ஒடித் தள்ளாடி விழுந்தது.",10
சிறந்த_கதைகள்_பதிமூன்று,சில கணங்களில் துள்ளி எழுந்தது.,4
சிறந்த_கதைகள்_பதிமூன்று,திரும்பிப் பார்க்காமலே தப்பினோம் பிழைத்தோம் என்று பாய்ந்து ஒடியது.,7
சிறந்த_கதைகள்_பதிமூன்று,"ஆகவே, தபன் பேரில் மற்றொரு குற்றச்சாட்டு வந்தது.",6
சிறந்த_கதைகள்_பதிமூன்று,இம்முறை ஆசிரியர் ரஜனி சகாரியா முறையிட்டார்.,5
சிறந்த_கதைகள்_பதிமூன்று,தலைமை ஆசிரியர் கோபத்தால் வெகுண்டார்.,4
சிறந்த_கதைகள்_பதிமூன்று,"அந்தப் பையன் ஒயாத தொல்லையாக, தொந்தரவு தருபவனாக இருக்கிறானே.",7
சிறந்த_கதைகள்_பதிமூன்று,"மாணவர்கள் மட்டுமின்றி, பள்ளிக் கட்டிடமும் பாதிக்கப்பட்டிருக்கிறது.",5
சிறந்த_கதைகள்_பதிமூன்று,அவர் தபனை மீண்டும் வரவழைத்தார்.,4
சிறந்த_கதைகள்_பதிமூன்று,பணியாள் மோகனோடு தபன் வந்தான்.,4
சிறந்த_கதைகள்_பதிமூன்று,அவனைக் கண்டதும் தலைமை ஆசிரியரின் கோபம் பொங்கியது.,6
சிறந்த_கதைகள்_பதிமூன்று,நீ ஒரு துஷ்டன் ஏன் அந்தக் காளையை நீ வகுப்பறைக்குள் ஒட்டினாய்?,9
சிறந்த_கதைகள்_பதிமூன்று,என்று பிரம்பை ஆட்டிக்கொண்டே அவர் கேட்டார்.,5
சிறந்த_கதைகள்_பதிமூன்று,"தலைகுனிந்து நின்ற தபன் சொன்னான் ஐயா, நான் அந்தக் காளையை வகுப்புக்குள் ஒட்டவில்லை.",10
சிறந்த_கதைகள்_பதிமூன்று,அதை அடக்குவதற்காக நான் ﻿அதன் முதுகில் சவாரி செய்தேன்.,7
சிறந்த_கதைகள்_பதிமூன்று,அது சடாரென்று அறைக்குள் பாய்ந்து விட்டது.,5
சிறந்த_கதைகள்_பதிமூன்று,பள்ளி நேரத்தில் காளைச் சவாரி பண்ணும்படி உனக்கு யார் சொன்னது?,8
சிறந்த_கதைகள்_பதிமூன்று,தபன் தலைமை ஆசிரியரின் பிரம்பால் பதினைந்து அடிகள் பெற்றான்.,7
சிறந்த_கதைகள்_பதிமூன்று,அவன் சகமானவர்கள் மீண்டும் சிரித்துக் கேலி செய்தார்கள்.,6
சிறந்த_கதைகள்_பதிமூன்று,பள்ளிக்கூடத்தின் கெட்ட பையன் என்ற பட்டம் அவனுக்குக் கிடைத்தது.,7
சிறந்த_கதைகள்_பதிமூன்று,வெகு சீக்கிரமே பள்ளியில் ஒரு சுற்றறிக்கை விடப்பட்டது.,6
சிறந்த_கதைகள்_பதிமூன்று,மேலும் நஷ்டத்துக்கு ஈடுகட்ட ரூ.,4
சிறந்த_கதைகள்_பதிமூன்று,இருபத்தைந்து அபராதம் விதிக்கப் பட்டிருக்கிறான்.,4
சிறந்த_கதைகள்_பதிமூன்று,இனியும் இதுபோல் குற்றம் ஏதேனும் செய்தால் தபன் பள்ளியிலிருந்து நீக்கப்படுவான் என்று அது முடிந்திருந்தது.,11
சிறந்த_கதைகள்_பதிமூன்று,சில பையன்கள் எச்சில் துப்பும் சாக்கில் வகுப்புகளை விட்டு வெளியே வந்து தபனை நோக்கிப் பழிப்புக் காட்டினர்.,13
சிறந்த_கதைகள்_பதிமூன்று,"அதே தினம் மாலை, தலைமை ஆசிரியர் வீடு திரும்பி, தேநீர் பருகிவிட்டு, உலா கிளம்பினார்.",11
சிறந்த_கதைகள்_பதிமூன்று,இது அவரது தினசரிப் பழக்கம்.,4
சிறந்த_கதைகள்_பதிமூன்று,அவர் திரும்பிக்கொண்டிருந்த போது இருள் கவிந்தது.,5
சிறந்த_கதைகள்_பதிமூன்று,அவ்வேளையில் பள்ளியின் கெட்ட பையனை அவர் பார்த்தார்.,6
சிறந்த_கதைகள்_பதிமூன்று,ஒரு கிழப் பிச்சைக்காரியின் கையை அவன் பற்றியிருந்தான்.,6
சிறந்த_கதைகள்_பதிமூன்று,அவளது பிச்சைக் கூடையை தன் தலையில் சுமந்து வந்தான்.,7
சிறந்த_கதைகள்_பதிமூன்று,அவனது வகுப்பைச் சேர்ந்த இரண்டு பையன்கள் படிப்பில் முதன்மையான நரேனும் மகேஷசம் அவனைக் கேலி செய்தபடி அருகில் நடந்தார்கள்.,14
சிறந்த_கதைகள்_பதிமூன்று,கிழவிக்குக் கடுமையான ஜூரம்.,3
சிறந்த_கதைகள்_பதிமூன்று,அவளால் நடக்கவே முடியவில்லை.,3
சிறந்த_கதைகள்_பதிமூன்று,அந்நிலையில் கூடையைச் சுமப்பது எப்படி?,4
சிறந்த_கதைகள்_பதிமூன்று,நான் உன்னை உன் இடத்துக்குக் கூட்டிப் போவேன் என்றான்.,7
சிறந்த_கதைகள்_பதிமூன்று,நரேனும் மகேஷம் தலைமை ஆசிரியரைக் கண்டதும் வணக்கம் தெரிவித்தார்கள்.,7
சிறந்த_கதைகள்_பதிமூன்று,தபனைக் கேலியாகப் பார்த்து முறுவலித்தார்கள்.,4
சிறந்த_கதைகள்_பதிமூன்று,தபனின் கெட்ட செயல் ஒன்றை அவரே நேரடியாகப் பார்த்துவிட்டார் என்ற மகிழ்ச்சி அவர்களுக்கு ஆசிரியர் கிழவியை விசாரித்தார்.,13
சிறந்த_கதைகள்_பதிமூன்று,கடவுள் அவனைக் காப்பாற்றட்டும்.,3
சிறந்த_கதைகள்_பதிமூன்று,நான் சிரமப்படுவதை இந்த இரண்டு பையன்களும் பார்த்தார்கள்.,6
