work_title,sentence,sentence_length
சோழர்_கால_அரசியல்_தலைவர்கள்,"தென்னாற்காடு, வடஆற்காடு, செங்கற்பட்டு மாவட்டங்களில் பார்த்திவேந்திரபன்மன் கல்லெழுத்துக்கள் காணப்பெறுகின்றன.",7
சோழர்_கால_அரசியல்_தலைவர்கள்,இரண்டாம் பராந்தகனாகிய சுந்தர சோழனுக்கு ஆதித்த கரிகாலன் என்ற ஒரு மகன் இருந்தான்.,10
சோழர்_கால_அரசியல்_தலைவர்கள்,"இவ் ஆதித்த கரிகாலனுடைய கல்வெட்டுக்களையும், பார்த்திவேந்திரபன்மனுடைய கல்வெட்டுக்களையும் ஆராய்ந்து திரு.",8
சோழர்_கால_அரசியல்_தலைவர்கள்,அதனேயே தாமும் ஏற்றுக்கொண்டு திரு.,4
சோழர்_கால_அரசியல்_தலைவர்கள்,இரண்டாம் பராந்தகனாகிய சுந்தரசோழனுடன் போரிட்ட வீரபாண்டியனே இவர்களால் வெல்லப்பட்ட வீரபாண்டியனாதல் ஏற்புடைத்து.,9
சோழர்_கால_அரசியல்_தலைவர்கள்,இருவரும் பரகேசரி எனப்பெறுகின்றனர்.,3
சோழர்_கால_அரசியல்_தலைவர்கள்,ஆதித்த கரிகாலன் கல்லெழுத்துக்கள் மிகச் சிலவே.,5
சோழர்_கால_அரசியல்_தலைவர்கள்,"அவை தாமும் தஞ்சை, திருச்சி, தென்னாற்காடு மாவட்டங்களில் உள்ளன ஐந்து ஆவது ஆண்டுக்கு மேலும் காணப்பெறவில்லை.",12
சோழர்_கால_அரசியல்_தலைவர்கள்,பார்த்திவேந்திரபன்மனுடைய கல்லெழுத்துக்கள் பல தொண்டை மண்டலத்திலுள்ளன அவை அவனது பதிமூன்று  ஆம் ஆட்சியாண்டு வரை கொடுக்கப்பெற்றனவாம்.,12
சோழர்_கால_அரசியல்_தலைவர்கள்,பார்த்திவேந்திரன் இவ்வரச குடும்பத்தைச் சேர்ந்த இளவரசனாதல் கூடும்.,6
சோழர்_கால_அரசியல்_தலைவர்கள்,ஆராய்ந்து பார்த்தால் இவ்விருவருடைய கல்லெழுத்துள்ள இடங்கள் தாம் வேறுபடுகின்றன.,7
சோழர்_கால_அரசியல்_தலைவர்கள்,இவ்வளவு சிறப்புக்களோடு இருந்த இவன் அரச குடும்பத்தைச் சேர்ந்தவனுக இருத்தல் கூடும் என்பது உறுதி.,11
சோழர்_கால_அரசியல்_தலைவர்கள்,"பார்த்திவேந்திர ஆதித்தவர்மன் என்பதும், அதன் பிற வடிவங்களும், பார்த்திவேந்திரன் என்ற சிறப்புப் பெயரை ஆதித்தன் கொண்டனன் என்பதைக் காட்டுவனவாகும்.",14
சோழர்_கால_அரசியல்_தலைவர்கள்,"ஆகவே பார்த்திவேந்திரபன்மனும், ஆதித்த கரிகாலனும் ஒருவரேயாதல் கூடும்.",6
சோழர்_கால_அரசியல்_தலைவர்கள்,இவன் காலம் தொள்ளாயிரத்து ஐம்பத்தாறு தொள்ளாயிரத்து அறுபத்தொன்பது.,6
சோழர்_கால_அரசியல்_தலைவர்கள்,ஒன்பது இனி இவ்விருவரும் ஒருவரேயல்லர் என்பாரும் உண்டு.,6
சோழர்_கால_அரசியல்_தலைவர்கள்,"சதாசிவ பண்டாரத்தார் அவர்கள் பத்து கூறியுள்ளமையின், ஆதித்த கரிகாலனும் பார்த்திவேந்திரனும் ஒருவரேயல்லர் என்ற கருத்துடையவர் இவர் என அறியலாம்.",14
சோழர்_கால_அரசியல்_தலைவர்கள்,"தென்னாற்காடு ஜில்லா தாயனூரில் வீரபாண்டியன் தலைகொண்ட கோப்பரகேசரிபன்மருடைய கல்வெட்டுக்களும், பார்த்தி வேந்திரனுடைய கல்வெட்டுக்களும் உள்ளன.",11
சோழர்_கால_அரசியல்_தலைவர்கள்,"எங்ஙனமாயினும் பார்த்திவேந்திர பன்மன், முதற்பராந்தகன் காலத்தில் தொண்டை நாட்டில் இருந்து ஆட்சி செய்தவன் என்பது மறுக்கப்படாததொன்று.",12
சோழர்_கால_அரசியல்_தலைவர்கள்,திருப்பாற்கடல் கல்லெழுத்து திருப்பாற்கடல் என்பது வட ஆற்காடு மாவட்டம் காவிரிப் பாக்கத்துக்கு அண்மையில் உள்ள ஓரூர்.,12
சோழர்_கால_அரசியல்_தலைவர்கள்,இவ்வூரில் கரபுரேசுவரர் கோயில் இறையக வடபுறச் சுவரில் இக்கல்லெழுத்துக் காணப்பெறுகிறது.,8
சோழர்_கால_அரசியல்_தலைவர்கள்,பதினெட்டு  இது பார்த்தி வேந்திராதிபன்மனது மூன்றாவது ஆட்சியாண்டுக் கல் வெட்டாகும்.,8
சோழர்_கால_அரசியல்_தலைவர்கள்,"வாரியங்கள் ஊர்ச்சபையின் உட்கழகங்கள் வாரியம் என்ற பெயராலும், வாரியத்தில் இருந்து யணியாற்றுபவர் வாரியப்பெருமக்கள் எனவும் கூறப்பெற்றனர்.",12
சோழர்_கால_அரசியல்_தலைவர்கள்,காவிரிப் பாக்கத்தில் எட்டு வாரியங்கள் இருந்தன வென்பது மேலே கூறப்பெற்றது.,8
சோழர்_கால_அரசியல்_தலைவர்கள்,முப்பத்தொன்று சம்வத்ஸ்ரவாரியம் இவ்வாரியப் பெருமக்கள் தமக்குரிய அலுவல்களை ஓராண்டுக் காலம் இருந்து ஆற்றும் தகுதியுடையர் ஆவர்.,12
சோழர்_கால_அரசியல்_தலைவர்கள்,"அறநிலையங்களைக் கண்காணிப்பதும், நியாயம் வழங்குவதும் இவர் கடமையாகும்.",6
சோழர்_கால_அரசியல்_தலைவர்கள்,இவ்வாரியம் எல்லா வாரியங்களையும்விடச் செல்வாக்குள்ளது சிறப்பு வாய்ந்தது.,6
சோழர்_கால_அரசியல்_தலைவர்கள்,மற்ற வாரியப் பெருமக்கள் தேர்ந்தெடுக்கப் பெறுவதற்கு முன்னதாக இவ்வாரியப் பெருமக்கள் தேர்ந்தெடுக்கப்படுவர்.,9
சோழர்_கால_அரசியல்_தலைவர்கள்,"தோட்ட வாரியத்திலோ ஏரி வாரியத்திலோ இருந்து பணியாற்றினவர்களும், கல்வியறிவில் சிறப்புடையவர்களும், வயதில் முதிர்ந்தவர்களுமே இவ்வாரியத்துக்குத் தகுதி யுடையராவர்.",13
சோழர்_கால_அரசியல்_தலைவர்கள்,இதில் பன்னிரண்டு உறுப்பினர் இருப்பர்.,4
சோழர்_கால_அரசியல்_தலைவர்கள்,"முப்பத்திரண்டு தோட்டவாரியம் நிலங்களைப்பற்றிய, எல்லா விஷயங்களையும் கண்காணிப்பது தோட்டவாரியரது கடமை என்பர் திரு.",10
சோழர்_கால_அரசியல்_தலைவர்கள்,தோட்டங்களைப் பற்றியவற்றைக் கண்காணிப்பதும் இவர் கடமையாகலாம்.,5
சோழர்_கால_அரசியல்_தலைவர்கள்,ஏரிவாரியம் நீர் நிலைகளைப் பாதுகாத்துப் பயன்படச் செய்வது இவர் கடமை என்பது திரு.,10
சோழர்_கால_அரசியல்_தலைவர்கள்,சிற்றூர்களில் உள்ள ஏரிகளை அடிக்கடி பழுதுபார்க்க வேண்டிய செலவுக்காக நிலங்கள் ஊரவையார் பார்வையில் விடப்பட்டிருக்கும்.,11
சோழர்_கால_அரசியல்_தலைவர்கள்,அவை ஏரிப்பட்டி எனப்பெறும்.,3
சோழர்_கால_அரசியல்_தலைவர்கள்,ஏரிப்பட்டியை மேற்பார்வையிட்டவர் ஏரிவாரியப் பெருமக்கள் எனப்பெற்றனர் என்றும் சிலர் கூறுவர்.,8
சோழர்_கால_அரசியல்_தலைவர்கள்,முப்பத்து மூன்று கழனிவாரியம் நன்செய் நிலங்களைப் பற்றியவற்றைக் கவனிப்பது இவர் கடமை.,9
சோழர்_கால_அரசியல்_தலைவர்கள்,முப்பத்து நான்கு ஒவ்வொரு சிற்றூரிலும் அறுவடை ஆனதும் பஞ்ச ஒழிப்பிற்கென்று ஒரு பகுதி நெல் ஒதுக்கிவைக்கப்பெறும்.,12
சோழர்_கால_அரசியல்_தலைவர்கள்,கணக்கு வாரியம் அரசியல் கணக்குகளைப் பரிசீலனை செய்வது இவர் கடமையாகலாம்.,8
சோழர்_கால_அரசியல்_தலைவர்கள்,கலிங்கு வாரியம் ஏரிக் கலிங்குகளை முப்பத்தைந்து மேற்பார்வை செய்பவர் இவர்.,8
சோழர்_கால_அரசியல்_தலைவர்கள்,தடிவழி வாரியம் வயல்களைக் கண்காணிப்பவர் இவர் தடி என்னும் அளவையால் அளக்கப்பெறும் பெருவழிகளைப் பார்வையிடுபவர் என்று திரு.,13
சோழர்_கால_அரசியல்_தலைவர்கள்,முப்பத்தாறு உறுப்பினரைத் தேர்ந்திடுமாறு உறுப்பினரைக் குடவோலை வாயிலாக ஆண்டு தோறும் தேர்ந்தெடுப்பார்கள்.,9
சோழர்_கால_அரசியல்_தலைவர்கள்,அவன் தன் ஐந்து விரல்களையும் அகலவிரித்து அகங்கையில் அதனை ஏற்று அதன்கண் எழுதப்பெற்றுள்ள பெயரை யாவரும் அறிய வாசிப்பன்.,14
சோழர்_கால_அரசியல்_தலைவர்கள்,அங்கிருந்த நம்பிமார் அனைவரும் அவ்வோலையைப் படித்திடுவர்.,5
சோழர்_கால_அரசியல்_தலைவர்கள்,அதன் பின்னர் அப்பெயர் ஒரு ஒலையின் கண் எழுதிக்கொள்ளப்படும்.,7
சோழர்_கால_அரசியல்_தலைவர்கள்,இவ்வண்ணம் எழுதிய முப்பதின்மருள் கல்வியின் முதிர்ந்து வயதின் மூத்தார் பன்னிருவரைச் சம்வத்சர வாரியர் எனத் தேர்ந்திடுவர்.,12
சோழர்_கால_அரசியல்_தலைவர்கள்,"மற்றைய பதினெண்மருள் பன்னிருவர் தோட்டவாரியராகவும், அறுவர் ஏரிவாரியராகவும் தேர்ந்திடப்பெறுவர்.",7
சோழர்_கால_அரசியல்_தலைவர்கள்,முப்பத்தேழு பொன்வாரியம் இக்கல்லெழுத்தில் பொன்வாரியம் என்று ஒரு வாரியம் குறிக்கப்பெறவில்லை.,8
சோழர்_கால_அரசியல்_தலைவர்கள்,பல்வகையானும் திரட்டப்படும் காசுகளை ஆராய்வு செய்வது பொன்வாரியக்காரர் பொறுப்பாக இருந்தது என்று பண்டித எல்.,11
சோழர்_கால_அரசியல்_தலைவர்கள்,உலகநாதபிள்ளை அவர்கள் கூறுவர்.,3
சோழர்_கால_அரசியல்_தலைவர்கள்,"நிலத்தை அளக்கும் கோல் திருப்பாற்கடல் கல்லெழுத்தில் நிலம் அளக்கும் கோல், கழனிக் கோல் என்று கூறப்பெற்றுள்ளது.",12
சோழர்_கால_அரசியல்_தலைவர்கள்,காவனூர்க் கல்லெழுத்தில் முப்பத்தெட்டு நிலம் அளக்கும் கோல் கடிகைக் களத்துக் கோல் என்று சொல்லப்பெற்றுள்ளது.,11
சோழர்_கால_அரசியல்_தலைவர்கள்,முதல் இராசராசனது ராஜக்கல் கல்வெட்டிலும் இக்கோல் குறிக்கப்பெற்றுள்ளது.,6
சோழர்_கால_அரசியல்_தலைவர்கள்,நாற்பத்தொன்று சில சொற்றாெடர்களும் வழக்காறுகளும் மஞ்சிக்கம் என்பது ஊர்களில் இருக்கும் புறம்போக்கு நிலம்.,10
சோழர்_கால_அரசியல்_தலைவர்கள்,இது ஊர்ச்சபையாரின் மேற்பார்வையில் இருக்கும் இந்நிலப்பகுதியை இங்ஙனம் சாசனம் செய்து கொடுக்கும் உரிமை ஊர்ச்சபையார்க்கிருந்தது.,11
சோழர்_கால_அரசியல்_தலைவர்கள்,இம்மஞ்சிக்கம் வரி செலுத்தாது கிடந்த பூமி என்பது ஊர் மஞ்சிக்கமாய் வரிசிலத்துக் கிடந்த பூமி என்ற பகுதியால் அறியலாம்.,14
சோழர்_கால_அரசியல்_தலைவர்கள்,"வரி சிலத்துக்கிடந்த, வரிசிரையாய்க் கிடந்த என்ற பகுதிகள் வரி செலுத்தாதிருந்த என்ற பொருளைத் தருவனவாம்.",11
சோழர்_கால_அரசியல்_தலைவர்கள்,குறி என்ற சொல் சபை என்று பொருள்படும்.,6
சோழர்_கால_அரசியல்_தலைவர்கள்,"ஊராள்கின்றவன், கண்காணி, மத்யஸ்தன் கணக்கன் என்ற அலுவலர்கள் பெயர்களும் அறியப் பெறுகின்றன.",9
சோழர்_கால_அரசியல்_தலைவர்கள்,கண்காணி என்பது மேற்பார்வை செய்பவர் என்று பொருள்படும்.,6
சோழர்_கால_அரசியல்_தலைவர்கள்,மத்யஸ்தன் என்பவர் கரணத்தான் என்றும் கூறப்பெறுவர் வாரியப் பெருமக்கள் அல்லது ஊர்ச் சபையினர் பணித்தவற்றைச் செய்வது இவர் கடமை.,14
சோழர்_கால_அரசியல்_தலைவர்கள்,இக்கல்லெழுத்திலிருந்து ஊராட்சிமுறை அக்காலத்துச் சிறந்திருந்தமை அறிந்து மகிழ்வோமாக !,6
சோழர்_கால_அரசியல்_தலைவர்கள்,பிற்கல்லெழுத்துச் செய்திகள் வியாக்கியான விருத்தி திருக்கோவில்களில் வியாக்கியான மண்டபங்கள் இருந்தன.,8
சோழர்_கால_அரசியல்_தலைவர்கள்,அங்குப் பெரும்புலவர்கள் இலக்கணத்தை விளக்கி விரிவுரை யாற்றுவர்.,6
சோழர்_கால_அரசியல்_தலைவர்கள்,நாற்பத்து மூன்று விஷஹரபோகம் மக்களின் உடற்பினிை போக்க ஆதுரசாலைகள் பல முற்காலத்து இருந்தன.,10
சோழர்_கால_அரசியல்_தலைவர்கள்,அங்குச் சல்லியக்கிரியை பண்ணுவாரும் இருந்தனர்.,4
சோழர்_கால_அரசியல்_தலைவர்கள்,வைத்தியர்களுக்கு மருத்துவக் காணியும் அளிக்கப்பெற்றது.,4
சோழர்_கால_அரசியல்_தலைவர்கள்,அது விஷஹரபோகம் எனப்பெற்றது.,3
சோழர்_கால_அரசியல்_தலைவர்கள்,விஷஹரபோகமாக அளிக்கப்பெற்ற நிலம் ஓர் ஆயிரத்து இருநூற்று எண்பது குழி.,8
சோழர்_கால_அரசியல்_தலைவர்கள்,இந்த நிலத்துக்கு யாராவது இறை செலுத்தவேண்டும் என்று கூறி இறை வசூலித்தால் தன்மாசனத்துக்கு.,10
சோழர்_கால_அரசியல்_தலைவர்கள்,நாற்பத்தாறு இருபத்தைந்து கழஞ்சு பொன் தண்டம் செலுத்த வேண்டும்.,7
சோழர்_கால_அரசியல்_தலைவர்கள்,"இக்கல்லெழுத்தில் கானும், சபையாரிடம் பணிபெற்றார்.",4
சோழர்_கால_அரசியல்_தலைவர்கள்,ஸ்ரீபலிபோகம் திருக்கோயில்களில் ஸ்ரீபலி என்று ஒரு சடங்கு நடைபெறும்.,7
சோழர்_கால_அரசியல்_தலைவர்கள்,வாத்தியம் முழக்கிச் சோறும் பூவும் திருக்கோயிலில் தூவுதலே ஸ்ரீபலி எனும் சடங்காகும்.,9
சோழர்_கால_அரசியல்_தலைவர்கள்,ஸ்ரீபலி இடும்போது விக்கிரகத் தோடு வலம்வருவர்.,5
சோழர்_கால_அரசியல்_தலைவர்கள்,அப்பொழுது இசைக்கருவிகளை வாசிப்பர்.,3
சோழர்_கால_அரசியல்_தலைவர்கள்,"ஸ்ரீபலி என்பது, ஹவிர்பலி எனவும் தீயெறி சோறு எனவும் கூறப்பெறும்.",8
சோழர்_கால_அரசியல்_தலைவர்கள்,இதற்கு நிபந்தம் விட்டதாகப் பார்த்திவேந்திரனது ஐந்து ஆவது ஆட்சியாண்டுக் கல்லெழுத்துச் செப்புகிறது.,9
சோழர்_கால_அரசியல்_தலைவர்கள்,நாற்பத்தேழு ஸ்ரீமந் நீலகங்கரையன் அண்ணாவன் நாட்டடிகளுக்குத் தாயனூர் ஊரார் விண்ணப்பித்தனர்.,8
சோழர்_கால_அரசியல்_தலைவர்கள்,சூரியகிரகண நாளில் ஸ்ரீபலிபோகம் தரப்பெற்றது.,4
சோழர்_கால_அரசியல்_தலைவர்கள்,ஸ்ரீபலிக்கு ஐந்துபேர் தணக்கமலை மகா தேவர் திருமுன் வாச்சியங்கள் முழக்க வேண்டும் என்று ஏற்பாடாயிற்று.,11
சோழர்_கால_அரசியல்_தலைவர்கள்,இதற்குரிய நிலம் ஒன்று.,3
சோழர்_கால_அரசியல்_தலைவர்கள்,உத்திரமேரூரில் ஸ்ரீ பலிபோகமாக நிலம் அளித்த செய்தி இரண்டு கல்லெழுத்துக்களில் நாற்பத்தெட்டு கூறப்பெற்றுள்ளது.,10
