work_title,sentence,sentence_length
சதுரங்கம்_விளையாடுவது_எப்படி,நூற்றி எழுபத்து நான்கு ம் ஆண்டு சதுரங்க ஆட்டம் கண்டுபிடிக்கப்பட்டதாகவும் வேறு பல கதைகளும்உண்டு.,11
சதுரங்கம்_விளையாடுவது_எப்படி,"மன அமைதிக்காக மலர்ந்த கதைகள் முதல் மனிதன் ஆதாம் என்பவருக்கு காய்ன், ஏபெல் என இரண்டு குமாரர்கள் உண்டு.",14
சதுரங்கம்_விளையாடுவது_எப்படி,"தன் தம்பி ஏபெல் மீது பொறாமை கொண்ட காய்ன், தம்பியை ஊருக்கு வெளிப்புறத்தில் வைத்துக் கொன்று விட்டான்.",13
சதுரங்கம்_விளையாடுவது_எப்படி,"ஆதாமைத் தொடர்ந்து ஷாம், ஜேபட், சாலமன் மன்னன் ஆடியதாகவும் அந்தக் கதை தொடர்கிறது.",10
சதுரங்கம்_விளையாடுவது_எப்படி,இனி முகமதிய புராணத்திலிருந்து கூறப்படும் ஒரு கதையினை காண்போம்.,7
சதுரங்கம்_விளையாடுவது_எப்படி,"முதலாம் நூற்றாண்டில், ஒரு ராணி அரசாண்டு வந்தாள்.",6
சதுரங்கம்_விளையாடுவது_எப்படி,"அவளுக்கு ஒரே மகன், உயிருக்குயிராய் காத்து, உள்ளன்புடன் நேசித்து வந்தாள்.",8
சதுரங்கம்_விளையாடுவது_எப்படி,"அரசியின் எதிரிகள் எவ்வாறோ இளவரசனைக் கொன்று, தங்கள் வஞ்சத்தைத் தீர்த்துக் கொண்டார்கள்.",9
சதுரங்கம்_விளையாடுவது_எப்படி,"இந்த இறப்புச் சேதியை அரசிக்குக் கூறுமாறு, கப்ளான் என்ற தத்துவ ஞானியிடம் தூது சென்றனர்.",11
சதுரங்கம்_விளையாடுவது_எப்படி,"துன்பச் செய்தியை செவி மெடுத்து தத்துவ ஞானியும் தான் துணைவருவதாகவும், வழி காட்டுவதாகவும் உறுதி கூறினார்.",12
சதுரங்கம்_விளையாடுவது_எப்படி,மூன்று நாட்கள் தீவிரமாக சிந்தித்து உழைத்தபிறகு அவர் ஒரு வழியினைக் கண்டறிந்தார்.,9
சதுரங்கம்_விளையாடுவது_எப்படி,"ஒரு தச்சனை அழைத்து வரச் செய்து, தான் விரும்புகின்ற வண்ணம், ஒரு பலகையினை மாற்றி அமைத்துத் தரச் செய்தார்.",14
சதுரங்கம்_விளையாடுவது_எப்படி,இதனை இரத்தம் சிந்தாத போர்க்களம் என்று பெயரிட்டழைத்தார்.,6
சதுரங்கம்_விளையாடுவது_எப்படி,"இராணியின் முன்னே, தன் சீடர்களைக் கொண்டு ஆட்டத்தை ஆடச் செய்தார் கப்ளான்.",9
சதுரங்கம்_விளையாடுவது_எப்படி,"இராணி ஆர்வத்தால் ஆழ்ந்து போய், ஆட்டத்தையே பார்த்துக் கொண்டிருந்தாள்.",7
சதுரங்கம்_விளையாடுவது_எப்படி,கப்ளானும் ஆட்டத்தைப் பற்றி விளக்கிக் கொண்டிருந்தார்.,5
சதுரங்கம்_விளையாடுவது_எப்படி,"ஆட்டம் நடந்து கொண்டிருக்கும் பொழுது ஒரு சீடன், ஷாமத் என்று வெறியுடன் கத்தினான்.",10
சதுரங்கம்_விளையாடுவது_எப்படி,அதற்கு அரசன் இறந்து விட்டான் என்பது அர்த்தமாகும்.,6
சதுரங்கம்_விளையாடுவது_எப்படி,"அந்த நிகழ்ச்சியைத் தொடர்ந்து, தன் மகன் இறந்த சேதியையும் ஞானி மூலம் தெரிந்து கொண்டாளாம் இராணி.",12
சதுரங்கம்_விளையாடுவது_எப்படி,"அவளது அதிர்ச்சியைத்தாங்கிக் கொள்ளும் சக்தியை, அந்த ஆட்டத்தின் மூலம் இராணி பெற்றாள் என்று கதை தொடர்ந்து செல்கிறது.",13
சதுரங்கம்_விளையாடுவது_எப்படி,ஒரு இராணிக்கு இரண்டு குமாரர்கள் இருந்தனர்.,5
சதுரங்கம்_விளையாடுவது_எப்படி,"அவர்கள் இருவரும் வெவ்வேறு திருமணத்தில், அவளுக்குப் பிறந்த குழந்தைகள், அவர்கள் இருவரும் எப்பொழுது பார்த்தாலும், பொறாமையுடன் சண்டையிட்டுக் கொண்டேயிருந்தனர்.",14
சதுரங்கம்_விளையாடுவது_எப்படி,"வழக்கம்போல் சண்டையிட்டுக் கொண்டிருக்கும் பொழுது, ஒருவன் இறந்து விட்டான்.",7
சதுரங்கம்_விளையாடுவது_எப்படி,"கத்தியால் குத்தாமல் இருக்கும் பொழுதே, அவன் எப்படி இறந்தான் என்பது உயிரோடிக்கும் இன்னொரு வனுக்குத் தெரியாமலே போயிற்று.",13
சதுரங்கம்_விளையாடுவது_எப்படி,"சேதி அறிந்த இராணி, நீ தான் அவனைக் கொன்றாய், என்று இவனை குற்றம் சாட்டத் தொடங்கினாள்.",12
சதுரங்கம்_விளையாடுவது_எப்படி,"விளங்கச் சொல்லுகின்ற வழி அவனுக்கு விளங்காமற் போகவே, அரசவையில் உள்ள அறிஞர்களை நாடிச் சென்றான்.",11
சதுரங்கம்_விளையாடுவது_எப்படி,செல்லும் வழி தெரியாது குழம்பினான்.,4
சதுரங்கம்_விளையாடுவது_எப்படி,"அவனது அரசவை அறிஞர்கள் என்று ஆல்அட்லி, என்ற வரலாற்றாசிரியர் கூறுகின்றார்.",8
சதுரங்கம்_விளையாடுவது_எப்படி,"நல்வினை, தீவினை இவைகளால் மனிதர்கள் எவ்வாறு அலைக்கழிக்கப்படுகின்றார்கள் என்பதை சித்தரிக்கும் வண்ணம், ஒரு விளையாட்டை உருவாக்கும்படி கேட்டுக்கொண்டான்.",13
சதுரங்கம்_விளையாடுவது_எப்படி,"இந்தக் கதையின் தொடர்ச்சியாக மேலும் ஒரு கதை பிறந்து, தொடர்ந்து துணை புரிகின்றது.",10
சதுரங்கம்_விளையாடுவது_எப்படி,"பால் கெய்ட் என்ற அரசன், அவனுக்கு பிரமன் என்னும் அமைச்சன்.",8
சதுரங்கம்_விளையாடுவது_எப்படி,போரினை அடிப்படையாகக் கொண்டுதான் பிரமன் அமைத்தார்.,5
சதுரங்கம்_விளையாடுவது_எப்படி,அறிவினைக் கொள்ள முடியும் என்பது அவருடைய கொள்கையாகும்.,6
சதுரங்கம்_விளையாடுவது_எப்படி,இனி வரலாற்றுக் குறிப்புகளைக் காண்போம்.,4
சதுரங்கம்_விளையாடுவது_எப்படி,சுமார் கி.மு.,3
சதுரங்கம்_விளையாடுவது_எப்படி,"கிரேக்கத்தில்தான் சதுரங்கம் முதன்முதலாகத் தொடங்கியது என்றும், அங்கிருந்து முகமதிய நாடுகளுக்குப் பரவியது என்பாரும் உண்டு.",11
சதுரங்கம்_விளையாடுவது_எப்படி,அதன் காலத்தை கி.பி.எனவும் குறிப்பிடுகின்றார்.,6
சதுரங்கம்_விளையாடுவது_எப்படி,"பாரசீகத்திலிருந்து ஸ்பெயின், மற்றும் ஐரோப்பா நாடுகளுக்கு முகமதியர்கள் தான் இந்த ஆட்டத்தைப் பரப்பியிருக்க வேண்டும் என்று கருத இடமுண்டு.",14
சதுரங்கம்_விளையாடுவது_எப்படி,எட்வர்டு யங் என்னும் ஆசிரியர் சதுரங்கம் பற்றிய தனது நூலில் குறிப்பிடுவதாவது சற்றேறக் குறைய கி.பி.,13
சதுரங்கம்_விளையாடுவது_எப்படி,"இங்கிருந்துதான், இது பாரசீகத்திற்கும் மற்றைய ஆசிய நாடுகளுக்கும் பரவியது என்கிறார்.",8
சதுரங்கம்_விளையாடுவது_எப்படி,"அதன் படியேதான் ஸ்பெயின், இத்தாலி, பிரான்சூ மற்றும் ஐரோப்பா கண்டம் முழுவதும் சதுரங்கம் பரவியது என்றும் எழுதுகிறார்.",13
சதுரங்கம்_விளையாடுவது_எப்படி,"இதன் பெருமைக்காக, எல்லா மதத்தினருமே ஆடி வந்தார்கள் என்ற குறிப்பையும் நாம் காணுகின்றோம்.",10
சதுரங்கம்_விளையாடுவது_எப்படி,முகமது நபியே சதுரங்க ஆட்டத்தை ஆடியதாக ஒரு குறிப்பு கூறுகின்றது.,8
சதுரங்கம்_விளையாடுவது_எப்படி,முதல் மனிதன் ஆதாம் ஆடியதாக ஒரு குறிப்பு.,6
சதுரங்கம்_விளையாடுவது_எப்படி,"கிருஷ்ணனும் ராதையும் சதுரங்கம் ஆடி மகிழ்வதாக, ஜெய்ப்பூரில் காணும் ஒவியம் ஒன்று காட்டுகிறது.",10
சதுரங்கம்_விளையாடுவது_எப்படி,"ஆகவே, எல்லா மதத்தினரும் ஈடுபாடும், ஆடுவதற்கு இதில் நிறைந்த ஆர்வமும் கொண்டிருந்தனர் என்பது நமக்கு விளங்குகின்றது.",12
சதுரங்கம்_விளையாடுவது_எப்படி,"அத்துடன், ஒரு பெரிய பட்டியலையே ஒருவர் நமக்கு தொகுத்துத் தருகிறார்.",8
சதுரங்கம்_விளையாடுவது_எப்படி,"இந்நிலையில், அரசருக்கு அடுத்தநிலை அமைச்சருக்கா, அல்லது இராணிக்கா என்பதிலே எழுந்த போட்டி, அரசியல் வரையிலும் நீடித்து நிலைத்து நின்றிருக்கிறது.",14
சதுரங்கம்_விளையாடுவது_எப்படி,"ஆரம்ப காலத்திலிருந்து பனிரண்டு  ம் நூற்றாண்டுவரை, அரசருக்கு அடுத்து அமைச்சரே சக்தியுள்ளவராக வைக்கப்பட்டிருந்தார்.",10
சதுரங்கம்_விளையாடுவது_எப்படி,"ஆட்டத்தில் அமைச்சரை அகற்றி விட்டு, இராணியே இருக்க வேண்டும் என்ற நிலை எவ்வாறு எழுந்தது என்று இனி காண்போம்.",14
சதுரங்கம்_விளையாடுவது_எப்படி,"அரேபியா போன்ற முகமதிய நாடுகளில் அரசருடன் போருக்குச் சென்று, உடனிருந்து பணியாற்றியவர்கள் அமைச்சர்கள் தான்.",11
சதுரங்கம்_விளையாடுவது_எப்படி,"அதனால், அமைச்சர் என்பவர் அரசருக்கு அடுத்த நிலையில் ஆட்டத்திலிருந்தார்.",7
சதுரங்கம்_விளையாடுவது_எப்படி,"இங்கிலாந்து நாட்டில் எழுந்த ஒரு புதிய கழ்நிலையால், ராணி மேரியின் புகழ் பெருகியதால் தான் இந்த நிலை உருவானது.",14
சதுரங்கம்_விளையாடுவது_எப்படி,"அதேபோல், வட இத்தாலியிலும் ஒரு நிகழ்ச்சி நடந்தது.",6
சதுரங்கம்_விளையாடுவது_எப்படி,"கேதரினா சபோர்சா என்ற மங்கை, இத்தாலியை ஆண்ட இளவரசனுக்குத் திருமணம் செய்விக்கப்பட்டாள்.",9
சதுரங்கம்_விளையாடுவது_எப்படி,இளவரசனோ ஆட்சிப் பொறுப்பேற்று நடத்தும் ஆற்றலின்றி இருந்தான்.,6
சதுரங்கம்_விளையாடுவது_எப்படி,"நிலையுணர்ந்த கேதரினா, நிதானமிழக்காமல், நெடுமூச்செறிந்து கணவனைப் பழிக்காமல், காரியம் அற்றத் துணிந்தாள்.",9
சதுரங்கம்_விளையாடுவது_எப்படி,படைகளை நடத்திச் சென்று போரிட்டாள்.,4
சதுரங்கம்_விளையாடுவது_எப்படி,"மக்களைக்காத்தாள், அதோடு மன்னன் மானத்தையும் காத்தாள்.",5
சதுரங்கம்_விளையாடுவது_எப்படி,"இராணியின் செல்வாக்கே ஓங்கியிருந்ததால், அமைச்சருக்கு அங்கு உரிய இடம் வழங்கப்படவில்லை.",8
சதுரங்கம்_விளையாடுவது_எப்படி,"ஆகவே, சதுரங்க ஆட்டத்திலும் அமைச்சரை நீக்கிவிட்டு, இராணியை வைத்து விட்டார்கள்.",8
சதுரங்கம்_விளையாடுவது_எப்படி,இது பதினைந்து  ம் நூற்றாண்டில் நிகழ்ந்த நிகழ்ச்சியாகும்.,6
சதுரங்கம்_விளையாடுவது_எப்படி,"அரசகுலத்திற்கும் சதுரங்க ஆட்டத்திற்கும் இவ்வளவு நெருக்கமும் நிறைந்த விருப்பமும் இருக்க, இன்னும் பல காரணங்களும் இருந்தன.",12
சதுரங்கம்_விளையாடுவது_எப்படி,அரச குலத்திற்கு மட்டுமே உரிய ஆட்டமாக இதுகட்டிக் காக்கப்பட்டது.,7
சதுரங்கம்_விளையாடுவது_எப்படி,பொதுமக்கள் இதனை ஆடக்கூடாது.,3
சதுரங்கம்_விளையாடுவது_எப்படி,மீறி விளையாடியவர்கள் தண்டிக்கப்பட்டனர் என்றும் வரலாறு கூறுகின்றது.,6
சதுரங்கம்_விளையாடுவது_எப்படி,அரச குலப் பெண்களுக்கு அவர்கள் பயிற்சியளித்தார்கள்.,5
சதுரங்கம்_விளையாடுவது_எப்படி,ஆடுவோரிடைய காதல் கவிதைகள் தோன்றின.,4
சதுரங்கம்_விளையாடுவது_எப்படி,ஆட்டத்திற்கிடையே ஆனந்தமான சொற்களும் அன்பைக் காட்ட உதவின.,6
சதுரங்கம்_விளையாடுவது_எப்படி,ஆட்டத்தைப் பற்றிய அக்கறையும் அதில் இதய நெகிழ்ச்சியும் ஏற்படக்கூடிய இனிய சூழ்நிலை அமைந்திருந்தது.,10
சதுரங்கம்_விளையாடுவது_எப்படி,அதன் காரணமாக ஆட்டமும் மேலும் மேலும் வளர்ச்சியடைந்தது.,6
சதுரங்கம்_விளையாடுவது_எப்படி,"ஆட்டக் காய்கள் அந்தந்த நாடுகளில் அவரவர்கள் விருப்பத்திற்கேற்ப, ஆட்டக் காய்களையும், வடிவத்தையும் அமைத்துக் கொண்டு ஆடினர்.",12
சதுரங்கம்_விளையாடுவது_எப்படி,இந்தியாவில் காய்களை உருவாக்கும் அமைப்பு முறையில் சிறிது மாற்றமும் முன்னேற்றமும் ஏற்பட்டது.,9
சதுரங்கம்_விளையாடுவது_எப்படி,"பதினேழு  ம் நூற்றாண்டு காலத்தில்தான், இந்த முறை வளர்ந்தது மணிக் கற்களினால் ஆட்டக்காய்கள் செய்யப்பட்டன.",11
சதுரங்கம்_விளையாடுவது_எப்படி,யானைத் தந்தங்களிலும் சந்தனக் கட்டைகளிலும் காய்களை உண்டாக்கி அதில் அழகான சித்திர வேலைப்பாடுகளைச் செதுக்கி ஆடி மகிழ்ந்தனர்.,13
சதுரங்கம்_விளையாடுவது_எப்படி,"காலங்கடந்த போதும், மற்ற விலையுயர்ந்த கற்கள் மாறிப் போனாலும், தந்தமும் சந்தனமரமுமே நிலைத்து நின்றன.",11
சதுரங்கம்_விளையாடுவது_எப்படி,இப்பொழுது பிளாஸ்டிக்கில் கூட ஆட்டக் காய்களை செய்து ஆடுகின்றனர்.,7
சதுரங்கம்_விளையாடுவது_எப்படி,"மனிதக் காய்கள் இவைகளை விட, ஆச்சரியமான ஆட்டக்காய்கள் முகலாயர் ஆட்சிக்காலத்தில் இருந்திருக்கின்றன என்றும் கூறுகின்றனர்.",11
சதுரங்கம்_விளையாடுவது_எப்படி,அவைகள் தான் மனிதக் காய்கள்.,4
சதுரங்கம்_விளையாடுவது_எப்படி,அரண்மனைத் தரையிலே கற்களின் மீதே சதுரங்கக் கட்டங்கள் பெரிது பெரிதாக அமைக்கப்பட்டிருந்தன.,9
சதுரங்கம்_விளையாடுவது_எப்படி,"பெரும்பாலும் ராணியும் அரசருமே இருந்து ஆடுவார்கள், அந்தந்தக் கட்டங்களுக்குரிய காய்களை வைக்காமல், அந்தக் கட்டங்களுக்குரிய காய்களின் அமைப்பைப் போல.",14
சதுரங்கம்_விளையாடுவது_எப்படி,தங்கள் தலையில் அணிகலன் அணிந்து பணியாட்கள் உரிய கட்டங்களில் நிற்பார்கள்.,8
சதுரங்கம்_விளையாடுவது_எப்படி,இப்படி ஆடியதாக வரலாறு எடுத்துரைக்கின்றது.,4
சதுரங்கம்_விளையாடுவது_எப்படி,அரசர்களின் அரசவைதானே ஆட்டத்தை நலிவுறாமல் காத்து வந்திருக்கிறது !.,6
சதுரங்கம்_விளையாடுவது_எப்படி,ஆட்டப் பலகை ஆட்டப் பலகையானது ஆதிமுதலாகவே கட்டங்களின் அமைப்பிலே தான் அமைந்திருந்தது.,9
