work_title,sentence,sentence_length
சோழர்_கால_அரசியல்_தலைவர்கள்,"சாசனத் தமிழ்க்கவி சரிதம், பக்கம் அறுபத்து நான்கு.",6
சோழர்_கால_அரசியல்_தலைவர்கள்,இவன் வேளாண்குடியிற் பிறந்தவன்.,3
சோழர்_கால_அரசியல்_தலைவர்கள்,"இவற்கு அருளாகரன், அரும்பாக்கிழான், நரலோக வீரன், காலிங்கர்கோன், பொன்னம்பலக்கூத்தன் என்ற பெயர்களும் வழங்கலாயின.",10
சோழர்_கால_அரசியல்_தலைவர்கள்,இவனுக்கு மானாவதாரன் என்ற விருதுப் பெயரும் இருந்ததெனச் சித்தலிங்கமடம் என்ற ஊரில் கிடைத்த கல்லெழுத்தால் அறியப்பெறுகிறது.,12
சோழர்_கால_அரசியல்_தலைவர்கள்,இவன் வெற்றிகளைக் கூறும் சாசனப் பகுதிகள் பின்வருமாறு ஒன்று.,7
சோழர்_கால_அரசியல்_தலைவர்கள்,தென்னாடன் சாவேற்றின் திண்செருக்கை அன்றமைத்தான் தொண்டையர்கோ னாங்கு.,6
சோழர்_கால_அரசியல்_தலைவர்கள்,⁠⁠⁠⁠・・・・・・ போரில் கொலைநாடு வெஞ்சினவேல் கூத்தன் குறுகார் மலை நாடு கொண்டபிரான் வந்து.,10
சோழர்_கால_அரசியல்_தலைவர்கள்,"தென்னர், குடமலை நாடறிந்து கொண்ட வேற்கூத்தன்.",5
சோழர்_கால_அரசியல்_தலைவர்கள்,⁠⁠⁠............ தென்னர் மலைமன்னர் ஏனை வடமன்னர் மற்றக் குலமன்னர் செல்வமெலாம் கொண்டு.,9
சோழர்_கால_அரசியல்_தலைவர்கள்,விக்கிரமசோழன் காலத்தில் முதற்குலோத்துங்க சோழனுக்குப் பிறகு சோழப் பேரரசனாகத் திகழ்ந்தவன் விக்கிரமசோழன்.,9
சோழர்_கால_அரசியல்_தலைவர்கள்,இவ் விக்கிரம சோழனுடைய ஆட்சியின் முற்பகுதியினும் மணவிற்கூத்தன் நிலவியிருந்தான்.,7
சோழர்_கால_அரசியல்_தலைவர்கள்,விக்கிரசோழனுலா விக்கிரம சோழனது அவைக்களப் புலவராய் வீற்றிருந்தவர் ஒட்டக்கூத்தர்.,7
சோழர்_கால_அரசியல்_தலைவர்கள்,இவ்வொட்டக்கூத்தர் விக்கிரமசோழனுலா என்னும் நூலொன்று விக்கிரமசோழன் பேரில் இயற்றியுள்ளார்.,7
சோழர்_கால_அரசியல்_தலைவர்கள்,இவன் தில்லையிலும் திருவதிகையிலும் செய்த சிவப்பணிகள் அளப்பில.,6
சோழர்_கால_அரசியல்_தலைவர்கள்,"அவற்றைத் தில்லையம்பதியில் கல்லெழுத்தாக அமைந்துள்ள முப்பத்தாறு வெண்பாக்களாலும், திருவதிகை வீரட்டானத்தில் சிலாசாசனம் செய்யப் பெற்றுள்ள இருபத்தைந்து வெண்பாக்களாலும் அறியலாம்.",14
சோழர்_கால_அரசியல்_தலைவர்கள்,அம்மண்டபம் இற்றை நாளில் சிதம்பரத்துக்கு அருகில் கிள்ளை என்னும் ஊரில் இருக்கிறது என்று ஆராய்ச்சியாளர் கூறுவர்.,12
சோழர்_கால_அரசியல்_தலைவர்கள்,"தேவாரம் ஒதுவதற்கும், இருந்து அன்பர்கள் செவிமடுத்து இன்புறுவதற்குமாக ஒரு மண்டபத்தைக் கட்டினான்.",9
சோழர்_கால_அரசியல்_தலைவர்கள்,அன்றியும் சம்பந்தர் கோயிலுக்கு இவன் பொன் வேய்ந்தான் என்று ஒரு பாடல் கூறுகிறது.,10
சோழர்_கால_அரசியல்_தலைவர்கள்,தென்வேந்தன் கூனிமிர்த்த செந்தமிழர் தென்கோயில் பொன்மேய்ந்து திக்கைப் புகழ்வேய்ந்தான்.,7
சோழர்_கால_அரசியல்_தலைவர்கள்,இதனுள் தென்வேந்தன் என்றது கூன்பாண்டியனை கூன்நிமிர்த்த செந்தமிழர் என்றது ஞானசம்பந்தரை.,8
சோழர்_கால_அரசியல்_தலைவர்கள்,"இனி, இம்மணவிற் கூத்தன் திருமுறைகளைச் செப்பேடு செய்வித்தான் என்பது சிறப்பாகக் குறிப்பிடத் தக்க செய்தியாகும்.",11
சோழர்_கால_அரசியல்_தலைவர்கள்,இதில் பாடியவாறு என்ற சொற்றாெடர் கவனிக்கற்பாலது.,5
சோழர்_கால_அரசியல்_தலைவர்கள்,ஒத்தமைத்த என்ற சொற்றாெடரும் கவனிக்கத்தக்கது.,4
சோழர்_கால_அரசியல்_தலைவர்கள்,திருவதிகைத் திருப்பணிகள் தில்லையில் பல திருப்பணிகளைச் செய்தவனாகிய மணவிற்கூத்தன் திருவதிகையில் செய்த திருப்பணிகளும் பல.,11
சோழர்_கால_அரசியல்_தலைவர்கள்,ஒன்று அமைத்தான் அருளாகர நல்லூர் என்று தன் பெயரால் ஒரு ஊரையும் ஆங்கொரு ஏரியையும் உண்டாக்கினான்.,12
சோழர்_கால_அரசியல்_தலைவர்கள்,இனித் திருவதிகைதான் திருநாவுக்கரசர் சூலை நீங்கித் திருநாவுக்கரசு என்னும் நாமத்தை மன்னிய தலமாகும்.,10
சோழர்_கால_அரசியல்_தலைவர்கள்,உமாதேவியார் காஞ்சிபுரத்தில் எண்ணான்கு பேரறங்களையும் செய்தருள்கிறார் என்பது சைவரறிந்த உண்மை.,8
சோழர்_கால_அரசியல்_தலைவர்கள்,நற்பண்புகள் இது காறும் கண்டவாற்றான் இவனது சிவபக்தி சிறப்புத் தெற்றென விளங்கும்.,9
சோழர்_கால_அரசியல்_தலைவர்கள்,"தொல்லை மழை வளர்க்க வெங்கலியை மாற்றி, வழுவாமல் அறம் வளர்த்தவன் இவன்.",9
சோழர்_கால_அரசியல்_தலைவர்கள்,பொன் மழையோடொக்கத் தரும் கொடையான் ஆகவும் இவன் திகழ்ந்தான்.,7
சோழர்_கால_அரசியல்_தலைவர்கள்,இவன் சைவ சமயத்துக்கு ஆற்றியுள்ள சிறந்த பணி மூவர் தேவரங்களையும் செப்பேடு செய்வித்தமையேயாகும்.,10
சோழர்_கால_அரசியல்_தலைவர்கள்,இதனால் இவன் சைவர் நெஞ்சில் நிலவுபவன் ஆவன்.,6
சோழர்_கால_அரசியல்_தலைவர்கள்,பிற நலப்பணிகள் நெய்வணை என்று இந்நாளில் வழங்கும் ஊர் முன்னாளில் திருநெல் வெண்ணெய் என்று வழங்கப்பட்டது.,12
சோழர்_கால_அரசியல்_தலைவர்கள்,இது சம்பந்தரால் பாடப்பட்ட தலம்.,4
சோழர்_கால_அரசியல்_தலைவர்கள்,இதில் அரும்பாக் கிழானுக்குப் பொற்கோயில் தொண்டைமான் என்ற பெயரும் வழங்கப்படுகிறது.,8
சோழர்_கால_அரசியல்_தலைவர்கள்,கீழுர் என்பது திருக் கோவலூரில் சிவன் கோயிலுள்ள பகுதி.,7
சோழர்_கால_அரசியல்_தலைவர்கள்,எண்ணூற்று தொன்னூற்றிரண்டு என்றுள்ளது.,3
சோழர்_கால_அரசியல்_தலைவர்கள்,தக்கோலம் என்பது முன்னாளில் திருவூறல் என்று வழங்கப்பட்டது.,6
சோழர்_கால_அரசியல்_தலைவர்கள்,இது தொண்டை நாட்டிலுள்ள பாடல் பெற்ற தலம்.,6
சோழர்_கால_அரசியல்_தலைவர்கள்,இக்கல்வெட்டில் தக்கோலம் குலோத்துங்க சோழபுரம் என்று குறிக்கப்பட்டுள்ளது.,6
சோழர்_கால_அரசியல்_தலைவர்கள்,திருப்பாசூர் என்பது செங்கற்பட்டு மாவட்டத்திலுள்ள ஒரு பாடல் பெற்ற தலம்.,8
சோழர்_கால_அரசியல்_தலைவர்கள்,எலவானாசூர் என்றவூரில் முதற் குலோத்துங்க சோழனுடைய நாற்பத்தெட்டு ஆவது ஆட்சியாண்டில் அரும்பாக் கிழான் பள்ளியறை நம்பிராட்டியாரை எழுந்தருளுவித்தான்.,13
சோழர்_கால_அரசியல்_தலைவர்கள்,"திருவதிகை, திருநாவுக்கரசருக்குச் சூலை நோய் நீங்கிய தலம்.",6
சோழர்_கால_அரசியல்_தலைவர்கள்,திருநாவுக்கரசரும் இத்தலத்தை அதி அரைய மங்கை என்று குறிப்பிடுவர்.,7
சோழர்_கால_அரசியல்_தலைவர்கள்,முதற் குலோத்துங்கனுடைய நாற்பத்தெட்டு ஆவது ஆட்சியாண்டுக் கல்வெட்டில் இவ்வூர் அதிராஜ மங்கல்யபுரம் என்று குறிக்கப்பட்டுள்ளது.,11
சோழர்_கால_அரசியல்_தலைவர்கள்,"சித்தலிங்கமடம் என்றவூரில் முதற் குலோத்துங்க சோழனுடைய, ஆட்சியாண்டு தெரியாத கல்வெட்டொன்று உள்ளது.",9
சோழர்_கால_அரசியல்_தலைவர்கள்,அது வடமொழிச் சுலோகமாகும் திருக்கோவலூர் ஆண்டபிள்ளை பட்டன் என்பான் எழுதியது.,8
சோழர்_கால_அரசியல்_தலைவர்கள்,மணவிலாதிபதி சபாநர்த்தக காலிங்கராயன் என்பான் அவ்வூர்ச் சிவன் கோயிலைப் புதுப்பித்தான் என்பது அச்சுலோகத்தில் கண்ட செய்தியாகும்.,12
சோழர்_கால_அரசியல்_தலைவர்கள்,"இக்கல்வெட்டில் அரசன் பெயர் ஜயதரன் என்றும், தலைமை அமைச்சன் பெயர் மானாவதாரன் என்றும் குறிக்கப் பெற்றுள்ளது.",12
சோழர்_கால_அரசியல்_தலைவர்கள்,"ஜயதரன் என்பது முதற் குலோத்துங்கனயும், மானாவதாரன் என்பது இம்மணவிற் கூத்தனையும் குறிக்கும்.",9
சோழர்_கால_அரசியல்_தலைவர்கள்,திருவாரூரில் விக்கிரம சோழனுடைய நான்காம் ஆட்சியாண்டுக் கல்வெட்டொன்று உள்ளது.,7
சோழர்_கால_அரசியல்_தலைவர்கள்,திண்டிவனம் என்ற வூரிலுள்ள விக்கிரம சோழனுடைய ஐந்து ஆவது ஆட்சியாண்டுக் கல்வெட்டுள்ளது.,9
சோழர்_கால_அரசியல்_தலைவர்கள்,நிலத்துக்கு விலை இருபது காசு.,4
சோழர்_கால_அரசியல்_தலைவர்கள்,நத்தக் கொல்லையையும் பத்துக்காசுக்குக் குடிகள் குடியிருக்க விற்றுக் கொடுத்தனர்.,7
சோழர்_கால_அரசியல்_தலைவர்கள்,திருபுவனி என்ற புதுச் சேரிக் கண்மையிலுள்ள ஊரில் விக்கிரம சோழனின் ஆறாம் ஆட்சியாண்டிற்குரிய கல்வெட்டொன்று உள்ளது.,12
சோழர்_கால_அரசியல்_தலைவர்கள்,அரசனுடைய நன்மையின் பொருட்டு அருளாகர ஈசுவர முடையாரை ஐந்தாவது ஆட்சியாண்டில் அரும்பாக்கிழான் எழுந்தருளுவித்தான்.,10
சோழர்_கால_அரசியல்_தலைவர்கள்,அக்கோயில் கட்டவும் திருமுற்றம் பூந்தோட்டம் ஆகியவை அமைக்கவும் திருபுவன மாதேவிச் சதுர்வேதி மங்கலத்தார் இக்கோயிலுக்கு நிலம் கொடுத்தனர்.,13
சோழர்_கால_அரசியல்_தலைவர்கள்,நரலோகவீரன் மண்டபம் திருப்புகலூர்த் திருக்கோயிலில் உள்ள மண்டபங்களுள் ஒன்றிற்கு நரலோகவீரன் மண்டபம் என்று பெயரிருந்ததென்று ஒரு கல்வெட்டு அறிவிக்கிறது.,14
சோழர்_கால_அரசியல்_தலைவர்கள்,அம்மண்டபத்தில் ஊர்ச்சபை கூடிற்று.,3
சோழர்_கால_அரசியல்_தலைவர்கள்,எனவே இப்பெருவீரர் பெயரால் ஒரு மண்டபம் விக்கிரம சோழனது ஆட்சியின் தொடக்கத்திலேயே கட்டப்பெற்றது என அறியலாம்.,12
சோழர்_கால_அரசியல்_தலைவர்கள்,நரலோக வீரன் தென்னாட்டுக்குப் படையெடுத்துச் சென்று வென்றபொழுது அவ்வூர்க்குத் தன் பெயரமைத்தனன் என்று அறியலாம்.,11
சோழர்_கால_அரசியல்_தலைவர்கள்,இவன் மகன் சூரைகாயகன் மாதவராயன் என்பவன் இம்மணவிற் கூத்தனுக்கு மகன் என்று தெரிய வருகிறது.,11
சோழர்_கால_அரசியல்_தலைவர்கள்,திருப்பாசூரிலுள்ள கல்வெட்டொன்று இம்மாதவராயன் செய்த சிவத்தொண்டினைக் குறிப்பிடுகிறது.,6
சோழர்_கால_அரசியல்_தலைவர்கள்,இவன் விக்கிரம சோழனது ஆட்சியில் இருந்தவன்.,5
சோழர்_கால_அரசியல்_தலைவர்கள்,இவனும் இவன் தந்தையைப் போல் சிவபக்தியில் சிறந்து விளங்கியவன் என்பது அறியத்தகும்.,9
சோழர்_கால_அரசியல்_தலைவர்கள்,"முடிப்புரை முதற்குலோத்துங்கனும், விக்கிரம சோழனும் பல சிவப்பணிகளை ஆற்றியுள்ளனர்.",7
சோழர்_கால_அரசியல்_தலைவர்கள்,விக்கிரமசோழனது தில்லைத்திருப்பணிகளைத் திருமழபாடிச் சாசனம் ஆறு விளக்கமாகக் கூறுகிறது.,7
சோழர்_கால_அரசியல்_தலைவர்கள்,திருக்கோயில் என்ற திங்களிதழில் வெளிவந்தது.,4
சோழர்_கால_அரசியல்_தலைவர்கள்,பண்டாரத்தார் சோழர் வரலாறு பகுதி பதினொன்று  பக்கம் எழுபத்தேழு.,7
சோழர்_கால_அரசியல்_தலைவர்கள்,வேளாளர் சிறப்பு வேளாளர் என்பவர்கள் வள்ளன்மையால் மிக்கிருக்கும் தாளாளர் என்று ஞானசம்பந்தரால் புகழப் பெற்றவர்கள்.,11
சோழர்_கால_அரசியல்_தலைவர்கள்,உழுதுண்டு வாழ்வாரே வாழ்வார் என்று சிறப்பிக்கப் பெற்றவர்கள் இவர்கள்.,7
சோழர்_கால_அரசியல்_தலைவர்கள்,மேலும் வேளாளர்கள் பாராளும் திறலரசருக்கு வெற்றி விளைவிக்கும் தானைத் தலைவர்களாகவும் விளங்கினர்.,9
சோழர்_கால_அரசியல்_தலைவர்கள்,சேக்கிழார்குடி தொண்டை நாட்டு இருபத்து நான்கு கோட்டங்களுள் புலியூர்க் கோட்டத்தைச் சேர்ந்த திரு ஆம் ஊர் குன்றத்தூர்.,13
சோழர்_கால_அரசியல்_தலைவர்கள்,"இவர்கள் அறிவு, ஒழுக்கம், சீலம், வாய்மை முதலிய நற்பண்புகள் உடையராய்ச் சிவபக்தியில் சிறந்து வாழ்ந்தனர்.",11
சோழர்_கால_அரசியல்_தலைவர்கள்,அருண் மொழித் தேவர் அன்னோருள் சேக்கிழார் குடியில் வெள்ளியங் கிரியார் என்ற ஒருவர் வாழ்ந்து வந்தார்.,12
சோழர்_கால_அரசியல்_தலைவர்கள்,அவருடைய மனைவியார் அழகாம்பிகை எனப் பெற்றர்.,5
சோழர்_கால_அரசியல்_தலைவர்கள்,எங்கள் பாக்கியப் பயனால் இவர்களுக்கு ஒரு ஆண் மகவு பிறந்தது.,8
சோழர்_கால_அரசியல்_தலைவர்கள்,அக்குழந்தைக்கு அருண் மொழித் தேவர் எனப் பெயர் சூட்டப்பட்டது.,7
சோழர்_கால_அரசியல்_தலைவர்கள்,அருண்மொழித் தேவன் என்பது சோழ அரசர்களுள் முதலாம் இராசராச சோழனுடைய பெயர் இராசராசனும் சிவபக்தியில் சிறந்தவன்.,12
சோழர்_கால_அரசியல்_தலைவர்கள்,சிறந்த சிவபக்தியுடைய வெள்ளியங் கிரியாரும் தம் அருமை மைந்தற்குப் பண்டு வாழ்ந்த சோழ அரசனது பெயரையே இட்டார்.,13
சோழர்_கால_அரசியல்_தலைவர்கள்,அந்நாளில் அருண் மொழித்தேவர் என்ற பெயர் பலரும் பூண்டிருந்ததாகவும் தெரியவருகிறது.,8
சோழர்_கால_அரசியல்_தலைவர்கள்,எனவே இப்பெயர் சேக்கிழாருக்குப் பெற்றாேரிட்ட பெயராகவும் கொள்ளலாம்.,6
சோழர்_கால_அரசியல்_தலைவர்கள்,இனி இப்பெயரைக் காரணப் பெயராகக் கொள்ளினும் அமையும்.,6
சோழர்_கால_அரசியல்_தலைவர்கள்,சேக்கிழார் பாடிய நூலாகிய பெரிய புராணம் திரு அருள் வாய் மொழி ஆகும்.,10
சோழர்_கால_அரசியல்_தலைவர்கள்,ஆகவே இவருக்கு அருள் மொழித்தேவரென்ற பெயர் வந்ததெனவும் கொள்ளலாம்.,7
