work_title,sentence,sentence_length
சோழர்_கால_அரசியல்_தலைவர்கள்,இப்பொய்கைநாடு கிழவன் முதலாம் இராசராசனின் ஒன்பது ஆவது ஆட்சியாண்டாகிய கி.,8
சோழர்_கால_அரசியல்_தலைவர்கள்,அக்கல்லெழுத்தில் பொய்கைநாடு கிழவன் ஆதித்தன் சூரியனை தென்னவன் மூவேந்த வேளான் என்று குறிக்கப் பெற்றுள்ளான்.,11
சோழர்_கால_அரசியல்_தலைவர்கள்,முதல் இராசராசனது இருபத்தொன்பது ஆம் ஆட்சியாண்டுக் கல்லெழுத்துக்களிலும் முதல் ராசேந்திரசோழனது மூன்று ஆவது ஆட்சியாண்டுக் கல்லெழுத்துக்களிலும் கி.,13
சோழர்_கால_அரசியல்_தலைவர்கள்,இவன் சிறந்த சிவபக்தி யுடையவன்.,4
சோழர்_கால_அரசியல்_தலைவர்கள்,இவன் தன் வாழ்நாளில் சிவனடியார்களிடத்தும் அரசனிடத்தும் ஒப்பற்ற அன்பு பூண்டொழுகியவன்.,8
சோழர்_கால_அரசியல்_தலைவர்கள்,"ஆதலின், இவனது சிறந்த பண்புகளையறிந்து, இராசராசன் இராசராசேச்சுரத்தில் ஸ்ரீகாரியஞ்செய்யும் வேலையில் இவனை அமர்த்தினன் என்னலாம்.",11
சோழர்_கால_அரசியல்_தலைவர்கள்,தொள்ளாயிரத்து எண்பத்தைந்து ல் திருச்சோற்றுத்துறை மகாதேவர் கோவிலுக்குப் பொய்கை நாடு கிழவன் சில அறங்கள் செய்துள்ளான் என்றும் அறியப்படுகிறது.,14
சோழர்_கால_அரசியல்_தலைவர்கள்,இதில் திருப்பதியம் பாடுவார்க்குப் பொன் அளித்துள்ளமை குறிப்பிடத் தக்கது.,7
சோழர்_கால_அரசியல்_தலைவர்கள்,விளக்கம் வருமாறு ஒன்று.,3
சோழர்_கால_அரசியல்_தலைவர்கள்,குறுவானியக் குடியாகிய பதிமூன்று  பரகேசரிபுரத்து நகரத்தார்.,5
சோழர்_கால_அரசியல்_தலைவர்கள்,"பரகேசரிபுரத்து நகரத்தார் கொடுத்தது திருகு ஒன்று உள்பட பட்டைக்காறை ஒன்று, பொன் முக்காலே குன்றி.",11
சோழர்_கால_அரசியல்_தலைவர்கள்,"ருத்ராக்ஷச்சுரி பொன்னின் நூலிற் கோத்த ருத்ராக்ஷம் ஒன்று உள்பட நிறை ஆறு மஞ்சாடியும் இரண்டுமா, விலை காசு ஒன்று.",14
சோழர்_கால_அரசியல்_தலைவர்கள்,கண்டிகை ருத்ராக்ஷம் ஒன்றும் சுரி ஒன்றும் நிறை ஐங்கழஞ்சே மஞ்சாடியும் குன்றி விலை காசு எட்டு.,12
சோழர்_கால_அரசியல்_தலைவர்கள்,ருத்ராக்ஷச்சுரி பொன்னின் நூலிற் கோத்த ருத்ராக்ஷம் ஒன்றுட்பட நிறை கழஞ்சே மஞ்சாடியும் குன்றிக்கு விலை ஒன்று காசு.,13
சோழர்_கால_அரசியல்_தலைவர்கள்,"திருப்பொற்பூ ஒன்று, பொன்கழஞ்சே குன்றி.",4
சோழர்_கால_அரசியல்_தலைவர்கள்,"திருக்கைக் காறை ஒன்று, பொன் இரு கழஞ்சே குன்றி.",7
சோழர்_கால_அரசியல்_தலைவர்கள்,"திருக்கைக் காறை ஒன்று, பொன் ஒன்று கழஞ்சே நான்கு மஞ்சாடி.",8
சோழர்_கால_அரசியல்_தலைவர்கள்,"திருப்பட்டிகை ஒன்று, பொன் இருகழஞ்சு.",4
சோழர்_கால_அரசியல்_தலைவர்கள்,"திருக்குதம்பை ஒன்று, பொன் எட்டு மஞ்சாடி ஏழு மாவாக இரண்டினால் பொன் கழஞ்சு இரண்டு மஞ்சாடி நான்கு மா.",14
சோழர்_கால_அரசியல்_தலைவர்கள்,தேவாரதேவர் திருமேனி பதினைந்து  இப்பிரதிமம் பெரிய பெருமாள் திருமுன் வைக்கப்பட்டிருத்தல் கூடும்.,9
சோழர்_கால_அரசியல்_தலைவர்கள்,இத்திருமேனி சந்திரசேகரர் எனப் பெறுவார்.,4
சோழர்_கால_அரசியல்_தலைவர்கள்,ஒரு விரல் சுற்றில் கனமாகச் செம்பால் செய்த பிரபை ஒன்றும் இத்திருமேனியைக் கவித்து இருந்தது.,11
சோழர்_கால_அரசியல்_தலைவர்கள்,"இவர்க்குப் பொய்கைநாடு கிழவன் கொடுத்தன திருக்குதம்பை ஒன்று, பொன் ஏழு மஞ்சாடியும் குன்றியாக இரண்டினால் பொன் முக்கால் கழஞ்சு.",14
சோழர்_கால_அரசியல்_தலைவர்கள்,"திருக்கைக் காறை ஒன்று, பொன் கழஞ்சே இரண்டு மஞ்சாடியும் மூன்றுமா.",8
சோழர்_கால_அரசியல்_தலைவர்கள்,"திருக்கைக்காறை ஒன்று, பொன் கழஞ்சே எட்டுமா.",5
சோழர்_கால_அரசியல்_தலைவர்கள்,விளக்குகளை அளித்தமை மேற்குறித்த ஆறு பிரதிமங்களும் ஒரு திருமேனியும் இராசராசசோழனது இருபத்தொன்பது ஆம் ஆட்சியாண்டில் எழுந்தருளுவிக்கப் பெற்றன.,13
சோழர்_கால_அரசியல்_தலைவர்கள்,பலம் எடையுள்ள வெண்கல மடல் ஒன்றும் அளித்துள்ளான்.,6
சோழர்_கால_அரசியல்_தலைவர்கள்,பதினெட்டு  வெண்கல மடல் இப்பிரதிமங்களை வணங்க வருவார்க்குத் திருநீறு அளித்தற் பொருட்டுக் கொடுக்கப்பட்டது போலும் !,11
சோழர்_கால_அரசியல்_தலைவர்கள்,இருபத்தொன்று அரசன் இவரது சிவபக்தியை அறிந்து இவர்க்கு ஓய்வு அளித்தார்.,8
சோழர்_கால_அரசியல்_தலைவர்கள்,இவர் திருச்செங்காட்டங்குடியில் இருந்து அடியார்களுக்குத் திருவமுது அளித்துவரும் தொண்டில் ஈடுபட்டிருந்தார்.,8
சோழர்_கால_அரசியல்_தலைவர்கள்,இவரது வாழ்க்கைத் துணைவியார் திருவெண் காட்டுநங்கை எனப் பெறுவர்.,7
சோழர்_கால_அரசியல்_தலைவர்கள்,இந்த சேஷத்திரபால தேவரே சிறுத்தொண்டருக்குக் காட்சி கொடுத்த தேவராக எழுந்தருளுவிக்கப் பெற்றார் எனக்கோடல் பொருந்தும்.,11
சோழர்_கால_அரசியல்_தலைவர்கள்,"முப்பத்தேழு முத்துக்கள் கோத்த முத்துவடம் ஒன்று, நிறை எட்டு மஞ்சாடி விலே காசு.",10
சோழர்_கால_அரசியல்_தலைவர்கள்,சிறுத்தொண்ட நம்பி பாதாதிகேசாந்தம் பதினேழு  விரல் உயரத்து இரண்டு கையுடையவர்.,8
சோழர்_கால_அரசியல்_தலைவர்கள்,திருவெண்காட்டு நங்கை பாதாதி கேசாந்தம் பதினைந்து  விரல் உயரத்து இரண்டு கை உடையவர்.,10
சோழர்_கால_அரசியல்_தலைவர்கள்,இவர்க்குப் பொய்கைநாடு கிழவன் கொடுத்தது பட்டைக்காறையிற் கோத்த தாலி உட்படப் பொன் ஒன்பது மஞ்சாடியும் குன்றி.,12
சோழர்_கால_அரசியல்_தலைவர்கள்,சீராள தேவர் பாதாதி கேசாந்தம் பனிரண்டு  விரல் உயரத்து இரண்டு கையுடையவர்.,9
சோழர்_கால_அரசியல்_தலைவர்கள்,மெய்ப்பொருள் நாயனார் இருபத்திரண்டு மெய்ப்பொருள் நாயனாருடைய படிவத்தைப் பொய்கைநாடு கிழவன் எழுந்தருளுவித்திருக்கிறான்.,9
சோழர்_கால_அரசியல்_தலைவர்கள்,நாயனர் தத்தா நமரே காண் என்று கூறித் தத்தனை விலக்கினார்.,8
சோழர்_கால_அரசியல்_தலைவர்கள்,முன்ளனாலும் பின்னாளிலும் இவ்வலுவலில் பலர் இருந்திருப்பினும் பொய்கை நாடு கிழவன் போன்று சிலைமேல் எழுத்தில் நின்றவர் சிலரே.,13
சோழர்_கால_அரசியல்_தலைவர்கள்,பொய்கை நாடு கிழவன்போன்று இந்நாள் இறைபணியாளர் தொண்டாற்றிச் சைவர் நெஞ்சில் நிலை பெறுவாராகுக.,10
சோழர்_கால_அரசியல்_தலைவர்கள்,இது ஞானசம்பந்தத்தில் வெளி வந்தது.,4
சோழர்_கால_அரசியல்_தலைவர்கள்,முப்பத்தெட்டு நாற்பத்தொன்று தோரை நெல்,4
சோழர்_கால_அரசியல்_தலைவர்கள்,"இரண்டு குன்றி ஒன்று மஞ்சாடி, இருபது மஞ்சாடி ஒன்று கழஞ்சு.",8
சோழர்_கால_அரசியல்_தலைவர்கள்,இது இராசேந்திர சிங்க வளநாட்டில் இருந்த ஊர் தஞ்சை ராசராசேச்சுரத்துத் தேவதானங்களுள் ஒன்று.,10
சோழர்_கால_அரசியல்_தலைவர்கள்,இதுவும் இராசராசேச்சுரமுடையார் தேவதானம் நித்த வினோதவளநாட்டது.,5
சோழர்_கால_அரசியல்_தலைவர்கள்,"கடவுள் வடிவம் திருமேனி என்றும், மக்கள் வடிவம் பிரதிமம் என்றும் வழங்கப்பெறும்.",9
சோழர்_கால_அரசியல்_தலைவர்கள்,"தரா எட்டுப் பாகம் செம்பும், ஐந்து பாகம் காரீயமும் கலந்த உலோகம்.",9
சோழர்_கால_அரசியல்_தலைவர்கள்,மன்னவர்க்குத் தண்டுபோய் என்ற பெரிய புராணம் சிறுத்தொண்ட புராணம் செ.,8
சோழர்_கால_அரசியல்_தலைவர்கள்,இவ்வாசிரியர் வெளியிட்ட இலக்கியக்கேணி என்ற நூலுள் தத்தா நமரே காண் என்ற கட்டுரை காண்க.,11
சோழர்_கால_அரசியல்_தலைவர்கள்,﻿சயங்கொண்டசோழப் பிரமாதிராசன் மணிமங்கலம் இது செங்கற்பட்டு மாவட்டம் சைதாப்பேட்டை வட்டத்தில் பல்லாவரத்துக்கு அருகில் இருக்கும் ஓர் ஊர்.,13
சோழர்_கால_அரசியல்_தலைவர்கள்,சளுக்கிய அரசனாகிய இரண்டாம் புலிகேசியை முதலாம் நரசிம்மவர்மன் தோல்வியுறச் செய்த போர்க்களங்களுள் இஃதொன்று.,10
சோழர்_கால_அரசியல்_தலைவர்கள்,இவ்வூரில் மூன்று திருமால் கோட்டங்களும் இரண்டு சிவன் திருக்கோயில்களும் உள்ளன.,8
சோழர்_கால_அரசியல்_தலைவர்கள்,இராச கோபாலப் பெருமாள் கோயிலில் ஏறத்தாழப் பதினான்கு கல்வெட்டுக்கள் உள்ளன.,8
சோழர்_கால_அரசியல்_தலைவர்கள்,அவையாவும் சோழர் காலத்தவை.,3
சோழர்_கால_அரசியல்_தலைவர்கள்,இம் மணிமங்கலம் வட மொழியில் ரத்நாக்ரஹாரா என்றும் ரத்நக் கிராமா என்றும் குறிக்கப் பெற்றுளது.,11
சோழர்_கால_அரசியல்_தலைவர்கள்,பெற்றாேர் இம்மணிமங்கலத்தில் செயங்கொண்ட சோழப் பிரமாதிராசன் என்ற பெயருடைய சேனைத்தலைவன் ஒருவன் வாழ்ந்து வந்தான்.,11
சோழர்_கால_அரசியல்_தலைவர்கள்,இவன் இரண்டாம் இராசேந்திரனுடைய நான்காம் ஆட்சி யாண்டுக் கல்வெட்டிலும் கி.,8
சோழர்_கால_அரசியல்_தலைவர்கள்,"ஓர் ஆயிரத்து ஐம்பத்து நான்கு, வீர ராசேந்திர சோழனுடைய ஐந்தாம் ஆட்சியாண்டுக் கல்வெட்டிலும் கி.",11
சோழர்_கால_அரசியல்_தலைவர்கள்,ஓர் ஆயிரத்து அறுபத்தெட்டு குறிக்கப் பெற்றிருக்கிறான்.,5
சோழர்_கால_அரசியல்_தலைவர்கள்,"சேனாபதி வீர ராசேந்திரனுடைய கல்வெட்டில், இவ்வூர் ஜிவிதமுடைய சேனாபதிகள் ஜெயங்கொண்ட சோழப் பிரம்மாதிராஜர் என்று இவன் குறிக்கப்பட்டுள்ளான்.",13
சோழர்_கால_அரசியல்_தலைவர்கள்,சயங்கொண்ட சோழன் ஒன்று என்பது முதலாம் இராசாதிராசனுடைய சிறப்புப் பெயர்களுள்ளும் ஒன்று.,9
சோழர்_கால_அரசியல்_தலைவர்கள்,இருபத்தெட்டு என்ற இரண்டாம் இராசாதி ராச சோழனுடைய இருபத்தொன்பது ஆம் ஆட்சி யாண்டுக் கல்வெட்டினின்று அறியலாம் கி.,13
சோழர்_கால_அரசியல்_தலைவர்கள்,ஜெயசிம்ம குலாந்தக னென்பது மேலைச் சளுக்கியர் குலத்துக்குக் காலன் போன்றவன் என்று பொருள்படும்.,10
சோழர்_கால_அரசியல்_தலைவர்கள்,எனவே மேலேச்சளுக்கியர்களோடு இடையீடின்றிப் போருடற்றிய இராசாதிராசனுக்கு இச்சிறப்புப் பெயர் இருந்திருத்தல் கூடும்.,9
சோழர்_கால_அரசியல்_தலைவர்கள்,பிரம்மாதிராஜர் என்ற பட்டம் அளிக்கப் பெற்றமையின் இவர்கள் பிராமணர்கள் என்பது தெளிவு.,9
சோழர்_கால_அரசியல்_தலைவர்கள்,அரசியல் அதிகாரிகளுக்கு அரசாங்கப் பொருள் நிலையத்திலிருந்து சம்பளம் கொடுக்கும் பழக்கம் முன்னாளில் இல்லை.,10
சோழர்_கால_அரசியல்_தலைவர்கள்,அவரவர் தகுதிக்கேற்ப அன்னேர் வானாள் முழுதும் அனுபவித்துக் கொள்ளுமாறு சோழ மன்னர்களால் நிலம் அளிக்கப்பெற்றது.,11
சோழர்_கால_அரசியல்_தலைவர்கள்,அங்ஙனம் அளிக்கப் பெற்ற நிலம் ஜீவிதம் எனப்படும்.,6
சோழர்_கால_அரசியல்_தலைவர்கள்,அன்னோர் மக்களுக்கு இதில் சிறிதும் உரிமையில்லை.,5
சோழர்_கால_அரசியல்_தலைவர்கள்,"பண்டாரத்தார் சோழர் வரலாறு, பாகம் நூற்றி பதினொன்று .",6
சோழர்_கால_அரசியல்_தலைவர்கள்,காமக்கவ்வையள் தருமம் இவ்வம்மையார் செயங்கொண்ட சோழப் பிரமாதி ராசனின் தாயார்.,8
சோழர்_கால_அரசியல்_தலைவர்கள்,இச்செய்தி இரண்டாம் இராசேந்திரனுடைய நான்கு ஆம் ஆட்சியாண்டுக்குரிய மணி மங்கலத்துச் சாசனத்தினின்று அறியப்பெறும்.,10
சோழர்_கால_அரசியல்_தலைவர்கள்,அமண்பாக்க மென்பது மணிமங்கலமாகிய இராசசூளாமணிச் சதுர்வேதி மங்கலத்துத் தென்பிடாகை அதாவது அச்சதுர்வேதி மங்கலத்துத் தெற்குப்பகுதியிலிருந்த உட்கிடையூர்.,12
சோழர்_கால_அரசியல்_தலைவர்கள்,அமண் பாக்கம் என்பது இந்நாளைய மணிமங்கலத்துக் கோயிலுக்குத் தெற்கிலுள்ள அம்மணம் பாக்கம் ஆகும்.,10
சோழர்_கால_அரசியல்_தலைவர்கள்,ஸ்வம் என்பது பொருள் என்று பொருள்படும்.,5
சோழர்_கால_அரசியல்_தலைவர்கள்,இது சொம்மு என்ற தெலுங்கச் சொல்லோடு தொடர்புடையதாகக் காணப் பெறும்.,8
சோழர்_கால_அரசியல்_தலைவர்கள்,இச் சொல் ஸ்ரீகுமரகுருபர சுவாமிகளால் சொம் என்ற உருவில் இரண்டிடங்களில் எடுத்தாளப் படுகிறது.,10
சோழர்_கால_அரசியல்_தலைவர்கள்,முதல் இராசராச சோழன் காலமுதற் கொண்டு கீழைச் சளுக்கியரோடு சோழர்கள் மணமுறையால் பிணிக்கப்பட்டிருந்தனர் என்பது தெரிந்ததே.,12
சோழர்_கால_அரசியல்_தலைவர்கள்,"ஆகவே தெலுங்க நாட்டிலிருந்து போந்தவருட் சிலர் சோழர்களுக்குத் தானைத் தலைவர்களாகவும், மண்டலத் தலைவர்களாகவும் இருந்துள்ளனர்.",11
சோழர்_கால_அரசியல்_தலைவர்கள்,எனவே மஞ்சிப் பயன் என்ற பெயர் ஆந்திரர்களுக்குரிய பெயராகக் காணப்படுகிறது.,8
சோழர்_கால_அரசியல்_தலைவர்கள்,மஞ்சிப் பயனாருடைய மனைவியின் பெயரில் கண்ட அக்க என்ற பகுதியும் தெலுங்கில் தமக்கை என்ற பொருளது.,12
சோழர்_கால_அரசியல்_தலைவர்கள்,மஞ்சிப் பயனாரும் தொண்டை மண்டலத்தில் நிலையாக வாழ்ந்தவர்.,6
சோழர்_கால_அரசியல்_தலைவர்கள்,இந் நாளிலும் மணிமங்கலத்தைச் சார்ந்த சிற்றூர்கள் பலவற்றிலும் தெலுங்க மொழி பேசும் அந்தணர் குடும்பங்கள் பல இருக்கின்றன.,13
