work_title,sentence,sentence_length
சிறந்த_கதைகள்_பதிமூன்று,ஒரு பையன் செய்யக் கூடிய எல்லா வேலைகளையும் அவள் செய்தாள்.,8
சிறந்த_கதைகள்_பதிமூன்று,சில சமயம் சிறப்பாகவே செய்தாள்.,4
சிறந்த_கதைகள்_பதிமூன்று,அவள் மிகச் சின்னவளாக இருந்த போதே அவள் அம்மா ﻿இறந்து போனாள்.,9
சிறந்த_கதைகள்_பதிமூன்று,"பாட்டி, ஒரு பெண் அறிய வேண்டிய அனைத்தையும் அவளுக்குக் கற்றுக் கொடுத்தாள்.",9
சிறந்த_கதைகள்_பதிமூன்று,தாத்தாவுக்கும் பாட்டிக்கும் எழுதப் படிக்கத் தெரியாது.,5
சிறந்த_கதைகள்_பதிமூன்று,ஆகவே சீதாவுக்கும் படிக்கவோ எழுதவோ தெரியாது.,5
சிறந்த_கதைகள்_பதிமூன்று,ஆற்றுக்கு அப்பால் ஒரு ஊரில் ஒரு பள்ளிக்கூடம் இருந்தது.,7
சிறந்த_கதைகள்_பதிமூன்று,ஆனால் சீதா அதைப் பார்த்ததேயில்லை.,4
சிறந்த_கதைகள்_பதிமூன்று,தீவில் அவளுக்கு ஏகப்பட்ட வேலைகள் இருந்தன.,5
சிறந்த_கதைகள்_பதிமூன்று,"தாத்தா தனது வலையைச் சீர்படுத்திக்கொண்டிருந்த போது, சீதா குடிசைக்குள் இருந்தாள்.",8
சிறந்த_கதைகள்_பதிமூன்று,பாட்டியின் நெற்றியைப் பிடித்து விட்டுக் கொண்டிருந்தாள்.,5
சிறந்த_கதைகள்_பதிமூன்று,பாட்டியின் உடல் சுரத்தால் கொதித்தது.,4
சிறந்த_கதைகள்_பதிமூன்று,மூன்று நாட்களாகவே பாட்டிக்கு நோய் எதுவும் சாப்பிட முடியவில்லை.,7
சிறந்த_கதைகள்_பதிமூன்று,முன்பும் அவள் சீக்காக இருந்திருக்கிறாள் ஆனால் இவ்வளவு மோசமாக இல்லை.,8
சிறந்த_கதைகள்_பதிமூன்று,பாட்டி தூங்கியதும் சீதா மெதுவாக அறைக்குள்ளிருந்து வெளியே வந்து நின்றாள்.,8
சிறந்த_கதைகள்_பதிமூன்று,மழைக்கால மேகங்களால் வானம் இருண்டிருந்தது.,4
சிறந்த_கதைகள்_பதிமூன்று,இரவு முழுவதும் மழை பெய்திருந்தது.,4
சிறந்த_கதைகள்_பதிமூன்று,இன்னும் சிறிது நேரத்தில் மீண்டும் மழைபெய்யும்.,5
சிறந்த_கதைகள்_பதிமூன்று,"அந்த வருடம் பருவ மழை சீக்கிரமாகவே, ஜூன் இறுதியிலேயே, வந்துவிட்டது.",8
சிறந்த_கதைகள்_பதிமூன்று,இப்போது ஜூலை கடைசி.,3
சிறந்த_கதைகள்_பதிமூன்று,ஏற்கெனவே ஆறு பொங்கிப் புரண்டது.,4
சிறந்த_கதைகள்_பதிமூன்று,"அது பாய்ந்து வரும் ஓசை மிக நெருங்கியும், வழக்கத்தைவிட மிக அச்சம் தருவதாகவும் இருந்தது.",11
சிறந்த_கதைகள்_பதிமூன்று,சீதா தாத்தா அருகில் சென்றாள்.,4
சிறந்த_கதைகள்_பதிமூன்று,அரசமரத்தின் கீழே அவருக்குப் பக்கத்தில் உட்கார்ந்தாள்.,5
சிறந்த_கதைகள்_பதிமூன்று,உனக்குப் பசிக்கிற போது சொல்.,4
சிறந்த_கதைகள்_பதிமூன்று,ரொட்டி சுட்டுத் தருவேன் என்றான் அவன்.,5
சிறந்த_கதைகள்_பதிமூன்று,உன் பாட்டி தூங்கிவிட்டாளா?,3
சிறந்த_கதைகள்_பதிமூன்று,ஆனால் சீக்கிரம் விழித்து விடுவாள்.,4
சிறந்த_கதைகள்_பதிமூன்று,அவளுக்கு நோவு அதிகம்.,3
சிறந்த_கதைகள்_பதிமூன்று,"கிழவர் ஆற்றுக்கும் அப்பால், காட்டின் இருண்ட பசுமையையும், சாம்பல் நிற வானத்தையும், உற்று நோக்கினார்.",11
சிறந்த_கதைகள்_பதிமூன்று,"நாளைக்கு அவள் குணம் அடையாவிட்டால், ஷாகன்ஞ் நகர ஆஸ்பத்திரிக்கு அவளை இட்டுப் போவேன்.",10
சிறந்த_கதைகள்_பதிமூன்று,அவளை எப்படிக் குணப்படுத்துவது என்பது அங்கு இருப்பவர்களுக்குத் தெரியும்.,7
சிறந்த_கதைகள்_பதிமூன்று,நீ சில தினங்கள் தனியாக இருக்க வேண்டும்.,6
சிறந்த_கதைகள்_பதிமூன்று,சீதா சிரத்தையாகத் தலையாட்டினாள்.,3
சிறந்த_கதைகள்_பதிமூன்று,பாட்டி குணம் அடைய வேண்டும்.,4
சிறந்த_கதைகள்_பதிமூன்று,ஆற்றில் நீரோட்டம் வேகமாக இருக்கையிலும் சிறு படகை வலித்துச் செல்லும் சக்தி தாத்தாவுக்கு இருந்தது.,11
சிறந்த_கதைகள்_பதிமூன்று,இதை அவள் அறிவாள்.,3
சிறந்த_கதைகள்_பதிமூன்று,வீட்டில் உள்ள தங்கள் சிறிது உடைமைகளைக் கண்காணிக்க யாராவது ஒருவர் அங்கு இருந்தாக வேண்டும்.,11
சிறந்த_கதைகள்_பதிமூன்று,﻿ தனித்து இருப்பதற்கு சீதா அஞ்சவில்லை.,5
சிறந்த_கதைகள்_பதிமூன்று,ஆனால் ஆற்றின் போக்கு அவளுக்குப் பிடிக்கவில்லை.,5
சிறந்த_கதைகள்_பதிமூன்று,"அன்று காலை, தண்ணிர் எடுத்து வரப் போனபோது, ஆற்றில் தண்ணர் அதிகரித்திருந்ததை அவள் கவனித்தாள்.",11
சிறந்த_கதைகள்_பதிமூன்று,வழக்கமாய் பறவைகளின் எச்சங்கள் சிதறிக் கிடக்கும் பாறைகள் திடீரென்று மறைந்து விட்டன.,9
சிறந்த_கதைகள்_பதிமூன்று,"தாத்தா, ஆறு பெருகி வந்தால் நான் என்ன செய்வேன்?",7
சிறந்த_கதைகள்_பதிமூன்று,மேடான பகுதியில் நின்றுகொள்.,3
சிறந்த_கதைகள்_பதிமூன்று,மேட்டுப் பகுதிக்கும் தண்ணிர் வந்துவிட்டால்?,4
சிறந்த_கதைகள்_பதிமூன்று,கோழிகளைக் குடிசைக்குள் கொண்டு போ.,4
சிறந்த_கதைகள்_பதிமூன்று,நீயும் உள்ளேயே இரு.,3
சிறந்த_கதைகள்_பதிமூன்று,குடிசைக்குள் தண்ணிர் வந்தால்?,3
சிறந்த_கதைகள்_பதிமூன்று,அரசமரத்தின் மேலே ஏறு.,3
சிறந்த_கதைகள்_பதிமூன்று,அது வலிமையான மரம்.,3
சிறந்த_கதைகள்_பதிமூன்று,தண்ணிரும் அவ்வளவு உயரம் வராது.,4
சிறந்த_கதைகள்_பதிமூன்று,"ஆடுகளை நான் கொண்டு போவேன், சீதா.",5
சிறந்த_கதைகள்_பதிமூன்று,"அவற்றை விற்க நேரலாம், உன் பாட்டிக்கு உணவுக்கும் மருத்துக்கும் செலவுபண்ண.",8
சிறந்த_கதைகள்_பதிமூன்று,"கோழிகளை, அவசியப்பட்டால், கூரை மேலே விட்டுவை.",5
சிறந்த_கதைகள்_பதிமூன்று,ஆனால் அதி கமாகக் கவலைப்படாதே.,4
சிறந்த_கதைகள்_பதிமூன்று,"தண்ணிர் அவ்வளவு அதிகம் வராது என்று, அவர் சீதாவின் தலையைத் தடவிக் கொடுத்தார்.",10
சிறந்த_கதைகள்_பதிமூன்று,⁠ ⁠ அன்று மாலை மீண்டும் மழை பெய்தது.,7
சிறந்த_கதைகள்_பதிமூன்று,பெரிய பெரிய துளிகள் ஆற்றின் பர்ப்பை வகுப்படுத்தின.,6
சிறந்த_கதைகள்_பதிமூன்று,ஆனால் கதகதப்பான மழை.,3
சிறந்த_கதைகள்_பதிமூன்று,சீதா அதில் சஞ்சரித்தாள்.,3
சிறந்த_கதைகள்_பதிமூன்று,நனைவது பற்றி அவள் பயப்படவில்லை.,4
சிறந்த_கதைகள்_பதிமூன்று,அது அவளுக்குப் பிடித்திருந்தது.,3
சிறந்த_கதைகள்_பதிமூன்று,குடிசைக்குள் புழுக்கமாக இருந்தது.,3
சிறந்த_கதைகள்_பதிமூன்று,அடுப்புத் தீயின் வெப்பத்தில் அவளுடைய மெல்லிய ஆடை சீக்கிரம் உலர்ந்து விடும்.,9
சிறந்த_கதைகள்_பதிமூன்று,"அவள் கொட்டுகிற மழையில் திரிந்து, கோழிகளைத் துரத்தி, குடிசைக்குப் பின்னால் இருந்த ஒரு கூண்டுக்குள் அடைத்தாள்.",12
சிறந்த_கதைகள்_பதிமூன்று,"தீங்கற்ற கபிலநிறப்பாம்பு ஒன்று, வளைக்குள் வெள்ளம் புகுந்ததால் வெளிப் பட்டு, திறந்த வெளியில் ஒடியது.",11
சிறந்த_கதைகள்_பதிமூன்று,"சீதா ஒரு கம்பை எடுத்து, பாம்பைத் துாக்கி, பாறைக் குவியல்களுக்கு இடையில் போட்டாள்.",10
சிறந்த_கதைகள்_பதிமூன்று,பாம்புகளிடம் அவளுக்கு விரோதம் இல்லை.,4
சிறந்த_கதைகள்_பதிமூன்று,அவை எலிகளும் தவளைகளும் பெருகி விடாது தடுத்தன.,6
சிறந்த_கதைகள்_பதிமூன்று,"முடிவில் சீதா குடிசைக்குள் போனபோது, அவளுக்குப் பசித்தது.",6
சிறந்த_கதைகள்_பதிமூன்று,வறுத்த பயறை அவள் தின்றாள்.,4
சிறந்த_கதைகள்_பதிமூன்று,சிறிது ஆட்டுப் பாலைக் காய்ச்சினாள்.,4
சிறந்த_கதைகள்_பதிமூன்று,பாட்டி ஒருதரம் கண் விழித்தாள்.,4
சிறந்த_கதைகள்_பதிமூன்று,தாத்தா பித்தளைத் தம்ளரில் நீர் கொடுத்தார் ⁠ ⁠ ﻿ இரவு முழுவதும் மழை பெய்தது.,12
சிறந்த_கதைகள்_பதிமூன்று,தரையில் சிறிது நீர் தேங்கிநின்றது.,4
சிறந்த_கதைகள்_பதிமூன்று,தாத்தா மண்ணெண்ணெய் விளக்கை எரிய விட்டிருந்தார்.,5
சிறந்த_கதைகள்_பதிமூன்று,அவர்களுக்கு வெளிச்சம் தேவையில்லை.,3
சிறந்த_கதைகள்_பதிமூன்று,இருப்பினும் அது பாதுகாப்பாகத் தோன்றியது.,4
சிறந்த_கதைகள்_பதிமூன்று,ஆற்றின் ஒசை சதா அவர்களோடுதான் இருந்தது.,5
சிறந்த_கதைகள்_பதிமூன்று,ஆயினும் அதை அவர்கள் கவனிப்பதில்லை.,4
சிறந்த_கதைகள்_பதிமூன்று,ஆனால் அன்று இரவு அதன் ஒசையில் ஒரு மாற்றம் தெரிந்தது.,8
சிறந்த_கதைகள்_பதிமூன்று,"ஒரு புலம்பல் போல, நெட்டை மரங்களின் உச்சியில் காற்று சரசரப்பது போல், ஏதோ ஒன்று.",11
சிறந்த_கதைகள்_பதிமூன்று,பாறைகளைச் சுற்றி ஒடி சிறு கற்களை அடித்துச் செல்கையில் ஒரு வேக இரைச்சல் எழுந்தது.,11
சிறந்த_கதைகள்_பதிமூன்று,சில சமயம் மண் சரிந்து நீருக்குள் விழுந்த போது பேரோசை கேட்டது.,9
சிறந்த_கதைகள்_பதிமூன்று,சீதாவால் தூங்க முடியவில்லை.,3
சிறந்த_கதைகள்_பதிமூன்று,"கூரையின் சிறு வெளியின் ஊடாக விடிவின் ஒளி எட்டிப் பார்த்ததுமே, அவள் எழுந்து வெளியே போனாள்.",12
சிறந்த_கதைகள்_பதிமூன்று,பெரும் மழை இல்லை.,3
சிறந்த_கதைகள்_பதிமூன்று,ஆனால் நாட்கணக்கில் சிணுங்கக்கூடிய தூறல் அது.,5
சிறந்த_கதைகள்_பதிமூன்று,மலைகளில் ஆறு தொடங்கும் இடத்தில் கனத்த மழை பெய்து கொண்டிருக்கும் என்று தோன்றியது.,10
சிறந்த_கதைகள்_பதிமூன்று,சீதா தண்ணீர் ஒரத்துக்குப் போனாள்.,4
சிறந்த_கதைகள்_பதிமூன்று,அவளுக்குப் பிரியமான பாறை தென்படவில்லை.,4
சிறந்த_கதைகள்_பதிமூன்று,"பாறை இப்பவும் அங்கு தான் இருந்தது, சந்தேகமில்லை, ஆனால் ஆறு அதுக்கு மேல் ஒடியது.",11
சிறந்த_கதைகள்_பதிமூன்று,அவள் மணலில் நின்றாள்.,3
சிறந்த_கதைகள்_பதிமூன்று,அவளது பாதங்களுக்கு அடியில் நீர் சுரந்து குமிழியிடுவதை அவள் உணரமுடிந்தது.,8
சிறந்த_கதைகள்_பதிமூன்று,"சூரியன் உதயமாகும் வேளையில், தாத்தா படகை ஒட்டிச் சென்றார்.",7
சிறந்த_கதைகள்_பதிமூன்று,பாட்டி படகின் முன் பகுதியில் படுத்திருந்தாள்.,5
சிறந்த_கதைகள்_பதிமூன்று,அவள் சீதாவை உறுத்துப் பார்த்தாள்.,4
சிறந்த_கதைகள்_பதிமூன்று,ஏதோ சொல்ல முயன்றாள்.,3
சிறந்த_கதைகள்_பதிமூன்று,ஆனால் வார்த்தை வரவில்லை.,3
சிறந்த_கதைகள்_பதிமூன்று,கையை உயர்த்தி ஆசியளித்தாள்.,3
சிறந்த_கதைகள்_பதிமூன்று,"சீதா குனிந்து, பாட்டியின் பாதங்களைத் தொட்டாள்.",5
சிறந்த_கதைகள்_பதிமூன்று,உடனே தாத்தா படகை வலித்தார்.,4
சிறந்த_கதைகள்_பதிமூன்று,"அந்தச் சிறு படகு இரு முதியவர்களோடும் மூன்று ஆடுகளுடனும் ஆற்றின் மேலே வேகமாக நகர்ந்து, மறுகரை நோக்கி முன்னேறியது.",14
சிறந்த_கதைகள்_பதிமூன்று,"நீர் மீது துள்ளிச் சென்ற அது, சிறிது சிறிதாகி, முடிவில் விசாலமான ஆற்றின் மேலே ஒரு புள்ளியெனத் தோன்றியது.",14
சிறந்த_கதைகள்_பதிமூன்று,திடீரென்று சீதா தனிமையில் விடப்பட்டாள்.,4
சிறந்த_கதைகள்_பதிமூன்று,அது மழைத்துளிகளை அவள் முகத்தில் அறைந்தது.,5
சிறந்த_கதைகள்_பதிமூன்று,தண்ணீர் தீவைக் கடந்து பாய்ந்து சென்றது.,5
சிறந்த_கதைகள்_பதிமூன்று,தூரக் கரை இருந்தது.,3
சிறந்த_கதைகள்_பதிமூன்று,அது ﻿மழையினால் மறைக்கப்பட்டது.,3
சிறந்த_கதைகள்_பதிமூன்று,சிறு குடிசை இருந்தது மரமும் இருந்தது.,5
சிறந்த_கதைகள்_பதிமூன்று,அவள் சுறுசுறுப்பானாள்.கோழிகளுக்குத் தீனி போட வேண்டும்.,6
சிறந்த_கதைகள்_பதிமூன்று,அவை தீனி தவிர வேறு எதைப் பற்றியும் கவலைப்படுவதில்லை.,7
சிறந்த_கதைகள்_பதிமூன்று,"சிறிது தானியம், உருளைக்கிழங்குத் தோல், வேர்க்கடலைத் தோல் ஆகியவற்றை அவள் அவற்றிடம் வீசினாள்.",10
சிறந்த_கதைகள்_பதிமூன்று,பிறகு அவள் துடைப்பம் எடுத்து குடிசையைப் பெருக்கினாள்.,6
சிறந்த_கதைகள்_பதிமூன்று,கரி அடுப்பைப் பற்ற வைத்தாள்.,4
சிறந்த_கதைகள்_பதிமூன்று,"நாளை பால் இராது, என்று நினைத்தாள்.",5
சிறந்த_கதைகள்_பதிமூன்று,மலைகளிலிருந்து இடி உருண்டு இறங்கியது.,4
சிறந்த_கதைகள்_பதிமூன்று,பூம் பூம் பூம்... சீதா நெடுநேரம் உள்ளே இருக்க முடியவில்லை.,8
சிறந்த_கதைகள்_பதிமூன்று,ஆற்றை ஊடுருவிப் பார்த்தாள்.,3
சிறந்த_கதைகள்_பதிமூன்று,இப்போது அது அதிக அகலமாகத் தோன்றியது.,5
சிறந்த_கதைகள்_பதிமூன்று,"அது கரைகளைத் தாண்டி, சமவெளியினூடே வெகு தூரம் பரவியிருந்தது.",7
சிறந்த_கதைகள்_பதிமூன்று,"வெகு தூரத்தில், மக்கள் நீர் நிறைந்த, வெள்ளம் பரவிய வயல்கள் ஊடாகத் தங்கள் மாடுகளை ஒட்டிச் சென்றார்கள்.",13
சிறந்த_கதைகள்_பதிமூன்று,"தங்கள் உடைமைகளை மூட்டைகட்டித்தலைகளில் அல்லது தோள்களில் சுமந்தபடி, தங்கள் வீடுகளை விடுத்து, மேட்டு நிலம் தேடிப் போனார்கள்.",13
சிறந்த_கதைகள்_பதிமூன்று,எங்கும் தண்ணிர் மயம்.,3
சிறந்த_கதைகள்_பதிமூன்று,உலகமே ஒரு பெரிய ஆறு ஆகிவிட்டது.,5
சிறந்த_கதைகள்_பதிமூன்று,"ஆற்றின் வனப்பகுதியில் நின்ற மரங்கள் கூட, நீரிலேயே முளைத்தெழுந்த சதுப்புநில மரங்கள் போல் தோன்றின.",11
சிறந்த_கதைகள்_பதிமூன்று,சீதாவின் பயம் உறுதிப்பட்டது.,3
