work_title,sentence,sentence_length
சதுரங்கம்_விளையாடுவது_எப்படி,"யானைக்காய் தனக்கு நேராக உள்ள கட்டத்தில் நேராகப் போவது போல, ரதக்காய் குறுக்குக் கட்டம் வழியாகத்தான் போகும்.",13
சதுரங்கம்_விளையாடுவது_எப்படி,ஒரு சமயத்தில் ஒரு கட்டம் நகரலாம்.,5
சதுரங்கம்_விளையாடுவது_எப்படி,அல்லது ஒரே வாய்ப்பில் பல கட்டங்களும் கடந்து போகலாம்.,7
சதுரங்கம்_விளையாடுவது_எப்படி,"இடையே, தன் இனக்காய் ஏதாவது ஒன்று இருந்தால், கடந்து தாண்டிப் போக முடியாது.",10
சதுரங்கம்_விளையாடுவது_எப்படி,வழி கிடைக்கும் வரைதான் அது போக முடியும்.,6
சதுரங்கம்_விளையாடுவது_எப்படி,முறையெல்லாம் யானைக் காய் போல்தான்.,4
சதுரங்கம்_விளையாடுவது_எப்படி,"கடக்கும் வழியில் எதிரிக்காய் இருந்தால், விரும்பினால் வெட்டியெறியலாம்.",6
சதுரங்கம்_விளையாடுவது_எப்படி,இல்லையேல் விரும்பிய இடத்தில் நகர்ந்து கொள்ளலாம்.,5
சதுரங்கம்_விளையாடுவது_எப்படி,குதிரைக்காய் சதுரங்க ஆட்டத்தில் குதிரைக் காய்களை நகர்த்தி ஆடுவது சற்று சிக்கலானதுதான்.,9
சதுரங்கம்_விளையாடுவது_எப்படி,"தெளிவாக நகர்த்தப் பழகிக் கொண்டால், ஆடுவதற்கு மிகவும் சுவையாக இருக்கும்.",8
சதுரங்கம்_விளையாடுவது_எப்படி,"அவசரப்பட்டால், குதிரைக்காய் சங்கடத்திலும் ஆழ்த்திவிடும்.",4
சதுரங்கம்_விளையாடுவது_எப்படி,குதிரைக் காய் நகரும் முறை சற்று வேடிக்கையானது.,6
சதுரங்கம்_விளையாடுவது_எப்படி,"ராஜா காய்க்கும், ராணி காய்க்கும் கூட இல்லாத தனிச் சிறப்பும் தனியான வாய்ப்பும், குதிரை காய்க்கு மட்டுமே உண்டு.",14
சதுரங்கம்_விளையாடுவது_எப்படி,"எல்லாக் காய்களும் தான் நகரும்போது எதிரே தன் இனக்காய்கள் இருந்தால், நகர்வதைத் தொடர முடியாமல், அங்கேயே நின்று விடும்.",14
சதுரங்கம்_விளையாடுவது_எப்படி,"தான் அமர்வதற்கு இடம் இருந்தால், விதி முறைப்படி எந்த இடத்திற்கும், தான் விரும்புகின்ற கட்டத்திற்கும் அது போகலாம்.",13
சதுரங்கம்_விளையாடுவது_எப்படி,"குதிரைக் காய் அமர்கின்ற இடத்தில், எதிரிக் காய் இருந்தால், வெட்டி விடலாம்.",9
சதுரங்கம்_விளையாடுவது_எப்படி,"தேவையில்லை என்றால், மாற்று இடம் இருந்தால் அதில் அமரலாம்.",7
சதுரங்கம்_விளையாடுவது_எப்படி,"யானைக்காய் போல முன்னும் பின்னும் பக்கவாட்டின் இருமருங்கிலும் நேராகவோ, ஒரு கட்டமோ அல்லது பல கட்டங்களோ போகலாம்.",13
சதுரங்கம்_விளையாடுவது_எப்படி,"அதேபோல், ரதக்காய் மாதிரி குறுக்குக் கட்டம் வழியாகவும் செல்லலாம்.",7
சதுரங்கம்_விளையாடுவது_எப்படி,விரும்பினால் ஒரு கட்டம் கடக்கலாம்.,4
சதுரங்கம்_விளையாடுவது_எப்படி,இல்லையேல் பல கட்டங்கள் கடந்து போகலாம்.,5
சதுரங்கம்_விளையாடுவது_எப்படி,ராஜா காய் ஆட்டத்தின் தலைமைக்காய் இதுதான்.,5
சதுரங்கம்_விளையாடுவது_எப்படி,இதனை சுற்றிச் சுற்றித்தான் ஆட்டத்தின் அத்தனைக் காய்களின் இயக்கமும் இருக்கும்.,8
சதுரங்கம்_விளையாடுவது_எப்படி,"சகல சக்தியும் சாகசமும் நிறைந்த ராணிக் காயை, சாதாரண சிப்பாய் காய்கள் கூட வெட்டி எறிந்துவிடலாம்.",12
சதுரங்கம்_விளையாடுவது_எப்படி,ஆட்டமும் களையிழந்து போகாது.,3
சதுரங்கம்_விளையாடுவது_எப்படி,ராணியை இழந்தாலும் ஆட்டம் தொடரும்.,4
சதுரங்கம்_விளையாடுவது_எப்படி,முடிந்தால் வெற்றியும் பெறலாம்.,3
சதுரங்கம்_விளையாடுவது_எப்படி,"ஆனால், ராஜா காய்தான் முக்கியமானதாகும்.",4
சதுரங்கம்_விளையாடுவது_எப்படி,"அதனால்தான் என்னவோ, இது ராஜா போலவே இயக்கமும் குறைந்த அளவிலே தான் நடந்து கொண்டிருக்கிறது.",11
சதுரங்கம்_விளையாடுவது_எப்படி,"ராஜாவுக்கு, எப்பொழுதுமே பலத்த காவல் சுற்றிலும் உண்டு.",6
சதுரங்கம்_விளையாடுவது_எப்படி,"ராஜாவுக்கு ஆபத்து என்றால், போர்க்களப் படைகளே அதிர்ந்து போவது உண்டு.",8
சதுரங்கம்_விளையாடுவது_எப்படி,"சில சமயங்களில், படை தோற்று விடுவதும் உண்டு.",6
சதுரங்கம்_விளையாடுவது_எப்படி,உடனே ஆபத்துள்ள ராஜா காய்க்குரியவர் அதனைக் காத்துக் கொள்ள முயற்சிப்பார்.,8
சதுரங்கம்_விளையாடுவது_எப்படி,"தற்காத்துக் கொள்ளவும், தப்பிக்கவும் வழியிருந்தால், வாய்ப்பிருந்தால், காத்துக் கொள்ளலாம்.",7
சதுரங்கம்_விளையாடுவது_எப்படி,"வெட்டக் கூடிய நிலைவந்துவிட்டால், ராஜாவை கைது செய்வதுபோலத்தான்.",6
சதுரங்கம்_விளையாடுவது_எப்படி,அத்துடன் ஆட்டம் முடிந்துவிடும்.,3
சதுரங்கம்_விளையாடுவது_எப்படி,ராஜாகாயை இழக்க இருக்கின்றவர் ஆட்டத்தில் தோற்றவராகின்றார்.,5
சதுரங்கம்_விளையாடுவது_எப்படி,"இல்லையேல், எளிதாக ஆட்டத்தில் தோற்றுப் போக நேரிடும்.",6
சதுரங்கம்_விளையாடுவது_எப்படி,"சதுரங்க ஆட்டமானது, சிந்தனைத் தெளிவுடன் தீர்க்கமாக உணர்ந்து ஆடக்கூடிய ஆட்டமாகும்.",8
சதுரங்கம்_விளையாடுவது_எப்படி,இவ்வாறு இருவர் ஆடுகின்ற சதுரங்க ஆட்டத்தின் நோக்கத்தை விரிவாகக் கீழே காண்போம்.,9
சதுரங்கம்_விளையாடுவது_எப்படி,ஆட்டத்தின் நோக்கம் எதிராட்டக்காரருக்குரிய ராஜா காயைப் பிடித்து விடுவதுதான் ஆட்டத்தின் நோக்கமாகும்.,9
சதுரங்கம்_விளையாடுவது_எப்படி,அத்துடன் அந்த ஆட்டம் முடிவடைந்து விடுகிறது.,5
சதுரங்கம்_விளையாடுவது_எப்படி,ஆகவே ராஜா காயை மிகவும் பாதுகாப்புடன் வைத்துத்தான் ஒவ்வொரு ஆட்டக்காரரும் விளையாடிக் கொண்டிருப்பார்.,10
சதுரங்கம்_விளையாடுவது_எப்படி,அப்படி இருந்துதான் ஆடவேண்டும்.,3
சதுரங்கம்_விளையாடுவது_எப்படி,அதனையும் கவனத்துடன் கண்காணித்து ஆடவேண்டும்.,4
சதுரங்கம்_விளையாடுவது_எப்படி,உள்ளுறை முற்றுகை முன்னர் விவரித்துக் கூறிய முறையானது நேரடித் தாக்குதலாகும்.,8
சதுரங்கம்_விளையாடுவது_எப்படி,உதாரணமாக வெள்ளை ராஜா காய் ஒரு கட்டத்தில் இருக்கிறது.,7
சதுரங்கம்_விளையாடுவது_எப்படி,அதற்கு நேர்க்கட்டத்தில் பல கட்டங்கள் தாண்டி கறுப்பு ராணிக் காய் இருக்கிறது.,9
சதுரங்கம்_விளையாடுவது_எப்படி,இவ்வாறு இருக்கும் இரண்டு காய்களுக்கும் இடையில் கறுப்பு சிப்பாய் காய் இருக்கிறது என்று வைத்துக் கொள்வோம்.,12
சதுரங்கம்_விளையாடுவது_எப்படி,கறுப்பு சிப்பாய் காய் நடுவில் இருக்கும் வரை வெள்ளை ராஜா காய்க்கு முற்றுகை தாக்குதல் இல்லை.,12
சதுரங்கம்_விளையாடுவது_எப்படி,இப்பொழுது இரட்டை முற்றுகை முறையைக் காண்போம்.,5
சதுரங்கம்_விளையாடுவது_எப்படி,வெள்ளை ராஜா காய் இருக்கிறது.,4
சதுரங்கம்_விளையாடுவது_எப்படி,அதனைத் தாக்குவதற்காக கறுப்பு ராணிக் காயும் கறுப்பு யானைக் காயும் காத்திருக்கின்றன.,9
சதுரங்கம்_விளையாடுவது_எப்படி,"இப்பொழுது கறுப்பு யானைக் காய் வேறு கட்டம் வந்துவிட்டால், நேர்க் கட்டம் வழியாக ராஜாவைத் தாக்கும் முற்றுகை ஏற்படும்.",14
சதுரங்கம்_விளையாடுவது_எப்படி,"அதே சமயத்தில் குறுக்குக் கட்டம் வழியாக, கறுப்பு ராணியும் தாக்கும்.",8
சதுரங்கம்_விளையாடுவது_எப்படி,தாக்கும் காயினை வெட்டிவிடலாம் என்றாலும் மற்றொரு எதிரிக் காய் தாக்குமே !,8
சதுரங்கம்_விளையாடுவது_எப்படி,தாக்கும் காயினை வெட்டிவிடலாம் என்றாலும் அடுத்த காயினால் ஆபத்து நிகழுமே !,8
சதுரங்கம்_விளையாடுவது_எப்படி,"எனவே, வேறு ஒரு பாதுகாப்பான இடத்திற்கு வெள்ளை ராஜா காய் போகத்தான் வேண்டும்.",10
சதுரங்கம்_விளையாடுவது_எப்படி,"சில நேரங்களில், ராஜா காய்க்கு பாதுகாப்பான கட்டம் கிடைக்கக்கூடிய சூழ்நிலை அமையலாம்.",9
சதுரங்கம்_விளையாடுவது_எப்படி,"சில சமயங்களில், கிடைக்காமலும் போகலாம்.",4
சதுரங்கம்_விளையாடுவது_எப்படி,கிடைத்தால் ஆட்டம் தொடரும் இல்லையேல் முடிவடையும்.,5
சதுரங்கம்_விளையாடுவது_எப்படி,"சில சமயங்களில், குதிரைக் காயும், மற்றொரு காயும் எதிரி ராஜா காயைகூட தாக்கலாம்.",10
சதுரங்கம்_விளையாடுவது_எப்படி,"குதிரைக் காயின் கிளைத் தாக்குதல் முக்கியமான எதிரிக் காய்களைக் கூட வெட்டியெறிந்து, வெற்றி தேடித் தந்துமிருக்கிறது.",12
சதுரங்கம்_விளையாடுவது_எப்படி,"ஆகவே, குதிரைக் காய் முற்றுகைத் தாக்குதல் வரும் நேரத்தில், இன்னும் சற்றுக் கவனத்துடன் ஆடுவது நல்லது.",12
சதுரங்கம்_விளையாடுவது_எப்படி,முற்றுகைத் தாக்குதலைத் தான் ஆங்கிலத்தில் செக் என்று கூறப்படுகிறது.,7
சதுரங்கம்_விளையாடுவது_எப்படி,இவ்வாறு செக்மேட் என்ற முற்றுகை வெற்றிக்கான ஆட்ட முறைகளை ஆடி ஆடிப் பழகப் பழகத்தான் தெளிவாகப் புரியும்.,13
சதுரங்கம்_விளையாடுவது_எப்படி,"அதன்படி, உரிய மதிப்பெண்களை காண்போம்.",4
சதுரங்கம்_விளையாடுவது_எப்படி,ஆட்டத்தின் நோக்கமே எதிரி ராஜா காயை பிடிப்பதென்பதுதான்.,6
சதுரங்கம்_விளையாடுவது_எப்படி,அதன் மதிப்பு அளவிடற்கரியது என்றே குறித்துள்ளனர்.,5
சதுரங்கம்_விளையாடுவது_எப்படி,"மேலே குறிக்கப்பட்டுள்ள மதிப்பெண்களை வைத்துக் கொண்டு, அவற்றைப் பற்றிய ஒரு சில விளக்க முறையை கீழே காணலாம்.",13
சதுரங்கம்_விளையாடுவது_எப்படி,அதேபோல் எதிராளியும் அந்த பிரதான சக்தியை இழந்துவிட்டிருக்கிறார் என்றால் சமாளிக்கலாம்.,8
சதுரங்கம்_விளையாடுவது_எப்படி,"இல்லையேல் தோல்வி நிச்சயம் என்ற அளவுக்கு, ராணிக் காயின் சக்தி கணிக்கப்பட்டிருக்கிறது.",9
சதுரங்கம்_விளையாடுவது_எப்படி,"இரண்டு யானைக் காய்கள் இருந்தாலும் அல்லது ஒரு சிப்பாய் காய் மட்டும் தனியாக இருந்தாலும், முற்றுகையிடுதல் அவ்வளவு எளிதல்ல.",14
சதுரங்கம்_விளையாடுவது_எப்படி,அவ்வாறு சூழ்நிலை அமையும் விதத்தையும் அறிந்து கொள்வது முக்கியம்.,7
சதுரங்கம்_விளையாடுவது_எப்படி,"சிப்பாய் காய்தான், எல்லாக் காய்களிலும் குறைந்த மதிப்பெண்ணை உடையது.",7
சதுரங்கம்_விளையாடுவது_எப்படி,அதன் இயக்கமானது நேர்க் கட்டத்தில் தான்.,5
சதுரங்கம்_விளையாடுவது_எப்படி,எதிரிக் காயை வெட்ட முற்படும் பொழுது அது குறுக்குக் கட்டமாக இயங்கலாம்.,9
சதுரங்கம்_விளையாடுவது_எப்படி,"ஒரு முறை முன்னேறிச் செல்கின்ற சிப்பாய் காய், எக்காரணத்தை முன்னிட்டும் பின்னே திரும்பி வர முடியாது.",12
சதுரங்கம்_விளையாடுவது_எப்படி,இயக்கத்தில் முன்னேறும் பொழுது வெட்டுப்பட்டு ஆட்டத்தை விட்டு அப்புறப்படுத்தப் படலாம்.,8
சதுரங்கம்_விளையாடுவது_எப்படி,"இல்லையேல், அது கடைசிக் கட்டம் வரை முன்னேறிச் சென்றுவிடலாம்.",7
சதுரங்கம்_விளையாடுவது_எப்படி,"அதாவது, சிப்பாய் காய் வீரியம் பெற்று, உயர்ந்த உன்னத ஸ்தானத்தையும் பெற்றுக் கொள்கிறது.",10
சதுரங்கம்_விளையாடுவது_எப்படி,"கடைசிக் கட்டத்தை அடைந்து விட்டால், சிப்பாய் காய் மறு வாழ்வு பெற்று விடுகிறது.",10
சதுரங்கம்_விளையாடுவது_எப்படி,"அதாவது, சிப்பாய் காய் வீரியம் பெற்று உயர்ந்து உன்னத ஸ்தானத்தையும் பெற்றுக் கொள்கிறது.",10
சதுரங்கம்_விளையாடுவது_எப்படி,கடைசிக் கட்டத்தை அடைந்த சிப்பாய் காயானது.,5
சதுரங்கம்_விளையாடுவது_எப்படி,"தான் எந்தக் காயாக மாற விரும்புகிறதோ அந்தக் காயாக மாறிக்கொண்டு, மீண்டும் தன் ஆட்டத்தைத் தொடரலாம்.",12
சதுரங்கம்_விளையாடுவது_எப்படி,உதாரணமாக வெள்ளை ராணிக்காய் ஆட்டநேரத்தில் வெட்டப்பட்டு விடுகிறது என்று வைத்துக் கொள்வோம்.,9
சதுரங்கம்_விளையாடுவது_எப்படி,"எளிய சிப்பாய், காயானது, வலிய சக்தி படைத்த ராணிக் காயாக மாறிப் போரிடுகின்ற விந்தை மிகு முறையானது.",13
சதுரங்கம்_விளையாடுவது_எப்படி,சதுரங்க ஆட்டத்தில் மட்டுமே காணப்படுகின்ற அரிய ஆட்டப்படைப் பாகும்.,7
சதுரங்கம்_விளையாடுவது_எப்படி,"அதனால்தான், சிப்பாய் காய் சிறப்பான இடத்தைப் பெற்றிருக்கின்றது.",6
சதுரங்கம்_விளையாடுவது_எப்படி,"ஆட்டக்காரர்கள் விளையாடும் பொழுது, இழந்து போகின்ற தன் காய்களுக்கேற்ப எதிராளிகளின் காயையும் வெட்டி ஆடவே முயல வேண்டும்.",13
சதுரங்கம்_விளையாடுவது_எப்படி,"எனவே, முன்கூட்டியே எச்சரிக்கையுடன் இருந்து ஆடிக்கொண்டு வரவேண்டும்.இனி, ஆட்டம் வெற்றி தோல்வியின்றி சமமாக முடிவடைகின்ற சூழ்நிலையை ஆராய்வோம்.",14
சதுரங்கம்_விளையாடுவது_எப்படி,கீழ்க்காணும் ஆட்ட முறைகள் ஆட்டத்தில் ஏற்படும்போது ஆட்டம் சமமாக முடிவடைந்து விடுகின்றது.,9
சதுரங்கம்_விளையாடுவது_எப்படி,அவ்வாறு ஆடுவதற்கான சூழ்நிலையை எதிராட்டக்காரர் தோற்றுவித்துக் கொண்டேயிருந்தால்.,6
