work_title,sentence,sentence_length
சோழர்_கால_அரசியல்_தலைவர்கள்,சோழர் கால அரசியல் தலைவர்கள் பேரா.,5
சோழர்_கால_அரசியல்_தலைவர்கள்,அருணிதி கலியன்... ஒன்று இரண்டு.,4
சோழர்_கால_அரசியல்_தலைவர்கள்,அம்பலவன் பழுவூர் நக்கன்... பனிரண்டு  மூன்று.,5
சோழர்_கால_அரசியல்_தலைவர்கள்,சிற்றிங்கணுடையான்... பத்தொன்பது  நான்கு.,3
சோழர்_கால_அரசியல்_தலைவர்கள்,பார்த்திவேந்திராதிபன்மன்... இருபத்தொன்பது ஐந்து.,3
சோழர்_கால_அரசியல்_தலைவர்கள்,மதுராந்தகன் கண்டராதித்தன்... ஐம்பத்து மூன்று ஆறு.,5
சோழர்_கால_அரசியல்_தலைவர்கள்,பொய்கைநாடு கிழவன்... ஐம்பத்தொன்பது ஏழு.,4
சோழர்_கால_அரசியல்_தலைவர்கள்,ஜெயங்கொண்ட சோழப் பிரம்மாதிராசன்... எழுபத்து நான்கு எட்டு.,6
சோழர்_கால_அரசியல்_தலைவர்கள்,கருணாகரத் தொண்டைமான்... எண்பத்தொன்று ஒன்பது.,4
சோழர்_கால_அரசியல்_தலைவர்கள்,நெற்குன்றங்கிழார்... தொன்னூற்றைந்து பத்து.,3
சோழர்_கால_அரசியல்_தலைவர்கள்,மணவில் கூத்தன்... நூற்றி இரண்டு பதினொன்று .,5
சோழர்_கால_அரசியல்_தலைவர்கள்,சேக்கிழார்... நூற்றி பதினேழு  பனிரண்டு .,4
சோழர்_கால_அரசியல்_தலைவர்கள்,அமராபரணன் சீயகங்கன்... நூற்றி முப்பத்து மூன்று பதிமூன்று .,6
சோழர்_கால_அரசியல்_தலைவர்கள்,பெருமான் நம்பிப் பல்லவராயன்... நூற்றி முப்பத்தெட்டு பதினான்கு .,6
சோழர்_கால_அரசியல்_தலைவர்கள்,தந்திவர்மனது திருவல்லிக்கேணிக் கல்லெழுத்தில் கி.,4
சோழர்_கால_அரசியல்_தலைவர்கள்,இங்ஙனம் நாயன்மார் பெயர்களை நினைவூட்டும் பல பெயர்கள் கல்லெழுத்துக்களிற் பயிலுதல் நன்கு தெரியவரும்.,10
சோழர்_கால_அரசியல்_தலைவர்கள்,﻿அருணிதி கலியன் அருணிதி கலியன் என்பான் முதற் பராந்தகன் என்னும் சோழ அரசனுடைய அதிகாரிகளில் ஒருவன்.,12
சோழர்_கால_அரசியல்_தலைவர்கள்,இவன் சோழ நாட்டவன் மருதூர் என்னும் ஊரவன் மருதூருடையான் அருணிதி கலியன் என்றும் கூறப்பெறுபவன்.,11
சோழர்_கால_அரசியல்_தலைவர்கள்,இவனைக் குறித்து முதற்பராந்தக சோழனுடைய ஆனைமலைக் கல்வெட்டால் அறியப்பெறுகின்றது.,7
சோழர்_கால_அரசியல்_தலைவர்கள்,சோழப் பெருமானடிகள் என்பது சோழவரசன் எனப் பொருள்படும்.,6
சோழர்_கால_அரசியல்_தலைவர்கள்,இங்குக் குறித்த சோழவரசன் முதற் பராந்தக சோழன் ஆவன்.,7
சோழர்_கால_அரசியல்_தலைவர்கள்,தொள்ளாயிரத்து பத்து லேயே மதுரையைக் கைப்பற்றினான் என்றறியலாம்.,6
சோழர்_கால_அரசியல்_தலைவர்கள்,இவனிடம் தோற்ற பாண்டிய அரசன் மூன்றாம் இராசசிம்மன் ஆவன்.,7
சோழர்_கால_அரசியல்_தலைவர்கள்,பதிமூன்று  அருணிதி கலியனுக்கு ஒட்டிக்கொடுத்த பரிசு பதினான்கு  அருணிதி கலியனொடு ஆனைமங்கலத்துச் சபையார் ஒரு ஒப்பந்தம் செய்து கொண்டார்கள்.,14
சோழர்_கால_அரசியல்_தலைவர்கள்,"அது மேற்குறிப்பிட்ட முதற் பராந்தகசோழனது முப்பத்துமூன்றாவது, ஆட்சியாண்டில் தரப்பெற்ற ஆனைமங்கலக் கல்லெழுத்தில் பதினைந்து  கூறப்பெற்றுள்ளது.",11
சோழர்_கால_அரசியல்_தலைவர்கள்,அவ்வொப்பந்தம் பின்வருமாறு நரசிங்கப் பெருமானடிகள் பதினாறு  தம்முடை நிலத்தால் சபையார்க்குக் கொடுக்கவேண்டிய ஈழக்காசு பதினெட்டு.,11
சோழர்_கால_அரசியல்_தலைவர்கள்,ஒரு ஈழாக்காசுக்குத் திங்கள் ஒன்றுக்கு வட்டி புத்தக்கம் பதினைந்து ஈழாக்காசுகளுக்குத் திங்கள் ஒன்றுக்கு மூன்று புத்தக்கம்.,12
சோழர்_கால_அரசியல்_தலைவர்கள்,பதினெட்டு  இது ஆண்டொன்றுக்கு நாற்பத்தைந்து புத்தக்கம் ஆகிறது.,6
சோழர்_கால_அரசியல்_தலைவர்கள்,"ஒரு ஈழக்காசுக்கு ஏழு, புத்தக்கம் எனில் நாற்பத்தைந்து புத்தக்கம் ஆறு ஈழாக்காசு ஆகிறது.",10
சோழர்_கால_அரசியல்_தலைவர்கள்,இங்ஙனம் பதினைந்து  ஈழக்காசுக்கு ஆறு ஈழக்காசு வட்டி.,6
சோழர்_கால_அரசியல்_தலைவர்கள்,நரசிங்கப் பெருமானடிகள் சமையார்க்கு இன்னும் கொடுக்கக் கடவ பனிரண்டு  ஈழாக்காசுகளும் நீக்கப்பெற்றன.,9
சோழர்_கால_அரசியல்_தலைவர்கள்,இனி ௸ இறைகாவலாகக் கொடுத்த பதினைந்து  காசினால் ஊருடையான் குளமான கலியனேரி பத்தொன்பது  என்ற நிலப்பகுதி விலைக்கு வாங்கப்பெற்றது.,14
சோழர்_கால_அரசியல்_தலைவர்கள்,இக்குளத்தின்கீழ் நீர்நிலன் இருபது இருவேலியை அருணிதி கலியன் விலைக்குக் கொண்டான்.,8
சோழர்_கால_அரசியல்_தலைவர்கள்,இதிலிருந்து வந்த வருமானம் அஞ்ஞாழிக்காலால் இருபத்தொன்று முன்னூறு கலம் நெல் ஆகும்.,9
சோழர்_கால_அரசியல்_தலைவர்கள்,இதில் நூற்றி ஐம்பது கலம் நரசிங்கப் பெருமானுக்கு மூன்று சந்தியும் திருவமுது செய்விக்க வேண்டும்.,11
சோழர்_கால_அரசியல்_தலைவர்கள்,தாலம் இருபத்தெட்டு ஐந்து வட்டில் இருபத்தொன்பது ஐந்து ஒட்டூட்டி முப்பது ஒன்று சட்டுவம் முப்பத்தொன்று ஒன்று.,12
சோழர்_கால_அரசியல்_தலைவர்கள்,அக்காசு கொண்டு திருமாலுக்குத் திருவிளக்கு எரிக்க வேண்டும்.,6
சோழர்_கால_அரசியல்_தலைவர்கள்,சபையார் எல்லோரும் சேர்ந்து இத்தருமத்தை நடத்தாவிடில் ஆறு காசு தண்டம் செலுத்த வேண்டும்.,10
சோழர்_கால_அரசியல்_தலைவர்கள்,இத்தண்டம் இறுத்தும் முட்டின்றிச் சந்திர சூரியர் உள்ளவரை இத்தருமம் நடத்தவேண்டும்.,8
சோழர்_கால_அரசியல்_தலைவர்கள்,இது அதிகமாகத் தோன்றுவது இயல்பே.,4
சோழர்_கால_அரசியல்_தலைவர்கள்,இங்ஙனம் அதிக வட்டி பெறுவது மிக அருகி இருந்திருத்தல் வேண்டும்.,8
சோழர்_கால_அரசியல்_தலைவர்கள்,சில சமயத்து முப்பத்தேழு ம் ஐம்பது ம் வட்டி பெற்றதாகக் கல்லெழுத்துக்கள் பகர்கின்றன.,10
சோழர்_கால_அரசியல்_தலைவர்கள்,எனவே அதிகவட்டி வாங்கியதேன்?,3
சோழர்_கால_அரசியல்_தலைவர்கள்,என்பதற்கு விடை எளிதில் தரவியலாது.,4
சோழர்_கால_அரசியல்_தலைவர்கள்,ஈழக்காசு இருபது ஈழக்காசு பத்து கழஞ்சு பொன் என்று ஒரு கல்வெட்டுக் கூறுகிறது.,10
சோழர்_கால_அரசியல்_தலைவர்கள்,முப்பத்தொன்பது எனவே ஒரு ஈழக்காசு கழஞ்சு எடையுடையதென அறியலாம்.,7
சோழர்_கால_அரசியல்_தலைவர்கள்,நாற்பது அக்கம் அக்கம் எத்தகைய நாணயம் என்று அறிந்து கொள்ள முடியவில்லை.,9
சோழர்_கால_அரசியல்_தலைவர்கள்,ஏழு புத்தக்கம் ஒரு ஈழக்காசு என்று இக்கல்லெழுத்துப் பகர்கிறது.,7
சோழர்_கால_அரசியல்_தலைவர்கள்,"நாற்பத்திரண்டு ஆனைமலைக் கோயில் கட்டிய காலம் இனி, ஆனைமலையிலே நரசிங்கப் பெருமாள் கோயில் கட்டப்பெற்ற காலத்தை அறிதலும், ஏற்புடைத்தே.",14
சோழர்_கால_அரசியல்_தலைவர்கள்,இவ்வரசனின்முதலமைச்சன் மாறன் காரி என்ற பெயருடையவன்.,5
சோழர்_கால_அரசியல்_தலைவர்கள்,எழுநூற்று எழுபது ல் நரசிங்கப் பெருமாள்கோயிலைக் குடைவித்து அக்கோயிற் கண்மையில் அந்தணர்களைக் குடியேற்றினன்.,10
சோழர்_கால_அரசியல்_தலைவர்கள்,இவன் தம்பி மாறன் எயினன் எனப்பெற்றான் அவனே முக மண்டபம் அமைத்துக் கடவுள் மங்கலமும் செய்வித்தவன் ஆவன்.,13
சோழர்_கால_அரசியல்_தலைவர்கள்,நாற்பத்து மூன்று கலி மூன்று ஆயிரத்து எண்ணூற்று எழுபத்தொன்று ல் இக்கற்றளியமைக்கப் பெற்றதென்று வடமொழிக் கல்வெட்டொன்றும் கூறுகிறது.,13
சோழர்_கால_அரசியல்_தலைவர்கள்,இது ஞானசம்பந்தம் திங்களிதழில் வெளிவந்தது.,4
சோழர்_கால_அரசியல்_தலைவர்கள்,"பொன்னார் மேனி என்ற சுந்தரர் வாக்கு, பொன்னார் மேனி பட்டன் என்று ஒருவர் பெயராக அமைந்தது.",12
சோழர்_கால_அரசியல்_தலைவர்கள்,இவ்வாசிரியர் வெளியிட்ட இலக்கியக்கேணி என்ற நூலில் பொன்னார் மேனியன் என்ற கட்டுரை காண்க.,10
சோழர்_கால_அரசியல்_தலைவர்கள்,"நீறணி பவளக்குன்றம், எடுத்த பாதம், மழலைச் சிலம்பு என்ற திருவிசைப்பாத் தொடர்கள் முற்காலத்து மக்கள் பெயராக வழங்கின.",13
சோழர்_கால_அரசியல்_தலைவர்கள்,"இராகவையங்கார் சாஸனத் தமிழ்க்கவி சரிதம், பக்கம் முப்பத்தெட்டு.",6
சோழர்_கால_அரசியல்_தலைவர்கள்,முதலாம் இராசராசன் காலத்துத் திருப்பதிகம் ஓத நியமிக்கப்பெற்றவர் பெயர்களையும் காண்க.,8
சோழர்_கால_அரசியல்_தலைவர்கள்,"பரகேசரி, ராசகேசரி என்பன சோழவரசர்கள் மாறி மாறிப் புனைந்துகொண்ட பட்டப் பெயர்கள்.",9
சோழர்_கால_அரசியல்_தலைவர்கள்,தேவதானம் கோயில்களுக்கு விடப்பட்ட இறையிலி நிலம்.,5
சோழர்_கால_அரசியல்_தலைவர்கள்,"கீழிரணியமுட்டம் ஆனைமலையைச் சுற்றியுள்ள பகுதி, இரணியமுட்டத்துப் பெருங்கௌசிகனார் என்ற புலவர் கடைச்சங்க காலத்தவர் மலைபடுகடாம் என்ற நூலின் ஆசிரியர்.",14
சோழர்_கால_அரசியல்_தலைவர்கள்,இரணியமுட்டம் என்ற நாட்டின் பகுதி சங்க காலத்திலேயே இப்பெயரோடிருந்தமை இப்புலவர் பெயரான் அறியப்பெறும்.,10
சோழர்_கால_அரசியல்_தலைவர்கள்,பிரமதேயம் அந்தணர்களுக்கு விடப்பெற்ற இறையிலி நிலம்.,5
சோழர்_கால_அரசியல்_தலைவர்கள்,நரசிங்கமங்கலம் ஆனைமங்கலத்துக்கு ஒரு பெயர் இஃது பிற்காலத்து அருமொழிதேவ வளநாட்டின் பகுதியாயிற்று.,9
சோழர்_கால_அரசியல்_தலைவர்கள்,ஐநூற்று எழுபத்தைந்து ல் கடுங்கோனால் நிறுவப்பெற்ற பாண்டிய அரசு கி.,8
சோழர்_கால_அரசியல்_தலைவர்கள்,தொள்ளாயிரத்து பதினைந்து  ல் பராந்தகசோழனால் இராசசிம்மன் காலத்தில் அழிவுற்றது.,7
சோழர்_கால_அரசியல்_தலைவர்கள்,ஒட்டிக்கொடுத்த பரிசு ஒப்புக்கொண்டு எழுதிக்கொடுத்த ஒப்பந்தம்.,5
சோழர்_கால_அரசியல்_தலைவர்கள்,நரசிங்கப் பெருமானடிகள் ஆனைமங்கலத் திருக்கோயிலில் எழுந்தருளியிருந்த திருமால் திருநாமம்.,7
சோழர்_கால_அரசியல்_தலைவர்கள்,இறைகாவல் இறைதிரவியம் வரிப்பணத்துக்குப் பதிலாகச் செலுத்தப்படும் முதற் பொருள்.,7
சோழர்_கால_அரசியல்_தலைவர்கள்,புத்தக்கம் புதிய அக்கம் அக்கம் ஒரு நாணயம்.,6
சோழர்_கால_அரசியல்_தலைவர்கள்,கலியனேரி அருணிதிகலியன் பெயரால் அமைந்த ஏரி.,5
சோழர்_கால_அரசியல்_தலைவர்கள்,நீர்நிலன் நன்செய் நிலம்.,3
சோழர்_கால_அரசியல்_தலைவர்கள்,அஞ்ஞாழிக்கால் மரக்கால் பெயர்.,3
சோழர்_கால_அரசியல்_தலைவர்கள்,உத்தம அக்கிரமாக சிறந்த முறையில்.,4
சோழர்_கால_அரசியல்_தலைவர்கள்,தேவர் நரசிங்கப் பெருமாள்.,3
சோழர்_கால_அரசியல்_தலைவர்கள்,பத்தெட்டுக் குத்தல் அரிசி பலதடவை குற்றிய அரிசி செவிடு ஆழாக்கு.,8
சோழர்_கால_அரசியல்_தலைவர்கள்,காயிலை பாக்கு வெற்றிலை தாலம் தாம்பாளம்.,5
சோழர்_கால_அரசியல்_தலைவர்கள்,ஒட்டூட்டி தண்ணீர் வார்க்கும் செம்பு போலும்,5
சோழர்_கால_அரசியல்_தலைவர்கள்,புடவை ஆண்கள் உடுக்கும் ஆடையும் புடவையெனப் பெற்றது.,6
சோழர்_கால_அரசியல்_தலைவர்கள்,கற்கடகநாயிறு ஆடி மாதம்.,3
சோழர்_கால_அரசியல்_தலைவர்கள்,குறைகிராணம் குறைகிரகணம் நிறைகிரகணம் என்று பாடமிருப்பின் சிறக்கும்.,6
சோழர்_கால_அரசியல்_தலைவர்கள்,சிறீகாரியம் சிரீகாச்சியம் சிரிகாற்றியம் என்று ஸ்ரீகாரியம் என்ற சொல் பிழையாக இக் கல்லெழுத்தில் காணப்பெறுகிறது.,11
சோழர்_கால_அரசியல்_தலைவர்கள்,திருவாய்ப்பாடி சண்டீசப்பெருமான் தலம் போலும் !,4
சோழர்_கால_அரசியல்_தலைவர்கள்,சந்திராதித்தவல் சந்திர சூரியர் உள்ளவரை.,4
சோழர்_கால_அரசியல்_தலைவர்கள்,பண்டாரத்தார் பாண்டியர் வரலாறு பக்கம் ஐம்பத்தைந்து ஐம்பத்தாறு.,6
சோழர்_கால_அரசியல்_தலைவர்கள்,பக்கம் பாகம் நூற்றி ஐம்பத்து நான்கு.,5
சோழர்_கால_அரசியல்_தலைவர்கள்,"﻿அம்பலவன் பழுவூர் நக்கன் ஒன்று கோவந்தபுத்தூர், விசயமங்கை கோவந்தபுத்தூர், கொள்ளிடத்தின் வடகரையிலுள்ள பாடல் பெற்ற சிவதலம்.",12
சோழர்_கால_அரசியல்_தலைவர்கள்,இதனை அப்பரும் சம்பந்தரும் பாடியுள்ளனர்.,4
சோழர்_கால_அரசியல்_தலைவர்கள்,கோவந்தபுத்தூர் என்பது ஊரின் பெயர் செயமங்கை என்பது திருக்கோயிலின் பெயராகும்.,8
சோழர்_கால_அரசியல்_தலைவர்கள்,"இதனை, கொள்ளி டக்கரை கோவந்த புத்தூரில் வெள்வி டைக்கருள் செய்விச யமங்கை என்ற அப்பர் தேவாரத்தான் அறியலாம்.",13
சோழர்_கால_அரசியல்_தலைவர்கள்,ஒரு பசு சிவலிங்கத் திருமேனியின்மீது பால் சொரிந்தமையால் இதற்குக் கோவந்தபுத்தூர் என்ற பெயர் எய்தியது என்பர்.,12
சோழர்_கால_அரசியல்_தலைவர்கள்,"இது, கோதனம் வழிபடக் குலவு நான்மறை வேதியர் தொழுதெழு விசய மங்கையே என்று ஞானசம்பந்தர் கூறியமையால் அறியப்பெறும்.",13
சோழர்_கால_அரசியல்_தலைவர்கள்,வெள் விடைக் கருள்செய் விசயமங்கை என்று அப்பர் கூறியபடியால் இடபதேவருக்கு அருள் செய்த வரலாறும் இங்கு அறியப்படுவ தொன்றாகும்.,14
சோழர்_கால_அரசியல்_தலைவர்கள்,"இனி, விசயன் வழிபட்டமையால் இத் திருக்கோயில் விசயமங்கை என்ற பெயர் எய்தியதென்பர்.",9
