work_title,sentence,sentence_length
தான்பிரீன்_தொடரும்_பயணம்,கின்னான் வேடிக்கையாக் கூறியிருப்பாரோ என்று சந்தேகித்து அவன் டிரீஸியைத் திரும்பிப் பார்த்தான்.,9
தான்பிரீன்_தொடரும்_பயணம்,ஒரு வினாடியில் மூவரும் எழுந்து நின்று அடுத்தாற் போல் என்ன செய்வதென்று யோசிக்கலாயினர்.,10
தான்பிரீன்_தொடரும்_பயணம்,தான்பிரீனுடைய தலை கிறுகிறுத்துக் கொண்டிருந்தது.,4
தான்பிரீன்_தொடரும்_பயணம்,உடம்வு முழுவதும் உணர்ச்சியற்றிருந்தது.,3
தான்பிரீன்_தொடரும்_பயணம்,ஆயினும் ஆருயிர்த்தோழன் ஹோகன் பகைவர் கையில் சிக்கிவிட்டான் என்றதைக் கேட்டு அவன் நிலை கொள்ளவில்லை.,11
தான்பிரீன்_தொடரும்_பயணம்,அவனும் தோழர்களும் ஹோகனைப் பீலர்களுடைய கையிலிருந்து உடனே விடுவிக்க ஏற்பாடு செய்ய வேண்டும் என்று தீர்மானித்தனர்.,12
தான்பிரீன்_தொடரும்_பயணம்,"ஹோகனை விடுவிக்க வேண்டும், அல்லது நாம் மடிய வேண்டும் என்று முடிவு செய்தனர்.",10
தான்பிரீன்_தொடரும்_பயணம்,ஹோகன் எப்படிப் பிடிப்பட்டான் என்பதைப் பற்றி அவர்கள் விசாரித்தார்கள்.,7
தான்பிரீன்_தொடரும்_பயணம்,அவன் அவர்களுக்குப் பின்னால் தொடர்ந்து வந்து கொண்டிருந்தான்.,6
தான்பிரீன்_தொடரும்_பயணம்,இடையில் பத்து பீலர்கள் அவனைச் சூழ்ந்து பிடித்துக் கொண்டனர்.,7
தான்பிரீன்_தொடரும்_பயணம்,அவன் துப்பாக்கியைத் தொடுவதற்குக் கூடச் சந்தர்ப்பம் கிடைக்கவில்லை.,6
தான்பிரீன்_தொடரும்_பயணம்,"பிற்காலத்தில் பீலர்கள் புரட்சிக்காரர்களைப் பிடிப்பதானால், பிடித்தவுடன் சுட்டுக் கொல்வது வழக்கமாயிற்று.",8
தான்பிரீன்_தொடரும்_பயணம்,கைதிகள் ஓட ஆரம்பித்தார்கள்.,3
தான்பிரீன்_தொடரும்_பயணம்,அதனால் சுட்டு விட்டோம் !,3
தான்பிரீன்_தொடரும்_பயணம்,என்று அவர்கள் மழுப்பிவிடுவார்கள்.,3
தான்பிரீன்_தொடரும்_பயணம்,ஆனால் அந்த வழக்கம் ஹோகன் பிடிபடும்போது அமுலில் இல்லை.,7
தான்பிரீன்_தொடரும்_பயணம்,ஹோகன் எங்கே வைக்கப்பட்டிருக்கிறான் என்ற தகவலொன்றும் கிடைக்கவில்லை.,6
தான்பிரீன்_தொடரும்_பயணம்,வழிப்போக்கர் யாரிடமாவது கேட்டுத் தெரிந்து கொள்ளலாமென்றால் அக்காலத்தில் நன்றாய் விடிவதற்குமுன்னால் எவரும் வீதியில் நடமாடுவதில்லை.,11
தான்பிரீன்_தொடரும்_பயணம்,அவனைப் பற்றிய தகவல்களைத் தெரிந்துவரச் சில வாலிப நண்பர்கள் சைக்கிள்களில் சுற்றித் திரிந்தனர்.,10
தான்பிரீன்_தொடரும்_பயணம்,ஒரு புலனுந் தெரியவில்லை.,3
தான்பிரீன்_தொடரும்_பயணம்,பீலர்கள் ஹோகனை மிகவும் எச்சரிக்கையாய் மறைத்துக் கொண்டு போயிருந்தனர்.,7
தான்பிரீன்_தொடரும்_பயணம்,"வெகு நேரத்திற்குப் பிறகு, அவன் தர்லஸ் போலிஸ் நிலையத்தில் இருப்பதாகத் தகவல் கிடைத்தது.",10
தான்பிரீன்_தொடரும்_பயணம்,தர்லஸ் போலிஸ் நிலையத்தைத் தாக்கி அதிலிருந்து ஹோகனை மீட்பது நடக்க முடியாத காரியம்.,10
தான்பிரீன்_தொடரும்_பயணம்,ஏனெனில் ஏராளமான போலிசும் பட்டாளமும் எந்த நேரத்திலும் தயாராய் வைக்கப்பட்டிருந்தன.,8
தான்பிரீன்_தொடரும்_பயணம்,போலிஸ் நிலையத்தைச் சுற்றிலும் பெரிய கோட்டை ஒன்று இருந்தது.,7
தான்பிரீன்_தொடரும்_பயணம்,போலிஸார் இமைகொட்டாது பாராக் கொடுத்து வந்தனர்.,5
தான்பிரீன்_தொடரும்_பயணம்,புரட்சிக்காரருடைய வேலைகள் அவர்களுக்கு மிக நன்றாய்த் தெரியும்.,6
தான்பிரீன்_தொடரும்_பயணம்,அதிலும் வெடிமருந்து வழக்கில் சம்பந்தப்பட்ட ஹோகன் அவர்களிடம் கைதியாக இருக்கும் பொழுது அவர்கள் அதிக எச்சரிக்கையாயிருந்தது ஆச்சரியமில்லை.,13
தான்பிரீன்_தொடரும்_பயணம்,அக்காலத்தில் கைதிகளை ரிமாண்டு செய்வதற்கும் ஆரம்ப விசாரனை செய்வதற்கும் இரண்டொரு நாள்தான் போலிஸ் நிலையத்தில் வைப்பது வழக்கம்.,13
தான்பிரீன்_தொடரும்_பயணம்,"பிறகு அவர்கள் மவுன்ட் ஜாய், கார்க், மேரிபரோ, டான்டாக், பெல்டாஸ்டு முதலிய பெரிய சிறைச்சாலைகளில் ஒன்றுக்கு மாற்றப்படுவது வழக்கம்.",14
தான்பிரீன்_தொடரும்_பயணம்,திப்பெரரிக் கைதிகளை கார்க் நகர ஜெயிலுக்குக் கொண்டு போவார்கள்.,7
தான்பிரீன்_தொடரும்_பயணம்,"எனவே ஹோகன், தர்லஸ் நிலையத்திலிருந்து ரயிலில் கார்க்குக்கே கொண்டு போகப்படுவான் என்று தான்பிரீன் ஊகித்தான்.",11
தான்பிரீன்_தொடரும்_பயணம்,அதற்குத் தக்கபடி திட்டம் அமைத்தான்.,4
தான்பிரீன்_தொடரும்_பயணம்,எமிலி சிறிய ஸ்டேஷன்.,3
தான்பிரீன்_தொடரும்_பயணம்,அங்கு பட்டாளம் கிடையாது.,3
தான்பிரீன்_தொடரும்_பயணம்,ஆனால் ரயிலை நிறுத்திக் கைதியை மீட்பது மூன்று பேர் செய்யக்கூடிய காரியமில்லை.,9
தான்பிரீன்_தொடரும்_பயணம்,"ஆதலால், தான்பிரீன் உதவியாட்கள் வேண்டுமென்று திப்பெரரி நகரலிருந்து தனது படைக்குத் தகவல் சொல்லிவிட்டான்.",10
தான்பிரீன்_தொடரும்_பயணம்,திப்பெரரியில் இருந்து எமிலி ஏழாவது மைலில் இருந்தது.,6
தான்பிரீன்_தொடரும்_பயணம்,முன்னேற்பாடுகள் யாவும் செய்யப்பட்டு முடிந்தன.,4
தான்பிரீன்_தொடரும்_பயணம்,"கோபத்தினாலும், ஆத்திரத்தாலும், கவலையாலும் அவர்களுடைய உதிரம் கொதித்துக் கொண்டிருந்தது.",7
தான்பிரீன்_தொடரும்_பயணம்,"நேர் பாதையிலே சென்றால், எமிலி முப்பது மைல் தூரத்தில்தான் இருந்தது.",8
தான்பிரீன்_தொடரும்_பயணம்,ஆனால் நேர் பாதையிலே போலிஸ் தோழர்கள் அடிக்கடி நடமாடிக்கொண்டிருப்பார்கள் அல்லவா?,8
தான்பிரீன்_தொடரும்_பயணம்,காட்டுப்பாதையில் ஐம்பது மைல் பிரயாணம் செய்ய வேண்டியிருந்தது.,6
தான்பிரீன்_தொடரும்_பயணம்,"எங்கு பார்த்தாலும் மேடும், பள்ளமும் குழியும், கல்லுமாயிருந்தது.",6
தான்பிரீன்_தொடரும்_பயணம்,"சைக்கிள்களில் அவர்களுடைய உடல் இருந்தனவேயன்றி, உறக்க மயக்கத்தால் மூவருடைய தலைகளும் நாலு பக்கத்திலும் ஆடிக்கொண்டேயிருந்தன.",11
தான்பிரீன்_தொடரும்_பயணம்,நண்பனை மீட்க வேண்டும் என்ற ஆத்திரம் மட்டுமே அவர்களையும் சைக்கிள்களையும் தள்ளிக்கொண்டு சென்றது.,10
தான்பிரீன்_தொடரும்_பயணம்,இடையிலே ஸீன்டிரீஸி வழக்கம் போல் கதைகள் சொல்ல ஆரம்பித்தான்.,7
தான்பிரீன்_தொடரும்_பயணம்,வழியிலிருந்து ஊர்களின் சரித்திரங்களையும் அவற்றில் வசித்த வீரர்களைப் பற்றியும் அவன் விரிவாக எடுத்துச் சொன்னான்.,11
தான்பிரீன்_தொடரும்_பயணம்,திடீரென்று ஏதோ வீழ்வதாக.,3
தான்பிரீன்_தொடரும்_பயணம்,"டிரீஸியும், தான்பிரீனும் பின்னால் திரும்பிப் பார்த்தனர்.",5
தான்பிரீன்_தொடரும்_பயணம்,ராபின்ஸன் சைக்கிளிலிருந்து தூங்கிக் கீழே விழந்து விட்டான் விழுந்தவன் பங்குவதைக் கண்டனர்.,9
தான்பிரீன்_தொடரும்_பயணம்,அவன் உடலில் அவ்வளவு களைப்பு இருந்தது.,5
தான்பிரீன்_தொடரும்_பயணம்,முதல் ரயில் மதியத்தில்தான் வரும் என்று தெரிந்து கொண்டு அவர்கள் திப்பெரரியிலிருந்து உதவியாட்கள் வருவதை எதிர்பார்த்துக் காத்திருந்தனர்.,13
தான்பிரீன்_தொடரும்_பயணம்,திப்பெரரி வீதியில் வழிமேல் விழிவைத்துப் பார்த்துக் கொண்டேயிருந்தனர்.,6
தான்பிரீன்_தொடரும்_பயணம்,வழியில் என்ன நேர்ந்ததோ என்று கவலையுற்றனர்.,5
தான்பிரீன்_தொடரும்_பயணம்,மணி பதினொன்று அடித்தது.,3
தான்பிரீன்_தொடரும்_பயணம்,ஒவ்வொரு நிமிஷமும் ஒரு நாளாகத் தோன்றிற்று.,5
தான்பிரீன்_தொடரும்_பயணம்,எந்த ஆசாமியும் வரக்கானோம்.,3
தான்பிரீன்_தொடரும்_பயணம்,ரயில் வரக்கூடிய நேரம் நெருங்கி விட்டது.,5
தான்பிரீன்_தொடரும்_பயணம்,"உதவிக்கு நண்பர்கள் வந்தால் என்ன, வராவிட்டால் என்ன?",6
தான்பிரீன்_தொடரும்_பயணம்,"ஸீன் ஹோகன் பகைவர்கள் கையில் அகப்பட்டுக் கொண்டிருக்கும்போது, அவனுடைய நண்பன் சும்மா இருப்பதா?",10
தான்பிரீன்_தொடரும்_பயணம்,அது நட்புக்குத்துரோகம் அல்லவா?,3
தான்பிரீன்_தொடரும்_பயணம்,இவ்வாறெல்லாம் தான்பிரீன் எண்ணமிட்டான்.,3
தான்பிரீன்_தொடரும்_பயணம்,எப்படியாவது முயற்சி செய்து பார்த்துவிட வேண்டியது தங்கள் கடமை என்று தீர்மானித்தான்.,9
தான்பிரீன்_தொடரும்_பயணம்,ஹோகனுக்குப் பாதுகாப்பாகச் சுமார் நான்கு முதல் எட்டுப் போலிஸார் தக்க ஆயுதங்களுடன் வரக்கூடும்.,10
தான்பிரீன்_தொடரும்_பயணம்,ஆனால் அவைகளையெல்லாம் பற்றி யோசிக்க அந்தத் தொண்டர்களுக்கு மனமில்லை.,7
தான்பிரீன்_தொடரும்_பயணம்,ஹோகனை மீட்க வேண்டும் அல்லது அவனுக்காகத் தங்கள் உயிரைப்பலியிட வேண்டும் வருவது வரட்டும் என்று அவர்கள் துணிந்து நின்றனர்.,14
தான்பிரீன்_தொடரும்_பயணம்,சரியாகப் பன்னிரண்டு மணிக்கு ரயில் வந்து விட்டது.,6
தான்பிரீன்_தொடரும்_பயணம்,உடனே மூவரும் ஸ்டேஷனுக்குள்ளே பாய்ந்தனர்.,4
தான்பிரீன்_தொடரும்_பயணம்,உள்ளே பாய்ந்த வேகத்தில் தான்பிரீன் ஒரு கிழவியை இடித்துத் தள்ளிவிட்டான் தானும் கீழே விழுந்தான்.,11
தான்பிரீன்_தொடரும்_பயணம்,கிழவியைத் திரும்பிப் பாராமலே துள்ளி எழுந்து ரயிலடிக்கு ஓடினான்.,7
தான்பிரீன்_தொடரும்_பயணம்,ஒவ்வொரு நிமிஷமும் அவனுடைய கைவிரல் சட்டைக்குள் மறைத்திருந்த ரிவால்வரின் குதிரையைப் பிடித்த வண்ணம் தயாராக இருந்தது.,12
தான்பிரீன்_தொடரும்_பயணம்,ரயில் வந்ததே யொழிய அதில் ஒரு கைதியையும் காணோம் !,7
தான்பிரீன்_தொடரும்_பயணம்,மூவரும் ஏமாற்றமடைந்து திகைத்தனர்.,3
தான்பிரீன்_தொடரும்_பயணம்,ஆனால் அதுவும் நல்லது தான் என்று கொஞ்சம் சந்தோஷம் அடைந்தனர்.,8
தான்பிரீன்_தொடரும்_பயணம்,"ஏனெனில் ஹோகன் அடுத்த ரயிலில் கொண்டு வரப்பட்டால், அதற்குள் திப்பெரரி ஆட்கள் வந்துவிடக்கூடும் என்று அவர்கள் நம்பினார்கள்.",13
தான்பிரீன்_தொடரும்_பயணம்,அடுத்த ரயில் வரும்வரை காத்திருப்பதுதான் மிகவும் கஷ்டமாயிருந்தது.,6
தான்பிரீன்_தொடரும்_பயணம்,போராட்டத்தில் தீவிரமாய்க் குதிப்பது எளிது.,4
தான்பிரீன்_தொடரும்_பயணம்,ஆனால் எதையும் எதிர்பார்த்துக் காத்திருப்பதுதான் கஷ்டம்.,5
தான்பிரீன்_தொடரும்_பயணம்,திப்பெரரி நண்பர்கள் ஆபத்துக்கு உதவத் தவறி விட்டனர்.,6
தான்பிரீன்_தொடரும்_பயணம்,தான்பிரீன் வேறு எங்கிருந்து உதவி பெறலாமெனச் சிந்தித்தான்.,6
தான்பிரீன்_தொடரும்_பயணம்,அவ்வண்ணமே அவர்களுக்குச் செய்தி அனுப்பி உதவிக்கு வரும்படி வேண்டினான்.,7
தான்பிரீன்_தொடரும்_பயணம்,கால்ட்டீ வீரர்கள் தகவல் கிடைத்த மறுநிமிஷமே ஐந்து பேர்களை அனுப்பி வைத்தனர்.,9
தான்பிரீன்_தொடரும்_பயணம்,கால்ட்டீ தொண்டர்களுடைய பெயர்களாவன ஈமன் ஓப்ரியன்.,5
தான்பிரீன்_தொடரும்_பயணம்,"ஜேம்ஸ் கான்லன், ஜே.",3
தான்பிரீன்_தொடரும்_பயணம்,"ஓப்ரியன், ஸீன் லிஞ்ச், மார்ட்டின் போலீ.",5
தான்பிரீன்_தொடரும்_பயணம்,அந்த இரு வாலிபரும் அயர்லாந்துக்காகச் சிரித்த முகத்துடன் உயிரைப் பலி கொடுத்தனர்.,9
தான்பிரீன்_தொடரும்_பயணம்,கால்ட்டீ துணைவர்களைச் சேர்த்து தான்பிரீன் படையில் மொத்தம் எட்டுப் பேர்கள் இருந்தனர்.,9
தான்பிரீன்_தொடரும்_பயணம்,ஐந்து பேர்களுக்கு ஆயுதங்கள் இருந்தன மூவர் நிராயுத பாணிகள்.,7
தான்பிரீன்_தொடரும்_பயணம்,எல்லோரும் கூடிஆலோசித்ததில் முன்போட்டதிட்டம் சிறிது மாற்றப்பட்டது.,5
தான்பிரீன்_தொடரும்_பயணம்,"ஸீன்டிரீஸியும், ஸிமஸ் ராபின்ஸனும், தான்பிரீனும், அடுத்த ஸ்டேஷனுன நாக்லாங்குக்கு சைக்கிள்களிற் சென்றனர்.",9
தான்பிரீன்_தொடரும்_பயணம்,நாக்லாங் எமிலியிலிருந்து மூன்றாவது மைலில் இருந்தது.,5
தான்பிரீன்_தொடரும்_பயணம்,மற்ற ஸ்டேஷன்களில் எப்பொழுதும் போலிஸாரும் பட்டாளத்தாரும் தங்கியிருப்பார்கள் என்பதால் நாக்லாங் ஸ்டேஷனுக்கே செல்ல வேண்டும் என்று அவர்கள் புறப்பட்டார்கள்.,14
தான்பிரீன்_தொடரும்_பயணம்,அதன் பக்கத்தில் இரண்டு மைல்களுக்கு இடையில் போலிஸ் நிலையமே கிடையாது.,8
தான்பிரீன்_தொடரும்_பயணம்,"நாக்லாங்கிலும் காரியம் பலிக்கவில்லையானால், அடுத்த ஸ்டேஷனான பிளார்னிக்கு மோட்டாரில் செல்வது என்று அவர்கள் தீர்மானித்தனர்.",11
தான்பிரீன்_தொடரும்_பயணம்,மற்ற நால்வரும் எமிலிக்குச் சென்றனர்.,4
தான்பிரீன்_தொடரும்_பயணம்,தான்பீரினும் நண்பர் இருவரும் நாக்லாங் ஸ்டேஷனை அடையும் பொழுது முதல் மணி அடிக்கப்பட்டது.,10
தான்பிரீன்_தொடரும்_பயணம்,ரயில் எமிலியை விட்டுப் புறப்பட்டுவிட்டது என்பதை அது அறிவித்தது.,7
