work_title,sentence,sentence_length
தான்பிரீன்_தொடரும்_பயணம்,பார்ட்டன் என்ற ஐரிஷ் தேசாபிமானி ஒருவர் ஆங்கிலயரின் சிறையிலிருந்தார்.,7
தான்பிரீன்_தொடரும்_பயணம்,அரசாங்கத்தார் அவர்மீது ராஜத்துவேஷக் குற்றஞ்சாட்டிப் பத்து வருடத் தண்டனை விதித்தனர்.,8
தான்பிரீன்_தொடரும்_பயணம்,"சிறையில் கொலை, களவு செய்த குற்றவாளியைப் போல் அவரை மிகவும் கேவலமாக நடத்தி வந்தனர்.",11
தான்பிரீன்_தொடரும்_பயணம்,அவரை விடுதலை செய்து வெளியே கொண்டுவருவதற்காகத்தான் லூகாஸ் கைது செய்யப்பட்டார்.,8
தான்பிரீன்_தொடரும்_பயணம்,லிஞ்ச் தம்முடைய கைதிகள் மூவரையும் அழைத்துக்கொண்டு செல்லும் பொழுது அவர்கள் அரபி பாஷையில் ஏதோ பேசிக்கொண்டிருந்தனர்.,12
தான்பிரீன்_தொடரும்_பயணம்,அவர்கள் லிஞ்சையும் அவருடைய தொண்டர்களையும் திடீரென்று எதிர்த்துப் போராடித் தப்பிவிட வேண்டுமென்றே இரகசியாகப் பேசிக் கொண்டனர்.,12
தான்பிரீன்_தொடரும்_பயணம்,சில நிமிஷங்களுக்குள் அவர்கள் பேசியபடியே தொண்ர்கள் மீது பாய்ந்தனர்.,7
தான்பிரீன்_தொடரும்_பயணம்,இரு கட்சியாருக்கும் போராட்டம் முற்றியது.,4
தான்பிரீன்_தொடரும்_பயணம்,கர்னல் டான் போர்டுக்குக் காயம் பட்டது.,5
தான்பிரீன்_தொடரும்_பயணம்,தொண்டர்களே வெற்றி பெற்றனர்.,3
தான்பிரீன்_தொடரும்_பயணம்,லூகாஸை மட்டும் கைதியாக வைத்துக் கொண்டு பந்தோபஸ்தான ஓரிடத்தில் அவரையடைத்து வைக்கும்படி அனுப்பினார்.,10
தான்பிரீன்_தொடரும்_பயணம்,இரு தளகர்த்தாக்களை விடுதலை செய்ததிலிருந்து லிஞ்சின் தாராள சிந்தையும் தொண்டர்களுடைய கண்ணியமும் விளங்குகின்றன.,10
தான்பிரீன்_தொடரும்_பயணம்,ஆனால் இந்த உதவிக்குப் பட்டாளத்தார் என்ன கைம்மாறு செய்தனர்?,7
தான்பிரீன்_தொடரும்_பயணம்,மறுநாள் இரவில் பெர்மாய் நகரையே தீவைத்து எரித்தனர் ஸியாம் வெற்றியடைந்து விட்டார் என்ற கோபமே இதற்கெல்லாம் காரணம்.,13
தான்பிரீன்_தொடரும்_பயணம்,ஜெனரல் லூகாஸ் கண்ணியமான போர் வீரர்.,5
தான்பிரீன்_தொடரும்_பயணம்,அவர் தொண்டர்களிடம் ஐந்து வாரம் கைதியாயிருந்தார்.,5
தான்பிரீன்_தொடரும்_பயணம்,"தொண்டர்கள் அவரை மிக்க மரியாதையாக நடத்திவந்து வேண்டிய உணவு, உடை முதலிய சௌகரியங்களும் செய்து கொடுத்தனர்.",12
தான்பிரீன்_தொடரும்_பயணம்,அருவடைய பந்துக்களுக்கு அடிக்கடி கடிதம் எழுதுவதற்கு வசதிகள் அளித்தனர்.,7
தான்பிரீன்_தொடரும்_பயணம்,லூகாஸ் பின்னால் தப்பியோடிய காலத்திலும் தொண்டர்களுடைய உதவிகளை நன்றியறிதலுடன் ஒப்புக்கொண்டிருக்கிறார்.,8
தான்பிரீன்_தொடரும்_பயணம்,கடைசியாக அவர் சிறை வைக்கப்பட்டிருந்த இடம் கீழ் லிமெரிக்கிலிருந்த ஒரு வீடு.,9
தான்பிரீன்_தொடரும்_பயணம்,ஜூலை மாதம் முதல் இரவு அவர் மிகவும் சாமர்த்தியமாக அங்கிருந்து தப்பி ஓடி விட்டார்.,11
தான்பிரீன்_தொடரும்_பயணம்,இந்த விஷயம் முக்கியமான தொண்டர்களுக்கெல்லாம் பத்திரிகையைப் பார்த்த பின்பே தெரிய வந்தது.,9
தான்பிரீன்_தொடரும்_பயணம்,அக்காலத்தில் தொண்டர்கள் சர்க்காருக்கு மிகுந்த தொந்தரவு கொடுத்து வந்தனர்.,7
தான்பிரீன்_தொடரும்_பயணம்,ரயில்களையும் தபால்களைக் கொண்டு செல்லும் கார்களையும் மறித்து நிறுத்தினார்கள்.,7
தான்பிரீன்_தொடரும்_பயணம்,"அவற்றிலிருந்த கடிதங்களையும், பட்டாளத்தாரின் இரகசிய தஸ்தாவேஜுகளையும் கைப்பற்றிவந்தனர்.",6
தான்பிரீன்_தொடரும்_பயணம்,இதனால் அவர்களுக்கு எதிரிகளுடைய உடவடிக்கைகளை முன்கூட்டியே தெரிந்துக் கொள்ளச் சந்தர்ப்பம் கிடைத்தது.,9
தான்பிரீன்_தொடரும்_பயணம்,ஆங்காங்கேயிருந்த ஒற்றர்களில் எவர்கள் மிகவும் அயோக்கியர்கள் என்பதை அறிந்து கொண்டு அவர்களைத் தண்டிப்பதற்கும் அரசாங்க கடிதங்கள் உபயோகமாயிருந்தன.,13
தான்பிரீன்_தொடரும்_பயணம்,"சர்க்கார், தொண்டர்களுடைய தொல்லை பொறுக்கமாட்டாமல் தபாலைக் கொண்டு செல்லும் கார்களுடன் பட்டாளங்களையும் பாதுகாப்புக்காக அனுப்பிவர ஆரம்பித்தது.",12
தான்பிரீன்_தொடரும்_பயணம்,அவர்கள் நின்ற இடம் ஊலா கிராமத்திலிருந்து அரை மைல் தூரத்திலிருந்தது.,8
தான்பிரீன்_தொடரும்_பயணம்,அங்கிருந்து திப்பெரரி ஆறுமைல் லிமெரிக் பதினைந்து மைல் ஸாஹெட்பக் நான்குமைல்.,8
தான்பிரீன்_தொடரும்_பயணம்,இவ்விடங்களைச் சுற்றிலும் சமவெளிகள் இருந்தமையால் தப்பியோடுவதற்குப் போதிய செளகரியங்கள் இருந்தன.,8
தான்பிரீன்_தொடரும்_பயணம்,"ஊலாவில் ஒரு பீலர் படையும் அதற்கு இரண்டு மைலுக்கு அப்பால், லிமெரீக் சந்திப்பில் ஒரு பீலர்படையும் இருந்தன.",13
தான்பிரீன்_தொடரும்_பயணம்,ஆதலால் எந்த நிமிஷத்தில் என்ன நேருமென்று தெரியாமலிருந்தது.,6
தான்பிரீன்_தொடரும்_பயணம்,குறித்த நேரத்தில் பட்டாளத்தாருடைய கார் மிக வேகமாக ஓடிவந்தது.,7
தான்பிரீன்_தொடரும்_பயணம்,தொண்டர்கள் அதைக் குறிவைத்துச்சுட்டனர்.,3
தான்பிரீன்_தொடரும்_பயணம்,உடனே காருக்குள்ளேயிருந்த சிப்பாய்கள் அனைவரும் கீழே குதித்து மறைவாக நின்று கொண்டு பதிலுக்குச் சுட ஆரம்பித்தனர்.,12
தான்பிரீன்_தொடரும்_பயணம்,அதுவரை அமைதியாயிருந்த அந்த நாட்டுப் புறத்தில் திடீரென்று குண்டுகள் இடி இடித்தது போல முழங்க ஆரம்பித்தன.,12
தான்பிரீன்_தொடரும்_பயணம்,முதல் நிமிடத்திலேயே இரண்டு ஆங்கிலேயர்கள் குண்டுபட்டுத் தங்கள் துப்பாக்கிகளை எறிந்து விட்டுக் கீழே சாய்ந்து மடிந்தனர்.,12
தான்பிரீன்_தொடரும்_பயணம்,பட்டாளத்தார் தொண்டர்களுடைய குண்டு வந்த திசையைப் பார்த்துச் சுட்டுக்கொண்டேயிருந்தனர்.,7
தான்பிரீன்_தொடரும்_பயணம்,தொண்டர்கள் மொத்தம் பத்துப் பேரேயிருந்தனர் அவர்கள் ஒவ்வொருவரிடமும் பத்துமுறை கடுவதற்குத்தான் மருந்து இருந்தது.,10
தான்பிரீன்_தொடரும்_பயணம்,அந்நிலையில் திடீரென்று லிமெரிக் பக்கத்திலிருந்து மற்றொரு ராணுவக் காரும் வந்து கொண்டிருந்தததை அவர்கள் கண்ணுற்றுனர்.,11
தான்பிரீன்_தொடரும்_பயணம்,இவ்வாறு ஏற்படுமென்று அவர்கள் எதிர்ப்பார்க்கவில்லை.,4
தான்பிரீன்_தொடரும்_பயணம்,தற்செயலாக எதிரிகளுக்கு உதவியாட்கள் வந்துவிட்டனர் தொண்டர்கள் திகைத்தனர்.,6
தான்பிரீன்_தொடரும்_பயணம்,அவர்கள் பின்வாங்கி மெதுவாக வேறிடத்திற்குச் சென்றுவிடத் தீர்மானித்துப் புறப்பட்டனர்.,7
தான்பிரீன்_தொடரும்_பயணம்,தொண்டர் மறையும் பொழுதும் சிப்பாய்களைப் பார்த்துச் சுட்டுக் கொண்டே பின்வாங்கி வந்தனர்.,9
தான்பிரீன்_தொடரும்_பயணம்,அந்நேரத்தில் சிப்பாய்களுக்கு உதவியாக ஊலாவிலிருந்தும் ஆறு பீலர்கள் வந்து கொண்டிருந்தனர்.,8
தான்பிரீன்_தொடரும்_பயணம்,தொணடர்களிடம் போதிய குண்டுகளிருந்திருந்தால் அவர்கள் ஊலா போலிஸ் நிலையப் பக்கமாகச் சிலரை அனுப்பிச் சுடக் கொல்லியிருப்பார்கள்.,12
தான்பிரீன்_தொடரும்_பயணம்,குண்டோசைகேட்டால் பீலர்களில் எவனும் சிப்பாய்களின் உதவிக்காக வெளியே வந்திருக்கமாட்டான்.,7
தான்பிரீன்_தொடரும்_பயணம்,அதற்கும் வழியில்லாமற் போயிற்று.,3
தான்பிரீன்_தொடரும்_பயணம்,எனவே அவர்கள் யாருக்கும் காயப் படாமலும் உயிர்ச் சேதமில்லாமலும் போராட்டத்தில் இருந்து விலகிச் சென்று மறைந்துவிட்டனர்.,12
தான்பிரீன்_தொடரும்_பயணம்,எதிரிகளில் மூவர் இறந்தனர் மற்றும் மூவர் காயமடைந்தனர்.,6
தான்பிரீன்_தொடரும்_பயணம்,அங்கு போராடிய சிப்பாய்களுடன் ஜெனரல் லூகாஸும் நின்று கொண்டிருந்தார்.,7
தான்பிரீன்_தொடரும்_பயணம்,இவ்விஷயம் தொண்டர்களுக்கு மறுநாள் காலையில்தான் தெரியவந்தது.,5
தான்பிரீன்_தொடரும்_பயணம்,"தொண்டர்கள், சண்டையின்போது அவரை அடையான, கண்டு பிடிக்கவில்லை.",6
தான்பிரீன்_தொடரும்_பயணம்,மக்கள் கடைசி வலை போராடியே தீர வேண்டும் என்று உறுதி கொண்டனர்.,9
தான்பிரீன்_தொடரும்_பயணம்,பிளாக் அண்டு டான் பட்டாளத்தாருடைய கொடுமைகள் சகிக்க முடியாமல் இருந்தன.,8
தான்பிரீன்_தொடரும்_பயணம்,அவர்கள் வடுகளையும் தெருக்களையும் பயிர்களையும் கொளுத்திப் பல உயிர்களையும் வதைத்து வந்தார்கள்.,9
தான்பிரீன்_தொடரும்_பயணம்,அரசியல்வாதிகளைக் கைதுசெய்து கொண்டு போகும் பொழுது சுட்டுத்தள்ளி வந்தனர்.,7
தான்பிரீன்_தொடரும்_பயணம்,நித்திரை செய்துகொண்டிருந்த மக்கள் துப்பாக்கிகளுக்குப் பலியாகி வந்தனர்.,6
தான்பிரீன்_தொடரும்_பயணம்,யாருக்கும் உயிரும் சொத்தும் உரிமையாக இருக்கவில்லை.,5
தான்பிரீன்_தொடரும்_பயணம்,ஆதலால் மக்கள் ஒன்றும் செய்யாமல் வீடுகளிலிருந்து மடிவதைக் காட்டிலும புரட்சிப்படையிலே சேர்ந்து வீரமரணம் அடைவது மேலென்று கருதினார்கள்.,13
தான்பிரீன்_தொடரும்_பயணம்,அவர்கள் தொண்டர்களுக்கு உணவும் உடையும் கொடுத்ததோடு அவசியமான செய்திகளையும் துப்புகளையும் அறிந்து கூறி உதவி செய்து வந்தார்கள்.,13
தான்பிரீன்_தொடரும்_பயணம்,அதேசமயத்தில் தொண்டர் படையும் வலிமையடைந்து தீரமான பட்டாளமாகி விட்டது.,7
தான்பிரீன்_தொடரும்_பயணம்,அது ஐரீஷ் குடியரசுப் படை என்ற பெயருக்குப் பொருத்தமாயிருந்தது.,7
தான்பிரீன்_தொடரும்_பயணம்,முதலில் போராட்டத்தை ஆரம்பித்துவிட்டால் அது பின்னால் நாடெங்கும் பரவிவிடும் என்று அவன் கூறியிருந்தான்.,10
தான்பிரீன்_தொடரும்_பயணம்,அதன்படி தேசத்து வாலிபர்கள் சுதந்திரப்படையில் ஆயிரக்கணக்காய்ச் சேர்த்து வந்தனர்.,7
தான்பிரீன்_தொடரும்_பயணம்,ஐரிஷ் மக்கள் எவ்வளவு துன்பப்பட்டாயினும் சுதந்திரம் பெற்றே தீரவேண்டும் என்று விரதம் பூண்டனர்.,10
தான்பிரீன்_தொடரும்_பயணம்,அயர்லாந்தின் சுதந்திரத்தைக் கடைசிவரை நசுக்கியே தீரவேண்டும் என்று இங்கிலாந்தும் கண்மூடித்தனமாக வெறிகொண்ட செயல்களில் இறங்கி நின்றது.,12
தான்பிரீன்_தொடரும்_பயணம்,அத்திட்டத்தின்படி பறக்கும் தொண்டர் படை யென்று சில படைகளை நியமிக்க வேண்டும் என்பது அவன் நோக்கம்.,12
தான்பிரீன்_தொடரும்_பயணம்,அடிமை நாட்டில் அமைதி நிலவியிருந்தால் ஆள்வோருக்குத்தான் செளகரியம்.,6
தான்பிரீன்_தொடரும்_பயணம்,"ஆதலால், விடுதலை வேட்கையுள்ள மக்கள் ஆட்சி முறையை எப்பொழுதும் இடைவிடாது எதிர்த்துக்கொண்டே இருப்பார்கள்.",10
தான்பிரீன்_தொடரும்_பயணம்,இத்தகைய எதிர்ப்புக்குப் பறக்குந் தொண்டர் படை பெரிய உதவியாயிருக்கும் என்று தான்பிரீன் கருதினான்.,10
தான்பிரீன்_தொடரும்_பயணம்,தொண்டர் படையில் அதுவரை சேர்ந்திருந்த வாலிபர்களிற் பலர் தங்களுடைய சொந்த வேலைகளைப் பார்த்துக்கொண்டு இடையிடையேதான் தேசிய வேலைக்கு முன்வந்தனர்.,14
தான்பிரீன்_தொடரும்_பயணம்,அவர்கள் முழுநேரத் தொண்டர்களாக இருக்கவில்லை.,4
தான்பிரீன்_தொடரும்_பயணம்,இதனால் முக்கியமான சந்தர்ப்பங்களில் மிகுந்த நஷ்டங்கள் ஏற்பட்டன.,6
தான்பிரீன்_தொடரும்_பயணம்,நாக்லாங்கில் ஸீன் ஹோகனை மீட்பதற்காக உதவிப்படை அனுப்பும்படி தான்பிரீன் திப்பெரரிக்குச் சொல்லியனுப்பி ஏமாந்து போனதன் காரணம் இதுவே.,13
தான்பிரீன்_தொடரும்_பயணம்,"பாதிநேரம் வேலை செய்தவர்கள், திடீரென்று வெளிவந்து எந்தக்காரியத்திலும் கலந்து கொள்ள முடியாது.",9
தான்பிரீன்_தொடரும்_பயணம்,"அவர்கள் பகல் முழுவதும் சொந்தத் தொழில்களைப் பார்த்து விட்டு, இரவில்தான் தேச ஊழியத்திற்கு வரமுடிந்தது.",11
தான்பிரீன்_தொடரும்_பயணம்,மேலும் மறுநாள் காலையில் அவர்கள் தங்கள் வீடுகளுக்குத் திரும்பிவிடுவார்கள்.,7
தான்பிரீன்_தொடரும்_பயணம்,நல்ல யுத்த வீரர்களுக்கு வேண்டிய பயிற்சியை அவர்களுக்கு அளிக்கமுடியவில்லை.,7
தான்பிரீன்_தொடரும்_பயணம்,எல்லா விஷயங்களைப் பார்க்கிலும் ஒரு பெருங்குறை அவர்களிடமிருந்தது.,6
தான்பிரீன்_தொடரும்_பயணம்,"அவர்கள் பெரும்பகுதியான நேரத்தை அமைதியான வாழ்க்கையிலே கழிந்து வந்ததால், போரின் ஆவேசம் அவர்களிடம் அதிகம் காணப்பட வில்லை.",13
தான்பிரீன்_தொடரும்_பயணம்,"எப்போழுதும் போரில் ஈடுபட்டு, இரவும் பகலும் பாசறையையும் படையையும் பகைவனையும் பற்றி எண்ணிக்கொண்டிருப்பவர்களே வீராவேசத்துடன் இருக்க முடியும்.",13
தான்பிரீன்_தொடரும்_பயணம்,அதன்படி வாலிபர்களும் நூற்றுக்கணக்காக முன்வந்தனர்.,4
