work_title,sentence,sentence_length
தான்பிரீன்_தொடரும்_பயணம்,தான்பிரீன் மாட்சிமை தங்கிய சக்கரவர்த்தியின் விருந்தினராகச் சிறைசெல்வதற்கு விரும்பவில்லை.,7
தான்பிரீன்_தொடரும்_பயணம்,"வெளியிலே பல வேலைகள் காத்து நிற்கும் பொழுது, மாமனார் வீட்டில் விருந்துண்ன என்ன அவசரம்?",11
தான்பிரீன்_தொடரும்_பயணம்,அவனும் ஸீன்டிரீஸியும் வீட்டைவிட்டு வெளியேறி வெளியிடங்களுக்குச் சென்று போலிஸ் புலிகளின் கண்ணில் படாமல் மறைந்தனர்.,11
தான்பிரீன்_தொடரும்_பயணம்,ஆனால் சில நாட்களில் ஸீன் போலிசாரால் கைது செய்யப்பட்டான்.,7
தான்பிரீன்_தொடரும்_பயணம்,அவன் கார்க் நகரத்து ஜெயிலில் கொண்டுவைக்கப்பட்டான்.,5
தான்பிரீன்_தொடரும்_பயணம்,அங்கே வேறு பல புரட்சித் தலைவர்கள் இருந்தனர்.,6
தான்பிரீன்_தொடரும்_பயணம்,ஸீன் அவர்களோடு கலந்து பின்னால் செய்ய வேண்டிய காரியங்களுக்குத் திட்டங்கள் வகுத்துக் கொண்டிருந்தான்.,10
தான்பிரீன்_தொடரும்_பயணம்,புரட்சிக்காரர்களைச் சிறைகளில் அடைத்து வந்தது அவர்களுக்கு விசேஷ உதவியாக இருந்தது.,8
தான்பிரீன்_தொடரும்_பயணம்,பல புரட்சிக்காரர்கள் சிறையில் வைத்துத்தான் ராணுவப் பயிற்சி பெற்று வெடிகுண்டு செய்யவேண்டிய வழிகளைத் தெரிந்து கொண்டார்கள்.,12
தான்பிரீன்_தொடரும்_பயணம்,ஆதலால் சிறைச்சாலையே புரட்சிக்காரர்களின் சர்வகலாசாலை என்பது பொருந்தும்.,6
தான்பிரீன்_தொடரும்_பயணம்,ஸீன்டிரிஸ் ராணுவ நீதி மன்றத்தில் விசாரிக்கப்பட்டு இரண்டு வருஷம் தண்டனை அடைந்தான்.,9
தான்பிரீன்_தொடரும்_பயணம்,ஆனால் எட்டு மாதத்திற்குப்பிறகு விடுதலை செய்யப்பட்டான்.,5
தான்பிரீன்_தொடரும்_பயணம்,இந்த விசாரனையெல்லாம் வீண் ஆடம்பரத்தைத் தவிர வேறில்லை.,6
தான்பிரீன்_தொடரும்_பயணம்,ஏனென்றால் தேசியத்தொண்டார்கள் எதிர் வழக்காடுவதில்லை.,4
தான்பிரீன்_தொடரும்_பயணம்,பிரிட்டிஷ் நீதி மன்றத்திற்குத் தங்களை விசாரிப்பதற்கு உரிமையே கிடையாது என்று அவர்கள் கூறிவந்ததார்கள்.,10
தான்பிரீன்_தொடரும்_பயணம்,விசாரணை நடந்து கொண்டிருக்கும் சாட்சிகள் போலீஸார் கட்டிக் கொடுத்த பொய் மூட்டைகளை அவிழ்த்து அளந்து கொண்டிருப்பார்கள்.,12
தான்பிரீன்_தொடரும்_பயணம்,அதேசமயத்தில் குற்றங்சாட்டப் பெற்றுக் கைதிக் கூண்டில் நிற்கும் தொண்டர்கள் பத்திரிகைகளைப் படித்துக் கொண்டிருப்பார்கள்.,10
தான்பிரீன்_தொடரும்_பயணம்,விசாரணையையும் தண்டனையையும் அவர்கள் ஒரு துரும்பாகக்கூட மதிக்கவில்லை.,6
தான்பிரீன்_தொடரும்_பயணம்,சிரித்த தாமரை மலர் போன்ற முகத்துடன் அவர்கள் சிறைசென்றவண்ணமாயிருந்தனர்.,7
தான்பிரீன்_தொடரும்_பயணம்,அடிமை நாட்டிலும் அந்த ஆட்சியுள்ள நாட்டிலும் கண்ணியமானவர்கள் இருக்க வேண்டிய இடம் சிறைதானே !,10
தான்பிரீன்_தொடரும்_பயணம்,சிறைக் கோட்டங்கள் மண்ணுலகில் மனிதனால் படைக்கப்பட்ட நகரங்கள்.,6
தான்பிரீன்_தொடரும்_பயணம்,"பெரும்பாலும் கொலை, களவு செய்து சிறைசெல்லுவோர் வாழ்க்கையில் மிகுந்த தாழ்ந்தபடியிலுள்ளவர்கள்.",8
தான்பிரீன்_தொடரும்_பயணம்,அவர்களுக்கே சிறைத் தண்டனை நரக வேதனையாகும்.,5
தான்பிரீன்_தொடரும்_பயணம்,"ஆனால் உலகம் தோன்றிய நாள்முதல், அரசியலில் மாறுபட்ட கருத்துக்கொண்டவர்களுக்கும் பழையமூப்படைந்த மூடக் கொள்கைகளை எதிர்பவர்களுக்கும் சிறையே வீடாக அமைந்துள்ளது.",14
தான்பிரீன்_தொடரும்_பயணம்,விதை கெடாமல் முளைவராது.,3
தான்பிரீன்_தொடரும்_பயணம்,பிறர் நலம் பேணுவோர் சிலுவையைத் தாங்கித் துன்புறாமல் முடியாது.,7
தான்பிரீன்_தொடரும்_பயணம்,ஆதலால் நல்லோருடைய யாத்திரா மார்க்கத்தில் சிறை ஒரு படை வீடு பயிற்சி நிலையம்.,10
தான்பிரீன்_தொடரும்_பயணம்,"ஆனால் சிறையில் தேசபக்தர்களுக்கு, ஆடும், மாடும் உண்ண மறுக்கும் ஆபாசமான உணவு கொடுக்கப்பட்டால் யாரிடம் முறையிடமுடியும்?",12
தான்பிரீன்_தொடரும்_பயணம்,உண்ணாவிரதம் என்னும் உயரிய ஆயுதம் மட்டுமே மட்டுமே அவர்களுக்கு ஆபத்தில் உதவுகிறது.,9
தான்பிரீன்_தொடரும்_பயணம்,இந்த ஆயுதத்தை அயர்லாந்தின் வீரர்களும் பல சமயம் உபயோகிக்கும் படி நேர்ந்தது.,9
தான்பிரீன்_தொடரும்_பயணம்,ஸின் முதலிய ஐரிஷ் தேசபக்தர்கள் தாங்கள் அந்நிய அரசாங்கத்தால் மிருகங்களிலும் கேவலமாக நடக்கப்பட்டதை எதிர்த்துப் போராட உண்ணாவிரதத்தையே மேற்கொண்டனர்.,14
தான்பிரீன்_தொடரும்_பயணம்,அவர்கள் யுத்தக் கைதிகள்.,3
தான்பிரீன்_தொடரும்_பயணம்,யுத்தக் கைதிகளுக்குரிய மரியாதையையே அவர்கள் வேண்டினார்கள்.,5
தான்பிரீன்_தொடரும்_பயணம்,ஆனால் அரசாங்கத்தார் அவர்களை டப்ளின் நகரச் சிறையில் கொண்டுபோய் வைத்தார்கள்.,8
தான்பிரீன்_தொடரும்_பயணம்,அங்கு அதிகாரிகள் அவர்களுக்குப் பலவந்தமாய் உணவு ஊட்டினார்கள்.,6
தான்பிரீன்_தொடரும்_பயணம்,"இந்தக் கொலை, தேசத்தை எழுப்பி விட்டது.",5
தான்பிரீன்_தொடரும்_பயணம்,ஜனங்கள் கோபங்கொண்டு பொங்கினர்.,3
தான்பிரீன்_தொடரும்_பயணம்,ஐரிஷ் தேசபக்தர்கள் எண்ணியதை நிறைவேற்றும் உறுதியுடையவர்கள் என்பதையும் அப்பொழுது முதன் முறையாக அரசாங்கத்தார் தெரிந்து கொண்டார்கள்.,12
தான்பிரீன்_தொடரும்_பயணம்,இதன் பின்பு அரசாங்கத்தார் உண்ணாவிரதம் இருந்தவர்களோடு ஒப்பந்தம் செய்து கொள்ள இசைந்தனர்.,9
தான்பிரீன்_தொடரும்_பயணம்,"அது முதல் அவர்களை அரசியல் கைதிகளாக, யுத்தக் கைதிகளாக நடத்துவதாக அரசாங்கத்தார் உறுதி கூறினர்.",11
தான்பிரீன்_தொடரும்_பயணம்,பின்னால் பலவந்தமாக உணவூட்டும் முறை கையாளப்படவில்லை.,5
தான்பிரீன்_தொடரும்_பயணம்,ஸின் சிறையின் புழுங்கிய காலத்தில் அவன் தோழன் தான்பிரீன் சும்மா இருக்கவில்லை.,9
தான்பிரீன்_தொடரும்_பயணம்,"அவன் சுற்றியிருந்த பல கிராமங்களுக்குச் சென்று, தொண்டர் படைகளைத் திரட்டிப் பயிற்சி கொடுத்து வந்தான்.",11
தான்பிரீன்_தொடரும்_பயணம்,அதே வேளையில் நாடு முழுவதிலும் தொண்டர்படைகள் மிகத் திறம்படப் பயிற்சி பெற்றுவந்தனர்.,9
தான்பிரீன்_தொடரும்_பயணம்,ஆனால் இடையில் பிரிட்டிஷ் அரசாங்கத்தார் தங்களுடைய பரம்பரை வழக்கப்படி கைதிகளுக்குக் கொடுத்த வாக்குறுதியைக் காற்றில் பறக்கவிட்டனர்.,12
தான்பிரீன்_தொடரும்_பயணம்,அப்பொழுது டண்டாக் சிறைக்கு மாற்றப்பட்டிருந்த ஸினும் அவன் தோழர்களும் மீண்டும் உண்ணாவிரதத்தை மேற்கொண்டனர்.,10
தான்பிரீன்_தொடரும்_பயணம்,அவர்கள் பின்னால் விடுதலை செய்யப்பட்டனர்.,4
தான்பிரீன்_தொடரும்_பயணம்,இவ்வளவு காலமாகத் தொண்டர்படையின் பயிற்சி ரகசியமாகவே நடந்து வந்தது.,7
தான்பிரீன்_தொடரும்_பயணம்,திடீர்ரென்று பிரிட்டிஷ் படைகள் கிராமங்களுக்குச்சென்று சில தொண்டர்களைப் பிடித்துக் கொண்டு சென்றன.,9
தான்பிரீன்_தொடரும்_பயணம்,ஏனென்றால் அரசாங்கம் தொண்டர்களை ஒழுங்காகக் கைது செய்ய ஆரம்பித்தால் பல்லாயிரக்கணக்காக முன்வரும் தொண்டர்களை வைப்பதற்கு அயர்லாந்திலுள்ள சிறைகளும் போதாது.,14
தான்பிரீன்_தொடரும்_பயணம்,பின் உலகமெல்லாம் இங்கிலாந்தைக் கண்டு எள்ளிநகையாடும்.,5
தான்பிரீன்_தொடரும்_பயணம்,எனவே இங்கிலாந்தும் சும்மாகிடந்த சங்கை ஊதிக்கெடுக்க விரும்பவில்லை.,6
தான்பிரீன்_தொடரும்_பயணம்,ஐரிஷ் தொண்டர்களுக்கு ஆயுதம் இல்லாமையே பெருங்குறையாக இருந்தது.,6
தான்பிரீன்_தொடரும்_பயணம்,தேசத்தில் யாரும் அரசாங்க உத்தரவில்லாமல் துப்பாக்கி வைத்திருக்கக்கூடாது என்று உத்தரவு போடப்பட்டது.,9
தான்பிரீன்_தொடரும்_பயணம்,அடுத்த கலகம் வெகுவிரைவில் வந்துவிடும் என்பதை அரசாங்கம் மோப்பம்பிடித்து அறிந்து கொண்டிருந்தது.,9
தான்பிரீன்_தொடரும்_பயணம்,கைது செய்யப்பட்டது முதலே அவன் உண்ணாவிரதத்தை மேற்கொண்டான்.,6
தான்பிரீன்_தொடரும்_பயணம்,சிறையில் வேறு பல நண்பர்களும் அவனுடன் சேர்ந்து கொண்டனர்.,7
தான்பிரீன்_தொடரும்_பயணம்,"அவர்களில் முக்கியமானவர்கள் மைக்கேல் பிரென்னன், ஸீமாஸ், ஓநீல்.",6
தான்பிரீன்_தொடரும்_பயணம்,தொண்டர் படையில் ஒவ்வொர் அங்கத்தினரும் வாக்குரிமை பெற்றுத்தத்தம் பிரிவுகளுக்கு ஒரு தலைவனைத் தேர்ந்தெடுத்துக்கொள்வது வழக்கம்.,11
தான்பிரீன்_தொடரும்_பயணம்,படையிலும் குடியரசுக் கொள்கையையே அவர்கள் கையாண்டு வந்தனர்.,6
தான்பிரீன்_தொடரும்_பயணம்,அக் காலத்தில் ஐரோப்பிய யுத்தத்தில் ஆங்கிலேயர் மிகுந்த கஷ்ட நஷ்டங்களை அடைந்து வந்தனர்.,10
தான்பிரீன்_தொடரும்_பயணம்,ஓர் ஆயிரத்து தொள்ளாயிரத்து பதினெட்டு  ஆம் ஆண்டு மார்கழி மாதம் ஜெர்மானியர் பிரிட்டிஷ் படைக்குள் புகுந்து அவற்றைச்சின்னா பின்னப்படுத்தினார்.,14
தான்பிரீன்_தொடரும்_பயணம்,மன்னர் பேச்சுக்கு மறுபேச்சு ஏது?,4
தான்பிரீன்_தொடரும்_பயணம்,ஆங்கிலேயர் அனைவரும் அயர்லாந்தின் மன்னரன்றோ சில வாரங்களில் தேவையான சட்டம் பார்லிமெண்டில் நிறைவேற்றப்பட்டது.,10
தான்பிரீன்_தொடரும்_பயணம்,ஐரிஷ் மக்கள் விரும்பினாலும் விரும்பாவிடினும் அவர்களைப் போர்க்களத்திலே பலிக்குக் கொண்டு நிறுத்தும் அதிகாரத்தை அச்சட்டம் ஆங்கிலேயருக்கு கொடுத்தது.,13
தான்பிரீன்_தொடரும்_பயணம்,அப்பொழுது முன் அத்தியாயத்தில் சொல்லப்பட்ட லார்ட் பிரெஞ்ச் டப்ளின் நகரில் வைசிராயாக இருந்தார்.,10
தான்பிரீன்_தொடரும்_பயணம்,"கட்டாய ராணுவச்சட்டம், அயர்லாந்தின் கண்ணைத் திறந்துவிட்டது.",5
தான்பிரீன்_தொடரும்_பயணம்,அதுவரை ஐரிஷ் ஜனங்கள் பிரிட்டிஷாரை அவ்வளவு கடுமையாய் எதிர்த் தில்லை.,8
தான்பிரீன்_தொடரும்_பயணம்,"ஆண், பெண், குஞ்சுகள் யாவரும் அச்சட்டத்தை எதிர்த்தனர்.",6
தான்பிரீன்_தொடரும்_பயணம்,பாமரர் முதல் பாதிரியார் வரை அனைவரும் அதைக் கண்டித்தனர்.,7
தான்பிரீன்_தொடரும்_பயணம்,அதுவரை பிளவுபட்டிருந்த கட்சிகளெல்லாம் மந்திரத்தில் கட்டுண்டதுபோல் ஒன்று சேர்ந்து உழைத்தனர்.,8
தான்பிரீன்_தொடரும்_பயணம்,தாங்கவொண்ணாத துன்பம் தலைமேல் விழப்போவதை அறிந்த ஜனங்கள் தொண்டர் படையினர் என்ன செய்கின்றனர்?,10
தான்பிரீன்_தொடரும்_பயணம்,அவர்கள் துப்பாக்கியும் ரிவால்வரும் கொண்டு பயிற்சி செய்தது வெறும் பாவனைக்காகவோ?,8
தான்பிரீன்_தொடரும்_பயணம்,அவர்களே என்று யாவரும் உணர்ந்தனர்.,4
தான்பிரீன்_தொடரும்_பயணம்,தொண்டர் படையில் ஆட்களுக்குக் குறைவில்லை ஆயுதத்திற்கே முடை !,6
தான்பிரீன்_தொடரும்_பயணம்,பல்லாயிரம் வாலிபர்கள் அப்படையில் சேர்ந்து கொண்டனர்.,5
தான்பிரீன்_தொடரும்_பயணம்,ஆனால் காற்றுக்கூடப் புகமுடியாதபடி பாதுகாக்கும் ஆங்கிலேயர் கண்முன்பு அத்தனை பேருக்கும் ஆயுதங்களைச் சேர்ப்பது எங்ஙனம்?,11
தான்பிரீன்_தொடரும்_பயணம்,தொண்டர்கள் திகைத்துத் தவித்துக் கொண்டிருந்தனர்.,4
தான்பிரீன்_தொடரும்_பயணம்,அவர்கள் கைகள் ஆயுதந்தாங்கத் துடித்துக் கொண்டிருந்தன.,5
தான்பிரீன்_தொடரும்_பயணம்,கால்கள் போர்க்களத்திற்கு செல்ல முனைந்து நின்றன.,5
தான்பிரீன்_தொடரும்_பயணம்,அந்நிலையில் அவர்கட்கு ஒரு விஷயம் ஞாபகத்திற்கு வந்தது.,6
தான்பிரீன்_தொடரும்_பயணம்,ராஜவிசுவாசிகளுக்கு இத்தனை ஆயுதங்களும் எதற்கு?,4
தான்பிரீன்_தொடரும்_பயணம்,புரட்சிக்காரருக்கே அவை தேவை !,3
தான்பிரீன்_தொடரும்_பயணம்,"தொண்டர்கள் இதை அறிந்து கொண்டு, ஊரூராய்ப் பிரிந்து சென்று ஆயுதம் சேகரிக்க ஏற்பாடு செய்தார்கள்.",11
தான்பிரீன்_தொடரும்_பயணம்,"முதலாவது எந்த ஊரில், யாரிடம், எத்தனை ஆயுதங்கள் உண்டு என்பதற்குக் கணக்கெடுத்தார்கள்.",9
தான்பிரீன்_தொடரும்_பயணம்,கணக்குப்படி ஆயுதங்களைக் கீழே வைக்கும்படி ஆங்காங்கு இரவில் சென்று கேட்டார்கள்.,8
தான்பிரீன்_தொடரும்_பயணம்,பலர் சமாதானமாகவே ஆயுதங்களைக் கொடுத்துவிட்டார்கள்.,4
தான்பிரீன்_தொடரும்_பயணம்,பலர் தங்களிடமுள்ள ஆயுதங்களை விரைவாக வந்து பெற்றுக்கொள்ள வேண்டுமென்று அழைப்பும் அனுப்பினார்கள் சிலர் மட்டும் மறுத்தார்கள்.,12
தான்பிரீன்_தொடரும்_பயணம்,"மறுத்தவர்கள் மார்புக்கு நேராகத் தொண்டர்கள் துப்பாக்கிகளைப் பிடித்தவுடன், அந்த மறுப்பும் ஒழிந்தது.",9
தான்பிரீன்_தொடரும்_பயணம்,ஓர் உயிரையும் வதையாமலே தொண்டர்களுக்குத் தேசத்திலிருந்த ஆயுதங்களெல்லாம் வந்து சேர்ந்தன.,8
