work_title,sentence,sentence_length
திருக்குறள்_கட்டுரைகள்,"ஏனெனில், செல்வமானது ஊக்கமுடைய மக்களின் இருப்பிடத்தைத் தானே தேடிப் போய்ச் சேரும் தன்மை வாய்ந்தது.",11
திருக்குறள்_கட்டுரைகள்,"உடல் முழுவதும் அம்புகளால் தாக்கப்பட்ட போதிலும் கூட, யானையானது பெருமித நடைபோடுவதில் தவறுவதில்லை.",10
திருக்குறள்_கட்டுரைகள்,"ஊக்கமுள்ள மக்கள் நல்லதை, உயர்வை, பெரியதை எண்ணி, அவைகளை அடைய முயற்சிப்பர்.",9
திருக்குறள்_கட்டுரைகள்,"ஒருக்கால் தோல்வி அடையினும், அவற்றைப் பெற மீண்டும் மீண்டும் முயற்சிப்பர்.",8
திருக்குறள்_கட்டுரைகள்,மற்றவர்களைவிட நாம் உயர்ந்தவர்கள் என்று பெருமை கொள்ளும் சிறப்பு ஊக்கமில்லாதவர்க்கு இல்லை.,9
திருக்குறள்_கட்டுரைகள்,"இவை வள்ளுவரது கருத்துக்கள், உள்ளத்தில் ஊக்கமில்லாதவர்க்குச் சுற்றுப்புறச் சூழ்நிலை நன்கு அமைந்திருந்தாலும், வாய்ப்பும் வசதியும் மிகுந்திருந்தாலும் பயனில்லை.",13
திருக்குறள்_கட்டுரைகள்,"வாழ்வில் ஒளி தோன்ற வேண்டுமானால், உள்ளத்தில் ஊக்கம் தோன்றியாக வேண்டும்.",8
திருக்குறள்_கட்டுரைகள்,"ஏன்? எனில், எண்ணிய எண்ணியாங்கு எய்துவர் என்பது பொய்யா மொழி.",8
திருக்குறள்_கட்டுரைகள்,எப்போது? எனில் எண்ணியவர் திண்ணியராகும் போது தான்.,6
திருக்குறள்_கட்டுரைகள்,படியுங்கள் மற்றொருமுறை இக்குறளை.,3
திருக்குறள்_கட்டுரைகள்,உடையர் எனப்படுவது ஊக்கம் அஃதிலார் உடையது உடையரோ மற்று?,7
திருக்குறள்_கட்டுரைகள்,பிற குறள்களையும் படியுங்கள்.,3
திருக்குறள்_கட்டுரைகள்,அவற்றின் ஆழ்ந்த கருத்துக்களை யெல்லாம் உங்கள் உள்ளத்தே பதித்து வையுங்கள்.,8
திருக்குறள்_கட்டுரைகள்,"சிந்திப்பதைச் சிந்தித்து, செய்வதை ஊக்கத்தோடு செய்து, சிறப்பெய்தி வாழுங்கள்.",7
திருக்குறள்_கட்டுரைகள்,﻿மெய்வேல் பறியா நகும் !,3
திருக்குறள்_கட்டுரைகள்,கைவேல் களிற்றொடு போக்கி வருபவன் மெய்வேல் பறியா நகும் என்பது திருக்குறளில் உள்ள ஒரு குறள்.,12
திருக்குறள்_கட்டுரைகள்,இக்குறள் படைச்செருக்கு என்ற அதிகாரத்தில் வந்துள்ளது.,5
திருக்குறள்_கட்டுரைகள்,"படைச்செருக்கு என்பது படையின் தன்மை, வீரனின் திறம், வீரனின் சிறப்பு என்றாகும்.",9
திருக்குறள்_கட்டுரைகள்,உலக மக்கள் பலரிடமும் காணப்படுகின்ற வீரத்திற்கும் தமிழகத்திற் காணப்பெறும் வீரத்திற்கும் வேறுபாடு உண்டு.,10
திருக்குறள்_கட்டுரைகள்,தமிழகத்தின் வீரம் ஒரு தனிப் பண்பு வாய்ந்தது.,6
திருக்குறள்_கட்டுரைகள்,"இதனைத் தமிழ் வீரம் என்றும், தமிழர் வீரம் என்றும் கூறுவதுண்டு.",8
திருக்குறள்_கட்டுரைகள்,எனினும் வள்ளுவரது குறள் அதனை இன்னும் தெளிவாக்கிக் காட்டுகிறது.,7
திருக்குறள்_கட்டுரைகள்,தமிழர் முயல் வேட்டைக்குச் செல்லுவதைவிட யானை வேட்டைக்குச் செல்லுவதையே பெரிதும் விரும்புவர் அவரது எண்ணம் அத்தகையது.,12
திருக்குறள்_கட்டுரைகள்,"முயலைக் கொன்று வெற்றிபெறுவதைவிட, யானையை எய்து தோல்வியடைவதையே பெருமையாகக் கொள்வர் அவரது கொள்கை அத்தகையது.",11
திருக்குறள்_கட்டுரைகள்,தம்மின் வலிமைகுறைந்த எவரையும் தமிழர் தாக்குவதில்லை.,5
திருக்குறள்_கட்டுரைகள்,அவரது அறம் அத்தகையது.,3
திருக்குறள்_கட்டுரைகள்,"தம்மோடு ஒத்த, அல்லது உயர்ந்த வலிமையுடையவரோடு மட்டுமே போரிடுவர்.",7
திருக்குறள்_கட்டுரைகள்,அவரது போராண்மை அத்தகையது.,3
திருக்குறள்_கட்டுரைகள்,போர்க்களத்தில் பகைவரை வெகுண்டு நோக்குவர்.,4
திருக்குறள்_கட்டுரைகள்,விழித்துப் பார்க்கும் அக்கண்களை நோக்கி வேல்கள் பறத்துவரும்.,6
திருக்குறள்_கட்டுரைகள்,"அப்பொழுதுங்கூட, அவர்கள் விழித்த கண்களை இமைப்பதே இல்லை.",6
திருக்குறள்_கட்டுரைகள்,அவரது போர் ஆண்மை அத்தகையது.,4
திருக்குறள்_கட்டுரைகள்,"இவைபோன்ற பழந்தமிழ் வீரர்களின் பண்பாட்டினை திருக்குறள் நிலைத்து நின்று, இன்றும் நமக்குக் காட்டிக் கொண்டிருக்கிறது.",11
திருக்குறள்_கட்டுரைகள்,இக்கட்டுரையின் தலைப்பில் இருக்கும் குறள் ஒரு போர் வீரனின் சிறந்த வலிமையைக் காட்டும் உயர்ந்த ஓவியமாகும்.,12
திருக்குறள்_கட்டுரைகள்,"வீரன் போர்க்களம் புகுந்தான், அவனுக்கு வேல் ஒன்றே படைக் கருவியாக இருந்தது.",9
திருக்குறள்_கட்டுரைகள்,பகைவனது யானை ஒன்று அவனைக் கொல்லவந்தது.,5
திருக்குறள்_கட்டுரைகள்,அதன்மீது குறிபார்த்து வேலை எறிந்தான்.,4
திருக்குறள்_கட்டுரைகள்,யானையொடு வேலும் போய் விட்டது.,4
திருக்குறள்_கட்டுரைகள்,அப்போது பகைவனால் எறியப் பெற்ற வேல் ஒன்று அவன் மார்பின் மீது பாய்ந்தது.,10
திருக்குறள்_கட்டுரைகள்,வீரன் அதனைப் பிடுங்கிக் கொண்டு நகைத்தான் என்பதே இக் குறள் கூறும் வரலாறு.,10
திருக்குறள்_கட்டுரைகள்,அன்றி களிற்றினது உடலில் புகுந்து அதன் உயிரைப் போக்கித் தானும் அதன் உடலில் அழுந்தி மறைந்துபோயிற்று என்பதா?,13
திருக்குறள்_கட்டுரைகள்,எனினும் இவை இரண்டுமே வீரனுக்கு வெற்றி தருவனவாகும்.,6
திருக்குறள்_கட்டுரைகள்,வெற்றிபெற்ற இவன் தன் கை வெறுமையாயிருப்பதைக் கண்டு மறுபடியும் ஒரு கருவியைப் பெறப் போர்க் களத்திலிருந்து திரும்புகிறான்.,13
திருக்குறள்_கட்டுரைகள்,வீரன் திரும்பி வரும் செய்தியைக் குறளில் உள்ள வருபவன் என்ற சொல்லால் அறிய முடிகிறது.,11
திருக்குறள்_கட்டுரைகள்,அப்போது மாற்றான் குறி வைத்து எறிந்த வேல் ஒன்று இவன் மார்பின் மீது வந்து பாய்கிறது.,12
திருக்குறள்_கட்டுரைகள்,அதைத் தன் கைகளிற் பற்றிப் பறித்துக் கொண்டே நகைக்கிறான்.,7
திருக்குறள்_கட்டுரைகள்,நகும் என்பது நகுதல் என்றாகிறது.,4
திருக்குறள்_கட்டுரைகள்,"இது நகைத்தல், சிரித்தல், களித்தல், மகிழ்தல் என்பவைகளைக் குறிக்கும்.",7
திருக்குறள்_கட்டுரைகள்,வீரன் ஏன் நகைத்தான்?,3
திருக்குறள்_கட்டுரைகள்,"என்று எண்ணும் பொழுதே, நமக்கு ஒரு வியப்பு உண்டா கிறது.",8
திருக்குறள்_கட்டுரைகள்,தேடிச்சென்ற கருவி வழியிலேயே தானே வலிய வந்து அகப்பட்டுவிட்டதே என எண்ணி நகைக்கிறானோ?,10
திருக்குறள்_கட்டுரைகள்,அவ்விதமாயின் இது மகிழ்ச்சிச் சிரிப்பாகும்.,4
திருக்குறள்_கட்டுரைகள்,மார்பில் தைத்த வேல் ஊடுருவிச் சென்று தன்னை வீழ்த்திவிடாமல் கையாற் பறித்து எடுக்கும் அளவில் மட்டும் தைத்ததேயென்று நகைக்கிறானோ?,14
திருக்குறள்_கட்டுரைகள்,அவ்விதமாயின் இது வெற்றிச் சிரிப்பு ஆகும்.,5
திருக்குறள்_கட்டுரைகள்,கைவேலை எறிந்து விடுவது வீரர்களுக்கு அழகல்லவே !,5
திருக்குறள்_கட்டுரைகள்,களிற்றின் மீது மட்டுமே எறிய வேண்டிய வேலை என் மீது எட்டியிருந்து ஏன் எறிந்தான்?,11
திருக்குறள்_கட்டுரைகள்,ஒரு கால் இவன் மதயானையை ஒழித்த என்னையும் ஒரு மதயானை எனக் கருகிவிட்டானே என எண்ணி நகைக்கிறானோ?,13
திருக்குறள்_கட்டுரைகள்,அவ்விதமாயின் அது ஏளனச் சிரிப்பு ஆகும்.,5
திருக்குறள்_கட்டுரைகள்,அவ்விதமாயின் இது மனக் குறைச் சிரிப்பு ஆகும்.,6
திருக்குறள்_கட்டுரைகள்,என எண்ணிப் புண்பட்ட மனத்தோடு நகைத் திருப்பானோ?,6
திருக்குறள்_கட்டுரைகள்,"அவ்விதமாயின், இது துன்பச் சிரிப்பு ஆகும்.",5
திருக்குறள்_கட்டுரைகள்,தன் கை வலிமைக்கு முன் மதயானையும் நிற்க ஆற்றாமல் போயிற்று.,8
திருக்குறள்_கட்டுரைகள்,எதிரிகள் நமக்கு எம்மாத்திரம் என் எண்ணி நகைத்திருப்பானோ?,6
திருக்குறள்_கட்டுரைகள்,அவ்விதமாயின் இது பெருமிதச் சிரிப்பு ஆகும்.,5
திருக்குறள்_கட்டுரைகள்,அவ்விதமாயின் இது வீரச் சிரிப்பாகும்.,4
திருக்குறள்_கட்டுரைகள்,யானையோடு போரிட்ட களைப்பையுங் கருதாது.,4
திருக்குறள்_கட்டுரைகள்,அவ்விதமாயின் அது பயங்கரச் சிரிப்பு ஆகும்.,5
திருக்குறள்_கட்டுரைகள்,இச்சிரிப்பில் அடங்கியிருக்கின்ற பொருள்கள் இவ்வளவுதானோ?,4
திருக்குறள்_கட்டுரைகள்,யாரால் அறிந்து கூற முடியும்?,4
திருக்குறள்_கட்டுரைகள்,"எத்தனையோ சிரிப்புகளைக்கண்டு சிரிப்பாய்ச் சிரிக்கின்ற நமக்கு, இவ் வீரனது சிரிப்பு ஒரு திகைப்பை உண்டாக்கி விடுகிறது.",12
திருக்குறள்_கட்டுரைகள்,"இக்குறளுக்கு உரை கண்ட ஆசிரியர் பரிமேலழகர், தன் கைவேலைக் களிற்றொடு போக்கிய பிறகு.",10
திருக்குறள்_கட்டுரைகள்,தன்னைக் கொல்ல வரும் மற்றொரு யானையைக் கண்டு தன் மெய்வேலைப் பறித்து நகைத்தான் என்று கூறுகிறார்.,12
திருக்குறள்_கட்டுரைகள்,"மற்றொரு யானையை அவர் வருவித்துக் காட்டுகின்ற காட்சி குறளைத் தழுவாவிட்டாலும், வீரத்தைத் தழுவி நிற்பதால் வரவேற்கக் கூடியதே யாகும்.",14
திருக்குறள்_கட்டுரைகள்,"என்ற வில்லிபாரதத்தினாலும், எய்தவன் பகடி யெல்லாம் பறித்தவன் என்மேல் எய்யும்.",8
திருக்குறள்_கட்டுரைகள்,என்ற கம்பராமாயணச் செய்யுளாலும் அறிய முடிகிறது.,5
திருக்குறள்_கட்டுரைகள்,"இதிலிருந்து தமிழ் மக்களின் பேராண்மையும், போராண்கையும் நன்கு அறியலாம்.",7
திருக்குறள்_கட்டுரைகள்,வளரட்டும் தமிழரின் வீரம் !,3
திருக்குறள்_கட்டுரைகள்,﻿சொல்லும் செயலும் இன்னாசிமுத்து உபதேசியார் என்றால் ஈச்சம்பட்டி மக்கள் அனைவர்க்கும் நன்கு தெரியும்.,10
திருக்குறள்_கட்டுரைகள்,அவருக்கு பைபிள் மனப்பாடம் எந்த வசனத்தையும் அவர் பாராமல் ஒப்புவிக்கும் ஆற்றல் படைத்தவர்.,10
திருக்குறள்_கட்டுரைகள்,ஆதலால் அவருடைய பரிந்துரையின்பேரில் அந்த வேலை இன்னாசி முத்து உபதேசியாருக்கே கிடைத்து விட்டது.,10
திருக்குறள்_கட்டுரைகள்,அவர் ஒரு நல்ல பேச்சாளி அவருடைய உணர்ச்சி கலந்த பேச்சு எவருடைய உள்ளத்தையும் உருக்கிவிடும்.,11
திருக்குறள்_கட்டுரைகள்,அவரது அருமையான தொண்டு காரணமாக ஊர்மக்கள் பலரும் கிறிஸ்து சமயத்தைப் பற்றி நன்கறிந்து கொண்டார்கள்.,11
திருக்குறள்_கட்டுரைகள்,சிலர் கிறிஸ்தவராகவும் மதம் மாறினர்.,4
திருக்குறள்_கட்டுரைகள்,சிலர் மதம் மாறும் நிலையிலும் இருந்து வந்தனர்.,6
திருக்குறள்_கட்டுரைகள்,இந்த நிகழ்ச்சி பனைமரத்துப்பட்டியிலுள்ள பரம சிவம் பிள்ளைக்கு ஒரு கலக்கத்தை உண்டு பண்ணி விட்டது.,11
திருக்குறள்_கட்டுரைகள்,அவர் சிவபக்தியுள்ள ஒரு பெரிய நிலக்கிழார்.,5
திருக்குறள்_கட்டுரைகள்,"இன்னாசிமுத்து உபதேசியாரின் பேச்சால், பிரசாரத்தால், இந்து மதமே அழிந்து போய்விடும் என்ற பயமும் அவருக்கு வந்து விட்டது.",13
திருக்குறள்_கட்டுரைகள்,இதற்காக என்ன செய்ய லாம்? என ஆலோசித்தார்.,6
திருக்குறள்_கட்டுரைகள்,கூட்டினார் ஊர்க் கூட்டத்தை.,3
திருக்குறள்_கட்டுரைகள்,"காலப் போக்கில் பிரசாரம் போட்டிப் பிரசாரமாக மாறிவிட்டதால், ஒருவர் பேச்சை மற்றொருவர் கண்டித்துப் பேசுவது இயல்பாகவே நடைபெறத் தொடங்கிவிட்டது.",14
திருக்குறள்_கட்டுரைகள்,"இதற்காகப் பிரசங்கியார் பைபிளையும், உபதேசியார் திருக்குறளையும் ஆழ்ந்து படித்து ஆராயத் தொடங்கினர்.",9
திருக்குறள்_கட்டுரைகள்,அந்த ஆராய்ச்சி அவர்களின் பேச்சுக்குப் பெருந்துணையாக இருந்து வந்தது.,7
திருக்குறள்_கட்டுரைகள்,இரு பேச்சர்ளிகளும் எந்த ஊரிலும் நேருக்கு நேராகச் சந்திக்கவில்லை.,7
திருக்குறள்_கட்டுரைகள்,ஒருவரை ஒருவர் அறியார் என்பது தான் ஊராரின் நம்பிக்கை.,7
திருக்குறள்_கட்டுரைகள்,உண்மையில் உபதேசியாரின் பேச்சுமுறை எப்படி?,4
திருக்குறள்_கட்டுரைகள்,"என்பதைப் பிரசங்கி யாரும், பிரசங்கியாரின் பேச்சுப்போக்கு எத்தகையது?",6
திருக்குறள்_கட்டுரைகள்,என்பதை உபதேசியாரும் ஒளிந்திருந்து பலமுறை கேட்டிருக்கிறார்கள் என்பதை ஊரார்கள் எப்படி அறிவார்கள்?,9
திருக்குறள்_கட்டுரைகள்,"ஒருவர் பேச்சை ஒருவர் கேட்டப்பிறகு பேசத் தொடங்கியதால், அவர்களின் பேச்சு முறையிலேயே ஒரு பெரிய மாறுதல் ஏற்பட்டுவிட்டது.",13
திருக்குறள்_கட்டுரைகள்,"இதனால், கிராமங்களிலுள்ள பொதுமக்கள் இவர்கள் இருவரையும் நன்கு வரவேற்று வந்தார்கள்.",8
திருக்குறள்_கட்டுரைகள்,எந்த மதமானால்தான் என்ன?,3
திருக்குறள்_கட்டுரைகள்,எந்தப் பிரசங்கமானால் தான் என்ன?,4
திருக்குறள்_கட்டுரைகள்,"கிராமத்தில் உண்மையும், ஒழுக்கமும், நிதியும், அன்பும் நிலைபெற்றாற் போதும் என்பதே பொதுமக்களின் எண்ணமாக இருந்துவந்தது.",11
