work_title,sentence,sentence_length
திருக்குறள்_கட்டுரைகள்,"இப்பொழுது தெரிகிறதா, அவள் தன் குடிகாரப் பிள்ளையை அடியோடு வெறுப்பதன் காரணம்?",9
திருக்குறள்_கட்டுரைகள்,மூன்றாவது கேள்வியும் பாருங்கள் !,3
திருக்குறள்_கட்டுரைகள்,காதல் வேறு காமம் வேறு.,4
திருக்குறள்_கட்டுரைகள்,"காதலால் பெறுவது இன்பம் காமத்தால் பெறுவது துன்பம் காதல் மக்களிடத்தும், காமம் மாக்களிடத்தும் தோன்றுவது.",11
திருக்குறள்_கட்டுரைகள்,மாக்களிடத்துத் தோன்றும் காமம் மக்களிடத்துத் தோன்றுமாயின் மக்களும் மாக்களாகி விடுவர்.,8
திருக்குறள்_கட்டுரைகள்,"ஆகவே, காதல் விரும்பத் தக்கதும், காமம் வெறுக்கத் தகுந்ததுமாகும்.",7
திருக்குறள்_கட்டுரைகள்,உள்ள பொருளைக் கொண்டுதானே இல்லாத பொருளை விளக்கியாக வேண்டும் இதற்காக அவர் உலகப் பொருள்கள் அனைத்தையும் தேடினார்.,13
திருக்குறள்_கட்டுரைகள்,"கிடைக்க வில்லையோ, பொருந்தவில்லையோ, ஒப்பவில்லையோ தெரியவில்லை.",5
திருக்குறள்_கட்டுரைகள்,கடைசியாக அவர் ஒரு உவமைப் பொருளைக் கண்டுபிடித்து வெற்றி பெற்றார்.,8
திருக்குறள்_கட்டுரைகள்,அந்த ஒரே உவமைப் பொருள் என்ன தெரியுமா?,6
திருக்குறள்_கட்டுரைகள்,கள் மிகவுங் கொடியது என்பதை மேலே கூறியவைகளால் நீங்கள் அறிந்திருப்பீர்கள்.,8
திருக்குறள்_கட்டுரைகள்,"ஆனால், காமம் அதை விடக் கொடியதுதானா?",5
திருக்குறள்_கட்டுரைகள்,என்பது எண்ணிப் பார்க்க வேண்டிய ஒன்று.,5
திருக்குறள்_கட்டுரைகள்,கள் என நினைத்துக் கொண்டால் போதை வருவதில்லை.,6
திருக்குறள்_கட்டுரைகள்,கள்ளின் அருகிலிருந்து அதைப் பார்த்துக்கொண்டேயிருந்தாலும் போதைவருவதில்லை.,5
திருக்குறள்_கட்டுரைகள்,"ஆனால், காமம் அப்படியில்லை.",3
திருக்குறள்_கட்டுரைகள்,நினைத்தாலும் போதை வந்துவிடும்.,3
திருக்குறள்_கட்டுரைகள்,பார்த்தாலும் போதை வந்துவிடும்.,3
திருக்குறள்_கட்டுரைகள்,"ஆகவே தான், கள்ளினுங் கொடிது காமம் என்பது வள்ளுவர் வாக்கில் வந்தது போலும்.",10
திருக்குறள்_கட்டுரைகள்,எப்படி அகப்பொருளை விளக்கப் புறப்பொருளைக் காட்டிய அவரது பேரறிவு?,7
திருக்குறள்_கட்டுரைகள்,இதிலிருந்து வள்ளுவர் நம்மைக் கேளாமற் கேட்கும் இந்த மூன்றாவது கேள்வி என்ன தெரியுமா?,10
திருக்குறள்_கட்டுரைகள்,கொடுமைகளுக்கெல்லாம் தலைசிறந்த ஒரு கொடுமைக்கு உவமையாகக் கூறவந்த கள் எவ்வளவு கொடியது?,9
திருக்குறள்_கட்டுரைகள்,எவர் இதற்கு விடை கூறுவது?,4
திருக்குறள்_கட்டுரைகள்,குடிப் பழக்கத்தில் தவறாக வழுக்கி வீழ்ந்துவிட்ட அன்பர்கள்தாம் இவற்றிற்கு விடை கூறியாக வேண்டும்.,10
திருக்குறள்_கட்டுரைகள்,"இப்போது சட்டத்தின் மூலம், நம் நாட்டில் குடி தடுத்து ஒழிக்கப் பெற்று விட்டது.",10
திருக்குறள்_கட்டுரைகள்,இதற்கும் பெரும் தொண்டு செய்தவர் பெரியார் காந்தியடிகளே !,6
திருக்குறள்_கட்டுரைகள்,அவரை நாம் என்றென்றும் மறக்க இயலாது.,5
திருக்குறள்_கட்டுரைகள்,"குடி சட்டத்தின் மூலம் விலக்கப் பெற்றிருக்கிறது, இது போதாது மக்கள் உள்ளத்திலிருந்தும் அது விலக்கப் பெற்றாகவேண்டும்.",12
திருக்குறள்_கட்டுரைகள்,அப்போதுதான் இந்த நல்ல முயற்சி முழுவதும் வெற்றி பெறும்.,7
திருக்குறள்_கட்டுரைகள்,இதற்கு மக்கள் பலவகை யிலும் துணை புரிந்தாக வேண்டும்.,7
திருக்குறள்_கட்டுரைகள்,"அமெரிக்கா, முன்பு ஒருமுறை குடியை ஒழித்தது.",5
திருக்குறள்_கட்டுரைகள்,"ஆனால், அங்கு விரைவில் அது திரும்பவும் வந்துவிட்டது.",6
திருக்குறள்_கட்டுரைகள்,அம்மாதிரி நம் நாட்டிலும் நடைபெறும் எனச் சிலர் நம்பிக் கொண்டும் எதிர்பார்த்துக்கொண்டும் இருக்கின்றனர்.,10
திருக்குறள்_கட்டுரைகள்,"பாவம், அவர்கள் அனைவரும் குடியை விடமுடியாதவர்களும், குடியால் பொருள் திரட்டுபவர்களுமே ஆவார்கள்.",9
திருக்குறள்_கட்டுரைகள்,"இப்பெருங் குடியர்களின் எண்ணத்தை நிறை வேறவொட்டாமல் அழித்து ஒழிக்கவேண்டியது, தமிழ் நாட்டுப் பெருங்குடி மக்களின் நீங்காத கடமைகளில் ஒன்றாகும்.",14
திருக்குறள்_கட்டுரைகள்,வள்ளுவர் கண்களை மயில் தோகையின் கண்கள் கவர்ந்தன.,6
திருக்குறள்_கட்டுரைகள்,அருகில் சென்று தொட்டுப் பார்வையிட்டார்.,4
திருக்குறள்_கட்டுரைகள்,என்னே அவரது துணிவு. !,3
திருக்குறள்_கட்டுரைகள்,உங்களால் அந்த முடிவுக்கு வர முடியுமா?,5
திருக்குறள்_கட்டுரைகள்,வள்ளுவர் என்ன செய்தார் தெரியுமா?,4
திருக்குறள்_கட்டுரைகள்,உடனே வண்டிக்காரனைக் கூப்பிட்டார்.,3
திருக்குறள்_கட்டுரைகள்,இக்குறளின் பொருள் மயில் தோகையையும் வண்டியையும் பற்றியதாக மட்டுமில்லை.,7
திருக்குறள்_கட்டுரைகள்,வாழ்க்கையின் பல திரு நான்கு துறைகளிலும் அது அடங்கியிருப்பதைக் கண்டு மகிழுங்கள்.,9
திருக்குறள்_கட்டுரைகள்,அளவுக்கு மீறினால் அச்சு முறிந்துவிடும் என்பதில் வண்டியும் சுமையும்தானா அடங்கியிருக்கின்றன.,8
திருக்குறள்_கட்டுரைகள்,வாயும் உணவும்கூட அடங்கியிருக்கின்றன.,3
திருக்குறள்_கட்டுரைகள்,"அளவுக்கு மீறி விடுமானால், அது நட்புக் கொண்ட உள்ளத்தையே முறித்துவிடும் என்ற கருத்தும் இதில் அடங்கியிருக்கிறது.",12
திருக்குறள்_கட்டுரைகள்,அவைகளில் நிகழ்த்துகின்ற சொற்பொழிவும் ஒரு அளவோடு இருக்க வேண்டும்.,7
திருக்குறள்_கட்டுரைகள்,"அது அளவுக்கு மீறி நீண்டுவிடுமானால், அச்சு முறிவதைப்போல அவையோர் உள்ளத்தை முறித்துவிடும் என்பதும் அக்குறளில் பொதிந்தே கிடக்கிறது.",13
திருக்குறள்_கட்டுரைகள்,"மனைவியை, மக்களை, தம்பியை, தங்கையை அடக்கி வளர்க்க வேண்டியது தன் கடமை எனக் குடும்பத்தின் தலைவன் கருதுகிறான்.உண்மைதான் !",14
திருக்குறள்_கட்டுரைகள்,"என்றாலும், அது அளவுக்கு மீறிவிடுமானால், அச்சு முறிவதைப்போல, அது குடும்பத்தையே முறித்துவிடும் என்ற கருத்தும் இக் குறளில் இல்லாமலில்லை.",14
திருக்குறள்_கட்டுரைகள்,மாடிமீது கட்டப்படும் கட்டடங்களுக்கும் ஒரு அளவு இருக்க வேண்டும்.,7
திருக்குறள்_கட்டுரைகள்,"அளவுக்கு மீறிவிடுமானால், அச்சு முறிவதைப்போல அவ்வீடும் முறிந்துவிடும் என்பதையும் அக்குறளில் அடக்கித்தான் வைத்திருக்கிறார்.",10
திருக்குறள்_கட்டுரைகள்,வேலை செய்யும் ஆட்களிடத்தில் தமது அதிகாரத்தைக் காட்டி மிரட்டுவதற்கும் ஒரு அளவு உண்டு.,10
திருக்குறள்_கட்டுரைகள்,"அளவுக்கு மீறி விடுமானால் அச்சு முறிவதுபோல அதிகாரமும் முறிந்துவிடும் என்ற கருத்தும், அதில் மறைந்துதான் காணப்படுகிறது.",12
திருக்குறள்_கட்டுரைகள்,அரசன் தன் குடிமக்களின் மீது செலுத்தும் ஆதிக்கத்திற்கும் ஒரு அளவு இருக்கவேண்டும்.,9
திருக்குறள்_கட்டுரைகள்,கட்டுரை எழுதுவதற்கும் ஒரு அளவு இருக்கவேண்டும்.,5
திருக்குறள்_கட்டுரைகள்,அவர் செய்த திருக்குறள் எப்படி?,4
திருக்குறள்_கட்டுரைகள்,இதில் கூறியுள்ள கருத்துக்கள் எப்படி?,4
திருக்குறள்_கட்டுரைகள்,மயில் தோகை மற்றவர்களுக்குப் பயன்பட்டது எப்படி?,5
திருக்குறள்_கட்டுரைகள்,திருவள்ளுவருக்குப் பயன்பட்டது எப்படி?,3
திருக்குறள்_கட்டுரைகள்,இத்தகைய திருக்குறளைப் படிக்காமல் இருக்கிறோமே நாம் எப்படி?,6
திருக்குறள்_கட்டுரைகள்,நமது நாடு தமிழ்நாடு.,3
திருக்குறள்_கட்டுரைகள்,நமது மொழி தமிழ்மொழி.,3
திருக்குறள்_கட்டுரைகள்,நமது வாழ்வும் வளமும் உரிமையும் உயிரும் தமிழ்.,6
திருக்குறள்_கட்டுரைகள்,வள்ளுவர் நமது முன்னோரில் ஒருவர்.,4
திருக்குறள்_கட்டுரைகள்,குறள் நமது திருமறை என்ற உணர்ச்சி நம் ஒவ்வொருவருக்கும் உண்டாகவேண்டும்.,8
திருக்குறள்_கட்டுரைகள்,இதற்காகத் தமிழ் நூல்கள் அனைத்தையும் படித்தாக வேண்டும்.,6
திருக்குறள்_கட்டுரைகள்,இன்றேல் திருக்குறள ஒன்றைாவது படித்துத் தீரவேண்டும்.,5
திருக்குறள்_கட்டுரைகள்,"அதுவும் முடியாவிடில், திருக்குறளைப் படிக்கவேண்டும் என்ற ஆசையாவது இப்போது உண்டாக வேண்டும்.",9
திருக்குறள்_கட்டுரைகள்,வாழட்டும் தமிழ் நாடு !,3
திருக்குறள்_கட்டுரைகள்,வளரட்டும் தமிழ் மொழி !,3
திருக்குறள்_கட்டுரைகள்,"உடை ஆடை, உடைமை அணிகலன், உடையவர் உடையவனாம் தன்மை என்றாகும்.",8
திருக்குறள்_கட்டுரைகள்,"இதைப் பொருளின் மேல் ஏற்றிச் செல்வம் என்றும், அதனையுடையவர் செல்வர் என்று கூறுவதுண்டு.",10
திருக்குறள்_கட்டுரைகள்,"வாழ்வுக்கு ஏற்றது பொருளுடைமை என்றும், அதுவும் தனியுடைமை நல்லதா?",7
திருக்குறள்_கட்டுரைகள்,என்றும் மக்கள் ஆராய்ந்து வருகின்றனர்.,4
திருக்குறள்_கட்டுரைகள்,வாழ்வுக்கு வேண்டியது பொருளே அல்ல என்பது வள்ளுவர் கருத்து என்று தெரிகிறது.,9
திருக்குறள்_கட்டுரைகள்,"அவர் அவைகளைத் துருவித்தேடிக் கண்டுபிடித்து எடுத்து, முறைப்படுத்தி, வகைப்படுத்தி, தொகைப்படுத்தி நமக்குத் தந்துள்ளார்.",10
திருக்குறள்_கட்டுரைகள்,"அவை அன்புடைமை, அருளுடைமை, அடக்கமுடைமை, ஆள்வினையுடைமை, ஊக்கமுடைமை, ஒழுக்கமுடைமை, நாணுடைமை, பொறையுடைமை, பண்புடைமை என்பன.",11
திருக்குறள்_கட்டுரைகள்,இவ்வுடைமைகளிற் பொருளுடைமை சேராமை காண்க.,4
திருக்குறள்_கட்டுரைகள்,"இவ்வுடைமைகள் ஒவ்வொன்றுக்கும் பத்துப் பத்துப் புள்ளிகள் வைத்தால், முழு மனிதப்பண்பு நூறு புள்ளி களாக முடியும்.",12
திருக்குறள்_கட்டுரைகள்,இதில் எந்த ஒன்று குறைந்தாலும் அவனுக்குப் பத்துப் புள்ளிகளைக் குறைத்து விடவேண்டியதுதான்.,9
திருக்குறள்_கட்டுரைகள்,ஒன்பது உடைமைகள் உள்ளவன் தொன்னூறு புள்ளி உடைய மனிதன்.,7
திருக்குறள்_கட்டுரைகள்,ஐந்து உடைமைகள் உள்ளவன் ஐம்பது புள்ளி மனிதன்.,6
திருக்குறள்_கட்டுரைகள்,மூன்று உடைமைகளை உடையவன் முப்பது புள்ளி மனிதன்.,6
திருக்குறள்_கட்டுரைகள்,ஒரே உடைமை உள்ளவன் பத்துப்புள்ளி மனிதன்.,5
திருக்குறள்_கட்டுரைகள்,அதுவும் அற்றவன் மனிதனே அல்லன்.,4
திருக்குறள்_கட்டுரைகள்,அவன் வெறும் கூடு என்பது வள்ளுவரது கருத்து.,6
திருக்குறள்_கட்டுரைகள்,இப்பத்து உடைமைகளையும் பத்து அதிகாரங்களாக்கி ஒவ்வொன்றுக்கும் பத்துக் குறள்கள் வீதம் இவ்வுடைமைகளை ஆசிரியர் திருள்ளுவர் நன்கு விளக்கிக் கூறியுள்ளார்.,14
திருக்குறள்_கட்டுரைகள்,இதில் பண்புடைமையை நூறாவது அதிகரமாக வைத்திருப்பது வியப்பிற்குரியதொன்றாகும்.,6
திருக்குறள்_கட்டுரைகள்,இதிலிருந்து முழு மனிதன் பண்போடு வாழ்வான் என்று தெரிகிறது.,7
திருக்குறள்_கட்டுரைகள்,பால் உடலுக்கு நலம் தரும் ஒரு பொருள்.,6
திருக்குறள்_கட்டுரைகள்,இதில் மாறுபட்ட கருத்து எவருக்கும் இருக்கக் காரணமில்லை.,6
திருக்குறள்_கட்டுரைகள்,என்றாலும் நல்ல பாலைக் கெட்ட பாத்திரத்தில் வைத்தால் என்ன ஆகும்?,8
திருக்குறள்_கட்டுரைகள்,பண்பில்லாத மக்களிடத்தில் உள்ள செல்வம் கெட்ட பாத்திரத்தில் ஊற்றிய பாலைப்போல் திரிந்து கெடும் என்பது வள்ளுவர் கருத்து.,13
திருக்குறள்_கட்டுரைகள்,"பண்பில்லா மக்களிடத்துச் சேர்ந்துள்ள பெருஞ்செல்வமே கெடும் எனின், சிறு செல்வத்தைப் பற்றிக் கூறவேண்டுவதில்லை.",10
திருக்குறள்_கட்டுரைகள்,இதிலிருந்து நலவாழ்வுக்கு வேண்டியது பொருள் அல்ல.,5
திருக்குறள்_கட்டுரைகள்,பண்பு என்று நன்கு விளங்குகிறது.,4
திருக்குறள்_கட்டுரைகள்,இப்பத்து உடைமைகளிலும் சிறந்து உயர்ந்து நிற்பது ஊக்கமுடைமையேயாகும்.,6
திருக்குறள்_கட்டுரைகள்,"இதனை, உடையர் எனப்படுவது ஊக்கம் அஃதிலார் உடையது உடையரோ மற்று என்பதனால் நன்கறியலாம்.",10
திருக்குறள்_கட்டுரைகள்,நிறைந்த செல்வத்தைப் பெற்றிருந்தாலும் ஊக்கம் இல்லாதவருக்கு அதனைக் காக்கும் ஆற்றல் இராது.,9
திருக்குறள்_கட்டுரைகள்,"ஆதலின், அதனை அவர் இழந்துவிடுவர் என்பது குறிப்பு, இதனை, உள்ளம் உடைமை உடைமை பொருளுடைமை நில்லாது நீங்கி விடும்.",14
திருக்குறள்_கட்டுரைகள்,என்ற குறளால் நன்கு விளக்கிக் காட்டுகிறார்.,5
திருக்குறள்_கட்டுரைகள்,ஊக்கமுடைய மக்கள் தம்மிடத்து உள்ள பொருளை இழப்பினும் வருந்துவதில்லை.,7
திருக்குறள்_கட்டுரைகள்,"ஏனெனில், அவர் அதனை விரைவில் முயன்று பெற்றுவிடுவர்.",6
திருக்குறள்_கட்டுரைகள்,ஊக்கமுடையவன் செல்வத்தைத் தேடித்திரிய வேண்டியதில்லை.,4
