work_title,sentence,sentence_length
தான்பிரீன்_தொடரும்_பயணம்,தான்பிரீன் தொடரும் பயணம் தியாகி ப.,5
தான்பிரீன்_தொடரும்_பயணம்,﻿தான்பிரீன் தொடரும் பயணம் ப.,4
தான்பிரீன்_தொடரும்_பயணம்,ஆஷ்டவுன் போராட்டம் இரண்டு.,3
தான்பிரீன்_தொடரும்_பயணம்,தொண்டர் படை மூன்று.,3
தான்பிரீன்_தொடரும்_பயணம்,முதல் வெடிமருந்துச்சாலை நான்கு.,3
தான்பிரீன்_தொடரும்_பயணம்,தேர்தல் வெற்றி ஐந்து.,3
தான்பிரீன்_தொடரும்_பயணம்,பதினாயிரம் பவுண்டு பரிசு ஏழு.,4
தான்பிரீன்_தொடரும்_பயணம்,சிப்பாய்களின் சிறந்த உதவி எட்டு.,4
தான்பிரீன்_தொடரும்_பயணம்,தாயின் தரிசனம் ஒன்பது.,3
தான்பிரீன்_தொடரும்_பயணம்,போலிஸாரிடம் பிடிபட்ட தொண்டன் பத்து.,4
தான்பிரீன்_தொடரும்_பயணம்,ரயில் நிலையத்தில் ரகளை பதினொன்று .,4
தான்பிரீன்_தொடரும்_பயணம்,பின் நிகழ்ச்சிகள் பனிரண்டு .,3
தான்பிரீன்_தொடரும்_பயணம்,பாதிரி வேஷம் பதிமூன்று .,3
தான்பிரீன்_தொடரும்_பயணம்,வைசிராயைக் குறிபார்த்தல் பதினான்கு .,3
தான்பிரீன்_தொடரும்_பயணம்,ஆஷ்டவுனுக்குப் பின்னால் பதினைந்து .,3
தான்பிரீன்_தொடரும்_பயணம்,மீண்டும் திப்பெரரி பதினாறு .,3
தான்பிரீன்_தொடரும்_பயணம்,புதிய போர்முறை பதினேழு .,3
தான்பிரீன்_தொடரும்_பயணம்,ஜெனரல் லூகாஸ் பதினெட்டு .,3
தான்பிரீன்_தொடரும்_பயணம்,கொலைக்கூட்டத்தின் முயற்சிகள் பத்தொன்பது .,3
தான்பிரீன்_தொடரும்_பயணம்,டிராம்கொண்டரா சண்டை இருபது.,3
தான்பிரீன்_தொடரும்_பயணம்,பிரிவும் பிரிவாற்றாமையும் இருபத்தொன்று.,3
தான்பிரீன்_தொடரும்_பயணம்,சமாதானம் இருபத்து மூன்று.,3
தான்பிரீன்_தொடரும்_பயணம்,உணர்ச்சியற்றுக் கிடக்கும் உயிர்ப்பிண்டங்களை உருவாக்கி உயிரூட்டக்கூடிய ஆசிரியர்களும் பத்திரிகைகளும் நூல்களும் வேண்டும்.,9
தான்பிரீன்_தொடரும்_பயணம்,மலைபெயர்ந்தாலும் நிலை பெயராத தீரர்கள் வேண்டும்.,5
தான்பிரீன்_தொடரும்_பயணம்,அயர்லாந்து அதையும் பெற்றிருந்தது.,3
தான்பிரீன்_தொடரும்_பயணம்,ஐரிஷ் மொழியைப் புதுப்பித்து அரியாசனத்தில் அமர்த்துவதற்குத் திறமையுள்ள புலவர்கள் சிலர் முன்வந்தனர்.,9
தான்பிரீன்_தொடரும்_பயணம்,"தொழிலாளிகளையும் குடியானவரையும் பிரபுகளையும் ஒன்று சேர்த்து வெறியூட்டி ஆட்டுவிப்பதற்கு ஆர்தர் கிரிபித், பார்ணல், மைக்கேல் காலின்ஸ், சமன்டி வெலா.",14
தான்பிரீன்_தொடரும்_பயணம்,"தான்பீரின், டெரன்ஸ் முதலிய ராஜதந்திரிகளும் அறிஞர்களும் வீரர்களும் முன்வந்து உழைத்தனர்.",8
தான்பிரீன்_தொடரும்_பயணம்,"இவர்களுடைய உழைப்பாலும் மக்களின் ஒத்துழைப்பாலும் முன்னூறு  ஆண்டு அடிமைத் தளை உடைந்து, சிதறிப் பொடிப் பொடியாகப் பறந்து போயின.",14
தான்பிரீன்_தொடரும்_பயணம்,அயர்லாந்து புரிந்த அரும் போரின் அடிப்படைத் தத்துவங்களைப் பற்றிக் தலைவர் டிவெலரா பலமுறையாக எடுத்துக் கூறியிருக்கிறார்.,12
தான்பிரீன்_தொடரும்_பயணம்,அவருடைய வாக்கியங்களில் சிலவற்றைக் கவனித்தாலே உண்மை எளிதில் புலப்படும்.,7
தான்பிரீன்_தொடரும்_பயணம்,﻿ நாமும் ஆங்கிலேயரும் பக்கத்து வீட்டுக்காரர்.,5
தான்பிரீன்_தொடரும்_பயணம்,இந்த மூன்றில் முந்தியவை இரண்டும் முன்பே வெளிவந்து விட்டன.,7
தான்பிரீன்_தொடரும்_பயணம்,ஓர் ஆயிரத்து தொள்ளாயிரத்து நாற்பத்தேழு வரை நம்நாடு அடிமைப்பட்டிருந்ததால் தான்பிரீன் சரித்திரத்தை வெளியிட இயலவில்லை.,11
தான்பிரீன்_தொடரும்_பயணம்,ஏனெனில் இதற்கு ஆதாரமான மூலநூல் இந்திய நாட்டில் வழங்கக் கூடாதென்று கடற் சங்கம் தடை செய்திருந்தது.,12
தான்பிரீன்_தொடரும்_பயணம்,பலர் அதனைப் பிரதி எடுத்து வைத்துக் கொண்டார்கள்.,6
தான்பிரீன்_தொடரும்_பயணம்,"காகிதம், பேனா, மை எதுவும் கிடையாது.",5
தான்பிரீன்_தொடரும்_பயணம்,எங்களைப் போலவே இந்தப் பொருள்களும் சட்டத்தை மீறி ஜெயிலுக்குள் வந்தன.,8
தான்பிரீன்_தொடரும்_பயணம்,தான்பிரீன் தானே ஒரு நூல் எழுதியிருந்தான்.,5
தான்பிரீன்_தொடரும்_பயணம்,அயர்லாந்தின் விடுதலைக்காக எனது போர் என்பது அதன் பெயர்.,7
தான்பிரீன்_தொடரும்_பயணம்,அதை ஆதாரமாக வைத்துக்கொண்டே இந்த நூலை எழுதினேன்.,6
தான்பிரீன்_தொடரும்_பயணம்,நான் எழுதின தாள்களையெல்லாம் ஒன்று சேர்த்து என் உயிர் நண்பர் திரு.,9
தான்பிரீன்_தொடரும்_பயணம்,"சிவராமன் என்ற சைவப்பிள்ளை, முத்துப் போன்ற தம் கையெழுத்தில் ஒரு நல்ல பிரதி எடுத்திருந்தார்.",11
தான்பிரீன்_தொடரும்_பயணம்,அதைப்போல் வேறு சில நூல்களிற்கும் அவர் பிரதி எடுத்திருந்தார்.,7
தான்பிரீன்_தொடரும்_பயணம்,சட்டவிரோதமான இந்தச் சரக்குகள் எல்லாம் சிறையில் நான் அடைபட்டிருந்த சிறு அறைக்குள் இருந்தன.,10
தான்பிரீன்_தொடரும்_பயணம்,சிறைக்காவலர்களோ அதிகாரிகளோ கண்டால் அவைகள் யாவும் கூண்டோடு கைலாசம் போய்விடும் !,8
தான்பிரீன்_தொடரும்_பயணம்,எப்படியோ பல மாதங்களாக என் புத்தக கட்டுகள் கான்விக்ட் வார்டர் களும் சிறை முழுவதும் சோதனைபோட ஆரம்பித்து விட்டார்கள்.,14
தான்பிரீன்_தொடரும்_பயணம்,விசில்களின் ஓசை போலிஸ் தடல்புடல் வேறு.,5
தான்பிரீன்_தொடரும்_பயணம்,கைதிகள் இருந்த இடங்களை விட்டு வெளியே வரமுடியாமல் அறைகளில் தள்ளிவிடப்பட்டனர்.,8
தான்பிரீன்_தொடரும்_பயணம்,நானும் என் அறைக்குள்ளே இருந்து கதவுகளின் இரும்புக் கம்பிகளைச்சரிபார்த்துக் கொண்டிருந்தேன்.,8
தான்பிரீன்_தொடரும்_பயணம்,எனக்கு அடுத்த அறையில் சைவப்பிள்ளை இருந்தார்.,5
தான்பிரீன்_தொடரும்_பயணம்,என் அறையில் இருந்தபடியே சப்தம் கொடுத்தேன்.,5
தான்பிரீன்_தொடரும்_பயணம்,நோட்டுப் புத்தகங்களை என்ன செய்ய என்று கேட்டேன்.,6
தான்பிரீன்_தொடரும்_பயணம்,நானும் அதைப் பற்றித்தான் யோசித்துக் கொண்டிருக்கிறேன்.,5
தான்பிரீன்_தொடரும்_பயணம்,எவனாவது வருகிறானா என்று பார்ப்போம் என்றார்.,5
தான்பிரீன்_தொடரும்_பயணம்,சிறிது நேரத்தில் அவருக்குத் தெரிந்த ஒரு கான்விக்ட் வார்டர் வராந்தாவழியே வந்தான்.,9
தான்பிரீன்_தொடரும்_பயணம்,ஆனால் அதிகாரிகள் எங்கும் அலைந்து திரிந்துக் கொண்டிருந்ததால் அதிகமாய் பயந்து நடுங்கினான்.,9
தான்பிரீன்_தொடரும்_பயணம்,"என் அறைவாசலுக்கு வந்து, சாமி கட்டு, கட்டு சீக்கிரம் கட்டு என்றான்.",9
தான்பிரீன்_தொடரும்_பயணம்,நான் கட்டவேண்டியது ஒன்றுமில்லை.,3
தான்பிரீன்_தொடரும்_பயணம்,கட்டியிருந்தவைகளை அவிழ்க்கத்தான் வேண்டிருந்தது.,3
தான்பிரீன்_தொடரும்_பயணம்,எப்படியோ மிக விரைவாக எல்லாம் வெளியேறிவிட்டன.,5
தான்பிரீன்_தொடரும்_பயணம்,அவன் எல்லாவற்றையும் அள்ளிக்கொண்டு ஒரே ஓட்டமாகப் போய் விட்டான்.,7
தான்பிரீன்_தொடரும்_பயணம்,என் அறைக்கு நேராக வெகுதூரத்தில் ஒரு பெரிய கிணறு உண்டு.,8
தான்பிரீன்_தொடரும்_பயணம்,அவன் அதை நோக்கியே ஒடினான்.,4
தான்பிரீன்_தொடரும்_பயணம்,என் எழுத்துக்கள் சிறைக்காவலர் வீடுகளிலே அடுப்பின் நெருப்புக்கு இரையாகும் என்று இதுவரை பயந்திருந்தேன்.,10
தான்பிரீன்_தொடரும்_பயணம்,இப்போது அவை வருணபகவானுக்கு இரையாகும் போலக் காணப்பட்டது.,6
தான்பிரீன்_தொடரும்_பயணம்,நூல்கள் கிணற்றுக்குள் தொங்கிக் கொண்டிருந்தன.,4
தான்பிரீன்_தொடரும்_பயணம்,வேறு எங்கு வைத்திருந்தாலும் அன்று நடந்த சோதனையில் அவை அகப்பட்டிருக்கும்.,8
தான்பிரீன்_தொடரும்_பயணம்,"சோதனை முடிந்ததும் எல்லாநூல்களும் ஒழுங்காக என் அறையில், முன் இருந்த இடத்திலே திரும்பி வந்து அமர்ந்துவிட்டன.",12
தான்பிரீன்_தொடரும்_பயணம்,"அதன்மூலமே நாம், எமது போராட்டத்தினை தடைகளை மீறியும், சரியான திசையிலும் முன்னெடுத்துச் சென்று, எமது இலக்கினை அடைய முடியும்.",14
தான்பிரீன்_தொடரும்_பயணம்,விடுதலைப் போராட்டங்களும் புரட்சிகளும் பல்வகைப்பட்டன.,4
தான்பிரீன்_தொடரும்_பயணம்,குடியேற்றவாதத்திற்கு எதிராகப் போராடி விடுதலை பெற்ற நாடுகளில் முதலாவது நாடு ஐக்கிய அமெரிக்காவாகும்.,10
தான்பிரீன்_தொடரும்_பயணம்,"அது, இரு நூற்றியொன்பது ஆண்டுகளுக்கு முன், ஓர் ஆயிரத்து எழுநூற்று எழுபத்தாறு இல், பிரித்தானியாவின் ஆதிக்கத்திலிருந்து விடுதலை பெற்றது.",14
தான்பிரீன்_தொடரும்_பயணம்,"ஆசிய, ஆபிரிக்க நாடுகள் பல, மேற்கத்தைய குடியேற்ற ஆதிககத்தினை எதிர்த்து விடுதலை பெறுவதற்காகத் தேசிய விடுதலைப் போராட்டங்களில் ஈடுபட்டன.",14
தான்பிரீன்_தொடரும்_பயணம்,"அவ்வாறு போராடி விடுதலை அடைந்த நாடுகளுள் இந்தியா, வியட்நாம், இந்தோனேசியா என்பன அடங்கும்.",10
தான்பிரீன்_தொடரும்_பயணம்,"﻿ மேற்கத்தைய அரைக் காலனித்துவம், யப்பானிய ஏகாதிபத்தியம், உள்நாட்டுப் பிரபுத்துவம் ஆகிவற்றிற்கு எதிரான சோசலிசப் புரட்சியாக அமைந்தது சீனாவில்.",14
தான்பிரீன்_தொடரும்_பயணம்,அமெரிக்காவின் நவகாலனித்துவத்திற்கு எதிரான தேசிய விடுதலைப் போராட்டமாகவும் சமூக மாற்றத்திற்கான புரட்சியாகவும் அமைந்தது கியூபப் புரட்சி.,12
தான்பிரீன்_தொடரும்_பயணம்,"ஆசியாவில், நவகாலனித்துவத்திற்கு எதிரான விடுதலைப்போராட்டமாக அமைந்த வகையில் ஈரானியப் புரட்சி முக்கியத்துவம் வாய்ந்தது.",10
தான்பிரீன்_தொடரும்_பயணம்,"இந்த வரிசையில் நிக்கரகுவா புரட்சியும், எல் சவ்வடோர் போராட்டமும் அடங்கும்.",8
தான்பிரீன்_தொடரும்_பயணம்,"அயர்லாந்து, பங்களாதேஷ் விடுதலைப் போராட்டங்களும், சைப்பிரஸில் துருக்கிய இனப்போராட்டமும், பிலிப்பைன்ஸில் மித்தனாபோராட்டமும் மேற்கூறிய பிரிவுள் அடங்கும்.",12
தான்பிரீன்_தொடரும்_பயணம்,இந்த வரிசையில் எமது தமிழீழ விடுதலைப் போராட்டமும் இடம் பெறுகிறது.,8
தான்பிரீன்_தொடரும்_பயணம்,"ஆக, விடுதலைப் போராட்டங்களும், புரட்சி அனுபவங்களும் கூடகாலத்திற்குக் காலம், நாட்டிற்கு நாடு மாறுபடுகின்றன.",10
தான்பிரீன்_தொடரும்_பயணம்,"அவ்வாறு நோக்குமிடத்து, ஐரிஷ் விடுதலை போராட்டத்திற்கும் தமிழீழ விடுதலைப் போராட்டத்திற்குமிடையே நிறைந்த ஒற்றுமை உண்டு.",11
தான்பிரீன்_தொடரும்_பயணம்,பிரித்தானிய ஆதிக்கத்தை எதிர்த்துக் கிளர்ந்த அந்தப் போராட்டம் எழுநூற்று ஐம்பது ஆண்டுகளாகியும் இன்னும் தொடர்கிறது.,11
தான்பிரீன்_தொடரும்_பயணம்,இவர்களுக்கு இணையாகக் குறிப்பிடத் தகுந்த ஒரு போராளி தான்பிரீன்.,7
தான்பிரீன்_தொடரும்_பயணம்,"வீரம் செறிந்த அவனது போராட்டம், இந்நூலில் இடம் பெறுகிறது.",7
தான்பிரீன்_தொடரும்_பயணம்,"அதனை மக்களிடையே பரப்பும் நோக்கில் நூலாக்கம் செய்யவென, பிரதி எடுத்து வைத்திருந்தார் மற்றுமொரு தமிழிழப் போராளி.",12
தான்பிரீன்_தொடரும்_பயணம்,"ஆனால் துரதிஷ்ட வசமாக, அவர்கள் எண்ணம் நிறைவேறுமுன்பாகவே, வீரமரணமடைந்துவிட்டனர் அந்த இருவர் வாழ்க்கையும் கூட இன்று வரலாறுகிவிட்டது.",13
தான்பிரீன்_தொடரும்_பயணம்,"எனினும், அவர்களின் அந்த உணர்வு பல்லாயிரம் போராளிகளை உருவாக்கியுள்ளது என்பதில் சந்தேகமில்லை.",9
தான்பிரீன்_தொடரும்_பயணம்,அவ்விருவரதும் உடனடி நோக்கமான நூல் வெளியீடு இன்று கைகூடுகிறது.,7
தான்பிரீன்_தொடரும்_பயணம்,"இதுபோலவே அவர்களதும், அவர்களை ஒத்த பலரதும், பரந்துபட்ட மக்களதும் இலக்கான விடுதலையை அடைந்தே தீருவோம் என்பது திண்ணம்.",13
தான்பிரீன்_தொடரும்_பயணம்,பிரதியெடுக்கப்பட்ட கையெழுத்துப்பிரதியே எமக்குக் கிடைத்த நிலையில் அதன் ஆசிரியர் பற்றி அதிற் குறிக்கப்படாமையால் நூலாசிரியர் பெயர் தெரியாதிருந்தது.,13
தான்பிரீன்_தொடரும்_பயணம்,இதனடிப்படையில் தேடிப்பார்க்கையில் மைக்கேல் காலின்ஸ் கிடைத்தது.,5
தான்பிரீன்_தொடரும்_பயணம்,"அதனைப் படித்துப் பார்த்ததில் அந்நூலில் உள்ள குறிப்புகளினூடாகவும், தான்பிரீன் பற்றிய நூலையும், மைக்கேல் காலின்ஸ் நூலை எழுதிய திரு.",14
தான்பிரீன்_தொடரும்_பயணம்,ராமஸ்வாமி என்பவரே எழுதினார் என்ற முடிவிற்கு வரவேண்டியுள்ளது.,6
தான்பிரீன்_தொடரும்_பயணம்,நூலின் தலைப்பையும் பொருத்தம் கருதி நாம் மாற்றியுள்ளோம்.,6
தான்பிரீன்_தொடரும்_பயணம்,"﻿இந்நூலில் இடம்பெற்றுள்ள ஒரு வார்த்தை, முன்னுரை ஆகிய பகுதிகளையும் நூலாசிரியரே எழுதியுள்ளார்.",9
தான்பிரீன்_தொடரும்_பயணம்,இவ்விரு பகுதிகளையும் உதயன் எழுதியுள்ளார்.,4
