work_title,sentence,sentence_length
நபிகள்_நாயகம்-கி._ஆ._பெ._விசுவநாதம்,"அதற்கு நாயகம் அவர்கள், நாள்தோறும் நான் வரும் போதெல்லாம் இது நடக்குமே?",9
நபிகள்_நாயகம்-கி._ஆ._பெ._விசுவநாதம்,இன்றைக்கு ஏன் நடக்கவில்லை?,3
நபிகள்_நாயகம்-கி._ஆ._பெ._விசுவநாதம்,என்று தெரிந்து கொண்டு போகலாமென்றுதான் கேட்டேன் என்றார்கள்.,6
நபிகள்_நாயகம்-கி._ஆ._பெ._விசுவநாதம்,அவன் பெரிய சுரத்தினாலே அவதிப்படுகிறான்.,4
நபிகள்_நாயகம்-கி._ஆ._பெ._விசுவநாதம்,எழுந்திருக்க முடியாது என்றான்.,3
நபிகள்_நாயகம்-கி._ஆ._பெ._விசுவநாதம்,"இதைக் கேட்ட நாயகம் அவர்கள் மனங்கலங்கி அவ்வீட்டின் கதவைத் தட்டி, கோஷா எச்சரிக்கை செய்து, உள்ளே நுழைந்தார்கள்.",13
நபிகள்_நாயகம்-கி._ஆ._பெ._விசுவநாதம்,அவன் படுக்கையிற் படுத்துக் கொண்டு அலறிக் கொண்டிருந்தான்.,6
நபிகள்_நாயகம்-கி._ஆ._பெ._விசுவநாதம்,நம் அறிவுக்கு எட்டாதது அங்கு நடந்தது.,5
நபிகள்_நாயகம்-கி._ஆ._பெ._விசுவநாதம்,"உடனே சென்று அவனைத் தூக்கி மடிமேல் வைத்துக் கொண்டு, ஆண்டவனிடத்தில் துவா கேட்க ஆரம்பித்தார்கள்.",11
நபிகள்_நாயகம்-கி._ஆ._பெ._விசுவநாதம்,நாள் தோறும் நான் வருகின்ற வழி மேல் விழி வைத்துக் காத்திருந்த என்னுடைய அரிய நண்பனுக்கா இந்த நோய்?,14
நபிகள்_நாயகம்-கி._ஆ._பெ._விசுவநாதம்,என்று துவாக் கேட்க ஆரம்பித்தார்கள்.,4
நபிகள்_நாயகம்-கி._ஆ._பெ._விசுவநாதம்,துவாக் கேட்கப் பட்டது.,3
நபிகள்_நாயகம்-கி._ஆ._பெ._விசுவநாதம்,நோய் நீங்கியது அவன் ஒரு நல்ல சீடனானான்.,6
நபிகள்_நாயகம்-கி._ஆ._பெ._விசுவநாதம்,கிறித்தவர்களுக்குத் தொழ இடம் ஒரு சமயம் கிறித்துவப் பாதிரியார் நாயகம் அவர்களைப் பார்க்க வந்தார்.,11
நபிகள்_நாயகம்-கி._ஆ._பெ._விசுவநாதம்,நாயகம் அவர்கள் அப்போது ஒரு பள்ளிவாசலில் இருந்தார்கள்.,6
நபிகள்_நாயகம்-கி._ஆ._பெ._விசுவநாதம்,பேச்சு வெகு நேரம் நடந்தது.,4
நபிகள்_நாயகம்-கி._ஆ._பெ._விசுவநாதம்,நாயகம் அவர்கள் மிக அமைதியாக இந்த வெய்யிலில் வெளியிற் போய் வர வேண்டாமே !,10
நபிகள்_நாயகம்-கி._ஆ._பெ._விசுவநாதம்,"உங்கள் ஜபத்தை இங்கேயே செய்யலாமே என்று, பள்ளிவாசலின் ஒரு மூலையைக் காட்டினார்கள்.",9
நபிகள்_நாயகம்-கி._ஆ._பெ._விசுவநாதம்,பாதிரியார் அங்கு ஜபம் செய்துகொண்டிருந்தார்.,4
நபிகள்_நாயகம்-கி._ஆ._பெ._விசுவநாதம்,இந்நிகழ்ச்சி நாயகம் அவர்களோடு இருந்த சிலருக்கு மனப் புழுக்கத்தையும் வெறுப்பையும் உண்டாக்கியது.,9
நபிகள்_நாயகம்-கி._ஆ._பெ._விசுவநாதம்,"அவர்கள் நாயகம் அவர்களிடம் வந்து, பள்ளிவாசலின் தூய்மை கெட்டு விட்டதே என வருந்திக் கூறினார்கள்.",11
நபிகள்_நாயகம்-கி._ஆ._பெ._விசுவநாதம்,"நாயகம் அவர்கள், இரண்டு ஆண்டவன் இல்லை.",5
நபிகள்_நாயகம்-கி._ஆ._பெ._விசுவநாதம்,"பாதிரியார் வணங்கும் ஆண்டவனும், நாம் வணங்கும் ஆண்டவனும் ஒருவனே எனக் கூறி அவர்களை அமைதிப்படுத்தினார்கள்.",11
நபிகள்_நாயகம்-கி._ஆ._பெ._விசுவநாதம்,"வணிகம் நாயகம் அவர்கள் முதல் நாற்பதாண்டுக் காலத்தில், ஒட்டக வணிகம் செய்தார்கள்.",9
நபிகள்_நாயகம்-கி._ஆ._பெ._விசுவநாதம்,அப்போது அவர்களிடம் நாற்பது ஒட்டகங்கள் இருந்தன.,5
நபிகள்_நாயகம்-கி._ஆ._பெ._விசுவநாதம்,"வெளியூரிலிருந்து ஒட்டகம் வாங்க வந்த ஒருவர், நாயகம் அவர்களிடம் நாற்பது ஒட்டகங்களுக்கும் சேர்த்து விலை கூறும்படி கேட்டார்.",13
நபிகள்_நாயகம்-கி._ஆ._பெ._விசுவநாதம்,முதலில் ஒட்டகங்களனைத்தையும் போய்ப் பார்த்து வரும்படி நாயகம் அவர்கள் கூறினார்கள்.,8
நபிகள்_நாயகம்-கி._ஆ._பெ._விசுவநாதம்,"வியாபாரி போய்ப் பார்த்து வந்து, மறுபடியும் எல்லா ஒட்டகங்களுக்கும் சேர்த்து விலை என்ன?",10
நபிகள்_நாயகம்-கி._ஆ._பெ._விசுவநாதம்,அதற்கு நாயகம் அவர்கள் சிரித்துக் கொண்டே.,5
நபிகள்_நாயகம்-கி._ஆ._பெ._விசுவநாதம்,"அதில் ஒரு ஒட்டகம் நொண்டி, ஒரு கால் தரையில் ஊன்றாது.",8
நபிகள்_நாயகம்-கி._ஆ._பெ._விசுவநாதம்,மூன்று கால்களாலே தத்தி தத்தி நடக்கும்.,5
நபிகள்_நாயகம்-கி._ஆ._பெ._விசுவநாதம்,"இந்தக் காலத்து வியாபாரிகளிடம் நாம் இந்த நேர்மையையும், நாணயத்தையும் காண முடியுமா?",9
நபிகள்_நாயகம்-கி._ஆ._பெ._விசுவநாதம்,இதைக் கேட்ட வியாபாரி அஞ்சி நடுநடுங்கிப் போனார்.,6
நபிகள்_நாயகம்-கி._ஆ._பெ._விசுவநாதம்,"எப்படி, நாயகம் அவர்களின் வணிகம் !",4
நபிகள்_நாயகம்-கி._ஆ._பெ._விசுவநாதம்,"ஒரு சமயம், போர்க் களத்தில் நாயகம் அவர்களின் சிறிய தந்தையார் வாளேந்திய கையுடன் மடிந்து கிடந்தார்.",12
நபிகள்_நாயகம்-கி._ஆ._பெ._விசுவநாதம்,நாயகம் அவர்களைச் சேர்ந்தோர் அவளைச் சிறைப்படுத்தி வைத்திருந்தனர்.,6
நபிகள்_நாயகம்-கி._ஆ._பெ._விசுவநாதம்,"இறுதியில் போர் முடிந்து, நாயகம் அவர்கள் வெற்றி விழாக் கொண்டாடிய பொழுது சிறைக் கைதிகளை விடுதலை செய்தனர்.",13
நபிகள்_நாயகம்-கி._ஆ._பெ._விசுவநாதம்,"இச் செய்தியைச் சிறைக் கைதிகள் அனைவரும் கேட்டு, மகிழ்ந்து வெளியில் ஓடினர்.",9
நபிகள்_நாயகம்-கி._ஆ._பெ._விசுவநாதம்,ஹிந்தா என்ற அந்தப் பெண் மட்டும் தனக்கு விடுதலை கிடைக்காது என்று நம்பி.,10
நபிகள்_நாயகம்-கி._ஆ._பெ._விசுவநாதம்,"சிறைக் காவலாளிகள் அவளுக்கும் விடுதலை கிடைத்திருப்பதாகச் சொல்லி வெளியே போக வற்புறுத்திய பொழுது, எனக்கும் விடுதலையா !",12
நபிகள்_நாயகம்-கி._ஆ._பெ._விசுவநாதம்,"என அவள் மனம் உருகி, உருகி அழுது, அழுது அரற்றிய சொற்கள் நம் உள்ளத்தை எல்லாம் உருக்குகின்றன.",13
நபிகள்_நாயகம்-கி._ஆ._பெ._விசுவநாதம்,என்னே நாயகம் அவர்களின் பெருந்தன்மை !,4
நபிகள்_நாயகம்-கி._ஆ._பெ._விசுவநாதம்,"தெய்வ பக்தி அவருடைய தெய்வ பக்திக்கு ஒன்றென்ன, இரண்டு சான்றுகள்.",8
நபிகள்_நாயகம்-கி._ஆ._பெ._விசுவநாதம்,"ஒரு தரம், அவருடைய பகைவர்கள் அவரை நெருங்கி விட்டார்கள்.",7
நபிகள்_நாயகம்-கி._ஆ._பெ._விசுவநாதம்,ஹஜ்ரத் அபூபக்கர் உடன் இருந்தார்கள்.,4
நபிகள்_நாயகம்-கி._ஆ._பெ._விசுவநாதம்,பகைவர்கள் அவர்களைத் தேடி அழிக்க எழுபது பேர் வந்தார்கள்.,7
நபிகள்_நாயகம்-கி._ஆ._பெ._விசுவநாதம்,"ஏதோ இன்று நடக்கும் என்று நாயகம் அவர்களும், அபூபக்கரும ஒரு குகைக்குள் இருந்தார்கள்.",10
நபிகள்_நாயகம்-கி._ஆ._பெ._விசுவநாதம்,பவருடைய காலடிச் சத்தம் மிக நெருக்கமாகக் கேட்கிறது.,6
நபிகள்_நாயகம்-கி._ஆ._பெ._விசுவநாதம்,"அப்பொழுது ஹஜ்ரத் அபூபக்கர், நாயகம் அவர்களை நோக்கி.",6
நபிகள்_நாயகம்-கி._ஆ._பெ._விசுவநாதம்,"ஹஜ்ரத், எழுபது பேர் வருகிறார்களே !",4
நபிகள்_நாயகம்-கி._ஆ._பெ._விசுவநாதம்,நாம் இரண்டு பேர்தானே இருக்கிறோம்?,4
நபிகள்_நாயகம்-கி._ஆ._பெ._விசுவநாதம்,நீங்களானால் என்ன சொல்வீர்கள்?,3
நபிகள்_நாயகம்-கி._ஆ._பெ._விசுவநாதம்,இரண்டு பேர் என்றுதானே?,3
நபிகள்_நாயகம்-கி._ஆ._பெ._விசுவநாதம்,நாம்தான் என்ன சொல்லுவோம்?,3
நபிகள்_நாயகம்-கி._ஆ._பெ._விசுவநாதம்,நாம் சொல்லாததை அவர்கள் சொன்னார்கள்.,4
நபிகள்_நாயகம்-கி._ஆ._பெ._விசுவநாதம்,"உடனே அவர்கள் நாம் இருவர் அல்லர், மூவர் என்றார்கள்.",7
நபிகள்_நாயகம்-கி._ஆ._பெ._விசுவநாதம்,ஹஜ்ரத் அபூபக்கர் யாரோ கூட இருக்கிறார்கள் என்று குகையைச் சுற்றிச் சுற்றிப் பார்த்தார்.,10
நபிகள்_நாயகம்-கி._ஆ._பெ._விசுவநாதம்,அதைக் கண்டு நாயகம் அவர்கள்.,4
நபிகள்_நாயகம்-கி._ஆ._பெ._விசுவநாதம்,ஆண்டவன் ஒருவன் நம்மோடு இருக்கிறான்.,4
நபிகள்_நாயகம்-கி._ஆ._பெ._விசுவநாதம்,அவனையும் சேர்த்து நாம் மூவர் என்றார்கள்.,5
நபிகள்_நாயகம்-கி._ஆ._பெ._விசுவநாதம்,இது அவர்களின் தெய்வ பக்திக்கு ஒரு சான்று.,6
நபிகள்_நாயகம்-கி._ஆ._பெ._விசுவநாதம்,இறுதியில் அவர்கள் கூறியவாறே நடந்தது.,4
நபிகள்_நாயகம்-கி._ஆ._பெ._விசுவநாதம்,இரண்டாவது நிகழ்ச்சி இன்னும் கொஞ்சம் கடுமையானது.,5
நபிகள்_நாயகம்-கி._ஆ._பெ._விசுவநாதம்,"யூதன் ஒருவன் தன் வாளை எடுத்துக் கொண்டு இவர்களை வெட்டு ஒன்று, துண்டு இரண்டாக வெட்ட நெடுநாளாகக் காத்திருந்தான்.",14
நபிகள்_நாயகம்-கி._ஆ._பெ._விசுவநாதம்,அவனுக்கு வாய்ப்பு வரவில்லை.,3
நபிகள்_நாயகம்-கி._ஆ._பெ._விசுவநாதம்,பல நாள் தேடிக் கொண்டிருந்தான்.,4
நபிகள்_நாயகம்-கி._ஆ._பெ._விசுவநாதம்,அப்போதும் வாய்ப்புக் கிடைக்கவில்லை.,3
நபிகள்_நாயகம்-கி._ஆ._பெ._விசுவநாதம்,பலர் கூட இருப்பதால் தனித்துச் சந்திக்க முடியவில்லை.,6
நபிகள்_நாயகம்-கி._ஆ._பெ._விசுவநாதம்,"ஒரு நாள் அவன் சாலையில் வரும் பொழுது, நாயகம் அவர்கள் ஒரு மரத்தடியில் களைப்பைத் தீர்த்துக் கொள்ளப் படுத்திருந்தார்கள்.",14
நபிகள்_நாயகம்-கி._ஆ._பெ._விசுவநாதம்,அப்படியே கண்ணயர்ந்து விட்டார்கள்.,3
நபிகள்_நாயகம்-கி._ஆ._பெ._விசுவநாதம்,இதைக் கண்டுவிட்டான் யூதன்.,3
நபிகள்_நாயகம்-கி._ஆ._பெ._விசுவநாதம்,"எடுத்தான் வாளை, நீட்டினான் கழுத்தண்டை.",4
நபிகள்_நாயகம்-கி._ஆ._பெ._விசுவநாதம்,யாரும் அங்கு தடுப்பாரும் இல்லை.,4
நபிகள்_நாயகம்-கி._ஆ._பெ._விசுவநாதம்,அவரும் அங்கு விழிப்போடு இல்லை.,4
நபிகள்_நாயகம்-கி._ஆ._பெ._விசுவநாதம்,"வாளை ஓங்கி விட்டான், வெட்டிக்கொல்வதற்கு !",4
நபிகள்_நாயகம்-கி._ஆ._பெ._விசுவநாதம்,"உள்ளத்தில் வெற்றி பெற்ற மகிழ்ச்சியோடு, ஓய் முகமதுவே !",6
நபிகள்_நாயகம்-கி._ஆ._பெ._விசுவநாதம்,உன்னை யார் இப்போது காப்பாற்றப் போகிறார்கள்?,5
நபிகள்_நாயகம்-கி._ஆ._பெ._விசுவநாதம்,என்று உரக்கக் கூறி வாளை ஓங்கினான்.,5
நபிகள்_நாயகம்-கி._ஆ._பெ._விசுவநாதம்,"உடனே நாயகம் அவர்கள் விழித்ததும், அவனையும் அவனது வாளையும் கண்டு ஆச்சரியப்பட்டு, அல்லாஹ் !",10
நபிகள்_நாயகம்-கி._ஆ._பெ._விசுவநாதம்,என்று கையை நீட்டிக் தேக்கினார்கள்.,4
நபிகள்_நாயகம்-கி._ஆ._பெ._விசுவநாதம்,அவன் குழம்பி உன்னை யார் காப்பாற்றப் போகிறார்கள்?,6
நபிகள்_நாயகம்-கி._ஆ._பெ._விசுவநாதம்,"என்று கேட்ட கேள்விக்கு, அல்லாஹ் காப்பாற்றப் போகிறார் என்ற விடை வந்ததாக எண்ணினான்.",10
நபிகள்_நாயகம்-கி._ஆ._பெ._விசுவநாதம்,"கை நழுவி, வாள் கீழே விழுந்து விட்டது.",6
நபிகள்_நாயகம்-கி._ஆ._பெ._விசுவநாதம்,"நாயகம் அவர்கள் அந்த வாளைக் கையில் எடுத்து கொண்டு, இப்பொழுது உன்னை யார் காப்பாற்றப் போகிறார்கள்?",12
நபிகள்_நாயகம்-கி._ஆ._பெ._விசுவநாதம்,அதற்கு அவன் ஹஜ்ரத் !,3
நபிகள்_நாயகம்-கி._ஆ._பெ._விசுவநாதம்,நீங்கள்தான் காப்பாற்ற வேண்டும் என்றான்.,4
நபிகள்_நாயகம்-கி._ஆ._பெ._விசுவநாதம்,"அதற்கு நாயகம் அவர்கள், அல்ல உன்னையும் என்னையும் காப்பாற்றியவன் ஆண்டவனே !",8
நபிகள்_நாயகம்-கி._ஆ._பெ._விசுவநாதம்,எனக் கூறிச் சென்று விட்டார்.,4
நபிகள்_நாயகம்-கி._ஆ._பெ._விசுவநாதம்,இது அவர்களது தெய்வ பக்திக்கு மற்றொரு சான்று.,6
நபிகள்_நாயகம்-கி._ஆ._பெ._விசுவநாதம்,தன்னைக் கொல்ல வந்த பசுவையும் கொல்லலாம் என்பது ஒரு நீதி.,8
நபிகள்_நாயகம்-கி._ஆ._பெ._விசுவநாதம்,"தன்னைக் கொல்ல வந்த மனிதனையும், கொல்லாமல் விட்டது நாயகம் அவர்களின் நீதி.",9
நபிகள்_நாயகம்-கி._ஆ._பெ._விசுவநாதம்,"என்னே, நாயகம் அவர்களின் நீதியும், தெய்வ பக்தியும் !",6
நபிகள்_நாயகம்-கி._ஆ._பெ._விசுவநாதம்,"சிக்கனம் கருமித்தனம் அல்ல ஒரு சமயம் நாயகம் அவர்களிடம் ஒரு பெரியவர் வந்து, தங்கள் ஊரில் பள்ளிவாசல் இல்லை.",14
நபிகள்_நாயகம்-கி._ஆ._பெ._விசுவநாதம்,அதைக் கட்டியாக வேண்டும்.,3
நபிகள்_நாயகம்-கி._ஆ._பெ._விசுவநாதம்,"அதற்குப் பணம் தேவை, என்ன செய்யலாம்?",5
நபிகள்_நாயகம்-கி._ஆ._பெ._விசுவநாதம்,"அதற்கு நாயகம் அவர்கள், பக்கத்து ஊரிலுள்ள ஒரு செல்வனின் பெயரைச் சொல்லி, அவரிடம் சென்று கேளுங்கள்.",12
நபிகள்_நாயகம்-கி._ஆ._பெ._விசுவநாதம்,பெரியவர் உடனே அவ்வூருக்குச் சென்று அப்பணக்காரரைப் பார்க்கப் போனார்.,7
நபிகள்_நாயகம்-கி._ஆ._பெ._விசுவநாதம்,"அப்பொழுது பணக்காரர் தம் வேலையாளைத் தூணிற் கட்டி வைத்துத் தம் கையை மடக்கி, அவன் முகத்தில் குத்திக் கொண்டிருந்தார்.",14
நபிகள்_நாயகம்-கி._ஆ._பெ._விசுவநாதம்,"பெரியவர் பக்கத்திலுள்ளவர்களிடம் ஏன் இப்படி, அவனைக் குத்துகிறார் என்று கேட்டார்.",8
நபிகள்_நாயகம்-கி._ஆ._பெ._விசுவநாதம்,செல்வர் வேலையாளைப் பருப்பு வாங்கி வரச் சொன்னார்.,6
நபிகள்_நாயகம்-கி._ஆ._பெ._விசுவநாதம்,"பத்துப் பருப்புச் சிந்திப் போயிற்று, அதற்காக அவனைப் பத்துக் குத்துக் குத்திக் கொண்டிருக்கிறார் என்றார்கள்.",11
நபிகள்_நாயகம்-கி._ஆ._பெ._விசுவநாதம்,"அதைக் கேட்டதும், பெரியவர் பயந்து ஓட்டம் பிடித்து நாயகம் அவர்களிடம் திரும்பி வந்து விட்டார்.",11
நபிகள்_நாயகம்-கி._ஆ._பெ._விசுவநாதம்,"நாயகம் அவர்கள், செல்வர் என்ன கொடுத்தார்?",5
