work_title,sentence,sentence_length
நபிகள்_நாயகம்-கி._ஆ._பெ._விசுவநாதம்,நபிகள் நாயகம் கி.,3
நபிகள்_நாயகம்-கி._ஆ._பெ._விசுவநாதம்,"﻿ நபிகள் நாயகம் முத்தமிழ்க் காவலர், கலைமாமணி, டாக்டர் கி.",8
நபிகள்_நாயகம்-கி._ஆ._பெ._விசுவநாதம்,"﻿விலை ரூ. கவின்கலை அச்சகம், து தெரு, கந்தசாமி நகர், பாலவாக்கம் சென்னை தொலைபேசி",11
நபிகள்_நாயகம்-கி._ஆ._பெ._விசுவநாதம்,"இப்பேச்சை இஸ்லாமியப் பெருமக்கள் பலரும், இஸ்லாமியப் பத்திரிகைகளின் ஆசிரியர்கள் சிலரும் பாராட்டியிருந்தனர்.",9
நபிகள்_நாயகம்-கி._ஆ._பெ._விசுவநாதம்,இதை நூல் வடிவில் வெளியிட வேண்டுமெனப் பல அன்பர்கள் வற்புறுத்தி எழுதியிருந்தனர்.,9
நபிகள்_நாயகம்-கி._ஆ._பெ._விசுவநாதம்,"இன்னும் சிறிது விரிவுபடுத்தி, ஒரு பெரிய நூலாக வெளியிட எண்ணியும், என்னால் முடியவில்லை.",10
நபிகள்_நாயகம்-கி._ஆ._பெ._விசுவநாதம்,இந்த அளவுக்கேனும் வெளியிட முடிந்தமை குறித்து மகிழ்ச்சியடைகிறேன்.,6
நபிகள்_நாயகம்-கி._ஆ._பெ._விசுவநாதம்,நயினார் முகம்மது எம்.,3
நபிகள்_நாயகம்-கி._ஆ._பெ._விசுவநாதம்,"ஆவி ஜனாப் மெளல்வி முன்ஷி பாசில் சையத் அப்துல் கனி அவர்களுக்கும் என் நன்றியறிதலையும், வணக்கத்தையும் தெரிவித்துக் கொள்ளுகிறேன்.",14
நபிகள்_நாயகம்-கி._ஆ._பெ._விசுவநாதம்,செல்லப்பன் அவர்களுக்கும் என் நன்றி.,4
நபிகள்_நாயகம்-கி._ஆ._பெ._விசுவநாதம்,"இதை இஸ்லாமியப் பெருமக்கள் மட்டுமின்றி, எல்லாச் சமய மக்களும் படித்து, வாழ்க்கைக்குப் பயன்படுத்திப் பலனடைவது நல்லது.",12
நபிகள்_நாயகம்-கி._ஆ._பெ._விசுவநாதம்,இஸ்மாயில் அவர்கள் மதிப்புரை திரு கி.,5
நபிகள்_நாயகம்-கி._ஆ._பெ._விசுவநாதம்,"விசுவநாதம் அவர்கள் சாதி, சமய பேதமின்றி தமிழர்கள் அனைவருடைய அன்புக்கும், மதிப்புக்கும், மரியாதைக்கும் பாத்திரமானவர்கள்.",11
நபிகள்_நாயகம்-கி._ஆ._பெ._விசுவநாதம்,"அவர்களுடைய பகுத்தறிவுப் பற்று இஸ்லாத்திடத்திலும், அதன் திருத்தூதரான முஹம்மது நபி அவர்களிடத்திலும் உண்மையான ஈடுபாட்டை உண்டாக்கிற்று.",12
நபிகள்_நாயகம்-கி._ஆ._பெ._விசுவநாதம்,"இத்தகைய நல்லெண்ணத்திற்காகவும், முஸ்லிம்கள் திரு கி.",5
நபிகள்_நாயகம்-கி._ஆ._பெ._விசுவநாதம்,விசுவநாதம் அவர்களுக்கு என்றும் நன்றியுள்ளவர்களாக இருப்பார்கள்.,5
நபிகள்_நாயகம்-கி._ஆ._பெ._விசுவநாதம்,"இந்நூலில் சரித்திர ஆதாரமில்லாமல் கர்ண பரம்பரையாக வழங்கி வருகின்ற நிகழ்ச்சிகள் சிலவும், சில தவறுகளும் இடம் பெற்றிருக்கின்றன.",13
நபிகள்_நாயகம்-கி._ஆ._பெ._விசுவநாதம்,சில அச்சுப் பிழைகளும் காணப்படுகின்றன.,4
நபிகள்_நாயகம்-கி._ஆ._பெ._விசுவநாதம்,இவை அடுத்த பதிப்பில் தவிர்க்கப்படவேண்டும் என்பது என் நோக்கம்.,7
நபிகள்_நாயகம்-கி._ஆ._பெ._விசுவநாதம்,"ஆசிரியர் அவர்களுடைய இந்த முயற்சியும், பணியும் எல்லோருடைய போற்றுதலுக்கும், பாராட்டுதலுக்கும் உரியன.",9
நபிகள்_நாயகம்-கி._ஆ._பெ._விசுவநாதம்,இத்தகைய கருத்துகளை அகமார்ந்த ஆர்வத்தோடு வெளியிட்டிருக்கும் திரு கி.,7
நபிகள்_நாயகம்-கி._ஆ._பெ._விசுவநாதம்,"விசுவநாதம் அவர்களுக்கு என்னுடைய பாராட்டுதலையும், நன்றியையும், மரியாதையையும் தெரிவித்துக்கொள்கிறேன்.",7
நபிகள்_நாயகம்-கி._ஆ._பெ._விசுவநாதம்,விசுவநாதம் அவர்களுக்கு அறிமுகம் தேவையில்லை.,4
நபிகள்_நாயகம்-கி._ஆ._பெ._விசுவநாதம்,வாதத்திறமை பெரிதும் உடையவர்.,3
நபிகள்_நாயகம்-கி._ஆ._பெ._விசுவநாதம்,முதுமைப் பருவம் எய்திய மூதறிஞர்.,4
நபிகள்_நாயகம்-கி._ஆ._பெ._விசுவநாதம்,எழுபத்தைந்து ஆண்டுகளை எட்டிப் பிடித்த பெரியவர்.,5
நபிகள்_நாயகம்-கி._ஆ._பெ._விசுவநாதம்,பற்பல சமயங்களைத் தர்க்க முறையில் ஆராய்ந்து அறிந்தவர்.,6
நபிகள்_நாயகம்-கி._ஆ._பெ._விசுவநாதம்,"தமிழகம் முழுவதுமிருந்து வருகின்ற முஸ்லீம் மக்களுடன், அவர் நீண்ட காலமாக நெருக்கமான தொடர்பு கொண்டவர்.",11
நபிகள்_நாயகம்-கி._ஆ._பெ._விசுவநாதம்,"இஸ்லாமிய சமூகத்தில் அவருக்கு மிகுந்த செல்வாக்கும், நல்ல மதிப்பும் உண்டு.",8
நபிகள்_நாயகம்-கி._ஆ._பெ._விசுவநாதம்,"இஸ்லாமிய இலக்கியங்களையும், சமய உண்மைகளையும் நன்கறிந்தவர்.",5
நபிகள்_நாயகம்-கி._ஆ._பெ._விசுவநாதம்,இன்றைய இஸ்லாமியத் தலைமுறையினரில் சிலர் கூட அவர் மூலம் இஸ்லாத்தைப் பற்றித் தெரிந்துகொண்டார்கள் என்பது மிகையாகாது.,12
நபிகள்_நாயகம்-கி._ஆ._பெ._விசுவநாதம்,"இன்று அது நூல் வடிவில் வெளிவருகிறது, இது அருமையும் பெருமையும் வாய்ந்ததாகும்.",9
நபிகள்_நாயகம்-கி._ஆ._பெ._விசுவநாதம்,இந்நூலை நான் பார்வையிட்டு மகிழ்ந்தேன்.,4
நபிகள்_நாயகம்-கி._ஆ._பெ._விசுவநாதம்,"கருத்துகள் சுவையும், நயமும் கலந்து மிளிர்கின்றன.",5
நபிகள்_நாயகம்-கி._ஆ._பெ._விசுவநாதம்,செய்திகள் ஆதாரத்தோடு விளக்கம் பெற்றிருக்கின்றன.,4
நபிகள்_நாயகம்-கி._ஆ._பெ._விசுவநாதம்,நாயகம் அவர்களைப் பற்றி நாவலர் விசுவநாதம் அவர்கள் எவ்வளவு ஆராய்ந்திருக்கிறார்கள் என்பதற்கு இந்நூலே ஒரு சான்று.,12
நபிகள்_நாயகம்-கி._ஆ._பெ._விசுவநாதம்,தங்களன்புள்ள சையத் அப்துல் கனி திருச்சிராப்பள்ளி உள்ளுறை ⁠ நபிகள் நாயகம்...,9
நபிகள்_நாயகம்-கி._ஆ._பெ._விசுவநாதம்,திருக் குர் ஆன்...,3
நபிகள்_நாயகம்-கி._ஆ._பெ._விசுவநாதம்,நாயகம் அவர்களின் போதனை﻿﻿﻿﻿...,3
நபிகள்_நாயகம்-கி._ஆ._பெ._விசுவநாதம்,முடிவுரை... ﻿ நபிகள் நாயகம் அவைத்தலைவர் அவர்களே !,6
நபிகள்_நாயகம்-கி._ஆ._பெ._விசுவநாதம்,உங்கள் அனைவருக்கும் இந்த மாலைப் பொழுதில் என்னுடைய தாழ்மையான வணக்கம்.,8
நபிகள்_நாயகம்-கி._ஆ._பெ._விசுவநாதம்,"கும்பகோணத்தில் கூடியுள்ள பெருமக்களாகிய உங்கள் முன்பு, இன்றைய தினம் அகில இந்திய மீலாத் விழா நடைபெற்றுக் கொண்டிருக்கிறது.",13
நபிகள்_நாயகம்-கி._ஆ._பெ._விசுவநாதம்,இந்த விழாவிலே பங்கு பெறுகின்ற பேறு எனக்கும் கிடைத்தமை பற்றி அதிக மகிழ்ச்சி அடைகிறேன்.,11
நபிகள்_நாயகம்-கி._ஆ._பெ._விசுவநாதம்,நாயகம் அவர்களுடைய பிறந்த நாள் விழா நடப்பது குறித்து நாற்பத்தைந்து ஆண்டுகளுக்கு முன்னே மாறுபட்ட கருத்தும் தோன்றியதுண்டு.,13
நபிகள்_நாயகம்-கி._ஆ._பெ._விசுவநாதம்,மெளல்விமார்கள் அன்று அதை மறுத்தார்கள் பண்டிகைகளைப் போல இவ்விழாவைக் கொண்டாடக் கூடாது என்று.,10
நபிகள்_நாயகம்-கி._ஆ._பெ._விசுவநாதம்,"முதன் முதலாக இந்த விழாவைக் கொண்டாடியது திருச்சிராப்பள்ளியில், நாற்பத்தைந்து ஆண்டுகளுக்கு முன்னே.",9
நபிகள்_நாயகம்-கி._ஆ._பெ._விசுவநாதம்,நாயகம் அவர்களுக்குப் பிறந்த நாள் விழாவா?,5
நபிகள்_நாயகம்-கி._ஆ._பெ._விசுவநாதம்,என்ற ஒரு கேள்வியும் கிளம்பியது அன்று.,5
நபிகள்_நாயகம்-கி._ஆ._பெ._விசுவநாதம்,அவர்கட்கு அன்று நாங்கள் பதில் சொன்னோம்.,5
நபிகள்_நாயகம்-கி._ஆ._பெ._விசுவநாதம்,பிள்ளைகள் பிறந்த நாளைப் பெற்றோர்கள் கொண்டாடுவது ஒரு மரபு.,7
நபிகள்_நாயகம்-கி._ஆ._பெ._விசுவநாதம்,பெற்றோர்களுடைய பிறந்த நாளைப் பிள்ளைகள் கொண்டாடுவது ஒரு வழக்கம்.,7
நபிகள்_நாயகம்-கி._ஆ._பெ._விசுவநாதம்,ஒரு நாட்டுத் தலைவன் பிறந்த நாளை அந்த நாட்டு மக்கள் கொண்டாடுவது ஒரு பழக்கம்.,11
நபிகள்_நாயகம்-கி._ஆ._பெ._விசுவநாதம்,ஒரு சமயத் தலைவர் பிறந்த நாளை அந்தச் சமயத்தைச் சார்ந்த மக்கள் எல்லாரும் கொண்டாடுவது ஒரு வழக்கம்.,13
நபிகள்_நாயகம்-கி._ஆ._பெ._விசுவநாதம்,ஒரு சேனைத் தலைவன் பிறந்த நாளை அச்சேனையைச் சார்ந்த போர் வீரர்கள் எல்லாரும் கொண்டாடுவது ஒரு பழக்கம்.,13
நபிகள்_நாயகம்-கி._ஆ._பெ._விசுவநாதம்,என்று அன்று முழக்கினோம்.,3
நபிகள்_நாயகம்-கி._ஆ._பெ._விசுவநாதம்,நாம் மட்டும் இங்கு விழாக் கொண்டாடவில்லை.,5
நபிகள்_நாயகம்-கி._ஆ._பெ._விசுவநாதம்,இன்று உலகம் முழுதும் கொண்டாடிக் கொண்டிருக்கிறது.,5
நபிகள்_நாயகம்-கி._ஆ._பெ._விசுவநாதம்,"கொண்டாடுவதின் நோக்கம் உத்தமன் பிறந்த நாள், உலகம் சிறந்த நாள் என்பதே.",9
நபிகள்_நாயகம்-கி._ஆ._பெ._விசுவநாதம்,"வரலாறு பிறந்த நாள் விழாக் கொண்டாடுகின்ற இந்தக் காலத்தில், பேசவேண்டிய பேச்சு அவருடைய வரலாறு ஒன்றுதான்.",12
நபிகள்_நாயகம்-கி._ஆ._பெ._விசுவநாதம்,வேறு எதையும் பேசுவதற்கு இந்த மேடையில் இடமில்லை.,6
நபிகள்_நாயகம்-கி._ஆ._பெ._விசுவநாதம்,நாயகம் அவர்களுடைய வரலாற்றைக் கூறுவதற்கு ஒரு நிமிடம் போதும்.,7
நபிகள்_நாயகம்-கி._ஆ._பெ._விசுவநாதம்,"அவர்கள் பிறந்த நகரம், அவரைப் பெற்றதனால் பெயரும் புகழும் பெற்ற மக்கா நகரம்.",10
நபிகள்_நாயகம்-கி._ஆ._பெ._விசுவநாதம்,அவர்கள் பிறந்து அறுபத்து மூன்று ஆண்டுகள் இந்த நிலவுலகில் வாழ்ந்தார்கள்.,8
நபிகள்_நாயகம்-கி._ஆ._பெ._விசுவநாதம்,பிறந்த ஆறு ஆண்டுக்குள்ளாகவே பெற்றோர் இருவரையும் இழந்தார்கள்.,6
நபிகள்_நாயகம்-கி._ஆ._பெ._விசுவநாதம்,பெரிய தந்தையாராலே வளர்க்கப் பெற்றார்கள்.,4
நபிகள்_நாயகம்-கி._ஆ._பெ._விசுவநாதம்,"முன்னைய நாற்பது ஆண்டுகள் குடும்பத்திற்காக, வணிகத்திற்காக என்றே கழிந்தன.",7
நபிகள்_நாயகம்-கி._ஆ._பெ._விசுவநாதம்,"அக்காலத்திலும் கூட, சாதாரண மக்களிடத்தில் காணப் பெறாத அரிய செயல்கள், அவர்களிடத்திலே காணப் பெற்றன.",11
நபிகள்_நாயகம்-கி._ஆ._பெ._விசுவநாதம்,"பின்னைய இருபத்து மூன்று ஆண்டுகள், உலக மக்களுக்காக என்றே வாழ்ந்தார்கள்.",8
நபிகள்_நாயகம்-கி._ஆ._பெ._விசுவநாதம்,"இந்த அறுபத்து மூன்று ஆண்டுகளிலே, அவர்கள் செயற்கரும் செயல்களைச் செய்து சீர்திருத்தத்தைப் புகுத்தி, தம் காலத்திலேயே வெற்றியும் பெற்றார்கள்.",14
நபிகள்_நாயகம்-கி._ஆ._பெ._விசுவநாதம்,"பசித்திருந்து, தனித்திருந்து, விழித்திருந்து புனிதத் திருமறையை நமக்கு இறக்கித் தந்தார்கள் நம்மைவிட்டு மறைந்தார்கள் என்பதுதான் அவர் களுடைய வரலாறு.",14
நபிகள்_நாயகம்-கி._ஆ._பெ._விசுவநாதம்,அவர்களுடைய வரலாற்றைக் கூறுவதற்கு.,3
நபிகள்_நாயகம்-கி._ஆ._பெ._விசுவநாதம்,அரேபியா நாடு ஒரு மணி நேரம் பேசவேண்டும் என்று கேட்டுக் கொண்டார்கள்.,9
நபிகள்_நாயகம்-கி._ஆ._பெ._விசுவநாதம்,ஒரு நிமிடத்தில் வரலாறு முடிந்தது.,4
நபிகள்_நாயகம்-கி._ஆ._பெ._விசுவநாதம்,இன்னும் ஐம்பத்தொன்பது நிமிடங்கட்கு என்ன சொல்வது என்று தெரியவில்லை.,7
நபிகள்_நாயகம்-கி._ஆ._பெ._விசுவநாதம்,ஆனால் அவர் தொடர்பான செய்திகளைப் பேசுவதற்கு ஆண்டுக் கணக்காகும்.,7
நபிகள்_நாயகம்-கி._ஆ._பெ._விசுவநாதம்,அவர் பிறந்த நாடு அரேபியா நாடு.,5
நபிகள்_நாயகம்-கி._ஆ._பெ._விசுவநாதம்,"அவர்கள் பிறந்த காலத்தில், அந்நாட்டு மக்கள் குடி, கூத்தி, கொள்ளையிடுதல் ஆகியவற்றைச் செய்து கொண்டிருந்தார்கள்.",11
நபிகள்_நாயகம்-கி._ஆ._பெ._விசுவநாதம்,மேல்நாட்டுப் பேரறிஞன் சொன்னான் நாயகம் அவர்கள் பிறந்த பொழுது அராபிய நாடு கார்காலத்து இருளைப் போல் இருந்தது என்று.,14
நபிகள்_நாயகம்-கி._ஆ._பெ._விசுவநாதம்,என் உள்ளம் அதை ஒப்பவில்லை.,4
நபிகள்_நாயகம்-கி._ஆ._பெ._விசுவநாதம்,கார்காலத்து இருளிலாவது அடிக்கடி மின்னல் தோன்றும்.,5
நபிகள்_நாயகம்-கி._ஆ._பெ._விசுவநாதம்,மக்கள் வழி நடக்க அது துணை செய்யும்.,6
நபிகள்_நாயகம்-கி._ஆ._பெ._விசுவநாதம்,"அன்றைய அரேபிய மக்களிடத்தில், அந்த மின்னல் கூடத் தோன்றவில்லை.",7
நபிகள்_நாயகம்-கி._ஆ._பெ._விசுவநாதம்,அவ்வளவு இருள் கவ்வி இருந்தது.,4
நபிகள்_நாயகம்-கி._ஆ._பெ._விசுவநாதம்,அதற்கு ஒரு சான்று சொன்னால் போதுமானது.,5
நபிகள்_நாயகம்-கி._ஆ._பெ._விசுவநாதம்,அடுத்த வீட்டுக்காரன் ஆடு வளர்த்தான்.,4
நபிகள்_நாயகம்-கி._ஆ._பெ._விசுவநாதம்,எதிர்த்த வீட்டுக்காரன் அவரைக் கொடி வளர்த்தான்.,5
நபிகள்_நாயகம்-கி._ஆ._பெ._விசுவநாதம்,அடுத்த வீட்டுக்காரனுடைய ஆடு எதிர் வீட்டு அவரைக் கொடியைத் தின்றுவிட்டது.,8
நபிகள்_நாயகம்-கி._ஆ._பெ._விசுவநாதம்,அவ்வளவு புத்திசாலித்தனம் அக்கால அரேபியர்களிடம் இருந்தது.,5
நபிகள்_நாயகம்-கி._ஆ._பெ._விசுவநாதம்,இன்றைய அரேபிய மக்கள் உலகத்தில் சிறந்த விஞ்ஞானிகளாக இருக்கிறார்கள்.,7
நபிகள்_நாயகம்-கி._ஆ._பெ._விசுவநாதம்,விஞ்ஞானிகளிலே மிகச் சிறந்த விஞ்ஞானிகள் இன்றைய அரேபியர்கள்.,6
நபிகள்_நாயகம்-கி._ஆ._பெ._விசுவநாதம்,இஸ்லாமிய மாணிக்கம் இதனால்தான் ஒரு மேலை நாட்டு அறிஞன் சொன்னான் !,8
நபிகள்_நாயகம்-கி._ஆ._பெ._விசுவநாதம்,உலகம் முழுவதும் ஒளி வீசக் கூடிய ஒரு இஸ்லாமிய மாணிக்கம் அரேபிய நாட்டில் கண்டெடுக்கப் பெற்றது என்று.,13
நபிகள்_நாயகம்-கி._ஆ._பெ._விசுவநாதம்,இந்தச் சொற்றொடருக்கு எவ்வளவு பொருள் !,4
