work_title,sentence,sentence_length
நபிகள்_நாயகம்-கி._ஆ._பெ._விசுவநாதம்,"ஆனால் ஓர் ஆயிரத்து நாநூறு  ஆண்டுகளுக்கு முன்பே மது விலக்குச் சட்டம் நிறைவேற்றியிருக்கிறார் என்றால், அவர் தீர்க்கதரிசியா அல்லவா?",14
நபிகள்_நாயகம்-கி._ஆ._பெ._விசுவநாதம்,அல்லவா என்பதை எண்ணிப் பாருங்கள்.,4
நபிகள்_நாயகம்-கி._ஆ._பெ._விசுவநாதம்,"திருக்குர்ஆன் எம்பெருமானார் நபிகள் நாயகம் அவர்கள் படிக்கவில்லை, அப்படிப் படிக்காத ஒருவர் வாயிலிருந்து நமது திருமறையாகிய திருக்குர்ஆன் தோன்றியுள்ளது.",14
நபிகள்_நாயகம்-கி._ஆ._பெ._விசுவநாதம்,இது நடக்கக்கூடிய காரியமா?,3
நபிகள்_நாயகம்-கி._ஆ._பெ._விசுவநாதம்,நீங்கள் இதை ஒப்புக் கொள்கிறீர்களா என்று என்னையே பலர் கேட்டிருக்கிறார்கள்.,8
நபிகள்_நாயகம்-கி._ஆ._பெ._விசுவநாதம்,நான் அவர்களுக்குக் கூறிய விடை பைபிளில் உள்ள ஒரு கதைதான்.,8
நபிகள்_நாயகம்-கி._ஆ._பெ._விசுவநாதம்,சாலமோன் ஞானி என்று ஒரு பெரியவர் இருந்தார் என்பதை பைபிளைப் படித்த எவரும் நன்கறிவார்கள்.,11
நபிகள்_நாயகம்-கி._ஆ._பெ._விசுவநாதம்,அவர் வேறு யாரும் அல்லர்.,4
நபிகள்_நாயகம்-கி._ஆ._பெ._விசுவநாதம்,அவர் நமது ஹஜரத் சுலைமான் அவர்கள் தாம்.,6
நபிகள்_நாயகம்-கி._ஆ._பெ._விசுவநாதம்,திருக்குர்ரானையும் பைபிளையும் படிப்பவர்களுக்கு இரண்டிலும் காணப்படுகின்ற பெயர்கள் ஒரே பெயராகத் தோன்றும்.,9
நபிகள்_நாயகம்-கி._ஆ._பெ._விசுவநாதம்,நல்லவன் வறுமை வாய்ப்பட்டுத் துன்பப்படுகிறானே ஏன் !,5
நபிகள்_நாயகம்-கி._ஆ._பெ._விசுவநாதம்,கெட்டவன் செல்வம் படைத்து மகிழ்ச்சியோடு வாழ்கிறானே ஏன்?,6
நபிகள்_நாயகம்-கி._ஆ._பெ._விசுவநாதம்,செல்வம் படைத்த பலருக்குக் குழந்தை இல்லையே ஏன்?,6
நபிகள்_நாயகம்-கி._ஆ._பெ._விசுவநாதம்,அவர்கள் விரும்பியும் வேண்டியும் குழந்தை பிறக்காதது ஏன்?,6
நபிகள்_நாயகம்-கி._ஆ._பெ._விசுவநாதம்,வறுமை வாய்ப்பட்ட ஏழை மக்களுக்கு அதிகப் பிள்ளைகள் பிறந்திருப்பதேன்?,7
நபிகள்_நாயகம்-கி._ஆ._பெ._விசுவநாதம்,அவர்கள் விரும்பா விட்டாலும் அதிகமான குழந்தைகள் பிறக்கின்றனவே !,6
நபிகள்_நாயகம்-கி._ஆ._பெ._விசுவநாதம்,இது கடவுள் செயலா?,3
நபிகள்_நாயகம்-கி._ஆ._பெ._விசுவநாதம்,கடவுள் செயல் என்றால் அது நியாயமாகுமா?,5
நபிகள்_நாயகம்-கி._ஆ._பெ._விசுவநாதம்,சாத்தான் செயல் என்றால் கடவுளின சக்திக்கு மீறியும் சில செயல்கள் நடக்க முடியுமா?,10
நபிகள்_நாயகம்-கி._ஆ._பெ._விசுவநாதம்,என்பதே அவரது ஐயம்.,3
நபிகள்_நாயகம்-கி._ஆ._பெ._விசுவநாதம்,இதை அவர்கள் எண்ணி எண்ணிப் பார்த்தார்கள்.,5
நபிகள்_நாயகம்-கி._ஆ._பெ._விசுவநாதம்,பல நாள் சிந்தித்தார்கள்.,3
நபிகள்_நாயகம்-கி._ஆ._பெ._விசுவநாதம்,"வீட்டிலிருந்தும், வீதியிலிருந்தும் நடந்தும், கிடந்தும் ஆலோசித்துப் பார்த்தார்கள்.",6
நபிகள்_நாயகம்-கி._ஆ._பெ._விசுவநாதம்,சாலமோன் ஞானி தம் முயற்சியைக் கை விடவில்லை.,6
நபிகள்_நாயகம்-கி._ஆ._பெ._விசுவநாதம்,எப்படியாகிலும் இதற்கு விடை கண்டே தீருவேன் என்று உறுதி பூண்டார்.,8
நபிகள்_நாயகம்-கி._ஆ._பெ._விசுவநாதம்,"ஞானி அதைப் பொருட்படுத்தாமல், தம் சிந்தனையிலேயே ஆழ்ந்து நடந்து கொண்டிருந்தார்.",8
நபிகள்_நாயகம்-கி._ஆ._பெ._விசுவநாதம்,ஒரு வித முடிவும் தோன்றவில்லை.,4
நபிகள்_நாயகம்-கி._ஆ._பெ._விசுவநாதம்,மாலைப் பொழுது மறையவே வீடு திரும்பலானார்.,5
நபிகள்_நாயகம்-கி._ஆ._பெ._விசுவநாதம்,"சிறிது தூரம் நடந்ததும், கடற்கரையில் விளையாடிக் கொண்டிருந்த சிறுவனின் நினைவு வந்தது.",9
நபிகள்_நாயகம்-கி._ஆ._பெ._விசுவநாதம்,அங்கிருந்தே அவனைக் கூப்பிட்டார்.,3
நபிகள்_நாயகம்-கி._ஆ._பெ._விசுவநாதம்,சிறுவன் அதைச் சிறிதும் காதில் வாங்காமல் மேலும் விளையாடிக் கொண்டிருந்தான்.,8
நபிகள்_நாயகம்-கி._ஆ._பெ._விசுவநாதம்,"சாலமோன் ஞானி அவனிடமே சென்று, தம்பி பொழுது இருட்டுகிறதே.",7
நபிகள்_நாயகம்-கி._ஆ._பெ._விசுவநாதம்,"அதற்கு அவன் ஹஜ்ரத், உங்கள் வேலை முடிந்து விட்டது போல் இருககிறது.",9
நபிகள்_நாயகம்-கி._ஆ._பெ._விசுவநாதம்,என் வேலை இன்னும் முடியவில்லை.,4
நபிகள்_நாயகம்-கி._ஆ._பெ._விசுவநாதம்,"அதை முடித்த பிறகுதான், நான் வீடு திரும்புவேன் என உறுதியாகக் கூறினான்.",9
நபிகள்_நாயகம்-கி._ஆ._பெ._விசுவநாதம்,அது என்ன வேலை?,3
நபிகள்_நாயகம்-கி._ஆ._பெ._விசுவநாதம்,"அதற்கு அவன், கடல் தண்ணீர் முழுவதையும் இந்தக் கொட்டாங்கச்சியால் இறைத்துக் கரையில் ஊற்றுகின்ற வேலை என்றான்.",12
நபிகள்_நாயகம்-கி._ஆ._பெ._விசுவநாதம்,"ஞானி வியப்புடன் சிரித்து, தம்பி !",4
நபிகள்_நாயகம்-கி._ஆ._பெ._விசுவநாதம்,கடல் தண்ணீர் எவ்வளவு !,3
நபிகள்_நாயகம்-கி._ஆ._பெ._விசுவநாதம்,உன் கையில் உள்ள கொட்டாங்கச்சி எவ்வளவு !,5
நபிகள்_நாயகம்-கி._ஆ._பெ._விசுவநாதம்,"இதைக் கொண்டு அதை எப்படி இறைத்து, ஊற்ற முடியும் எனக் கேட்டார்.",9
நபிகள்_நாயகம்-கி._ஆ._பெ._விசுவநாதம்,"சிறுவன் சொன்னான், ஹஜரத் !",3
நபிகள்_நாயகம்-கி._ஆ._பெ._விசுவநாதம்,ஆண்டவன் எவ்வளவு ! உங்கள் மூளை எவ்வளவு !,5
நபிகள்_நாயகம்-கி._ஆ._பெ._விசுவநாதம்,"இதைக் கொண்டு அவன் செயலை அறிய முடியுமானால், இந்தக் கொட்டாங்கச்சியைக் கொண்டு இக்கடல் தண்ணீரை இறைத்து விட முடியாதா?",14
நபிகள்_நாயகம்-கி._ஆ._பெ._விசுவநாதம்,நீங்களும் முயற்சி செய்யுங்கள் நானும் முயற்சிக்கிறேன் என்று மறுபடியும் ஓடிக் கடல் தண்ணீரை முகக்கத் தொடங்கினான்.,12
நபிகள்_நாயகம்-கி._ஆ._பெ._விசுவநாதம்,சாலமோன் ஞானிக்கு விடை கிடைத்து விட்டது.,5
நபிகள்_நாயகம்-கி._ஆ._பெ._விசுவநாதம்,கிடைத்த விடை என்ன?,3
நபிகள்_நாயகம்-கி._ஆ._பெ._விசுவநாதம்,ஞானிக்கு ஐயம் மறைந்தது.,3
நபிகள்_நாயகம்-கி._ஆ._பெ._விசுவநாதம்,அதே வினாடியில் சிறுவனும் மறைந்தான்.,4
நபிகள்_நாயகம்-கி._ஆ._பெ._விசுவநாதம்,இஸ்லாத்தின் வளர்ச்சி கி.,3
நபிகள்_நாயகம்-கி._ஆ._பெ._விசுவநாதம்,இன்று இஸ்லாமிய சமயத்தினர் எண்ணிக்கை தொண்ணுறு கோடியாக உயர்ந்திருக்கிறது.,7
நபிகள்_நாயகம்-கி._ஆ._பெ._விசுவநாதம்,"அதாவது, இன்றைய உலக மக்களின் எண்ணிக்கையில் ஐந்தில் ஒரு பங்கு.",8
நபிகள்_நாயகம்-கி._ஆ._பெ._விசுவநாதம்,நூறு மக்களில் இருபது பேர் இஸ்லாமிய சமயத்தைத் தழுவி நிற்பவர்.,8
நபிகள்_நாயகம்-கி._ஆ._பெ._விசுவநாதம்,"இது நபிகள் நாயகத்தின் பேராற்றலையும், இஸ்லாமிய சமயத்தின் தத்துவத்தையும் விளக்கிக் காட்டுவதாகும்.",9
நபிகள்_நாயகம்-கி._ஆ._பெ._விசுவநாதம்,நபி என்ற சொல்லுக்கு இறைவனுடைய தூதர் என்று பொருள்.,7
நபிகள்_நாயகம்-கி._ஆ._பெ._விசுவநாதம்,"இது, அதன் பரந்து விரிந்த மனப்பான்மையையே காட்டுவதாகும்.",6
நபிகள்_நாயகம்-கி._ஆ._பெ._விசுவநாதம்,இம்முறையில் இறைவனால் கடைசியாக அனுப்பப்பட்ட திருத்தூதர் முகமது நபி அவர்கள் என்பதே இஸ்லாமியக் கோட்பாடுகளில் தலை சிறந்தது.,13
நபிகள்_நாயகம்-கி._ஆ._பெ._விசுவநாதம்,இவ்வுலகில் இதுவரை தோன்றியுள்ள எல்லா நபிகளுக்கும் எட்டு.,6
நபிகள்_நாயகம்-கி._ஆ._பெ._விசுவநாதம்,"இவ்வுலகில் இதுவரை தோன்றியுள்ள எல்லா நபிகளுக்கும் தலைவர் என்ற பொருளில்தான், நபிகள் நாயகம் என்ற பெயரே அமைந்திருக்கிறது.",13
நபிகள்_நாயகம்-கி._ஆ._பெ._விசுவநாதம்,அருங்குணங்கள் இனி இவரது அருங்குணங்கள் சிலவற்றை ஆராய்வோம்.,6
நபிகள்_நாயகம்-கி._ஆ._பெ._விசுவநாதம்,ஏழைகள் மீது கருணை எம்பெருமானார் அவர்கள் கருணையுள்ளம் படைத்தவர்கள்.,7
நபிகள்_நாயகம்-கி._ஆ._பெ._விசுவநாதம்,அதிலும் அவர்கள் ஏழைகளிடத்தில் காட்டும் கருணை அளவு கடந்ததாகும்.,7
நபிகள்_நாயகம்-கி._ஆ._பெ._விசுவநாதம்,அதற்கு எடுத்துக்காட்டு ஒன்று கூறுகிறேன்.,4
நபிகள்_நாயகம்-கி._ஆ._பெ._விசுவநாதம்,"ஆனால் இத்தாலி தேசத்துப் பேராசிரியர் ஒருவர், அதில் ஒரு நயத்தைப் புகுத்தி எழுதியிருக்கிறார்.",10
நபிகள்_நாயகம்-கி._ஆ._பெ._விசுவநாதம்,இது நம் உள்ளத்தைத் தொடவில்லையா?,4
நபிகள்_நாயகம்-கி._ஆ._பெ._விசுவநாதம்,இது எவ்வளவு பெரிய கருணை என எண்ணிப் பார்க்க வேண்டும்.,8
நபிகள்_நாயகம்-கி._ஆ._பெ._விசுவநாதம்,பெண்ணுக்குப் பெருமை ஒரு சமயம் நாயகம் அவர்களை அவரது தாயார் பார்க்க வந்தார்கள்.,10
நபிகள்_நாயகம்-கி._ஆ._பெ._விசுவநாதம்,அதுவும் பெற்ற தாயல்ல செவிலித்தாய் வளர்த்த தாய்.,6
நபிகள்_நாயகம்-கி._ஆ._பெ._விசுவநாதம்,உடனே தம் மேலாடையை எடுத்து விரித்து அதில் உட்கார வைத்துப் பேசி அனுப்பி வைத்தார்கள்.,11
நபிகள்_நாயகம்-கி._ஆ._பெ._விசுவநாதம்,பெண்ணுக்கு அவர்கள் தந்த பெருமைக்கு இதைவிட வேறு என்ன சான்று வேண்டும்?,9
நபிகள்_நாயகம்-கி._ஆ._பெ._விசுவநாதம்,"எளிமை நாயகம் அவர்களைப் பல அறிஞர்கள் சூழ்ந்து கொண்டு, நீங்கள் தேவனா?",9
நபிகள்_நாயகம்-கி._ஆ._பெ._விசுவநாதம்,இல்லை நான் உங்களைப் போன்று ஒரு மனிதன் என்றார்கள்.,7
நபிகள்_நாயகம்-கி._ஆ._பெ._விசுவநாதம்,இது அவர்களிடம் காணப்பெற்ற எளிமைக்கு ஒரு சான்று தங்களையே கடவுள் என்று சொல்லிக் கொண்டு வாழ்ந்தவர்களையெல்லாம் நாம் பாத்திருக்கிறோம்.,14
நபிகள்_நாயகம்-கி._ஆ._பெ._விசுவநாதம்,தங்களைக் கடவுளுடைய குமாரன் என்று சொல்லிக் கொண்டவர்களுடைய வரலாறு நமக்குத் தெரியும்.,9
நபிகள்_நாயகம்-கி._ஆ._பெ._விசுவநாதம்,கடவுளுடைய அவதார புருஷர்கள் என்று சொல்லிக் கொண்டவர்கள் பலர்.,7
நபிகள்_நாயகம்-கி._ஆ._பெ._விசுவநாதம்,"நாயகம் அவர்களிடத்தில் இந்தச் சொல், அவர்கள் வாயிலிருந்து வந்ததே இல்லை.",8
நபிகள்_நாயகம்-கி._ஆ._பெ._விசுவநாதம்,இத்தகைய பெருந்தன்மையை மற்றவர்களிடத்தில் காண முடியுமா?,5
நபிகள்_நாயகம்-கி._ஆ._பெ._விசுவநாதம்,ஜீவகாருண்யம் ஜீவகாருண்யத்தில் நாயகம் அவர்களுக்கு அதிகப் பற்றுண்டு.,6
நபிகள்_நாயகம்-கி._ஆ._பெ._விசுவநாதம்,பல பேர் நினைக்கிறார்கள்.,3
நபிகள்_நாயகம்-கி._ஆ._பெ._விசுவநாதம்,"இஸ்லாமியர் எல்லாம் இரக்கமில்லாது, உயிர்களைக் கொல்லுகின்றவர்கள் என்றும், அவ்வாறு அவர்களுக்கு நாயகம் போதித்திருக்கிறார்கள் என்றும்.",11
நபிகள்_நாயகம்-கி._ஆ._பெ._விசுவநாதம்,அவர்களுடைய சீடர்களிலே ஒருவர் நேற்றுப் பத்துப் பேருக்கு விருந்து பண்ணினேன் என்றார்.,9
நபிகள்_நாயகம்-கி._ஆ._பெ._விசுவநாதம்,நாயகம் அவர்கள் என்ன செய்தாய்?,4
நபிகள்_நாயகம்-கி._ஆ._பெ._விசுவநாதம்,பத்து குருவிகளைச் சமைத்தேன் என்றார்.,4
நபிகள்_நாயகம்-கி._ஆ._பெ._விசுவநாதம்,ஒரு கோழியைச் சமைத்திருக்கலாமே ! என்றார்.,4
நபிகள்_நாயகம்-கி._ஆ._பெ._விசுவநாதம்,"பத்து உயிர்கள் கொல்லப்படுகிறதை விட ஒர் உயிர் கொல்லப்படுவது இரக்கம், அவர்களுடைய கருணை.",10
நபிகள்_நாயகம்-கி._ஆ._பெ._விசுவநாதம்,"மற்றொரு நாள், வேறொருவர் வந்து ஐந்து ஆடுகளை அறுத்து இருநூறு  பேருக்கு விருந்தளித்தேன் என்றார்.",11
நபிகள்_நாயகம்-கி._ஆ._பெ._விசுவநாதம்,ஒரு மாட்டை அறுத்திருக்கலாமே !,3
நபிகள்_நாயகம்-கி._ஆ._பெ._விசுவநாதம்,எவ்வளவு ஜீவகாருண்யம் பாருங்கள் !,3
நபிகள்_நாயகம்-கி._ஆ._பெ._விசுவநாதம்,சகிப்புத் தன்மை அவர்களுடைய சகிப்புத் தன்மைக்கு ஒரே ஒரு சான்று.,8
நபிகள்_நாயகம்-கி._ஆ._பெ._விசுவநாதம்,நாள்தோறும் அவர்கள் பள்ளிவாசலுக்குப் போவார்கள்.,4
நபிகள்_நாயகம்-கி._ஆ._பெ._விசுவநாதம்,"ஒரு நாளாகிலும் நின்று, அது யார் என்று அவர்கள் கேட்டதில்லை.",8
நபிகள்_நாயகம்-கி._ஆ._பெ._விசுவநாதம்,பல நாள் அது நடை பெற்று வந்தது.,6
நபிகள்_நாயகம்-கி._ஆ._பெ._விசுவநாதம்,அவர்கள் சகிப்புத் தன்மையோடு அதைத் துடைத்துக் கொண்டு பள்ளிவாசலுக்குப் போய் ஒதுச் செய்து தொழுது வருவார்கள்.,12
நபிகள்_நாயகம்-கி._ஆ._பெ._விசுவநாதம்,"போகும் போது கொட்டாவிட்டால், வரும் போது கொட்டுவான் என்பது அவர்களுக்குத் தெரியும்.",9
நபிகள்_நாயகம்-கி._ஆ._பெ._விசுவநாதம்,அவர்கள் அதற்கும் தயாராக வருவார்கள்.,4
நபிகள்_நாயகம்-கி._ஆ._பெ._விசுவநாதம்,ஒரு நாள் பள்ளிவாசலுக்குப் போகும் போதும் குப்பை விழவில்லை.,7
நபிகள்_நாயகம்-கி._ஆ._பெ._விசுவநாதம்,தொழுது திரும்பி வரும் போதும் விழவில்லை.,5
நபிகள்_நாயகம்-கி._ஆ._பெ._விசுவநாதம்,அவர்கள் கால் எட்டிப் போகவில்லை.,4
நபிகள்_நாயகம்-கி._ஆ._பெ._விசுவநாதம்,அந்த வீட்டைத் திரும்பிப் பார்த்தார்கள்.,4
நபிகள்_நாயகம்-கி._ஆ._பெ._விசுவநாதம்,ஆனால் ஒருவன் எதிர்த்த வீட்டிலிருந்து சொன்னான்.,5
நபிகள்_நாயகம்-கி._ஆ._பெ._விசுவநாதம்,"நீங்கள் செல்லுங்கள், ஹஜ்ரத்.",3
நபிகள்_நாயகம்-கி._ஆ._பெ._விசுவநாதம்,அவன் விளையாட்டுக்காரப் பையன்.,3
நபிகள்_நாயகம்-கி._ஆ._பெ._விசுவநாதம்,அவன் ஏதோ தெரியாமல் செய்து விட்டான் என்று.,6
