work_title,sentence,sentence_length
பாப்பா_முதல்_பாட்டி_வரை,சில சமயங்களில் கருக் குழந்தையின் கழுத்தை நஞ்சுக்கொடி சுற்றிக்கொண்டு அதற்கு திணறல் ஏற்படும் நிலையில் சிசேரியன் தேவைப்படும்.,13
பாப்பா_முதல்_பாட்டி_வரை,மன இறுக்கம் கூடாது பிரசவ நேரத்தில் கர்ப்பிணிகள் மன நிலை தளர்வாக இருப்பது அவசியம்.,11
பாப்பா_முதல்_பாட்டி_வரை,"அதிர்ச்சி, குடும்பப் பிரச்சினைகள், பேற்றைப் பற்றி அதிகக் கவலை ஆகியவற்றடன் கர்ப்பிணி இருந்தால், கர்ப்பப் பை வாய் திறக்காது.",14
பாப்பா_முதல்_பாட்டி_வரை,"விளைவு, பிரசவம் தாமதமாகி, சிசேரியன் அறுவை சிகிச்சை தான் செய்ய வேண்டியிருக்கும்.",9
பாப்பா_முதல்_பாட்டி_வரை,"குழந்தைப் பேறு இல்லாத் தன்மையைப் போக்க, தற்போது செயற்கைக் கருத்தரிப்பு உள்பட, நவீன சிகிச்சை முறைகள் உள்ளன.",13
பாப்பா_முதல்_பாட்டி_வரை,"குழந்தை, பாதுகாப்பாக இப் பூமியை எட்ட வேண்டும் என்றுதான் ஆசைப்படுகின்றனர்.",8
பாப்பா_முதல்_பாட்டி_வரை,எனவே சிசேரியன் அவசியமாகிறது.,3
பாப்பா_முதல்_பாட்டி_வரை,தாய் மரண விகிதம் பிரசவ நேரத்தில் சிக்கல் ஏற்படும் சூழ்நிலையில் தாய் இறக்கும்நிலை சிசேரியன் காரணமாக வெகுவாகக் குறைந்துள்ளது.,14
பாப்பா_முதல்_பாட்டி_வரை,தற்போது அந்த விகிதம் ஓர் ஆயிரம் த்துக்கு ஒன்று என்ற அளவுக்குக் குறைந்துள்ளது.,10
பாப்பா_முதல்_பாட்டி_வரை,"அப்போது, முதல் பிரசவத்துக்கு வந்த இருபது பேரில் இரண்டு பேருக்கும் சிசேரியன் அறுவை சிகிச்சை தேவைப்பட்டது.",12
பாப்பா_முதல்_பாட்டி_வரை,மீதமுள்ள நாற்பது பேர் தான் இரண்டு அல்லது மூன்றாவது குழந்தையைப் பெற்றெடுக்க வருகின்றனர்.,10
பாப்பா_முதல்_பாட்டி_வரை,இவர்களில் ஒருவருக்கு சிசேரியன் மூலம் குழந்தை பிறக்கிறது.,6
பாப்பா_முதல்_பாட்டி_வரை,ஆக மொத்த சிசேரியன் விகிதம் ஏழு சதவீதம்.,6
பாப்பா_முதல்_பாட்டி_வரை,"ஆக நாற்பது ஆண்டுக்காலம் சிசேரியன் விகிதம், கிட்டத்தட்ட ஒரே அளவாகத்தான் உள்ளது.",9
பாப்பா_முதல்_பாட்டி_வரை,"இரட்டைக் குழந்தைகள் கருவில் இரட்டைக் குழந்தைகள் வளரும் நிலையிலும், சுகப்பிரசவம் ஏற்பட வாய்ப்புண்டு.",10
பாப்பா_முதல்_பாட்டி_வரை,"முதல் குழந்தை சிசேரியன் என்றால், இரண்டாவது குழந்தயுைம் சிசேரியனா?",7
பாப்பா_முதல்_பாட்டி_வரை,"ஆனால், தாய்க்குக் குறுகிய கூபகம்.",4
பாப்பா_முதல்_பாட்டி_வரை,"அனைத்துச் சோதனை வசதிகளும் கொண்ட மகப்பேறு மருத்தவமனையில், முன் பேற்றுக்கால கவனிப்பைச் செய்துகொள்ளவேண்டும்.",10
பாப்பா_முதல்_பாட்டி_வரை,"ஏனெனில், பிரசவ நேரத்தில் எற்படும் திடீர் விளைவுகளைச் சமாளிக்க, அனைத்து வசதிளும் கொண்ட மருத்துவமனை அவசியம்.",12
பாப்பா_முதல்_பாட்டி_வரை,சிசேரியன் செய்தவதற்கான கட்டாயச் சூழ்நிலைகள் தான் பட்டியலிடப்பட்டுள்ளன.,6
பாப்பா_முதல்_பாட்டி_வரை,"எனவே, பெற்றோரைப் போலவே சுகப் பிரசவம் மட்டுமே மருத்துவருக்கு மிகுந்த ஆறுதலையும், பெருமூச்சையும் அளிக்கக்கூடிய விஷயம்.",12
பாப்பா_முதல்_பாட்டி_வரை,மருத்துவச் செலவு அதிகரித்துள்ளதை யாரும் மறுக்க முடியாது.,6
பாப்பா_முதல்_பாட்டி_வரை,"தாய் சேய் இருவருமே, நலமே ஒரு நல்ல மகப்பேறு மருத்துவரின் அக்கறையாக இருக்க வேண்டும்.",11
பாப்பா_முதல்_பாட்டி_வரை,கர்ப்பப் பைக்கு நீங்களே காவல் கர்ப்ப காலத்தில் குழந்தையைச் சுமத்தல் என்பது ஒரு சுகமான சுமை.,12
பாப்பா_முதல்_பாட்டி_வரை,"குழந்தையின் கர்ப்பக்கிரகமான கர்ப்பப் பையில், உயிருக்கு ஆபத்தான கட்டிகளும் தோன்றுகின்றன என்பது வேதனைக்குரியது.",10
பாப்பா_முதல்_பாட்டி_வரை,"வயிற்றின் அடிப்பகுதியில் சிறநீர்ப் பைக்கும், மலக்குடலுக்கும் நடுவில், கர்ப்பப் பை உள்ளது.",9
பாப்பா_முதல்_பாட்டி_வரை,கர்ப்பப் பை வளர்வதற்குக் கரு முட்டையின் வளர்ச்சியும் முக்கியக் காரணம்.,8
பாப்பா_முதல்_பாட்டி_வரை,குழந்தையைச் சுமக்கும் காலத்தில் முப்பது செ.மீ வரை இது விரிவடைகிறது.,9
பாப்பா_முதல்_பாட்டி_வரை,"கர்ப்பப் பையின் பாகங்கள் உடல், வாய், குழாய் என மூன்று பகுதிகளைக் கொண்டது.",10
பாப்பா_முதல்_பாட்டி_வரை,கர்ப்பப் பை வாயில் நீர் கோர்த்த கட்டிகள் வரும்.,7
பாப்பா_முதல்_பாட்டி_வரை,ஹார்மோன்கள் மாற்றத்தால் ரத்த ஓட்டம் அதிகமாகி கர்ப்பப் பையின் உடல் பகுதியில் வருவது கர்ப்பப் பை தசைக்கட்டி.,13
பாப்பா_முதல்_பாட்டி_வரை,இது எந்த வயதிலும் வரலாம்.,4
பாப்பா_முதல்_பாட்டி_வரை,குடும்பப் பாரம்பரியமாகவும் முப்பது வயது முதல் ஐம்பது வயது வரையிலும் இக்கட்டி வர அதிக வாய்புள்ளது.,12
பாப்பா_முதல்_பாட்டி_வரை,"குழந்தை இல்லாதவர்களுக்கும், ஒரு குழந்தையுடன் நிறுத்திக் கொள்பவர்களுக்கும், அடிக்கடி ﻿கருக்கலைப்பு செய்து கொள்பவர்களுக்கும் இக் கட்டி வரக்கூடும்.",13
பாப்பா_முதல்_பாட்டி_வரை,நெல்லிக்காய் அளவில் உருவாகும் இக் கட்டி சுமார் மூன்று கிலோ வரை வளரும்.,10
பாப்பா_முதல்_பாட்டி_வரை,"இது பெரிதாக வளராது என்றாலும், வயிற்று வலியும் ரத்தப்போக்கும், கீழ் முதுகு வலியும் இருக்கும்.",11
பாப்பா_முதல்_பாட்டி_வரை,மூன்று அல்லது நான்கு குழந்தைகள் உள்ளவர்களுக்கும் நாற்பது வயதுக்கு மேலானவர்களுக்கும் இக்கட்டி வர வாய்ப்புள்ளது.,11
பாப்பா_முதல்_பாட்டி_வரை,"கர்ப்பக் குழாயில் அதிகமாக நோய்க்கிருமிகள் தாக்கினாலும், சீழ் பிடித்து கட்டிகள் உருவாகலாம்.",9
பாப்பா_முதல்_பாட்டி_வரை,"தொடர்ந்து ஆராேக்கியமற்ற முறையில் கருச்சிதைவு செய்பவர்களுக்கு, இக் கட்டி வரலாம்.",8
பாப்பா_முதல்_பாட்டி_வரை,சுமார் இருபது முதல் நாற்பது வயது வரை இந்த கட்டிகள் வரக்கூடும்.,9
பாப்பா_முதல்_பாட்டி_வரை,"புற்றுநோய்க் கட்டிகள் பெண்களுக்கு ஏற்படும் புற்றுநோய்களில், எண்பது சதவீதம் கர்ப்பப் பையில் தான் ஏற்படுகிறது.",11
பாப்பா_முதல்_பாட்டி_வரை,கிராமங்களில் இப்பாதிப்பு அதிமாகவுள்ளது.,3
பாப்பா_முதல்_பாட்டி_வரை,இக் கட்டியானது நாற்பத்தைந்து முதல் அறுபது வயதுக்கு இடைப்பட்ட காலத்தில் வரும்.,9
பாப்பா_முதல்_பாட்டி_வரை,மாதவிடாய் ﻿நின்ற பிறகு வருவதற்கான வாய்ப்புகள் அதிகம்.,6
பாப்பா_முதல்_பாட்டி_வரை,"வெள்ளைபடுதல், விட்டு விட்டு வரும் மாதவிடாய், முதுகுவலி ஆகியவை இதற்கான அறிகுறிகளாகும்.",9
பாப்பா_முதல்_பாட்டி_வரை,இப் புற்றுநோயை பூஜ்ஜியம் நான்கு கட்டங்களாகப் பிரிக்கலாம்.,6
பாப்பா_முதல்_பாட்டி_வரை,"ஆரம்பத்தில் கண்டுபிடித்தால், எளிதாக சிகிச்சை அளிக்க முடியும்.",6
பாப்பா_முதல்_பாட்டி_வரை,"சிகிச்சை காலதாமதமானால், அது உயிருக்கு ஆபத்தாக முடியும்.",6
பாப்பா_முதல்_பாட்டி_வரை,"வேகமாக வளரும் கர்ப்பப் பை புற்று நோயானது, அருகில் உள்ள உறுப்புகளையும் பாதிக்கும்.",10
பாப்பா_முதல்_பாட்டி_வரை,"கர்ப்பப் பையின் உடல் பகுதியில் ஏற்படும் புற்றுநோய்க் கட்டிகள், மகப்பேறு தொடர்பானவை.",9
பாப்பா_முதல்_பாட்டி_வரை,"கர்ப்பப் பையில் முத்துப்பிள்ளை உண்டானவர்களுக்கு, இந்தக் கட்டிவர நாற்பது சதவீத வாய்ப்புள்ளது.",9
பாப்பா_முதல்_பாட்டி_வரை,இக் கட்டி உள்ளவர்களுக்குக் குழந்தை உண்டாயிருத்தல் போன்ற உணர்வு ஏற்படும்.,8
பாப்பா_முதல்_பாட்டி_வரை,"ஆனால், குழந்தையின் அசைவு இருக்காது.",4
பாப்பா_முதல்_பாட்டி_வரை,இதை ஸ்கேன் மூலம் பத்து வாரத்துக்குள் கண்டுபிடித்து விடலாம்.,7
பாப்பா_முதல்_பாட்டி_வரை,"இக் கட்டி ஏற்பட்டவர்களுக்குக் கல்லீரல், நுரையீரல் பாதிப்பு ஏற்பட வாய்ப்புள்ளது.",8
பாப்பா_முதல்_பாட்டி_வரை,இக் கட்டியை மருத்து மூலமாகக் குணமாக்கலாம்.,5
பாப்பா_முதல்_பாட்டி_வரை,"தெற்காசிய நாட்டிலுள்ளவர்களுக்கு, இக் கட்டி அதிகமாக வருகிறது.",6
பாப்பா_முதல்_பாட்டி_வரை,"இருபது வயது முதல் முப்பத்தைந்து வயதுக்குள்ளானவர்களுக்கு, இக் கட்டியின் தாக்குதல் ஏற்படுகிறது.",9
பாப்பா_முதல்_பாட்டி_வரை,புற்றுநோயாக மாறும் கட்டிகள் சதைக்கட்டிகள் நாளடைவில் புற்றுநோய்க் கட்டிகளாக மாற வாய்புள்ளது.,9
பாப்பா_முதல்_பாட்டி_வரை,கர்ப்பப் பையின் உட்புறப் பகுதியிலும் புற்றுநோய் ஏற்பட வாய்ப்பு உண்டு.,8
பாப்பா_முதல்_பாட்டி_வரை,"குழந்தை இல்லாதவர்கள், அதிக எடை, ரத்த அழுத்தம், சர்க்கரை நோய் உள்ளவர்களுக்கு இக் கட்டி வரலாம்.",12
பாப்பா_முதல்_பாட்டி_வரை,நாற்பது வயதுக்கு மேற்பட்டவர்களுக்கு இது வரக்கூடும்.,5
பாப்பா_முதல்_பாட்டி_வரை,கர்ப்பப் பையில் ஏற்படும் புற்றுநோய்க் கட்டிகளால் உயிருக்கு ஆபத்து.,7
பாப்பா_முதல்_பாட்டி_வரை,"சாராரணக் கட்டிகள் பக்க உறுப்புகளைப் பாதித்து, அதனால் சாவு ஏற்படும்.",8
பாப்பா_முதல்_பாட்டி_வரை,கண்டுபிடித்தல் டாக்டரிடம் சென்று பரிசோதனை செய்ய வேண்டும்.,6
பாப்பா_முதல்_பாட்டி_வரை,"பரிசோதனையின் போதே, ஐம்பது சதவீத நோயைக் கண்டுபிடித்து விடலாம்.",7
பாப்பா_முதல்_பாட்டி_வரை,"இதன் மூலம், புற்றுநோயின் துவக்கத் கட்டத்தைக் கண்டுபிடித்து விடலாம்.",7
பாப்பா_முதல்_பாட்டி_வரை,"அடுத்து, திசு பரிசோதனை செய்தாலும் கர்ப்பப் பையில் ஏற்படும் கட்டிகள் குறித்துக் கண்டுபிடித்து விடலாம்.",11
பாப்பா_முதல்_பாட்டி_வரை,ஸ்கேன் பரிசோதனையின் மூலம் கட்டி குறித்து அறியலாம்.,6
பாப்பா_முதல்_பாட்டி_வரை,"லேப்ராஸ்கோப்பி மூலமாகக் கட்டியை நேரடியாகப் பார்த்து, அதில் பயாப்சி எடுத்துப் பரிசோதனைக்கு உட்படுத்தலாம்.",10
பாப்பா_முதல்_பாட்டி_வரை,"கர்ப்பப் பை உள்ளே வளரும் கட்டியை, ஹிஸ்ட்தோஸிகோபி கருவி மூலம் அறிய முடியும்.",10
பாப்பா_முதல்_பாட்டி_வரை,ஸ்கேன் பரிசோதனையும் இதற்கு பயனுள்ளதாக இருக்கும்.,5
பாப்பா_முதல்_பாட்டி_வரை,"சிகிச்சை பெண்ணின் வயது, குழந்தை நிலை, குழந்தைகள் எண்ணிக்கை, நோயின் தன்மை ஆகியவற்றைக் கருத்தில் கொண்டு, சிகிச்சை அளிக்கப்படுகிறது.",14
பாப்பா_முதல்_பாட்டி_வரை,"குழந்தை இல்லாதவர்களுக்கு அறுவை சிகிச்சை மூலம், கட்டி மட்டுமே அகற்றப்படுகிறது.",8
பாப்பா_முதல்_பாட்டி_வரை,கர்ப்பப் பை அகற்றப்பட மாட்டாது.,4
பாப்பா_முதல்_பாட்டி_வரை,"ஆனால், குழந்தை இருந்தாலும், இல்லா விட்டாலும், புற்றுநோய் இருந்தால், கர்ப்பப்பையும் அதைச் சார்ந்த பகுதியும் அகற்றுவது அவசியம்.",13
பாப்பா_முதல்_பாட்டி_வரை,"புற்றுநோய் இல்லையெனில், லேப்ராஸ்கோப்பி மூலம் கட்டியின் அளவைப் பொறுத்து அகற்றி விடலாம்.",9
பாப்பா_முதல்_பாட்டி_வரை,கர்ப்பப் பை வாயில் ஏற்படும் புற்று நோயைக் கதிர் வீச்சு மூலம் அகற்றலாம்.,10
பாப்பா_முதல்_பாட்டி_வரை,மூன்றாவது கட்ட நிலையிலுள்ள புற்றுநோய்க்குக் கதிர்வீச்சு மூலம் சிகிச்சையளிப்பது நல்லது.,8
பாப்பா_முதல்_பாட்டி_வரை,"இதனால் ரத்தக்கசிவும், வலியும் குறைய வாய்புள்ளது.",5
பாப்பா_முதல்_பாட்டி_வரை,இதைத்தவிர மருந்துகள் மூலமாகவும் சிகிச்சையளிக்கத் தற்போது வசதிகள் உள்ளன.,7
பாப்பா_முதல்_பாட்டி_வரை,பெரிய அளவிலான கட்டிகளை அறுவை சிகிச்சை மூலம் மட்டுமே அகற்றமுடியும்.,8
பாப்பா_முதல்_பாட்டி_வரை,"முத்துப்பிள்ளை தொடர்பாக ஏற்படும் புற்றுநோய்க் கட்டிகளை, மருந்துகள் மூலமாகக் கரைக்க முடியும்.",9
பாப்பா_முதல்_பாட்டி_வரை,தடுப்பு முறை கர்ப்பப் பைக் கட்டி தொடர்பாக பொதுமக்களுக்கு விழிப்புணர்வு தேவை.,9
பாப்பா_முதல்_பாட்டி_வரை,"டாக்டர்கள் அனுமதியில்லாமல், ஹார்மோன் மாத்திரைகளைச் சாப்பிடக்கூடாது.",5
பாப்பா_முதல்_பாட்டி_வரை,"வெள்ளைபடுதல் பிரச்சனை ஏற்பட்டால், டாக்டரின் ஆலோசனை பெற்று ஆண்டுதோறும் பரிசோதனை செய்துகொள்ள வேண்டும்.",10
பாப்பா_முதல்_பாட்டி_வரை,எப்போது திருமணம் பதினெட்டு  வயதிற்குள் திருமணம் செய்து கொள்ளக்கூடாது.,7
பாப்பா_முதல்_பாட்டி_வரை,"இரண்டு குழந்தைகளுக்கு நடுவில், மூன்று ஆண்டு இடைவெளி தேவை.",7
பாப்பா_முதல்_பாட்டி_வரை,இடையில் கருவுற்றால் கருக்கலைப்புக் கூடாது.,4
பாப்பா_முதல்_பாட்டி_வரை,"நாற்பது வயதுக்கு மேலான பெண்கள், ஆண்டுதோறும் மருத்துவப் பரிசோதனை செய்து கொள்ள வேண்டும்.",10
பாப்பா_முதல்_பாட்டி_வரை,"ஆக, கர்ப்பப் பையில் நோய் வராமல் காத்துக் கொள்வது ஒவ்வொரு பெண்ணின் கையில் உள்ளது.",11
பாப்பா_முதல்_பாட்டி_வரை,"குழந்தைக்காக முயற்சிக்கும் நான்கு கோடிப் பேரில், நாற்பது லட்சம் பேருக்குக் குழந்தை பாக்கியம் கிடைப்பதில்லை.",11
