work_title,sentence,sentence_length
பாப்பா_முதல்_பாட்டி_வரை,"முகத்தில், கன்னத்தின் மீது மெல்லத் தட்டினால், அங்குள்ள முக நரம்பு அதிர்ச்சியுற்றுக் கன்னத்துத் தசை துடிக்கத் துவங்கும்.",13
பாப்பா_முதல்_பாட்டி_வரை,"இந்த அறிகுறி தென்பட்டால், நரம்புமண்டலம் மிகவும் மெலிந்த நிலையில் உள்ளது என அறிந்து, தக்க சிகிச்சை செய்யவேண்டும்.",13
பாப்பா_முதல்_பாட்டி_வரை,மாந்த இரைப்பு இது பல் முளைக்கும் பருவத்தில் காணப்படும்.,7
பாப்பா_முதல்_பாட்டி_வரை,"பெரும்பாலும் இதற்கு இலக்காகும் குழந்தைகள், ஏற்கெனவே கணைய நோயினால் பாதிக்கப்பட்டிருப்பார்கள்.",8
பாப்பா_முதல்_பாட்டி_வரை,நோய்க்குறி குரல்வளை வாயில் இசிவுகண்டு வருவதால் நுரையீரலுக்குக் காற்றுப்போக முடியாது தடங்கல் ஏற்பட்டு விடுகின்றது.,11
பாப்பா_முதல்_பாட்டி_வரை,"அதனால் மூச்சு நன்றாகச் சுவாசிக்க இயலாது, திணறல் ஏற்படுகின்றது.",7
பாப்பா_முதல்_பாட்டி_வரை,"விளையாடிக்கொண்டிருந்த குழந்தை திடீரென்று சுவாசிக்க முடியாது, தலையைப் பின்பக்கம் சாய்த்துக்கொண்டு, முகம் நீலமாகித் திடீரென்று கொளகொளவென்று விநோதமான ஒலியுண்டாக்கும்.",14
பாப்பா_முதல்_பாட்டி_வரை,"சிறிது பொழுது எதையோ கண்டு பயந்தது போல் அழுதுவிட்டுப், பிறகு மறுபடியும் விளையாட்டில் ஈடுபடும்.",11
பாப்பா_முதல்_பாட்டி_வரை,இது மிகவும் அபாயகரமானதொரு கோளாறு.,4
பாப்பா_முதல்_பாட்டி_வரை,"சில சமயம் மூச்சுத் திணறல் அதிகமாகி விட்டால், குழந்தை மரணமடைவதும் உண்டு.",9
பாப்பா_முதல்_பாட்டி_வரை,இதைத் தான் மாந்தம் என்கிறார்கள்.,4
பாப்பா_முதல்_பாட்டி_வரை,சிகிச்சை இசிவின்போது முகத்தில் குளிர்ந்த நீரைத் தெளிக்கவேண்டும்.,6
பாப்பா_முதல்_பாட்டி_வரை,கழுத்தின் மீது சூடான ஒத்தடம் கொடுப்பதும் நன்மை பயக்கும்.,7
பாப்பா_முதல்_பாட்டி_வரை,"இசிவு மிகவும் மும்முரமாக இருந்தால், சிறிது குளோரோபாரம் மயக்கம் கொடுப்பதும் அதைத்தடுக்கும் ஒரு முறையாம்.",11
பாப்பா_முதல்_பாட்டி_வரை,இத்தகைய இசிவு வராது தடுப்பதுதான் நல்ல சிகிச்சையாகும்.,6
பாப்பா_முதல்_பாட்டி_வரை,"இந்தக் குழந்தைகளை அடித்துத் துயரப்படுத்தி, மனச் சங்கடம் உண்டாக்காது பாதுகாக்கவேண்டும்.",8
பாப்பா_முதல்_பாட்டி_வரை,"நரம்பு மண்டலத்தை ﻿நிதானப்படுத்த, புரோமைடுகள், குளோரால் முதலிய மருந்துகள் உள்ளுக்குச் சாப்பிடக் கொடுப்பது நலம்.",11
பாப்பா_முதல்_பாட்டி_வரை,"கணைநோய் மூலகாரணமாக இருந்தால், அதற்குத் தகுந்தை சிகிச்சைகள் செய்வது தான் முறையாகும்.",9
பாப்பா_முதல்_பாட்டி_வரை,பிறவிக் குறள்வளை நடுக்கம் இதுவும் நரம்புபற்றிய ஒரு கோளாறு.,7
பாப்பா_முதல்_பாட்டி_வரை,"நோய்க்குறி பிறந்த சில வாரங்களில், குழந்தை மூச்சு விடுகையில் பூனை சீறுகின்றதைப் போன்ற ஒரு ஒலி எழும்.",13
பாப்பா_முதல்_பாட்டி_வரை,"ஆனால், தூங்குகையில் இத்தகைய ஒலி காணப்படாது.",5
பாப்பா_முதல்_பாட்டி_வரை,"குழந்தை கோபப்படும் பொழுதும், எரிச்சலாக இருக்கையிலும், இந்த ஒலி மிகவும் அதிகமாகக் கேட்கும்.",10
பாப்பா_முதல்_பாட்டி_வரை,"சிகிச்சை இது மந்த இசிவைப்போல், கொடியதல்ல.",5
பாப்பா_முதல்_பாட்டி_வரை,இது குழந்தையின் முதல் வயதில் தானே மறைந்துபோகும்.,6
பாப்பா_முதல்_பாட்டி_வரை,ஆகவே தனிப்பட்ட சிகிச்சை தேவையில்லை.,4
பாப்பா_முதல்_பாட்டி_வரை,"காரணம் இந் நோய்க்கு மூலகாரணமாக உள்ளது, கணைநோயும், அதிக பேதியும் ஆகும்.",9
பாப்பா_முதல்_பாட்டி_வரை,"ஒரு வயதிற்கு ﻿மேற்பட்ட குழந்தையிடம் கணைநோய் கர்ணப் படுகையில், இந்த இசிவு நோயையும் வரக் காணலாம்.",12
பாப்பா_முதல்_பாட்டி_வரை,"ஒரு வயதிற்குட்பட்ட குழந்தை, பேதியில் கஷ்டப்படுகையில் இத்தகைய இசிவும் தோன்றலாம்.",8
பாப்பா_முதல்_பாட்டி_வரை,"ஆனால் இந்த இசிவுற்கு முக்கியக் காரணம், இரத்திலுள்ள கால்சிய அளவிற்கு வெகு குறைவாக இருப்பது.",11
பாப்பா_முதல்_பாட்டி_வரை,இரத்தத்தில் கால்சியம் கறைந்து போவதற்குக் காரணம் கேடயச் சுரப்பித்துணை எனும் சுரப்பி ஒழுங்கீனமாக வேலை செய்வதுதான்.,12
பாப்பா_முதல்_பாட்டி_வரை,"இந் நோய் உயிருக்குக் கெடுதி செய்யாது, எனினும் மிகவும் வலி கொடுக்கும் நோய்.",10
பாப்பா_முதல்_பாட்டி_வரை,"சிகிச்சை கணை நோய்க்கு உகந்த சிகிச்சை செய்தல், வேண்டும்.",7
பாப்பா_முதல்_பாட்டி_வரை,"கால்சியம் லாக்டேட்டு மருந்து, தினசரி பதினைந்து  லிருந்து முப்பது கிரெயின் கொடுப்பதும் நலமாகும்.",10
பாப்பா_முதல்_பாட்டி_வரை,"அத்துடன் மீன் எண்ணெய் தினசரி ஒரு தேக்கரண்டி அளவு, காலையிலும் மாலையிலும் கொடுக்க வேண்டும்.",11
பாப்பா_முதல்_பாட்டி_வரை,"இசிவு நோயைக் குறைக்க, புரோமைடுகள், குளோரால் போன்ற மருந்துகள், அப்போதைக்கப்போது கொடுப்பது நலம்.",10
பாப்பா_முதல்_பாட்டி_வரை,"இத்துடன் சில சமயம், கண்களின் விழிகளும் கடியாரப் பெண்டுலம் போல் ஆடுவதும் உண்டு.",10
பாப்பா_முதல்_பாட்டி_வரை,இது சுமார் ஒரு வயதிற்குட்பட்ட குழந்தைகளிடம் காணப்படும்.,6
பாப்பா_முதல்_பாட்டி_வரை,"குழந்தை, எதையாவது ஒரு பொருளை ஊன்றிப் பார்க்க முயன்றவுடன், தலை கடிகாரப் பெண்டுலம் போல் ஆடத் துவங்கிவிடும்.",13
பாப்பா_முதல்_பாட்டி_வரை,"நரம்பு மண்டலம் ஒழுங்காக இயங்கும் கச்தி பெறாததினால், ஏற்படும் இது, விரைவில் தானே குணமாகிவிடும்.",11
பாப்பா_முதல்_பாட்டி_வரை,ஆகவே சிகிச்சை தேவையில்லை.,3
பாப்பா_முதல்_பாட்டி_வரை,சில சமயம் கொஞ்சம் அழுத்தமாக மோதிக்கொள்வதினால் சிறு காயம் ஏதேனும் ஏற்படுவதும் உண்டு.,10
பாப்பா_முதல்_பாட்டி_வரை,தனிப்பட்ட சிகிச்சை தேவையில்லை.,3
பாப்பா_முதல்_பாட்டி_வரை,புரோமைடு மருந்துகள் சிறிதளவு அவ்வப்போது அளித்தால் குணமாகிவிடும்.,6
பாப்பா_முதல்_பாட்டி_வரை,"இரவில் பயக்கோளாறு இரவில் தூங்கும் குழந்தை, சடக்கென்று விழித்துக்கொண்டு, வீறிட்டு அலறி நடுங்குவதும், ஒருவகை நரம்புக் கோளாறாகும்.",13
பாப்பா_முதல்_பாட்டி_வரை,அடிக்கடி இப்படி நேர்ந்ததால் குழந்தையின் நரம்பு மண்டலம் மிகவும் மெலிந்து போகக்கூடும்.,9
பாப்பா_முதல்_பாட்டி_வரை,அதனால் தூக்கம் கெடும்.,3
பாப்பா_முதல்_பாட்டி_வரை,உடல் நலம் அழிந்துபோகும்.,3
பாப்பா_முதல்_பாட்டி_வரை,"பயக் கோளாறுகளுக்குக் குழந்தை இலக்காவதற்கு உண்மையான காரணம், உடல்நலம் பழுதுபட்டிருப்பது தான்.",9
பாப்பா_முதல்_பாட்டி_வரை,"மலச்சிக்கல், தொண்டைச்சதை அடினாய்டு முதலியவை வீங்கி வளர்ந்து விடுதல், இவைகள் காரணமாகின்றன.",9
பாப்பா_முதல்_பாட்டி_வரை,மலச்சிக்கலுக்கு ஒருமுறை பேதிக்குக் கொடுப்பது நலம்.,5
பாப்பா_முதல்_பாட்டி_வரை,"இரவில் இருளாக இருக்கும் அறையில், தனியே குழந்தையைத் தூங்கவிடக் கூடாது.",8
பாப்பா_முதல்_பாட்டி_வரை,அறைக்குள் சிறு விளக்கை எரிப்பது நன்மையாகும்.,5
பாப்பா_முதல்_பாட்டி_வரை,பற்களைக் கடித்தல் தூக்கத்தில் பற்களைக் கடிப்பதும் உண்டு.,6
பாப்பா_முதல்_பாட்டி_வரை,"இதற்கு அசீரணம், குடல் பூச்சிகள் முதலியவை காரணம்.",6
பாப்பா_முதல்_பாட்டி_வரை,சிகிச்சை அங்கங்கே விவரிக்கப்பட்டுள்ளது.,3
பாப்பா_முதல்_பாட்டி_வரை,"ஆனால், சில குழந்தைகளுக்கு சிறுநீர்ப் பையைக் கட்டுப்படுத்த இயலுவதில்லை.",7
பாப்பா_முதல்_பாட்டி_வரை,இக் குழந்தைகள் இரவில் உறங்கும்போது சிறுநீர் கழித்துவிடும்.,6
பாப்பா_முதல்_பாட்டி_வரை,காரணம் மூன்றுவகைப்பட்டது ஒன்று.,3
பாப்பா_முதல்_பாட்டி_வரை,கீரைப்பூச்சி குடலில் இருப்பது.,3
பாப்பா_முதல்_பாட்டி_வரை,இவை இரவு வேளையில் ஆசன வாயில் வந்து தங்கிக்கொண்டு அரிப்பை உண்டாக்குகின்றன.,9
பாப்பா_முதல்_பாட்டி_வரை,தொண்டையிலும் மூக்கிலும் சதை வளர்ந்திருப்பது.,4
பாப்பா_முதல்_பாட்டி_வரை,பெண் குழந்தைகள் மணலில் விளையாடிப் பெண் உறுப்பில் புண் ஏற்படுவது.,8
பாப்பா_முதல்_பாட்டி_வரை,ஆண் குழந்தைகளுக்கு ஆண் உறுப்பின் முன்தோல் சிறுநீர் துவாரத்தை மூடும் அளவு நீண்டு வளர்ந்திருப்பது.,11
பாப்பா_முதல்_பாட்டி_வரை,சிறுநீரில் அமிலம் அதிகமாக இருப்பது முதலியன.,5
பாப்பா_முதல்_பாட்டி_வரை,சிறுநீர் பெய்யப் பயிற்சி அளியாதிருப்பது.,4
பாப்பா_முதல்_பாட்டி_வரை,"பயம், கோபம், வருத்தம், அதிர்ச்சி போன்றவை.",5
பாப்பா_முதல்_பாட்டி_வரை,"﻿சிகிச்சை புண், பூச்சித் தொந்தரவு இவைகளைக் கவனித்து, உடனுக்குடன் சிகிச்சை செய்தல் வேண்டும்.",10
பாப்பா_முதல்_பாட்டி_வரை,"பயம், கோபம் முதலிய உணாச்சிகளின் காரணமாக ஏற்பட்டதாக இருந்தால், தனிப்பட்ட சிகிச்சை தேவையில்லை.",10
பாப்பா_முதல்_பாட்டி_வரை,"மகிழ்ச்சியான மனநிலை, தாயின் ஆறுதல் மொழிகள், முதலியவையே குழந்தையிடம் காணப்படும் இப் பழக்கத்தை நீக்கிவிடும்.",11
பாப்பா_முதல்_பாட்டி_வரை,இதுவும் நரம்பு பற்றிய ஒரு கோளாறுதான்.,5
பாப்பா_முதல்_பாட்டி_வரை,"காரணம் முடக்குவாத நோயினால் பீடிக்கப்பட்டு மெலிந்துபோதல், இரத்த சோகை, பள்ளிக்கூடத்தில் அதிக வேலை, பொதுவாக, நலக்குறைவு முதலியன ஆகும்.",14
பாப்பா_முதல்_பாட்டி_வரை,"இதைத் தவிர, சொத்தைப் பல், தொண்டையில் இரணம், கண்களில் பார்வைக் கோளாறு முதலியவைகளும் காரணமாகின்றன.",11
பாப்பா_முதல்_பாட்டி_வரை,இந்த மாதிரி அங்க சேஷ்டைகளை நிறுத்த முயல வேண்டுமென்று தாயார் மெல்லக் குழந்தைகளுக்கு எடுத்துச் சொல்லவதும் நலமாகும்.,13
பாப்பா_முதல்_பாட்டி_வரை,﻿மூர்ச்சை பள்ளிப் பவருத்தில் குழந்தைகளுக்கு ஏற்படும் நரம்பு சம்பந்தமான நோய்.,8
பாப்பா_முதல்_பாட்டி_வரை,நினைவு பூரணமாக மங்கி விடுவதில்லை.,4
பாப்பா_முதல்_பாட்டி_வரை,"சில சமயம் வாந்தி, குமட்டல் இவைகளும் காணப்படும்.",6
பாப்பா_முதல்_பாட்டி_வரை,"உணர்வு பாதி தவறிய இந்நிலை, சில விநாடிகளிருந்து அரைமணி நேரம் வரையும் நீடித்திருக்கும்.",10
பாப்பா_முதல்_பாட்டி_வரை,"காரணம் இயல்பாகவே பயந்த குணம் கொண்ட மனநிலை, அசீரணம், பொதுவான ஆரோக்கிய நலிவு.",10
பாப்பா_முதல்_பாட்டி_வரை,"சிகிச்சை நரம்புகளைத் தூண்டிவிடும் ஸ்ட்ரிக்னீன் கலந்த டானிக்குகள், நல்ல ஓய்வு, இடமாற்றம், ஊட்டமான உணவு.",11
பாப்பா_முதல்_பாட்டி_வரை,இழுப்பு இரு நரம்புமண்டலம் பற்றிய நோய்களில் மிகவும் கடுமையான வகையைச் சேர்ந்தது.,9
பாப்பா_முதல்_பாட்டி_வரை,ஹிஸ்டிரியா குழந்தைகளுக்கு ஹிஸ்டிரியா வருவதற்கு இரண்டு முக்கியக் காரணங்கள் உள்ளன.,8
பாப்பா_முதல்_பாட்டி_வரை,நோய் ஏற்பட அதிக காரணமாக இருந்த சூழ்நிலை.,6
பாப்பா_முதல்_பாட்டி_வரை,நோயைத் தூண்டி உற்பத்தி செய்பவை.,4
பாப்பா_முதல்_பாட்டி_வரை,இந் நோயைத் தூண்டி வரச் செய்யக் காரணமாக அமைவன சிறு காயம் அல்லது பயம் முதலியவைகள் ஆகும்.,13
பாப்பா_முதல்_பாட்டி_வரை,குழந்தைகளிடம் ஹிஸ்டீரியா பலவகைத் தோற்றத்தில் காணப்படும்.,5
பாப்பா_முதல்_பாட்டி_வரை,இதை ஹிஸ்டீரியா தான் எனத் தீர்மானமாகக் கண்டுபிடிப்பதற்கு மருத்துவர்களால் தான் இயலும்.,9
பாப்பா_முதல்_பாட்டி_வரை,நடக்க முடியாதபடி வாத நோயல் படுத்துக் கிடக்கும் குழந்தையைத் தகுந்த மருத்துவரைக்கொண்டு சிகிச்சை செய்வது நலம்.,12
பாப்பா_முதல்_பாட்டி_வரை,"ஆனால், சில நாடுகளில் ஏழு வயது வரையுள்ள குழந்தைகளையும் இப் பள்ளிகளில் சேர்த்துக் கொள்கிறார்கள்.",11
பாப்பா_முதல்_பாட்டி_வரை,"குழந்தைப் பள்ளியானது, குழந்தைக் காப்பு விடுதிக்கும், ஆரம்பப் பள்ளிக்கும் இடையே, ஒரு முக்கிய நிலையமாக இருந்து வருகிறது.",13
பாப்பா_முதல்_பாட்டி_வரை,﻿வாழ்க்கை அனுபவங்களே கல்வியாகும் என்பது குழந்தைப் பள்ளிகளின் அடிப்படைக் கொள்கை.,8
பாப்பா_முதல்_பாட்டி_வரை,பாடம் சொல்லிக் கொடுப்பது என்பதற்கு இங்கு இடம் கிடையாது.,7
பாப்பா_முதல்_பாட்டி_வரை,அதுவே குழந்தைகள் கல்வி பெறுவதற்கான இயற்கை முறையாகும்.,6
பாப்பா_முதல்_பாட்டி_வரை,இத்தாலியில் மான்டிசோரி அம்மையார் ஒருவகைக் குழந்தைப் பள்ளியை ஓர் ஆயிரத்து தொள்ளாயிரத்து ஏழு ல் அமைத்தார்.,12
பாப்பா_முதல்_பாட்டி_வரை,ஆங்கில முறை மான்டிசோரி முறையை த.,5
பாப்பா_முதல்_பாட்டி_வரை,"விட, கிண்டர் கார்ட்டன் முறையே அதிகமாகத் தழுவியுள்ளது.",6
பாப்பா_முதல்_பாட்டி_வரை,"﻿இந்தியாவில், சென்ற இருபது ஆண்டுகளாக இந்த மூன்று வகைப் பள்ளிகளுடன் காந்தியடிகள் அமைத்த பூர்வாதாரப் பள்ளிகள் த.",13
