work_title,sentence,sentence_length
பல்லவர்_வரலாறு,பல்லவர் வரலாறு — பல்லவர் வரலாறு டாக்டர்.,6
பல்லவர்_வரலாறு,பல்லவர் வரலாறு டாக்டர்.,3
பல்லவர்_வரலாறு,"இராசமாணிக்கனார் திருநெல்வேலி, தென்னிந்திய சைவசித்தாந்த நூற்பதிப்புக் கழகம், லிட்., டி.டி.கே.",10
பல்லவர்_வரலாறு,"சாலை, சென்னை பதினெட்டு .",3
பல்லவர்_வரலாறு,"இராமசந்திரஞ் செட்டியார், பி.ஏ., பி.எல்.",6
பல்லவர்_வரலாறு,"ஆணையாளர், இந்து அறநிலையப் பாதுகாப்புக் கழகம்.",5
பல்லவர்_வரலாறு,பல்லவர் வரலாறு என்ற இந்நூல் மிகத் திறம்பட எழுதப்பட்டுள்ளது.,7
பல்லவர்_வரலாறு,இதனைப் போலவே மற்றத் தமிழ் அரசர் பரம்பரைகளுக்கும் தமிழ் நாடுகளுக்கும் வரலாற்று நூல்கள் வெளிவருவது ஒரு சிறந்த முறையாகும்.,14
பல்லவர்_வரலாறு,அந்தப் பணியை ஏற்றுக்கொண்டிருக்கும் கழகத்தார் அருஞ்செயலும் போற்றத் தக்கதே.,7
பல்லவர்_வரலாறு,சில ஆண்டுகளுக்கு முன் ஆராய்ச்சியாளர்கள் மூளையில் ஒருவிதக் கோட்பாடு முளைத்து நிலைநின்று கொண்டிருந்தது.,10
பல்லவர்_வரலாறு,அந்தக் கோட்பாடு இப்போது ஒருவாறு மாறிக் கொண்டு வருகிறது.,7
பல்லவர்_வரலாறு,இவ்வகைக் கோட்பாடு பல்லவர் தொடக்கத்திற்கும் வருவிக்கப்பட்டது.,5
பல்லவர்_வரலாறு,"ஆகவே, பெயரை நோக்கிப் பாரசீக நாட்டிற்கும் பல்லவர் தொடக்கம் கொண்டு போகப் பட்டது.",10
பல்லவர்_வரலாறு,அவ்வரசர்கள் வடமொழியில் அக்கரை எடுத்துக் கொண்டிருந்ததனால் இக்கூற்று வலியுறுத்தலும் செய்யப் பட்டது.,9
பல்லவர்_வரலாறு,"ஆனால், அம் மன்னர்கள் ஏன் தமிழ் மன்னர்களாக இருக்கக்கூடாது? என்பதுதான் இப்போது கேட்கப்படுகிற கேள்வி.",11
பல்லவர்_வரலாறு,அக் கேள்வியை மறுப்பதற்கு எதுவுமில்லை.,4
பல்லவர்_வரலாறு,"அதுபோலவே பல்லவரும், ஒருவேளை, வெளி நாட்டிலிருந்து புகுந்திருந்த போதிலும் நாளடைவில் தமிழராகித் தமிழையே போற்றினார்கள்.",11
பல்லவர்_வரலாறு,தமிழில் சைவ வைணவ இலக்கியங்களும் சமய மேம்பாடுகளும் அவர்கள் காலத்திலேயே தோன்றி உயர்வடைந்தன அல்லவா?,11
பல்லவர்_வரலாறு,உண்மையில் அம் மன்னர்களுடைய தொடக்கமும் தமிழ் மயமே என்பதற்கு எதிரிடை வாதம் யாதுமில்லை என்னலாம்.,11
பல்லவர்_வரலாறு,பல்லவர் என்ற சொல் தமிழ் அல்லவா?,5
பல்லவர்_வரலாறு,அச்சொல் அம் மரபினர்க்கே வந்திருக்கலாம்.,4
பல்லவர்_வரலாறு,இத்தகைய எடுத்துக் காட்டு சரித்திரத்தில் வந்திருக்கிறது.,5
பல்லவர்_வரலாறு,கருநாடகத்தில் ஆறு விரல் கொண்ட ஒரு மன்னனுக்கு அப்பெயர் நிலையத்திருக்கிறது.,8
பல்லவர்_வரலாறு,"முடப் பாண்டியன், கூன் பாண்டியன், நெடுமாறன் முதலிய பெயர்கள் அவ்வாறே ﻿ஏற்பட்டன.",9
பல்லவர்_வரலாறு,"மேலும், பல்லவர்கள் காடவர் முதலிய பட்டங்களைக் கொண்டிருந்தார்கள் காடு வெட்டி நகரத்தின் பெயர் காண்க.",11
பல்லவர்_வரலாறு,இஃது இப்போது கார்வெட்டி நகரம் எனப்படுகிறது அப்பெயர்கள் தமிழ்ப் பெயர்களே.,8
பல்லவர்_வரலாறு,அவை பிற்காலப் பெயர்களாக இருக்கலாம்.,4
பல்லவர்_வரலாறு,இருந்தாலும் அவற்றையே தமிழ் நூல்கள் ஆதரிக்கின்றன.,5
பல்லவர்_வரலாறு,போத்தரையர் என்பது அவர்களுடைய சிறப்புப் பெயர்.,5
பல்லவர்_வரலாறு,போது என்பது மலருக்கும் எருமைக் கடாவிற்கும் கூறப்படும்.,6
பல்லவர்_வரலாறு,மலையாளத்தில் கொங்கு அரசன் போது என்ற சொல் எருமைக் கடாவில் வந்து போர் புரிந்ததாகச் சொல்லப்படுகிறது.,12
பல்லவர்_வரலாறு,இப்போதும் தொண்டை நாட்டிலும் அதனைச் சுற்றிலும் போத்தராச கோவில்கள் உண்டு.,8
பல்லவர்_வரலாறு,இவை பல்லவர் காலத்து வழக்கு என்று அறியக்கூடும்.,6
பல்லவர்_வரலாறு,அக் கோவில்களை அரச பரம்பரையினராக உரிமை பாராட்டும் வன்னிய குலத்தார் போற்றி வருவதை அறிவோம்.,11
பல்லவர்_வரலாறு,"ஆகவே, பல்லவர் தமிழ் நாட்டினரே என்று கொள்வதே தகுதி என்னலாம்.",8
பல்லவர்_வரலாறு,பல்லவப் பெருமக்கள் வடமொழிக்குப் பல உதவிகள் புரிந்துள்ளார்கள்.,6
பல்லவர்_வரலாறு,அதற்குக் காரணம் அக்காலத்தில் வடநாட்டு நாகரிகம் தெற்கே பரவத் தொடங்கியதே.,8
பல்லவர்_வரலாறு,"எந்த இயக்கமும் முதலில் அதிகமாகப் பாராட்டப் படுவது இயற்கை பின்னர், அதன் வேகம் குறைந்து விடுவது வழக்கம்.",13
பல்லவர்_வரலாறு,பல்லவ அரசு தொடங்கிய காலத்தில் வடக்கே இருந்த பெளத்தமும் சமணமும் வந்தன.,9
பல்லவர்_வரலாறு,அவற்றின் குரவர்கள் தம்மோடு வட மொழியைக் கொண்டுவந்தார்கள்.,6
பல்லவர்_வரலாறு,காஞ்சி அச் சமயங்கட்கு நடுநாயகமாக விளங்கியது.,5
பல்லவர்_வரலாறு,பல்லவ மன்னர்களும் அவற்றை ஆதரித்தனர்.,4
பல்லவர்_வரலாறு,"ஆகவே, வடமொழிக்கு ஏற்றம் தரப்பட்டது.",4
பல்லவர்_வரலாறு,"ஆனால், நாள் ஆக ஆக அவ்வேற்றம் குறைந்தது.",6
பல்லவர்_வரலாறு,தமிழின் மேம்பாடு தொடங்கியது.,3
பல்லவர்_வரலாறு,அம் மேம்பாட்டிற்கு ஆதரவு தந்தவர்கள் சைவ வைணவ சமய ஆசிரியர்கள்.,8
பல்லவர்_வரலாறு,"நாயன்மார்களும், ஆழ்வார்களும் ஐந்து, ஆறு, ஏழு, எட்டு ஆம் நூற்றாண்டுகளில் தோன்றித் தமிழை ஆதரித்தனர்.",11
பல்லவர்_வரலாறு,சமணமும் பெளத்தமும் நிலை குலைந்தன.,4
பல்லவர்_வரலாறு,சைவ வைணவங்கள் மேலிட்டுத் தமிழை ஆதரித்தன.,5
பல்லவர்_வரலாறு,இவ்வியக்கங்களுக்குப் பல்லவர்களே காரணர்களாக இருந்தனர்.,4
பல்லவர்_வரலாறு,அவர்களால் ஆயிரக் கணக்கான சமய நிலையங்கள் தோற்றுவிக்கப்பட்டன.,6
பல்லவர்_வரலாறு,தமிழ்மக்கள் பெருமையும் விரிந்தது.,3
பல்லவர்_வரலாறு,பல்லவர்கள் சமயத்திற்குச் செய்த தொண்டுகளுள் சிறந்தவை கோயில்களே.,6
பல்லவர்_வரலாறு,அதுவரை மண்தளி களாக இருந்தவை கற்றளிகளாக மாற்றப்பட்டன.,6
பல்லவர்_வரலாறு,தொடக்கத்தில் பாறைகளைக் குடைந்து குடை கோவில்களைக் கண்டனர்.,6
பல்லவர்_வரலாறு,குடை கோவில்கள் சமணர்களுடைய பழக்கத்தின்மேல் ஏற்பட்டவை என்று கூறவேண்டும்.,7
பல்லவர்_வரலாறு,பண்டைக் குடை கோவில்கள் சமணர்கள் தவத்திற்காகக் குடைந்தவையே.,6
பல்லவர்_வரலாறு,அதனைப் பின்பற்றிப் பல்லவர்கள் குடை கோவில்களை ஆக்கினார்கள்.,6
பல்லவர்_வரலாறு,பிறகு தனிப் பாறைகளைக் கோவில்களாகச் செதுக்கினார்கள்.,5
பல்லவர்_வரலாறு,பிறகு கற்களைப் படிமானம் செய்து கட்டடமாகக் கட்டினார்கள்.,6
பல்லவர்_வரலாறு,இம்மூன்றுவகைக் கோவில்களும் பல்லவர்கள் சமைத்தவையே.,4
பல்லவர்_வரலாறு,இவற்றைப் பின்பற்றியே சோழர்கள் பெருங் கோவில்களை எழுப்பினார்கள்.,6
பல்லவர்_வரலாறு,"ஆகவே, பல்லவர்களே கோவில் அமைப்பிற்கு மூல புருடர் என்று கூறல்வேண்டும்.",8
பல்லவர்_வரலாறு,அவர்கள் காலச் சிற்பங்களை வெகு எளிதில் கண்டுகொள்ளலாம்.,6
பல்லவர்_வரலாறு,தூண்கள் கன சதுரங்களும் இடையில் எட்டு பட்டைகளும் கொண்டுள்ளன.,7
பல்லவர்_வரலாறு,துவார பாலகர்கள் இரு கைகள் கொண்டுள்ளார்கள்.,5
பல்லவர்_வரலாறு,திருமால் எறியும் படை தரித்தவர்.,4
பல்லவர்_வரலாறு,இலிங்கத்திற்குப் பின் சோமஸ்கந்தமூர்த்தி உண்டு.,4
பல்லவர்_வரலாறு,இச்சின்னங்கள் இருப்பின் பல்லவர் கோவில் என்றறிக.,5
பல்லவர்_வரலாறு,இவர்கள் காலத்தில்தான் யானை முதுகு அல்லது தூங்கானை மாடம் என்ற விமானம் தோன்றியது.,10
பல்லவர்_வரலாறு,"மேலும், கல்வெட்டுச் சாசனங்களுக்கும் பல்லவர் முதன்மை தந்தார்கள்.",6
பல்லவர்_வரலாறு,இவர்கட்கு முன் கல்வெட்டுகள் வெகு குறைவு.,5
பல்லவர்_வரலாறு,அவை பிராமி எழுத்தில் இருந்தன.,4
பல்லவர்_வரலாறு,பல்லவர் காலத்தில் பல்லவ கிரந்தம் என்று கூறும் அழகிய எழுத்துக்கள் ஆளப்பட்டன.,9
பல்லவர்_வரலாறு,அவ்வெழுத்துக்களின் அழகு பார்த்தால்தான் தெரியும்.,4
பல்லவர்_வரலாறு,பிறகு தமிழை அதிகமாகப் போற்றத் தொடங்கியவுடன் பல்லவர்கள் தமிழிலேயே எழுதினார்கள்.,8
பல்லவர்_வரலாறு,அன்றுமுதல் இப் புது இயக்கம் வெற்றியடைந்தது.,5
பல்லவர்_வரலாறு,"ஆகவே, பல்லவர்களாலே சமயமும் தமிழும் போற்றப்பட்டதை நாம் அறியவேண்டும்.",7
பல்லவர்_வரலாறு,இத்தன்மையான ஒரு பெரிய மன்னர் குடும்பத்தைப் பற்றி நாம் நன்றாக அறிய வேண்டாவோ !,10
பல்லவர்_வரலாறு,அதனை அறிவிப்பதற்காகவே திருவித்துவான் மா.இராசமாணிக்கம் பிள்ளை.,6
பல்லவர்_வரலாறு,பி.ஓ.எல்.,3
பல்லவர்_வரலாறு,அவர்கள் இவ்வரிய நூலை வெளியீட்டுள்ளார்கள்.,4
பல்லவர்_வரலாறு,"ஆயின், அவற்றிற் காணப்பெறும் செய்திகள் அனைத்தும் நன்கு ஆராய்ந்து தமிழில் இதுகாறும் செம்மையுற எழுதப்படவில்லை.",11
பல்லவர்_வரலாறு,காலஞ் சென்ற வரலாற்றுப் பேராசிரியர் வெளிப்படுத்தினார்கள்.,5
பல்லவர்_வரலாறு,அவ் வரலாற்று நூற்குப் பிறகு வெளிப்போந்த ஆராய்ச்சி நூல்கள் பல சிறந்த கட்டுரைகள் பல கிடைத்தகல்வெட்டுச்செய்திகள் பல.,13
பல்லவர்_வரலாறு,"மேலும், அவ்வரலாற்று நூல் இன்று கிடைக்கு மாறில்லை.",6
பல்லவர்_வரலாறு,வித்துவான் தேர்விற்கு அது பாடமாக வைக்கப் பட்டுள்ளது.,6
பல்லவர்_வரலாறு,நூலின்றி மாணவர் இடர்ப்படுகின்றனர்.,3
பல்லவர்_வரலாறு,இக் குறைகள் அனைத்தையும் உளங்கொண்டு இந்நூல் எழுதப் பெற்றதாகும்.,7
பல்லவர்_வரலாறு,இந்நூலின்கண் புதிய வரலாற்று முடிபுகள் பல குறிக்கப் பெற்றுள.,7
பல்லவர்_வரலாறு,அவை ஆராய்ச்சியாளர் நடுவுநிலைமை வழாத ஆராய்ச்சிக்கு உரியவாகும்.,6
பல்லவர்_வரலாறு,"என்னைப் பாகூருக்கு அழைத்துச் சென்றவரும், பாகூரைப்பற்றி விளக்கமான படம் வரைந்து உதவியவருமாகிய திருவாளர் புதுவை ரா.",12
பல்லவர்_வரலாறு,அப் பெருமக்கள் உழைப்பின் பயனே இந்நூல் வெளிவரச் செய்தது என்றால் மிகையாகாது.,9
பல்லவர்_வரலாறு,சேக்கிழார் அகம் சென்னை மா.இராசமாணிக்கம் ﻿பொருளடக்கம்,6
பல்லவர்_வரலாறு,முப்பத்தாறு நாற்பத்திரண்டு களப்பிரர் களப்பிரர் பல்லவர்போர்கள் சோணாட்டில் களப்பிரர் பாண்டி நாட்டில் களப்பிரர்.,10
பல்லவர்_வரலாறு,முதற்காலப் பல்லவர் கி.பி.,4
பல்லவர்_வரலாறு,இடைக்காலப் பல்லவர் கி.பி.,4
பல்லவர்_வரலாறு,பிற்காலப் பல்லவர் கி.பி.,4
பல்லவர்_வரலாறு,சிம்ம விஷ்ணு கி.பி.,4
பல்லவர்_வரலாறு,மகேந்திரவர்மன் கி.பி.,3
பல்லவர்_வரலாறு,நூல் எழுதப்பெற்ற காலம் சிறந்த குணங்கள்.,5
பல்லவர்_வரலாறு,நரசிம்மவர்மன் கி.பி.,3
பல்லவர்_வரலாறு,பரமேசுவரமன் கி.பி.,3
பல்லவர்_வரலாறு,இராசசிம்மன் கி.பி.,3
பல்லவர்_வரலாறு,இவன் காலத்து அரசர் இரண்டாம் பரமேசுவரவர்மன்.,5
பல்லவர்_வரலாறு,இரண்டாம் நந்திவர்மன் கி.பி.,4
பல்லவர்_வரலாறு,போர் நடந்த காலம் போர் நடந்ததா?,5
பல்லவர்_வரலாறு,நந்திவர்மன் கி.பி.,3
பல்லவர்_வரலாறு,மூன்றாம் நந்திவர்மன் கி.பி.,4
பல்லவர்_வரலாறு,பல்லவர் இரட்டர் போர் பல்லவர் பாண்டியர் போர் பல்லவர் தமிழரசர் இப்போருக்குக் காரணம் என்ன?,11
பல்லவர்_வரலாறு,பல்லவன் காவிரிநாடன் பேரரசன் நல்லியல்புகள் மனைவியர் அரசியல் திருப்பணிகள் சிவனடியான் இவன் காலத்து அரசர்.,11
பல்லவர்_வரலாறு,பிற்பட்ட பல்லவர் கி.பி.,4
பல்லவர்_வரலாறு,கலைக் கழகங்கள் இருநூற்று நாற்பத்தாறு இருநூற்று அறுபத்திரண்டு முன்னுரை ஓவியசிற்பக்கலைக்கூடங்கள் காஞ்சிக்கல்லூரிஎத்தகைய கல்வி?,10
பல்லவர்_வரலாறு,சமயநிலை இருநூற்று அறுபத்திரண்டு இருநூற்று எழுபத்து மூன்று சமண வீழ்ச்சிக்குக் காரணம் உடனே இம் மாறுபாடு எப்படி உண்டானது?,14
பல்லவர்_வரலாறு,சைவசமயம் பாசுபதர் காபாலிகர் காளாமுகர் வைணவம் வைணவ வேந்தர் சமயக் கொடுமை சமணர் சைவர் கொடுமை இவை நடந்தனவா?,14
பல்லவர்_வரலாறு,வைணவர் கொடுமை பட்டயச் சான்று சிற்பச் சான்று உயிர்ப்பலி இடுதல் முன்னுரை சிற்பங்கள் சான்றுகள்.,11
பல்லவர்_வரலாறு,உள்ளறை மேற்கூரை இவற்றை எழுதிய முறை பல்லவர் சிற்பம்.,7
பல்லவர்_வரலாறு,"பல்லவர்க்கு முற்பட்ட தமிழகம் தமிழகம் தமிழகம் பண்டுதொட்டே சேரநாடு, சோழநாடு, பாண்டிய நாடு என்னும் முப்பிரிவுகளாக இருந்துவந்தது.",13
பல்லவர்_வரலாறு,"இம் மூன்று நாடுகளையும் சேரர், சோழர், பாண்டியர் என்னும் மூன்று மரபரசர் நெடுங்காலமாக ஆண்டு வந்தனர்.",12
பல்லவர்_வரலாறு,பாண்டியர் நடத்திய சங்கங்களில் இறுதியாயது கடைச் சங்கம் எனப்பட்டது.,7
பல்லவர்_வரலாறு,அது கி.மு.,3
பல்லவர்_வரலாறு,நான்காம் நூற்றாண்டிலிருந்து கி.பி.,4
பல்லவர்_வரலாறு,இரண்டாம் நூற்றாண்டுவரை நடந்ததாகும் என்பது ஆராய்ச்சியாளர் துணிபு.,6
பல்லவர்_வரலாறு,மூன்றாம் நூற்றாண்டுக்கு முற்பட்டதமிழகம் இன்னவாறு இருந்தது என்பதை ஒருவாறு அறியலாம்.,8
