work_title,sentence,sentence_length
பல்லவர்_வரலாறு,அவற்றுள் மூன்றாம் குலோத்துங்கன்ஆட்சியில் உண்டானது கொடியது ஒரு காசுக்குக் கால்படி அரிசி விற்றது.,10
பல்லவர்_வரலாறு,எய்போற் கிடந்தான் என் ஏறு பு.வெ.மாலை.,7
பல்லவர்_வரலாறு,கலைக் கழகங்கள் முன்னுரை பண்டைக் காலக் கல்விமுறை இக்காலக் கல்விமுறையில் முற்றும் மாறுபட்டதாகும்.,10
பல்லவர்_வரலாறு,"அக்காலக் கல்வி, இக்காலக் கல்வி முறைப்படி தொடக்கக் கல்வி, நடுத்தரக்கல்வி, பல்கலைக் கழகக் கல்வி எனப்பலபிரிவுகளை உடையதன்று.",13
பல்லவர்_வரலாறு,"உலகில் அறம், பொருள், இன்பம் நுகரவும் வீடுபேற்றுக்குரியநெறியிற் பயிலவுமே பண்டைக் காலத்தார் கல்வி கற்றனர்.",11
பல்லவர்_வரலாறு,அவர்கள் உயிர்க்கு உறுதி பயக்கும் கல்வியையே சிறப்பாகக் கொண்டனர்.,7
பல்லவர்_வரலாறு,ஒவிய சிற்பக் கலைக்கூடங்கள் பல்லவரை உலகம் புகழ வைத்த பெருமை ஒவிய சிற்பப் புலவர்கட்கே உரித்தானது.,12
பல்லவர்_வரலாறு,ஓவியம் வரைதலும் சிற்பம் பொறித்தலும் எளிய செயல்கள் அல்ல.,7
பல்லவர்_வரலாறு,இவ்வேலைத்திறனை இன்றளவும் நாம் உணருமாறு செய்த அப்பெருமக்கள் கலை அறிவு வியக்கத்தக்கதன்றோ?,9
பல்லவர்_வரலாறு,"ஆகவே, அவர்கள் அரசாங்கத்தாலும் பொதுமக்களாலும் உயர்வாக மதிக்கப் பெற்று வந்தவராவர்.",8
பல்லவர்_வரலாறு,காஞ்சிக் கல்லுரரி கதம்ப அரசர் மரபைத் தோற்றுவித்த மயூரசன்மன் முதற்பல்லவர் காலத்தில் காஞ்சியில் இருந்தவடமொழிக்கல்லூரியில் படிக்க வந்தான்.,13
பல்லவர்_வரலாறு,அக்கல்லூரியில் எவ்வகைக் கல்வி அளிக்கப்பட்டது?,4
பல்லவர்_வரலாறு,மயூரசன்மன் வேதங்களை நன்றாகப் படித்தவன்.,4
பல்லவர்_வரலாறு,அக்கல்லூரியில் நூற்றுக்கணக்கான மாணவர் வடமொழிச் சாத்திரங்களைக் கற்றனர்.,6
பல்லவர்_வரலாறு,அவற்றைப் போதிக்க வடமொழிப் புலவர் பலர் இருந்தனர்.,6
பல்லவர்_வரலாறு,"மயூரசன்மன் பல்லவ அரசனால் கல்லூரியிலிருந்து விரட்டப்பட்டான் என்பதிலிருந்து, கல்லூரி பல்லவ அரசனது பார்வையின் கீழ் இருந்தது என்பது தெளிவாகும்.",14
பல்லவர்_வரலாறு,பல கலை வல்லார் இங்குக் கூடிப் பேசலும் மரபு.,7
பல்லவர்_வரலாறு,"ஒரு கலையிற் புலமை எய்திய ஒருவர், தாம் கண்டதைக் கூறிப்பிறர் இசைவைப் பெறவும் இக்கடிகை பயன்பெற்றது.",12
பல்லவர்_வரலாறு,இங்குப் பேசுதல் அக்காலத்தில் சிறப்பளித்த ஒன்றாகக் கருதப்பட்டது.,6
பல்லவர்_வரலாறு,"இதனால், இச்சிறப்பைப் பெறப் பல நாட்டார் இங்கு வந்து சென்றனர்.",8
பல்லவர்_வரலாறு,இரண்டு இங்கிருந்துதர்மபாலர் நாலந்தாப் பல்கலைக் கழகப் பேராசிரியராகச் சென்றார்.,7
பல்லவர்_வரலாறு,கடிகாசலம் இரண்டாம் நந்திவர்மன் காலத்தில் சோளிங்கர் மலைமீதுள்ள கடிகைக்கு மானியம் விடப்பட்டதாகத் திருவல்லம் கல்வெட்டுக் குறிக்கிறது.,12
பல்லவர்_வரலாறு,இது நீண்ட காலமாக அங்கு இருந்திருக்கலாம்.,5
பல்லவர்_வரலாறு,இது வைணவர் கலைப் பீடமாக இருந்திருத்தல் கூடியதே.,6
பல்லவர்_வரலாறு,பாகூர் வடமொழிக் கல்லூரி பாகூர் என்பது தென்னார்க்காட்டுக் கோட்டத்தில் திருப்பாதிரிப்புலியூருக்கும் புதுச்சேரிக்கும் இடையில் உள்ள பெரும்பாதையில் அமைந்துள்ள சிற்றுாராகும்.,14
பல்லவர்_வரலாறு,இது பல்லவர் காலத்திற் சிறந்திருந்த பெரும் பதியாகும்.,6
பல்லவர்_வரலாறு,இங்கு ஒரு வடமொழிக் கல்லூரி இருந்தது.,5
பல்லவர்_வரலாறு,"நிருபதுங்கவர்மன் காலத்துப் பட்டயத்தில் உள்ள செய்திகளைக் காண, அக்கல்லூரி அதற்கு முன்னரே உயரிய நிலையில் இருந்துவந்தது.",12
பல்லவர்_வரலாறு,"முன்று சிற்றரர்கள் இக் கல்லூரி செவ்வனே நடைபெற, ஏறத்தாழக் கி.பி.",9
பல்லவர்_வரலாறு,"அச்சிற்றுார்களாவன சேட்டுப்பாக்கம், விளாங்காட்டங் கடுவனுர், இறைபுனைச்சேரி என்பன.",6
பல்லவர்_வரலாறு,"வாகூர்ப் பட்டயப்படி, விளாங்காட்டங் கடுவனுர் என்பது இன்று கடுவனூர் என்ற பெயருடன் இருக்கிறது.",10
பல்லவர்_வரலாறு,அது வாகூர்க்குத் தென்மேற்கில் மூன்று கல் தொலைவில் இருக்கிறது.,7
பல்லவர்_வரலாறு,அதற்குத் தெற்கே சேட்டுப்பாக்கம் இருந்தது என்று பட்டயம் குறிக்கிறது.,7
பல்லவர்_வரலாறு,அப்பெயர் இன்று காணுமாறில்லை.,3
பல்லவர்_வரலாறு,இவ்வூர்களின் பெயர்கள் இன்றுகாணு மாறில்லை.,4
பல்லவர்_வரலாறு,"பட்டயப்படி, இறைபுனைச் சேரிக்குக் கிழக்கே காடு இருந்தது.",6
பல்லவர்_வரலாறு,இதற்கு அடையாளமாக அங்குக் காட்டுப்பாக்கம் என்னும் சிற்றுர் இன்று இருக்கின்றது.,8
பல்லவர்_வரலாறு,பட்டயப்படி வடக்கே கிரிமாம்பட்டி இருந்தது.,4
பல்லவர்_வரலாறு,அதுவே இன்றைய கிரிமாம் பாக்கம் என்பது.,5
பல்லவர்_வரலாறு,இறைபுனைச்சேரி என்னும் பெயர் கொண்ட சிற்றுார் இப்பொழுதில்லை.,6
பல்லவர்_வரலாறு,பட்டயத்தில் உள்ள எல்லைகளை நோக்க இன்றைய பின்னாச்சி குப்பம் என்பதே அக்கால இறைபுனைச் சேரியாக இருந்திருக்கலாம் என்பது உய்த்துணரலாம்.,14
பல்லவர்_வரலாறு,"ஐந்து பாகூர்ப் பழம்பதி ஆறு இன்றுள்ள பாகூர், நெடுவழிக்கு இரண்டு கல் தொலைவில் இருக்கின்றது.",11
பல்லவர்_வரலாறு,நெடுவழிக்கு மறுபுறத்தில் பெருமான் கோவிலும் பார்ப்பனச்சேரி ஒன்றும் பழங்காலத்துக் குளம் ஒன்றும் பிற சிதைவுகளும் இருக்கின்றன.,12
பல்லவர்_வரலாறு,இன்றைய பாகூர் சிற்றுர் ஆகும்.,4
பல்லவர்_வரலாறு,அதன்கண் உள்ள சிவன் கோவில் பழைமையானது.,5
பல்லவர்_வரலாறு,அங்குக் கல்வெட்டுகள் பல இருக்கின்றன.,4
பல்லவர்_வரலாறு,இதனால் பழைய பாகூரும் மிகப்பெரியதாக இருந்திருத்தல் வேண்டும் என்பது தவறாகாது.,8
பல்லவர்_வரலாறு,"அக்கிரகாரங்க நான்கு வேதங்கள், ஆறு அங்கங்கள் முதலிய பல கலைகளில் வல்ல மறையவரைக் கொண்ட சேரியே அக்கிரகாரம் என்பது.",14
பல்லவர்_வரலாறு,இத்தகைய சேரிகள் சில சங்க காலத்திலே இருந்தன என்பது பத்துப்பாட்டால் அறியலாம்.,9
பல்லவர்_வரலாறு,"பொதுவாக இச்சேரிகள் ஊர்கட்கு வெளியே, அமைதி குடி கொண்ட கழனி வெளிகட்கு இடையே, இயற்கைப் பொருள்களின் நடுவே அமைந்திருந்தன.",14
பல்லவர்_வரலாறு,அரசர்கள் இவர்கட்குச் சிற்றுார்களை இறையிலியாக விட்டு எல்லா வசதிகளையும் அளித்தனர்.,8
பல்லவர்_வரலாறு,"இங்ஙனம் சேரி பெரிதாய் விட்டமையின், மறையவரே ஊராண்மையை ச் சட்டப்படி கவனித்து வந்தனர்.",10
பல்லவர்_வரலாறு,இவையே குடி அல்லது சதுர்வேதி மங்கலம் எனப் பெயர் பெற்ற சிற்றுர்கள்.,9
பல்லவர்_வரலாறு,இவை பலவாக இருந்தன என்பது கல்வெட்டுகளாலும் பெரிய புராணத்தாலும் நன்கறியலாம்.,8
பல்லவர்_வரலாறு,சம்பந்தரை வரவேற்ற சதுர்வேதி மங்கலத்தார் பலராவர் சுந்தரர்க்கு வேண்டிய வசதிகள் அளித்த மறையவர் பலராவர்.,11
பல்லவர்_வரலாறு,ஊராண்மை இவர்கள் ஆட்சியில் ஊர் அவைகள் பல இருந்தன.,7
பல்லவர்_வரலாறு,அவை ஊருக்கு வேண்டிய அனைத்தையும் செய்து வந்தன வழக்குகளை விசாரித்துமுடிவு கூறின.,9
பல்லவர்_வரலாறு,இதனைத்தடுத்தாட்கொண்டபுராணத்தும் திருநீலகண்ட நாயனார் புராணத்தும் சண்டீசர் புராணத்தும் காணலாம்.,7
பல்லவர்_வரலாறு,"அவற்றுள் சேந்தன் அளித்த சேய்ஞலூர், திருமணஞ்சேரி, தெளிச்சேரி, திருவெண்ணெய் நல்லூர், திருநாவலூர், திருநின்றவூர் முதலியன குறிப்பிடத்தக்கன.",12
பல்லவர்_வரலாறு,பல்லவ அரசர் அளித்த சிற்றுர்கள் மிகப் பல ஆகும்.,7
பல்லவர்_வரலாறு,"சான்றாக, இரண்டாம் நந்திவர்மன் காலத்தில் கும்பகோணம், நாகப்பட்டினம் ஆகிய இரண்டிற்கும் அருகில் இரண்டு சேரிகளை உண்டாக்கினான்.",12
பல்லவர்_வரலாறு,"அவையே பட்டயத்தாள் மங்கல அக்கிரகாரம், தயாமுகமங்கல அக்கிரகாரம் என்பன.",7
பல்லவர்_வரலாறு,இத்தகைய பயிற்சியாற்றான் பிராமணர் பலர் மேலைச் சாளுக்கியரிடம் மகா சாமந்தராக இருந்தனர் என்பது இங்கு அறியத்தகும்.,12
பல்லவர்_வரலாறு,"பல்லவர் ஆட்சியில் இத்தகையோர் இருந்தமைக்குரிய சான்றுகள் இல்லை ஆயினும், மயூரசன்மனைக் குறிக்கலாம்.",9
பல்லவர்_வரலாறு,"சுருங்கக் கூறின், அரசர் ஆணைப்படி இம் மறையவர், சிற்றுர்களில் இருந்துகொண்டு பலவகைத் தொண்டுகளைச் செய்து வந்தனர் என்னலாம்.",13
பல்லவர்_வரலாறு,"புரோகிதர் கோவில் உரிமை பெற்றதும், தமிழ் மக்களிடம் குருக்கள் வேலை தொடங்கியதும் இந்தக் காலமே ஆகும்.",12
பல்லவர்_வரலாறு,ஏழு பிரம்மபுரிகள் பேரூர்களிலும் நகரங்களிலும் கலை வளர்ச்சிக்காக மறையவர் தங்கியிருந்த இடம் பிரம்மபுரி எனப்பட்டது.,11
பல்லவர்_வரலாறு,"இவர்க்கு பிரம்மதேயம் இல்லை எனினும், கல்வி கற்பிப்பதற்காக நிலம் மானியமாக விடப்பட்டது.",9
பல்லவர்_வரலாறு,இத்தகைய பிரம்மபுரிகள் கங்கர் தலைநகரான தழைக்காட்டில் பல இருந்தன.,7
பல்லவர்_வரலாறு,எட்டு இப் பிரம்மபுரிகள் பல்லவர் காலத்தில் இருந்தன என்பதற்குப் பட்டயச்சான்று இல்லை.,9
பல்லவர்_வரலாறு,"ஆயினும், சீகாழிக்கு உரிய பல பெயர்களுட் பிரம்மபுரம் என்பதொன்றாகும்.",7
பல்லவர்_வரலாறு,அம் முறையை இந்தியா முழுவதிலும் இருந்த பெரும்பாலான அரசர் பின்பற்றி வந்தனர்.,9
பல்லவர்_வரலாறு,இது பிற்காலச் சோழர் காலத்தில் பட்டவிருத்தி எனப்பட்டது.,6
பல்லவர்_வரலாறு,இதனைப் பல்லவ அரசர் செய்து வந்தனர் என்பது பல பட்டயங்களைக் கொண்டு அறியலாம்.,10
பல்லவர்_வரலாறு,அம் மறையவன் காசியபகோத்திரத்தான்.,3
பல்லவர்_வரலாறு,இரண்டு வேதங்களிலும் ஆறு அங்கங்களிலும் வல்லவன் அவனுக்குக் கொடுக்கப்பட்ட சிற்றுார் பதினெட்டு  வகை வரியினின்றும் நீக்கப்பட்டது.,12
பல்லவர்_வரலாறு,காசக்குடிப் பட்டயம் இஃது இரண்டாம் நந்திவர்மனால் விடப்பட்டதாகும்.,6
பல்லவர்_வரலாறு,கொடுகொள்ளி என்ற சிற்றுர் ஏக தீரமங்கலம் என்று பெயரிடப்பட்டுச் சோமயாஜி என்ற மறையவற்குக் கொடுக்கப்பட்டது.,11
பல்லவர்_வரலாறு,பனிரண்டு  இதனால் பல்லவ மன்னர் தனிப்பட்ட கல்விமான்களைத் தாராளமாக ஆதரித்து வந்தனர் என்பது வெள்ளிடைமலை.,11
பல்லவர்_வரலாறு,கோவில்கள் பல்லவர் காலத்தில் கயிலாசநாதர் கோவில் போன்றவை பல்கலைப் பள்ளிகளாகவும் இருந்து வந்தன.,10
பல்லவர்_வரலாறு,"அங்குச் சிற்பம், ஓவியம், இசை, நடனம், நாடகம், சமயக்கல்வி சாத்திரக்கல்வி இன்ன பிறவும் கற்பிக்கப்பட்டு வந்தன.",12
பல்லவர்_வரலாறு,நாகரிக நாட்டார் போற்றும் இக்கலைகள் அனைத்திற்கும் கோவிலே தாயகமாக இருந்தது.,8
பல்லவர்_வரலாறு,பத்திரப் பதிவும் அங்குத்தான் நடைபெற்று வந்தன.,5
பல்லவர்_வரலாறு,"அப்பத்திரங்களிலிருந்தன்றோ, நாம், இன்று பல்லவர் வரலாற்றை அறிந்து இன்புறுகின்றோம் !",7
பல்லவர்_வரலாறு,"பெரிய கோவில்களில் படிக்கும் மண்டபம், நடன மண்டபம், நாடக மண்டபம், தருக்க மண்டபம் முதலியன இருந்தன.",12
பல்லவர்_வரலாறு,மாபாரதம் போன்ற பழைய கதைகளைக்குடி மக்கட்கு ஊட்டி அவர் ஒழுக்கத்தை வளர்க்க முயன்றது கோவிலே ஆகும்.,12
பல்லவர்_வரலாறு,"சமய நூல்கள், தேவாரப் பதிகங்கள் முதலியன பாதுகாக்கப்பட்ட இடங்களும் கோவில்களே ஆகும்.",9
பல்லவர்_வரலாறு,இங்ஙனம் இக் கோவில்கள் இருமைக்கும் இன்பம் ஊட்டும் நிலைக்களங்களாக இருந்தன.,8
பல்லவர்_வரலாறு,மடங்கள் இவை நீண்ட காலமாக நாட்டில் இருந்து வருபவை.,7
பல்லவர்_வரலாறு,"இவை அரசர், சிற்றரசர், செல்வர் முதலியோரால் அமைக்கப் பட்டவை.",7
பல்லவர்_வரலாறு,இவை சமய உயர்தரக் கல்வியை ஊட்டி வந்தன.,6
பல்லவர்_வரலாறு,"சைவ மடங்கள் சைவ மடங்களுள் காபாலிக மடம், பாசுபத மடம், காளாமுக மடம் எனப் பலவகை இருந்தன.",13
பல்லவர்_வரலாறு,காபாலிகர் மடம் காஞ்சி ஏகாம்பரநாதர் கோவிலை அடுத்து இருந்தது என்பதை மந்தவிலாசத்தைக் கொண்டு குறிப்பாக உணரலாம்.,12
பல்லவர்_வரலாறு,"காஞ்சியில் பாசுபதர் இருந்தனர் என்று அதே மத்தவிலாசம் கூறலால், அவர்கட்கும் தனி மடம் இருந்திருத்தல் வேண்டும் என்பது தெரிகிறது.",14
பல்லவர்_வரலாறு,மயிலாப்பூர் கபாலீசர் கோவிலில் அல்லது அதனை அடுத்துக் காபாலிகர் மடம் இருந்திருத்தல் வேண்டும்.,10
பல்லவர்_வரலாறு,கொடும்பாளுர் முதலிய இடங்களிற் காளாமுகர் மடங்கள் இருந்தன.,6
பல்லவர்_வரலாறு,இவற்றுள் பின்னவர் வைத்து நடத்திய மடங்களே சிறப்பெய்தின என்றுகங்கநாட்டு வரலாற்றைக்கொண்டு உணரலாம்.,9
பல்லவர்_வரலாறு,இவற்றிற்குப் பட்டயச் சான்று இல்லை.,4
பல்லவர்_வரலாறு,"அவர் தம் பெயர்கள் ராசி, சக்தி, அபரண என்ற முடிபுகளைப் பெற்றவை.",9
பல்லவர்_வரலாறு,அவருள் மணமானவரும் உண்டு மணமற்றவரும் உண்டு.,5
