work_title,sentence,sentence_length
பாற்கடல்,அம்மாவை எங்கே அழைச்சுண்டு போறா? உஷ்.,5
பாற்கடல்,"குழந்தைகளா, விளையாடப் போங்கோ.",3
பாற்கடல்,அம்மா அப்போ போனவள்தான்.,3
பாற்கடல்,மன்னி இரவு வீட்டில் படுக்கவில்லை.,4
பாற்கடல்,"காலை ஒன்பது மணி வாக்கில் அவசரமாக வந்து, பல் விளக்கு கிறாள் காபி, ஸ்நானம்.",11
பாற்கடல்,"அவசரமாகச் சாப்பிட்டுவிட்டு, இரவுக்குத் தனக்கு எதையோ கட்டி எடுத்துக்கொண்டு போகிறாள்.",8
பாற்கடல்,மறுபடியும் அவளைப் பார்க்க முடிவது மறுநாள் காலைதான்.,6
பாற்கடல்,அண்ணா பள்ளிக்கூடம் போகிறார்.,3
பாற்கடல்,சித்தப்பா ஆபீஸ் போகிறார்.,3
பாற்கடல்,விட்டுக் காரியம் பார்க்கிறாள்.,3
பாற்கடல்,முடிந்தபோது முன்கட்டு மாமியுடன் கிசுகிசு.,4
பாற்கடல்,நான் அந்தப் பக்கம் வந்தால் பேச்சே அடங்கிவிடுகிறது.,6
பாற்கடல்,சிவாவும் பானுவும் விளையாடிக் கொண்டிருக்கிறார்கள்.,4
பாற்கடல்,நான்தான் இருப்புக் கொள்ளாமல் வீட்டுள் சுற்றிச் சுற்றி வருகிறேன்.,7
பாற்கடல்,காடுன்னா இப்படித்தான் இருக்குமா?,3
பாற்கடல்,அம்மா இங்கேயே எங்கேனும் ஒர் அறையில் ஒளிஞ்சுண்டு கண்ணாமூச்சி காட்றாளா?,8
பாற்கடல்,"அண்ணா, அம்மா எப்போ வருவா? எல்லாம் வருவாள்.",6
பாற்கடல்,போடா என்னைத் தொந்தரவு பண்ணாதே.,4
பாற்கடல்,"இதென்ன தாத்தா அதான் அப்பா இல்லை, அதான் தாத்தா, முன்னே பின்னே தெரியாமே, திடீரென்று ஊரிலேருந்து வரா?",13
பாற்கடல்,"அந்த ஆறடியும், கற்பூரக் கொழுந்து போன்ற அந்தச் சிவப்பும், நிமிர்ந்த முதுகையும் அன்றுதான் முதலாகப் பார்க்கிறேன் போலும்.",13
பாற்கடல்,ஏதோ தைரியம் என் உள் புகுவதை உணர முடிகிறது.,7
பாற்கடல்,அன்று மாலை ஆஸ்பத்திரியிலிருந்து அவர் வீடு திரும்பியதும் அவருடைய நோட்டுப் புத்தகத்தில் மணிமணியாக எழுதிக் கொண்டிருக்கிறார்.,12
பாற்கடல்,மனசில் ஆயிரம் சந்தேகங்களுடன் அவரை அணுகுகிறேன்.,5
பாற்கடல்,லேசாகப் புன்முறுவல் பூக்கிறார்.,3
பாற்கடல்,என் தலைமேல் கையை வைக்கிறார்.,4
பாற்கடல்,எனக்குத் திடீரென்று அழுகை வருகிறது.,4
பாற்கடல்,கூடவே சிரிப்பும் வருகிறது.,3
பாற்கடல்,அத்தியாயம் பதினாறு  மன்னி புறப்பட்டுக் கொண்டிருக்கிறாள்.,5
பாற்கடல்,"மன்னி, அம்மா எப்ப வருவா?",4
பாற்கடல்,நீங்கள் எங்கே போறேள்? பாட்டி முகம் சுளிக்கிறாள்.,6
பாற்கடல்,இது என்னடி அபசகுனம் மாதிரி !,4
பாற்கடல்,"போடா உள்ளே ! சித்தப்பா, அம்மா எப்போ வருவா? அம்மா எப்ப வரணும்னு பெரிய வாளுக்குத் தெரியும்.",12
பாற்கடல்,நீ அம்மியாத்துக்கு விளையாடப் போ சித்தப்பாவே அம்மியாத்துக்குப் போகப் பர்மிஷன் குடுக்கறான்னா பயமாயிருக்கு.,10
பாற்கடல்,"அம்மி, அம்மா எப்போ வருவா? அம்மி என் தோள்மேல் கையை வைத்து நாற்காலி யிலிருந்து எழுந்திருக்கிறாள்.",12
பாற்கடல்,மலை எழுந்திருக்கிற மாதிரி.,3
பாற்கடல்,என்னை உள்ளே அழைத்துச் செல்கிறாள் படுக்கை அறையில் சுவரில் ஆள் உயரத்துக்கு ஒரு பெரிய படம்.,12
பாற்கடல்,"அழகான முகம் தாடி, தலையைச் சுற்றி ஒரு முள் மகுடம்.",8
பாற்கடல்,ஆள் சிலுவையிலிருந்து தொங்குகிறான்.,3
பாற்கடல்,இடுப்பைச் சுற்றி அந்த இடத்தை மட்டும் மூடிக்கொண்டு கொஞ்சம் துணி.,8
பாற்கடல்,"இரண்டு புது மெழுகுவர்த்திகளைக் கொண்டு வந்து, அம்மி படத்துக்கு எதிரே வைத்து ஏற்றி மண்டியிடுகிறாள்.",11
பாற்கடல்,என்னையும் மண்டியிட ஜாடை காட்டு கிறாள்.,5
பாற்கடல்,ஆனால் நான் மாட்டேன்.,3
பாற்கடல்,அவளைப் பார்த்துக் கொண்டு நிற்கிறேன்.,4
பாற்கடல்,அவள் கண்ணை மூடிக்கொண்டு தலை குனிகிறாள்.,5
பாற்கடல்,அம்மி என்ன செய்கிறாள்?,3
பாற்கடல்,சற்று நேரம் கழித்து அம்மி கண்ணைத் திறக்கிறாள்.,6
பாற்கடல்,"ஆனால், எனக்கு இப்போ வேண்டியில்லை.",4
பாற்கடல்,நான் தொடக்கூட இல்லை.,3
பாற்கடல்,ஒருநாள் திடீர்னு வீடு பளிச்சிடுகிறது.,4
பாற்கடல்,வாசலில் ஜட்கா நிக்கிறது.,3
பாற்கடல்,வாசலில் சின்னவா பெரியவா எல்லாருமே கூடி இருக்கிறோம்.,6
பாற்கடல்,ஆனால் மன்னி மேல் ஒருமட்டா தாங்கிக்கொண்டு ஜட் காவிலிருந்து இறங்குவது அம்மாவா?,9
பாற்கடல்,அம்மா மாதிரி யாரோவா?,3
பாற்கடல்,"குழி விழுந்து கன்னம் ஒட்டிப்போய், தேஞ்சு மாஞ்சு அம்மாப்பொண்ணே, வந்தையா?",8
பாற்கடல்,"தாத்தா, நான்தான் அன்னிக்கே சொன்னேனே.",4
பாற்கடல்,அவள் என்ன சத்தியம் மறந்தவளா? பாடுகிறார்.,5
பாற்கடல்,வெண்கலப் பானை மேல் கரண்டியை அடித்தாற் போல் கும் கொடுத்து அந்தக் கணிர் அலை பாய்ந்தது.,12
பாற்கடல்,அம்மா போய்க் கட்டிலில் சாய்கிறாள்.,4
பாற்கடல்,அவள் அருகில் கட்டிலில் சுண்டு விரலுக்குக் கையும் காலும் முளைத்தாற்போல் ஏதோ ஒண்ணு நெளியறது.,11
பாற்கடல்,அம்பிப் பாப்பாடா ! வியப்புடன் பார்க்கிறேன்.,4
பாற்கடல்,இது என் தம்பியாமே !,3
பாற்கடல்,பாதி இரவில் திடுக்கென முழிச்சுக்கறேன்.,4
பாற்கடல்,"இல்லை, எனக்குத் தூக்கமே வரல்லியோ என்னவோ?",5
பாற்கடல்,"ஒசைப்படாமல் எழுந்து அடிமேல் அடி வெச்சு கும்மிருட்டு, பயமாத்தானிருக்கு ஆனாலும் முன் கட்டுக்குப் போறேன்.",11
பாற்கடல்,கதவை மெதுவா திறக்கிறேன்.,3
பாற்கடல்,விடிவிளக்கில் கட்டில்மேல் அம்மா தெரியறா.,4
பாற்கடல்,நான் உள்ளே வரக் காலை எடுத்து வைக்க முன்னிடுவதைக் கண்டதும் மறுக்கும் பாவனையில் தலையை பலமாக ஆட்டுகிறாள்.,13
பாற்கடல்,"அம்மா, உன்னை நான் தொடணுமே ! புன்னகை புரிகிறாள்.",6
பாற்கடல்,உன்னைத் தொடத்தான் தொடுவேன் ! என் முனகல் உயர்கிறது.,6
பாற்கடல்,தரைமேல் காலைப் பிடிவாதத்தில் உதைக்கிறேன்.,4
பாற்கடல்,உதட்டின்மேல் கையை வைத்துத் தரையில் சுருண்டு படுத்திருக்கும் உருவத்தைக் காட்டுகிறாள்.,8
பாற்கடல்,மன்னிப் பாட்டி குறட்டை விடுகிறாள்.,4
பாற்கடல்,"பாவம் சரியான அசதி, ஒரே ஒருவாட்டி !",5
பாற்கடல்,அம்மாவின் கண்களில் தயக்கம் தலைகாட்டுகிறது.,4
பாற்கடல்,அடுத்த நிமிஷமே திடம் திரும்பிக் கூடாது என்று தலையை பலமாக ஆட்டுகிறாள்.,9
பாற்கடல்,தாங்க முடியாத அசதி என்மேல் படருகிறது.,5
பாற்கடல்,திரும்பி என் இடத்துக்கு வந்து கவிழ்கிறேன்.,5
பாற்கடல்,"அம்மா, நீ செத்துப் போ.",4
பாற்கடல்,"தாத்தா அதான் அப்பா அதான் தாத்தா சரி அப்பா, சாப்பிட்டுக் கொண்டிருக்கிறார்.",9
பாற்கடல்,கொத்த மல்லித் துவையல் அடுத்து புடலங்காய் பொரித்த குழம்பு.,7
பாற்கடல்,தாத்தாவுக்கு ரொம்பப் புடிக்கும்.,3
பாற்கடல்,எங்களுக்குச் சாப்பாடு ஆயிடுத்து.,3
பாற்கடல்,ஏன் என் தட்டில் என் சாதம் இவ்வளவு நன்னா இல்லை?,8
பாற்கடல்,பக்கத்தில் உட்கார்ந்து கொண்டு அவர் வாய்க்கும் கைக்கும் பார்த்துக் கொண்டிருக்கிறேன்.,8
பாற்கடல்,தாத்தா சப்பளம் மாற்றி ஒரு காலை மண்டியிட்டுக் கொள்கிறார்.,7
பாற்கடல்,ஒரு கையைத் தரையில் ஊன்றிக் கொள்கிறார்.,5
பாற்கடல்,துவையலுக்குப் பின் பொரித்த குழம்பு சாதம்.,5
பாற்கடல்,எங்களுக்குத் தொட்டுக்க மட்டும் பொரிச்ச குழம்பு.,5
பாற்கடல்,அப்பறம் நேரே மோருஞ் சாதம்.,4
பாற்கடல்,தாத்தாவுக்கு மட்டும் இத்தனை சாதமோ?,4
பாற்கடல்,ரசஞ்சாதம் முடித்தபின் தாத்தா இலையை ஸ்பெஷலாக வழிக்கிறார்.,6
பாற்கடல்,சித்தி ஒரு ஒரத்தில் சர்க்கரை வைக்கிறாள்.,5
பாற்கடல்,தாத்தா தளரப் பிசைந்த அன்னத்தைத் தூக்கித் தூக்கி வாய்க்குள் எறிந்துகொள்கிறார்.,8
பாற்கடல்,பூனைபோல் ஏதோ முனகல்கள் அவரிடமிருந்து வெளிப்படுகின்றன.,5
பாற்கடல்,எனக்குத் தாங்க முடிய வில்லை.,4
பாற்கடல்,என் வாயிலிருந்து சொள்ளு தரையில் சொட்டுகிறது.,5
பாற்கடல்,அவருக்கு முகம் சுளிக்கிறது.,3
பாற்கடல்,இதுகளைத் துரங்கப் பண்ணப்படாதா எனக்குப் படைக்கு முன்? எல்லாரும் தூங்கியாச்சு.,8
பாற்கடல்,"கிட்ட வந்து தொலை ! இரண்டு கவளங்கள் அள்ளி, குருவிபோல் திறந்த என் வாயுள் எறிகிறார்.",11
பாற்கடல்,"அப்பா, என்ன ருசி !",3
பாற்கடல்,அந்தப் பிரசாதம்தான் என்னிடம் ஏதோ ஒர் அளவுக்கு இப்பவும் பேசுகிறதோ?,8
பாற்கடல்,அம்மாவுக்குச் சாதம் போடும்போதெல்லாம் மன்னி கதவை மூடிக்கொள்கிறாள்.,6
பாற்கடல்,அப்படியும் அவாளுக்குத் தெரியாமல் நான் தலையை உள்ளே நீட்டுகிறேன்.,7
பாற்கடல்,"அம்மாவின் கை வழிய முழு நெய், அம்மாவுக்கு மட்டும் தனிச் சமையல் கெட்டித் தயிர்.",11
பாற்கடல்,பாட்டி என்னைப் பார்த்துவிட்டாள்.,3
பாற்கடல்,எழுந்து ஓடி வருகிறாள்.,3
பாற்கடல்,மத்ததெல்லாம் இவன் மாதிரி இருக்கா பாரு.,5
பாற்கடல்,சாறை மட்டும் முழுங்கு.,3
பாற்கடல்,சக்கை ஜீரணமாகாது. அம்மா முகத்தின் சுண்ணாம்பு வெளுப்பில் உதடுகள் மட்டும் வெகு சீக்கிரம் ரத்தச் சிவப்புக் கொள்கின்றன.,13
பாற்கடல்,"நாளடைவில் அந்தச் சிவப்பு அம்மாவின் கன்னங் களுக்கு, நெற்றிக்கு ரோஸா பரவறது.",9
பாற்கடல்,பிள்ளை பெற்றாள் லேகியம் பண்ணின சூட்டில் எங்களுக்கும் ஆளுக்கு ஒரு சுண்டைக்காய் கிடைத்தது.,10
பாற்கடல்,"ஒரே காரம், கொஞ்சம் கசப்பு.",4
பாற்கடல்,ஆனால் தாண்டி ஒரு தித்திப்பு.,4
பாற்கடல்,நெய் எல்லாம் சேர்ந்து என்னவோ ரொம்ப ஜோர்.,6
பாற்கடல்,"அது என்ன ராத்திரி கண் மூடறவரையில் வாய் மூடாப் பட்டினியோ, சதா எதையேனும் அரைச் சிண்டு !",12
பாற்கடல்,எங்கேடிம்மா வெச்சுக் காப் பாத்தறது?,4
பாற்கடல்,வயத்துலதான் வெச்சுக் காப்பாத்தனும் ! அவன் வயத்துலதானே வெச்சுக்கறான் ! அம்மாவுக்கு ரோசமாயிருக்கு.,8
பாற்கடல்,பல்லைக் கடிக் கிறாள்.,3
பாற்கடல்,"நேற்றுத்தான் மறுபடியும் மன்னி புதுசா பண்ணி, பாட்டில் நெறைய அடைச்சு வெச்சிருக்கு.",9
பாற்கடல்,சுற்றுமுற்றும் பார்த்துவிட்டுத் திறந்து வழித்துப் போட்டுக் கொள்கிறேன்.,6
பாற்கடல்,காரம் காதில் சுரீல் என்கிறது.,4
பாற்கடல்,ஆனால் நாக்கடியில் கூடவே தேனும் வெல்லமும் தித்திக்கிறதே !,6
பாற்கடல்,இரண்டாம் வேளை குழந்தைகளுக்குச் சாப்பாட்டு நேரம் வந்துவிட்டது.,6
பாற்கடல்,"வட்டமா எங்களை உட்கார வைத்து மன்னி, கல்சட்டியில் பழையதைப் பிசைந்து கையில் போடுகிறாள்.",10
பாற்கடல்,என்னடா தூங்கித் தூங்கி வழியறே?,4
பாற்கடல்,"ஆமாம், அதென்ன அப்படியொரு தூக்கம் வரது !",5
பாற்கடல்,கை அலம்பினதாகக்கூட ஞாபகம் இல்லை.,4
பாற்கடல்,முன் அறையில் அடுக்கி வெச்சிருக்கும் பாய் தலைகாணிமேல் விழுகிறேன்.,7
பாற்கடல்,அதற்கு முன்னால் சாப்பிட்ட வாய்க்கு ஒரு பெரிய பாச்சாக் கோலிக் குண்டளவு.,9
பாற்கடல்,ஆனால் எனக்குத் தூக்கமாக வரவில்லை.,4
பாற்கடல்,என்னவோ என் அடியில் தரை வளைஞ்சு நகர்றமாதிரி இருக்கு.,7
பாற்கடல்,சுவர் சுத்திச் சுத்தி மிதக்கிறது.,4
பாற்கடல்,அம்மா பதைபதைத்துப் பின்கட்டிலிருந்து ஒடி வருகிறாள்.,5
பாற்கடல்,எங்கோ சுட்டிக் காண்பிக்கிறேன்.,3
பாற்கடல்,"அங்கே பாத்தியா, சாமி வரார் எருமை மாட்டு மேலே மன்னி இங்கே வாங்களேன் !",10
பாற்கடல்,குழந்தையைப் பாருங்களேன் ! மன்னி என்னைத் தன் மடியில் கிடத்திக்கொள் கிறாள்.,8
பாற்கடல்,என்னடி இவன் வாயோரம் கறுப்பாயிருக்கு?,4
பாற்கடல்,அம்மாவுக்குப் பளிச்சின்னு விஷயம் உதயமாகிறது.,4
பாற்கடல்,எழுந்து ஒடிப்போய் மருந்து பாட்டிலைக் கொண்டு வருகிறாள்.,6
பாற்கடல்,அம்மாவின் விழிகள் வட்டம் சுழல்கின்றன.,4
பாற்கடல்,"மன்னி முகத்துக்கெதிர், பாட்டிலைத் துரக்கிப் பிடிக்கிறாள்.",5
பாற்கடல்,என்னடி அம்மாப்பெண்ணே? பாட்டில் பாதிக்கு மேல் காலி.,6
பாற்கடல்,மருந்தில் கஞ்சா சேர்ந்திருக்குடி விஸ்வனாதன் செட்டி எழுதின ப்ரகாரம் ! பெருந்திருவே கருப்பண்ணா !,9
பாற்கடல்,எனக்கு எல்லாம் அக்கரையில் தெரியறாப்போல இருக்கு.,5
பாற்கடல்,"அண்ணாவுக்குச் சொல்லி அனுப்பி, வருகிறார்.",4
பாற்கடல்,தலையில் டர்பன் கழுத்துவரை க்ளோஸ் கோட் ஒரு கையில் பஞ்சகச்சத்தின் கொடுக்கைப் பிடித்துக் கொண்டு நிற்கிறார்.,12
பாற்கடல்,அண்ணாவுக்குக் கொஞ்சம் ஜவஹர்லால் நேரு ஜாடை உண்டு.,6
பாற்கடல்,கன்னத்துள் நாக்கைத் துழாவிக்கொண்டு.,3
பாற்கடல்,அண்ணாவுக்கு எப்பவுமே ஒரு நமுட்டு விஷமச் சிரிப்பு உண்டு.,7
பாற்கடல்,மன்னி என்னைத் தூக்கிக்கொள்கிறாள்.,3
பாற்கடல்,நெற்றியில் விபூதி இடுகிறாள்.,3
பாற்கடல்,அடுத்த தெருவில் ராயப்பேட்டை ஆஸ்பத்திரி மதில் ஒடுகிறது.,6
பாற்கடல்,பெருந்திரு கருப்பண்ணன் துணை.,3
பாற்கடல்,நான் தின்ற மருந்து கோழையுடன் சடைசடையாக வெளியே பேஸனில் வந்து விழறது.,9
பாற்கடல்,ரெண்டு மூணு தடவை அப்படிப் பண்ணி எனக்கு வயிறு புண்ணா வலிக்கிறது.,9
