work_title,sentence,sentence_length
பல்லவர்_வரலாறு,இச் சிற்பம் இராசசிம்மன் குடும்பத்தைக் குறிப்பதா என்பது விளங்கவில்லை.,7
பல்லவர்_வரலாறு,இதனை அடுத்துப் பதினாறு கைகளையுடைய காளி சிங்கத்தின்மீதுள்ள கோலம் அழகாகச் செய்யப்பட்டுள்ளது.,9
பல்லவர்_வரலாறு,இரண்டு கோவில்கட்கு இடையில் சுவரில் அம்மனைக்குறிக்கும் பல திறப்பட்ட சிற்பங்களே பலவாகக் காண்கின்றன.,10
பல்லவர்_வரலாறு,சில அம்மை அப்பரைக் குறிப்பன.,4
பல்லவர்_வரலாறு,அம்மன் இடக்கையில் கிளியேந்தி அமர்ந்துள்ள நிலை கீழே இரண்டு யானைகளின் தோற்றம் தோழிப்பெண் தோற்றம் இவைகண்ணைக் கவர்வனவாக உள்ளன.,14
பல்லவர்_வரலாறு,"அம்மை அப்பர் திருமணம், பிரமன் நாமகள் திருமணம், திருமால் திருமகள் திருமணம் இவை தெளிவாக விளக்கப்பட்டுள்ளன.",12
பல்லவர்_வரலாறு,பராசக்தியின் எழுவகை உருவங்கள் ஓரிடத்தில் காட்டப்பட்டுள்ளன.,5
பல்லவர்_வரலாறு,இவ்விடத்திற்கு எதிர்புறச் சுவரில் உருத்திரர் பதினொருவர் உருவங்கள் இருக்கின்றன.,7
பல்லவர்_வரலாறு,அம்மை யாழ் வாசிப்பது சில சிற்பங்களில் காட்டப்பட்டுள்ளது.,6
பல்லவர்_வரலாறு,சிவனார் சடை முடி மிகத் தெளிவாகப் பல சிற்பங்களில் விளக்கப்பட்டுள்ளது.,8
பல்லவர்_வரலாறு,இச்சிற்பங்கள் எல்லாவற்றிலும் பின் வருபவை பலவாகக் காணப்படுகின்றன.,6
பல்லவர்_வரலாறு,"அவை யாழ் வாசித்தல், கையை முடிக்குமேல் உயர்த்திவைத்துச் சிவனார் நடித்தல் பிள்ளையார், கற்றைவார் சடை என்பன.",12
பல்லவர்_வரலாறு,எல்லாச் சுவர்களிலும் சிங்கத்தூண்கள் இருக்கின்றன.,4
பல்லவர்_வரலாறு,சிங்கங்கள் மீது வீரர்கள் அமர்ந்துள்ளனர்.,4
பல்லவர்_வரலாறு,கோவிலின் புறச்சுவர்ப் பக்கத்தும் இக் காட்சியைக் காணலாம்.,6
பல்லவர்_வரலாறு,சிங்கங்கள் பின் கால்கள் மீது நிற்பன.,5
பல்லவர்_வரலாறு,"சிறப் அழகில் ஈடுபட்டகண்கள், இக்காட்சி இன்பத்தை நன்கு நுகரலாம்.",7
பல்லவர்_வரலாறு,"ஆனால், அளவிற் பெரியது.",3
பல்லவர்_வரலாறு,இதன் வளர்ச்சியே இராசராச சோழன் தஞ்சையிற் கட்டிய பெரிய கோவில் கும்பம்.,9
பல்லவர்_வரலாறு,இந்தக்கும்பத்தில் சிங்கத்தலைகளே காணப்படுகின்றன.,3
பல்லவர்_வரலாறு,கல்வெட்டுகள் கைலாசநாதர் கோவில் நிறையக் கல்வெட்டுகள் இருகின்றன.,6
பல்லவர்_வரலாறு,"பல்லவரைவென்று தொண்டைநாட்டைஆண்டமுதற் பராந்தகன், இராசராசன்.",4
பல்லவர்_வரலாறு,"இராசேந்திரன், முதற் குலோத்துங்கன் இவர் தம் கல்வெட்டுகள் பலவாகக் காண்கின்றன.",8
பல்லவர்_வரலாறு,"இவ்வுண்மையைச் சாளுக்கியருடைய வக்கலேரி, கேந்தூர்ப் பட்டயங்களும் பகர்கின்றன.",6
பல்லவர்_வரலாறு,இருபத்தெட்டு சிறப்பு கயிலாசநாதர் கோயில் திருக்கயிலையின் அளவைக் கொண்டே கட்டப்பட்டதாகும் என்று விபுலானந்த அடிகள் போன்றார் கூறுகின்றனர்.,13
பல்லவர்_வரலாறு,கயிலாசநாதர் கோவில் கல்வெட்டு இதற்கு மறைமுகமாகச் சான்று பகர்கின்றது.,7
பல்லவர்_வரலாறு,இராசசிம்மன் தன்னை வாத்ய வித்யாதரன் என்பதற்கேற்ப இக் கோவிலில் யாழ் வாசிக்கும் உருவங்கள் பல செதுக்கப்பட்டுள்ளன.,12
பல்லவர்_வரலாறு,இக் கோவில் ஏறத்தாழ வைகுந்தப் பெருமாள் கோவிலுக்கு நேர் எதிரே அமைந்திருத்தல் வியத்தற்குரியது.,10
பல்லவர்_வரலாறு,இங்குள்ள கணக்கற்ற சிற்பங்கள் சுவர்களில் இருத்தல் போலவே அக் கோவிற் சுவர்களிலும் இருத்தல் இங்கு நினைக்கத்தகும்.,12
பல்லவர்_வரலாறு,சுருங்கக் கூறின் கயிலாசநாதர் கோவில் பல்லவரது சிற்பக்கலையை உலகத்திற்கு அறிவிக்க எழுந்த சிற்பக்கலைக்கூடம் என்னலாம்.,11
பல்லவர்_வரலாறு,வடமொழிப் புலவன் இராசசிம்மன் பேரவையில் தண்டி என்னும் வடமொழிப் புலவர் இருந்தமை முன்னரே கூறப்பட்டதன்றோ?,11
பல்லவர்_வரலாறு,இருபத்தொன்பது இவற்றறோடு அவர் செய்த அவந்தி சுந்தரி கதா என்னும் நூலில் பல்லவன் காலத்து வறுமையை விளக்கியுள்ளார்.,13
பல்லவர்_வரலாறு,"அத்துடன், இவன் நாகரிகக் கலைகளான இசை நடனம், ஓவியம், சிற்பம் இவற்றிலும் வல்லவனாக இருந்தான் என்பதும் நன்கு புலனாகிறது.",14
பல்லவர்_வரலாறு,நாடக அறிஞன் வடமொழியில் பாஷர் என்பவர் பல நாடகங்களை விரிவாக வரைந்துள்ளார்.,9
பல்லவர்_வரலாறு,பிறகு அவை நடிப்பதற்கேற்ற முறையிற் சுருக்கி வரையப்பட்டன.,6
பல்லவர்_வரலாறு,"அவற்றின் இறுதியில், பல்லவன் அவையில் நடித்துகாட்ட இங்ஙனம் தாயாரிக்கப் பெற்றவை என்பது கண்டுள்ளது.",10
பல்லவர்_வரலாறு,இரண்டாம் பரமேசுவரவர்மன் கி.பி.,4
பல்லவர்_வரலாறு,"இவனது மூன்றாம் ஆண்டுக் கல்வெட்டு ஒன்று, வீரட்டானேச்சுரர் கோவிலில் காணப்படுகிறது.",8
பல்லவர்_வரலாறு,"அதற்குப் பிற்பட்ட கல்வெட்டு ஒன்றும் கிடைக்காமையால், இவன் சிறிது காலமே அரசாண்டான் என்று கொள்ளவேண்டும்.",11
பல்லவர்_வரலாறு,"வேலூர் பாளையப் பட்டயம், இவன் கலியை வென்றவன் மது கூறிய விதிகளின்படி நாட்டை ஆண்டவன் என்று கூறுகிறது.",13
பல்லவர்_வரலாறு,முப்பத்தொன்று இவன் காஞ்சியில் உள்ள பரமேச்சுர விண்ணகரம் எனப்படும் வைகுந்தப் பெருமாள் கோவிலைக் கட்டியவன் என்று அறிஞர் அறைகின்றனர்.,14
பல்லவர்_வரலாறு,முப்பத்திரண்டு திருவதிகையில் உள்ள சிவன் கோவிலையும் கற்களால் அமைத்தவன் இவனே என்றும் கருதுகின்றனர்.,10
பல்லவர்_வரலாறு,இதுகாறும் கூறியவற்றை ஆராய்ச்சி அறிஞர் நன்கு ஆராய்ந்து முடிவு காண்பாராக.,8
பல்லவர்_வரலாறு,இதன் சரியான பெயர் திருஎவ்வுள்.,4
பல்லவர்_வரலாறு,இந்த நுட்பமான செய்தி கி.பி.,5
பல்லவர்_வரலாறு,பனிரண்டு  ஆம் நூற்றாண்டினரான சேக்கிழார் பெருமானுக்கு எங்கனம் தெரிந்தது?,7
பல்லவர்_வரலாறு,அவர் கயிலாசநாதர் கோவில் கல்வெட்டைப் படித்தே இந் நுட்பமான செய்தியை எழுதியிருத்தல் வேண்டும் என்னல் மிகையாகாது.,12
பல்லவர்_வரலாறு,அவர் அரசரிடம் உயர் அலுவலாளராக இருந்தவர் ஆதலின் கல்வெட்டில் நிரம்பிய புலமையுடைராய் இருந்திருத்தல் வேண்டும்.,11
பல்லவர்_வரலாறு,"இங்ஙனமே அவர், கல்வெட்டுகளிற் காணப்படும் பல குறிப்புகளைத் தம் நூலுட் பல இடங்களிற் குறித்துச் சொல்லலைக் காணலாம்.",13
பல்லவர்_வரலாறு,எழுபது தவறாக எழுதிவிட்டனர்.,3
பல்லவர்_வரலாறு,"இவை பற்றிய விளக்கத்தை, இசையும் நடனமும் என்ற தலைப்பிற் காண்க.",8
பல்லவர்_வரலாறு,சான்றாக ஒன்று காண்க என்னேய் சிலமடவார் எய்தற் கெளியவோ பொன்னே அநபாயன்பொன்னெடுந்தோள் !,9
பல்லவர்_வரலாறு,புதிய பல்லவர் மரபு சில செய்திகள் இரண்டாம் பரமேசுர வர்மனுடன் சிம்மவிஷ்ணு மரபு முடிந்து விடுகிறது.,12
பல்லவர்_வரலாறு,"கொற்றங்குடிப் பட்டயம், இரண்டாம் நந்திவர்மனுக்கு முன் இரண்யவர்மன் என்பவன் ஆண்டதாகக் கூறுகிறது.",9
பல்லவர்_வரலாறு,இந்த இரண்யவர்மன் யாவன்?,3
பல்லவர்_வரலாறு,அவற்றின் கீழ்ச் சில செய்திகள் செதுக்கப் பட்டுள்ளன.,6
பல்லவர்_வரலாறு,முதற் சிற்பம் இரண்டாம் பரமேசுவரவர்மன் இறப்பைக் குறிக்கிறது.,6
பல்லவர்_வரலாறு,அங்குப் பரமேசுவரன் நான் போவேன் என்று தொழுது நின்ற இடம் என்பது குறிக்கப்பட்டுள்ளது.,10
பல்லவர்_வரலாறு,"உடனே இரண்யவர்மன் தன் மைந்தர் நால்வரையும் அழைத்து, யார் அரசராக விரும்புகிறீர்? என்று கேட்டான்.",11
பல்லவர்_வரலாறு,முதல் மூவரும் மறுத்தனர்.,3
பல்லவர்_வரலாறு,பன்னிரண்டு வயதுடைய பல்லவமல்லன்தான் அரசனாக விழைவதை வணக்கத்தோடு கூறினான்.,7
பல்லவர்_வரலாறு,தரணிகொண்ட போசர் இரண்டு தனது இசைவைத் தருமாறு இரண்யவர்மனை வற்புறுத்தினார்.,8
பல்லவர்_வரலாறு,பிறகு தந்தையும் தரணிகொண்ட போசரும் தந்த கைப்படைகளையும் தாண்டிக் காஞ்சிக்குவந்தான்.,8
பல்லவர்_வரலாறு,அவன் வருதலை அறிந்த பல்லவடி அரையன் பெருஞ்சேனையுடன் எதிர்கொண்டு அவனை யானைமீது அமர்த்திஅழைத்து வந்தான்.,11
பல்லவர்_வரலாறு,"விடேல் விடுகு, கத்வாங்கதான், ரிஷபலாஞ்சினன் என்னும் பட்டத்திற்குரிய விருதுப் பெயர்களை வழங்கினர்.",9
பல்லவர்_வரலாறு,நந்திவர்மன் அரசன் ஆனான்.,3
பல்லவர்_வரலாறு,"ஆனால், பல்லவர் வழிமுறை கூறும் பல பட்டயங்கள் அவன் பெயரை க் குறிக்கவில்லை.",10
பல்லவர்_வரலாறு,புதிய மரபு ஏன் வந்தது?,4
பல்லவர்_வரலாறு,சிம்மவிஷ்ணுவின் தம்பி பீமவர்மன்.,3
பல்லவர்_வரலாறு,பீமவர்மன் மரபில் வந்தவன் இரண்யவர்மன்.,4
பல்லவர்_வரலாறு,இரண்யவர்மன் மகன் பல்லவ மல்லனாகிய இரண்டாம் நந்திவர்மன்.,6
பல்லவர்_வரலாறு,சிம்மவிஷ்ணு மரபினர் ஆட்சி இரண்டாம் பரமேசுவர வர்மனோடு முடிவுற்றுவிட்டது.,7
பல்லவர்_வரலாறு,அவனுக்குச் சித்திரமாயன் என்னும் மைந்தன் இருந்தான்.,5
பல்லவர்_வரலாறு,ஆயின் அவன் அரசனாகப் பொதுமக்கள் விடவில்லை.,5
பல்லவர்_வரலாறு,பல்லவ நாட்டிற்கு வடமேற்கே பிறவிப்பகைவராக இருந்த சாளுக்கியர் எந்த நிமிடத்திலும் படையெடுக்கலாம் என்னும்பெருங் கவலை இருந்தது.,12
பல்லவர்_வரலாறு,"அத்துடன், தெற்கே பெருவீரராக இருந்து நாடு கவரும் வேட்கையில் பாண்டியர் முனைந்திருந்தனர்.",9
பல்லவர்_வரலாறு,இங்ஙனம் வடக்கே சாளுக்கியர் அச்சமும் தெற்கே பாண்டியர் அச்சமுமே அமைச்சர் முதலிய பொறுப்புள்ளவர் மனத்தைக் கலக்கிக்கொண்டிருந்தது.,12
பல்லவர்_வரலாறு,இரண்டாம் பரமேசுவர வர்மனே போரில் இறந்தான் என்பது எண்ணவேண்டு வதாக இருக்கிறது.,9
பல்லவர்_வரலாறு,"நான்கு காலஞ் சென்ற அரசனின் மகனான சித்திரமாயன் குழந்தையாக அல்லது சிறுவனாக, அல்லது பொறுப்பற்ற வாலிபனாக இருந்திருக்கலாம்.",13
பல்லவர்_வரலாறு,மிகப்பெரிய பேரரசிற்கு அவன் தகுதியற்றவன் என்று அரசியல் தலைவர்கள் கருதினர் போலும் மேற்சொன்ன இரு பேரரசரான சாளுக்கியரையும்.,13
பல்லவர்_வரலாறு,அவன் மறுத்துத் தன் வீரமகனை அரசு கட்டிலில் அமர்த்தினான் போலும் !,8
பல்லவர்_வரலாறு,பன்னிரண்டு வயதுடைய இளைஞனான பல்லவ மல்லன் நான் அரசனாவேன் என்று தந்தையிடம் கூறினது நோக்கற்பாலது.,11
பல்லவர்_வரலாறு,தனக்கு முன்னோர் மூவரும் மறுத்ததை அருள் நோக்கங் கொண்ட அவன் தன் இளமையும் கருதாமல் ஏற்றது.,12
பல்லவர்_வரலாறு,அவனது பெருந்தன்மையையும் அரசியல் பொறுப்புணர்ச்சியையும் உணர்த்துகிறது.,5
பல்லவர்_வரலாறு,அவன் பிறர்க்கு உரிய பட்டத்தை வலிதிற் கவரவில்லை தானாக வந்ததைச் சிறுவயதில் ஏற்றுங்கொண்டான்.,10
பல்லவர்_வரலாறு,இப்புதிய பல்லவ மரபரசர் இவராவர் இரண்டாம் நந்திவர்மன் கி.பி.,8
பல்லவர்_வரலாறு,தந்திவர்மன் மூன்றாம் நந்திவர்மன் பிற்பட்ட பல்லவர் கி.பி.,7
பல்லவர்_வரலாறு,இவன் கி.பி.,3
பல்லவர்_வரலாறு,"அதனால், இவன் ஆட்சிக் காலம் ஏறக்குறையை அறுபத்தைந்து ஆண்டுகள் என அறிஞர் கொண்டுள்ளனர்.",10
பல்லவர்_வரலாறு,இவ்வளவு நீண்டகாலம் ஆண்ட வேறு பல்லவ அரசன் இல்லை.,7
பல்லவர்_வரலாறு,இவன் பனிரண்டு  வயதில் பட்டம் பெற்றது.,5
பல்லவர்_வரலாறு,ஆட்சிக் காலம் நீண்டமைக்கொரு காரணமாகும்.,4
பல்லவர்_வரலாறு,பல்லவர் பட்யங்களுள் இவன் காலத்தன ஐந்து.,5
பல்லவர்_வரலாறு,"பாண்டியர் பட்டயங்கள் வேள்விக்குபடி பட்டயம், சின்னமனூர்ப் பட்டயம் என்பன.",7
பல்லவர்_வரலாறு,"இங்ஙனமே கங்கர், இராட்டிரகூடர் பட்டயங்களும் இருக்கின்றன.",5
பல்லவர்_வரலாறு,இவை அனைத்தும் ஆய்ந்து இப் பல்லவப் பேரரசர்கள் வரலாறு காண்போம்.,8
பல்லவர்_வரலாறு,பல்லவர் பாண்டியர் போர் போருக்குக் காரணம் பல்லவர்க்கும் பாண்டியர்க்கும் போர் நடந்ததற் கெல்லாம் சிறந்த காரணம் கொங்குநாட்டு உரிமையாகும்.,14
பல்லவர்_வரலாறு,கொங்குநாடு ஒருகாலத்திற் பாண்டியரிடமும் பிறிதொருகாலத்திற் பல்லவரிடமும் கைமாறிவந்தன.,6
பல்லவர்_வரலாறு,நந்திவர்மன்கொங்குநாட்டைப் பிடிக்க முயன்றான்.,3
பல்லவர்_வரலாறு,அதற்காகப் பாண்டிய அரசன் போரிட வேண்டியவன் ஆனான்.,6
பல்லவர்_வரலாறு,அடுத்த காரணம் சித்திரமாயன் பாண்டியனைச் சரணமடைந்திருந்தது.,5
பல்லவர்_வரலாறு,"இவ்விரண்டு காரணங்களாலும், பாண்டியர் அரிகேசரி பராங்குச மாறவர்மன் கி.பி.",8
பல்லவர்_வரலாறு,எழுநூற்று பத்து எழுநூற்று அறுபத்தைந்து நந்திவர்மனைத் தாக்கச் சமயம் பார்த்திருந்தான்.,8
பல்லவர்_வரலாறு,அதற்கு நந்திபுரம் என்பது பெயர்.,4
பல்லவர்_வரலாறு,அங்குப் பெருமாள் கோவில் உண்டு.,4
பல்லவர்_வரலாறு,அதனைத் திருமங்கையாழ்வார் பாடியுள்ளார்.,3
பல்லவர்_வரலாறு,பாண்டியன் படையெடுப்பை எதிர்பாராத நந்திவர்மன் கோட்டைக்குள் அகப்பட்டுக்கொண்டான்.,6
