work_title,sentence,sentence_length
பாற்கடல்,உயிர் மிகவும் மலிவாகி விட்டது.,4
பாற்கடல்,காய்கறிகளின் விலைதான் தலைவிரித்தாடு கிறது.,4
பாற்கடல்,வியாபாரமும் இப்போதுதான் மும்முரம்.,3
பாற்கடல்,"அது யாருக்காகவும், எதற்காகவும் பார்க்கவில்லை, காத்திருப்பதில்லை.",5
பாற்கடல்,"எது உண்மையாக, மன்னுயி ருக்குப் பரிதவிப்பு?",5
பாற்கடல்,எது கண்ணிரைத் துடைப்பது?,3
பாற்கடல்,என் பெரிய பாட்டனார் ஐயாவைச் சந்தேகமில்லாமல் இந்த ரகத்தில் சேர்த்து விடலாம்.,9
பாற்கடல்,இதுமாதிரி ஒரு மனிதன் இருக்க முடியுமா என்று அவரிடம் ஒரு நம்பமுடியாத தன்மையிருந்தது.,10
பாற்கடல்,"அத்தனை வயதிலும், ஆச்சரியத்துக்குரிய ஒரு குழந் தைத்தனம், தனக்கென்று ஏதுமில்லை.",8
பாற்கடல்,தனக்கென்று ஏதும் தேடவில்லை.,3
பாற்கடல்,நேற்றையின் பச்சாதாபமும் இல்லை.,3
பாற்கடல்,"இருந்தவரை அன்று அன்றைக்கே என, அவர் உடல் மனவறைகளுக்கு எட்டியவரை, ஒவ்வொரு நாளையும் பூராக வாழ்ந்தவர்.",12
பாற்கடல்,அது அவருக்கு இயல்பாக அமைந்து விட்டது.,5
பாற்கடல்,"எழுத்தில் மட்டும், கலைகளில் மட்டும்தானா உத்தி?",5
பாற்கடல்,"வாழ்க்கையை வாழ்வது, வாழ்ந்து காட்டுவது இதைவிடப் பெரிய உத்தி இருக்கிறதா என்ன?",9
பாற்கடல்,"இந்த அத்தியாயத்துக்கு, நனவோடை உத்தியில், எழுத்தாளனின் இலக்கிய வாழ்வில் ஒருநாள் என்று தலைப்பு இடலாமா?",11
பாற்கடல்,அத்தியாயம் ஏழு மீண்டும் ஞாபகத்துக்கு,4
பாற்கடல்,என் பாட்டனாரும் அவர் உடன்பிறந்தோரும்.,4
பாற்கடல்,ராமஸ்வாமி ஐயர் என் பாட்டனார் லால்குடி போர்டு ஸ்கூல் தமிழ்ப்பண்டிதர்.,8
பாற்கடல்,சிதம்பரம் ஐயர் போலீஸ் இலாகா குமாஸ்தாதான் ஆனால் அவருக்கு எட்டுக் கண்ணும் விட்டெறிந்தது.,10
பாற்கடல்,"ஆபீஸ் நெளிவு சுளிவுகள் அற்றுப்படி, ஆங்கிலத்தில் சூரன்.",6
பாற்கடல்,"அவர் கை காட்டிய இடத்தில், கண்ணை மூடிக்கொண்டு கையெழுத்துப் போடுவான்.",8
பாற்கடல்,காம்ப் க்ளார்க் மேல் அவ்வளவு அபார நம்பிக்கை.,6
பாற்கடல்,எத்தனையோ பேருக்கு வழி திறந்துவிட்டிருக்கிறார் அடைத்தும் இருக்கார்.,6
பாற்கடல்,இத்த னைக்கும் படிப்பு மெட்ரிகுலேஷன் வரைதான்.,5
பாற்கடல்,சுந்தரம் உப்பு இலாகா.,3
பாற்கடல்,லசுஷ்மி புக்ககம் லால்குடி பக்கத்தில் வாளாடி யில்.,6
பாற்கடல்,கைநாடி பிடித்துப் பார்த்து உடல்நிலை சொல் வதில் அவ்வளவு நிபுணியாம்.,8
பாற்கடல்,அவளுக்குச் சொல்லிக் கொடுத்த வைத்தியனே அவளிடம் யோசனை கேட்கும் அளவுக்குத் தேறிவிட்டாள்.,9
பாற்கடல்,"வெகு சீக்கிரத்தில், விளை யாட்டாக ஆரம்பித்ததுதான்.",5
பாற்கடல்,"என் வீட்டில், பரணில் நாடிசாஸ்திரம் பற்றி மட்டுமே, அடுக்கடுக்கா புஸ்தகங் களும், ஒலைச்சுவடிகளும் கிடக்கு, பாட்டனார் படிச்சது.",13
பாற்கடல்,நானும் படிக்காமல் இல்லை.,3
பாற்கடல்,ஆனால் லக்ஷமி அம்மாளின் தரிசனம் எனக்குக் கிட்டுமா? ஆறு.,7
பாற்கடல்,"ஜகதீச ஐயர், பி.ஏ.பி.எல்.",6
பாற்கடல்,"இவர் வக்கீ லுக்குப் படித்ததாகத் தெரியுமே ஒழிய, தொழில் நடத் தினதாகத் தெரியவில்லை.",10
பாற்கடல்,வயிற்றுக் கோளாறில் நொந்த முகம்.,4
பாற்கடல்,"தினம் பொரித்த குழம்பு, பத்தியச் சாப்பாடு.",5
பாற்கடல்,ப்ரவ்ருத்த ஸ்ரீமதி புக்ககம் லால்குடிக்கு அடுத்த ஆங்கரையில்.,6
பாற்கடல்,"பிச்சு கடைக்குட்டி, போலீஸ், தாத்தா இறந்த சமயம், இவர் லால்குடிக்கு ஈமச்சடங்குகளுக்கு வந்திருந்தபோது நான் முதன்முதலாகப் பார்த்தது.",13
பாற்கடல்,"எனக்கு அப்போது வயது பத்து, பனிரண்டு  இருக்குமா?",6
பாற்கடல்,இல்லை இன்னும் குறைவுதான்.,3
பாற்கடல்,அவர் அதிகமாக யாருடனும் பேசிக் கலகலப்பாக இருந்ததாகத் தெரிய வில்லை.,8
பாற்கடல்,"ஆஜானுபாகு, தலையில் அடர்த்தியான கன்னங்கரேல் மயிர்.",5
பாற்கடல்,"பரந்த முகத்தில் குத்துமீசை, அல்லது கொத்துமீசையா?",5
பாற்கடல்,என்னவோ எலுமிச்சம் பழத்தை நுனியில் வைத்துப் பார்க்கிறதாமே !,6
பாற்கடல்,வேலையி லிருந்து ஒய்வுபெற்று லால்குடி வாசத்துக்குத் திரும்பி விட்டார்.,7
பாற்கடல்,மாயாபஜார் ராக்ஷஸன் மாதிரி இருந்தார்.,4
பாற்கடல்,"முன்னுக்கும் பின்னுக்கும் ஏகத்தாறாகத் தள்ளி, உடல் சரிந்துவிட்டது.",6
பாற்கடல்,"தலையிலும், மீசையிலும் பழைய கரேலும் பொலிவும் இன்னும் இருக்குமா?",7
பாற்கடல்,"ஒஹோ, சப்தரிஷி பிள்ளையா? தொண்டையில் மணல் நறநறத்தது.",6
பாற்கடல்,அம்மாப்பெண் மாதிரியே இருக்கையே !,3
பாற்கடல்,"பேஷ், எங்களுக்கு உன் தாயார் ரொம்ப உசத்தி.",6
பாற்கடல்,அம்மா எப்படியிருக்காள்? இவர் ப்ரதாபங்களுக்கு இந்த வரலாற்றில் இட மில்லை.,8
பாற்கடல்,ஆனாலும் தனிக்கதை பெறும்.,3
பாற்கடல்,ஒரு கொள்ளைக் கூட்டத்தையே தனியாக வளைத்துவிட்டாராம் !,5
பாற்கடல்,"சிதம்பரம் ஐயர், சுந்தரம் ஐயர், பிச்சு ஐயர் நன்றாகச் சம்பாதித்தனர்.",8
பாற்கடல்,அவர்கள் தொழில் பார்த்த இலா காக்கள் அப்படி.,6
பாற்கடல்,"ஐயாதான் தனக்கு உதவாத, ஊருக்குச் செல்லப் பிள்ளை.",6
பாற்கடல்,"காது கேட்டால், கனவில் வந்து அதட்டுவார்.",5
பாற்கடல்,நீதான் வயசுக்கு முன்னால் தலை நரைச்சு கிழவனாயிட்டே !,6
பாற்கடல்,அவர் உண்டு அவர் பாட்டு நோட்டு உண்டு.,6
பாற்கடல்,"வக்கீலய்யா, எப்படியோ முண்டி அடித்து, பி.எல்.",6
பாற்கடல்,"தேறினாரே ஒழிய, தொழிலில் அதிர்ஷ்டமில்லை.",4
பாற்கடல்,ஜி. சுப்ரமணிய ஐயருக்கு மாப்பிள்ளை ராசி கிடையாது.,6
பாற்கடல்,"இந்தக் குடும்பத்தில் ஆண் பெண் அனைவருமே, ஏதோ உக்கிரம் படைத்தவர்கள்.",8
பாற்கடல்,"வெளித் தெரியா விட்டால், உள் புழுங்கும் உக்கிரம்.",6
பாற்கடல்,"காவிய நாயகம் உண்டோ இல்லையோ, காவியத்தன்மை படைத்த வர்கள்.",7
பாற்கடல்,எல்லோருடைய தன்மையிலும் ஏதோ விபரீதமும் கட்டு மாத்திரை உரை சொட்டு மருந்துபோல் கலந் திருந்தது.,11
பாற்கடல்,அடிப்படை குரூரம்கூட என்று சொல்வேன்.,4
பாற்கடல்,"தவிர, தனி வர்க்க எண்ணம்.",4
பாற்கடல்,"காரம், பூரம் எல்லாம் சேர்ந்துதான் உயிர் காக்கும் லேகியம் அல்லது சூரணம் ஆகிறது.",10
பாற்கடல்,பாற்கடலின் கடையலில் வாசுகி கக்கிய விஷத்தை ஆண்டவன் எடுத்துக்கொண்டான் எனினும் ஒரு சிறிதேனும் கடலில் கலவாது இருந்திருக்குமா?,13
பாற்கடல்,அதுவும் பின்னர் திரண்ட அமிர்தத்துடன் கலந்துதானே இருக்கும்?,6
பாற்கடல்,இல்லையென்று நான் நம்பத் தயாராக இல்லை.,5
பாற்கடல்,என் எண்ணம் என் உரிமை,4
பாற்கடல்,"ஆனால் வீட்டுக்கு வீடு, குடும்பத்துக்குக் குடும்பம் அவரவர்களுக்குத் தங்களைப் பற்றி எண்ணம் இப்படித் தான் இருக்குமோ என்னவோ?",13
பாற்கடல்,"எண்ணச் செருக்கு ஏறத்தாழ, அவ்வளவுதானே !",4
பாற்கடல்,"இதுகூட இல்லாவிடின், பின் எப்படி?",4
பாற்கடல்,இத்தனை செருக்குகளின் திரட்சிதானே மானுடத்தின் பெருமிதம் !,5
பாற்கடல்,"ஆண்களுக்குப் பொதுவான, அடித் தலைமுறை களுக்கும் இறங்கிவிட்ட ஒரு அங்கசேஷ்டை உண்டு.",9
பாற்கடல்,"வாசற்படி இறங்கி, யாரையும் கைதாழ்ந்து கேட்க மாட்டார்கள்.",6
பாற்கடல்,உதவு பவர்கள் தங்கள் கெளரவமாக பாவித்தல் வேண்டும்.,6
பாற்கடல்,இது என் தகப்பனார் பார்த்த கோணம்.,5
பாற்கடல்,ஆனால் பொதுவாக அந்தக் கூட்டத்தின் வணங்காமுடித் தன்மையை என்னால் மனக்கண்ணில் பார்க்க முடிகிறது.,10
பாற்கடல்,அவள் என் அம்மாவைப் பெற்ற பாட்டி அவள் கீர்த்தி பெரிதாகையால் தனியாகச் சொல்லும் நிலை கொண்டது.,12
பாற்கடல்,வெள்ளைப் பீங்கான் நிறம்.,3
பாற்கடல்,கன்னங்கள் அசல் பீங்கான்கள் போலவே பளபளக்குமாம்.,5
பாற்கடல்,", ஜலம் விழுங்கினால் நெஞ்சில் கண்ணாடிபோல் தெரியுமாம்.",5
பாற்கடல்,அவள் நிறத்துக்குப் பார்த்தவர்களின் அலங்கார பாஷை.,5
பாற்கடல்,"இவளுக்கு நைடதம், நன்னூல் பாடம் என்று ஏற்கெனவே சொல்லி இருக்கிறேன்.",8
பாற்கடல்,வேளைக்கு ஆளுக்குக் கால்படி அரிசி வேணும்.,5
பாற்கடல்,அதற்கு வக்கும் இருந்தது.,3
பாற்கடல்,மூடி வைத்துக் கல்யாணம் பண்ணி விட்டார்கள்.,5
பாற்கடல்,பேசு மொழிக்குப் பெண்டிர் சொல்.,4
பாற்கடல்,அழகு பார்த்தா அந்த நாள் திருமணங்கள் !,5
பாற்கடல்,புகுந்த வீட்டில் பெண் வயிறு பசியாமல் சாப்பிடு வாளா?,7
பாற்கடல்,"அதைவிட முக்கியம், ஊர் வாயில் புகுந்து புறப்படு முன் வீட்டை விட்டுப் பெண்ணை எப்படி யேனும் கழற்றிவிடு.",13
பாற்கடல்,நடராஜ ஐயருக்குக் காலில் சக்கரம்.,4
பாற்கடல்,வீட்டைவிட்டு அப்பப்போ காணாமல் போய்விடுவார்.,4
பாற்கடல்,பல மாதங்கள் கழித்துத் திரும்பி வருவார்.,5
பாற்கடல்,போகும்போது பண்டங்களைக் கழற்றிப் போனார்.,4
பாற்கடல்,"அல்ல, எடுத்துக்கொண்டு போனார்.",3
பாற்கடல்,நான் உங்களைக் கேட்கிறேன்.,3
பாற்கடல்,"சில வீடுகளில் இதுபோல், செல்லாக்காசு ஒன்று இருக்கும்.",6
பாற்கடல்,மளிகைக் கடைக்கார னிடம் கொடுத்து மாற்றிவிட்டதாகச் சந்தோஷப்பட்டுக் கொண்டிருப்போம்.,7
பாற்கடல்,காய்கறிக் கடைக்காரனிடமிருந்து அதே காசு திரும்பி வந்துவிடும்.,6
பாற்கடல்,வீட்டுக்கு வந்து சில்லரையை எண்ணிப் பார்க்கும் போதுதான் தெரியும்.,7
பாற்கடல்,அதிர்ஷ்டக் காசு என்று தேற்றிக் கொள்வதா?,5
பாற்கடல்,நடராஜ ஐயர் கஞ்சா அடிப்பார்.,4
பாற்கடல்,"இடது உள்ளங்கையில் இலைச்சூர்ணத்தை வைத்து வலது கட்டைவிரலால் தேய், தேய்.",8
பாற்கடல்,"நிமண்டு, மறுபடியும் தேய்.",3
பாற்கடல்,பதம் காணும்வரை இப்படியே செய்து கொண்டிரு.,5
பாற்கடல்,அனுபவிக்கப்போகும் பங் கின் எதிர்பார்ப்பில் இப்பவே கண்ணில் ஒரு செருகல்.,8
பாற்கடல்,புகைத்துப் புகைத்துப் பொலிவிழந்து போன முகத்தில் நாளடைவில் வெந்நீர் அண்டாக் கரிபோல் கன்னங் களில் சேர்ந்துவிட்ட ஒர் அசடு.,14
பாற்கடல்,"கூடவே, மாட்டிக் கொண்டோம், கழற்றிக்கொள்ள முடியவில்லை, பார்த்தையா எனும் உண்மையான சோகம்….",9
பாற்கடல்,"எடு குழாயை, அத்தோடு ஒட்டிய துணியுடன் பற்றவை பற்றவை.",7
பாற்கடல்,"புக் புக், புகு புகு, புக்டக்.",5
பாற்கடல்,"என்ன சுகம், பெகு ஸுக், பெகு ஸுக், மஞ்சி ஸுகம் மஞ்சி ஸுகம்.",10
பாற்கடல்,உலகத்தின் அத்தனை பாஷைகளிலும் அந்த சுகம்.,5
பாற்கடல்,அதையும் தாண்டி ஆனந்தம்.,3
பாற்கடல்,பின் வேறு எங்கு இருக்கிறேன்?,4
பாற்கடல்,இதெல்லாம் அப்பா அண்ணா சொன்னது.,4
பாற்கடல்,லாசராவுக்குத் தானாகவே இந்த கெத்து வந்துவிடுமா?,5
பாற்கடல்,"அண்ணா, பார்ப்பதற்கு ஏன், சுபாவத்திலேயும் சாதுதான்.",5
பாற்கடல்,ஆனால் அவரிடம் ஒரு வெள்ளை க் கபடு உண்டு.,7
பாற்கடல்,எதிராளிக்கு விலா தைக்கும்படி ஆகிவிடும்.,4
பாற்கடல்,"மேற்கூறிய சடங்கை, படிப்படியாக அதன் கடைசி சித்திவரை வீட்டுள் பண்ண முடியாது.",9
பாற்கடல்,முதலில் கஞ்சா சம்பாதிக்கணும்.,3
பாற்கடல்,அவர் ஊர் ஊராய்த் திரிந்ததே கஞ்சா வேட்டையில்தானோ என்னவோ?,7
பாற்கடல்,"பொறுத்துப் பார்த்து, இது தேறாத கேஸ் என்று தெளிந்ததும், சகோதரர்கள் கழற்றிவிட்டனர்.",9
பாற்கடல்,அரசப் பழக்கத்துடன் ஆண்டிப் பிழைப்பு தீவிரமாயிற்று.,5
பாற்கடல்,"வீட் டுக்கு வந்தால், சாப்பாட்டோடு சாப்பாடு தனியாகப் பண்ணிப் போடுவது என்ன தட்டுக் கெட்டுப்போகிறது?",11
பாற்கடல்,அந்த நாளிலேயே இல்லாதவருக்கும் இருக்கப்பட்ட வருக்கும் வித்தியாசம் அளவில்தான்.,7
பாற்கடல்,அனேகமாக எல்லார் வீட்டிலும் பானை நிறையச் சோறு.,6
பாற்கடல்,"சட்டி நிறையக் குழம்பு, ஆம், மண்பாண்டச் சமையல்தான்.",6
பாற்கடல்,இப்போது அதற்கு ஒட்டல்களில் தனி விளம்பரம்.,5
பாற்கடல்,"தனிக்கட்டணம் கூடவோ என்னவோ சட்டி நிறையக் கீரை, ஒருவேளை சுட்ட அப்பளாம், மூலையில் பழையது.",11
பாற்கடல்,வகைவகையாகப் பண்ணிப் போடவும் தெரியாது.,4
பாற்கடல்,வகைகளும் வழக்கில் இல்லை.,3
பாற்கடல்,"ஐயா யாத்திரையில் சொல்லாமல் கிளம்பும்போது வயிற்றில் பூச்சியை வாங்கிக் கொண்டு, திரும்பி வரும் போது குழந்தையைப் பார்த்தேளா?",13
பாற்கடல்,அந்தப் போஸ் கொடுக்கவில்லை.,3
பாற்கடல்,ஸ்ரீமதி தன் பேறுகளுடன் இங்கேயே வேரோடிப் போனாள்.,6
பாற்கடல்,"மூத்த பிள்ளைக்கு அடுத்துப் பெண் அடுத்து என் அம்மா, அப்புறம் சுப்ரமணியன், சுந்தரம்.",10
பாற்கடல்,"பொதுவாகவே, இதுபோன்ற துர்ப்பாக்கியவதிக்குக் குடும்பத்தில், அவள் வயது கடந்த செல்லம் கிடைத்து விடும்.",10
பாற்கடல்,இதை என் சொந்த அனுபவத்திலிருந்தும் சொல்கிறேன்.,5
பாற்கடல்,ஸ்ரீமதியை இமைபோல்தான் காத்தனர்.,3
பாற்கடல்,செல்லம் என்றால் என்ன?,3
