work_title,sentence,sentence_length
பாற்கடல்,ஆனால் பிட்டுப் பார்த்தால் இன்னும் வேகாத மைதா மாவு !,7
பாற்கடல்,நாங்கள் அந்த நாளில் கையால் தொடக்கூட மாட்டோம்.,6
பாற்கடல்,யாராவது விசேஷம் என்னுது உன்னு துன்னு இழுத்துப் போட்டுண்டு செய்யறாளா?,8
பாற்கடல்,"அம்மாப்பெண்ணே, நீ அந்தச் சீமந்தக் கல்யாணத் துக்குச் சமைச்சயே, அதைவிட ஒசத்தியாடீ? அத்தனை தொண்டைகளிலிருந்தும் ஏகோபித்து ஒரு ஹாஹாகாரம்.",14
பாற்கடல்,பிறகு தனித்தனியாகவும் சேர்ந்தும் விசாரித்துத் தெரிந்துகொண்டேன்.,5
பாற்கடல்,சிதம்பர மாமா மூத்த பெண்ணுக்குச் சீமந்தம்.,5
பாற்கடல்,"ஏற்பாடு செய்திருந்த சமையல்கார செட், செட்டா டோக்கர் கொடுத்துவிட்டான்கள்.",7
பாற்கடல்,"வேறு எங்கே இரண்டு காசு கூடக் கிடைத்ததோ, இல்லை ஹெட் சொல்லி வைத்திருந்த ஸெட் சேரவில்லையோ?",12
பாற்கடல்,"இல்லை, யாருக்கு உடம்பு சரியில்லையோ?",4
பாற்கடல்,மணி ஏழாயிடுத்து ஜாடா க் காணோம்.,5
பாற்கடல்,இட்டிலிக்கு முதல்நாள் அரைச்சு வைத்திருக்கும் மாவு பொங்கி வழிகின்றது.,7
பாற்கடல்,தேடின இடத்தில் ஆள் இல்லை.,4
பாற்கடல்,சிதம்பரமையர் போலீஸ் இலாகாதான்.,3
பாற்கடல்,அதிலும் அவர் ஆட்டம் தனிப் பெரிசுதான்.,5
பாற்கடல்,ஆனால் இசைகேடாக மாட்டிக்கொண்டு விட்டார்.,4
பாற்கடல்,"பின்னால் சிகூைர் சமையல்காரனுக்கு, நடக்கிறபடி நடந்ததோ, என்னவோ?",6
பாற்கடல்,"ஆனால், இன்று, இப்போ, ஆகவேண்டியது என்ன?",5
பாற்கடல்,"கல்யாண சீசன், மாற்றாள் கிடைக்கவில்லை.",4
பாற்கடல்,அந்த அவசரத்துக்கு எவன் அகப்படுவான்?,4
பாற்கடல்,கூட வைத்துக்கொண்டு சமாளிக்க முதல்நாள் இட்டிலிக்கு அரைத்த பாட்டிமார்கள் கூடக் கிடைக்கவில்லை.,9
பாற்கடல்,அவர்களும் எங்கோ தேங்காய் துருவப் போய்விட்டார்களோ?,5
பாற்கடல்,வந்திருக்கும் பெண்டிரில் யாருக்கும் காரியத்தில் இறங்கத் துணிச்சல் இல்லை.,7
பாற்கடல்,ஏதேனும் கொஞ்சம் பிசகினாலும் சிதம்பரமையர் வாயில் யார் புகுந்து புறப்படுவது?,8
பாற்கடல்,அந்தச் சமயத்துக்கு மன்னிப் பாட்டியும் இருந்த தாகத் தெரியவில்லை.,7
பாற்கடல்,ஒருவேளை கார்த்திகேயனை ப் பிரசவித்திருந்தாளோ என்னவோ?,5
பாற்கடல்,இதெல்லாம் ஹேஷ்ய விஷயம்.,3
பாற்கடல்,"சீமந்தத்துக்குச் சாமான்கள், காய்கறிகள், பால் தயிர் வாங்கிப் போட் டதும், காணிக்கையாக வந்தவையும், உக்ராண உள்ளிலும், கூடத்திலும் வதியழிகின்றன.",14
பாற்கடல்,கோட்டை அடுப்பு தூங்கறது.,3
பாற்கடல்,சிதம்பரமையரோ கையைப் பிசையும் நிலைமைக்கு வந்துவிட்டார்.,5
பாற்கடல்,"அப்போ அம்மாப்பெண் இன்னும் மணமாக வில்லை வயது பதிமூணோ பதினாலோ விளையாட்டாகச் சொன்னாளோ, வினையாகச் சொன்னாளோ?",12
பாற்கடல்,"ஏன் மாமா, நான் சமைக்கட்டுமா? ஐயர்வாள் மருமாளை ஒருமுறை அடையாளம் தெரியாத கண்களுடன் பார்த்தார்.",11
பாற்கடல்,"அடுத்த அடை யாளத்தில், அவர் விழிகள் அகல விரிந்தன.",7
பாற்கடல்,குட்டி என்னடி சொல்றாள்? சிதம்பரமையர் சம்சாரம் சோனியா?,6
பாற்கடல்,சோற்றுத் தவலையை என்னால் இறக்கி வைக்க முடியாது.,6
பாற்கடல்,அதுமட்டும் புருஷாள் கவனிச்சுக்கட்டும்.,3
பாற்கடல்,சாதம் பதம்வரை நான் பார்த்துக்கிறேன்.,4
பாற்கடல்,சுற்றுக் காரியம் வந்திருக்கறவா செஞ்சு கொடுத்தால் நான் ஏத்தி இறக்கிடறேன்.,8
பாற்கடல்,அவ்வளவுதான் சமையல்கட்டு ஒரே குதூகலக் கூடமாக மாறிவிட்டது.,6
பாற்கடல்,பட்டுப்புடவை கட்டிக் கொண்டு வந்திருக்கும் மாமிகள் போட்டி போட்டுக் கொண்டு தேங்காய் துருவுகிறார்கள்.,10
பாற்கடல்,"அதற்கு உப்பு, மிளகாய்த்திட்டம் அம்மாப் பெண்ணுடையது தான்.",6
பாற்கடல்,கூடத்தில் அதுபாட்டுக்கு இட்டிலிக் கடை நடக்கிறது.,5
பாற்கடல்,ஹெஸர் இன்னொரு தவலையில் காய்கிறது.,4
பாற்கடல்,"இதற்குள் இட்டிலிப் பானையின் மேல்மூடியை ஒரு ஆண்பிள்ளை தூக்க, இட்டிலியைப் பதம் பார்க்கி றாள்.",11
பாற்கடல்,"ஆச்சு, ஆச்சு, இன்னும் பாயசமும், வடையும் தான் பாக்கி.",7
பாற்கடல்,சொன்னபடி பதினோரு மணிக்கு இல்லாட்டாலும் பன்னிரண்டு மணிக்கு இலை போட்டுவிடலாம்.,8
பாற்கடல்,அந்தச் சந்துஷ்டியான முகத்தைச் சுற்றி மற்ற அத்தனை இளசுகளும் வட்டம்.,8
பாற்கடல்,இப்போ நினைச்சால்கூட எங்களுக்கு ஆச்சரியமா யிருக்குடி.,5
பாற்கடல்,"நான் சமைக்கிறேன், காரியத்தை ஒப்பேத்திக் கொடுக்கறேன்.",5
பாற்கடல்,கழுதை வயசானவளுக்கெல்லாம் ஏத்துக்கத் தெம்பு வல்லே.,5
பாற்கடல்,"நீ பச்சைக் குழந்தை, உனக்கெப்படி அந்தத் தைரியம் வந்தது?",7
பாற்கடல்,அம்மு வாத்து ரத்தம் அவள் உடம்பிலும் ஒடல்லியா?,6
பாற்கடல்,"தைரியத்துக்கென்ன குறைச்சல்? அந்தச் சமையலும் என்ன, சின்னப்பொண்ணு பண்ற மாதிரியா இருந்தது?",9
பாற்கடல்,அதெப்படி ஆவேசம் வந்தமாதிரி அப்படி அப்பழுக்கில்லாமல் அமைஞ்சுது?,6
பாற்கடல்,"அம்மாப்பெண்ணே, மறுபடியும் அதுமாதிரி நேர்ந்தால் அதேமாதிரி உன்னால் முடியுமா? அம்மா புன்னகை புரிந்தாள்.",10
பாற்கடல்,"வந்தாலும் அதுமாதிரி, நமக்குத் தெரியாது.",4
பாற்கடல்,"இப்பவும் அதைப்பத்திப் பேச, அந்தச் சமயம் ஒரே தரமா நேர்ந்து, அப்புறமும் சமயம் சமயமா நிக்கறது.",12
பாற்கடல்,"பெருந்திரு, எத்தனை காலமாக, மூலஸ்தானத்தில் நின்றவிடத்திலேயே நின்னுண்டிருக்கா, அது மாதிரி அம்மாடி !",9
பாற்கடல்,ராமாமிருதம் சுண்டெலிகூட இல்லை.,3
பாற்கடல்,"சுண்டைக்காய், சுண்டைக்காய் கூட இல்லை.",4
பாற்கடல்,அதன் தகுதி எனக்கில்லை.,3
பாற்கடல்,நான் சுண்டெலியாகவே இருந்துவிடுகிறேன்.,3
பாற்கடல்,இதுவரை அம்மா இதுபற்றி என்னிடம் ஏன் சொன்னதில்லை?,6
பாற்கடல்,சொல்ல வேண்டாம் என்கிற எண்ணமா?,4
பாற்கடல்,சொல்லி என்ன ஆக வேண்டும் என்கிற அலகூழியப் பாங்காயிருக்கலாம்.,7
பாற்கடல்,"இல்லை, அந்த விஷயத்தின் பேரிலேயே அலகூழியமா யிருக்கலாம்.",6
பாற்கடல்,அதில் என்ன இருக்கிறது?,3
பாற்கடல்,நடந்தது நடந்தாச்சு என்கிற போக்கு.,4
பாற்கடல்,"விஷயத்தின் எடை தெரிந்தே அதைத் தூக்கி எறிதல், துறவிச்செருக்கு.",7
பாற்கடல்,அன்று எல்லோரும் படுத்து ஒசை அடங்கின பின்னர் ஒசைப்படாமல் எழுந்து அம்மா எங்கு இருக்கிறாள்?,11
பாற்கடல்,உதட்டின்மேல் இரு விரல்கள்.,3
பாற்கடல்,அவளுடைய வழக்கமான போஸ்.,3
பாற்கடல்,அவளுக்கும் என்போல் தூக்கமில்லை.,3
பாற்கடல்,ஒரு பாறை போல் தோன்றுகிறாள்.,4
பாற்கடல்,நீல நக்ஷத்ரங்களில் தனித் தனியாகப் பொறிந்து கொண்டு என் மனக்கண்ணில் சொல் எழுகிறது.,10
பாற்கடல்,எனக்கு மிகவும் பிடித்தமான சொல்.,4
பாற்கடல்,இதன்மேல் எனக்கு எப்பவுமே பாரபகஷம் உண்டு.,5
பாற்கடல்,இப்போ மதுரையிலிருந்து திரும்புகையில் தரிசனத் துக்கு லால்குடி போயிருந்தேன்.,7
பாற்கடல்,"தேனோ, பன்னிரோ, இளநீரோ ஏதோ ஒரு அபிஷே கத்துக்குப் பின்னர் குருக்கள் உபசார தீபாராதனை காட்டுகிறார்.",12
பாற்கடல்,சிவராஜ குருக்களுக்குப் பின் இப்போ அவர் பிள்ளை கணேசன்.,7
பாற்கடல்,அம்பாளை நன்னா பார்த்துக்கோங்கோ. அவள் எங்கே அப்படி நன்றாகத் தெரிந்துவிடு வாளா?,9
பாற்கடல்,ஏற்கெனவே எனக்குக் கண்ணில் கோளாறு.,4
பாற்கடல்,"குன்றிக்கொண்டே வரும் கற்பூர ஒளியில், கர்ப்பக்ரு ஹத்தின் மையிருளிலிருந்து, உருவம் மங்கலாக அங்கு மிங்குமாக பிதுங்குகிறது.",12
பாற்கடல்,"கற்பூரம் குளிர்ந்ததும், உருவம் மறுபடியும் இருளோடு கரைந்து விடுகிறது.",7
பாற்கடல்,தேடின கண்ணுக்குத் தோற்றம்.,3
பாற்கடல்,மிச்ச நேரத்துக்கு இருளோடு இருள்.,4
பாற்கடல்,"அம்பா, நீ இருக்கிறாயா, இல்லையா?",4
பாற்கடல்,"நீ எது சொல்கிறாயோ, அது.",4
பாற்கடல்,"இருக்கிறேன் இல்லை இல்லை, இருக்கிறேன்.",4
பாற்கடல்,அத்தியாயம் பனிரண்டு  கலியாணமான கையோடு சோனா அத்தை தனிக் குடித்தனம் போய்விட்டாள்.,9
பாற்கடல்,"அண்ணாவுக்கு பெங்களுரில் வேலை, லீவுக்கு லீவு லால்குடி வந்துவிடுவார்.",7
பாற்கடல்,வாத்தியார் வேலையில் லீவுக்குக் கேட்பானேன் !,4
பாற்கடல்,"நவராத்திரி, கிறிஸ்துமஸ், பொங்கல், கோடை விடுமுறை வெள்ளையன் ராஜ்யம்.",7
பாற்கடல்,"அவன் பண்டிகை தவிர, இந்துப் பண்டிகைக்கு வேறு.",6
பாற்கடல்,ஆம்படையான்தான் அப்பப்போ வந்துவிடுகிறானே என்பதன்றி தனிக்குடித்தனம் உடனே வைக்காததற்கு இன்னொரு காரணம் உண்டு.,10
பாற்கடல்,ஊருக்கு அண்ணா அனுப்பும் மாதாமாதக் கப்பம் பாதிக்கப்படுமே !,6
பாற்கடல்,"குடும்பம் என்றால் அவசரக் கடன்கள், எதிர்பாராத செலவுகள் அப்பப்போ எத்தனை எத்தனை !",9
பாற்கடல்,ஒருவாறு சமாளிச்சுத் தலைநிமிர்ந்து கொண்டுதானே சிறிசுகள் அவசரத்தை கவனிக்க முடியும் சிறிசுகளுக்கு என்ன அவசரம்?,11
பாற்கடல்,வயசு வேணது கிடக்கு.,3
பாற்கடல்,பாற்கடல் கதையில் ஒரு வாக்கியம் வருகிறது.,5
பாற்கடல்,குடும்பம் என்பது பாற்கடல் இந்த வாக்கியந்தான் கதையின் முதுகெலும்பு.,7
பாற்கடல்,உள்ளபடி உப்புக் கடல்தான் !,3
பாற்கடல்,விடுமுறைக்கு விடுமறை அண்ணா குண்டாக வருவார்.,5
பாற்கடல்,ஹோட்டல் சாப்பாடு அவருக்கு நன்றாக ஒத்துக்கொண்டிருந்தது.,5
பாற்கடல்,காய்ந்த மாடு கம்பில் விழுந்த கதைதான்.,5
பாற்கடல்,அண்ணாவின் ஹோட்டல் வாழ்க்கை பற்றி ஒரு துணுக்கோடு நிறுத்திக்கொள்கிறேன்.,7
பாற்கடல்,"பானை சோற்றுக்கு இல்லை, பருப்புக்கு ஒரு பதம்.",6
பாற்கடல்,போன புதிதில் ரஸத்தைத் தெளிவாக விட்டுக் கொண்டு சாப்பிட்டுக் கொண்டிருந்தாராம்.,8
பாற்கடல்,ரஸம் என்றால் தெளிவாய்த்தான் இருக்கும் என்கிற நினைப்புப் போலும்.,7
பாற்கடல்,அடியா? என்று கேட்பானாம்.,3
பாற்கடல்,"என்னடா தினமும் இப்படிக் கேட்கிறானே என்று ஒருநாள், சரி கலக்கித்தான் விடேன் ! என்றாராம்.",10
பாற்கடல்,பேக்கா? கேள்விக்குக் கன்னடம் தெரியாத வெளியூர்க்காரன்.,5
பாற்கடல்,ஸாக்குலே கொஞ்சம் பேக்குலே கொஞ்சம் விடுங்கோ என்றானாம்.,6
பாற்கடல்,அது மாதிரி என்று அந்தக் கதையும் சொல்வார்.,6
பாற்கடல்,"நாங்கள் முழங்காலை இறுகக் கட்டிக்கொண்டு, குதூகலத்தில் குமுங்குவோம் கொக்கரிப்போம் !",7
பாற்கடல்,எங்களுக்கு நா சுரக்கும்.,3
பாற்கடல்,பையன்கள் ரொம்ப ரஸிக்கிறான்கள்.,3
பாற்கடல்,நாளைக்கு மைசூர் ரஸம் வைத்துவிட வேண்டியதுதான்.,5
பாற்கடல்,"மைசூர் ரஸம், கத்தரிக்காய் எண்ணெய் வதக்கல்.",5
பாற்கடல்,நமுட்டு விஷமத்தில்தான் விவரிக்கிறேன்.,3
பாற்கடல்,இதைப் படித்துவிட்டுப் பிள்ளையாண்டான்மார்கள் படப் போகும் எரிச்சலில் நான் இப்பவே காணும் உவகை தான்.,11
பாற்கடல்,கதையில் கூடவா அப்பா சாப்பாட்டு விவகாரத்தைக் கொண்டு வரணும்?,7
பாற்கடல்,அது என்ன கத்தரிக்காய் எண்ணெய்க் கறியோ?,5
பாற்கடல்,அது மாறினால் உருளைக்கிழங்கு வதக்கல்.,4
பாற்கடல்,பாங்க் மானேஜ ராக உத்தியோகம் பண்ணுண மனுஷனா இருக்கா பார்?,8
பாற்கடல்,என்னவோ சமையல்காரன். உஷார் !,3
பாற்கடல்,நா காக்க ஜாதியைப் பற்றிப் பேசுவதோ தொழிலைப் பழிப்பதோ சட்ட விரோதம்.,9
பாற்கடல்,இவர்கள் ஏன் இப்படிக் குமுறுகிறார்கள்?,4
பாற்கடல்,வகை யாகப் பணணிப் போட்டால் ஒரு வளை வளைப்பதில் குறைச்சல் இல்லை.,9
பாற்கடல்,தின்றால் குற்றம் இல்லை.,3
பாற்கடல்,தின்பதை எழுதினால்தான் குற்றமா?,3
பாற்கடல்,என் ரஸனையைப் பற்றிக் கவிஞர் அபி சொல்வதைக் கேளுங்கள்.,7
பாற்கடல்,பண்ணு வதற்கே விஷயங்கள் இருக்கின்றன.,4
பாற்கடல்,உணவு பற்றி மேலை எழுத்தாகட்டும் இதிகாச காலத்திலிருந்து நம் வரலாறு ஆகட்டும் வேணது வழங்கியிருக்கிறது.,11
பாற்கடல்,அதற்கெதிரில் நான் எந்த மூலை?,4
பாற்கடல்,எந்த மேனாட்டுக் கதையையோ நாவலையோ எடுத்துக்கொள்ளுங்கள்.,5
பாற்கடல்,"ஒன்று குடி, அல்லது தீனி அல்லது இரண்டும்.",6
பாற்கடல்,பக்கத்துக்குப் பக்கம் இடறி விழுந்தேயாகணும்.,4
பாற்கடல்,"முதல்அத்தியாயம், முப்பது பக்கங்களுக்கு மேல் ஜெர்மனியில் ஒர் உயர்தரக் குடும்பத்தின் சாப்பாட்டை வெகு சாவகாசமாக விவரிக்கின்றது.",12
பாற்கடல்,அதனாலேயே அந்த அத்தியாயம் தனிப் பிரசித்தி பெற்றது.,6
பாற்கடல்,"அதில் ஒரு பத்திரிகை நிருபன், சாப்பாட்டு ராமன்.",6
பாற்கடல்,முக்கியமான பாத்திரம் நாவலின் கடைசி அத்தியாயம் வரை வருகிறான்.,7
பாற்கடல்,"அவன் தின்கிற தீனியும், பருகுகிற குடி வகைகளும், நமக்குப் புரியாவிட்டாலும் ஆச்சரியத்தைத் தருகின்றன.",10
பாற்கடல்,"கணக்கெடுத்தால், புத்தகத்தில் கால்பங்கு இந்த விவரத்துக்கே தேறும்.",6
