work_title,sentence,sentence_length
பல்லவர்_வரலாறு,அவன் பட்டம் பெற்ற பிறகே சமணனாக மாறி இருக்கலாம்.,7
பல்லவர்_வரலாறு,"எனவே, இக்கோவில் சிம்மவிஷ்ணு காலத்திற்றான் அமைக்கப்பட்டது எனக் கோடல் பொருத்தமானதே.",8
பல்லவர்_வரலாறு,அது கீழ் வருமாறு தென் நாட்டில் பல்லவப் பேரரசனான சிம்மவிஷ்ணு ஆண்டு கொண்டிருந்தான்.,10
பல்லவர்_வரலாறு,அவன் புலவர்க்குப் புரவலனாக இருந்தான்.,4
பல்லவர்_வரலாறு,அச் செய்யுளில் இருந்த சொல்லழகும் பொருள் அழகும் அரசனை ஈர்த்தன.,8
பல்லவர்_வரலாறு,"உடனே அவன் பாடகனை நோக்கி, இதனைச் செய்தவர் யாவர்? என்று ஆவலோடு கேட்டான்.",10
பல்லவர்_வரலாறு,"பாடகன், ஐயனே, வடமேற்கே ஆரியநாடு என வரும் ஒரு நாடு உண்டு.",9
பல்லவர்_வரலாறு,அதில் அனந்தபுரம் என்பது ஒர் ஊர்.,5
பல்லவர்_வரலாறு,அஃது ஆரிய நாட்டின் தலைமணி ஆகும்.,5
பல்லவர்_வரலாறு,அப்பதியில் கெளசிக மரபிற் பிறந்த பிராமணர் சிலர் இருந்தனர்.,7
பல்லவர்_வரலாறு,அவர்கள் அதனை விட்டு அசலபுரத்திற் பதினெட்டு  குடியேறினர்.,6
பல்லவர்_வரலாறு,அப் பிராமணருள் ஒருவர் நாராயணசாமி என்பவர்.,5
பல்லவர்_வரலாறு,அவர் மைந்தர் தாமோதரன் என்பவர்.,4
பல்லவர்_வரலாறு,அவர் சிறந்த வடமொழிப் புலவராகிப் பாரவி எனப்பட்டார்.,6
பல்லவர்_வரலாறு,அப் புலவர் விஷ்ணுவர்த்தனுக்கு நண்பர் ஆனார். ஒருநாள் அவர் அவ்வரசனைத் தொடர்ந்து காட்டிற்குச் சென்றார்.,11
பல்லவர்_வரலாறு,அரசன் வேட்டையாடி விலங்கிறைஞ்சி தின்றான்.,4
பல்லவர்_வரலாறு,புலவரையும் தூண்டித் தின்னச் செய்தான்.,4
பல்லவர்_வரலாறு,அப்பாவத்தைத் தொலைக்க அப் புலவர் புறப்பட்டுப் பல இடங்கட்கும் சென்றார்.,8
பல்லவர்_வரலாறு,இறுதியில் துர்விநீதன் அவையைஅடைந்தார்.,3
பல்லவர்_வரலாறு,இப்பொழுது அங்கு இருந்தவருகிறார்.,3
பல்லவர்_வரலாறு,பாரவி காஞ்சி நகரம் வந்து சேர்ந்தார்.,5
பல்லவர்_வரலாறு,அரசன் அவருக்கு நல்ல விடுதி ஒன்றை அளித்துப் பிற வசதிகள் அனைத்தும் செய்து கொடுத்தான்.,11
பல்லவர்_வரலாறு,"பாரவி தம் புலமையால் அரசனை மகிழ்வித்து, ஓய்வு நேரங்களில் பாக்கள் இயற்றிக்கொண்டிருந்தார்.",9
பல்லவர்_வரலாறு,அறுநூற்று நாற்பத்திரண்டு வரை ஆண்டான்.,4
பல்லவர்_வரலாறு,கங்க நாட்டைத் துர்விநீதன் கி.பி.,5
பல்லவர்_வரலாறு,அறுநூற்று ஐந்து அறுநூற்று ஐம்பது என்பவன் ஆண்டு வந்தான்.,7
பல்லவர்_வரலாறு,தெற்கே மாறவர்மன் அவனி சூளாமணி என்ற பாண்டியன் கி.பி.,8
பல்லவர்_வரலாறு,அறுநூறு  அறுநூற்று இருபத்தைந்து பாண்டிய நாட்டை ஆண்டு வந்தான்.,7
பல்லவர்_வரலாறு,நாசிக்கிலும் வேங்கி நாட்டிலும் விஷ்ணுவர்த்தனன் என்பவன் ஆண்டு வந்தான்.,7
பல்லவர்_வரலாறு,களப்பிரர் இவரைப்பற்றி முன்னரே கூறப்பட்டுள்ளது.,4
பல்லவர்_வரலாறு,இவர் தொண்டைநாட்டில் ஒரு பகுதியையும் சோழ நாட்டின் பெரும்பகுதியையும் ஆண்டு வந்தனர்.,9
பல்லவர்_வரலாறு,சோழர் களப்பிரர் ஆட்சிக்குப்பட்டும் படாமலும் சிறிதளவு நிலப் பாகத்தை ஆண்டவர்.,8
பல்லவர்_வரலாறு,இவர்நிலைமை கி.பி.வரை இங்ஙனமே இருந்தது.,6
பல்லவர்_வரலாறு,இவர் தலைநகரம் உறையூர்.,3
பல்லவர்_வரலாறு,மழவர் இவர்கள் மழ நாட்டினர் மலாடர் என்றும் கூறப்படுவர்.,7
பல்லவர்_வரலாறு,இவர்கள் திருக்கோவலூர் முதலிய மலைப்பகுதிகளில் வாழ்ந்தவர்.,5
பல்லவர்_வரலாறு,மெய்ப்பொருள் நாயனார் மலாடர் அரசர் ஆவர். பாண்டியருள் கி.பி.,8
பல்லவர்_வரலாறு,"கொங்குதேச ராசாக்கள் வரலாற்றைக் கானின், துர்விநீதன் காஞ்சி உள்ளிட்ட திராவிடத்தை வென்றான் என்பது காணப்படுகிறது என கூறல், காண்க.",14
பல்லவர்_வரலாறு,"சாளுக்கிய இரணராகன், முதல் புலிகேசி இவர்கள் காலத்திற் சாளுக்கிய பல்லவர் போர்கள் நடந்தன.",10
பல்லவர்_வரலாறு,முதற் புலிகேசி எல்லோரையும் தான் அடக்கியதாகக் கூறிக்கொண்ட கி.பி.,8
பல்லவர்_வரலாறு,"எனவே, குமார விஷ்ணுவுக்குப் பிறகு காஞ்சிகளப்பிரர் கைப்பட்டதோ, கங்கர் கைப்பட்டதோ, சாளுக்கியர் கைப்பட்டதோ தெரியவில்லை.",11
பல்லவர்_வரலாறு,இது நன்கு ஆராயவேண்டும் செய்தியாகும்.,4
பல்லவர்_வரலாறு,பிற சான்றுகள்கிடைத்தாற்றான்.இஃது ஒரு முடிவுக்கு வருதல் கூடும்.,7
பல்லவர்_வரலாறு,திருவொற்றியூரை அடுத்த மணல் என்னும் கிராமம் அக் காலத்தில் சிம்மவிஷ்ணு சதுர்வேதி மங்கலம் என்றே பெயர் பெற்றிருந்தது.,13
பல்லவர்_வரலாறு,முன்னுரை சிம்மவிஷ்ணு மகனான மகேந்திரவர்மன் கிட்டத்தட்டக் கி.பி.ஏழாம் நூற்றாண்டின் தொடக்கத்தில் பல்லவ அரியணை ஏறினான்.,13
பல்லவர்_வரலாறு,இவனது அரசியலின் முதற்பகுதியில் சமணம் உயர்நிலையில் இருந்தது பிற்பகுதியில் சைவம் உயர்நிலைக்கு வந்தது.,10
பல்லவர்_வரலாறு,"இவனே, சமணத்தினின்று சைவத்திற்கு மாறினான்.",4
பல்லவர்_வரலாறு,குகைகளைக் கோவில்களாகக்குடைந்தவன் இவனே பாறைகளைக் கோவில்களாக மாற்றியவனும் இவனே.,7
பல்லவர்_வரலாறு,இவன் காலத்திற்றான் பல்லவர் சாளுக்கியர் போர் உச்சநிலை அடைந்தது.அப்போராட்டம் இவனுக்குப்பின் ஆண்டுகள் வரை ஓய்ந்திலது.,12
பல்லவர்_வரலாறு,"சிற்பம், ஓவியம், இசை, நாடகம் முதலிய நாகரிகக் கலைகள் இவனது ஆட்சியில் வளர்ச்சியுற்றன.",10
பல்லவர்_வரலாறு,இவன் காலத்தவரே அப்பர் சுவாமிகள்.,4
பல்லவர்_வரலாறு,இரண்டாம் புலிகேசி இவன் சாளுக்கியப் பேரரசன் கி.பி.,7
பல்லவர்_வரலாறு,அறுநூற்று பத்து இல் சாளுக்கிய அரியணை ஏறினான்.,6
பல்லவர்_வரலாறு,மயூரர் முதலிய சிற்றரசரை அடக்கிப் பேரரசை நிலைநாட்டச் சில ஆண்டுகள் ஆயின.,9
பல்லவர்_வரலாறு,அவன் அங்குக் கி.பி.முதல் ஆளத்தொடங்கினான் என்னலாம்.,7
பல்லவர்_வரலாறு,புலிகேசி வெளியிட்ட ஆய்ஹொளே கல்வெட்டுக் கி.பி.,6
பல்லவர்_வரலாறு,"அதனில், தான் வேங்கியை வென்று, பல்லவ நாட்டைத் தாக்கியதாகக் குறித்துள்ளான்.",8
பல்லவர்_வரலாறு,அப்பொழுது கிளம்பின துளியானது எதிர்க்க வந்த பல்லவ வேந்தன் ஒளியை மங்கச் செய்தது.,10
பல்லவர்_வரலாறு,புலிகேசியின் பெரும் படைக் கடலைக் கண்டு காஞ்சி அரசன் காஞ்சிபுரக் கோட்டைக்குள் புகுந்து கொண்டான் இரண்டு என்று கூறுகிறது.,14
பல்லவர்_வரலாறு,"இரண்டாம் நந்திவர்ம பல்லவன் வெளியிட்ட காசக்குடிப் பட்டயம், மகேந்திரன் தன் பகைவரைப் புள்ளலூரில் அழித்தான் என்று குறிக்கிறது.",13
பல்லவர்_வரலாறு,"மூன்று காசக்குடிப் பட்டயம் சாளுக்கியர் பெயரைக் குறிப்பிடாவிடினும், வரலாற்று ஆசிரியர் அனைவரும் பகைவர் என்றது சாளுக்கியரை என்றே கொண்டுள்ளனர்.",14
பல்லவர்_வரலாறு,"எனவே, காசகுடிப்பட்டயத்தில் கூறியுள்ள செய்தி மகேந்திரன் புலிகேசி போரேயாகும் என்பதில் ஐயமில்லை.",9
பல்லவர்_வரலாறு,இப்பட்டயங்களில் ஒவ்வொன்றும் தன் அரசன் வென்றதாகவே கூறுகிறது.,6
பல்லவர்_வரலாறு,"மேலும், புலிகேசியினது ஆட்சியில் பல்லவநாடு அவன் கைப்பட்டதாகவும் தெரியவில்லை.",7
பல்லவர்_வரலாறு,புலிகேசியும் பல்லவப் பணியைப் போக்கும் கடுங் கதிரவனாய்ச் சேர சோழ பாண்டியரைக் களிப்புறச் செய்தான் என்று கூறுகிறது.,13
பல்லவர்_வரலாறு,திடீரென அவனை வளைத்துக்கொண்டு போரிட்டுப் பகைவரை அழித்தான்.,6
பல்லவர்_வரலாறு,இதுவே நடந்த செய்தி என்பதை இரண்டு பட்டயங்களையும் கூர்ந்து கவனிப்பவர் நன்குணரலாம்.,9
பல்லவர்_வரலாறு,மேலும் மகேந்திரன் மகனான நரசிம்மவர்மனது ஆட்சியில் இப் புலிகேசியே இரண்டாம் முறைபடையெடுத்து வந்தான் என்பது காணப்படுகிறது.,12
பல்லவர்_வரலாறு,நான்கு புள்ளலூர் என்பது பல்லவர் பட்டயத்தில் வருதல்போலச் சாளுக்கியர் கல்வெட்டில் வருதல் இல்லை.,10
பல்லவர்_வரலாறு,"எனவே, துர்விநீதனும் புலிகேசியுடன் சேர்ந்து மகேந்திரனுடன் போரிட்டனன் என்பது புலனாகிறது.",8
பல்லவர்_வரலாறு,கங்கன் போரிடக் காரணம் என்ன?,4
பல்லவர்_வரலாறு,இதற்கு விடை கங்கர் கல்வெட்டே கூறுகிறது.,5
பல்லவர்_வரலாறு,விஷ்ணுவர்த்தனன் மகன் இரண்டாம் புலிகேசிக்குத்தம்பிமகன் கங்க துர்விநிதனுக்குமகள்வயிற்றுப்பேரன்.,6
பல்லவர்_வரலாறு,இப்போர்கள் ஒன்றில் துர்விநீதன் படைத்தலைவனை மடித்திருத்தல் வேண்டும்.,6
பல்லவர்_வரலாறு,இத் தோல்விக்குப்பிறகே கங்கரும் சாளுக்கியரும் தம் முயற்சியைக் கைவிட்டு ஓடினராதல் வேண்டும்.,9
பல்லவர்_வரலாறு,சமணமும் சைவமும் மகேந்திரவர்மன் முதலில் சமணனாக இருந்து பின் சைவன் ஆனவன் என்று பெரியபுராணம் கூறுகின்றது.,12
பல்லவர்_வரலாறு,இதனையே அவனது திருச்சிராப்பள்ளி மலைக்கோயில் கல்வெட்டும் கூறுகின்றது.,6
பல்லவர்_வரலாறு,"இவன் வல்லம், தனவானூர், சீயமங்கலம், பல்லாவரம், திருச்சிராப்பள்ளி முதலிய இடங்களில் சிவன் கோயில்களையும், மகேந்திரவாடியில் பெருமாள் கோவிலையும் அமைந்துள்ளான்.",14
பல்லவர்_வரலாறு,இவை அனைத்தும் இவன் சமனானாக இருந்து செய்திருத்தல் இயலாது.,7
பல்லவர்_வரலாறு,இவ்வேலை நடைபெறச் சில ஆண்டுகள் ஆகி இருக்கலாம்.,6
பல்லவர்_வரலாறு,"எனவே, இவன்சுமார், கி.பி.",4
பல்லவர்_வரலாறு,அறுநூற்று இருபது இல் சமணத்தை விட்டுச் சைவனாகி இருக்கலாம்.,7
பல்லவர்_வரலாறு,இவன் சமணனாக இருந்தபொழுது சமணர் சொற்கேட்டு அப்பர்க்குப் பலகொடுமைகள் இழைத்தான்.,8
பல்லவர்_வரலாறு,"இறுதியில் இவன்சைவன் ஆனதும், குடிகள் சைவராக மாறியதில் வியப்பில்லை அன்றோ?",8
பல்லவர்_வரலாறு,"எனவே, தொண்டை நாட்டில், அதுகாறும் உயர்நிலையில் இருந்த சமணம் இழிநிலை உற்றது சைவ சமயம் வளர்ச்சி அடையத் தொடங்கியது.",14
பல்லவர்_வரலாறு,அரசனே திருப்பாதிரிப்புலியூரில் இருந்த சமணப் பள்ளிகளையும் பாழிகளையும் இடித்து.,7
பல்லவர்_வரலாறு,மகேந்திரன் காலத்தில் தொண்டை நாட்டுச் சைவநிலையை என்னென்பது மகேந்திரன் ஆட்சிதொண்டை நாட்டோடு நின்றதில்லை அன்றோ?,11
பல்லவர்_வரலாறு,"அது புதுக்கோட்டைவரை பரவி இருந்ததால், பல்லவ நாடு முழுவதும் சைவ சமய வளர்ச்சி.",10
பல்லவர்_வரலாறு,இவன் காலத்தரசர் பல்லவர்க்குக்கொடிய பகைவரான மேலைச் சாளுக்கியர் கிருஷ்ணையாறு வரை ஆண்டு வந்தனர்.,10
பல்லவர்_வரலாறு,சாளுக்கியர் படையெடுப்பால் நாட்டை இழந்த கதம்பர் சிற்றரசராக இருந்தனர்.,7
பல்லவர்_வரலாறு,இவர்கட்குத் தெற்கே இற்றை மைசூர்ப் பகுதியைக் கங்கர் ஆண்டு வந்தனர்.,8
பல்லவர்_வரலாறு,அவர் தலைநகரம் தழைக்காடு என்பது.,4
பல்லவர்_வரலாறு,வடக்கே கோதாவரிக்கும் கிருஷ்ணையாற்றிற்கும் இடையில் கீழைச் சாளுக்கியர் ஆண்டு வந்தனர்.,8
பல்லவர்_வரலாறு,தெற்கே பாண்டியர் வன்மையுடன் ஆண்டு வந்தனர்.,5
பல்லவர்_வரலாறு,"பாண்டிய நாடடிற்கும் பல்லவர் நாட்டிற்கும் இடையே சோழர், களப்பிரர் என்போர் சிற்றரசர்களாக இருந்து சில ஊர்களை ஆண்டு வந்தனர்.",14
பல்லவர்_வரலாறு,களப்பிரர் ஒருகால் பல்லவரையும் மற்றொருகால் பாண்டியரையும் தழுவிக் காலத்திற்கு ஏற்றாற்போல் வாழ்ந்து வந்தனர்.,10
பல்லவர்_வரலாறு,சோழருள் ஒருபிரிவினர் பல்லவர் துணையால் வடக்கே சென்று கடப்பை கர்நூல் தோட்டங்களைச் சிற்றரசராக இருந்து ஆண்டு வந்தனர்.,13
பல்லவர்_வரலாறு,அவர்கள் தம்மை ரேநாண்டுச் சோழர்கரிகாலன் மரபினர் என்று கல்வெட்டுகளிற் கூறிக் கொண்டனர்.,9
பல்லவர்_வரலாறு,ஒன்பது ஆந்திர அரசர் தெலுங்கு நாட்டின் சில பகுதிகளை ஆண்டனர்.,8
பல்லவர்_வரலாறு,குண்டுர்க் கோட்டத்தையும் அதற்கு வடக்கே உள்ள கடற்கரை வெளியையும் பீமவர்மன் மரபினர் ஆண்டு வந்தனர்.,11
பல்லவர்_வரலாறு,இங்ஙனம் சிற்றரசர் பலர் மகேந்திரன் நாடடில் இருந்தனர்.,6
பல்லவர்_வரலாறு,கோவில் அமைப்பு மகேந்திரன் கோவில்களைக் கண்டவுடன் எளிதில் இவை மகேந்திரன் கட்டியவை எனக் கூறிவிடலாம்.,11
பல்லவர்_வரலாறு,இக்கோவில்கள் அனைத்தும் மலைச் சரிவுகளில் குடைந்து தஅமைத்தவை.,6
பல்லவர்_வரலாறு,"இவை மலை உச்சியினும் இரா, அடியிலும் இரா, இடையிற்றான் இருக்கும்.",8
பல்லவர்_வரலாறு,"இத்தகைய இடத்தில் ஒரு கோவிலைக் குடையும்பொழுது, ஆங்குத் துண்களையும் சுவர்களையும் மூர்த்தங்களையும் செய்வதற்காக இடம்விட்டு, மிகுந்த இடமே குடையப்பட்டிருக்கும்.",14
பல்லவர்_வரலாறு,சதுரத்தில் தாமரை மலர் செதுக்கப்பட்டிருக்கும்.,4
பல்லவர்_வரலாறு,தூண்களின் புறங்களில் மகேந்திரன் பட்டப்பெயர்கள் பல செதுக்கப் பட்டிருக்கும்.,7
பல்லவர்_வரலாறு,துணின் போதிகை சதுரக் கற்பலகையால் இயன்றது.,5
