work_title,sentence,sentence_length
பாப்பா_முதல்_பாட்டி_வரை,"பவுடர் பாலில் உப்புத் தன்மை அதிகம் என்பதால், குழந்தையின் சிறுநீரகங்கள் பாதிக்கப்படுவதற்கு வாய்ப்புகள் அதிகம்.",11
பாப்பா_முதல்_பாட்டி_வரை,"புட்டிப்பால் சரியாக ஜீரணிக்காது, அதில் உள்ள புரதச்சத்து காரணமாக, ஒவ்வாமை ஏற்படும்.",9
பாப்பா_முதல்_பாட்டி_வரை,"சளி, காய்ச்சல், உடல் பருமன் ஆகியவற்றுக்குப் புட்டிப் பால் வழி வகுத்துவிடும்.",9
பாப்பா_முதல்_பாட்டி_வரை,"வேலைக்குச் செல்லும் பெண்கள் குழந்தை பிறந்து முதல் நான்கு மாதம் லீவு எடுத்துவிட்டு, தாய்ப்பால் மட்டுமே கொடுக்க வேண்டும்.",14
பாப்பா_முதல்_பாட்டி_வரை,"அதன் பின்னர் பாலைப் பீய்ச்சி எடுத்து, வீட்டில் உள்ளோர் மூலம் கொடுக்கலாம்.",9
பாப்பா_முதல்_பாட்டி_வரை,"﻿பீய்ச்சி எடுக்கும் பால், அறை வெப்ப நிலைக்கு, ஆறு மணி நேரத்துக்குக் கெட்டுப்போகாது.",10
பாப்பா_முதல்_பாட்டி_வரை,"ஆறு மாதம் ஆனவுடன், குழந்தைக்குத் தாய்ப் பாலுடன், இணை உணவு கொடுக்கத் தொடங்க வேண்டும்.",11
பாப்பா_முதல்_பாட்டி_வரை,வீட்டு உணவை மட்டுமே கொடுக்க வேண்டும்.,5
பாப்பா_முதல்_பாட்டி_வரை,"மசித்த உணவுகள், காய்கறிகள், பழங்கள், சாதம், இட்லி ஆகியவை கொடுக்கலாம்.",8
பாப்பா_முதல்_பாட்டி_வரை,கொஞ்சம் கொஞ்சமாக இவற்றைக் கொடுக்க வேண்டும்.,5
பாப்பா_முதல்_பாட்டி_வரை,"குழந்தையின் கழுத்து நிற்காவிட்டால் குழந்தை பிறந்தது முதல், மூளை வளர்ச்சித் திறனைக் கண்காணித்துக் கொண்டே இருக்க வேண்டும்.",13
பாப்பா_முதல்_பாட்டி_வரை,பிறந்தது முதல் ஓராண்டுக்கு தலையின் சுற்றளவு எடுக்க வேண்டும்.,7
பாப்பா_முதல்_பாட்டி_வரை,"அந்தந்த மாதங்களில், குழந்தை செய்ய வேண்டியதைச் செய்கிறதா என்பதைப் பார்க்க வேண்டும்.",9
பாப்பா_முதல்_பாட்டி_வரை,நான்கு மாதங்களுக்குள் கழுத்து நிற்க வேண்டும்.,5
பாப்பா_முதல்_பாட்டி_வரை,"குழந்தையைப் படுக்க வைத்து மேலே நேராகப் பொம்மையை அசைத்து, தாய் பயிற்சி அளித்தால், கழுத்து நிற்க ஆரம்பித்து விடும்.",14
பாப்பா_முதல்_பாட்டி_வரை,"பயிற்சி அளித்தும் கழுத்து நிற்காவிட்டால், மருத்துவரின் ஆலோசனை பெறுவது நல்லது.",8
பாப்பா_முதல்_பாட்டி_வரை,"குழந்தையின் கால்கள் பின்னிப் பிணைந்திருந்தால் குழந்தையின் கால்கள் பின்னிப் பிணைந்திருந்தால், அடிக்கடி இடுப்பில் தூக்கி வைத்திருந்தால் சரியாகி விடும்.",14
பாப்பா_முதல்_பாட்டி_வரை,அடுக்குமாடிக் குழந்தைகளுக்கு என்ன நோய்?,4
பாப்பா_முதல்_பாட்டி_வரை,"அடுக்குமாடிக் குடியிருப்புகளில் வசிப்போர், தங்களது குழந்தைகளை வீட்டுக்கு உள்ளேயே வைத்திருந்தால், அவர்களது உடலில் சூரியஒளி படாத நிலை ஏற்படும்.",14
பாப்பா_முதல்_பாட்டி_வரை,"இதனால் எலும்பு வளர்ச்சிக்குத் தேவையான வைட்டமின் ﻿ டி பற்றாக்குறை ஏற்பட்டு, கால் கோணலாக இருக்க வாய்ப்புகள் உண்டு.",14
பாப்பா_முதல்_பாட்டி_வரை,"எனவே தினமும் குறைந்தபட்சம் அரை மணி நேரமாவது, குழந்தைகளின் உடலில் வெயில் படும்படிச் செய்ய வேண்டும்.",12
பாப்பா_முதல்_பாட்டி_வரை,"விளையாட்டுக் கல்வியே சிறந்தது நான்கு வயதுக்குள், குழந்தையை எழுதச் சொல்லி நிர்ப்பந்தித்தல் கூடாது.",10
பாப்பா_முதல்_பாட்டி_வரை,குழந்தை தானாகவே எழுதினால் தப்பில்லை.,4
பாப்பா_முதல்_பாட்டி_வரை,ஆறு வயது வரை விளையாட்டு முறைக் கல்வியே சிறந்தது.,7
பாப்பா_முதல்_பாட்டி_வரை,விளையாட்டு முறைக் கல்வி காரணமாக மூளைத் திறன் வளரும்.,7
பாப்பா_முதல்_பாட்டி_வரை,"﻿சோதனைக் குழாய் உருவாக்கும் குழந்தைகள் மக்கள்தொகை அதிகரித்துக் கொண்டிருந்தாலும், ஒரு குழந்தைக்குக்கூட தாயாக முடியாமல் ஏங்கித் தவிப்பவர்கள் ஏறாளம்.",14
பாப்பா_முதல்_பாட்டி_வரை,இதனால் தாம்பத்ய வாழ்க்கையில் மிகவும் பாதிக்கப்படுபவர்கள் பெண்களே.,6
பாப்பா_முதல்_பாட்டி_வரை,"அறிவியலின் வளர்ச்சி காரணமாக, குழந்தை பெறும் விஷயத்தில் முடியாதவை பல, இந் நாளில் முடியும் என்ற நிலைக்கு வந்துள்ளன.",14
பாப்பா_முதல்_பாட்டி_வரை,"சோதனைக் குழாய் முறையில் பெரும் செலவில் கருவை வளர்த்து, குழந்தைப் பேற்றைக் கொடுப்பது.",10
பாப்பா_முதல்_பாட்டி_வரை,"அதற்காக, அதிக செலவில் சோதனைக் குழாய்க் கூடம் ஆகியவை அவசியம்தானா?",8
பாப்பா_முதல்_பாட்டி_வரை,பதிலாகக் குழந்தைகளைத் தத்து எடுத்துக் கொள்ளலாமே எனக் கூறுகின்றனர்.,7
பாப்பா_முதல்_பாட்டி_வரை,"தத்து எடுப்பது பெருகிவிட்டால், குழந்தை பெற்றுக் கொடுக்கக் கூடிய தம்பதியினர், இதனை ஒரு வியாபாரமாக ஆக்கிவிடக் கூடும்.",13
பாப்பா_முதல்_பாட்டி_வரை,"சோதனைக் குழாய் முறையில் ஒரு தம்பதியிக்குக் குழந்தை அளிப்பதன் மூலம், அவர்களது வாழ்வை முழுமையடையச் செய்ய முடிகிறது.",13
பாப்பா_முதல்_பாட்டி_வரை,மறைந்த டாக்டர் ஸ்டெப்போ ﻿குழுவினரின் முயற்சியால் பிறந்த அக் குழந்தையின் பெயர் லூயிஸா ப்ரெளன்.,11
பாப்பா_முதல்_பாட்டி_வரை,"இயற்கைக் கருத்தரிப்பு கரு முட்டையும், ஆண் விந்துவில் உள்ள உயிர் அணுவும் இணைந்தால், கரு உண்டாகிறது.",12
பாப்பா_முதல்_பாட்டி_வரை,"மாதத்துக்கு ஒரு முறை வெளிவரும் கரு முட்டை, கரு இணைக் குழாயின் நுண்ணிய விரல்கள் போன்ற பகுதியால் உறிஞ்சப்படுகிறது.",14
பாப்பா_முதல்_பாட்டி_வரை,"நான்கு, ஐந்து நாட்களில் இந்த இணைந்த கரு, மேலும் வளர்ச்சி அடைந்து அதன் சுவரில் பதிந்து வளர ஆரம்பிக்கிறது.",14
பாப்பா_முதல்_பாட்டி_வரை,"கரு பதிய கருப்பை சாதகமாக இருந்தால் தான், கரு பதிந்து குழந்தை வளரும்.",10
பாப்பா_முதல்_பாட்டி_வரை,"கருப்பை, கருவினை ஏற்கும் நிலையில் இல்லாமல், இருந்தாலும், கரு இணைப்பு ஏற்படவில்லை என்றாலும், மாதவிடாய் வந்து விடும்.",13
பாப்பா_முதல்_பாட்டி_வரை,"கருத்தரியாமைக்குக் காரணங்கள் சில பெண்களுக்குக் கரு முட்டை, சரியாக உற்பத்தி ஆகாதால் மாதவிடாய் சரியாக வராது.",12
பாப்பா_முதல்_பாட்டி_வரை,"சிலருக்கு மாதவிடாய் சரியாய் இருந்தும், கரு முட்டை உற்பத்தி சீராக இல்லாமல் இருக்கக்கூடும்.",10
பாப்பா_முதல்_பாட்டி_வரை,மாதவிடாய் நின்றுவிட்ட பெண்களுக்குக் கருமுட்டை ﻿உற்பத்தியே இருக்காது.,6
பாப்பா_முதல்_பாட்டி_வரை,"சிலருக்கு இளம் வயதிலேயே, அதாவது இருபத்தைந்து முப்பத்தைந்து வயதுக்குள்ளேயே கருவகம் செயலிழந்துவிடுகிறது.",9
பாப்பா_முதல்_பாட்டி_வரை,இதற்கு ப்ரிமெச்சூர் ஒவேரியன் ஃபெயிலியா் என்று பெயா்.,6
பாப்பா_முதல்_பாட்டி_வரை,கருப்பையின் கீழே சிறிய வாய் போன்ற பாகம் சர்விக்ஸ் எனப்படுகிறது.,8
பாப்பா_முதல்_பாட்டி_வரை,"இதே திரவம் சில காரணங்களால் கெட்டியாகவும், எதிர்ப்பு சக்தி நிறைந்தும் இருந்தால், கரு இணைவதைத் தடுத்து விடுகிறது.",13
பாப்பா_முதல்_பாட்டி_வரை,இந்த அளவிருந்து குறைந்து காணப்படும் உயிர் அணுக்கள் கருத்தரிப்பைத் தாமதிக்கும்.,8
பாப்பா_முதல்_பாட்டி_வரை,"சில தம்பதியருக்கு, எவ்விதக் குறைபாடும் இல்லாமலேயே கருத்தரிப்பு நிகழாமல் இருக்கக்கூடும்.",8
பாப்பா_முதல்_பாட்டி_வரை,"கரு இணைக் குழாயில் கருமுட்டை நுழைய வாய்ப்பு இல்லாமல் போவதே, பெரும்பாலும் இதற்குக் காரணம்.",11
பாப்பா_முதல்_பாட்டி_வரை,"இம் மாதிரி விவரிக்க இயலாத மலட்டுத் தன்மை உள்ள பெண்கள், எப்போது வேண்டுமானாலும் கருத்தரிக்க வாய்ப்புண்டு.",12
பாப்பா_முதல்_பாட்டி_வரை,ஆனால் நாற்பது வயதுக்கு மேல் கருத்தரிக்கும் வாய்ப்புக் குறைந்து விடும்.,8
பாப்பா_முதல்_பாட்டி_வரை,"எதிர்ப்புச் சக்திகள் ஆணின் விந்து அணுக்களுக்கு எதிராகப் பெண்ணின் உடலில், எதிர்ப்புச் சக்தி ஏற்படும்.",11
பாப்பா_முதல்_பாட்டி_வரை,"ஆணின் உடலில், ஆணின் விந்து அணுக்களுக்கே எதிராகச் ﻿செயல்படும் எதிர்ப்புச் சக்தி ஏற்பட வாய்ப்பு உண்டு.",12
பாப்பா_முதல்_பாட்டி_வரை,இதனால் கரு தங்காமல் போகலாம்.,4
பாப்பா_முதல்_பாட்டி_வரை,"மீறி கரு நின்றாலும், கருப்பையில் பதிந்து வளராமல் இருக்க வாய்ப்பு உண்டு.",9
பாப்பா_முதல்_பாட்டி_வரை,"கரு பதிந்து வளர்ந்தாலும், உயிரற்ற கரு மட்டும் வளர்வதற்கும் வாய்ப்புகள் உண்டு.",9
பாப்பா_முதல்_பாட்டி_வரை,"கருப்பை வாயில் சுரக்கும் திரவத்திலும், கரு முட்டை இருக்கக்கூடிய திரவத்திலும், இந்த எதிர்ப்புச் சக்தி அதிகம் காணப்படுகிறது.",13
பாப்பா_முதல்_பாட்டி_வரை,எல்லோருக்கும் இந்த எதிர்ப்புச் சக்தி இருக்கும் என்று பயப்படத் தேவை இல்லை.,9
பாப்பா_முதல்_பாட்டி_வரை,எதிர்ப்புச் சக்தி இருப்பதை ரத்தப் பரிசோதனை மூலம் முறியடித்து விடலாம்.,8
பாப்பா_முதல்_பாட்டி_வரை,ஆண் அணுக்களையும் கரு முட்டையும் மருத்துவ ரீதியில் வெளியே இணைத்து கருவினைக் கருப்பையில் செலத்துவதுதான் டெஸ்ட் டியூப் முறை.,14
பாப்பா_முதல்_பாட்டி_வரை,"இணைக்கப்பட்ட கரு, கருப்பையின் சுவரில் பதிந்து வளர ஆரம்பித்து விடும்.",8
பாப்பா_முதல்_பாட்டி_வரை,ஒரு பெண்ணின் கருவகத்தில் சாதாரணமாக மாதமொன்றுக்கு ஒரு கரு முட்டைதான் உருவாகும்.,9
பாப்பா_முதல்_பாட்டி_வரை,டெஸ்ட் டியூப் முறையில் பல கரு முட்டைகள் தேவை.,7
பாப்பா_முதல்_பாட்டி_வரை,"﻿ஊசி, மருந்து, மாத்திரைகள் மூலம் பெண்ணின் கருவகத்தில் பல கரு முட்டைகளை உற்பத்தி செய்ய முடியும்.",12
பாப்பா_முதல்_பாட்டி_வரை,இதனால் கருத்தரிக்கும் வாய்ப்பு கூடுகிறது.,4
பாப்பா_முதல்_பாட்டி_வரை,"சோதனைக் குழாய் முறையில் கரு, கருப்பையில் பதிந்து வளர்வது இருபது முதல் முப்பது சதவீதமாக உள்ளது.",12
பாப்பா_முதல்_பாட்டி_வரை,தற்போது பெண் குழந்தைகள் அதிக அளவில் பிறப்பதாகச் சொல்லப்படுகிறதே?,7
பாப்பா_முதல்_பாட்டி_வரை,"பெண் குழந்தை பிறந்தால், பெண்ணைக் குறை கூறுவது சரியா?",7
பாப்பா_முதல்_பாட்டி_வரை,பெண் குழந்தைகளுக்குக் கருவிலேயே எதையும் தாங்கும் சக்தி உருவாகி விடுகிறது.,8
பாப்பா_முதல்_பாட்டி_வரை,"பிறந்து வளரும் நிலையில், நோயைத் தாங்கும் சக்தி ஆண் குழந்தைகளைக் காட்டிலும் பெண் குழந்தைகளுக்கு அதிகம்.",12
பாப்பா_முதல்_பாட்டி_வரை,"இந்தியாவில் ஒரு ஆண் குழந்தைக்கு மூன்று என்ற விகிதத்தில், பெண் குழந்தைகள் பிறக்கின்றன.",10
பாப்பா_முதல்_பாட்டி_வரை,"ஆணின் உயிர் அணுக்களில், எக்ஸ், ஒய் குரோமோசோம்கள் உள்ளன.",7
பாப்பா_முதல்_பாட்டி_வரை,"ஆனால், பெண்களுக்கு, முட்டையில் எக்ஸ் குரோமோசோம்கள் மட்டுமே இருக்கும்.",7
பாப்பா_முதல்_பாட்டி_வரை,"எக்ஸ்ஸும் ஒய்யும் சேரும் நிலையில், ஆண் குழந்தையும், எக்ஸ்ஸும் எக்ஸ்ஸும் சேரும் நிலையில் பெண் குழந்தையும் பிறக்கிறது.",13
பாப்பா_முதல்_பாட்டி_வரை,"கணவனின் குரோமோசோம்கள் தான், குழந்தை ஆணா, பெண்ணா என்பதை இயற்கையாகத் தீர்மானிக்கிறது.",9
பாப்பா_முதல்_பாட்டி_வரை,"எனவே, பெண் குழந்தை பிறந்தால், பெண்ணைக் குறை சொல்வது அர்த்தமற்றது.",8
பாப்பா_முதல்_பாட்டி_வரை,பெண்கள் அளவுக்கு ஆண்கள் தங்களைச் சோதனை செய்துகொள்ள முன் வருகிறார்களா?,8
பாப்பா_முதல்_பாட்டி_வரை,"குழந்தை பிறக்காமல் இருப்பதற்கு ஆண், பெண் கோளாறு விகிதம் சமமாகவே உள்ளது.",9
பாப்பா_முதல்_பாட்டி_வரை,"முன்னைப் போல் இல்லாமல், ஆண்கள் பெருமளவில், தாங்களாகவே, முன்வந்து சோதனை செய்துகொள்ளும் அளவுக்கு நல்ல விழிப்புணர்வு ஏற்பட்டுள்ளது.",13
பாப்பா_முதல்_பாட்டி_வரை,"வராவிட்டாலும், அவர்களைத் தற்போது மனைவிகள் விடுவதில்லை.",5
பாப்பா_முதல்_பாட்டி_வரை,"திருமணமான இரண்டு ஆண்டுகள் வரை, இயற்கையான கருத்தரிப்புக்குக் காத்திருக்கலாம்.",7
பாப்பா_முதல்_பாட்டி_வரை,"இரண்டு ஆண்டுகளுக்குள் குழந்தை பிறக்காவிட்டால், மருத்துவரை அணுகுவது நல்லது.",7
பாப்பா_முதல்_பாட்டி_வரை,சோதனைக் குழாய் முறையில் குழந்தை உருவாக்குவதில் அண்மையில் ஏற்பட்டுள்ள முன்னேற்றம் என்ன?,9
பாப்பா_முதல்_பாட்டி_வரை,மொத்தம் எத்தனை வகைகளில் சோதனைக்குழாய்க் குழந்தைகள் உருவாக்கப்படுகின்றன?,6
பாப்பா_முதல்_பாட்டி_வரை,"ஆணின் உயிர் அணுவில் அசைவோ, சுறுசுறுப்போ இல்லாமல் இருந்தால், ஒன்றும் செய்ய முடியாத நிலை இருந்து வந்தது.",13
பாப்பா_முதல்_பாட்டி_வரை,இது மலட்டுத் தன்மை உள்ள ஆண்களுக்கு ஒரு வரப்பிரசாத மாகும்.,8
பாப்பா_முதல்_பாட்டி_வரை,எந்தவித ஆண் மலட்டுத் தன்மையையும் போக்கிட முடியுமா?,6
