work_title,sentence,sentence_length
மனத்தின்_தோற்றம்,"திருப்பாதிரிப்புலியூர் இன்னும் சிறிது தொலைவில் இருந்த நிலையில், இடையிலே யிருந்த கெடிலத்தில் வெள்ளம் சீறிப் பெருக்கெடுத்தோடிய தாம்.",13
மனத்தின்_தோற்றம்,என்செய்வார் மாணிக்கவாசகர் ஆற்றில் வெள்ளம் தணிவது எப்போது?,6
மனத்தின்_தோற்றம்,வெள்ளத்தின் அளவும் விரைவும் மிகக் கடுமையாயிருந்ததால் தெப்பமும் விடப்பட வில்லை.,8
மனத்தின்_தோற்றம்,ஆற்றைக் கடந்து அக்கரையை அடைந்தால் அல்லவா திருப் பாதிரிப்புலியூர்த் திருக்கோயிலுக்குச் சென்று வழிபடமுடியும்?,10
மனத்தின்_தோற்றம்,மூன்று நாள்கள் இரவு பகல் பட்டினியுடன் அங்கேயே கிடந்தாராம்.,7
மனத்தின்_தோற்றம்,அப்போது இறைவன் மாணிக்கவாசகர் மேல் இரக்கங்கொண்டு ஒரு சித்தராய்த் திருவுருவந் தாங்கி அவ்விடத்தில் தோன்றி உமக்கு என்ன வேண்டும்?,14
மனத்தின்_தோற்றம்,என்று அவரைக் கேட்டாராம்.,3
மனத்தின்_தோற்றம்,நான் ஆற்றைக் கடந்து அப்பால் சென்று திருப்பாதிரிப்புலியூர்த் தேவனை வழிபடவேண்டும் அதற்கு ஏற்பாடு செய்தருளுக என்று வேண்டிக் கொண்டாராம்.,14
மனத்தின்_தோற்றம்,"உடனே சித்தர் ஆற்றை நோக்கி, ஏ கெடிலமே !",6
மனத்தின்_தோற்றம்,நகருக்குத் தெற்கே ஒடிய கெடிலம் சித்தர் கட்டளைப்படி திசைமாறி நகருக்கு வடக்கே ஒடி வழி விட்டதாம்.,12
மனத்தின்_தோற்றம்,"புரிந்து கொள்ளவில்லை யெனில், திருப்பாதிரிப் புலியூர்க் கலம்பகம் பொய்ச் செய்தி தெரிவிப்பதாக எண்ண வேண்டிவரும்.",11
மனத்தின்_தோற்றம்,"புராண நம்பிக்கையுள்ளவர்கள், மணிவாசகருக்காகத் தான் கெடிலம் திசை மாறியது இது முற்றிலும் உண்மையான வரலாறேயாகும் என அடித்துப் பேசுவர்.",14
மனத்தின்_தோற்றம்,"அங்கனமெனில், கெடிலத்தின் வரலாறு கண்ட இத்திசை மாற்றம் நடந்த காலம் எது?",9
மனத்தின்_தோற்றம்,என ஆராய வேண்டும்.,3
மனத்தின்_தோற்றம்,திருநாவுக்கரசர் கரையேறியபோது கெடிலம் திருப் பாதிரிப் புலியூருக்குத் தெற்கே ஓடியது என்பது அனைவரும் நன்கு அறிந்த செய்தி.,13
மனத்தின்_தோற்றம்,அதற்குப் பல சான்றுகளும் பலரால் காட்டப்பட்டுள்ளன.,5
மனத்தின்_தோற்றம்,நாவுக்கரசரின் காலம் கி.பி.,4
மனத்தின்_தோற்றம்,ஏழாம் நூற்றாண்டு என்பது ஆராய்ச்சியாளர் பலர்க்கும் ஒப்ப முடிந்த கருத்து.,8
மனத்தின்_தோற்றம்,"எனவே, அதன் பிறகுதான் கெடிலத்தின் திசைமாற்றம் நிகழ்ந்திருக்க வேண்டும்.",7
மனத்தின்_தோற்றம்,அடுத்துத் தொல் காப்பியத் தேவரின் காலத்தை ஆராயவேண்டும்.,6
மனத்தின்_தோற்றம்,தொல்காப்பியத் தேவர் இரட்டையர்களால் புகழ்ந்து பாடப்பெற்றுள்ளார்.,5
மனத்தின்_தோற்றம்,"இரட்டையர்கள், திருப்பாதிரிப் புவிழர் சென்றிருந்தபோது, அவ்வூர்ச் சிவன்மேல் ஒரு இலம்பகம் பாடித் தருமாறு அவ்வூரார் வேண்டினர்.",12
மனத்தின்_தோற்றம்,சிவன் மேல் கலம்பகம் வேண்டுமென்றால் தொல்காப்பியத் தேவர் பாட வேண்டும் நாம் பாடுவது இறைவனுக்கு ஏறுமோ?,12
மனத்தின்_தோற்றம்,இதிலிருந்து இரட்டையர் காலத்திற்கு முற்பட்டவர் தொல்காப்பியத் தேவர் என்பது தெளிவு.,8
மனத்தின்_தோற்றம்,"அங்ங்னமெனில், இரட்டையர் காலம் எது?",4
மனத்தின்_தோற்றம்,இரட்டையர்கள் வரபதியாட்கொண்டான் என்னும் வள்ளலைப் பாடியுள்ளனர்.,5
மனத்தின்_தோற்றம்,வரபதியாட்கொண்டானின் வேண்டுதலால் வில்லிபுத்துரார் பாரதம் பாடினார்.,5
மனத்தின்_தோற்றம்,வில்லிபுத்துாரார் காலத்தில் அருணகிரிநாதரும் காளமேகப் புலவரும் வாழ்ந்ததாக வரலாறு.,7
மனத்தின்_தோற்றம்,இவர்களின் காலம் பதினைந்தாம் நூற்றாண்டு.,4
மனத்தின்_தோற்றம்,"எனவே, இரட்டையர் காலம் பதினைந்து  ஆம் நூற்றாண்டு என அறியலாம்.",8
மனத்தின்_தோற்றம்,"ஆகவே, இரட்டையரால் புகழ்ந்து பாடப்பெற்ற தொல்காப்பியத் தேவர் பதினைந்து  ஆம் நூற்றாண்டிற்கும் முற்பட்டவர் என்பது புலனாகும்.",12
மனத்தின்_தோற்றம்,இரட்டையர் காலத்திலேயே தொல்காப்பியத் தேவரும் ஏன் இருந்திருக்கக் கூடாது?,7
மனத்தின்_தோற்றம்,என்பதாக இங்கே ஒர் ஐயம் தோன்றலாம்.,5
மனத்தின்_தோற்றம்,இந்தக் காலத்தில் ஒருவர் ஒரு நூல் எழுதினால் அது உடனே அச்சிடப்படுகிறது.,9
மனத்தின்_தோற்றம்,அச்சிடப்பட்ட ஒரு திங்களில் உலக முழுவதும் பரவவுஞ் செய்கிறது.,7
மனத்தின்_தோற்றம்,அந்தக் காலத்தில் ஒருவர் நூல் எழுதுவது ஒலைச் சுவடியில்தான்.,7
மனத்தின்_தோற்றம்,அது பலராலும் பலபடிகள் எடுக்கப்பட்டுப் பல ஊர்களிலும் பரவுவதற்குப் பன்னெடுநாள் ஆகும்.,9
மனத்தின்_தோற்றம்,அதன் பிறகே அந்நூலின் சிறப்பு பலராலும் அறிந்து பாராட்டப்படும்.,7
மனத்தின்_தோற்றம்,"எனவே, இரட்டையர் வாழ்ந்த பதினைந்து  ஆம் நூற்றாண்டுக்கும் முற்பட்டவர் தொல்காப்பியத் தேவர் என்று கொள்ளவேண்டும்.",11
மனத்தின்_தோற்றம்,தேவர் காலத்தைப் பதினைந்தாம் நூற்றாண்டுக்கும் பல நூற்றாண்டுகள் முன்னால் தள்ளிக்கொண்டு போகவேண்டும்.,9
மனத்தின்_தோற்றம்,பழங் காலத்தவர் என்றால் இற்றைக்கு ஆயிரம் ஆண்டாவது முற்பட்டவர்.,7
மனத்தின்_தோற்றம்,இக் கூற்றுப் பொருந்தாது.,3
மனத்தின்_தோற்றம்,"திருநாவுக்கரசர், சுந்தரர், மாணிக்கவாசகர் என மாணிக்கவாசகர் நான்காம் இடத்தைப் பெற்றுள்ளமை காண்க.",9
மனத்தின்_தோற்றம்,இவர் மற்ற மூவரினும் காலத்தால் பிற்பட்டவரா யிருந்ததனால்தான் இறுதியில் வைத்து எண்ணப்பட் டுள்ளார்.,10
மனத்தின்_தோற்றம்,"மற்றபடி, பெருமையினால் நால்வரும் ஒரு நிகரானவர்களே.",5
மனத்தின்_தோற்றம்,இந்நால்வருள் முதல் இருவராகிய திருஞானசம்பந்தரும் திருநாவுக்கரசரும் ஒரே காலத்தினர் அதாவது ஏழாம் நூற்றாண்டினர்.,10
மனத்தின்_தோற்றம்,இவ்விருவரையும் தம் நூலில் பாடியுள்ள சுந்தரர் எட்டு அல்லது ஒன்பதாம் நூற்றாண்டினராகத் துணியப்பட்டுள்ளார்.,10
மனத்தின்_தோற்றம்,"எனவே, மாணிக்கவாசகர் ஒன்பதாம் நூற்றாண்டிற்குப் பிற்பட்டவர் எனக் கொள்ள வேண்டும்.",8
மனத்தின்_தோற்றம்,"ஒன்பதாம் நூற்றாண்டிற்குப் பிற்பட்டவர் என்றால், பல நூற்றாண்டுகள் பின் தள்ளியிருக்க முடியாது ஒரிரு நூற்றாண்டுதான் பிற்பட்டிருக்க முடியும்.",13
மனத்தின்_தோற்றம்,அங்ஙனமின்றி இந்நால்வரும் அடுத்தடுத்த நூற்றாண்டுகளில் மிகப் பெரிய சைவத் தலைவர்களாக விளங்கினமையால்தான் நால்வர் என இணைத்துச் சிறப்பிக்கப் பெற்றனர்.,14
மனத்தின்_தோற்றம்,இஃது இயற்கையின் தீர்ப்பு !,3
மனத்தின்_தோற்றம்,"ஆம், மக்களின் தீர்ப்பு எனவே, பத்தாவது நூற்றாண்டினர் மாணிக்கவாசகர் என்று கொள்ளலாம்.",9
மனத்தின்_தோற்றம்,இந்தக் கருத்துக்கு எதிராக அப்பர் தேவாரத்திலிருந்து ஒர் அகச்சான்று காட்டப்படுகிறது.,8
மனத்தின்_தோற்றம்,"ஆனால், இறைவன் மாணிக்கவாசகருக்காக நரியைப் பரியாக்கிய கதை இங்கே அப்பரால் குறிப்பிடப்பட வில்லை.",10
மனத்தின்_தோற்றம்,இறைவன் எதையும் செய்யவல்ல சித்தர் என்ற கருத்திலேயே அப்பர் இதனைக் கூறியுள்ளார்.,9
மனத்தின்_தோற்றம்,"எனவே, இந்தத் தேவாரப் பகுதிக்கும் மாணிக்கவாசகர் பற்றிய கதைக்கும் இங்கே தொடர்டே யில்லை.",10
மனத்தின்_தோற்றம்,"எனவே, மணிவாசகர், தேவார ஆசிரியர் மூவருக்கும் பிற்பட்டவர் பத்தாம் நூற்றாண்டினர் என்பது போதரும்.",10
மனத்தின்_தோற்றம்,இதற்கு இன்னும் கூரான சான்று ஒன்று கொடுக்க முடியும்.,7
மனத்தின்_தோற்றம்,"நம்பி யாண்டார் நம்பியின் காலம் பதினோராம் நூற்றாண்டு என்பது, அனைவரும் எளிதில் ஒப்புக்கொண்டுள்ள உண்மை.",11
மனத்தின்_தோற்றம்,"எனவே, அவருக்கும் முற்பட்டவர் மாணிக்கவாசகர் என்பது தெளிவு.",6
மனத்தின்_தோற்றம்,"ஆகவே, மாணிக்கவாசகரின் கால்ம் பத்தாம் நூற்றாண்டு என்பதும் தெளிவு.",7
மனத்தின்_தோற்றம்,மற்றொரு வகையிலும் மாணிக்கவாசகரின் காலத்தைக் குறுக்கி நெருக்கிக்கொண்டு வரலாம்.,7
மனத்தின்_தோற்றம்,பதினோராம் நூற்றாண்டினரான நம்பியாண்டார் நம்பி பட்டினத்தாரின் பாடல்களைத் தொகுத்துள்ளார்.,7
மனத்தின்_தோற்றம்,"பட்டினத்தாரோ, மாணிக்கவாசகரைப் பாராட்டிப் பாடியுள்ளார்.",4
மனத்தின்_தோற்றம்,"எனவே, நம்பியாண்டார் நம்பிக்கும் முற்பட்ட பட்டினத்தார்க்கும் முற்பட்டவர் மாணிக்கவாசகர் என்பது புலனாகும்.",9
மனத்தின்_தோற்றம்,பத்து பதினோராம் நூற்றாண்டுகளாகிய இருநூறு ஆண்டு காலத்தில் மூன்று தலைமுறையினர் இருந்திருப்பதில் வியப்பேதுமில்லை அது நடக்கக் கூடியதே.,13
மனத்தின்_தோற்றம்,இவ்விரண்டிற்கும் உரிய மறுப்புப் பதில்களாவன மாணிக்கவாசகருக்காக ஆறு திரும்பியது என்பதை நம்பாவிட்டால் போகிறது.,10
மனத்தின்_தோற்றம்,இயற்கையாகவே ஆறு மாறிய தாக ஏற்றுக்கொள்வோம்.,5
மனத்தின்_தோற்றம்,"ஆனால், அவர் காலத்தில் இயற்கையாக ஆறு திசைமாறியிருக்கலாம் என்பதையாவது நம்பலாமே !",8
மனத்தின்_தோற்றம்,ஒன்றாவது இருந்தால் தானே ஒன்பதாகச் சொல்ல முடியும்?,6
மனத்தின்_தோற்றம்,"மாணிக்கவாசகருக்காகச் சித்தர் கட்டளையிட அதனால் கெடிலம் திசைமாறாவிட்டாலும், உண்மையில் என்ன நடந் திருக்கலாம்?",10
மனத்தின்_தோற்றம்,"மாணிக்கவாசகர் தில்லையிலிருந்து வடக்கு நோக்கி வந்து திருப்பாதிரிப்புலியூரை நெருங்கினபோது, வழியிலே கெடிலத்தில் வெள்ளம் ஒடியிருக்கலாம்.",11
மனத்தின்_தோற்றம்,அதனால் அவர் வெள்ளத்தின் வடிவை எதிர்பார்த்து அக் கரையி லேயே கடவுளை வேண்டிக் காத்திருக்கலாம்.,11
மனத்தின்_தோற்றம்,"இந்த நேரத்தில், அவ்விடத்திற்கு மேற்கே திருவயிந்திரபுரத்தில் ஆற்று வெள்ளம் பிய்த்துக் கொண்டு திசைமாறி ஓடி யிருக்கலாம்.",12
மனத்தின்_தோற்றம்,வந்துகொண்டிருந்த வெள்ளத்தின் பெரும் பகுதி மேற்கே திசைமாறி எதிர்ப்பக்கம் திரும்பியதால் மணிவாசகர் காத்துக் கொண்டிருந்த இடத்தில் தண்ணீர் குறைந்திருக்கலாம்.,14
மனத்தின்_தோற்றம்,இது மாதிரி இந்தக் காலத்திலும் நடப்பதுண்டு.,5
மனத்தின்_தோற்றம்,வேறு பக்கம் திசை மாறிய கெடிலம் அந்தப் புதுப்பாதையிலேயே தொடர்ந்து சென்றிருக்கலாம்.,9
மனத்தின்_தோற்றம்,இந்த நிகழ்ச்சி தொடர்ந்து பல நூற்றாண்டுகளாகச் செவி வழியாக மக்களிடையே அறியப்பட்டு வந்திருக்கலாம்.,10
மனத்தின்_தோற்றம்,இதைக் கேள்விபட்ட சிதம்பரநாத முனிவர் புராணத்தில் பொருந்தப் புளுகிவிட்டிருக்கலாம்.,7
மனத்தின்_தோற்றம்,"அடுத்து, மாணிக்கவாசகரை முற்பட்டவராகவும், தொல்காப்பியத் தேவரைப் பிற்பட்டவராகவும் கொள்ளுத லும் பொருந்தாது.",9
மனத்தின்_தோற்றம்,பத்தாம் நூற்றாண்டினராகிய மாணிக்க வாசகருக்குச் சில ஆண்டுகளாயினும் தொல்காப்பியத் தேவர் முற்பட்டவராகவே இருந்திருப்பார்.,10
மனத்தின்_தோற்றம்,"ஏன், இரு வரையும் ஒரு காலத்தில் வாழ்ந்தவராகக் கூடக் கூறலாமே !",8
மனத்தின்_தோற்றம்,தொல்காப்பியத் தேவர் வயதில் மூத்தவராயிருந்து முன்னால் காலமாகி யிருக்கலாம் மாணிக்கவாசகர் வயதில் இளையவராயிருந்து பின்னால் காலமாகி யிருக்கலாம்.,13
மனத்தின்_தோற்றம்,திருப்பாதிரிப்புலியூர்க்குத் தெற்கே கெடிலம் ஓடியதாக எழுதிய தொல்காப்பியத் தேவர் காலமான சில ஆண்டுகளில் கெடிலம் திசை மாறியிருக்கலாமே !,13
மனத்தின்_தோற்றம்,"சிலர், வேறொரு காரணங் காட்டியும் தொல்காப்பியத் தேவரின் காலத்தைப் பின்னுக்குத் தள்ள முயலலாம்.",10
மனத்தின்_தோற்றம்,ஆளுடைய பிள்ளையார் திருக்கலம்பகம் நம்பி யாண்டார் நம்பி இயற்றியது.,7
மனத்தின்_தோற்றம்,அவர் பதினோராம் நூற்றாண்டினர்.,3
மனத்தின்_தோற்றம்,"இவ்வகையில் பார்க்குங்கால், மாணிக்கவாசகருக்குச் சிலவாண்டுகளாயினும் முற்பட்டவர் தொல்காப்பியத் தேவர் என்று கூறமுடியுமே.",9
மனத்தின்_தோற்றம்,"மேலும், தேவர் என்னும் பட்டப் பெயரைப் பார்க்கும் போது, இவர் சமணராயிருந்து பிறகு சைவத்திற்கு மாறினதாகத் தெரிகிறது.",13
மனத்தின்_தோற்றம்,தேவர் என்பது சமணமுனிவரைக் குறிக்கும் பெயராகும்.,5
மனத்தின்_தோற்றம்,திருத்தக்க தேவரும் தோலா மொழித் தேவரும் எட்டு அல்லது ஒன்பதாம் நூற் றாண்டினராக இருக்கலாம் எனக் கூறப்படுகின்றனர்.,13
மனத்தின்_தோற்றம்,அவர்கள் காலத்தையொட்டியவராகத் தொல்காப்பியத் தேவரையும் கொள்ளலாம்.,5
மனத்தின்_தோற்றம்,புத்த மதங்களைப் பின்பற்றியிருந்தவர்கள் சைவத்திற்கு மாறினதும் அறிந்த செய்திகளே.,7
