work_title,sentence,sentence_length
மனத்தின்_தோற்றம்,பெரும் பாலும் அவை இப்போது மறைந்து விட்டன.,6
மனத்தின்_தோற்றம்,இசை மரபு என்ற நூலை மறப்பதற்கில்லை.,5
மனத்தின்_தோற்றம்,"இது காறும் கூறியவற்றால், முத்தமிழ் வளர்ச்சிக்கும் இலக்கணப் புலவர்கள் கொடுத்துள்ள கொடைமிகுதி என்பது தெள்ளிதின் புலனாகும்.",12
மனத்தின்_தோற்றம்,தமிழ் வளர்ச்சிக்கு மொழியியலாரின் பங்கு தமிழ் வளர்ச்சிக்கு மொழியியலாரின் பங்கும் சிறிது உண்டு.,10
மனத்தின்_தோற்றம்,அப்பங்கை ஆராய்வதற்கு முன் எந்தத் தமிழ் வளர்ச்சிக்கு? என்னும் வினாவிற்கு விடை காணல் வேண்டும்.,11
மனத்தின்_தோற்றம்,ஒரு வேடிக்கைக் கதை உண்டு.,4
மனத்தின்_தோற்றம்,நோயாளி ஒருவன் சாகுந்தறுவாயில் இருந்தபோது அவன் உயிரைப் பிடிக்க எமன் சென்றானாம்.,9
மனத்தின்_தோற்றம்,என்று நோயாளி கேட்டானாம்.,3
மனத்தின்_தோற்றம்,நான் எமன் என்ற பதில் வந்தது.,5
மனத்தின்_தோற்றம்,"உடனே நோயாளி, நீ பழைய எமனா?",5
மனத்தின்_தோற்றம்,என்று வாளா திரும்பி விட்டானாம்.,4
மனத்தின்_தோற்றம்,மொழியியலாரின் அடிப்படை நோக்கம் நல்லதே.,4
மனத்தின்_தோற்றம்,தமிழை வளர்க்க வேண்டும் என்னும் நல்லெண்ணம் கொண்டவர்களே அவர்கள்.,7
மனத்தின்_தோற்றம்,பழையன கழிதலும் புதியன புகுதலும் வழுவல கால வகையி னானே எனப் பவணந்தி முனிவர் நன்னு லில் கூறியுள்ளார்.,14
மனத்தின்_தோற்றம்,புதுமையைப் புகுத்துபவர்கள் தங்கள் கொள்கைக்கு அரணாக இந்தக் கருத்தைக் கூறுகின்றனர்.,8
மனத்தின்_தோற்றம்,"ஆனால், இங்கே, பழைய காலைத் தூர்க்காதே புதிய காலை விடாதே என்னும் பழமொழி இருப்பதையும் நினைவுசெய்துகொள்ளல் வேண்டும்.",13
மனத்தின்_தோற்றம்,"கால் என்றால், நீரோடும் வாய்க்கால்.",4
மனத்தின்_தோற்றம்,முன்னைப் பழம்பொருட்கு முன்னைப் பழம்பொரு பின்னைப் புதுமைக்கும் பேர்த்தும் அப்பெற்றியனே. என்பது மாணிக்கவாசகரின் திருவாசகப் பகுதி.,12
மனத்தின்_தோற்றம்,பழமையைக் கழித்துப் புதியன புகுத்தும் பயனுள்ள நல்ல பணி இன்றைய மொழியியலாரால் இப்போது மட்டும் செய்யப்படவில்லை.,12
மனத்தின்_தோற்றம்,இரண்டாயிரம் மூவாயிரம் ஆண்டு களாகவே இந்தப் பணி முன்னோரால் செய்யப்பட்டு வந்துள்ளது.,9
மனத்தின்_தோற்றம்,எடுத்துக்காட்டுகள் ஆவிரை என்ற சொல்லைக் குறிப்பிட்டுத் தொல் காப்பியர் புணர்ச்சி விதி கூறியுள்ளார்.,10
மனத்தின்_தோற்றம்,நன்னூலார் இச் சொல்லைக் குறிப்பிடவில்லை.,4
மனத்தின்_தோற்றம்,தொல்காப்பியர் சொல்லாத பதவியலை நன்னூலார் நன்னூலில் புகுத்தியுள்ளார்.,6
மனத்தின்_தோற்றம்,எகர ஒகரம் புள்ளியொடு நிற்கும் எனத் தொல்காப்பியர் சொன்னதை நன்னூலார் சொல்லவில்லை.,9
மனத்தின்_தோற்றம்,தொல்காப்பியரையே எடுத்துக் கொள்வோமே இப்படியெல்லாம் முன்னோர்கள் கூறியுள்ளார்கள் எனப் பல இடங்களில் குறிப்பிட்டுள்ளார்.,10
மனத்தின்_தோற்றம்,இப்போதைய மொழியியலார் இப்போது வழக்கில் இல்லாததை நீக்கிப் புதிய வழக்கைப் புகுத்துகின்றனர்.,9
மனத்தின்_தோற்றம்,"எனவே, தொல் காப்பியரையும் அந்தக் காலத்துப் புதிய மொழியலார் என்று கூறலாம்.",9
மனத்தின்_தோற்றம்,ஒரோஒர் எடுத்துக் காட்டு வருமாறு மக்கள் பனைமரத்தின் பூவைப் பனம்பூ என்கின்றனர்.,9
மனத்தின்_தோற்றம்,ஆனால் பனம் என ஒரு சொல் கிடையாது.,6
மனத்தின்_தோற்றம்,இதோடு பூ சேரும் போது பனம்பூ என்றாகிறது.,6
மனத்தின்_தோற்றம்,காய் என்பது சேரின் பனங்காய் என ம் என்பது ங் எனத் திரிகிறது.,10
மனத்தின்_தோற்றம்,பனை பூ என்னும் பழைய இயற்கையான சொற்களை மக்கள் பனம்பூ எனத் திரித்துப் பேசினர்.,11
மனத்தின்_தோற்றம்,இவ்வாறு எண்ணற்ற எடுத்துக் காட்டுகள் தர முடியும்.,6
மனத்தின்_தோற்றம்,இதுகாறும் இவ்வளவு கூறவேண்டியதின் காரண மாவது புதிய தமிழ் என்னும் பெயர் பலரைப் புண் படுத்துவதேயாகும்.,12
மனத்தின்_தோற்றம்,இப்போது இது பற்றித் தமிழ் அறிஞர்களிடையே கடுமையான கார சாரமான கருத்து வேற்றுமை நிலவி வருகிறது.,12
மனத்தின்_தோற்றம்,"மொழியியல் என்னும் பாடம் படித்துப்பட்டம் பெற்றவர்கள், அப்பட்டம் பெறாதவர்களை மிகவும் மட்டமாக மதிக்கிறார்கள்.",10
மனத்தின்_தோற்றம்,இதற்கு எவ்வளவோ சான்றுகள் உண்டு.,4
மனத்தின்_தோற்றம்,முன்னோர்கள் செய்தது இப்படித்தானே.,3
மனத்தின்_தோற்றம்,தமிழ் வளர்ச்சிக்கு மொழியியலாரின் பங்கு என்னும் தலைப்பில் இந்தச் செய்திகளை யெல்லாம் ஆராய வேண்டியது மிகவும் இன்றியமையாதது.,13
மனத்தின்_தோற்றம்,இங்கே இதை ஒதுக்கிவிடலாகாது.,3
மனத்தின்_தோற்றம்,என்னும் முதுகலைப்பட்டமும் உண்டு.,3
மனத்தின்_தோற்றம்,இதற்கென நூற்றுக்கணக்கான புதிய கலைச் சொற்களை ஆங்கிலத்திலும் தமிழிலும் மொழியியலார் படித்து அறிந்து வைத்துள்ளனர்.,11
மனத்தின்_தோற்றம்,மற்றதுறைப் பாடங்களாலும் தமிழ் வளர்ச்சிக்கு ஒரு சிறிது கொடை கிடைக்காலம்.,8
மனத்தின்_தோற்றம்,"அவற்றினும், மொழியியலால் சிறிது கூடுதலாகத் தமிழ் வளர்ச்சிக்குக் கொடை கிடைக்கலாம்.",8
மனத்தின்_தோற்றம்,இன்றைய மொழியியலார் எழுத்து சொல் சொற்றொடர் இவற்றிலேயே நிற்கின்றனர்.,7
மனத்தின்_தோற்றம்,பொருளுக்குப் போவது குறைவு.,3
மனத்தின்_தோற்றம்,"எனவே, தமிழ் எழுத்துகளின் மேல் தங்கள் சினத்தைச் செலுத்தி அவற்றுள் சிலவற்றை ஒழித்துக் கட்டுவதில் முனைப்பாயுள்ளனர்.",12
மனத்தின்_தோற்றம்,இது அவர்களின் பங்குகளுள் ஒன்றாகும்?,4
மனத்தின்_தோற்றம்,இந்திய மொழிகளுள் தமிழ் மொழியில் எழுத்து குறைவு.,6
மனத்தின்_தோற்றம்,ஆங்கிலம் இருப்பத்தாறு எழுத்தில் நடை போடுகிறதாம்.,5
மனத்தின்_தோற்றம்,குறில் நெடில் தனித்தனியே இல்லாத குறையினால் நேர்வது இது போன்றது.,8
மனத்தின்_தோற்றம்,இதை நோக்கத் தமிழில் எழுத்து மிகக் குறைவே என்பது தெளிவாகும்.,8
மனத்தின்_தோற்றம்,"இங்கே, சீன மொழியின் எழுத்துப் பெருக்கத்தை ஒப்பிட்டு நோக்கின் வியப்பாயிருக்கும்.",8
மனத்தின்_தோற்றம்,தமிழில் நடைமுறை வசதிக்காக உயிர்மெய் எழுத்து படைக்கப்பட்டுள்ளது.,6
மனத்தின்_தோற்றம்,தமிழுக்கு ஏற்பப் பொறி அமைக்க முயலின் முடியுமே.,6
மனத்தின்_தோற்றம்,இப்போதுள்ள வரிவடிவங்கள் சிறார்கள் எளிதில் கற்றுக்கொள்ளும் முறையில் உள்ளன.,7
மனத்தின்_தோற்றம்,"எழுத்துச் சீர்திருத்தத்தில் மொழியியலார் மிகவும் வற்புறுத்துவது ஐ, ஒள என்னும் ஈரெழுத்துகளையும் நீக்கி விடவேண்டும் என்பதே.",12
மனத்தின்_தோற்றம்,"இவை, வேறு மொழியிலிருந்து வந்ததாகச் சிலர் உளறுவர்.",6
மனத்தின்_தோற்றம்,தொல்காப்பியத்தின் சிற்சில பகுதிகளைப் பிய்த்துப் பிய்த்துக் கல்லறைக்குள் எறிகின்றனர் சிலர்.,8
மனத்தின்_தோற்றம்,"⁠தமிழிலிருந்து வேறு மொழிகட்குப் போன எழுத்துகளும் கலைகளும், அம்மொழிகளிலிருந்து தமிழுக்குத் திரும்ப வந்தன என்று கூறக் கூடாதா?",13
மனத்தின்_தோற்றம்,"அப்பா தந்த மிட்டாய்களுள் இரண்டை, சிறுவன் மீண்டும் அப்பாவுக்குக் கொடுத்தது போன்றதாகும் இது.",10
மனத்தின்_தோற்றம்,"⁠ஐ, ஒள இரண்டனுள் ஒள என்பது புதிய வரிவடிவம் கொண்டது அல்லவே !",9
மனத்தின்_தோற்றம்,முன்பே ஒ உள்ளது.,3
மனத்தின்_தோற்றம்,இவற்றைப் பொறிகளில் பயன்படுத்தி ஒள எழுத்தைச் சரி கட்டலாமே.,7
மனத்தின்_தோற்றம்,"மற்றும், அய்யர் என்பதனினும் ஐயர் என்பதில் ஒரு வரிவடிவம் குறைவாயிற்றே.",8
மனத்தின்_தோற்றம்,"⁠ஐ, ஒள என்னும் எழுத்துகளை இந்த வரிவடிவத்தில் ஏன் படைத்துச் சேர்த்துக் கொண்டிருக்கவேண்டும்?",10
மனத்தின்_தோற்றம்,என்பதையும் ஆராய வேண்டும்.,3
மனத்தின்_தோற்றம்,ஏதோ பயன் கருதித்தானே அந்தக் காலத்தில் முன்னோர்கள் இந்த ஐ எழுத்தை அமைத்துள்ளனர்.,10
மனத்தின்_தோற்றம்,இது எழுத்தைக் குறைக்கவேண்டும் என்னும் எண்ணத்தால் ஏற்பட்ட முயற்சியே.,7
மனத்தின்_தோற்றம்,"என்பதைச் சிலர் னை என எழுதாது,, என இரண்டையும் ஒன்று போல் எழுதி விடுகின் றனர்.",12
மனத்தின்_தோற்றம்,சிலர் னன என ஒன்று போல் எழுதி விடுகின்றனர்.,7
மனத்தின்_தோற்றம்,இரண்டும் ஒத்த வரிவடிவம் உடைமையால் நேர்ந்த குறை பாடே இது.,8
மனத்தின்_தோற்றம்,இந்தக் குறைபாடு அச்சுக்கோப்பவரிடத்திலும் எதிரொலிக்கிறது.,4
மனத்தின்_தோற்றம்,"சில நேரங்களில் அவர்கள் என்பதை, எனவும், என்பதை ளள எனவும் அச்சுக்கோக் கின்றனர்.",10
மனத்தின்_தோற்றம்,இதனை அச்சுப் பிழைகள் திருத்துபவர்கள் நன்கறிவர்.,5
மனத்தின்_தோற்றம்,"இந்தக் குழப்பத்தை நீக்குவதற்கே முன்னோர்கள்,,, என்னும் வரி வடிவங்களைப் படைத்தனர்.",8
மனத்தின்_தோற்றம்,நிற்க — எழுத்துச் சீர் திருத்தம் பற்றிப் பார்த்தோம்.,7
மனத்தின்_தோற்றம்,இனிச் சில சொல்லாட்சிகளைப் பார்ப்போம் வேண்டாம் தீய செயல்களைச் செய்ய வேண்டா என எழுதுவது அந்தக் கால வழக்கு.,14
மனத்தின்_தோற்றம்,வேண்டா என்றிருந்தால் தான் வேண்டு ஆ எனப் பிரித்து ஏதாவது பொருத்தமான புணர்ச்சி விதி கூறலாம்.,12
மனத்தின்_தோற்றம்,"வேண்டாம் என்றால், வேண்டு ஆ ஆம் எனப் பிரிக்க வேண்டும்.",8
மனத்தின்_தோற்றம்,இங்கே ஆம் என்பதை என்ன என்று சொல்வது என்ற குழப்பம் நேரும்.,9
மனத்தின்_தோற்றம்,ஆம் என்பது தன்மைப் பன்மை வினைமுற்று விகுதியாகும்.,6
மனத்தின்_தோற்றம்,இங்கே அது பொருந்தாது.,3
மனத்தின்_தோற்றம்,"ஆனால், யான், இதுவரையும் வேண்டா என்று எழுதி வருகிறேன்.",7
மனத்தின்_தோற்றம்,மொழியியலார் சிலர் வேண்டாம் என்பதை எடுத்துக் கொள்ள வேண்டும் என்கின்றனர்.,8
மனத்தின்_தோற்றம்,இதற்கு இலக்கண அமைதி என்ன?,4
மனத்தின்_தோற்றம்,வேறு இல்லை உண்டு ஐம்பால் மூவிடத்தன என்பது நன்னூல் பா.,8
மனத்தின்_தோற்றம்,இவை ஐந்து பால்களுக்கும் மூன்று இடங்கட்கும் வரும் என்பது இதன் கருத்து.,9
மனத்தின்_தோற்றம்,"வேண்டும், தகும், படும் என்னும் சொற்களையும் இவ்வாறே கொள்ள லாம் என உரையாசிரியர்கள் தெரிவித்துள்ளனர்.",11
மனத்தின்_தோற்றம்,இவற் றுடன் வேண்டாம் என்பதையும் சேர்த்துக் கொள்ளலாம்.,6
மனத்தின்_தோற்றம்,"அதனால், அல்ல என்பதையும் வேறு, இல்லை, உண்டு முதலியன போல் பொதுவாக வைத்துக் கொள்ளலாம் என்கின்றனர்.",12
மனத்தின்_தோற்றம்,இதையும் வேண்டா வெறுப்பகாவாவது ஏற்றுக் கொள்ளலாம்.,5
மனத்தின்_தோற்றம்,"எல்லாரும் நாங்கள் எல்லேமும், நீங்கள் எல்லீரும், அவர்கள் எல்லாரும் என எழுதுவது விதி.",10
மனத்தின்_தோற்றம்,"எனவே, எல்லாரும் என்பதையே மூன்றிடங்கட்கும் கொள்ளலாம் என்பதையும் வேண்டா வெறுப்பாயாவது ஏற்றுக் கொள்ளலாம்.",10
மனத்தின்_தோற்றம்,"ஆறாம் வேற்றுமை உருபு எனது மகன் முருகன், எனது நண்பன் என எழுது கின்றனர் மக்கள்.",12
மனத்தின்_தோற்றம்,"திருமண அழைப்பிதழ்களில் பெரும்பாலும் எனது மகன், எனது மருகர் என்று எனது என்னும் சொல்லே பயன்படுத்தப்படுகிறது.",12
மனத்தின்_தோற்றம்,எனக்கு என்பதை வேண்டுமானால் விட்டு விடலாம்.,5
மனத்தின்_தோற்றம்,"பெரியவர் ஒருவர் ஒரு திருமண அழைப்பிதழில், எனது மகன் என்று எழுதிக் கொடுத்திருக்கிறார்.",10
மனத்தின்_தோற்றம்,உரியவர்கள் அழைப்பிதழின் கைப்படியை என்னிடம் காட்டித் திருத்தித் தரச் சொன்னார்கள்.,8
மனத்தின்_தோற்றம்,நான் எனது மகன் என்பதை என் மகன் என்று திருத்திக் கொடுத்தேன்.,9
மனத்தின்_தோற்றம்,எனது மகன் என்று எழுதாதவர்கள் மடையர்கள் என்ற அளவுக்கு நிலைமை முற்றிவிட்டிருக்கிறது.,9
மனத்தின்_தோற்றம்,மொழி யியலார் சிலரும் மடையர்களாதற்கு அஞ்சிப் போலும் எனது மகன் என்றே எழுதத் தொடங்கி விட்டனர்.,12
மனத்தின்_தோற்றம்,இது ஒரு மாணவனின் காலுக்கு உரியது.,5
மனத்தின்_தோற்றம்,"அதாவது, உடையவர் ஒருமையாயிருந்தால் இது தகும்.",5
மனத்தின்_தோற்றம்,இது போய்த் தொலைகிறது.,3
மனத்தின்_தோற்றம்,எனது மகன் என்று எழுதாதவர்கள் மடையர்களாவதால் விட்டுக் கொடுத்து விடலாம்.,8
மனத்தின்_தோற்றம்,கோவணம் கட்டாத ஊரில் கோவணம் கட்டியவன் பைத்தியக்கார னல்லவா?,7
மனத்தின்_தோற்றம்,இவ்வாறு புதியன புகுதலுக்கும் ஒர் அளவு உண்டு.,6
மனத்தின்_தோற்றம்,கண்டபடி மாற்றிக்கொண்டு போனால் மொழியே வேறாகி விடும்.,6
மனத்தின்_தோற்றம்,இந்த முயற்சியில் இறங்காதீர் என அவர்களின் திருவடிகளை வணங்கி மன்றாடிக் கேட்டுக்கொள்கிறேன்.,9
