work_title,sentence,sentence_length
மொஹெஞ்சொ-தரோ_அல்லது_சிந்துவெளி_நாகரிகம்,நகரத்தின் பல இடங்களில் இக்காலத்திய பொது இடங்கள் இக்காலத்துப் பூம்பொழில் போன்றவை இருந்தன என்று நினைப்பதற்குரிய சான்றுகள் கிடைக்கின்றன.,14
மொஹெஞ்சொ-தரோ_அல்லது_சிந்துவெளி_நாகரிகம்,ஒருநகரம் நன்முறையில் அமைந்துள்ளது.,3
மொஹெஞ்சொ-தரோ_அல்லது_சிந்துவெளி_நாகரிகம்,இவ்வசதிகள் அனைத்தும் மொஹெஞ்சொ தரோவில் இருந்தன.,5
மொஹெஞ்சொ-தரோ_அல்லது_சிந்துவெளி_நாகரிகம்,"எனவே, இந்நகர மக்கள் சிறந்த நாகரிகத்தைப் பேணிய பெருமக்கள் என்னலாம்.",8
மொஹெஞ்சொ-தரோ_அல்லது_சிந்துவெளி_நாகரிகம்,"இந்நகர ஆட்சியினர், அக்கால உலகில் இருந்த பிற நகர ஆட்சியினரைவிட மிக உயர்ந்த அறிவுடையவர் என்னல் மிகையாகாது.",13
மொஹெஞ்சொ-தரோ_அல்லது_சிந்துவெளி_நாகரிகம்,"சுகாதாரம் ஒரு பால் இருப்ப, நகரின் பல பாகங்களில் காவற்.",8
மொஹெஞ்சொ-தரோ_அல்லது_சிந்துவெளி_நாகரிகம்,"கூடங்கள் இருந்தன என்பதிலிருந்து, நகர ஆட்சியினர் நகரத்தைப் பாதுகாத்த முறையும் நன்கு விளங்கும்.",10
மொஹெஞ்சொ-தரோ_அல்லது_சிந்துவெளி_நாகரிகம்,பல பெரிய தெருக்களின் கோடிகளில் இத்தகைய காவற் கூடங்கள் அமைந்திருந்தன.,8
மொஹெஞ்சொ-தரோ_அல்லது_சிந்துவெளி_நாகரிகம்,மொஹெஞ்சொ தரோ வாணிபம் மிகுந்த நகரம் அன்றோ?,6
மொஹெஞ்சொ-தரோ_அல்லது_சிந்துவெளி_நாகரிகம்,அங்கு வணிகர் தங்குவதற்காகப் பெரிய கட்டிடங்கள் இருந்தன.,6
மொஹெஞ்சொ-தரோ_அல்லது_சிந்துவெளி_நாகரிகம்,அவற்றின் அருகில் காவற் கூடங்கள் இருந்தன.,5
மொஹெஞ்சொ-தரோ_அல்லது_சிந்துவெளி_நாகரிகம்,வாணிபப் பொருள்களைச் சேமித்து வைக்க விடுதிகள் பல இருந்தன வெளிநாட்டு வணிகரும் உள்நாட்டு வணிகரும் செல்வப்பெருக்கு உடையவர்கள்.,13
மொஹெஞ்சொ-தரோ_அல்லது_சிந்துவெளி_நாகரிகம்,நகராண்மைக் கழகத்தில் பெரும்பாலார் வணிகராகவே இருந்திருத்தல் வேண்டும்.,6
மொஹெஞ்சொ-தரோ_அல்லது_சிந்துவெளி_நாகரிகம்,பெருக்க முடைய நகரமாதலின் என்க.,4
மொஹெஞ்சொ-தரோ_அல்லது_சிந்துவெளி_நாகரிகம்,"எனவே, மொஹெஞ்சொ தரோ, ஹரப்பா போன்ற பண்டை நகரங்கள் அந்நகர மக்களின் அறிவு நுட்பத்தைக் கொண்டே அமைந்தனவாதல் வேண்டும்.",14
மொஹெஞ்சொ-தரோ_அல்லது_சிந்துவெளி_நாகரிகம்,அவர்கள் வேறெவரையும் பார்த்து நகர அமைப்பு முறையைக் கற்றுக்கொண்டனர் என்று இன்றுள்ள ஆராய்ச்சி நிலையைக்கொண்டு கூறுதல் இயலாதது.,13
மொஹெஞ்சொ-தரோ_அல்லது_சிந்துவெளி_நாகரிகம்,"ஏனெனில், அதே காலத்தில் சிறப்புற்றிருந்த எகிப்தியர், சுமேரியர் நகரங்கள் இவ்வளவு சிறப்புடையனவாக இல்லாமையே இங்ஙனம் வற்புறுத்திக் கூறுதற்குக் காரணமாகும்.",14
மொஹெஞ்சொ-தரோ_அல்லது_சிந்துவெளி_நாகரிகம்,அதே காலத்திற்றான் பாபிலோனியாவிலும் இத்திட்டம் தோன்றியது.,5
மொஹெஞ்சொ-தரோ_அல்லது_சிந்துவெளி_நாகரிகம்,எகிப்தில் உள்ள கஹுன் என்னும் நகரில் பன்னிரண்டாம் அரச பரம்பரையினர் ஆண்டகாலத்தேதான் இது போன்ற திட்டம் தோன்றியது.,13
மொஹெஞ்சொ-தரோ_அல்லது_சிந்துவெளி_நாகரிகம்,"அவர்களது நாகரிகம் சுமேரியர், ஏலத்தவர் தம் நாகரிகங்களைவிட மிகவும் உயர்ந்ததாகும்.",8
மொஹெஞ்சொ-தரோ_அல்லது_சிந்துவெளி_நாகரிகம்,"பதினொன்று , பனிரண்டு , இருபத்திரண்டு இங்ஙனம் பலமுறை அமைக்கப்பட்ட நகரம் அழிந்து மண் மேடிட்டுக் கி.பி.",12
மொஹெஞ்சொ-தரோ_அல்லது_சிந்துவெளி_நாகரிகம்,முதல் அல்லது இரண்டாம் நூற்றாண்டு வரை கவனிப்பார் அற்றுக்கிடந்தது.,7
மொஹெஞ்சொ-தரோ_அல்லது_சிந்துவெளி_நாகரிகம்,"அப்பெருமக்கள், தங்கள் கட்டிடங்கட்குச் சுட்ட செங்கற்களையும் உலர்ந்த செங்கற்களையும் பயன்படுத்தி உள்ளனர்.",9
மொஹெஞ்சொ-தரோ_அல்லது_சிந்துவெளி_நாகரிகம்,"மழை, வெயில், வெள்ளம், புயற்காற்று இவற்றுக்கு எளிதில் ஆட்படுபவை கட்டிடங்களின் புறச் சுவர்களே ஆகும்.",11
மொஹெஞ்சொ-தரோ_அல்லது_சிந்துவெளி_நாகரிகம்,"ஆதலின் அவ்வறிஞர்கள், அப்புறச் சுவர்களைச் சுட்ட செங்கற்களாலேயே அமைத்துள்ளனர்.",7
மொஹெஞ்சொ-தரோ_அல்லது_சிந்துவெளி_நாகரிகம்,மேற் சொன்னவற்றால் துன்புறுத்தப்படாத உட்புறச் சுவர்களை உலர்ந்த சூளையிடப்படாத செங்கற்களால் அமைத்துள்ளனர்.,9
மொஹெஞ்சொ-தரோ_அல்லது_சிந்துவெளி_நாகரிகம்,அவர்கள் இக்காலத்திய சிமென்டை அறியார் கான்க்ரீட் என்பதையும் அறியார்.,7
மொஹெஞ்சொ-தரோ_அல்லது_சிந்துவெளி_நாகரிகம்,"ஆதலின், அக்கால முறைக்கு ஏற்றபடி களிமண் சாந்தையே சுவர்களின் மேற்பூச்சாகப் பயன்படுத்தினர்.",9
மொஹெஞ்சொ-தரோ_அல்லது_சிந்துவெளி_நாகரிகம்,சில இல்லச் சுவர்களைத் தவிடு கலந்த களிமண் சாந்தால் மெழுகியுள்ளனர்.,8
மொஹெஞ்சொ-தரோ_அல்லது_சிந்துவெளி_நாகரிகம்,"சுவர், தரை, கூரை இம்மூன்றும் களிமண் சாந்தால் ஆனவை.",7
மொஹெஞ்சொ-தரோ_அல்லது_சிந்துவெளி_நாகரிகம்,நாம் அவற்றை இன்னும் தெளிவுறக் காணலாம்.,5
மொஹெஞ்சொ-தரோ_அல்லது_சிந்துவெளி_நாகரிகம்,கட்டிடப் புலவர்கள் சுவர்களையும் தரையையும் மேற்கூரையையும் ஒழுங்குபடுத்த மட்டப் பலகையைப் பயன்படுத்தினர்.,9
மொஹெஞ்சொ-தரோ_அல்லது_சிந்துவெளி_நாகரிகம்,அப்பலகைகள் பல மொஹெஞ்சொ தரோவில் கிடைத்துள்ளன.,5
மொஹெஞ்சொ-தரோ_அல்லது_சிந்துவெளி_நாகரிகம்,அவை பல அளவுகள் உடையனவாக உள்ளன.,5
மொஹெஞ்சொ-தரோ_அல்லது_சிந்துவெளி_நாகரிகம்,அணி அணியான கட்டிடங்கள் ஒவ்வொரு தெருவிலும் வீடுகள் ஒன்றுக்கொன்று இடைவெளியின்றிச் சேர்ந்தாற்போலவே அமைந்துள்ள.,10
மொஹெஞ்சொ-தரோ_அல்லது_சிந்துவெளி_நாகரிகம்,அவற்றின் தரைமட்டம் உயர்த்தப் பட்டது.,4
மொஹெஞ்சொ-தரோ_அல்லது_சிந்துவெளி_நாகரிகம்,இங்ஙனம் மும்முறை தரை மட்டம் உயர்த்தப்பட் டுள்ளது.,6
மொஹெஞ்சொ-தரோ_அல்லது_சிந்துவெளி_நாகரிகம்,"நகர அடிமட்டம் உயர்த்தப் பட்ட பின் போதிய இடம் இன்மையின், இவ்வாறு தாறுமாகக் கட்டிடங்கள் எழுப்பப்பட்டனவாதல் வேண்டும்.",13
மொஹெஞ்சொ-தரோ_அல்லது_சிந்துவெளி_நாகரிகம்,"தொடக்கத்தில் அமைந்துள்ள கட்டிட அமைப்பும், பின்னர் அமைந்துள்ள கட்டிட அமைப்பும் காண்போர்க்கு நன்கு காட்சியளிக்கின்றன.",11
மொஹெஞ்சொ-தரோ_அல்லது_சிந்துவெளி_நாகரிகம்,அகன்ற நெடுந்தெருக்களில் உள்ள இல்லங்களை விடக்குறுந் தெருக்களில் உள்ள இல்லங்களே நன்னிலையில் இருக்கின்றன.,10
மொஹெஞ்சொ-தரோ_அல்லது_சிந்துவெளி_நாகரிகம்,பருத்த சுவர்கள் பெரும்பாலும் எல்லாக் கட்டிடங்களின் சுவர்களும் பருத்தவையாக இருக்கின்றன.,8
மொஹெஞ்சொ-தரோ_அல்லது_சிந்துவெளி_நாகரிகம்,அவை நூற்றி ஐந்து செ.,4
மொஹெஞ்சொ-தரோ_அல்லது_சிந்துவெளி_நாகரிகம்,முதல் நூற்றி எண்பது செ.மீ.,5
மொஹெஞ்சொ-தரோ_அல்லது_சிந்துவெளி_நாகரிகம்,வரை தடித்தவையாக இருக்கின்றன.,3
மொஹெஞ்சொ-தரோ_அல்லது_சிந்துவெளி_நாகரிகம்,சிந்து நதியின் வெள்ளத்தை எதிர்நோக்கியே இச்சுவர்கள் இவ்வளவு கனமாக அமைக்கப்பட்டுள்ளன.,8
மொஹெஞ்சொ-தரோ_அல்லது_சிந்துவெளி_நாகரிகம்,இரண்டிற்கு மேற்பட்ட மேன் மாடங்களை அமைக்கும்பொழுது அவற்றின் பாரத்தைத் தாங்க வல்லவையாக இவை அமைந்திருத்தல் வேண்டும் அன்றோ?,13
மொஹெஞ்சொ-தரோ_அல்லது_சிந்துவெளி_நாகரிகம்,அந் நோக்கம் பற்றியும் இச்சுவர்கள் இங்ஙனம் அமைக்கப்பட்டுள்ளன என்று கூறலாம்.,8
மொஹெஞ்சொ-தரோ_அல்லது_சிந்துவெளி_நாகரிகம்,"கனமுடையதாகவும், பிற சுவர்கள் நூற்றி ஐந்து செ.",6
மொஹெஞ்சொ-தரோ_அல்லது_சிந்துவெளி_நாகரிகம்,"மீ, நூற்றி நாற்பத்தைந்து செ.",4
மொஹெஞ்சொ-தரோ_அல்லது_சிந்துவெளி_நாகரிகம்,கனம் உடையன வாகவும் அமைந்துள்ளன.,4
மொஹெஞ்சொ-தரோ_அல்லது_சிந்துவெளி_நாகரிகம்,இவை அவ்வப்போது புதுப்பிக்கப் பட்டன.,4
மொஹெஞ்சொ-தரோ_அல்லது_சிந்துவெளி_நாகரிகம்,"ஆதலின், இங்ஙனம் வேறுபட்டுக் காண்கின்றன.",4
மொஹெஞ்சொ-தரோ_அல்லது_சிந்துவெளி_நாகரிகம்,நெடுஞ்சுவர்கள் கட்டிடச் சுவர்கள் ஓரளவில் இல்லை.,5
மொஹெஞ்சொ-தரோ_அல்லது_சிந்துவெளி_நாகரிகம்,பெரிய தெருக்களில் உள்ள கட்டிடச் சுவர்கள் ஐநூற்று நாற்பது செ.,8
மொஹெஞ்சொ-தரோ_அல்லது_சிந்துவெளி_நாகரிகம்,உயரம் உடையனவாக இருக்கின்றன.,3
மொஹெஞ்சொ-தரோ_அல்லது_சிந்துவெளி_நாகரிகம்,முதல் எழுநூற்று ஐம்பது செ.,4
மொஹெஞ்சொ-தரோ_அல்லது_சிந்துவெளி_நாகரிகம்,வரை உயரம் உடையனவாக உள்ளன.,4
மொஹெஞ்சொ-தரோ_அல்லது_சிந்துவெளி_நாகரிகம்,"இவற்றை நன்கு கவனிப்பின், தரைமட்டம் உயர்த்தப் பட்டபோதெல்லாம் இவையும் உயர்த்தப்பட்டு வந்தன என்பதை எளிதில் உணர்தல் கூடும்.",13
மொஹெஞ்சொ-தரோ_அல்லது_சிந்துவெளி_நாகரிகம்,பலவகைக் கட்டிடங்கள் மொஹெஞ்சொ தரோவில் பல திறப்பட்ட கட்டிடங்கள் இருக்கின்றன.,8
மொஹெஞ்சொ-தரோ_அல்லது_சிந்துவெளி_நாகரிகம்,சில இரண்டு அடுக்கும் இரண்டிற்கு மேற்பட்டவையும் உடைய மாடிவீடுகள் சில அகன்ற முற்றங்களை உடைய ஒரே அடுக்கு உடையவை.,14
மொஹெஞ்சொ-தரோ_அல்லது_சிந்துவெளி_நாகரிகம்,சில கட்டிடங்கள் அங்காடிகளாக இருந்தவை சில கோவில்கள் என்று கருதத் தக்கவை பல எளியவர் இல்லங்கள்.,12
மொஹெஞ்சொ-தரோ_அல்லது_சிந்துவெளி_நாகரிகம்,எளியவர் இல்லங்கள் சிறிய இல்லங்கள் என்பன நான்கைந்து அறைகள் கொண்டுள்ளன.,8
மொஹெஞ்சொ-தரோ_அல்லது_சிந்துவெளி_நாகரிகம்,இவை தொள்ளாயிரம்  செ.மீ நீளமும் எண்ணூற்று பத்து செ.,8
மொஹெஞ்சொ-தரோ_அல்லது_சிந்துவெளி_நாகரிகம்,இவை அனைத்தும் செங்கற்களைக் கொண்டே அமைத்தவை ஆகும்.,6
மொஹெஞ்சொ-தரோ_அல்லது_சிந்துவெளி_நாகரிகம்,இவற்றின் தரை சாணத்தால் மெழுகப்பட்டு வந்தது.,5
மொஹெஞ்சொ-தரோ_அல்லது_சிந்துவெளி_நாகரிகம்,பெரிய முற்றமுடைய இல்லங்கள் சில பெரிய கட்டிடங்களின் நடுவில் பெரிய அகன்ற முற்றம் இருக்கின்றது.,11
மொஹெஞ்சொ-தரோ_அல்லது_சிந்துவெளி_நாகரிகம்,அதனைச் சூழப் பல அறைகள் அமைந்துள்ளன.,5
மொஹெஞ்சொ-தரோ_அல்லது_சிந்துவெளி_நாகரிகம்,அவ்வறைகள் இக்காலத்துப் பெரிய அறைகள் போன்றவை அல்ல எனினும் காற்றோட்டம் கொண்டனவாகவே அமைந்துள்ளன.,10
மொஹெஞ்சொ-தரோ_அல்லது_சிந்துவெளி_நாகரிகம்,ஒவ்வோர் அறையிலும் காற்றும் வெளிச்சமும் புகத் தக்கவாறு சாளரம் அமைந்துள்ளது.,8
மொஹெஞ்சொ-தரோ_அல்லது_சிந்துவெளி_நாகரிகம்,காற்றோட்டம் நன்கு அமைந்திருக்கத் தக்கவாறு வீட்டின் வாயிற்படியும் கூரையும் உயர்த்திக் கட்டப்பட்டுள்ளன.,9
மொஹெஞ்சொ-தரோ_அல்லது_சிந்துவெளி_நாகரிகம்,இத்தகைய இல்லங்கள் சென்னையில் வண்ணாரப்பேட்டையிலும் இராயபுரத்திலும் காணலாம்.,6
மொஹெஞ்சொ-தரோ_அல்லது_சிந்துவெளி_நாகரிகம்,சிந்து மாகாணத்திலும் பல இடங்களில் இத்தகைய அகன்ற முற்றமுடைய இல்லங்கள் இருக்கின்றன என்று ஆராய்ச்சியாளர் அறைகின்றனர்.,12
மொஹெஞ்சொ-தரோ_அல்லது_சிந்துவெளி_நாகரிகம்,பல குடும்பங்கள் வாழ்ந்த வீடுகள் பெரிய வீடுகளிற் சில இடையே நெடுஞ்சுவர்கள் வைத்துப் பிரிக்கப்பட்டுள்ளன.,11
மொஹெஞ்சொ-தரோ_அல்லது_சிந்துவெளி_நாகரிகம்,அத்தகைய இல்லங்கள் உடன் பிறந்தோர் பிரிந்து வாழ்வதற்கென்றே அமைக்கப்பட்டவை ஆகும்.,8
மொஹெஞ்சொ-தரோ_அல்லது_சிந்துவெளி_நாகரிகம்,சில இடங்களில் சிலவீடுகள் அவற்றின் தாய்ச் சுவர்களுக்கும்.,6
மொஹெஞ்சொ-தரோ_அல்லது_சிந்துவெளி_நாகரிகம்,அடுத்த வீட்டுச் சுவர்களுக்கும் இடையில் சிறு இடைவெளி விட்டுக் கட்டப்பட்டுள்ளன.,8
மொஹெஞ்சொ-தரோ_அல்லது_சிந்துவெளி_நாகரிகம்,இத்தகைய பெரிய வீடுகளில் கூலங்களைச் சேமித்துவைக்கும் களஞ்சியங்கள் தரையிற் பதிக்கப்பட்டு இருந்தன.,9
மொஹெஞ்சொ-தரோ_அல்லது_சிந்துவெளி_நாகரிகம்,சில இல்லங் களில் மாடங்களும் சுவர் அறைகளும் அமைந்துள்ளன.,7
மொஹெஞ்சொ-தரோ_அல்லது_சிந்துவெளி_நாகரிகம்,"செல்வர் தம் மாட மாளிகைகள் இவை, இரண்டும் இரண்டுக்கு மேற்பட்ட அடுக்குகளு முடைய மாளிகைகள் ஆகும்.",12
மொஹெஞ்சொ-தரோ_அல்லது_சிந்துவெளி_நாகரிகம்,இவற்றின் மேன்மாடங்கள் செங்கல் தள வரிசை உடையன.,6
மொஹெஞ்சொ-தரோ_அல்லது_சிந்துவெளி_நாகரிகம்,மேன்மாடங்கட்குச் செல்லும் படிக்கட்டுகள் பல இன்றும் நன்னிலையிற் காண்கின்றன.,7
மொஹெஞ்சொ-தரோ_அல்லது_சிந்துவெளி_நாகரிகம்,அவை இன்று நம் வீடுகளில் உள்ள படிக்கட்டுகள் போலவே இருக்கின்றன.,8
மொஹெஞ்சொ-தரோ_அல்லது_சிந்துவெளி_நாகரிகம்,படிக்கட்டு இல்லாத மாடங்கள் சில காணப்படுகின்றன.அவற்றுக்கு மர ஏணிகள் பயன் பட்டனவாதல் வேண்டும்.,11
