work_title,sentence,sentence_length
மனத்தின்_தோற்றம்,பேராசையைக் காட்டிலும் பெரிய வறுமைத்தனம் வேறு இருக்க முடியாது.,7
மனத்தின்_தோற்றம்,நமக்குப் பின் விட்டுப் போகக்கூடிய எச்சப்பொருள் புகழினும் வேறேதும் இன்று.,8
மனத்தின்_தோற்றம்,ஒருவரிடம் சென்று கெஞ்சிக் கேட்டு இரத்தலைக் காட்டிலும் இழிவு வேறு யாதும் இலது.,10
மனத்தின்_தோற்றம்,தம்மிடம் வந்து ஒன்று கேட்டு இரப்பவர்க்குக் கொடுப்பதைவிட உயர்ந்த சிறப்பு வேறு இருத்தற்கு இல்லை.,11
மனத்தின்_தோற்றம்,பொய்யான பத்து உரைகள் ஒன்று.,4
மனத்தின்_தோற்றம்,மிகப் பெரிய செல்வமும் செல்வாக்கும் பெற்றவன் பிறரிடம் சினம் காட்டமாட்டான் என்பது பொய்.,10
மனத்தின்_தோற்றம்,செருக்கினால் அவன் சுடுமுகம் காட்டலாம்.,4
மனத்தின்_தோற்றம்,கள் உண்பவன் எதிலும் சோர்வடையான் தாழ்வடையான் என்பது பொய்.,7
மனத்தின்_தோற்றம்,செய்ய வேண்டிய செயலை உரிய காலம் அறிந்து செய்யாதவனுக்குச் செயல் கைகூடி வரும் என்பது பொய்.,12
மனத்தின்_தோற்றம்,உற்ற செயலைக் காய்ந்து வெறுத்துச் செய்யா தவன் உயர்வு பெறுதல் இயலாது.,9
மனத்தின்_தோற்றம்,"எதையும் பொறுத்து அடக்கமாய் இல்லாதவன், பெருமையை வேண்டிப் பெறுதல் இயலாது.",8
மனத்தின்_தோற்றம்,"தனக்குப் பெருமை வேண்டாதவன், அதாவது தற்பெருமையை விரும்பாதவன் சிறுமை அடைதல் இல்லை.",9
மனத்தின்_தோற்றம்,"பொருளின் மேல் பேரவாக் கொள்பவன், முறை யாகப் பொருள் ஈட்டுவான் என்பது பொய்.",10
மனத்தின்_தோற்றம்,"தூய்மையான உள்ளத்தான் அல்லாதவன், உயர்ந்த தவம் செய்வான் என்பது பொய்.",8
மனத்தின்_தோற்றம்,உறுதல் எளிதான பத்து மொழிகள் ஒன்று.,5
மனத்தின்_தோற்றம்,போரை ஏற்று உண்மையாய்ப் போரிடுபவர்க்குப் பெரிய போரில் வெற்றி கிடைத்தல் எளிது.,9
மனத்தின்_தோற்றம்,"குளிர்ந்த உள்ளன்பு உடையவர்கட்கு, பிறர் விரும்பும் பொருளைக் கொடுத்தல் எளிது.",8
மனத்தின்_தோற்றம்,"நான்கு, பிறர்மேல் கோள் சொல்லுதலை விரும்புபவர், எந்த மறை பொருளையும் எளிதில் வெளியிட்டுவிடுவர்.",10
மனத்தின்_தோற்றம்,உழைப்பினால் உண்டாகும் துன்பத்தைப் பொருட்படுத்தாது உழைப்பவர்க்கு இன்பம் கிடைப்பது எளிது.,8
மனத்தின்_தோற்றம்,உழைக்காமல் இன்பத்தை மட்டுமே விரும்புபவர்கள் எளிதில் துன்பம் எய்துவர்.,7
மனத்தின்_தோற்றம்,"பெருந்தீனியை விரும்பி உட்கொள்பவர்க்கு, மிகுந்த பெரிய நோய்கள் எளிதில் உண்டாகும்.",8
மனத்தின்_தோற்றம்,தன் மனைவியல்லாத மற்ற பெண்களை விரும்பு பவர்க்குப் பெரும் பழி நேர்தல் எளிது.,10
மனத்தின்_தோற்றம்,"எந்தப் பொறுப்பும் கவலையும் இல்லாதவர்க்கு, பிறரைப் படுகொலை செய்தல் எளிது.",8
மனத்தின்_தோற்றம்,நல்கூர்தலாகக் கூறும் பத்துக் கருத்துகள் ஒன்று.,5
மனத்தின்_தோற்றம்,மிகவும் அகவை முதிர்ந்தவன் காமத்தை விரும்புதல் அதாவது மேலும் புதிதாகத் திருமணம் செய்து கொள்ள விரும்புதல் பயனற்றதாகும்.,13
மனத்தின்_தோற்றம்,பெரிய பிணியாளி பெறுகின்ற இன்பம் என்பது உண்மையான பயன் உடையதாகாது.,8
மனத்தின்_தோற்றம்,தன்னைப் பொருட்படுத்தாது புறக்கணிப்பவரிடத்தில் சினம் கொள்வது செல்லாது பயனற்றது.,7
மனத்தின்_தோற்றம்,மிகவும் அகவை முதிர்த்த மூத்தோன் தன்னை ஆடையணிகலன்களால் ஒப்பனை செய்து கொள்வது அவ்வளவாக எடுபடாது.,11
மனத்தின்_தோற்றம்,தனது பேச்சு எடுபடாத இடத்தில் பேசுதல் என்பது பயனற்ற வீண்செயலாகும்.,8
மனத்தின்_தோற்றம்,உள்ளத்தில் குளிர்ச்சியின்றி வறட்சியுற்றிருப்புவனோடு அதாவது உள்ளன்பு இல்லாதவனோடு சேர்ந்திருத்தல் பயன் தராததாகும்.,9
மனத்தின்_தோற்றம்,தமது பெருமையைக் கண்டு அஞ்சி மதிப்பு கொடாத இடத்தில் சினம் காட்டுதலால் பயனில்லை.,10
மனத்தின்_தோற்றம்,உண்மையான நட்பு இல்லாதவரிடத்தில் இன் சொல்லையோ ஓர் உதவியையோ பெற உள்ளத்தில் விரும்பிச் செல்லுதலால் ஒரு பயனும் இராது.,14
மனத்தின்_தோற்றம்,தவறாமை பற்றிய பத்து உரைகள் ஒன்று.,5
மனத்தின்_தோற்றம்,"தான் பெருமையில் பெருக விரும்புபவன், பல புகழ்ச் செயல்களைச் செய்யத் தவிரான், மூன்று.",10
மனத்தின்_தோற்றம்,கல்வி கற்க விரும்புபவன் ஆசிரியரை வணங்குவதில் பின் வாங்கமாட்டான்.,7
மனத்தின்_தோற்றம்,உலகில் புகழுடன் நிலைத்து நிற்க விரும்புபவன் உயர்ந்த தவம் இயற்றுதலைத் தவிர்க்கமாட்டான்.,9
மனத்தின்_தோற்றம்,"தான் நன்முறையில் வாழ வேண்டுபவன், பெரியோருடன் சூழ்ந்து வாழும் வழி அறிதலைத் தவிரான்.",10
மனத்தின்_தோற்றம்,"தான் மேன்மேலும் வளர விரும்புபவன், முயற்சி யுடன் உழைப்பதை விடமாட்டான்.",8
மனத்தின்_தோற்றம்,"இன்பம் பெற விழைபவன், அதைப் பெறும் முயற்சியினிடையே ஏற்படும் இன்னல்களைக் கண்டு சோர மாட்டான்.",11
மனத்தின்_தோற்றம்,"பின்னால் துன்பப்பட இருப்பவன், முன்னால் தேவையில்லாத சிற்றின்பங்களை விடாது நுகர்வான்.",8
மனத்தின்_தோற்றம்,"குடிமக்களின் நன்மையை விரும்பும் அரசன், செங்கோல் முறை தவறாமல் ஆளுதலைக் கைவிட மாட்டான்.",10
மனத்தின்_தோற்றம்,"இன்பம் விரும்புவன், பெரியோரின் குறிப்பறிந்து செயலாற்றுதலினின்றும் நீங்கான்.",6
மனத்தின்_தோற்றம்,மலர் கொய்து போடும் போதும் போட்ட பின்னரும் மலர்க் குடலையை இடுப்பின் கீழ் தொங்கவிடக் கூடாது என்பர்.,13
மனத்தின்_தோற்றம்,குளிக்காமல் மலர் கொய்யக் கூடாதென்பதும் ஒரு கொள்கை.,6
மனத்தின்_தோற்றம்,மூக்கால் மலரை மோந்து பார்த்தலும் கூடாதாம்.,5
மனத்தின்_தோற்றம்,இவரும் ஒரு நாயனார்.,3
மனத்தின்_தோற்றம்,எவ்வளவு கடுமைச் செயல் இது !,4
மனத்தின்_தோற்றம்,இது பெரியபுராணக் கதை.,3
மனத்தின்_தோற்றம்,பின் அவற்றை மூக்கால் மோந்தாராம்.,4
மனத்தின்_தோற்றம்,அப்போது அவருடைய உதவியாளராக உடன் சென்றிருந்த எச்.,6
மனத்தின்_தோற்றம்,"ஐயங்கார் என்னும் தமிழர், நேருவை நோக்கி, மோந்த மலரை அளிப்பது எங்கள் பக்கத்தில் வழக்கமில்லை என்று கூறினாராம்.",13
மனத்தின்_தோற்றம்,உடனே நேரு மோந்த மலர்களைக் கீழே போட்டு விட்டு வேறு புது மலர்களை எடுத்துச் சென்றாராம்.,12
மனத்தின்_தோற்றம்,"மோந்ததே கூடாதெனின், கண்ணிர் பட்டது சிறிதும் கூடா தன்றோ !",7
மனத்தின்_தோற்றம்,அந்தக் காலத்திலும் பெண்கள் காவலுடன் இயங்க வேண்டியவர்களாக இருந் தனர் என்பது இதனால் பெறப்படும்.,11
மனத்தின்_தோற்றம்,மண்ணாமை சமணத் துறவிகள் குளித்துக் கழுவி உடலைத் தூய்மை செய்வதில்லையாம்.,8
மனத்தின்_தோற்றம்,"இதனை, மண்ணா மேனியன் வருவோன் தன்னை என்னும் பகுதியால் அறியலாம்.",8
மனத்தின்_தோற்றம்,மண்ணுதல் குளித்தல் தூய்மை செய்தல்.,4
மனத்தின்_தோற்றம்,துணியைத் தூய்மை செய்யும் வண்ணான் என்னும் பெயர்ப் பொருளில் மலையாளத்தில் மண்ணான் என்னும் பெயர் வழங்கப்படுகிறது.,12
மனத்தின்_தோற்றம்,கழுவா உடலம் எனினும் மண்ணா மேனி எனினும் பொருள் ஒன்றே.,8
மனத்தின்_தோற்றம்,"ஒட்டக் கூத்தரின் தக்க யாகப் பரணியிலும், மண்ணா உடம்பு வருவோன் தன்னை நோக்கி எனக் குறிப்பிடப்பட்டுள்ளது.",12
மனத்தின்_தோற்றம்,"குடிகாரன் ஒருவன் சமணத் துறவி ஒருவரை நோக்கிக் கூறாதன கூறிக் கிண்டல் செய்ய, அவனை அப்புறப்படுத்த அவர் கையசைத்தனாராம்.",14
மனத்தின்_தோற்றம்,ஐம்படைத்தாலி இந்தக் காலத்தில் குழந்தைகளைக் காக்க அரையில் என்னென்னவோ கட்டுகின்றனர்.,8
மனத்தின்_தோற்றம்,அந்தக் காலத்தில் அரை யில் ஐம்படைத் தாலி கட்டினர்.,7
மனத்தின்_தோற்றம்,இதற்குத்தான் ஐம்படைத் தாலி கட்டுதல் என்பது பெயர்.,6
மனத்தின்_தோற்றம்,"மற்றும், சங்க இலக்கியம் முதற்கொண்டு பல்வேறு நூல்களில் இச் செய்தி இடம் பெற்றுள்ளது.",10
மனத்தின்_தோற்றம்,"இரட்டைக் காப்பியங் களுள் மற்றொன்றான சிலப்பதிகாரத்திலும், கணவனை இழந்தவர் பெருமூச்செறிந்து உயிர்விடுதல் கூறப் பட்டுள்ளது.",11
மனத்தின்_தோற்றம்,இதற்குப் பாண்டிமாதேவி எடுத்துக்காட்டு.,3
மனத்தின்_தோற்றம்,மறுமணம் செய்து கொள்ளாவிடினும் தவ நோன்பு கொள்ளலாம்.,6
மனத்தின்_தோற்றம்,"ஆனால், திக்குளிப்பு தேவையற்றது கொடுமையானது ஆண் பெண் சம நிலைக்கு முரணானது.",9
மனத்தின்_தோற்றம்,"அதாவது, இந்தக் காலத்திற்கு ஒவ்வாதது.",4
மனத்தின்_தோற்றம்,தொழுது பேசுதல் அரசரிடம் ஒன்று பேசுவோர் முதலில் அரசனுக்கு வணக்கம் செய்தலும் வாழ்த்துச் சொல்லுதலும் வழக்கம்.,12
மனத்தின்_தோற்றம்,"அவனைக் கண்ட உதயகுமரன் என்னும் சோழ இளவரசன், நீ இவ்வாறு இருப்பதற்குக் காரணம் என்ன என வினவினான்.",13
மனத்தின்_தோற்றம்,எட்டி குமரன் அரச குமரனை வணங்கிச் சொல்லலானான்.,6
மனத்தின்_தோற்றம்,பேசத் தொடங்குமுன் மன்னரை வணங்கி வாழ்த்துவது போலவே பேச்சின் முடிவிலும் வாழ்த்துவது மரபு.,10
மனத்தின்_தோற்றம்,சுதமதி இவ்வாறு உதயகுமரனை வாழ்த்தி முடித்தாள்.,5
மனத்தின்_தோற்றம்,"இதனை, மிகைநா இல்லேன் வேங்தே வாழ்கஎன என்பதால் அறியலாம்.",7
மனத்தின்_தோற்றம்,"சிலப்பதிகாரத்திலும், இவ்வாறு மன்னனிடம் பேசத் தொடங்கும்போதும் முடித்த போதும் வாழ்த்தும் மரபு பல காதைகளில் இடம் பெற்றுள்ளமை குறிப்பிடத்தக்கது.",14
மனத்தின்_தோற்றம்,இரட்டைக் காப்பியங்கள் ஆயிற்றே.,3
மனத்தின்_தோற்றம்,"குமரியும் காவிரியும் ஆடல் வடபுலத்திலிருந்து தமிழகம் வருவோர், குமரியிலும் காவிரியிலும் குளித்தல் வழக்கமாம்.",10
மனத்தின்_தோற்றம்,சுதமதியின் தந்தை வட புலத்திலிருந்து குமரியும் காவிரியும் ஆடி வந்தோருடன் சேர்ந்துகொண்டு புகார் வந்தானாம்.,11
மனத்தின்_தோற்றம்,"மற்றும், ஒழுக்கம் தவறிய பெண்களும் அத்தீவினையைத் தீர்த்துக்கொள்ள வந்து குமரியாடுதல் உண்டாம்.",9
மனத்தின்_தோற்றம்,"இதனால், தவ ஒழுக்கம் பூண்டோர்க்கும் உள்ளம் தடுமாறுதல் இயல்பு என்பது புலப் படும்.",10
மனத்தின்_தோற்றம்,"கணவன் எல்லா வகையிலும் சிறந்தவன் எனினும், ஒரு பெண்ணுக்கு மற்றோர் ஆடவன்பால் மனம் நாடக் கூடுமாம்.",12
மனத்தின்_தோற்றம்,"அதாவது, மனம் மாற்றானைப் பற்றி நினைத்துப் பார்க்கக் கூடுமாம்.",7
மனத்தின்_தோற்றம்,இப்பாடல் ஈண்டு ஒப்பு நோக்கத் தக்கது.,5
மனத்தின்_தோற்றம்,உயிர்க் கடன் கொற்றவைக்கு உயிர்க்கடன் கொடுக்கும் வழக்கம் பண்டு இருந்தது.,8
மனத்தின்_தோற்றம்,உயிர்க்கடன் தருவோர் தலைமுடியை மரத்தில் கட்டி விட்டுக் கழுத்தை அரிந்து கொள்வாராம்.,9
மனத்தின்_தோற்றம்,தலைமுடியை மரத்தில் கட்டி இவ்வாறு கழுத்தை அரிந்து கொண்டபின் தலைகள் மரத்தில் தொங்கிக்கொண்டிருக்குமாம்.,10
மனத்தின்_தோற்றம்,காடு அமர் செல்வியாகிய கொற்றவையின் கோட்டத்தில் இக்காட்சியைக் காணலாம்.,7
மனத்தின்_தோற்றம்,சிலப்பதிகாரத்திலும் உயிர்க் கொடை கூறப்பட்டுள்ளது.,4
மனத்தின்_தோற்றம்,இறந்தோர் கோயில் சிறந்தவர்கள் இறந்துவிடின் அவர்கட்குக் கோயில் எடுத்தல் மரபு.,8
மனத்தின்_தோற்றம்,பிணம் படும் பாடு பிணத்தைச் சுடுவதும் பள்ளம் வெட்டியும் தாழியில் இட்டும் புதைப்பது மன்றி.,11
மனத்தின்_தோற்றம்,அப்படியே முழு உருவத்துடன் தரையின் மேலே போட்டுவிட்டுப் போவதும் உண்டு எனத் தெரிகின்றது.,10
மனத்தின்_தோற்றம்,சக்கர வாளக் கோட்டம் உரைத்த காதையில் இது விரிவாகச் சொல்லப்பட்டுள்ளது.,8
மனத்தின்_தோற்றம்,"இந்தக் காலத்தில், சுடுகாடு எனச் சுடும் பகுதியையும், இடுகாடு எனப் புதைக்கும் பகுதியையும் குறிப்பர்.",11
மனத்தின்_தோற்றம்,அந்தக் காலத்தில் வெளியில் இட்டுச் செல்லும் பகுதியையே இடுகாடு என்பது குறித்ததாகத் தோன்றுகிறது.,10
மனத்தின்_தோற்றம்,இதற்கு உரிய சான்று பெண்களின் செம்பஞ்சு ஊட்டிய அழகிய அடிகளை நரிகள் கவ்விச் செல்கின்றனவாம்.,11
மனத்தின்_தோற்றம்,ஆடை உடுத்தி மறைத்திருந்த அல்குலைக் கழுகுகள் குடைந்து உண்கின்றனவாம்.,7
மனத்தின்_தோற்றம்,கடகம் அணிந்த கையை நாய் கவ்விச் செல்கிறதாம்.,6
மனத்தின்_தோற்றம்,சாந்து பூசிய எடுப்பான அழகிய முலைகளைப் பருந்துகள் கொத்தி உண்கின்றனவாம்.,8
மனத்தின்_தோற்றம்,"ஒருபேய், பெண்ணின் தலையை முழவுபோல் கையில் ஏந்திக் கண்களைத் தோண்டி உண்கிறதாம்.",9
மனத்தின்_தோற்றம்,"இதனால், பிணங்களைச் சுடாமலும் புதைக்காமலும் வெளியே போட்டுவிட்டுச் செல்லும் வழக்கமும் இருந்தது என்பது தெளிவு.",11
மனத்தின்_தோற்றம்,மணிமேகலை நூல் புத்த காப்பியம்.,4
