work_title,sentence,sentence_length
மொஹெஞ்சொ-தரோ_அல்லது_சிந்துவெளி_நாகரிகம்,மொஹெஞ்சொ தரோ அல்லது சிந்துவெளி நாகரிகம் — மொஹெஞ்சொ தரோ அல்லது சிந்துவெளி நாகரிகம் டாக்டர்.,12
மொஹெஞ்சொ-தரோ_அல்லது_சிந்துவெளி_நாகரிகம்,கடலாழங் காண்பதும் இந்திய் நாகரிக ஆழங் காண்பதும் ஒன்று.,7
மொஹெஞ்சொ-தரோ_அல்லது_சிந்துவெளி_நாகரிகம்,சில காலத்துக்குமுன் வரையில் ஆராய்ச்சியாளர் இந்திய நிலைகளைப் பற்றிப் பற்பல கருத்துடையராயிருந்தனர்.,9
மொஹெஞ்சொ-தரோ_அல்லது_சிந்துவெளி_நாகரிகம்,ஆராய்ச்சியாளர் கண்ணுக்கு வடமொழி நூல்களே இந்தியாவின் தலை நூல்கள் என்று அப்போது காணப்பட்டு வந்தமையே அதற்குக் காரணம்.,13
மொஹெஞ்சொ-தரோ_அல்லது_சிந்துவெளி_நாகரிகம்,"பின்பு, பண்டைக் காலத்தில் இயற்றப்பட்ட, தமிழ் நூல்கள் சில வெளிப்படலாயின.",8
மொஹெஞ்சொ-தரோ_அல்லது_சிந்துவெளி_நாகரிகம்,"இதற்குள் நூலாராய்ச்சியே யல்லாமல், ஞால ஆராய்ச்சி, கல்வெட்டு ஆராய்ச்சி, அகப்பொரு ளாராய்ச்சி முதலான பலவகை ஆராய்ச்சிகள் வளர்ச்சிபெறலாயின.",13
மொஹெஞ்சொ-தரோ_அல்லது_சிந்துவெளி_நாகரிகம்,"ஆழ்ந்து வடக்கே இமயமலை எழுந்தபோது, அக் கண்டத்திலிருந்த மக்கள் வடக்கே வந்து உலகெங்கும் பரவினர்.",11
மொஹெஞ்சொ-தரோ_அல்லது_சிந்துவெளி_நாகரிகம்,ஒரு கருத்தைத் துணிவதற்கு இங்ஙனம் மூவகையளவைகளும் முதன்மையானவை.,6
மொஹெஞ்சொ-தரோ_அல்லது_சிந்துவெளி_நாகரிகம்,திராவிடர் இப்போது எந்நிலையி லிருக்கின்றனர்.,4
மொஹெஞ்சொ-தரோ_அல்லது_சிந்துவெளி_நாகரிகம்,திராவிடர் தம் தொன்மையையும் வன்மையையும் உலகறிய வைத்து வாழவன்றோ முற்படுவர் !,8
மொஹெஞ்சொ-தரோ_அல்லது_சிந்துவெளி_நாகரிகம்,இவ் வுணர்ச்சியும் முயற்சியும் உண்டாகும் பொருட்டே இம் மொஹஞ்சொ தரோ ஆராய்ச்சிகளை விளக்கமாகத் தமிழ்மொழியில் எழுதுவித்து வெளியிடுகின்றோம்.,13
மொஹெஞ்சொ-தரோ_அல்லது_சிந்துவெளி_நாகரிகம்,இவ் வெளியீடு அக் கருத்தைச் செவ்வனம் நிறைவேற்றுமென்று நம்புகிறோம்.,7
மொஹெஞ்சொ-தரோ_அல்லது_சிந்துவெளி_நாகரிகம்,"அச்சிடுங் காலத்தில், இந்நூலை நன்கு பார்வையிட்டுதவியவர் தருமையாதீன வித்துவான், திருவாளர்.",8
மொஹெஞ்சொ-தரோ_அல்லது_சிந்துவெளி_நாகரிகம்,இவ்வறிஞரிருவர்க்கும் எங்கள் நன்றியை அன்புடன் தெரிவித்துக் கொள்ளுகிறோம்.,6
மொஹெஞ்சொ-தரோ_அல்லது_சிந்துவெளி_நாகரிகம்,சைவசித்தாந்த நூற்பதிப்புக் கழகத்தார்.,3
மொஹெஞ்சொ-தரோ_அல்லது_சிந்துவெளி_நாகரிகம்,புதைபொருள் ஆராய்ச்சி பக்கம் ஒன்று பதினேழு  புதை பொருள் ஆராய்ச்சி ஆராய்ச்சி அவா உண்டாவதேன்?,11
மொஹெஞ்சொ-தரோ_அல்லது_சிந்துவெளி_நாகரிகம்,கோட்லா நிஹாங் கான் நூற்றுக்கு மேற்பட்ட மண்மேடுகள்.,6
மொஹெஞ்சொ-தரோ_அல்லது_சிந்துவெளி_நாகரிகம்,பண்டைத் தமிழ் நகரங்கள் சங்கு சான்று பகரும்.,6
மொஹெஞ்சொ-தரோ_அல்லது_சிந்துவெளி_நாகரிகம்,மேனாட்டார் முயற்சி நம்மவர் கடமை.,4
மொஹெஞ்சொ-தரோ_அல்லது_சிந்துவெளி_நாகரிகம்,தையலார்க்குத் தனி அறைகள் நீராடும் அறைகள் சமையல் அறைகள் அங்காடியோ?,8
மொஹெஞ்சொ-தரோ_அல்லது_சிந்துவெளி_நாகரிகம்,வீட்டுவாயில்கள் தூண்கள் ஹரப்பாவில் கட்டிட அமைப்பு இருவகை இல்லங்கள் பெருங் ﻿களஞ்சியம் தொழிலாளர் இல்லங்கள் வீட்டிற்கு உரிய வீடுகளே.,14
மொஹெஞ்சொ-தரோ_அல்லது_சிந்துவெளி_நாகரிகம்,உருளைகள் காளவாய் மெருகிடும் கருவிகள் பல நிறப் பாண்டங்கள் நிறங்களைப் பூசுவானேன்?,9
மொஹெஞ்சொ-தரோ_அல்லது_சிந்துவெளி_நாகரிகம்,எருமைகள் ஒட்டகம் முயல்கள் ஆமை முதலியன பறவைகள் நாகங்கள்.,7
மொஹெஞ்சொ-தரோ_அல்லது_சிந்துவெளி_நாகரிகம்,சமய நிலை நூற்றி எண்பத்தெட்டு இருநூற்று ஐந்து சான்றுகள் தரைப் பெண் வணக்கம் கவின்பெறு கற்பனை நரபலி உண்டா?,14
மொஹெஞ்சொ-தரோ_அல்லது_சிந்துவெளி_நாகரிகம்,தலையில் விசிறிப் பாகை சிவ வணக்கம் லிங்க வழிபாடு புத்தர் பெருமானா?,9
மொஹெஞ்சொ-தரோ_அல்லது_சிந்துவெளி_நாகரிகம்,கொம்புள்ள தெய்வங்கள் நான்கு கைத் தெய்வங்கள் சமண சமயமும் பண்டையதோ?,8
மொஹெஞ்சொ-தரோ_அல்லது_சிந்துவெளி_நாகரிகம்,﻿பறவைமுக மனித உருவங்கள் தாழிகளுட் பல பொருள்கள் உடன் இறக்கும் வழக்கம் முடிவு.,10
மொஹெஞ்சொ-தரோ_அல்லது_சிந்துவெளி_நாகரிகம்,எழுத்துகள் எழுத்துகள் முடிவுரை.,3
மொஹெஞ்சொ-தரோ_அல்லது_சிந்துவெளி_நாகரிகம்,சிந்துவெளி மக்கள் யாவர்?,3
மொஹெஞ்சொ-தரோ_அல்லது_சிந்துவெளி_நாகரிகம்,இருநூற்று இருபத்தாறு இருநூற்று அறுபத்தொன்று பண்டை இந்திய மக்கள் நீக்ரோவர்.,8
மொஹெஞ்சொ-தரோ_அல்லது_சிந்துவெளி_நாகரிகம்,ஆஸ்ட்ரேலியர் மெலனேவியர் மத்தியதரைக் கடலினர்.,4
மொஹெஞ்சொ-தரோ_அல்லது_சிந்துவெளி_நாகரிகம்,மொழி ஆராய்ச்சி கூறும் உண்மை பிற சான்றுகள் இந்திய மக்கள் பற்றிய அறிக்கை நெடுங்காலம் வாழ்ந்த மக்கள் முடிவுரை.,14
மொஹெஞ்சொ-தரோ_அல்லது_சிந்துவெளி_நாகரிகம்,இதன்கண் எடுத்தாளப் பெற்ற மேற்கோள் நூல்கள் இருநூற்று அறுபத்திரண்டு ﻿மொஹெஞ்சொ தரோ அல்லது சிந்து வெளி நாகரிகம் ஒன்று.,14
மொஹெஞ்சொ-தரோ_அல்லது_சிந்துவெளி_நாகரிகம்,புதைபொருள் ஆராய்ச்சி புதைபொருள் ஆராய்ச்சி மிகப் பழைய மனிதன் வீடு கட்ட அறியாது மலை முழைகளில் வாழ்ந்து வந்தான்.,14
மொஹெஞ்சொ-தரோ_அல்லது_சிந்துவெளி_நாகரிகம்,அப்போது அவன் இயல்பாகக் கிடைத்த கற்களையே தன் கருவிகளாகக் கொண்டான்.,8
மொஹெஞ்சொ-தரோ_அல்லது_சிந்துவெளி_நாகரிகம்,ஒன்று ஆற்றங்கரைகளிலும் சமவெளிகளிலும் இயல்பாகக் கிடைத்த களிமண்ணைக் கொண்டு வீடுகளை அமைத்தான்.,9
மொஹெஞ்சொ-தரோ_அல்லது_சிந்துவெளி_நாகரிகம்,"அறிவுக்கு எட்டிய அளவில், தான்.",4
மொஹெஞ்சொ-தரோ_அல்லது_சிந்துவெளி_நாகரிகம்,இக்காலம் கற்காலம் எனப்படும்.,3
மொஹெஞ்சொ-தரோ_அல்லது_சிந்துவெளி_நாகரிகம்,"இக்காலங்கள் முறையே செம்புக் காலம், வெண்கலக் காலம், இரும்புக் காலம் எனப்படும்.",9
மொஹெஞ்சொ-தரோ_அல்லது_சிந்துவெளி_நாகரிகம்,இப்பழக்கமே நாளடைவில் வாணிபமாக வளர்ந்தோங்கியது.,4
மொஹெஞ்சொ-தரோ_அல்லது_சிந்துவெளி_நாகரிகம்,"இக்கலப்பினால் இருவேறுபட்ட பழக்க வழக்கங்கள், கலைகள், மத உணர்ச்சிகள் இன்ன பிறவும் கலப் புறுதலும் இயல்பே.",12
மொஹெஞ்சொ-தரோ_அல்லது_சிந்துவெளி_நாகரிகம்,இக்கலப்பு நாகரிகத்தினின்றும் தெளிவுபெற்ற புதியதோர் நாகரிகம் தோற்றம் எடுத்தலும் உண்டு.,8
மொஹெஞ்சொ-தரோ_அல்லது_சிந்துவெளி_நாகரிகம்,இஃது உலக இயற்கை இங்ஙனம் உலகின் பல பகுதிகளில் மக்கட் கலப்பும் நாகரிகக் கலப்பும் பண்டைக்காலத்திலேயே உண்டாயின.,13
மொஹெஞ்சொ-தரோ_அல்லது_சிந்துவெளி_நாகரிகம்,"இங்ஙனம் உலகத்தின் பல பகுதிகளில் வாழ்ந்த பண்டை மக்கள், தனித்தும் கலந்தும் பலவகை நாகரிகங்களை வளர்த்து வந்தனர்.",13
மொஹெஞ்சொ-தரோ_அல்லது_சிந்துவெளி_நாகரிகம்,"கற்கால மக்கள் செம்பைப் பயன்படுத்தத் தொடங்கியதும், கல்லால் செய்யப்பட்ட பல பொருள்களைப் புறக்கணித்து விட்டனர் பயனற்ற மட்பாண்டங்களை விலக்கினர்.",14
மொஹெஞ்சொ-தரோ_அல்லது_சிந்துவெளி_நாகரிகம்,"தென் இந்தியாவில் இவ்வகைத் தா, கள் புதுக்கோட்டையில் ஏராளமாகக் கண்டெடுக்கப்பட்டன.",8
மொஹெஞ்சொ-தரோ_அல்லது_சிந்துவெளி_நாகரிகம்,பண்டை மக்கள் நல்லிடங்கள் தேடி அடிக்கடி இடம் மாறித் திரிந்தனர்.,8
மொஹெஞ்சொ-தரோ_அல்லது_சிந்துவெளி_நாகரிகம்,"ஆதலின், ஆங்காங்குப் பழுதுற்ற பொருள்களைப் போட்டுப் போயினர்.",6
மொஹெஞ்சொ-தரோ_அல்லது_சிந்துவெளி_நாகரிகம்,அப்பொருள்கள் நாளடைவில் மண்ணுள் மறைப்புண்டன.,4
மொஹெஞ்சொ-தரோ_அல்லது_சிந்துவெளி_நாகரிகம்,பழங்கால மன்னர் உடலங்கள் புதைக்கப் பெற்ற இடங்களில் கற்கோபுரங்கள் கட்டப்பட்டன.,8
மொஹெஞ்சொ-தரோ_அல்லது_சிந்துவெளி_நாகரிகம்,அவற்றின் மீது அக்காலச் சித்திர எழுத்துக்களும் பல சித்திரங்களும் பொறிக்கப்பட்டன.,8
மொஹெஞ்சொ-தரோ_அல்லது_சிந்துவெளி_நாகரிகம்,"வேறு சில இடங்கள், வேற்று மக்கள் படையெடுப்புக்கு அஞ்சித் துறக்கப்பட்டிருக்கலாம்.",8
மொஹெஞ்சொ-தரோ_அல்லது_சிந்துவெளி_நாகரிகம்,சில நகரங்கள் எரிமலைகளின் சேட்டையால் அழிவுற்று இருக்கலாம்.,6
மொஹெஞ்சொ-தரோ_அல்லது_சிந்துவெளி_நாகரிகம்,சில நகரங்கள் மண் மாரியால் அழிந்ததுண்டு.,5
மொஹெஞ்சொ-தரோ_அல்லது_சிந்துவெளி_நாகரிகம்,"இங்ஙனம் பல்வேறு காரணங்களால் அப்பண்டை மக்கள் வாழ்ந்து வந்த கிராமங்களும் நகரங்களும் கைவிடப்பட்டு, நாளடைவில் மண் மூடப்பட்டு விட்டன.",14
மொஹெஞ்சொ-தரோ_அல்லது_சிந்துவெளி_நாகரிகம்,பல நகரங்கள் கடலுள் ஆழ்ந்தன.,4
மொஹெஞ்சொ-தரோ_அல்லது_சிந்துவெளி_நாகரிகம்,பல ஆற்றங்கரைகளின் அடியில் புதையுண்டு விட்டன.,5
மொஹெஞ்சொ-தரோ_அல்லது_சிந்துவெளி_நாகரிகம்,பல சமவெளிகளில் மண் மேடிட்டுக் கிடக்கின்றன.,5
மொஹெஞ்சொ-தரோ_அல்லது_சிந்துவெளி_நாகரிகம்,"இங்ஙனம் மண் மேடிட்ட இடங்களைத் தோண்டிப் பார்த்து, அவ்விடங்களிற் காணப்பெறும் பலதிறப்பட்ட பொருள்களை.",10
மொஹெஞ்சொ-தரோ_அல்லது_சிந்துவெளி_நாகரிகம்,"ஆராய்ந்து அவற்றைப்பற்றிய உண்மைச் செய்திகளையும், அவற்றைப் பயன்படுத்திய பண்டை மக்களைப்பற்றிய சுவை பயக்கும் செய்திகளையும் அறியும் முயற்சியே.",13
மொஹெஞ்சொ-தரோ_அல்லது_சிந்துவெளி_நாகரிகம்,புதைபொருள் ஆராய்ச்சி எனப்படும்.,3
மொஹெஞ்சொ-தரோ_அல்லது_சிந்துவெளி_நாகரிகம்,ஆராய்ச்சி அவா உண்டானதேன்?,3
மொஹெஞ்சொ-தரோ_அல்லது_சிந்துவெளி_நாகரிகம்,கடல் கொந்தளிப்பால் உண்டான தீமை பைபிளிலும் ரிக்வேதத்திலும் புராணங்களிலும் ஈழ நாட்டவர் பழைய நூல்களிலும் குறிப்பிடப்பட்டுள்ளன.,12
மொஹெஞ்சொ-தரோ_அல்லது_சிந்துவெளி_நாகரிகம்,"பைபிள், ரிக்வேதம், புராணங்கள் முதலிய நூல்களில் குறிப்பிடப்பட்டுள்ள அழகிய நகரங்கள் பல இன்று காணப்படவில்லை.",11
மொஹெஞ்சொ-தரோ_அல்லது_சிந்துவெளி_நாகரிகம்,ஹோமர் என்னும் கிரேக்க கவிஞர் எழுதியுள்ள இலியட் என்னும் நூலில் குறிப்பிடப்பட்டுள்ள ட்ராய் நகரம் எங்கே?,12
மொஹெஞ்சொ-தரோ_அல்லது_சிந்துவெளி_நாகரிகம்,"அப்பொன்னகரைக் கண்டு, அதன் அமைப்பையும் பிறவற்றையும் அறியின், அப்பழங்கால நகரத்தில் வாழ்ந்த மக்களைப்பற்றிய பல செய்திகளை அறிதல் கூடுமன்றோ?",14
மொஹெஞ்சொ-தரோ_அல்லது_சிந்துவெளி_நாகரிகம்,என்று அறிவுடையவர் எண்ணுதல் இயல்பேயாகும்.,4
மொஹெஞ்சொ-தரோ_அல்லது_சிந்துவெளி_நாகரிகம்,நாசரேத்தூர் அடிகள் வாழ்ந்து பல அற்புதச் செயல்களைச் செய்த இடங்கள் பைபிளில் குறிப்பிடப்பட்டுள்ளன.,10
மொஹெஞ்சொ-தரோ_அல்லது_சிந்துவெளி_நாகரிகம்,"ஆனால், அவ்விடங்கள் இன்று காணப்படுகின்றில.",4
மொஹெஞ்சொ-தரோ_அல்லது_சிந்துவெளி_நாகரிகம்,அவை மண்மூடி இருத்தல் வேண்டும்.,4
மொஹெஞ்சொ-தரோ_அல்லது_சிந்துவெளி_நாகரிகம்,"உடனே, அவர்கள் வாழ்ந்த இடங்கள் அகப்படாவோ?",5
மொஹெஞ்சொ-தரோ_அல்லது_சிந்துவெளி_நாகரிகம்,அவை என்ன வாயின?,3
மொஹெஞ்சொ-தரோ_அல்லது_சிந்துவெளி_நாகரிகம்,அவர்தம் பழக்க வழக்கங்கள் நம்மிடம் இன்று இருப்பவைதாமா?,6
மொஹெஞ்சொ-தரோ_அல்லது_சிந்துவெளி_நாகரிகம்,அவற்றை அறிய வேண்டுமே எனப் பலவாறு புத்துணர்ச்சி பெறுகின்றோம்.,7
மொஹெஞ்சொ-தரோ_அல்லது_சிந்துவெளி_நாகரிகம்,இவ்வுணர்ச்சி தோன்றற்கு அறிஞர்கள் அன்புடன் எழுதி வைத்துள்ள அரிய நூல்களே காரணமாகும்.,9
மொஹெஞ்சொ-தரோ_அல்லது_சிந்துவெளி_நாகரிகம்,நாம் இன்று கொண்டுள்ள பழக்க வழக்கங்கள் திடீரென வந்திரா.,7
மொஹெஞ்சொ-தரோ_அல்லது_சிந்துவெளி_நாகரிகம்,அவற்றுள் சில மிகப் பழைய காலந்தொட்டே வந்திருத்தல் வேண்டும்.,7
மொஹெஞ்சொ-தரோ_அல்லது_சிந்துவெளி_நாகரிகம்,"ஒரு வகை நாகரிகம் தோன்றும் பொழுது அஃது, அதற்கு முற்பட்ட நாகரிகத்தின் ஒரு பகுதியைத் தன்னகத்துக் கொண்டே தோற்றமெடுக்கும்.",14
மொஹெஞ்சொ-தரோ_அல்லது_சிந்துவெளி_நாகரிகம்,"இந்த உண்மை, வரலாற்றின் உயிர் நாடியாகும்.",5
மொஹெஞ்சொ-தரோ_அல்லது_சிந்துவெளி_நாகரிகம்,வரலாறு என்பது என்றும் தொடர்புற்று வரும் இயக்கமாகும்.,6
மொஹெஞ்சொ-தரோ_அல்லது_சிந்துவெளி_நாகரிகம்,"இன்றைய ஐரோப்பா, பழைய உரோமப்பேரரசிலிருந்து தோன்றியதாகும்.",5
மொஹெஞ்சொ-தரோ_அல்லது_சிந்துவெளி_நாகரிகம்,அந்த உரோமப் பேரரசும் அலெக்ஸாண்டரது பெரு வெற்றியிலிருந்து பிறந்ததாகும்.,7
