work_title,sentence,sentence_length
மொஹெஞ்சொ-தரோ_அல்லது_சிந்துவெளி_நாகரிகம்,இப்பதுமைகள் மெசொபொட்டேமியாவில் கிடைத்த பறவைப் பதுமைகளை ஒத்துள்ளன.,6
மொஹெஞ்சொ-தரோ_அல்லது_சிந்துவெளி_நாகரிகம்,ஒரு பெண் பதுமையின் தலை மீது இரண்டு புறாக்கள் இருப்பதுபோலச் செய்யப் பட்டுள்ளன.,10
மொஹெஞ்சொ-தரோ_அல்லது_சிந்துவெளி_நாகரிகம்,"இவை அன்றி மைனாக்கள், பருந்துகள் போன்றவையும் அங்கு இருந்தன என்னலாம்.",8
மொஹெஞ்சொ-தரோ_அல்லது_சிந்துவெளி_நாகரிகம்,நாகங்கள் ஹரப்பாவில் பாம்புப் பதுமைகள் கிடைத்துள்ளன சில முத்திரைகள் பாம்பு படம் விரித்தாற் போலச் செதுக்கப் பட்டுள்ளன.,13
மொஹெஞ்சொ-தரோ_அல்லது_சிந்துவெளி_நாகரிகம்,சில பாண்டங்கள் மீதும் பாம்பு உருவம் தீட்டப் பட்டுள்ளது.,7
மொஹெஞ்சொ-தரோ_அல்லது_சிந்துவெளி_நாகரிகம்,அக்கால மக்கள் பாம்பை வணங்கி வந்தனர் பாம்பிற்குப் பால் வார்த்தனர் என்று எண்ணுதற்குரிய குறிகள் காணப்படுகின்றன.,12
மொஹெஞ்சொ-தரோ_அல்லது_சிந்துவெளி_நாகரிகம்,கோழிச்சண்டை மிகப் பழைய காலமுதலே தமிழகத்தில் உண்டு என்பதைப் புறப்பொருள் நூல்களால் உணர்க.,10
மொஹெஞ்சொ-தரோ_அல்லது_சிந்துவெளி_நாகரிகம்,உணவும் உடையும் விளைபொருள்கள் சிந்து ஆற்றுவெளி பருவ மழையும் ஆற்றுப் பாய்ச்சலும் சிறப்புறப் பெற்று விளங்கியதாகும்.,12
மொஹெஞ்சொ-தரோ_அல்லது_சிந்துவெளி_நாகரிகம்,"ஆதலின், அங்கு இருந்த நிலங்கள் செழிப்புற்று இருந்தன வண்டல் மண் படிந்திருந்தன சிறந்த மருதநிலங்களாக விளங்கின.",12
மொஹெஞ்சொ-தரோ_அல்லது_சிந்துவெளி_நாகரிகம்,"ஆதலின், அங்குக் கோதுமை, நெல், வாற் கோதுமை, பருத்தி, பட்டாணி, எள், பேரிந்து, முலாம்பழம் முதலியன ஏராளமாகப் பயிராக்கப்பட்டன.",14
மொஹெஞ்சொ-தரோ_அல்லது_சிந்துவெளி_நாகரிகம்,இன்றும் அப்பகுதிகளில் நெல்லும் கோதுமையும் சிறப்புடை விளை பொருள்களாக இருத்தல் கவனிக்கத் தக்கது.,10
மொஹெஞ்சொ-தரோ_அல்லது_சிந்துவெளி_நாகரிகம்,இப்பலவகை விளைபொருள்களை அப்பண்டை மக்கள் தாழிகளிற் சேமித்து வைத்திருந்தனர்.அத்தாழிகள் நிலத்தில் பாதியளவு புதைக்கப் பட்டிருந்தன.,12
மொஹெஞ்சொ-தரோ_அல்லது_சிந்துவெளி_நாகரிகம்,"ஆற்றுப்பாய்ச்சல் பெற்ற மருத நிலமே, மக்கள் நாகரிக வாழ்க்கை நடத்த ஏற்றதெனத் தமிழ்நூல்களும் சான்று பகர்கின்றன.",12
மொஹெஞ்சொ-தரோ_அல்லது_சிந்துவெளி_நாகரிகம்,"அவற்றைப் பார்வையிட்ட ஆராய்ச்சியாளர், பொதுவாக இந்நகர மக்கள் புலால் உண்ணும் வழக்கத்தினர் என்று கருதுகின்றனர்.",11
மொஹெஞ்சொ-தரோ_அல்லது_சிந்துவெளி_நாகரிகம்,இக்காலத்தில் சோற்றிலேயே இறைச்சியைக் கலந்து தயாரிக்கும் புலவு ஒன்று என்னும் ஒருவகை உணவு அக்காலத்திலும் சமைக்கப்பட்டு வந்தது.,13
மொஹெஞ்சொ-தரோ_அல்லது_சிந்துவெளி_நாகரிகம்,"இத்தாழிகளில் வெள்ளாடு, எருது, செம்மறியாடு இவற்றின் எலும்புகள் கிடைத்துள்ளன.",7
மொஹெஞ்சொ-தரோ_அல்லது_சிந்துவெளி_நாகரிகம்,"எனவே, இவ்விலங்குகளின் இறைச்சிகள் பதப்படுத்தி அடைத்து வைக்கப்பட்டன என்பது உண்மை.",8
மொஹெஞ்சொ-தரோ_அல்லது_சிந்துவெளி_நாகரிகம்,"ஆனால், இப்பதப்படுத்தப்பட்ட இறைச்சித்துண்டங்கள் தினந்தோறும் பயன்படுத்தப்பட்டன என்றோ, விசேட காலங்களிற்றாம் பயன்படுத்தப்பட்டன என்றோ இப்போது திட்டமாகக் கூறுதல் இயலாது.",14
மொஹெஞ்சொ-தரோ_அல்லது_சிந்துவெளி_நாகரிகம்,சமையற் பொருள்கள் அவர்கள் மாவரைத்துப் பலவகை உணவுப் பொருள்கள் செய்யக் கற்றிருந்தனர்.,9
மொஹெஞ்சொ-தரோ_அல்லது_சிந்துவெளி_நாகரிகம்,"வாணல் சட்டி, ஆட்டுக்கல், இட்டலி ஊற்றும் சட்டி இவை கிடைத்துள்ளமையே இம்முடிபுக்குரிய சான்றாகும்.",10
மொஹெஞ்சொ-தரோ_அல்லது_சிந்துவெளி_நாகரிகம்,"குழம்பு கூட்டுவதற்குரிய வேறு கறிகள் செய்வதற்குரிய மசாலைப் பொருள்களை இடித்து, அவற்றைப் பல அறை ப் பெட்டியில் வைத்திருந்தனர்.",14
மொஹெஞ்சொ-தரோ_அல்லது_சிந்துவெளி_நாகரிகம்,உணவு கொண்ட முறை அக்காலத்தவருள் பலர் பாய்கள்மீது அமர்ந்து உணவுப் பொருள்களை எதிரில் வைத்துக்கொண்டு உண்டனர்.,12
மொஹெஞ்சொ-தரோ_அல்லது_சிந்துவெளி_நாகரிகம்,பணக்காரர் நாற்காலிகளில் அமர்ந்து உண்டனர் என்று முத்திரைகளைக் கொண்டு கூறலாம்.,8
மொஹெஞ்சொ-தரோ_அல்லது_சிந்துவெளி_நாகரிகம்,"எனினும், இது ஒரோவழிக் கொண்டிருந்த வழக்கமாகக் கோடலே பொருந்துவதாகும்.",7
மொஹெஞ்சொ-தரோ_அல்லது_சிந்துவெளி_நாகரிகம்,இன்னும் பெரும்பாலான இந்தியர் வீடுகளில் நாற்காலி மேஜைகளை உண்பதற்குப் பயன்படுத்தாமையின் என்க.,9
மொஹெஞ்சொ-தரோ_அல்லது_சிந்துவெளி_நாகரிகம்,"மரம், சிப்பி, சங்கு, களிமண், செம்பு, வெண்கலம் இவற்றாலாய கரண்டிகள், கறிகளையும் குழம்பு, வகைகளையும் சோற்றையும் எடுக்கப் பயன்பட்டன.",14
மொஹெஞ்சொ-தரோ_அல்லது_சிந்துவெளி_நாகரிகம்,"உண்ணற்குதவும் கரண்டிகளோ முட்களோ கிடைக்காமையின், அவர்கள் கைகளாலேயே உணவு பிசைந்து உண்டனர் என்பது தெரிகிறது.",11
மொஹெஞ்சொ-தரோ_அல்லது_சிந்துவெளி_நாகரிகம்,உடைகள் அப்பழைய மக்கள் எத்தகைய உடைகளை எவ்வெவ்வாறு உடுத்திருந்தனர் என்பதை இன்று உறுதிப்படுத்திக் கூறுதற்குரிய சான்றுகள் கிடைத்தில.,13
மொஹெஞ்சொ-தரோ_அல்லது_சிந்துவெளி_நாகரிகம்,எளியவர் சாதாரணப் பருத்தி ஆடைகளை அணிந்திருந்தனர்.,5
மொஹெஞ்சொ-தரோ_அல்லது_சிந்துவெளி_நாகரிகம்,அது சிறந்த வேலைப்பாடு உடையது.,4
மொஹெஞ்சொ-தரோ_அல்லது_சிந்துவெளி_நாகரிகம்,அத்தகைய போர்வைகளைச் செல்வரே பயன்படுத்தி வந்தனர் எனல் தகும்.,7
மொஹெஞ்சொ-தரோ_அல்லது_சிந்துவெளி_நாகரிகம்,அவர்கள் தம் இடக்கையும் மார்பும் மறையுமாறு போர்வை போர்த்தினராதல் வேண்டும்.,8
மொஹெஞ்சொ-தரோ_அல்லது_சிந்துவெளி_நாகரிகம்,"ஆயின், எளிய மக்கள் இடை ஆடையுடனே திருப்தி அடைந்திருந்தனரோ எளிய விலையிற் கிடைத்த போர்வைகளை அணிந்திருத்தனரோ தெரியவில்லை.",13
மொஹெஞ்சொ-தரோ_அல்லது_சிந்துவெளி_நாகரிகம்,மொஹெஞ்சொ தரோவில் பலவகைப் பொத்தான்கள் கிடைத்தன.,5
மொஹெஞ்சொ-தரோ_அல்லது_சிந்துவெளி_நாகரிகம்,"ஆதலின், அந்நகர மக்கள் சட்டைகளை அணிந்திருந்தனர் என்பது வெள்ளிடைமலை.",7
மொஹெஞ்சொ-தரோ_அல்லது_சிந்துவெளி_நாகரிகம்,கழுத்துப் பட்டைகளும் வழக்கில் இருந்தன.,4
மொஹெஞ்சொ-தரோ_அல்லது_சிந்துவெளி_நாகரிகம்,அணங்குகளின் ஆடைச் சிறப்பு பண்டைச் சிந்துவெளிப் பெண்மணிகள் பாவாடைகளைப் பெரிதும் பயன்படுத்தினர் என்பதை முத்திரைகளைக்கொண்டு கூறலாம்.,12
மொஹெஞ்சொ-தரோ_அல்லது_சிந்துவெளி_நாகரிகம்,அவை முன்புறம் ஒரளவு குட்டையாகவும் பின்புறம் நீண்டும் இருந்திருக்கலாம் நாடாக்களைக் கொண்டனவாக இருக்கலாம்.,10
மொஹெஞ்சொ-தரோ_அல்லது_சிந்துவெளி_நாகரிகம்,"பாவாடைகளை இறுக்க, மணிகள் சேர்த்துச் செய்யப் பட்ட அரைக்கச்சைகளை அம்மகளிர் பயன்படுத்தினர்.",9
மொஹெஞ்சொ-தரோ_அல்லது_சிந்துவெளி_நாகரிகம்,அக்கச்சைகளுட் சில முன்புறம் முகப்பு வைக்கப் பட்டுள்ளன.,6
மொஹெஞ்சொ-தரோ_அல்லது_சிந்துவெளி_நாகரிகம்,செல்வர் வீட்டு மகளிர் மெல்லிய மேலாடைகளை அணிந்து வந்தனர்.,7
மொஹெஞ்சொ-தரோ_அல்லது_சிந்துவெளி_நாகரிகம்,எளிய மகளிர் மேலாடைகளைப்பற்றி ஒன்றும் கூறக்கூடவில்லை.,5
மொஹெஞ்சொ-தரோ_அல்லது_சிந்துவெளி_நாகரிகம்,மொஹெஞ்சொ தரோவில் இன்னும் தோண்டி எடுக்கப்படாத பகுதி பத்தில் ஒன்பது பங்கு.,9
மொஹெஞ்சொ-தரோ_அல்லது_சிந்துவெளி_நாகரிகம்,"ஆதலின், இன்றுள்ள நிலைமையில் எதனையும் உறுதியாகக் கூறக் கூடவில்லை என்பது இங்கு நினைவில் இருத்தத் தக்கது.",12
மொஹெஞ்சொ-தரோ_அல்லது_சிந்துவெளி_நாகரிகம்,மொஹெஞ்சொ தரோவில் கிடைத்த களிமண் படிவங்களுள் ஆண் உருவங்கள் பெரும்பாலான ஆடை இன்றியே காண்கின்றன.,11
மொஹெஞ்சொ-தரோ_அல்லது_சிந்துவெளி_நாகரிகம்,பெண் உருவங்கள் அனைத்தும் ஆடையுடனே காணப்படுகின்றன.,5
மொஹெஞ்சொ-தரோ_அல்லது_சிந்துவெளி_நாகரிகம்,ஐந்து இம் முடியே பொருத்தமானது.,4
மொஹெஞ்சொ-தரோ_அல்லது_சிந்துவெளி_நாகரிகம்,"முண்டாசு கட்டிய மகளிர் மொஹெஞ்சொ தரோவிற் கிடைத்த பெண் வடிவங்களுட்பல, தலையில் ஒருவகை முண்டாசுடன் காணப்படுகின்றன.",12
மொஹெஞ்சொ-தரோ_அல்லது_சிந்துவெளி_நாகரிகம்,சில ஆண் படிவங்களிலும் இத்தகைய முண்டாசுகள் உள்ளன.,6
மொஹெஞ்சொ-தரோ_அல்லது_சிந்துவெளி_நாகரிகம்,இத் தலை முண்டாசுகள் பருத்தியால் ஆனவை நிமிர்ந்து விசிறிபோல விரைப்புடன் இருக்குமாறு ஓரங்களில் பட்டை வைத்துத் தைக்கப்பட்டவை கனமானவை.,14
மொஹெஞ்சொ-தரோ_அல்லது_சிந்துவெளி_நாகரிகம்,இத்தகைய முண்டாசுகளை மங்கோலிய மகளிர் இன்றும் தலையில் அணிகின்றனர் என்பது நன்கு கவனித்தத் தக்கது.,11
மொஹெஞ்சொ-தரோ_அல்லது_சிந்துவெளி_நாகரிகம்,ஆறு கால் சட்டையோ?,3
மொஹெஞ்சொ-தரோ_அல்லது_சிந்துவெளி_நாகரிகம்,"தெய்வங்கள் எனக் கருதப்படும் ஆண் உருவங்கள் சில, முழங்கால் அளவுவரை துண்டுகளை உடுத்தியுள்ளன போலத் தோன்றுகின்றன.",12
மொஹெஞ்சொ-தரோ_அல்லது_சிந்துவெளி_நாகரிகம்,ஆயின் ஒரு படிவம் மட்டுமே முழங்காலுக்குக் கீழே தொங்குமாறு வேட்டிகட்டியுள்ளதுபோலத் தோற்றுகிறது.,9
மொஹெஞ்சொ-தரோ_அல்லது_சிந்துவெளி_நாகரிகம்,உட்கார்ந்திருக்கும் மற்றோர் ஆண் உருவம் நீண்ட வேட்டியுடன் காணப்படுகிறது.,7
மொஹெஞ்சொ-தரோ_அல்லது_சிந்துவெளி_நாகரிகம்,ஹரப்பாவில் கிடைத்த மட்பாண்டத்தின் மீதுள்ள ஒவியம் ஒன்றில் காணப்படும் மனித உருவம் கால் சட்டை அணிந்திருப்பது போலத் தோற்றுகிறது.,14
மொஹெஞ்சொ-தரோ_அல்லது_சிந்துவெளி_நாகரிகம்,உண்மை உணரக் கூடவில்லை.,3
மொஹெஞ்சொ-தரோ_அல்லது_சிந்துவெளி_நாகரிகம்,இவ்வொன்றுதான் ஆடையே இன்றிக் காணப்படுகின்றது.,4
மொஹெஞ்சொ-தரோ_அல்லது_சிந்துவெளி_நாகரிகம்,இதைப்போலவே ஹரப்பாவிலும் வெண்கலப் படிவம் ஒன்று கிடைத்துள்ளது.,6
மொஹெஞ்சொ-தரோ_அல்லது_சிந்துவெளி_நாகரிகம்,அப்பெண் படிவங்கள் நீக்ரோ இனப்பெண்ணைக் குறிப்பனவாகவே தோற்று கின்றனவாம்.,7
மொஹெஞ்சொ-தரோ_அல்லது_சிந்துவெளி_நாகரிகம்,அப்பதுமைகள் இரண்டும் நடனச் செயலைக் குறிக்கின்றன.,5
மொஹெஞ்சொ-தரோ_அல்லது_சிந்துவெளி_நாகரிகம்,வலக்கை இடுப்பின்மீது இருக்கிறது.,3
மொஹெஞ்சொ-தரோ_அல்லது_சிந்துவெளி_நாகரிகம்,பண்டை எகிப்தில் நடனமாதர் ஆடையின்ளிச் சில வேளைகளில் நடிப்பது வழக்கமாம்.,8
மொஹெஞ்சொ-தரோ_அல்லது_சிந்துவெளி_நாகரிகம்,ஏழு அப்பழக்கம் சிந்து நாட்டிலும் இருந்திருத்தல் வேண்டும் என்று அறிஞர் கருதுகின்றனர்.,9
மொஹெஞ்சொ-தரோ_அல்லது_சிந்துவெளி_நாகரிகம்,பண்டைத் தமிழ் மக்களுட் சிலர் திருமண விருந்துகளிலும் புலவு செய்து உண்டு வந்தனர்.,10
மொஹெஞ்சொ-தரோ_அல்லது_சிந்துவெளி_நாகரிகம்,பண்டைத் தமிழர் ஏற்றுமதிப் பொருள்களில் உப்புப்படுத்திய மீனும் ஒன்றாகும் என்பது இங்கு அறியத்தக்கது.,10
மொஹெஞ்சொ-தரோ_அல்லது_சிந்துவெளி_நாகரிகம்,நாராடை மரவுரி போன்றது.,3
மொஹெஞ்சொ-தரோ_அல்லது_சிந்துவெளி_நாகரிகம்,"இஃது அப்பழங்காலத்தில் உபயோகிக்கப்பட்டதை அறிவிப்பதற்கே போலும், இன்றைய மக்கள் நார்ப்பட்டை விசேட காலங்களில் அணிகின்றனர்.",11
மொஹெஞ்சொ-தரோ_அல்லது_சிந்துவெளி_நாகரிகம்,"பண்டைத் தமிழகத்தில் விறலியர் விசேட காலங்களில் ஆடையின்றித் தழையை அரையிற் கட்டிக்கொண்டு ஆடுதல் மரபு நற்றிணை, நூற்றி எழுபது.",14
மொஹெஞ்சொ-தரோ_அல்லது_சிந்துவெளி_நாகரிகம்,"அணிகலன்கள் அணிகலன்கள் சிந்துப் பிரதேச மக்களின் உடை வகைகளை ஒவியங்கள், சிற்பங்கள் முதலியவற்றைக் கொண்டே அறிய வேண்டி இருக்கின்றன.",14
மொஹெஞ்சொ-தரோ_அல்லது_சிந்துவெளி_நாகரிகம்,"ஆனால், அவர்கள் மகிழந்தேற்ற அணிகலன்கள் நிரம்பக் கிடைத்துள்ளமையால், அவற்றைப் பற்றித் தெளிவான உண்மைகளை உணர இடம் ஏற்பட்டுள்ளது.",13
மொஹெஞ்சொ-தரோ_அல்லது_சிந்துவெளி_நாகரிகம்,"எளிய மக்கள் கறுப்பு சிவப்புக் களிமண்ணால் நகைகள் செய்து சூளையிட்டு, அணிந்து வந்தனர்.",10
மொஹெஞ்சொ-தரோ_அல்லது_சிந்துவெளி_நாகரிகம்,"சிலர் ஒளிக்கற்களால் நகைகள் செய்து மெருகிட்டு, அவற்றில், வித விதமான நிறங்களைத் தீட்டி ஒளி வீசச் செய்து அணிந்துவந்தனர்.",14
மொஹெஞ்சொ-தரோ_அல்லது_சிந்துவெளி_நாகரிகம்,"செம்பு, சலவைக்கல், ஒருவகைக் கருங்கல், சங்கு எலும்பு, களிமண் இவற்றால் ஆன வளையல்கள் மிகப் பல கிடைத் துள்ளன.",14
