work_title,sentence,sentence_length
மனத்தின்_தோற்றம்,மனத்தின் தோற்றம் பேரா.,3
மனத்தின்_தோற்றம்,"இரண்டாம் தெரு, வேங்கடங்கர் புதுச்சேரி அறுநூற்று ஐந்து ஆயிரத்து பதினொன்று .",8
மனத்தின்_தோற்றம்,﻿முன்னுரை மனத்தின் தோற்றம் என்னும் இந்த நூல் பதினாறு ஆய்வுக் கட்டுரைகளின் தொகுப்பாகும்.,10
மனத்தின்_தோற்றம்,"இவற்றுள், முதல் கட்டுரையாகிய மனத்தின் தோற்றம் என்பதே நூலுக்குப் பெயராகச் சூட்டப் பெற்றுள்ளது.",10
மனத்தின்_தோற்றம்,இதற்காக நாம் சோர்ந்து விடக் கூடாது.,5
மனத்தின்_தோற்றம்,கதை படிக்கும் எளிய பயிற்சி நிலையிலேயே வைத்து நிலையாக மக்களைப் பழக்கி விடலாகாது.,10
மனத்தின்_தோற்றம்,கதையல்லாத மற்ற ஆய்வுச் செய்திகளையும் படிக்கும் பொறுமையினையும் படித்துச் சுவைக்கும் திறனையும் வளர்த்துவிட வேண்டியது நம் போன்றோர் கடமையாகும்.,14
மனத்தின்_தோற்றம்,"கதையல்லாத ஆய்வுச் செய்திகளைப் படிப்பதால், பல்வேறு செய்திகளைப் பற்றி அறிந்து பயன்பெறும் வளமான வாய்ப்பு பெறப்படும்.",12
மனத்தின்_தோற்றம்,கட்டுரைகள் உருப்பெறப் பல மேற்கோள் நூல்கள் துணைபுரிந்துள்ளன.,6
மனத்தின்_தோற்றம்,"இந்நூல்களால், பழந்தமிழ் அறிஞர்கள் பல துறைகளில் பெற்றுள்ள அறிவுவளம் அறியவரும்.",8
மனத்தின்_தோற்றம்,எனது நூலையும் வரவேற்று வாழ்த்து நல்க வேண்டு கிறேன்.,7
மனத்தின்_தோற்றம்,நூலை நன்முறையில் அச்சிட்டுத் தந்த சிதம்பரம் சபாநாயகம் அச்சகத்தாருக்கு நன்றி செலுத்துகிறேன்.,9
மனத்தின்_தோற்றம்,அன்பன் சுந்தர சண்முகன் பொருளடக்கம் பக்கம் ஒன்று.,6
மனத்தின்_தோற்றம்,கம்பரின் தமிழ்ப் படலம் நாற்பத்தாறு ஐந்து.,5
மனத்தின்_தோற்றம்,குற்றாலத்திற்கு ஒரு குறவஞ்சி எண்பத்தைந்து எட்டு.,5
மனத்தின்_தோற்றம்,தமிழ் வளர்ச்சிக்கு இலக்கணப் புலவர்களின் நன்கொடை நூற்றி ஒன்று ஒன்பது.,8
மனத்தின்_தோற்றம்,தமிழ் வளர்ச்சிக்கு மொழியியலாரின் பங்கு நூற்றி ஒன்பது பத்து.,7
மனத்தின்_தோற்றம்,பிரபுலிங்கலீலை ஒர் அறிமுகம் நூற்றி இருபத்திரண்டு பதினொன்று .,6
மனத்தின்_தோற்றம்,மணிமேகலையில் பழக்க வழக்க மரபுகள் நூற்றி எழுபத்தொன்று பதிமூன்று .,7
மனத்தின்_தோற்றம்,திராவிட மொழிகளில் சில சொல்லாட்சிகளும் சொற்சுவைகளும் நூற்றி தொன்னூற்றொன்பது பதினைந்து .,8
மனத்தின்_தோற்றம்,சிலம்பில் இரு குரவைகள் இருநூற்று பதிமூன்று  பதினாறு .,6
மனத்தின்_தோற்றம்,மனத்தின் தோற்றம் உயிரின் தோற்றம் போலவே மனத்தின் தோற்றமும் ஆராயத்தக்கது.,8
மனத்தின்_தோற்றம்,"மனம், புத்தி அகங்காரம், சித்தம், என நான்கு உட்கருவிகள் இருப்பதாக இந்தியத் தத்துவவாதிகள் சிலர் கூறுகின்றனர்.",12
மனத்தின்_தோற்றம்,"மனம் என்பது நெஞ்சில் இருப்பதாக அப்பாவிகள் சிலரும், மனம் என்பது இதயத்தில் இருப்பதாக வேறு சிலரும் எண்ணிக் கொண்டிருக்கின்றனர்.",14
மனத்தின்_தோற்றம்,ஆன்மாவே மனம் என்பது சிலரது கருத்து.,5
மனத்தின்_தோற்றம்,மனம் ஒரு தனிப் பொருள் அது மூளையில் தங்கியிருக்கிறது என்பர் சிலர்.,9
மனத்தின்_தோற்றம்,உடலிலேயே ஏற்படும் ஒரு வகை உணர்ச்சியே மனம் என்பது ஒரு சாரார் கருத்து.,10
மனத்தின்_தோற்றம்,மனம் ஒர் அணு என்பர் சிலர்.,5
மனத்தின்_தோற்றம்,"உடல் இயக்க செயல்பாடுகளைக் கொண்டு, மனம் என்னும் ஒர் ஆற்றல் இருப்பது புலனாகிறது எனப் பரிணாமக் கொள்கையினர் கூறுகின்றனர்.",14
மனத்தின்_தோற்றம்,தூண்டல் துலங்கல் என்றால் என்ன?,4
மனத்தின்_தோற்றம்,"அவ்வாறே மூளையும் நேராகத் தொடர்பு கொள்ளாமல், தண்டுவடத்தின் வாயிலாகவே பொறிகள், சுரப்பிகள் முதலியவற்றோடு தொடர்பு கொள்கிறது.",12
மனத்தின்_தோற்றம்,மூளைக்குக் கீழே தண்டுவடம் உள்ளது.,4
மனத்தின்_தோற்றம்,"எனவே, தண்டு வடத்தை, பல மறிவினைகளின் இருப்பிடம் எனக் கூறலாம்.",8
மனத்தின்_தோற்றம்,"இது, தண்டு வடம் செய்யும் ஒரு வகை மறிவினை ஆகும்.",8
மனத்தின்_தோற்றம்,இங்கே நெருப்பு தூண்டல் ஆகும் கையை இழுத்துக்கொள்வது துலங்கல் எனப்படும்.,8
மனத்தின்_தோற்றம்,"இங்கே, ஐம் பொறிகளுள் மெய் என்னும் ஒரு பொறியின் ஊறு என்னும் புலன் தொடர்பான தூண்டல் துலங்கலை அறிந்தோம்.",14
மனத்தின்_தோற்றம்,"இதே போன்று, வாய், கண், மூக்கு, செவி என்னும் மற்ற நான்கு பொறிகள் தொடர்பாகவும் தூண்டலுக்குத் துலங்கல் உண்டு.",14
மனத்தின்_தோற்றம்,இவ்வாறு எல்லாச் செயல்களிலும் தூண்டல் துலங்கல் இருப்பதைக் காணலாம்.,7
மனத்தின்_தோற்றம்,"எனவே, நரம்பு கயிறுபோல் இருந்து மூளையையும் மற்ற பகுதிகளையும் இணைக்கிறது என்பது தெளிவு.",10
மனத்தின்_தோற்றம்,குப்பாயம் என்றால் சட்டை என்று பொருளாகும்.,5
மனத்தின்_தோற்றம்,இக்கால அறிவியல் தோன்றுவதற்குப் பலநூற்றாண்டுகட்கு முன்பே தமிழர்கள் நரம்பின் இயக்கத்தை அறிந்திருந்தனர் என்பதற்காக இவை ஈண்டு எடுத்துக்காட்டப் பட்டன.,14
மனத்தின்_தோற்றம்,இவ்வாறு பல அலகுகள் உள்ளன.,4
மனத்தின்_தோற்றம்,இத்தகைய தூண்டல் துலங்கல் செயல்களின் தொகுப்பே உளம் ஆகும் என்பது இக்கால உளவியல் கொள்கை.,11
மனத்தின்_தோற்றம்,"எனவே, ஒருவகை உடல் இயக்கச் செயல்பாடே குறிப்பாக மூளை இயக்கமே மனம் என உணரப்படுகிறது.",11
மனத்தின்_தோற்றம்,இக் கொள்கை மிகவும் பொருத்தமானதாகத் தோன்றுகிறது.,5
மனத்தின்_தோற்றம்,இங்கே ஒரு சாராரின் மாறுபட்ட கருத்து ஒன்றுக்குப் பதில் தரவேண்டியுள்ளது.,8
மனத்தின்_தோற்றம்,"நம்மிடம் ஒருவர் ஏதாவது சொல்லுங்கால், மனம் ஈடுபடாவிடின் அவர் சொன்னது கேட்காது புரியாது.",10
மனத்தின்_தோற்றம்,உண்ணுங்கால் மனம் வேறொன்றில் ஈடுபட்டிருப்பின் சுவை தெரியாது.,6
மனத்தின்_தோற்றம்,"மனம் வன்மையாக வேறொன்றில் நாட்டம் கொண்டிருப்பின், உடம்பில் எறும்பு கடித்தாலும் தெரியாது.",9
மனத்தின்_தோற்றம்,இங்கே மனம் என்னும் ஒன்று தேவையில்லை.,5
மனத்தின்_தோற்றம்,இவ்வாறு எல்லாப் பொறிகளின் துண்டலுக்கும் கொள்ள வேண்டும்.,6
மனத்தின்_தோற்றம்,இது கவனக்குறைவு அன்று இது கவன மாற்றம் ஆகும்.,7
மனத்தின்_தோற்றம்,"அஃதாவது, ஒரு தூண்டலுக்குத் துலங்க வேண்டிய நேரத்தில் வேறு துண்டலுக்குத் துலங்கிக் கொண்டிருக்கிறோம் என்பது இதற்குப் பொருளாகும்.",13
மனத்தின்_தோற்றம்,நினைவும் மறதியும் ஈண்டு மறதி என்பது ஒப்புநோக்கத் தக்கது.,7
மனத்தின்_தோற்றம்,"ஒன்றை நினைத்திருக்க வேண்டிய நேரத்தில், அதனை விட்டு, வேறொன்றில் நினைப்பு இருப்பது தானே மறதி !",11
மனத்தின்_தோற்றம்,"எனவே, நினைவு மாற்றமே மறதி எனப்படும்.",5
மனத்தின்_தோற்றம்,நினைவும் மறதியும் ஒரு நாணயத்தின் இரு பக்கங்கள் போன்றவை எனலாம். ஒன்றின்றி மற்றொன்றில்லை.,10
மனத்தின்_தோற்றம்,ஒன்றை மறந்தால்தான் இன்னொன்றை நினைக்கலாம் ஒன்றை நினைத்தால்தான் மற்றொன்றை மறக்கலாம்.,8
மனத்தின்_தோற்றம்,மரத்தால் செய்யப்பட்ட யானையை எடுத்துக் கொள்வோம்.,5
மனத்தின்_தோற்றம்,அதை மரம் என்று நினைக்கும்போது யானையை மறந்து விடுகிறோம் அதை யானை என்று நினைக்கும்போது மரத்தை மறந்து விடுகிறோம்.,14
மனத்தின்_தோற்றம்,"இதைத் தான், திருமூலர் தமது திருமந்திர நூலில், மரத்தை மறைத்தது மாமத யானை மரத்தில் மறைந்தது மாமத யானை.",14
மனத்தின்_தோற்றம்,என்னும் பாடலில் மிகவும் நயமாகக் கூறியுள்ளார்.,5
மனத்தின்_தோற்றம்,"என்று கூறி, அவனைத் தழுவாமல் ஊடல் கொண்டாளாம்.",6
மனத்தின்_தோற்றம்,உள்ளினேன் என்றேன் மற்று என் மறந்தீர் என்றென்னைப் புல்லாள் புலத்தக்க னள்.,9
மனத்தின்_தோற்றம்,"மனைவி என்னும் துண்டலுக்குத் துலங்காமல், வேறொன்றிற்குத் துலங்கியதை இது குறிக் கின்றது.",9
மனத்தின்_தோற்றம்,அன்னார் வேறொன்றும் கூறுவர் திறமை மிக்க ஒருவர் ஒரே நேரத்தில் பல செய்தி களுக்கு ஈடு கொடுக்கிறார்.,13
மனத்தின்_தோற்றம்,அனைவராலும் இது செய்ய வியலாது.,4
மனத்தின்_தோற்றம்,ஆற்றல் மிக்க ஓரிருவரே இதனைச் செய்ய வியலும்.,6
மனத்தின்_தோற்றம்,அவர் களும் சில நேரத்தில் தவறிப் போவதுண்டு.,6
மனத்தின்_தோற்றம்,"எனவே, மனம் எனத் தனியாக ஒன்றும் இல்லை உடற் கூற்றின் ஒருவகை இயக்கமே மன உணர்வாகும்.",12
மனத்தின்_தோற்றம்,"எந்தத் தூண்டலும் அங்கே இல்லாமலேயே, பல எண்ணங்களின் மேல் எவ்வாறு துலங்கிக் கொண்டிருக்கிறான்?",10
மனத்தின்_தோற்றம்,"எனவே, மனம் என ஒன்று இருந்து கொண்டே அவ்வாறு செய்து கொண்டிருக்கிறது என்பது புலனாக வில்லையா?",12
மனத்தின்_தோற்றம்,"என்பதாக, மாற்றுக் கொள்கையினர் வினவலாம்.",4
மனத்தின்_தோற்றம்,இதற்குப் பதில் வருமாறு மூளையில் பல மடிப்புகள் உள்ளன.,7
மனத்தின்_தோற்றம்,மனிதன் ஐம்பொறி புலன்களால் அறிந்த செய்திகள் அனைத்தும் அவ்வப்போது மூளையில் பதிவாகி விடுகின்றன.,10
மனத்தின்_தோற்றம்,"ஒருமுறை எழுதியதை அழித்தால்தான், மறுமுறை எழுதுவது புரியும்.",6
மனத்தின்_தோற்றம்,"அதேபோல, நாடாவில் ஒலியை ஒரு முறை மட்டும் பதிவு செய்தால்தான், மீண்டும் அவ் வொலியைக் கேட்க முடியும்.",13
மனத்தின்_தோற்றம்,இத்தகைய வியத்தகு ஆற்றலும் அமைப்பும் மூளைக்கு உண்டு.,6
மனத்தின்_தோற்றம்,இங்கே துண்டல் எதுவும் இல்லையே என்று வினவலாம்.,6
மனத்தின்_தோற்றம்,ஏன் தூண்டல் இல்லை !,3
மனத்தின்_தோற்றம்,"எனவே, இதற்கு மனம் என ஒன்று தனியாக இருக்க வேண்டியதில்லை.",8
மனத்தின்_தோற்றம்,"ஆகவே, எவ்வாறு நோக்கினும், உடற் கூற்றின் ஒருவகை இயக்கமே சிறப்பாக முளையின் இயக்கமே மன உணர்வாகும் என்பது வெளிப்படை.",14
மனத்தின்_தோற்றம்,"மக்களாகிய உயர்திணை உயிரிகட்கேயன்றி, அஃறிணை, உயிரிகட்கும் துண்டல் துலங்கல் செயல்பாடுகள் இருப் பதைப் பரக்கக் காணலாம்.",12
மனத்தின்_தோற்றம்,"எனவே, அவையும் மன உணர்வு உடையன என்பது விளங்கும்.",7
மனத்தின்_தோற்றம்,"எனவே, கையே மனிதன் என்னும் கொள்கை உறுதியாகிறது.",6
மனத்தின்_தோற்றம்,முடிவான கருத்து மனம் என ஒன்று தனியாக இல்லை மூளையின் இயக்கமே மனம் என்ப்படுகிறது என்பது என் கருத்து.,14
மனத்தின்_தோற்றம்,"எனக்குப் பின்னால், நன்றி கூற வந்த ஒருவர் என் கருத்தை மறுத்துப் பேசினார்.",10
மனத்தின்_தோற்றம்,பின்பு நான் அவரை மறுத்தேன்.,4
மனத்தின்_தோற்றம்,இவ்வாறு சிறிது நேரம் இருவரும் மாறி மாறி மறுப்பு தெரிவித்துக் கொண்டிருந்தோம்.,9
மனத்தின்_தோற்றம்,"அப்போது, சங்கத்தின் நிறுவனர், எனக்கு மறுப்பு தெரிவித்தவரை அமரும்படிச் சொல்லி விட்டார்.",9
மனத்தின்_தோற்றம்,அதோடு இது முடிந்தது.,3
மனத்தின்_தோற்றம்,"நான் பல இடங்களில், இது தொடர்பான வாய்ப்பு கிடைத்த போதெல்லாம் எனது கருத்தைக் கூறிவந்திருக்கிறேன்.",11
மனத்தின்_தோற்றம்,அங்கு அடிக்கடிப் பலதுறைகள் பற்றிக் கருத்தரங்குகள் நடைபெறும் ஒரு நாள் மருத்துவத் துறைக் கருத்தரங்கு நடைபெற்றது.,12
மனத்தின்_தோற்றம்,"இதில், பல்வேறு மருத்துவத்துறைப் பிரிவிலும் வல்லுநர்கள் பலர் கலந்து கொண்டு உரையாற்றினர்.",9
மனத்தின்_தோற்றம்,எனக்குப் பெயர் நினைவில்லை.,3
மனத்தின்_தோற்றம்,யான் எனது கருத்தை ஒத்து நோக்கி மகிழ்ச்சி யுற்றேன்.,7
மனத்தின்_தோற்றம்,திருவாசகம் ஆசைப் பத்து இரண்டு.,4
மனத்தின்_தோற்றம்,சீவக சிந்தாமணி கனக மாலையார் இலம்பகம் இருபத்தொன்று.,6
மனத்தின்_தோற்றம்,மக்கள் எல்லோருமே தத்தம் உடைமைகளைப் பாதுகாப்பதில் கண்ணுங்கருத்துமாய் இருப்பதைக் காண்கின்றோம்.,8
மனத்தின்_தோற்றம்,"ஏனைய உடைமைகளை இழந்து விட்டால், அரிய விலை தந்து அரும்பாடுபட்டாவது திரும்பப் பெற்றாலும் பெறலாம்.",11
மனத்தின்_தோற்றம்,ஆனால் உடலுறுப்புகளை யிழந்து அவற்றைத் திரும்பப் பெற முடியாதன்றோ?,7
மனத்தின்_தோற்றம்,அதனாலேயே உறுப்புகளை ஏனைய உடைமைகளினும் மிகுதியாகப் போற்றுகிறோம்.,6
மனத்தின்_தோற்றம்,ஒடும் வழியில் ஒரு படைபட்டுக் கை வெட்டுண்டு விழுந்தாலும் அதைப்போட்டு விட்டு ஒடுகின்றனர்.,10
மனத்தின்_தோற்றம்,"கால் வெட்டுண்டாலும், முடிந்தவரை தரையில் ஊர்ந்து ஊர்ந்து நகர முயல்கின்றனர்.",8
மனத்தின்_தோற்றம்,"இங்ஙனம் தம் உடைமைகள், உடலுறுப்புகள் இவற்றையெல்லாம் மனமார விட்டுவிட்டு வெளியில் ஒடுகின்றார்களே !",9
மனத்தின்_தோற்றம்,எதைக் காப்பதற்காக இவற்றையெல்லாம் விட்டுவிட்டு ஒடுகின்றார்கள்?,5
மனத்தின்_தோற்றம்,தம் உயிரைக் காப்பதற்காக வன்றோ?,4
