work_title,sentence,sentence_length
மொஹெஞ்சொ-தரோ_அல்லது_சிந்துவெளி_நாகரிகம்,"அகலம் எட்டு செ.மீ, கனம் நூற்றி எண்பது செ.",8
மொஹெஞ்சொ-தரோ_அல்லது_சிந்துவெளி_நாகரிகம்,"அவற்றின் மீது ஒருவகைப் பொருள் தடவப்பட்டு, அப்பொருள்மீது எழுதப்பட்டிருக்கலாம் என்பது அறிஞர் கருத்து.",10
மொஹெஞ்சொ-தரோ_அல்லது_சிந்துவெளி_நாகரிகம்,"பதினொன்று  கணக்கற்ற முத்திரைகளிற் காணப்படும் சித்திர எழுத்துகளைக் கானின், சிந்து வெளி மக்களது எழுத்து முறையை நன்கு அறியலாம்.",14
மொஹெஞ்சொ-தரோ_அல்லது_சிந்துவெளி_நாகரிகம்,அவ்வெழுத்துகள் இன்று வசிக்கப்படவில்லை.,3
மொஹெஞ்சொ-தரோ_அல்லது_சிந்துவெளி_நாகரிகம்,ஹீராஸ் என்னும் பாதிரியார் ஒருவரும் இத்தகைய ஆராய்ச்சிப் பணியில் இறங்கியுள்ளார்.அவரும் விரைவில் நூல் ஒன்றை வெளியிடுவார்.,13
மொஹெஞ்சொ-தரோ_அல்லது_சிந்துவெளி_நாகரிகம்,இங்ஙனம் அறிஞர் பலர் கவனத்தையும் ஈர்த்துள்ள அற்புத எழுத்துக்களைப் பண்டைச் சிந்துப் பிரதேச மக்கள் பயன்படுத்தியுள்ளனர்.,12
மொஹெஞ்சொ-தரோ_அல்லது_சிந்துவெளி_நாகரிகம்,தொலைவில் நடு ஆசியாவிலிருந்து எகிப்து வரை வாணிபம் நடத்தி வந்தனர்.,8
மொஹெஞ்சொ-தரோ_அல்லது_சிந்துவெளி_நாகரிகம்,திரைகடல் ஒடியும் திரவியம் தேடு என்பதற்கு அப்பெருமக்களே சான்றாவர்.,7
மொஹெஞ்சொ-தரோ_அல்லது_சிந்துவெளி_நாகரிகம்,அவர்கள் இந்தியாவின் பல பகுதியிலிருந்தும் தமக்கு வேண்டிய பொருள்களைப் பெற்று உள்நாட்டு வாணிபத்தையும் வளர்த்து வந்தனர்.,12
மொஹெஞ்சொ-தரோ_அல்லது_சிந்துவெளி_நாகரிகம்,சிற்பக் கலை சிந்து வெளி மக்கள் சிற்பக் கலையைத் தோற்றுவித்தவர் என்னல் தவறாகாது.,10
மொஹெஞ்சொ-தரோ_அல்லது_சிந்துவெளி_நாகரிகம்,மொஹெஞ்சொ தரோவிற் கிடைத்த சுண்ணாம்புக்கல் கொண்டு செய்யப்பட்டிருந்த சிலை ஒன்று அறிஞர் கவனத்தை ஈர்த்தது.,11
மொஹெஞ்சொ-தரோ_அல்லது_சிந்துவெளி_நாகரிகம்,"அவ்வுருவம் யோகியின் உருவம் என்றும், சமயத் தலைவர் உருவம் என்றும் அறிஞர் பலவாறு கருதுகின்றனர்.",11
மொஹெஞ்சொ-தரோ_அல்லது_சிந்துவெளி_நாகரிகம்,அவ்வுருவம் சித்திரத் தையலைக்கொண்ட போர்வை ஒன்றைப் போர்த்துள்ளது மீசையின்றித் தாடியை மட்டும் வைத்துள்ளது அத்தாடி ஒழுங்குபெற அமைக்கப்பட்டுள்ளது.,13
மொஹெஞ்சொ-தரோ_அல்லது_சிந்துவெளி_நாகரிகம்,"தலைமயிர் ஒழுங்காகச் சீவப்பெற்று, வட்டப் பதக்கத்துடன் கூடிய தலையணியால் அழுத்தப்பட்டுள்ளது.இந்த அமைப்பு முறை கண்கவர் வனப்பினது.",13
மொஹெஞ்சொ-தரோ_அல்லது_சிந்துவெளி_நாகரிகம்,ஹரப்பாவில் கிடைத்துள்ள கற்சிலைகள் சிந்து வெளி மக்களின் சிற்பக்கலை அறிவைத் திறம்படக் காட்டுவனவாம்.,10
மொஹெஞ்சொ-தரோ_அல்லது_சிந்துவெளி_நாகரிகம்,அவை வியக்கத்தக்க முறையில் செய்யப்பட்டுள்ளன.,4
மொஹெஞ்சொ-தரோ_அல்லது_சிந்துவெளி_நாகரிகம்,இவ்வாடவர் சிலைகள் மணற் கல்லாலும் பழுப்பு நிறக் கல்லாலும் செய்யப்பட்டுள்ளன.,8
மொஹெஞ்சொ-தரோ_அல்லது_சிந்துவெளி_நாகரிகம்,இக்கற்கள் சிந்து வெளியிற் கிடைப்பன அல்ல வெளி இடங்களிலிருந்தே கொண்டுவரப் பட்டவை.,9
மொஹெஞ்சொ-தரோ_அல்லது_சிந்துவெளி_நாகரிகம்,இக்கற்களைப் பிற்கால இந்தியர் இன்றளவும் சிலைகட்குப் பயன்படுத்த அறிந்திலர் என்பது கவனிக்கத் தக்கது.,10
மொஹெஞ்சொ-தரோ_அல்லது_சிந்துவெளி_நாகரிகம்,சிற்பக் கலை கிரேக்கரிடமிருந்துதான் இந்தியாவிற்கு வந்தது என்று இதுகாறும் கூறி வந்தது இன்று தவறாகிவிட்டது.,11
மொஹெஞ்சொ-தரோ_அல்லது_சிந்துவெளி_நாகரிகம்,அவர்தம் கலை தோன்றற்கு முன்னரே சிந்துவெளி மக்கள் சிற்பக் கலையைத் தோற்றுவித்தனராதல் வேண்டும்.,10
மொஹெஞ்சொ-தரோ_அல்லது_சிந்துவெளி_நாகரிகம்,இந்தியச் சிற்பக் கலை இந்தியாவிற்கே உரியது என்று சர்ஜான் மார்ஷல் கூறியுள்ளது கவனிக்கத் தக்கது.,11
மொஹெஞ்சொ-தரோ_அல்லது_சிந்துவெளி_நாகரிகம்,பதிமூன்று  வெண்கலத்தாற் செய்யப்பட்ட நடனமாதின் உருவம் ஒன்றும் சிந்துவெளி மக்களின் சிற்ப அறிவைச் சிறப்புறக் காட்டுவதாகும்.,12
மொஹெஞ்சொ-தரோ_அல்லது_சிந்துவெளி_நாகரிகம்,"அதனைப்பற்றி வியந்து எழுதாத அறிஞர் இலர் எனின், அதன் வேலைப்பாட்டுச் சிறப்பை என்னென்பது !",10
மொஹெஞ்சொ-தரோ_அல்லது_சிந்துவெளி_நாகரிகம்,வெண்கல வார்ப்படங் கொண்டு செய்யப்பட்ட அவ்வுருவம் வழவழப்பாகவும் ஒழுங்காகவும் அமைந்துள்ளது வியப்புக்கு உரியதேயாகும்.,10
மொஹெஞ்சொ-தரோ_அல்லது_சிந்துவெளி_நாகரிகம்,சில உருவச் சிலைகள் நடனம் செய்வத்ற்கு ஏற்றவாறு நிற்பனபோலச் செய்யப்பட்டுள்ளன.,8
மொஹெஞ்சொ-தரோ_அல்லது_சிந்துவெளி_நாகரிகம்,ஒவ்வோர் உருவமும் இடது காலைத் தூக்கி வலது கால்மீது நின்று நடனம் செய்வது போல அமைக்கப்பட்டுள்ளது.,12
மொஹெஞ்சொ-தரோ_அல்லது_சிந்துவெளி_நாகரிகம்,"இச்சிலைகள், சிவபெருமானது பிற்கால நடனத்திற்கு தோற்றுவாய் ஆகலாம் என்பது ஆராய்ச்சியாளர் கருத்து.",9
மொஹெஞ்சொ-தரோ_அல்லது_சிந்துவெளி_நாகரிகம்,வேறு ஒரு குரங்கு தன்முழங்கால்கள் மீது கைகளை ஊன்றிக்கொண்டு உட்கார்ந்திருப்பது போலச் செய்யப்பட்டுள்ளது.,10
மொஹெஞ்சொ-தரோ_அல்லது_சிந்துவெளி_நாகரிகம்,இங்ஙனம் செய்யப்பட்ட உருவங்களில் கற்களும் சிப்பிகளும் கண்களாக வைத்துப்பதிக்கப்பட்டுள்ளன.,7
மொஹெஞ்சொ-தரோ_அல்லது_சிந்துவெளி_நாகரிகம்,இம்முறை எகிப்திலும் சுமேரியாவிலும் கையாளப்பட்டது.,4
மொஹெஞ்சொ-தரோ_அல்லது_சிந்துவெளி_நாகரிகம்,"வெண்கலத்தால் செய்யப்பட்ட எருமை, குரங்கு, வெள்ளாடு என்பன பார்க்கத் தக்கவை சிறந்த முறையில் அமைந்துள்ளவை.",11
மொஹெஞ்சொ-தரோ_அல்லது_சிந்துவெளி_நாகரிகம்,ஓவியக் கலை சிந்து வெளி மக்களின் ஒவியத் திறமை அவர் தம் மட்பாண்டங்களிலிருந்தே அறியப்படுகின்றது.,11
மொஹெஞ்சொ-தரோ_அல்லது_சிந்துவெளி_நாகரிகம்,அங்குக் கிடைத்துள்ள மட்பாண்டங்கள் மீது தீட்டப்பட்டுள்ள ஒவியங்கள் மிகத் தெளிவாக அக்கால நிலையையும் நாகரிகத்தையும் உணர்த்த வல்லவையாக இருக்கின்றன.,14
மொஹெஞ்சொ-தரோ_அல்லது_சிந்துவெளி_நாகரிகம்,அவை வரலாற்றுக் காலத்து ஒவியங்கட்கு முற்பட்ட ஓவியக் கலையை அளவிட்டு அறியப் பேருதவி புரிகின்றன.,11
மொஹெஞ்சொ-தரோ_அல்லது_சிந்துவெளி_நாகரிகம்,ஒரு வட்டத்திற்குள் பல வட்டங்கள் இட்டுள்ள முறை போற்றுதற்குரியது.,7
மொஹெஞ்சொ-தரோ_அல்லது_சிந்துவெளி_நாகரிகம்,"தொடர்ந்து வரும்தொன்மை நாகரிகம் இவையன்றி, மிக்க வேலைப்பாடுகள் அற்ற சிலைகளும் ஒவியங்களும் பல கண்டெடுக்கப்பட்டுள்ளன.",11
மொஹெஞ்சொ-தரோ_அல்லது_சிந்துவெளி_நாகரிகம்,இவை சிந்து கங்கை வெளிகளிலும் பரவி இருக்கின்றன.,6
மொஹெஞ்சொ-தரோ_அல்லது_சிந்துவெளி_நாகரிகம்,"ஆதலின், சிந்து வெளிப் பண்டை நாகரிகம் கங்கை வெளியிலும் பரவி இருந்தமை நன்கு புலனாகின்றது.",11
மொஹெஞ்சொ-தரோ_அல்லது_சிந்துவெளி_நாகரிகம்,மேலும் அப்பண்டைக் காலச் சிற்பக் கலையும் ஓவியக் கலையும் வரலாற்றுக்காலம் வரை தொடர்ந்து கைக் கொள்ளப்பட்டு வந்திருந்தமை வெளியாகின்றது.,14
மொஹெஞ்சொ-தரோ_அல்லது_சிந்துவெளி_நாகரிகம்,பாடலிபுரத்தில் அகப்பட்ட மோரியர் காலத்து மட்பாண்டங்களும் சிந்து வெளியின் மட்பாண்டத் தொடர்ச்சியாகவே கருதப்படுகின்றன.,10
மொஹெஞ்சொ-தரோ_அல்லது_சிந்துவெளி_நாகரிகம்,"இவற்றால், இந்தியச் சிற்பக் கலைக்கும் ஒவியக் கலைக்கும் சிந்து வெளியே தாயகமானது என்பது தெளிவாகும் அன்றோ?",12
மொஹெஞ்சொ-தரோ_அல்லது_சிந்துவெளி_நாகரிகம்,இசையும் நடனமும் களிமண்ணாற் செய்யப்பட்ட ஆண் உருவம் ஒன்றன் கழுத்தில் தவுல் கட்டப்பட்டுள்ளது.,10
மொஹெஞ்சொ-தரோ_அல்லது_சிந்துவெளி_நாகரிகம்,வெண்கலத்தாற் செய்யப்பட்ட நடனமாதின் வடிவம் ஒன்று கிடைத்துள்ளது.,6
மொஹெஞ்சொ-தரோ_அல்லது_சிந்துவெளி_நாகரிகம்,சில கற்சிலைகள் நடனமுறையிற் காணப்படுகின்றன.,4
மொஹெஞ்சொ-தரோ_அல்லது_சிந்துவெளி_நாகரிகம்,இரண்டு முத்திரைகளில் மிருதங்கம் போன்ற தோற் கருவிகள் பொறிக்கப் பட்டுள்ளன.,8
மொஹெஞ்சொ-தரோ_அல்லது_சிந்துவெளி_நாகரிகம்,இக்காலத்து வீணை போல ஒவியம் ஒன்று தீட்டப் பட்டுள்ளது.,7
மொஹெஞ்சொ-தரோ_அல்லது_சிந்துவெளி_நாகரிகம்,இக்காலத்துப் பாகவதர்கள் கைகளில் வைத்துக் கொண்டு தாளமிடும் கருவிகள் போன்றவையும் கிடைத்துள்ளன.,9
மொஹெஞ்சொ-தரோ_அல்லது_சிந்துவெளி_நாகரிகம்,கணிதப் புலமை சிந்து வெளியிற் கிடைத்துள்ள நிறைக் கற்கள் மிகப்பல.,8
மொஹெஞ்சொ-தரோ_அல்லது_சிந்துவெளி_நாகரிகம்,அவை பெரும்பாலும் எல்லா வீடுகளிலும் பயன்பட்டன எனக் கூறலாம்.,7
மொஹெஞ்சொ-தரோ_அல்லது_சிந்துவெளி_நாகரிகம்,நிறைக் கற்களைப் பற்றிய விளக்கம் சென்ற பகுதியிற் கூறப்பட்டமையின் ஈண்டு விரித்தல் வேண்டா.,10
மொஹெஞ்சொ-தரோ_அல்லது_சிந்துவெளி_நாகரிகம்,நிறைகள் அறுபத்து நான்கு வரை இரட்டை எண்களாக இருக்கின்றன.,7
மொஹெஞ்சொ-தரோ_அல்லது_சிந்துவெளி_நாகரிகம்,கணிதக் கலை வளர்ச்சியை என்னென்று கூறி வியப்பது.,6
மொஹெஞ்சொ-தரோ_அல்லது_சிந்துவெளி_நாகரிகம்,"சிந்து வெளியினர், சம்பர் மான் கொம்புகளைப் பொடியாக்கி மருந்தாகப் பயன்படுத்தினர் என்பது தெரிகிறது.",10
மொஹெஞ்சொ-தரோ_அல்லது_சிந்துவெளி_நாகரிகம்,"மான் கொம்புகளும், மாட்டுக் கொம்புகளும் பல கிடைத்துள்ளன.",6
மொஹெஞ்சொ-தரோ_அல்லது_சிந்துவெளி_நாகரிகம்,மாட்டுக்கொம்புகள் சில கிண்ணம் போலக் குடையப்பட்டுள்ளன.,5
மொஹெஞ்சொ-தரோ_அல்லது_சிந்துவெளி_நாகரிகம்,அவை மருந்து வைத்துக் கொள்ளப் பயன்பட்டன ஆகும்.,6
மொஹெஞ்சொ-தரோ_அல்லது_சிந்துவெளி_நாகரிகம்,நாட்டு மருத்துவத்தில் சிலா சித்து உயர்தர மருந்தாகும்.,6
மொஹெஞ்சொ-தரோ_அல்லது_சிந்துவெளி_நாகரிகம்,"அது வயிற்றில் உண்டாகும் குடல், நுரையீரல் முதலியன பற்றிய நோய்களைக் குணப்படுத்தும் ஆற்றல் பெற்றது.",11
மொஹெஞ்சொ-தரோ_அல்லது_சிந்துவெளி_நாகரிகம்,"அது, இமயமலைப் பாறைகளிலிருந்து கசிந்து வருவது.",5
மொஹெஞ்சொ-தரோ_அல்லது_சிந்துவெளி_நாகரிகம்,அதனை மலை வாழ்நர் கொண்டுவந்து இன்றும் உள் நாடுகளில் கொடுக்கின்றனர்.,8
மொஹெஞ்சொ-தரோ_அல்லது_சிந்துவெளி_நாகரிகம்,"அவை காது, கண், தொண்டை தோல் பற்றிய நோய்களைக் குணப்படுத்தும் வன்மையுடையன.",9
மொஹெஞ்சொ-தரோ_அல்லது_சிந்துவெளி_நாகரிகம்,மொஹெஞ்சொ தரோ மக்கள் விருந்தில் விருப்புடையர் என்பது நன்கு புலனாகின்றது.,8
மொஹெஞ்சொ-தரோ_அல்லது_சிந்துவெளி_நாகரிகம்,"ஆதலால், அவர்கள் அசீரணத்தால் துன்புற்றனராதல் இயல்பே.",5
மொஹெஞ்சொ-தரோ_அல்லது_சிந்துவெளி_நாகரிகம்,அவர்களைக் குணப்படுத்த மகளிர் சில மருத்துவ முறைகளை அறிந்திருந்தனர் என்று கூறல் தவறாகாது.,10
மொஹெஞ்சொ-தரோ_அல்லது_சிந்துவெளி_நாகரிகம்,"பதினாறு  ஆனால், அவற்றைத் திட்டமாகக் கூறக்கூடவில்லை என்று இராவ் பகதூர் தீக்ஷித் போன்றோர் கூறுகின்றனர்.",11
மொஹெஞ்சொ-தரோ_அல்லது_சிந்துவெளி_நாகரிகம்,"சிந்து மக்களின் இராசி மண்டலக் குறிப்பைக் கணித்துப் பார்க்கையில், அக்காலம், ஏறக்குறைய கி.மு.",11
மொஹெஞ்சொ-தரோ_அல்லது_சிந்துவெளி_நாகரிகம்,ஐந்து ஆயிரத்து அறுநூற்று பத்து எனக் கூறலாம்.,6
மொஹெஞ்சொ-தரோ_அல்லது_சிந்துவெளி_நாகரிகம்,"இது, சுமேரியர் நாகரிகமே தோன்றாத காலம் ஆகும் என்று பேசியுள்ளார்.",8
மொஹெஞ்சொ-தரோ_அல்லது_சிந்துவெளி_நாகரிகம்,பதினெட்டு  உடற் பயிற்சி ஹரப்பாவிற் கிடைத்த முத்திரை ஒன்றில் ஒர் ஆடவன் உடற் பயிற்சி செய்வதாகப் பொறிக்கப்பட்டுள்ளது.,13
மொஹெஞ்சொ-தரோ_அல்லது_சிந்துவெளி_நாகரிகம்,"இதனால், சிந்துவெளி மக்கள் ஓரளவு உடற்பயிற்சி முறைகளை அறிந்திருந்தனர் என்று கூறுதல் தவறாகாது.",10
மொஹெஞ்சொ-தரோ_அல்லது_சிந்துவெளி_நாகரிகம்,இருநூற்று ஐம்பத்தாறு முதலிய பாடல்களால் அறிக.,5
மொஹெஞ்சொ-தரோ_அல்லது_சிந்துவெளி_நாகரிகம்,எகிப்திய மொழியில் வேள் என்பதுமட்பாண்டத்தைக் குறிக்கும் சொல்லாதல் அறிக.,7
மொஹெஞ்சொ-தரோ_அல்லது_சிந்துவெளி_நாகரிகம்,இத்தகை செம்பு நாணயங்கள் பல திருநெல்வேலிக் கோட்டத்திற் கிடைத்துள்ளன.,7
மொஹெஞ்சொ-தரோ_அல்லது_சிந்துவெளி_நாகரிகம்,சிந்து வெளி மக்கள் யார்? என்னும் பகுதியிற் காண்க.,7
மொஹெஞ்சொ-தரோ_அல்லது_சிந்துவெளி_நாகரிகம்,பண்டைத் தமிழ் நாட்டுக் காவற்காரர் களவு நூலைக்கற்றவர்.,6
