work_title,sentence,sentence_length
விந்தன்_கதைகள்-2,வி.க இருபத்தாறு வியாபாரத்தில் சபலச் சித்தம் கூடாது திடச் சித்தம் வேண்டும் என்பது என் அப்பாவின் சித்தாந்தம்.,14
விந்தன்_கதைகள்-2,இப்போது நான் அதை மீறியல்லவாகாரியம் செய்துவிட்டேன்?,5
விந்தன்_கதைகள்-2,இப்படி எண்ணிய வண்ணம் உட்கார்ந்திருந்தபோது கடை வாயிலில் வந்து நின்ற சத்தம் கேட்டுத் திரும்பிப் பார்த்தேன்.,12
விந்தன்_கதைகள்-2,"ஐயோ, அப்பா வந்துவிட்டாரா?",3
விந்தன்_கதைகள்-2,"இல்லை, ராணிதான் காரிலிருந்து இறங்கி, அன்ன நடை க்குப் பதிலாக யானை நடை போட்டுக் கொண்டு வந்தாள்.",13
விந்தன்_கதைகள்-2,அவள் என் அத்தையின் ஏக புத்திரி கலாசாலையில் படித்துக் கொண்டிருக்கிறாள்.,8
விந்தன்_கதைகள்-2,அவளுடைய அம்மாவுக்கு என்மீது என்ன கோபமோ தெரியவில்லை.,6
விந்தன்_கதைகள்-2,நாளது வரை ராணியை என் தலையில்தான் எப்படியாவது கட்டிவைக்க வேண்டும் என்று ஒரே பிடிவாதமாயிருந்து வருகிறாள்.,12
விந்தன்_கதைகள்-2,எனக்கோ அவளைப் பார்க்கும் போதெல்லாம் அச்சம் ஏன் தெரியுமா?,7
விந்தன்_கதைகள்-2,இதில் ஒன்றும் குற்றம் இல்லைதான்.,4
விந்தன்_கதைகள்-2,"ஆயினும் உண்மையான அன்புக்கு உள்ளேதான் இடமிருக்குமே தவிர, வெளியே இடமிராதல்லவா?",8
விந்தன்_கதைகள்-2,"இந்த நிலையில் இருந்த என்னை இன்று அவள் நெருங்கியதும், நான்சுற்றுமுற்றும் பார்த்துத் திருடனைப்போல் விழித்தேன்.",11
விந்தன்_கதைகள்-2,இப்போது என்னடாவென்றால் அத்தனை பேரும் கடைக்குள் அடைந்து கிடந்தார்கள் ! அவர்களெல்லாம் போதாதென்று கடையில் வியாபாரம் வேறு பிரமாதமாக நடந்துகொண்டிருந்தது !,14
விந்தன்_கதைகள்-2,என்ன செய்வேன்? என் உடம்போ சில்லிட்டுவிட்டது உணர்ச்சியோகுன்றிவிட்டது.,6
விந்தன்_கதைகள்-2,"வலுவில் புன்னகையை வரவழைத்துக் கொண்டு, வாராணி, வா !",6
விந்தன்_கதைகள்-2,"அதைப் பொருட்படுத்தாமல், ஹெல்லோ, ஹெள ஆர் யூ?",6
விந்தன்_கதைகள்-2,அடுத்தாற்போல் எனக்கு எதிரே போட்டிருந்த மேஜையின் மேல் அவள் வானரம் போல் தாவி உட்கார்ந்தாள்.,11
விந்தன்_கதைகள்-2,"அவர்களுடைய சிரிப்புக்கிடையே என்னை நோக்கி, என்ன உங்கள் உடம்புக்கு?",7
விந்தன்_கதைகள்-2,என்று கேட்டாள் அவள்.,3
விந்தன்_கதைகள்-2,பின் ஏன் ஒரு மாதிரியாயிருக்கிறீர்கள்?,4
விந்தன்_கதைகள்-2,"உங்களுக்குத் தலையைக் கிலையை வலிக்கிறதா, என்ன? ஆமாம் கொஞ்ச நேரமாகத் தலையை வலிக்கத்தான் செய்கிறது !",11
விந்தன்_கதைகள்-2,"அதாவது, நான் வந்ததிலிருந்து என்று சொல்லுங்கள் !",5
விந்தன்_கதைகள்-2,சரிதான் என்னை இங்கிருந்து சீக்கிரமாக வெளியேற்றச் சதியோ?,6
விந்தன்_கதைகள்-2,"சரியாய்ப் போச்சு வந்தவர்களை ஏன், என்ன? என்று விசாரிக்க வேண்டாமா?",8
விந்தன்_கதைகள்-2,"ஆமாம், ஆமாம் அது கிடக்கட்டும், எனக்குக் கொஞ்சம் மல் வேண்டியிருக்கிறது நானும் க்யூ வரிசையில்தான் நிற்க வேண்டுமா?",13
விந்தன்_கதைகள்-2,"காலையில் வந்திருந்தால் நின்றிருக்கலாம் இப்போது தான் கூட்டமில்லையே ! சரி, எத்தனை கெஜம் வேண்டும்?",10
விந்தன்_கதைகள்-2,"நாலு பீஸ் வேண்டும் ஸார், நாலு பீஸ் !",6
விந்தன்_கதைகள்-2,"அவ்வளவு தூரத்துக்கு வந்துவிட்டாயா, நீ?",4
விந்தன்_கதைகள்-2,...... உன்னை யாரடா நான் சொன்னதற்கு மேல் விற்கச் சொன்னார்கள்?,7
விந்தன்_கதைகள்-2,...... இளம் பெண்ணைக் கண்டதும் இரக்கம் வந்து விட்டதோ? ஐயோ !,7
விந்தன்_கதைகள்-2,"அவள் குழந்தை, அப்பா !",3
விந்தன்_கதைகள்-2,அவள் குந்தைதான் அவளுடைய அக்கா?,4
விந்தன்_கதைகள்-2,இதென்ன வீண் பழி !,3
விந்தன்_கதைகள்-2,யாரோ சொன்னதைக் கேட்டு..... சொன்னதைக் கேட்டு என்னடா?,6
விந்தன்_கதைகள்-2,இப்படி என் தலையை மொட்டையடிக்க எத்தனை நாட்களாகக் காத்துக் கொண்டிருந்தாய்?,8
விந்தன்_கதைகள்-2,"அப்படி என்ன அப்பா, பிரமாதமாக மொட்டையடித்துவிட்டேன்?",5
விந்தன்_கதைகள்-2,ஆறு கெஜம் மல்தானே?,3
விந்தன்_கதைகள்-2,"எதிர்த்துப் பேசக் கூடத் தைரியம் வந்துவிட்டதா? ம், நடடா வெளியே !",8
விந்தன்_கதைகள்-2,என்று என்னை ஓங்கி அறைந்தார் அவர்.,5
விந்தன்_கதைகள்-2,"அதற்குள் அம்மா அலறிக் கொண்டே, ஓடிவந்து, நன்றாயிருக்கிறது.",6
விந்தன்_கதைகள்-2,ஏன் இப்படி அமர்க்களம் பண்ணுகிறீர்கள்?,4
விந்தன்_கதைகள்-2,நீங்கள் சொன்னதற்குமேல் ஆறு கெஜம் மல்லை விற்றுவிட்டால் குடியா முழுகிப் போய்விடும் !,9
விந்தன்_கதைகள்-2,நாளைக்கு கொடுக்கிறேன் என்று சொல்வது !,4
விந்தன்_கதைகள்-2,அதற்காக குழந்தையை அடித்தால் வந்துவிடுமா?,4
விந்தன்_கதைகள்-2,நீயும் உன் குழந்தையும் நாசமாய்ப் போங்கள் சொற்படி நடக்காத பிள்ளை எனக்கு வேண்டாம் !,10
விந்தன்_கதைகள்-2,கதைகளில் நிகழும் சில சம்பவங்களை நம்மால் நம்ப முடிவதேயில்லை.,7
விந்தன்_கதைகள்-2,"ஆனால் அதே மாதிரி சம்பவங்கள் சில நமது வாழ்க்கையில் நிகழும்போது, அவற்றை நம்மால் எப்படி நம்பாமல் இருக்க முடியும்?",14
விந்தன்_கதைகள்-2,"அன்றோ நல்ல வெண்ணிலவு கலங்கிய, மனத்துடன் நான் கால்கள் போன வழி நடந்துகொண்டிருந்தேன்.",10
விந்தன்_கதைகள்-2,"அப்படியென்ன, நாம் செய்யத் தகாத காரியம் செய்து விட்டோம்?",7
விந்தன்_கதைகள்-2,ஓர் ஏழைச் சிறுமியிடம் இரக்கம் காட்டியதா குற்றம்?,6
விந்தன்_கதைகள்-2,அதுவும் காசை வாங்கிக் கொண்டுதானே இரக்கம் காட்டினோம்.,6
விந்தன்_கதைகள்-2,இதற்கா இத்தனை அமர்க்களம்? இந்தக் கோடை விடுமுறை என்று ஒன்று ஏன்தான் வந்து தொலைந்ததோ?,11
விந்தன்_கதைகள்-2,அது வந்திராவிட்டால் நாம் ஏன் அந்த நாசமாய்ப் போன கடையில் உட்கார்ந்திருக்கப் போகிறோம்?,10
விந்தன்_கதைகள்-2,அந்தச் சிறுமியிடந்தான் ஏன் இரக்கம் காட்டியிருக்கப் போகிறோம்?,6
விந்தன்_கதைகள்-2,அப்பாதான் இப்படி ஏன் கோபித்துக் கொண்டிருக்கப் போகிறார்?,6
விந்தன்_கதைகள்-2,பேதலித்ததிலிருந்து நான் ஒரு காரணமும் இல்லாமல் அந்தத் தெரு வழியே சென்றேன்.,9
விந்தன்_கதைகள்-2,மனச்சோர்வினால் அங்கே பூட்டிக்கிடந்த ஒரு வீட்டுத் திண்ணையை என் கால்கள் தஞ்சமடைகின்றன.,9
விந்தன்_கதைகள்-2,யோக்கிய தாம்ச த்தைக் கூடப் பொருட்படுத்தாமல் அந்தத் திண்ணையின்மேல் உட்கார்ந்தேன்.,8
விந்தன்_கதைகள்-2,கதவில் எழுதப்பட்டிருந்த ஒன்பது என்ற இலக்கம் என்னைக் கவர்ந்தது.,7
விந்தன்_கதைகள்-2,"அதைக் கண்டதும், இந்த வீட்டுச் சிறுமியால்தானே நமக்கு இந்தக் கஷ்டம்?",8
விந்தன்_கதைகள்-2,என்று எண்ணி என்மனம் இடிந்தது.,4
விந்தன்_கதைகள்-2,"என்னடா, பூட்டை உடைப்பதற்கு யோசனையோ?",4
விந்தன்_கதைகள்-2,திடுக்கிட்டு நான் திரும்பிப் பார்த்தேன்.,4
விந்தன்_கதைகள்-2,யாரோ ஒருவர் வந்து எனக்கு எதிரே நின்றுகொண்டிருந்தார்.,6
விந்தன்_கதைகள்-2,தலைவிரி கோலமாயிருந்த என்னை அவர் திருடனென்றும் தீர்மானித்து விட்டார் போலும் !,8
விந்தன்_கதைகள்-2,"அவ்வளவுதான் அப்பா, அப்பா !",3
விந்தன்_கதைகள்-2,"அவர் என்னை தனியே அழைத்து ஆறு கெஜம் மல் கொடுத்தனுப்பிய ஜவுளிக் கடைக்காரராச்சே, அப்பா !",11
விந்தன்_கதைகள்-2,அவரைப் போய் பூட்டை உடைக்க யோசனையோ !,5
விந்தன்_கதைகள்-2,என்று அங்கலாய்த்தாள் அவள்.,3
விந்தன்_கதைகள்-2,"முதியவர் அசடு வழிய, மன்னிக்கவேணும் கோபித்துக் கொள்ளக்கூடாது !",6
விந்தன்_கதைகள்-2,என்று கெஞ்சிக் கொண்டே என்னை நெருங்கினார்.,5
விந்தன்_கதைகள்-2,"அதற்கென்ன, இந்நேரத்தில் இப்படி வந்து உட்கார்ந்திருந்தால் அப்படித்தான் தோன்றும் !",7
விந்தன்_கதைகள்-2,என்று நான் அவருடைய மனச் சாந்திக்காகச் சொல்லிவிட்டு அங்கிருந்து மெல்ல நகர்ந்தேன்.,9
விந்தன்_கதைகள்-2,"என்ன ரத்னா, இன்னும் ஏன் அங்கேயே நின்று கொண்டிருக்கிறாய்? உள்ளே வந்து விளக்கை ஏற்று !",11
விந்தன்_கதைகள்-2,அதே சமயத்தில் என் உள்ளத்திலும் அவள் நுழைந்து விட்டாள் என்பதை அப்போது நான் ஏனோ உணரவில்லை.,12
விந்தன்_கதைகள்-2,இரவு மணி பத்துக்கு மேலே இருக்கும்.,5
விந்தன்_கதைகள்-2,"எனக்காகக் காத்துக் கொண்டிருந்த அம்மா என்னைக் கண்டதும், வாடா அப்பா ! வந்துவிட்டாயா?",9
விந்தன்_கதைகள்-2,அந்த மட்டும் என் வயிற்றில் பாலை வார்த்தாயே ! என்று கனிவு ததும்ப வரவேற்றாள்.,10
விந்தன்_கதைகள்-2,எடுத்தததற்கெல்லாம் நான் தற்கொலை செய்து கொள்வேனோ என்று அவளுக்குப் பயம்.,8
விந்தன்_கதைகள்-2,நான் சுற்றுமுற்றும் பார்த்தேன்.,3
விந்தன்_கதைகள்-2,அதற்குள் அம்மா எனக்குச் சாதம் பரிமாறினாள்.,5
விந்தன்_கதைகள்-2,சாப்பிட்டு விட்டுப் படுக்கப் போனேன்.,4
விந்தன்_கதைகள்-2,அதே சமயத்தில் யாரோகதவைத்தடதட வென்று தட்டும் சத்தம் கேட்டது.,7
விந்தன்_கதைகள்-2,என்ன பயங்கரமான சேதி !,3
விந்தன்_கதைகள்-2,எங்கள் கடையில் தீப்பிடித்துக்கொண்டு விட்டதாம் !,4
விந்தன்_கதைகள்-2,"அவ்வளவுதான் அடுத்த கணம் நானும் அக்கினி பகவானால் ஆட்கொள்ளப்பட்டுத் திருதிரு வென்று எரிவதுபோல், எனக்குத் தோன்றியது.",12
விந்தன்_கதைகள்-2,அப்பாவிடம் சேதி சொல்வதற்காக விரைந்தேன்.,4
விந்தன்_கதைகள்-2,கண்ணில் பட்ட ஒவ்வொரு பொருளும் தீப்பற்றி எரிவது போல எனக்குத் தோன்றின !,9
விந்தன்_கதைகள்-2,பரபரப்புடன் அவருடைய அறைக்குள் நுழைந்தேன்.,4
விந்தன்_கதைகள்-2,அவரும் தீப்பற்றி எரிந்து கொண்டிருந்தார் !,4
விந்தன்_கதைகள்-2,வாயிற்படியில் பாவி எமன் காத்துக் கொண்டிருந்தான் போலும் தடுக்கி விழுந்த அப்பாதடுக்கி விழுந்தவர்தான் மறுபடியும் எழுந்திருக்கவேயில்லை !,12
விந்தன்_கதைகள்-2,அடுத்தாற்போல் அவரைத் தொடர்ந்து சென்று நானும் உணர்விழந்து கீழே விழுந்தேன்.,8
விந்தன்_கதைகள்-2,அந்த நிலையில் எவ்வளவு நேரம் இருந்தேனோ.,5
விந்தன்_கதைகள்-2,"மீண்டும் உணர்வு பெற்றபோது என் அன்னை, அழுது, அழுது ஓயும் தருவாயில் இருந்தாள்.",10
விந்தன்_கதைகள்-2,"அவளுடைய வெளுத்த முகத்தையும், கண்ணிர் பெருகிய கண்களையும், என்னால் சகிக்க முடியவில்லை.",9
விந்தன்_கதைகள்-2,மெல்ல எழுந்து கடையின் பக்கம் சென்றேன்.,5
விந்தன்_கதைகள்-2,கருத்த சாம்பல் என் கண்களுக்குக் காட்சியளித்தது.,5
விந்தன்_கதைகள்-2,யாரோ கொடுத்த தகவலின்பேரில் தீயணைக்கும் படையினர் வழக்கம்போல் தீயணைந்த பிறகு வந்து திரும்பிச் சென்றனராம் !,11
விந்தன்_கதைகள்-2,எந்த விஷயத்திலும் பிறரை நம்பாத என் அப்பா எங்கள் கடையை ஒரு காலணாவுக்குக் கூட இன்ஷ்யூர் செய்து வைக்கவில்லை.,14
விந்தன்_கதைகள்-2,"அவருக்குப் பிறகு எனக்கும் என் அன்னைக்கும் ஜீவாதாரமாக இருந்தது நாங்கள் குடியிருந்த வீடும், அந்த வீட்டின் பெறுமானமுள்ள கடனுந்தான் !",14
விந்தன்_கதைகள்-2,பணக் கவலை என்னைப் படுத்திய பாடோ கொஞ்சநஞ்சமல்ல.,6
விந்தன்_கதைகள்-2,நான் பார்த்து வந்த வேலைக்காகப் பாங்கிக்காரர்கள் கொடுத்த மாதச் சம்பளம் அறுபது ரூபாய் போதவில்லை.,11
விந்தன்_கதைகள்-2,வீட்டின் ஒரு பகுதியை வாடகைக்கு விடுவதென்று தீர்மானித்தேன்.,6
விந்தன்_கதைகள்-2,அன்றே வீடு வாடகைக்கு விடப்படும் என்று ஒர் அட்டையில் எழுதி வாயிற்படியில் தொங்கவிட்டேன்.,10
விந்தன்_கதைகள்-2,இந்த நிலையிலே சதிசெய்யும் விதிக்கு என்மேல் என்ன கருணையோ தெரியவில்லை.,8
விந்தன்_கதைகள்-2,அவள்தாயை இழந்து விட்டிருந்தாள்.,3
விந்தன்_கதைகள்-2,"ஒரு நாள் ஏதோ பேச்சுவாக்கில் ரத்னாவின் தகப்பனாரை நோக்கி, நீங்கள் இரண்டாந்தாரம் கல்யாணம் செய்துகொள்ள வில்லையா?",12
விந்தன்_கதைகள்-2,என்று கேட்டாள் என் தாயார்.,4
விந்தன்_கதைகள்-2,அவர் சிரித்துக்கொண்டே இப்போது ரத்னாவுக்கு மாப்பிள்ளை தேடிக் கொண்டிருக்கிறேன் !,7
விந்தன்_கதைகள்-2,"என்னமோ போங்கள், எவன் யாருக்கு எங்கே பிறந்திருக்கிறானோ !",6
விந்தன்_கதைகள்-2,என்று சொல்லிவிட்டு அம்மா உள்ளே வந்தாள்.,5
விந்தன்_கதைகள்-2,"அதுதான் சமயமென்று, இதோ, ரத்னாவுக்காக நான் பிறந்திருக்கிறேனே ! என்றேன்.",7
விந்தன்_கதைகள்-2,"கொஞ்சம் பொறு, நாளைக்கே அவர்களை வேறு வீடு பார்த்துக்கொள்ளச் சொல்கிறேன் என்று உறுமினாள் அம்மா.",11
விந்தன்_கதைகள்-2,"அதற்காக இந்த வீட்டைவிட்டு அவர்களைக் காலி செய்யவோ, அவர்களிடம் கடுமையாகவோ நடந்து கொள்ள வேண்டாம் !",11
விந்தன்_கதைகள்-2,என்று நான் கெஞ்சு கெஞ்சு என்று கெஞ்சினேன்.,6
விந்தன்_கதைகள்-2,"அதற்குப் பிறகு அம்மா ஒருவாறு சமாதான மடைந்து, ஏற்கெனவே கெட்டது போதாதென்று மேலும் கெட்டுப் போகப் பார்க்கிறாய்?",13
விந்தன்_கதைகள்-2,நம்மை விட மேலான இடம் நமக்காக எத்தனையோ நாட்கள் காத்துக் கொண்டிருக்கும்போது ஏன் இப்படியெல்லாம் உளறுகிறாய்?,12
