work_title,sentence,sentence_length
விந்தன்_கதைகள்-2,இப்படி மழையில் நனைந்தால் உடம்பு என்னத்துக்கு ஆகும்?,6
விந்தன்_கதைகள்-2,என்று அது கரிசனத்துடன் சொல்லிற்று.,4
விந்தன்_கதைகள்-2,என்னால் நம்ப முடியவில்லை.,3
விந்தன்_கதைகள்-2,"ஆமாம், நிஜமாகத்தான் என்றது அது அன்புடன்.",5
விந்தன்_கதைகள்-2,"வந்தனம் என்று சொல்லிவிட்டு, அந்தப் பொந்துக்குள் நுழைந்தேன்.",6
விந்தன்_கதைகள்-2,பிறகு உள்ளே யிருந்தபடி நனைந்த சிறகுகளையெல்லாம் அலகால் கோதிவிட ஆரம்பித்தேன்.,8
விந்தன்_கதைகள்-2,"இந்தச் சகிக்க முடியாத காட்சி யைக் கண்ட ரங்கா, ஆத்திரத்துடன் ஓடோடியும் வந்து என்னையும் ஒரு கைபார்த்துவிட்டுச் சென்றது.",14
விந்தன்_கதைகள்-2,என்று எட்டிப் பார்த்தேன்.,3
விந்தன்_கதைகள்-2,சண்டை தொடர்ந்து நடந்து கொண்டிருந்தது !,4
விந்தன்_கதைகள்-2,சிறிது நேரத்துக்கெல்லாம் மழை நின்றது ஆனால் சண்டை நிற்கவில்லை !,7
விந்தன்_கதைகள்-2,என்ன விந்தை இது !,3
விந்தன்_கதைகள்-2,அப்போதும் சண்டை ஓயவில்லை.,3
விந்தன்_கதைகள்-2,என்று இரண்டும் விடாமல் ஒன்றையொன்று கொத்திக் கொண்டிருந்தன.,6
விந்தன்_கதைகள்-2,"ரங்கா போதும், சண்டையை நிறுத்து !",4
விந்தன்_கதைகள்-2,பகையைப் பகையால் வெல்வது முடியாத காரியம் அப்படியே வென்றாலும் அந்த வெற்றி நீடித்திருக்காது.,10
விந்தன்_கதைகள்-2,இந்த வீணான முயற்சியில் ஏன் உன்னுடைய அருமையான காலத்தைக் கழிக்கிறாய்?,8
விந்தன்_கதைகள்-2,"வீட்டுக்குப் போவோம், வா !",3
விந்தன்_கதைகள்-2,"போடா, உன்னைப்போல் என்னையும் கோழை என்று நினைத்துக் கொண்டாயா?",7
விந்தன்_கதைகள்-2,என்று ரங்கா சீறி விழுந்தது.,4
விந்தன்_கதைகள்-2,"சரி, நீ வீரனாகவே இரு, அப்பா !",5
விந்தன்_கதைகள்-2,என்று சொல்லிவிட்டு நான் வீட்டை நோக்கிக் கிளம்பினேன்.,6
விந்தன்_கதைகள்-2,அந்த முடிவில்லாத சண்டை தொடர்ந்து நடந்து கொண்டேயிருந்தது.,6
விந்தன்_கதைகள்-2,﻿﻿அன்பும் அதிகாரமும் பாதுஷா லில்லாவின் பிறந்த நாளை முன்னிட்டு அன்று ஆப்கானிஸ்தானமே ஒரே கோலகலமாகக் காட்சியளித்தது.,12
விந்தன்_கதைகள்-2,ராணி ஜிஜியாவுடன் லில்லாவும் வந்து சிம்மாசனத்தில் அமர்ந்து விட்டான்.,7
விந்தன்_கதைகள்-2,கவி இஸாவை மட்டும் அதுவரை காணவில்லை.,5
விந்தன்_கதைகள்-2,பாதுஷாவின் புருவங்கள் சற்றே நெரிந்தன.,4
விந்தன்_கதைகள்-2,அதே சமயத்தில் கவி இஸா ராஜ சபைக்குள் பிரவேசித்தான்.,7
விந்தன்_கதைகள்-2,என்றுமில்லாதபடி அன்று ஒரு மானும் அவனைப் பின்தொடர்ந்து வந்தது.,7
விந்தன்_கதைகள்-2,அந்த மானைக் கண்ட மாத்திரத்தில் தன் மனதை அதனிடம் பறி கொடுத்து விட்டாள் ராணி ஜிஜியா.,12
விந்தன்_கதைகள்-2,"ஆகவே, ராணி ஜிஜியாவின் ஆக்கிரமிக்கும் ஆசையும், பாதுஷாவின் அலட்சியப் புன்னகையும் அவனுக்கு அடக்க முடியாத ஆத்திரத்தையளித்தன.",12
விந்தன்_கதைகள்-2,அவன் எதிர்பார்த்தபடியே அடுத்த கணம் இஸா... !,5
விந்தன்_கதைகள்-2,என்று அவனை அலட்சியமாக அழைத்தான் பாதுஷா.,5
விந்தன்_கதைகள்-2,"அப்பொழுது, அவனுடைய வலது கண்ணும் வலதுபக்கத்து மீசையும் சற்றே உயர்ந்து தாழ்ந்தன.",9
விந்தன்_கதைகள்-2,"தன் உள்ளத்தில் பொங்கி வந்த உணர்ச்சிகளை யெல்லாம் ஒருவாறு அடக்கிக் கொண்டு, ஷாஹுன்ஷா !",10
விந்தன்_கதைகள்-2,என்றுதன் ஆசனத்தை விட்டு எழுந்து வந்து சம்பிரதாயப்படி அரசனின் முன்னால் நின்றான் கவி.,10
விந்தன்_கதைகள்-2,உன்னுடைய மானிடம்... என்றான் பாதுஷா.,4
விந்தன்_கதைகள்-2,"தான் சொல்ல வந்ததை சொல்லி முடிக்கு முன்னரே, என்னுடைய மான் இல்லை, மகராஜ் !",10
விந்தன்_கதைகள்-2,என்று அடித்துச் சொன்னான் கவி.,4
விந்தன்_கதைகள்-2,பாதுஷாவின் கண்கள் ஜிவ் வென்று சிவந்தன.,5
விந்தன்_கதைகள்-2,அவன் கலகலவென்று பயங்கரமாகச் சிரித்தான்.,4
விந்தன்_கதைகள்-2,ராஜசபையில் பிரச்சன்னமாயிருந்தவர்களின் விழிகளெல்லாம் மிரண்டு விழித்தன.,5
விந்தன்_கதைகள்-2,ஜிஜியா அந்த மானை அடையவேண்டுமென்றால் அவளிடம் அது தன் மனதைப் பறி கொடுக்க வேண்டுமோ?,11
விந்தன்_கதைகள்-2,வில்லாவின் கண்களில் தீப்பொறி பறந்தது.,4
விந்தன்_கதைகள்-2,என்ன என்னால் கூடவாமுடியாது !,3
விந்தன்_கதைகள்-2,"என்னைப் பொறுத்தவரையில் எல்லோரையும் சமமாகத் தான் பாவிக்கிறேன், பாதுஷா !",7
விந்தன்_கதைகள்-2,முப்பத்தாறு கவியின் அஞ்சாநெஞ்சம் அரசனின் அதிகாரத் திமிரைக்கூட ஒர் அசக்கு அசக்கிவிட்டது.,9
விந்தன்_கதைகள்-2,என்று கேட்டுக் கொண்டே அவன் இஸாவை ஏற இறங்கப் பார்த்தான்.,8
விந்தன்_கதைகள்-2,"வேண்டுமானால் அதை அரே அல்லா, வா !",5
விந்தன்_கதைகள்-2,என்று ராணியைக் கூப்பிடச் சொல்லுங்கள் வந்தால் நான் அதைத் தடுக்க மாட்டேன் ! என்றான் இஸா.,11
விந்தன்_கதைகள்-2,"பாதுஷா, ராணியின் முகத்தைப் பார்த்தான் அவளும் குறிப்பறிந்து அரே அல்லா வா !",9
விந்தன்_கதைகள்-2,என்று அந்த மானை அன்புடன் அழைத்தாள்.,5
விந்தன்_கதைகள்-2,"முகத்தில் புன்னகை தவழ, அந்த மானை அன்புடன் துக்கி மார்புடன் அணைத்துக் கொண்டான் கவி.",11
விந்தன்_கதைகள்-2,அன்பால் பிணைக்கப்பட்டிருந்த அந்த இரு ஜீவன்களுக்கு முன்னால் அரசனின் ஆணவமும் கொஞ்சம் ஒடுங்கிற்று.,10
விந்தன்_கதைகள்-2,ஆயிரம் மோகராக்கள் தருகிறேன் !,3
விந்தன்_கதைகள்-2,அந்த மோகராக்களும் உமக்குச் சொந்தமில்லை இந்த மானும் எனக்குச் சொந்தமில்லை உலகத்தில் இருக்கும் எல்லாப் பொருளுமே உண்மையில் அல்லாவினுடையவையல்லவா?,14
விந்தன்_கதைகள்-2,அவற்றில் எதையாவது விற்கவோ வாங்கவோ நமக்கு என்ன உரிமையிருக்கிறது?,7
விந்தன்_கதைகள்-2,என்று கேட்டான் கவிஇஸா.,3
விந்தன்_கதைகள்-2,நான் யார் என்று தெரியவில்லையா?,4
விந்தன்_கதைகள்-2,என்று அனலைக் கக்கினான்.,3
விந்தன்_கதைகள்-2,தெரிந்தால் உடனே மானைக் கொடுத்து விடு மன்னித்து விடுகிறேன் !,7
விந்தன்_கதைகள்-2,என்னை மன்னிக்கக் கூடியவர் ஒரே ஒருவர் தான் உண்டு அவர்தான் அல்லா !,9
விந்தன்_கதைகள்-2,அரண்மனையின் முகட்டை நோக்கி.,3
விந்தன்_கதைகள்-2,அவன் கை உடைவாளை உருவ விரைந்தது.,5
விந்தன்_கதைகள்-2,"அதற்குள் என்ன நினைத்தானோ என்னமோ, இவனைக் கொண்டு போய்ச் சிறையில் தள்ளுங்கள் !",9
விந்தன்_கதைகள்-2,அடுத்த கணமே அவருடைய ஆக்கினை நிறைவேற்றி வைக்கப்பட்டது.,6
விந்தன்_கதைகள்-2,அவற்றையெல்லாம் காணாமல் அவன் கவி இதயம் வெடித்து விடும் போலிருந்தது.,8
விந்தன்_கதைகள்-2,என்று சிறையிலிருந்தபடியே அந்த மானை அன்புடன் கூவி யழைப்பான் இஸா.,8
விந்தன்_கதைகள்-2,அது இழுத்துப் பறித்துக் கொண்டு எப்படியாவது அவனை அடைந்துவிடத் துடியாய்த் துடிக்கும்.,9
விந்தன்_கதைகள்-2,ஆனால் அதன் பலன்?,3
விந்தன்_கதைகள்-2,இரும்புச் சங்கிலி இறுகி இறுகி அதன்கழுத்தில் செக்கச்செவேரென்று இரத்தம் கசியச் செய்துவிடும்.,9
விந்தன்_கதைகள்-2,"அந்தக் காட்சியைக் கண்டதும் கவியின் உள்ளம் பதை பதைக்கும், நெஞ்சு நெக்குருகிக் கண்ணிர் கசிந்துவிடும்.",11
விந்தன்_கதைகள்-2,"அல்லா வோ அவனை வா, வா !",5
விந்தன்_கதைகள்-2,என்று அழைப்பது போல் மருண்டு நோக்கித் தன் முன் கால்கள் இரண்டையும் தூக்கி தூக்கி நிற்கும்.,12
விந்தன்_கதைகள்-2,பொறு அல்லா பொறு !,3
விந்தன்_கதைகள்-2,அல்லா வைப் பிரிந்ததிலிருந்து அவனுக்கு உணவு செல்லவில்லை.,6
விந்தன்_கதைகள்-2,அவனைப் பிரிந்ததிலிருந்து அல்லா வும் அதே நிலைமையில் தானிருந்தது.,7
விந்தன்_கதைகள்-2,⁠ ⁠ ராணி ஜிஜியாவோ அல்லா வின் அன்பைப் பெறுவதற்கு என்ன வெல்லாமோ செய்து பார்த்தாள்.,12
விந்தன்_கதைகள்-2,அடிக்கடி அதன் முதுகை ﻿அன்புடன் தடவிக் கொடுக்க யத்தனிப்பாள்.,7
விந்தன்_கதைகள்-2,அதற்கு இடங் கொடுக்காமல் அல்லா இப்படியும் அப்படியுமாகத் துள்ளித்துள்ளி ஒடி அவளை அலக்கழிக்கும்.,10
விந்தன்_கதைகள்-2,வேளைக்கு வேளை விதம் விதமான இரைகளை எடுத்துக் கொண்டு ஜிஜியாவின் தோழிகள் அல்லா விடம் வருவார்கள்.,12
விந்தன்_கதைகள்-2,அவற்றை ஏறெடுத்தும் பார்ப்பதில்லை.,3
விந்தன்_கதைகள்-2,"அல்லா, தோழிகள் மனமுடைந்து போய் விஷயத்தை ராணியிடம் தெரிவிப்பார்கள்.",7
விந்தன்_கதைகள்-2,அவளே நேரில் வருவாள்.,3
விந்தன்_கதைகள்-2,என்னவெல்லாமோ கொஞ்சி குலாவி ஒரு பிடி புல்லையாவது அதன் வாயில் திணித்துவிடப் பார்ப்பாள்.,10
விந்தன்_கதைகள்-2,அல்லா வோ தன்னால் முடிந்தவரை வாயை இறுக மூடிக்கொண்டு தலையைத் திருப்பிக் கொள்ளும்.,10
விந்தன்_கதைகள்-2,இதனால் ராணி ஜிஜியா அடைந்த வேதனை கொஞ்சநஞ்மன்று.,6
விந்தன்_கதைகள்-2,ஆனால் அந்தப் பாழும் ஆசை மட்டும் அவளை விடவேயில்லை.,7
விந்தன்_கதைகள்-2,இதயத்தோடு இதயம் ஒன்றிப்போயிருந்த இரு ஜீவன்களும் எத்தனையோ நாட்களை இப்படியே உணவின்றி உறக்கமின்றிக் கழித்துவிட்டன.,11
விந்தன்_கதைகள்-2,"கவி இலா, அரே அல்லா அரே அல்லா என்று கதறினான்.",8
விந்தன்_கதைகள்-2,அவனுடைய கதறல் அந்த மானின் காதில் விழுவதற்கு அதனுடைய உடம்பில் உயிர் இருந்தால் தானே !,11
விந்தன்_கதைகள்-2,என்று கதறிக் கொண்டே யிருந்தான்.,4
விந்தன்_கதைகள்-2,அதே சமயத்தில் தன் தோழிகளின் மூலம் செய்தி கேட்ட ராணி ஜிஜியா அங்கே ஒடோடியும் வந்தாள்.,12
விந்தன்_கதைகள்-2,அல்லா வை இப்படியும் அப்படியுமாக புரட்டிப் பார்த்துவிட்டு அவள் அழுது கொண்டே சிறையின் ஜன்னலை நோக்கினாள்.,12
விந்தன்_கதைகள்-2,இஸாவுக்கு விஷயம் புரிந்து விட்டது.,4
விந்தன்_கதைகள்-2,அவன் வானத்தை நோக்கித் தன் இரு கைகளையும் ஏந்தி அரே அல்லாஹுத ஆலா !,10
விந்தன்_கதைகள்-2,அல்லா வை உன் திருவடிக்கு அழைத்துக் கொண்டு விட்டாயா?,7
விந்தன்_கதைகள்-2,என்று கேட்டு விட்டுக் கண்ணிர் மல்கிய கண்களுடன் சிறையின் வாயிலை நோக்கித் திரும்பினான்.,10
விந்தன்_கதைகள்-2,கடக் கென்று பூட்டுத் திறக்கும் சத்தமும் லொடக் கென்று நாதங்கி கழன்று விழும் சத்தமும் அவன் காதில் விழுந்தன.,14
விந்தன்_கதைகள்-2,என்று வேண்டிக் கொண்டான்.,3
விந்தன்_கதைகள்-2,"மாட்டார், அல்லாஹுத ஆலா உம்மை ஒரு போதும் மன்னிக்க மாட்டார் !",8
விந்தன்_கதைகள்-2,"என்று சொல்லி அவன் பிடியிலிருந்து விலகிக் கொண்ட இஸா, அரே, அல்லா இதோ நானும் உன்னுடன் வந்து விட்டேன் !",14
விந்தன்_கதைகள்-2,"அரே, அல்லா இதோ, நானும் உன்னுடன் வந்து விட்டேன் !",7
விந்தன்_கதைகள்-2,"என்று ஆவேசத்துடன் இரைந்து கொண்டே, சிறை வாயிலை விட்டுச்சிட்டுக் குருவி போல் பறந்து சென்றான் !",11
விந்தன்_கதைகள்-2,அரண்மனை நெடுகிலும் நின்று காவல் புரிந்த ஆயுத பாணிகளான வீரர்கள் யாரும் அவனை ஏனோ தடுக்கவில்லை !,12
விந்தன்_கதைகள்-2,என்று பெருமூச்சு விட்டுக் கொண்டே நின்றது.,5
விந்தன்_கதைகள்-2,கவலைப்படாதீர் அடுத்த ஐந்தாண்டுத் திட்டத்துக்குள் அவசியம் கட்டிவிடுவார்கள் !,6
விந்தன்_கதைகள்-2,என்றது அதற்கு முன்னால் நின்று கொண்டிருந்த கார் நம்பர் நான்கு ஆயிரத்து ஐநூற்று நாற்பத்தைந்து.,11
விந்தன்_கதைகள்-2,இதைக் கேட்டதும் நீங்கள் நாசமாய்ப் போக !,5
விந்தன்_கதைகள்-2,"என்று சாபம் கொடுத்தது, அவற்றுக்கு அருகே நின்று கொண்டிருந்த ஒரு கைவண்டி.",9
விந்தன்_கதைகள்-2,"பாவம், அவர் என்ன செய்வார்?",4
விந்தன்_கதைகள்-2,"மேம்பாலத்தின் மேல் ஏறும் போதும் கஷ்டம், இறங்கும் போதும் கஷ்டம், அவருக்கு !",9
விந்தன்_கதைகள்-2,என்றது முப்பத்தாறு முப்பத்தாறு.,3
விந்தன்_கதைகள்-2,ஒருவர் கஷ்டப்படுவாரே என்பதற்காக உலகத்தில் உள்ளவர்களெல்லாம் கஷ்டப்பட்டுக் கொண்டிருக்க முடியுமா என்ன?,9
விந்தன்_கதைகள்-2,"வண்டியப்பர் எப்போதும் வண்டியப்பராகவே இருந்து விடப் போகிறாரா, என்ன?",7
விந்தன்_கதைகள்-2,"நமது சர்க்கார் நாட்டை முன்னேற்றிக் கொண்டிருக்கும் வேகத்தைப் பார்த்தால் நாளைக்கே அவரும் உம்மைப் போல் லாரியப்பரானாலும் ஆகிவிடுவார், இல்லையா?",14
விந்தன்_கதைகள்-2,என்றது நாற்பத்தைந்து நாற்பத்தைந்து.,3
விந்தன்_கதைகள்-2,கைவண்டி பெருமூச்சுடன் சொல்லிற்று.,3
விந்தன்_கதைகள்-2,"ம், அந்த நம்பிக்கையுடன்தான் வாழ்க்கையை ஆரம்பித்தார் என் முதலாளி ஆனால்... என்ன ஆனால்?",10
விந்தன்_கதைகள்-2,இப்போது அவர் வாழவில்லை செத்துக் கொண்டிருக்கிறார் !,5
விந்தன்_கதைகள்-2,"இப்படி ஒரு சட்டப் பிரச்சனை யைக் கிளப்பியது, கார் நம்பர் நான்கு ஆயிரத்து ஐநூற்று நாற்பத்தைந்து.",12
விந்தன்_கதைகள்-2,சட்ட விரோதம் மட்டுமல்ல இலக்கிய விரோதமுங்கூட.,5
விந்தன்_கதைகள்-2,"ஏனெனில், மனிதன் சாகும் போது கூட நம்பிக்கையுடன்தான் சாக வேண்டுமென்று தற்கால இலக்கியகர்த்தாக்கள் சொல்லிக் கொண்டிருக்கும் !",12
