work_title,sentence,sentence_length
விந்தன்_கதைகள்-2,என்ற கவலையோடு கையில் முறத்துடன் வீடு வீடாக நுழைந்து வந்து கொண்டிருந்த அம்மாவிடம்.,10
விந்தன்_கதைகள்-2,"அப்பா எனக்கு என்ன வாங்கிக் கொடுத்தார், அம்மா?",6
விந்தன்_கதைகள்-2,"அது என்ன வாங்கிக் கொடுத்தாரோ, எனக்குத் தெரியாது !",6
விந்தன்_கதைகள்-2,உண்மையிலேயே தெரியாதுதானே? எனவே அவள் நிற்கவில்லை போய்க்கொண்டே இருந்தாள்.,7
விந்தன்_கதைகள்-2,அவள் முந்தானையைப் பிடித்து இழுத்தது குழந்தை.,5
விந்தன்_கதைகள்-2,விளக்கு வைக்கிற நேரமாச்சு !,3
விந்தன்_கதைகள்-2,"அப்பா பசியோடு வருவார் விடு சனியனே, விடு !",6
விந்தன்_கதைகள்-2,"ஊஹும், விடமாட்டேன் சொன்னால்தான் விடுவேன் !",4
விந்தன்_கதைகள்-2,"விடப் போகிறாயா, இல்லையா?",3
விந்தன்_கதைகள்-2,கோபா வேசத்துடன் இரைந்தாள் தாய்.,4
விந்தன்_கதைகள்-2,கொஞ்சலுடன் கெஞ்சியது சேய்.,3
விந்தன்_கதைகள்-2,"என்று குழந்தையைப் பிடித்து ஒரு தள்ளுத் தள்ளி, அதன் முதுகில் பளார், பளார் என்று அறைந்தாள் அவள்.",13
விந்தன்_கதைகள்-2,குச்சு வீட்டுக் குழந்தை கோ வென்று அழுதது.,6
விந்தன்_கதைகள்-2,"இது உன் அம்மா உனக்கு வாங்கிக் கொடுத்ததா, வாங்காமல் கொடுத்ததா?",8
விந்தன்_கதைகள்-2,"என்று அதைக் குறும்புடன் கேட்டுவிட்டு, கலகல வென்று நகைத்தது மச்சு வீட்டுக் குழந்தை.",10
விந்தன்_கதைகள்-2,அழுவதற்கு எத்தனையோ காரணங்கள் இருந்தும் ஒரு காரணமும் இல்லாதது போல !,8
விந்தன்_கதைகள்-2,"நீ எனக்கு என்ன வாங்கிக் கொடுத்தேன்னு கேட்டால், அம்மா சொல்லமாட்டேங்குதே !",8
விந்தன்_கதைகள்-2,வந்து.... வந்து....... அவனாலும் அதற்கு மேல் ஒன்றும் சொல்ல முடியவில்லை விழித்தான் !,9
விந்தன்_கதைகள்-2,"ஏம்ப்பா, அது உனக்கும் தெரியாதா?",4
விந்தன்_கதைகள்-2,"என்றது குழந்தை, ஏமாற்றத்துடன்.",3
விந்தன்_கதைகள்-2,"இதோ, என் அன்பு முத்தம் ! இதுதான் உனக்கு நான் வாங்கிக் கொடுத்தது, கொடுப்பது, கொடுக்கப் போவது எல்லாம் !",13
விந்தன்_கதைகள்-2,என்று கலங்கிய கண்களைத் துடைத்துக்கொண்டே குழந்தையை வாரி எடுத்து முத்தப் போனான் அவன்.,10
விந்தன்_கதைகள்-2,"முத்தமாம் முத்தம் யாருக்கு வேணும், உன் முத்தம் !",6
விந்தன்_கதைகள்-2,"என்று அவனுடைய கையை உதறித் தள்ளிவிட்டு, விரைத்துக்கொண்டு நின்றது குழந்தை.",8
விந்தன்_கதைகள்-2,அன்புக்கும் ஆதாரம் அது தானா?,4
விந்தன்_கதைகள்-2,"என்றான் அவன், வானத்தை நோக்கி.",4
விந்தன்_கதைகள்-2,என்பதுபோல் தன் தலையை ஆட்டி ஆட்டிச் சிரித்தது மச்சு வீட்டுக் குழந்தை !,9
விந்தன்_கதைகள்-2,"கொண்டு வா, நாயை !",3
விந்தன்_கதைகள்-2,"அன்று என்னவோ தெரியவில்லை கம்பெனிக்கு வந்ததும் வராததுமாயிருக்கும்போதே, கொண்டு வா, நாயை !",9
விந்தன்_கதைகள்-2,"என்று என்னை நோக்கி இரைந்து விட்டு, மடமடவென்று மாடிக்குப் போனார் முதலாளி.",9
விந்தன்_கதைகள்-2,"முதலாளி என்றால், முதல் உள்ள முதலாளி இல்லை முதல் இல்லாத முதலானி !",9
விந்தன்_கதைகள்-2,முதல் இல்லாத முதலாளியும் இந்த உலகத்தில் உண்டா?,6
விந்தன்_கதைகள்-2,எப்படி என்று கேட்கிறீர்களா? சொல்கிறேன் முதலாளி என்ற பெயர் முதல் போடுபவரைக் குறிக்கவில்லை முதலை ஆளுபவரைத்தான் குறிக்கிறது.,13
விந்தன்_கதைகள்-2,ஒன்றுமில்லை அன்றிரவு பத்து மணிக்கு மேல் யாரோ ஓர் அம்மாள் அவரைத் தேடிக்கொண்டு வந்தார்களாம்.,11
விந்தன்_கதைகள்-2,அம்மாள் என்றதும் வயது நாற்பதுக்கு மேலிருக்கும் போலிருக்கிறது !,6
விந்தன்_கதைகள்-2,"அந்தக் குறிக்கோள் அதுவாயிருந்தது, அவருக்கு !",4
விந்தன்_கதைகள்-2,"மனிதனா, ஆளுக்குத் தகுந்தாற்போல் வேஷம் போட?",5
விந்தன்_கதைகள்-2,"அதுதான் நாயாச்சே, வேஷம் போட முடியவில்லை அதனால் எனவே, குரைத்திருக்கிறது.",8
விந்தன்_கதைகள்-2,"போதை தெளிந்தபின் ஐயா எழுந்து, அந்த எதிர்கால நட்சத்திரத்தைத் தேடியிருக்கிறார்.",8
விந்தன்_கதைகள்-2,"அது அங்கே இல்லை என்ன ஏமாற்றம், எப்படிப்பட்ட ஏமாற்றம் டிரைவர் !",8
விந்தன்_கதைகள்-2,என்று மேலே இருந்தபடியே கத்தியிருக்கிறார்.,4
விந்தன்_கதைகள்-2,அளவு கடந்த ஆத்திரத்துடன் கீழே வந்து காரைத் தாமே எடுத்திருக்கிறார் பெட்ரோல் இல்லை முட்டாள் !,11
விந்தன்_கதைகள்-2,"வரட்டும் அவன், முதல் வேலையாக வீட்டுக்கு அனுப்பிவிட்டு மறு வேலை பார்க்கிறேன் !",9
விந்தன்_கதைகள்-2,என்று கருவிக்கொண்டே போய்ப் படுத்திருக்கிறார் ! தூக்கம் வருமா? வரவில்லை !,7
விந்தன்_கதைகள்-2,அவ்வளவுதான் அடுத்த நாள் வந்தது ஆபத்து !,5
விந்தன்_கதைகள்-2,டிரைவர் வீட்டுக்கு அனுப்பப்பட்டான் நாயும் வீட்டுக்கு அனுப்பப்பட்டு விட்டது !,7
விந்தன்_கதைகள்-2,முப்பத்தொன்று சித்தாந்தம் அப்படி என்னதான் இருக்கும் அந்தப் பெண்களிடம்?,7
விந்தன்_கதைகள்-2,என்று என்னைக் கேட்கிறீர்களா?,3
விந்தன்_கதைகள்-2,"அது எனக்குத் தெரியாது ஐயா, நிச்சயமாகத் தெரியாது !",6
விந்தன்_கதைகள்-2,"டிரைவருக்குப் பதிலாக வேறொரு டிரைவரை நியமித்த முதலாளி, நாய்க்குப் பதிலாக வேறொரு நாயை நியமிக்கவில்லை எப்படி நியமிக்க முடியும்?",14
விந்தன்_கதைகள்-2,அது தனக்கென்று ஒரு தனிக் குணம் வைத்துக் கொண்டிருக்கிறதே?,7
விந்தன்_கதைகள்-2,"ஆகவே நாய்க்குப் பதிலாக அந்தரங்கக் காரிய தரிசி என்று ஒருவரை அன்றே நியமித்துவிட்டார், அவர் !",11
விந்தன்_கதைகள்-2,"அவர்தான் என்ன செய்வார், பாவம் ! வேறு எந்த விதத்திலும் தம்முடைய அந்தஸ்தை உயர்த்திக் கொள்ள முடியாமல் இருக்கும்போது?",13
விந்தன்_கதைகள்-2,"இதனால் தமக்கு வேண்டியவர்கள் மட்டுமே தம்மைச் சந்திக்கவும், வேண்டாதவர்கள் சந்திக்க முடியாமல் திரும்பி, அடேயப்பா !",11
விந்தன்_கதைகள்-2,அவரைப் பார்ப்பதென்றால் அவ்வளவு லேசா?,4
விந்தன்_கதைகள்-2,கடவுளைப் பார்த்தாலும் பார்த்துவிடலாம் அவரைப் பார்க்கவே முடியாது போலிருக்கிறதே?,7
விந்தன்_கதைகள்-2,என்று தமக்காகக் கடவுளைக்கூட ஒரு படி கீழே இறக்கி விட்டுவிடவும் வாய்ப்புக் கிடைத்தது அவருக்கு !,11
விந்தன்_கதைகள்-2,கிடைக்கட்டும் வேண்டாமென்று சொல்லவில்லை.,3
விந்தன்_கதைகள்-2,"அதற்காக, கொண்டு வா, நாயை !",4
விந்தன்_கதைகள்-2,"என்று திடீரென்று சொன்னால், எங்கிருந்து கொண்டு வருவேன்?",6
விந்தன்_கதைகள்-2,வீட்டுக்குப் போய்க் கொண்டு எப்படிக் கொண்டு வருவது?,6
விந்தன்_கதைகள்-2,"என்றும் அவருடைய வீடு என்ன, பக்கத்திலா இருக்கிறது?",6
விந்தன்_கதைகள்-2,அந்தரங்கக் காரியதரிசி விரும்பினால் வெளிக்குப் போய்விட்டு வரக்கூடக் கார் கிடைக்கும் எனக்குக் கிடைக்குமா?,10
விந்தன்_கதைகள்-2,நாயைக் கொண்டு வரத்தான் !,3
விந்தன்_கதைகள்-2,"அதிலும் பாருங்கள், என்னுடைய வேலையோ கணக்கெழுதும் வேலை கணக்கு எழுதும் வேலை என்றால் சாதாரணக் கணக்கு எழுதும் வேலையா?",14
விந்தன்_கதைகள்-2,"அதுவும் இல்லை வராத வரவுக்கும், செய்யாத செலவுக்குமல்லவா நான் கணக்கு எழுத வேண்டியிருக்கிறது?",10
விந்தன்_கதைகள்-2,"எனவே, கணக்குக்கும் எனக்கும் வேண்டுமானால் ஏதாவது சம்பந்தம் இருக்கலாம் நாய்க்கும் எனக்கும் என்ன சம்பந்தம்?",11
விந்தன்_கதைகள்-2,"முன்னாள் காரியதரிசி யான அந்த நாயை, இந்நாள் காரியதரிசி யான அவர் வேண்டுமானாலும் கொண்டுவரட்டுமே !",11
விந்தன்_கதைகள்-2,"இப்படி நினைத்த நான், அந்தரங்கக் காரியதரிசியின் அறையை மெல்லத் திறந்து எட்டிப் பார்த்தேன் அவரைக் காணவில்லை !",12
விந்தன்_கதைகள்-2,முதலாளி வருவதற்கு முன்னால் வந்து விடுபவராயிற்றே அவர்?,6
விந்தன்_கதைகள்-2,இன்று ஏன் அவர் வந்தபிறகும் வரவில்லை?,5
விந்தன்_கதைகள்-2,ஒன்றும் புரியவில்லை எனக்கு முகத்தில் கேள்விக் குறியுடன் திரும்பினேன்.,7
விந்தன்_கதைகள்-2,"ஆபீஸ் பையன், உங்களுக்குத் தெரியாதா?",4
விந்தன்_கதைகள்-2,"என் வாயெல்லாம் பல்லாக, தெரியாதே !",4
விந்தன்_கதைகள்-2,"என்று ஒரு கைக்கு இரண்டு கைகளாக விரித்தேன், நான்.",7
விந்தன்_கதைகள்-2,"அந்தரங்கக் காரியதரிசியிடம் வந்து, முதலாளியைப் பார்க்க வேண்டும் என்று சொல்லியிருக்கிறாள்.",8
விந்தன்_கதைகள்-2,"அவளைப் பார்த்த அந்தரங்கக் காரியதரிசிக்கு அந்த நேரத்தில் எப்படி இருந்ததோ என்னவோ, நான் தான் முதலாளி !",12
விந்தன்_கதைகள்-2,அவ்வளவுதான் ஆபீசுக்குப் போனால் ஆபத்து என்று வீட்டிலிருந்தபடியே தம்முடைய வேலையை ராஜினாமா செய்துவிட்டிருக்கிறார் !,10
விந்தன்_கதைகள்-2,"இப்பொழுதுதான் தெரிகிறது, கொண்டு வா, நாயை !",5
விந்தன்_கதைகள்-2,"என்று நான் நடந்தேன், கழுதைக்கு வாழ்க்கைப் பட்டபின் உதைக்கு அஞ்சிப் பயனில்லை !",9
விந்தன்_கதைகள்-2,"அந்தரங்கக் காரியதரிசியைவிட அல்சேஷியன் நாயே மேல் என்று இப்பொழுதாவது தெரிந்ததே முதலாளிக்கு, அதைச் சொல்லுங்கள் !",11
விந்தன்_கதைகள்-2,என்றான் ஆபீஸ் பையன்.,3
விந்தன்_கதைகள்-2,"என்ற ஏமாற்றம் இன்னொரு பக்கம் இவையிரண்டுக்கும் இடையே தவித்தபடி, அவன் வரும் வழி மேல் விழி வைத்துக்கொண்டிருந்தான் டேவிட்.",14
விந்தன்_கதைகள்-2,அவனைக் காணவில்லை காணவேயில்லை.,3
விந்தன்_கதைகள்-2,"தன் வீட்டுக்கு நேர் எதிரேயிருந்த மாதா கோவிலின் மணிக் கூண்டைப் பார்த்தான் டேவிட், மணி இரண்டு !",12
விந்தன்_கதைகள்-2,காவற்காரன் சாப்பாட்டுக்குப் போயிருக்கும் சமயத்திலல்லவா அவன் கை வரிசையைக் காட்ட வேண்டுமென்று சொன்னான்?,10
விந்தன்_கதைகள்-2,அவன்கூட இந்நேரம் திரும்பி வந்திருப்பான் போலிருக்கிறதே?,5
விந்தன்_கதைகள்-2,வேறு எங்கே போயிருக்கப் போகிறான்?,4
விந்தன்_கதைகள்-2,"கடற்கரைக்குத்தான் போயிருக்க வேண்டும், காற்றாடி விட !",5
விந்தன்_கதைகள்-2,"இனி தாமதிப்பதில் பிரயோசனமில்லை ஆம், இனி தாமதிப்பதில் பிரயோசனமே இல்லை !",8
விந்தன்_கதைகள்-2,இல்லை டீல் விட்டுக் கொண்டிருந்தான் !,4
விந்தன்_கதைகள்-2,மாஞ்சா போடுவதில் மகா சூரனான மஸ்தான் காற்றாடியுட னல்லவா இவனுடைய காற்றாடி மோதிக்கொண்டிருக்கிறது?,10
விந்தன்_கதைகள்-2,"அவனுடைய காற்றாடியையாவது, இவனுடைய காற்றாடி அறுப்பதாவது?",5
விந்தன்_கதைகள்-2,நடக்காத காரியம் அப்படியே நடப்பதாயிருந்தாலும் அதுவரை தான் இங்கே காத்திருப்பது முடியாத காரியம் !,10
விந்தன்_கதைகள்-2,"வஜ்ஜிர மாஞ்சா போட்டிருக்கிறாரா, இவர்?",4
விந்தன்_கதைகள்-2,விடப்பா விடு இந்தப் பக்கம் திரும்பிப் பார்க்காமலே நூலை விடு !,8
விந்தன்_கதைகள்-2,உனக்குப் பின்னால் உருண்டோடி வரும் நூலுருண்டையை நான் அறுத்து எடுத்துக்கொண்டு ஓடிவிட்டால் என்னை நீ என்ன செய்வாயாம்?,13
விந்தன்_கதைகள்-2,அதுதான் சரி அதுதான் தன்னைக் காக்க வைத்ததற்குச் சரியான தண்டனை !,8
விந்தன்_கதைகள்-2,"டேவிட் இப்படி நினைத்தானோ இல்லையோ, எடுத்தான் பிளேடை அறுத்தான் உருண்டையை பிடித்தான் ஓட்டம் !",10
விந்தன்_கதைகள்-2,அவ்வளவுதான் ஊர்க்குருவியைப் பருந்து துரத்துவதுபோல் துரத்தினான் அவன்.,6
விந்தன்_கதைகள்-2,கடற்கரையில் பிடித்த ஓட்டத்தை மாந்தோப்பின் வாசலை அடைந்த பிறகு தான் நிறுத்தினான் டேவிட்.,10
விந்தன்_கதைகள்-2,"இப்படிக் கூடச் செய்யலாமா, நீ?",4
விந்தன்_கதைகள்-2,என்று பீட்டர் கையை ஓங்கினான்.,4
விந்தன்_கதைகள்-2,இல்லாவிட்டால் ஒரு மணிக்கே இங்கு வந்திருக்கவேண்டிய நாம் மூன்று மணிக்காவது வந்திருப்போமா?,9
விந்தன்_கதைகள்-2,என்று சமாளித்தான் டேவிட்.,3
விந்தன்_கதைகள்-2,"அவ்வளவுதான் நல்ல வேலை செய்தாய், நான் மறந்தே போய்விட்டேன் !",7
விந்தன்_கதைகள்-2,"என்று தன் கோபத்தை மறந்து, பீட்டர் அவனைப் பாராட்ட ஆரம்பித்துவிட்டான் !",8
விந்தன்_கதைகள்-2,அதற்குப் பிறகு கேட்க வேண்டுமா?,4
விந்தன்_கதைகள்-2,இருவரும் ஒரே தாவில் மதிற்சுவரின்மேல் ஏறி உட்கார்ந்தனர்.,6
விந்தன்_கதைகள்-2,முதலில் காவற்காரன் எங்கே இருக்கிறான் என்று பார்?,6
விந்தன்_கதைகள்-2,"என்றான் பீட்டர், தன்னுடைய கண்ணோட்டத்தையும் தோப்புக்குள் செலுத்தியபடி.",6
விந்தன்_கதைகள்-2,"அதோ, அந்த மரத்தடியைப் பார் அவன் தூங்குகிறான் போலிருக்கிறது !",7
விந்தன்_கதைகள்-2,"ஓஹோ, சாப்பிட்ட களைப்பிலே இளைப்பாறுகிறார் போலிருக்கிறது !",5
விந்தன்_கதைகள்-2,"இளைப்பாறாட்டும், இளைப்பாறட்டும் நன்றாக இளைப்பாறட்டும் !",4
விந்தன்_கதைகள்-2,"என்று படுத்தபடி கேட்டுக் கொண்டே, தலையைத் தூக்கிப் பார்த்தான் காவற்காரன்.",8
விந்தன்_கதைகள்-2,என்று நினைத்த டேவிட் ஒரே தாவாகத் தாவி மதில்மேல் ஏறப்போனான் உஸ் !,9
விந்தன்_கதைகள்-2,என்று மீண்டும் தலையைக் கீழே போட்டுக் கண்ணையும் மூடிக்கொண்டுவிட்டான் அவன் !,8
