work_title,sentence,sentence_length
வேண்டும்_விடுதலை,"ப.அறிவழகன், சென்னை",3
வேண்டும்_விடுதலை,"மாசிலாமணி, கலிக்க நாய்க்கன்பட்டி.",3
வேண்டும்_விடுதலை,"அரிமா மகிழ்கோ, புதுவை ஐந்து, இருபத்து மூன்று.",6
வேண்டும்_விடுதலை,"ப. அறவாழி, தளவாய்ப்பட்டணம்.",3
வேண்டும்_விடுதலை,"ப. துரையரசன், கைகாட்டிப்புதூர்.",3
வேண்டும்_விடுதலை,"ப. கு. முருகவேள், புன்செய்ப் புளியம்பட்டி.",5
வேண்டும்_விடுதலை,"புத்தன், சென்னை இரண்டு.",3
வேண்டும்_விடுதலை,"மு. மகிழரசன், சென்னை",3
வேண்டும்_விடுதலை,"தாமரை பெருஞ்சித்திரன், கடலூர் ஒன்று, முப்பத்து மூன்று.",6
வேண்டும்_விடுதலை,"செந்தாழை, கடலூர் ஒன்று.",3
வேண்டும்_விடுதலை,"பொற்கொடி, மதுரை பத்து.",3
வேண்டும்_விடுதலை,"புலவர் இறைக்குருவனார், மதுரை பத்து.",4
வேண்டும்_விடுதலை,"செம்பியன், சென்னை இருபத்தொன்று.",3
வேண்டும்_விடுதலை,மு. பரண் ஆக்கன்.,3
வேண்டும்_விடுதலை,"ச. சின்னத்துரை, சிவபுரம்.",3
வேண்டும்_விடுதலை,"கா. இராவணன், கூடலூர்",3
வேண்டும்_விடுதலை,"மதன்மோகன், மதுரை ஒன்று.",3
வேண்டும்_விடுதலை,"ம. முருகுவேந்தன், மதுரை.",3
வேண்டும்_விடுதலை,"ச. எழில், வாழ்வாங்கி.",3
வேண்டும்_விடுதலை,அன்பு ந.வை.,3
வேண்டும்_விடுதலை,"இளஞ்செழியன், அம்மையன்பட்டி ஐம்பத்தொன்பது.",3
வேண்டும்_விடுதலை,வே. மு. பொதியவெற்பன்.,3
வேண்டும்_விடுதலை,"ந. அரணமுறுவல், நாயனார்பாளையம்,",3
வேண்டும்_விடுதலை,"ச. தம்பி, சென்னிமலை.",3
வேண்டும்_விடுதலை,"தமிழப்பன், திருப்பூர் நான்கு.",3
வேண்டும்_விடுதலை,"அருள் வேட்டன், கண்ணூற்று.",3
வேண்டும்_விடுதலை,"மலரவன், வெங்காலூர், எழுபது.",3
வேண்டும்_விடுதலை,இப்பட்டியலில் பத்துப் பெயர்கள் விடுபட்டுள்ளன.,4
வேண்டும்_விடுதலை,அவர்களின் பெயர்கள் எங்களுக்குக் கிடைக்கவில்லை.,4
வேண்டும்_விடுதலை,இளமாறன் மீண்டும் தம் விடுதலையுணர்வுப் பாடல்களைப் பாடினார்.,6
வேண்டும்_விடுதலை,திருச்சி வழக்குரைஞர் அ.மு.,4
வேண்டும்_விடுதலை,சம்பந்தம் பிற்பகல் நிகழ்ச்சியை முன்னின்று நடத்தினார்.,5
வேண்டும்_விடுதலை,"சரவணத்தமிழனாரும், காரைக்குடிக் கல்லூரி மாணவர் திரு மா.",6
வேண்டும்_விடுதலை,"ஆடலரசும், புதுவைக் கல்லூரி மாணவர் ப. அடியார்க்கருளியும் பிற்பகல் மாநாட்டில் தொடக்கத்தில் பேசினர்.",10
வேண்டும்_விடுதலை,ஆனால் ஊர்வலத்தில் வந்தவர்களை மட்டுமே நாங்கள் சிறைப்படுத்த முடியும் என்று அதிகாரிகள் அறவே மறுத்துவிட்டனர்.,11
வேண்டும்_விடுதலை,திரு ஆடலரசு விடுதலையுரையாற்றினார்.,3
வேண்டும்_விடுதலை,திரு அடியார்க்கருளி தமிழின் பெருமை பற்றிக் காவலர்களுக்கு மிகத் தெளிவாகச் சுவைபட எடுத்துக் கூறினார்.,11
வேண்டும்_விடுதலை,காவலர்கள் மிக நெருக்கமாக வந்து நின்று மிக ஆர்வத்துடன் கேட்டனர்.,8
வேண்டும்_விடுதலை,அதன்பின்னர் திருவாளர்கள் க.,3
வேண்டும்_விடுதலை,"நெடுஞ்சேரலாதனும், அருட்குவையும் தமிழரின் அடிமைத்தனம் பற்றியும்.",5
வேண்டும்_விடுதலை,இந்திராவின் ஆட்சிபற்றியும் பேசினர்.,3
வேண்டும்_விடுதலை,நித்தலின்பன் அறம் வெல்லும் என்று பேசினார்.,5
வேண்டும்_விடுதலை,அதன்படி அன்பர்கள் வரவழைக்கப் பெற்றனர்.,4
வேண்டும்_விடுதலை,இதற்கிடையில் அதிகாரிகள் பரபரப்போடு இயங்கியில் வெளியே போவதும் வருவதுமாக இருந்தனர்.,8
வேண்டும்_விடுதலை,அடிக்கடி தொலைபேசித் தொடர்புகள் நிகழ்த்தப் பெற்றன.,5
வேண்டும்_விடுதலை,அதன்பின் விடுதலை முழக்கங்களுடன் விடுதலை மறவர்கள் காவல் நிலையத்தை விட்டு வெளியேறினர்.,9
வேண்டும்_விடுதலை,இரவு மணியளவில் பொதுக்குழுக் கூட்டம் அமைப்பாளர் பெருஞ்சித்திரனார் தலைமையில் கூடியது.,8
வேண்டும்_விடுதலை,மறுநாள் மாநாடு நடத்துவதா வேண்டாவா என்ற கருத்து பற்றித் தனித்தனியே ஒவ்வொருவரிடமும் கேட்கப் பெற்றது.,11
வேண்டும்_விடுதலை,விடுதலையுணர்ச்சி உள்ளவர்களின் மனநிலைகளைத் தெளிவாகத் தெரிந்து கொள்ள வேண்டுமென்பதே அதன் நோக்கம்.,9
வேண்டும்_விடுதலை,ஒரே ஒருவர் தம்மில் மாறுபட்டாலும்கூட அவர் மாறுபடுவது ஏன் என்னும் விளக்கத்தைக் கேட்டுத் தெரிந்து கொள்வதிலே நான் அக்கறையுள்ளவன்.,14
வேண்டும்_விடுதலை,அவர் நம் கருத்துகளை விளங்கிக் கொள்ள வேண்டுமென்பதற்காக அவற்றைப் பலவாறு விளக்க அணியமாக விருக்கின்றவன்.,11
வேண்டும்_விடுதலை,பெரும்பாலும் நாம் எல்லாரும் அப்படித்தான் இருக்க வேண்டும்.,6
வேண்டும்_விடுதலை,ஒருவர் மாறுபட்டாலும் அவரைப் புறக்கணிக்கக் கூடாது.,5
வேண்டும்_விடுதலை,கூடிய வரையில் அவரையும் இணக்கத்திற்குக் கொண்டுவரவே முயல வேண்டும்.,7
வேண்டும்_விடுதலை,இப்பொழுது மாநாட்டைத் தொடர்ந்து நடத்துவதில் நமக்குள் மாறுபாடான கருத்து இருக்கக் கூடாது.,9
வேண்டும்_விடுதலை,இது கொள்கைப் பரப்புக் காலந்தான் என்பதை அறிவேன்.,6
வேண்டும்_விடுதலை,இப்பொழுதும் நாம் கொள்கையைப் பரப்புவதற்குத்தான் மாநாடுகளை நடத்துகின்றோம்.,6
வேண்டும்_விடுதலை,நாம் திருச்சி மாநாட்டில் தீர்மானித்துக் கொண்டபடி இக் கொள்கைப் பரப்புக் காலத்தில் சரிவரச் செயல்படாமைக்குக் கரணியம் பொருளியல் வலிமையின்மையே !,14
வேண்டும்_விடுதலை,முதலில் நம்மை அந்நிலைக்குப் பக்குவப்படுத்திக் கொள்வதும் ஒரு முயற்சிதான்.,7
வேண்டும்_விடுதலை,இன்று நம் ஊர்வலத்தின் முடிவில் நடந்த சில தொய்வுகளைப் பற்றி அறிவீர்கள்.,9
வேண்டும்_விடுதலை,நாம்தாம் கொள்கைகளைப் பரப்ப வேண்டும்.,4
வேண்டும்_விடுதலை,நமக்குள்ளேயே சிலர் தெளிவற்று இருக்கின்றார்கள்.,4
வேண்டும்_விடுதலை,அவர்களுக்கும் நாம் தெளிவேற்ற வேண்டும்.,4
வேண்டும்_விடுதலை,அதுவும் ஒரு முயற்சியே !,3
வேண்டும்_விடுதலை,சும்மா வாயளவில் கொள்கையைச் சொல்லிக் கொண்டிருப்பது வேறு.,6
வேண்டும்_விடுதலை,செயலளவுக்கு அதைக் கொண்டுவருவது வேறு.,4
வேண்டும்_விடுதலை,செயலுக்கு வரும்பொழுது அதில் பலவகையான இழுப்பு பறிப்புகள் இருக்கவே செய்யும்.,8
வேண்டும்_விடுதலை,அஃது அவரவர் மனநிலைகளைப் போறுத்தது.,4
வேண்டும்_விடுதலை,கொள்கைப் பரப்புக் காலத்தில் போராட்டத்தில் ஈடுபட வேண்டா என்று அன்பர் சிலர் கேட்டுக் கொண்டனர்.,11
வேண்டும்_விடுதலை,நாம் இப்பொழுதுங்கூட கொள்கையைப் பரப்புவதற்குத்தான் மாநாட்டைக் கூட்டினோம்.,6
வேண்டும்_விடுதலை,இது போன்ற மாநாடுகள் ஒவ்வொரு மாவட்டத்திலும் நடத்தப்பட வேண்டும்.,7
வேண்டும்_விடுதலை,"அப்பொழுதுதான் மக்கள் கவனமும் அரசினர் கவனமும், செய்தித்தாள்களின் கவனமும் நம் பக்கம் திரும்பும்.",10
வேண்டும்_விடுதலை,அப்பொழுதுதான் நாம் சொல்வதை அவர்கள் எண்ணிப் பார்க்க முயற்சி செய்வர்.,8
வேண்டும்_விடுதலை,அந்த முயற்சியைத்தான் நாம் இப்பொழுது செய்தோம்.,5
வேண்டும்_விடுதலை,அதற்குத்தான் இப்பொழுது தடையிட்டிருக்கின்றார்கள்.,3
வேண்டும்_விடுதலை,மாநாடு நடைபெறவிருந்த மன்றம் சாத்திப் பூட்டி முத்திரையிடப் பெற்றுக் காவலர்களால் காக்கப் பெற்று வருகின்றது.,11
வேண்டும்_விடுதலை,"நம்மை அமைதியாக ஊர்வலம் நடத்தவும், மாநாட்டை நடத்தவும் விட்டிருந்தார்களானால் இந்த மதுரையில் ஒரு விழிப்புணர்ச்சியை ஏற்படுத்தியிருக்கலாம்.",12
வேண்டும்_விடுதலை,ஆனால் அப்படி நடைபெறுவதை இந்த அரசு விரும்பவில்லை போலும் !,7
வேண்டும்_விடுதலை,கொள்கையைப் பரப்பும் முயற்சியில்தான் ஈடுபட்டோம் போராட்டத்திலன்று.,5
வேண்டும்_விடுதலை,ஆனால் அதற்கே இப்பொழுது தடையிடப் பெற்றுள்ளது.,5
வேண்டும்_விடுதலை,எனவே அன்பர்கள் எதற்கும் அணியமாக விருக்க வேண்டும்.,6
வேண்டும்_விடுதலை,நாளை காலை ஒன்பது மணிக்கு மேற்கொண்டு நாம் என்ன செய்ய வேண்டும் என்று தெளிவாக அறிவிக்கப் பெறும்.,13
வேண்டும்_விடுதலை,அன்பர்கள் பலருடைய உணர்ச்சியையும் நான் நன்கு அறிவேன்.,6
வேண்டும்_விடுதலை,சிலர் இப் போராட்டத்திலீடுபட்டு எத்தனை ஆண்டுகளேனும் சிறைக்குச் செல்ல அணியமாக விருக்கின்றார்கள் என்றும் எனக்குத் தெரியும்.,12
வேண்டும்_விடுதலை,"சிலர் கூட்டத்தோடு வந்துவிட்டோமே, நடவடிக்கைகள் கடுமையாக விருந்தால் என்ன செய்வது என்று அலமருகின்றதையும் அறிவேன்.",11
வேண்டும்_விடுதலை,அனைவரும் காலை வரை பொறுத்துக் கொள்ளுங்கள்.,5
வேண்டும்_விடுதலை,காலையில் எல்லாம் தெரிந்துவிடும்.,3
வேண்டும்_விடுதலை,நீங்கள் இப்பொழுது அமைதியாகப் போகலாம் என்று விரிவாக எடுத்துரைத்தார்.,7
வேண்டும்_விடுதலை,இரவு பதினொன்றரை மணியளவில் கூட்டம் முடிவுற்றது.,5
வேண்டும்_விடுதலை,"இருவரும் மாநாட்டுச் செய்தி மிகவும் பரபரப்பூட்டி யிருப்பதாகவும், அரசுவரை எட்டியிருப்பதாகவும் சொன்னார்கள்.",9
வேண்டும்_விடுதலை,"அன்றையச் செய்தி அன்றைய மாலை வெளியீடுகளிலும், மறுநாளைய காலை வெளியீடுகளிலும் வந்திருந்தன.",9
வேண்டும்_விடுதலை,"பிற தாள்கள் அனைத்திலும் செய்திகள் திரிக்கப்பட்டும், மாற்றப்பட்டும், குறைக்கப்பட்டும், மறைக்கப்பட்டும் வெளியிடப் பெற்றிருந்தன.",10
வேண்டும்_விடுதலை,"தினத்தந்தி தனக்கேயுரிய முறையில், மதுரையில் திராலிடர் கழகத்தினர் தொன்னூற்றிரண்டு பேர் கைது என்று புளுகியிருந்தது.",11
வேண்டும்_விடுதலை,தினமணி யும் அதற்கு ஒத்தூதியிருந்தது.,4
வேண்டும்_விடுதலை,அதற்கு இயல்பாகவுள்ள பார்ப்பனக் குறும்புக்கு ஓர் எடுத்துக்காட்டாக விருந்தது.,7
வேண்டும்_விடுதலை,தென்மொழி என்னும் பெயரைச் சொல்லவும் ஆரியப் பார்ப்பனர்கள் நாக்கூசுகின்றனர் என்று அதனால் தெரியவருகின்றது.,10
வேண்டும்_விடுதலை,மாநாடு என்பதைக் கூட மகாநாடு என்று எழுதி நிறைவடைகிறார்கள் அவர்கள் என்பதை நம் அடிமை கள் கவனித்தால் நல்லது.,14
வேண்டும்_விடுதலை,"இந்து ஆங்கில ஆரிய நாளிதழ், தளைப்பட்ட ஒருசிலர் பிணையல் கொடுத்து வெளிவர முயற்சி செய்ததாக ச் செய்தியையே களங்கப்படுத்தியிருந்தது.",14
வேண்டும்_விடுதலை,நவசக்தி பெருஞ்சித்திரனாரைப் பெருஞ்சித்தனார் என்று எழுதியிருந்தது.,5
வேண்டும்_விடுதலை,மற்றும் ஒவ்வொரு செய்தித்தாளும் தளைப்பட்டவர்களின் எண்ணிக்கையை ஒவ்வொரு வகையாகக் குறித்திருந்தது இன்னும் வியக்கத்தக்க செய்தியாம்.,11
வேண்டும்_விடுதலை,அலைஓசை தொன்னூறு பேர்கள் அவர்களுள் ஐந்து பெண்கள் என்று எழுதியிருந்தது.,8
வேண்டும்_விடுதலை,மதுரைத் தமிழ்முரசு நூறு பேர் என்றும் அவர்களுள் பெண்கள் பத்து பேர் என்றும் எழுதியிருந்தது.,11
வேண்டும்_விடுதலை,திருச்சி தினமலர் நான்கு பெண்கள் உட்பட நூறு பேர் என்று வெளியிட்டிருந்தது.,9
வேண்டும்_விடுதலை,நம் நாட்டில் உள்ள செய்தித்தாள்கள் எவ்வாறு பொறுப்பில்லாமல் செய்திகளை வெளியிடுகின்றன என்பதை உணர்த்தவே இந்நிலைகளையெல்லாம் இங்குத் தெரிவிக்க வேண்டியிருக்கின்றது.,14
வேண்டும்_விடுதலை,"வீரமணியால் இயக்கப் பெறுவதுமாகிய விடுதலை என்னும் நாளிதழும், முரசொலியுந்தாம் இந்த மாநாட்டுச் செய்திகளை ஒருவரி கூட போடவில்லை.",13
வேண்டும்_விடுதலை,அவற்றிற்கு இம்மாநாடும் மாநாடில்லை.,3
வேண்டும்_விடுதலை,அதன் செய்தியும் செய்தியில்லை என்பது கருத்துப் போலும்.,6
வேண்டும்_விடுதலை,தமிழரின் எதிர்காலம் பற்றி இவற்றின் கருத்து என்னதான் என்பதை அந்தக் காலமே தான் முடிவு கட்ட வேண்டும்.,13
வேண்டும்_விடுதலை,இன்னும் இதைவிட வியப்பான செய்தி ஒன்று உண்டு.,6
வேண்டும்_விடுதலை,"என்றதும், அவர்களுக்கும் எங்களுக்கும் எவ்வகைத் தொடர்பும் இல்லை என்றதும் !",7
வேண்டும்_விடுதலை,இவற்றிற்கெல்லாம் ஒட்டுமொத்தப் பெயர்தானோ அரசியல் என்பது !,5
வேண்டும்_விடுதலை,"ஓலை ஒன்று பனிரண்டு , ஒன்று இரண்டு, வெறும் கருத்தரங்குகளால் இதுவரை எந்தப் பயனும் விளைந்ததில்லை.",11
வேண்டும்_விடுதலை,"• தமிழன் வடநாட்டானுக்கு அடிமையாயிருக்கும் வரை, அவன் நம் கருத்துகளையும், நம் உரிமைகளையும் காதுகளிலேயே போட்டுக்கொள்ளமாட்டான்.",12
வேண்டும்_விடுதலை,• திண்னையிலே இடம் கேட்டு உட்கார்ந்தவன் வீட்டையே தனக்குச் சொந்தம் என்பதா?,9
வேண்டும்_விடுதலை,• பாவாணர் போன்ற அறிஞர்கள் வேண்டுமானால் கருத்தரங்கை நம்பியிருக்கட்டும்.,7
வேண்டும்_விடுதலை,இளைஞர்கள் போராடித்தான் உரிமைகளைப் பெற முடியும்.,5
