work_title,sentence,sentence_length
வேண்டும்_விடுதலை,அப்பொழுதும் இயங்கி வழியாக ஒலிபரப்பும் இசைவுக்கு இறுதிவரை அரசினர் இசைவு தரவே இல்லை.,10
வேண்டும்_விடுதலை,அவை போவோர் வருவோரைச் சற்று இடை நிறுத்திப் படிக்கத் தூண்டும் படி அவ்வளவு எடுப்பாக அமைந்திருந்தன.,12
வேண்டும்_விடுதலை,தேவர் மன்ற நுழைவாயிலில் வாழை மரங்கள் கட்டப் பெற்று அழகுடன் காட்சியளித்தன.,9
வேண்டும்_விடுதலை,ஊர்வலத்தின் இறுதியில் பெண்களும் அவர்களை யடுத்துத் தொண்டர்கள் சிலரும் கூடினர்.,8
வேண்டும்_விடுதலை,பெரும்பாலும் மாநாட்டுக்கு அழைக்கப் பெற்றிருந்த தலைவர்களுள் தமிழ்மறவர் திரு வை.,8
வேண்டும்_விடுதலை,பொன்னம்பலனார் ஒருவரே ஊர்லத்தில் கலந்து கொண்டார்.,5
வேண்டும்_விடுதலை,ஆனால் அன்றைய மாநாட்டில் கோவை மாவட்ட தி.,6
வேண்டும்_விடுதலை,க தலைவரும் வழக்கறிஞருமாகிய திரு கசுத்தூரி அவர்களும் கலந்து கொண்டு சொற்பொழி வாற்றினார்.,10
வேண்டும்_விடுதலை,இதுபற்றி வேறு முன்பே தென்மொழியில் எச்சரிக்கை தரப் பெற்றுள்ளது.,7
வேண்டும்_விடுதலை,எனவே ஊர்வலத்தில் கலந்து கொண்டவர் ஒருவர் பதின்மருக்கு இன்னுஞ்சொன்னால் நூற்றுவருக்குக் கூடச் சமமாவர்.,10
வேண்டும்_விடுதலை,அப்படிக் கணக்கிட்டால் ஊர்வலம் மிகுந்த அளவில் வெற்றி பெற்றது என்றே சொல்லுதல் வேண்டும்.,10
வேண்டும்_விடுதலை,"ஊர்வலத்தினர் அணி அணியாகப் பிரிந்து, தமிழ் குமுகாய, தமிழக விடுதலை முழக்கங்களைத் தொடர்ந்து எழுப்பிய வண்ணம் சென்றனர்.",13
வேண்டும்_விடுதலை,"உரத்த குரலுடைய மறவர்கள் சிலர் முன் முழக்கமிட, அவர்களைத் தொடர்ந்து அன்பர்கள் வீறுபட கொள்கைகளை முழங்கியது.",12
வேண்டும்_விடுதலை,முழக்கமிட்டவர்களில் திரு அரணமுறுவல் அவர்களின் குரலும் திரு நெடுஞ்சேரலாதன் அவர்களின் குரலும் இன்னுங்கூட திருச்சியிலுள்ள பொதுமக்களின் காதுகளில் சிலையோடிக்கொண்டிருக்கும்.,14
வேண்டும்_விடுதலை,ஊர்வலத்தோடு ஏற்கெனவே வந்து கொண்டிருந்த காவலர் சிலருடன் புதிதாகச் சிலரும் வந்து சேர்ந்தனர்.,10
வேண்டும்_விடுதலை,அவருக்கு இருபத்தைந்து முழக்கங்களும் அச்சிட்ட படி ஒன்று கொடுக்கப் பெற்றது.,8
வேண்டும்_விடுதலை,"சற்று நேரங்கழித்து ஊர்வலம் காந்தி அங்காடியை அடைந்ததும், காவல்துறை அதிகாரிகள் ஊர்வலத்தை மறித்தனர்.",10
வேண்டும்_விடுதலை,காவலர் பலர் ஊர்வலத்தைச் சுற்றி வளைத்துக்கொண்டனர்.,5
வேண்டும்_விடுதலை,அப்போது ஊர்வலம் நின்ற போதிலும் விடுதலை முழக்கங்கள் முன்னிலும் பன்மடங்கு உரத்த குரலில் முழக்கப்பெற்றன.,11
வேண்டும்_விடுதலை,மக்கள் கூட்டங் கூட்டமாய் ஆங்காங்கு நின்று வியப்புடன் பார்த்துக் கொண்டிருந்தனர்.,8
வேண்டும்_விடுதலை,ஊர்வலத்தை மறித்த அதிகாரிகள் மாநாட்டு அமைப்பாளர் பாவலரேறு பெருஞ்சித்திரனாருடன் ஏதோ பேசினர்.,9
வேண்டும்_விடுதலை,"அப்போது அவர்கள் பக்கத்தில் திருவாளன்மார் மகிழ்நனும், தமிழ்நம்பியும் போய் நின்று கொண்டனர்.",9
வேண்டும்_விடுதலை,காவல் துறை அதிகாரிகளுடன் பேசிய பேச்சைப் பாவலரேறு அவர்கள் மாநாட்டில் பின்னர் வெளியிட்டார்கள்.,10
வேண்டும்_விடுதலை,இறுதியில் அதிகாரிகள் விடுதலை முழக்கங்கள் எழுதிய சில தட்டிகளைக் கொடுத்துவிட்டுப் போகுமாறு கேட்டார்கள்.,10
வேண்டும்_விடுதலை,அவ் விடுதலை மறவர்களின் உணர் வெழுச்சி முழக்கங்களாக வெளிப்பட்டுக் கொண்டிருந்தது.,8
வேண்டும்_விடுதலை,அப்போது திரு மகிழ்நன் முழங்குவதைச் சற்று நிறுத்தவேண்டும்.,6
வேண்டும்_விடுதலை,என்பதும் அதிகாரிகள் எந்தெந்தத் தட்டிகளை எடுத்துக் கொண்டாலும் வாளாவிருக்க வேண்டும் என்பதும் அமைப்பாளர் கட்டளை என்றும் சொன்னார்.,13
வேண்டும்_விடுதலை,பின் அதிகாரிகள் விடுதலை முழக்கத் தட்டிகள் சிலவற்றை எடுத்துக்கொண்டனர்.,7
வேண்டும்_விடுதலை,பின் அனைவரும் நன்பகல் உணவுக்காகக் கலைந்து சென்றனர்.,6
வேண்டும்_விடுதலை,பிற்பகல் இரண்டு மணியளவில் செல்வி மா.,5
வேண்டும்_விடுதலை,தேன்மொழியின் தமிழ் வணக்கப் பாடலுடன் குமுகாய மாநாடு தொடங்கியது.,7
வேண்டும்_விடுதலை,"மாநாட்டு அமைப்பாளர் பாவலரேறு பெருஞ்சித்திரனார் செயலர் புலவர் இறைக்குருவனார், தமிழ்மறவர் புலவர் வை.",10
வேண்டும்_விடுதலை,"பொன்னம்பலனார், கோவை மாவட்ட தி.",4
வேண்டும்_விடுதலை,"தலைவர் கசுத்துளரி, கைகாட்டி ஆசிரியர், திரு தமிழ்க்குடிமகனார் முதலியோர் மேடையிலும், அதற்கண்மையிலும் அமர்ந்திருந்தனர்.",10
வேண்டும்_விடுதலை,மாநாட்டிற்கு வருவதாகத் தெரிவித்திருந்த பர்.,4
வேண்டும்_விடுதலை,"இலக்குவனாரும், புலவர் குழந்தையும் என்ன கரணியத்தாலோ வரவில்லை.",6
வேண்டும்_விடுதலை,முதலில் மாநாட்டரங்கில் ஏறத்தாழ இருநூற்றுவர் கூடியிருந்தனர்.,5
வேண்டும்_விடுதலை,பின் அன்பர்களும் பொதுமக்களும் வரத் தொடங்கினர்.,5
வேண்டும்_விடுதலை,பின் மாநாட்டிற்குத் தலைமை தாங்க அங்கு வந்திருந்தவருள் ஒருவரைத் தேர்ந்தெடுக்க முற்பட்டார்கள்.,9
வேண்டும்_விடுதலை,"எவருடைய துணையுமின்றி, எவரையும் எதிர்பாராமல், தம் ஊரினின்று தனியராய்த் தாம் ஒருவரே வந்த அன்பர்களை மேடைக்கு அழைத்தார்கள்.",13
வேண்டும்_விடுதலை,நான்கைந்து பேர் வந்தனர்.,3
வேண்டும்_விடுதலை,அவருள் நீண்ட நாட்களாகத் தொடர்ந்து தென்மொழி படித்துவரும் அன்பரைத் தேர்ந்தெடுக்கும் பொருட்டு ஒவ்வொரு வரையும் வினவினார்கள்.,12
வேண்டும்_விடுதலை,"அவர்தம் அறிவுணர்ச்சித் திருட்டையும், அஞ்சாமை யையும், திறமையையும்.",6
வேண்டும்_விடுதலை,தமிழுணர்வையும் பாராட்டி அவரைத் தலைவராக அமர்த்தினார்கள்.,5
வேண்டும்_விடுதலை,திரு இராசசேகரன் தாம் தலைவராக அமர்த்தப் பெற்றமைக்கு நன்றி தெரிவித்து மாநாட்டைத் தொடங்கினார்.,10
வேண்டும்_விடுதலை,"திருவாளன்மார் எழிற்கண்ணன், பெ.வெற்றிக் கூத்தன், இரா.",6
வேண்டும்_விடுதலை,"பாவாணன், புலவர் சா.",3
வேண்டும்_விடுதலை,"அடல் எழிலன், த.",3
வேண்டும்_விடுதலை,"அரிமா வளங்கோ, ந. அரணமுறுவல், தரங்கை பன்னிர்ச்செல்வன், புலவர்.",7
வேண்டும்_விடுதலை,கோவை மாவட்ட தி.க.,4
வேண்டும்_விடுதலை,கைகாட்டி ஆசிரியர் பேரா.,3
வேண்டும்_விடுதலை,தமிழ் மறவர் புலவர்.,3
வேண்டும்_விடுதலை,சில் ஆண்டுகளுக்கு முன்னால் தமிழர்கள் ஆரியப் பார்ப்பனர்களால் எவ்வாறு இழிவு படுத்தப் பெற்றனர் என்பதையும்.,11
வேண்டும்_விடுதலை,என்றும் தனித்தமிழ் இயக்கம் எப்படி எப்படிக் குமுகாய விடுதலைக்கு அடிப்படையாய் இருக்கிறதென்றும் விளக்கினார்கள்.,10
வேண்டும்_விடுதலை,குமுகாய மாநாட்டுத் தீர்மானத்தை,3
வேண்டும்_விடுதலை,விளக்கும்முன்னர் மற்ற மாநாடுகளில் போலன்றித் தீர்மானத்தில் குறிக்கோளுடன் செயல் திட்டமும் கொடுக்கப் பெறும் சிறப்பைச் சொன்னார்கள்.,12
வேண்டும்_விடுதலை,எல்லாப் பேச்சுகளையும் நடுவணரசு ஒற்றர்கள் எழுதிக் கொண்டனர்.,6
வேண்டும்_விடுதலை,"மாநாட்டரங்கினுள்ளும், வெளியேயும் நின்றுக் கொண்டிருந்த காவலர்களும், பாவலரேற்றின் உணர்வழுத்த உரையால் கட்டப்பெற்றிருக்காமல் இருந்திரார் என்றே சொல்லல் வேண்டும்.",13
வேண்டும்_விடுதலை,பாவலரேறு பேசி முடித்தபோது இரவு மணி எட்டு பூஜ்ஜியம்.,7
வேண்டும்_விடுதலை,அப்போது இரவு உணவுக்காக அனைவரும் கலைந்து சென்றனர்.,6
வேண்டும்_விடுதலை,"பின் வெங்காளூர் திரு அறவாழி எழுதி, இயக்கி, நடத்திய எந்நாளோ? என்னும்நாடகம் கொள்கை நடிக்கப்பெற்றது.",11
வேண்டும்_விடுதலை,"அந்நாடகத்தில் ஒன்றிரண்டு அயற் சொற்கள் கலந்து உரையாடல் எழுதப்பெற்றிருப்பினும் தமிழுணர்வும், தமிழக விடுதலைக் கருத்துகளுமே மிகுதியும் புகுத்தப்பெற்றிருந்தன.",13
வேண்டும்_விடுதலை,நாடகத்தில் வீர உணர்வு இழையோடிற்று.,4
வேண்டும்_விடுதலை,"நாடகத்தில் திருவாளன்மார் மணிவேங்கை விட்டுணு, பன்னீர்ச்செல்வன்.",5
வேண்டும்_விடுதலை,"மன்னன், பீர்முகம்மது, சிவநேசன், நடராசன், செல்வி.",5
வேண்டும்_விடுதலை,பிரேம்குமாரி ஆகியோர் நடித்தனர்.,3
வேண்டும்_விடுதலை,மாநாட்டுக்கு வந்திருந்த அன்பர்களும் நாடகம் பார்க்க வந்திருந்த பொதுமக்களும் நாடகத்தைப் பாரட்டிப் பேசிக் கொண்டனர்.,11
வேண்டும்_விடுதலை,இரவு பனிரண்டு  மணியளவில் நாடகமும் குமுகாய மாநாடும் முடிவுற்றன.,7
வேண்டும்_விடுதலை,அரசியல் மாநாடு ஞாயிற்றுக்கிழமை காலை ஒன்பது.,5
வேண்டும்_விடுதலை,முப்பது மணியளவில் அரசியல் மாநாடு தொடடங்ற்று.,5
வேண்டும்_விடுதலை,மாநாட்டின் முதல் கட்டமாக மாணவர் அரங்கமும் இரண்டாவதாக மகளிர் அரங்கமும் நிகழ்ந்தன.,9
வேண்டும்_விடுதலை,இவ்விரு அரங்குகளுக்கும் மாநாட்டு செயலாளர் புலவர்.,5
வேண்டும்_விடுதலை,"இறைக்குருவனார் தலைமை தாங்கினார், செல்வி மா.",5
வேண்டும்_விடுதலை,தேன்மொழி தமிழ் வணக்கப் பாடல் பாடினார்.,5
வேண்டும்_விடுதலை,"மாணவர் அரங்கத்தில் திருவாளன்மார் வே. மு. பொதிய வெற்பன், கோ.",8
வேண்டும்_விடுதலை,"திருநாவுக்கரசு, அரிமா மகிழ்கோ, ஆ.",4
வேண்டும்_விடுதலை,"மதியழகன், ஆடலரசு, அன்பழகன், பாமகன், கரிகாலன், சிவந்த பெருமாள் ஆகியோர் பேசினர்.",9
வேண்டும்_விடுதலை,மகளிர் அரங்கில் திருவாட்டிமார் இறை.,4
வேண்டும்_விடுதலை,"உலகமுதல்வி, தாமரைபெருஞ்சித்திரன் ஆகியோர் பேசினர்.",4
வேண்டும்_விடுதலை,நண்பகல் இடை நேரத்தில் பெகும்ப கல்லா திரு நா.,7
வேண்டும்_விடுதலை,இளமாறன் தமிழியக்கப் பாடல்கள் சில பாடினார்.,5
வேண்டும்_விடுதலை,இறுதியாக அரசியல் அரங்கம் தொடங்கியது.,4
வேண்டும்_விடுதலை,அதற்குத் தலைவரைத் தேர்ந்தெடுக்கும் பொருட்டு மாநாட்டு அமைப்பாளர் சார்பில் திரு க.,9
வேண்டும்_விடுதலை,நெடுஞ்சேரலாதன் நான்காண்டுகள் தொடர்ந்து திரைப்படம் பார்க்காத அன்பர் யாரேனும் உளரா என்று கேட்டார் யாரும் வரவில்லை.,12
வேண்டும்_விடுதலை,சிலர் வந்து ஆறாண்டு ஏழாண்டுகள் பார்க்காமல் இருந்து அண்மையில் ஒரு படம் பார்த்ததாகக் கூறினர்.,11
வேண்டும்_விடுதலை,இறுதியில் இரண்டரை ஆண்டுகளாகத் தொடர்ந்து திரைப்படம் பார்க்காத திருவாரூர் அன்பர் திரு வை.,10
வேண்டும்_விடுதலை,தமிழ்க்குமரன் தலைவராக அமர்த்தப் பெற்றார்.,4
வேண்டும்_விடுதலை,"கண்ணன், தமிழநம்பி, மு. மகிழரசன், இரும்பொறை திருக்குறள் பெருமாள், இரா.",8
வேண்டும்_விடுதலை,"அருட்குவை, க.வெ.",3
வேண்டும்_விடுதலை,நித்தலின்பனார் ஆகியோர் தத்தம் பாணியில் தமிழக விடுதலைபற்றி வலியுறுத்தித் தம் உணர்வு கனலும் உள்ளங்களை வெளிக்காட்டினர்.,12
வேண்டும்_விடுதலை,பாப்பா அரசியலில் மகளிர் பங்குபற்றி உரையாற்றினார்.,5
வேண்டும்_விடுதலை,தமிழை மதிக்காத திராவிடர் கழகத்தினர் திருக்குறளைப் பெண்ணடிமை செய்கிறது கண்முடி வழக்கங்களைக் கற்பிக்கிறது என்று சொல்லி வருவதற்கு மறுத்தார்கள்.,14
வேண்டும்_விடுதலை,பிழைத்துணர்ந்தும் பேதைமை சொல்லார் இழைத்துணர்ந்து ஈண்டிய கேள்வி யவர் என்னும் திருக்குறட் பொருளை அரைமணி நேரம் விளக்கியிருப்பார்கள்.,13
வேண்டும்_விடுதலை,பிரெஞ்சுப்புரட்சி ஏறத்தாழ நாநூறு  பேர்களால் தான் முன்னின்று நடத்தப் பெற்றது.,8
வேண்டும்_விடுதலை,மக்கள் தக்க நேரத்தில் அவர்களாகவேவந்து சேர்ந்து கொண்டார்கள்.,6
வேண்டும்_விடுதலை,எனவே மக்களைப் பற்றிக் கவலைப்பட வேண்டியதில்லை.,5
வேண்டும்_விடுதலை,அவர்களை எந்தநேரத்திலும் இழுத்துக் கொள்ளலாம்.,4
வேண்டும்_விடுதலை,வங்காளத்தில் நடந்த விடுதலைப் புரட்சியில் இலக்கக் கணக்கில் மடிந்துள்ளார்களே என்கிறார்கள் அங்கு மடிந்தால் இங்கும் மடிய வேண்டுமா என்ன?,14
வேண்டும்_விடுதலை,அப்படியே செத்தாலும்தான் என்ன கெட்டுப் போகிறது.,5
வேண்டும்_விடுதலை,இப்போதுள்ள நிலை வாழ்ந்து கொண்டா இருக்கிறது?,5
வேண்டும்_விடுதலை,இந்திரா அம்மையாருக்கு அவ்வளவு துணிச்சல் வராது.,5
வேண்டும்_விடுதலை,"மேலும் பேசுகையில் காவல்துறையினரும், புலனாய்வுத் துறையினரும் இப்போது தம்தம் கடமைகளைச் செய்யலாம்.",9
வேண்டும்_விடுதலை,ஆனால் ஒருகாலம் வரும்.,3
வேண்டும்_விடுதலை,அப்போது நீங்கள் உடனே மாறிக் கொண்டு எங்களுடன் சேர்த்து ஒத்துழைக்க வேண்டியிருக்கும் என்றும் குறிப்பிட்டார்கள்.,11
