work_title,sentence,sentence_length
வேண்டும்_விடுதலை,"அக்கால், உண்மையான எழுச்சியுள்ள வீரர்களையும் உணர்வாளர்களையும் இவர்கள் பிற நாடுகளிலிருந்து இறக்குமதி செய்யப் போகிறார்களோ?",11
வேண்டும்_விடுதலை,"எனவே, நாட்டுணர்வுகளையும், போராட்ட எழுச்சிகளையும் வெறும் அழிவுக் கருவிகளைக் கொண்டே அடக்கிவிட நினைக்க வேண்டாம்.",11
வேண்டும்_விடுதலை,ஆட்சியாளரிடம் உள்ள அக் கருவிகள் மக்கள் கைகளுக்குவர நெடுநாள் ஆகாது !,8
வேண்டும்_விடுதலை,ஒரேயொரு கால எல்லைதான் தேவை !,4
வேண்டும்_விடுதலை,அஃது எந்தக் காலம் என்று யாராலும் வரையறுக்க முடியாது.,7
வேண்டும்_விடுதலை,ஊர் நலனுக்கென்று தேக்கி வைக்கப் பெறுகின்ற அணைநீர் !,6
வேண்டும்_விடுதலை,வின் செயற்குழுக் கூட்டத்தில் பேசப்பெற்றதாகக் கேள்விப்பட்டோம்.,5
வேண்டும்_விடுதலை,அதற்குத் தங்களின் விளக்கம் என்ன?,4
வேண்டும்_விடுதலை,அவர்கள் தங்கள் இனத்தவர்களைக் கட்டிக் காத்துக் கொள்கிறார்கள்.,6
வேண்டும்_விடுதலை,நாம் ஒருவரை ஒருவர் தாழ்த்திக் கொண்டு பின்னிறங்குகிறோம்.,6
வேண்டும்_விடுதலை,நமக்கிதில் விருப்பமில்லை என்றாலும் அவர்கள் கூறுவதற்கு நாம் விடை சொல்ல வேண்டியுள்ளதே என்ன செய்வது?,11
வேண்டும்_விடுதலை,"முதலாவதாக, நாம் எதற்காகவும் யாரிடத்தும் என்றும் மன்னிப்புக் கேட்டது.",7
வேண்டும்_விடுதலை,கெஞ்சுவதில்லை என்னும் கொள்கை முழக்கத்தைத் தென்மொழி என்றுமே கைவிட்டதில்லை.,7
வேண்டும்_விடுதலை,மிசாக் கால ஓராண்டுச் சிறையை முழுவதும் நான் ஏற்றுக் கொண்டே வெளிவந்தேன்.,9
வேண்டும்_விடுதலை,ஆனால் நமக்கோ அக்கால் உதவுவார் எவரும் இல்லை.,6
வேண்டும்_விடுதலை,எனவே விடுமுறை கேட்க வேண்டியிருந்தது.,4
வேண்டும்_விடுதலை,அதுவும் கிடைக்கவில்லை அதை இப்பொழுது இவ்வாறு திரித்துப் பேசுவது அவர்களுக்கே நல்லதில்லை.,9
வேண்டும்_விடுதலை,"ஒருவரை யொருவர் குற்றம் சாட்டிக் கொள்வதானால், அந்நிலை எங்கே போய் நிற்குமோ தெரியாது.",10
வேண்டும்_விடுதலை,முடிவாக நாம் என்றும் எப்பொழுதும் எந்தக் கொள்கையையுமே கைநெகிழ்த்ததில்லை.,7
வேண்டும்_விடுதலை,பொதுவான உண்மை ஒன்று உண்டு ஒருவர் தாம் மெலிவு அடைகிற போதுதான் பிறரைக் குறைகூற முற்படுகிறார் என்பதே அது.,14
வேண்டும்_விடுதலை,"அதன்படி அவர்கள் இவ்வாறு கூறத் தொடங்கியுள்ளார்களோ, என்னவோ?",6
வேண்டும்_விடுதலை,"அடுத்தபடி, நாம் பிரிவினைத் தடைச்சட்டத்தை எரிப்போம் எனத் தீர்மானம் போட்டது உண்மைதான்.",9
வேண்டும்_விடுதலை,ஆனால் அதன் பின்னர்தான் அப்படி ஒரு தனிச்சட்டமே இல்லை என்று தெரிய வந்தது.,10
வேண்டும்_விடுதலை,கூட்டம் கூட்டுவதும் மாநாடுகள் போடுவதுமா?,4
வேண்டும்_விடுதலை,அவற்றுக்கான எதிர்விளைவுகளைத்தாம் நடுவணரசின் இந்தித் திணிப்பில் நாம் நேரடியாகப் பார்க்கிறோமே !,8
வேண்டும்_விடுதலை,பின் என்ன செய்வது?,3
வேண்டும்_விடுதலை,எதையும் மெதுவாகத்தான் நாம் செய்ய முடியும்.,5
வேண்டும்_விடுதலை,"தென்மொழி, சுவடி இருபத்திரண்டு, ஓலை ஆறு, ஓர் ஆயிரத்து தொள்ளாயிரத்து எண்பத்தாறு தமிழகம் !",10
வேண்டும்_விடுதலை,மணவாளன் க.மு.,3
வேண்டும்_விடுதலை,அவர்களின் மெய்.மு பட்ட ஆய்வுக்காக எடுக்கப் பெற்ற குறிப்புகளிலிருந்து.,8
வேண்டும்_விடுதலை,தமிழகம் தன்னாட்சி பெற முடியுமென்று தாங்கள் கருதுகிறீர்களா?,6
வேண்டும்_விடுதலை,"இஃதொன்றும் மலையைக் கரைக்கின்ற செய்தியோ, கடலை வற்றடிக்கின்ற செய்தியோ அன்று.",8
வேண்டும்_விடுதலை,அவையும் கூட இற்றை நாள் அறிவியல் வளர்ச்சிக் காலத்தில் முடிகின்ற செய்திகளே?,9
வேண்டும்_விடுதலை,"அது வெள்ளைக்காரர்களின் கையிலிருந்த ஆட்சி, வடநாட்டார் கைகளுக்கு வரவில்லையா?",7
வேண்டும்_விடுதலை,அது போன்றதே அது தமிழ் நாட்டார் கைக்கு வரவேண்டும் என்பதும்.,8
வேண்டும்_விடுதலை,இது முடியாது என்பதற்கு எந்தக் காரணமோ அடிப்படையோ இல்லை.,7
வேண்டும்_விடுதலை,முயற்சி செய்தால் அனைத்தும் ஒரு கால கட்டத்தில் முடிந்தே ஆக வேண்டும்.,9
வேண்டும்_விடுதலை,"நான் கருதுவது போல், பலரையும் கருதும் படி செய்து விட்டால், அது செயலாவதற்கு நீண்ட காலம் ஆகாது.",13
வேண்டும்_விடுதலை,"திராவிடர் கழகம், நமக்கு எதிரான இயக்கம் அன்று தோழமைக் கழகமே !",8
வேண்டும்_விடுதலை,"இந்த வகையில் நாம், இதுவரை நேரிடையாக எந்தக் கருத்தையும் அதன் செயற்பாடுகள் தொடர்பாக இவ்வாறு எடுத்துக் கூறிட முன்வந்ததில்லை.",14
வேண்டும்_விடுதலை,"ஆனாலும், இக்கால், தவிர்க்கவியலாத சில விளைவுகளை நோக்கி, அதைப்பற்றியும் சில பல கருத்துகளைக் காணவேண்டிய கட்டாயத்துக்குக் கொணரப்பட்டுள்ளோம்.",13
வேண்டும்_விடுதலை,"எதிரான நோக்கிலன்று சார்பான நோக்கிலேயே, இக் கருத்துகள் இங்குக் கூறப்பெறுகின்றன என்பதை அன்பர்கள் உணர்ந்துகொள்ள வேண்டும்.",12
வேண்டும்_விடுதலை,"தேவையான இடத்தில் தொலைவில் நின்றும், இணைந்து – இயங்கியும் நாம் அவ்வாறு பாராட்டியும் – போற்றியும் வந்திருக்கிறோம்.",13
வேண்டும்_விடுதலை,"இந்தவகையில் சில சொற்களை நாம் எச்சரிக்கையுடனும், தோழமையுணர்வுடனுமே கையாள விரும்புகிறோம்.",8
வேண்டும்_விடுதலை,"சரியாகச் சொன்னால், கடந்த அறுபது ஆண்டுகளாக நாம் இந்தியை எதிர்த்துக் குரல் கொடுத்து வருகிறோம்.",11
வேண்டும்_விடுதலை,"அப்பொழுதெல்லாம், இந்தி திணிக்கப்படவில்லை என்பதை நாம் நினைவில் கொள்ள வேண்டும்.",8
வேண்டும்_விடுதலை,"இருப்பினும், பின்னால் இந்தத் தமிழினத்துக்கு வரவிருந்த மிகப் பெருங்கேட்டை முன்னமேயே உணர்ந்து, முன்னறிவித்த பெருமை அவருடையது.",12
வேண்டும்_விடுதலை,"அப்பொழுதெல்லாம் நாமும், இன்று இந்தியைத் தீவிரமாக எதிர்க்கும் பலரும் பிறந்தே இருக்கமாட்டோம்.",9
வேண்டும்_விடுதலை,"எனவே, நாம் பிறப்பதற்கு முன்பிருந்தே இந்தி எனும் நச்சுச்செடிக்கு, இங்கிருந்து எதிர்ப்புக் குரல் கிளம்பிவிட்டது.",11
வேண்டும்_விடுதலை,"அந்த முதல் குரலும், தந்தை பெரியாருடையது என்று எண்ணும்பொழுது நாம் வியப்பும், அதே சமயத்தில் சொல்லவொண்ணாத் துயரமும் கொள்கிறோம்.",14
வேண்டும்_விடுதலை,தம்மின் தம் மக்கள் அறிவுடைமை என்பார் திருவள்ளுவர்.,6
வேண்டும்_விடுதலை,யார் அஞ்சிக் குலை நடுங்கப் போகிறார்கள்?,5
வேண்டும்_விடுதலை,இதைச் சிந்தித்துப் பார்க்க வேண்டாவா?,4
வேண்டும்_விடுதலை,"குன்றக்குடி அடிகளார், கி.",3
வேண்டும்_விடுதலை,இராமலிங்கனார் போன்ற தலைவர்களையெல்லாம் மேடையில் வைத்துக் கொண்டு சொன்னோம்.,7
வேண்டும்_விடுதலை,இவ் வகையாலெல்லாம் நம் ஆற்றலை இழந்துகொண்டே போகக்கூடாது நாம் இந்தியை எதிர்ப்பதை விட்டுவிட்டு இந்திய அரசையே எதிர்க்கவேண்டும்.,13
வேண்டும்_விடுதலை,தமிழ்நாட்டைத் தனிநாடாகப் பிரிக்கப் போராடவேண்டும்.,4
வேண்டும்_விடுதலை,"நாம் எவருக்கும் எதிராகவோ, அல்லது நம் வாழ்க்கை உயிர் பிழைப்புக்காகவோ, எந்த முயற்சியையும் தொடங்கவில்லை செய்துகொண்டும் வரவில்லை.",13
வேண்டும்_விடுதலை,இந்த நிலைகளை நாம் எந்த விளம்பர நோக்கத்துடனும் கூறவில்லை.,7
வேண்டும்_விடுதலை,ஊரை அடித்து உலையில் கொட்ட வேண்டிய இன்றியமையாமையும் எமக்கில்லை.,7
வேண்டும்_விடுதலை,"இன்றும் அரிசியும், பருப்பும், உப்பும், புளியும் அன்றாடப் பட்டியலிலேயே சேர்க்கப் பெற்றுள்ளன.",9
வேண்டும்_விடுதலை,"எனவே, இன்றிறந்தாலும் ஒன்றுதான் என்று இறந்தாலும் ஒன்றுதான் !",6
வேண்டும்_விடுதலை,"மற்று, இனநல, நாட்டுநலக் கொள்கையில் நாம் தொய்வு கொள்ள வேண்டிய தேவை என்ன வந்தது?",11
வேண்டும்_விடுதலை,யாருக்காக நாம் அஞ்ச வேண்டும்?,4
வேண்டும்_விடுதலை,பின்னர் ஏன் நம் முயற்சிகளில் இத்துணைத் தொய்வு?,6
வேண்டும்_விடுதலை,என்ன இந்தி எதிர்ப்பு வேண்டிக் கிடக்கிறது இன்னும்?,6
வேண்டும்_விடுதலை,"சொல்லிக் கொண்டிருந்தவர்களுக்கே, சொல்லிக் கொண்டிருந்தவற்றையே, சொல்லிக் கொண்டிருப்பவர்கள், சொல்லிக் கொண்டிருக்கிறோம் !",8
வேண்டும்_விடுதலை,இவற்றால் யாருக்கு என்ன புதுப்பயன் விளைந்து விடப் போகிறது?,7
வேண்டும்_விடுதலை,ஏன் நம்மிடத்தில் இந்த அடிமைத்தனமும் மடிமைத்தனமும் !,5
வேண்டும்_விடுதலை,"நாங்கள் கூட்டினால், இந்தி எதிர்ப்பு மாநாடு சிறப்புறாது என்ன பயனும் விளைந்துவிடாது என்பது போலவேதான் நீங்கள் கூட்டினாலும் !",13
வேண்டும்_விடுதலை,"ஏன், கலைஞர் கூட்டுவதுதானே !",3
வேண்டும்_விடுதலை,"அவர் கூட்டினால் வடநாட்டு அரசு, ஓரளவுக்கு அஞ்சும் !",6
வேண்டும்_விடுதலை,"ஆனால் அவர் அவர்களைப் பார்த்து அஞ்சுகிறார் அஞ்சுவதும், நாணுவதும், ஆமைபோல் வாழுவதும், கெஞ்சுவதுமாக எத்தனை நாளைக்குக் கிடப்பது?",13
வேண்டும்_விடுதலை,இந்தியைப் பற்றித்தான் எல்லா வரலாறும் இங்குள்ளவர்களுக்குத் தெரியுமே !,6
வேண்டும்_விடுதலை,"கடந்த அறுபது ஆண்டுகளாக அதுபற்றிய விளக்கங்களும், அதை எதிர்த்துத் தகர்க்க வேண்டிய தேவைகளும்தாம் மலைமலையாக கூறப்பட்டு வந்துள்ளனவே !",13
வேண்டும்_விடுதலை,இன்னும் யாரைத் தட்டியெழுப்ப இம் மாநாடுகள்?,5
வேண்டும்_விடுதலை,யாருக்கு உணர்வூட்டுவதற்கு இம்முயற்சிகள்?,3
வேண்டும்_விடுதலை,யாரை ஏமாற்றுவதற்கு இப்போராட்டங்கள்?,3
வேண்டும்_விடுதலை,"நாம் இனி எழுப்ப வேண்டுவது, மக்களை அன்று நம்மைத்தான் நாம் எழுப்பிக் கொள்ளவேண்டும் !",10
வேண்டும்_விடுதலை,"நாம் இனி உணர்வூட்ட வேண்டுவது, இளைஞர்களுக்கு அன்று, நமக்குத்தான் உணர்வூட்டிக் கொள்ளவேண்டும் !",9
வேண்டும்_விடுதலை,"நாம் இனி, ஏமாற்றுவதற்காகப் போராட்டங்கள் நடத்தக் கூடாது ஏமாறாமல் இருக்கின்றோம் என்கிற போராட்டங்களை நடத்த வேண்டும்?",12
வேண்டும்_விடுதலை,"நாம் தூக்கும் கரிநெய்ச் சட்டிக்கும் எழுது தூரிகைக்கும் செலவழிக்கும் பணத்தை, வெடி மருந்துக்கும், துமுக்கிக்கும் செலவழிக்க வேண்டும்.",13
வேண்டும்_விடுதலை,அதே எழுத்துகளை யாகிலும் மண்ணெய் கொண்டு அழிக்காமல் துமுக்கிகொண்டு சுடப் போகிறோம் என்று அறிவிக்க வேண்டும்.,12
வேண்டும்_விடுதலை,"இந்திக்காரனைச் சுடாமற் போனாலும், இந்தி எழுத்தையாவது சுடும்படியான புதிய போராட்டத்தை, உந்துவேகம் கொண்ட உணர்வுச்செயலை நாம் நடத்திக்காட்ட வேண்டும்.",14
வேண்டும்_விடுதலை,இதற்குப் பெயர்தான் தம்மின் தம்மக்கள் அறிவுடைமை !,5
வேண்டும்_விடுதலை,"இப்படிச் செய்தாலன்றோ, நமக்குப்பின் வருபவர்களாகிலும், அதே துமுக்கியை எடுத்துப் போரிட வருவார்கள் !",9
வேண்டும்_விடுதலை,"அதைக் கல்லால் அடித்துத் துரத்துகின்ற வகையில், தனித்தமிழ்நாடு என்னும் கொள்கைக் கல்லால் அடித்து விரட்ட வேண்டும்.",12
வேண்டும்_விடுதலை,தமிழ்நாடு தனிநாடு ஆகாமல் இந்தி ஒழியாது !,5
வேண்டும்_விடுதலை,யாராலும் ஒழிக்க முடியாது.,3
வேண்டும்_விடுதலை,"ஆனால், உயிர் மூச்சான இந்தக் கொள்கை என்னாயிற்று?",6
வேண்டும்_விடுதலை,இந்தக் கொள்கையை முன்வைத்து நாம் போராடினால் என்ன?,6
வேண்டும்_விடுதலை,"அச்சப்பட்டு அச்சப்பட்டுத் தமிழினம் இத்துணைக் காலம், ஏறத்தாழ ஈராயிரம் ஆண்டுகள் அடிமையுற்றது போதாதா?",10
வேண்டும்_விடுதலை,அடுத்த தலைமுறையில் இப்பொழுதுள்ள போராட்ட நிலைகள் என்னாகும்?,6
வேண்டும்_விடுதலை,"வீரமணி நடத்துகின்ற இந்த இந்தியெதிர்ப்பு மாநாட்டைக் கலைஞர் நடத்தினால், எல்லா நிலையிலும் இன்னும் வலுப்பெற வாய்ப்பிருக்குமே !",12
வேண்டும்_விடுதலை,"வடநாட்டுத் தலைவர்களையும், இங்கு நடைபெறும் இந்தி எதிர்ப்பில் சேர்ப்பது ஒருவகை விளம்பரத்திற்குத்தானே பயன்பட முடியும்?",11
வேண்டும்_விடுதலை,அவர்களால் என்ன விளைவு ஏற்பட்டுவிட முடியும்?,5
வேண்டும்_விடுதலை,அவர்கள் இந்தியை எதிர்க்கவில்லை இந்திரா பேராயத்தை – அதன் ஆட்சியை எதிர்க்க இதையொரு வாய்ப்பாகத்தானே பயன்படுத்திக் கொள்கிறார்கள் !,13
வேண்டும்_விடுதலை,"மேலும், அவர்கள் இந்தியை எதிர்ப்பதானால், அத்தகைய எதிர்ப்பை நம் தென்னாட்டு உறுப்பினர்களுடன் சேர்ந்து பேசுவதுதானே முறை?",12
வேண்டும்_விடுதலை,அந்த வகையில் அவர்கள் வடநாட்டுத் தலைவர்களையும் இணைத்துப் போராடலாமே !,7
வேண்டும்_விடுதலை,அவர்களின் பொருட்டாகவே நாம் ஆங்கிலத்தை வேறு அளவிறந்து தூக்கிப்பிடித்துப் பேச வேண்டியிருக்கிறது.,9
