work_title,sentence,sentence_length
வேண்டும்_விடுதலை,﻿வேண்டும் விடுதலை — பாவலரேறு பெருஞ்சித்திரனார் ﻿ பதிப்பு ⁠ முதல் பதிப்பு தி.பி.,12
வேண்டும்_விடுதலை,தமிழ்த் தேச முயற்சிக்குத் தந்தையாக வரலாற்றில் குறிப்பிடத்தக்க ஐயா அவர்களின் போராட்ட முயற்சிகள் எதிர்கால இளைஞர்களுக்குப் போர்வாள் !,13
வேண்டும்_விடுதலை,அவரின் ஆற்றல் சான்ற எழுத்துகள் தமிழ்இன உணர்வினர் பட்டைத் திட்டிக் கொள்ளுகிற கற்பாறை !,10
வேண்டும்_விடுதலை,அவரின் நெஞ்சுறுதி தமிழர்களுக்கு உள்ளவூற்றம் !,4
வேண்டும்_விடுதலை,அதேபோது இவைகுறித்துப் பாவலரேறு அவர்கள் எழுதிய நூற்றுக்கும் மேலான பாடல்கள் இத் தொகுப்புள் இடம்பெறவில்லை.,11
வேண்டும்_விடுதலை,அவை கணிச்சாறு — எனும் பாவலரேறு பெருஞ்சித்திரனார் பாடல்கள் தொகுப்பில் நாட்டுரிமை எனும் தலைப்பின் கீழ் இடம்பெற்றுள்ளன.,13
வேண்டும்_விடுதலை,இத் தொகுப்பு நூலுக்கு ஐயா அவர்கள் எழுதிய வேண்டும் விடுதலை — எனும் ஆசிரியவுரைத் தலைப்பே இடம்பெற்றிருக்கிறது.,13
வேண்டும்_விடுதலை,"இந் நூலுக்கானத் தொகுப்பு அச்சாக்க முயற்சிகளில் பெரும்பங்கேற்று உழைத்த உயர்திருவாளர்கள் புலவர் கு. அண்டிரன், தென்மொழி ஈகவரசன், கி.",14
வேண்டும்_விடுதலை,"பிறைநுதல், அரசி, மா.",3
வேண்டும்_விடுதலை,"தமிழ்மொய்ம்பன், கு.பி.",3
வேண்டும்_விடுதலை,சுடரொளி — ஆகியோர்க்குத் தென்மொழி பதிப்பகம் உளம் நிறைந்த நன்றியைத் தெரிவித்துக் கொள்கின்றது.,10
வேண்டும்_விடுதலை,மீனம் பத்தொன்பது  — தென்மொழி பதிப்பகம் உள்ளுறை எண்.,7
வேண்டும்_விடுதலை,﻿ தமிழகப் பிரிவினை தேவையே ﻿ நேரம் வந்துவிட்டது படைமுகத்துக்கு வாருங்கள் !,9
வேண்டும்_விடுதலை,தென்மொழிக் கொள்கைச் செயற்பாட்டு மாநாடு !,4
வேண்டும்_விடுதலை,கொள்கைச் சிறப்புடைய முதல் விடுதலை மாநாடு.,5
வேண்டும்_விடுதலை,﻿ இரண்டாவது தமிழ்கப் பிரிவினை மாநாட்டு நிகழ்ச்சி ﻿ வெறும் கருத்தரங்குகளால் இதுவரை எந்தப் பயனும் விளைந்ததில்லை !,13
வேண்டும்_விடுதலை,﻿ மூன்றாம் விடுதலை மாநாட்டுக்கு முன்னும் பின்னும் ﻿ தனிநாடு கோரிக்கை அனைத்துலகச் சட்டப்படி குற்றமன்று !,12
வேண்டும்_விடுதலை,﻿ தேசியம் பேசும் திருடர்கள் ﻿ அரசியலை விட்டு விலகித் தமிழக விடுதலைக்குப்பாடுபடுங்கள் !,10
வேண்டும்_விடுதலை,﻿ இந்தியாவில் தேசிய இனங்களின் எழுச்சிகள் ﻿ தமிழக விடுதலைக் கோரிக்கையே தமிழிழத்தையும் வென்றெடுக்க வல்லது !,12
வேண்டும்_விடுதலை,﻿ தொடர்வண்டிப் போராட்டத்தைத் தொடர்ந்து படிப்படியாகத் தனித்தமிழ்நாட்டுப் போராட்டத்தை முன்வைக்க வேண்டும்.,9
வேண்டும்_விடுதலை,"﻿ தென்மொழி, தமிழ்நிலம் ஆசிரியர் தமிழ்நாட்டு பிரிவினை உணர்வைத் தூண்டிவருகிறார்.",8
வேண்டும்_விடுதலை,தமிழ்நாட்டுப் பற்றுக் கொள்ளுங்கள் !,3
வேண்டும்_விடுதலை,﻿ தமிழருக்கு வாழ்வுரிமைகளும் தனிநாடும் கிடைத்துவிடக் கூடாதென்பதே இந்தியாவின் கொள்கை ﻿ தமிழ்நாட்டு விடுதலையே உரிமை அரசியலை மீட்டெடுக்கும் !,14
வேண்டும்_விடுதலை,﻿ முன்புபோல் ஆட்சி கவிழ்க்கப்பட்டால் அடுத்து நடப்பது வேறு ﻿ சிறுசிறு நன்மைகளும் சலுகைகளும் இனத்தை ஈடேற்றிவிட முடியாது !,14
வேண்டும்_விடுதலை,பிரிவினை உணர்வும் வளர்ந்தே தீரும் !,4
வேண்டும்_விடுதலை,தனித்தமிழ் நாடு கேட்பதும் தேச விரோதமன்று முன்னூற்று நாற்பத்தொன்பது நாடும் மக்களும் நாடென்ப நாடா வளத்தன என்றார் பொய்யாமொழியார்.,14
வேண்டும்_விடுதலை,அவ்வறிவாற்றலிற் சிறந்தோரை நாம் ஆளுநராகக் கொள்வோமாயின் நாமும் அவ்வளம் சான்ற நாட்டில் வதிந்து வாழ்வை நுகரலாகும்.,12
வேண்டும்_விடுதலை,"இனி இத்தகைய நாட்டை உண்டாக்க ஆளுநருமே அன்றி, மக்களும் உயர்ந்தோராய் இருத்தல் வேண்டும்.",10
வேண்டும்_விடுதலை,நாடாகொன்றோ காடாகொன்றோ அவலாகொன்றோ மிசையாகொன்றோ எவ்வழி நல்லவர் ஆடவர் அவ்வழி நல்லை வாழிய நிலனே.,11
வேண்டும்_விடுதலை,புறம் என்றார் ஒளவை மூதாட்டியாரும்.,4
வேண்டும்_விடுதலை,ஆர்கலி உலகத்து மக்கட் கெல்லாம் ஒதலிற் சிறந்தன் றொழுக்க முடைமை என்று முதுமொழிக்காஞ்சி முழங்கும்.,11
வேண்டும்_விடுதலை,"ஒருநாட்டின் பெருமைக்கு, முதற்பெருங் காரணமாய் நிற்போர் அந்நாட்டு மக்களே.",7
வேண்டும்_விடுதலை,பொய் அறியா வாய் மொழியால் புகழ் நிறைந்த நல் மாந்தரொடு ⁠⁠⁠ விளங்கும் நாடே நாடெனப்படும்.,12
வேண்டும்_விடுதலை,"சோழன் குளமுற்றத்துத் துஞ்சிய கிள்ளிவளவன்பால், அவன் ஆண்ட உறையூரைப்பற்றி வெள்ளை நாகனார் என்னும் நல்லிசைப் புலவர்.",12
வேண்டும்_விடுதலை,அரசெனப் படுவது நினதே பெரும !,4
வேண்டும்_விடுதலை,............................................................. நாடெனப் படுவது நினதே ! என்று பாடிப் பரவுகின்றார்.,6
வேண்டும்_விடுதலை,அத்தகைய நன்மக்கள் வாய்ந்த ஒரு திருநாட்டை அரசும் நெறி திறம்பாமல் ஆளல் வேண்டும்.,10
வேண்டும்_விடுதலை,அறநெறி முதற்றே யரசின் கொற்றம் !,4
வேண்டும்_விடுதலை,தண்டமிழ்ச்சான்றோர் பல்கிய பண்டைத் தமிழரசு அவ்வாறிருந்தது.,5
வேண்டும்_விடுதலை,"மாந்தர் இன்புற்று வாழ்ந்தனர், இவையெல்லாம் பழங்கதை !",5
வேண்டும்_விடுதலை,"இற்றைத் தமிழரசோ, ஒழுங்கற்றார் கையிற்றங்கியது.",4
வேண்டும்_விடுதலை,"மக்கள் நலங்கருதாது, தன்னலங் கருதுவார் பின்புறத்திற் போயொடுங்கியது.",6
வேண்டும்_விடுதலை,"இதுவேயுமன்றி, மக்களும் அரசு பிறழ்ந்த அடிவழித் தாமும் பிறழ்ந்தனர்.",7
வேண்டும்_விடுதலை,கொள்வதும் மிகை கொளாது கொடுப்பதுஉம் குறைகொடாது ⁠⁠⁠ வாழும் வணிகரைக் காணோம்.,9
வேண்டும்_விடுதலை,இத்துணை ஏற்றத் தாழ்வுக்கும் காரணம் என்னை?,5
வேண்டும்_விடுதலை,"என்று கடாவுவாரையும், கவலுறுவாரையும் கூடக் காணவியலவில்லை.",5
வேண்டும்_விடுதலை,ஊன்றிப் பார்க்குங்கால் நமக்குக் கிடைத்த முடிபுகள் இரண்டு.,6
வேண்டும்_விடுதலை,"இற்றைத் தமிழகத்தில், அரசுக்குத் தக்க குடிகளில்லை !",5
வேண்டும்_விடுதலை,குடிகளுக்குத் தக்க அரசில்லை.,3
வேண்டும்_விடுதலை,"இவ்விரு குறைகளுள் ஒன்று நிறைவாயிருப்பினும், காட்டரசாகவோ, அன்றி நாட்டரசாகவோ இஃது இயங்க முடியும்.",10
வேண்டும்_விடுதலை,"ஈண்டோ, காடுமல்லாது, நாடுமல்லாது, மக்காளும், மக்களும் புகுந்த காடுங் கழனியுமாக வன்றோ காண்கின்றோம்.",10
வேண்டும்_விடுதலை,நல்ல மக்கள் நல்லாட்சியை அமைத்தல் இயலும்.,5
வேண்டும்_விடுதலை,இதற்குக் கல்லாமையைக் காரணங் காட்டுவாருமுளர்.,4
வேண்டும்_விடுதலை,"அதுவும் ஒரு காரணமேயன்றி, அதுவே முழுக் காரணமாகாதென்போம்.",6
வேண்டும்_விடுதலை,கற்றவரில் நூற்றுக்குப் பதின்மர் தாமும் அவ்வாறில்லாதிருக்கக் கல்லாமையே ஆட்சிச் சிறப்பின்மைக்குக் காரணமாவ தெங்ஙன்?,10
வேண்டும்_விடுதலை,நாட்டை இயக்குகின்ற அரசும் சிறப்பாக நாம் இலக்கியங்களில் படிக்குமாறும்.,7
வேண்டும்_விடுதலை,கேட்குமாறும் அமைய இயலவில்லை.,3
வேண்டும்_விடுதலை,"இனி, ஒழுக்கத்தானும் பண்பாலும் கவலுறாமல் பொருளும், அரசுமே வாழ்வெனக் கொண்டு சிறக்கும் புறநாட்டார் எல்லா வற்றானும் பெருமையுறல் காண்கின்றோமே.",14
வேண்டும்_விடுதலை,என்று கேட்பார்க்குச் சில கூறுகின்றோம்.,4
வேண்டும்_விடுதலை,மேன்னாட்டாரின் இலக்கியங்கள் யாவும் ஒழுங்கு ஒழுங்கு என்று அரற்றுவன.,7
வேண்டும்_விடுதலை,நம்நாட்டு இலக்கியங்கள் முற்றும் பசி பசி என்று அழுங்குவன.,7
வேண்டும்_விடுதலை,அவர்க்கு வயிற்றைப் பற்றிக் கவலையில்லை.,4
வேண்டும்_விடுதலை,வாழ்வைப் பற்றிய கவலையே மிகுவானது நமக்கு வாழ்வைப் பற்றிக் கவலையில்லை.,8
வேண்டும்_விடுதலை,வயிறு பற்றிய ஏக்கமே மிக இருந்தது.,5
வேண்டும்_விடுதலை,"ஒழுக்கம் ஒழுக்கம் என்று முழக்கிய அன்னா கரினினாவும், ஒழுங்கற்றுப்போன கதையும் அதுபோன்றவையுமே அவரின் இலக்கியங்களாகத் திகழ்கின்றன.",12
வேண்டும்_விடுதலை,"ஆனால் இங்கோ, குப்பைக்கீரையை உப்பின்றி உனக்கி ஒருநாள் ஒருபொழுது உண்டதாக இலக்கியங்கள் பேசுகின்றன.",10
வேண்டும்_விடுதலை,இற்றைத் தமிழகத்திலும் மாந்தர் பசியைப் பற்றிப் பேசுகின்றனர்.,6
வேண்டும்_விடுதலை,ஆனால் அதற்கொரு வழியும் காணவில்லை.,4
வேண்டும்_விடுதலை,"ஒழுக்கத்தைப் பற்றியும், பண்பாடு பற்றியும் பேசிப்பேசிக் காற்று மண்டலத்தை கூற்று மண்டலமாக்குகின்றனர்.",9
வேண்டும்_விடுதலை,ஆனால் அவ்வாறு நடப்போரையும் நடந்து காட்டுவாரையும் காணோம்.,6
வேண்டும்_விடுதலை,"ஆகலின் மக்கள் என்று பண்பாட்டில் சிறந்து விளங்குகின்றனரோ, அன்றே ஆட்சியும் நெறியிற் சிறந்து விளங்க இயலும்.",12
வேண்டும்_விடுதலை,கற்றால் மட்டும் போதாது கற்றவாறு நிற்கவும் மக்கள் பழகல் வேண்டும்.,8
வேண்டும்_விடுதலை,"இதுபற்றியே வள்ளுவர் ஒழுக்கம், பண்பு என்று முழங்குகின்றார்.",6
வேண்டும்_விடுதலை,இன்று தமிழகங் காண்கின்ற நிலையில் மக்கள் செய்ய வேண்டுவனவும் ஆள்நர் செய்ய வேண்டுவனவும் நிறைய உள.,12
வேண்டும்_விடுதலை,இருவரும் முறையாக அவற்றைக் கடைப்பிடியாய் நின்றாற்று வாராயின் நம் தமிழகம் விரைந்து முன்னேறும்.,10
வேண்டும்_விடுதலை,"மக்கட்பிரிவும் சமயப்பிரிவும் அவற்றை வளர்க்கும் கொள்கையும், சட்டமும் உடனே நீக்கப்படல் வேண்டும்.",9
வேண்டும்_விடுதலை,வெற்று ஆரவாரச் சிறுத்தொழில்களையும் பெருந் தொழில்களையும் தடைப்படுத்தி நாட்டை ஒரு உழவு நாடாக முதலில் அமைத்தல் வேண்டும்.,13
வேண்டும்_விடுதலை,"எங்கும் பிரிந்து போக விரும்புவார் சிறுபான்மையராக விருப்பதையும், பிரிந்து போகத் தடையிடுவார் பெரும்பான்மையராக விருப்பதையும் நாம் அறிவோம்.",13
வேண்டும்_விடுதலை,இப்பெரும்பான்மையரிடமிருந்து சிறுபான்மையினர் பிரிந்துபோக விரும்புவது ஏன்?,5
வேண்டும்_விடுதலை,"பெருத்த அரசியல் வரலாற்று மொழி, பண்பாட்டு அடிப்படையிலேயே ஒரு சாரார்க்கு விடுதலை வேட்கை பிறக்கும்.",11
வேண்டும்_விடுதலை,அவை பொருட்டே ஒரு கூட்டம் அவ்விடுதலை வேட்கைகையத் தடுக்க முயற்சி செய்யும்.,9
வேண்டும்_விடுதலை,"உலகியல் முறைப்படி ஒருவர் பிரிவு கேட்டதோ, இன்னொருவர் அதைத்தடுத்து ஒற்றுமையை வலியுறுத்துவதோ குற்றமாகாது.",10
வேண்டும்_விடுதலை,இப்பொது நிலைகளை ஒருவாறு விடுத்துப் பிரிவினைக்குரிய சிறப்பு நிலைகளை ஒரு சிறிது பார்ப்போம்.,10
வேண்டும்_விடுதலை,இவ்விடுதலை உணர்வு இன்று நேற்று ஏற்பட்டதா?,5
வேண்டும்_விடுதலை,தமிழ் மொழி உள்ளளவும் தமிழன் இருப்பான்.,5
வேண்டும்_விடுதலை,"தமிழன் இருக்கும் வரை, தமிழ் நாட்டுணர்வும் இருந்தே தீரும் என்பதை எவரும் மறந்துவிடல் வேண்டாம்.",11
வேண்டும்_விடுதலை,போலி ஒற்றுமை மணிலாக் கொட்டையின் புறத் தோலைப் போன்றது.,7
வேண்டும்_விடுதலை,வேட்கையுள்ளத்தால் அக்காய் உடைத் தெறியப்படும்பொழுது மணிகள் விடுதலை பெற்றே தீரும்.,8
வேண்டும்_விடுதலை,முற்றி முதிர்ந்து வளர்ந்து பரந்து சிறந்த ஓரினத்தின் ஆணி வேரை ஒருவராலும் அவ்வளவு எளிதில் அறுத்தெறிந்து விடல் முடியாது.,14
வேண்டும்_விடுதலை,சாவைவிட அடக்கியொடுக்கப் படுந்தன்மை.,3
வேண்டும்_விடுதலை,இந்திய நாட்டின் ஒற்றுமை உணர்வைவிடப் பன்னூறாயிர மடங்கு உயர்ந்து வலிந்ததாகும் தமிழக விடுதலை யுணர்வு.,11
வேண்டும்_விடுதலை,அதைச் சட்டத்தால் அடக்குதல் சீறும்புயலை மீன் வலை கொண்டு மறிக்கும் மடமைச் செயல் போன்றது.,11
வேண்டும்_விடுதலை,குடியரசு கொள்கைக்கே மாறான இச் சட்டம் நன்மை பயப்பதன்று.,7
வேண்டும்_விடுதலை,மேலும் மேலும் விடுதலை உள்ளத்தைக் கிண்டிக் கிளறுவதாகும்.,6
வேண்டும்_விடுதலை,துஞ்சு புலி இடறிய சிதடன் போல ஆளுநர் ஆகிவிடக் கூடாது என்பதே நாம் விரும்புவதாகும்.,11
வேண்டும்_விடுதலை,"தென்மொழி, சுவடி ஒன்று ஓலை இரண்டு, ஓர் ஆயிரத்து தொள்ளாயிரத்து அறுபத்து மூன்று தனித்தமிழ் நாடு !",12
வேண்டும்_விடுதலை,தனித்தமிழ் நாட்டு விடுதலைப் போராட்டத்தை நான் இன்னும் கைவிட்டு விடவில்லை.,8
வேண்டும்_விடுதலை,பெரியார் வேலூரில் பேசியுள்ளதாகச் செய்தித் தாள்களில் செய்தி வந்துள்ளது.,7
வேண்டும்_விடுதலை,முதலமைச்சர் திரு பக்தவத்சலத்தின் வல்லாண்மைத்தனத்தால் தமிழ்மொழிக் காப்புணர்வும் தமிழ்நாட்டு விடுதலை ஆர்வமும் கொழுந்து விட்டு எரியத் தொடங்கியுள்ளன.,13
